# ----------------------------------------
# Jasper Version Info
# tool      : Jasper 2024.06
# platform  : Linux 3.10.0-1160.62.1.el7.x86_64
# version   : 2024.06p002 64 bits
# build date: 2024.09.02 16:28:38 UTC
# ----------------------------------------
# started   : 2025-11-17 21:55:45 IST
# hostname  : vlsi-ria85.vlsidomain
# pid       : 26090
# arguments : '-label' 'session_0' '-console' '//127.0.0.1:38230' '-nowindow' '-style' 'windows' '-exitonerror' '-data' 'AAAA4nicY2RgYLCp////PwMYMD6A0Aw2jAyoAMRnQhUJbEChGRhYYZphSliAmItBl6GAoYghnyELyDNj0ANCfSA7HS6aypDMUMJQDBTNAfITGVIY4oG8EiC7CCgXz2DIYATUyQM0JwkoWwJUnQHkK+FRrQdWlQN2AwChVBuL' '-proj' '/users/rompel/jasper_executions/safety/jgprojects/load_store_12/sessionLogs/session_0' '-init' '-hidden' '/users/rompel/jasper_executions/safety/jgprojects/load_store_12/.tmp/.initCmds.tcl' 'load_store_12.tcl' '-hidden' '/users/rompel/jasper_executions/safety/jgprojects/load_store_12/.tmp/.postCmds.tcl'

Any disclosure about the Cadence Design Systems software or its use
model to any third party violates the written Non-Disclosure Agreement
between Cadence Design Systems, Inc. and the customer.

THIS SOFTWARE CONTAINS CONFIDENTIAL INFORMATION AND TRADE SECRETS OF
CADENCE DESIGN SYSTEMS, INC. USE, DISCLOSURE, OR REPRODUCTION IS
PROHIBITED WITHOUT THE PRIOR EXPRESS WRITTEN PERMISSION OF CADENCE
DESIGN SYSTEMS, INC.

Copyright (C) 2000-2024 Cadence Design Systems, Inc. All Rights
Reserved.  Unpublished -- rights reserved under the copyright laws of
the United States.

This product includes software developed by others and redistributed
according to license agreement. See doc/third_party_readme.txt for
further details.

RESTRICTED RIGHTS LEGEND

Use, duplication, or disclosure by the Government is subject to
restrictions as set forth in subparagraph (c) (1) (ii) of the Rights in
Technical Data and Computer Software clause at DFARS 252.227-7013 or
subparagraphs (c) (1) and (2) of Commercial Computer Software -- Restricted
Rights at 48 CFR 52.227-19, as applicable.


                          Cadence Design Systems, Inc.
                          2655 Seely Avenue
                          San Jose, CA 95134
                          Phone: 408.943.1234

For technical assistance visit http://support.cadence.com.

Jasper Apps Analysis Session - /users/rompel/jasper_executions/safety/jgprojects/load_store_12/sessionLogs/session_0

WARNING (WG017): [session]: The system's locale is "ANSI_X3.4-1968", which is not UTF-8. Non-ASCII characters might not be handled correctly.
WARNING (WG017): [jg_console]: The system's locale is "ANSI_X3.4-1968", which is not UTF-8. Non-ASCII characters might not be handled correctly.
INFO: successfully checked out license "jasper_fao".
INFO: reading configuration file "/users/rompel/.config/cadence/jasper.conf".
% analyze -sv09 ../load_store_12.sv
[-- (VERI-1482)] Analyzing Verilog file '/tools/cadence2425/JASPER/jasper_2024.06p002/lib/verilog/packages/std/std.sv' into library 'std'
[-- (VERI-1482)] Analyzing Verilog file '../load_store_12.sv'
% elaborate -bbox_mul 1000000 -bbox_div 1000000 -bbox_mod 1000000 -bbox_a 1000000
[INFO (HIER-8002)] ../load_store_12.sv(23): Disabling old hierarchical reference handler
[INFO (VERI-1018)] ../load_store_12.sv(1): compiling module 'Load_Store'
[WARN (VERI-1209)] ../load_store_12.sv(10): expression size 32 truncated to fit in target size 15
[WARN (VERI-1209)] ../load_store_12.sv(12): expression size 32 truncated to fit in target size 15
[INFO (VERI-8005)] ../load_store_12.sv(5): Unintentional sequential element inferred for m read before write using blocking assignment
[INFO (VERI-8005)] ../load_store_12.sv(4): Unintentional sequential element inferred for vol read before write using blocking assignment
[INFO (VERI-8005)] ../load_store_12.sv(1): Unintentional sequential element inferred for sig read before write using blocking assignment
INFO (ISW003): Top module name is "Load_Store".
INFO (INL208): Elaboration synthesis summary:
  Number of synthesized netlists          1 (0 packages)
  Single run mode                         On
  Pipeline                                On (1 pipelined netlists)
  Late hierarchical reference connection  On
  Number of analyzed Verilog modules      1 (1 synthesized)
  Number of analyzed VHDL entities        0 (0 synthesized)
INFO (INL003): Clearing all state information (assumes, stopats, and so forth).
Load_Store
[<embedded>] % reset rst
INFO (IPM031): Clearing proof results of all properties.
INFO (IRS006): Current reset condition is "rst".
[<embedded>] % clock clk
[<embedded>] % prove -all
Ncustom1: Custom engine code is hT3Ng7hPPfiYQOTDZ3qhYOwGAM51eA+J/FjkM5shLioAsqhgLR4Ft+O1BuKG6ilQ83B9tLXSl+CwjiTMAQA
Bcustom2: Custom engine code is hT3Nm7hPr1Vp3Di1Ra2USNIGL4JypRnLKLAdF6JAyuavO2JfGCiY9OZJhcAcOUnLx5xwNdhILGrAWX9s+z2WDkKwNR7tAfClBEjRFVQeq6DU54boFgEA
AMcustom3: Custom engine code is hT3Ng7hP/feYQOTDZ3qhYOwGAM51eA+J/FjkM5shLioAsqhgLR4Ft+O1BuKG6ilQ83B9tLXSmmqwm7g9AQA
Mpcustom4: Custom engine code is hT3NZbhP9fmY2AbBQnsjfOxn6c+6e6yL+/e8fZFmaQrnlgEA
INFO (IPF036): Starting proof on task: "<embedded>", 1 properties to prove with 0 already proven/unreachable
INFO (IRS029): Starting reset analysis: phase 1 of 4.
INFO (IRS030): Running reset analysis: phase 2 of 4.
INFO (IRS031): Running reset analysis: phase 3 of 4.
INFO (IRS020): Starting the reset analysis simulation with a limit of 100 iterations (phase 4 of 4).
INFO (IRS024): Reset iterations 0 to 4 analyzed.
INFO (IRS018): Reset analysis simulation executed for 3 iterations. Assigned values for 17 of 17 design flops, 0 of 0 design latches, 3 of 3 internal elements.
INFO (IRS039): Reset analysis complete.
INFO (IPF031): Settings used for proof thread 0:
    orchestration                 = on
    time_limit                    = 86400s
    per_property_time_limit       = 1s * 10 ^ scan
    engine_mode                   = auto
    proofgrid_per_engine_max_jobs = 1
    max engine jobs               = auto
    proofgrid_mode                = local
    proofgrid_restarts            = 10
0: Using multistage preprocessing
AMcustom5: Custom engine code is hT3N1rhP11/52HrFRS21ROp2LOjVTgPvT8L8BGXHgLhaIuqtT4nARFjUqrBL+7pLmaTOzBepZW/Jm8SSrHDybSQtoNiO3y43wk+dEoWlsZizu97Fih6O6lPVG/LpWP5SsUPwlGagLNa1FKEFvwVXyX7//8prySbvSxIHXr5er+z4RAEA
0: Starting reduce
Ncustom6: Custom engine code is hT3OXrhPByJp3TrFSTLhUmMH4KVtJgmTCnNDF46yMXOKY48m4LS5nE7yBzFjA7kDuwO/GhGUpEPiky3p3wmPn3dJZHxFMsafSoObRzSC+tn7sEY0WbTdZ/FV4hL3MYH/b1CIUvXSWR4wqEoVLsmMOD4xIPT4lI1LO6ZCO7PnnWQuLwetnvKlrXx6wCW/A+x+enqslg1YPobi4wEF/EvbzOvcTYdJvl2s4H2yZg2b2ofAVN5WvhWk1HoBAA
ADcustom7: Custom engine code is hT3Nv7hPv1752HrFRa2kROx2f/ECJeZB2AZsLdlO8VwmIuqtT4nIDFXclhg+O+o+DMmQCekbheGk0kK28laA9gaOFDXsQp29J3X615HY1IPHJWd6FUFvCHjO+p1k652b5JJvZlShNpGlGSXAiQe/mEAj6tEBAA
Tricustom8: Custom engine code is hT3Nu7hPt1752DvFRa0kNDiyIV97VyejwM9C/jCLJjdPvusZONHY42VYUy0Q1ZotnhcVtNc56tJ5wbxv6V2+XpdsaSlHck5vfnbYjdwj1OECy9U+7oSQ0SZE3g5ayD+Phuh4odCJTjeKa2k4elM9ldQfkAEA
Gcustom9: Custom engine code is hT3NibhPDfeYQADBZnYcglOvK9Pfd7EOeniIqP8jNsyIqInncipMGcUXqAadachREE9F2PwhBUZUNw5kHnd4JdXkamORRgEA
C2custom10: Custom engine code is hT3NirhPjfWYQADBZnYcglOvK9Pfd7EOeniIqP8jNsyIqInncgkrYMMXCYbdK0dUjZIF9d4cJ0rHoBDjwVLBKuG86XYVV00BAA
AGcustom11: Custom engine code is hT3NirhP/fmYQADBZnYcglOvK9Pfd7EOeniIqP8jNsyIqInnckcwYMMXCYbdK0dUjZIF9d4cJ0rHoBDjwVLBKuHEZnZByh0BAA
Bcustom12: Custom engine code is hT3NjrhPDfiYQADBZnYcglOvK9PfWxFtenjIyBqfrgr7if/jL/yPOuK1BAflEcW0DxNH2eDIoezN2gxlQFg81RZtiWXh7aiTAidvAQA
Ncustom13: Custom engine code is hT3NR7hPByFp3TrFSTLhUmMH4KWtJglTyV/c51BHEeZWamnJv767nE6PCak26bd3gf3XGN3rIRheufhDieCJQVISo+gNYUKhiUedBKGtsP/a18svAnlMJZudHxDFwK5ufsyoxsIyiAeSY2oi3tEuoDHr5gw42DFKAG3PqO3CEsl8Azzdt3pl5nGA1Ifv2H02eYsFzWb/nfp8PMb3F0krE/EgBcm8TD9Div8BAA
Tricustom14: Custom engine code is hT3Nu7hP3fiYQADBZnYcglNHp9bfd7EOeniIqP/ji8sGLQu8yhsFO+wxJ+O+R0bU8g/IewXFomyos+viQnWc2xYNYmMqpo3i40O7DaZR7qfp4YqNx26KRvQ/qx0BAA
0: Finished reduce in 0s
0.0.PRE: Performing Proof Simplification...
0.0.N: clocks: 1, declared: 1, looping: 0, posedge: 1, negedge: 0, noedge: 0, bothedge: 0
0.0.N: Proof Simplification Iteration 1	[0.00 s]
0.0.N: Proof Simplification Iteration 2	[0.00 s]
0.0.N: Proof Simplification Iteration 3	[0.00 s]
0.0.PRE: A proof was found: No trace exists. [0.00 s]
INFO (IPF057): 0.0.PRE: The property ":noDeadEnd" was proven in 0.00 s.
    Use check_assumptions -show -dead_end to show this property in the property table.
0.0.PRE: A proof was found: No trace exists. [0.00 s]
INFO (IPF057): 0.0.PRE: The property ":noConflict" was proven in 0.00 s.
    Use check_assumptions -show to show this property in the property table.
INFO (IPF047): 0.0.PRE: The cover property ":live" was covered in 1 cycles in 0.00 s.
    Use check_assumptions -show -live to show this property in the property table.
0.0.PRE: Proof Simplification completed in 0.00 s
0: About to start ProofGrid in its own thread with a limit of 10000 pending notifications and a limit of 10 traces.
0: =============================== ProofGrid start ===============================
0: ProofGrid usable level: 1
0: Initial ProofGrid level: 1
0: ProofGrid is starting event handling
0.0.Hp: Proofgrid shell started at 26253@vlsi-ria85(local) jg_26090_vlsi-ria85_1
0.0.N: Proofgrid shell started at 26252@vlsi-ria85(local) jg_26090_vlsi-ria85_1
0.0.N: clocks: 1, declared: 1, looping: 0, posedge: 1, negedge: 0, noedge: 0, bothedge: 0
0.0.N: Last scan. Per property time limit: 0s
0.0.N: Starting proof for property "Load_Store.p1"	[0.00 s].
0.0.Hp: clocks: 1, declared: 1, looping: 0, posedge: 1, negedge: 0, noedge: 0, bothedge: 0
0.0.Hp: Last scan. Per property time limit: 0s
0.0.N: Trace Attempt  1	[0.00 s]
0.0.N: Trace Attempt  2	[0.00 s]
0.0.N: Trace Attempt  2	[0.00 s]
0.0.N: Trace Attempt  3	[0.00 s]
0.0.N: Trace Attempt  3	[0.00 s]
0.0.Hp: Trace Attempt  1	[0.00 s]
0.0.N: Trace Attempt  4	[0.00 s]
0.0.N: Trace Attempt  5	[0.00 s]
0.0.Hp: Trace Attempt  2	[0.00 s]
0.0.Hp: Trace Attempt  3	[0.00 s]
0.0.Hp: Trace Attempt  4	[0.00 s]
0.0.Hp: Trace Attempt  5	[0.00 s]
0.0.N: Trace Attempt  5	[0.00 s]
0.0.N: Trace Attempt  1	[0.02 s]
0.0.N: Trace Attempt  2	[0.02 s]
0.0.N: Trace Attempt  3	[0.02 s]
0.0.N: Trace Attempt  4	[0.02 s]
0.0.N: Trace Attempt  5	[0.02 s]
0.0.Ht: Proofgrid shell started at 26287@vlsi-ria85(local) jg_26090_vlsi-ria85_1
0.0.B: Proofgrid shell started at 26289@vlsi-ria85(local) jg_26090_vlsi-ria85_1
0.0.Ht: clocks: 1, declared: 1, looping: 0, posedge: 1, negedge: 0, noedge: 0, bothedge: 0
0.0.Ht: Last scan. Per property time limit: 0s
0.0.Ht: Trace Attempt  1	[0.00 s]
0.0.Ht: Trace Attempt  2	[0.00 s]
0.0.Ht: Trace Attempt  3	[0.00 s]
0.0.Ht: Trace Attempt  4	[0.00 s]
0.0.Ht: Trace Attempt  5	[0.00 s]
0.0.B: clocks: 1, declared: 1, looping: 0, posedge: 1, negedge: 0, noedge: 0, bothedge: 0
0.0.B: Last scan. Per property time limit: 0s
0.0.B: Starting proof for property "Load_Store.p1"	[0.00 s].
0.0.B: Trace Attempt  1	[0.00 s]
0.0.B: Trace Attempt  2	[0.00 s]
0.0.B: Trace Attempt  3	[0.00 s]
0.0.B: Trace Attempt  4	[0.00 s]
0.0.B: Trace Attempt  5	[0.00 s]
0.0.AM: Proofgrid shell started at 26290@vlsi-ria85(local) jg_26090_vlsi-ria85_1
0.0.AM: clocks: 1, declared: 1, looping: 0, posedge: 1, negedge: 0, noedge: 0, bothedge: 0
0.0.AM: Last scan. Per property time limit: 0s
0.0.AM: Starting proof for property "Load_Store.p1"	[0.00 s].
0.0.AM: Trace Attempt  1	[0.00 s]
0.0.AM: Trace Attempt  2	[0.00 s]
0.0.AM: Trace Attempt  3	[0.00 s]
0.0.AM: Trace Attempt  4	[0.00 s]
0.0.AM: Trace Attempt  5	[0.00 s]
0.0.AM: Trace Attempt  1	[0.00 s]
0.0.AM: Trace Attempt  2	[0.00 s]
0.0.AM: Trace Attempt  3	[0.01 s]
0.0.AM: Trace Attempt  4	[0.01 s]
0.0.AM: Trace Attempt  5	[0.01 s]
0.0.AM: Trace Attempt  1	[0.02 s]
0.0.AM: Trace Attempt  2	[0.02 s]
0.0.AM: Trace Attempt  3	[0.02 s]
0.0.AM: Trace Attempt  4	[0.03 s]
0.0.Oh: Proofgrid shell started at 26288@vlsi-ria85(local) jg_26090_vlsi-ria85_1
0.0.AM: Trace Attempt  5	[0.03 s]
0.0.Oh: clocks: 1, declared: 1, looping: 0, posedge: 1, negedge: 0, noedge: 0, bothedge: 0
0.0.Oh: Reached length limit (2147483647) [0.01 s]
0.0.Oh: Exited with Success (@ 0.08 s)
0.0.AM: Trace Attempt  1	[0.07 s]
0.0.AM: Trace Attempt  2	[0.07 s]
0.0.AM: Trace Attempt  3	[0.07 s]
0.0.AM: Trace Attempt  4	[0.07 s]
0.0.AM: Trace Attempt  5	[0.07 s]
0.0.N: Trace Attempt  1	[0.19 s]
0.0.N: Trace Attempt  2	[0.19 s]
0.0.N: Trace Attempt  3	[0.19 s]
0.0.N: Trace Attempt  4	[0.19 s]
0.0.N: Trace Attempt  5	[0.20 s]
0.0.AM: Trace Attempt  1	[0.21 s]
0.0.AM: Trace Attempt  2	[0.21 s]
0.0.AM: Trace Attempt  3	[0.21 s]
0.0.AM: Trace Attempt  4	[0.22 s]
0.0.AM: Trace Attempt  5	[0.22 s]
0.0.AM: Trace Attempt  1	[0.59 s]
0.0.AM: Trace Attempt  2	[0.60 s]
0.0.AM: Trace Attempt  3	[0.60 s]
0.0.AM: Trace Attempt  4	[0.60 s]
0.0.AM: Trace Attempt  5	[0.60 s]
0.0.N: Trace Attempt  1	[0.82 s]
0.0.N: Trace Attempt  2	[0.82 s]
0.0.N: Trace Attempt  3	[0.82 s]
0.0.N: Trace Attempt  4	[0.82 s]
0.0.N: Trace Attempt  5	[0.82 s]
0.0.N: Trace Attempt  1	[2.42 s]
0.0.N: Trace Attempt  2	[2.42 s]
0.0.N: Trace Attempt  3	[2.42 s]
0.0.N: Trace Attempt  4	[2.42 s]
0.0.N: Trace Attempt  5	[2.42 s]
0.0.AM: Trace Attempt  1	[2.81 s]
0.0.AM: Trace Attempt  2	[2.81 s]
0.0.AM: Trace Attempt  3	[2.81 s]
0.0.AM: Trace Attempt  4	[2.82 s]
0.0.AM: Trace Attempt  5	[2.82 s]
0.0.Hp: Trace Attempt 448	[4.02 s]
0.0.B: Trace Attempt 1801	[4.00 s]
0.0.Ht: Trace Attempt 1996	[4.00 s]
0.0.N: Trace Attempt  1	[4.63 s]
0.0.N: Trace Attempt  2	[4.63 s]
0.0.N: Trace Attempt  3	[4.63 s]
0.0.N: Trace Attempt  4	[4.63 s]
0.0.N: Trace Attempt  5	[4.63 s]
0.0.N: Trace Attempt  1	[6.37 s]
0.0.N: Trace Attempt  2	[6.37 s]
0.0.N: Trace Attempt  3	[6.37 s]
0.0.N: Trace Attempt  4	[6.37 s]
0.0.N: Trace Attempt  5	[6.37 s]
0.0.AM: Trace Attempt 159	[6.86 s]
0.0.Hp: Trace Attempt 624	[8.04 s]
0.0.Ht: Trace Attempt 2722	[8.01 s]
0.0.B: Trace Attempt 2504	[8.01 s]
0.0.N: Trace Attempt  1	[8.69 s]
0.0.N: Trace Attempt  2	[8.69 s]
0.0.N: Trace Attempt  3	[8.69 s]
0.0.N: Trace Attempt  4	[8.70 s]
0.0.N: Trace Attempt  5	[8.70 s]
0.0.AM: Trace Attempt 221	[10.92 s]
0.0.N: Trace Attempt  1	[11.00 s]
0.0.N: Trace Attempt  2	[11.00 s]
0.0.N: Trace Attempt  3	[11.00 s]
0.0.N: Trace Attempt  4	[11.01 s]
0.0.N: Trace Attempt  5	[11.01 s]
0.0.Ht: Trace Attempt 3287	[12.01 s]
0.0.B: Trace Attempt 3045	[12.01 s]
0.0.Hp: Trace Attempt 678	[12.65 s]
0.0.AM: Trace Attempt  1	[13.25 s]
0.0.AM: Trace Attempt  2	[13.25 s]
0.0.AM: Trace Attempt  3	[13.25 s]
0.0.AM: Trace Attempt  4	[13.25 s]
0.0.AM: Trace Attempt  5	[13.26 s]
0.0.N: Trace Attempt  1	[13.51 s]
0.0.N: Trace Attempt  2	[13.51 s]
0.0.N: Trace Attempt  3	[13.51 s]
0.0.N: Trace Attempt  4	[13.52 s]
0.0.N: Trace Attempt  5	[13.52 s]
0.0.Ht: Trace Attempt 3739	[16.01 s]
0.0.B: Trace Attempt 3475	[16.02 s]
0.0.Hp: Trace Attempt 801	[16.65 s]
0.0.AM: Trace Attempt 158	[17.33 s]
0.0.N: Trace Attempt 187	[17.55 s]
0.0.N: Trace Attempt  1	[19.36 s]
0.0.N: Trace Attempt  2	[19.36 s]
0.0.N: Trace Attempt  3	[19.36 s]
0.0.N: Trace Attempt  4	[19.37 s]
0.0.N: Trace Attempt  5	[19.37 s]
0.0.B: Trace Attempt 3870	[20.02 s]
0.0.Ht: Trace Attempt 4146	[20.02 s]
0.0.Hp: Trace Attempt 927	[21.32 s]
0.0.AM: Trace Attempt 227	[21.48 s]
0.0.N: Trace Attempt 183	[23.37 s]
0.0.Ht: Trace Attempt 4531	[24.02 s]
0.0.B: Trace Attempt 4233	[24.02 s]
0.0.N: Trace Attempt  1	[25.04 s]
0.0.N: Trace Attempt  2	[25.04 s]
0.0.N: Trace Attempt  3	[25.04 s]
0.0.N: Trace Attempt  4	[25.04 s]
0.0.N: Trace Attempt  5	[25.05 s]
0.0.Hp: Trace Attempt 1030	[25.33 s]
0.0.AM: Trace Attempt 260	[25.52 s]
0.0.B: Trace Attempt 4561	[28.03 s]
0.0.Ht: Trace Attempt 4872	[28.03 s]
0.0.N: Trace Attempt 184	[29.06 s]
0.0.Hp: Trace Attempt 1125	[29.35 s]
0.0.AM: Trace Attempt 305	[29.54 s]
0.0.N: Trace Attempt  1	[30.65 s]
0.0.N: Trace Attempt  2	[30.65 s]
0.0.N: Trace Attempt  3	[30.65 s]
0.0.N: Trace Attempt  4	[30.66 s]
0.0.N: Trace Attempt  5	[30.66 s]
0.0.B: Trace Attempt 4867	[32.03 s]
0.0.Ht: Trace Attempt 5193	[32.03 s]
0.0.Hp: Trace Attempt 1206	[33.38 s]
0.0.AM: Trace Attempt 338	[33.56 s]
0.0.N: Trace Attempt 184	[34.67 s]
0.0.B: Trace Attempt 5155	[36.04 s]
0.0.Ht: Trace Attempt 5510	[36.04 s]
0.0.N: Trace Attempt  1	[36.34 s]
0.0.N: Trace Attempt  2	[36.34 s]
0.0.N: Trace Attempt  3	[36.34 s]
0.0.N: Trace Attempt  4	[36.35 s]
0.0.N: Trace Attempt  5	[36.35 s]
0.0.Hp: Trace Attempt 1295	[37.43 s]
0.0.AM: Trace Attempt 374	[37.69 s]
0.0.Ht: Trace Attempt 5806	[40.05 s]
0.0.B: Trace Attempt 5424	[40.05 s]
0.0.N: Trace Attempt 150	[40.37 s]
0.0.Hp: Trace Attempt 1377	[41.43 s]
0.0.AM: Trace Attempt 412	[41.77 s]
0.0.Ht: Trace Attempt 6086	[44.06 s]
0.0.B: Trace Attempt 5677	[44.06 s]
0.0.N: Trace Attempt 226	[44.38 s]
0.0.N: Trace Attempt  1	[45.35 s]
0.0.N: Trace Attempt  2	[45.35 s]
0.0.N: Trace Attempt  3	[45.36 s]
0.0.N: Trace Attempt  4	[45.36 s]
0.0.N: Trace Attempt  5	[45.36 s]
0.0.Hp: Trace Attempt 1453	[45.44 s]
0.0.AM: Trace Attempt 450	[46.31 s]
0.0.Ht: Trace Attempt 6323	[48.07 s]
0.0.B: Trace Attempt 5907	[48.08 s]
0.0.N: Trace Attempt 150	[49.41 s]
0.0.Hp: Trace Attempt 1523	[49.44 s]
0.0.AM: Trace Attempt 427	[50.31 s]
0.0.Ht: Trace Attempt 6552	[52.08 s]
0.0.B: Trace Attempt 6120	[52.09 s]
0.0.N: Trace Attempt 226	[53.43 s]
0.0.Hp: Trace Attempt 1588	[53.46 s]
0.0.N: Trace Attempt  1	[54.44 s]
0.0.N: Trace Attempt  2	[54.44 s]
0.0.N: Trace Attempt  3	[54.44 s]
0.0.N: Trace Attempt  4	[54.45 s]
0.0.N: Trace Attempt  5	[54.45 s]
0.0.AM: Trace Attempt 514	[54.70 s]
0.0.AM: Trace Attempt  1	[54.82 s]
0.0.AM: Trace Attempt  2	[54.82 s]
0.0.AM: Trace Attempt  3	[54.82 s]
0.0.AM: Trace Attempt  4	[54.82 s]
0.0.AM: Trace Attempt  5	[54.83 s]
0.0.Ht: Trace Attempt 6768	[56.09 s]
0.0.B: Trace Attempt 6328	[56.10 s]
0.0.Hp: Trace Attempt 1654	[57.49 s]
0.0.N: Trace Attempt 186	[58.46 s]
0.0.AM: Trace Attempt 168	[58.87 s]
0.0.N: Trace Attempt  1	[59.96 s]
0.0.N: Trace Attempt  2	[59.96 s]
0.0.N: Trace Attempt  3	[59.96 s]
0.0.N: Trace Attempt  4	[59.96 s]
0.0.N: Trace Attempt  5	[59.96 s]
0.0.Ht: Trace Attempt 7000	[60.10 s]
0.0.B: Trace Attempt 6543	[60.12 s]
0.0.Hp: Trace Attempt 1719	[61.54 s]
0.0.AM: Trace Attempt 232	[62.96 s]
0.0.N: Trace Attempt 150	[63.98 s]
0.0.Ht: Trace Attempt 7229	[64.12 s]
0.0.B: Trace Attempt 6748	[64.14 s]
0.0.Hp: Trace Attempt 1782	[65.57 s]
0.0.AM: Trace Attempt 281	[67.02 s]
0.0.N: Trace Attempt 226	[67.98 s]
0.0.Ht: Trace Attempt 7454	[68.12 s]
0.0.B: Trace Attempt 6952	[68.15 s]
0.0.N: Trace Attempt  1	[68.94 s]
0.0.N: Trace Attempt  2	[68.94 s]
0.0.N: Trace Attempt  3	[68.94 s]
0.0.N: Trace Attempt  4	[68.95 s]
0.0.N: Trace Attempt  5	[68.95 s]
0.0.Hp: Trace Attempt 1842	[69.62 s]
0.0.AM: Trace Attempt 327	[71.11 s]
0.0.Ht: Trace Attempt 7667	[72.12 s]
0.0.B: Trace Attempt 7150	[72.16 s]
0.0.N: Trace Attempt 150	[72.96 s]
0.0.Hp: Trace Attempt 1900	[73.62 s]
0.0.AM: Trace Attempt 369	[75.19 s]
0.0.Ht: Trace Attempt 7869	[76.13 s]
0.0.B: Trace Attempt 7342	[76.17 s]
0.0.N: Trace Attempt 225	[76.97 s]
0.0.Hp: Trace Attempt 1956	[77.65 s]
0.0.N: Trace Attempt  1	[78.00 s]
0.0.N: Trace Attempt  2	[78.00 s]
0.0.N: Trace Attempt  3	[78.00 s]
0.0.N: Trace Attempt  4	[78.00 s]
0.0.N: Trace Attempt  5	[78.00 s]
0.0.AM: Trace Attempt 415	[79.25 s]
0.0.Ht: Trace Attempt 8069	[80.15 s]
0.0.B: Trace Attempt 7527	[80.17 s]
0.0.Hp: Trace Attempt 2011	[81.70 s]
0.0.N: Trace Attempt 150	[82.02 s]
0.0.AM: Trace Attempt 434	[83.67 s]
0.0.Ht: Trace Attempt 8251	[84.16 s]
0.0.B: Trace Attempt 7709	[84.18 s]
0.0.Hp: Trace Attempt 2059	[85.71 s]
0.0.N: Trace Attempt 225	[86.03 s]
0.0.N: Trace Attempt  1	[86.97 s]
0.0.N: Trace Attempt  2	[86.97 s]
0.0.N: Trace Attempt  3	[86.97 s]
0.0.N: Trace Attempt  4	[86.98 s]
0.0.N: Trace Attempt  5	[86.98 s]
0.0.AM: Trace Attempt 455	[87.70 s]
0.0.Ht: Trace Attempt 8451	[88.18 s]
0.0.B: Trace Attempt 7884	[88.20 s]
0.0.Hp: Trace Attempt 2112	[89.79 s]
0.0.N: Trace Attempt 150	[90.99 s]
0.0.AM: Trace Attempt 479	[91.92 s]
0.0.Ht: Trace Attempt 8634	[92.20 s]
0.0.B: Trace Attempt 8056	[92.20 s]
0.0.Hp: Trace Attempt 2164	[93.81 s]
0.0.N: Trace Attempt 227	[95.04 s]
0.0.N: Trace Attempt  1	[96.03 s]
0.0.N: Trace Attempt  2	[96.03 s]
0.0.N: Trace Attempt  3	[96.03 s]
0.0.N: Trace Attempt  4	[96.04 s]
0.0.N: Trace Attempt  5	[96.04 s]
0.0.AM: Trace Attempt 499	[96.12 s]
0.0.Ht: Trace Attempt 8805	[96.20 s]
0.0.B: Trace Attempt 8225	[96.21 s]
0.0.Hp: Trace Attempt 2214	[97.89 s]
0.0.N: Trace Attempt 150	[100.04 s]
0.0.AM: Trace Attempt 521	[100.13 s]
0.0.Ht: Trace Attempt 8984	[100.21 s]
0.0.B: Trace Attempt 8399	[100.23 s]
0.0.Hp: Trace Attempt 2263	[101.96 s]
0.0.N: Trace Attempt 227	[104.09 s]
0.0.Ht: Trace Attempt 9158	[104.22 s]
0.0.B: Trace Attempt 8568	[104.24 s]
0.0.AM: Trace Attempt 541	[104.27 s]
0.0.N: Trace Attempt  1	[105.11 s]
0.0.N: Trace Attempt  2	[105.11 s]
0.0.N: Trace Attempt  3	[105.11 s]
0.0.N: Trace Attempt  4	[105.12 s]
0.0.N: Trace Attempt  5	[105.12 s]
0.0.Hp: Trace Attempt 2311	[106.04 s]
0.0.Ht: Trace Attempt 9329	[108.22 s]
0.0.B: Trace Attempt 8731	[108.26 s]
0.0.AM: Trace Attempt 567	[108.53 s]
0.0.N: Trace Attempt 185	[109.12 s]
0.0.Hp: Trace Attempt 2357	[110.08 s]
0.0.N: Trace Attempt  1	[110.73 s]
0.0.N: Trace Attempt  2	[110.73 s]
0.0.N: Trace Attempt  3	[110.73 s]
0.0.N: Trace Attempt  4	[110.73 s]
0.0.N: Trace Attempt  5	[110.73 s]
0.0.Ht: Trace Attempt 9500	[112.22 s]
0.0.B: Trace Attempt 8889	[112.26 s]
0.0.AM: Trace Attempt 591	[112.72 s]
0.0.Hp: Trace Attempt 2402	[114.11 s]
0.0.N: Trace Attempt 150	[114.74 s]
0.0.Ht: Trace Attempt 9668	[116.24 s]
0.0.B: Trace Attempt 9045	[116.26 s]
0.0.AM: Trace Attempt 614	[116.89 s]
0.0.Hp: Trace Attempt 2446	[118.11 s]
0.0.N: Trace Attempt 227	[118.79 s]
0.0.N: Trace Attempt  1	[119.70 s]
0.0.N: Trace Attempt  2	[119.70 s]
0.0.N: Trace Attempt  3	[119.70 s]
0.0.N: Trace Attempt  4	[119.71 s]
0.0.N: Trace Attempt  5	[119.71 s]
0.0.Ht: Trace Attempt 9829	[120.25 s]
0.0.B: Trace Attempt 9197	[120.28 s]
0.0.AM: Trace Attempt 636	[121.00 s]
0.0.Hp: Trace Attempt 2490	[122.20 s]
0.0.N: Trace Attempt 185	[123.71 s]
0.0.Ht: Trace Attempt 9995	[124.27 s]
0.0.B: Trace Attempt 9346	[124.28 s]
0.0.AM: Trace Attempt 657	[125.03 s]
0.0.N: Trace Attempt  1	[125.20 s]
0.0.N: Trace Attempt  2	[125.20 s]
0.0.N: Trace Attempt  3	[125.20 s]
0.0.N: Trace Attempt  4	[125.21 s]
0.0.N: Trace Attempt  5	[125.21 s]
0.0.Hp: Trace Attempt 2533	[126.26 s]
0.0.B: Trace Attempt 9490	[128.28 s]
0.0.Ht: Trace Attempt 10149	[128.28 s]
0.0.AM: Trace Attempt 683	[129.14 s]
0.0.N: Trace Attempt 185	[129.21 s]
0.0.Hp: Trace Attempt 2575	[130.34 s]
0.0.N: Trace Attempt  1	[131.28 s]
0.0.N: Trace Attempt  2	[131.28 s]
0.0.N: Trace Attempt  3	[131.28 s]
0.0.N: Trace Attempt  4	[131.29 s]
0.0.N: Trace Attempt  5	[131.29 s]
0.0.B: Trace Attempt 9630	[132.29 s]
0.0.Ht: Trace Attempt 10291	[132.31 s]
0.0.AM: Trace Attempt 708	[133.22 s]
0.0.Hp: Trace Attempt 2615	[134.38 s]
0.0.N: Trace Attempt 162	[135.32 s]
0.0.B: Trace Attempt 9769	[136.31 s]
0.0.Ht: Trace Attempt 10439	[136.34 s]
0.0.AM: Trace Attempt 730	[137.30 s]
0.0.Hp: Trace Attempt 2655	[138.43 s]
0.0.N: Trace Attempt 215	[139.37 s]
0.0.B: Trace Attempt 9910	[140.34 s]
0.0.Ht: Trace Attempt 10579	[140.34 s]
0.0.AM: Trace Attempt 754	[141.41 s]
0.0.Hp: Trace Attempt 2695	[142.49 s]
0.0.N: Trace Attempt 238	[143.46 s]
0.0.B: Trace Attempt 10048	[144.34 s]
0.0.Ht: Trace Attempt 10725	[144.36 s]
0.0.AM: Trace Attempt 777	[145.49 s]
0.0.Hp: Trace Attempt 2734	[146.56 s]
0.0.N: Trace Attempt 272	[147.54 s]
0.0.B: Trace Attempt 10185	[148.36 s]
0.0.Ht: Trace Attempt 10853	[148.37 s]
0.0.AM: Trace Attempt 801	[149.67 s]
0.0.Hp: Trace Attempt 2773	[150.64 s]
0.0.N: Trace Attempt 310	[151.60 s]
0.0.B: Trace Attempt 10319	[152.39 s]
0.0.Ht: Trace Attempt 10995	[152.39 s]
0.0.Hp: Trace Attempt 2811	[154.73 s]
0.0.AM: Trace Attempt 825	[154.96 s]
0.0.N: Trace Attempt 345	[155.67 s]
0.0.B: Trace Attempt 10452	[156.40 s]
0.0.Ht: Trace Attempt 11127	[156.41 s]
0.0.Hp: Trace Attempt 2848	[158.75 s]
0.0.AM: Trace Attempt 833	[159.56 s]
0.0.N: Trace Attempt 375	[159.71 s]
0.0.B: Trace Attempt 10583	[160.41 s]
0.0.Ht: Trace Attempt 11268	[160.43 s]
0.0.Hp: Trace Attempt 2885	[162.83 s]
0.0.AM: Trace Attempt 840	[163.57 s]
0.0.N: Trace Attempt 410	[163.77 s]
0.0.B: Trace Attempt 10712	[164.41 s]
0.0.Ht: Trace Attempt 11399	[164.44 s]
0.0.Hp: Trace Attempt 2922	[166.93 s]
0.0.AM: Trace Attempt 847	[167.61 s]
0.0.N: Trace Attempt 448	[167.79 s]
0.0.B: Trace Attempt 10838	[168.44 s]
0.0.Ht: Trace Attempt 11533	[168.46 s]
0.0.Hp: Trace Attempt 2958	[171.01 s]
0.0.AM: Trace Attempt 851	[172.20 s]
0.0.Ht: Trace Attempt 11658	[172.46 s]
0.0.B: Trace Attempt 10960	[172.47 s]
0.0.N: Trace Attempt 469	[172.77 s]
0.0.N: Trace Attempt  1	[172.79 s]
0.0.N: Trace Attempt  2	[172.79 s]
0.0.N: Trace Attempt  3	[172.79 s]
0.0.N: Trace Attempt  4	[172.79 s]
0.0.N: Trace Attempt  5	[172.79 s]
0.0.Hp: Trace Attempt 2993	[175.12 s]
0.0.AM: Trace Attempt 857	[176.38 s]
0.0.Ht: Trace Attempt 11790	[176.46 s]
0.0.B: Trace Attempt 11085	[176.49 s]
0.0.N: Trace Attempt 165	[176.83 s]
0.0.Hp: Trace Attempt 3028	[179.12 s]
0.0.Ht: Trace Attempt 11916	[180.48 s]
0.0.B: Trace Attempt 11208	[180.50 s]
0.0.AM: Trace Attempt 861	[180.65 s]
0.0.N: Trace Attempt 216	[180.85 s]
0.0.N: Stopped processing property "Load_Store.p1"	[181.03 s].
0.0.N: Morphing to Ncustom1
0.0.N: All properties determined. [0.00 s]
0.0.N: Exited with Success (@ 0.00 s)
0.0.Ncustom1: clocks: 1, declared: 1, looping: 0, posedge: 1, negedge: 0, noedge: 0, bothedge: 0
0.0.Ncustom1: Starting proof for property "Load_Store.p1"	[0.00 s].
0.0.Ncustom1: Trace Attempt 468	[0.08 s]
0.0.B: Trace Attempt 11222	[180.96 s]
0.0.B: Stopped processing property "Load_Store.p1"	[181.08 s].
0.0.B: Morphing to Bcustom2
0.0.B: All properties determined. [0.00 s]
0.0.B: Exited with Success (@ 0.00 s)
0.0.Bcustom2: clocks: 1, declared: 1, looping: 0, posedge: 1, negedge: 0, noedge: 0, bothedge: 0
0.0.Bcustom2: Starting proof for property "Load_Store.p1"	[0.00 s].
0.0.Bcustom2: Trace Attempt  1	[0.00 s]
0.0.Tri: Proofgrid shell started at 30629@vlsi-ria85(local) jg_26090_vlsi-ria85_1
0.0.Bcustom2: Trace Attempt  2	[0.00 s]
0.0.Bcustom2: Trace Attempt  1	[0.00 s]
0.0.Bcustom2: Trace Attempt  2	[0.00 s]
0.0.Bcustom2: Trace Attempt  3	[0.00 s]
0.0.Bcustom2: Trace Attempt  1	[0.00 s]
0.0.Bcustom2: Trace Attempt  2	[0.00 s]
0.0.Bcustom2: Trace Attempt  3	[0.00 s]
0.0.Bcustom2: Trace Attempt  4	[0.00 s]
0.0.Bcustom2: Trace Attempt  5	[0.00 s]
0.0.Bcustom2: Trace Attempt  1	[0.00 s]
0.0.Bcustom2: Trace Attempt  2	[0.00 s]
0.0.Bcustom2: Trace Attempt  3	[0.00 s]
0.0.Bcustom2: Trace Attempt  4	[0.00 s]
0.0.Bcustom2: Trace Attempt  5	[0.00 s]
0.0.Bcustom2: Trace Attempt  1	[0.01 s]
0.0.Bcustom2: Trace Attempt  2	[0.01 s]
0.0.Bcustom2: Trace Attempt  3	[0.01 s]
0.0.Bcustom2: Trace Attempt  4	[0.01 s]
0.0.Bcustom2: Trace Attempt  5	[0.01 s]
0.0.Bcustom2: Trace Attempt  1	[0.01 s]
0.0.Bcustom2: Trace Attempt  2	[0.01 s]
0.0.Bcustom2: Trace Attempt  3	[0.01 s]
0.0.Bcustom2: Trace Attempt  4	[0.01 s]
0.0.Bcustom2: Trace Attempt  5	[0.01 s]
0.0.Tri: clocks: 1, declared: 1, looping: 0, posedge: 1, negedge: 0, noedge: 0, bothedge: 0
0.0.Tri: Last scan. Per property time limit: 0s
0.0.Tri: Starting proof for property "Load_Store.p1"	[0.00 s].
0.0.Tri: Trace Attempt  1	[0.00 s]
0.0.Bcustom2: Trace Attempt  1	[0.03 s]
0.0.Bcustom2: Trace Attempt  2	[0.03 s]
0.0.Bcustom2: Trace Attempt  3	[0.03 s]
0.0.Bcustom2: Trace Attempt  4	[0.03 s]
0.0.Bcustom2: Trace Attempt  5	[0.03 s]
0.0.AM: Stopped processing property "Load_Store.p1"	[181.12 s].
0.0.AM: Morphing to AMcustom3
0.0.Bcustom2: Trace Attempt  1	[0.05 s]
0.0.Bcustom2: Trace Attempt  2	[0.05 s]
0.0.Bcustom2: Trace Attempt  3	[0.05 s]
0.0.Bcustom2: Trace Attempt  4	[0.05 s]
0.0.Bcustom2: Trace Attempt  5	[0.05 s]
0.0.Tri:    0.00" ---- Launching main thread ----
0.0.AM: All properties determined. [0.00 s]
0.0.AM: Exited with Success (@ 0.00 s)
0.0.AMcustom3: clocks: 1, declared: 1, looping: 0, posedge: 1, negedge: 0, noedge: 0, bothedge: 0
0.0.AMcustom3: Starting proof for property "Load_Store.p1"	[0.00 s].
0.0.AMcustom3: Trace Attempt  1	[0.00 s]
0.0.AMcustom3: Trace Attempt  2	[0.00 s]
0.0.AMcustom3: Trace Attempt  3	[0.00 s]
0.0.AMcustom3: Trace Attempt  4	[0.00 s]
0.0.AMcustom3: Trace Attempt  5	[0.00 s]
0.0.AMcustom3: Trace Attempt  1	[0.00 s]
0.0.AMcustom3: Trace Attempt  2	[0.01 s]
0.0.AMcustom3: Trace Attempt  3	[0.01 s]
0.0.AMcustom3: Trace Attempt  4	[0.01 s]
0.0.AMcustom3: Trace Attempt  5	[0.01 s]
0.0.Bcustom2: Trace Attempt  1	[0.11 s]
0.0.Bcustom2: Trace Attempt  2	[0.11 s]
0.0.Bcustom2: Trace Attempt  3	[0.11 s]
0.0.Bcustom2: Trace Attempt  4	[0.11 s]
0.0.Bcustom2: Trace Attempt  5	[0.11 s]
0.0.AMcustom3: Trace Attempt  1	[0.02 s]
0.0.AMcustom3: Trace Attempt  2	[0.02 s]
0.0.AMcustom3: Trace Attempt  3	[0.02 s]
0.0.AMcustom3: Trace Attempt  4	[0.03 s]
0.0.AMcustom3: Trace Attempt  5	[0.03 s]
0.0.AMcustom3: Trace Attempt  1	[0.07 s]
0.0.Tri:    0.09" ---- Launching abstraction thread ----
0.0.AMcustom3: Trace Attempt  2	[0.07 s]
0.0.AMcustom3: Trace Attempt  3	[0.08 s]
0.0.Tri:    0.10" ---- Launching multi-phase simplification thread ----
0.0.AMcustom3: Trace Attempt  4	[0.08 s]
0.0.AMcustom3: Trace Attempt  5	[0.08 s]
0.0.Tri:    0.15" ---- Launching liveness simplification thread ----
0.0.Bcustom2: Trace Attempt  1	[0.27 s]
0.0.Bcustom2: Trace Attempt  2	[0.27 s]
0.0.Bcustom2: Trace Attempt  3	[0.27 s]
0.0.Bcustom2: Trace Attempt  4	[0.27 s]
0.0.Bcustom2: Trace Attempt  5	[0.27 s]
0.0.AMcustom3: Trace Attempt  1	[0.24 s]
0.0.AMcustom3: Trace Attempt  2	[0.25 s]
0.0.AMcustom3: Trace Attempt  3	[0.25 s]
0.0.AMcustom3: Trace Attempt  4	[0.25 s]
0.0.AMcustom3: Trace Attempt  5	[0.26 s]
0.0.AMcustom3: Trace Attempt  1	[0.69 s]
0.0.Bcustom2: Trace Attempt  1	[0.79 s]
0.0.Bcustom2: Trace Attempt  2	[0.79 s]
0.0.Bcustom2: Trace Attempt  3	[0.79 s]
0.0.Bcustom2: Trace Attempt  4	[0.79 s]
0.0.Bcustom2: Trace Attempt  5	[0.79 s]
0.0.AMcustom3: Trace Attempt  2	[0.69 s]
0.0.AMcustom3: Trace Attempt  3	[0.69 s]
0.0.AMcustom3: Trace Attempt  4	[0.70 s]
0.0.AMcustom3: Trace Attempt  5	[0.70 s]
0.0.Bcustom2: Trace Attempt 409	[0.92 s]
0.0.Bcustom2: Stopped processing property "Load_Store.p1"	[0.91 s].
0.0.Bcustom2: Morphing to D
0.0.Bcustom2: All properties determined. [0.00 s]
0.0.Bcustom2: Exited with Success (@ 0.00 s)
0.0.AMcustom3: Trace Attempt 23	[0.82 s]
0.0.AMcustom3: Stopped processing property "Load_Store.p1"	[0.83 s].
0.0.AMcustom3: Morphing to M
0.0.AMcustom3: All properties determined. [0.00 s]
0.0.AMcustom3: Exited with Success (@ 0.00 s)
0.0.D: clocks: 1, declared: 1, looping: 0, posedge: 1, negedge: 0, noedge: 0, bothedge: 0
0.0.D: Starting proof for property "Load_Store.p1"	[0.00 s].
0.0.D: Trace Attempt  1	[0.00 s]
0.0.M: clocks: 1, declared: 1, looping: 0, posedge: 1, negedge: 0, noedge: 0, bothedge: 0
0.0.M: Starting proof for property "Load_Store.p1"	[0.00 s].
0.0.M: Trace Attempt  1	[0.00 s]
0.0.D: Trace Attempt  2	[0.00 s]
0.0.D: Trace Attempt  4	[0.00 s]
0.0.M: Trace Attempt  2	[0.00 s]
0.0.M: Trace Attempt  3	[0.00 s]
0.0.M: Trace Attempt  4	[0.01 s]
0.0.M: Trace Attempt  5	[0.01 s]
0.0.Tri:    0.95" Simplification phase 1 complete
0.0.Tri: Stopped processing property "Load_Store.p1"	[1.01 s].
0.0.Tri: Morphing to AMcustom5
0.0.Tri: All properties determined. [0.00 s]
0.0.Tri: Exited with Success (@ 0.00 s)
0.0.AMcustom5: clocks: 1, declared: 1, looping: 0, posedge: 1, negedge: 0, noedge: 0, bothedge: 0
0.0.AMcustom5: Starting proof for property "Load_Store.p1"	[0.00 s].
0.0.AMcustom5: Trace Attempt  1	[0.00 s]
0.0.AMcustom5: Trace Attempt  2	[0.00 s]
0.0.AMcustom5: Trace Attempt  1	[0.00 s]
0.0.AMcustom5: Trace Attempt  2	[0.00 s]
0.0.AMcustom5: Trace Attempt  3	[0.00 s]
0.0.AMcustom5: Trace Attempt  1	[0.00 s]
0.0.AMcustom5: Trace Attempt  2	[0.00 s]
0.0.AMcustom5: Trace Attempt  3	[0.00 s]
0.0.AMcustom5: Trace Attempt  4	[0.01 s]
0.0.AMcustom5: Trace Attempt  5	[0.01 s]
0.0.AMcustom5: Trace Attempt  1	[0.01 s]
0.0.AMcustom5: Trace Attempt  2	[0.01 s]
0.0.AMcustom5: Trace Attempt  3	[0.01 s]
0.0.AMcustom5: Trace Attempt  4	[0.01 s]
0.0.AMcustom5: Trace Attempt  5	[0.02 s]
0.0.AMcustom5: Trace Attempt  1	[0.02 s]
0.0.AMcustom5: Trace Attempt  2	[0.02 s]
0.0.AMcustom5: Trace Attempt  3	[0.02 s]
0.0.AMcustom5: Trace Attempt  4	[0.02 s]
0.0.AMcustom5: Trace Attempt  5	[0.03 s]
0.0.AMcustom5: Trace Attempt  1	[0.03 s]
0.0.AMcustom5: Trace Attempt  2	[0.03 s]
0.0.AMcustom5: Trace Attempt  3	[0.03 s]
0.0.AMcustom5: Trace Attempt  4	[0.04 s]
0.0.AMcustom5: Trace Attempt  5	[0.04 s]
0.0.AMcustom5: Trace Attempt  1	[0.04 s]
0.0.AMcustom5: Trace Attempt  2	[0.04 s]
0.0.AMcustom5: Trace Attempt  3	[0.04 s]
0.0.AMcustom5: Trace Attempt  4	[0.04 s]
0.0.AMcustom5: Trace Attempt  5	[0.04 s]
0.0.AMcustom5: Trace Attempt  1	[0.06 s]
0.0.AMcustom5: Trace Attempt  2	[0.06 s]
0.0.AMcustom5: Trace Attempt  3	[0.06 s]
0.0.AMcustom5: Trace Attempt  4	[0.07 s]
0.0.AMcustom5: Trace Attempt  5	[0.07 s]
0.0.AMcustom5: Trace Attempt  1	[0.12 s]
0.0.AMcustom5: Trace Attempt  2	[0.12 s]
0.0.AMcustom5: Trace Attempt  3	[0.12 s]
0.0.AMcustom5: Trace Attempt  4	[0.12 s]
0.0.AMcustom5: Trace Attempt  5	[0.12 s]
0.0.AMcustom5: Trace Attempt  1	[0.12 s]
0.0.AMcustom5: Trace Attempt  2	[0.12 s]
0.0.AMcustom5: Trace Attempt  3	[0.12 s]
0.0.AMcustom5: Trace Attempt  4	[0.13 s]
0.0.AMcustom5: Trace Attempt  5	[0.13 s]
0.0.AMcustom5: Trace Attempt  1	[0.14 s]
0.0.AMcustom5: Trace Attempt  2	[0.14 s]
0.0.AMcustom5: Trace Attempt  3	[0.14 s]
0.0.AMcustom5: Trace Attempt  4	[0.14 s]
0.0.AMcustom5: Trace Attempt  5	[0.15 s]
0.0.AMcustom5: Trace Attempt  1	[0.19 s]
0.0.AMcustom5: Trace Attempt  2	[0.19 s]
0.0.AMcustom5: Trace Attempt  3	[0.19 s]
0.0.AMcustom5: Trace Attempt  4	[0.19 s]
0.0.AMcustom5: Trace Attempt  5	[0.20 s]
0.0.Ncustom1: Trace Attempt  1	[1.34 s]
0.0.Ncustom1: Trace Attempt  2	[1.34 s]
0.0.Ncustom1: Trace Attempt  3	[1.34 s]
0.0.Ncustom1: Trace Attempt  4	[1.35 s]
0.0.Ncustom1: Trace Attempt  5	[1.35 s]
0.0.AMcustom5: Trace Attempt  1	[0.36 s]
0.0.AMcustom5: Trace Attempt  2	[0.36 s]
0.0.AMcustom5: Trace Attempt  3	[0.36 s]
0.0.AMcustom5: Trace Attempt  4	[0.36 s]
0.0.AMcustom5: Trace Attempt  5	[0.36 s]
0.0.AMcustom5: Trace Attempt  1	[0.36 s]
0.0.AMcustom5: Trace Attempt  2	[0.36 s]
0.0.AMcustom5: Trace Attempt  3	[0.36 s]
0.0.AMcustom5: Trace Attempt  4	[0.37 s]
0.0.AMcustom5: Trace Attempt  5	[0.37 s]
0.0.AMcustom5: Trace Attempt  1	[0.40 s]
0.0.AMcustom5: Trace Attempt  2	[0.40 s]
0.0.AMcustom5: Trace Attempt  3	[0.40 s]
0.0.AMcustom5: Trace Attempt  4	[0.41 s]
0.0.AMcustom5: Trace Attempt  1	[0.44 s]
0.0.AMcustom5: Trace Attempt  2	[0.44 s]
0.0.AMcustom5: Trace Attempt  3	[0.44 s]
0.0.AMcustom5: Trace Attempt  4	[0.45 s]
0.0.AMcustom5: Trace Attempt  1	[0.54 s]
0.0.AMcustom5: Trace Attempt  2	[0.54 s]
0.0.AMcustom5: Trace Attempt  3	[0.55 s]
0.0.AMcustom5: Trace Attempt  4	[0.55 s]
0.0.AMcustom5: Trace Attempt  5	[0.55 s]
0.0.AMcustom5: Trace Attempt  1	[0.95 s]
0.0.AMcustom5: Trace Attempt  2	[0.95 s]
0.0.AMcustom5: Trace Attempt  3	[0.95 s]
0.0.AMcustom5: Trace Attempt  4	[0.95 s]
0.0.AMcustom5: Trace Attempt  5	[0.95 s]
0.0.AMcustom5: Trace Attempt  1	[0.95 s]
0.0.AMcustom5: Trace Attempt  2	[0.95 s]
0.0.AMcustom5: Trace Attempt  3	[0.95 s]
0.0.AMcustom5: Trace Attempt  4	[0.96 s]
0.0.AMcustom5: Trace Attempt  5	[0.96 s]
0.0.AMcustom5: Trace Attempt  1	[0.96 s]
0.0.AMcustom5: Trace Attempt  2	[0.97 s]
0.0.AMcustom5: Trace Attempt  3	[0.97 s]
0.0.AMcustom5: Trace Attempt  4	[0.97 s]
0.0.AMcustom5: Trace Attempt  1	[1.02 s]
0.0.AMcustom5: Trace Attempt  2	[1.02 s]
0.0.AMcustom5: Trace Attempt  3	[1.02 s]
0.0.AMcustom5: Trace Attempt  4	[1.02 s]
0.0.AMcustom5: Trace Attempt  5	[1.02 s]
0.0.AMcustom5: Trace Attempt  1	[1.14 s]
0.0.AMcustom5: Trace Attempt  2	[1.14 s]
0.0.AMcustom5: Trace Attempt  3	[1.14 s]
0.0.AMcustom5: Trace Attempt  4	[1.15 s]
0.0.AMcustom5: Trace Attempt  5	[1.15 s]
0.0.AMcustom5: Trace Attempt  1	[1.77 s]
0.0.AMcustom5: Trace Attempt  2	[1.77 s]
0.0.AMcustom5: Trace Attempt  3	[1.77 s]
0.0.AMcustom5: Trace Attempt  4	[1.78 s]
0.0.AMcustom5: Trace Attempt  5	[1.78 s]
0.0.Ncustom1: Trace Attempt 116	[3.27 s]
0.0.Ncustom1: Stopped processing property "Load_Store.p1"	[3.40 s].
0.0.D: Trace Attempt 65	[1.26 s]
0.0.D: Stopped processing property "Load_Store.p1"	[2.40 s].
0.0.D: Morphing to AMcustom3
0.0.D: All properties determined. [0.00 s]
0.0.D: Exited with Success (@ 0.00 s)
0.0.AMcustom5: Trace Attempt 49	[2.28 s]
0.0.AMcustom5: Stopped processing property "Load_Store.p1"	[2.27 s].
0.0.AMcustom5: Morphing to ADcustom7
0.0.AMcustom5: All properties determined. [0.00 s]
0.0.AMcustom5: Exited with Success (@ 0.00 s)
0.0.Ncustom1: Morphing to Bcustom2
0.0.Ncustom1: All properties determined. [0.00 s]
0.0.Ncustom1: Exited with Success (@ 0.00 s)
0.0.AMcustom3: clocks: 1, declared: 1, looping: 0, posedge: 1, negedge: 0, noedge: 0, bothedge: 0
0.0.AMcustom3: Starting proof for property "Load_Store.p1"	[0.00 s].
0.0.AMcustom3: Trace Attempt  1	[0.00 s]
0.0.AMcustom3: Trace Attempt  2	[0.00 s]
0.0.AMcustom3: Trace Attempt  3	[0.00 s]
0.0.AMcustom3: Trace Attempt  4	[0.00 s]
0.0.AMcustom3: Trace Attempt  5	[0.00 s]
0.0.AMcustom3: Trace Attempt  1	[0.00 s]
0.0.Bcustom2: clocks: 1, declared: 1, looping: 0, posedge: 1, negedge: 0, noedge: 0, bothedge: 0
0.0.Bcustom2: Starting proof for property "Load_Store.p1"	[0.00 s].
0.0.AMcustom3: Trace Attempt  2	[0.01 s]
0.0.ADcustom7: clocks: 1, declared: 1, looping: 0, posedge: 1, negedge: 0, noedge: 0, bothedge: 0
0.0.ADcustom7: Starting proof for property "Load_Store.p1"	[0.00 s].
0.0.ADcustom7: Trace Attempt  1	[0.00 s]
0.0.ADcustom7: Trace Attempt  2	[0.00 s]
0.0.ADcustom7: Trace Attempt  1	[0.00 s]
0.0.Bcustom2: Trace Attempt  1	[0.00 s]
0.0.Bcustom2: Trace Attempt  2	[0.00 s]
0.0.Bcustom2: Trace Attempt  1	[0.00 s]
0.0.Bcustom2: Trace Attempt  2	[0.00 s]
0.0.Bcustom2: Trace Attempt  3	[0.00 s]
0.0.ADcustom7: Trace Attempt  2	[0.00 s]
0.0.ADcustom7: Trace Attempt  3	[0.00 s]
0.0.ADcustom7: Trace Attempt  1	[0.00 s]
0.0.ADcustom7: Trace Attempt  2	[0.00 s]
0.0.ADcustom7: Trace Attempt  3	[0.00 s]
0.0.ADcustom7: Trace Attempt  4	[0.00 s]
0.0.Bcustom2: Trace Attempt  1	[0.00 s]
0.0.Bcustom2: Trace Attempt  2	[0.00 s]
0.0.Bcustom2: Trace Attempt  3	[0.00 s]
0.0.Bcustom2: Trace Attempt  4	[0.00 s]
0.0.Bcustom2: Trace Attempt  5	[0.00 s]
0.0.Bcustom2: Trace Attempt  1	[0.00 s]
0.0.Bcustom2: Trace Attempt  2	[0.00 s]
0.0.Bcustom2: Trace Attempt  3	[0.00 s]
0.0.Bcustom2: Trace Attempt  4	[0.00 s]
0.0.Bcustom2: Trace Attempt  5	[0.00 s]
0.0.AMcustom3: Trace Attempt  3	[0.01 s]
0.0.ADcustom7: Trace Attempt  5	[0.00 s]
0.0.ADcustom7: Trace Attempt  1	[0.01 s]
0.0.ADcustom7: Trace Attempt  2	[0.01 s]
0.0.ADcustom7: Trace Attempt  3	[0.01 s]
0.0.ADcustom7: Trace Attempt  4	[0.01 s]
0.0.ADcustom7: Trace Attempt  5	[0.01 s]
0.0.ADcustom7: Trace Attempt  1	[0.01 s]
0.0.ADcustom7: Trace Attempt  2	[0.01 s]
0.0.Bcustom2: Trace Attempt  1	[0.01 s]
0.0.Bcustom2: Trace Attempt  2	[0.01 s]
0.0.Bcustom2: Trace Attempt  3	[0.01 s]
0.0.Bcustom2: Trace Attempt  4	[0.01 s]
0.0.Bcustom2: Trace Attempt  5	[0.01 s]
0.0.AMcustom3: Trace Attempt  4	[0.01 s]
0.0.AMcustom3: Trace Attempt  5	[0.01 s]
0.0.ADcustom7: Trace Attempt  4	[0.01 s]
0.0.Bcustom2: Trace Attempt  1	[0.01 s]
0.0.Bcustom2: Trace Attempt  2	[0.01 s]
0.0.Bcustom2: Trace Attempt  3	[0.01 s]
0.0.Bcustom2: Trace Attempt  4	[0.01 s]
0.0.Bcustom2: Trace Attempt  5	[0.01 s]
0.0.AMcustom3: Trace Attempt  1	[0.02 s]
0.0.AMcustom3: Trace Attempt  2	[0.02 s]
0.0.AMcustom3: Trace Attempt  3	[0.02 s]
0.0.AMcustom3: Trace Attempt  4	[0.03 s]
0.0.ADcustom7: Trace Attempt  1	[0.03 s]
0.0.ADcustom7: Trace Attempt  2	[0.03 s]
0.0.Bcustom2: Trace Attempt  1	[0.03 s]
0.0.Bcustom2: Trace Attempt  2	[0.03 s]
0.0.Bcustom2: Trace Attempt  3	[0.03 s]
0.0.Bcustom2: Trace Attempt  4	[0.03 s]
0.0.Bcustom2: Trace Attempt  5	[0.03 s]
0.0.AMcustom3: Trace Attempt  5	[0.03 s]
0.0.ADcustom7: Trace Attempt  3	[0.03 s]
0.0.ADcustom7: Trace Attempt  4	[0.03 s]
0.0.ADcustom7: Trace Attempt  5	[0.03 s]
0.0.ADcustom7: Trace Attempt  1	[0.03 s]
0.0.ADcustom7: Trace Attempt  2	[0.03 s]
0.0.ADcustom7: Trace Attempt  4	[0.03 s]
0.0.ADcustom7: Trace Attempt  1	[0.05 s]
0.0.ADcustom7: Trace Attempt  2	[0.05 s]
0.0.Bcustom2: Trace Attempt  1	[0.05 s]
0.0.Bcustom2: Trace Attempt  2	[0.05 s]
0.0.Bcustom2: Trace Attempt  3	[0.05 s]
0.0.Bcustom2: Trace Attempt  4	[0.05 s]
0.0.Bcustom2: Trace Attempt  5	[0.05 s]
0.0.ADcustom7: Trace Attempt  4	[0.05 s]
0.0.AMcustom3: Trace Attempt  1	[0.07 s]
0.0.AMcustom3: Trace Attempt  2	[0.07 s]
0.0.AMcustom3: Trace Attempt  3	[0.07 s]
0.0.AMcustom3: Trace Attempt  4	[0.08 s]
0.0.AMcustom3: Trace Attempt  5	[0.08 s]
0.0.Ht: Trace Attempt 12050	[184.50 s]
0.0.ADcustom7: Trace Attempt  1	[0.10 s]
0.0.ADcustom7: Trace Attempt  2	[0.10 s]
0.0.ADcustom7: Trace Attempt  3	[0.10 s]
0.0.ADcustom7: Trace Attempt  4	[0.10 s]
0.0.ADcustom7: Trace Attempt  5	[0.10 s]
0.0.ADcustom7: Trace Attempt  1	[0.10 s]
0.0.ADcustom7: Trace Attempt  2	[0.11 s]
0.0.ADcustom7: Trace Attempt  4	[0.11 s]
0.0.Bcustom2: Trace Attempt  1	[0.12 s]
0.0.Bcustom2: Trace Attempt  2	[0.12 s]
0.0.Bcustom2: Trace Attempt  3	[0.12 s]
0.0.Bcustom2: Trace Attempt  4	[0.12 s]
0.0.Bcustom2: Trace Attempt  5	[0.12 s]
0.0.ADcustom7: Trace Attempt  1	[0.12 s]
0.0.ADcustom7: Trace Attempt  2	[0.12 s]
0.0.ADcustom7: Trace Attempt  4	[0.12 s]
0.0.ADcustom7: Trace Attempt  5	[0.13 s]
0.0.ADcustom7: Trace Attempt  1	[0.18 s]
0.0.ADcustom7: Trace Attempt  2	[0.18 s]
0.0.ADcustom7: Trace Attempt  3	[0.18 s]
0.0.ADcustom7: Trace Attempt  5	[0.18 s]
0.0.AMcustom3: Trace Attempt  1	[0.23 s]
0.0.AMcustom3: Trace Attempt  2	[0.23 s]
0.0.AMcustom3: Trace Attempt  3	[0.24 s]
0.0.AMcustom3: Trace Attempt  4	[0.24 s]
0.0.AMcustom3: Trace Attempt  5	[0.24 s]
0.0.Bcustom2: Trace Attempt  1	[0.28 s]
0.0.Bcustom2: Trace Attempt  2	[0.28 s]
0.0.Bcustom2: Trace Attempt  3	[0.28 s]
0.0.Bcustom2: Trace Attempt  4	[0.28 s]
0.0.Bcustom2: Trace Attempt  5	[0.28 s]
0.0.ADcustom7: Trace Attempt  1	[0.39 s]
0.0.ADcustom7: Trace Attempt  2	[0.39 s]
0.0.ADcustom7: Trace Attempt  3	[0.39 s]
0.0.ADcustom7: Trace Attempt  4	[0.39 s]
0.0.ADcustom7: Trace Attempt  5	[0.39 s]
0.0.ADcustom7: Trace Attempt  1	[0.39 s]
0.0.ADcustom7: Trace Attempt  2	[0.39 s]
0.0.ADcustom7: Trace Attempt  3	[0.40 s]
0.0.ADcustom7: Trace Attempt  5	[0.40 s]
0.0.ADcustom7: Trace Attempt  1	[0.44 s]
0.0.ADcustom7: Trace Attempt  2	[0.44 s]
0.0.ADcustom7: Trace Attempt  3	[0.44 s]
0.0.ADcustom7: Trace Attempt  5	[0.45 s]
0.0.ADcustom7: Trace Attempt  1	[0.50 s]
0.0.ADcustom7: Trace Attempt  2	[0.50 s]
0.0.ADcustom7: Trace Attempt  3	[0.50 s]
0.0.ADcustom7: Trace Attempt  5	[0.50 s]
0.0.AMcustom3: Trace Attempt  1	[0.65 s]
0.0.AMcustom3: Trace Attempt  2	[0.65 s]
0.0.AMcustom3: Trace Attempt  3	[0.65 s]
0.0.AMcustom3: Trace Attempt  4	[0.65 s]
0.0.AMcustom3: Trace Attempt  5	[0.66 s]
0.0.ADcustom7: Trace Attempt  1	[0.71 s]
0.0.ADcustom7: Trace Attempt  2	[0.71 s]
0.0.ADcustom7: Trace Attempt  3	[0.71 s]
0.0.ADcustom7: Trace Attempt  5	[0.71 s]
0.0.Bcustom2: Trace Attempt  1	[0.74 s]
0.0.Bcustom2: Trace Attempt  2	[0.74 s]
0.0.Bcustom2: Trace Attempt  3	[0.74 s]
0.0.Bcustom2: Trace Attempt  4	[0.74 s]
0.0.Bcustom2: Trace Attempt  5	[0.74 s]
0.0.M: Trace Attempt 141	[4.01 s]
0.0.ADcustom7: Trace Attempt  1	[2.03 s]
0.0.ADcustom7: Trace Attempt  2	[2.03 s]
0.0.ADcustom7: Trace Attempt  3	[2.03 s]
0.0.ADcustom7: Trace Attempt  4	[2.03 s]
0.0.ADcustom7: Trace Attempt  5	[2.03 s]
0.0.ADcustom7: Trace Attempt  1	[2.03 s]
0.0.ADcustom7: Trace Attempt  2	[2.03 s]
0.0.ADcustom7: Trace Attempt  3	[2.03 s]
0.0.ADcustom7: Trace Attempt  5	[2.03 s]
0.0.ADcustom7: Trace Attempt  1	[2.05 s]
0.0.ADcustom7: Trace Attempt  2	[2.05 s]
0.0.ADcustom7: Trace Attempt  3	[2.05 s]
0.0.ADcustom7: Trace Attempt  5	[2.05 s]
0.0.ADcustom7: Trace Attempt  1	[2.10 s]
0.0.ADcustom7: Trace Attempt  2	[2.10 s]
0.0.ADcustom7: Trace Attempt  3	[2.10 s]
0.0.ADcustom7: Trace Attempt  5	[2.11 s]
0.0.ADcustom7: Trace Attempt  1	[2.34 s]
0.0.ADcustom7: Trace Attempt  2	[2.34 s]
0.0.ADcustom7: Trace Attempt  3	[2.34 s]
0.0.ADcustom7: Trace Attempt  5	[2.34 s]
0.0.AMcustom3: Trace Attempt  1	[3.14 s]
0.0.AMcustom3: Trace Attempt  2	[3.14 s]
0.0.AMcustom3: Trace Attempt  3	[3.14 s]
0.0.AMcustom3: Trace Attempt  4	[3.14 s]
0.0.AMcustom3: Trace Attempt  5	[3.15 s]
0.0.ADcustom7: Trace Attempt  1	[3.55 s]
0.0.ADcustom7: Trace Attempt  2	[3.55 s]
0.0.ADcustom7: Trace Attempt  3	[3.55 s]
0.0.ADcustom7: Trace Attempt  5	[3.55 s]
0.0.Ht: Trace Attempt 12175	[188.50 s]
0.0.ADcustom7: Trace Attempt 33	[3.76 s]
0.0.ADcustom7: Stopped processing property "Load_Store.p1"	[4.54 s].
0.0.ADcustom7: Morphing to Tricustom8
0.0.ADcustom7: All properties determined. [0.00 s]
0.0.ADcustom7: Exited with Success (@ 0.00 s)
0.0.Tricustom8: clocks: 1, declared: 1, looping: 0, posedge: 1, negedge: 0, noedge: 0, bothedge: 0
0.0.AMcustom3: Trace Attempt 90	[4.52 s]
0.0.AMcustom3: Stopped processing property "Load_Store.p1"	[4.55 s].
0.0.AMcustom3: Morphing to D
0.0.AMcustom3: All properties determined. [0.00 s]
0.0.AMcustom3: Exited with Success (@ 0.00 s)
0.0.D: clocks: 1, declared: 1, looping: 0, posedge: 1, negedge: 0, noedge: 0, bothedge: 0
0.0.D: Starting proof for property "Load_Store.p1"	[0.00 s].
0.0.D: Trace Attempt 65	[0.01 s]
0.0.Tricustom8: Starting proof for property "Load_Store.p1"	[0.00 s].
0.0.Tricustom8: Trace Attempt  1	[0.00 s]
0.0.D: Requesting engine job to terminate
0.0.M: Requesting engine job to terminate
0.0.Tricustom8: Requesting engine job to terminate
0.0.Hp: Requesting engine job to terminate
0.0.Ht: Requesting engine job to terminate
INFO (IPF144): 0: Initiating shutdown of proof [189.28 s]
0.0.Tricustom8: A proof was found: No trace exists. [0.28 s]
INFO (IPF057): 0.0.Tricustom8: The property "Load_Store.p1" was proven in 0.28 s.
0.0.D: Stopped processing property "Load_Store.p1"	[0.29 s].
0.0.D: All properties determined. [0.29 s]
0.0.M: Trace Attempt 192	[7.01 s]
0.0.M: Stopped processing property "Load_Store.p1"	[7.25 s].
0.0.M: All properties determined. [7.25 s]
0.0.Ht: Trace Attempt 12197	[189.23 s]
0.0.Ht: All properties determined. [189.26 s]
0.0.M: Exited with Success (@ 189.31 s)
0: ProofGrid usable level: 0
0.0.D: Exited with Success (@ 189.34 s)
0.0.Ht: Exited with Success (@ 189.47 s)
0.0.Tricustom8: Stopped processing property "Load_Store.p1"	[0.48 s].
0.0.Tricustom8: All properties determined. [0.48 s]
0.0.Tricustom8: Exited with Success (@ 189.49 s)
0.0.Hp: Trace Attempt 3052	[181.95 s]
0.0.Hp: All properties determined. [190.13 s]
0.0.Hp: Exited with Success (@ 190.58 s)
0.0.Bcustom2: Sending SIGKILL
0.0.Bcustom2: Stopped processing property "Load_Store.p1"	[6.88 s].
0.0.Bcustom2: Trace Attempt 1025	[2.02 s]
0.0.Bcustom2: Terminated by signal SIGKILL (@ 191.33 s)
0: --------------------------------------------------------------
ProofGrid Summary (utilization 99.96 %)
--------------------------------------------------------------
     engines started                               :    15
     engine jobs started                           :     7

    Average time in state (seconds)
    ------------------------------------------------------
    Engine  Pending     Running        Dead    Utilization
    ------------------------------------------------------
     Hp        0.03      189.28        0.00       99.98 %
     Ht        0.04      189.25        0.00       99.98 %
     Oh        0.07        0.00        0.00        1.37 %
    Tri        0.03      188.93        0.00       99.98 %
      D        0.04      189.10        0.00       99.98 %
      M        0.04      189.03        0.00       99.98 %
    Tricustom8        0.12        8.03        0.00       98.51 %
    all        0.05      136.23        0.00       99.96 %

    Total time in state (seconds)
    -----------------------------------------
            Pending     Running        Dead  
    -----------------------------------------
               0.37      953.63        0.00

    Data read    : 6.98 MiB
    Data written : 5.22 kiB

0: All pending notifications were processed.
INFO (IPF059): 0: Completed proof on task: "<embedded>"

==============================================================
SUMMARY
==============================================================
           Properties Considered              : 1
                 assertions                   : 1
                  - proven                    : 1 (100%)
                  - bounded_proven (user)     : 0 (0%)
                  - bounded_proven (auto)     : 0 (0%)
                  - marked_proven             : 0 (0%)
                  - cex                       : 0 (0%)
                  - ar_cex                    : 0 (0%)
                  - undetermined              : 0 (0%)
                  - unknown                   : 0 (0%)
                  - error                     : 0 (0%)
                 covers                       : 0
                  - unreachable               : 0
                  - bounded_unreachable (user): 0
                  - covered                   : 0
                  - ar_covered                : 0
                  - undetermined              : 0
                  - unknown                   : 0
                  - error                     : 0
proven
[<embedded>] % exit -force
INFO (IPL005): Received request to exit from the console.
INFO: Waiting for proof threads to stop...
INFO: Proof threads stopped.
INFO (IPL018): The peak resident set memory use for this session was 2.084 GB.
INFO (IPL014): Waiting for the Tcl-thread to exit.
INFO (IPL015): The Tcl-thread exited with status 0.
INFO (IPL016): Exiting the analysis session with status 0.
