# ----------------------------------------
# Jasper Version Info
# tool      : Jasper 2024.06
# platform  : Linux 3.10.0-1160.62.1.el7.x86_64
# version   : 2024.06p002 64 bits
# build date: 2024.09.02 16:28:38 UTC
# ----------------------------------------
# started   : 2025-11-17 19:38:06 IST
# hostname  : vlsi-ria84.vlsidomain
# pid       : 7399
# arguments : '-label' 'session_0' '-console' '//127.0.0.1:32800' '-nowindow' '-style' 'windows' '-exitonerror' '-data' 'AAAAynicY2RgYLCp////PwMYMD6A0Aw2jAyoAMRnQhUJbEChGRhYYZphSliAmItBl6GAoYghnyELyNNi0ANCfSA7HS6aypDMUMJQDBRNYshhyGTIY8hmiGewAKrmAepNYkgEyiYzZAD5Ymgq9MAyOWC7AAvoFuU=' '-proj' '/users/rompel/jasper_executions/safety_liveness/jgprojects/blink_8/sessionLogs/session_0' '-init' '-hidden' '/users/rompel/jasper_executions/safety_liveness/jgprojects/blink_8/.tmp/.initCmds.tcl' 'blink_8.tcl' '-hidden' '/users/rompel/jasper_executions/safety_liveness/jgprojects/blink_8/.tmp/.postCmds.tcl'

Any disclosure about the Cadence Design Systems software or its use
model to any third party violates the written Non-Disclosure Agreement
between Cadence Design Systems, Inc. and the customer.

THIS SOFTWARE CONTAINS CONFIDENTIAL INFORMATION AND TRADE SECRETS OF
CADENCE DESIGN SYSTEMS, INC. USE, DISCLOSURE, OR REPRODUCTION IS
PROHIBITED WITHOUT THE PRIOR EXPRESS WRITTEN PERMISSION OF CADENCE
DESIGN SYSTEMS, INC.

Copyright (C) 2000-2024 Cadence Design Systems, Inc. All Rights
Reserved.  Unpublished -- rights reserved under the copyright laws of
the United States.

This product includes software developed by others and redistributed
according to license agreement. See doc/third_party_readme.txt for
further details.

RESTRICTED RIGHTS LEGEND

Use, duplication, or disclosure by the Government is subject to
restrictions as set forth in subparagraph (c) (1) (ii) of the Rights in
Technical Data and Computer Software clause at DFARS 252.227-7013 or
subparagraphs (c) (1) and (2) of Commercial Computer Software -- Restricted
Rights at 48 CFR 52.227-19, as applicable.


                          Cadence Design Systems, Inc.
                          2655 Seely Avenue
                          San Jose, CA 95134
                          Phone: 408.943.1234

For technical assistance visit http://support.cadence.com.

Jasper Apps Analysis Session - /users/rompel/jasper_executions/safety_liveness/jgprojects/blink_8/sessionLogs/session_0

WARNING (WG017): [session]: The system's locale is "ANSI_X3.4-1968", which is not UTF-8. Non-ASCII characters might not be handled correctly.
WARNING (WG017): [jg_console]: The system's locale is "ANSI_X3.4-1968", which is not UTF-8. Non-ASCII characters might not be handled correctly.
INFO: successfully checked out license "jasper_fao".
INFO: reading configuration file "/users/rompel/.config/cadence/jasper.conf".
% analyze -sv09 ../blink_8.sv
[-- (VERI-1482)] Analyzing Verilog file '/tools/cadence2425/JASPER/jasper_2024.06p002/lib/verilog/packages/std/std.sv' into library 'std'
[-- (VERI-1482)] Analyzing Verilog file '../blink_8.sv'
% elaborate -bbox_mul 1000000 -bbox_div 1000000 -bbox_mod 1000000 -bbox_a 1000000
[INFO (HIER-8002)] ../blink_8.sv(18): Disabling old hierarchical reference handler
[INFO (VERI-1018)] ../blink_8.sv(1): compiling module 'BLINK'
[WARN (VERI-1209)] ../blink_8.sv(10): expression size 32 truncated to fit in target size 15
INFO (ISW003): Top module name is "BLINK".
INFO (INL208): Elaboration synthesis summary:
  Number of synthesized netlists          1 (0 packages)
  Single run mode                         On
  Pipeline                                On (1 pipelined netlists)
  Late hierarchical reference connection  On
  Number of analyzed Verilog modules      1 (1 synthesized)
  Number of analyzed VHDL entities        0 (0 synthesized)
INFO (INL003): Clearing all state information (assumes, stopats, and so forth).
BLINK
[<embedded>] % reset rst
INFO (IPM031): Clearing proof results of all properties.
INFO (IRS006): Current reset condition is "rst".
[<embedded>] % clock clk
[<embedded>] % prove -all
Ncustom1: Custom engine code is hT3Ng7hPPfiYQOTDZ3qhYOwGAM51eA+J/FjkM5shLioAsqhgLR4Ft+O1BuKG6ilQ83B9tLXSl+CwjiTMAQA
Bcustom2: Custom engine code is hT3Nm7hPr1Vp3Di1Ra2USNIGL4JypRnLKLAdF6JAyuavO2JfGCiY9OZJhcAcOUnLx5xwNdhILGrAWX9s+z2WDkKwNR7tAfClBEjRFVQeq6DU54boFgEA
AMcustom3: Custom engine code is hT3Ng7hP/feYQOTDZ3qhYOwGAM51eA+J/FjkM5shLioAsqhgLR4Ft+O1BuKG6ilQ83B9tLXSmmqwm7g9AQA
Mpcustom4: Custom engine code is hT3NZbhP9fmY2AbBQnsjfOxn6c+6e6yL+/e8fZFmaQrnlgEA
INFO (IPF036): Starting proof on task: "<embedded>", 1 properties to prove with 0 already proven/unreachable
INFO (IRS029): Starting reset analysis: phase 1 of 4.
INFO (IRS030): Running reset analysis: phase 2 of 4.
INFO (IRS031): Running reset analysis: phase 3 of 4.
INFO (IRS020): Starting the reset analysis simulation with a limit of 100 iterations (phase 4 of 4).
INFO (IRS024): Reset iterations 0 to 4 analyzed.
INFO (IRS018): Reset analysis simulation executed for 3 iterations. Assigned values for 16 of 18 design flops, 0 of 0 design latches, 3 of 3 internal elements.
INFO (IRS039): Reset analysis complete.
INFO (IPF031): Settings used for proof thread 0:
    orchestration                 = on
    time_limit                    = 86400s
    per_property_time_limit       = 1s * 10 ^ scan
    engine_mode                   = auto
    proofgrid_per_engine_max_jobs = 1
    max engine jobs               = auto
    proofgrid_mode                = local
    proofgrid_restarts            = 10
AMcustom5: Custom engine code is hT3N1rhP11/52HrFRS21ROp2LOjVTgPvT8L8BGXHgLhaIuqtT4nARFjUqrBL+7pLmaTOzBepZW/Jm8SSrHDybSQtoNiO3y43wk+dEoWlsZizu97Fih6O6lPVG/LpWP5SsUPwlGagLNa1FKEFvwVXyX7//8prySbvSxIHXr5er+z4RAEA
0: Using multistage preprocessing
Ncustom6: Custom engine code is hT3OXrhPByJp3TrFSTLhUmMH4KVtJgmTCnNDF46yMXOKY48m4LS5nE7yBzFjA7kDuwO/GhGUpEPiky3p3wmPn3dJZHxFMsafSoObRzSC+tn7sEY0WbTdZ/FV4hL3MYH/b1CIUvXSWR4wqEoVLsmMOD4xIPT4lI1LO6ZCO7PnnWQuLwetnvKlrXx6wCW/A+x+enqslg1YPobi4wEF/EvbzOvcTYdJvl2s4H2yZg2b2ofAVN5WvhWk1HoBAA
0: Starting reduce
ADcustom7: Custom engine code is hT3Nv7hPv1752HrFRa2kROx2f/ECJeZB2AZsLdlO8VwmIuqtT4nIDFXclhg+O+o+DMmQCekbheGk0kK28laA9gaOFDXsQp29J3X615HY1IPHJWd6FUFvCHjO+p1k652b5JJvZlShNpGlGSXAiQe/mEAj6tEBAA
Tricustom8: Custom engine code is hT3Nu7hPt1752DvFRa0kNDiyIV97VyejwM9C/jCLJjdPvusZONHY42VYUy0Q1ZotnhcVtNc56tJ5wbxv6V2+XpdsaSlHck5vfnbYjdwj1OECy9U+7oSQ0SZE3g5ayD+Phuh4odCJTjeKa2k4elM9ldQfkAEA
Gcustom9: Custom engine code is hT3NibhPDfeYQADBZnYcglOvK9Pfd7EOeniIqP8jNsyIqInncipMGcUXqAadachREE9F2PwhBUZUNw5kHnd4JdXkamORRgEA
C2custom10: Custom engine code is hT3NirhPjfWYQADBZnYcglOvK9Pfd7EOeniIqP8jNsyIqInncgkrYMMXCYbdK0dUjZIF9d4cJ0rHoBDjwVLBKuG86XYVV00BAA
AGcustom11: Custom engine code is hT3NirhP/fmYQADBZnYcglOvK9Pfd7EOeniIqP8jNsyIqInnckcwYMMXCYbdK0dUjZIF9d4cJ0rHoBDjwVLBKuHEZnZByh0BAA
Bcustom12: Custom engine code is hT3NjrhPDfiYQADBZnYcglOvK9PfWxFtenjIyBqfrgr7if/jL/yPOuK1BAflEcW0DxNH2eDIoezN2gxlQFg81RZtiWXh7aiTAidvAQA
Ncustom13: Custom engine code is hT3NR7hPByFp3TrFSTLhUmMH4KWtJglTyV/c51BHEeZWamnJv767nE6PCak26bd3gf3XGN3rIRheufhDieCJQVISo+gNYUKhiUedBKGtsP/a18svAnlMJZudHxDFwK5ufsyoxsIyiAeSY2oi3tEuoDHr5gw42DFKAG3PqO3CEsl8Azzdt3pl5nGA1Ifv2H02eYsFzWb/nfp8PMb3F0krE/EgBcm8TD9Div8BAA
0: Finished reduce in 0s
Tricustom14: Custom engine code is hT3Nu7hP3fiYQADBZnYcglNHp9bfd7EOeniIqP/ji8sGLQu8yhsFO+wxJ+O+R0bU8g/IewXFomyos+viQnWc2xYNYmMqpo3i40O7DaZR7qfp4YqNx26KRvQ/qx0BAA
0.0.PRE: Performing Proof Simplification...
0.0.N: clocks: 1, declared: 1, looping: 0, posedge: 1, negedge: 0, noedge: 0, bothedge: 0
0.0.N: Proof Simplification Iteration 1	[0.00 s]
0.0.PRE: A proof was found: No trace exists. [0.00 s]
INFO (IPF057): 0.0.PRE: The property ":noDeadEnd" was proven in 0.00 s.
    Use check_assumptions -show -dead_end to show this property in the property table.
0.0.PRE: A proof was found: No trace exists. [0.00 s]
INFO (IPF057): 0.0.PRE: The property ":noConflict" was proven in 0.00 s.
    Use check_assumptions -show to show this property in the property table.
INFO (IPF047): 0.0.PRE: The cover property ":live" was covered in 1 cycles in 0.00 s.
    Use check_assumptions -show -live to show this property in the property table.
0.0.PRE: Proof Simplification completed in 0.00 s
0: About to start ProofGrid in its own thread with a limit of 10000 pending notifications and a limit of 10 traces.
0: =============================== ProofGrid start ===============================
0: ProofGrid usable level: 1
0: Initial ProofGrid level: 1
0: ProofGrid is starting event handling
0.0.N: Proofgrid shell started at 7465@vlsi-ria84(local) jg_7399_vlsi-ria84_1
0.0.Hp: Proofgrid shell started at 7466@vlsi-ria84(local) jg_7399_vlsi-ria84_1
0.0.Hp: clocks: 1, declared: 1, looping: 0, posedge: 1, negedge: 0, noedge: 0, bothedge: 0
0.0.N: clocks: 1, declared: 1, looping: 0, posedge: 1, negedge: 0, noedge: 0, bothedge: 0
0.0.N: Last scan. Per property time limit: 0s
0.0.N: Starting proof for property "BLINK.p1"	[0.00 s].
0.0.N: Trace Attempt  1	[0.00 s]
0.0.N: Trace Attempt  2	[0.00 s]
0.0.N: Trace Attempt  2	[0.00 s]
0.0.Hp: Last scan. Per property time limit: 0s
0.0.Hp: Trace Attempt  1	[0.00 s]
0.0.Hp: Trace Attempt  2	[0.00 s]
0.0.Hp: Trace Attempt  3	[0.00 s]
0.0.Hp: Trace Attempt  4	[0.00 s]
0.0.N: Trace Attempt  3	[0.00 s]
0.0.Hp: Trace Attempt  5	[0.00 s]
0.0.N: Trace Attempt  3	[0.00 s]
0.0.N: Trace Attempt  4	[0.00 s]
0.0.N: Trace Attempt  5	[0.00 s]
0.0.N: Trace Attempt  1	[0.00 s]
0.0.N: Trace Attempt  2	[0.00 s]
0.0.N: Trace Attempt  3	[0.00 s]
0.0.N: Trace Attempt  4	[0.00 s]
0.0.N: Trace Attempt  5	[0.01 s]
0.0.Ht: Proofgrid shell started at 7497@vlsi-ria84(local) jg_7399_vlsi-ria84_1
0.0.AM: Proofgrid shell started at 7500@vlsi-ria84(local) jg_7399_vlsi-ria84_1
0.0.Ht: clocks: 1, declared: 1, looping: 0, posedge: 1, negedge: 0, noedge: 0, bothedge: 0
0.0.Ht: Last scan. Per property time limit: 0s
0.0.Ht: Trace Attempt  1	[0.00 s]
0.0.Ht: Trace Attempt  2	[0.00 s]
0.0.Ht: Trace Attempt  3	[0.00 s]
0.0.Ht: Trace Attempt  4	[0.00 s]
0.0.Ht: Trace Attempt  5	[0.00 s]
0.0.AM: clocks: 1, declared: 1, looping: 0, posedge: 1, negedge: 0, noedge: 0, bothedge: 0
0.0.AM: Last scan. Per property time limit: 0s
0.0.AM: Starting proof for property "BLINK.p1"	[0.00 s].
0.0.AM: Trace Attempt  1	[0.00 s]
0.0.AM: Trace Attempt  2	[0.00 s]
0.0.AM: Trace Attempt  3	[0.00 s]
0.0.AM: Trace Attempt  4	[0.00 s]
0.0.AM: Trace Attempt  5	[0.00 s]
0.0.AM: Trace Attempt  1	[0.00 s]
0.0.AM: Trace Attempt  2	[0.00 s]
0.0.AM: Trace Attempt  3	[0.00 s]
0.0.AM: Trace Attempt  4	[0.01 s]
0.0.AM: Trace Attempt  5	[0.01 s]
0.0.B: Proofgrid shell started at 7499@vlsi-ria84(local) jg_7399_vlsi-ria84_1
0.0.B: clocks: 1, declared: 1, looping: 0, posedge: 1, negedge: 0, noedge: 0, bothedge: 0
0.0.B: Last scan. Per property time limit: 0s
0.0.B: Starting proof for property "BLINK.p1"	[0.00 s].
0.0.B: Trace Attempt  1	[0.00 s]
0.0.B: Trace Attempt  2	[0.00 s]
0.0.B: Trace Attempt  3	[0.00 s]
0.0.B: Trace Attempt  4	[0.00 s]
0.0.AM: Trace Attempt  1	[0.02 s]
0.0.AM: Trace Attempt  2	[0.02 s]
0.0.AM: Trace Attempt  3	[0.02 s]
0.0.AM: Trace Attempt  4	[0.02 s]
0.0.AM: Trace Attempt  5	[0.02 s]
0.0.B: Trace Attempt  5	[0.00 s]
0.0.Oh: Proofgrid shell started at 7498@vlsi-ria84(local) jg_7399_vlsi-ria84_1
0.0.Oh: clocks: 1, declared: 1, looping: 0, posedge: 1, negedge: 0, noedge: 0, bothedge: 0
0.0.Oh: Reached length limit (2147483647) [0.00 s]
0.0.Oh: Exited with Success (@ 0.07 s)
0.0.Oh: Completed, Restart ignored.
0.0.AM: Trace Attempt  1	[0.06 s]
0.0.AM: Trace Attempt  2	[0.06 s]
0.0.AM: Trace Attempt  3	[0.06 s]
0.0.AM: Trace Attempt  4	[0.06 s]
0.0.AM: Trace Attempt  5	[0.06 s]
0.0.AM: Trace Attempt  1	[0.14 s]
0.0.AM: Trace Attempt  2	[0.14 s]
0.0.AM: Trace Attempt  3	[0.14 s]
0.0.AM: Trace Attempt  4	[0.14 s]
0.0.AM: Trace Attempt  5	[0.14 s]
0.0.AM: Trace Attempt  1	[0.33 s]
0.0.AM: Trace Attempt  2	[0.33 s]
0.0.AM: Trace Attempt  3	[0.33 s]
0.0.AM: Trace Attempt  4	[0.34 s]
0.0.AM: Trace Attempt  5	[0.34 s]
0.0.AM: Trace Attempt  1	[0.77 s]
0.0.AM: Trace Attempt  2	[0.77 s]
0.0.AM: Trace Attempt  3	[0.77 s]
0.0.AM: Trace Attempt  4	[0.78 s]
0.0.AM: Trace Attempt  5	[0.78 s]
0.0.AM: Trace Attempt  1	[2.11 s]
0.0.AM: Trace Attempt  2	[2.11 s]
0.0.AM: Trace Attempt  3	[2.11 s]
0.0.AM: Trace Attempt  4	[2.11 s]
0.0.AM: Trace Attempt  5	[2.11 s]
0.0.Hp: Trace Attempt 684	[4.00 s]
0.0.Ht: Trace Attempt 2083	[4.00 s]
0.0.B: Trace Attempt 1995	[4.00 s]
0.0.N: Trace Attempt 157	[5.05 s]
0.0.AM: Trace Attempt 430	[6.11 s]
0.0.AM: Trace Attempt  1	[6.81 s]
0.0.AM: Trace Attempt  2	[6.81 s]
0.0.AM: Trace Attempt  3	[6.81 s]
0.0.AM: Trace Attempt  4	[6.81 s]
0.0.AM: Trace Attempt  5	[6.81 s]
0.0.Hp: Trace Attempt 954	[8.02 s]
0.0.Ht: Trace Attempt 2827	[8.00 s]
0.0.B: Trace Attempt 2768	[8.00 s]
0.0.N: Trace Attempt 310	[9.17 s]
0.0.AM: Trace Attempt 580	[10.82 s]
0.0.Hp: Trace Attempt 1164	[12.04 s]
0.0.Ht: Trace Attempt 3444	[12.01 s]
0.0.B: Trace Attempt 3386	[12.00 s]
0.0.N: Trace Attempt 469	[13.45 s]
0.0.AM: Trace Attempt 841	[15.28 s]
0.0.Ht: Trace Attempt 3949	[16.01 s]
0.0.Hp: Trace Attempt 1342	[16.05 s]
0.0.B: Trace Attempt 3905	[16.01 s]
0.0.N: Trace Attempt 684	[18.01 s]
0.0.AM: Trace Attempt 868	[19.56 s]
0.0.Ht: Trace Attempt 4375	[20.02 s]
0.0.B: Trace Attempt 4359	[20.02 s]
0.0.Hp: Trace Attempt 1500	[20.08 s]
0.0.N: Trace Attempt 895	[22.09 s]
0.0.AM: Trace Attempt 896	[23.98 s]
0.0.Ht: Trace Attempt 4775	[24.02 s]
0.0.B: Trace Attempt 4765	[24.02 s]
0.0.Hp: Trace Attempt 1639	[24.10 s]
0.0.N: Trace Attempt 1137	[26.19 s]
0.0.AM: Trace Attempt 718	[27.98 s]
0.0.Ht: Trace Attempt 5133	[28.02 s]
0.0.B: Trace Attempt 5105	[28.03 s]
0.0.Hp: Trace Attempt 1761	[28.12 s]
0.0.N: Trace Attempt 1313	[30.39 s]
0.0.AM: Trace Attempt 968	[32.00 s]
0.0.Ht: Trace Attempt 5425	[32.02 s]
0.0.B: Trace Attempt 5417	[32.03 s]
0.0.Hp: Trace Attempt 1873	[32.14 s]
0.0.AM: Trace Attempt  1	[33.47 s]
0.0.AM: Trace Attempt  2	[33.47 s]
0.0.AM: Trace Attempt  3	[33.47 s]
0.0.AM: Trace Attempt  4	[33.47 s]
0.0.AM: Trace Attempt  5	[33.47 s]
0.0.N: Trace Attempt 1429	[35.35 s]
0.0.Ht: Trace Attempt 5741	[36.03 s]
0.0.B: Trace Attempt 5739	[36.04 s]
0.0.Hp: Trace Attempt 1984	[36.16 s]
0.0.AM: Trace Attempt 435	[37.51 s]
0.0.N: Trace Attempt 1493	[39.39 s]
0.0.Ht: Trace Attempt 6070	[40.03 s]
0.0.B: Trace Attempt 6047	[40.04 s]
0.0.Hp: Trace Attempt 2090	[40.17 s]
0.0.AM: Trace Attempt 768	[41.51 s]
0.0.Ht: Trace Attempt 6357	[44.04 s]
0.0.B: Trace Attempt 6335	[44.04 s]
0.0.Hp: Trace Attempt 2190	[44.17 s]
0.0.N: Trace Attempt 1520	[44.53 s]
0.0.AM: Trace Attempt 824	[45.83 s]
0.0.Ht: Trace Attempt 6662	[48.05 s]
0.0.B: Trace Attempt 6608	[48.05 s]
0.0.Hp: Trace Attempt 2286	[48.17 s]
0.0.N: Trace Attempt 1522	[49.04 s]
0.0.AM: Trace Attempt 862	[49.90 s]
0.0.Ht: Trace Attempt 6919	[52.06 s]
0.0.B: Trace Attempt 6875	[52.06 s]
0.0.Hp: Trace Attempt 2379	[52.19 s]
0.0.N: Trace Attempt 1587	[53.35 s]
0.0.AM: Trace Attempt 938	[53.92 s]
0.0.Ht: Trace Attempt 7194	[56.08 s]
0.0.B: Trace Attempt 7132	[56.07 s]
0.0.Hp: Trace Attempt 2467	[56.20 s]
0.0.N: Trace Attempt 1627	[57.37 s]
0.0.AM: Trace Attempt 1007	[57.92 s]
0.0.Ht: Trace Attempt 7428	[60.08 s]
0.0.B: Trace Attempt 7380	[60.07 s]
0.0.Hp: Trace Attempt 2553	[60.24 s]
0.0.AM: Trace Attempt 1229	[61.93 s]
0.0.N: Trace Attempt 1633	[63.89 s]
0.0.Ht: Trace Attempt 7688	[64.10 s]
0.0.B: Trace Attempt 7620	[64.08 s]
0.0.Hp: Trace Attempt 2634	[64.25 s]
0.0.AM: Trace Attempt 1428	[65.93 s]
0.0.Ht: Trace Attempt 7900	[68.10 s]
0.0.B: Trace Attempt 7849	[68.09 s]
0.0.Hp: Trace Attempt 2712	[68.27 s]
0.0.AM: Trace Attempt 1620	[70.10 s]
0.0.N: Trace Attempt 1641	[70.90 s]
0.0.Ht: Trace Attempt 8139	[72.11 s]
0.0.B: Trace Attempt 8071	[72.10 s]
0.0.Hp: Trace Attempt 2788	[72.27 s]
0.0.AM: Trace Attempt 1640	[74.88 s]
0.0.N: Trace Attempt 1988	[75.13 s]
0.0.Ht: Trace Attempt 8332	[76.12 s]
0.0.B: Trace Attempt 8294	[76.11 s]
0.0.Hp: Trace Attempt 2864	[76.30 s]
0.0.AM: Trace Attempt 1656	[79.06 s]
0.0.N: Trace Attempt 2138	[79.16 s]
0.0.Ht: Trace Attempt 8563	[80.13 s]
0.0.B: Trace Attempt 8511	[80.11 s]
0.0.Hp: Trace Attempt 2938	[80.34 s]
0.0.AM: Trace Attempt 1678	[83.08 s]
0.0.N: Trace Attempt 2426	[83.27 s]
0.0.Ht: Trace Attempt 8774	[84.14 s]
0.0.B: Trace Attempt 8720	[84.12 s]
0.0.Hp: Trace Attempt 3009	[84.34 s]
0.0.N: Trace Attempt 2629	[87.31 s]
0.0.AM: Trace Attempt 1688	[87.55 s]
0.0.Ht: Trace Attempt 8974	[88.15 s]
0.0.B: Trace Attempt 8925	[88.14 s]
0.0.Hp: Trace Attempt 3079	[88.39 s]
0.0.N: Trace Attempt 2726	[91.37 s]
0.0.AM: Trace Attempt 1700	[91.63 s]
0.0.B: Trace Attempt 9123	[92.15 s]
0.0.Ht: Trace Attempt 9198	[92.17 s]
0.0.Hp: Trace Attempt 3146	[92.45 s]
0.0.N: Trace Attempt 2755	[95.45 s]
0.0.AM: Trace Attempt 1709	[95.77 s]
0.0.B: Trace Attempt 9317	[96.15 s]
0.0.Ht: Trace Attempt 9361	[96.18 s]
0.0.Hp: Trace Attempt 3211	[96.46 s]
0.0.N: Trace Attempt 3067	[99.46 s]
0.0.B: Trace Attempt 9509	[100.16 s]
0.0.Ht: Trace Attempt 9565	[100.20 s]
0.0.AM: Trace Attempt 1720	[100.45 s]
0.0.Hp: Trace Attempt 3276	[100.50 s]
0.0.N: Trace Attempt 3098	[103.58 s]
0.0.B: Trace Attempt 9694	[104.16 s]
0.0.Ht: Trace Attempt 9758	[104.22 s]
0.0.Hp: Trace Attempt 3339	[104.53 s]
0.0.AM: Trace Attempt 1727	[104.98 s]
0.0.N: Trace Attempt 3409	[107.60 s]
0.0.B: Trace Attempt 9873	[108.17 s]
0.0.Ht: Trace Attempt 9930	[108.23 s]
0.0.Hp: Trace Attempt 3402	[108.56 s]
0.0.AM: Trace Attempt 1740	[109.03 s]
0.0.N: Trace Attempt 3499	[111.64 s]
0.0.B: Trace Attempt 10049	[112.18 s]
0.0.Ht: Trace Attempt 10128	[112.25 s]
0.0.Hp: Trace Attempt 3464	[112.63 s]
0.0.AM: Trace Attempt 1747	[113.17 s]
0.0.N: Trace Attempt 3561	[115.65 s]
0.0.B: Trace Attempt 10217	[116.18 s]
0.0.Ht: Trace Attempt 10305	[116.25 s]
0.0.Hp: Trace Attempt 3524	[116.68 s]
0.0.AM: Trace Attempt 1750	[117.24 s]
0.0.N: Trace Attempt 3621	[119.67 s]
0.0.B: Trace Attempt 10382	[120.20 s]
0.0.Ht: Trace Attempt 10471	[120.26 s]
0.0.Hp: Trace Attempt 3583	[120.72 s]
0.0.AM: Trace Attempt 1754	[122.45 s]
0.0.B: Trace Attempt 10544	[124.22 s]
0.0.Ht: Trace Attempt 10658	[124.26 s]
0.0.N: Trace Attempt 3827	[124.35 s]
0.0.Hp: Trace Attempt 3640	[124.77 s]
0.0.AM: Trace Attempt 1027	[126.68 s]
0.0.B: Trace Attempt 10697	[128.24 s]
0.0.Ht: Trace Attempt 10819	[128.26 s]
0.0.N: Trace Attempt 3953	[128.51 s]
0.0.Hp: Trace Attempt 3693	[128.78 s]
0.0.AM: Trace Attempt 1150	[130.70 s]
0.0.B: Trace Attempt 10837	[132.26 s]
0.0.Ht: Trace Attempt 10961	[132.28 s]
0.0.N: Trace Attempt 4092	[132.53 s]
0.0.Hp: Trace Attempt 3744	[132.78 s]
0.0.AM: Trace Attempt 1277	[134.71 s]
0.0.Ht: Trace Attempt 11119	[136.28 s]
0.0.B: Trace Attempt 10978	[136.28 s]
0.0.Hp: Trace Attempt 3795	[136.82 s]
0.0.N: Trace Attempt 4220	[137.08 s]
0.0.AM: Trace Attempt 1419	[138.72 s]
0.0.Ht: Trace Attempt 11275	[140.29 s]
0.0.B: Trace Attempt 11121	[140.31 s]
0.0.Hp: Trace Attempt 3845	[140.85 s]
0.0.N: Trace Attempt 4267	[141.08 s]
0.0.AM: Trace Attempt 1543	[142.74 s]
0.0.Ht: Trace Attempt 11402	[144.31 s]
0.0.B: Trace Attempt 11262	[144.31 s]
0.0.Hp: Trace Attempt 3895	[144.90 s]
0.0.N: Trace Attempt 4425	[146.13 s]
0.0.Ht: Trace Attempt 11549	[148.32 s]
0.0.B: Trace Attempt 11403	[148.33 s]
0.0.Hp: Trace Attempt 3945	[148.93 s]
0.0.N: Trace Attempt 4524	[151.12 s]
0.0.AM: Trace Attempt 1605	[151.35 s]
0.0.Ht: Trace Attempt 11703	[152.34 s]
0.0.B: Trace Attempt 11540	[152.33 s]
0.0.Hp: Trace Attempt 3994	[152.99 s]
0.0.AM: Trace Attempt 1703	[155.37 s]
0.0.N: Trace Attempt 4738	[156.24 s]
0.0.B: Trace Attempt 11680	[156.34 s]
0.0.Ht: Trace Attempt 11843	[156.35 s]
0.0.Hp: Trace Attempt 4043	[157.00 s]
0.0.AM: Trace Attempt 1806	[159.40 s]
0.0.N: Trace Attempt 4866	[160.37 s]
0.0.B: Trace Attempt 11820	[160.36 s]
0.0.Ht: Trace Attempt 11978	[160.38 s]
0.0.Hp: Trace Attempt 4092	[161.04 s]
0.0.AM: Trace Attempt 1903	[163.43 s]
0.0.Ht: Trace Attempt 12127	[164.38 s]
0.0.B: Trace Attempt 11958	[164.37 s]
0.0.N: Trace Attempt 4930	[164.75 s]
0.0.Hp: Trace Attempt 4138	[165.06 s]
0.0.AM: Trace Attempt 1995	[167.46 s]
0.0.Ht: Trace Attempt 12279	[168.38 s]
0.0.B: Trace Attempt 12094	[168.40 s]
0.0.Hp: Trace Attempt 4184	[169.12 s]
0.0.N: Trace Attempt 4939	[169.61 s]
0.0.B: Trace Attempt 12223	[172.40 s]
0.0.Ht: Trace Attempt 12382	[172.43 s]
0.0.Hp: Trace Attempt 4229	[173.21 s]
0.0.N: Trace Attempt 5099	[173.92 s]
0.0.B: Trace Attempt 12347	[176.41 s]
0.0.Ht: Trace Attempt 12509	[176.45 s]
0.0.Hp: Trace Attempt 4274	[177.30 s]
0.0.AM: Trace Attempt 2049	[177.60 s]
0.0.N: Trace Attempt 5304	[177.94 s]
0.0.AM: Trace Attempt  1	[178.16 s]
0.0.AM: Trace Attempt  2	[178.16 s]
0.0.AM: Trace Attempt  3	[178.16 s]
0.0.AM: Trace Attempt  4	[178.17 s]
0.0.AM: Trace Attempt  5	[178.17 s]
0.0.B: Trace Attempt 12479	[180.42 s]
0.0.Ht: Trace Attempt 12659	[180.46 s]
0.0.AM: Trace Attempt 393	[180.93 s]
0.0.AM: Stopped processing property "BLINK.p1"	[180.98 s].
0.0.AM: Morphing to AMcustom3
0.0.AM: All properties determined. [0.00 s]
0.0.AM: Exited with Success (@ 0.00 s)
0.0.AMcustom3: clocks: 1, declared: 1, looping: 0, posedge: 1, negedge: 0, noedge: 0, bothedge: 0
0.0.AMcustom3: Starting proof for property "BLINK.p1"	[0.00 s].
0.0.AMcustom3: Trace Attempt  1	[0.00 s]
0.0.AMcustom3: Trace Attempt  2	[0.00 s]
0.0.AMcustom3: Trace Attempt  3	[0.00 s]
0.0.AMcustom3: Trace Attempt  4	[0.00 s]
0.0.AMcustom3: Trace Attempt  5	[0.00 s]
0.0.AMcustom3: Trace Attempt  1	[0.00 s]
0.0.AMcustom3: Trace Attempt  2	[0.00 s]
0.0.AMcustom3: Trace Attempt  3	[0.00 s]
0.0.AMcustom3: Trace Attempt  4	[0.01 s]
0.0.AMcustom3: Trace Attempt  5	[0.01 s]
0.0.AMcustom3: Trace Attempt  1	[0.02 s]
0.0.AMcustom3: Trace Attempt  2	[0.02 s]
0.0.AMcustom3: Trace Attempt  3	[0.02 s]
0.0.AMcustom3: Trace Attempt  4	[0.02 s]
0.0.AMcustom3: Trace Attempt  5	[0.02 s]
0.0.Tri: Proofgrid shell started at 7816@vlsi-ria84(local) jg_7399_vlsi-ria84_1
0.0.Tri: clocks: 1, declared: 1, looping: 0, posedge: 1, negedge: 0, noedge: 0, bothedge: 0
0.0.Tri: Last scan. Per property time limit: 0s
0.0.Tri: Starting proof for property "BLINK.p1"	[0.00 s].
0.0.Tri: Trace Attempt  1	[0.00 s]
0.0.AMcustom3: Trace Attempt  1	[0.04 s]
0.0.AMcustom3: Trace Attempt  2	[0.04 s]
0.0.AMcustom3: Trace Attempt  3	[0.04 s]
0.0.AMcustom3: Trace Attempt  4	[0.05 s]
0.0.AMcustom3: Trace Attempt  5	[0.05 s]
0.0.Tri:    0.00" ---- Launching main thread ----
0.0.Tri:    0.02" ---- Launching abstraction thread ----
0.0.B: Trace Attempt 12496	[180.92 s]
0.0.B: Stopped processing property "BLINK.p1"	[181.07 s].
0.0.B: Morphing to Bcustom2
0.0.B: All properties determined. [0.00 s]
0.0.B: Exited with Success (@ 0.00 s)
0.0.Bcustom2: clocks: 1, declared: 1, looping: 0, posedge: 1, negedge: 0, noedge: 0, bothedge: 0
0.0.Bcustom2: Starting proof for property "BLINK.p1"	[0.00 s].
0.0.Bcustom2: Trace Attempt  1	[0.00 s]
0.0.Bcustom2: Trace Attempt  2	[0.00 s]
0.0.Bcustom2: Trace Attempt  1	[0.00 s]
0.0.Bcustom2: Trace Attempt  2	[0.00 s]
0.0.Bcustom2: Trace Attempt  3	[0.00 s]
0.0.Bcustom2: Trace Attempt  4	[0.00 s]
0.0.Bcustom2: Trace Attempt  5	[0.00 s]
0.0.Tri:    0.03" ---- Launching multi-phase simplification thread ----
0.0.AMcustom3: Trace Attempt  1	[0.12 s]
0.0.AMcustom3: Trace Attempt  2	[0.12 s]
0.0.AMcustom3: Trace Attempt  3	[0.12 s]
0.0.AMcustom3: Trace Attempt  4	[0.12 s]
0.0.AMcustom3: Trace Attempt  5	[0.12 s]
0.0.Tri:    0.05" ---- Launching liveness simplification thread ----
0.0.Hp: Trace Attempt 4321	[181.34 s]
0.0.N: Trace Attempt 5356	[179.97 s]
0.0.N: Stopped processing property "BLINK.p1"	[181.44 s].
0.0.N: Morphing to Ncustom1
0.0.N: All properties determined. [0.00 s]
0.0.N: Exited with Success (@ 0.00 s)
0.0.Ncustom1: clocks: 1, declared: 1, looping: 0, posedge: 1, negedge: 0, noedge: 0, bothedge: 0
0.0.Ncustom1: Starting proof for property "BLINK.p1"	[0.00 s].
0.0.Ncustom1: Trace Attempt  3	[0.00 s]
0.0.Ncustom1: Trace Attempt  4	[0.00 s]
0.0.Ncustom1: Trace Attempt  5	[0.00 s]
0.0.Ncustom1: Trace Attempt  1	[0.00 s]
0.0.Ncustom1: Trace Attempt  2	[0.00 s]
0.0.Ncustom1: Trace Attempt  3	[0.00 s]
0.0.Ncustom1: Trace Attempt  4	[0.00 s]
0.0.Ncustom1: Trace Attempt  5	[0.01 s]
0.0.AMcustom3: Trace Attempt  1	[0.45 s]
0.0.AMcustom3: Trace Attempt  2	[0.45 s]
0.0.AMcustom3: Trace Attempt  3	[0.45 s]
0.0.AMcustom3: Trace Attempt  4	[0.45 s]
0.0.AMcustom3: Trace Attempt  5	[0.45 s]
0.0.AMcustom3: Trace Attempt  1	[0.82 s]
0.0.AMcustom3: Trace Attempt  2	[0.82 s]
0.0.AMcustom3: Trace Attempt  3	[0.82 s]
0.0.AMcustom3: Trace Attempt  4	[0.82 s]
0.0.AMcustom3: Trace Attempt  5	[0.82 s]
0.0.Tri:    0.91" Simplification phase 1 complete
0.0.Ncustom1: Requesting engine job to terminate
0.0.Bcustom2: Requesting engine job to terminate
0.0.AMcustom3: Requesting engine job to terminate
0.0.Tri: Requesting engine job to terminate
0.0.Hp: Requesting engine job to terminate
0.0.Ht: Requesting engine job to terminate
INFO (IPF144): 0: Initiating shutdown of proof [182.04 s]
0.0.Tri: A proof was found: No trace exists. [0.98 s]
INFO (IPF057): 0.0.Tri: The property "BLINK.p1" was proven in 0.99 s.
0.0.AMcustom3: Trace Attempt 63	[1.02 s]
0.0.AMcustom3: Stopped processing property "BLINK.p1"	[1.03 s].
0.0.AMcustom3: All properties determined. [1.02 s]
0.0.Ncustom1: Trace Attempt 65	[0.56 s]
0.0.Ncustom1: Stopped processing property "BLINK.p1"	[0.59 s].
0.0.Ncustom1: All properties determined. [0.59 s]
0.0.Hp: Trace Attempt 4328	[181.96 s]
0.0.Hp: All properties determined. [182.05 s]
0.0.Ht: Trace Attempt 12718	[181.99 s]
0.0.Ht: All properties determined. [182.01 s]
0.0.Bcustom2: Trace Attempt 1551	[0.92 s]
0.0.Bcustom2: Stopped processing property "BLINK.p1"	[0.93 s].
0.0.Bcustom2: All properties determined. [0.93 s]
0.0.AMcustom3: Exited with Success (@ 182.05 s)
0: ProofGrid usable level: 0
0.0.Ncustom1: Exited with Success (@ 182.07 s)
0.0.Bcustom2: Exited with Success (@ 182.07 s)
0.0.Ht: Exited with Success (@ 182.13 s)
0.0.Tri: Stopped processing property "BLINK.p1"	[1.12 s].
0.0.Tri: All properties determined. [1.12 s]
0.0.Tri: Exited with Success (@ 182.18 s)
0.0.Hp: Exited with Success (@ 182.23 s)
0: --------------------------------------------------------------
ProofGrid Summary (utilization 99.97 %)
--------------------------------------------------------------
     engines started                               :    10
     engine jobs started                           :     7

    Average time in state (seconds)
    ------------------------------------------------------
    Engine  Pending     Running        Dead    Utilization
    ------------------------------------------------------
     Hp        0.03      182.04        0.00       99.98 %
     Ht        0.03      182.01        0.00       99.98 %
     Oh        0.07        0.00        0.00        1.89 %
    Ncustom1        0.03      181.58        0.00       99.98 %
    Bcustom2        0.04      181.87        0.00       99.98 %
    AMcustom3        0.03      181.99        0.00       99.98 %
    Tri        0.05        0.99        0.00       94.87 %
    all        0.04      130.07        0.00       99.97 %

    Total time in state (seconds)
    -----------------------------------------
            Pending     Running        Dead  
    -----------------------------------------
               0.28      910.48        0.00

    Data read    : 7.90 MiB
    Data written : 4.84 kiB

0: All pending notifications were processed.
INFO (IPF059): 0: Completed proof on task: "<embedded>"

==============================================================
SUMMARY
==============================================================
           Properties Considered              : 1
                 assertions                   : 1
                  - proven                    : 1 (100%)
                  - bounded_proven (user)     : 0 (0%)
                  - bounded_proven (auto)     : 0 (0%)
                  - marked_proven             : 0 (0%)
                  - cex                       : 0 (0%)
                  - ar_cex                    : 0 (0%)
                  - undetermined              : 0 (0%)
                  - unknown                   : 0 (0%)
                  - error                     : 0 (0%)
                 covers                       : 0
                  - unreachable               : 0
                  - bounded_unreachable (user): 0
                  - covered                   : 0
                  - ar_covered                : 0
                  - undetermined              : 0
                  - unknown                   : 0
                  - error                     : 0
proven
[<embedded>] % exit -force
INFO (IPL005): Received request to exit from the console.
INFO: Waiting for proof threads to stop...
INFO: Proof threads stopped.
INFO (IPL018): The peak resident set memory use for this session was 2.800 GB.
INFO (IPL014): Waiting for the Tcl-thread to exit.
INFO (IPL015): The Tcl-thread exited with status 0.
INFO (IPL016): Exiting the analysis session with status 0.
