# ----------------------------------------
# Jasper Version Info
# tool      : Jasper 2024.06
# platform  : Linux 3.10.0-1160.62.1.el7.x86_64
# version   : 2024.06p002 64 bits
# build date: 2024.09.02 16:28:38 UTC
# ----------------------------------------
# started   : 2025-11-20 03:42:08 IST
# hostname  : vlsi-ria85.vlsidomain
# pid       : 29660
# arguments : '-label' 'session_0' '-console' '//127.0.0.1:34799' '-nowindow' '-style' 'windows' '-exitonerror' '-data' 'AAAA4nicY2RgYLCp////PwMYMD6A0Aw2jAyoAMRnQhUJbEChGRhYYZphSliAmItBl6GAoYghnyELyDNj0ANCfSA7HS6aypDMUMJQDBQ1YogH0qkMZUCcB2WnA2kLoE4eoDlJDIlAlckMGUC+Eh7VemBVOWA3AACVMht9' '-proj' '/users/rompel/jasper_executions/liveness/jgprojects/2_seven_seg_8/sessionLogs/session_0' '-init' '-hidden' '/users/rompel/jasper_executions/liveness/jgprojects/2_seven_seg_8/.tmp/.initCmds.tcl' '2_seven_seg_8.tcl' '-hidden' '/users/rompel/jasper_executions/liveness/jgprojects/2_seven_seg_8/.tmp/.postCmds.tcl'

Any disclosure about the Cadence Design Systems software or its use
model to any third party violates the written Non-Disclosure Agreement
between Cadence Design Systems, Inc. and the customer.

THIS SOFTWARE CONTAINS CONFIDENTIAL INFORMATION AND TRADE SECRETS OF
CADENCE DESIGN SYSTEMS, INC. USE, DISCLOSURE, OR REPRODUCTION IS
PROHIBITED WITHOUT THE PRIOR EXPRESS WRITTEN PERMISSION OF CADENCE
DESIGN SYSTEMS, INC.

Copyright (C) 2000-2024 Cadence Design Systems, Inc. All Rights
Reserved.  Unpublished -- rights reserved under the copyright laws of
the United States.

This product includes software developed by others and redistributed
according to license agreement. See doc/third_party_readme.txt for
further details.

RESTRICTED RIGHTS LEGEND

Use, duplication, or disclosure by the Government is subject to
restrictions as set forth in subparagraph (c) (1) (ii) of the Rights in
Technical Data and Computer Software clause at DFARS 252.227-7013 or
subparagraphs (c) (1) and (2) of Commercial Computer Software -- Restricted
Rights at 48 CFR 52.227-19, as applicable.


                          Cadence Design Systems, Inc.
                          2655 Seely Avenue
                          San Jose, CA 95134
                          Phone: 408.943.1234

For technical assistance visit http://support.cadence.com.

Jasper Apps Analysis Session - /users/rompel/jasper_executions/liveness/jgprojects/2_seven_seg_8/sessionLogs/session_0

WARNING (WG017): [session]: The system's locale is "ANSI_X3.4-1968", which is not UTF-8. Non-ASCII characters might not be handled correctly.
WARNING (WG017): [jg_console]: The system's locale is "ANSI_X3.4-1968", which is not UTF-8. Non-ASCII characters might not be handled correctly.
INFO: successfully checked out license "jasper_fao".
INFO: reading configuration file "/users/rompel/.config/cadence/jasper.conf".
% analyze -sv09 ../2_seven_seg_8.sv
[-- (VERI-1482)] Analyzing Verilog file '/tools/cadence2425/JASPER/jasper_2024.06p002/lib/verilog/packages/std/std.sv' into library 'std'
[-- (VERI-1482)] Analyzing Verilog file '../2_seven_seg_8.sv'
% elaborate -bbox_mul 1000000 -bbox_div 1000000 -bbox_mod 1000000 -bbox_a 1000000
[INFO (HIER-8002)] ../2_seven_seg_8.sv(32): Disabling old hierarchical reference handler
[INFO (VERI-1018)] ../2_seven_seg_8.sv(1): compiling module 'SEVEN'
[WARN (VERI-1209)] ../2_seven_seg_8.sv(15): expression size 32 truncated to fit in target size 14
[INFO (VERI-8005)] ../2_seven_seg_8.sv(5): Unintentional sequential element inferred for cnt read before write using blocking assignment
[INFO (VERI-8005)] ../2_seven_seg_8.sv(6): Unintentional sequential element inferred for digit_select read before write using blocking assignment
[INFO (VERI-8005)] ../2_seven_seg_8.sv(1): Unintentional sequential element inferred for segment read before write using blocking assignment
[INFO (VERI-8005)] ../2_seven_seg_8.sv(1): Unintentional sequential element inferred for sig read before write using blocking assignment
INFO (ISW003): Top module name is "SEVEN".
INFO (INL208): Elaboration synthesis summary:
  Number of synthesized netlists          1 (0 packages)
  Single run mode                         On
  Pipeline                                On (1 pipelined netlists)
  Late hierarchical reference connection  On
  Number of analyzed Verilog modules      1 (1 synthesized)
  Number of analyzed VHDL entities        0 (0 synthesized)
INFO (INL003): Clearing all state information (assumes, stopats, and so forth).
SEVEN
[<embedded>] % reset rst
INFO (IPM031): Clearing proof results of all properties.
INFO (IRS006): Current reset condition is "rst".
[<embedded>] % clock clk
[<embedded>] % prove -all
Ncustom1: Custom engine code is hT3Ng7hPPfiYQOTDZ3qhYOwGAM51eA+J/FjkM5shLioAsqhgLR4Ft+O1BuKG6ilQ83B9tLXSl+CwjiTMAQA
Bcustom2: Custom engine code is hT3Nm7hPr1Vp3Di1Ra2USNIGL4JypRnLKLAdF6JAyuavO2JfGCiY9OZJhcAcOUnLx5xwNdhILGrAWX9s+z2WDkKwNR7tAfClBEjRFVQeq6DU54boFgEA
AMcustom3: Custom engine code is hT3Ng7hP/feYQOTDZ3qhYOwGAM51eA+J/FjkM5shLioAsqhgLR4Ft+O1BuKG6ilQ83B9tLXSmmqwm7g9AQA
Mpcustom4: Custom engine code is hT3NZbhP9fmY2AbBQnsjfOxn6c+6e6yL+/e8fZFmaQrnlgEA
INFO (IPF036): Starting proof on task: "<embedded>", 2 properties to prove with 0 already proven/unreachable
INFO (IRS029): Starting reset analysis: phase 1 of 4.
INFO (IRS030): Running reset analysis: phase 2 of 4.
INFO (IRS031): Running reset analysis: phase 3 of 4.
INFO (IRS020): Starting the reset analysis simulation with a limit of 100 iterations (phase 4 of 4).
INFO (IRS024): Reset iterations 0 to 4 analyzed.
INFO (IRS018): Reset analysis simulation executed for 3 iterations. Assigned values for 23 of 23 design flops, 0 of 0 design latches, 6 of 6 internal elements.
INFO (IRS039): Reset analysis complete.
INFO (IPF031): Settings used for proof thread 0:
    orchestration                 = on
    time_limit                    = 86400s
    per_property_time_limit       = 1s * 10 ^ scan
    engine_mode                   = auto
    proofgrid_per_engine_max_jobs = 1
    max engine jobs               = auto
    proofgrid_mode                = local
    proofgrid_restarts            = 10
0: Using multistage preprocessing
0: Starting reduce
AMcustom5: Custom engine code is hT3N1rhP11/52HrFRS21ROp2LOjVTgPvT8L8BGXHgLhaIuqtT4nARFjUqrBL+7pLmaTOzBepZW/Jm8SSrHDybSQtoNiO3y43wk+dEoWlsZizu97Fih6O6lPVG/LpWP5SsUPwlGagLNa1FKEFvwVXyX7//8prySbvSxIHXr5er+z4RAEA
Ncustom6: Custom engine code is hT3OXrhPByJp3TrFSTLhUmMH4KVtJgmTCnNDF46yMXOKY48m4LS5nE7yBzFjA7kDuwO/GhGUpEPiky3p3wmPn3dJZHxFMsafSoObRzSC+tn7sEY0WbTdZ/FV4hL3MYH/b1CIUvXSWR4wqEoVLsmMOD4xIPT4lI1LO6ZCO7PnnWQuLwetnvKlrXx6wCW/A+x+enqslg1YPobi4wEF/EvbzOvcTYdJvl2s4H2yZg2b2ofAVN5WvhWk1HoBAA
ADcustom7: Custom engine code is hT3Nv7hPv1752HrFRa2kROx2f/ECJeZB2AZsLdlO8VwmIuqtT4nIDFXclhg+O+o+DMmQCekbheGk0kK28laA9gaOFDXsQp29J3X615HY1IPHJWd6FUFvCHjO+p1k652b5JJvZlShNpGlGSXAiQe/mEAj6tEBAA
0: Finished reduce in 0s
Tricustom8: Custom engine code is hT3Nu7hPt1752DvFRa0kNDiyIV97VyejwM9C/jCLJjdPvusZONHY42VYUy0Q1ZotnhcVtNc56tJ5wbxv6V2+XpdsaSlHck5vfnbYjdwj1OECy9U+7oSQ0SZE3g5ayD+Phuh4odCJTjeKa2k4elM9ldQfkAEA
Gcustom9: Custom engine code is hT3NibhPDfeYQADBZnYcglOvK9Pfd7EOeniIqP8jNsyIqInncipMGcUXqAadachREE9F2PwhBUZUNw5kHnd4JdXkamORRgEA
C2custom10: Custom engine code is hT3NirhPjfWYQADBZnYcglOvK9Pfd7EOeniIqP8jNsyIqInncgkrYMMXCYbdK0dUjZIF9d4cJ0rHoBDjwVLBKuG86XYVV00BAA
AGcustom11: Custom engine code is hT3NirhP/fmYQADBZnYcglOvK9Pfd7EOeniIqP8jNsyIqInnckcwYMMXCYbdK0dUjZIF9d4cJ0rHoBDjwVLBKuHEZnZByh0BAA
Bcustom12: Custom engine code is hT3NjrhPDfiYQADBZnYcglOvK9PfWxFtenjIyBqfrgr7if/jL/yPOuK1BAflEcW0DxNH2eDIoezN2gxlQFg81RZtiWXh7aiTAidvAQA
0.0.PRE: Performing Proof Simplification...
Ncustom13: Custom engine code is hT3NR7hPByFp3TrFSTLhUmMH4KWtJglTyV/c51BHEeZWamnJv767nE6PCak26bd3gf3XGN3rIRheufhDieCJQVISo+gNYUKhiUedBKGtsP/a18svAnlMJZudHxDFwK5ufsyoxsIyiAeSY2oi3tEuoDHr5gw42DFKAG3PqO3CEsl8Azzdt3pl5nGA1Ifv2H02eYsFzWb/nfp8PMb3F0krE/EgBcm8TD9Div8BAA
0.0.N: clocks: 1, declared: 1, looping: 0, posedge: 1, negedge: 0, noedge: 0, bothedge: 0
Tricustom14: Custom engine code is hT3Nu7hP3fiYQADBZnYcglNHp9bfd7EOeniIqP/ji8sGLQu8yhsFO+wxJ+O+R0bU8g/IewXFomyos+viQnWc2xYNYmMqpo3i40O7DaZR7qfp4YqNx26KRvQ/qx0BAA
0.0.N: Proof Simplification Iteration 1	[0.00 s]
0.0.PRE: A trace with 1 cycles was found. [0.00 s]
INFO (IPF047): 0.0.PRE: The cover property "SEVEN.p1:precondition1" was covered in 1 cycles in 0.00 s.
0.0.N: Proof Simplification Iteration 2	[0.05 s]
0.0.PRE: A proof was found: No trace exists. [0.00 s]
INFO (IPF057): 0.0.PRE: The property ":noDeadEnd" was proven in 0.00 s.
    Use check_assumptions -show -dead_end to show this property in the property table.
0.0.PRE: A proof was found: No trace exists. [0.00 s]
INFO (IPF057): 0.0.PRE: The property ":noConflict" was proven in 0.00 s.
    Use check_assumptions -show to show this property in the property table.
INFO (IPF047): 0.0.PRE: The cover property ":live" was covered in 1 cycles in 0.00 s.
    Use check_assumptions -show -live to show this property in the property table.
0.0.PRE: Proof Simplification completed in 0.05 s
0: About to start ProofGrid in its own thread with a limit of 10000 pending notifications and a limit of 10 traces.
0: =============================== ProofGrid start ===============================
0: ProofGrid usable level: 1
0: Initial ProofGrid level: 1
0: ProofGrid is starting event handling
0.0.Hp: Proofgrid shell started at 29783@vlsi-ria85(local) jg_29660_vlsi-ria85_1
0.0.Hp: clocks: 1, declared: 1, looping: 0, posedge: 1, negedge: 0, noedge: 0, bothedge: 0
0.0.Hp: Last scan. Per property time limit: 0s
0.0.Hp: Trace Attempt  1	[0.00 s]
0.0.Hp: Trace Attempt  2	[0.00 s]
0.0.Hp: Trace Attempt  3	[0.00 s]
0.0.Hp: Trace Attempt  4	[0.00 s]
0.0.Hp: Trace Attempt  5	[0.00 s]
0.0.N: Proofgrid shell started at 29782@vlsi-ria85(local) jg_29660_vlsi-ria85_1
0.0.N: clocks: 1, declared: 1, looping: 0, posedge: 1, negedge: 0, noedge: 0, bothedge: 0
0.0.N: Last scan. Per property time limit: 0s
0.0.N: Starting proof for property "SEVEN.p1"	[0.00 s].
0.0.N: Trace Attempt  1	[0.00 s]
0.0.N: Trace Attempt  2	[0.00 s]
0.0.N: Trace Attempt  2	[0.00 s]
0.0.N: Trace Attempt  3	[0.00 s]
0.0.N: Trace Attempt  3	[0.00 s]
0.0.N: Trace Attempt  4	[0.00 s]
0.0.N: Trace Attempt  5	[0.00 s]
0.0.N: Trace Attempt  1	[0.01 s]
0.0.N: Trace Attempt  2	[0.01 s]
0.0.N: Trace Attempt  3	[0.01 s]
0.0.N: Trace Attempt  4	[0.01 s]
0.0.N: Trace Attempt  5	[0.01 s]
0.0.Mpcustom4: Proofgrid shell started at 29819@vlsi-ria85(local) jg_29660_vlsi-ria85_1
0.0.B: Proofgrid shell started at 29827@vlsi-ria85(local) jg_29660_vlsi-ria85_1
0.0.AM: Proofgrid shell started at 29832@vlsi-ria85(local) jg_29660_vlsi-ria85_1
0.0.Mpcustom4: clocks: 1, declared: 1, looping: 0, posedge: 1, negedge: 0, noedge: 0, bothedge: 0
0.0.Mpcustom4: Ignoring liveness properties
0.0.Mpcustom4: All properties either determined or skipped. [0.00 s]
0.0.B: clocks: 1, declared: 1, looping: 0, posedge: 1, negedge: 0, noedge: 0, bothedge: 0
0.0.B: Last scan. Per property time limit: 0s
0.0.B: Starting proof for property "SEVEN.p1"	[0.00 s].
0.0.B: Trace Attempt  1	[0.00 s]
0.0.B: Trace Attempt  2	[0.00 s]
0.0.B: Trace Attempt  3	[0.00 s]
0.0.Mpcustom4: Exited with Success (@ 0.06 s)
0.0.Mpcustom4: Completed, Restart ignored.
0.0.B: Trace Attempt  4	[0.00 s]
0.0.B: Trace Attempt  5	[0.00 s]
0.0.AM: clocks: 1, declared: 1, looping: 0, posedge: 1, negedge: 0, noedge: 0, bothedge: 0
0.0.AM: Last scan. Per property time limit: 0s
0.0.AM: Starting proof for property "SEVEN.p1"	[0.00 s].
0.0.AM: Trace Attempt  1	[0.00 s]
0.0.AM: Trace Attempt  2	[0.00 s]
0.0.AM: Trace Attempt  3	[0.00 s]
0.0.AM: Trace Attempt  4	[0.00 s]
0.0.AM: Trace Attempt  5	[0.00 s]
0.0.AM: Trace Attempt  1	[0.00 s]
0.0.AM: Trace Attempt  2	[0.00 s]
0.0.AM: Trace Attempt  3	[0.00 s]
0.0.AM: Trace Attempt  4	[0.00 s]
0.0.AM: Trace Attempt  5	[0.00 s]
0.0.L: Proofgrid shell started at 29823@vlsi-ria85(local) jg_29660_vlsi-ria85_1
0.0.AM: Trace Attempt  1	[0.01 s]
0.0.Ht: Proofgrid shell started at 29817@vlsi-ria85(local) jg_29660_vlsi-ria85_1
0.0.L: clocks: 1, declared: 1, looping: 0, posedge: 1, negedge: 0, noedge: 0, bothedge: 0
0.0.L: Using trace diversification with seed 1 (0.05)
0.0.L: Using LRU state removal heuristic
0.0.L: Ignoring liveness properties
0.0.L: All properties either determined or skipped. [0.00 s]
0.0.AM: Trace Attempt  2	[0.01 s]
0.0.AM: Trace Attempt  3	[0.01 s]
0.0.AM: Trace Attempt  4	[0.01 s]
0.0.AM: Trace Attempt  5	[0.01 s]
0.0.L: Exited with Success (@ 0.07 s)
0.0.L: Completed, Restart ignored.
0.0.Ht: clocks: 1, declared: 1, looping: 0, posedge: 1, negedge: 0, noedge: 0, bothedge: 0
0.0.Ht: Last scan. Per property time limit: 0s
0.0.Ht: Trace Attempt  1	[0.00 s]
0.0.Ht: Trace Attempt  2	[0.00 s]
0.0.Ht: Trace Attempt  3	[0.00 s]
0.0.Ht: Trace Attempt  4	[0.00 s]
0.0.Ht: Trace Attempt  5	[0.00 s]
0.0.Oh: Proofgrid shell started at 29820@vlsi-ria85(local) jg_29660_vlsi-ria85_1
0.0.Oh: clocks: 1, declared: 1, looping: 0, posedge: 1, negedge: 0, noedge: 0, bothedge: 0
0.0.Oh: Reached length limit (2147483647) [0.00 s]
0.0.Oh: Exited with Success (@ 0.09 s)
0.0.Oh: Completed, Restart ignored.
0.0.AM: Trace Attempt  1	[0.03 s]
0.0.AM: Trace Attempt  2	[0.03 s]
0.0.AM: Trace Attempt  3	[0.03 s]
0.0.AM: Trace Attempt  4	[0.03 s]
0.0.AM: Trace Attempt  5	[0.03 s]
0.0.Bm: Proofgrid shell started at 29818@vlsi-ria85(local) jg_29660_vlsi-ria85_1
0.0.Bm: clocks: 1, declared: 1, looping: 0, posedge: 1, negedge: 0, noedge: 0, bothedge: 0
0.0.Bm: Ignoring liveness properties
0.0.Bm: Last scan. Per property time limit: 0s
0.0.Bm: Trace Attempt  1	[0.00 s]
0.0.Bm: Trace Attempt  2	[0.00 s]
0.0.Bm: Trace Attempt  3	[0.00 s]
0.0.Bm: Trace Attempt  4	[0.00 s]
0.0.Bm: Trace Attempt  5	[0.00 s]
0.0.N: Trace Attempt  1	[0.12 s]
0.0.N: Trace Attempt  2	[0.12 s]
0.0.N: Trace Attempt  3	[0.12 s]
0.0.N: Trace Attempt  4	[0.13 s]
0.0.N: Trace Attempt  5	[0.13 s]
0.0.AM: Trace Attempt  1	[0.10 s]
0.0.AM: Trace Attempt  2	[0.10 s]
0.0.AM: Trace Attempt  3	[0.10 s]
0.0.AM: Trace Attempt  4	[0.11 s]
0.0.AM: Trace Attempt  5	[0.11 s]
0.0.N: Trace Attempt  1	[0.46 s]
0.0.N: Trace Attempt  2	[0.46 s]
0.0.N: Trace Attempt  3	[0.46 s]
0.0.N: Trace Attempt  4	[0.47 s]
0.0.N: Trace Attempt  5	[0.47 s]
0.0.AM: Trace Attempt  1	[0.45 s]
0.0.AM: Trace Attempt  2	[0.45 s]
0.0.AM: Trace Attempt  3	[0.45 s]
0.0.AM: Trace Attempt  4	[0.45 s]
0.0.AM: Trace Attempt  5	[0.45 s]
0.0.AM: Trace Attempt  1	[1.77 s]
0.0.AM: Trace Attempt  2	[1.77 s]
0.0.AM: Trace Attempt  3	[1.77 s]
0.0.AM: Trace Attempt  4	[1.77 s]
0.0.AM: Trace Attempt  5	[1.77 s]
0.0.N: Trace Attempt  1	[1.84 s]
0.0.N: Trace Attempt  2	[1.84 s]
0.0.N: Trace Attempt  3	[1.84 s]
0.0.N: Trace Attempt  4	[1.84 s]
0.0.N: Trace Attempt  5	[1.84 s]
0.0.N: Trace Attempt  1	[3.31 s]
0.0.N: Trace Attempt  2	[3.31 s]
0.0.N: Trace Attempt  3	[3.31 s]
0.0.N: Trace Attempt  4	[3.31 s]
0.0.N: Trace Attempt  5	[3.31 s]
0.0.Hp: Trace Attempt 479	[4.01 s]
0.0.B: Trace Attempt 1686	[4.00 s]
0.0.Ht: Trace Attempt 1727	[4.00 s]
0.0.Bm: Trace Attempt 1678	[4.00 s]
0.0.AM: Trace Attempt 228	[5.78 s]
0.0.AM: Trace Attempt  1	[6.45 s]
0.0.AM: Trace Attempt  2	[6.45 s]
0.0.AM: Trace Attempt  3	[6.45 s]
0.0.AM: Trace Attempt  4	[6.45 s]
0.0.AM: Trace Attempt  5	[6.45 s]
0.0.N: Trace Attempt 232	[7.61 s]
0.0.N: Trace Attempt  1	[7.62 s]
0.0.N: Trace Attempt  2	[7.62 s]
0.0.N: Trace Attempt  3	[7.62 s]
0.0.N: Trace Attempt  4	[7.62 s]
0.0.N: Trace Attempt  5	[7.62 s]
0.0.Hp: Trace Attempt 666	[8.02 s]
0.0.B: Trace Attempt 2322	[8.00 s]
0.0.Ht: Trace Attempt 2360	[8.01 s]
0.0.Bm: Trace Attempt 2303	[8.01 s]
0.0.AM: Trace Attempt 187	[10.50 s]
0.0.N: Trace Attempt 229	[11.62 s]
0.0.Hp: Trace Attempt 813	[12.04 s]
0.0.B: Trace Attempt 2819	[12.01 s]
0.0.Ht: Trace Attempt 2862	[12.01 s]
0.0.Bm: Trace Attempt 2802	[12.01 s]
0.0.N: Trace Attempt  1	[12.17 s]
0.0.N: Trace Attempt  2	[12.17 s]
0.0.N: Trace Attempt  3	[12.17 s]
0.0.N: Trace Attempt  4	[12.17 s]
0.0.N: Trace Attempt  5	[12.17 s]
0.0.AM: Trace Attempt 243	[14.50 s]
0.0.Hp: Trace Attempt 936	[16.05 s]
0.0.B: Trace Attempt 3222	[16.02 s]
0.0.Ht: Trace Attempt 3286	[16.01 s]
0.0.Bm: Trace Attempt 3213	[16.02 s]
0.0.N: Trace Attempt 229	[16.18 s]
0.0.N: Trace Attempt  1	[16.78 s]
0.0.N: Trace Attempt  2	[16.78 s]
0.0.N: Trace Attempt  3	[16.78 s]
0.0.N: Trace Attempt  4	[16.78 s]
0.0.N: Trace Attempt  5	[16.78 s]
0.0.AM: Trace Attempt 287	[18.58 s]
0.0.B: Trace Attempt 3585	[20.02 s]
0.0.Hp: Trace Attempt 1043	[20.07 s]
0.0.Ht: Trace Attempt 3669	[20.02 s]
0.0.Bm: Trace Attempt 3577	[20.03 s]
0.0.N: Trace Attempt 231	[20.80 s]
0.0.N: Trace Attempt  1	[21.17 s]
0.0.N: Trace Attempt  2	[21.17 s]
0.0.N: Trace Attempt  3	[21.17 s]
0.0.N: Trace Attempt  4	[21.17 s]
0.0.N: Trace Attempt  5	[21.18 s]
0.0.AM: Trace Attempt 333	[22.73 s]
0.0.B: Trace Attempt 3908	[24.02 s]
0.0.Hp: Trace Attempt 1140	[24.08 s]
0.0.Ht: Trace Attempt 4008	[24.02 s]
0.0.Bm: Trace Attempt 3894	[24.03 s]
0.0.N: Trace Attempt 231	[25.18 s]
0.0.N: Trace Attempt  1	[25.79 s]
0.0.N: Trace Attempt  2	[25.79 s]
0.0.N: Trace Attempt  3	[25.79 s]
0.0.N: Trace Attempt  4	[25.79 s]
0.0.N: Trace Attempt  5	[25.80 s]
0.0.AM: Trace Attempt 368	[26.81 s]
0.0.B: Trace Attempt 4206	[28.02 s]
0.0.Ht: Trace Attempt 4309	[28.02 s]
0.0.Hp: Trace Attempt 1228	[28.10 s]
0.0.Bm: Trace Attempt 4190	[28.04 s]
0.0.N: Trace Attempt 229	[29.81 s]
0.0.N: Trace Attempt  1	[30.31 s]
0.0.N: Trace Attempt  2	[30.31 s]
0.0.N: Trace Attempt  3	[30.31 s]
0.0.N: Trace Attempt  4	[30.31 s]
0.0.N: Trace Attempt  5	[30.31 s]
0.0.AM: Trace Attempt 409	[30.89 s]
0.0.B: Trace Attempt 4492	[32.03 s]
0.0.Ht: Trace Attempt 4614	[32.03 s]
0.0.Bm: Trace Attempt 4478	[32.03 s]
0.0.Hp: Trace Attempt 1310	[32.13 s]
0.0.N: Trace Attempt 231	[34.33 s]
0.0.N: Trace Attempt  1	[34.83 s]
0.0.N: Trace Attempt  2	[34.83 s]
0.0.N: Trace Attempt  3	[34.83 s]
0.0.N: Trace Attempt  4	[34.83 s]
0.0.N: Trace Attempt  5	[34.84 s]
0.0.AM: Trace Attempt 449	[34.94 s]
0.0.B: Trace Attempt 4754	[36.03 s]
0.0.Ht: Trace Attempt 4870	[36.04 s]
0.0.Bm: Trace Attempt 4741	[36.05 s]
0.0.Hp: Trace Attempt 1387	[36.18 s]
0.0.N: Trace Attempt 229	[38.85 s]
0.0.AM: Trace Attempt 401	[38.94 s]
0.0.N: Trace Attempt  1	[39.33 s]
0.0.N: Trace Attempt  2	[39.33 s]
0.0.N: Trace Attempt  3	[39.33 s]
0.0.N: Trace Attempt  4	[39.33 s]
0.0.N: Trace Attempt  5	[39.33 s]
0.0.B: Trace Attempt 4984	[40.04 s]
0.0.Ht: Trace Attempt 5125	[40.05 s]
0.0.Bm: Trace Attempt 4968	[40.06 s]
0.0.Hp: Trace Attempt 1456	[40.23 s]
0.0.N: Trace Attempt 229	[43.37 s]
0.0.N: Trace Attempt  1	[43.92 s]
0.0.N: Trace Attempt  2	[43.92 s]
0.0.N: Trace Attempt  3	[43.92 s]
0.0.N: Trace Attempt  4	[43.92 s]
0.0.N: Trace Attempt  5	[43.92 s]
0.0.B: Trace Attempt 5199	[44.06 s]
0.0.Ht: Trace Attempt 5337	[44.05 s]
0.0.Bm: Trace Attempt 5181	[44.08 s]
0.0.Hp: Trace Attempt 1521	[44.27 s]
0.0.AM: Trace Attempt 512	[44.67 s]
0.0.AM: Trace Attempt  1	[45.58 s]
0.0.AM: Trace Attempt  2	[45.58 s]
0.0.AM: Trace Attempt  3	[45.58 s]
0.0.AM: Trace Attempt  4	[45.58 s]
0.0.AM: Trace Attempt  5	[45.58 s]
0.0.N: Trace Attempt 229	[47.92 s]
0.0.B: Trace Attempt 5422	[48.08 s]
0.0.Ht: Trace Attempt 5584	[48.06 s]
0.0.Bm: Trace Attempt 5400	[48.08 s]
0.0.Hp: Trace Attempt 1587	[48.33 s]
0.0.N: Trace Attempt  1	[48.36 s]
0.0.N: Trace Attempt  2	[48.36 s]
0.0.N: Trace Attempt  3	[48.36 s]
0.0.N: Trace Attempt  4	[48.36 s]
0.0.N: Trace Attempt  5	[48.36 s]
0.0.AM: Trace Attempt 172	[49.59 s]
0.0.Ht: Trace Attempt 5798	[52.06 s]
0.0.B: Trace Attempt 5648	[52.09 s]
0.0.Bm: Trace Attempt 5622	[52.10 s]
0.0.Hp: Trace Attempt 1652	[52.38 s]
0.0.N: Trace Attempt 229	[52.39 s]
0.0.N: Trace Attempt  1	[52.84 s]
0.0.N: Trace Attempt  2	[52.84 s]
0.0.N: Trace Attempt  3	[52.84 s]
0.0.N: Trace Attempt  4	[52.84 s]
0.0.N: Trace Attempt  5	[52.84 s]
0.0.AM: Trace Attempt 244	[53.68 s]
0.0.Ht: Trace Attempt 6021	[56.07 s]
0.0.B: Trace Attempt 5858	[56.09 s]
0.0.Bm: Trace Attempt 5829	[56.10 s]
0.0.Hp: Trace Attempt 1713	[56.38 s]
0.0.N: Trace Attempt 231	[56.86 s]
0.0.N: Trace Attempt  1	[57.21 s]
0.0.N: Trace Attempt  2	[57.21 s]
0.0.N: Trace Attempt  3	[57.21 s]
0.0.N: Trace Attempt  4	[57.22 s]
0.0.N: Trace Attempt  5	[57.22 s]
0.0.AM: Trace Attempt 282	[57.68 s]
0.0.Ht: Trace Attempt 6231	[60.07 s]
0.0.B: Trace Attempt 6060	[60.09 s]
0.0.Bm: Trace Attempt 6029	[60.11 s]
0.0.Hp: Trace Attempt 1772	[60.40 s]
0.0.N: Trace Attempt 229	[61.24 s]
0.0.AM: Trace Attempt 323	[61.70 s]
0.0.N: Trace Attempt  1	[61.83 s]
0.0.N: Trace Attempt  2	[61.83 s]
0.0.N: Trace Attempt  3	[61.83 s]
0.0.N: Trace Attempt  4	[61.84 s]
0.0.N: Trace Attempt  5	[61.84 s]
0.0.Ht: Trace Attempt 6422	[64.08 s]
0.0.B: Trace Attempt 6251	[64.11 s]
0.0.Bm: Trace Attempt 6218	[64.11 s]
0.0.Hp: Trace Attempt 1829	[64.46 s]
0.0.AM: Trace Attempt 347	[65.75 s]
0.0.N: Trace Attempt 229	[65.84 s]
0.0.N: Trace Attempt  1	[66.33 s]
0.0.N: Trace Attempt  2	[66.33 s]
0.0.N: Trace Attempt  3	[66.33 s]
0.0.N: Trace Attempt  4	[66.33 s]
0.0.N: Trace Attempt  5	[66.33 s]
0.0.Ht: Trace Attempt 6628	[68.10 s]
0.0.B: Trace Attempt 6436	[68.11 s]
0.0.Bm: Trace Attempt 6401	[68.13 s]
0.0.Hp: Trace Attempt 1885	[68.52 s]
0.0.AM: Trace Attempt 381	[69.78 s]
0.0.N: Trace Attempt 231	[70.33 s]
0.0.N: Trace Attempt  1	[70.86 s]
0.0.N: Trace Attempt  2	[70.86 s]
0.0.N: Trace Attempt  3	[70.86 s]
0.0.N: Trace Attempt  4	[70.86 s]
0.0.N: Trace Attempt  5	[70.86 s]
0.0.B: Trace Attempt 6615	[72.13 s]
0.0.Ht: Trace Attempt 6803	[72.12 s]
0.0.Bm: Trace Attempt 6578	[72.14 s]
0.0.Hp: Trace Attempt 1939	[72.57 s]
0.0.AM: Trace Attempt 419	[73.90 s]
0.0.N: Trace Attempt 231	[74.87 s]
0.0.N: Trace Attempt  1	[75.84 s]
0.0.N: Trace Attempt  2	[75.84 s]
0.0.N: Trace Attempt  3	[75.84 s]
0.0.N: Trace Attempt  4	[75.84 s]
0.0.N: Trace Attempt  5	[75.84 s]
0.0.B: Trace Attempt 6783	[76.14 s]
0.0.Ht: Trace Attempt 6978	[76.13 s]
0.0.Bm: Trace Attempt 6746	[76.14 s]
0.0.Hp: Trace Attempt 1990	[76.59 s]
0.0.AM: Trace Attempt 453	[78.00 s]
0.0.N: Trace Attempt 246	[79.86 s]
0.0.B: Trace Attempt 6947	[80.15 s]
0.0.Ht: Trace Attempt 7161	[80.14 s]
0.0.Bm: Trace Attempt 6912	[80.16 s]
0.0.Hp: Trace Attempt 2040	[80.59 s]
0.0.AM: Trace Attempt 471	[82.13 s]
0.0.N: Trace Attempt 346	[83.86 s]
0.0.B: Trace Attempt 7113	[84.15 s]
0.0.Ht: Trace Attempt 7316	[84.16 s]
0.0.Bm: Trace Attempt 7078	[84.16 s]
0.0.Hp: Trace Attempt 2089	[84.67 s]
0.0.AM: Trace Attempt 478	[86.44 s]
0.0.N: Trace Attempt 439	[87.87 s]
0.0.B: Trace Attempt 7275	[88.16 s]
0.0.Ht: Trace Attempt 7479	[88.17 s]
0.0.Bm: Trace Attempt 7242	[88.17 s]
0.0.Hp: Trace Attempt 2137	[88.71 s]
0.0.AM: Trace Attempt 485	[90.61 s]
0.0.N: Trace Attempt  1	[91.86 s]
0.0.N: Trace Attempt  2	[91.86 s]
0.0.N: Trace Attempt  3	[91.86 s]
0.0.N: Trace Attempt  4	[91.87 s]
0.0.N: Trace Attempt  5	[91.87 s]
0.0.B: Trace Attempt 7426	[92.18 s]
0.0.Ht: Trace Attempt 7642	[92.17 s]
0.0.Bm: Trace Attempt 7394	[92.17 s]
0.0.Hp: Trace Attempt 2182	[92.72 s]
0.0.AM: Trace Attempt 498	[94.79 s]
0.0.N: Trace Attempt 247	[95.88 s]
0.0.B: Trace Attempt 7580	[96.19 s]
0.0.Ht: Trace Attempt 7794	[96.17 s]
0.0.Bm: Trace Attempt 7550	[96.19 s]
0.0.Hp: Trace Attempt 2228	[96.76 s]
0.0.AM: Trace Attempt 510	[98.93 s]
0.0.N: Trace Attempt 348	[99.89 s]
0.0.Ht: Trace Attempt 7942	[100.18 s]
0.0.B: Trace Attempt 7730	[100.20 s]
0.0.Bm: Trace Attempt 7702	[100.21 s]
0.0.Hp: Trace Attempt 2273	[100.78 s]
0.0.AM: Trace Attempt 528	[103.33 s]
0.0.N: Trace Attempt 442	[103.91 s]
0.0.Ht: Trace Attempt 8102	[104.20 s]
0.0.B: Trace Attempt 7874	[104.22 s]
0.0.Bm: Trace Attempt 7847	[104.22 s]
0.0.Hp: Trace Attempt 2317	[104.81 s]
0.0.AM: Trace Attempt 541	[107.56 s]
0.0.N: Trace Attempt 458	[108.12 s]
0.0.N: Trace Attempt  1	[108.14 s]
0.0.N: Trace Attempt  2	[108.14 s]
0.0.N: Trace Attempt  3	[108.14 s]
0.0.N: Trace Attempt  4	[108.14 s]
0.0.N: Trace Attempt  5	[108.14 s]
0.0.Ht: Trace Attempt 8243	[108.22 s]
0.0.B: Trace Attempt 8008	[108.25 s]
0.0.Bm: Trace Attempt 7982	[108.24 s]
0.0.Hp: Trace Attempt 2359	[108.86 s]
0.0.AM: Trace Attempt 555	[111.83 s]
0.0.N: Trace Attempt 244	[112.15 s]
0.0.B: Trace Attempt 8145	[112.25 s]
0.0.Ht: Trace Attempt 8382	[112.25 s]
0.0.Bm: Trace Attempt 8122	[112.26 s]
0.0.Hp: Trace Attempt 2402	[112.92 s]
0.0.AM: Trace Attempt 569	[116.06 s]
0.0.N: Trace Attempt 346	[116.21 s]
0.0.B: Trace Attempt 8285	[116.27 s]
0.0.Ht: Trace Attempt 8532	[116.26 s]
0.0.Bm: Trace Attempt 8262	[116.28 s]
0.0.Hp: Trace Attempt 2444	[116.94 s]
0.0.AM: Trace Attempt 578	[120.06 s]
0.0.N: Trace Attempt 439	[120.24 s]
0.0.B: Trace Attempt 8425	[120.28 s]
0.0.Ht: Trace Attempt 8688	[120.26 s]
0.0.Bm: Trace Attempt 8404	[120.30 s]
0.0.Hp: Trace Attempt 2486	[121.03 s]
0.0.AM: Trace Attempt 588	[124.19 s]
0.0.N: Trace Attempt 459	[124.25 s]
0.0.N: Trace Attempt  1	[124.26 s]
0.0.N: Trace Attempt  2	[124.26 s]
0.0.N: Trace Attempt  3	[124.26 s]
0.0.N: Trace Attempt  4	[124.27 s]
0.0.N: Trace Attempt  5	[124.27 s]
0.0.Ht: Trace Attempt 8814	[124.26 s]
0.0.B: Trace Attempt 8552	[124.30 s]
0.0.Bm: Trace Attempt 8533	[124.33 s]
0.0.Hp: Trace Attempt 2526	[125.12 s]
0.0.N: Trace Attempt 247	[128.29 s]
0.0.Ht: Trace Attempt 8944	[128.28 s]
0.0.B: Trace Attempt 8685	[128.32 s]
0.0.AM: Trace Attempt 599	[128.35 s]
0.0.Bm: Trace Attempt 8669	[128.35 s]
0.0.Hp: Trace Attempt 2566	[129.13 s]
0.0.N: Trace Attempt 349	[132.34 s]
0.0.Ht: Trace Attempt 9090	[132.28 s]
0.0.B: Trace Attempt 8815	[132.34 s]
0.0.Bm: Trace Attempt 8801	[132.36 s]
0.0.AM: Trace Attempt 610	[132.68 s]
0.0.Hp: Trace Attempt 2606	[133.23 s]
0.0.Ht: Trace Attempt 9225	[136.29 s]
0.0.N: Trace Attempt 443	[136.38 s]
0.0.B: Trace Attempt 8942	[136.34 s]
0.0.Bm: Trace Attempt 8929	[136.36 s]
0.0.AM: Trace Attempt 621	[136.95 s]
0.0.Hp: Trace Attempt 2645	[137.27 s]
0.0.Ht: Trace Attempt 9343	[140.31 s]
0.0.B: Trace Attempt 9062	[140.37 s]
0.0.N: Trace Attempt 460	[140.46 s]
0.0.N: Trace Attempt  1	[140.48 s]
0.0.Bm: Trace Attempt 9049	[140.39 s]
0.0.N: Trace Attempt  2	[140.48 s]
0.0.N: Trace Attempt  3	[140.48 s]
0.0.N: Trace Attempt  4	[140.48 s]
0.0.N: Trace Attempt  5	[140.48 s]
0.0.Hp: Trace Attempt 2682	[141.28 s]
0.0.AM: Trace Attempt 632	[141.95 s]
0.0.Ht: Trace Attempt 9462	[144.33 s]
0.0.B: Trace Attempt 9190	[144.37 s]
0.0.Bm: Trace Attempt 9177	[144.41 s]
0.0.N: Trace Attempt 247	[144.50 s]
0.0.Hp: Trace Attempt 2720	[145.33 s]
0.0.AM: Trace Attempt 641	[146.28 s]
0.0.Ht: Trace Attempt 9597	[148.34 s]
0.0.B: Trace Attempt 9315	[148.38 s]
0.0.N: Trace Attempt 348	[148.50 s]
0.0.Bm: Trace Attempt 9302	[148.43 s]
0.0.Hp: Trace Attempt 2758	[149.42 s]
0.0.AM: Trace Attempt 650	[150.41 s]
0.0.Ht: Trace Attempt 9729	[152.37 s]
0.0.B: Trace Attempt 9437	[152.40 s]
0.0.N: Trace Attempt 441	[152.51 s]
0.0.Bm: Trace Attempt 9422	[152.44 s]
0.0.Hp: Trace Attempt 2795	[153.49 s]
0.0.AM: Trace Attempt 659	[154.53 s]
0.0.N: Trace Attempt  1	[156.40 s]
0.0.N: Trace Attempt  2	[156.40 s]
0.0.N: Trace Attempt  3	[156.40 s]
0.0.N: Trace Attempt  4	[156.41 s]
0.0.N: Trace Attempt  5	[156.41 s]
0.0.B: Trace Attempt 9551	[156.40 s]
0.0.Ht: Trace Attempt 9838	[156.39 s]
0.0.Bm: Trace Attempt 9534	[156.46 s]
0.0.Hp: Trace Attempt 2831	[157.57 s]
0.0.AM: Trace Attempt 668	[158.90 s]
0.0.N: Trace Attempt 246	[160.42 s]
0.0.Ht: Trace Attempt 9952	[160.40 s]
0.0.B: Trace Attempt 9671	[160.43 s]
0.0.Bm: Trace Attempt 9652	[160.48 s]
0.0.Hp: Trace Attempt 2868	[161.65 s]
0.0.AM: Trace Attempt 676	[163.01 s]
0.0.N: Trace Attempt 347	[164.43 s]
0.0.B: Trace Attempt 9787	[164.44 s]
0.0.Ht: Trace Attempt 10068	[164.44 s]
0.0.Bm: Trace Attempt 9768	[164.51 s]
0.0.Hp: Trace Attempt 2904	[165.69 s]
0.0.AM: Trace Attempt 685	[167.60 s]
0.0.N: Trace Attempt 440	[168.44 s]
0.0.Ht: Trace Attempt 10181	[168.45 s]
0.0.B: Trace Attempt 9901	[168.48 s]
0.0.Bm: Trace Attempt 9881	[168.52 s]
0.0.Hp: Trace Attempt 2940	[169.81 s]
0.0.AM: Trace Attempt 693	[171.98 s]
0.0.N: Trace Attempt  1	[172.36 s]
0.0.N: Trace Attempt  2	[172.37 s]
0.0.N: Trace Attempt  3	[172.37 s]
0.0.N: Trace Attempt  4	[172.37 s]
0.0.N: Trace Attempt  5	[172.37 s]
0.0.B: Trace Attempt 10007	[172.48 s]
0.0.Ht: Trace Attempt 10297	[172.47 s]
0.0.Bm: Trace Attempt 9987	[172.52 s]
0.0.Hp: Trace Attempt 2975	[173.90 s]
0.0.N: Trace Attempt 246	[176.41 s]
0.0.AM: Trace Attempt 701	[176.38 s]
0.0.Ht: Trace Attempt 10433	[176.47 s]
0.0.B: Trace Attempt 10119	[176.51 s]
0.0.Bm: Trace Attempt 10098	[176.53 s]
0.0.Hp: Trace Attempt 3011	[178.00 s]
0.0.N: Trace Attempt 348	[180.44 s]
0.0.Ht: Trace Attempt 10552	[180.48 s]
0.0.B: Trace Attempt 10228	[180.53 s]
0.0.Bm: Trace Attempt 10206	[180.54 s]
0.0.AM: Trace Attempt 709	[180.87 s]
0.0.N: Trace Attempt 358	[180.95 s]
0.0.N: Stopped processing property "SEVEN.p1"	[180.98 s].
0.0.N: Morphing to Ncustom1
0.0.N: All properties determined. [0.00 s]
0.0.N: Exited with Success (@ 0.00 s)
0.0.Ncustom1: clocks: 1, declared: 1, looping: 0, posedge: 1, negedge: 0, noedge: 0, bothedge: 0
0.0.Ncustom1: Starting proof for property "SEVEN.p1"	[0.00 s].
0.0.Ncustom1: Trace Attempt 461	[0.04 s]
0.0.B: Trace Attempt 10237	[180.88 s]
0.0.B: Stopped processing property "SEVEN.p1"	[181.05 s].
0.0.B: Morphing to Bcustom2
0.0.B: All properties determined. [0.00 s]
0.0.B: Exited with Success (@ 0.00 s)
0.0.Bcustom2: clocks: 1, declared: 1, looping: 0, posedge: 1, negedge: 0, noedge: 0, bothedge: 0
0.0.Bcustom2: Starting proof for property "SEVEN.p1"	[0.00 s].
0.0.Bcustom2: Trace Attempt  1	[0.00 s]
0.0.Bcustom2: Trace Attempt  2	[0.00 s]
0.0.Bcustom2: Trace Attempt  1	[0.00 s]
0.0.Bcustom2: Trace Attempt  2	[0.00 s]
0.0.Bcustom2: Trace Attempt  3	[0.00 s]
0.0.Bcustom2: Trace Attempt  4	[0.00 s]
0.0.Bcustom2: Trace Attempt  5	[0.00 s]
0.0.Bcustom2: Trace Attempt  1	[0.00 s]
0.0.Bcustom2: Trace Attempt  2	[0.00 s]
0.0.Bcustom2: Trace Attempt  3	[0.00 s]
0.0.Bcustom2: Trace Attempt  4	[0.00 s]
0.0.Bcustom2: Trace Attempt  5	[0.00 s]
0.0.Bcustom2: Trace Attempt  1	[0.00 s]
0.0.Bcustom2: Trace Attempt  2	[0.00 s]
0.0.Bcustom2: Trace Attempt  3	[0.00 s]
0.0.Bcustom2: Trace Attempt  4	[0.00 s]
0.0.Bcustom2: Trace Attempt  5	[0.00 s]
0.0.Bcustom2: Trace Attempt  1	[0.01 s]
0.0.Bcustom2: Trace Attempt  2	[0.01 s]
0.0.Bcustom2: Trace Attempt  3	[0.01 s]
0.0.Bcustom2: Trace Attempt  4	[0.01 s]
0.0.Bcustom2: Trace Attempt  5	[0.01 s]
0.0.Bcustom2: Trace Attempt  1	[0.02 s]
0.0.Bcustom2: Trace Attempt  2	[0.02 s]
0.0.Bcustom2: Trace Attempt  3	[0.02 s]
0.0.Bcustom2: Trace Attempt  4	[0.02 s]
0.0.Bcustom2: Trace Attempt  5	[0.02 s]
0.0.AM: Stopped processing property "SEVEN.p1"	[181.07 s].
0.0.AM: Morphing to AMcustom3
0.0.Bcustom2: Trace Attempt  1	[0.04 s]
0.0.Bcustom2: Trace Attempt  2	[0.04 s]
0.0.Bcustom2: Trace Attempt  3	[0.04 s]
0.0.Bcustom2: Trace Attempt  4	[0.04 s]
0.0.Bcustom2: Trace Attempt  5	[0.04 s]
0.0.AM: All properties determined. [0.00 s]
0.0.AM: Exited with Success (@ 0.00 s)
0.0.AMcustom3: clocks: 1, declared: 1, looping: 0, posedge: 1, negedge: 0, noedge: 0, bothedge: 0
0.0.AMcustom3: Starting proof for property "SEVEN.p1"	[0.00 s].
0.0.AMcustom3: Trace Attempt  1	[0.00 s]
0.0.AMcustom3: Trace Attempt  2	[0.00 s]
0.0.AMcustom3: Trace Attempt  3	[0.00 s]
0.0.AMcustom3: Trace Attempt  4	[0.00 s]
0.0.AMcustom3: Trace Attempt  5	[0.00 s]
0.0.AMcustom3: Trace Attempt  1	[0.00 s]
0.0.AMcustom3: Trace Attempt  2	[0.00 s]
0.0.AMcustom3: Trace Attempt  3	[0.00 s]
0.0.AMcustom3: Trace Attempt  4	[0.00 s]
0.0.AMcustom3: Trace Attempt  5	[0.00 s]
0.0.AMcustom3: Trace Attempt  1	[0.01 s]
0.0.AMcustom3: Trace Attempt  2	[0.01 s]
0.0.AMcustom3: Trace Attempt  3	[0.01 s]
0.0.AMcustom3: Trace Attempt  4	[0.01 s]
0.0.AMcustom3: Trace Attempt  5	[0.01 s]
0.0.Tri: Proofgrid shell started at 3632@vlsi-ria85(local) jg_29660_vlsi-ria85_1
0.0.Bcustom2: Trace Attempt  1	[0.09 s]
0.0.Bcustom2: Trace Attempt  2	[0.09 s]
0.0.Bcustom2: Trace Attempt  3	[0.09 s]
0.0.Bcustom2: Trace Attempt  4	[0.09 s]
0.0.Bcustom2: Trace Attempt  5	[0.09 s]
0.0.Tri: clocks: 1, declared: 1, looping: 0, posedge: 1, negedge: 0, noedge: 0, bothedge: 0
0.0.AMcustom3: Trace Attempt  1	[0.03 s]
0.0.AMcustom3: Trace Attempt  2	[0.03 s]
0.0.AMcustom3: Trace Attempt  3	[0.03 s]
0.0.AMcustom3: Trace Attempt  4	[0.03 s]
0.0.AMcustom3: Trace Attempt  5	[0.03 s]
0.0.Tri: Last scan. Per property time limit: 0s
0.0.Tri: Starting proof for property "SEVEN.p1"	[0.00 s].
0.0.Tri: Trace Attempt  1	[0.00 s]
0.0.D: Proofgrid shell started at 3633@vlsi-ria85(local) jg_29660_vlsi-ria85_1
0.0.D: clocks: 1, declared: 1, looping: 0, posedge: 1, negedge: 0, noedge: 0, bothedge: 0
0.0.D: Last scan. Per property time limit: 0s
0.0.D: Starting proof for property "SEVEN.p1"	[0.00 s].
0.0.D: Trace Attempt  1	[0.00 s]
0.0.D: Trace Attempt  2	[0.00 s]
0.0.D: Trace Attempt  3	[0.00 s]
0.0.AMcustom3: Trace Attempt  1	[0.11 s]
0.0.AMcustom3: Trace Attempt  2	[0.11 s]
0.0.AMcustom3: Trace Attempt  3	[0.11 s]
0.0.AMcustom3: Trace Attempt  4	[0.12 s]
0.0.AMcustom3: Trace Attempt  5	[0.12 s]
0.0.Tri:    0.00" ---- Launching main thread ----
0.0.Bcustom2: Trace Attempt  1	[0.24 s]
0.0.Bcustom2: Trace Attempt  2	[0.24 s]
0.0.Bcustom2: Trace Attempt  3	[0.24 s]
0.0.Bcustom2: Trace Attempt  4	[0.24 s]
0.0.Bcustom2: Trace Attempt  5	[0.24 s]
0.0.Tri:    0.14" ---- Launching abstraction thread ----
0.0.Tri:    0.22" ---- Launching multi-phase simplification thread ----
0.0.Tri:    0.30" ---- Launching liveness simplification thread ----
0.0.AMcustom3: Trace Attempt  1	[0.50 s]
0.0.AMcustom3: Trace Attempt  2	[0.50 s]
0.0.AMcustom3: Trace Attempt  3	[0.50 s]
0.0.AMcustom3: Trace Attempt  4	[0.50 s]
0.0.AMcustom3: Trace Attempt  5	[0.50 s]
0.0.Hp: Trace Attempt 3046	[182.08 s]
0.0.Tri:    1.13" Simplification phase 1 complete
0.0.Ncustom1: Requesting engine job to terminate
0.0.Bcustom2: Requesting engine job to terminate
0.0.AMcustom3: Requesting engine job to terminate
0.0.Tri: Requesting engine job to terminate
0.0.D: Requesting engine job to terminate
0.0.Hp: Requesting engine job to terminate
0.0.Ht: Requesting engine job to terminate
0.0.Bm: Requesting engine job to terminate
INFO (IPF144): 0: Initiating shutdown of proof [182.48 s]
0.0.Tri: A proof was found: No trace exists. [1.26 s]
INFO (IPF057): 0.0.Tri: The property "SEVEN.p1" was proven in 1.26 s.
0.0.AMcustom3: Trace Attempt 83	[1.29 s]
0.0.AMcustom3: Stopped processing property "SEVEN.p1"	[1.30 s].
0.0.AMcustom3: All properties determined. [1.31 s]
0.0.D: Trace Attempt 65	[0.99 s]
0.0.D: Stopped processing property "SEVEN.p1"	[1.26 s].
0.0.D: All properties determined. [1.26 s]
0.0.AMcustom3: Exited with Success (@ 182.49 s)
0: ProofGrid usable level: 0
0.0.D: Exited with Success (@ 182.49 s)
0.0.Ncustom1: Stopped processing property "SEVEN.p1"	[1.48 s].
0.0.Ncustom1: All properties determined. [1.50 s]
0.0.Ncustom1: Exited with Success (@ 182.50 s)
0.0.Ht: Trace Attempt 10603	[182.40 s]
0.0.Ht: All properties determined. [182.43 s]
0.0.Hp: Trace Attempt 3049	[182.44 s]
0.0.Hp: All properties determined. [182.54 s]
0.0.Bm: Trace Attempt 10248	[182.35 s]
0.0.Bm: All properties determined. [182.48 s]
0.0.Bm: Exited with Success (@ 182.61 s)
0.0.Ht: Exited with Success (@ 182.63 s)
0.0.Tri: Stopped processing property "SEVEN.p1"	[1.46 s].
0.0.Tri: All properties determined. [1.47 s]
0.0.Tri: Exited with Success (@ 182.69 s)
0.0.Hp: Exited with Success (@ 182.73 s)
0.0.Bcustom2: Trace Attempt  1	[2.76 s]
0.0.Bcustom2: Stopped processing property "SEVEN.p1"	[2.75 s].
0.0.Bcustom2: All properties determined. [2.76 s]
0.0.Bcustom2: Exited with Success (@ 183.89 s)
0: --------------------------------------------------------------
ProofGrid Summary (utilization 99.91 %)
--------------------------------------------------------------
     engines started                               :    14
     engine jobs started                           :    11

    Average time in state (seconds)
    ------------------------------------------------------
    Engine  Pending     Running        Dead    Utilization
    ------------------------------------------------------
     Hp        0.03      182.48        0.00       99.98 %
     Ht        0.07      182.40        0.00       99.96 %
     Bm        0.10      182.38        0.00       99.95 %
    Mpcustom4        0.05        0.00        0.00        5.52 %
     Oh        0.07        0.00        0.00        6.42 %
      L        0.05        0.00        0.00        0.49 %
    Ncustom1        0.05      182.44        0.00       99.97 %
    Bcustom2        0.04      182.28        0.00       99.98 %
    AMcustom3        0.04      182.21        0.00       99.98 %
    Tri        0.22        1.28        0.00       85.23 %
      D        0.23        1.26        0.00       84.49 %
    all        0.09       99.70        0.00       99.91 %

    Total time in state (seconds)
    -----------------------------------------
            Pending     Running        Dead  
    -----------------------------------------
               0.94     1096.73        0.00

    Data read    : 8.35 MiB
    Data written : 4.21 kiB

0: All pending notifications were processed.
INFO (IPF059): 0: Completed proof on task: "<embedded>"

==============================================================
SUMMARY
==============================================================
           Properties Considered              : 2
                 assertions                   : 1
                  - proven                    : 1 (100%)
                  - bounded_proven (user)     : 0 (0%)
                  - bounded_proven (auto)     : 0 (0%)
                  - marked_proven             : 0 (0%)
                  - cex                       : 0 (0%)
                  - ar_cex                    : 0 (0%)
                  - undetermined              : 0 (0%)
                  - unknown                   : 0 (0%)
                  - error                     : 0 (0%)
                 covers                       : 1
                  - unreachable               : 0 (0%)
                  - bounded_unreachable (user): 0 (0%)
                  - covered                   : 1 (100%)
                  - ar_covered                : 0 (0%)
                  - undetermined              : 0 (0%)
                  - unknown                   : 0 (0%)
                  - error                     : 0 (0%)
determined
[<embedded>] % exit -force
INFO (IPL005): Received request to exit from the console.
INFO (IPL014): Waiting for the Tcl-thread to exit.
INFO: Waiting for proof threads to stop...
INFO: Proof threads stopped.
INFO (IPL018): The peak resident set memory use for this session was 1.965 GB.
INFO (IPL015): The Tcl-thread exited with status 0.
INFO (IPL016): Exiting the analysis session with status 0.
