Jasper Apps 2024.06p002 64 bits 2024.09.02 16:28:38 UTC

Any disclosure about the Cadence Design Systems software or its use
model to any third party violates the written Non-Disclosure Agreement
between Cadence Design Systems, Inc. and the customer.

THIS SOFTWARE CONTAINS CONFIDENTIAL INFORMATION AND TRADE SECRETS OF
CADENCE DESIGN SYSTEMS, INC. USE, DISCLOSURE, OR REPRODUCTION IS
PROHIBITED WITHOUT THE PRIOR EXPRESS WRITTEN PERMISSION OF CADENCE
DESIGN SYSTEMS, INC.

Copyright (C) 2000-2024 Cadence Design Systems, Inc. All Rights
Reserved.  Unpublished -- rights reserved under the copyright laws of
the United States.

This product includes software developed by others and redistributed
according to license agreement. See doc/third_party_readme.txt for
further details.

RESTRICTED RIGHTS LEGEND

Use, duplication, or disclosure by the Government is subject to
restrictions as set forth in subparagraph (c) (1) (ii) of the Rights in
Technical Data and Computer Software clause at DFARS 252.227-7013 or
subparagraphs (c) (1) and (2) of Commercial Computer Software -- Restricted
Rights at 48 CFR 52.227-19, as applicable.


                          Cadence Design Systems, Inc.
                          2655 Seely Avenue
                          San Jose, CA 95134
                          Phone: 408.943.1234

For technical assistance visit http://support.cadence.com.

Jasper Apps Analysis Session - /users/rompel/jasper_executions/safety_liveness/jgprojects/seven_seg_11/sessionLogs/session_0

WARNING (WG017): [session]: The system's locale is "ANSI_X3.4-1968", which is not UTF-8. Non-ASCII characters might not be handled correctly.
WARNING (WG017): [jg_console]: The system's locale is "ANSI_X3.4-1968", which is not UTF-8. Non-ASCII characters might not be handled correctly.
INFO: successfully checked out license "jasper_fao".
INFO: reading configuration file "/users/rompel/.config/cadence/jasper.conf".
% analyze -sv09 ../seven_seg_11.sv
[-- (VERI-1482)] Analyzing Verilog file '/tools/cadence2425/JASPER/jasper_2024.06p002/lib/verilog/packages/std/std.sv' into library 'std'
[-- (VERI-1482)] Analyzing Verilog file '../seven_seg_11.sv'
% elaborate -bbox_mul 1000000 -bbox_div 1000000 -bbox_mod 1000000 -bbox_a 1000000
[INFO (HIER-8002)] ../seven_seg_11.sv(32): Disabling old hierarchical reference handler
[INFO (VERI-1018)] ../seven_seg_11.sv(1): compiling module 'SEVEN'
[WARN (VERI-1209)] ../seven_seg_11.sv(15): expression size 32 truncated to fit in target size 15
[INFO (VERI-8005)] ../seven_seg_11.sv(5): Unintentional sequential element inferred for cnt read before write using blocking assignment
[INFO (VERI-8005)] ../seven_seg_11.sv(6): Unintentional sequential element inferred for digit_select read before write using blocking assignment
[INFO (VERI-8005)] ../seven_seg_11.sv(1): Unintentional sequential element inferred for segment read before write using blocking assignment
[INFO (VERI-8005)] ../seven_seg_11.sv(1): Unintentional sequential element inferred for sig read before write using blocking assignment
INFO (ISW003): Top module name is "SEVEN".
INFO (INL208): Elaboration synthesis summary:
  Number of synthesized netlists          1 (0 packages)
  Single run mode                         On
  Pipeline                                On (1 pipelined netlists)
  Late hierarchical reference connection  On
  Number of analyzed Verilog modules      1 (1 synthesized)
  Number of analyzed VHDL entities        0 (0 synthesized)
INFO (INL003): Clearing all state information (assumes, stopats, and so forth).
SEVEN
[<embedded>] % reset rst
INFO (IPM031): Clearing proof results of all properties.
INFO (IRS006): Current reset condition is "rst".
[<embedded>] % clock clk
[<embedded>] % prove -all
Ncustom1: Custom engine code is hT3Ng7hPPfiYQOTDZ3qhYOwGAM51eA+J/FjkM5shLioAsqhgLR4Ft+O1BuKG6ilQ83B9tLXSl+CwjiTMAQA
Bcustom2: Custom engine code is hT3Nm7hPr1Vp3Di1Ra2USNIGL4JypRnLKLAdF6JAyuavO2JfGCiY9OZJhcAcOUnLx5xwNdhILGrAWX9s+z2WDkKwNR7tAfClBEjRFVQeq6DU54boFgEA
AMcustom3: Custom engine code is hT3Ng7hP/feYQOTDZ3qhYOwGAM51eA+J/FjkM5shLioAsqhgLR4Ft+O1BuKG6ilQ83B9tLXSmmqwm7g9AQA
Mpcustom4: Custom engine code is hT3NZbhP9fmY2AbBQnsjfOxn6c+6e6yL+/e8fZFmaQrnlgEA
INFO (IPF036): Starting proof on task: "<embedded>", 2 properties to prove with 0 already proven/unreachable
INFO (IRS029): Starting reset analysis: phase 1 of 4.
INFO (IRS030): Running reset analysis: phase 2 of 4.
INFO (IRS031): Running reset analysis: phase 3 of 4.
INFO (IRS020): Starting the reset analysis simulation with a limit of 100 iterations (phase 4 of 4).
INFO (IRS024): Reset iterations 0 to 4 analyzed.
INFO (IRS018): Reset analysis simulation executed for 3 iterations. Assigned values for 24 of 24 design flops, 0 of 0 design latches, 6 of 6 internal elements.
INFO (IRS039): Reset analysis complete.
INFO (IPF031): Settings used for proof thread 0:
    orchestration                 = on
    time_limit                    = 86400s
    per_property_time_limit       = 1s * 10 ^ scan
    engine_mode                   = auto
    proofgrid_per_engine_max_jobs = 1
    max engine jobs               = auto
    proofgrid_mode                = local
    proofgrid_restarts            = 10
0: Using multistage preprocessing
AMcustom5: Custom engine code is hT3N1rhP11/52HrFRS21ROp2LOjVTgPvT8L8BGXHgLhaIuqtT4nARFjUqrBL+7pLmaTOzBepZW/Jm8SSrHDybSQtoNiO3y43wk+dEoWlsZizu97Fih6O6lPVG/LpWP5SsUPwlGagLNa1FKEFvwVXyX7//8prySbvSxIHXr5er+z4RAEA
0: Starting reduce
Ncustom6: Custom engine code is hT3OXrhPByJp3TrFSTLhUmMH4KVtJgmTCnNDF46yMXOKY48m4LS5nE7yBzFjA7kDuwO/GhGUpEPiky3p3wmPn3dJZHxFMsafSoObRzSC+tn7sEY0WbTdZ/FV4hL3MYH/b1CIUvXSWR4wqEoVLsmMOD4xIPT4lI1LO6ZCO7PnnWQuLwetnvKlrXx6wCW/A+x+enqslg1YPobi4wEF/EvbzOvcTYdJvl2s4H2yZg2b2ofAVN5WvhWk1HoBAA
ADcustom7: Custom engine code is hT3Nv7hPv1752HrFRa2kROx2f/ECJeZB2AZsLdlO8VwmIuqtT4nIDFXclhg+O+o+DMmQCekbheGk0kK28laA9gaOFDXsQp29J3X615HY1IPHJWd6FUFvCHjO+p1k652b5JJvZlShNpGlGSXAiQe/mEAj6tEBAA
Tricustom8: Custom engine code is hT3Nu7hPt1752DvFRa0kNDiyIV97VyejwM9C/jCLJjdPvusZONHY42VYUy0Q1ZotnhcVtNc56tJ5wbxv6V2+XpdsaSlHck5vfnbYjdwj1OECy9U+7oSQ0SZE3g5ayD+Phuh4odCJTjeKa2k4elM9ldQfkAEA
Gcustom9: Custom engine code is hT3NibhPDfeYQADBZnYcglOvK9Pfd7EOeniIqP8jNsyIqInncipMGcUXqAadachREE9F2PwhBUZUNw5kHnd4JdXkamORRgEA
C2custom10: Custom engine code is hT3NirhPjfWYQADBZnYcglOvK9Pfd7EOeniIqP8jNsyIqInncgkrYMMXCYbdK0dUjZIF9d4cJ0rHoBDjwVLBKuG86XYVV00BAA
AGcustom11: Custom engine code is hT3NirhP/fmYQADBZnYcglOvK9Pfd7EOeniIqP8jNsyIqInnckcwYMMXCYbdK0dUjZIF9d4cJ0rHoBDjwVLBKuHEZnZByh0BAA
Bcustom12: Custom engine code is hT3NjrhPDfiYQADBZnYcglOvK9PfWxFtenjIyBqfrgr7if/jL/yPOuK1BAflEcW0DxNH2eDIoezN2gxlQFg81RZtiWXh7aiTAidvAQA
0: Finished reduce in 0s
Ncustom13: Custom engine code is hT3NR7hPByFp3TrFSTLhUmMH4KWtJglTyV/c51BHEeZWamnJv767nE6PCak26bd3gf3XGN3rIRheufhDieCJQVISo+gNYUKhiUedBKGtsP/a18svAnlMJZudHxDFwK5ufsyoxsIyiAeSY2oi3tEuoDHr5gw42DFKAG3PqO3CEsl8Azzdt3pl5nGA1Ifv2H02eYsFzWb/nfp8PMb3F0krE/EgBcm8TD9Div8BAA
Tricustom14: Custom engine code is hT3Nu7hP3fiYQADBZnYcglNHp9bfd7EOeniIqP/ji8sGLQu8yhsFO+wxJ+O+R0bU8g/IewXFomyos+viQnWc2xYNYmMqpo3i40O7DaZR7qfp4YqNx26KRvQ/qx0BAA
0.0.PRE: Performing Proof Simplification...
0.0.N: clocks: 1, declared: 1, looping: 0, posedge: 1, negedge: 0, noedge: 0, bothedge: 0
0.0.N: Proof Simplification Iteration 1	[0.00 s]
0.0.PRE: A trace with 1 cycles was found. [0.00 s]
INFO (IPF047): 0.0.PRE: The cover property "SEVEN.p1:precondition1" was covered in 1 cycles in 0.00 s.
0.0.N: Proof Simplification Iteration 2	[0.06 s]
0.0.PRE: A proof was found: No trace exists. [0.00 s]
INFO (IPF057): 0.0.PRE: The property ":noDeadEnd" was proven in 0.00 s.
    Use check_assumptions -show -dead_end to show this property in the property table.
0.0.PRE: A proof was found: No trace exists. [0.00 s]
INFO (IPF057): 0.0.PRE: The property ":noConflict" was proven in 0.00 s.
    Use check_assumptions -show to show this property in the property table.
INFO (IPF047): 0.0.PRE: The cover property ":live" was covered in 1 cycles in 0.00 s.
    Use check_assumptions -show -live to show this property in the property table.
0.0.PRE: Proof Simplification completed in 0.06 s
0: About to start ProofGrid in its own thread with a limit of 10000 pending notifications and a limit of 10 traces.
0: =============================== ProofGrid start ===============================
0: ProofGrid usable level: 1
0: Initial ProofGrid level: 1
0: ProofGrid is starting event handling
0.0.Hp: Proofgrid shell started at 24615@vlsi-ria84(local) jg_24548_vlsi-ria84_1
0.0.N: Proofgrid shell started at 24614@vlsi-ria84(local) jg_24548_vlsi-ria84_1
0.0.N: clocks: 1, declared: 1, looping: 0, posedge: 1, negedge: 0, noedge: 0, bothedge: 0
0.0.N: Last scan. Per property time limit: 0s
0.0.N: Starting proof for property "SEVEN.p1"	[0.00 s].
0.0.N: Trace Attempt  1	[0.00 s]
0.0.N: Trace Attempt  2	[0.00 s]
0.0.N: Trace Attempt  2	[0.00 s]
0.0.N: Trace Attempt  3	[0.00 s]
0.0.N: Trace Attempt  3	[0.00 s]
0.0.Hp: clocks: 1, declared: 1, looping: 0, posedge: 1, negedge: 0, noedge: 0, bothedge: 0
0.0.Hp: Last scan. Per property time limit: 0s
0.0.Hp: Trace Attempt  1	[0.00 s]
0.0.N: Trace Attempt  4	[0.00 s]
0.0.N: Trace Attempt  5	[0.00 s]
0.0.Hp: Trace Attempt  2	[0.00 s]
0.0.Hp: Trace Attempt  3	[0.00 s]
0.0.Hp: Trace Attempt  4	[0.00 s]
0.0.Hp: Trace Attempt  5	[0.00 s]
0.0.N: Trace Attempt  1	[0.01 s]
0.0.N: Trace Attempt  2	[0.01 s]
0.0.N: Trace Attempt  3	[0.01 s]
0.0.N: Trace Attempt  4	[0.01 s]
0.0.N: Trace Attempt  5	[0.01 s]
0.0.Bm: Proofgrid shell started at 24647@vlsi-ria84(local) jg_24548_vlsi-ria84_1
0.0.Oh: Proofgrid shell started at 24649@vlsi-ria84(local) jg_24548_vlsi-ria84_1
0.0.L: Proofgrid shell started at 24650@vlsi-ria84(local) jg_24548_vlsi-ria84_1
0.0.B: Proofgrid shell started at 24651@vlsi-ria84(local) jg_24548_vlsi-ria84_1
0.0.Ht: Proofgrid shell started at 24646@vlsi-ria84(local) jg_24548_vlsi-ria84_1
0.0.Mpcustom4: Proofgrid shell started at 24648@vlsi-ria84(local) jg_24548_vlsi-ria84_1
0.0.Oh: clocks: 1, declared: 1, looping: 0, posedge: 1, negedge: 0, noedge: 0, bothedge: 0
0.0.B: clocks: 1, declared: 1, looping: 0, posedge: 1, negedge: 0, noedge: 0, bothedge: 0
0.0.Bm: clocks: 1, declared: 1, looping: 0, posedge: 1, negedge: 0, noedge: 0, bothedge: 0
0.0.B: Last scan. Per property time limit: 0s
0.0.B: Starting proof for property "SEVEN.p1"	[0.00 s].
0.0.Bm: Ignoring liveness properties
0.0.Bm: Last scan. Per property time limit: 0s
0.0.Oh: Reached length limit (2147483647) [0.01 s]
0.0.Bm: Trace Attempt  1	[0.00 s]
0.0.B: Trace Attempt  1	[0.00 s]
0.0.Bm: Trace Attempt  2	[0.00 s]
0.0.B: Trace Attempt  2	[0.00 s]
0.0.Bm: Trace Attempt  3	[0.00 s]
0.0.B: Trace Attempt  3	[0.00 s]
0.0.Ht: clocks: 1, declared: 1, looping: 0, posedge: 1, negedge: 0, noedge: 0, bothedge: 0
0.0.Ht: Last scan. Per property time limit: 0s
0.0.Ht: Trace Attempt  1	[0.00 s]
0.0.Ht: Trace Attempt  2	[0.00 s]
0.0.Ht: Trace Attempt  3	[0.00 s]
0.0.Ht: Trace Attempt  4	[0.00 s]
0.0.Ht: Trace Attempt  5	[0.00 s]
0.0.Bm: Trace Attempt  4	[0.00 s]
0.0.Bm: Trace Attempt  5	[0.00 s]
0.0.Mpcustom4: clocks: 1, declared: 1, looping: 0, posedge: 1, negedge: 0, noedge: 0, bothedge: 0
0.0.Mpcustom4: Ignoring liveness properties
0.0.Mpcustom4: All properties either determined or skipped. [0.00 s]
0.0.Oh: Exited with Success (@ 0.05 s)
0.0.Oh: Completed, Restart ignored.
0.0.L: clocks: 1, declared: 1, looping: 0, posedge: 1, negedge: 0, noedge: 0, bothedge: 0
0.0.L: Using trace diversification with seed 1 (0.05)
0.0.L: Using LRU state removal heuristic
0.0.L: Ignoring liveness properties
0.0.L: All properties either determined or skipped. [0.00 s]
0.0.B: Trace Attempt  4	[0.00 s]
0.0.B: Trace Attempt  5	[0.00 s]
0.0.Mpcustom4: Exited with Success (@ 0.05 s)
0.0.Mpcustom4: Completed, Restart ignored.
0.0.L: Exited with Success (@ 0.05 s)
0.0.L: Completed, Restart ignored.
0.0.AM: Proofgrid shell started at 24656@vlsi-ria84(local) jg_24548_vlsi-ria84_1
0.0.AM: clocks: 1, declared: 1, looping: 0, posedge: 1, negedge: 0, noedge: 0, bothedge: 0
0.0.AM: Last scan. Per property time limit: 0s
0.0.AM: Starting proof for property "SEVEN.p1"	[0.00 s].
0.0.AM: Trace Attempt  1	[0.00 s]
0.0.AM: Trace Attempt  2	[0.00 s]
0.0.AM: Trace Attempt  3	[0.00 s]
0.0.AM: Trace Attempt  4	[0.00 s]
0.0.AM: Trace Attempt  5	[0.00 s]
0.0.AM: Trace Attempt  1	[0.00 s]
0.0.AM: Trace Attempt  2	[0.00 s]
0.0.AM: Trace Attempt  3	[0.00 s]
0.0.AM: Trace Attempt  4	[0.00 s]
0.0.AM: Trace Attempt  5	[0.00 s]
0.0.AM: Trace Attempt  1	[0.01 s]
0.0.AM: Trace Attempt  2	[0.01 s]
0.0.AM: Trace Attempt  3	[0.01 s]
0.0.AM: Trace Attempt  4	[0.01 s]
0.0.AM: Trace Attempt  5	[0.01 s]
0.0.AM: Trace Attempt  1	[0.03 s]
0.0.AM: Trace Attempt  2	[0.03 s]
0.0.AM: Trace Attempt  3	[0.03 s]
0.0.AM: Trace Attempt  4	[0.03 s]
0.0.AM: Trace Attempt  5	[0.03 s]
0.0.N: Trace Attempt  1	[0.10 s]
0.0.N: Trace Attempt  2	[0.10 s]
0.0.N: Trace Attempt  3	[0.10 s]
0.0.N: Trace Attempt  4	[0.10 s]
0.0.N: Trace Attempt  5	[0.10 s]
0.0.AM: Trace Attempt  1	[0.10 s]
0.0.AM: Trace Attempt  2	[0.10 s]
0.0.AM: Trace Attempt  3	[0.10 s]
0.0.AM: Trace Attempt  4	[0.10 s]
0.0.AM: Trace Attempt  5	[0.10 s]
0.0.AM: Trace Attempt  1	[0.40 s]
0.0.AM: Trace Attempt  2	[0.40 s]
0.0.AM: Trace Attempt  3	[0.40 s]
0.0.AM: Trace Attempt  4	[0.40 s]
0.0.AM: Trace Attempt  5	[0.40 s]
0.0.N: Trace Attempt  1	[0.49 s]
0.0.N: Trace Attempt  2	[0.49 s]
0.0.N: Trace Attempt  3	[0.49 s]
0.0.N: Trace Attempt  4	[0.49 s]
0.0.N: Trace Attempt  5	[0.49 s]
0.0.AM: Trace Attempt  1	[1.78 s]
0.0.AM: Trace Attempt  2	[1.78 s]
0.0.AM: Trace Attempt  3	[1.78 s]
0.0.AM: Trace Attempt  4	[1.78 s]
0.0.AM: Trace Attempt  5	[1.78 s]
0.0.N: Trace Attempt  1	[1.96 s]
0.0.N: Trace Attempt  2	[1.96 s]
0.0.N: Trace Attempt  3	[1.96 s]
0.0.N: Trace Attempt  4	[1.96 s]
0.0.N: Trace Attempt  5	[1.96 s]
0.0.Hp: Trace Attempt 472	[4.00 s]
0.0.Ht: Trace Attempt 1786	[4.00 s]
0.0.Bm: Trace Attempt 1717	[4.00 s]
0.0.B: Trace Attempt 1706	[4.00 s]
0.0.N: Trace Attempt  1	[5.49 s]
0.0.N: Trace Attempt  2	[5.49 s]
0.0.N: Trace Attempt  3	[5.49 s]
0.0.N: Trace Attempt  4	[5.50 s]
0.0.N: Trace Attempt  5	[5.50 s]
0.0.AM: Trace Attempt 199	[5.81 s]
0.0.Hp: Trace Attempt 659	[8.02 s]
0.0.Bm: Trace Attempt 2362	[8.00 s]
0.0.Ht: Trace Attempt 2402	[8.01 s]
0.0.B: Trace Attempt 2345	[8.01 s]
0.0.AM: Trace Attempt  1	[8.36 s]
0.0.AM: Trace Attempt  2	[8.36 s]
0.0.AM: Trace Attempt  3	[8.37 s]
0.0.AM: Trace Attempt  4	[8.37 s]
0.0.AM: Trace Attempt  5	[8.37 s]
0.0.N: Trace Attempt  1	[9.00 s]
0.0.N: Trace Attempt  2	[9.00 s]
0.0.N: Trace Attempt  3	[9.00 s]
0.0.N: Trace Attempt  4	[9.01 s]
0.0.N: Trace Attempt  5	[9.01 s]
0.0.Hp: Trace Attempt 803	[12.03 s]
0.0.Bm: Trace Attempt 2865	[12.01 s]
0.0.B: Trace Attempt 2848	[12.01 s]
0.0.Ht: Trace Attempt 2892	[12.01 s]
0.0.AM: Trace Attempt 193	[12.38 s]
0.0.N: Trace Attempt  1	[12.57 s]
0.0.N: Trace Attempt  2	[12.57 s]
0.0.N: Trace Attempt  3	[12.57 s]
0.0.N: Trace Attempt  4	[12.57 s]
0.0.N: Trace Attempt  5	[12.57 s]
0.0.Hp: Trace Attempt 924	[16.05 s]
0.0.Bm: Trace Attempt 3283	[16.01 s]
0.0.Ht: Trace Attempt 3296	[16.02 s]
0.0.B: Trace Attempt 3264	[16.01 s]
0.0.N: Trace Attempt  1	[16.18 s]
0.0.N: Trace Attempt  2	[16.18 s]
0.0.N: Trace Attempt  3	[16.18 s]
0.0.N: Trace Attempt  4	[16.18 s]
0.0.N: Trace Attempt  5	[16.18 s]
0.0.AM: Trace Attempt 243	[16.39 s]
0.0.N: Trace Attempt  1	[19.81 s]
0.0.N: Trace Attempt  2	[19.81 s]
0.0.N: Trace Attempt  3	[19.81 s]
0.0.N: Trace Attempt  4	[19.81 s]
0.0.N: Trace Attempt  5	[19.81 s]
0.0.Bm: Trace Attempt 3646	[20.02 s]
0.0.B: Trace Attempt 3624	[20.02 s]
0.0.Ht: Trace Attempt 3655	[20.03 s]
0.0.Hp: Trace Attempt 1031	[20.08 s]
0.0.AM: Trace Attempt 285	[20.44 s]
0.0.N: Trace Attempt  1	[23.35 s]
0.0.N: Trace Attempt  2	[23.35 s]
0.0.N: Trace Attempt  3	[23.35 s]
0.0.N: Trace Attempt  4	[23.35 s]
0.0.N: Trace Attempt  5	[23.36 s]
0.0.Bm: Trace Attempt 3975	[24.02 s]
0.0.B: Trace Attempt 3950	[24.03 s]
0.0.Ht: Trace Attempt 3987	[24.03 s]
0.0.Hp: Trace Attempt 1128	[24.12 s]
0.0.AM: Trace Attempt 332	[24.53 s]
0.0.N: Trace Attempt  1	[26.98 s]
0.0.N: Trace Attempt  2	[26.98 s]
0.0.N: Trace Attempt  3	[26.98 s]
0.0.N: Trace Attempt  4	[26.98 s]
0.0.N: Trace Attempt  5	[26.98 s]
0.0.Bm: Trace Attempt 4286	[28.02 s]
0.0.B: Trace Attempt 4256	[28.03 s]
0.0.Ht: Trace Attempt 4282	[28.04 s]
0.0.Hp: Trace Attempt 1216	[28.16 s]
0.0.AM: Trace Attempt 370	[28.57 s]
0.0.N: Trace Attempt  1	[30.65 s]
0.0.N: Trace Attempt  2	[30.66 s]
0.0.N: Trace Attempt  3	[30.66 s]
0.0.N: Trace Attempt  4	[30.66 s]
0.0.N: Trace Attempt  5	[30.66 s]
0.0.Bm: Trace Attempt 4577	[32.03 s]
0.0.Ht: Trace Attempt 4555	[32.04 s]
0.0.B: Trace Attempt 4545	[32.04 s]
0.0.Hp: Trace Attempt 1297	[32.17 s]
0.0.AM: Trace Attempt 407	[32.61 s]
0.0.N: Trace Attempt  1	[34.16 s]
0.0.N: Trace Attempt  2	[34.16 s]
0.0.N: Trace Attempt  3	[34.16 s]
0.0.N: Trace Attempt  4	[34.17 s]
0.0.N: Trace Attempt  5	[34.17 s]
0.0.Bm: Trace Attempt 4842	[36.03 s]
0.0.Ht: Trace Attempt 4819	[36.04 s]
0.0.B: Trace Attempt 4810	[36.05 s]
0.0.Hp: Trace Attempt 1373	[36.19 s]
0.0.AM: Trace Attempt 442	[36.67 s]
0.0.N: Trace Attempt  1	[37.86 s]
0.0.N: Trace Attempt  2	[37.87 s]
0.0.N: Trace Attempt  3	[37.87 s]
0.0.N: Trace Attempt  4	[37.87 s]
0.0.N: Trace Attempt  5	[37.87 s]
0.0.Bm: Trace Attempt 5093	[40.05 s]
0.0.B: Trace Attempt 5057	[40.06 s]
0.0.Ht: Trace Attempt 5062	[40.06 s]
0.0.Hp: Trace Attempt 1444	[40.25 s]
0.0.AM: Trace Attempt 358	[40.67 s]
0.0.N: Trace Attempt  1	[41.49 s]
0.0.N: Trace Attempt  2	[41.49 s]
0.0.N: Trace Attempt  3	[41.49 s]
0.0.N: Trace Attempt  4	[41.50 s]
0.0.N: Trace Attempt  5	[41.50 s]
0.0.B: Trace Attempt 5273	[44.06 s]
0.0.Bm: Trace Attempt 5310	[44.07 s]
0.0.Ht: Trace Attempt 5269	[44.07 s]
0.0.Hp: Trace Attempt 1508	[44.28 s]
0.0.N: Trace Attempt  1	[45.12 s]
0.0.N: Trace Attempt  2	[45.12 s]
0.0.N: Trace Attempt  3	[45.12 s]
0.0.N: Trace Attempt  4	[45.12 s]
0.0.N: Trace Attempt  5	[45.12 s]
0.0.AM: Trace Attempt 512	[46.72 s]
0.0.AM: Trace Attempt  1	[47.29 s]
0.0.AM: Trace Attempt  2	[47.29 s]
0.0.AM: Trace Attempt  3	[47.29 s]
0.0.AM: Trace Attempt  4	[47.29 s]
0.0.AM: Trace Attempt  5	[47.29 s]
0.0.B: Trace Attempt 5487	[48.07 s]
0.0.Ht: Trace Attempt 5475	[48.08 s]
0.0.Bm: Trace Attempt 5524	[48.08 s]
0.0.Hp: Trace Attempt 1571	[48.34 s]
0.0.N: Trace Attempt 257	[49.25 s]
0.0.N: Trace Attempt  1	[49.26 s]
0.0.N: Trace Attempt  2	[49.26 s]
0.0.N: Trace Attempt  3	[49.26 s]
0.0.N: Trace Attempt  4	[49.26 s]
0.0.N: Trace Attempt  5	[49.26 s]
0.0.AM: Trace Attempt 244	[51.32 s]
0.0.B: Trace Attempt 5707	[52.08 s]
0.0.Bm: Trace Attempt 5744	[52.08 s]
0.0.Ht: Trace Attempt 5693	[52.09 s]
0.0.Hp: Trace Attempt 1635	[52.39 s]
0.0.N: Trace Attempt 183	[53.32 s]
0.0.AM: Trace Attempt 340	[55.36 s]
0.0.B: Trace Attempt 5919	[56.08 s]
0.0.Bm: Trace Attempt 5956	[56.09 s]
0.0.Ht: Trace Attempt 5906	[56.10 s]
0.0.Hp: Trace Attempt 1696	[56.46 s]
0.0.N: Trace Attempt 250	[57.41 s]
0.0.AM: Trace Attempt 431	[59.39 s]
0.0.B: Trace Attempt 6123	[60.09 s]
0.0.Bm: Trace Attempt 6160	[60.10 s]
0.0.Ht: Trace Attempt 6108	[60.11 s]
0.0.Hp: Trace Attempt 1755	[60.51 s]
0.0.N: Trace Attempt 290	[61.45 s]
0.0.AM: Trace Attempt 469	[63.49 s]
0.0.B: Trace Attempt 6311	[64.11 s]
0.0.Bm: Trace Attempt 6349	[64.12 s]
0.0.Ht: Trace Attempt 6299	[64.12 s]
0.0.Hp: Trace Attempt 1811	[64.54 s]
0.0.N: Trace Attempt 333	[65.54 s]
0.0.AM: Trace Attempt 497	[67.64 s]
0.0.B: Trace Attempt 6499	[68.11 s]
0.0.Ht: Trace Attempt 6489	[68.13 s]
0.0.Bm: Trace Attempt 6539	[68.14 s]
0.0.Hp: Trace Attempt 1866	[68.60 s]
0.0.N: Trace Attempt 368	[69.66 s]
0.0.AM: Trace Attempt 542	[71.68 s]
0.0.B: Trace Attempt 6681	[72.13 s]
0.0.Ht: Trace Attempt 6676	[72.15 s]
0.0.Bm: Trace Attempt 6721	[72.16 s]
0.0.Hp: Trace Attempt 1919	[72.67 s]
0.0.N: Trace Attempt 401	[73.66 s]
0.0.AM: Trace Attempt 579	[75.71 s]
0.0.B: Trace Attempt 6856	[76.14 s]
0.0.Ht: Trace Attempt 6858	[76.17 s]
0.0.Bm: Trace Attempt 6896	[76.18 s]
0.0.Hp: Trace Attempt 1969	[76.67 s]
0.0.N: Trace Attempt 436	[77.66 s]
0.0.AM: Trace Attempt 608	[79.75 s]
0.0.B: Trace Attempt 7024	[80.16 s]
0.0.Ht: Trace Attempt 7032	[80.17 s]
0.0.Bm: Trace Attempt 7064	[80.20 s]
0.0.Hp: Trace Attempt 2018	[80.70 s]
0.0.N: Trace Attempt 470	[81.73 s]
0.0.AM: Trace Attempt 636	[83.82 s]
0.0.B: Trace Attempt 7185	[84.16 s]
0.0.Ht: Trace Attempt 7191	[84.20 s]
0.0.Bm: Trace Attempt 7225	[84.21 s]
0.0.Hp: Trace Attempt 2065	[84.73 s]
0.0.N: Trace Attempt 494	[85.92 s]
0.0.AM: Trace Attempt 663	[87.85 s]
0.0.B: Trace Attempt 7334	[88.17 s]
0.0.Ht: Trace Attempt 7346	[88.21 s]
0.0.Bm: Trace Attempt 7375	[88.23 s]
0.0.Hp: Trace Attempt 2110	[88.76 s]
0.0.N: Trace Attempt  1	[89.11 s]
0.0.N: Trace Attempt  2	[89.11 s]
0.0.N: Trace Attempt  3	[89.11 s]
0.0.N: Trace Attempt  4	[89.11 s]
0.0.N: Trace Attempt  5	[89.11 s]
0.0.AM: Trace Attempt 689	[91.96 s]
0.0.B: Trace Attempt 7489	[92.18 s]
0.0.Ht: Trace Attempt 7500	[92.23 s]
0.0.Bm: Trace Attempt 7531	[92.24 s]
0.0.Hp: Trace Attempt 2157	[92.82 s]
0.0.N: Trace Attempt 183	[93.16 s]
0.0.AM: Trace Attempt 711	[96.05 s]
0.0.B: Trace Attempt 7643	[96.18 s]
0.0.Ht: Trace Attempt 7656	[96.23 s]
0.0.Bm: Trace Attempt 7687	[96.27 s]
0.0.Hp: Trace Attempt 2203	[96.90 s]
0.0.N: Trace Attempt 250	[97.20 s]
0.0.AM: Trace Attempt 730	[100.15 s]
0.0.B: Trace Attempt 7793	[100.19 s]
0.0.Ht: Trace Attempt 7813	[100.25 s]
0.0.Bm: Trace Attempt 7838	[100.29 s]
0.0.Hp: Trace Attempt 2248	[100.96 s]
0.0.N: Trace Attempt 290	[101.22 s]
0.0.B: Trace Attempt 7939	[104.19 s]
0.0.Ht: Trace Attempt 7962	[104.25 s]
0.0.Bm: Trace Attempt 7985	[104.30 s]
0.0.AM: Trace Attempt 752	[104.29 s]
0.0.Hp: Trace Attempt 2292	[105.04 s]
0.0.N: Trace Attempt 333	[105.27 s]
0.0.B: Trace Attempt 8082	[108.22 s]
0.0.Ht: Trace Attempt 8109	[108.26 s]
0.0.Bm: Trace Attempt 8127	[108.31 s]
0.0.AM: Trace Attempt 777	[108.48 s]
0.0.Hp: Trace Attempt 2334	[109.09 s]
0.0.N: Trace Attempt 368	[109.34 s]
0.0.B: Trace Attempt 8223	[112.23 s]
0.0.Ht: Trace Attempt 8247	[112.27 s]
0.0.Bm: Trace Attempt 8272	[112.33 s]
0.0.AM: Trace Attempt 801	[112.61 s]
0.0.Hp: Trace Attempt 2376	[113.17 s]
0.0.N: Trace Attempt 402	[113.44 s]
0.0.B: Trace Attempt 8369	[116.25 s]
0.0.Ht: Trace Attempt 8392	[116.27 s]
0.0.Bm: Trace Attempt 8418	[116.34 s]
0.0.AM: Trace Attempt 820	[116.67 s]
0.0.Hp: Trace Attempt 2417	[117.21 s]
0.0.N: Trace Attempt 437	[117.49 s]
0.0.B: Trace Attempt 8509	[120.27 s]
0.0.Ht: Trace Attempt 8526	[120.28 s]
0.0.Bm: Trace Attempt 8558	[120.35 s]
0.0.AM: Trace Attempt 842	[120.71 s]
0.0.Hp: Trace Attempt 2457	[121.28 s]
0.0.N: Trace Attempt 471	[121.49 s]
0.0.B: Trace Attempt 8644	[124.28 s]
0.0.Ht: Trace Attempt 8661	[124.30 s]
0.0.Bm: Trace Attempt 8693	[124.38 s]
0.0.AM: Trace Attempt 862	[124.83 s]
0.0.Hp: Trace Attempt 2496	[125.36 s]
0.0.N: Trace Attempt 495	[125.54 s]
0.0.N: Trace Attempt  1	[128.15 s]
0.0.N: Trace Attempt  2	[128.15 s]
0.0.N: Trace Attempt  3	[128.15 s]
0.0.N: Trace Attempt  4	[128.16 s]
0.0.N: Trace Attempt  5	[128.16 s]
0.0.B: Trace Attempt 8772	[128.29 s]
0.0.Ht: Trace Attempt 8792	[128.31 s]
0.0.Bm: Trace Attempt 8822	[128.40 s]
0.0.AM: Trace Attempt 883	[129.06 s]
0.0.Hp: Trace Attempt 2534	[129.46 s]
0.0.N: Trace Attempt 183	[132.20 s]
0.0.Ht: Trace Attempt 8928	[132.31 s]
0.0.B: Trace Attempt 8907	[132.32 s]
0.0.Bm: Trace Attempt 8957	[132.42 s]
0.0.AM: Trace Attempt 905	[133.13 s]
0.0.Hp: Trace Attempt 2572	[133.47 s]
0.0.N: Trace Attempt 250	[136.22 s]
0.0.Ht: Trace Attempt 9061	[136.32 s]
0.0.B: Trace Attempt 9038	[136.34 s]
0.0.Bm: Trace Attempt 9088	[136.42 s]
0.0.AM: Trace Attempt 921	[137.18 s]
0.0.Hp: Trace Attempt 2610	[137.56 s]
0.0.N: Trace Attempt 290	[140.25 s]
0.0.Ht: Trace Attempt 9192	[140.33 s]
0.0.B: Trace Attempt 9167	[140.34 s]
0.0.Bm: Trace Attempt 9218	[140.44 s]
0.0.Hp: Trace Attempt 2647	[141.59 s]
0.0.AM: Trace Attempt 932	[141.55 s]
0.0.N: Trace Attempt 333	[144.32 s]
0.0.B: Trace Attempt 9293	[144.34 s]
0.0.Ht: Trace Attempt 9315	[144.36 s]
0.0.Bm: Trace Attempt 9344	[144.46 s]
0.0.Hp: Trace Attempt 2683	[145.60 s]
0.0.AM: Trace Attempt 515	[145.80 s]
0.0.B: Trace Attempt 9408	[148.36 s]
0.0.Ht: Trace Attempt 9433	[148.38 s]
0.0.N: Trace Attempt 367	[148.43 s]
0.0.Bm: Trace Attempt 9459	[148.48 s]
0.0.Hp: Trace Attempt 2717	[149.67 s]
0.0.AM: Trace Attempt 633	[149.80 s]
0.0.B: Trace Attempt 9521	[152.38 s]
0.0.Ht: Trace Attempt 9545	[152.40 s]
0.0.N: Trace Attempt 399	[152.50 s]
0.0.Bm: Trace Attempt 9572	[152.50 s]
0.0.Hp: Trace Attempt 2751	[153.76 s]
0.0.AM: Trace Attempt 766	[153.82 s]
0.0.B: Trace Attempt 9632	[156.39 s]
0.0.Ht: Trace Attempt 9659	[156.42 s]
0.0.N: Trace Attempt 434	[156.54 s]
0.0.Bm: Trace Attempt 9683	[156.50 s]
0.0.Hp: Trace Attempt 2785	[157.85 s]
0.0.B: Trace Attempt 9745	[160.41 s]
0.0.Ht: Trace Attempt 9776	[160.43 s]
0.0.AM: Trace Attempt 783	[160.45 s]
0.0.Bm: Trace Attempt 9796	[160.51 s]
0.0.N: Trace Attempt 467	[160.57 s]
0.0.Hp: Trace Attempt 2818	[161.86 s]
0.0.B: Trace Attempt 9854	[164.44 s]
0.0.Ht: Trace Attempt 9889	[164.46 s]
0.0.AM: Trace Attempt 861	[164.46 s]
0.0.Bm: Trace Attempt 9905	[164.55 s]
0.0.N: Trace Attempt 494	[165.02 s]
0.0.Hp: Trace Attempt 2850	[165.91 s]
0.0.N: Trace Attempt  1	[167.48 s]
0.0.N: Trace Attempt  2	[167.48 s]
0.0.N: Trace Attempt  3	[167.48 s]
0.0.N: Trace Attempt  4	[167.49 s]
0.0.N: Trace Attempt  5	[167.49 s]
0.0.B: Trace Attempt 9960	[168.45 s]
0.0.Ht: Trace Attempt 10000	[168.46 s]
0.0.AM: Trace Attempt 964	[168.49 s]
0.0.Bm: Trace Attempt 10011	[168.56 s]
0.0.Hp: Trace Attempt 2882	[169.92 s]
0.0.N: Trace Attempt 183	[171.54 s]
0.0.AM: Trace Attempt  1	[171.65 s]
0.0.AM: Trace Attempt  2	[171.65 s]
0.0.AM: Trace Attempt  3	[171.65 s]
0.0.AM: Trace Attempt  4	[171.65 s]
0.0.AM: Trace Attempt  5	[171.65 s]
0.0.B: Trace Attempt 10072	[172.47 s]
0.0.Ht: Trace Attempt 10116	[172.49 s]
0.0.Bm: Trace Attempt 10123	[172.57 s]
0.0.Hp: Trace Attempt 2916	[174.01 s]
0.0.N: Trace Attempt 250	[175.56 s]
0.0.AM: Trace Attempt 173	[175.68 s]
0.0.Ht: Trace Attempt 10237	[176.50 s]
0.0.B: Trace Attempt 10192	[176.50 s]
0.0.Bm: Trace Attempt 10243	[176.61 s]
0.0.Hp: Trace Attempt 2950	[178.03 s]
0.0.N: Trace Attempt 290	[179.62 s]
0.0.AM: Trace Attempt 242	[179.77 s]
0.0.Ht: Trace Attempt 10352	[180.51 s]
0.0.B: Trace Attempt 10308	[180.53 s]
0.0.Bm: Trace Attempt 10358	[180.63 s]
0.0.AM: Trace Attempt 253	[180.86 s]
0.0.AM: Stopped processing property "SEVEN.p1"	[180.90 s].
0.0.AM: Morphing to AMcustom3
0.0.AM: All properties determined. [0.00 s]
0.0.AM: Exited with Success (@ 0.00 s)
0.0.N: Trace Attempt 306	[180.92 s]
0.0.N: Stopped processing property "SEVEN.p1"	[180.97 s].
0.0.N: Morphing to Ncustom1
0.0.N: All properties determined. [0.00 s]
0.0.N: Exited with Success (@ 0.00 s)
0.0.AMcustom3: clocks: 1, declared: 1, looping: 0, posedge: 1, negedge: 0, noedge: 0, bothedge: 0
0.0.AMcustom3: Starting proof for property "SEVEN.p1"	[0.00 s].
0.0.AMcustom3: Trace Attempt  1	[0.00 s]
0.0.Ncustom1: clocks: 1, declared: 1, looping: 0, posedge: 1, negedge: 0, noedge: 0, bothedge: 0
0.0.Ncustom1: Starting proof for property "SEVEN.p1"	[0.00 s].
0.0.AMcustom3: Trace Attempt  2	[0.00 s]
0.0.AMcustom3: Trace Attempt  3	[0.00 s]
0.0.AMcustom3: Trace Attempt  4	[0.00 s]
0.0.AMcustom3: Trace Attempt  5	[0.00 s]
0.0.AMcustom3: Trace Attempt  1	[0.00 s]
0.0.AMcustom3: Trace Attempt  2	[0.00 s]
0.0.AMcustom3: Trace Attempt  3	[0.00 s]
0.0.AMcustom3: Trace Attempt  4	[0.00 s]
0.0.AMcustom3: Trace Attempt  5	[0.00 s]
0.0.AMcustom3: Trace Attempt  1	[0.02 s]
0.0.AMcustom3: Trace Attempt  2	[0.02 s]
0.0.AMcustom3: Trace Attempt  3	[0.02 s]
0.0.AMcustom3: Trace Attempt  4	[0.02 s]
0.0.AMcustom3: Trace Attempt  5	[0.02 s]
0.0.AMcustom3: Trace Attempt  1	[0.04 s]
0.0.AMcustom3: Trace Attempt  2	[0.04 s]
0.0.Ncustom1: Trace Attempt 496	[0.04 s]
0.0.AMcustom3: Trace Attempt  3	[0.04 s]
0.0.AMcustom3: Trace Attempt  4	[0.04 s]
0.0.AMcustom3: Trace Attempt  5	[0.04 s]
0.0.Tri: Proofgrid shell started at 25036@vlsi-ria84(local) jg_24548_vlsi-ria84_1
0.0.Tri: clocks: 1, declared: 1, looping: 0, posedge: 1, negedge: 0, noedge: 0, bothedge: 0
0.0.Tri: Last scan. Per property time limit: 0s
0.0.Tri: Starting proof for property "SEVEN.p1"	[0.00 s].
0.0.Tri: Trace Attempt  1	[0.00 s]
0.0.B: Trace Attempt 10318	[180.89 s]
0.0.B: Stopped processing property "SEVEN.p1"	[181.02 s].
0.0.B: Morphing to Bcustom2
0.0.B: All properties determined. [0.00 s]
0.0.B: Exited with Success (@ 0.00 s)
0.0.Bcustom2: clocks: 1, declared: 1, looping: 0, posedge: 1, negedge: 0, noedge: 0, bothedge: 0
0.0.Bcustom2: Starting proof for property "SEVEN.p1"	[0.00 s].
0.0.Bcustom2: Trace Attempt  1	[0.00 s]
0.0.Bcustom2: Trace Attempt  2	[0.00 s]
0.0.Bcustom2: Trace Attempt  1	[0.00 s]
0.0.Bcustom2: Trace Attempt  2	[0.00 s]
0.0.Bcustom2: Trace Attempt  3	[0.00 s]
0.0.Bcustom2: Trace Attempt  4	[0.00 s]
0.0.Bcustom2: Trace Attempt  5	[0.00 s]
0.0.Bcustom2: Trace Attempt  1	[0.00 s]
0.0.Bcustom2: Trace Attempt  2	[0.00 s]
0.0.Bcustom2: Trace Attempt  3	[0.00 s]
0.0.Bcustom2: Trace Attempt  4	[0.00 s]
0.0.Bcustom2: Trace Attempt  5	[0.00 s]
0.0.Bcustom2: Trace Attempt  1	[0.00 s]
0.0.Bcustom2: Trace Attempt  2	[0.00 s]
0.0.Bcustom2: Trace Attempt  3	[0.00 s]
0.0.Bcustom2: Trace Attempt  4	[0.00 s]
0.0.Bcustom2: Trace Attempt  5	[0.00 s]
0.0.D: Proofgrid shell started at 25041@vlsi-ria84(local) jg_24548_vlsi-ria84_1
0.0.Bcustom2: Trace Attempt  1	[0.01 s]
0.0.Bcustom2: Trace Attempt  2	[0.01 s]
0.0.Bcustom2: Trace Attempt  3	[0.01 s]
0.0.Bcustom2: Trace Attempt  4	[0.01 s]
0.0.Bcustom2: Trace Attempt  5	[0.01 s]
0.0.D: clocks: 1, declared: 1, looping: 0, posedge: 1, negedge: 0, noedge: 0, bothedge: 0
0.0.D: Last scan. Per property time limit: 0s
0.0.D: Starting proof for property "SEVEN.p1"	[0.00 s].
0.0.D: Trace Attempt  1	[0.00 s]
0.0.D: Trace Attempt  2	[0.00 s]
0.0.D: Trace Attempt  3	[0.00 s]
0.0.Bcustom2: Trace Attempt  1	[0.02 s]
0.0.Bcustom2: Trace Attempt  2	[0.02 s]
0.0.Bcustom2: Trace Attempt  3	[0.02 s]
0.0.Bcustom2: Trace Attempt  4	[0.02 s]
0.0.Bcustom2: Trace Attempt  5	[0.02 s]
0.0.AMcustom3: Trace Attempt  1	[0.12 s]
0.0.AMcustom3: Trace Attempt  2	[0.12 s]
0.0.AMcustom3: Trace Attempt  3	[0.12 s]
0.0.AMcustom3: Trace Attempt  4	[0.12 s]
0.0.AMcustom3: Trace Attempt  5	[0.12 s]
0.0.Tri:    0.00" ---- Launching main thread ----
0.0.Bcustom2: Trace Attempt  1	[0.04 s]
0.0.Bcustom2: Trace Attempt  2	[0.04 s]
0.0.Bcustom2: Trace Attempt  3	[0.04 s]
0.0.Bcustom2: Trace Attempt  4	[0.04 s]
0.0.Bcustom2: Trace Attempt  5	[0.04 s]
0.0.Tri:    0.06" ---- Launching abstraction thread ----
0.0.Tri:    0.06" ---- Launching multi-phase simplification thread ----
0.0.Bcustom2: Trace Attempt  1	[0.09 s]
0.0.Bcustom2: Trace Attempt  2	[0.09 s]
0.0.Bcustom2: Trace Attempt  3	[0.09 s]
0.0.Bcustom2: Trace Attempt  4	[0.09 s]
0.0.Bcustom2: Trace Attempt  5	[0.09 s]
0.0.Tri:    0.13" ---- Launching liveness simplification thread ----
0.0.Bcustom2: Trace Attempt  1	[0.22 s]
0.0.Bcustom2: Trace Attempt  2	[0.22 s]
0.0.Bcustom2: Trace Attempt  3	[0.22 s]
0.0.Bcustom2: Trace Attempt  4	[0.22 s]
0.0.Bcustom2: Trace Attempt  5	[0.22 s]
0.0.AMcustom3: Trace Attempt  1	[0.46 s]
0.0.AMcustom3: Trace Attempt  2	[0.46 s]
0.0.AMcustom3: Trace Attempt  3	[0.46 s]
0.0.AMcustom3: Trace Attempt  4	[0.46 s]
0.0.AMcustom3: Trace Attempt  5	[0.46 s]
0.0.Bcustom2: Trace Attempt  1	[0.66 s]
0.0.Bcustom2: Trace Attempt  2	[0.66 s]
0.0.Bcustom2: Trace Attempt  3	[0.66 s]
0.0.Bcustom2: Trace Attempt  4	[0.66 s]
0.0.Bcustom2: Trace Attempt  5	[0.66 s]
0.0.Tri:    0.95" Simplification phase 1 complete
0.0.D: Trace Attempt 63	[0.76 s]
0.0.D: Stopped processing property "SEVEN.p1"	[0.97 s].
0.0.D: Morphing to M
0.0.D: All properties determined. [0.00 s]
0.0.D: Exited with Success (@ 0.00 s)
0.0.M: clocks: 1, declared: 1, looping: 0, posedge: 1, negedge: 0, noedge: 0, bothedge: 0
0.0.Hp: Trace Attempt 2982	[182.06 s]
0.0.M: Starting proof for property "SEVEN.p1"	[0.00 s].
0.0.M: Trace Attempt  1	[0.00 s]
0.0.M: Trace Attempt  2	[0.00 s]
0.0.M: Trace Attempt  3	[0.00 s]
0.0.M: Trace Attempt  4	[0.01 s]
0.0.M: Trace Attempt  5	[0.01 s]
0.0.Ncustom1: Requesting engine job to terminate
0.0.Bcustom2: Requesting engine job to terminate
0.0.AMcustom3: Requesting engine job to terminate
0.0.Tri: Requesting engine job to terminate
0.0.M: Requesting engine job to terminate
0.0.Hp: Requesting engine job to terminate
0.0.Ht: Requesting engine job to terminate
0.0.Bm: Requesting engine job to terminate
INFO (IPF144): 0: Initiating shutdown of proof [182.09 s]
0.0.Tri: A proof was found: No trace exists. [1.05 s]
INFO (IPF057): 0.0.Tri: The property "SEVEN.p1" was proven in 1.05 s.
0.0.M: Trace Attempt 15	[0.03 s]
0.0.M: Stopped processing property "SEVEN.p1"	[0.02 s].
0.0.M: All properties determined. [0.03 s]
0.0.M: Exited with Success (@ 182.09 s)
0: ProofGrid usable level: 0
0.0.AMcustom3: Trace Attempt 75	[1.11 s]
0.0.AMcustom3: Stopped processing property "SEVEN.p1"	[1.13 s].
0.0.AMcustom3: All properties determined. [1.13 s]
0.0.Ht: Trace Attempt 10392	[182.01 s]
0.0.Ht: All properties determined. [182.05 s]
0.0.AMcustom3: Exited with Success (@ 182.10 s)
0.0.Bcustom2: Trace Attempt 568	[1.02 s]
0.0.Bcustom2: Stopped processing property "SEVEN.p1"	[1.02 s].
0.0.Bcustom2: All properties determined. [1.03 s]
0.0.Ncustom1: Stopped processing property "SEVEN.p1"	[1.13 s].
0.0.Ncustom1: All properties determined. [1.13 s]
0.0.Ncustom1: Exited with Success (@ 182.11 s)
0.0.Bcustom2: Exited with Success (@ 182.12 s)
0.0.AMcustom5: Proofgrid shell started at 25120@vlsi-ria84(local) jg_24548_vlsi-ria84_1
0.0.AMcustom5: Requesting engine job to terminate
0.0.AMcustom5: Preventing job from starting because proof is shutting down.
0.0.AMcustom5: Requesting engine job to terminate
0.0.AMcustom5: Interrupted. [0.00 s]
0.0.AMcustom5: Exited with Success (@ 182.14 s)
0.0.Hp: All properties determined. [182.17 s]
0.0.Bm: Trace Attempt 10394	[182.03 s]
0.0.Bm: All properties determined. [182.13 s]
0.0.Bm: Exited with Success (@ 182.19 s)
0.0.Ht: Exited with Success (@ 182.22 s)
0.0.Tri: Stopped processing property "SEVEN.p1"	[1.25 s].
0.0.Tri: All properties determined. [1.25 s]
0.0.Tri: Exited with Success (@ 182.29 s)
0.0.Hp: Exited with Success (@ 182.33 s)
0: --------------------------------------------------------------
ProofGrid Summary (utilization 99.94 %)
--------------------------------------------------------------
     engines started                               :    16
     engine jobs started                           :    12

    Average time in state (seconds)
    ------------------------------------------------------
    Engine  Pending     Running        Dead    Utilization
    ------------------------------------------------------
     Hp        0.03      182.09        0.00       99.98 %
     Ht        0.05      182.05        0.00       99.97 %
     Bm        0.04      182.05        0.00       99.98 %
    Mpcustom4        0.05        0.00        0.00        9.73 %
     Oh        0.04        0.00        0.00        1.70 %
      L        0.04        0.01        0.00       11.67 %
    Ncustom1        0.03      182.05        0.00       99.98 %
    Bcustom2        0.04      181.91        0.00       99.98 %
    AMcustom3        0.06      182.00        0.00       99.97 %
    Tri        0.10        1.05        0.00       90.92 %
      M        0.12        1.00        0.00       89.44 %
    AMcustom5        0.09        0.00        0.00        0.00 %
    all        0.06       91.18        0.00       99.94 %

    Total time in state (seconds)
    -----------------------------------------
            Pending     Running        Dead  
    -----------------------------------------
               0.68     1094.20        0.00

    Data read    : 8.05 MiB
    Data written : 4.39 kiB

0: All pending notifications were processed.
INFO (IPF059): 0: Completed proof on task: "<embedded>"

==============================================================
SUMMARY
==============================================================
           Properties Considered              : 2
                 assertions                   : 1
                  - proven                    : 1 (100%)
                  - bounded_proven (user)     : 0 (0%)
                  - bounded_proven (auto)     : 0 (0%)
                  - marked_proven             : 0 (0%)
                  - cex                       : 0 (0%)
                  - ar_cex                    : 0 (0%)
                  - undetermined              : 0 (0%)
                  - unknown                   : 0 (0%)
                  - error                     : 0 (0%)
                 covers                       : 1
                  - unreachable               : 0 (0%)
                  - bounded_unreachable (user): 0 (0%)
                  - covered                   : 1 (100%)
                  - ar_covered                : 0 (0%)
                  - undetermined              : 0 (0%)
                  - unknown                   : 0 (0%)
                  - error                     : 0 (0%)
determined
[<embedded>] % exit -force
[<embedded>] % INFO (IPL005): Received request to exit from the console.
INFO (IPL014): Waiting for the Tcl-thread to exit.
INFO: Waiting for proof threads to stop...
INFO: Proof threads stopped.
INFO (IPL018): The peak resident set memory use for this session was 2.022 GB.
INFO (IPL015): The Tcl-thread exited with status 0.
INFO (IPL016): Exiting the analysis session with status 0.
Finished seven_seg_11.tcl successfully
