Jasper Apps 2024.06p002 64 bits 2024.09.02 16:28:38 UTC

Any disclosure about the Cadence Design Systems software or its use
model to any third party violates the written Non-Disclosure Agreement
between Cadence Design Systems, Inc. and the customer.

THIS SOFTWARE CONTAINS CONFIDENTIAL INFORMATION AND TRADE SECRETS OF
CADENCE DESIGN SYSTEMS, INC. USE, DISCLOSURE, OR REPRODUCTION IS
PROHIBITED WITHOUT THE PRIOR EXPRESS WRITTEN PERMISSION OF CADENCE
DESIGN SYSTEMS, INC.

Copyright (C) 2000-2024 Cadence Design Systems, Inc. All Rights
Reserved.  Unpublished -- rights reserved under the copyright laws of
the United States.

This product includes software developed by others and redistributed
according to license agreement. See doc/third_party_readme.txt for
further details.

RESTRICTED RIGHTS LEGEND

Use, duplication, or disclosure by the Government is subject to
restrictions as set forth in subparagraph (c) (1) (ii) of the Rights in
Technical Data and Computer Software clause at DFARS 252.227-7013 or
subparagraphs (c) (1) and (2) of Commercial Computer Software -- Restricted
Rights at 48 CFR 52.227-19, as applicable.


                          Cadence Design Systems, Inc.
                          2655 Seely Avenue
                          San Jose, CA 95134
                          Phone: 408.943.1234

For technical assistance visit http://support.cadence.com.

Jasper Apps Analysis Session - /users/rompel/jasper_executions/safety_liveness/jgprojects/blink_21/sessionLogs/session_0

WARNING (WG017): [session]: The system's locale is "ANSI_X3.4-1968", which is not UTF-8. Non-ASCII characters might not be handled correctly.
WARNING (WG017): [jg_console]: The system's locale is "ANSI_X3.4-1968", which is not UTF-8. Non-ASCII characters might not be handled correctly.
INFO: successfully checked out license "jasper_fao".
INFO: reading configuration file "/users/rompel/.config/cadence/jasper.conf".
% analyze -sv09 ../blink_21.sv
[-- (VERI-1482)] Analyzing Verilog file '/tools/cadence2425/JASPER/jasper_2024.06p002/lib/verilog/packages/std/std.sv' into library 'std'
[-- (VERI-1482)] Analyzing Verilog file '../blink_21.sv'
% elaborate -bbox_mul 1000000 -bbox_div 1000000 -bbox_mod 1000000 -bbox_a 1000000
[INFO (HIER-8002)] ../blink_21.sv(18): Disabling old hierarchical reference handler
[INFO (VERI-1018)] ../blink_21.sv(1): compiling module 'BLINK'
[WARN (VERI-1209)] ../blink_21.sv(10): expression size 32 truncated to fit in target size 28
INFO (ISW003): Top module name is "BLINK".
INFO (INL208): Elaboration synthesis summary:
  Number of synthesized netlists          1 (0 packages)
  Single run mode                         On
  Pipeline                                On (1 pipelined netlists)
  Late hierarchical reference connection  On
  Number of analyzed Verilog modules      1 (1 synthesized)
  Number of analyzed VHDL entities        0 (0 synthesized)
INFO (INL003): Clearing all state information (assumes, stopats, and so forth).
BLINK
[<embedded>] % reset rst
INFO (IPM031): Clearing proof results of all properties.
INFO (IRS006): Current reset condition is "rst".
[<embedded>] % clock clk
[<embedded>] % prove -all
Ncustom1: Custom engine code is hT3Ng7hPPfiYQOTDZ3qhYOwGAM51eA+J/FjkM5shLioAsqhgLR4Ft+O1BuKG6ilQ83B9tLXSl+CwjiTMAQA
Bcustom2: Custom engine code is hT3Nm7hPr1Vp3Di1Ra2USNIGL4JypRnLKLAdF6JAyuavO2JfGCiY9OZJhcAcOUnLx5xwNdhILGrAWX9s+z2WDkKwNR7tAfClBEjRFVQeq6DU54boFgEA
AMcustom3: Custom engine code is hT3Ng7hP/feYQOTDZ3qhYOwGAM51eA+J/FjkM5shLioAsqhgLR4Ft+O1BuKG6ilQ83B9tLXSmmqwm7g9AQA
Mpcustom4: Custom engine code is hT3NZbhP9fmY2AbBQnsjfOxn6c+6e6yL+/e8fZFmaQrnlgEA
INFO (IPF036): Starting proof on task: "<embedded>", 1 properties to prove with 0 already proven/unreachable
INFO (IRS029): Starting reset analysis: phase 1 of 4.
INFO (IRS030): Running reset analysis: phase 2 of 4.
INFO (IRS031): Running reset analysis: phase 3 of 4.
INFO (IRS020): Starting the reset analysis simulation with a limit of 100 iterations (phase 4 of 4).
INFO (IRS024): Reset iterations 0 to 4 analyzed.
INFO (IRS018): Reset analysis simulation executed for 3 iterations. Assigned values for 29 of 31 design flops, 0 of 0 design latches, 3 of 3 internal elements.
INFO (IRS039): Reset analysis complete.
INFO (IPF031): Settings used for proof thread 0:
    orchestration                 = on
    time_limit                    = 86400s
    per_property_time_limit       = 1s * 10 ^ scan
    engine_mode                   = auto
    proofgrid_per_engine_max_jobs = 1
    max engine jobs               = auto
    proofgrid_mode                = local
    proofgrid_restarts            = 10
0: Using multistage preprocessing
AMcustom5: Custom engine code is hT3N1rhP11/52HrFRS21ROp2LOjVTgPvT8L8BGXHgLhaIuqtT4nARFjUqrBL+7pLmaTOzBepZW/Jm8SSrHDybSQtoNiO3y43wk+dEoWlsZizu97Fih6O6lPVG/LpWP5SsUPwlGagLNa1FKEFvwVXyX7//8prySbvSxIHXr5er+z4RAEA
0: Starting reduce
Ncustom6: Custom engine code is hT3OXrhPByJp3TrFSTLhUmMH4KVtJgmTCnNDF46yMXOKY48m4LS5nE7yBzFjA7kDuwO/GhGUpEPiky3p3wmPn3dJZHxFMsafSoObRzSC+tn7sEY0WbTdZ/FV4hL3MYH/b1CIUvXSWR4wqEoVLsmMOD4xIPT4lI1LO6ZCO7PnnWQuLwetnvKlrXx6wCW/A+x+enqslg1YPobi4wEF/EvbzOvcTYdJvl2s4H2yZg2b2ofAVN5WvhWk1HoBAA
ADcustom7: Custom engine code is hT3Nv7hPv1752HrFRa2kROx2f/ECJeZB2AZsLdlO8VwmIuqtT4nIDFXclhg+O+o+DMmQCekbheGk0kK28laA9gaOFDXsQp29J3X615HY1IPHJWd6FUFvCHjO+p1k652b5JJvZlShNpGlGSXAiQe/mEAj6tEBAA
Tricustom8: Custom engine code is hT3Nu7hPt1752DvFRa0kNDiyIV97VyejwM9C/jCLJjdPvusZONHY42VYUy0Q1ZotnhcVtNc56tJ5wbxv6V2+XpdsaSlHck5vfnbYjdwj1OECy9U+7oSQ0SZE3g5ayD+Phuh4odCJTjeKa2k4elM9ldQfkAEA
Gcustom9: Custom engine code is hT3NibhPDfeYQADBZnYcglOvK9Pfd7EOeniIqP8jNsyIqInncipMGcUXqAadachREE9F2PwhBUZUNw5kHnd4JdXkamORRgEA
C2custom10: Custom engine code is hT3NirhPjfWYQADBZnYcglOvK9Pfd7EOeniIqP8jNsyIqInncgkrYMMXCYbdK0dUjZIF9d4cJ0rHoBDjwVLBKuG86XYVV00BAA
AGcustom11: Custom engine code is hT3NirhP/fmYQADBZnYcglOvK9Pfd7EOeniIqP8jNsyIqInnckcwYMMXCYbdK0dUjZIF9d4cJ0rHoBDjwVLBKuHEZnZByh0BAA
Bcustom12: Custom engine code is hT3NjrhPDfiYQADBZnYcglOvK9PfWxFtenjIyBqfrgr7if/jL/yPOuK1BAflEcW0DxNH2eDIoezN2gxlQFg81RZtiWXh7aiTAidvAQA
Ncustom13: Custom engine code is hT3NR7hPByFp3TrFSTLhUmMH4KWtJglTyV/c51BHEeZWamnJv767nE6PCak26bd3gf3XGN3rIRheufhDieCJQVISo+gNYUKhiUedBKGtsP/a18svAnlMJZudHxDFwK5ufsyoxsIyiAeSY2oi3tEuoDHr5gw42DFKAG3PqO3CEsl8Azzdt3pl5nGA1Ifv2H02eYsFzWb/nfp8PMb3F0krE/EgBcm8TD9Div8BAA
Tricustom14: Custom engine code is hT3Nu7hP3fiYQADBZnYcglNHp9bfd7EOeniIqP/ji8sGLQu8yhsFO+wxJ+O+R0bU8g/IewXFomyos+viQnWc2xYNYmMqpo3i40O7DaZR7qfp4YqNx26KRvQ/qx0BAA
0: Finished reduce in 0s
0.0.PRE: Performing Proof Simplification...
0.0.N: clocks: 1, declared: 1, looping: 0, posedge: 1, negedge: 0, noedge: 0, bothedge: 0
0.0.N: Proof Simplification Iteration 1	[0.00 s]
0.0.PRE: A proof was found: No trace exists. [0.00 s]
INFO (IPF057): 0.0.PRE: The property ":noDeadEnd" was proven in 0.00 s.
    Use check_assumptions -show -dead_end to show this property in the property table.
0.0.PRE: A proof was found: No trace exists. [0.00 s]
INFO (IPF057): 0.0.PRE: The property ":noConflict" was proven in 0.00 s.
    Use check_assumptions -show to show this property in the property table.
INFO (IPF047): 0.0.PRE: The cover property ":live" was covered in 1 cycles in 0.00 s.
    Use check_assumptions -show -live to show this property in the property table.
0.0.PRE: Proof Simplification completed in 0.00 s
0: About to start ProofGrid in its own thread with a limit of 10000 pending notifications and a limit of 10 traces.
0: =============================== ProofGrid start ===============================
0: ProofGrid usable level: 1
0: Initial ProofGrid level: 1
0: ProofGrid is starting event handling
0.0.Hp: Proofgrid shell started at 1322@vlsi-ria84(local) jg_1226_vlsi-ria84_1
0.0.N: Proofgrid shell started at 1321@vlsi-ria84(local) jg_1226_vlsi-ria84_1
0.0.Hp: clocks: 1, declared: 1, looping: 0, posedge: 1, negedge: 0, noedge: 0, bothedge: 0
0.0.N: clocks: 1, declared: 1, looping: 0, posedge: 1, negedge: 0, noedge: 0, bothedge: 0
0.0.N: Last scan. Per property time limit: 0s
0.0.N: Starting proof for property "BLINK.p1"	[0.00 s].
0.0.Hp: Last scan. Per property time limit: 0s
0.0.Hp: Trace Attempt  1	[0.00 s]
0.0.N: Trace Attempt  1	[0.00 s]
0.0.Hp: Trace Attempt  2	[0.00 s]
0.0.N: Trace Attempt  2	[0.00 s]
0.0.Hp: Trace Attempt  3	[0.00 s]
0.0.Hp: Trace Attempt  4	[0.00 s]
0.0.Hp: Trace Attempt  5	[0.00 s]
0.0.N: Trace Attempt  2	[0.00 s]
0.0.N: Trace Attempt  3	[0.00 s]
0.0.N: Trace Attempt  3	[0.00 s]
0.0.N: Trace Attempt  4	[0.00 s]
0.0.N: Trace Attempt  5	[0.00 s]
0.0.N: Trace Attempt  1	[0.00 s]
0.0.N: Trace Attempt  2	[0.00 s]
0.0.N: Trace Attempt  3	[0.00 s]
0.0.N: Trace Attempt  4	[0.01 s]
0.0.N: Trace Attempt  5	[0.01 s]
0.0.Oh: Proofgrid shell started at 1358@vlsi-ria84(local) jg_1226_vlsi-ria84_1
0.0.Oh: clocks: 1, declared: 1, looping: 0, posedge: 1, negedge: 0, noedge: 0, bothedge: 0
0.0.Oh: Reached length limit (2147483647) [0.00 s]
0.0.Oh: Exited with Success (@ 0.03 s)
0.0.AM: Proofgrid shell started at 1361@vlsi-ria84(local) jg_1226_vlsi-ria84_1
0.0.AM: clocks: 1, declared: 1, looping: 0, posedge: 1, negedge: 0, noedge: 0, bothedge: 0
0.0.AM: Last scan. Per property time limit: 0s
0.0.AM: Starting proof for property "BLINK.p1"	[0.00 s].
0.0.Ht: Proofgrid shell started at 1357@vlsi-ria84(local) jg_1226_vlsi-ria84_1
0.0.B: Proofgrid shell started at 1360@vlsi-ria84(local) jg_1226_vlsi-ria84_1
0.0.AM: Trace Attempt  1	[0.00 s]
0.0.AM: Trace Attempt  2	[0.00 s]
0.0.AM: Trace Attempt  3	[0.00 s]
0.0.AM: Trace Attempt  4	[0.00 s]
0.0.AM: Trace Attempt  5	[0.00 s]
0.0.AM: Trace Attempt  1	[0.00 s]
0.0.AM: Trace Attempt  2	[0.00 s]
0.0.AM: Trace Attempt  3	[0.00 s]
0.0.Ht: clocks: 1, declared: 1, looping: 0, posedge: 1, negedge: 0, noedge: 0, bothedge: 0
0.0.B: clocks: 1, declared: 1, looping: 0, posedge: 1, negedge: 0, noedge: 0, bothedge: 0
0.0.Ht: Last scan. Per property time limit: 0s
0.0.B: Last scan. Per property time limit: 0s
0.0.B: Starting proof for property "BLINK.p1"	[0.00 s].
0.0.B: Trace Attempt  1	[0.00 s]
0.0.Ht: Trace Attempt  1	[0.00 s]
0.0.B: Trace Attempt  2	[0.00 s]
0.0.Ht: Trace Attempt  2	[0.00 s]
0.0.Ht: Trace Attempt  3	[0.00 s]
0.0.B: Trace Attempt  3	[0.00 s]
0.0.Ht: Trace Attempt  4	[0.00 s]
0.0.Ht: Trace Attempt  5	[0.00 s]
0.0.B: Trace Attempt  4	[0.00 s]
0.0.B: Trace Attempt  5	[0.00 s]
0.0.AM: Trace Attempt  4	[0.01 s]
0.0.AM: Trace Attempt  5	[0.01 s]
0.0.AM: Trace Attempt  1	[0.02 s]
0.0.AM: Trace Attempt  2	[0.03 s]
0.0.AM: Trace Attempt  3	[0.03 s]
0.0.AM: Trace Attempt  4	[0.03 s]
0.0.AM: Trace Attempt  5	[0.03 s]
0.0.AM: Trace Attempt  1	[0.07 s]
0.0.AM: Trace Attempt  2	[0.07 s]
0.0.AM: Trace Attempt  3	[0.07 s]
0.0.AM: Trace Attempt  4	[0.07 s]
0.0.AM: Trace Attempt  5	[0.07 s]
0.0.AM: Trace Attempt  1	[0.17 s]
0.0.AM: Trace Attempt  2	[0.17 s]
0.0.AM: Trace Attempt  3	[0.17 s]
0.0.AM: Trace Attempt  4	[0.17 s]
0.0.AM: Trace Attempt  5	[0.17 s]
0.0.AM: Trace Attempt  1	[0.40 s]
0.0.AM: Trace Attempt  2	[0.40 s]
0.0.AM: Trace Attempt  3	[0.40 s]
0.0.AM: Trace Attempt  4	[0.41 s]
0.0.AM: Trace Attempt  5	[0.41 s]
0.0.AM: Trace Attempt  1	[0.98 s]
0.0.AM: Trace Attempt  2	[0.98 s]
0.0.AM: Trace Attempt  3	[0.99 s]
0.0.AM: Trace Attempt  4	[0.99 s]
0.0.AM: Trace Attempt  5	[0.99 s]
0.0.AM: Trace Attempt  1	[2.76 s]
0.0.AM: Trace Attempt  2	[2.76 s]
0.0.AM: Trace Attempt  3	[2.76 s]
0.0.AM: Trace Attempt  4	[2.77 s]
0.0.AM: Trace Attempt  5	[2.77 s]
0.0.Hp: Trace Attempt 502	[4.01 s]
0.0.B: Trace Attempt 1664	[4.00 s]
0.0.Ht: Trace Attempt 1493	[4.00 s]
0.0.N: Trace Attempt 118	[4.84 s]
0.0.AM: Trace Attempt 425	[6.89 s]
0.0.Hp: Trace Attempt 708	[8.03 s]
0.0.Ht: Trace Attempt 2065	[8.01 s]
0.0.B: Trace Attempt 2338	[8.01 s]
0.0.N: Trace Attempt 149	[8.91 s]
0.0.AM: Trace Attempt  1	[10.46 s]
0.0.AM: Trace Attempt  2	[10.46 s]
0.0.AM: Trace Attempt  3	[10.46 s]
0.0.AM: Trace Attempt  4	[10.46 s]
0.0.AM: Trace Attempt  5	[10.46 s]
0.0.Hp: Trace Attempt 858	[12.04 s]
0.0.Ht: Trace Attempt 2447	[12.01 s]
0.0.B: Trace Attempt 2824	[12.02 s]
0.0.N: Trace Attempt 192	[13.16 s]
0.0.AM: Trace Attempt 588	[14.48 s]
0.0.Hp: Trace Attempt 991	[16.06 s]
0.0.Ht: Trace Attempt 2822	[16.02 s]
0.0.B: Trace Attempt 3266	[16.02 s]
0.0.AM: Trace Attempt 834	[18.49 s]
0.0.N: Trace Attempt 216	[19.08 s]
0.0.Hp: Trace Attempt 1105	[20.06 s]
0.0.Ht: Trace Attempt 3144	[20.02 s]
0.0.B: Trace Attempt 3654	[20.03 s]
0.0.AM: Trace Attempt 865	[22.66 s]
0.0.Ht: Trace Attempt 3407	[24.03 s]
0.0.B: Trace Attempt 3999	[24.03 s]
0.0.Hp: Trace Attempt 1208	[24.09 s]
0.0.N: Trace Attempt 247	[24.22 s]
0.0.AM: Trace Attempt 884	[27.23 s]
0.0.Ht: Trace Attempt 3654	[28.03 s]
0.0.B: Trace Attempt 4325	[28.05 s]
0.0.Hp: Trace Attempt 1302	[28.12 s]
0.0.N: Trace Attempt 266	[28.68 s]
0.0.AM: Trace Attempt 605	[31.24 s]
0.0.Ht: Trace Attempt 3886	[32.05 s]
0.0.B: Trace Attempt 4606	[32.05 s]
0.0.Hp: Trace Attempt 1385	[32.15 s]
0.0.AM: Trace Attempt 817	[35.26 s]
0.0.B: Trace Attempt 4854	[36.06 s]
0.0.Ht: Trace Attempt 4089	[36.06 s]
0.0.Hp: Trace Attempt 1459	[36.15 s]
0.0.AM: Trace Attempt 996	[39.27 s]
0.0.B: Trace Attempt 5094	[40.07 s]
0.0.Ht: Trace Attempt 4247	[40.08 s]
0.0.Hp: Trace Attempt 1530	[40.15 s]
0.0.AM: Trace Attempt  1	[40.34 s]
0.0.AM: Trace Attempt  2	[40.34 s]
0.0.AM: Trace Attempt  3	[40.34 s]
0.0.AM: Trace Attempt  4	[40.35 s]
0.0.AM: Trace Attempt  5	[40.35 s]
0.0.N: Trace Attempt 272	[40.48 s]
0.0.B: Trace Attempt 5352	[44.07 s]
0.0.Ht: Trace Attempt 4427	[44.08 s]
0.0.Hp: Trace Attempt 1605	[44.16 s]
0.0.AM: Trace Attempt 445	[44.40 s]
0.0.N: Trace Attempt 275	[45.51 s]
0.0.B: Trace Attempt 5597	[48.08 s]
0.0.Ht: Trace Attempt 4602	[48.08 s]
0.0.Hp: Trace Attempt 1677	[48.18 s]
0.0.AM: Trace Attempt 618	[48.49 s]
0.0.N: Trace Attempt 305	[49.70 s]
0.0.Ht: Trace Attempt 4796	[52.08 s]
0.0.B: Trace Attempt 5829	[52.09 s]
0.0.Hp: Trace Attempt 1746	[52.21 s]
0.0.AM: Trace Attempt 830	[53.38 s]
0.0.N: Trace Attempt 320	[54.08 s]
0.0.Ht: Trace Attempt 4981	[56.10 s]
0.0.B: Trace Attempt 6053	[56.10 s]
0.0.Hp: Trace Attempt 1812	[56.27 s]
0.0.AM: Trace Attempt 972	[57.39 s]
0.0.Ht: Trace Attempt 5152	[60.10 s]
0.0.B: Trace Attempt 6270	[60.10 s]
0.0.Hp: Trace Attempt 1876	[60.33 s]
0.0.AM: Trace Attempt 1051	[61.44 s]
0.0.N: Trace Attempt 345	[62.12 s]
0.0.B: Trace Attempt 6479	[64.11 s]
0.0.Ht: Trace Attempt 5293	[64.12 s]
0.0.Hp: Trace Attempt 1937	[64.34 s]
0.0.AM: Trace Attempt 1096	[65.70 s]
0.0.N: Trace Attempt 364	[66.15 s]
0.0.B: Trace Attempt 6679	[68.11 s]
0.0.Ht: Trace Attempt 5433	[68.12 s]
0.0.Hp: Trace Attempt 1996	[68.38 s]
0.0.AM: Trace Attempt 1177	[69.82 s]
0.0.N: Trace Attempt 370	[72.03 s]
0.0.B: Trace Attempt 6872	[72.12 s]
0.0.Ht: Trace Attempt 5573	[72.15 s]
0.0.Hp: Trace Attempt 2053	[72.42 s]
0.0.AM: Trace Attempt 1276	[74.21 s]
0.0.B: Trace Attempt 7059	[76.14 s]
0.0.Ht: Trace Attempt 5720	[76.15 s]
0.0.Hp: Trace Attempt 2108	[76.47 s]
0.0.N: Trace Attempt 373	[76.77 s]
0.0.AM: Trace Attempt 1418	[78.39 s]
0.0.Ht: Trace Attempt 5875	[80.15 s]
0.0.B: Trace Attempt 7245	[80.16 s]
0.0.Hp: Trace Attempt 2162	[80.54 s]
0.0.AM: Trace Attempt 1561	[82.47 s]
0.0.N: Trace Attempt 376	[82.53 s]
0.0.B: Trace Attempt 7424	[84.16 s]
0.0.Ht: Trace Attempt 6026	[84.16 s]
0.0.Hp: Trace Attempt 2214	[84.57 s]
0.0.N: Trace Attempt 378	[86.55 s]
0.0.AM: Trace Attempt 1596	[86.65 s]
0.0.B: Trace Attempt 7597	[88.16 s]
0.0.Ht: Trace Attempt 6168	[88.19 s]
0.0.Hp: Trace Attempt 2265	[88.64 s]
0.0.AM: Trace Attempt 1611	[90.88 s]
0.0.B: Trace Attempt 7766	[92.16 s]
0.0.Ht: Trace Attempt 6290	[92.19 s]
0.0.Hp: Trace Attempt 2315	[92.71 s]
0.0.N: Trace Attempt 379	[93.18 s]
0.0.AM: Trace Attempt 1641	[95.06 s]
0.0.B: Trace Attempt 7931	[96.17 s]
0.0.Ht: Trace Attempt 6410	[96.21 s]
0.0.Hp: Trace Attempt 2364	[96.79 s]
0.0.N: Trace Attempt 380	[98.84 s]
0.0.AM: Trace Attempt 1659	[99.38 s]
0.0.B: Trace Attempt 8091	[100.18 s]
0.0.Ht: Trace Attempt 6528	[100.23 s]
0.0.Hp: Trace Attempt 2411	[100.81 s]
0.0.AM: Trace Attempt 1667	[103.43 s]
0.0.B: Trace Attempt 8248	[104.19 s]
0.0.Ht: Trace Attempt 6643	[104.26 s]
0.0.Hp: Trace Attempt 2457	[104.86 s]
0.0.N: Trace Attempt 384	[106.74 s]
0.0.AM: Trace Attempt 1680	[107.64 s]
0.0.B: Trace Attempt 8400	[108.19 s]
0.0.Ht: Trace Attempt 6770	[108.27 s]
0.0.Hp: Trace Attempt 2502	[108.91 s]
0.0.N: Trace Attempt 600	[110.80 s]
0.0.B: Trace Attempt 8553	[112.20 s]
0.0.AM: Trace Attempt 1688	[112.23 s]
0.0.Ht: Trace Attempt 6899	[112.27 s]
0.0.Hp: Trace Attempt 2547	[112.99 s]
0.0.B: Trace Attempt 8705	[116.22 s]
0.0.Ht: Trace Attempt 7025	[116.30 s]
0.0.AM: Trace Attempt 1698	[116.33 s]
0.0.Hp: Trace Attempt 2591	[117.05 s]
0.0.B: Trace Attempt 8855	[120.25 s]
0.0.Ht: Trace Attempt 7149	[120.31 s]
0.0.Hp: Trace Attempt 2634	[121.06 s]
0.0.AM: Trace Attempt 1708	[121.65 s]
0.0.N: Trace Attempt 631	[121.82 s]
0.0.B: Trace Attempt 9002	[124.27 s]
0.0.Ht: Trace Attempt 7256	[124.32 s]
0.0.Hp: Trace Attempt 2677	[125.12 s]
0.0.N: Trace Attempt 711	[125.82 s]
0.0.AM: Trace Attempt 1716	[126.69 s]
0.0.B: Trace Attempt 9145	[128.27 s]
0.0.Ht: Trace Attempt 7359	[128.32 s]
0.0.Hp: Trace Attempt 2719	[129.18 s]
0.0.AM: Trace Attempt 1725	[131.17 s]
0.0.B: Trace Attempt 9285	[132.28 s]
0.0.Ht: Trace Attempt 7460	[132.32 s]
0.0.Hp: Trace Attempt 2760	[133.21 s]
0.0.N: Trace Attempt 1033	[134.33 s]
0.0.AM: Trace Attempt 1738	[135.22 s]
0.0.B: Trace Attempt 9423	[136.28 s]
0.0.Ht: Trace Attempt 7561	[136.34 s]
0.0.Hp: Trace Attempt 2800	[137.22 s]
0.0.N: Trace Attempt 1093	[138.37 s]
0.0.AM: Trace Attempt 1741	[139.29 s]
0.0.B: Trace Attempt 9558	[140.30 s]
0.0.Ht: Trace Attempt 7660	[140.36 s]
0.0.Hp: Trace Attempt 2840	[141.30 s]
0.0.B: Trace Attempt 9690	[144.30 s]
0.0.Ht: Trace Attempt 7770	[144.39 s]
0.0.N: Trace Attempt 1114	[144.48 s]
0.0.AM: Trace Attempt 1746	[145.11 s]
0.0.Hp: Trace Attempt 2879	[145.35 s]
0.0.B: Trace Attempt 9820	[148.33 s]
0.0.Ht: Trace Attempt 7882	[148.41 s]
0.0.Hp: Trace Attempt 2918	[149.43 s]
0.0.AM: Trace Attempt 1754	[149.65 s]
0.0.N: Trace Attempt 1123	[150.57 s]
0.0.B: Trace Attempt 9947	[152.33 s]
0.0.Ht: Trace Attempt 7991	[152.41 s]
0.0.Hp: Trace Attempt 2956	[153.50 s]
0.0.AM: Trace Attempt 1759	[154.04 s]
0.0.N: Trace Attempt 1124	[155.39 s]
0.0.B: Trace Attempt 10070	[156.35 s]
0.0.Ht: Trace Attempt 8098	[156.44 s]
0.0.Hp: Trace Attempt 2993	[157.57 s]
0.0.AM: Trace Attempt 1767	[158.86 s]
0.0.N: Trace Attempt 1128	[160.02 s]
0.0.B: Trace Attempt 10190	[160.35 s]
0.0.Ht: Trace Attempt 8200	[160.47 s]
0.0.Hp: Trace Attempt 3029	[161.57 s]
0.0.B: Trace Attempt 10314	[164.36 s]
0.0.N: Trace Attempt 1308	[164.52 s]
0.0.Ht: Trace Attempt 8291	[164.50 s]
0.0.AM: Trace Attempt 1776	[165.39 s]
0.0.Hp: Trace Attempt 3066	[165.63 s]
0.0.B: Trace Attempt 10438	[168.37 s]
0.0.Ht: Trace Attempt 8382	[168.52 s]
0.0.N: Trace Attempt 1372	[168.80 s]
0.0.AM: Trace Attempt 1783	[169.42 s]
0.0.Hp: Trace Attempt 3102	[169.69 s]
0.0.B: Trace Attempt 10560	[172.37 s]
0.0.Ht: Trace Attempt 8472	[172.53 s]
0.0.N: Trace Attempt 1401	[173.08 s]
0.0.AM: Trace Attempt 1786	[173.53 s]
0.0.Hp: Trace Attempt 3137	[173.72 s]
0.0.B: Trace Attempt 10671	[176.41 s]
0.0.Ht: Trace Attempt 8557	[176.55 s]
0.0.N: Trace Attempt 1415	[177.20 s]
0.0.AM: Trace Attempt 1099	[177.53 s]
0.0.Hp: Trace Attempt 3168	[177.74 s]
0.0.B: Trace Attempt 10775	[180.41 s]
0.0.Ht: Trace Attempt 8639	[180.56 s]
0.0.Tri: Proofgrid shell started at 1969@vlsi-ria84(local) jg_1226_vlsi-ria84_1
0.0.Tri: clocks: 1, declared: 1, looping: 0, posedge: 1, negedge: 0, noedge: 0, bothedge: 0
0.0.Tri: Last scan. Per property time limit: 0s
0.0.Tri: Starting proof for property "BLINK.p1"	[0.00 s].
0.0.Tri: Trace Attempt  1	[0.00 s]
0.0.Tri:    0.00" ---- Launching main thread ----
0.0.Tri:    0.02" ---- Launching abstraction thread ----
0.0.Tri:    0.03" ---- Launching multi-phase simplification thread ----
0.0.Tri:    0.05" ---- Launching liveness simplification thread ----
0.0.B: Trace Attempt 10788	[180.91 s]
0.0.B: Stopped processing property "BLINK.p1"	[181.10 s].
0.0.B: Morphing to Bcustom2
0.0.B: All properties determined. [0.00 s]
0.0.B: Exited with Success (@ 0.00 s)
0.0.Bcustom2: clocks: 1, declared: 1, looping: 0, posedge: 1, negedge: 0, noedge: 0, bothedge: 0
0.0.Bcustom2: Starting proof for property "BLINK.p1"	[0.00 s].
0.0.Bcustom2: Trace Attempt  1	[0.00 s]
0.0.Bcustom2: Trace Attempt  2	[0.00 s]
0.0.Bcustom2: Trace Attempt  1	[0.00 s]
0.0.Bcustom2: Trace Attempt  2	[0.00 s]
0.0.Bcustom2: Trace Attempt  3	[0.00 s]
0.0.Bcustom2: Trace Attempt  4	[0.00 s]
0.0.Bcustom2: Trace Attempt  5	[0.00 s]
0.0.N: Trace Attempt 1429	[179.68 s]
0.0.N: Stopped processing property "BLINK.p1"	[181.30 s].
0.0.N: Morphing to Ncustom1
0.0.N: All properties determined. [0.00 s]
0.0.N: Exited with Success (@ 0.00 s)
0.0.Ncustom1: clocks: 1, declared: 1, looping: 0, posedge: 1, negedge: 0, noedge: 0, bothedge: 0
0.0.Ncustom1: Starting proof for property "BLINK.p1"	[0.00 s].
0.0.Ncustom1: Trace Attempt  3	[0.00 s]
0.0.Ncustom1: Trace Attempt  4	[0.00 s]
0.0.Ncustom1: Trace Attempt  5	[0.00 s]
0.0.Ncustom1: Trace Attempt  1	[0.00 s]
0.0.Ncustom1: Trace Attempt  2	[0.00 s]
0.0.Ncustom1: Trace Attempt  3	[0.00 s]
0.0.Ncustom1: Trace Attempt  4	[0.01 s]
0.0.Ncustom1: Trace Attempt  5	[0.01 s]
0.0.AM: Trace Attempt 1209	[181.49 s]
0.0.AM: Stopped processing property "BLINK.p1"	[181.60 s].
0.0.AM: Morphing to AMcustom3
0.0.AM: All properties determined. [0.00 s]
0.0.AM: Exited with Success (@ 0.00 s)
0.0.AMcustom3: clocks: 1, declared: 1, looping: 0, posedge: 1, negedge: 0, noedge: 0, bothedge: 0
0.0.AMcustom3: Starting proof for property "BLINK.p1"	[0.00 s].
0.0.AMcustom3: Trace Attempt  1	[0.00 s]
0.0.AMcustom3: Trace Attempt  2	[0.00 s]
0.0.AMcustom3: Trace Attempt  3	[0.00 s]
0.0.AMcustom3: Trace Attempt  4	[0.00 s]
0.0.AMcustom3: Trace Attempt  5	[0.00 s]
0.0.AMcustom3: Trace Attempt  1	[0.00 s]
0.0.AMcustom3: Trace Attempt  2	[0.00 s]
0.0.AMcustom3: Trace Attempt  3	[0.00 s]
0.0.AMcustom3: Trace Attempt  4	[0.01 s]
0.0.AMcustom3: Trace Attempt  5	[0.01 s]
0.0.AMcustom3: Trace Attempt  1	[0.03 s]
0.0.AMcustom3: Trace Attempt  2	[0.03 s]
0.0.AMcustom3: Trace Attempt  3	[0.03 s]
0.0.AMcustom3: Trace Attempt  4	[0.03 s]
0.0.AMcustom3: Trace Attempt  5	[0.04 s]
0.0.AMcustom3: Trace Attempt  1	[0.08 s]
0.0.AMcustom3: Trace Attempt  2	[0.08 s]
0.0.AMcustom3: Trace Attempt  3	[0.08 s]
0.0.AMcustom3: Trace Attempt  4	[0.08 s]
0.0.AMcustom3: Trace Attempt  5	[0.08 s]
0.0.Hp: Trace Attempt 3199	[181.79 s]
0.0.AMcustom3: Trace Attempt  1	[0.17 s]
0.0.AMcustom3: Trace Attempt  2	[0.17 s]
0.0.AMcustom3: Trace Attempt  3	[0.17 s]
0.0.AMcustom3: Trace Attempt  4	[0.17 s]
0.0.AMcustom3: Trace Attempt  5	[0.18 s]
0.0.Tri:    0.90" Simplification phase 1 complete
0.0.AMcustom3: Trace Attempt  1	[0.38 s]
0.0.AMcustom3: Trace Attempt  2	[0.38 s]
0.0.AMcustom3: Trace Attempt  3	[0.38 s]
0.0.AMcustom3: Trace Attempt  4	[0.39 s]
0.0.AMcustom3: Trace Attempt  5	[0.39 s]
0.0.AMcustom3: Stopped processing property "BLINK.p1"	[0.39 s].
0.0.AMcustom3: Morphing to M
0.0.AMcustom3: All properties determined. [0.00 s]
0.0.AMcustom3: Exited with Success (@ 0.00 s)
0.0.M: clocks: 1, declared: 1, looping: 0, posedge: 1, negedge: 0, noedge: 0, bothedge: 0
0.0.M: Starting proof for property "BLINK.p1"	[0.00 s].
0.0.M: Trace Attempt  1	[0.00 s]
0.0.M: Trace Attempt  2	[0.00 s]
0.0.M: Trace Attempt  3	[0.00 s]
0.0.Bcustom2: Trace Attempt 1475	[0.88 s]
0.0.Bcustom2: Stopped processing property "BLINK.p1"	[0.89 s].
0.0.Bcustom2: Morphing to D
0.0.Bcustom2: All properties determined. [0.00 s]
0.0.Bcustom2: Exited with Success (@ 0.00 s)
0.0.D: clocks: 1, declared: 1, looping: 0, posedge: 1, negedge: 0, noedge: 0, bothedge: 0
0.0.D: Starting proof for property "BLINK.p1"	[0.00 s].
0.0.D: Trace Attempt  1	[0.00 s]
0.0.D: Trace Attempt  2	[0.00 s]
0.0.M: Trace Attempt  4	[0.01 s]
0.0.D: Trace Attempt  4	[0.00 s]
0.0.M: Trace Attempt  5	[0.01 s]
0.0.D: Trace Attempt  5	[0.00 s]
0.0.Ncustom1: Requesting engine job to terminate
0.0.D: Requesting engine job to terminate
0.0.M: Requesting engine job to terminate
0.0.Hp: Requesting engine job to terminate
0.0.Ht: Requesting engine job to terminate
INFO (IPF144): 0: Initiating shutdown of proof [182.05 s]
0.0.Tri: A proof was found: No trace exists. [1.00 s]
INFO (IPF057): 0.0.Tri: The property "BLINK.p1" was proven in 1.00 s.
0.0.Ncustom1: Trace Attempt 77	[0.65 s]
0.0.Ncustom1: Stopped processing property "BLINK.p1"	[0.74 s].
0.0.Ncustom1: All properties determined. [0.75 s]
0.0.D: Trace Attempt  8	[0.01 s]
0.0.D: Stopped processing property "BLINK.p1"	[0.02 s].
0.0.D: All properties determined. [0.01 s]
0.0.M: Trace Attempt  7	[0.01 s]
0.0.M: Stopped processing property "BLINK.p1"	[0.02 s].
0.0.M: All properties determined. [0.01 s]
0.0.Tri: Stopped processing property "BLINK.p1"	[1.00 s].
0.0.Tri: Morphing to AMcustom5
0.0.Tri: Preventing job from starting because proof is shutting down.
0.0.Tri: Requesting engine job to terminate
0.0.Tri: Interrupted. [0.00 s]
0.0.Tri: Exited with Success (@ 182.06 s)
0: ProofGrid usable level: 0
0.0.Hp: Trace Attempt 3201	[182.04 s]
0.0.Hp: All properties determined. [182.06 s]
0.0.Ht: Trace Attempt 8668	[181.98 s]
0.0.Ht: All properties determined. [182.01 s]
0.0.M: Exited with Success (@ 182.07 s)
0.0.Ncustom1: Exited with Success (@ 182.07 s)
0.0.D: Exited with Success (@ 182.07 s)
0.0.Ht: Exited with Success (@ 182.16 s)
0.0.Hp: Exited with Success (@ 182.27 s)
0: --------------------------------------------------------------
ProofGrid Summary (utilization 99.97 %)
--------------------------------------------------------------
     engines started                               :    13
     engine jobs started                           :     7

    Average time in state (seconds)
    ------------------------------------------------------
    Engine  Pending     Running        Dead    Utilization
    ------------------------------------------------------
     Hp        0.03      182.05        0.00       99.98 %
     Ht        0.04      182.01        0.00       99.98 %
     Oh        0.03        0.00        0.00        0.75 %
    Ncustom1        0.03      181.73        0.00       99.98 %
      D        0.04      181.84        0.00       99.98 %
      M        0.04      181.36        0.00       99.98 %
    AMcustom5        0.05        0.98        0.00       94.93 %
    all        0.04      130.00        0.00       99.97 %

    Total time in state (seconds)
    -----------------------------------------
            Pending     Running        Dead  
    -----------------------------------------
               0.27      909.98        0.00

    Data read    : 5.46 MiB
    Data written : 5.70 kiB

0: All pending notifications were processed.
INFO (IPF059): 0: Completed proof on task: "<embedded>"

==============================================================
SUMMARY
==============================================================
           Properties Considered              : 1
                 assertions                   : 1
                  - proven                    : 1 (100%)
                  - bounded_proven (user)     : 0 (0%)
                  - bounded_proven (auto)     : 0 (0%)
                  - marked_proven             : 0 (0%)
                  - cex                       : 0 (0%)
                  - ar_cex                    : 0 (0%)
                  - undetermined              : 0 (0%)
                  - unknown                   : 0 (0%)
                  - error                     : 0 (0%)
                 covers                       : 0
                  - unreachable               : 0
                  - bounded_unreachable (user): 0
                  - covered                   : 0
                  - ar_covered                : 0
                  - undetermined              : 0
                  - unknown                   : 0
                  - error                     : 0
proven
[<embedded>] % exit -force
[<embedded>] % INFO (IPL005): Received request to exit from the console.
INFO: Waiting for proof threads to stop...
INFO: Proof threads stopped.
INFO (IPL018): The peak resident set memory use for this session was 2.786 GB.
INFO (IPL014): Waiting for the Tcl-thread to exit.
INFO (IPL015): The Tcl-thread exited with status 0.
INFO (IPL016): Exiting the analysis session with status 0.
Finished blink_21.tcl successfully
