Jasper Apps 2024.06p002 64 bits 2024.09.02 16:28:38 UTC

Any disclosure about the Cadence Design Systems software or its use
model to any third party violates the written Non-Disclosure Agreement
between Cadence Design Systems, Inc. and the customer.

THIS SOFTWARE CONTAINS CONFIDENTIAL INFORMATION AND TRADE SECRETS OF
CADENCE DESIGN SYSTEMS, INC. USE, DISCLOSURE, OR REPRODUCTION IS
PROHIBITED WITHOUT THE PRIOR EXPRESS WRITTEN PERMISSION OF CADENCE
DESIGN SYSTEMS, INC.

Copyright (C) 2000-2024 Cadence Design Systems, Inc. All Rights
Reserved.  Unpublished -- rights reserved under the copyright laws of
the United States.

This product includes software developed by others and redistributed
according to license agreement. See doc/third_party_readme.txt for
further details.

RESTRICTED RIGHTS LEGEND

Use, duplication, or disclosure by the Government is subject to
restrictions as set forth in subparagraph (c) (1) (ii) of the Rights in
Technical Data and Computer Software clause at DFARS 252.227-7013 or
subparagraphs (c) (1) and (2) of Commercial Computer Software -- Restricted
Rights at 48 CFR 52.227-19, as applicable.


                          Cadence Design Systems, Inc.
                          2655 Seely Avenue
                          San Jose, CA 95134
                          Phone: 408.943.1234

For technical assistance visit http://support.cadence.com.

Jasper Apps Analysis Session - /users/rompel/jasper_executions/safety_liveness/jgprojects/delay_12/sessionLogs/session_0

WARNING (WG017): [session]: The system's locale is "ANSI_X3.4-1968", which is not UTF-8. Non-ASCII characters might not be handled correctly.
WARNING (WG017): [jg_console]: The system's locale is "ANSI_X3.4-1968", which is not UTF-8. Non-ASCII characters might not be handled correctly.
INFO: successfully checked out license "jasper_fao".
INFO: reading configuration file "/users/rompel/.config/cadence/jasper.conf".
% analyze -sv09 ../delay_12.sv
[-- (VERI-1482)] Analyzing Verilog file '/tools/cadence2425/JASPER/jasper_2024.06p002/lib/verilog/packages/std/std.sv' into library 'std'
[-- (VERI-1482)] Analyzing Verilog file '../delay_12.sv'
% elaborate -bbox_mul 1000000 -bbox_div 1000000 -bbox_mod 1000000 -bbox_a 1000000
[INFO (HIER-8002)] ../delay_12.sv(13): Disabling old hierarchical reference handler
[INFO (VERI-1018)] ../delay_12.sv(1): compiling module 'DELAY'
[WARN (VERI-1209)] ../delay_12.sv(10): expression size 32 truncated to fit in target size 15
INFO (ISW003): Top module name is "DELAY".
INFO (INL208): Elaboration synthesis summary:
  Number of synthesized netlists          1 (0 packages)
  Single run mode                         On
  Pipeline                                On (1 pipelined netlists)
  Late hierarchical reference connection  On
  Number of analyzed Verilog modules      1 (1 synthesized)
  Number of analyzed VHDL entities        0 (0 synthesized)
INFO (INL003): Clearing all state information (assumes, stopats, and so forth).
DELAY
[<embedded>] % reset rst
INFO (IPM031): Clearing proof results of all properties.
INFO (IRS006): Current reset condition is "rst".
[<embedded>] % clock clk
[<embedded>] % prove -all
Ncustom1: Custom engine code is hT3Ng7hPPfiYQOTDZ3qhYOwGAM51eA+J/FjkM5shLioAsqhgLR4Ft+O1BuKG6ilQ83B9tLXSl+CwjiTMAQA
Bcustom2: Custom engine code is hT3Nm7hPr1Vp3Di1Ra2USNIGL4JypRnLKLAdF6JAyuavO2JfGCiY9OZJhcAcOUnLx5xwNdhILGrAWX9s+z2WDkKwNR7tAfClBEjRFVQeq6DU54boFgEA
AMcustom3: Custom engine code is hT3Ng7hP/feYQOTDZ3qhYOwGAM51eA+J/FjkM5shLioAsqhgLR4Ft+O1BuKG6ilQ83B9tLXSmmqwm7g9AQA
Mpcustom4: Custom engine code is hT3NZbhP9fmY2AbBQnsjfOxn6c+6e6yL+/e8fZFmaQrnlgEA
INFO (IPF036): Starting proof on task: "<embedded>", 2 properties to prove with 0 already proven/unreachable
INFO (IRS029): Starting reset analysis: phase 1 of 4.
INFO (IRS030): Running reset analysis: phase 2 of 4.
INFO (IRS031): Running reset analysis: phase 3 of 4.
INFO (IRS020): Starting the reset analysis simulation with a limit of 100 iterations (phase 4 of 4).
INFO (IRS024): Reset iterations 0 to 4 analyzed.
INFO (IRS018): Reset analysis simulation executed for 3 iterations. Assigned values for 15 of 15 design flops, 0 of 0 design latches, 6 of 6 internal elements.
INFO (IRS039): Reset analysis complete.
INFO (IPF031): Settings used for proof thread 0:
    orchestration                 = on
    time_limit                    = 86400s
    per_property_time_limit       = 1s * 10 ^ scan
    engine_mode                   = auto
    proofgrid_per_engine_max_jobs = 1
    max engine jobs               = auto
    proofgrid_mode                = local
    proofgrid_restarts            = 10
0: Using multistage preprocessing
AMcustom5: Custom engine code is hT3N1rhP11/52HrFRS21ROp2LOjVTgPvT8L8BGXHgLhaIuqtT4nARFjUqrBL+7pLmaTOzBepZW/Jm8SSrHDybSQtoNiO3y43wk+dEoWlsZizu97Fih6O6lPVG/LpWP5SsUPwlGagLNa1FKEFvwVXyX7//8prySbvSxIHXr5er+z4RAEA
0: Starting reduce
Ncustom6: Custom engine code is hT3OXrhPByJp3TrFSTLhUmMH4KVtJgmTCnNDF46yMXOKY48m4LS5nE7yBzFjA7kDuwO/GhGUpEPiky3p3wmPn3dJZHxFMsafSoObRzSC+tn7sEY0WbTdZ/FV4hL3MYH/b1CIUvXSWR4wqEoVLsmMOD4xIPT4lI1LO6ZCO7PnnWQuLwetnvKlrXx6wCW/A+x+enqslg1YPobi4wEF/EvbzOvcTYdJvl2s4H2yZg2b2ofAVN5WvhWk1HoBAA
ADcustom7: Custom engine code is hT3Nv7hPv1752HrFRa2kROx2f/ECJeZB2AZsLdlO8VwmIuqtT4nIDFXclhg+O+o+DMmQCekbheGk0kK28laA9gaOFDXsQp29J3X615HY1IPHJWd6FUFvCHjO+p1k652b5JJvZlShNpGlGSXAiQe/mEAj6tEBAA
Tricustom8: Custom engine code is hT3Nu7hPt1752DvFRa0kNDiyIV97VyejwM9C/jCLJjdPvusZONHY42VYUy0Q1ZotnhcVtNc56tJ5wbxv6V2+XpdsaSlHck5vfnbYjdwj1OECy9U+7oSQ0SZE3g5ayD+Phuh4odCJTjeKa2k4elM9ldQfkAEA
Gcustom9: Custom engine code is hT3NibhPDfeYQADBZnYcglOvK9Pfd7EOeniIqP8jNsyIqInncipMGcUXqAadachREE9F2PwhBUZUNw5kHnd4JdXkamORRgEA
C2custom10: Custom engine code is hT3NirhPjfWYQADBZnYcglOvK9Pfd7EOeniIqP8jNsyIqInncgkrYMMXCYbdK0dUjZIF9d4cJ0rHoBDjwVLBKuG86XYVV00BAA
AGcustom11: Custom engine code is hT3NirhP/fmYQADBZnYcglOvK9Pfd7EOeniIqP8jNsyIqInnckcwYMMXCYbdK0dUjZIF9d4cJ0rHoBDjwVLBKuHEZnZByh0BAA
Bcustom12: Custom engine code is hT3NjrhPDfiYQADBZnYcglOvK9PfWxFtenjIyBqfrgr7if/jL/yPOuK1BAflEcW0DxNH2eDIoezN2gxlQFg81RZtiWXh7aiTAidvAQA
0: Finished reduce in 0s
Ncustom13: Custom engine code is hT3NR7hPByFp3TrFSTLhUmMH4KWtJglTyV/c51BHEeZWamnJv767nE6PCak26bd3gf3XGN3rIRheufhDieCJQVISo+gNYUKhiUedBKGtsP/a18svAnlMJZudHxDFwK5ufsyoxsIyiAeSY2oi3tEuoDHr5gw42DFKAG3PqO3CEsl8Azzdt3pl5nGA1Ifv2H02eYsFzWb/nfp8PMb3F0krE/EgBcm8TD9Div8BAA
Tricustom14: Custom engine code is hT3Nu7hP3fiYQADBZnYcglNHp9bfd7EOeniIqP/ji8sGLQu8yhsFO+wxJ+O+R0bU8g/IewXFomyos+viQnWc2xYNYmMqpo3i40O7DaZR7qfp4YqNx26KRvQ/qx0BAA
0.0.PRE: Performing Proof Simplification...
0.0.N: clocks: 1, declared: 1, looping: 0, posedge: 1, negedge: 0, noedge: 0, bothedge: 0
0.0.N: Proof Simplification Iteration 1	[0.00 s]
0.0.PRE: A trace with 1 cycles was found. [0.00 s]
INFO (IPF047): 0.0.PRE: The cover property "DELAY.p1:precondition1" was covered in 1 cycles in 0.00 s.
0.0.N: Proof Simplification Iteration 2	[0.06 s]
0.0.PRE: A proof was found: No trace exists. [0.00 s]
INFO (IPF057): 0.0.PRE: The property ":noDeadEnd" was proven in 0.00 s.
    Use check_assumptions -show -dead_end to show this property in the property table.
0.0.PRE: A proof was found: No trace exists. [0.00 s]
INFO (IPF057): 0.0.PRE: The property ":noConflict" was proven in 0.00 s.
    Use check_assumptions -show to show this property in the property table.
INFO (IPF047): 0.0.PRE: The cover property ":live" was covered in 1 cycles in 0.00 s.
    Use check_assumptions -show -live to show this property in the property table.
0.0.PRE: Proof Simplification completed in 0.06 s
0: About to start ProofGrid in its own thread with a limit of 10000 pending notifications and a limit of 10 traces.
0: =============================== ProofGrid start ===============================
0: ProofGrid usable level: 1
0: Initial ProofGrid level: 1
0: ProofGrid is starting event handling
0.0.Hp: Proofgrid shell started at 10152@vlsi-ria84(local) jg_10081_vlsi-ria84_1
0.0.N: Proofgrid shell started at 10151@vlsi-ria84(local) jg_10081_vlsi-ria84_1
0.0.N: clocks: 1, declared: 1, looping: 0, posedge: 1, negedge: 0, noedge: 0, bothedge: 0
0.0.Hp: clocks: 1, declared: 1, looping: 0, posedge: 1, negedge: 0, noedge: 0, bothedge: 0
0.0.Hp: Last scan. Per property time limit: 0s
0.0.Hp: Trace Attempt  1	[0.00 s]
0.0.Hp: Trace Attempt  2	[0.00 s]
0.0.Hp: Trace Attempt  3	[0.00 s]
0.0.Hp: Trace Attempt  4	[0.00 s]
0.0.Hp: Trace Attempt  5	[0.00 s]
0.0.N: Last scan. Per property time limit: 0s
0.0.N: Starting proof for property "DELAY.p1"	[0.00 s].
0.0.N: Trace Attempt  1	[0.00 s]
0.0.N: Trace Attempt  2	[0.00 s]
0.0.N: Trace Attempt  2	[0.00 s]
0.0.N: Trace Attempt  3	[0.00 s]
0.0.N: Trace Attempt  4	[0.00 s]
0.0.N: Trace Attempt  4	[0.00 s]
0.0.N: Trace Attempt  5	[0.00 s]
0.0.N: Trace Attempt  1	[0.01 s]
0.0.N: Trace Attempt  2	[0.01 s]
0.0.N: Trace Attempt  3	[0.01 s]
0.0.N: Trace Attempt  4	[0.01 s]
0.0.N: Trace Attempt  5	[0.01 s]
0.0.Ht: Proofgrid shell started at 10184@vlsi-ria84(local) jg_10081_vlsi-ria84_1
0.0.Mpcustom4: Proofgrid shell started at 10186@vlsi-ria84(local) jg_10081_vlsi-ria84_1
0.0.Ht: clocks: 1, declared: 1, looping: 0, posedge: 1, negedge: 0, noedge: 0, bothedge: 0
0.0.Ht: Last scan. Per property time limit: 0s
0.0.Ht: Trace Attempt  1	[0.00 s]
0.0.Ht: Trace Attempt  2	[0.00 s]
0.0.Ht: Trace Attempt  3	[0.00 s]
0.0.Ht: Trace Attempt  4	[0.00 s]
0.0.Ht: Trace Attempt  5	[0.00 s]
0.0.Mpcustom4: clocks: 1, declared: 1, looping: 0, posedge: 1, negedge: 0, noedge: 0, bothedge: 0
0.0.Mpcustom4: Ignoring liveness properties
0.0.Mpcustom4: All properties either determined or skipped. [0.00 s]
0.0.Mpcustom4: Exited with Success (@ 0.03 s)
0.0.Mpcustom4: Completed, Restart ignored.
0.0.Oh: Proofgrid shell started at 10187@vlsi-ria84(local) jg_10081_vlsi-ria84_1
0.0.Oh: clocks: 1, declared: 1, looping: 0, posedge: 1, negedge: 0, noedge: 0, bothedge: 0
0.0.Oh: Reached length limit (2147483647) [0.00 s]
0.0.Oh: Exited with Success (@ 0.05 s)
0.0.Oh: Completed, Restart ignored.
0.0.B: Proofgrid shell started at 10240@vlsi-ria84(local) jg_10081_vlsi-ria84_1
0.0.L: Proofgrid shell started at 10222@vlsi-ria84(local) jg_10081_vlsi-ria84_1
0.0.B: clocks: 1, declared: 1, looping: 0, posedge: 1, negedge: 0, noedge: 0, bothedge: 0
0.0.B: Last scan. Per property time limit: 0s
0.0.B: Starting proof for property "DELAY.p1"	[0.00 s].
0.0.B: Trace Attempt  1	[0.00 s]
0.0.B: Trace Attempt  2	[0.00 s]
0.0.B: Trace Attempt  3	[0.00 s]
0.0.B: Trace Attempt  4	[0.00 s]
0.0.B: Trace Attempt  5	[0.00 s]
0.0.AM: Proofgrid shell started at 10248@vlsi-ria84(local) jg_10081_vlsi-ria84_1
0.0.L: clocks: 1, declared: 1, looping: 0, posedge: 1, negedge: 0, noedge: 0, bothedge: 0
0.0.L: Using trace diversification with seed 1 (0.05)
0.0.L: Using LRU state removal heuristic
0.0.L: Ignoring liveness properties
0.0.L: All properties either determined or skipped. [0.00 s]
0.0.L: Exited with Success (@ 0.08 s)
0.0.L: Completed, Restart ignored.
0.0.AM: clocks: 1, declared: 1, looping: 0, posedge: 1, negedge: 0, noedge: 0, bothedge: 0
0.0.AM: Last scan. Per property time limit: 0s
0.0.AM: Starting proof for property "DELAY.p1"	[0.00 s].
0.0.AM: Trace Attempt  1	[0.00 s]
0.0.AM: Trace Attempt  2	[0.00 s]
0.0.AM: Trace Attempt  3	[0.00 s]
0.0.AM: Trace Attempt  4	[0.00 s]
0.0.Bm: Proofgrid shell started at 10185@vlsi-ria84(local) jg_10081_vlsi-ria84_1
0.0.AM: Trace Attempt  5	[0.00 s]
0.0.AM: Trace Attempt  1	[0.00 s]
0.0.AM: Trace Attempt  2	[0.00 s]
0.0.AM: Trace Attempt  3	[0.00 s]
0.0.AM: Trace Attempt  4	[0.00 s]
0.0.AM: Trace Attempt  5	[0.00 s]
0.0.Bm: clocks: 1, declared: 1, looping: 0, posedge: 1, negedge: 0, noedge: 0, bothedge: 0
0.0.Bm: Ignoring liveness properties
0.0.Bm: Last scan. Per property time limit: 0s
0.0.Bm: Trace Attempt  1	[0.00 s]
0.0.Bm: Trace Attempt  2	[0.00 s]
0.0.Bm: Trace Attempt  3	[0.00 s]
0.0.Bm: Trace Attempt  4	[0.00 s]
0.0.Bm: Trace Attempt  5	[0.00 s]
0.0.AM: Trace Attempt  1	[0.01 s]
0.0.AM: Trace Attempt  2	[0.01 s]
0.0.AM: Trace Attempt  3	[0.01 s]
0.0.AM: Trace Attempt  4	[0.01 s]
0.0.AM: Trace Attempt  5	[0.01 s]
0.0.N: Trace Attempt  1	[0.11 s]
0.0.N: Trace Attempt  2	[0.11 s]
0.0.N: Trace Attempt  3	[0.11 s]
0.0.N: Trace Attempt  4	[0.11 s]
0.0.AM: Trace Attempt  1	[0.03 s]
0.0.N: Trace Attempt  5	[0.11 s]
0.0.AM: Trace Attempt  2	[0.03 s]
0.0.AM: Trace Attempt  3	[0.03 s]
0.0.AM: Trace Attempt  4	[0.03 s]
0.0.AM: Trace Attempt  5	[0.04 s]
0.0.AM: Trace Attempt  1	[0.12 s]
0.0.AM: Trace Attempt  2	[0.12 s]
0.0.AM: Trace Attempt  3	[0.12 s]
0.0.AM: Trace Attempt  4	[0.12 s]
0.0.AM: Trace Attempt  5	[0.12 s]
0.0.N: Trace Attempt  1	[0.47 s]
0.0.N: Trace Attempt  2	[0.47 s]
0.0.N: Trace Attempt  3	[0.47 s]
0.0.N: Trace Attempt  4	[0.47 s]
0.0.N: Trace Attempt  5	[0.47 s]
0.0.AM: Trace Attempt  1	[0.44 s]
0.0.AM: Trace Attempt  2	[0.44 s]
0.0.AM: Trace Attempt  3	[0.44 s]
0.0.AM: Trace Attempt  4	[0.44 s]
0.0.AM: Trace Attempt  5	[0.44 s]
0.0.N: Trace Attempt  1	[1.79 s]
0.0.N: Trace Attempt  2	[1.80 s]
0.0.N: Trace Attempt  3	[1.80 s]
0.0.N: Trace Attempt  4	[1.80 s]
0.0.N: Trace Attempt  5	[1.80 s]
0.0.AM: Trace Attempt  1	[1.83 s]
0.0.AM: Trace Attempt  2	[1.83 s]
0.0.AM: Trace Attempt  3	[1.83 s]
0.0.AM: Trace Attempt  4	[1.84 s]
0.0.AM: Trace Attempt  5	[1.84 s]
0.0.N: Trace Attempt  1	[3.20 s]
0.0.N: Trace Attempt  2	[3.20 s]
0.0.N: Trace Attempt  3	[3.20 s]
0.0.N: Trace Attempt  4	[3.21 s]
0.0.N: Trace Attempt  5	[3.21 s]
0.0.Hp: Trace Attempt 603	[4.00 s]
0.0.Ht: Trace Attempt 1819	[4.00 s]
0.0.B: Trace Attempt 1697	[4.00 s]
0.0.Bm: Trace Attempt 1684	[4.00 s]
0.0.AM: Trace Attempt 198	[5.85 s]
0.0.N: Trace Attempt 204	[7.23 s]
0.0.AM: Trace Attempt  1	[7.92 s]
0.0.AM: Trace Attempt  2	[7.92 s]
0.0.AM: Trace Attempt  3	[7.92 s]
0.0.AM: Trace Attempt  4	[7.92 s]
0.0.AM: Trace Attempt  5	[7.92 s]
0.0.Hp: Trace Attempt 842	[8.01 s]
0.0.Ht: Trace Attempt 2473	[8.01 s]
0.0.B: Trace Attempt 2344	[8.00 s]
0.0.Bm: Trace Attempt 2329	[8.01 s]
0.0.N: Trace Attempt  1	[8.26 s]
0.0.N: Trace Attempt  2	[8.26 s]
0.0.N: Trace Attempt  3	[8.26 s]
0.0.N: Trace Attempt  4	[8.26 s]
0.0.N: Trace Attempt  5	[8.26 s]
0.0.Hp: Trace Attempt 1029	[12.01 s]
0.0.Ht: Trace Attempt 2982	[12.01 s]
0.0.AM: Trace Attempt 192	[11.98 s]
0.0.B: Trace Attempt 2849	[12.00 s]
0.0.Bm: Trace Attempt 2839	[12.01 s]
0.0.N: Trace Attempt 199	[12.29 s]
0.0.N: Trace Attempt  1	[13.47 s]
0.0.N: Trace Attempt  2	[13.47 s]
0.0.N: Trace Attempt  3	[13.47 s]
0.0.N: Trace Attempt  4	[13.48 s]
0.0.N: Trace Attempt  5	[13.48 s]
0.0.Hp: Trace Attempt 1185	[16.03 s]
0.0.Ht: Trace Attempt 3408	[16.01 s]
0.0.B: Trace Attempt 3269	[16.00 s]
0.0.Bm: Trace Attempt 3259	[16.02 s]
0.0.AM: Trace Attempt 227	[16.03 s]
0.0.N: Trace Attempt 197	[17.50 s]
0.0.N: Trace Attempt  1	[18.76 s]
0.0.N: Trace Attempt  2	[18.76 s]
0.0.N: Trace Attempt  3	[18.76 s]
0.0.N: Trace Attempt  4	[18.77 s]
0.0.N: Trace Attempt  5	[18.77 s]
0.0.Hp: Trace Attempt 1321	[20.03 s]
0.0.Ht: Trace Attempt 3786	[20.01 s]
0.0.B: Trace Attempt 3628	[20.01 s]
0.0.Bm: Trace Attempt 3618	[20.03 s]
0.0.AM: Trace Attempt 250	[20.07 s]
0.0.N: Trace Attempt 196	[22.77 s]
0.0.Hp: Trace Attempt 1445	[24.04 s]
0.0.Ht: Trace Attempt 4125	[24.02 s]
0.0.B: Trace Attempt 3962	[24.02 s]
0.0.Bm: Trace Attempt 3949	[24.03 s]
0.0.N: Trace Attempt  1	[24.15 s]
0.0.N: Trace Attempt  2	[24.15 s]
0.0.N: Trace Attempt  3	[24.15 s]
0.0.N: Trace Attempt  4	[24.15 s]
0.0.N: Trace Attempt  5	[24.15 s]
0.0.AM: Trace Attempt 278	[24.19 s]
0.0.Ht: Trace Attempt 4442	[28.02 s]
0.0.Hp: Trace Attempt 1560	[28.07 s]
0.0.B: Trace Attempt 4273	[28.03 s]
0.0.Bm: Trace Attempt 4258	[28.03 s]
0.0.N: Trace Attempt 197	[28.17 s]
0.0.AM: Trace Attempt 318	[28.20 s]
0.0.N: Trace Attempt  1	[29.37 s]
0.0.N: Trace Attempt  2	[29.37 s]
0.0.N: Trace Attempt  3	[29.37 s]
0.0.N: Trace Attempt  4	[29.38 s]
0.0.N: Trace Attempt  5	[29.38 s]
0.0.Ht: Trace Attempt 4734	[32.03 s]
0.0.Hp: Trace Attempt 1666	[32.09 s]
0.0.B: Trace Attempt 4561	[32.03 s]
0.0.Bm: Trace Attempt 4544	[32.04 s]
0.0.AM: Trace Attempt 355	[32.24 s]
0.0.N: Trace Attempt 198	[33.39 s]
0.0.N: Trace Attempt  1	[34.63 s]
0.0.N: Trace Attempt  2	[34.63 s]
0.0.N: Trace Attempt  3	[34.63 s]
0.0.N: Trace Attempt  4	[34.63 s]
0.0.N: Trace Attempt  5	[34.64 s]
0.0.Ht: Trace Attempt 5011	[36.03 s]
0.0.Hp: Trace Attempt 1765	[36.11 s]
0.0.B: Trace Attempt 4831	[36.04 s]
0.0.Bm: Trace Attempt 4812	[36.05 s]
0.0.AM: Trace Attempt 394	[36.30 s]
0.0.N: Trace Attempt 198	[38.65 s]
0.0.N: Trace Attempt  1	[39.89 s]
0.0.N: Trace Attempt  2	[39.89 s]
0.0.N: Trace Attempt  3	[39.89 s]
0.0.N: Trace Attempt  4	[39.89 s]
0.0.N: Trace Attempt  5	[39.89 s]
0.0.Ht: Trace Attempt 5276	[40.04 s]
0.0.B: Trace Attempt 5080	[40.05 s]
0.0.Bm: Trace Attempt 5060	[40.06 s]
0.0.Hp: Trace Attempt 1858	[40.15 s]
0.0.AM: Trace Attempt 436	[40.33 s]
0.0.N: Trace Attempt 198	[43.90 s]
0.0.Ht: Trace Attempt 5529	[44.04 s]
0.0.B: Trace Attempt 5312	[44.06 s]
0.0.Bm: Trace Attempt 5290	[44.06 s]
0.0.Hp: Trace Attempt 1946	[44.16 s]
0.0.AM: Trace Attempt 260	[44.36 s]
0.0.N: Trace Attempt  1	[45.17 s]
0.0.N: Trace Attempt  2	[45.17 s]
0.0.N: Trace Attempt  3	[45.17 s]
0.0.N: Trace Attempt  4	[45.17 s]
0.0.N: Trace Attempt  5	[45.18 s]
0.0.Ht: Trace Attempt 5751	[48.04 s]
0.0.B: Trace Attempt 5514	[48.08 s]
0.0.Bm: Trace Attempt 5491	[48.07 s]
0.0.Hp: Trace Attempt 2025	[48.18 s]
0.0.N: Trace Attempt 198	[49.19 s]
0.0.N: Trace Attempt  1	[50.45 s]
0.0.N: Trace Attempt  2	[50.45 s]
0.0.N: Trace Attempt  3	[50.45 s]
0.0.N: Trace Attempt  4	[50.45 s]
0.0.N: Trace Attempt  5	[50.45 s]
0.0.AM: Trace Attempt 513	[50.89 s]
0.0.AM: Trace Attempt  1	[51.34 s]
0.0.AM: Trace Attempt  2	[51.34 s]
0.0.AM: Trace Attempt  3	[51.34 s]
0.0.AM: Trace Attempt  4	[51.34 s]
0.0.AM: Trace Attempt  5	[51.34 s]
0.0.Ht: Trace Attempt 5966	[52.05 s]
0.0.B: Trace Attempt 5712	[52.09 s]
0.0.Bm: Trace Attempt 5688	[52.09 s]
0.0.Hp: Trace Attempt 2101	[52.20 s]
0.0.N: Trace Attempt 198	[54.48 s]
0.0.AM: Trace Attempt 178	[55.36 s]
0.0.N: Trace Attempt  1	[55.65 s]
0.0.N: Trace Attempt  2	[55.65 s]
0.0.N: Trace Attempt  3	[55.65 s]
0.0.N: Trace Attempt  4	[55.65 s]
0.0.N: Trace Attempt  5	[55.65 s]
0.0.Ht: Trace Attempt 6187	[56.05 s]
0.0.B: Trace Attempt 5927	[56.09 s]
0.0.Bm: Trace Attempt 5902	[56.10 s]
0.0.Hp: Trace Attempt 2181	[56.23 s]
0.0.AM: Trace Attempt 244	[59.38 s]
0.0.N: Trace Attempt 198	[59.67 s]
0.0.Ht: Trace Attempt 6402	[60.06 s]
0.0.B: Trace Attempt 6135	[60.10 s]
0.0.Bm: Trace Attempt 6108	[60.10 s]
0.0.Hp: Trace Attempt 2258	[60.27 s]
0.0.N: Trace Attempt  1	[60.93 s]
0.0.N: Trace Attempt  2	[60.93 s]
0.0.N: Trace Attempt  3	[60.93 s]
0.0.N: Trace Attempt  4	[60.93 s]
0.0.N: Trace Attempt  5	[60.93 s]
0.0.AM: Trace Attempt 274	[63.41 s]
0.0.Ht: Trace Attempt 6604	[64.08 s]
0.0.B: Trace Attempt 6330	[64.11 s]
0.0.Bm: Trace Attempt 6303	[64.11 s]
0.0.Hp: Trace Attempt 2332	[64.31 s]
0.0.N: Trace Attempt 198	[64.95 s]
0.0.N: Trace Attempt  1	[66.22 s]
0.0.N: Trace Attempt  2	[66.22 s]
0.0.N: Trace Attempt  3	[66.22 s]
0.0.N: Trace Attempt  4	[66.22 s]
0.0.N: Trace Attempt  5	[66.22 s]
0.0.AM: Trace Attempt 319	[67.46 s]
0.0.Ht: Trace Attempt 6794	[68.08 s]
0.0.B: Trace Attempt 6519	[68.13 s]
0.0.Bm: Trace Attempt 6492	[68.13 s]
0.0.Hp: Trace Attempt 2403	[68.33 s]
0.0.N: Trace Attempt 198	[70.24 s]
0.0.N: Trace Attempt  1	[71.45 s]
0.0.N: Trace Attempt  2	[71.45 s]
0.0.N: Trace Attempt  3	[71.45 s]
0.0.N: Trace Attempt  4	[71.45 s]
0.0.N: Trace Attempt  5	[71.45 s]
0.0.AM: Trace Attempt 359	[71.60 s]
0.0.Ht: Trace Attempt 6982	[72.08 s]
0.0.B: Trace Attempt 6701	[72.15 s]
0.0.Bm: Trace Attempt 6674	[72.14 s]
0.0.Hp: Trace Attempt 2472	[72.36 s]
0.0.N: Trace Attempt 198	[75.46 s]
0.0.AM: Trace Attempt 385	[75.63 s]
0.0.Ht: Trace Attempt 7175	[76.08 s]
0.0.B: Trace Attempt 6877	[76.16 s]
0.0.Bm: Trace Attempt 6849	[76.14 s]
0.0.Hp: Trace Attempt 2539	[76.37 s]
0.0.N: Trace Attempt  1	[76.68 s]
0.0.N: Trace Attempt  2	[76.68 s]
0.0.N: Trace Attempt  3	[76.68 s]
0.0.N: Trace Attempt  4	[76.68 s]
0.0.N: Trace Attempt  5	[76.68 s]
0.0.AM: Trace Attempt 418	[79.68 s]
0.0.Ht: Trace Attempt 7350	[80.10 s]
0.0.B: Trace Attempt 7042	[80.18 s]
0.0.Bm: Trace Attempt 7014	[80.16 s]
0.0.Hp: Trace Attempt 2601	[80.38 s]
0.0.N: Trace Attempt 196	[80.72 s]
0.0.N: Trace Attempt  1	[82.03 s]
0.0.N: Trace Attempt  2	[82.03 s]
0.0.N: Trace Attempt  3	[82.03 s]
0.0.N: Trace Attempt  4	[82.03 s]
0.0.N: Trace Attempt  5	[82.03 s]
0.0.AM: Trace Attempt 450	[83.74 s]
0.0.Ht: Trace Attempt 7524	[84.12 s]
0.0.B: Trace Attempt 7205	[84.19 s]
0.0.Bm: Trace Attempt 7178	[84.19 s]
0.0.Hp: Trace Attempt 2663	[84.40 s]
0.0.N: Trace Attempt 198	[86.04 s]
0.0.N: Trace Attempt  1	[87.41 s]
0.0.N: Trace Attempt  2	[87.41 s]
0.0.N: Trace Attempt  3	[87.41 s]
0.0.N: Trace Attempt  4	[87.41 s]
0.0.N: Trace Attempt  5	[87.41 s]
0.0.AM: Trace Attempt 474	[87.80 s]
0.0.Ht: Trace Attempt 7697	[88.14 s]
0.0.B: Trace Attempt 7363	[88.20 s]
0.0.Bm: Trace Attempt 7336	[88.20 s]
0.0.Hp: Trace Attempt 2724	[88.45 s]
0.0.N: Trace Attempt 198	[91.42 s]
0.0.Ht: Trace Attempt 7864	[92.14 s]
0.0.B: Trace Attempt 7525	[92.22 s]
0.0.Bm: Trace Attempt 7498	[92.22 s]
0.0.AM: Trace Attempt 484	[92.36 s]
0.0.Hp: Trace Attempt 2784	[92.45 s]
0.0.N: Trace Attempt  1	[92.70 s]
0.0.N: Trace Attempt  2	[92.70 s]
0.0.N: Trace Attempt  3	[92.70 s]
0.0.N: Trace Attempt  4	[92.70 s]
0.0.N: Trace Attempt  5	[92.70 s]
0.0.Ht: Trace Attempt 8028	[96.16 s]
0.0.B: Trace Attempt 7682	[96.24 s]
0.0.Bm: Trace Attempt 7655	[96.23 s]
0.0.Hp: Trace Attempt 2843	[96.51 s]
0.0.AM: Trace Attempt 494	[96.51 s]
0.0.N: Trace Attempt 198	[96.71 s]
0.0.N: Trace Attempt  1	[97.89 s]
0.0.N: Trace Attempt  2	[97.89 s]
0.0.N: Trace Attempt  3	[97.89 s]
0.0.N: Trace Attempt  4	[97.89 s]
0.0.N: Trace Attempt  5	[97.89 s]
0.0.Ht: Trace Attempt 8193	[100.18 s]
0.0.B: Trace Attempt 7833	[100.26 s]
0.0.Bm: Trace Attempt 7807	[100.25 s]
0.0.Hp: Trace Attempt 2900	[100.54 s]
0.0.AM: Trace Attempt 505	[100.55 s]
0.0.N: Trace Attempt 198	[101.89 s]
0.0.N: Trace Attempt  1	[103.19 s]
0.0.N: Trace Attempt  2	[103.19 s]
0.0.N: Trace Attempt  3	[103.19 s]
0.0.N: Trace Attempt  4	[103.19 s]
0.0.N: Trace Attempt  5	[103.19 s]
0.0.Ht: Trace Attempt 8342	[104.20 s]
0.0.B: Trace Attempt 7981	[104.27 s]
0.0.Bm: Trace Attempt 7956	[104.28 s]
0.0.Hp: Trace Attempt 2957	[104.61 s]
0.0.AM: Trace Attempt 516	[104.87 s]
0.0.N: Trace Attempt 199	[107.21 s]
0.0.Ht: Trace Attempt 8495	[108.21 s]
0.0.B: Trace Attempt 8126	[108.29 s]
0.0.Bm: Trace Attempt 8101	[108.31 s]
0.0.N: Trace Attempt  1	[108.43 s]
0.0.N: Trace Attempt  2	[108.43 s]
0.0.N: Trace Attempt  3	[108.43 s]
0.0.N: Trace Attempt  4	[108.43 s]
0.0.N: Trace Attempt  5	[108.43 s]
0.0.Hp: Trace Attempt 3012	[108.66 s]
0.0.AM: Trace Attempt 528	[109.07 s]
0.0.Ht: Trace Attempt 8649	[112.22 s]
0.0.B: Trace Attempt 8272	[112.30 s]
0.0.Bm: Trace Attempt 8246	[112.31 s]
0.0.N: Trace Attempt 199	[112.46 s]
0.0.Hp: Trace Attempt 3066	[112.66 s]
0.0.AM: Trace Attempt 540	[113.19 s]
0.0.N: Trace Attempt  1	[113.65 s]
0.0.N: Trace Attempt  2	[113.65 s]
0.0.N: Trace Attempt  3	[113.65 s]
0.0.N: Trace Attempt  4	[113.65 s]
0.0.N: Trace Attempt  5	[113.66 s]
0.0.Ht: Trace Attempt 8788	[116.24 s]
0.0.B: Trace Attempt 8416	[116.30 s]
0.0.Bm: Trace Attempt 8391	[116.33 s]
0.0.Hp: Trace Attempt 3118	[116.69 s]
0.0.AM: Trace Attempt 553	[117.36 s]
0.0.N: Trace Attempt 198	[117.66 s]
0.0.N: Trace Attempt  1	[119.07 s]
0.0.N: Trace Attempt  2	[119.08 s]
0.0.N: Trace Attempt  3	[119.08 s]
0.0.N: Trace Attempt  4	[119.08 s]
0.0.N: Trace Attempt  5	[119.08 s]
0.0.Ht: Trace Attempt 8938	[120.26 s]
0.0.B: Trace Attempt 8558	[120.33 s]
0.0.Bm: Trace Attempt 8532	[120.34 s]
0.0.Hp: Trace Attempt 3170	[120.74 s]
0.0.AM: Trace Attempt 566	[121.90 s]
0.0.N: Trace Attempt 198	[123.08 s]
0.0.Ht: Trace Attempt 9076	[124.27 s]
0.0.B: Trace Attempt 8695	[124.33 s]
0.0.Bm: Trace Attempt 8669	[124.35 s]
0.0.N: Trace Attempt  1	[124.70 s]
0.0.N: Trace Attempt  2	[124.70 s]
0.0.N: Trace Attempt  3	[124.70 s]
0.0.N: Trace Attempt  4	[124.70 s]
0.0.N: Trace Attempt  5	[124.70 s]
0.0.Hp: Trace Attempt 3220	[124.75 s]
0.0.AM: Trace Attempt 578	[125.97 s]
0.0.Ht: Trace Attempt 9219	[128.27 s]
0.0.B: Trace Attempt 8830	[128.35 s]
0.0.Bm: Trace Attempt 8804	[128.36 s]
0.0.N: Trace Attempt 230	[128.70 s]
0.0.Hp: Trace Attempt 3270	[128.80 s]
0.0.AM: Trace Attempt 589	[130.74 s]
0.0.Ht: Trace Attempt 9356	[132.29 s]
0.0.B: Trace Attempt 8963	[132.35 s]
0.0.Bm: Trace Attempt 8937	[132.37 s]
0.0.N: Trace Attempt 321	[132.70 s]
0.0.Hp: Trace Attempt 3319	[132.80 s]
0.0.AM: Trace Attempt 600	[134.87 s]
0.0.Ht: Trace Attempt 9494	[136.31 s]
0.0.B: Trace Attempt 9093	[136.38 s]
0.0.Bm: Trace Attempt 9067	[136.38 s]
0.0.N: Trace Attempt 404	[136.72 s]
0.0.Hp: Trace Attempt 3366	[136.83 s]
0.0.AM: Trace Attempt 608	[139.07 s]
0.0.Ht: Trace Attempt 9624	[140.34 s]
0.0.B: Trace Attempt 9214	[140.38 s]
0.0.Bm: Trace Attempt 9188	[140.41 s]
0.0.Hp: Trace Attempt 3412	[140.86 s]
0.0.N: Trace Attempt 449	[143.01 s]
0.0.N: Trace Attempt  1	[143.03 s]
0.0.N: Trace Attempt  2	[143.03 s]
0.0.N: Trace Attempt  3	[143.03 s]
0.0.N: Trace Attempt  4	[143.03 s]
0.0.N: Trace Attempt  5	[143.03 s]
0.0.AM: Trace Attempt 617	[143.26 s]
0.0.Ht: Trace Attempt 9754	[144.36 s]
0.0.B: Trace Attempt 9336	[144.40 s]
0.0.Bm: Trace Attempt 9310	[144.41 s]
0.0.Hp: Trace Attempt 3458	[144.86 s]
0.0.N: Trace Attempt 231	[147.09 s]
0.0.AM: Trace Attempt 627	[147.47 s]
0.0.Ht: Trace Attempt 9883	[148.38 s]
0.0.B: Trace Attempt 9460	[148.41 s]
0.0.Bm: Trace Attempt 9434	[148.43 s]
0.0.Hp: Trace Attempt 3504	[148.88 s]
0.0.N: Trace Attempt 323	[151.12 s]
0.0.AM: Trace Attempt 637	[151.84 s]
0.0.Ht: Trace Attempt 10011	[152.38 s]
0.0.B: Trace Attempt 9583	[152.44 s]
0.0.Bm: Trace Attempt 9557	[152.45 s]
0.0.Hp: Trace Attempt 3550	[152.93 s]
0.0.N: Trace Attempt 407	[155.14 s]
0.0.AM: Trace Attempt 646	[155.92 s]
0.0.Ht: Trace Attempt 10136	[156.39 s]
0.0.B: Trace Attempt 9703	[156.44 s]
0.0.Bm: Trace Attempt 9677	[156.45 s]
0.0.Hp: Trace Attempt 3595	[156.97 s]
0.0.N: Trace Attempt 450	[159.56 s]
0.0.N: Trace Attempt  1	[159.58 s]
0.0.N: Trace Attempt  2	[159.58 s]
0.0.N: Trace Attempt  3	[159.58 s]
0.0.N: Trace Attempt  4	[159.58 s]
0.0.N: Trace Attempt  5	[159.58 s]
0.0.Ht: Trace Attempt 10255	[160.40 s]
0.0.AM: Trace Attempt 656	[160.38 s]
0.0.B: Trace Attempt 9818	[160.47 s]
0.0.Bm: Trace Attempt 9792	[160.48 s]
0.0.Hp: Trace Attempt 3638	[161.02 s]
0.0.N: Trace Attempt 231	[163.62 s]
0.0.Ht: Trace Attempt 10371	[164.42 s]
0.0.B: Trace Attempt 9937	[164.50 s]
0.0.Bm: Trace Attempt 9909	[164.49 s]
0.0.AM: Trace Attempt 665	[164.69 s]
0.0.Hp: Trace Attempt 3682	[165.03 s]
0.0.N: Trace Attempt 323	[167.66 s]
0.0.Ht: Trace Attempt 10493	[168.45 s]
0.0.Bm: Trace Attempt 10024	[168.49 s]
0.0.B: Trace Attempt 10053	[168.51 s]
0.0.AM: Trace Attempt 674	[168.93 s]
0.0.Hp: Trace Attempt 3726	[169.11 s]
0.0.N: Trace Attempt 407	[171.68 s]
0.0.Ht: Trace Attempt 10605	[172.47 s]
0.0.B: Trace Attempt 10166	[172.51 s]
0.0.Bm: Trace Attempt 10137	[172.52 s]
0.0.Hp: Trace Attempt 3769	[173.21 s]
0.0.AM: Trace Attempt 683	[173.36 s]
0.0.N: Trace Attempt  1	[175.56 s]
0.0.N: Trace Attempt  2	[175.56 s]
0.0.N: Trace Attempt  3	[175.56 s]
0.0.N: Trace Attempt  4	[175.56 s]
0.0.N: Trace Attempt  5	[175.56 s]
0.0.Ht: Trace Attempt 10721	[176.48 s]
0.0.B: Trace Attempt 10274	[176.55 s]
0.0.Bm: Trace Attempt 10245	[176.53 s]
0.0.Hp: Trace Attempt 3811	[177.29 s]
0.0.AM: Trace Attempt 692	[177.72 s]
0.0.N: Trace Attempt 231	[179.60 s]
0.0.Ht: Trace Attempt 10828	[180.50 s]
0.0.B: Trace Attempt 10383	[180.55 s]
0.0.Bm: Trace Attempt 10354	[180.55 s]
0.0.N: Trace Attempt 255	[180.90 s]
0.0.N: Stopped processing property "DELAY.p1"	[180.93 s].
0.0.N: Morphing to Ncustom1
0.0.N: All properties determined. [0.00 s]
0.0.N: Exited with Success (@ 0.00 s)
0.0.Ncustom1: clocks: 1, declared: 1, looping: 0, posedge: 1, negedge: 0, noedge: 0, bothedge: 0
0.0.Ncustom1: Starting proof for property "DELAY.p1"	[0.00 s].
0.0.Ncustom1: Trace Attempt 450	[0.03 s]
0.0.Tri: Proofgrid shell started at 11210@vlsi-ria84(local) jg_10081_vlsi-ria84_1
0.0.D: Proofgrid shell started at 11211@vlsi-ria84(local) jg_10081_vlsi-ria84_1
0.0.Tri: clocks: 1, declared: 1, looping: 0, posedge: 1, negedge: 0, noedge: 0, bothedge: 0
0.0.D: clocks: 1, declared: 1, looping: 0, posedge: 1, negedge: 0, noedge: 0, bothedge: 0
0.0.D: Last scan. Per property time limit: 0s
0.0.D: Starting proof for property "DELAY.p1"	[0.00 s].
0.0.D: Trace Attempt  1	[0.00 s]
0.0.D: Trace Attempt  2	[0.00 s]
0.0.D: Trace Attempt  4	[0.00 s]
0.0.Tri: Last scan. Per property time limit: 0s
0.0.Tri: Starting proof for property "DELAY.p1"	[0.00 s].
0.0.Tri: Trace Attempt  1	[0.00 s]
0.0.AM: Trace Attempt 697	[180.49 s]
0.0.AM: Stopped processing property "DELAY.p1"	[181.01 s].
0.0.AM: Morphing to AMcustom3
0.0.B: Trace Attempt 10391	[180.85 s]
0.0.B: Stopped processing property "DELAY.p1"	[181.03 s].
0.0.B: Morphing to Bcustom2
0.0.B: All properties determined. [0.00 s]
0.0.B: Exited with Success (@ 0.00 s)
0.0.AM: All properties determined. [0.00 s]
0.0.AM: Exited with Success (@ 0.00 s)
0.0.Bcustom2: clocks: 1, declared: 1, looping: 0, posedge: 1, negedge: 0, noedge: 0, bothedge: 0
0.0.Bcustom2: Starting proof for property "DELAY.p1"	[0.00 s].
0.0.Bcustom2: Trace Attempt  1	[0.00 s]
0.0.Bcustom2: Trace Attempt  2	[0.00 s]
0.0.AMcustom3: clocks: 1, declared: 1, looping: 0, posedge: 1, negedge: 0, noedge: 0, bothedge: 0
0.0.Bcustom2: Trace Attempt  1	[0.00 s]
0.0.Bcustom2: Trace Attempt  2	[0.00 s]
0.0.AMcustom3: Starting proof for property "DELAY.p1"	[0.00 s].
0.0.Bcustom2: Trace Attempt  3	[0.00 s]
0.0.Bcustom2: Trace Attempt  4	[0.00 s]
0.0.Bcustom2: Trace Attempt  5	[0.00 s]
0.0.AMcustom3: Trace Attempt  1	[0.00 s]
0.0.AMcustom3: Trace Attempt  2	[0.00 s]
0.0.AMcustom3: Trace Attempt  3	[0.00 s]
0.0.AMcustom3: Trace Attempt  4	[0.00 s]
0.0.Bcustom2: Trace Attempt  1	[0.00 s]
0.0.AMcustom3: Trace Attempt  5	[0.00 s]
0.0.Bcustom2: Trace Attempt  2	[0.00 s]
0.0.Bcustom2: Trace Attempt  3	[0.00 s]
0.0.Bcustom2: Trace Attempt  4	[0.00 s]
0.0.Bcustom2: Trace Attempt  5	[0.00 s]
0.0.AMcustom3: Trace Attempt  1	[0.00 s]
0.0.AMcustom3: Trace Attempt  2	[0.00 s]
0.0.AMcustom3: Trace Attempt  3	[0.00 s]
0.0.AMcustom3: Trace Attempt  4	[0.00 s]
0.0.Bcustom2: Trace Attempt  1	[0.00 s]
0.0.Bcustom2: Trace Attempt  2	[0.00 s]
0.0.Bcustom2: Trace Attempt  3	[0.01 s]
0.0.Bcustom2: Trace Attempt  4	[0.01 s]
0.0.Bcustom2: Trace Attempt  5	[0.01 s]
0.0.AMcustom3: Trace Attempt  5	[0.00 s]
0.0.Bcustom2: Trace Attempt  1	[0.01 s]
0.0.Bcustom2: Trace Attempt  2	[0.01 s]
0.0.Bcustom2: Trace Attempt  3	[0.01 s]
0.0.Bcustom2: Trace Attempt  4	[0.01 s]
0.0.Bcustom2: Trace Attempt  5	[0.01 s]
0.0.AMcustom3: Trace Attempt  1	[0.01 s]
0.0.Tri:    0.00" ---- Launching main thread ----
0.0.AMcustom3: Trace Attempt  2	[0.01 s]
0.0.AMcustom3: Trace Attempt  3	[0.01 s]
0.0.AMcustom3: Trace Attempt  4	[0.01 s]
0.0.AMcustom3: Trace Attempt  5	[0.01 s]
0.0.Bcustom2: Trace Attempt  1	[0.02 s]
0.0.Bcustom2: Trace Attempt  2	[0.02 s]
0.0.Bcustom2: Trace Attempt  3	[0.02 s]
0.0.Bcustom2: Trace Attempt  4	[0.02 s]
0.0.Bcustom2: Trace Attempt  5	[0.02 s]
0.0.AMcustom3: Trace Attempt  1	[0.04 s]
0.0.AMcustom3: Trace Attempt  2	[0.04 s]
0.0.AMcustom3: Trace Attempt  3	[0.04 s]
0.0.AMcustom3: Trace Attempt  4	[0.04 s]
0.0.Bcustom2: Trace Attempt  1	[0.04 s]
0.0.Bcustom2: Trace Attempt  2	[0.04 s]
0.0.Bcustom2: Trace Attempt  3	[0.04 s]
0.0.AMcustom3: Trace Attempt  5	[0.04 s]
0.0.Bcustom2: Trace Attempt  4	[0.04 s]
0.0.Bcustom2: Trace Attempt  5	[0.04 s]
0.0.Tri:    0.07" ---- Launching abstraction thread ----
0.0.Bcustom2: Trace Attempt  1	[0.09 s]
0.0.Bcustom2: Trace Attempt  2	[0.09 s]
0.0.Bcustom2: Trace Attempt  3	[0.09 s]
0.0.Bcustom2: Trace Attempt  4	[0.09 s]
0.0.Bcustom2: Trace Attempt  5	[0.09 s]
0.0.Tri:    0.10" ---- Launching multi-phase simplification thread ----
0.0.AMcustom3: Trace Attempt  1	[0.13 s]
0.0.AMcustom3: Trace Attempt  2	[0.14 s]
0.0.Tri:    0.13" ---- Launching liveness simplification thread ----
0.0.AMcustom3: Trace Attempt  3	[0.14 s]
0.0.AMcustom3: Trace Attempt  4	[0.14 s]
0.0.AMcustom3: Trace Attempt  5	[0.14 s]
0.0.Bcustom2: Trace Attempt  1	[0.22 s]
0.0.Bcustom2: Trace Attempt  2	[0.22 s]
0.0.Bcustom2: Trace Attempt  3	[0.22 s]
0.0.Bcustom2: Trace Attempt  4	[0.22 s]
0.0.Bcustom2: Trace Attempt  5	[0.22 s]
0.0.Hp: Trace Attempt 3853	[181.36 s]
0.0.AMcustom3: Trace Attempt  1	[0.52 s]
0.0.AMcustom3: Trace Attempt  2	[0.52 s]
0.0.AMcustom3: Trace Attempt  3	[0.52 s]
0.0.AMcustom3: Trace Attempt  4	[0.52 s]
0.0.AMcustom3: Trace Attempt  5	[0.52 s]
0.0.Bcustom2: Trace Attempt  1	[0.90 s]
0.0.Bcustom2: Trace Attempt  2	[0.90 s]
0.0.Bcustom2: Trace Attempt  3	[0.90 s]
0.0.Bcustom2: Trace Attempt  4	[0.90 s]
0.0.Bcustom2: Trace Attempt  5	[0.91 s]
0.0.D: Trace Attempt 64	[0.81 s]
0.0.D: Stopped processing property "DELAY.p1"	[1.00 s].
0.0.D: Morphing to M
0.0.D: All properties determined. [0.00 s]
0.0.D: Exited with Success (@ 0.00 s)
0.0.M: clocks: 1, declared: 1, looping: 0, posedge: 1, negedge: 0, noedge: 0, bothedge: 0
0.0.M: Starting proof for property "DELAY.p1"	[0.00 s].
0.0.M: Trace Attempt  1	[0.00 s]
0.0.M: Trace Attempt  2	[0.00 s]
0.0.M: Trace Attempt  3	[0.00 s]
0.0.M: Trace Attempt  4	[0.00 s]
0.0.M: Trace Attempt  5	[0.00 s]
0.0.Tri:    0.97" Simplification phase 1 complete
0.0.Ncustom1: Requesting engine job to terminate
0.0.Bcustom2: Requesting engine job to terminate
0.0.AMcustom3: Requesting engine job to terminate
0.0.Tri: Requesting engine job to terminate
0.0.M: Requesting engine job to terminate
0.0.Hp: Requesting engine job to terminate
0.0.Ht: Requesting engine job to terminate
0.0.Bm: Requesting engine job to terminate
INFO (IPF144): 0: Initiating shutdown of proof [182.14 s]
0.0.Tri: A proof was found: No trace exists. [1.08 s]
INFO (IPF057): 0.0.Tri: The property "DELAY.p1" was proven in 1.09 s.
0.0.AMcustom3: Trace Attempt 64	[1.03 s]
0.0.AMcustom3: Stopped processing property "DELAY.p1"	[1.04 s].
0.0.AMcustom3: All properties determined. [1.03 s]
0.0.M: Trace Attempt 30	[0.09 s]
0.0.M: Stopped processing property "DELAY.p1"	[0.09 s].
0.0.M: All properties determined. [0.10 s]
0.0.AMcustom3: Exited with Success (@ 182.14 s)
0: ProofGrid usable level: 0
0.0.M: Exited with Success (@ 182.14 s)
0.0.Ht: Trace Attempt 10875	[182.08 s]
0.0.Ht: All properties determined. [182.12 s]
0.0.Bcustom2: Trace Attempt 385	[1.03 s]
0.0.Bcustom2: Stopped processing property "DELAY.p1"	[1.04 s].
0.0.Bcustom2: All properties determined. [1.04 s]
0.0.Ncustom1: Stopped processing property "DELAY.p1"	[1.18 s].
0.0.Ncustom1: All properties determined. [1.20 s]
0.0.Ncustom1: Exited with Success (@ 182.16 s)
0.0.Bcustom2: Exited with Success (@ 182.16 s)
0.0.AMcustom5: Proofgrid shell started at 11295@vlsi-ria84(local) jg_10081_vlsi-ria84_1
0.0.AMcustom5: Requesting engine job to terminate
0.0.AMcustom5: Preventing job from starting because proof is shutting down.
0.0.AMcustom5: Requesting engine job to terminate
0.0.AMcustom5: Interrupted. [0.00 s]
0.0.AMcustom5: Exited with Success (@ 182.17 s)
0.0.Hp: Trace Attempt 3860	[182.11 s]
0.0.Hp: All properties determined. [182.19 s]
0.0.Bm: Trace Attempt 10391	[182.03 s]
0.0.Bm: All properties determined. [182.16 s]
0.0.Bm: Exited with Success (@ 182.26 s)
0.0.Ht: Exited with Success (@ 182.28 s)
0.0.Tri: Stopped processing property "DELAY.p1"	[1.28 s].
0.0.Tri: All properties determined. [1.28 s]
0.0.Tri: Exited with Success (@ 182.34 s)
0.0.Hp: Exited with Success (@ 182.41 s)
0: --------------------------------------------------------------
ProofGrid Summary (utilization 99.93 %)
--------------------------------------------------------------
     engines started                               :    16
     engine jobs started                           :    12

    Average time in state (seconds)
    ------------------------------------------------------
    Engine  Pending     Running        Dead    Utilization
    ------------------------------------------------------
     Hp        0.03      182.14        0.00       99.98 %
     Ht        0.03      182.11        0.00       99.98 %
     Bm        0.09      182.05        0.00       99.95 %
    Mpcustom4        0.03        0.00        0.00        2.77 %
     Oh        0.05        0.00        0.00        0.48 %
      L        0.06        0.01        0.00        8.75 %
    Ncustom1        0.03      182.11        0.00       99.98 %
    Bcustom2        0.04      181.90        0.00       99.98 %
    AMcustom3        0.04      181.89        0.00       99.98 %
    Tri        0.10        1.09        0.00       91.90 %
      M        0.09        1.09        0.00       92.42 %
    AMcustom5        0.13        0.00        0.00        0.00 %
    all        0.06       91.20        0.00       99.93 %

    Total time in state (seconds)
    -----------------------------------------
            Pending     Running        Dead  
    -----------------------------------------
               0.71     1094.38        0.00

    Data read    : 7.97 MiB
    Data written : 4.58 kiB

0: All pending notifications were processed.
INFO (IPF059): 0: Completed proof on task: "<embedded>"

==============================================================
SUMMARY
==============================================================
           Properties Considered              : 2
                 assertions                   : 1
                  - proven                    : 1 (100%)
                  - bounded_proven (user)     : 0 (0%)
                  - bounded_proven (auto)     : 0 (0%)
                  - marked_proven             : 0 (0%)
                  - cex                       : 0 (0%)
                  - ar_cex                    : 0 (0%)
                  - undetermined              : 0 (0%)
                  - unknown                   : 0 (0%)
                  - error                     : 0 (0%)
                 covers                       : 1
                  - unreachable               : 0 (0%)
                  - bounded_unreachable (user): 0 (0%)
                  - covered                   : 1 (100%)
                  - ar_covered                : 0 (0%)
                  - undetermined              : 0 (0%)
                  - unknown                   : 0 (0%)
                  - error                     : 0 (0%)
determined
[<embedded>] % exit -force
[<embedded>] % INFO (IPL005): Received request to exit from the console.
INFO (IPL014): Waiting for the Tcl-thread to exit.
INFO: Waiting for proof threads to stop...
INFO: Proof threads stopped.
INFO (IPL018): The peak resident set memory use for this session was 2.196 GB.
INFO (IPL015): The Tcl-thread exited with status 0.
INFO (IPL016): Exiting the analysis session with status 0.
Finished delay_12.tcl successfully
