Jasper Apps 2024.06p002 64 bits 2024.09.02 16:28:38 UTC

Any disclosure about the Cadence Design Systems software or its use
model to any third party violates the written Non-Disclosure Agreement
between Cadence Design Systems, Inc. and the customer.

THIS SOFTWARE CONTAINS CONFIDENTIAL INFORMATION AND TRADE SECRETS OF
CADENCE DESIGN SYSTEMS, INC. USE, DISCLOSURE, OR REPRODUCTION IS
PROHIBITED WITHOUT THE PRIOR EXPRESS WRITTEN PERMISSION OF CADENCE
DESIGN SYSTEMS, INC.

Copyright (C) 2000-2024 Cadence Design Systems, Inc. All Rights
Reserved.  Unpublished -- rights reserved under the copyright laws of
the United States.

This product includes software developed by others and redistributed
according to license agreement. See doc/third_party_readme.txt for
further details.

RESTRICTED RIGHTS LEGEND

Use, duplication, or disclosure by the Government is subject to
restrictions as set forth in subparagraph (c) (1) (ii) of the Rights in
Technical Data and Computer Software clause at DFARS 252.227-7013 or
subparagraphs (c) (1) and (2) of Commercial Computer Software -- Restricted
Rights at 48 CFR 52.227-19, as applicable.


                          Cadence Design Systems, Inc.
                          2655 Seely Avenue
                          San Jose, CA 95134
                          Phone: 408.943.1234

For technical assistance visit http://support.cadence.com.

Jasper Apps Analysis Session - /users/rompel/jasper_executions/safety_liveness/jgprojects/delay_8/sessionLogs/session_0

WARNING (WG017): [session]: The system's locale is "ANSI_X3.4-1968", which is not UTF-8. Non-ASCII characters might not be handled correctly.
WARNING (WG017): [jg_console]: The system's locale is "ANSI_X3.4-1968", which is not UTF-8. Non-ASCII characters might not be handled correctly.
INFO: successfully checked out license "jasper_fao".
INFO: reading configuration file "/users/rompel/.config/cadence/jasper.conf".
% analyze -sv09 ../delay_8.sv
[-- (VERI-1482)] Analyzing Verilog file '/tools/cadence2425/JASPER/jasper_2024.06p002/lib/verilog/packages/std/std.sv' into library 'std'
[-- (VERI-1482)] Analyzing Verilog file '../delay_8.sv'
% elaborate -bbox_mul 1000000 -bbox_div 1000000 -bbox_mod 1000000 -bbox_a 1000000
[INFO (HIER-8002)] ../delay_8.sv(13): Disabling old hierarchical reference handler
[INFO (VERI-1018)] ../delay_8.sv(1): compiling module 'DELAY'
[WARN (VERI-1209)] ../delay_8.sv(10): expression size 32 truncated to fit in target size 14
INFO (ISW003): Top module name is "DELAY".
INFO (INL208): Elaboration synthesis summary:
  Number of synthesized netlists          1 (0 packages)
  Single run mode                         On
  Pipeline                                On (1 pipelined netlists)
  Late hierarchical reference connection  On
  Number of analyzed Verilog modules      1 (1 synthesized)
  Number of analyzed VHDL entities        0 (0 synthesized)
INFO (INL003): Clearing all state information (assumes, stopats, and so forth).
DELAY
[<embedded>] % reset rst
INFO (IPM031): Clearing proof results of all properties.
INFO (IRS006): Current reset condition is "rst".
[<embedded>] % clock clk
[<embedded>] % prove -all
Ncustom1: Custom engine code is hT3Ng7hPPfiYQOTDZ3qhYOwGAM51eA+J/FjkM5shLioAsqhgLR4Ft+O1BuKG6ilQ83B9tLXSl+CwjiTMAQA
Bcustom2: Custom engine code is hT3Nm7hPr1Vp3Di1Ra2USNIGL4JypRnLKLAdF6JAyuavO2JfGCiY9OZJhcAcOUnLx5xwNdhILGrAWX9s+z2WDkKwNR7tAfClBEjRFVQeq6DU54boFgEA
AMcustom3: Custom engine code is hT3Ng7hP/feYQOTDZ3qhYOwGAM51eA+J/FjkM5shLioAsqhgLR4Ft+O1BuKG6ilQ83B9tLXSmmqwm7g9AQA
Mpcustom4: Custom engine code is hT3NZbhP9fmY2AbBQnsjfOxn6c+6e6yL+/e8fZFmaQrnlgEA
INFO (IPF036): Starting proof on task: "<embedded>", 2 properties to prove with 0 already proven/unreachable
INFO (IRS029): Starting reset analysis: phase 1 of 4.
INFO (IRS030): Running reset analysis: phase 2 of 4.
INFO (IRS031): Running reset analysis: phase 3 of 4.
INFO (IRS020): Starting the reset analysis simulation with a limit of 100 iterations (phase 4 of 4).
INFO (IRS024): Reset iterations 0 to 4 analyzed.
INFO (IRS018): Reset analysis simulation executed for 3 iterations. Assigned values for 14 of 14 design flops, 0 of 0 design latches, 6 of 6 internal elements.
INFO (IRS039): Reset analysis complete.
INFO (IPF031): Settings used for proof thread 0:
    orchestration                 = on
    time_limit                    = 86400s
    per_property_time_limit       = 1s * 10 ^ scan
    engine_mode                   = auto
    proofgrid_per_engine_max_jobs = 1
    max engine jobs               = auto
    proofgrid_mode                = local
    proofgrid_restarts            = 10
AMcustom5: Custom engine code is hT3N1rhP11/52HrFRS21ROp2LOjVTgPvT8L8BGXHgLhaIuqtT4nARFjUqrBL+7pLmaTOzBepZW/Jm8SSrHDybSQtoNiO3y43wk+dEoWlsZizu97Fih6O6lPVG/LpWP5SsUPwlGagLNa1FKEFvwVXyX7//8prySbvSxIHXr5er+z4RAEA
0: Using multistage preprocessing
0: Starting reduce
Ncustom6: Custom engine code is hT3OXrhPByJp3TrFSTLhUmMH4KVtJgmTCnNDF46yMXOKY48m4LS5nE7yBzFjA7kDuwO/GhGUpEPiky3p3wmPn3dJZHxFMsafSoObRzSC+tn7sEY0WbTdZ/FV4hL3MYH/b1CIUvXSWR4wqEoVLsmMOD4xIPT4lI1LO6ZCO7PnnWQuLwetnvKlrXx6wCW/A+x+enqslg1YPobi4wEF/EvbzOvcTYdJvl2s4H2yZg2b2ofAVN5WvhWk1HoBAA
ADcustom7: Custom engine code is hT3Nv7hPv1752HrFRa2kROx2f/ECJeZB2AZsLdlO8VwmIuqtT4nIDFXclhg+O+o+DMmQCekbheGk0kK28laA9gaOFDXsQp29J3X615HY1IPHJWd6FUFvCHjO+p1k652b5JJvZlShNpGlGSXAiQe/mEAj6tEBAA
Tricustom8: Custom engine code is hT3Nu7hPt1752DvFRa0kNDiyIV97VyejwM9C/jCLJjdPvusZONHY42VYUy0Q1ZotnhcVtNc56tJ5wbxv6V2+XpdsaSlHck5vfnbYjdwj1OECy9U+7oSQ0SZE3g5ayD+Phuh4odCJTjeKa2k4elM9ldQfkAEA
Gcustom9: Custom engine code is hT3NibhPDfeYQADBZnYcglOvK9Pfd7EOeniIqP8jNsyIqInncipMGcUXqAadachREE9F2PwhBUZUNw5kHnd4JdXkamORRgEA
C2custom10: Custom engine code is hT3NirhPjfWYQADBZnYcglOvK9Pfd7EOeniIqP8jNsyIqInncgkrYMMXCYbdK0dUjZIF9d4cJ0rHoBDjwVLBKuG86XYVV00BAA
AGcustom11: Custom engine code is hT3NirhP/fmYQADBZnYcglOvK9Pfd7EOeniIqP8jNsyIqInnckcwYMMXCYbdK0dUjZIF9d4cJ0rHoBDjwVLBKuHEZnZByh0BAA
Bcustom12: Custom engine code is hT3NjrhPDfiYQADBZnYcglOvK9PfWxFtenjIyBqfrgr7if/jL/yPOuK1BAflEcW0DxNH2eDIoezN2gxlQFg81RZtiWXh7aiTAidvAQA
Ncustom13: Custom engine code is hT3NR7hPByFp3TrFSTLhUmMH4KWtJglTyV/c51BHEeZWamnJv767nE6PCak26bd3gf3XGN3rIRheufhDieCJQVISo+gNYUKhiUedBKGtsP/a18svAnlMJZudHxDFwK5ufsyoxsIyiAeSY2oi3tEuoDHr5gw42DFKAG3PqO3CEsl8Azzdt3pl5nGA1Ifv2H02eYsFzWb/nfp8PMb3F0krE/EgBcm8TD9Div8BAA
0: Finished reduce in 0s
Tricustom14: Custom engine code is hT3Nu7hP3fiYQADBZnYcglNHp9bfd7EOeniIqP/ji8sGLQu8yhsFO+wxJ+O+R0bU8g/IewXFomyos+viQnWc2xYNYmMqpo3i40O7DaZR7qfp4YqNx26KRvQ/qx0BAA
0.0.PRE: Performing Proof Simplification...
0.0.N: clocks: 1, declared: 1, looping: 0, posedge: 1, negedge: 0, noedge: 0, bothedge: 0
0.0.N: Proof Simplification Iteration 1	[0.00 s]
0.0.PRE: A trace with 1 cycles was found. [0.00 s]
INFO (IPF047): 0.0.PRE: The cover property "DELAY.p1:precondition1" was covered in 1 cycles in 0.00 s.
0.0.N: Proof Simplification Iteration 2	[0.06 s]
0.0.PRE: A proof was found: No trace exists. [0.00 s]
INFO (IPF057): 0.0.PRE: The property ":noDeadEnd" was proven in 0.00 s.
    Use check_assumptions -show -dead_end to show this property in the property table.
0.0.PRE: A proof was found: No trace exists. [0.00 s]
INFO (IPF057): 0.0.PRE: The property ":noConflict" was proven in 0.00 s.
    Use check_assumptions -show to show this property in the property table.
INFO (IPF047): 0.0.PRE: The cover property ":live" was covered in 1 cycles in 0.00 s.
    Use check_assumptions -show -live to show this property in the property table.
0.0.PRE: Proof Simplification completed in 0.06 s
0: About to start ProofGrid in its own thread with a limit of 10000 pending notifications and a limit of 10 traces.
0: =============================== ProofGrid start ===============================
0: ProofGrid usable level: 1
0: Initial ProofGrid level: 1
0: ProofGrid is starting event handling
0.0.Hp: Proofgrid shell started at 18636@vlsi-ria84(local) jg_18569_vlsi-ria84_1
0.0.N: Proofgrid shell started at 18635@vlsi-ria84(local) jg_18569_vlsi-ria84_1
0.0.Hp: clocks: 1, declared: 1, looping: 0, posedge: 1, negedge: 0, noedge: 0, bothedge: 0
0.0.Hp: Last scan. Per property time limit: 0s
0.0.N: clocks: 1, declared: 1, looping: 0, posedge: 1, negedge: 0, noedge: 0, bothedge: 0
0.0.N: Last scan. Per property time limit: 0s
0.0.N: Starting proof for property "DELAY.p1"	[0.00 s].
0.0.N: Trace Attempt  1	[0.00 s]
0.0.N: Trace Attempt  2	[0.00 s]
0.0.N: Trace Attempt  2	[0.00 s]
0.0.N: Trace Attempt  3	[0.00 s]
0.0.N: Trace Attempt  4	[0.00 s]
0.0.N: Trace Attempt  4	[0.00 s]
0.0.N: Trace Attempt  5	[0.00 s]
0.0.Hp: Trace Attempt  1	[0.00 s]
0.0.Hp: Trace Attempt  2	[0.00 s]
0.0.Hp: Trace Attempt  3	[0.00 s]
0.0.Hp: Trace Attempt  4	[0.00 s]
0.0.Hp: Trace Attempt  5	[0.00 s]
0.0.N: Trace Attempt  1	[0.01 s]
0.0.N: Trace Attempt  2	[0.01 s]
0.0.N: Trace Attempt  3	[0.01 s]
0.0.N: Trace Attempt  4	[0.01 s]
0.0.N: Trace Attempt  5	[0.01 s]
0.0.Ht: Proofgrid shell started at 18667@vlsi-ria84(local) jg_18569_vlsi-ria84_1
0.0.Oh: Proofgrid shell started at 18670@vlsi-ria84(local) jg_18569_vlsi-ria84_1
0.0.Mpcustom4: Proofgrid shell started at 18669@vlsi-ria84(local) jg_18569_vlsi-ria84_1
0.0.Mpcustom4: clocks: 1, declared: 1, looping: 0, posedge: 1, negedge: 0, noedge: 0, bothedge: 0
0.0.Oh: clocks: 1, declared: 1, looping: 0, posedge: 1, negedge: 0, noedge: 0, bothedge: 0
0.0.Mpcustom4: Ignoring liveness properties
0.0.Oh: Reached length limit (2147483647) [0.00 s]
0.0.Mpcustom4: All properties either determined or skipped. [0.00 s]
0.0.Mpcustom4: Exited with Success (@ 0.04 s)
0.0.Mpcustom4: Completed, Restart ignored.
0.0.Ht: clocks: 1, declared: 1, looping: 0, posedge: 1, negedge: 0, noedge: 0, bothedge: 0
0.0.Ht: Last scan. Per property time limit: 0s
0.0.Ht: Trace Attempt  1	[0.00 s]
0.0.Ht: Trace Attempt  2	[0.00 s]
0.0.Ht: Trace Attempt  3	[0.00 s]
0.0.Oh: Exited with Success (@ 0.04 s)
0.0.L: Proofgrid shell started at 18671@vlsi-ria84(local) jg_18569_vlsi-ria84_1
0.0.Ht: Trace Attempt  4	[0.00 s]
0.0.Ht: Trace Attempt  5	[0.00 s]
0.0.L: clocks: 1, declared: 1, looping: 0, posedge: 1, negedge: 0, noedge: 0, bothedge: 0
0.0.L: Using trace diversification with seed 1 (0.05)
0.0.L: Using LRU state removal heuristic
0.0.L: Ignoring liveness properties
0.0.L: All properties either determined or skipped. [0.00 s]
0.0.L: Exited with Success (@ 0.04 s)
0.0.L: Completed, Restart ignored.
0.0.Bm: Proofgrid shell started at 18668@vlsi-ria84(local) jg_18569_vlsi-ria84_1
0.0.Bm: clocks: 1, declared: 1, looping: 0, posedge: 1, negedge: 0, noedge: 0, bothedge: 0
0.0.Bm: Ignoring liveness properties
0.0.Bm: Last scan. Per property time limit: 0s
0.0.Bm: Trace Attempt  1	[0.00 s]
0.0.Bm: Trace Attempt  2	[0.00 s]
0.0.Bm: Trace Attempt  3	[0.00 s]
0.0.Bm: Trace Attempt  4	[0.00 s]
0.0.Bm: Trace Attempt  5	[0.00 s]
0.0.AM: Proofgrid shell started at 18701@vlsi-ria84(local) jg_18569_vlsi-ria84_1
0.0.B: Proofgrid shell started at 18698@vlsi-ria84(local) jg_18569_vlsi-ria84_1
0.0.AM: clocks: 1, declared: 1, looping: 0, posedge: 1, negedge: 0, noedge: 0, bothedge: 0
0.0.AM: Last scan. Per property time limit: 0s
0.0.AM: Starting proof for property "DELAY.p1"	[0.00 s].
0.0.AM: Trace Attempt  1	[0.00 s]
0.0.AM: Trace Attempt  2	[0.00 s]
0.0.AM: Trace Attempt  3	[0.00 s]
0.0.AM: Trace Attempt  4	[0.00 s]
0.0.AM: Trace Attempt  5	[0.00 s]
0.0.B: clocks: 1, declared: 1, looping: 0, posedge: 1, negedge: 0, noedge: 0, bothedge: 0
0.0.B: Last scan. Per property time limit: 0s
0.0.B: Starting proof for property "DELAY.p1"	[0.00 s].
0.0.B: Trace Attempt  1	[0.00 s]
0.0.B: Trace Attempt  2	[0.00 s]
0.0.B: Trace Attempt  3	[0.00 s]
0.0.B: Trace Attempt  4	[0.00 s]
0.0.B: Trace Attempt  5	[0.00 s]
0.0.AM: Trace Attempt  1	[0.00 s]
0.0.AM: Trace Attempt  2	[0.00 s]
0.0.AM: Trace Attempt  3	[0.00 s]
0.0.AM: Trace Attempt  4	[0.00 s]
0.0.AM: Trace Attempt  5	[0.00 s]
0.0.AM: Trace Attempt  1	[0.01 s]
0.0.AM: Trace Attempt  2	[0.01 s]
0.0.AM: Trace Attempt  3	[0.01 s]
0.0.AM: Trace Attempt  4	[0.01 s]
0.0.AM: Trace Attempt  5	[0.01 s]
0.0.N: Trace Attempt  1	[0.08 s]
0.0.N: Trace Attempt  2	[0.08 s]
0.0.N: Trace Attempt  3	[0.08 s]
0.0.N: Trace Attempt  4	[0.09 s]
0.0.N: Trace Attempt  5	[0.09 s]
0.0.AM: Trace Attempt  1	[0.03 s]
0.0.AM: Trace Attempt  2	[0.03 s]
0.0.AM: Trace Attempt  3	[0.03 s]
0.0.AM: Trace Attempt  4	[0.04 s]
0.0.AM: Trace Attempt  5	[0.04 s]
0.0.AM: Trace Attempt  1	[0.13 s]
0.0.AM: Trace Attempt  2	[0.13 s]
0.0.AM: Trace Attempt  3	[0.13 s]
0.0.AM: Trace Attempt  4	[0.13 s]
0.0.AM: Trace Attempt  5	[0.13 s]
0.0.N: Trace Attempt  1	[0.37 s]
0.0.N: Trace Attempt  2	[0.37 s]
0.0.N: Trace Attempt  3	[0.37 s]
0.0.N: Trace Attempt  4	[0.37 s]
0.0.N: Trace Attempt  5	[0.37 s]
0.0.AM: Trace Attempt  1	[0.48 s]
0.0.AM: Trace Attempt  2	[0.48 s]
0.0.AM: Trace Attempt  3	[0.48 s]
0.0.AM: Trace Attempt  4	[0.48 s]
0.0.AM: Trace Attempt  5	[0.48 s]
0.0.N: Trace Attempt  1	[1.56 s]
0.0.N: Trace Attempt  2	[1.56 s]
0.0.N: Trace Attempt  3	[1.56 s]
0.0.N: Trace Attempt  4	[1.56 s]
0.0.N: Trace Attempt  5	[1.56 s]
0.0.AM: Trace Attempt  1	[1.80 s]
0.0.AM: Trace Attempt  2	[1.80 s]
0.0.AM: Trace Attempt  3	[1.80 s]
0.0.AM: Trace Attempt  4	[1.80 s]
0.0.AM: Trace Attempt  5	[1.80 s]
0.0.N: Trace Attempt  1	[2.83 s]
0.0.N: Trace Attempt  2	[2.83 s]
0.0.N: Trace Attempt  3	[2.83 s]
0.0.N: Trace Attempt  4	[2.83 s]
0.0.N: Trace Attempt  5	[2.83 s]
0.0.Hp: Trace Attempt 609	[4.01 s]
0.0.Ht: Trace Attempt 1814	[4.00 s]
0.0.Bm: Trace Attempt 1715	[4.00 s]
0.0.B: Trace Attempt 1705	[4.00 s]
0.0.AM: Trace Attempt 217	[5.81 s]
0.0.AM: Trace Attempt  1	[6.47 s]
0.0.AM: Trace Attempt  2	[6.47 s]
0.0.AM: Trace Attempt  3	[6.48 s]
0.0.AM: Trace Attempt  4	[6.48 s]
0.0.AM: Trace Attempt  5	[6.48 s]
0.0.N: Trace Attempt 190	[6.84 s]
0.0.Ht: Trace Attempt 2438	[8.01 s]
0.0.Bm: Trace Attempt 2353	[8.01 s]
0.0.Hp: Trace Attempt 740	[8.06 s]
0.0.B: Trace Attempt 2341	[8.00 s]
0.0.N: Trace Attempt  1	[8.77 s]
0.0.N: Trace Attempt  2	[8.77 s]
0.0.N: Trace Attempt  3	[8.77 s]
0.0.N: Trace Attempt  4	[8.77 s]
0.0.N: Trace Attempt  5	[8.78 s]
0.0.AM: Trace Attempt 199	[10.49 s]
0.0.Ht: Trace Attempt 2943	[12.01 s]
0.0.Bm: Trace Attempt 2849	[12.01 s]
0.0.B: Trace Attempt 2838	[12.01 s]
0.0.Hp: Trace Attempt 817	[12.09 s]
0.0.N: Trace Attempt 187	[12.84 s]
0.0.AM: Trace Attempt 260	[14.54 s]
0.0.N: Trace Attempt  1	[14.90 s]
0.0.N: Trace Attempt  2	[14.90 s]
0.0.N: Trace Attempt  3	[14.90 s]
0.0.N: Trace Attempt  4	[14.90 s]
0.0.N: Trace Attempt  5	[14.90 s]
0.0.Ht: Trace Attempt 3356	[16.02 s]
0.0.Bm: Trace Attempt 3265	[16.02 s]
0.0.B: Trace Attempt 3253	[16.01 s]
0.0.Hp: Trace Attempt 884	[16.13 s]
0.0.AM: Trace Attempt 315	[18.57 s]
0.0.N: Trace Attempt 185	[18.90 s]
0.0.Ht: Trace Attempt 3737	[20.02 s]
0.0.Bm: Trace Attempt 3631	[20.02 s]
0.0.B: Trace Attempt 3617	[20.02 s]
0.0.Hp: Trace Attempt 946	[20.15 s]
0.0.N: Trace Attempt  1	[21.11 s]
0.0.N: Trace Attempt  2	[21.11 s]
0.0.N: Trace Attempt  3	[21.11 s]
0.0.N: Trace Attempt  4	[21.11 s]
0.0.N: Trace Attempt  5	[21.11 s]
0.0.AM: Trace Attempt 360	[22.64 s]
0.0.Ht: Trace Attempt 4086	[24.02 s]
0.0.Bm: Trace Attempt 3960	[24.02 s]
0.0.B: Trace Attempt 3944	[24.03 s]
0.0.Hp: Trace Attempt 1004	[24.17 s]
0.0.N: Trace Attempt 186	[25.12 s]
0.0.AM: Trace Attempt 393	[26.69 s]
0.0.N: Trace Attempt  1	[27.25 s]
0.0.N: Trace Attempt  2	[27.25 s]
0.0.N: Trace Attempt  3	[27.25 s]
0.0.N: Trace Attempt  4	[27.25 s]
0.0.N: Trace Attempt  5	[27.25 s]
0.0.Ht: Trace Attempt 4379	[28.04 s]
0.0.Bm: Trace Attempt 4268	[28.02 s]
0.0.B: Trace Attempt 4250	[28.03 s]
0.0.Hp: Trace Attempt 1064	[28.20 s]
0.0.AM: Trace Attempt 429	[30.78 s]
0.0.N: Trace Attempt 185	[31.27 s]
0.0.Bm: Trace Attempt 4557	[32.03 s]
0.0.Ht: Trace Attempt 4671	[32.05 s]
0.0.B: Trace Attempt 4538	[32.04 s]
0.0.Hp: Trace Attempt 1124	[32.23 s]
0.0.N: Trace Attempt  1	[33.51 s]
0.0.N: Trace Attempt  2	[33.52 s]
0.0.N: Trace Attempt  3	[33.52 s]
0.0.N: Trace Attempt  4	[33.52 s]
0.0.N: Trace Attempt  5	[33.52 s]
0.0.AM: Trace Attempt 464	[34.88 s]
0.0.Ht: Trace Attempt 4940	[36.06 s]
0.0.Bm: Trace Attempt 4820	[36.04 s]
0.0.B: Trace Attempt 4801	[36.04 s]
0.0.Hp: Trace Attempt 1180	[36.30 s]
0.0.N: Trace Attempt 185	[37.53 s]
0.0.AM: Trace Attempt 437	[38.88 s]
0.0.N: Trace Attempt  1	[39.83 s]
0.0.N: Trace Attempt  2	[39.83 s]
0.0.N: Trace Attempt  3	[39.83 s]
0.0.N: Trace Attempt  4	[39.83 s]
0.0.N: Trace Attempt  5	[39.83 s]
0.0.Bm: Trace Attempt 5050	[40.04 s]
0.0.Ht: Trace Attempt 5173	[40.07 s]
0.0.B: Trace Attempt 5032	[40.04 s]
0.0.Hp: Trace Attempt 1230	[40.34 s]
0.0.AM: Trace Attempt 513	[43.22 s]
0.0.AM: Trace Attempt  1	[43.68 s]
0.0.AM: Trace Attempt  2	[43.68 s]
0.0.AM: Trace Attempt  3	[43.68 s]
0.0.AM: Trace Attempt  4	[43.68 s]
0.0.AM: Trace Attempt  5	[43.68 s]
0.0.N: Trace Attempt 186	[43.84 s]
0.0.Ht: Trace Attempt 5404	[44.07 s]
0.0.Bm: Trace Attempt 5269	[44.06 s]
0.0.B: Trace Attempt 5252	[44.05 s]
0.0.Hp: Trace Attempt 1279	[44.37 s]
0.0.N: Trace Attempt  1	[45.99 s]
0.0.N: Trace Attempt  2	[45.99 s]
0.0.N: Trace Attempt  3	[45.99 s]
0.0.N: Trace Attempt  4	[45.99 s]
0.0.N: Trace Attempt  5	[45.99 s]
0.0.AM: Trace Attempt 190	[47.73 s]
0.0.Bm: Trace Attempt 5495	[48.06 s]
0.0.B: Trace Attempt 5478	[48.05 s]
0.0.Ht: Trace Attempt 5649	[48.08 s]
0.0.Hp: Trace Attempt 1315	[48.44 s]
0.0.N: Trace Attempt 186	[50.00 s]
0.0.AM: Trace Attempt 251	[51.77 s]
0.0.Bm: Trace Attempt 5716	[52.07 s]
0.0.Ht: Trace Attempt 5879	[52.09 s]
0.0.B: Trace Attempt 5700	[52.06 s]
0.0.N: Trace Attempt  1	[52.19 s]
0.0.N: Trace Attempt  2	[52.19 s]
0.0.N: Trace Attempt  3	[52.19 s]
0.0.N: Trace Attempt  4	[52.19 s]
0.0.N: Trace Attempt  5	[52.19 s]
0.0.Hp: Trace Attempt 1348	[52.47 s]
0.0.AM: Trace Attempt 296	[55.92 s]
0.0.Bm: Trace Attempt 5929	[56.07 s]
0.0.B: Trace Attempt 5913	[56.06 s]
0.0.Ht: Trace Attempt 6099	[56.10 s]
0.0.N: Trace Attempt 186	[56.21 s]
0.0.Hp: Trace Attempt 1381	[56.55 s]
0.0.N: Trace Attempt  1	[58.45 s]
0.0.N: Trace Attempt  2	[58.45 s]
0.0.N: Trace Attempt  3	[58.45 s]
0.0.N: Trace Attempt  4	[58.45 s]
0.0.N: Trace Attempt  5	[58.45 s]
0.0.AM: Trace Attempt 335	[60.00 s]
0.0.Bm: Trace Attempt 6132	[60.07 s]
0.0.B: Trace Attempt 6116	[60.07 s]
0.0.Ht: Trace Attempt 6304	[60.12 s]
0.0.Hp: Trace Attempt 1412	[60.56 s]
0.0.N: Trace Attempt 186	[62.46 s]
0.0.Bm: Trace Attempt 6325	[64.08 s]
0.0.B: Trace Attempt 6310	[64.08 s]
0.0.Ht: Trace Attempt 6509	[64.12 s]
0.0.AM: Trace Attempt 367	[64.11 s]
0.0.Hp: Trace Attempt 1443	[64.66 s]
0.0.N: Trace Attempt  1	[64.68 s]
0.0.N: Trace Attempt  2	[64.69 s]
0.0.N: Trace Attempt  3	[64.69 s]
0.0.N: Trace Attempt  4	[64.69 s]
0.0.N: Trace Attempt  5	[64.69 s]
0.0.Bm: Trace Attempt 6509	[68.08 s]
0.0.B: Trace Attempt 6494	[68.09 s]
0.0.Ht: Trace Attempt 6701	[68.12 s]
0.0.AM: Trace Attempt 406	[68.15 s]
0.0.Hp: Trace Attempt 1473	[68.70 s]
0.0.N: Trace Attempt 186	[68.70 s]
0.0.N: Trace Attempt  1	[70.92 s]
0.0.N: Trace Attempt  2	[70.92 s]
0.0.N: Trace Attempt  3	[70.92 s]
0.0.N: Trace Attempt  4	[70.92 s]
0.0.N: Trace Attempt  5	[70.92 s]
0.0.Bm: Trace Attempt 6687	[72.09 s]
0.0.B: Trace Attempt 6671	[72.09 s]
0.0.Ht: Trace Attempt 6894	[72.13 s]
0.0.AM: Trace Attempt 437	[72.17 s]
0.0.Hp: Trace Attempt 1502	[72.71 s]
0.0.N: Trace Attempt 186	[74.93 s]
0.0.Bm: Trace Attempt 6859	[76.10 s]
0.0.B: Trace Attempt 6842	[76.11 s]
0.0.Ht: Trace Attempt 7078	[76.15 s]
0.0.AM: Trace Attempt 470	[76.21 s]
0.0.Hp: Trace Attempt 1531	[76.81 s]
0.0.N: Trace Attempt  1	[77.12 s]
0.0.N: Trace Attempt  2	[77.12 s]
0.0.N: Trace Attempt  3	[77.12 s]
0.0.N: Trace Attempt  4	[77.12 s]
0.0.N: Trace Attempt  5	[77.12 s]
0.0.B: Trace Attempt 7009	[80.12 s]
0.0.Ht: Trace Attempt 7252	[80.17 s]
0.0.Bm: Trace Attempt 7027	[80.16 s]
0.0.AM: Trace Attempt 480	[80.30 s]
0.0.Hp: Trace Attempt 1562	[80.90 s]
0.0.N: Trace Attempt 186	[81.15 s]
0.0.N: Trace Attempt  1	[83.48 s]
0.0.N: Trace Attempt  2	[83.48 s]
0.0.N: Trace Attempt  3	[83.48 s]
0.0.N: Trace Attempt  4	[83.48 s]
0.0.N: Trace Attempt  5	[83.48 s]
0.0.B: Trace Attempt 7175	[84.13 s]
0.0.Bm: Trace Attempt 7195	[84.16 s]
0.0.Ht: Trace Attempt 7428	[84.19 s]
0.0.AM: Trace Attempt 488	[84.62 s]
0.0.Hp: Trace Attempt 1593	[85.01 s]
0.0.N: Trace Attempt 186	[87.50 s]
0.0.B: Trace Attempt 7337	[88.13 s]
0.0.Ht: Trace Attempt 7591	[88.19 s]
0.0.Bm: Trace Attempt 7358	[88.17 s]
0.0.AM: Trace Attempt 500	[88.75 s]
0.0.Hp: Trace Attempt 1623	[89.04 s]
0.0.N: Trace Attempt  1	[89.74 s]
0.0.N: Trace Attempt  2	[89.74 s]
0.0.N: Trace Attempt  3	[89.74 s]
0.0.N: Trace Attempt  4	[89.74 s]
0.0.N: Trace Attempt  5	[89.74 s]
0.0.B: Trace Attempt 7492	[92.13 s]
0.0.Bm: Trace Attempt 7513	[92.17 s]
0.0.Ht: Trace Attempt 7760	[92.21 s]
0.0.AM: Trace Attempt 516	[92.84 s]
0.0.Hp: Trace Attempt 1652	[93.05 s]
0.0.N: Trace Attempt 186	[93.76 s]
0.0.N: Trace Attempt  1	[95.96 s]
0.0.N: Trace Attempt  2	[95.96 s]
0.0.N: Trace Attempt  3	[95.96 s]
0.0.N: Trace Attempt  4	[95.96 s]
0.0.N: Trace Attempt  5	[95.96 s]
0.0.B: Trace Attempt 7645	[96.16 s]
0.0.Bm: Trace Attempt 7666	[96.19 s]
0.0.Ht: Trace Attempt 7928	[96.23 s]
0.0.AM: Trace Attempt 527	[97.02 s]
0.0.Hp: Trace Attempt 1681	[97.12 s]
0.0.N: Trace Attempt 186	[99.97 s]
0.0.B: Trace Attempt 7794	[100.16 s]
0.0.Bm: Trace Attempt 7815	[100.19 s]
0.0.Ht: Trace Attempt 8089	[100.24 s]
0.0.Hp: Trace Attempt 1710	[101.24 s]
0.0.AM: Trace Attempt 541	[101.27 s]
0.0.N: Trace Attempt  1	[102.18 s]
0.0.N: Trace Attempt  2	[102.19 s]
0.0.N: Trace Attempt  3	[102.19 s]
0.0.N: Trace Attempt  4	[102.19 s]
0.0.N: Trace Attempt  5	[102.19 s]
0.0.B: Trace Attempt 7939	[104.17 s]
0.0.Bm: Trace Attempt 7960	[104.20 s]
0.0.Ht: Trace Attempt 8236	[104.24 s]
0.0.Hp: Trace Attempt 1738	[105.30 s]
0.0.AM: Trace Attempt 555	[105.39 s]
0.0.N: Trace Attempt 187	[106.25 s]
0.0.B: Trace Attempt 8080	[108.17 s]
0.0.Bm: Trace Attempt 8102	[108.22 s]
0.0.Ht: Trace Attempt 8387	[108.25 s]
0.0.N: Trace Attempt  1	[108.34 s]
0.0.N: Trace Attempt  2	[108.34 s]
0.0.N: Trace Attempt  3	[108.34 s]
0.0.N: Trace Attempt  4	[108.34 s]
0.0.N: Trace Attempt  5	[108.34 s]
0.0.Hp: Trace Attempt 1766	[109.42 s]
0.0.AM: Trace Attempt 570	[109.62 s]
0.0.B: Trace Attempt 8223	[112.19 s]
0.0.Ht: Trace Attempt 8538	[112.26 s]
0.0.Bm: Trace Attempt 8247	[112.25 s]
0.0.N: Trace Attempt 187	[112.41 s]
0.0.Hp: Trace Attempt 1793	[113.46 s]
0.0.AM: Trace Attempt 581	[113.65 s]
0.0.N: Trace Attempt  1	[114.93 s]
0.0.N: Trace Attempt  2	[114.94 s]
0.0.N: Trace Attempt  3	[114.94 s]
0.0.N: Trace Attempt  4	[114.94 s]
0.0.N: Trace Attempt  5	[114.94 s]
0.0.B: Trace Attempt 8367	[116.21 s]
0.0.Ht: Trace Attempt 8685	[116.26 s]
0.0.Bm: Trace Attempt 8391	[116.27 s]
0.0.Hp: Trace Attempt 1817	[117.46 s]
0.0.AM: Trace Attempt 591	[117.78 s]
0.0.N: Trace Attempt 200	[118.95 s]
0.0.B: Trace Attempt 8509	[120.24 s]
0.0.Ht: Trace Attempt 8835	[120.27 s]
0.0.Bm: Trace Attempt 8532	[120.27 s]
0.0.Hp: Trace Attempt 1841	[121.50 s]
0.0.AM: Trace Attempt 602	[122.06 s]
0.0.N: Trace Attempt 258	[123.06 s]
0.0.Ht: Trace Attempt 8979	[124.28 s]
0.0.B: Trace Attempt 8646	[124.25 s]
0.0.Bm: Trace Attempt 8669	[124.30 s]
0.0.Hp: Trace Attempt 1865	[125.62 s]
0.0.AM: Trace Attempt 613	[126.21 s]
0.0.N: Trace Attempt 305	[127.09 s]
0.0.B: Trace Attempt 8779	[128.27 s]
0.0.Ht: Trace Attempt 9119	[128.30 s]
0.0.Bm: Trace Attempt 8802	[128.31 s]
0.0.Hp: Trace Attempt 1888	[129.73 s]
0.0.AM: Trace Attempt 624	[130.38 s]
0.0.N: Trace Attempt 348	[131.23 s]
0.0.B: Trace Attempt 8909	[132.27 s]
0.0.Ht: Trace Attempt 9247	[132.30 s]
0.0.Bm: Trace Attempt 8932	[132.31 s]
0.0.Hp: Trace Attempt 1911	[133.79 s]
0.0.AM: Trace Attempt 634	[134.60 s]
0.0.N: Trace Attempt 382	[135.26 s]
0.0.B: Trace Attempt 9037	[136.27 s]
0.0.Ht: Trace Attempt 9379	[136.32 s]
0.0.Bm: Trace Attempt 9061	[136.33 s]
0.0.Hp: Trace Attempt 1933	[137.91 s]
0.0.AM: Trace Attempt 643	[138.75 s]
0.0.N: Trace Attempt 415	[139.27 s]
0.0.B: Trace Attempt 9166	[140.27 s]
0.0.Ht: Trace Attempt 9507	[140.34 s]
0.0.Bm: Trace Attempt 9191	[140.35 s]
0.0.Hp: Trace Attempt 1956	[141.99 s]
0.0.AM: Trace Attempt 651	[142.75 s]
0.0.N: Trace Attempt 447	[143.36 s]
0.0.B: Trace Attempt 9290	[144.28 s]
0.0.Ht: Trace Attempt 9633	[144.34 s]
0.0.Bm: Trace Attempt 9315	[144.36 s]
0.0.AM: Trace Attempt 660	[147.06 s]
0.0.B: Trace Attempt 9413	[148.28 s]
0.0.Ht: Trace Attempt 9764	[148.34 s]
0.0.Bm: Trace Attempt 9438	[148.36 s]
0.0.N: Trace Attempt 475	[148.60 s]
0.0.N: Trace Attempt  1	[148.62 s]
0.0.N: Trace Attempt  2	[148.62 s]
0.0.N: Trace Attempt  3	[148.62 s]
0.0.N: Trace Attempt  4	[148.62 s]
0.0.N: Trace Attempt  5	[148.62 s]
0.0.AM: Trace Attempt 669	[151.08 s]
0.0.B: Trace Attempt 9548	[152.31 s]
0.0.Ht: Trace Attempt 9903	[152.35 s]
0.0.Bm: Trace Attempt 9573	[152.38 s]
0.0.N: Trace Attempt 201	[152.64 s]
0.0.Hp: Trace Attempt 1969	[153.42 s]
0.0.AM: Trace Attempt 678	[155.18 s]
0.0.B: Trace Attempt 9672	[156.32 s]
0.0.Ht: Trace Attempt 10032	[156.35 s]
0.0.Bm: Trace Attempt 9698	[156.40 s]
0.0.N: Trace Attempt 258	[156.72 s]
0.0.Hp: Trace Attempt 2012	[157.44 s]
0.0.AM: Trace Attempt 686	[159.32 s]
0.0.B: Trace Attempt 9794	[160.35 s]
0.0.Ht: Trace Attempt 10159	[160.38 s]
0.0.Bm: Trace Attempt 9820	[160.41 s]
0.0.N: Trace Attempt 305	[160.74 s]
0.0.Hp: Trace Attempt 2059	[161.46 s]
0.0.AM: Trace Attempt 694	[163.62 s]
0.0.Ht: Trace Attempt 10277	[164.39 s]
0.0.B: Trace Attempt 9915	[164.36 s]
0.0.Bm: Trace Attempt 9942	[164.43 s]
0.0.N: Trace Attempt 348	[164.74 s]
0.0.Hp: Trace Attempt 2104	[165.48 s]
0.0.AM: Trace Attempt 701	[168.04 s]
0.0.Ht: Trace Attempt 10397	[168.39 s]
0.0.B: Trace Attempt 10033	[168.40 s]
0.0.Bm: Trace Attempt 10062	[168.47 s]
0.0.N: Trace Attempt 382	[168.77 s]
0.0.Hp: Trace Attempt 2150	[169.51 s]
0.0.AM: Trace Attempt 709	[172.10 s]
0.0.Ht: Trace Attempt 10516	[172.42 s]
0.0.B: Trace Attempt 10148	[172.44 s]
0.0.Bm: Trace Attempt 10179	[172.49 s]
0.0.N: Trace Attempt 416	[172.88 s]
0.0.Hp: Trace Attempt 2195	[173.59 s]
0.0.AM: Trace Attempt 718	[176.37 s]
0.0.Ht: Trace Attempt 10631	[176.43 s]
0.0.B: Trace Attempt 10259	[176.45 s]
0.0.Bm: Trace Attempt 10292	[176.52 s]
0.0.N: Trace Attempt 448	[176.90 s]
0.0.Hp: Trace Attempt 2236	[177.69 s]
0.0.Ht: Trace Attempt 10749	[180.44 s]
0.0.B: Trace Attempt 10366	[180.47 s]
0.0.Bm: Trace Attempt 10401	[180.54 s]
0.0.AM: Trace Attempt 727	[180.88 s]
0.0.N: Trace Attempt 475	[180.39 s]
0.0.N: Stopped processing property "DELAY.p1"	[180.94 s].
0.0.N: Morphing to Ncustom1
0.0.N: All properties determined. [0.00 s]
0.0.N: Exited with Success (@ 0.00 s)
0.0.Ncustom1: clocks: 1, declared: 1, looping: 0, posedge: 1, negedge: 0, noedge: 0, bothedge: 0
0.0.Ncustom1: Starting proof for property "DELAY.p1"	[0.00 s].
0.0.Ncustom1: Trace Attempt 475	[0.03 s]
0.0.Tri: Proofgrid shell started at 19288@vlsi-ria84(local) jg_18569_vlsi-ria84_1
0.0.Tri: clocks: 1, declared: 1, looping: 0, posedge: 1, negedge: 0, noedge: 0, bothedge: 0
0.0.Tri: Last scan. Per property time limit: 0s
0.0.Tri: Starting proof for property "DELAY.p1"	[0.00 s].
0.0.Tri: Trace Attempt  1	[0.00 s]
0.0.D: Proofgrid shell started at 19298@vlsi-ria84(local) jg_18569_vlsi-ria84_1
0.0.D: clocks: 1, declared: 1, looping: 0, posedge: 1, negedge: 0, noedge: 0, bothedge: 0
0.0.D: Last scan. Per property time limit: 0s
0.0.D: Starting proof for property "DELAY.p1"	[0.00 s].
0.0.D: Trace Attempt  1	[0.00 s]
0.0.D: Trace Attempt  2	[0.00 s]
0.0.D: Trace Attempt  4	[0.00 s]
0.0.Tri:    0.00" ---- Launching main thread ----
0.0.B: Trace Attempt 10376	[180.88 s]
0.0.B: Stopped processing property "DELAY.p1"	[181.04 s].
0.0.B: Morphing to Bcustom2
0.0.B: All properties determined. [0.00 s]
0.0.B: Exited with Success (@ 0.00 s)
0.0.Bcustom2: clocks: 1, declared: 1, looping: 0, posedge: 1, negedge: 0, noedge: 0, bothedge: 0
0.0.Bcustom2: Starting proof for property "DELAY.p1"	[0.00 s].
0.0.Bcustom2: Trace Attempt  1	[0.00 s]
0.0.Bcustom2: Trace Attempt  2	[0.00 s]
0.0.Bcustom2: Trace Attempt  1	[0.00 s]
0.0.Bcustom2: Trace Attempt  2	[0.00 s]
0.0.Bcustom2: Trace Attempt  3	[0.00 s]
0.0.Bcustom2: Trace Attempt  4	[0.00 s]
0.0.Bcustom2: Trace Attempt  5	[0.00 s]
0.0.Bcustom2: Trace Attempt  1	[0.00 s]
0.0.Bcustom2: Trace Attempt  2	[0.00 s]
0.0.Bcustom2: Trace Attempt  3	[0.00 s]
0.0.Bcustom2: Trace Attempt  4	[0.00 s]
0.0.Bcustom2: Trace Attempt  5	[0.00 s]
0.0.AM: Stopped processing property "DELAY.p1"	[181.05 s].
0.0.AM: Morphing to AMcustom3
0.0.AM: All properties determined. [0.00 s]
0.0.AM: Exited with Success (@ 0.00 s)
0.0.Bcustom2: Trace Attempt  1	[0.00 s]
0.0.Bcustom2: Trace Attempt  2	[0.00 s]
0.0.Bcustom2: Trace Attempt  3	[0.00 s]
0.0.Bcustom2: Trace Attempt  4	[0.00 s]
0.0.Bcustom2: Trace Attempt  5	[0.00 s]
0.0.Bcustom2: Trace Attempt  1	[0.01 s]
0.0.Bcustom2: Trace Attempt  2	[0.01 s]
0.0.Bcustom2: Trace Attempt  3	[0.01 s]
0.0.Bcustom2: Trace Attempt  4	[0.01 s]
0.0.Bcustom2: Trace Attempt  5	[0.01 s]
0.0.AMcustom3: clocks: 1, declared: 1, looping: 0, posedge: 1, negedge: 0, noedge: 0, bothedge: 0
0.0.AMcustom3: Starting proof for property "DELAY.p1"	[0.00 s].
0.0.AMcustom3: Trace Attempt  1	[0.00 s]
0.0.AMcustom3: Trace Attempt  2	[0.00 s]
0.0.AMcustom3: Trace Attempt  3	[0.00 s]
0.0.AMcustom3: Trace Attempt  4	[0.00 s]
0.0.AMcustom3: Trace Attempt  5	[0.00 s]
0.0.AMcustom3: Trace Attempt  1	[0.00 s]
0.0.AMcustom3: Trace Attempt  2	[0.00 s]
0.0.AMcustom3: Trace Attempt  3	[0.00 s]
0.0.AMcustom3: Trace Attempt  4	[0.00 s]
0.0.AMcustom3: Trace Attempt  5	[0.00 s]
0.0.AMcustom3: Trace Attempt  1	[0.01 s]
0.0.Bcustom2: Trace Attempt  1	[0.02 s]
0.0.Bcustom2: Trace Attempt  2	[0.02 s]
0.0.Bcustom2: Trace Attempt  3	[0.02 s]
0.0.Bcustom2: Trace Attempt  4	[0.02 s]
0.0.Bcustom2: Trace Attempt  5	[0.02 s]
0.0.AMcustom3: Trace Attempt  2	[0.01 s]
0.0.AMcustom3: Trace Attempt  3	[0.01 s]
0.0.AMcustom3: Trace Attempt  4	[0.01 s]
0.0.AMcustom3: Trace Attempt  5	[0.01 s]
0.0.Bcustom2: Trace Attempt  1	[0.04 s]
0.0.Bcustom2: Trace Attempt  2	[0.04 s]
0.0.Bcustom2: Trace Attempt  3	[0.04 s]
0.0.Bcustom2: Trace Attempt  4	[0.04 s]
0.0.Bcustom2: Trace Attempt  5	[0.04 s]
0.0.AMcustom3: Trace Attempt  1	[0.04 s]
0.0.AMcustom3: Trace Attempt  2	[0.04 s]
0.0.AMcustom3: Trace Attempt  3	[0.04 s]
0.0.AMcustom3: Trace Attempt  4	[0.04 s]
0.0.AMcustom3: Trace Attempt  5	[0.04 s]
0.0.Tri:    0.10" ---- Launching abstraction thread ----
0.0.Bcustom2: Trace Attempt  1	[0.09 s]
0.0.Bcustom2: Trace Attempt  2	[0.09 s]
0.0.Bcustom2: Trace Attempt  3	[0.09 s]
0.0.Bcustom2: Trace Attempt  4	[0.09 s]
0.0.Bcustom2: Trace Attempt  5	[0.09 s]
0.0.Tri:    0.12" ---- Launching multi-phase simplification thread ----
0.0.AMcustom3: Trace Attempt  1	[0.14 s]
0.0.AMcustom3: Trace Attempt  2	[0.14 s]
0.0.AMcustom3: Trace Attempt  3	[0.14 s]
0.0.AMcustom3: Trace Attempt  4	[0.14 s]
0.0.AMcustom3: Trace Attempt  5	[0.14 s]
0.0.Tri:    0.18" ---- Launching liveness simplification thread ----
0.0.Bcustom2: Trace Attempt  1	[0.22 s]
0.0.Bcustom2: Trace Attempt  2	[0.22 s]
0.0.Bcustom2: Trace Attempt  3	[0.22 s]
0.0.Bcustom2: Trace Attempt  4	[0.22 s]
0.0.Bcustom2: Trace Attempt  5	[0.22 s]
0.0.AMcustom3: Trace Attempt  1	[0.58 s]
0.0.AMcustom3: Trace Attempt  2	[0.58 s]
0.0.AMcustom3: Trace Attempt  3	[0.58 s]
0.0.AMcustom3: Trace Attempt  4	[0.58 s]
0.0.AMcustom3: Trace Attempt  5	[0.58 s]
0.0.Hp: Trace Attempt 2277	[181.72 s]
0.0.Tri:    1.03" Simplification phase 1 complete
0.0.Ncustom1: Requesting engine job to terminate
0.0.Bcustom2: Requesting engine job to terminate
0.0.AMcustom3: Requesting engine job to terminate
0.0.Tri: Requesting engine job to terminate
0.0.D: Requesting engine job to terminate
0.0.Hp: Requesting engine job to terminate
0.0.Ht: Requesting engine job to terminate
0.0.Bm: Requesting engine job to terminate
INFO (IPF144): 0: Initiating shutdown of proof [182.15 s]
0.0.Tri: A proof was found: No trace exists. [1.11 s]
INFO (IPF057): 0.0.Tri: The property "DELAY.p1" was proven in 1.11 s.
0.0.D: Trace Attempt 64	[0.69 s]
0.0.D: Stopped processing property "DELAY.p1"	[1.08 s].
0.0.D: All properties determined. [1.08 s]
0.0.AMcustom3: Trace Attempt 65	[1.02 s]
0.0.D: Exited with Success (@ 182.16 s)
0: ProofGrid usable level: 0
0.0.AMcustom3: Stopped processing property "DELAY.p1"	[1.04 s].
0.0.AMcustom3: All properties determined. [1.04 s]
0.0.Ncustom1: Stopped processing property "DELAY.p1"	[1.20 s].
0.0.Ncustom1: All properties determined. [1.21 s]
0.0.Hp: Trace Attempt 2282	[182.12 s]
0.0.Hp: All properties determined. [182.16 s]
0.0.Ht: Trace Attempt 10795	[182.10 s]
0.0.Ht: All properties determined. [182.13 s]
0.0.Ncustom1: Exited with Success (@ 182.17 s)
0.0.AMcustom3: Exited with Success (@ 182.18 s)
0.0.Bm: Trace Attempt 10441	[182.09 s]
0.0.Bm: All properties determined. [182.19 s]
0.0.Bm: Exited with Success (@ 182.26 s)
0.0.Ht: Exited with Success (@ 182.30 s)
0.0.Hp: Exited with Success (@ 182.32 s)
0.0.Tri: Stopped processing property "DELAY.p1"	[1.31 s].
0.0.Tri: All properties determined. [1.31 s]
0.0.Tri: Exited with Success (@ 182.35 s)
0.0.Bcustom2: Trace Attempt  1	[2.06 s]
0.0.Bcustom2: Stopped processing property "DELAY.p1"	[2.06 s].
0.0.Bcustom2: All properties determined. [2.06 s]
0.0.Bcustom2: Exited with Success (@ 183.18 s)
0: --------------------------------------------------------------
ProofGrid Summary (utilization 99.95 %)
--------------------------------------------------------------
     engines started                               :    14
     engine jobs started                           :    11

    Average time in state (seconds)
    ------------------------------------------------------
    Engine  Pending     Running        Dead    Utilization
    ------------------------------------------------------
     Hp        0.03      182.15        0.00       99.98 %
     Ht        0.03      182.12        0.00       99.98 %
     Bm        0.05      182.10        0.00       99.97 %
    Mpcustom4        0.03        0.00        0.00        0.78 %
     Oh        0.03        0.00        0.00        0.70 %
      L        0.04        0.00        0.00        3.49 %
    Ncustom1        0.03      182.14        0.00       99.98 %
    Bcustom2        0.05      181.93        0.00       99.97 %
    AMcustom3        0.05      181.93        0.00       99.97 %
    Tri        0.07        1.12        0.00       93.79 %
      D        0.09        1.08        0.00       92.58 %
    all        0.05       99.51        0.00       99.95 %

    Total time in state (seconds)
    -----------------------------------------
            Pending     Running        Dead  
    -----------------------------------------
               0.52     1094.58        0.00

    Data read    : 7.00 MiB
    Data written : 4.18 kiB

0: All pending notifications were processed.
INFO (IPF059): 0: Completed proof on task: "<embedded>"

==============================================================
SUMMARY
==============================================================
           Properties Considered              : 2
                 assertions                   : 1
                  - proven                    : 1 (100%)
                  - bounded_proven (user)     : 0 (0%)
                  - bounded_proven (auto)     : 0 (0%)
                  - marked_proven             : 0 (0%)
                  - cex                       : 0 (0%)
                  - ar_cex                    : 0 (0%)
                  - undetermined              : 0 (0%)
                  - unknown                   : 0 (0%)
                  - error                     : 0 (0%)
                 covers                       : 1
                  - unreachable               : 0 (0%)
                  - bounded_unreachable (user): 0 (0%)
                  - covered                   : 1 (100%)
                  - ar_covered                : 0 (0%)
                  - undetermined              : 0 (0%)
                  - unknown                   : 0 (0%)
                  - error                     : 0 (0%)
determined
[<embedded>] % exit -force
[<embedded>] % INFO (IPL005): Received request to exit from the console.
INFO (IPL014): Waiting for the Tcl-thread to exit.
INFO: Waiting for proof threads to stop...
INFO: Proof threads stopped.
INFO (IPL018): The peak resident set memory use for this session was 2.141 GB.
INFO (IPL015): The Tcl-thread exited with status 0.
INFO (IPL016): Exiting the analysis session with status 0.
Finished delay_8.tcl successfully
