Jasper Apps 2024.06p002 64 bits 2024.09.02 16:28:38 UTC

Any disclosure about the Cadence Design Systems software or its use
model to any third party violates the written Non-Disclosure Agreement
between Cadence Design Systems, Inc. and the customer.

THIS SOFTWARE CONTAINS CONFIDENTIAL INFORMATION AND TRADE SECRETS OF
CADENCE DESIGN SYSTEMS, INC. USE, DISCLOSURE, OR REPRODUCTION IS
PROHIBITED WITHOUT THE PRIOR EXPRESS WRITTEN PERMISSION OF CADENCE
DESIGN SYSTEMS, INC.

Copyright (C) 2000-2024 Cadence Design Systems, Inc. All Rights
Reserved.  Unpublished -- rights reserved under the copyright laws of
the United States.

This product includes software developed by others and redistributed
according to license agreement. See doc/third_party_readme.txt for
further details.

RESTRICTED RIGHTS LEGEND

Use, duplication, or disclosure by the Government is subject to
restrictions as set forth in subparagraph (c) (1) (ii) of the Rights in
Technical Data and Computer Software clause at DFARS 252.227-7013 or
subparagraphs (c) (1) and (2) of Commercial Computer Software -- Restricted
Rights at 48 CFR 52.227-19, as applicable.


                          Cadence Design Systems, Inc.
                          2655 Seely Avenue
                          San Jose, CA 95134
                          Phone: 408.943.1234

For technical assistance visit http://support.cadence.com.

Jasper Apps Analysis Session - /users/rompel/jasper_executions/safety_liveness/jgprojects/load_store_6/sessionLogs/session_0

WARNING (WG017): [session]: The system's locale is "ANSI_X3.4-1968", which is not UTF-8. Non-ASCII characters might not be handled correctly.
WARNING (WG017): [jg_console]: The system's locale is "ANSI_X3.4-1968", which is not UTF-8. Non-ASCII characters might not be handled correctly.
INFO: successfully checked out license "jasper_fao".
INFO: reading configuration file "/users/rompel/.config/cadence/jasper.conf".
% analyze -sv09 ../load_store_6.sv
[-- (VERI-1482)] Analyzing Verilog file '/tools/cadence2425/JASPER/jasper_2024.06p002/lib/verilog/packages/std/std.sv' into library 'std'
[-- (VERI-1482)] Analyzing Verilog file '../load_store_6.sv'
% elaborate -bbox_mul 1000000 -bbox_div 1000000 -bbox_mod 1000000 -bbox_a 1000000
[INFO (HIER-8002)] ../load_store_6.sv(23): Disabling old hierarchical reference handler
[INFO (VERI-1018)] ../load_store_6.sv(1): compiling module 'Load_Store'
[WARN (VERI-1209)] ../load_store_6.sv(10): expression size 32 truncated to fit in target size 14
[WARN (VERI-1209)] ../load_store_6.sv(12): expression size 32 truncated to fit in target size 14
[INFO (VERI-8005)] ../load_store_6.sv(5): Unintentional sequential element inferred for m read before write using blocking assignment
[INFO (VERI-8005)] ../load_store_6.sv(4): Unintentional sequential element inferred for vol read before write using blocking assignment
[INFO (VERI-8005)] ../load_store_6.sv(1): Unintentional sequential element inferred for sig read before write using blocking assignment
INFO (ISW003): Top module name is "Load_Store".
INFO (INL208): Elaboration synthesis summary:
  Number of synthesized netlists          1 (0 packages)
  Single run mode                         On
  Pipeline                                On (1 pipelined netlists)
  Late hierarchical reference connection  On
  Number of analyzed Verilog modules      1 (1 synthesized)
  Number of analyzed VHDL entities        0 (0 synthesized)
INFO (INL003): Clearing all state information (assumes, stopats, and so forth).
Load_Store
[<embedded>] % reset rst
INFO (IPM031): Clearing proof results of all properties.
INFO (IRS006): Current reset condition is "rst".
[<embedded>] % clock clk
[<embedded>] % prove -all
Ncustom1: Custom engine code is hT3Ng7hPPfiYQOTDZ3qhYOwGAM51eA+J/FjkM5shLioAsqhgLR4Ft+O1BuKG6ilQ83B9tLXSl+CwjiTMAQA
Bcustom2: Custom engine code is hT3Nm7hPr1Vp3Di1Ra2USNIGL4JypRnLKLAdF6JAyuavO2JfGCiY9OZJhcAcOUnLx5xwNdhILGrAWX9s+z2WDkKwNR7tAfClBEjRFVQeq6DU54boFgEA
AMcustom3: Custom engine code is hT3Ng7hP/feYQOTDZ3qhYOwGAM51eA+J/FjkM5shLioAsqhgLR4Ft+O1BuKG6ilQ83B9tLXSmmqwm7g9AQA
Mpcustom4: Custom engine code is hT3NZbhP9fmY2AbBQnsjfOxn6c+6e6yL+/e8fZFmaQrnlgEA
INFO (IPF036): Starting proof on task: "<embedded>", 1 properties to prove with 0 already proven/unreachable
INFO (IRS029): Starting reset analysis: phase 1 of 4.
INFO (IRS030): Running reset analysis: phase 2 of 4.
INFO (IRS031): Running reset analysis: phase 3 of 4.
INFO (IRS020): Starting the reset analysis simulation with a limit of 100 iterations (phase 4 of 4).
INFO (IRS024): Reset iterations 0 to 4 analyzed.
INFO (IRS018): Reset analysis simulation executed for 3 iterations. Assigned values for 16 of 16 design flops, 0 of 0 design latches, 3 of 3 internal elements.
INFO (IRS039): Reset analysis complete.
INFO (IPF031): Settings used for proof thread 0:
    orchestration                 = on
    time_limit                    = 86400s
    per_property_time_limit       = 1s * 10 ^ scan
    engine_mode                   = auto
    proofgrid_per_engine_max_jobs = 1
    max engine jobs               = auto
    proofgrid_mode                = local
    proofgrid_restarts            = 10
0: Using multistage preprocessing
0: Starting reduce
AMcustom5: Custom engine code is hT3N1rhP11/52HrFRS21ROp2LOjVTgPvT8L8BGXHgLhaIuqtT4nARFjUqrBL+7pLmaTOzBepZW/Jm8SSrHDybSQtoNiO3y43wk+dEoWlsZizu97Fih6O6lPVG/LpWP5SsUPwlGagLNa1FKEFvwVXyX7//8prySbvSxIHXr5er+z4RAEA
Ncustom6: Custom engine code is hT3OXrhPByJp3TrFSTLhUmMH4KVtJgmTCnNDF46yMXOKY48m4LS5nE7yBzFjA7kDuwO/GhGUpEPiky3p3wmPn3dJZHxFMsafSoObRzSC+tn7sEY0WbTdZ/FV4hL3MYH/b1CIUvXSWR4wqEoVLsmMOD4xIPT4lI1LO6ZCO7PnnWQuLwetnvKlrXx6wCW/A+x+enqslg1YPobi4wEF/EvbzOvcTYdJvl2s4H2yZg2b2ofAVN5WvhWk1HoBAA
ADcustom7: Custom engine code is hT3Nv7hPv1752HrFRa2kROx2f/ECJeZB2AZsLdlO8VwmIuqtT4nIDFXclhg+O+o+DMmQCekbheGk0kK28laA9gaOFDXsQp29J3X615HY1IPHJWd6FUFvCHjO+p1k652b5JJvZlShNpGlGSXAiQe/mEAj6tEBAA
Tricustom8: Custom engine code is hT3Nu7hPt1752DvFRa0kNDiyIV97VyejwM9C/jCLJjdPvusZONHY42VYUy0Q1ZotnhcVtNc56tJ5wbxv6V2+XpdsaSlHck5vfnbYjdwj1OECy9U+7oSQ0SZE3g5ayD+Phuh4odCJTjeKa2k4elM9ldQfkAEA
Gcustom9: Custom engine code is hT3NibhPDfeYQADBZnYcglOvK9Pfd7EOeniIqP8jNsyIqInncipMGcUXqAadachREE9F2PwhBUZUNw5kHnd4JdXkamORRgEA
C2custom10: Custom engine code is hT3NirhPjfWYQADBZnYcglOvK9Pfd7EOeniIqP8jNsyIqInncgkrYMMXCYbdK0dUjZIF9d4cJ0rHoBDjwVLBKuG86XYVV00BAA
AGcustom11: Custom engine code is hT3NirhP/fmYQADBZnYcglOvK9Pfd7EOeniIqP8jNsyIqInnckcwYMMXCYbdK0dUjZIF9d4cJ0rHoBDjwVLBKuHEZnZByh0BAA
Bcustom12: Custom engine code is hT3NjrhPDfiYQADBZnYcglOvK9PfWxFtenjIyBqfrgr7if/jL/yPOuK1BAflEcW0DxNH2eDIoezN2gxlQFg81RZtiWXh7aiTAidvAQA
0: Finished reduce in 0s
Ncustom13: Custom engine code is hT3NR7hPByFp3TrFSTLhUmMH4KWtJglTyV/c51BHEeZWamnJv767nE6PCak26bd3gf3XGN3rIRheufhDieCJQVISo+gNYUKhiUedBKGtsP/a18svAnlMJZudHxDFwK5ufsyoxsIyiAeSY2oi3tEuoDHr5gw42DFKAG3PqO3CEsl8Azzdt3pl5nGA1Ifv2H02eYsFzWb/nfp8PMb3F0krE/EgBcm8TD9Div8BAA
Tricustom14: Custom engine code is hT3Nu7hP3fiYQADBZnYcglNHp9bfd7EOeniIqP/ji8sGLQu8yhsFO+wxJ+O+R0bU8g/IewXFomyos+viQnWc2xYNYmMqpo3i40O7DaZR7qfp4YqNx26KRvQ/qx0BAA
0.0.PRE: Performing Proof Simplification...
0.0.N: clocks: 1, declared: 1, looping: 0, posedge: 1, negedge: 0, noedge: 0, bothedge: 0
0.0.N: Proof Simplification Iteration 1	[0.00 s]
0.0.N: Proof Simplification Iteration 2	[0.00 s]
0.0.N: Proof Simplification Iteration 3	[0.00 s]
0.0.PRE: A proof was found: No trace exists. [0.00 s]
INFO (IPF057): 0.0.PRE: The property ":noDeadEnd" was proven in 0.00 s.
    Use check_assumptions -show -dead_end to show this property in the property table.
0.0.PRE: A proof was found: No trace exists. [0.00 s]
INFO (IPF057): 0.0.PRE: The property ":noConflict" was proven in 0.00 s.
    Use check_assumptions -show to show this property in the property table.
INFO (IPF047): 0.0.PRE: The cover property ":live" was covered in 1 cycles in 0.00 s.
    Use check_assumptions -show -live to show this property in the property table.
0.0.PRE: Proof Simplification completed in 0.00 s
0: About to start ProofGrid in its own thread with a limit of 10000 pending notifications and a limit of 10 traces.
0: =============================== ProofGrid start ===============================
0: ProofGrid usable level: 1
0: Initial ProofGrid level: 1
0: ProofGrid is starting event handling
0.0.N: Proofgrid shell started at 20973@vlsi-ria84(local) jg_20906_vlsi-ria84_1
0.0.Hp: Proofgrid shell started at 20974@vlsi-ria84(local) jg_20906_vlsi-ria84_1
0.0.N: clocks: 1, declared: 1, looping: 0, posedge: 1, negedge: 0, noedge: 0, bothedge: 0
0.0.N: Last scan. Per property time limit: 0s
0.0.N: Starting proof for property "Load_Store.p1"	[0.00 s].
0.0.N: Trace Attempt  1	[0.00 s]
0.0.Hp: clocks: 1, declared: 1, looping: 0, posedge: 1, negedge: 0, noedge: 0, bothedge: 0
0.0.Hp: Last scan. Per property time limit: 0s
0.0.Hp: Trace Attempt  1	[0.00 s]
0.0.Hp: Trace Attempt  2	[0.00 s]
0.0.Hp: Trace Attempt  3	[0.00 s]
0.0.Hp: Trace Attempt  4	[0.00 s]
0.0.Hp: Trace Attempt  5	[0.00 s]
0.0.N: Trace Attempt  2	[0.00 s]
0.0.N: Trace Attempt  2	[0.00 s]
0.0.N: Trace Attempt  3	[0.00 s]
0.0.N: Trace Attempt  3	[0.00 s]
0.0.N: Trace Attempt  4	[0.00 s]
0.0.N: Trace Attempt  5	[0.00 s]
0.0.N: Trace Attempt  5	[0.00 s]
0.0.N: Trace Attempt  1	[0.01 s]
0.0.N: Trace Attempt  2	[0.02 s]
0.0.N: Trace Attempt  3	[0.02 s]
0.0.N: Trace Attempt  4	[0.02 s]
0.0.N: Trace Attempt  5	[0.02 s]
0.0.B: Proofgrid shell started at 21007@vlsi-ria84(local) jg_20906_vlsi-ria84_1
0.0.Ht: Proofgrid shell started at 21005@vlsi-ria84(local) jg_20906_vlsi-ria84_1
0.0.AM: Proofgrid shell started at 21008@vlsi-ria84(local) jg_20906_vlsi-ria84_1
0.0.Ht: clocks: 1, declared: 1, looping: 0, posedge: 1, negedge: 0, noedge: 0, bothedge: 0
0.0.Ht: Last scan. Per property time limit: 0s
0.0.Ht: Trace Attempt  1	[0.00 s]
0.0.Ht: Trace Attempt  2	[0.00 s]
0.0.Ht: Trace Attempt  3	[0.00 s]
0.0.Ht: Trace Attempt  4	[0.00 s]
0.0.Ht: Trace Attempt  5	[0.00 s]
0.0.B: clocks: 1, declared: 1, looping: 0, posedge: 1, negedge: 0, noedge: 0, bothedge: 0
0.0.B: Last scan. Per property time limit: 0s
0.0.B: Starting proof for property "Load_Store.p1"	[0.00 s].
0.0.B: Trace Attempt  1	[0.00 s]
0.0.B: Trace Attempt  2	[0.00 s]
0.0.B: Trace Attempt  3	[0.00 s]
0.0.B: Trace Attempt  4	[0.00 s]
0.0.B: Trace Attempt  5	[0.00 s]
0.0.AM: clocks: 1, declared: 1, looping: 0, posedge: 1, negedge: 0, noedge: 0, bothedge: 0
0.0.AM: Last scan. Per property time limit: 0s
0.0.AM: Starting proof for property "Load_Store.p1"	[0.00 s].
0.0.AM: Trace Attempt  1	[0.00 s]
0.0.AM: Trace Attempt  2	[0.00 s]
0.0.AM: Trace Attempt  3	[0.00 s]
0.0.AM: Trace Attempt  4	[0.00 s]
0.0.AM: Trace Attempt  5	[0.00 s]
0.0.AM: Trace Attempt  1	[0.00 s]
0.0.AM: Trace Attempt  2	[0.00 s]
0.0.AM: Trace Attempt  3	[0.00 s]
0.0.AM: Trace Attempt  4	[0.01 s]
0.0.AM: Trace Attempt  5	[0.01 s]
0.0.Oh: Proofgrid shell started at 21006@vlsi-ria84(local) jg_20906_vlsi-ria84_1
0.0.AM: Trace Attempt  1	[0.02 s]
0.0.AM: Trace Attempt  2	[0.02 s]
0.0.AM: Trace Attempt  3	[0.02 s]
0.0.Oh: clocks: 1, declared: 1, looping: 0, posedge: 1, negedge: 0, noedge: 0, bothedge: 0
0.0.Oh: Reached length limit (2147483647) [0.00 s]
0.0.Oh: Exited with Success (@ 0.05 s)
0.0.Oh: Completed, Restart ignored.
0.0.AM: Trace Attempt  4	[0.02 s]
0.0.AM: Trace Attempt  5	[0.02 s]
0.0.AM: Trace Attempt  1	[0.06 s]
0.0.AM: Trace Attempt  2	[0.06 s]
0.0.AM: Trace Attempt  3	[0.06 s]
0.0.AM: Trace Attempt  4	[0.06 s]
0.0.AM: Trace Attempt  5	[0.07 s]
0.0.N: Trace Attempt  1	[0.18 s]
0.0.N: Trace Attempt  2	[0.18 s]
0.0.N: Trace Attempt  3	[0.18 s]
0.0.N: Trace Attempt  4	[0.18 s]
0.0.N: Trace Attempt  5	[0.18 s]
0.0.AM: Trace Attempt  1	[0.20 s]
0.0.AM: Trace Attempt  2	[0.20 s]
0.0.AM: Trace Attempt  3	[0.20 s]
0.0.AM: Trace Attempt  4	[0.21 s]
0.0.AM: Trace Attempt  5	[0.21 s]
0.0.N: Trace Attempt  1	[0.74 s]
0.0.N: Trace Attempt  2	[0.74 s]
0.0.N: Trace Attempt  3	[0.75 s]
0.0.N: Trace Attempt  4	[0.75 s]
0.0.N: Trace Attempt  5	[0.75 s]
0.0.AM: Trace Attempt  1	[0.74 s]
0.0.AM: Trace Attempt  2	[0.74 s]
0.0.AM: Trace Attempt  3	[0.74 s]
0.0.AM: Trace Attempt  4	[0.74 s]
0.0.AM: Trace Attempt  5	[0.74 s]
0.0.AM: Trace Attempt  1	[2.07 s]
0.0.AM: Trace Attempt  2	[2.07 s]
0.0.AM: Trace Attempt  3	[2.07 s]
0.0.AM: Trace Attempt  4	[2.07 s]
0.0.AM: Trace Attempt  5	[2.07 s]
0.0.N: Trace Attempt  1	[2.25 s]
0.0.N: Trace Attempt  2	[2.25 s]
0.0.N: Trace Attempt  3	[2.25 s]
0.0.N: Trace Attempt  4	[2.25 s]
0.0.N: Trace Attempt  5	[2.25 s]
0.0.N: Trace Attempt  1	[3.41 s]
0.0.N: Trace Attempt  2	[3.41 s]
0.0.N: Trace Attempt  3	[3.41 s]
0.0.N: Trace Attempt  4	[3.41 s]
0.0.N: Trace Attempt  5	[3.41 s]
0.0.Hp: Trace Attempt 444	[4.02 s]
0.0.B: Trace Attempt 1905	[4.00 s]
0.0.Ht: Trace Attempt 2051	[4.00 s]
0.0.N: Trace Attempt  1	[5.47 s]
0.0.N: Trace Attempt  2	[5.47 s]
0.0.N: Trace Attempt  3	[5.47 s]
0.0.N: Trace Attempt  4	[5.47 s]
0.0.N: Trace Attempt  5	[5.47 s]
0.0.AM: Trace Attempt 165	[6.09 s]
0.0.Hp: Trace Attempt 617	[8.02 s]
0.0.Ht: Trace Attempt 2812	[8.00 s]
0.0.B: Trace Attempt 2655	[8.00 s]
0.0.N: Trace Attempt 153	[9.48 s]
0.0.AM: Trace Attempt 258	[10.12 s]
0.0.AM: Trace Attempt  1	[10.17 s]
0.0.AM: Trace Attempt  2	[10.17 s]
0.0.AM: Trace Attempt  3	[10.17 s]
0.0.AM: Trace Attempt  4	[10.17 s]
0.0.AM: Trace Attempt  5	[10.17 s]
0.0.B: Trace Attempt 3205	[12.00 s]
0.0.Ht: Trace Attempt 3360	[12.01 s]
0.0.N: Trace Attempt  1	[13.32 s]
0.0.N: Trace Attempt  2	[13.32 s]
0.0.N: Trace Attempt  3	[13.32 s]
0.0.N: Trace Attempt  4	[13.32 s]
0.0.N: Trace Attempt  5	[13.32 s]
0.0.Hp: Trace Attempt 712	[13.74 s]
0.0.AM: Trace Attempt 178	[14.19 s]
0.0.B: Trace Attempt 3688	[16.01 s]
0.0.Ht: Trace Attempt 3873	[16.01 s]
0.0.N: Trace Attempt 157	[17.33 s]
0.0.Hp: Trace Attempt 847	[17.76 s]
0.0.AM: Trace Attempt 233	[18.24 s]
0.0.B: Trace Attempt 4105	[20.01 s]
0.0.Ht: Trace Attempt 4315	[20.01 s]
0.0.N: Trace Attempt  1	[20.55 s]
0.0.N: Trace Attempt  2	[20.55 s]
0.0.N: Trace Attempt  3	[20.55 s]
0.0.N: Trace Attempt  4	[20.56 s]
0.0.N: Trace Attempt  5	[20.56 s]
0.0.Hp: Trace Attempt 948	[21.76 s]
0.0.AM: Trace Attempt 289	[22.28 s]
0.0.B: Trace Attempt 4494	[24.01 s]
0.0.Ht: Trace Attempt 4709	[24.02 s]
0.0.N: Trace Attempt 170	[24.60 s]
0.0.Hp: Trace Attempt 1054	[25.78 s]
0.0.AM: Trace Attempt 334	[26.35 s]
0.0.N: Trace Attempt  1	[27.88 s]
0.0.N: Trace Attempt  2	[27.88 s]
0.0.N: Trace Attempt  3	[27.89 s]
0.0.N: Trace Attempt  4	[27.89 s]
0.0.N: Trace Attempt  5	[27.89 s]
0.0.B: Trace Attempt 4843	[28.02 s]
0.0.Ht: Trace Attempt 5070	[28.03 s]
0.0.Hp: Trace Attempt 1160	[29.80 s]
0.0.AM: Trace Attempt 371	[30.36 s]
0.0.N: Trace Attempt 169	[31.89 s]
0.0.B: Trace Attempt 5166	[32.03 s]
0.0.Ht: Trace Attempt 5393	[32.03 s]
0.0.Hp: Trace Attempt 1267	[33.81 s]
0.0.AM: Trace Attempt 414	[34.41 s]
0.0.N: Trace Attempt  1	[35.19 s]
0.0.N: Trace Attempt  2	[35.19 s]
0.0.N: Trace Attempt  3	[35.19 s]
0.0.N: Trace Attempt  4	[35.19 s]
0.0.N: Trace Attempt  5	[35.19 s]
0.0.B: Trace Attempt 5460	[36.04 s]
0.0.Ht: Trace Attempt 5703	[36.05 s]
0.0.Hp: Trace Attempt 1362	[37.82 s]
0.0.AM: Trace Attempt 449	[38.48 s]
0.0.N: Trace Attempt 155	[39.20 s]
0.0.B: Trace Attempt 5733	[40.04 s]
0.0.Ht: Trace Attempt 5997	[40.05 s]
0.0.Hp: Trace Attempt 1448	[41.86 s]
0.0.AM: Trace Attempt 417	[42.48 s]
0.0.N: Trace Attempt  1	[42.69 s]
0.0.N: Trace Attempt  2	[42.69 s]
0.0.N: Trace Attempt  3	[42.69 s]
0.0.N: Trace Attempt  4	[42.69 s]
0.0.N: Trace Attempt  5	[42.69 s]
0.0.B: Trace Attempt 5971	[44.05 s]
0.0.Ht: Trace Attempt 6249	[44.06 s]
0.0.Hp: Trace Attempt 1525	[45.87 s]
0.0.AM: Trace Attempt  1	[46.53 s]
0.0.AM: Trace Attempt  2	[46.53 s]
0.0.AM: Trace Attempt  3	[46.53 s]
0.0.AM: Trace Attempt  4	[46.54 s]
0.0.AM: Trace Attempt  5	[46.54 s]
0.0.N: Trace Attempt 169	[46.70 s]
0.0.B: Trace Attempt 6214	[48.06 s]
0.0.Ht: Trace Attempt 6509	[48.07 s]
0.0.Hp: Trace Attempt 1603	[49.87 s]
0.0.N: Trace Attempt  1	[49.95 s]
0.0.N: Trace Attempt  2	[49.95 s]
0.0.N: Trace Attempt  3	[49.95 s]
0.0.N: Trace Attempt  4	[49.95 s]
0.0.N: Trace Attempt  5	[49.95 s]
0.0.AM: Trace Attempt 177	[50.61 s]
0.0.B: Trace Attempt 6463	[52.07 s]
0.0.Ht: Trace Attempt 6784	[52.08 s]
0.0.Hp: Trace Attempt 1678	[53.90 s]
0.0.N: Trace Attempt 169	[54.00 s]
0.0.AM: Trace Attempt 256	[54.65 s]
0.0.B: Trace Attempt 6702	[56.07 s]
0.0.Ht: Trace Attempt 7049	[56.09 s]
0.0.N: Trace Attempt  1	[57.30 s]
0.0.N: Trace Attempt  2	[57.30 s]
0.0.N: Trace Attempt  3	[57.30 s]
0.0.N: Trace Attempt  4	[57.30 s]
0.0.N: Trace Attempt  5	[57.30 s]
0.0.Hp: Trace Attempt 1748	[57.92 s]
0.0.AM: Trace Attempt 351	[59.02 s]
0.0.B: Trace Attempt 6931	[60.07 s]
0.0.Ht: Trace Attempt 7293	[60.10 s]
0.0.N: Trace Attempt 170	[61.36 s]
0.0.Hp: Trace Attempt 1816	[61.94 s]
0.0.AM: Trace Attempt 391	[63.14 s]
0.0.B: Trace Attempt 7154	[64.08 s]
0.0.Ht: Trace Attempt 7524	[64.10 s]
0.0.N: Trace Attempt  1	[64.56 s]
0.0.N: Trace Attempt  2	[64.56 s]
0.0.N: Trace Attempt  3	[64.56 s]
0.0.N: Trace Attempt  4	[64.57 s]
0.0.N: Trace Attempt  5	[64.57 s]
0.0.Hp: Trace Attempt 1881	[65.96 s]
0.0.AM: Trace Attempt 427	[67.22 s]
0.0.B: Trace Attempt 7366	[68.10 s]
0.0.Ht: Trace Attempt 7756	[68.11 s]
0.0.N: Trace Attempt 155	[68.57 s]
0.0.Hp: Trace Attempt 1944	[70.03 s]
0.0.AM: Trace Attempt 473	[71.22 s]
0.0.N: Trace Attempt  1	[72.00 s]
0.0.N: Trace Attempt  2	[72.00 s]
0.0.N: Trace Attempt  3	[72.00 s]
0.0.N: Trace Attempt  4	[72.00 s]
0.0.N: Trace Attempt  5	[72.01 s]
0.0.B: Trace Attempt 7571	[72.11 s]
0.0.Ht: Trace Attempt 7980	[72.12 s]
0.0.Hp: Trace Attempt 2001	[74.05 s]
0.0.AM: Trace Attempt 518	[75.31 s]
0.0.N: Trace Attempt 170	[76.07 s]
0.0.Ht: Trace Attempt 8198	[76.13 s]
0.0.B: Trace Attempt 7771	[76.13 s]
0.0.Hp: Trace Attempt 2061	[78.11 s]
0.0.N: Trace Attempt  1	[79.23 s]
0.0.N: Trace Attempt  2	[79.23 s]
0.0.N: Trace Attempt  3	[79.23 s]
0.0.N: Trace Attempt  4	[79.24 s]
0.0.N: Trace Attempt  5	[79.24 s]
0.0.AM: Trace Attempt 561	[79.34 s]
0.0.Ht: Trace Attempt 8405	[80.13 s]
0.0.B: Trace Attempt 7964	[80.14 s]
0.0.Hp: Trace Attempt 2118	[82.14 s]
0.0.N: Trace Attempt 170	[83.30 s]
0.0.AM: Trace Attempt 600	[83.37 s]
0.0.Ht: Trace Attempt 8605	[84.14 s]
0.0.B: Trace Attempt 8154	[84.15 s]
0.0.Hp: Trace Attempt 2173	[86.21 s]
0.0.N: Trace Attempt  1	[86.51 s]
0.0.N: Trace Attempt  2	[86.51 s]
0.0.N: Trace Attempt  3	[86.51 s]
0.0.N: Trace Attempt  4	[86.51 s]
0.0.N: Trace Attempt  5	[86.51 s]
0.0.AM: Trace Attempt 635	[87.37 s]
0.0.Ht: Trace Attempt 8812	[88.14 s]
0.0.B: Trace Attempt 8344	[88.16 s]
0.0.Hp: Trace Attempt 2226	[90.21 s]
0.0.N: Trace Attempt 170	[90.57 s]
0.0.AM: Trace Attempt 664	[91.54 s]
0.0.Ht: Trace Attempt 9014	[92.16 s]
0.0.B: Trace Attempt 8532	[92.16 s]
0.0.N: Trace Attempt  1	[93.77 s]
0.0.N: Trace Attempt  2	[93.77 s]
0.0.N: Trace Attempt  3	[93.77 s]
0.0.N: Trace Attempt  4	[93.77 s]
0.0.N: Trace Attempt  5	[93.77 s]
0.0.Hp: Trace Attempt 2278	[94.26 s]
0.0.AM: Trace Attempt 700	[95.58 s]
0.0.B: Trace Attempt 8712	[96.16 s]
0.0.Ht: Trace Attempt 9209	[96.16 s]
0.0.N: Trace Attempt 154	[97.82 s]
0.0.Hp: Trace Attempt 2327	[98.26 s]
0.0.AM: Trace Attempt 734	[99.58 s]
0.0.Ht: Trace Attempt 9383	[100.16 s]
0.0.B: Trace Attempt 8886	[100.18 s]
0.0.N: Trace Attempt  1	[101.37 s]
0.0.N: Trace Attempt  2	[101.37 s]
0.0.N: Trace Attempt  3	[101.37 s]
0.0.N: Trace Attempt  4	[101.37 s]
0.0.N: Trace Attempt  5	[101.37 s]
0.0.Hp: Trace Attempt 2377	[102.33 s]
0.0.AM: Trace Attempt 768	[103.65 s]
0.0.B: Trace Attempt 9057	[104.18 s]
0.0.Ht: Trace Attempt 9562	[104.18 s]
0.0.N: Trace Attempt 155	[105.38 s]
0.0.Hp: Trace Attempt 2426	[106.38 s]
0.0.AM: Trace Attempt 804	[107.66 s]
0.0.Ht: Trace Attempt 9740	[108.19 s]
0.0.B: Trace Attempt 9232	[108.19 s]
0.0.N: Trace Attempt  1	[108.80 s]
0.0.N: Trace Attempt  2	[108.80 s]
0.0.N: Trace Attempt  3	[108.80 s]
0.0.N: Trace Attempt  4	[108.80 s]
0.0.N: Trace Attempt  5	[108.81 s]
0.0.Hp: Trace Attempt 2473	[110.42 s]
0.0.AM: Trace Attempt 837	[111.73 s]
0.0.B: Trace Attempt 9399	[112.20 s]
0.0.Ht: Trace Attempt 9917	[112.21 s]
0.0.N: Trace Attempt 155	[112.84 s]
0.0.Hp: Trace Attempt 2519	[114.43 s]
0.0.AM: Trace Attempt 872	[115.79 s]
0.0.B: Trace Attempt 9562	[116.21 s]
0.0.Ht: Trace Attempt 10071	[116.21 s]
0.0.N: Trace Attempt  1	[116.25 s]
0.0.N: Trace Attempt  2	[116.26 s]
0.0.N: Trace Attempt  3	[116.26 s]
0.0.N: Trace Attempt  4	[116.26 s]
0.0.N: Trace Attempt  5	[116.26 s]
0.0.Hp: Trace Attempt 2565	[118.51 s]
0.0.AM: Trace Attempt 878	[119.88 s]
0.0.B: Trace Attempt 9727	[120.21 s]
0.0.Ht: Trace Attempt 10240	[120.22 s]
0.0.N: Trace Attempt 169	[120.27 s]
0.0.Hp: Trace Attempt 2610	[122.57 s]
0.0.N: Trace Attempt  1	[123.97 s]
0.0.N: Trace Attempt  2	[123.98 s]
0.0.N: Trace Attempt  3	[123.98 s]
0.0.N: Trace Attempt  4	[123.98 s]
0.0.N: Trace Attempt  5	[123.98 s]
0.0.AM: Trace Attempt 885	[124.10 s]
0.0.B: Trace Attempt 9885	[124.21 s]
0.0.Ht: Trace Attempt 10402	[124.24 s]
0.0.Hp: Trace Attempt 2653	[126.61 s]
0.0.N: Trace Attempt 205	[128.01 s]
0.0.B: Trace Attempt 10042	[128.21 s]
0.0.Ht: Trace Attempt 10562	[128.25 s]
0.0.Hp: Trace Attempt 2696	[130.65 s]
0.0.AM: Trace Attempt 889	[131.58 s]
0.0.N: Trace Attempt 289	[132.02 s]
0.0.B: Trace Attempt 10198	[132.21 s]
0.0.Ht: Trace Attempt 10726	[132.27 s]
0.0.Hp: Trace Attempt 2738	[134.66 s]
0.0.AM: Trace Attempt 893	[135.74 s]
0.0.N: Trace Attempt 381	[136.02 s]
0.0.B: Trace Attempt 10351	[136.22 s]
0.0.Ht: Trace Attempt 10875	[136.27 s]
0.0.Hp: Trace Attempt 2780	[138.76 s]
0.0.N: Trace Attempt 426	[140.07 s]
0.0.AM: Trace Attempt 900	[140.07 s]
0.0.B: Trace Attempt 10500	[140.24 s]
0.0.Ht: Trace Attempt 11027	[140.28 s]
0.0.Hp: Trace Attempt 2820	[142.78 s]
0.0.AM: Trace Attempt 908	[144.09 s]
0.0.B: Trace Attempt 10643	[144.25 s]
0.0.Ht: Trace Attempt 11168	[144.30 s]
0.0.N: Trace Attempt 439	[144.89 s]
0.0.N: Trace Attempt  1	[144.90 s]
0.0.N: Trace Attempt  2	[144.90 s]
0.0.N: Trace Attempt  3	[144.90 s]
0.0.N: Trace Attempt  4	[144.90 s]
0.0.N: Trace Attempt  5	[144.90 s]
0.0.Hp: Trace Attempt 2859	[146.85 s]
0.0.B: Trace Attempt 10785	[148.26 s]
0.0.Ht: Trace Attempt 11313	[148.32 s]
0.0.AM: Trace Attempt 912	[148.56 s]
0.0.N: Trace Attempt 169	[148.92 s]
0.0.Hp: Trace Attempt 2898	[150.87 s]
0.0.B: Trace Attempt 10925	[152.26 s]
0.0.Ht: Trace Attempt 11459	[152.35 s]
0.0.N: Trace Attempt 240	[152.93 s]
0.0.AM: Trace Attempt 917	[153.60 s]
0.0.Hp: Trace Attempt 2936	[154.89 s]
0.0.B: Trace Attempt 11062	[156.29 s]
0.0.Ht: Trace Attempt 11602	[156.35 s]
0.0.N: Trace Attempt 278	[156.99 s]
0.0.Hp: Trace Attempt 2972	[158.91 s]
0.0.B: Trace Attempt 11189	[160.31 s]
0.0.Ht: Trace Attempt 11734	[160.37 s]
0.0.N: Trace Attempt 318	[161.06 s]
0.0.AM: Trace Attempt 517	[163.05 s]
0.0.B: Trace Attempt 11316	[164.31 s]
0.0.Ht: Trace Attempt 11859	[164.40 s]
0.0.N: Trace Attempt 353	[165.10 s]
0.0.AM: Trace Attempt 612	[167.16 s]
0.0.B: Trace Attempt 11439	[168.34 s]
0.0.Ht: Trace Attempt 11986	[168.41 s]
0.0.N: Trace Attempt 394	[169.16 s]
0.0.AM: Trace Attempt 675	[171.18 s]
0.0.B: Trace Attempt 11563	[172.35 s]
0.0.Ht: Trace Attempt 12108	[172.41 s]
0.0.N: Trace Attempt 435	[173.20 s]
0.0.AM: Trace Attempt 825	[175.18 s]
0.0.B: Trace Attempt 11686	[176.38 s]
0.0.Ht: Trace Attempt 12235	[176.43 s]
0.0.N: Trace Attempt  1	[176.97 s]
0.0.N: Trace Attempt  2	[176.97 s]
0.0.N: Trace Attempt  3	[176.97 s]
0.0.N: Trace Attempt  4	[176.98 s]
0.0.N: Trace Attempt  5	[176.98 s]
0.0.Hp: Trace Attempt 2999	[178.84 s]
0.0.AM: Trace Attempt 936	[179.22 s]
0.0.B: Trace Attempt 11803	[180.42 s]
0.0.Ht: Trace Attempt 12359	[180.45 s]
0.0.N: Trace Attempt 168	[180.96 s]
0.0.N: Stopped processing property "Load_Store.p1"	[181.00 s].
0.0.N: Morphing to Ncustom1
0.0.N: All properties determined. [0.00 s]
0.0.N: Exited with Success (@ 0.00 s)
0.0.Ncustom1: clocks: 1, declared: 1, looping: 0, posedge: 1, negedge: 0, noedge: 0, bothedge: 0
0.0.Ncustom1: Starting proof for property "Load_Store.p1"	[0.00 s].
0.0.Tri: Proofgrid shell started at 21273@vlsi-ria84(local) jg_20906_vlsi-ria84_1
0.0.Tri: clocks: 1, declared: 1, looping: 0, posedge: 1, negedge: 0, noedge: 0, bothedge: 0
0.0.Tri: Last scan. Per property time limit: 0s
0.0.Tri: Starting proof for property "Load_Store.p1"	[0.00 s].
0.0.Tri: Trace Attempt  1	[0.00 s]
0.0.Ncustom1: Trace Attempt 448	[0.06 s]
0.0.Tri:    0.00" ---- Launching main thread ----
0.0.B: Trace Attempt 11818	[180.95 s]
0.0.B: Stopped processing property "Load_Store.p1"	[181.08 s].
0.0.B: Morphing to Bcustom2
0.0.B: All properties determined. [0.00 s]
0.0.B: Exited with Success (@ 0.00 s)
0.0.Bcustom2: clocks: 1, declared: 1, looping: 0, posedge: 1, negedge: 0, noedge: 0, bothedge: 0
0.0.Bcustom2: Starting proof for property "Load_Store.p1"	[0.00 s].
0.0.Bcustom2: Trace Attempt  1	[0.00 s]
0.0.Bcustom2: Trace Attempt  2	[0.00 s]
0.0.Bcustom2: Trace Attempt  1	[0.00 s]
0.0.Bcustom2: Trace Attempt  2	[0.00 s]
0.0.Bcustom2: Trace Attempt  3	[0.00 s]
0.0.Bcustom2: Trace Attempt  1	[0.00 s]
0.0.Bcustom2: Trace Attempt  2	[0.00 s]
0.0.Bcustom2: Trace Attempt  3	[0.00 s]
0.0.Bcustom2: Trace Attempt  4	[0.00 s]
0.0.Bcustom2: Trace Attempt  5	[0.00 s]
0.0.Bcustom2: Trace Attempt  1	[0.00 s]
0.0.Bcustom2: Trace Attempt  2	[0.00 s]
0.0.Bcustom2: Trace Attempt  3	[0.00 s]
0.0.Bcustom2: Trace Attempt  4	[0.00 s]
0.0.Bcustom2: Trace Attempt  5	[0.00 s]
0.0.Tri:    0.02" ---- Launching abstraction thread ----
0.0.Bcustom2: Trace Attempt  1	[0.01 s]
0.0.Bcustom2: Trace Attempt  2	[0.01 s]
0.0.Bcustom2: Trace Attempt  3	[0.01 s]
0.0.Bcustom2: Trace Attempt  4	[0.01 s]
0.0.Bcustom2: Trace Attempt  5	[0.01 s]
0.0.Tri:    0.02" ---- Launching multi-phase simplification thread ----
0.0.Bcustom2: Trace Attempt  1	[0.01 s]
0.0.Bcustom2: Trace Attempt  2	[0.01 s]
0.0.Bcustom2: Trace Attempt  3	[0.01 s]
0.0.Bcustom2: Trace Attempt  4	[0.01 s]
0.0.Bcustom2: Trace Attempt  5	[0.01 s]
0.0.Bcustom2: Trace Attempt  1	[0.02 s]
0.0.Bcustom2: Trace Attempt  2	[0.02 s]
0.0.Bcustom2: Trace Attempt  3	[0.02 s]
0.0.Bcustom2: Trace Attempt  4	[0.02 s]
0.0.Bcustom2: Trace Attempt  5	[0.02 s]
0.0.Tri:    0.04" ---- Launching liveness simplification thread ----
0.0.Bcustom2: Trace Attempt  1	[0.04 s]
0.0.Bcustom2: Trace Attempt  2	[0.04 s]
0.0.Bcustom2: Trace Attempt  3	[0.04 s]
0.0.Bcustom2: Trace Attempt  4	[0.04 s]
0.0.Bcustom2: Trace Attempt  5	[0.04 s]
0.0.Bcustom2: Trace Attempt  1	[0.10 s]
0.0.Bcustom2: Trace Attempt  2	[0.10 s]
0.0.Bcustom2: Trace Attempt  3	[0.10 s]
0.0.Bcustom2: Trace Attempt  4	[0.10 s]
0.0.Bcustom2: Trace Attempt  5	[0.10 s]
0.0.Bcustom2: Trace Attempt  1	[0.24 s]
0.0.Bcustom2: Trace Attempt  2	[0.24 s]
0.0.Bcustom2: Trace Attempt  3	[0.24 s]
0.0.Bcustom2: Trace Attempt  4	[0.24 s]
0.0.Bcustom2: Trace Attempt  5	[0.24 s]
0.0.AM: Trace Attempt 983	[181.36 s]
0.0.AM: Stopped processing property "Load_Store.p1"	[181.40 s].
0.0.AM: Morphing to AMcustom3
0.0.AM: All properties determined. [0.00 s]
0.0.AM: Exited with Success (@ 0.00 s)
0.0.AMcustom3: clocks: 1, declared: 1, looping: 0, posedge: 1, negedge: 0, noedge: 0, bothedge: 0
0.0.AMcustom3: Starting proof for property "Load_Store.p1"	[0.00 s].
0.0.AMcustom3: Trace Attempt  1	[0.00 s]
0.0.AMcustom3: Trace Attempt  2	[0.00 s]
0.0.AMcustom3: Trace Attempt  3	[0.00 s]
0.0.AMcustom3: Trace Attempt  4	[0.00 s]
0.0.AMcustom3: Trace Attempt  5	[0.00 s]
0.0.AMcustom3: Trace Attempt  1	[0.00 s]
0.0.AMcustom3: Trace Attempt  2	[0.00 s]
0.0.AMcustom3: Trace Attempt  3	[0.01 s]
0.0.AMcustom3: Trace Attempt  4	[0.01 s]
0.0.AMcustom3: Trace Attempt  5	[0.01 s]
0.0.AMcustom3: Trace Attempt  1	[0.02 s]
0.0.AMcustom3: Trace Attempt  2	[0.02 s]
0.0.AMcustom3: Trace Attempt  3	[0.02 s]
0.0.AMcustom3: Trace Attempt  4	[0.02 s]
0.0.AMcustom3: Trace Attempt  5	[0.03 s]
0.0.AMcustom3: Trace Attempt  1	[0.06 s]
0.0.AMcustom3: Trace Attempt  2	[0.06 s]
0.0.AMcustom3: Trace Attempt  3	[0.06 s]
0.0.AMcustom3: Trace Attempt  4	[0.07 s]
0.0.AMcustom3: Trace Attempt  5	[0.07 s]
0.0.AMcustom3: Trace Attempt  1	[0.21 s]
0.0.AMcustom3: Trace Attempt  2	[0.21 s]
0.0.AMcustom3: Trace Attempt  3	[0.21 s]
0.0.AMcustom3: Trace Attempt  4	[0.21 s]
0.0.AMcustom3: Trace Attempt  5	[0.21 s]
0.0.Tri:    0.85" Simplification phase 1 complete
0.0.Ncustom1: Requesting engine job to terminate
0.0.Bcustom2: Requesting engine job to terminate
0.0.AMcustom3: Requesting engine job to terminate
0.0.Tri: Requesting engine job to terminate
0.0.Hp: Requesting engine job to terminate
0.0.Ht: Requesting engine job to terminate
INFO (IPF144): 0: Initiating shutdown of proof [182.02 s]
0.0.Tri: A proof was found: No trace exists. [0.96 s]
INFO (IPF057): 0.0.Tri: The property "Load_Store.p1" was proven in 0.96 s.
0.0.AMcustom3: Trace Attempt 50	[0.58 s]
0.0.AMcustom3: Stopped processing property "Load_Store.p1"	[0.59 s].
0.0.AMcustom3: All properties determined. [0.60 s]
0.0.AMcustom3: Exited with Success (@ 182.04 s)
0: ProofGrid usable level: 0
0.0.Ncustom1: Stopped processing property "Load_Store.p1"	[1.04 s].
0.0.Ncustom1: All properties determined. [1.04 s]
0.0.Ncustom1: Exited with Success (@ 182.04 s)
0.0.Ht: Trace Attempt 12408	[181.99 s]
0.0.Ht: All properties determined. [182.01 s]
0.0.Ht: Exited with Success (@ 182.16 s)
0.0.Tri: Stopped processing property "Load_Store.p1"	[1.12 s].
0.0.Tri: All properties determined. [1.12 s]
0.0.Tri: Exited with Success (@ 182.18 s)
0.0.Hp: All properties determined. [182.51 s]
0.0.Hp: Exited with Success (@ 182.67 s)
0.0.Bcustom2: Trace Attempt  1	[2.37 s]
0.0.Bcustom2: Stopped processing property "Load_Store.p1"	[2.37 s].
0.0.Bcustom2: All properties determined. [2.37 s]
0.0.Bcustom2: Exited with Success (@ 183.50 s)
0: --------------------------------------------------------------
ProofGrid Summary (utilization 99.97 %)
--------------------------------------------------------------
     engines started                               :    10
     engine jobs started                           :     7

    Average time in state (seconds)
    ------------------------------------------------------
    Engine  Pending     Running        Dead    Utilization
    ------------------------------------------------------
     Hp        0.03      182.02        0.00       99.98 %
     Ht        0.03      181.99        0.00       99.98 %
     Oh        0.05        0.00        0.00        5.39 %
    Ncustom1        0.03      182.00        0.00       99.98 %
    Bcustom2        0.03      181.86        0.00       99.98 %
    AMcustom3        0.03      181.55        0.00       99.98 %
    Tri        0.06        0.96        0.00       94.14 %
    all        0.04      130.06        0.00       99.97 %

    Total time in state (seconds)
    -----------------------------------------
            Pending     Running        Dead  
    -----------------------------------------
               0.26      910.39        0.00

    Data read    : 6.66 MiB
    Data written : 3.06 kiB

0: All pending notifications were processed.
INFO (IPF059): 0: Completed proof on task: "<embedded>"

==============================================================
SUMMARY
==============================================================
           Properties Considered              : 1
                 assertions                   : 1
                  - proven                    : 1 (100%)
                  - bounded_proven (user)     : 0 (0%)
                  - bounded_proven (auto)     : 0 (0%)
                  - marked_proven             : 0 (0%)
                  - cex                       : 0 (0%)
                  - ar_cex                    : 0 (0%)
                  - undetermined              : 0 (0%)
                  - unknown                   : 0 (0%)
                  - error                     : 0 (0%)
                 covers                       : 0
                  - unreachable               : 0
                  - bounded_unreachable (user): 0
                  - covered                   : 0
                  - ar_covered                : 0
                  - undetermined              : 0
                  - unknown                   : 0
                  - error                     : 0
proven
[<embedded>] % exit -force
[<embedded>] % INFO (IPL005): Received request to exit from the console.
INFO: Waiting for proof threads to stop...
INFO: Proof threads stopped.
INFO (IPL018): The peak resident set memory use for this session was 1.932 GB.
INFO (IPL014): Waiting for the Tcl-thread to exit.
INFO (IPL015): The Tcl-thread exited with status 0.
INFO (IPL016): Exiting the analysis session with status 0.
Finished load_store_6.tcl successfully
