# ----------------------------------------
# Jasper Version Info
# tool      : Jasper 2024.06
# platform  : Linux 3.10.0-1160.62.1.el7.x86_64
# version   : 2024.06p002 64 bits
# build date: 2024.09.02 16:28:38 UTC
# ----------------------------------------
# started   : 2025-11-18 08:49:46 IST
# hostname  : vlsi-ria84.vlsidomain
# pid       : 1628
# arguments : '-label' 'session_0' '-console' '//127.0.0.1:32773' '-nowindow' '-style' 'windows' '-exitonerror' '-data' 'AAAA6nicY2RgYLCp////PwMYMD6A0Aw2jAyoAMRnQhUJbEChGRhYYZphSliAmItBl6GAoYghnyELyLNi0ANCfSA7HS6aypDMUMJQDBQtYcgA8ooYcoHiyUBcClSTAxSJZzBkMAbq5gGalcSQCFSXDFTJwKBGQIceWGUO2C0AqRMdaw==' '-proj' '/users/rompel/jasper_executions/safety_liveness/jgprojects/thermocouple_13/sessionLogs/session_0' '-init' '-hidden' '/users/rompel/jasper_executions/safety_liveness/jgprojects/thermocouple_13/.tmp/.initCmds.tcl' 'thermocouple_13.tcl' '-hidden' '/users/rompel/jasper_executions/safety_liveness/jgprojects/thermocouple_13/.tmp/.postCmds.tcl'

Any disclosure about the Cadence Design Systems software or its use
model to any third party violates the written Non-Disclosure Agreement
between Cadence Design Systems, Inc. and the customer.

THIS SOFTWARE CONTAINS CONFIDENTIAL INFORMATION AND TRADE SECRETS OF
CADENCE DESIGN SYSTEMS, INC. USE, DISCLOSURE, OR REPRODUCTION IS
PROHIBITED WITHOUT THE PRIOR EXPRESS WRITTEN PERMISSION OF CADENCE
DESIGN SYSTEMS, INC.

Copyright (C) 2000-2024 Cadence Design Systems, Inc. All Rights
Reserved.  Unpublished -- rights reserved under the copyright laws of
the United States.

This product includes software developed by others and redistributed
according to license agreement. See doc/third_party_readme.txt for
further details.

RESTRICTED RIGHTS LEGEND

Use, duplication, or disclosure by the Government is subject to
restrictions as set forth in subparagraph (c) (1) (ii) of the Rights in
Technical Data and Computer Software clause at DFARS 252.227-7013 or
subparagraphs (c) (1) and (2) of Commercial Computer Software -- Restricted
Rights at 48 CFR 52.227-19, as applicable.


                          Cadence Design Systems, Inc.
                          2655 Seely Avenue
                          San Jose, CA 95134
                          Phone: 408.943.1234

For technical assistance visit http://support.cadence.com.

Jasper Apps Analysis Session - /users/rompel/jasper_executions/safety_liveness/jgprojects/thermocouple_13/sessionLogs/session_0

WARNING (WG017): [session]: The system's locale is "ANSI_X3.4-1968", which is not UTF-8. Non-ASCII characters might not be handled correctly.
WARNING (WG017): [jg_console]: The system's locale is "ANSI_X3.4-1968", which is not UTF-8. Non-ASCII characters might not be handled correctly.
INFO: successfully checked out license "jasper_fao".
INFO: reading configuration file "/users/rompel/.config/cadence/jasper.conf".
% analyze -sv09 ../thermocouple_13.sv
[-- (VERI-1482)] Analyzing Verilog file '/tools/cadence2425/JASPER/jasper_2024.06p002/lib/verilog/packages/std/std.sv' into library 'std'
[-- (VERI-1482)] Analyzing Verilog file '../thermocouple_13.sv'
% elaborate -bbox_mul 1000000 -bbox_div 1000000 -bbox_mod 1000000 -bbox_a 1000000
[INFO (HIER-8002)] ../thermocouple_13.sv(46): Disabling old hierarchical reference handler
[INFO (VERI-1018)] ../thermocouple_13.sv(1): compiling module 'Thermocouple'
[WARN (VERI-1209)] ../thermocouple_13.sv(18): expression size 32 truncated to fit in target size 15
[WARN (VERI-1209)] ../thermocouple_13.sv(37): expression size 32 truncated to fit in target size 15
[INFO (VERI-8005)] ../thermocouple_13.sv(1): Unintentional sequential element inferred for tc_temp_data read before write using blocking assignment
[INFO (VERI-8005)] ../thermocouple_13.sv(1): Unintentional sequential element inferred for junction_temp_data read before write using blocking assignment
[INFO (VERI-8005)] ../thermocouple_13.sv(1): Unintentional sequential element inferred for fault_bits read before write using blocking assignment
[INFO (VERI-8005)] ../thermocouple_13.sv(5): Unintentional sequential element inferred for state read before write using blocking assignment
[INFO (VERI-8005)] ../thermocouple_13.sv(6): Unintentional sequential element inferred for cnt read before write using blocking assignment
INFO (ISW003): Top module name is "Thermocouple".
INFO (INL208): Elaboration synthesis summary:
  Number of synthesized netlists          1 (0 packages)
  Single run mode                         On
  Pipeline                                On (1 pipelined netlists)
  Late hierarchical reference connection  On
  Number of analyzed Verilog modules      1 (1 synthesized)
  Number of analyzed VHDL entities        0 (0 synthesized)
INFO (INL003): Clearing all state information (assumes, stopats, and so forth).
Thermocouple
[<embedded>] % reset rst
INFO (IPM031): Clearing proof results of all properties.
INFO (IRS006): Current reset condition is "rst".
[<embedded>] % clock clk
[<embedded>] % prove -all
Ncustom1: Custom engine code is hT3Ng7hPPfiYQOTDZ3qhYOwGAM51eA+J/FjkM5shLioAsqhgLR4Ft+O1BuKG6ilQ83B9tLXSl+CwjiTMAQA
Bcustom2: Custom engine code is hT3Nm7hPr1Vp3Di1Ra2USNIGL4JypRnLKLAdF6JAyuavO2JfGCiY9OZJhcAcOUnLx5xwNdhILGrAWX9s+z2WDkKwNR7tAfClBEjRFVQeq6DU54boFgEA
AMcustom3: Custom engine code is hT3Ng7hP/feYQOTDZ3qhYOwGAM51eA+J/FjkM5shLioAsqhgLR4Ft+O1BuKG6ilQ83B9tLXSmmqwm7g9AQA
Mpcustom4: Custom engine code is hT3NZbhP9fmY2AbBQnsjfOxn6c+6e6yL+/e8fZFmaQrnlgEA
INFO (IPF036): Starting proof on task: "<embedded>", 1 properties to prove with 0 already proven/unreachable
INFO (IRS029): Starting reset analysis: phase 1 of 4.
INFO (IRS030): Running reset analysis: phase 2 of 4.
INFO (IRS031): Running reset analysis: phase 3 of 4.
INFO (IRS020): Starting the reset analysis simulation with a limit of 100 iterations (phase 4 of 4).
INFO (IRS024): Reset iterations 0 to 4 analyzed.
INFO (IRS018): Reset analysis simulation executed for 3 iterations. Assigned values for 48 of 48 design flops, 0 of 0 design latches, 3 of 3 internal elements.
INFO (IRS039): Reset analysis complete.
INFO (IPF031): Settings used for proof thread 0:
    orchestration                 = on
    time_limit                    = 86400s
    per_property_time_limit       = 1s * 10 ^ scan
    engine_mode                   = auto
    proofgrid_per_engine_max_jobs = 1
    max engine jobs               = auto
    proofgrid_mode                = local
    proofgrid_restarts            = 10
0: Using multistage preprocessing
AMcustom5: Custom engine code is hT3N1rhP11/52HrFRS21ROp2LOjVTgPvT8L8BGXHgLhaIuqtT4nARFjUqrBL+7pLmaTOzBepZW/Jm8SSrHDybSQtoNiO3y43wk+dEoWlsZizu97Fih6O6lPVG/LpWP5SsUPwlGagLNa1FKEFvwVXyX7//8prySbvSxIHXr5er+z4RAEA
0: Starting reduce
Ncustom6: Custom engine code is hT3OXrhPByJp3TrFSTLhUmMH4KVtJgmTCnNDF46yMXOKY48m4LS5nE7yBzFjA7kDuwO/GhGUpEPiky3p3wmPn3dJZHxFMsafSoObRzSC+tn7sEY0WbTdZ/FV4hL3MYH/b1CIUvXSWR4wqEoVLsmMOD4xIPT4lI1LO6ZCO7PnnWQuLwetnvKlrXx6wCW/A+x+enqslg1YPobi4wEF/EvbzOvcTYdJvl2s4H2yZg2b2ofAVN5WvhWk1HoBAA
ADcustom7: Custom engine code is hT3Nv7hPv1752HrFRa2kROx2f/ECJeZB2AZsLdlO8VwmIuqtT4nIDFXclhg+O+o+DMmQCekbheGk0kK28laA9gaOFDXsQp29J3X615HY1IPHJWd6FUFvCHjO+p1k652b5JJvZlShNpGlGSXAiQe/mEAj6tEBAA
Tricustom8: Custom engine code is hT3Nu7hPt1752DvFRa0kNDiyIV97VyejwM9C/jCLJjdPvusZONHY42VYUy0Q1ZotnhcVtNc56tJ5wbxv6V2+XpdsaSlHck5vfnbYjdwj1OECy9U+7oSQ0SZE3g5ayD+Phuh4odCJTjeKa2k4elM9ldQfkAEA
Gcustom9: Custom engine code is hT3NibhPDfeYQADBZnYcglOvK9Pfd7EOeniIqP8jNsyIqInncipMGcUXqAadachREE9F2PwhBUZUNw5kHnd4JdXkamORRgEA
C2custom10: Custom engine code is hT3NirhPjfWYQADBZnYcglOvK9Pfd7EOeniIqP8jNsyIqInncgkrYMMXCYbdK0dUjZIF9d4cJ0rHoBDjwVLBKuG86XYVV00BAA
AGcustom11: Custom engine code is hT3NirhP/fmYQADBZnYcglOvK9Pfd7EOeniIqP8jNsyIqInnckcwYMMXCYbdK0dUjZIF9d4cJ0rHoBDjwVLBKuHEZnZByh0BAA
Bcustom12: Custom engine code is hT3NjrhPDfiYQADBZnYcglOvK9PfWxFtenjIyBqfrgr7if/jL/yPOuK1BAflEcW0DxNH2eDIoezN2gxlQFg81RZtiWXh7aiTAidvAQA
Ncustom13: Custom engine code is hT3NR7hPByFp3TrFSTLhUmMH4KWtJglTyV/c51BHEeZWamnJv767nE6PCak26bd3gf3XGN3rIRheufhDieCJQVISo+gNYUKhiUedBKGtsP/a18svAnlMJZudHxDFwK5ufsyoxsIyiAeSY2oi3tEuoDHr5gw42DFKAG3PqO3CEsl8Azzdt3pl5nGA1Ifv2H02eYsFzWb/nfp8PMb3F0krE/EgBcm8TD9Div8BAA
0: Finished reduce in 0s
Tricustom14: Custom engine code is hT3Nu7hP3fiYQADBZnYcglNHp9bfd7EOeniIqP/ji8sGLQu8yhsFO+wxJ+O+R0bU8g/IewXFomyos+viQnWc2xYNYmMqpo3i40O7DaZR7qfp4YqNx26KRvQ/qx0BAA
0.0.PRE: Performing Proof Simplification...
0.0.N: clocks: 1, declared: 1, looping: 0, posedge: 1, negedge: 0, noedge: 0, bothedge: 0
0.0.N: Proof Simplification Iteration 1	[0.00 s]
0.0.N: Proof Simplification Iteration 2	[0.00 s]
0.0.N: Proof Simplification Iteration 3	[0.00 s]
0.0.PRE: A proof was found: No trace exists. [0.00 s]
INFO (IPF057): 0.0.PRE: The property ":noDeadEnd" was proven in 0.00 s.
    Use check_assumptions -show -dead_end to show this property in the property table.
0.0.PRE: A proof was found: No trace exists. [0.00 s]
INFO (IPF057): 0.0.PRE: The property ":noConflict" was proven in 0.00 s.
    Use check_assumptions -show to show this property in the property table.
INFO (IPF047): 0.0.PRE: The cover property ":live" was covered in 1 cycles in 0.00 s.
    Use check_assumptions -show -live to show this property in the property table.
0.0.PRE: Proof Simplification completed in 0.00 s
0: About to start ProofGrid in its own thread with a limit of 10000 pending notifications and a limit of 10 traces.
0: =============================== ProofGrid start ===============================
0: ProofGrid usable level: 1
0: Initial ProofGrid level: 1
0: ProofGrid is starting event handling
0.0.N: Proofgrid shell started at 1765@vlsi-ria84(local) jg_1628_vlsi-ria84_1
0.0.Hp: Proofgrid shell started at 1767@vlsi-ria84(local) jg_1628_vlsi-ria84_1
0.0.N: clocks: 1, declared: 1, looping: 0, posedge: 1, negedge: 0, noedge: 0, bothedge: 0
0.0.N: Last scan. Per property time limit: 0s
0.0.N: Starting proof for property "Thermocouple.p1"	[0.00 s].
0.0.N: Trace Attempt  1	[0.00 s]
0.0.N: Trace Attempt  2	[0.00 s]
0.0.N: Trace Attempt  2	[0.00 s]
0.0.N: Trace Attempt  3	[0.00 s]
0.0.N: Trace Attempt  4	[0.00 s]
0.0.N: Trace Attempt  4	[0.00 s]
0.0.N: Trace Attempt  5	[0.00 s]
0.0.Hp: clocks: 1, declared: 1, looping: 0, posedge: 1, negedge: 0, noedge: 0, bothedge: 0
0.0.Hp: Last scan. Per property time limit: 0s
0.0.Hp: Trace Attempt  1	[0.00 s]
0.0.Hp: Trace Attempt  2	[0.00 s]
0.0.Hp: Trace Attempt  3	[0.00 s]
0.0.Hp: Trace Attempt  4	[0.00 s]
0.0.Hp: Trace Attempt  5	[0.00 s]
0.0.N: Trace Attempt  1	[0.01 s]
0.0.N: Trace Attempt  2	[0.01 s]
0.0.N: Trace Attempt  3	[0.01 s]
0.0.N: Trace Attempt  4	[0.01 s]
0.0.N: Trace Attempt  5	[0.02 s]
0.0.Ht: Proofgrid shell started at 1803@vlsi-ria84(local) jg_1628_vlsi-ria84_1
0.0.Oh: Proofgrid shell started at 1804@vlsi-ria84(local) jg_1628_vlsi-ria84_1
0.0.Ht: clocks: 1, declared: 1, looping: 0, posedge: 1, negedge: 0, noedge: 0, bothedge: 0
0.0.Oh: clocks: 1, declared: 1, looping: 0, posedge: 1, negedge: 0, noedge: 0, bothedge: 0
0.0.Ht: Last scan. Per property time limit: 0s
0.0.Oh: Reached length limit (2147483647) [0.00 s]
0.0.Ht: Trace Attempt  1	[0.00 s]
0.0.Ht: Trace Attempt  2	[0.00 s]
0.0.Ht: Trace Attempt  3	[0.00 s]
0.0.Ht: Trace Attempt  4	[0.00 s]
0.0.Ht: Trace Attempt  5	[0.00 s]
0.0.Oh: Exited with Success (@ 0.03 s)
0.0.B: Proofgrid shell started at 1805@vlsi-ria84(local) jg_1628_vlsi-ria84_1
0.0.AM: Proofgrid shell started at 1812@vlsi-ria84(local) jg_1628_vlsi-ria84_1
0.0.B: clocks: 1, declared: 1, looping: 0, posedge: 1, negedge: 0, noedge: 0, bothedge: 0
0.0.AM: clocks: 1, declared: 1, looping: 0, posedge: 1, negedge: 0, noedge: 0, bothedge: 0
0.0.B: Last scan. Per property time limit: 0s
0.0.B: Starting proof for property "Thermocouple.p1"	[0.00 s].
0.0.AM: Last scan. Per property time limit: 0s
0.0.AM: Starting proof for property "Thermocouple.p1"	[0.00 s].
0.0.B: Trace Attempt  1	[0.00 s]
0.0.B: Trace Attempt  2	[0.00 s]
0.0.AM: Trace Attempt  1	[0.00 s]
0.0.B: Trace Attempt  3	[0.00 s]
0.0.B: Trace Attempt  4	[0.00 s]
0.0.AM: Trace Attempt  2	[0.00 s]
0.0.B: Trace Attempt  5	[0.00 s]
0.0.AM: Trace Attempt  3	[0.00 s]
0.0.AM: Trace Attempt  4	[0.00 s]
0.0.AM: Trace Attempt  5	[0.00 s]
0.0.AM: Trace Attempt  1	[0.00 s]
0.0.AM: Trace Attempt  2	[0.00 s]
0.0.AM: Trace Attempt  3	[0.00 s]
0.0.AM: Trace Attempt  4	[0.01 s]
0.0.AM: Trace Attempt  1	[0.01 s]
0.0.AM: Trace Attempt  2	[0.01 s]
0.0.AM: Trace Attempt  3	[0.01 s]
0.0.AM: Trace Attempt  4	[0.01 s]
0.0.AM: Trace Attempt  5	[0.02 s]
0.0.AM: Trace Attempt  1	[0.04 s]
0.0.AM: Trace Attempt  2	[0.04 s]
0.0.AM: Trace Attempt  3	[0.04 s]
0.0.AM: Trace Attempt  4	[0.04 s]
0.0.AM: Trace Attempt  5	[0.04 s]
0.0.N: Trace Attempt  1	[0.13 s]
0.0.N: Trace Attempt  2	[0.14 s]
0.0.N: Trace Attempt  3	[0.14 s]
0.0.N: Trace Attempt  4	[0.14 s]
0.0.N: Trace Attempt  5	[0.14 s]
0.0.AM: Trace Attempt  1	[0.14 s]
0.0.AM: Trace Attempt  2	[0.14 s]
0.0.AM: Trace Attempt  3	[0.14 s]
0.0.AM: Trace Attempt  4	[0.14 s]
0.0.AM: Trace Attempt  5	[0.14 s]
0.0.N: Trace Attempt  1	[0.54 s]
0.0.N: Trace Attempt  2	[0.54 s]
0.0.N: Trace Attempt  3	[0.54 s]
0.0.N: Trace Attempt  4	[0.55 s]
0.0.AM: Trace Attempt  1	[0.52 s]
0.0.AM: Trace Attempt  2	[0.52 s]
0.0.AM: Trace Attempt  3	[0.52 s]
0.0.AM: Trace Attempt  4	[0.52 s]
0.0.AM: Trace Attempt  5	[0.52 s]
0.0.AM: Trace Attempt  1	[2.13 s]
0.0.AM: Trace Attempt  2	[2.14 s]
0.0.AM: Trace Attempt  3	[2.14 s]
0.0.AM: Trace Attempt  4	[2.14 s]
0.0.AM: Trace Attempt  5	[2.14 s]
0.0.N: Trace Attempt  1	[2.30 s]
0.0.N: Trace Attempt  2	[2.30 s]
0.0.N: Trace Attempt  3	[2.30 s]
0.0.N: Trace Attempt  4	[2.31 s]
0.0.Hp: Trace Attempt 506	[4.01 s]
0.0.Ht: Trace Attempt 1996	[4.00 s]
0.0.B: Trace Attempt 1889	[4.00 s]
0.0.AM: Trace Attempt 179	[6.18 s]
0.0.N: Trace Attempt 175	[6.34 s]
0.0.Hp: Trace Attempt 715	[8.03 s]
0.0.Ht: Trace Attempt 2716	[8.01 s]
0.0.B: Trace Attempt 2610	[8.01 s]
0.0.N: Trace Attempt  1	[8.61 s]
0.0.N: Trace Attempt  2	[8.62 s]
0.0.N: Trace Attempt  3	[8.62 s]
0.0.N: Trace Attempt  4	[8.62 s]
0.0.N: Trace Attempt  5	[8.62 s]
0.0.AM: Trace Attempt  1	[9.25 s]
0.0.AM: Trace Attempt  2	[9.26 s]
0.0.AM: Trace Attempt  3	[9.26 s]
0.0.AM: Trace Attempt  4	[9.26 s]
0.0.AM: Trace Attempt  5	[9.26 s]
0.0.Hp: Trace Attempt 870	[12.03 s]
0.0.Ht: Trace Attempt 3260	[12.01 s]
0.0.B: Trace Attempt 3141	[12.01 s]
0.0.N: Trace Attempt 180	[12.65 s]
0.0.AM: Trace Attempt 199	[13.29 s]
0.0.N: Trace Attempt  1	[14.93 s]
0.0.N: Trace Attempt  2	[14.93 s]
0.0.N: Trace Attempt  3	[14.93 s]
0.0.N: Trace Attempt  4	[14.94 s]
0.0.N: Trace Attempt  5	[14.94 s]
0.0.Ht: Trace Attempt 3733	[16.01 s]
0.0.B: Trace Attempt 3592	[16.01 s]
0.0.Hp: Trace Attempt 1003	[16.05 s]
0.0.AM: Trace Attempt 259	[17.35 s]
0.0.N: Trace Attempt 179	[18.95 s]
0.0.Ht: Trace Attempt 4148	[20.03 s]
0.0.B: Trace Attempt 3997	[20.02 s]
0.0.Hp: Trace Attempt 1120	[20.08 s]
0.0.N: Trace Attempt  1	[21.38 s]
0.0.N: Trace Attempt  2	[21.38 s]
0.0.N: Trace Attempt  3	[21.38 s]
0.0.N: Trace Attempt  4	[21.39 s]
0.0.N: Trace Attempt  5	[21.39 s]
0.0.AM: Trace Attempt 316	[21.36 s]
0.0.Ht: Trace Attempt 4503	[24.03 s]
0.0.B: Trace Attempt 4365	[24.03 s]
0.0.Hp: Trace Attempt 1224	[24.09 s]
0.0.N: Trace Attempt 179	[25.41 s]
0.0.AM: Trace Attempt 366	[25.41 s]
0.0.N: Trace Attempt  1	[27.72 s]
0.0.N: Trace Attempt  2	[27.72 s]
0.0.N: Trace Attempt  3	[27.72 s]
0.0.N: Trace Attempt  4	[27.72 s]
0.0.N: Trace Attempt  5	[27.72 s]
0.0.B: Trace Attempt 4706	[28.03 s]
0.0.Ht: Trace Attempt 4852	[28.04 s]
0.0.Hp: Trace Attempt 1320	[28.12 s]
0.0.AM: Trace Attempt 409	[29.46 s]
0.0.N: Trace Attempt 179	[31.75 s]
0.0.B: Trace Attempt 5027	[32.04 s]
0.0.Ht: Trace Attempt 5177	[32.05 s]
0.0.Hp: Trace Attempt 1410	[32.17 s]
0.0.AM: Trace Attempt 458	[33.61 s]
0.0.N: Trace Attempt  1	[34.06 s]
0.0.N: Trace Attempt  2	[34.06 s]
0.0.N: Trace Attempt  3	[34.06 s]
0.0.N: Trace Attempt  4	[34.06 s]
0.0.N: Trace Attempt  5	[34.06 s]
0.0.B: Trace Attempt 5309	[36.05 s]
0.0.Ht: Trace Attempt 5461	[36.05 s]
0.0.Hp: Trace Attempt 1491	[36.19 s]
0.0.AM: Trace Attempt 415	[37.70 s]
0.0.N: Trace Attempt 179	[38.11 s]
0.0.Ht: Trace Attempt 5732	[40.06 s]
0.0.B: Trace Attempt 5557	[40.06 s]
0.0.Hp: Trace Attempt 1564	[40.20 s]
0.0.N: Trace Attempt  1	[40.42 s]
0.0.N: Trace Attempt  2	[40.42 s]
0.0.N: Trace Attempt  3	[40.42 s]
0.0.N: Trace Attempt  4	[40.42 s]
0.0.N: Trace Attempt  5	[40.42 s]
0.0.AM: Trace Attempt 513	[41.78 s]
0.0.AM: Trace Attempt  1	[41.87 s]
0.0.AM: Trace Attempt  2	[41.87 s]
0.0.AM: Trace Attempt  3	[41.87 s]
0.0.AM: Trace Attempt  4	[41.88 s]
0.0.AM: Trace Attempt  5	[41.88 s]
0.0.Ht: Trace Attempt 6008	[44.07 s]
0.0.B: Trace Attempt 5810	[44.07 s]
0.0.Hp: Trace Attempt 1638	[44.21 s]
0.0.N: Trace Attempt 180	[44.47 s]
0.0.AM: Trace Attempt 178	[45.88 s]
0.0.N: Trace Attempt  1	[46.69 s]
0.0.N: Trace Attempt  2	[46.70 s]
0.0.N: Trace Attempt  3	[46.70 s]
0.0.N: Trace Attempt  4	[46.70 s]
0.0.N: Trace Attempt  5	[46.70 s]
0.0.B: Trace Attempt 6067	[48.08 s]
0.0.Ht: Trace Attempt 6262	[48.08 s]
0.0.Hp: Trace Attempt 1711	[48.23 s]
0.0.AM: Trace Attempt 246	[50.01 s]
0.0.N: Trace Attempt 179	[50.73 s]
0.0.Ht: Trace Attempt 6501	[52.08 s]
0.0.B: Trace Attempt 6317	[52.09 s]
0.0.Hp: Trace Attempt 1781	[52.24 s]
0.0.N: Trace Attempt  1	[53.10 s]
0.0.N: Trace Attempt  2	[53.10 s]
0.0.N: Trace Attempt  3	[53.10 s]
0.0.N: Trace Attempt  4	[53.11 s]
0.0.N: Trace Attempt  5	[53.11 s]
0.0.AM: Trace Attempt 291	[54.05 s]
0.0.Ht: Trace Attempt 6745	[56.09 s]
0.0.B: Trace Attempt 6552	[56.10 s]
0.0.Hp: Trace Attempt 1848	[56.27 s]
0.0.N: Trace Attempt 179	[57.14 s]
0.0.AM: Trace Attempt 342	[58.09 s]
0.0.N: Trace Attempt  1	[59.53 s]
0.0.N: Trace Attempt  2	[59.53 s]
0.0.N: Trace Attempt  3	[59.53 s]
0.0.N: Trace Attempt  4	[59.53 s]
0.0.N: Trace Attempt  5	[59.53 s]
0.0.Ht: Trace Attempt 6978	[60.09 s]
0.0.B: Trace Attempt 6778	[60.11 s]
0.0.AM: Trace Attempt 383	[62.20 s]
0.0.N: Trace Attempt 179	[63.55 s]
0.0.Ht: Trace Attempt 7216	[64.11 s]
0.0.B: Trace Attempt 7007	[64.12 s]
0.0.N: Trace Attempt  1	[65.85 s]
0.0.N: Trace Attempt  2	[65.85 s]
0.0.N: Trace Attempt  3	[65.85 s]
0.0.N: Trace Attempt  4	[65.86 s]
0.0.N: Trace Attempt  5	[65.86 s]
0.0.AM: Trace Attempt 428	[66.27 s]
0.0.Ht: Trace Attempt 7427	[68.11 s]
0.0.B: Trace Attempt 7226	[68.12 s]
0.0.N: Trace Attempt 179	[69.86 s]
0.0.AM: Trace Attempt 443	[70.55 s]
0.0.Hp: Trace Attempt 1910	[71.01 s]
0.0.Ht: Trace Attempt 7654	[72.11 s]
0.0.B: Trace Attempt 7434	[72.14 s]
0.0.N: Trace Attempt  1	[72.41 s]
0.0.N: Trace Attempt  2	[72.41 s]
0.0.N: Trace Attempt  3	[72.41 s]
0.0.N: Trace Attempt  4	[72.41 s]
0.0.N: Trace Attempt  5	[72.41 s]
0.0.AM: Trace Attempt 453	[74.73 s]
0.0.Ht: Trace Attempt 7867	[76.11 s]
0.0.B: Trace Attempt 7638	[76.14 s]
0.0.N: Trace Attempt 179	[76.43 s]
0.0.N: Trace Attempt  1	[78.74 s]
0.0.N: Trace Attempt  2	[78.74 s]
0.0.N: Trace Attempt  3	[78.74 s]
0.0.N: Trace Attempt  4	[78.75 s]
0.0.N: Trace Attempt  5	[78.75 s]
0.0.Hp: Trace Attempt 1914	[78.84 s]
0.0.AM: Trace Attempt 462	[79.06 s]
0.0.Ht: Trace Attempt 8075	[80.13 s]
0.0.B: Trace Attempt 7830	[80.14 s]
0.0.N: Trace Attempt 179	[82.78 s]
0.0.AM: Trace Attempt 471	[83.43 s]
0.0.Ht: Trace Attempt 8258	[84.14 s]
0.0.B: Trace Attempt 8025	[84.15 s]
0.0.N: Trace Attempt  1	[85.18 s]
0.0.N: Trace Attempt  2	[85.18 s]
0.0.N: Trace Attempt  3	[85.18 s]
0.0.N: Trace Attempt  4	[85.18 s]
0.0.N: Trace Attempt  5	[85.18 s]
0.0.AM: Trace Attempt 482	[87.58 s]
0.0.Ht: Trace Attempt 8421	[88.15 s]
0.0.B: Trace Attempt 8215	[88.17 s]
0.0.N: Trace Attempt 179	[89.21 s]
0.0.N: Trace Attempt  1	[91.56 s]
0.0.N: Trace Attempt  2	[91.56 s]
0.0.N: Trace Attempt  3	[91.56 s]
0.0.N: Trace Attempt  4	[91.56 s]
0.0.N: Trace Attempt  5	[91.56 s]
0.0.AM: Trace Attempt 496	[91.61 s]
0.0.Ht: Trace Attempt 8624	[92.16 s]
0.0.B: Trace Attempt 8402	[92.18 s]
0.0.N: Trace Attempt 179	[95.59 s]
0.0.AM: Trace Attempt 512	[95.65 s]
0.0.Ht: Trace Attempt 8822	[96.17 s]
0.0.B: Trace Attempt 8585	[96.20 s]
0.0.N: Trace Attempt  1	[97.97 s]
0.0.N: Trace Attempt  2	[97.97 s]
0.0.N: Trace Attempt  3	[97.97 s]
0.0.N: Trace Attempt  4	[97.97 s]
0.0.N: Trace Attempt  5	[97.97 s]
0.0.AM: Trace Attempt 529	[99.91 s]
0.0.Ht: Trace Attempt 9013	[100.17 s]
0.0.B: Trace Attempt 8761	[100.21 s]
0.0.N: Trace Attempt 179	[102.00 s]
0.0.AM: Trace Attempt 546	[103.92 s]
0.0.Ht: Trace Attempt 9213	[104.18 s]
0.0.B: Trace Attempt 8938	[104.23 s]
0.0.N: Trace Attempt  1	[104.52 s]
0.0.N: Trace Attempt  2	[104.52 s]
0.0.N: Trace Attempt  3	[104.52 s]
0.0.N: Trace Attempt  4	[104.53 s]
0.0.N: Trace Attempt  5	[104.53 s]
0.0.Hp: Trace Attempt 1917	[105.30 s]
0.0.AM: Trace Attempt 564	[108.06 s]
0.0.Ht: Trace Attempt 9376	[108.18 s]
0.0.B: Trace Attempt 9106	[108.25 s]
0.0.N: Trace Attempt 179	[108.57 s]
0.0.Hp: Trace Attempt 1920	[110.68 s]
0.0.N: Trace Attempt  1	[111.01 s]
0.0.N: Trace Attempt  2	[111.01 s]
0.0.N: Trace Attempt  3	[111.01 s]
0.0.N: Trace Attempt  4	[111.01 s]
0.0.N: Trace Attempt  5	[111.01 s]
0.0.Ht: Trace Attempt 9539	[112.19 s]
0.0.B: Trace Attempt 9267	[112.26 s]
0.0.AM: Trace Attempt 585	[112.32 s]
0.0.N: Trace Attempt 179	[115.03 s]
0.0.Ht: Trace Attempt 9716	[116.20 s]
0.0.B: Trace Attempt 9428	[116.26 s]
0.0.AM: Trace Attempt 598	[116.38 s]
0.0.N: Trace Attempt  1	[117.36 s]
0.0.N: Trace Attempt  2	[117.36 s]
0.0.N: Trace Attempt  3	[117.36 s]
0.0.N: Trace Attempt  4	[117.36 s]
0.0.N: Trace Attempt  5	[117.36 s]
0.0.Ht: Trace Attempt 9885	[120.21 s]
0.0.B: Trace Attempt 9586	[120.28 s]
0.0.AM: Trace Attempt 613	[120.54 s]
0.0.Hp: Trace Attempt 1922	[120.62 s]
0.0.N: Trace Attempt 179	[121.38 s]
0.0.N: Trace Attempt  1	[123.81 s]
0.0.N: Trace Attempt  2	[123.81 s]
0.0.N: Trace Attempt  3	[123.81 s]
0.0.N: Trace Attempt  4	[123.82 s]
0.0.N: Trace Attempt  5	[123.82 s]
0.0.Ht: Trace Attempt 10050	[124.23 s]
0.0.B: Trace Attempt 9737	[124.29 s]
0.0.AM: Trace Attempt 629	[124.76 s]
0.0.N: Trace Attempt 179	[127.84 s]
0.0.Ht: Trace Attempt 10217	[128.24 s]
0.0.B: Trace Attempt 9888	[128.31 s]
0.0.AM: Trace Attempt 646	[128.77 s]
0.0.N: Trace Attempt  1	[130.63 s]
0.0.N: Trace Attempt  2	[130.63 s]
0.0.N: Trace Attempt  3	[130.63 s]
0.0.N: Trace Attempt  4	[130.63 s]
0.0.Ht: Trace Attempt 10345	[132.25 s]
0.0.B: Trace Attempt 10037	[132.33 s]
0.0.AM: Trace Attempt 660	[133.00 s]
0.0.N: Trace Attempt 181	[134.64 s]
0.0.Hp: Trace Attempt 1927	[134.86 s]
0.0.Ht: Trace Attempt 10471	[136.27 s]
0.0.B: Trace Attempt 10181	[136.35 s]
0.0.AM: Trace Attempt 674	[137.11 s]
0.0.N: Trace Attempt 245	[138.66 s]
0.0.Ht: Trace Attempt 10627	[140.28 s]
0.0.B: Trace Attempt 10327	[140.35 s]
0.0.AM: Trace Attempt 687	[141.20 s]
0.0.N: Trace Attempt 285	[142.72 s]
0.0.Ht: Trace Attempt 10787	[144.29 s]
0.0.B: Trace Attempt 10478	[144.35 s]
0.0.AM: Trace Attempt 700	[145.36 s]
0.0.N: Trace Attempt 328	[146.76 s]
0.0.Ht: Trace Attempt 10943	[148.29 s]
0.0.B: Trace Attempt 10628	[148.37 s]
0.0.AM: Trace Attempt 713	[149.87 s]
0.0.N: Trace Attempt 361	[150.78 s]
0.0.Ht: Trace Attempt 11102	[152.29 s]
0.0.B: Trace Attempt 10776	[152.39 s]
0.0.AM: Trace Attempt 723	[154.35 s]
0.0.N: Trace Attempt 401	[154.82 s]
0.0.Ht: Trace Attempt 11253	[156.30 s]
0.0.B: Trace Attempt 10915	[156.41 s]
0.0.AM: Trace Attempt 733	[158.42 s]
0.0.N: Trace Attempt 441	[158.83 s]
0.0.Ht: Trace Attempt 11383	[160.31 s]
0.0.B: Trace Attempt 11050	[160.44 s]
0.0.N: Trace Attempt  1	[161.37 s]
0.0.N: Trace Attempt  2	[161.37 s]
0.0.N: Trace Attempt  3	[161.37 s]
0.0.N: Trace Attempt  4	[161.37 s]
0.0.N: Trace Attempt  5	[161.37 s]
0.0.Hp: Trace Attempt 1931	[162.55 s]
0.0.AM: Trace Attempt 745	[162.58 s]
0.0.Ht: Trace Attempt 11511	[164.34 s]
0.0.B: Trace Attempt 11183	[164.45 s]
0.0.N: Trace Attempt 194	[165.39 s]
0.0.AM: Trace Attempt 757	[166.71 s]
0.0.Ht: Trace Attempt 11654	[168.35 s]
0.0.B: Trace Attempt 11312	[168.45 s]
0.0.N: Trace Attempt 238	[169.40 s]
0.0.AM: Trace Attempt 771	[170.95 s]
0.0.Hp: Trace Attempt 1936	[171.43 s]
0.0.Ht: Trace Attempt 11794	[172.36 s]
0.0.B: Trace Attempt 11439	[172.47 s]
0.0.N: Trace Attempt 265	[173.45 s]
0.0.AM: Trace Attempt 783	[175.25 s]
0.0.Hp: Trace Attempt 1939	[175.51 s]
0.0.Ht: Trace Attempt 11928	[176.36 s]
0.0.B: Trace Attempt 11566	[176.50 s]
0.0.N: Trace Attempt 312	[177.55 s]
0.0.AM: Trace Attempt 795	[179.49 s]
0.0.Ht: Trace Attempt 12063	[180.37 s]
0.0.B: Trace Attempt 11695	[180.51 s]
0.0.N: Trace Attempt 345	[180.97 s]
0.0.N: Stopped processing property "Thermocouple.p1"	[181.02 s].
0.0.N: Morphing to Ncustom1
0.0.N: All properties determined. [0.00 s]
0.0.N: Exited with Success (@ 0.00 s)
0.0.Ncustom1: clocks: 1, declared: 1, looping: 0, posedge: 1, negedge: 0, noedge: 0, bothedge: 0
0.0.Ncustom1: Starting proof for property "Thermocouple.p1"	[0.00 s].
0.0.Tri: Proofgrid shell started at 2441@vlsi-ria84(local) jg_1628_vlsi-ria84_1
0.0.Tri: clocks: 1, declared: 1, looping: 0, posedge: 1, negedge: 0, noedge: 0, bothedge: 0
0.0.Tri: Last scan. Per property time limit: 0s
0.0.Tri: Starting proof for property "Thermocouple.p1"	[0.00 s].
0.0.Tri: Trace Attempt  1	[0.00 s]
0.0.Ncustom1: Trace Attempt 451	[0.06 s]
0.0.Tri:    0.00" ---- Launching main thread ----
0.0.B: Trace Attempt 11708	[180.93 s]
0.0.B: Stopped processing property "Thermocouple.p1"	[181.10 s].
0.0.B: Morphing to Bcustom2
0.0.B: All properties determined. [0.00 s]
0.0.B: Exited with Success (@ 0.00 s)
0.0.Bcustom2: clocks: 1, declared: 1, looping: 0, posedge: 1, negedge: 0, noedge: 0, bothedge: 0
0.0.Bcustom2: Starting proof for property "Thermocouple.p1"	[0.00 s].
0.0.Bcustom2: Trace Attempt  1	[0.00 s]
0.0.Bcustom2: Trace Attempt  2	[0.00 s]
0.0.Bcustom2: Trace Attempt  1	[0.00 s]
0.0.Bcustom2: Trace Attempt  2	[0.00 s]
0.0.Bcustom2: Trace Attempt  3	[0.00 s]
0.0.Bcustom2: Trace Attempt  4	[0.00 s]
0.0.Bcustom2: Trace Attempt  5	[0.00 s]
0.0.Bcustom2: Trace Attempt  1	[0.00 s]
0.0.Bcustom2: Trace Attempt  2	[0.00 s]
0.0.Bcustom2: Trace Attempt  3	[0.00 s]
0.0.Bcustom2: Trace Attempt  4	[0.00 s]
0.0.Bcustom2: Trace Attempt  5	[0.00 s]
0.0.Bcustom2: Trace Attempt  1	[0.01 s]
0.0.Bcustom2: Trace Attempt  2	[0.01 s]
0.0.Bcustom2: Trace Attempt  3	[0.01 s]
0.0.Bcustom2: Trace Attempt  4	[0.01 s]
0.0.Bcustom2: Trace Attempt  5	[0.01 s]
0.0.Bcustom2: Trace Attempt  1	[0.01 s]
0.0.Bcustom2: Trace Attempt  2	[0.01 s]
0.0.Bcustom2: Trace Attempt  3	[0.01 s]
0.0.Bcustom2: Trace Attempt  4	[0.01 s]
0.0.Bcustom2: Trace Attempt  5	[0.01 s]
0.0.Bcustom2: Trace Attempt  1	[0.02 s]
0.0.Bcustom2: Trace Attempt  2	[0.02 s]
0.0.Bcustom2: Trace Attempt  3	[0.02 s]
0.0.Bcustom2: Trace Attempt  4	[0.02 s]
0.0.Bcustom2: Trace Attempt  5	[0.02 s]
0.0.Tri:    0.03" ---- Launching abstraction thread ----
0.0.Tri:    0.04" ---- Launching multi-phase simplification thread ----
0.0.Tri:    0.05" ---- Launching liveness simplification thread ----
0.0.Bcustom2: Trace Attempt  1	[0.04 s]
0.0.Bcustom2: Trace Attempt  2	[0.04 s]
0.0.Bcustom2: Trace Attempt  3	[0.04 s]
0.0.Bcustom2: Trace Attempt  4	[0.04 s]
0.0.Bcustom2: Trace Attempt  5	[0.04 s]
0.0.AM: Trace Attempt 799	[180.67 s]
0.0.AM: Stopped processing property "Thermocouple.p1"	[181.16 s].
0.0.AM: Morphing to AMcustom3
0.0.AM: All properties determined. [0.00 s]
0.0.AM: Exited with Success (@ 0.00 s)
0.0.AMcustom3: clocks: 1, declared: 1, looping: 0, posedge: 1, negedge: 0, noedge: 0, bothedge: 0
0.0.AMcustom3: Starting proof for property "Thermocouple.p1"	[0.00 s].
0.0.AMcustom3: Trace Attempt  1	[0.00 s]
0.0.AMcustom3: Trace Attempt  2	[0.00 s]
0.0.AMcustom3: Trace Attempt  3	[0.00 s]
0.0.AMcustom3: Trace Attempt  4	[0.00 s]
0.0.AMcustom3: Trace Attempt  5	[0.00 s]
0.0.AMcustom3: Trace Attempt  1	[0.00 s]
0.0.AMcustom3: Trace Attempt  2	[0.00 s]
0.0.AMcustom3: Trace Attempt  3	[0.00 s]
0.0.AMcustom3: Trace Attempt  4	[0.01 s]
0.0.AMcustom3: Trace Attempt  1	[0.01 s]
0.0.AMcustom3: Trace Attempt  2	[0.01 s]
0.0.AMcustom3: Trace Attempt  3	[0.01 s]
0.0.AMcustom3: Trace Attempt  4	[0.01 s]
0.0.AMcustom3: Trace Attempt  5	[0.02 s]
0.0.Bcustom2: Trace Attempt  1	[0.10 s]
0.0.Bcustom2: Trace Attempt  2	[0.10 s]
0.0.Bcustom2: Trace Attempt  3	[0.10 s]
0.0.Bcustom2: Trace Attempt  4	[0.10 s]
0.0.Bcustom2: Trace Attempt  5	[0.10 s]
0.0.AMcustom3: Trace Attempt  1	[0.04 s]
0.0.AMcustom3: Trace Attempt  2	[0.04 s]
0.0.AMcustom3: Trace Attempt  3	[0.04 s]
0.0.AMcustom3: Trace Attempt  4	[0.05 s]
0.0.AMcustom3: Trace Attempt  5	[0.05 s]
0.0.AMcustom3: Trace Attempt  1	[0.15 s]
0.0.AMcustom3: Trace Attempt  2	[0.15 s]
0.0.AMcustom3: Trace Attempt  3	[0.15 s]
0.0.AMcustom3: Trace Attempt  4	[0.15 s]
0.0.AMcustom3: Trace Attempt  5	[0.15 s]
0.0.Bcustom2: Trace Attempt  1	[0.24 s]
0.0.Bcustom2: Trace Attempt  2	[0.24 s]
0.0.Bcustom2: Trace Attempt  3	[0.24 s]
0.0.Bcustom2: Trace Attempt  4	[0.24 s]
0.0.Bcustom2: Trace Attempt  5	[0.24 s]
0.0.AMcustom3: Trace Attempt  1	[0.56 s]
0.0.AMcustom3: Trace Attempt  2	[0.56 s]
0.0.AMcustom3: Trace Attempt  3	[0.56 s]
0.0.AMcustom3: Trace Attempt  4	[0.56 s]
0.0.AMcustom3: Trace Attempt  5	[0.56 s]
0.0.Bcustom2: Trace Attempt  1	[0.66 s]
0.0.Bcustom2: Trace Attempt  2	[0.66 s]
0.0.Bcustom2: Trace Attempt  3	[0.66 s]
0.0.Bcustom2: Trace Attempt  4	[0.66 s]
0.0.Bcustom2: Trace Attempt  5	[0.66 s]
0.0.Tri:    0.85" Simplification phase 1 complete
0.0.Ncustom1: Requesting engine job to terminate
0.0.Bcustom2: Requesting engine job to terminate
0.0.AMcustom3: Requesting engine job to terminate
0.0.Tri: Requesting engine job to terminate
0.0.Hp: Requesting engine job to terminate
0.0.Ht: Requesting engine job to terminate
INFO (IPF144): 0: Initiating shutdown of proof [182.02 s]
0.0.Tri: A proof was found: No trace exists. [0.94 s]
INFO (IPF057): 0.0.Tri: The property "Thermocouple.p1" was proven in 0.94 s.
0.0.AMcustom3: Trace Attempt 46	[0.80 s]
0.0.AMcustom3: Stopped processing property "Thermocouple.p1"	[0.82 s].
0.0.AMcustom3: All properties determined. [0.81 s]
0.0.AMcustom3: Exited with Success (@ 182.03 s)
0: ProofGrid usable level: 0
0.0.Bcustom2: Trace Attempt 549	[0.89 s]
0.0.Bcustom2: Stopped processing property "Thermocouple.p1"	[0.90 s].
0.0.Bcustom2: All properties determined. [0.90 s]
0.0.Ncustom1: Stopped processing property "Thermocouple.p1"	[1.00 s].
0.0.Ncustom1: All properties determined. [1.00 s]
0.0.Ncustom1: Exited with Success (@ 182.04 s)
0.0.Ht: Trace Attempt 12117	[181.99 s]
0.0.Ht: All properties determined. [182.01 s]
0.0.Bcustom2: Exited with Success (@ 182.06 s)
0.0.Ht: Exited with Success (@ 182.14 s)
0.0.Tri: Stopped processing property "Thermocouple.p1"	[1.12 s].
0.0.Tri: All properties determined. [1.12 s]
0.0.Hp: Trace Attempt 1940	[176.05 s]
0.0.Hp: All properties determined. [182.28 s]
0.0.Tri: Exited with Success (@ 182.29 s)
0.0.Hp: Exited with Success (@ 182.43 s)
0: --------------------------------------------------------------
ProofGrid Summary (utilization 99.97 %)
--------------------------------------------------------------
     engines started                               :    10
     engine jobs started                           :     7

    Average time in state (seconds)
    ------------------------------------------------------
    Engine  Pending     Running        Dead    Utilization
    ------------------------------------------------------
     Hp        0.03      182.02        0.00       99.98 %
     Ht        0.03      181.99        0.00       99.98 %
     Oh        0.03        0.00        0.00        3.96 %
    Ncustom1        0.03      181.97        0.00       99.98 %
    Bcustom2        0.03      181.85        0.00       99.98 %
    AMcustom3        0.03      181.81        0.00       99.98 %
    Tri        0.06        0.94        0.00       94.43 %
    all        0.03      130.08        0.00       99.97 %

    Total time in state (seconds)
    -----------------------------------------
            Pending     Running        Dead  
    -----------------------------------------
               0.24      910.58        0.00

    Data read    : 6.91 MiB
    Data written : 3.19 kiB

0: All pending notifications were processed.
INFO (IPF059): 0: Completed proof on task: "<embedded>"

==============================================================
SUMMARY
==============================================================
           Properties Considered              : 1
                 assertions                   : 1
                  - proven                    : 1 (100%)
                  - bounded_proven (user)     : 0 (0%)
                  - bounded_proven (auto)     : 0 (0%)
                  - marked_proven             : 0 (0%)
                  - cex                       : 0 (0%)
                  - ar_cex                    : 0 (0%)
                  - undetermined              : 0 (0%)
                  - unknown                   : 0 (0%)
                  - error                     : 0 (0%)
                 covers                       : 0
                  - unreachable               : 0
                  - bounded_unreachable (user): 0
                  - covered                   : 0
                  - ar_covered                : 0
                  - undetermined              : 0
                  - unknown                   : 0
                  - error                     : 0
proven
[<embedded>] % exit -force
INFO (IPL005): Received request to exit from the console.
INFO: Waiting for proof threads to stop...
INFO: Proof threads stopped.
INFO (IPL018): The peak resident set memory use for this session was 2.077 GB.
INFO (IPL014): Waiting for the Tcl-thread to exit.
INFO (IPL015): The Tcl-thread exited with status 0.
INFO (IPL016): Exiting the analysis session with status 0.
