# ----------------------------------------
# Jasper Version Info
# tool      : Jasper 2024.06
# platform  : Linux 3.10.0-1160.62.1.el7.x86_64
# version   : 2024.06p002 64 bits
# build date: 2024.09.02 16:28:38 UTC
# ----------------------------------------
# started   : 2025-11-17 18:27:06 IST
# hostname  : vlsi-ria84.vlsidomain
# pid       : 25866
# arguments : '-label' 'session_0' '-console' '//127.0.0.1:41992' '-nowindow' '-style' 'windows' '-exitonerror' '-data' 'AAAAwnicY2RgYLCp////PwMYMD6A0Aw2jAyoAMRnQhUJbEChGRhYYZphSliAmItBl6GAoYghnyELyFNj0ANCfSA7HS6aypDMUMJQDBQNYAhn8GWIZ7AEquQB6ktiSATKJDNkAPlCSLJ6YNEcsB0AMlcUpw==' '-proj' '/users/rompel/jasper_executions/safety_liveness/jgprojects/PWM_9/sessionLogs/session_0' '-init' '-hidden' '/users/rompel/jasper_executions/safety_liveness/jgprojects/PWM_9/.tmp/.initCmds.tcl' 'PWM_9.tcl' '-hidden' '/users/rompel/jasper_executions/safety_liveness/jgprojects/PWM_9/.tmp/.postCmds.tcl'

Any disclosure about the Cadence Design Systems software or its use
model to any third party violates the written Non-Disclosure Agreement
between Cadence Design Systems, Inc. and the customer.

THIS SOFTWARE CONTAINS CONFIDENTIAL INFORMATION AND TRADE SECRETS OF
CADENCE DESIGN SYSTEMS, INC. USE, DISCLOSURE, OR REPRODUCTION IS
PROHIBITED WITHOUT THE PRIOR EXPRESS WRITTEN PERMISSION OF CADENCE
DESIGN SYSTEMS, INC.

Copyright (C) 2000-2024 Cadence Design Systems, Inc. All Rights
Reserved.  Unpublished -- rights reserved under the copyright laws of
the United States.

This product includes software developed by others and redistributed
according to license agreement. See doc/third_party_readme.txt for
further details.

RESTRICTED RIGHTS LEGEND

Use, duplication, or disclosure by the Government is subject to
restrictions as set forth in subparagraph (c) (1) (ii) of the Rights in
Technical Data and Computer Software clause at DFARS 252.227-7013 or
subparagraphs (c) (1) and (2) of Commercial Computer Software -- Restricted
Rights at 48 CFR 52.227-19, as applicable.


                          Cadence Design Systems, Inc.
                          2655 Seely Avenue
                          San Jose, CA 95134
                          Phone: 408.943.1234

For technical assistance visit http://support.cadence.com.

Jasper Apps Analysis Session - /users/rompel/jasper_executions/safety_liveness/jgprojects/PWM_9/sessionLogs/session_0

WARNING (WG017): [session]: The system's locale is "ANSI_X3.4-1968", which is not UTF-8. Non-ASCII characters might not be handled correctly.
WARNING (WG017): [jg_console]: The system's locale is "ANSI_X3.4-1968", which is not UTF-8. Non-ASCII characters might not be handled correctly.
INFO: successfully checked out license "jasper_fao".
INFO: reading configuration file "/users/rompel/.config/cadence/jasper.conf".
% analyze -sv09 ../PWM_9.sv
[-- (VERI-1482)] Analyzing Verilog file '/tools/cadence2425/JASPER/jasper_2024.06p002/lib/verilog/packages/std/std.sv' into library 'std'
[-- (VERI-1482)] Analyzing Verilog file '../PWM_9.sv'
[INFO (VERI-2561)] ../PWM_9.sv(7): undeclared symbol 'lbR', assumed default net type 'wire'
[INFO (VERI-2561)] ../PWM_9.sv(8): undeclared symbol 'ubR', assumed default net type 'wire'
% elaborate -bbox_mul 1000000 -bbox_div 1000000 -bbox_mod 1000000 -bbox_a 1000000
[INFO (HIER-8002)] ../PWM_9.sv(32): Disabling old hierarchical reference handler
[INFO (VERI-1018)] ../PWM_9.sv(1): compiling module 'PWM_TOP'
[WARN (VERI-1209)] ../PWM_9.sv(7): expression size 19 truncated to fit in target size 1
[WARN (VERI-1209)] ../PWM_9.sv(8): expression size 19 truncated to fit in target size 1
[WARN (VERI-1209)] ../PWM_9.sv(13): expression size 32 truncated to fit in target size 18
[INFO (VERI-8005)] ../PWM_9.sv(1): Unintentional sequential element inferred for pulse_red read before write using blocking assignment
[INFO (VERI-8005)] ../PWM_9.sv(1): Unintentional sequential element inferred for lb_pulse read before write using blocking assignment
[INFO (VERI-8005)] ../PWM_9.sv(1): Unintentional sequential element inferred for ub_pulse read before write using blocking assignment
INFO (ISW003): Top module name is "PWM_TOP".
INFO (INL208): Elaboration synthesis summary:
  Number of synthesized netlists          1 (0 packages)
  Single run mode                         On
  Pipeline                                On (1 pipelined netlists)
  Late hierarchical reference connection  On
  Number of analyzed Verilog modules      1 (1 synthesized)
  Number of analyzed VHDL entities        0 (0 synthesized)
INFO (INL003): Clearing all state information (assumes, stopats, and so forth).
PWM_TOP
[<embedded>] % reset -none
INFO (IPM031): Clearing proof results of all properties.
[<embedded>] % clock clk
[<embedded>] % prove -all
Ncustom1: Custom engine code is hT3Ng7hPPfiYQOTDZ3qhYOwGAM51eA+J/FjkM5shLioAsqhgLR4Ft+O1BuKG6ilQ83B9tLXSl+CwjiTMAQA
Bcustom2: Custom engine code is hT3Nm7hPr1Vp3Di1Ra2USNIGL4JypRnLKLAdF6JAyuavO2JfGCiY9OZJhcAcOUnLx5xwNdhILGrAWX9s+z2WDkKwNR7tAfClBEjRFVQeq6DU54boFgEA
AMcustom3: Custom engine code is hT3Ng7hP/feYQOTDZ3qhYOwGAM51eA+J/FjkM5shLioAsqhgLR4Ft+O1BuKG6ilQ83B9tLXSmmqwm7g9AQA
Mpcustom4: Custom engine code is hT3NZbhP9fmY2AbBQnsjfOxn6c+6e6yL+/e8fZFmaQrnlgEA
INFO (IPF036): Starting proof on task: "<embedded>", 1 properties to prove with 0 already proven/unreachable
INFO (IRS029): Starting reset analysis: phase 1 of 4.
INFO (IRS030): Running reset analysis: phase 2 of 4.
INFO (IRS031): Running reset analysis: phase 3 of 4.
INFO (IRS020): Starting the reset analysis simulation with a limit of 100 iterations (phase 4 of 4).
INFO (IRS024): Reset iterations 0 to 4 analyzed.
INFO (IRS018): Reset analysis simulation executed for 3 iterations. Assigned values for 2 of 21 design flops, 0 of 0 design latches, 3 of 3 internal elements.
INFO (IRS039): Reset analysis complete.
INFO (IPF031): Settings used for proof thread 0:
    orchestration                 = on
    time_limit                    = 86400s
    per_property_time_limit       = 1s * 10 ^ scan
    engine_mode                   = auto
    proofgrid_per_engine_max_jobs = 1
    max engine jobs               = auto
    proofgrid_mode                = local
    proofgrid_restarts            = 10
0: Using multistage preprocessing
AMcustom5: Custom engine code is hT3N1rhP11/52HrFRS21ROp2LOjVTgPvT8L8BGXHgLhaIuqtT4nARFjUqrBL+7pLmaTOzBepZW/Jm8SSrHDybSQtoNiO3y43wk+dEoWlsZizu97Fih6O6lPVG/LpWP5SsUPwlGagLNa1FKEFvwVXyX7//8prySbvSxIHXr5er+z4RAEA
0: Starting reduce
Ncustom6: Custom engine code is hT3OXrhPByJp3TrFSTLhUmMH4KVtJgmTCnNDF46yMXOKY48m4LS5nE7yBzFjA7kDuwO/GhGUpEPiky3p3wmPn3dJZHxFMsafSoObRzSC+tn7sEY0WbTdZ/FV4hL3MYH/b1CIUvXSWR4wqEoVLsmMOD4xIPT4lI1LO6ZCO7PnnWQuLwetnvKlrXx6wCW/A+x+enqslg1YPobi4wEF/EvbzOvcTYdJvl2s4H2yZg2b2ofAVN5WvhWk1HoBAA
ADcustom7: Custom engine code is hT3Nv7hPv1752HrFRa2kROx2f/ECJeZB2AZsLdlO8VwmIuqtT4nIDFXclhg+O+o+DMmQCekbheGk0kK28laA9gaOFDXsQp29J3X615HY1IPHJWd6FUFvCHjO+p1k652b5JJvZlShNpGlGSXAiQe/mEAj6tEBAA
Tricustom8: Custom engine code is hT3Nu7hPt1752DvFRa0kNDiyIV97VyejwM9C/jCLJjdPvusZONHY42VYUy0Q1ZotnhcVtNc56tJ5wbxv6V2+XpdsaSlHck5vfnbYjdwj1OECy9U+7oSQ0SZE3g5ayD+Phuh4odCJTjeKa2k4elM9ldQfkAEA
Gcustom9: Custom engine code is hT3NibhPDfeYQADBZnYcglOvK9Pfd7EOeniIqP8jNsyIqInncipMGcUXqAadachREE9F2PwhBUZUNw5kHnd4JdXkamORRgEA
C2custom10: Custom engine code is hT3NirhPjfWYQADBZnYcglOvK9Pfd7EOeniIqP8jNsyIqInncgkrYMMXCYbdK0dUjZIF9d4cJ0rHoBDjwVLBKuG86XYVV00BAA
AGcustom11: Custom engine code is hT3NirhP/fmYQADBZnYcglOvK9Pfd7EOeniIqP8jNsyIqInnckcwYMMXCYbdK0dUjZIF9d4cJ0rHoBDjwVLBKuHEZnZByh0BAA
Bcustom12: Custom engine code is hT3NjrhPDfiYQADBZnYcglOvK9PfWxFtenjIyBqfrgr7if/jL/yPOuK1BAflEcW0DxNH2eDIoezN2gxlQFg81RZtiWXh7aiTAidvAQA
0: Finished reduce in 0s
Ncustom13: Custom engine code is hT3NR7hPByFp3TrFSTLhUmMH4KWtJglTyV/c51BHEeZWamnJv767nE6PCak26bd3gf3XGN3rIRheufhDieCJQVISo+gNYUKhiUedBKGtsP/a18svAnlMJZudHxDFwK5ufsyoxsIyiAeSY2oi3tEuoDHr5gw42DFKAG3PqO3CEsl8Azzdt3pl5nGA1Ifv2H02eYsFzWb/nfp8PMb3F0krE/EgBcm8TD9Div8BAA
Tricustom14: Custom engine code is hT3Nu7hP3fiYQADBZnYcglNHp9bfd7EOeniIqP/ji8sGLQu8yhsFO+wxJ+O+R0bU8g/IewXFomyos+viQnWc2xYNYmMqpo3i40O7DaZR7qfp4YqNx26KRvQ/qx0BAA
0.0.PRE: Performing Proof Simplification...
0.0.N: clocks: 1, declared: 1, looping: 0, posedge: 1, negedge: 0, noedge: 0, bothedge: 0
0.0.N: Proof Simplification Iteration 1	[0.00 s]
0.0.N: Proof Simplification Iteration 2	[0.00 s]
0.0.PRE: A proof was found: No trace exists. [0.00 s]
INFO (IPF057): 0.0.PRE: The property ":noDeadEnd" was proven in 0.00 s.
    Use check_assumptions -show -dead_end to show this property in the property table.
0.0.PRE: A proof was found: No trace exists. [0.00 s]
INFO (IPF057): 0.0.PRE: The property ":noConflict" was proven in 0.00 s.
    Use check_assumptions -show to show this property in the property table.
INFO (IPF047): 0.0.PRE: The cover property ":live" was covered in 1 cycles in 0.00 s.
    Use check_assumptions -show -live to show this property in the property table.
0.0.PRE: Proof Simplification completed in 0.00 s
0: About to start ProofGrid in its own thread with a limit of 10000 pending notifications and a limit of 10 traces.
0: =============================== ProofGrid start ===============================
0: ProofGrid usable level: 1
0: Initial ProofGrid level: 1
0: ProofGrid is starting event handling
0.0.Hp: Proofgrid shell started at 25932@vlsi-ria84(local) jg_25866_vlsi-ria84_1
0.0.N: Proofgrid shell started at 25931@vlsi-ria84(local) jg_25866_vlsi-ria84_1
0.0.Hp: clocks: 1, declared: 1, looping: 0, posedge: 1, negedge: 0, noedge: 0, bothedge: 0
0.0.N: clocks: 1, declared: 1, looping: 0, posedge: 1, negedge: 0, noedge: 0, bothedge: 0
0.0.N: Last scan. Per property time limit: 0s
0.0.N: Starting proof for property "PWM_TOP.p1"	[0.00 s].
0.0.N: Trace Attempt  1	[0.00 s]
0.0.Hp: Last scan. Per property time limit: 0s
0.0.N: Trace Attempt  2	[0.00 s]
0.0.N: Trace Attempt  2	[0.00 s]
0.0.N: Trace Attempt  3	[0.00 s]
0.0.N: Trace Attempt  3	[0.00 s]
0.0.N: Trace Attempt  4	[0.00 s]
0.0.N: Trace Attempt  5	[0.00 s]
0.0.Hp: Trace Attempt  1	[0.00 s]
0.0.Hp: Trace Attempt  2	[0.00 s]
0.0.Hp: Trace Attempt  3	[0.00 s]
0.0.Hp: Trace Attempt  4	[0.00 s]
0.0.Hp: Trace Attempt  5	[0.00 s]
0.0.Ht: Proofgrid shell started at 25963@vlsi-ria84(local) jg_25866_vlsi-ria84_1
0.0.Oh: Proofgrid shell started at 25964@vlsi-ria84(local) jg_25866_vlsi-ria84_1
0.0.Ht: clocks: 1, declared: 1, looping: 0, posedge: 1, negedge: 0, noedge: 0, bothedge: 0
0.0.Ht: Last scan. Per property time limit: 0s
0.0.Oh: clocks: 1, declared: 1, looping: 0, posedge: 1, negedge: 0, noedge: 0, bothedge: 0
0.0.Ht: Trace Attempt  1	[0.00 s]
0.0.Oh: Reached length limit (2147483647) [0.00 s]
0.0.Ht: Trace Attempt  2	[0.00 s]
0.0.Ht: Trace Attempt  3	[0.00 s]
0.0.AM: Proofgrid shell started at 25966@vlsi-ria84(local) jg_25866_vlsi-ria84_1
0.0.Ht: Trace Attempt  4	[0.00 s]
0.0.Oh: Exited with Success (@ 0.03 s)
0.0.Ht: Trace Attempt  5	[0.00 s]
0.0.AM: clocks: 1, declared: 1, looping: 0, posedge: 1, negedge: 0, noedge: 0, bothedge: 0
0.0.AM: Last scan. Per property time limit: 0s
0.0.AM: Starting proof for property "PWM_TOP.p1"	[0.00 s].
0.0.AM: Trace Attempt  1	[0.00 s]
0.0.AM: Trace Attempt  2	[0.00 s]
0.0.AM: Trace Attempt  3	[0.00 s]
0.0.AM: Trace Attempt  4	[0.00 s]
0.0.AM: Trace Attempt  5	[0.00 s]
0.0.AM: Trace Attempt  1	[0.00 s]
0.0.AM: Trace Attempt  2	[0.00 s]
0.0.AM: Trace Attempt  3	[0.00 s]
0.0.AM: Trace Attempt  4	[0.01 s]
0.0.AM: Trace Attempt  5	[0.01 s]
0.0.B: Proofgrid shell started at 25965@vlsi-ria84(local) jg_25866_vlsi-ria84_1
0.0.B: clocks: 1, declared: 1, looping: 0, posedge: 1, negedge: 0, noedge: 0, bothedge: 0
0.0.B: Last scan. Per property time limit: 0s
0.0.B: Starting proof for property "PWM_TOP.p1"	[0.00 s].
0.0.B: Trace Attempt  1	[0.00 s]
0.0.B: Trace Attempt  2	[0.00 s]
0.0.AM: Trace Attempt  1	[0.01 s]
0.0.B: Trace Attempt  3	[0.00 s]
0.0.B: Trace Attempt  4	[0.00 s]
0.0.N: Trace Attempt  1	[0.04 s]
0.0.B: Trace Attempt  5	[0.00 s]
0.0.AM: Trace Attempt  2	[0.01 s]
0.0.AM: Trace Attempt  3	[0.01 s]
0.0.N: Trace Attempt  2	[0.04 s]
0.0.N: Trace Attempt  3	[0.04 s]
0.0.AM: Trace Attempt  4	[0.02 s]
0.0.N: Trace Attempt  4	[0.05 s]
0.0.AM: Trace Attempt  5	[0.02 s]
0.0.N: Trace Attempt  5	[0.05 s]
0.0.AM: Trace Attempt  1	[0.06 s]
0.0.AM: Trace Attempt  2	[0.06 s]
0.0.AM: Trace Attempt  3	[0.06 s]
0.0.AM: Trace Attempt  4	[0.07 s]
0.0.AM: Trace Attempt  5	[0.07 s]
0.0.N: Trace Attempt  1	[0.26 s]
0.0.N: Trace Attempt  2	[0.26 s]
0.0.N: Trace Attempt  3	[0.26 s]
0.0.N: Trace Attempt  4	[0.26 s]
0.0.N: Trace Attempt  5	[0.27 s]
0.0.AM: Trace Attempt  1	[0.30 s]
0.0.AM: Trace Attempt  2	[0.30 s]
0.0.AM: Trace Attempt  3	[0.30 s]
0.0.AM: Trace Attempt  4	[0.31 s]
0.0.AM: Trace Attempt  5	[0.31 s]
0.0.N: Trace Attempt  1	[0.69 s]
0.0.N: Trace Attempt  2	[0.69 s]
0.0.N: Trace Attempt  3	[0.69 s]
0.0.N: Trace Attempt  4	[0.69 s]
0.0.N: Trace Attempt  5	[0.70 s]
0.0.N: Trace Attempt  1	[1.90 s]
0.0.N: Trace Attempt  2	[1.90 s]
0.0.N: Trace Attempt  3	[1.90 s]
0.0.N: Trace Attempt  4	[1.90 s]
0.0.N: Trace Attempt  5	[1.91 s]
0.0.AM: Trace Attempt  1	[2.58 s]
0.0.AM: Trace Attempt  2	[2.59 s]
0.0.AM: Trace Attempt  3	[2.59 s]
0.0.AM: Trace Attempt  4	[2.59 s]
0.0.AM: Trace Attempt  5	[2.60 s]
0.0.N: Trace Attempt  1	[3.10 s]
0.0.N: Trace Attempt  2	[3.11 s]
0.0.N: Trace Attempt  3	[3.11 s]
0.0.N: Trace Attempt  4	[3.11 s]
0.0.N: Trace Attempt  5	[3.12 s]
0.0.Ht: Trace Attempt 143	[4.05 s]
0.0.B: Trace Attempt 150	[4.07 s]
0.0.Hp: Trace Attempt 140	[4.13 s]
0.0.N: Trace Attempt  1	[4.36 s]
0.0.N: Trace Attempt  2	[4.36 s]
0.0.N: Trace Attempt  3	[4.36 s]
0.0.N: Trace Attempt  4	[4.36 s]
0.0.N: Trace Attempt  5	[4.37 s]
0.0.N: Trace Attempt  1	[5.64 s]
0.0.N: Trace Attempt  2	[5.64 s]
0.0.N: Trace Attempt  3	[5.64 s]
0.0.N: Trace Attempt  4	[5.64 s]
0.0.N: Trace Attempt  5	[5.65 s]
0.0.AM: Trace Attempt 71	[6.80 s]
0.0.N: Trace Attempt  1	[6.96 s]
0.0.N: Trace Attempt  2	[6.96 s]
0.0.N: Trace Attempt  3	[6.96 s]
0.0.N: Trace Attempt  4	[6.96 s]
0.0.N: Trace Attempt  5	[6.96 s]
0.0.Ht: Trace Attempt 177	[8.06 s]
0.0.B: Trace Attempt 186	[8.09 s]
0.0.Hp: Trace Attempt 174	[8.29 s]
0.0.N: Trace Attempt  1	[8.32 s]
0.0.N: Trace Attempt  2	[8.32 s]
0.0.N: Trace Attempt  3	[8.32 s]
0.0.N: Trace Attempt  4	[8.32 s]
0.0.N: Trace Attempt  5	[8.33 s]
0.0.N: Trace Attempt  1	[9.66 s]
0.0.N: Trace Attempt  2	[9.66 s]
0.0.N: Trace Attempt  3	[9.66 s]
0.0.N: Trace Attempt  4	[9.67 s]
0.0.N: Trace Attempt  5	[9.67 s]
0.0.N: Trace Attempt  1	[11.03 s]
0.0.N: Trace Attempt  2	[11.03 s]
0.0.N: Trace Attempt  3	[11.03 s]
0.0.N: Trace Attempt  4	[11.04 s]
0.0.N: Trace Attempt  5	[11.04 s]
0.0.AM: Trace Attempt 83	[11.15 s]
0.0.B: Trace Attempt 209	[12.22 s]
0.0.Ht: Trace Attempt 202	[12.26 s]
0.0.Hp: Trace Attempt 200	[12.41 s]
0.0.N: Trace Attempt  1	[12.51 s]
0.0.N: Trace Attempt  2	[12.51 s]
0.0.N: Trace Attempt  3	[12.51 s]
0.0.N: Trace Attempt  4	[12.52 s]
0.0.N: Trace Attempt  5	[12.52 s]
0.0.N: Trace Attempt  1	[14.10 s]
0.0.N: Trace Attempt  2	[14.10 s]
0.0.N: Trace Attempt  3	[14.10 s]
0.0.N: Trace Attempt  4	[14.10 s]
0.0.N: Trace Attempt  5	[14.11 s]
0.0.N: Trace Attempt  1	[15.62 s]
0.0.N: Trace Attempt  2	[15.62 s]
0.0.N: Trace Attempt  3	[15.62 s]
0.0.N: Trace Attempt  4	[15.63 s]
0.0.N: Trace Attempt  5	[15.63 s]
0.0.B: Trace Attempt 228	[16.23 s]
0.0.AM: Trace Attempt 90	[16.26 s]
0.0.Hp: Trace Attempt 219	[16.42 s]
0.0.Ht: Trace Attempt 225	[16.43 s]
0.0.N: Trace Attempt  1	[17.18 s]
0.0.N: Trace Attempt  2	[17.18 s]
0.0.N: Trace Attempt  3	[17.18 s]
0.0.N: Trace Attempt  4	[17.18 s]
0.0.N: Trace Attempt  5	[17.19 s]
0.0.N: Trace Attempt  1	[18.79 s]
0.0.N: Trace Attempt  2	[18.79 s]
0.0.N: Trace Attempt  3	[18.79 s]
0.0.N: Trace Attempt  4	[18.80 s]
0.0.N: Trace Attempt  5	[18.80 s]
0.0.N: Trace Attempt  1	[20.43 s]
0.0.N: Trace Attempt  2	[20.43 s]
0.0.B: Trace Attempt 246	[20.39 s]
0.0.N: Trace Attempt  3	[20.43 s]
0.0.N: Trace Attempt  4	[20.44 s]
0.0.N: Trace Attempt  5	[20.44 s]
0.0.AM: Trace Attempt 71	[20.48 s]
0.0.Hp: Trace Attempt 235	[20.56 s]
0.0.Ht: Trace Attempt 240	[20.64 s]
0.0.N: Trace Attempt  1	[22.11 s]
0.0.N: Trace Attempt  2	[22.11 s]
0.0.N: Trace Attempt  3	[22.11 s]
0.0.N: Trace Attempt  4	[22.12 s]
0.0.N: Trace Attempt  5	[22.12 s]
0.0.B: Trace Attempt 260	[24.52 s]
0.0.AM: Trace Attempt 132	[24.54 s]
0.0.AM: Trace Attempt  1	[24.69 s]
0.0.AM: Trace Attempt  2	[24.69 s]
0.0.AM: Trace Attempt  3	[24.69 s]
0.0.AM: Trace Attempt  4	[24.69 s]
0.0.AM: Trace Attempt  5	[24.70 s]
0.0.Ht: Trace Attempt 257	[24.72 s]
0.0.Hp: Trace Attempt 251	[24.80 s]
0.0.N: Trace Attempt  1	[25.53 s]
0.0.N: Trace Attempt  2	[25.53 s]
0.0.N: Trace Attempt  3	[25.53 s]
0.0.N: Trace Attempt  4	[25.54 s]
0.0.N: Trace Attempt  5	[25.54 s]
0.0.B: Trace Attempt 271	[28.58 s]
0.0.AM: Trace Attempt 73	[28.72 s]
0.0.Hp: Trace Attempt 262	[28.82 s]
0.0.Ht: Trace Attempt 266	[28.97 s]
0.0.N: Trace Attempt 73	[29.67 s]
0.0.AM: Trace Attempt 91	[32.77 s]
0.0.B: Trace Attempt 283	[32.85 s]
0.0.Hp: Trace Attempt 270	[33.02 s]
0.0.Ht: Trace Attempt 275	[33.11 s]
0.0.N: Trace Attempt 86	[33.91 s]
0.0.AM: Trace Attempt 107	[36.91 s]
0.0.B: Trace Attempt 294	[37.12 s]
0.0.Hp: Trace Attempt 280	[37.38 s]
0.0.Ht: Trace Attempt 285	[38.07 s]
0.0.N: Trace Attempt 91	[40.73 s]
0.0.N: Trace Attempt  1	[40.97 s]
0.0.N: Trace Attempt  2	[40.97 s]
0.0.N: Trace Attempt  3	[40.97 s]
0.0.N: Trace Attempt  4	[40.98 s]
0.0.N: Trace Attempt  5	[40.98 s]
0.0.B: Trace Attempt 305	[41.20 s]
0.0.Hp: Trace Attempt 288	[41.57 s]
0.0.AM: Trace Attempt 118	[41.72 s]
0.0.Ht: Trace Attempt 294	[42.32 s]
0.0.N: Trace Attempt 73	[45.06 s]
0.0.B: Trace Attempt 317	[45.53 s]
0.0.Hp: Trace Attempt 296	[45.79 s]
0.0.AM: Trace Attempt 125	[46.28 s]
0.0.Ht: Trace Attempt 302	[46.42 s]
0.0.N: Trace Attempt 86	[49.30 s]
0.0.B: Trace Attempt 327	[49.97 s]
0.0.Hp: Trace Attempt 305	[50.28 s]
0.0.Ht: Trace Attempt 311	[50.90 s]
0.0.AM: Trace Attempt 128	[51.06 s]
0.0.B: Trace Attempt 335	[54.09 s]
0.0.Hp: Trace Attempt 313	[54.49 s]
0.0.Ht: Trace Attempt 318	[55.12 s]
0.0.AM: Trace Attempt 131	[56.12 s]
0.0.N: Trace Attempt 92	[56.66 s]
0.0.N: Trace Attempt  1	[56.92 s]
0.0.N: Trace Attempt  2	[56.92 s]
0.0.N: Trace Attempt  3	[56.92 s]
0.0.N: Trace Attempt  4	[56.93 s]
0.0.N: Trace Attempt  5	[56.94 s]
0.0.B: Trace Attempt 344	[58.42 s]
0.0.Hp: Trace Attempt 320	[58.98 s]
0.0.Ht: Trace Attempt 324	[59.18 s]
0.0.AM: Trace Attempt 136	[61.00 s]
0.0.N: Trace Attempt 73	[61.06 s]
0.0.B: Trace Attempt 353	[62.70 s]
0.0.Hp: Trace Attempt 326	[63.21 s]
0.0.Ht: Trace Attempt 331	[63.23 s]
0.0.N: Trace Attempt 86	[65.33 s]
0.0.AM: Trace Attempt 140	[66.52 s]
0.0.B: Trace Attempt 361	[66.80 s]
0.0.Ht: Trace Attempt 338	[67.26 s]
0.0.Hp: Trace Attempt 333	[67.34 s]
0.0.B: Trace Attempt 368	[70.81 s]
0.0.AM: Trace Attempt 143	[71.15 s]
0.0.Hp: Trace Attempt 340	[71.60 s]
0.0.Ht: Trace Attempt 344	[71.75 s]
0.0.N: Trace Attempt 93	[72.78 s]
0.0.N: Trace Attempt  1	[73.05 s]
0.0.N: Trace Attempt  2	[73.05 s]
0.0.N: Trace Attempt  3	[73.05 s]
0.0.N: Trace Attempt  4	[73.05 s]
0.0.N: Trace Attempt  5	[73.06 s]
0.0.B: Trace Attempt 376	[74.88 s]
0.0.AM: Trace Attempt 146	[75.44 s]
0.0.Hp: Trace Attempt 345	[75.60 s]
0.0.Ht: Trace Attempt 350	[75.93 s]
0.0.N: Trace Attempt 73	[77.13 s]
0.0.B: Trace Attempt 385	[79.34 s]
0.0.AM: Trace Attempt 148	[79.66 s]
0.0.Hp: Trace Attempt 351	[80.22 s]
0.0.Ht: Trace Attempt 356	[80.31 s]
0.0.N: Trace Attempt 86	[81.37 s]
0.0.B: Trace Attempt 390	[83.53 s]
0.0.Hp: Trace Attempt 357	[84.54 s]
0.0.Ht: Trace Attempt 363	[84.73 s]
0.0.B: Trace Attempt 395	[87.78 s]
0.0.AM: Trace Attempt 150	[88.44 s]
0.0.N: Trace Attempt 94	[88.56 s]
0.0.Hp: Trace Attempt 363	[88.58 s]
0.0.N: Trace Attempt  1	[88.81 s]
0.0.N: Trace Attempt  2	[88.81 s]
0.0.N: Trace Attempt  3	[88.81 s]
0.0.N: Trace Attempt  4	[88.82 s]
0.0.N: Trace Attempt  5	[88.82 s]
0.0.Ht: Trace Attempt 370	[89.35 s]
0.0.B: Trace Attempt 400	[92.05 s]
0.0.N: Trace Attempt 73	[92.89 s]
0.0.Hp: Trace Attempt 370	[93.13 s]
0.0.Ht: Trace Attempt 375	[93.83 s]
0.0.AM: Trace Attempt 152	[94.66 s]
0.0.B: Trace Attempt 406	[96.77 s]
0.0.N: Trace Attempt 86	[97.17 s]
0.0.Hp: Trace Attempt 374	[97.34 s]
0.0.Ht: Trace Attempt 381	[97.92 s]
0.0.AM: Trace Attempt 154	[99.24 s]
0.0.Hp: Trace Attempt 380	[101.42 s]
0.0.B: Trace Attempt 411	[101.68 s]
0.0.Ht: Trace Attempt 385	[101.96 s]
0.0.AM: Trace Attempt 156	[103.53 s]
0.0.N: Trace Attempt 95	[105.14 s]
0.0.N: Trace Attempt  1	[105.42 s]
0.0.N: Trace Attempt  2	[105.42 s]
0.0.N: Trace Attempt  3	[105.42 s]
0.0.N: Trace Attempt  4	[105.42 s]
0.0.N: Trace Attempt  5	[105.43 s]
0.0.Hp: Trace Attempt 384	[105.46 s]
0.0.B: Trace Attempt 416	[105.81 s]
0.0.Ht: Trace Attempt 390	[106.54 s]
0.0.AM: Trace Attempt 158	[107.85 s]
0.0.N: Trace Attempt 73	[109.54 s]
0.0.Hp: Trace Attempt 389	[110.04 s]
0.0.B: Trace Attempt 422	[110.53 s]
0.0.Ht: Trace Attempt 395	[110.92 s]
0.0.AM: Trace Attempt 161	[112.80 s]
0.0.N: Trace Attempt 86	[113.80 s]
0.0.Hp: Trace Attempt 394	[114.48 s]
0.0.B: Trace Attempt 427	[114.96 s]
0.0.Ht: Trace Attempt 400	[115.22 s]
0.0.AM: Trace Attempt 164	[117.87 s]
0.0.Hp: Trace Attempt 399	[118.72 s]
0.0.B: Trace Attempt 432	[119.23 s]
0.0.Ht: Trace Attempt 404	[120.64 s]
0.0.N: Trace Attempt 96	[121.21 s]
0.0.N: Trace Attempt  1	[121.52 s]
0.0.N: Trace Attempt  2	[121.52 s]
0.0.N: Trace Attempt  3	[121.52 s]
0.0.N: Trace Attempt  4	[121.53 s]
0.0.N: Trace Attempt  5	[121.54 s]
0.0.AM: Trace Attempt 168	[122.47 s]
0.0.B: Trace Attempt 438	[123.87 s]
0.0.Ht: Trace Attempt 409	[124.71 s]
0.0.Hp: Trace Attempt 404	[124.90 s]
0.0.N: Trace Attempt 73	[125.60 s]
0.0.AM: Trace Attempt 171	[126.47 s]
0.0.B: Trace Attempt 443	[127.96 s]
0.0.Hp: Trace Attempt 409	[129.14 s]
0.0.Ht: Trace Attempt 413	[129.34 s]
0.0.N: Trace Attempt 86	[129.82 s]
0.0.AM: Trace Attempt 175	[130.71 s]
0.0.B: Trace Attempt 449	[132.72 s]
0.0.Hp: Trace Attempt 413	[133.99 s]
0.0.Ht: Trace Attempt 417	[134.13 s]
0.0.AM: Trace Attempt 179	[136.74 s]
0.0.B: Trace Attempt 453	[137.30 s]
0.0.N: Trace Attempt 97	[137.83 s]
0.0.N: Trace Attempt  1	[138.10 s]
0.0.N: Trace Attempt  2	[138.10 s]
0.0.N: Trace Attempt  3	[138.10 s]
0.0.N: Trace Attempt  4	[138.10 s]
0.0.N: Trace Attempt  5	[138.11 s]
0.0.Hp: Trace Attempt 417	[138.77 s]
0.0.Ht: Trace Attempt 422	[139.05 s]
0.0.AM: Trace Attempt 181	[140.99 s]
0.0.B: Trace Attempt 457	[141.76 s]
0.0.N: Trace Attempt 73	[142.23 s]
0.0.Hp: Trace Attempt 422	[143.63 s]
0.0.Ht: Trace Attempt 427	[144.05 s]
0.0.B: Trace Attempt 460	[146.34 s]
0.0.N: Trace Attempt 86	[146.50 s]
0.0.AM: Trace Attempt 183	[147.98 s]
0.0.Ht: Trace Attempt 431	[148.35 s]
0.0.Hp: Trace Attempt 427	[148.55 s]
0.0.B: Trace Attempt 464	[150.78 s]
0.0.Hp: Trace Attempt 431	[153.03 s]
0.0.AM: Trace Attempt 185	[153.15 s]
0.0.Ht: Trace Attempt 434	[153.96 s]
0.0.N: Trace Attempt 98	[155.60 s]
0.0.B: Trace Attempt 468	[155.56 s]
0.0.N: Trace Attempt  1	[155.89 s]
0.0.N: Trace Attempt  2	[155.89 s]
0.0.N: Trace Attempt  3	[155.89 s]
0.0.N: Trace Attempt  4	[155.89 s]
0.0.N: Trace Attempt  5	[155.90 s]
0.0.Hp: Trace Attempt 434	[158.24 s]
0.0.AM: Trace Attempt 187	[158.62 s]
0.0.Ht: Trace Attempt 439	[158.66 s]
0.0.B: Trace Attempt 473	[159.88 s]
0.0.N: Trace Attempt 76	[159.92 s]
0.0.Hp: Trace Attempt 439	[162.76 s]
0.0.Ht: Trace Attempt 444	[163.53 s]
0.0.N: Trace Attempt 95	[164.02 s]
0.0.B: Trace Attempt 477	[164.40 s]
0.0.AM: Trace Attempt 189	[164.50 s]
0.0.Ht: Trace Attempt 446	[167.55 s]
0.0.Hp: Trace Attempt 444	[167.66 s]
0.0.B: Trace Attempt 481	[168.79 s]
0.0.N: Trace Attempt 99	[170.43 s]
0.0.N: Trace Attempt  1	[170.72 s]
0.0.N: Trace Attempt  2	[170.73 s]
0.0.N: Trace Attempt  3	[170.73 s]
0.0.N: Trace Attempt  4	[170.73 s]
0.0.N: Trace Attempt  5	[170.74 s]
0.0.Ht: Trace Attempt 450	[172.39 s]
0.0.AM: Trace Attempt 191	[172.81 s]
0.0.Hp: Trace Attempt 447	[173.06 s]
0.0.B: Trace Attempt 486	[173.88 s]
0.0.N: Trace Attempt 73	[174.81 s]
0.0.Ht: Trace Attempt 454	[176.88 s]
0.0.Hp: Trace Attempt 451	[177.39 s]
0.0.B: Trace Attempt 490	[178.45 s]
0.0.N: Trace Attempt 86	[179.10 s]
0.0.AM: Trace Attempt 192	[179.97 s]
0.0.Ht: Trace Attempt 458	[181.30 s]
0.0.N: Trace Attempt 89	[180.58 s]
0.0.N: Stopped processing property "PWM_TOP.p1"	[181.36 s].
0.0.N: Morphing to Ncustom1
0.0.N: All properties determined. [0.00 s]
0.0.N: Exited with Success (@ 0.00 s)
0.0.Ncustom1: clocks: 1, declared: 1, looping: 0, posedge: 1, negedge: 0, noedge: 0, bothedge: 0
0.0.Ncustom1: Starting proof for property "PWM_TOP.p1"	[0.00 s].
0.0.Ncustom1: Trace Attempt 98	[0.00 s]
0.0.B: Trace Attempt 492	[180.93 s]
0.0.B: Stopped processing property "PWM_TOP.p1"	[181.33 s].
0.0.B: Morphing to Bcustom2
0.0.B: All properties determined. [0.00 s]
0.0.B: Exited with Success (@ 0.00 s)
0.0.Bcustom2: clocks: 1, declared: 1, looping: 0, posedge: 1, negedge: 0, noedge: 0, bothedge: 0
0.0.Bcustom2: Starting proof for property "PWM_TOP.p1"	[0.00 s].
0.0.Bcustom2: Trace Attempt  1	[0.00 s]
0.0.Bcustom2: Trace Attempt  2	[0.00 s]
0.0.Bcustom2: Trace Attempt  1	[0.00 s]
0.0.Bcustom2: Trace Attempt  2	[0.00 s]
0.0.Bcustom2: Trace Attempt  3	[0.00 s]
0.0.Bcustom2: Trace Attempt  4	[0.00 s]
0.0.Bcustom2: Trace Attempt  5	[0.00 s]
0.0.Tri: Proofgrid shell started at 26547@vlsi-ria84(local) jg_25866_vlsi-ria84_1
0.0.Tri: clocks: 1, declared: 1, looping: 0, posedge: 1, negedge: 0, noedge: 0, bothedge: 0
0.0.Tri: Last scan. Per property time limit: 0s
0.0.Tri: Starting proof for property "PWM_TOP.p1"	[0.00 s].
0.0.Tri: Trace Attempt  1	[0.00 s]
0.0.Tri:    0.00" ---- Launching main thread ----
0.0.Tri:    0.02" ---- Launching abstraction thread ----
0.0.Tri:    0.03" ---- Launching multi-phase simplification thread ----
0.0.Tri:    0.04" ---- Launching liveness simplification thread ----
0.0.AM: Stopped processing property "PWM_TOP.p1"	[181.67 s].
0.0.AM: Morphing to AMcustom3
0.0.AM: All properties determined. [0.00 s]
0.0.AM: Exited with Success (@ 0.00 s)
0.0.AMcustom3: clocks: 1, declared: 1, looping: 0, posedge: 1, negedge: 0, noedge: 0, bothedge: 0
0.0.AMcustom3: Starting proof for property "PWM_TOP.p1"	[0.00 s].
0.0.AMcustom3: Trace Attempt  1	[0.00 s]
0.0.AMcustom3: Trace Attempt  2	[0.00 s]
0.0.AMcustom3: Trace Attempt  3	[0.00 s]
0.0.AMcustom3: Trace Attempt  4	[0.00 s]
0.0.AMcustom3: Trace Attempt  5	[0.00 s]
0.0.AMcustom3: Trace Attempt  1	[0.00 s]
0.0.AMcustom3: Trace Attempt  2	[0.00 s]
0.0.AMcustom3: Trace Attempt  3	[0.00 s]
0.0.AMcustom3: Trace Attempt  4	[0.01 s]
0.0.AMcustom3: Trace Attempt  5	[0.01 s]
0.0.AMcustom3: Trace Attempt  1	[0.01 s]
0.0.AMcustom3: Trace Attempt  2	[0.02 s]
0.0.AMcustom3: Trace Attempt  3	[0.02 s]
0.0.AMcustom3: Trace Attempt  4	[0.02 s]
0.0.AMcustom3: Trace Attempt  5	[0.02 s]
0.0.Hp: Trace Attempt 455	[181.73 s]
0.0.AMcustom3: Trace Attempt  1	[0.07 s]
0.0.AMcustom3: Trace Attempt  2	[0.07 s]
0.0.AMcustom3: Trace Attempt  3	[0.07 s]
0.0.AMcustom3: Trace Attempt  4	[0.07 s]
0.0.AMcustom3: Trace Attempt  5	[0.08 s]
0.0.AMcustom3: Trace Attempt  1	[0.41 s]
0.0.AMcustom3: Trace Attempt  2	[0.41 s]
0.0.AMcustom3: Trace Attempt  3	[0.41 s]
0.0.AMcustom3: Trace Attempt  4	[0.41 s]
0.0.AMcustom3: Trace Attempt  5	[0.42 s]
0.0.Tri:    0.79" Simplification phase 1 complete
0.0.Ncustom1: Requesting engine job to terminate
0.0.Bcustom2: Requesting engine job to terminate
0.0.AMcustom3: Requesting engine job to terminate
0.0.Tri: Requesting engine job to terminate
0.0.Hp: Requesting engine job to terminate
0.0.Ht: Requesting engine job to terminate
INFO (IPF144): 0: Initiating shutdown of proof [182.31 s]
0.0.Tri: A proof was found: No trace exists. [0.87 s]
INFO (IPF057): 0.0.Tri: The property "PWM_TOP.p1" was proven in 0.87 s.
0.0.AMcustom3: Trace Attempt 23	[0.57 s]
0.0.AMcustom3: Stopped processing property "PWM_TOP.p1"	[0.61 s].
0.0.AMcustom3: All properties determined. [0.61 s]
0.0.Ncustom1: Stopped processing property "PWM_TOP.p1"	[0.95 s].
0.0.Ncustom1: All properties determined. [0.95 s]
0.0.Ncustom1: Exited with Success (@ 182.31 s)
0: ProofGrid usable level: 0
0.0.Bcustom2: Trace Attempt 82	[0.92 s]
0.0.Bcustom2: Stopped processing property "PWM_TOP.p1"	[0.93 s].
0.0.Bcustom2: All properties determined. [0.94 s]
0.0.AMcustom3: Exited with Success (@ 182.32 s)
0.0.Bcustom2: Exited with Success (@ 182.32 s)
0.0.Hp: All properties determined. [182.32 s]
0.0.Hp: Exited with Success (@ 182.37 s)
0.0.Ht: All properties determined. [182.39 s]
0.0.Ht: Exited with Success (@ 182.43 s)
0.0.Tri: Stopped processing property "PWM_TOP.p1"	[1.02 s].
0.0.Tri: All properties determined. [1.02 s]
0.0.Tri: Exited with Success (@ 182.47 s)
0: --------------------------------------------------------------
ProofGrid Summary (utilization 99.97 %)
--------------------------------------------------------------
     engines started                               :    10
     engine jobs started                           :     7

    Average time in state (seconds)
    ------------------------------------------------------
    Engine  Pending     Running        Dead    Utilization
    ------------------------------------------------------
     Hp        0.03      182.31        0.00       99.98 %
     Ht        0.03      182.28        0.00       99.98 %
     Oh        0.03        0.00        0.00        0.72 %
    Ncustom1        0.03      182.28        0.00       99.98 %
    Bcustom2        0.04      182.25        0.00       99.98 %
    AMcustom3        0.03      181.95        0.00       99.98 %
    Tri        0.08        0.87        0.00       91.65 %
    all        0.04      130.28        0.00       99.97 %

    Total time in state (seconds)
    -----------------------------------------
            Pending     Running        Dead  
    -----------------------------------------
               0.27      911.94        0.00

    Data read    : 1.66 MiB
    Data written : 2.98 kiB

0: All pending notifications were processed.
INFO (IPF059): 0: Completed proof on task: "<embedded>"

==============================================================
SUMMARY
==============================================================
           Properties Considered              : 1
                 assertions                   : 1
                  - proven                    : 1 (100%)
                  - bounded_proven (user)     : 0 (0%)
                  - bounded_proven (auto)     : 0 (0%)
                  - marked_proven             : 0 (0%)
                  - cex                       : 0 (0%)
                  - ar_cex                    : 0 (0%)
                  - undetermined              : 0 (0%)
                  - unknown                   : 0 (0%)
                  - error                     : 0 (0%)
                 covers                       : 0
                  - unreachable               : 0
                  - bounded_unreachable (user): 0
                  - covered                   : 0
                  - ar_covered                : 0
                  - undetermined              : 0
                  - unknown                   : 0
                  - error                     : 0
proven
[<embedded>] % exit -force
INFO (IPL005): Received request to exit from the console.
INFO: Waiting for proof threads to stop...
INFO: Proof threads stopped.
INFO (IPL018): The peak resident set memory use for this session was 1.231 GB.
INFO (IPL014): Waiting for the Tcl-thread to exit.
INFO (IPL015): The Tcl-thread exited with status 0.
INFO (IPL016): Exiting the analysis session with status 0.
