# ----------------------------------------
# Jasper Version Info
# tool      : Jasper 2024.06
# platform  : Linux 3.10.0-1160.62.1.el7.x86_64
# version   : 2024.06p002 64 bits
# build date: 2024.09.02 16:28:38 UTC
# ----------------------------------------
# started   : 2025-11-20 03:29:41 IST
# hostname  : vlsi-ria85.vlsidomain
# pid       : 1391
# arguments : '-label' 'session_0' '-console' '//127.0.0.1:33866' '-nowindow' '-style' 'windows' '-exitonerror' '-data' 'AAAA4nicY2RgYLCp////PwMYMD6A0Aw2jAyoAMRnQhUJbEChGRhYYZphSliAmItBl6GAoYghnyELyDNj0ANCfSA7HS6aypDMUMJQDBQ1YogH0qkMZUCcB2WnA2kToE4eoDlJDIlAlckMGUC+Eh7VemBVOWA3AACUCht1' '-proj' '/users/rompel/jasper_executions/liveness/jgprojects/2_seven_seg_4/sessionLogs/session_0' '-init' '-hidden' '/users/rompel/jasper_executions/liveness/jgprojects/2_seven_seg_4/.tmp/.initCmds.tcl' '2_seven_seg_4.tcl' '-hidden' '/users/rompel/jasper_executions/liveness/jgprojects/2_seven_seg_4/.tmp/.postCmds.tcl'

Any disclosure about the Cadence Design Systems software or its use
model to any third party violates the written Non-Disclosure Agreement
between Cadence Design Systems, Inc. and the customer.

THIS SOFTWARE CONTAINS CONFIDENTIAL INFORMATION AND TRADE SECRETS OF
CADENCE DESIGN SYSTEMS, INC. USE, DISCLOSURE, OR REPRODUCTION IS
PROHIBITED WITHOUT THE PRIOR EXPRESS WRITTEN PERMISSION OF CADENCE
DESIGN SYSTEMS, INC.

Copyright (C) 2000-2024 Cadence Design Systems, Inc. All Rights
Reserved.  Unpublished -- rights reserved under the copyright laws of
the United States.

This product includes software developed by others and redistributed
according to license agreement. See doc/third_party_readme.txt for
further details.

RESTRICTED RIGHTS LEGEND

Use, duplication, or disclosure by the Government is subject to
restrictions as set forth in subparagraph (c) (1) (ii) of the Rights in
Technical Data and Computer Software clause at DFARS 252.227-7013 or
subparagraphs (c) (1) and (2) of Commercial Computer Software -- Restricted
Rights at 48 CFR 52.227-19, as applicable.


                          Cadence Design Systems, Inc.
                          2655 Seely Avenue
                          San Jose, CA 95134
                          Phone: 408.943.1234

For technical assistance visit http://support.cadence.com.

Jasper Apps Analysis Session - /users/rompel/jasper_executions/liveness/jgprojects/2_seven_seg_4/sessionLogs/session_0

WARNING (WG017): [session]: The system's locale is "ANSI_X3.4-1968", which is not UTF-8. Non-ASCII characters might not be handled correctly.
WARNING (WG017): [jg_console]: The system's locale is "ANSI_X3.4-1968", which is not UTF-8. Non-ASCII characters might not be handled correctly.
INFO: successfully checked out license "jasper_fao".
INFO: reading configuration file "/users/rompel/.config/cadence/jasper.conf".
% analyze -sv09 ../2_seven_seg_4.sv
[-- (VERI-1482)] Analyzing Verilog file '/tools/cadence2425/JASPER/jasper_2024.06p002/lib/verilog/packages/std/std.sv' into library 'std'
[-- (VERI-1482)] Analyzing Verilog file '../2_seven_seg_4.sv'
% elaborate -bbox_mul 1000000 -bbox_div 1000000 -bbox_mod 1000000 -bbox_a 1000000
[INFO (HIER-8002)] ../2_seven_seg_4.sv(32): Disabling old hierarchical reference handler
[INFO (VERI-1018)] ../2_seven_seg_4.sv(1): compiling module 'SEVEN'
[WARN (VERI-1209)] ../2_seven_seg_4.sv(15): expression size 32 truncated to fit in target size 10
[INFO (VERI-8005)] ../2_seven_seg_4.sv(5): Unintentional sequential element inferred for cnt read before write using blocking assignment
[INFO (VERI-8005)] ../2_seven_seg_4.sv(6): Unintentional sequential element inferred for digit_select read before write using blocking assignment
[INFO (VERI-8005)] ../2_seven_seg_4.sv(1): Unintentional sequential element inferred for segment read before write using blocking assignment
[INFO (VERI-8005)] ../2_seven_seg_4.sv(1): Unintentional sequential element inferred for sig read before write using blocking assignment
INFO (ISW003): Top module name is "SEVEN".
INFO (INL208): Elaboration synthesis summary:
  Number of synthesized netlists          1 (0 packages)
  Single run mode                         On
  Pipeline                                On (1 pipelined netlists)
  Late hierarchical reference connection  On
  Number of analyzed Verilog modules      1 (1 synthesized)
  Number of analyzed VHDL entities        0 (0 synthesized)
INFO (INL003): Clearing all state information (assumes, stopats, and so forth).
SEVEN
[<embedded>] % reset rst
INFO (IPM031): Clearing proof results of all properties.
INFO (IRS006): Current reset condition is "rst".
[<embedded>] % clock clk
[<embedded>] % prove -all
Ncustom1: Custom engine code is hT3Ng7hPPfiYQOTDZ3qhYOwGAM51eA+J/FjkM5shLioAsqhgLR4Ft+O1BuKG6ilQ83B9tLXSl+CwjiTMAQA
Bcustom2: Custom engine code is hT3Nm7hPr1Vp3Di1Ra2USNIGL4JypRnLKLAdF6JAyuavO2JfGCiY9OZJhcAcOUnLx5xwNdhILGrAWX9s+z2WDkKwNR7tAfClBEjRFVQeq6DU54boFgEA
AMcustom3: Custom engine code is hT3Ng7hP/feYQOTDZ3qhYOwGAM51eA+J/FjkM5shLioAsqhgLR4Ft+O1BuKG6ilQ83B9tLXSmmqwm7g9AQA
Mpcustom4: Custom engine code is hT3NZbhP9fmY2AbBQnsjfOxn6c+6e6yL+/e8fZFmaQrnlgEA
INFO (IPF036): Starting proof on task: "<embedded>", 2 properties to prove with 0 already proven/unreachable
INFO (IRS029): Starting reset analysis: phase 1 of 4.
INFO (IRS030): Running reset analysis: phase 2 of 4.
INFO (IRS031): Running reset analysis: phase 3 of 4.
INFO (IRS020): Starting the reset analysis simulation with a limit of 100 iterations (phase 4 of 4).
INFO (IRS024): Reset iterations 0 to 4 analyzed.
INFO (IRS018): Reset analysis simulation executed for 3 iterations. Assigned values for 19 of 19 design flops, 0 of 0 design latches, 6 of 6 internal elements.
INFO (IRS039): Reset analysis complete.
INFO (IPF031): Settings used for proof thread 0:
    orchestration                 = on
    time_limit                    = 86400s
    per_property_time_limit       = 1s * 10 ^ scan
    engine_mode                   = auto
    proofgrid_per_engine_max_jobs = 1
    max engine jobs               = auto
    proofgrid_mode                = local
    proofgrid_restarts            = 10
AMcustom5: Custom engine code is hT3N1rhP11/52HrFRS21ROp2LOjVTgPvT8L8BGXHgLhaIuqtT4nARFjUqrBL+7pLmaTOzBepZW/Jm8SSrHDybSQtoNiO3y43wk+dEoWlsZizu97Fih6O6lPVG/LpWP5SsUPwlGagLNa1FKEFvwVXyX7//8prySbvSxIHXr5er+z4RAEA
0: Using multistage preprocessing
Ncustom6: Custom engine code is hT3OXrhPByJp3TrFSTLhUmMH4KVtJgmTCnNDF46yMXOKY48m4LS5nE7yBzFjA7kDuwO/GhGUpEPiky3p3wmPn3dJZHxFMsafSoObRzSC+tn7sEY0WbTdZ/FV4hL3MYH/b1CIUvXSWR4wqEoVLsmMOD4xIPT4lI1LO6ZCO7PnnWQuLwetnvKlrXx6wCW/A+x+enqslg1YPobi4wEF/EvbzOvcTYdJvl2s4H2yZg2b2ofAVN5WvhWk1HoBAA
0: Starting reduce
ADcustom7: Custom engine code is hT3Nv7hPv1752HrFRa2kROx2f/ECJeZB2AZsLdlO8VwmIuqtT4nIDFXclhg+O+o+DMmQCekbheGk0kK28laA9gaOFDXsQp29J3X615HY1IPHJWd6FUFvCHjO+p1k652b5JJvZlShNpGlGSXAiQe/mEAj6tEBAA
Tricustom8: Custom engine code is hT3Nu7hPt1752DvFRa0kNDiyIV97VyejwM9C/jCLJjdPvusZONHY42VYUy0Q1ZotnhcVtNc56tJ5wbxv6V2+XpdsaSlHck5vfnbYjdwj1OECy9U+7oSQ0SZE3g5ayD+Phuh4odCJTjeKa2k4elM9ldQfkAEA
Gcustom9: Custom engine code is hT3NibhPDfeYQADBZnYcglOvK9Pfd7EOeniIqP8jNsyIqInncipMGcUXqAadachREE9F2PwhBUZUNw5kHnd4JdXkamORRgEA
C2custom10: Custom engine code is hT3NirhPjfWYQADBZnYcglOvK9Pfd7EOeniIqP8jNsyIqInncgkrYMMXCYbdK0dUjZIF9d4cJ0rHoBDjwVLBKuG86XYVV00BAA
AGcustom11: Custom engine code is hT3NirhP/fmYQADBZnYcglOvK9Pfd7EOeniIqP8jNsyIqInnckcwYMMXCYbdK0dUjZIF9d4cJ0rHoBDjwVLBKuHEZnZByh0BAA
Bcustom12: Custom engine code is hT3NjrhPDfiYQADBZnYcglOvK9PfWxFtenjIyBqfrgr7if/jL/yPOuK1BAflEcW0DxNH2eDIoezN2gxlQFg81RZtiWXh7aiTAidvAQA
Ncustom13: Custom engine code is hT3NR7hPByFp3TrFSTLhUmMH4KWtJglTyV/c51BHEeZWamnJv767nE6PCak26bd3gf3XGN3rIRheufhDieCJQVISo+gNYUKhiUedBKGtsP/a18svAnlMJZudHxDFwK5ufsyoxsIyiAeSY2oi3tEuoDHr5gw42DFKAG3PqO3CEsl8Azzdt3pl5nGA1Ifv2H02eYsFzWb/nfp8PMb3F0krE/EgBcm8TD9Div8BAA
Tricustom14: Custom engine code is hT3Nu7hP3fiYQADBZnYcglNHp9bfd7EOeniIqP/ji8sGLQu8yhsFO+wxJ+O+R0bU8g/IewXFomyos+viQnWc2xYNYmMqpo3i40O7DaZR7qfp4YqNx26KRvQ/qx0BAA
0: Finished reduce in 0s
0.0.PRE: Performing Proof Simplification...
0.0.N: clocks: 1, declared: 1, looping: 0, posedge: 1, negedge: 0, noedge: 0, bothedge: 0
0.0.N: Proof Simplification Iteration 1	[0.00 s]
0.0.PRE: A trace with 1 cycles was found. [0.00 s]
INFO (IPF047): 0.0.PRE: The cover property "SEVEN.p1:precondition1" was covered in 1 cycles in 0.00 s.
0.0.N: Proof Simplification Iteration 2	[0.06 s]
0.0.PRE: A proof was found: No trace exists. [0.00 s]
INFO (IPF057): 0.0.PRE: The property ":noDeadEnd" was proven in 0.00 s.
    Use check_assumptions -show -dead_end to show this property in the property table.
0.0.PRE: A proof was found: No trace exists. [0.00 s]
INFO (IPF057): 0.0.PRE: The property ":noConflict" was proven in 0.00 s.
    Use check_assumptions -show to show this property in the property table.
INFO (IPF047): 0.0.PRE: The cover property ":live" was covered in 1 cycles in 0.00 s.
    Use check_assumptions -show -live to show this property in the property table.
0.0.PRE: Proof Simplification completed in 0.06 s
0: About to start ProofGrid in its own thread with a limit of 10000 pending notifications and a limit of 10 traces.
0: =============================== ProofGrid start ===============================
0: ProofGrid usable level: 1
0: Initial ProofGrid level: 1
0: ProofGrid is starting event handling
0.0.Hp: Proofgrid shell started at 1495@vlsi-ria85(local) jg_1391_vlsi-ria85_1
0.0.N: Proofgrid shell started at 1494@vlsi-ria85(local) jg_1391_vlsi-ria85_1
0.0.N: clocks: 1, declared: 1, looping: 0, posedge: 1, negedge: 0, noedge: 0, bothedge: 0
0.0.Hp: clocks: 1, declared: 1, looping: 0, posedge: 1, negedge: 0, noedge: 0, bothedge: 0
0.0.N: Last scan. Per property time limit: 0s
0.0.N: Starting proof for property "SEVEN.p1"	[0.00 s].
0.0.N: Trace Attempt  1	[0.00 s]
0.0.N: Trace Attempt  2	[0.00 s]
0.0.Hp: Last scan. Per property time limit: 0s
0.0.Hp: Trace Attempt  1	[0.00 s]
0.0.Hp: Trace Attempt  2	[0.00 s]
0.0.Hp: Trace Attempt  3	[0.00 s]
0.0.Hp: Trace Attempt  4	[0.00 s]
0.0.Hp: Trace Attempt  5	[0.00 s]
0.0.N: Trace Attempt  2	[0.00 s]
0.0.N: Trace Attempt  3	[0.00 s]
0.0.N: Trace Attempt  3	[0.00 s]
0.0.N: Trace Attempt  4	[0.00 s]
0.0.N: Trace Attempt  5	[0.00 s]
0.0.N: Trace Attempt  1	[0.01 s]
0.0.N: Trace Attempt  2	[0.01 s]
0.0.N: Trace Attempt  3	[0.01 s]
0.0.N: Trace Attempt  4	[0.01 s]
0.0.N: Trace Attempt  5	[0.01 s]
0.0.Bm: Proofgrid shell started at 1549@vlsi-ria85(local) jg_1391_vlsi-ria85_1
0.0.Bm: clocks: 1, declared: 1, looping: 0, posedge: 1, negedge: 0, noedge: 0, bothedge: 0
0.0.Bm: Ignoring liveness properties
0.0.Bm: Last scan. Per property time limit: 0s
0.0.Bm: Trace Attempt  1	[0.00 s]
0.0.Bm: Trace Attempt  2	[0.00 s]
0.0.Bm: Trace Attempt  3	[0.00 s]
0.0.Bm: Trace Attempt  4	[0.00 s]
0.0.Bm: Trace Attempt  5	[0.00 s]
0.0.B: Proofgrid shell started at 1553@vlsi-ria85(local) jg_1391_vlsi-ria85_1
0.0.AM: Proofgrid shell started at 1554@vlsi-ria85(local) jg_1391_vlsi-ria85_1
0.0.Ht: Proofgrid shell started at 1548@vlsi-ria85(local) jg_1391_vlsi-ria85_1
0.0.B: clocks: 1, declared: 1, looping: 0, posedge: 1, negedge: 0, noedge: 0, bothedge: 0
0.0.B: Last scan. Per property time limit: 0s
0.0.B: Starting proof for property "SEVEN.p1"	[0.00 s].
0.0.B: Trace Attempt  1	[0.00 s]
0.0.B: Trace Attempt  2	[0.00 s]
0.0.Ht: clocks: 1, declared: 1, looping: 0, posedge: 1, negedge: 0, noedge: 0, bothedge: 0
0.0.B: Trace Attempt  3	[0.00 s]
0.0.Ht: Last scan. Per property time limit: 0s
0.0.B: Trace Attempt  4	[0.00 s]
0.0.B: Trace Attempt  5	[0.00 s]
0.0.Ht: Trace Attempt  1	[0.00 s]
0.0.Ht: Trace Attempt  2	[0.00 s]
0.0.Ht: Trace Attempt  3	[0.00 s]
0.0.AM: clocks: 1, declared: 1, looping: 0, posedge: 1, negedge: 0, noedge: 0, bothedge: 0
0.0.AM: Last scan. Per property time limit: 0s
0.0.AM: Starting proof for property "SEVEN.p1"	[0.00 s].
0.0.AM: Trace Attempt  1	[0.00 s]
0.0.AM: Trace Attempt  2	[0.00 s]
0.0.AM: Trace Attempt  3	[0.00 s]
0.0.AM: Trace Attempt  4	[0.00 s]
0.0.AM: Trace Attempt  5	[0.00 s]
0.0.AM: Trace Attempt  1	[0.00 s]
0.0.AM: Trace Attempt  2	[0.00 s]
0.0.AM: Trace Attempt  3	[0.00 s]
0.0.AM: Trace Attempt  4	[0.00 s]
0.0.AM: Trace Attempt  5	[0.00 s]
0.0.AM: Trace Attempt  1	[0.01 s]
0.0.Ht: Trace Attempt  4	[0.00 s]
0.0.Ht: Trace Attempt  5	[0.00 s]
0.0.Mpcustom4: Proofgrid shell started at 1550@vlsi-ria85(local) jg_1391_vlsi-ria85_1
0.0.AM: Trace Attempt  2	[0.01 s]
0.0.AM: Trace Attempt  3	[0.01 s]
0.0.Mpcustom4: clocks: 1, declared: 1, looping: 0, posedge: 1, negedge: 0, noedge: 0, bothedge: 0
0.0.Mpcustom4: Ignoring liveness properties
0.0.Mpcustom4: All properties either determined or skipped. [0.00 s]
0.0.AM: Trace Attempt  4	[0.01 s]
0.0.AM: Trace Attempt  5	[0.01 s]
0.0.Mpcustom4: Exited with Success (@ 0.08 s)
0.0.Mpcustom4: Completed, Restart ignored.
0.0.L: Proofgrid shell started at 1552@vlsi-ria85(local) jg_1391_vlsi-ria85_1
0.0.AM: Trace Attempt  1	[0.02 s]
0.0.AM: Trace Attempt  2	[0.03 s]
0.0.AM: Trace Attempt  3	[0.03 s]
0.0.AM: Trace Attempt  4	[0.03 s]
0.0.AM: Trace Attempt  5	[0.03 s]
0.0.Oh: Proofgrid shell started at 1551@vlsi-ria85(local) jg_1391_vlsi-ria85_1
0.0.L: clocks: 1, declared: 1, looping: 0, posedge: 1, negedge: 0, noedge: 0, bothedge: 0
0.0.L: Using trace diversification with seed 1 (0.05)
0.0.L: Using LRU state removal heuristic
0.0.L: Ignoring liveness properties
0.0.L: All properties either determined or skipped. [0.01 s]
0.0.L: Exited with Success (@ 0.09 s)
0.0.L: Completed, Restart ignored.
0.0.N: Trace Attempt  1	[0.09 s]
0.0.N: Trace Attempt  2	[0.09 s]
0.0.N: Trace Attempt  3	[0.09 s]
0.0.N: Trace Attempt  4	[0.09 s]
0.0.N: Trace Attempt  5	[0.09 s]
0.0.Oh: clocks: 1, declared: 1, looping: 0, posedge: 1, negedge: 0, noedge: 0, bothedge: 0
0.0.Oh: Reached length limit (2147483647) [0.01 s]
0.0.Oh: Exited with Success (@ 0.10 s)
0.0.Oh: Completed, Restart ignored.
0.0.AM: Trace Attempt  1	[0.10 s]
0.0.AM: Trace Attempt  2	[0.10 s]
0.0.AM: Trace Attempt  3	[0.10 s]
0.0.AM: Trace Attempt  4	[0.10 s]
0.0.AM: Trace Attempt  5	[0.10 s]
0.0.N: Trace Attempt  1	[0.42 s]
0.0.N: Trace Attempt  2	[0.42 s]
0.0.N: Trace Attempt  3	[0.42 s]
0.0.N: Trace Attempt  4	[0.42 s]
0.0.N: Trace Attempt  5	[0.42 s]
0.0.AM: Trace Attempt  1	[0.43 s]
0.0.AM: Trace Attempt  2	[0.43 s]
0.0.AM: Trace Attempt  3	[0.43 s]
0.0.AM: Trace Attempt  4	[0.43 s]
0.0.AM: Trace Attempt  5	[0.43 s]
0.0.AM: Trace Attempt  1	[1.58 s]
0.0.AM: Trace Attempt  2	[1.58 s]
0.0.AM: Trace Attempt  3	[1.58 s]
0.0.AM: Trace Attempt  4	[1.58 s]
0.0.AM: Trace Attempt  5	[1.58 s]
0.0.N: Trace Attempt  1	[1.81 s]
0.0.N: Trace Attempt  2	[1.81 s]
0.0.N: Trace Attempt  3	[1.81 s]
0.0.N: Trace Attempt  4	[1.81 s]
0.0.N: Trace Attempt  5	[1.81 s]
0.0.Hp: Trace Attempt 416	[4.02 s]
0.0.Bm: Trace Attempt 1816	[4.00 s]
0.0.Ht: Trace Attempt 1916	[4.00 s]
0.0.B: Trace Attempt 1818	[4.00 s]
0.0.AM: Trace Attempt 179	[5.60 s]
0.0.N: Trace Attempt 208	[5.82 s]
0.0.N: Trace Attempt  1	[7.09 s]
0.0.N: Trace Attempt  2	[7.09 s]
0.0.N: Trace Attempt  3	[7.09 s]
0.0.N: Trace Attempt  4	[7.09 s]
0.0.N: Trace Attempt  5	[7.09 s]
0.0.B: Trace Attempt 2168	[8.00 s]
0.0.Hp: Trace Attempt 560	[8.05 s]
0.0.Bm: Trace Attempt 2166	[8.02 s]
0.0.AM: Trace Attempt  1	[8.76 s]
0.0.AM: Trace Attempt  2	[8.77 s]
0.0.AM: Trace Attempt  3	[8.77 s]
0.0.AM: Trace Attempt  4	[8.77 s]
0.0.AM: Trace Attempt  5	[8.77 s]
0.0.Ht: Trace Attempt 2006	[9.46 s]
0.0.N: Trace Attempt 201	[11.13 s]
0.0.B: Trace Attempt 2370	[12.02 s]
0.0.Hp: Trace Attempt 680	[12.06 s]
0.0.Bm: Trace Attempt 2369	[12.03 s]
0.0.N: Trace Attempt  1	[12.74 s]
0.0.N: Trace Attempt  2	[12.74 s]
0.0.N: Trace Attempt  3	[12.74 s]
0.0.N: Trace Attempt  4	[12.75 s]
0.0.N: Trace Attempt  5	[12.75 s]
0.0.AM: Trace Attempt 185	[12.79 s]
0.0.Ht: Trace Attempt 2325	[13.46 s]
0.0.Hp: Trace Attempt 780	[16.07 s]
0.0.B: Trace Attempt 2536	[16.03 s]
0.0.Bm: Trace Attempt 2536	[16.04 s]
0.0.N: Trace Attempt 201	[16.78 s]
0.0.AM: Trace Attempt 249	[16.80 s]
0.0.Ht: Trace Attempt 2644	[17.47 s]
0.0.N: Trace Attempt  1	[18.40 s]
0.0.N: Trace Attempt  2	[18.40 s]
0.0.N: Trace Attempt  3	[18.40 s]
0.0.N: Trace Attempt  4	[18.40 s]
0.0.N: Trace Attempt  5	[18.40 s]
0.0.Hp: Trace Attempt 878	[20.08 s]
0.0.Bm: Trace Attempt 2697	[20.06 s]
0.0.B: Trace Attempt 2698	[20.06 s]
0.0.AM: Trace Attempt 310	[20.83 s]
0.0.Ht: Trace Attempt 2881	[21.48 s]
0.0.N: Trace Attempt 196	[22.41 s]
0.0.Hp: Trace Attempt 952	[24.10 s]
0.0.Bm: Trace Attempt 2835	[24.07 s]
0.0.B: Trace Attempt 2837	[24.09 s]
0.0.N: Trace Attempt  1	[24.36 s]
0.0.N: Trace Attempt  2	[24.36 s]
0.0.N: Trace Attempt  3	[24.36 s]
0.0.N: Trace Attempt  4	[24.36 s]
0.0.N: Trace Attempt  5	[24.36 s]
0.0.AM: Trace Attempt 359	[24.88 s]
0.0.Ht: Trace Attempt 3044	[25.50 s]
0.0.Bm: Trace Attempt 2952	[28.09 s]
0.0.B: Trace Attempt 2954	[28.11 s]
0.0.N: Trace Attempt 192	[28.38 s]
0.0.AM: Trace Attempt 402	[28.95 s]
0.0.Ht: Trace Attempt 3149	[29.50 s]
0.0.N: Trace Attempt  1	[30.32 s]
0.0.N: Trace Attempt  2	[30.32 s]
0.0.N: Trace Attempt  3	[30.32 s]
0.0.N: Trace Attempt  4	[30.32 s]
0.0.N: Trace Attempt  5	[30.32 s]
0.0.Hp: Trace Attempt 1003	[30.36 s]
0.0.Bm: Trace Attempt 3088	[32.11 s]
0.0.B: Trace Attempt 3089	[32.12 s]
0.0.AM: Trace Attempt 449	[33.14 s]
0.0.Ht: Trace Attempt 3416	[33.73 s]
0.0.Hp: Trace Attempt 1043	[34.36 s]
0.0.N: Trace Attempt 201	[34.37 s]
0.0.N: Trace Attempt  1	[35.99 s]
0.0.N: Trace Attempt  2	[35.99 s]
0.0.N: Trace Attempt  3	[35.99 s]
0.0.N: Trace Attempt  4	[35.99 s]
0.0.N: Trace Attempt  5	[35.99 s]
0.0.Bm: Trace Attempt 3219	[36.13 s]
0.0.B: Trace Attempt 3218	[36.15 s]
0.0.AM: Trace Attempt 464	[37.15 s]
0.0.Ht: Trace Attempt 3604	[37.74 s]
0.0.Hp: Trace Attempt 1120	[38.41 s]
0.0.N: Trace Attempt 201	[40.06 s]
0.0.Bm: Trace Attempt 3339	[40.15 s]
0.0.B: Trace Attempt 3336	[40.18 s]
0.0.AM: Trace Attempt  1	[40.90 s]
0.0.AM: Trace Attempt  2	[40.90 s]
0.0.AM: Trace Attempt  3	[40.90 s]
0.0.AM: Trace Attempt  4	[40.90 s]
0.0.AM: Trace Attempt  5	[40.90 s]
0.0.N: Trace Attempt  1	[41.73 s]
0.0.N: Trace Attempt  2	[41.73 s]
0.0.N: Trace Attempt  3	[41.73 s]
0.0.N: Trace Attempt  4	[41.73 s]
0.0.N: Trace Attempt  5	[41.73 s]
0.0.Ht: Trace Attempt 3762	[41.74 s]
0.0.Hp: Trace Attempt 1194	[42.41 s]
0.0.Bm: Trace Attempt 3465	[44.18 s]
0.0.B: Trace Attempt 3459	[44.19 s]
0.0.AM: Trace Attempt 207	[44.92 s]
0.0.N: Trace Attempt 202	[45.75 s]
0.0.Ht: Trace Attempt 3914	[45.75 s]
0.0.Hp: Trace Attempt 1269	[46.43 s]
0.0.N: Trace Attempt  1	[47.33 s]
0.0.N: Trace Attempt  2	[47.33 s]
0.0.N: Trace Attempt  3	[47.33 s]
0.0.N: Trace Attempt  4	[47.33 s]
0.0.N: Trace Attempt  5	[47.33 s]
0.0.Bm: Trace Attempt 3587	[48.20 s]
0.0.B: Trace Attempt 3576	[48.20 s]
0.0.AM: Trace Attempt 253	[48.99 s]
0.0.Ht: Trace Attempt 4040	[49.83 s]
0.0.Hp: Trace Attempt 1339	[50.43 s]
0.0.N: Trace Attempt 201	[51.38 s]
0.0.Bm: Trace Attempt 3716	[52.20 s]
0.0.B: Trace Attempt 3705	[52.21 s]
0.0.N: Trace Attempt  1	[53.04 s]
0.0.N: Trace Attempt  2	[53.04 s]
0.0.N: Trace Attempt  3	[53.04 s]
0.0.N: Trace Attempt  4	[53.04 s]
0.0.N: Trace Attempt  5	[53.04 s]
0.0.AM: Trace Attempt 292	[53.09 s]
0.0.Ht: Trace Attempt 4157	[53.83 s]
0.0.Hp: Trace Attempt 1362	[54.48 s]
0.0.Bm: Trace Attempt 3828	[56.22 s]
0.0.B: Trace Attempt 3815	[56.24 s]
0.0.N: Trace Attempt 202	[57.05 s]
0.0.AM: Trace Attempt 338	[57.17 s]
0.0.Ht: Trace Attempt 4251	[57.83 s]
0.0.Hp: Trace Attempt 1406	[58.52 s]
0.0.N: Trace Attempt  1	[58.58 s]
0.0.N: Trace Attempt  2	[58.59 s]
0.0.N: Trace Attempt  3	[58.59 s]
0.0.N: Trace Attempt  4	[58.59 s]
0.0.N: Trace Attempt  5	[58.59 s]
0.0.Bm: Trace Attempt 3938	[60.22 s]
0.0.B: Trace Attempt 3923	[60.24 s]
0.0.AM: Trace Attempt 374	[61.17 s]
0.0.Ht: Trace Attempt 4338	[61.84 s]
0.0.N: Trace Attempt 203	[62.61 s]
0.0.Hp: Trace Attempt 1450	[62.62 s]
0.0.B: Trace Attempt 4017	[64.24 s]
0.0.Bm: Trace Attempt 4026	[64.26 s]
0.0.N: Trace Attempt  1	[64.64 s]
0.0.N: Trace Attempt  2	[64.64 s]
0.0.N: Trace Attempt  3	[64.64 s]
0.0.N: Trace Attempt  4	[64.64 s]
0.0.N: Trace Attempt  5	[64.64 s]
0.0.AM: Trace Attempt 411	[65.18 s]
0.0.Ht: Trace Attempt 4378	[66.10 s]
0.0.Hp: Trace Attempt 1493	[66.69 s]
0.0.Bm: Trace Attempt 4083	[68.27 s]
0.0.B: Trace Attempt 4071	[68.27 s]
0.0.N: Trace Attempt 246	[68.72 s]
0.0.AM: Trace Attempt 451	[69.34 s]
0.0.Ht: Trace Attempt 4556	[70.10 s]
0.0.Hp: Trace Attempt 1533	[70.72 s]
0.0.Bm: Trace Attempt 4149	[72.31 s]
0.0.B: Trace Attempt 4136	[72.33 s]
0.0.N: Trace Attempt 336	[72.72 s]
0.0.AM: Trace Attempt 469	[73.78 s]
0.0.Ht: Trace Attempt 4686	[74.11 s]
0.0.Hp: Trace Attempt 1567	[74.74 s]
0.0.Bm: Trace Attempt 4219	[76.36 s]
0.0.B: Trace Attempt 4204	[76.38 s]
0.0.N: Trace Attempt 424	[76.75 s]
0.0.AM: Trace Attempt 481	[77.83 s]
0.0.Ht: Trace Attempt 4829	[78.13 s]
0.0.Hp: Trace Attempt 1622	[78.75 s]
0.0.Bm: Trace Attempt 4285	[80.38 s]
0.0.B: Trace Attempt 4270	[80.44 s]
0.0.N: Trace Attempt 460	[81.05 s]
0.0.N: Trace Attempt  1	[81.06 s]
0.0.N: Trace Attempt  2	[81.06 s]
0.0.N: Trace Attempt  3	[81.06 s]
0.0.N: Trace Attempt  4	[81.06 s]
0.0.N: Trace Attempt  5	[81.06 s]
0.0.AM: Trace Attempt 494	[81.97 s]
0.0.Ht: Trace Attempt 4960	[82.15 s]
0.0.Hp: Trace Attempt 1675	[82.79 s]
0.0.Bm: Trace Attempt 4351	[84.42 s]
0.0.B: Trace Attempt 4336	[84.47 s]
0.0.N: Trace Attempt 246	[85.11 s]
0.0.AM: Trace Attempt 504	[86.13 s]
0.0.Ht: Trace Attempt 5093	[86.18 s]
0.0.Hp: Trace Attempt 1727	[86.86 s]
0.0.Bm: Trace Attempt 4417	[88.49 s]
0.0.B: Trace Attempt 4400	[88.52 s]
0.0.N: Trace Attempt 337	[89.19 s]
0.0.AM: Trace Attempt 516	[90.15 s]
0.0.Ht: Trace Attempt 5192	[90.22 s]
0.0.Hp: Trace Attempt 1776	[90.88 s]
0.0.Bm: Trace Attempt 4480	[92.51 s]
0.0.B: Trace Attempt 4462	[92.53 s]
0.0.N: Trace Attempt 428	[93.22 s]
0.0.Ht: Trace Attempt 5273	[94.27 s]
0.0.AM: Trace Attempt 532	[94.37 s]
0.0.Hp: Trace Attempt 1824	[94.90 s]
0.0.B: Trace Attempt 4521	[96.54 s]
0.0.Bm: Trace Attempt 4540	[96.58 s]
0.0.N: Trace Attempt  1	[97.09 s]
0.0.N: Trace Attempt  2	[97.09 s]
0.0.N: Trace Attempt  3	[97.09 s]
0.0.N: Trace Attempt  4	[97.09 s]
0.0.N: Trace Attempt  5	[97.09 s]
0.0.Ht: Trace Attempt 5342	[98.41 s]
0.0.AM: Trace Attempt 546	[98.57 s]
0.0.Hp: Trace Attempt 1871	[98.93 s]
0.0.B: Trace Attempt 4574	[100.57 s]
0.0.Bm: Trace Attempt 4593	[100.61 s]
0.0.N: Trace Attempt 246	[101.15 s]
0.0.Ht: Trace Attempt 5410	[102.44 s]
0.0.AM: Trace Attempt 560	[102.68 s]
0.0.Hp: Trace Attempt 1918	[102.99 s]
0.0.Bm: Trace Attempt 4650	[104.63 s]
0.0.B: Trace Attempt 4631	[104.64 s]
0.0.N: Trace Attempt 337	[105.19 s]
0.0.Ht: Trace Attempt 5460	[106.46 s]
0.0.AM: Trace Attempt 575	[106.83 s]
0.0.Hp: Trace Attempt 1964	[107.07 s]
0.0.B: Trace Attempt 4682	[108.65 s]
0.0.Bm: Trace Attempt 4699	[108.69 s]
0.0.N: Trace Attempt 428	[109.20 s]
0.0.Ht: Trace Attempt 5512	[110.46 s]
0.0.AM: Trace Attempt 587	[111.11 s]
0.0.B: Trace Attempt 4725	[112.69 s]
0.0.Bm: Trace Attempt 4743	[112.78 s]
0.0.N: Trace Attempt 462	[113.52 s]
0.0.N: Trace Attempt  1	[113.53 s]
0.0.N: Trace Attempt  2	[113.53 s]
0.0.N: Trace Attempt  3	[113.53 s]
0.0.N: Trace Attempt  4	[113.53 s]
0.0.N: Trace Attempt  5	[113.53 s]
0.0.Hp: Trace Attempt 2005	[113.96 s]
0.0.Ht: Trace Attempt 5539	[115.19 s]
0.0.AM: Trace Attempt 599	[115.30 s]
0.0.B: Trace Attempt 4769	[116.71 s]
0.0.Bm: Trace Attempt 4787	[116.79 s]
0.0.N: Trace Attempt 246	[117.59 s]
0.0.Hp: Trace Attempt 2021	[118.03 s]
0.0.Ht: Trace Attempt 5584	[119.27 s]
0.0.AM: Trace Attempt 611	[119.43 s]
0.0.B: Trace Attempt 4814	[120.74 s]
0.0.Bm: Trace Attempt 4835	[120.81 s]
0.0.N: Trace Attempt 336	[121.62 s]
0.0.Hp: Trace Attempt 2047	[122.05 s]
0.0.Ht: Trace Attempt 5676	[123.29 s]
0.0.AM: Trace Attempt 623	[123.57 s]
0.0.B: Trace Attempt 4865	[124.76 s]
0.0.Bm: Trace Attempt 4887	[124.86 s]
0.0.N: Trace Attempt 424	[125.64 s]
0.0.Hp: Trace Attempt 2099	[126.06 s]
0.0.AM: Trace Attempt 634	[127.88 s]
0.0.Ht: Trace Attempt 5736	[127.90 s]
0.0.B: Trace Attempt 4917	[128.79 s]
0.0.Bm: Trace Attempt 4939	[128.92 s]
0.0.N: Trace Attempt  1	[129.61 s]
0.0.N: Trace Attempt  2	[129.61 s]
0.0.N: Trace Attempt  3	[129.61 s]
0.0.N: Trace Attempt  4	[129.61 s]
0.0.N: Trace Attempt  5	[129.61 s]
0.0.Hp: Trace Attempt 2149	[130.11 s]
0.0.Ht: Trace Attempt 5803	[131.93 s]
0.0.AM: Trace Attempt 645	[132.28 s]
0.0.B: Trace Attempt 4970	[132.82 s]
0.0.Bm: Trace Attempt 4992	[132.97 s]
0.0.N: Trace Attempt 246	[133.63 s]
0.0.Hp: Trace Attempt 2198	[134.12 s]
0.0.Ht: Trace Attempt 5895	[135.95 s]
0.0.AM: Trace Attempt 655	[136.50 s]
0.0.B: Trace Attempt 5024	[136.87 s]
0.0.Bm: Trace Attempt 5046	[137.03 s]
0.0.N: Trace Attempt 337	[137.64 s]
0.0.Hp: Trace Attempt 2246	[138.24 s]
0.0.Ht: Trace Attempt 5949	[140.17 s]
0.0.B: Trace Attempt 5077	[140.93 s]
0.0.Bm: Trace Attempt 5099	[141.07 s]
0.0.AM: Trace Attempt 666	[141.15 s]
0.0.N: Trace Attempt 427	[141.71 s]
0.0.Hp: Trace Attempt 2291	[142.28 s]
0.0.Ht: Trace Attempt 5982	[144.19 s]
0.0.B: Trace Attempt 5128	[144.95 s]
0.0.Bm: Trace Attempt 5150	[145.16 s]
0.0.AM: Trace Attempt 676	[145.30 s]
0.0.Hp: Trace Attempt 2333	[146.31 s]
0.0.N: Trace Attempt 464	[147.05 s]
0.0.N: Trace Attempt  1	[147.06 s]
0.0.N: Trace Attempt  2	[147.06 s]
0.0.N: Trace Attempt  3	[147.06 s]
0.0.N: Trace Attempt  4	[147.07 s]
0.0.N: Trace Attempt  5	[147.07 s]
0.0.Ht: Trace Attempt 6075	[148.22 s]
0.0.B: Trace Attempt 5176	[148.99 s]
0.0.Bm: Trace Attempt 5199	[149.22 s]
0.0.AM: Trace Attempt 685	[149.31 s]
0.0.Hp: Trace Attempt 2375	[150.34 s]
0.0.N: Trace Attempt 246	[151.17 s]
0.0.Ht: Trace Attempt 6111	[152.36 s]
0.0.B: Trace Attempt 5226	[153.00 s]
0.0.Bm: Trace Attempt 5250	[153.23 s]
0.0.AM: Trace Attempt 694	[153.46 s]
0.0.Hp: Trace Attempt 2418	[154.37 s]
0.0.N: Trace Attempt 337	[155.21 s]
0.0.Ht: Trace Attempt 6168	[156.39 s]
0.0.B: Trace Attempt 5276	[157.03 s]
0.0.Bm: Trace Attempt 5301	[157.28 s]
0.0.AM: Trace Attempt 702	[157.81 s]
0.0.Hp: Trace Attempt 2454	[158.37 s]
0.0.N: Trace Attempt 427	[159.25 s]
0.0.Ht: Trace Attempt 6199	[160.41 s]
0.0.B: Trace Attempt 5325	[161.06 s]
0.0.Bm: Trace Attempt 5351	[161.32 s]
0.0.AM: Trace Attempt 711	[162.27 s]
0.0.Hp: Trace Attempt 2492	[162.46 s]
0.0.N: Trace Attempt 465	[163.69 s]
0.0.N: Trace Attempt  1	[163.70 s]
0.0.N: Trace Attempt  2	[163.70 s]
0.0.N: Trace Attempt  3	[163.70 s]
0.0.N: Trace Attempt  4	[163.70 s]
0.0.N: Trace Attempt  5	[163.70 s]
0.0.Ht: Trace Attempt 6243	[164.44 s]
0.0.B: Trace Attempt 5373	[165.10 s]
0.0.Bm: Trace Attempt 5400	[165.40 s]
0.0.Hp: Trace Attempt 2534	[166.49 s]
0.0.AM: Trace Attempt 719	[166.65 s]
0.0.N: Trace Attempt 246	[167.75 s]
0.0.Ht: Trace Attempt 6289	[168.44 s]
0.0.B: Trace Attempt 5422	[169.18 s]
0.0.Bm: Trace Attempt 5448	[169.45 s]
0.0.Hp: Trace Attempt 2575	[170.55 s]
0.0.AM: Trace Attempt 729	[170.75 s]
0.0.N: Trace Attempt 337	[171.82 s]
0.0.Ht: Trace Attempt 6322	[172.71 s]
0.0.B: Trace Attempt 5469	[173.21 s]
0.0.Bm: Trace Attempt 5494	[173.45 s]
0.0.Hp: Trace Attempt 2616	[174.60 s]
0.0.AM: Trace Attempt 737	[174.77 s]
0.0.N: Trace Attempt 427	[175.85 s]
0.0.Ht: Trace Attempt 6366	[176.73 s]
0.0.B: Trace Attempt 5514	[177.24 s]
0.0.Bm: Trace Attempt 5537	[177.49 s]
0.0.Hp: Trace Attempt 2654	[178.62 s]
0.0.AM: Trace Attempt 746	[178.93 s]
0.0.N: Trace Attempt 466	[180.64 s]
0.0.N: Trace Attempt  1	[180.66 s]
0.0.N: Trace Attempt  2	[180.66 s]
0.0.N: Trace Attempt  3	[180.66 s]
0.0.N: Trace Attempt  4	[180.66 s]
0.0.N: Trace Attempt  5	[180.66 s]
0.0.Ht: Trace Attempt 6384	[180.76 s]
0.0.N: Trace Attempt 59	[180.92 s]
0.0.N: Stopped processing property "SEVEN.p1"	[180.93 s].
0.0.N: Morphing to Ncustom1
0.0.N: All properties determined. [0.00 s]
0.0.N: Exited with Success (@ 0.00 s)
0.0.Ncustom1: clocks: 1, declared: 1, looping: 0, posedge: 1, negedge: 0, noedge: 0, bothedge: 0
0.0.Ncustom1: Starting proof for property "SEVEN.p1"	[0.00 s].
0.0.Ncustom1: Trace Attempt 465	[0.04 s]
0.0.B: Trace Attempt 5550	[180.80 s]
0.0.B: Stopped processing property "SEVEN.p1"	[180.95 s].
0.0.B: Morphing to Bcustom2
0.0.B: All properties determined. [0.00 s]
0.0.B: Exited with Success (@ 0.00 s)
0.0.Bcustom2: clocks: 1, declared: 1, looping: 0, posedge: 1, negedge: 0, noedge: 0, bothedge: 0
0.0.Bcustom2: Starting proof for property "SEVEN.p1"	[0.00 s].
0.0.Bcustom2: Trace Attempt  1	[0.00 s]
0.0.Bcustom2: Trace Attempt  2	[0.00 s]
0.0.Bcustom2: Trace Attempt  1	[0.00 s]
0.0.Bcustom2: Trace Attempt  2	[0.00 s]
0.0.Bcustom2: Trace Attempt  3	[0.00 s]
0.0.Bcustom2: Trace Attempt  4	[0.00 s]
0.0.Bcustom2: Trace Attempt  5	[0.00 s]
0.0.Bcustom2: Trace Attempt  1	[0.00 s]
0.0.Bcustom2: Trace Attempt  2	[0.00 s]
0.0.Bcustom2: Trace Attempt  3	[0.00 s]
0.0.Bcustom2: Trace Attempt  4	[0.00 s]
0.0.Bcustom2: Trace Attempt  5	[0.00 s]
0.0.Bcustom2: Trace Attempt  1	[0.00 s]
0.0.Bcustom2: Trace Attempt  2	[0.00 s]
0.0.Bcustom2: Trace Attempt  3	[0.00 s]
0.0.Bcustom2: Trace Attempt  4	[0.00 s]
0.0.Bcustom2: Trace Attempt  5	[0.00 s]
0.0.Bcustom2: Trace Attempt  1	[0.01 s]
0.0.Bcustom2: Trace Attempt  2	[0.01 s]
0.0.Bcustom2: Trace Attempt  3	[0.01 s]
0.0.Bcustom2: Trace Attempt  4	[0.01 s]
0.0.Bcustom2: Trace Attempt  5	[0.01 s]
0.0.Bcustom2: Trace Attempt  1	[0.02 s]
0.0.Bcustom2: Trace Attempt  2	[0.02 s]
0.0.Bcustom2: Trace Attempt  3	[0.02 s]
0.0.Bcustom2: Trace Attempt  4	[0.02 s]
0.0.Bcustom2: Trace Attempt  5	[0.02 s]
0.0.Bcustom2: Trace Attempt  1	[0.07 s]
0.0.Bcustom2: Trace Attempt  2	[0.07 s]
0.0.Bcustom2: Trace Attempt  3	[0.07 s]
0.0.Bcustom2: Trace Attempt  4	[0.07 s]
0.0.Bcustom2: Trace Attempt  5	[0.07 s]
0.0.Tri: Proofgrid shell started at 11816@vlsi-ria85(local) jg_1391_vlsi-ria85_1
0.0.Tri: clocks: 1, declared: 1, looping: 0, posedge: 1, negedge: 0, noedge: 0, bothedge: 0
0.0.AM: Trace Attempt 750	[180.87 s]
0.0.AM: Stopped processing property "SEVEN.p1"	[181.05 s].
0.0.AM: Morphing to AMcustom3
0.0.AM: All properties determined. [0.00 s]
0.0.AM: Exited with Success (@ 0.00 s)
0.0.AMcustom3: clocks: 1, declared: 1, looping: 0, posedge: 1, negedge: 0, noedge: 0, bothedge: 0
0.0.AMcustom3: Starting proof for property "SEVEN.p1"	[0.00 s].
0.0.AMcustom3: Trace Attempt  1	[0.00 s]
0.0.AMcustom3: Trace Attempt  2	[0.00 s]
0.0.AMcustom3: Trace Attempt  3	[0.00 s]
0.0.AMcustom3: Trace Attempt  4	[0.00 s]
0.0.AMcustom3: Trace Attempt  5	[0.00 s]
0.0.AMcustom3: Trace Attempt  1	[0.00 s]
0.0.AMcustom3: Trace Attempt  2	[0.00 s]
0.0.AMcustom3: Trace Attempt  3	[0.00 s]
0.0.AMcustom3: Trace Attempt  4	[0.00 s]
0.0.AMcustom3: Trace Attempt  5	[0.00 s]
0.0.Tri: Last scan. Per property time limit: 0s
0.0.Tri: Starting proof for property "SEVEN.p1"	[0.00 s].
0.0.Tri: Trace Attempt  1	[0.00 s]
0.0.AMcustom3: Trace Attempt  1	[0.04 s]
0.0.AMcustom3: Trace Attempt  2	[0.04 s]
0.0.AMcustom3: Trace Attempt  3	[0.04 s]
0.0.AMcustom3: Trace Attempt  4	[0.05 s]
0.0.AMcustom3: Trace Attempt  5	[0.05 s]
0.0.D: Proofgrid shell started at 11817@vlsi-ria85(local) jg_1391_vlsi-ria85_1
0.0.AMcustom3: Trace Attempt  1	[0.06 s]
0.0.AMcustom3: Trace Attempt  2	[0.06 s]
0.0.AMcustom3: Trace Attempt  3	[0.06 s]
0.0.AMcustom3: Trace Attempt  4	[0.06 s]
0.0.AMcustom3: Trace Attempt  5	[0.06 s]
0.0.D: clocks: 1, declared: 1, looping: 0, posedge: 1, negedge: 0, noedge: 0, bothedge: 0
0.0.D: Last scan. Per property time limit: 0s
0.0.D: Starting proof for property "SEVEN.p1"	[0.00 s].
0.0.D: Trace Attempt  1	[0.00 s]
0.0.D: Trace Attempt  2	[0.00 s]
0.0.D: Trace Attempt  3	[0.00 s]
0.0.Tri:    0.00" ---- Launching main thread ----
0.0.Bcustom2: Trace Attempt  1	[0.20 s]
0.0.Bcustom2: Trace Attempt  2	[0.20 s]
0.0.Bcustom2: Trace Attempt  3	[0.20 s]
0.0.Bcustom2: Trace Attempt  4	[0.20 s]
0.0.Bcustom2: Trace Attempt  5	[0.20 s]
0.0.AMcustom3: Trace Attempt  1	[0.14 s]
0.0.AMcustom3: Trace Attempt  2	[0.14 s]
0.0.AMcustom3: Trace Attempt  3	[0.14 s]
0.0.AMcustom3: Trace Attempt  4	[0.14 s]
0.0.AMcustom3: Trace Attempt  5	[0.14 s]
0.0.Tri:    0.20" ---- Launching abstraction thread ----
0.0.Tri:    0.22" ---- Launching multi-phase simplification thread ----
0.0.Bcustom2: Trace Attempt  1	[0.54 s]
0.0.Bcustom2: Trace Attempt  2	[0.54 s]
0.0.Bcustom2: Trace Attempt  3	[0.54 s]
0.0.Bcustom2: Trace Attempt  4	[0.54 s]
0.0.Bcustom2: Trace Attempt  5	[0.54 s]
0.0.Bm: Trace Attempt 5579	[181.50 s]
0.0.Tri:    0.41" ---- Launching liveness simplification thread ----
0.0.AMcustom3: Trace Attempt  1	[0.51 s]
0.0.AMcustom3: Trace Attempt  2	[0.51 s]
0.0.AMcustom3: Trace Attempt  3	[0.51 s]
0.0.AMcustom3: Trace Attempt  4	[0.51 s]
0.0.AMcustom3: Trace Attempt  5	[0.51 s]
0.0.Tri:    1.22" Simplification phase 1 complete
0.0.Ncustom1: Requesting engine job to terminate
0.0.Bcustom2: Requesting engine job to terminate
0.0.AMcustom3: Requesting engine job to terminate
0.0.Tri: Requesting engine job to terminate
0.0.D: Requesting engine job to terminate
0.0.Hp: Requesting engine job to terminate
0.0.Ht: Requesting engine job to terminate
0.0.Bm: Requesting engine job to terminate
INFO (IPF144): 0: Initiating shutdown of proof [182.48 s]
0.0.Tri: A proof was found: No trace exists. [1.35 s]
INFO (IPF057): 0.0.Tri: The property "SEVEN.p1" was proven in 1.36 s.
0.0.D: Trace Attempt 63	[0.80 s]
0.0.D: Stopped processing property "SEVEN.p1"	[1.31 s].
0.0.D: All properties determined. [1.31 s]
0.0.AMcustom3: Trace Attempt 92	[1.38 s]
0.0.AMcustom3: Stopped processing property "SEVEN.p1"	[1.38 s].
0.0.AMcustom3: All properties determined. [1.39 s]
0.0.D: Exited with Success (@ 182.49 s)
0: ProofGrid usable level: 0
0.0.AMcustom3: Exited with Success (@ 182.49 s)
0.0.Ncustom1: Stopped processing property "SEVEN.p1"	[1.54 s].
0.0.Ncustom1: All properties determined. [1.55 s]
0.0.Ncustom1: Exited with Success (@ 182.50 s)
0.0.Ht: Trace Attempt 6403	[182.43 s]
0.0.Ht: All properties determined. [182.46 s]
0.0.Hp: Trace Attempt 2688	[182.40 s]
0.0.Hp: All properties determined. [182.51 s]
0.0.Ht: Exited with Success (@ 182.53 s)
0.0.Bm: Trace Attempt 5587	[182.35 s]
0.0.Bm: All properties determined. [182.50 s]
0.0.Bm: Exited with Success (@ 182.54 s)
0.0.Bcustom2: Trace Attempt  1	[1.56 s]
0.0.Bcustom2: Stopped processing property "SEVEN.p1"	[1.56 s].
0.0.Bcustom2: All properties determined. [1.56 s]
0.0.Bcustom2: Exited with Success (@ 182.56 s)
0.0.Hp: Exited with Success (@ 182.65 s)
0.0.Tri: Stopped processing property "SEVEN.p1"	[1.55 s].
0.0.Tri: All properties determined. [1.55 s]
0.0.Tri: Exited with Success (@ 182.67 s)
0: --------------------------------------------------------------
ProofGrid Summary (utilization 99.93 %)
--------------------------------------------------------------
     engines started                               :    14
     engine jobs started                           :    11

    Average time in state (seconds)
    ------------------------------------------------------
    Engine  Pending     Running        Dead    Utilization
    ------------------------------------------------------
     Hp        0.03      182.48        0.00       99.98 %
     Ht        0.04      182.43        0.00       99.98 %
     Bm        0.04      182.44        0.00       99.98 %
    Mpcustom4        0.05        0.02        0.00       32.52 %
     Oh        0.08        0.01        0.00        7.12 %
      L        0.07        0.01        0.00       12.54 %
    Ncustom1        0.04      182.46        0.00       99.98 %
    Bcustom2        0.04      182.37        0.00       99.98 %
    AMcustom3        0.04      182.27        0.00       99.98 %
    Tri        0.15        1.39        0.00       90.09 %
      D        0.21        1.31        0.00       85.94 %
    all        0.07       99.75        0.00       99.93 %

    Total time in state (seconds)
    -----------------------------------------
            Pending     Running        Dead  
    -----------------------------------------
               0.79     1097.20        0.00

    Data read    : 7.57 MiB
    Data written : 4.09 kiB

0: All pending notifications were processed.
INFO (IPF059): 0: Completed proof on task: "<embedded>"

==============================================================
SUMMARY
==============================================================
           Properties Considered              : 2
                 assertions                   : 1
                  - proven                    : 1 (100%)
                  - bounded_proven (user)     : 0 (0%)
                  - bounded_proven (auto)     : 0 (0%)
                  - marked_proven             : 0 (0%)
                  - cex                       : 0 (0%)
                  - ar_cex                    : 0 (0%)
                  - undetermined              : 0 (0%)
                  - unknown                   : 0 (0%)
                  - error                     : 0 (0%)
                 covers                       : 1
                  - unreachable               : 0 (0%)
                  - bounded_unreachable (user): 0 (0%)
                  - covered                   : 1 (100%)
                  - ar_covered                : 0 (0%)
                  - undetermined              : 0 (0%)
                  - unknown                   : 0 (0%)
                  - error                     : 0 (0%)
determined
[<embedded>] % exit -force
INFO (IPL005): Received request to exit from the console.
INFO (IPL014): Waiting for the Tcl-thread to exit.
INFO: Waiting for proof threads to stop...
INFO: Proof threads stopped.
INFO (IPL018): The peak resident set memory use for this session was 1.766 GB.
INFO (IPL015): The Tcl-thread exited with status 0.
INFO (IPL016): Exiting the analysis session with status 0.
