# ----------------------------------------
# Jasper Version Info
# tool      : Jasper 2024.06
# platform  : Linux 3.10.0-1062.el7.x86_64
# version   : 2024.06p002 64 bits
# build date: 2024.09.02 16:28:38 UTC
# ----------------------------------------
# started   : 2025-11-20 13:56:28 IST
# hostname  : vlsi-moon.vlsidomain
# pid       : 81347
# arguments : '-label' 'session_0' '-console' '//127.0.0.1:44756' '-nowindow' '-style' 'windows' '-exitonerror' '-data' 'AAAAynicY2RgYLCp////PwMYMD6A0Aw2jAyoAMRnQhUJbEChGRhYYZphSliAmItBl6GAoYghnyELyNNi0ANCfSA7HS6aypDMUMJQDBQ1ZIhnyGQwAvLjGUyAqnmAepMYEoGyyQwZQL4Ymgo9sEwO2C4A4rkV2Q==' '-proj' '/users/rompel/jasper_executions/safety_liveness/jgprojects/1_i2c_4/sessionLogs/session_0' '-init' '-hidden' '/users/rompel/jasper_executions/safety_liveness/jgprojects/1_i2c_4/.tmp/.initCmds.tcl' '1_i2c_4.tcl' '-hidden' '/users/rompel/jasper_executions/safety_liveness/jgprojects/1_i2c_4/.tmp/.postCmds.tcl'

Any disclosure about the Cadence Design Systems software or its use
model to any third party violates the written Non-Disclosure Agreement
between Cadence Design Systems, Inc. and the customer.

THIS SOFTWARE CONTAINS CONFIDENTIAL INFORMATION AND TRADE SECRETS OF
CADENCE DESIGN SYSTEMS, INC. USE, DISCLOSURE, OR REPRODUCTION IS
PROHIBITED WITHOUT THE PRIOR EXPRESS WRITTEN PERMISSION OF CADENCE
DESIGN SYSTEMS, INC.

Copyright (C) 2000-2024 Cadence Design Systems, Inc. All Rights
Reserved.  Unpublished -- rights reserved under the copyright laws of
the United States.

This product includes software developed by others and redistributed
according to license agreement. See doc/third_party_readme.txt for
further details.

RESTRICTED RIGHTS LEGEND

Use, duplication, or disclosure by the Government is subject to
restrictions as set forth in subparagraph (c) (1) (ii) of the Rights in
Technical Data and Computer Software clause at DFARS 252.227-7013 or
subparagraphs (c) (1) and (2) of Commercial Computer Software -- Restricted
Rights at 48 CFR 52.227-19, as applicable.


                          Cadence Design Systems, Inc.
                          2655 Seely Avenue
                          San Jose, CA 95134
                          Phone: 408.943.1234

For technical assistance visit http://support.cadence.com.

Jasper Apps Analysis Session - /users/rompel/jasper_executions/safety_liveness/jgprojects/1_i2c_4/sessionLogs/session_0

WARNING (WG017): [session]: The system's locale is "ANSI_X3.4-1968", which is not UTF-8. Non-ASCII characters might not be handled correctly.
WARNING (WG017): [jg_console]: The system's locale is "ANSI_X3.4-1968", which is not UTF-8. Non-ASCII characters might not be handled correctly.
INFO: successfully checked out license "jasper_fao".
INFO: reading configuration file "/users/rompel/.config/cadence/jasper.conf".
% analyze -sv09 ../1_i2c_4.sv
[-- (VERI-1482)] Analyzing Verilog file '/tools/cadence2425/JASPER/jasper_2024.06p002/lib/verilog/packages/std/std.sv' into library 'std'
[-- (VERI-1482)] Analyzing Verilog file '../1_i2c_4.sv'
% elaborate -bbox_mul 1000000 -bbox_div 1000000 -bbox_mod 1000000 -bbox_a 1000000
[INFO (HIER-8002)] ../1_i2c_4.sv(43): Disabling old hierarchical reference handler
[INFO (VERI-1018)] ../1_i2c_4.sv(1): compiling module 'i2cStrech'
[WARN (VERI-1209)] ../1_i2c_4.sv(15): expression size 32 truncated to fit in target size 12
[INFO (VERI-8005)] ../1_i2c_4.sv(6): Unintentional sequential element inferred for stretch read before write using blocking assignment
[INFO (VERI-8005)] ../1_i2c_4.sv(4): Unintentional sequential element inferred for cnt read before write using blocking assignment
[INFO (VERI-8005)] ../1_i2c_4.sv(5): Unintentional sequential element inferred for scl_clk read before write using blocking assignment
[INFO (VERI-8005)] ../1_i2c_4.sv(1): Unintentional sequential element inferred for data_clk read before write using blocking assignment
[INFO (VERI-8005)] ../1_i2c_4.sv(1): Unintentional sequential element inferred for switch_range read before write using blocking assignment
INFO (ISW003): Top module name is "i2cStrech".
INFO (INL208): Elaboration synthesis summary:
  Number of synthesized netlists          1 (0 packages)
  Single run mode                         On
  Pipeline                                On (1 pipelined netlists)
  Late hierarchical reference connection  On
  Number of analyzed Verilog modules      1 (1 synthesized)
  Number of analyzed VHDL entities        0 (0 synthesized)
INFO (INL003): Clearing all state information (assumes, stopats, and so forth).
i2cStrech
[<embedded>] % reset rst
INFO (IPM031): Clearing proof results of all properties.
INFO (IRS006): Current reset condition is "rst".
[<embedded>] % clock clk
[<embedded>] % prove -all
Ncustom1: Custom engine code is hT3Ng7hPPfiYQOTDZ3qhYOwGAM51eA+J/FjkM5shLioAsqhgLR4Ft+O1BuKG6ilQ83B9tLXSl+CwjiTMAQA
Bcustom2: Custom engine code is hT3Nm7hPr1Vp3Di1Ra2USNIGL4JypRnLKLAdF6JAyuavO2JfGCiY9OZJhcAcOUnLx5xwNdhILGrAWX9s+z2WDkKwNR7tAfClBEjRFVQeq6DU54boFgEA
AMcustom3: Custom engine code is hT3Ng7hP/feYQOTDZ3qhYOwGAM51eA+J/FjkM5shLioAsqhgLR4Ft+O1BuKG6ilQ83B9tLXSmmqwm7g9AQA
Mpcustom4: Custom engine code is hT3NZbhP9fmY2AbBQnsjfOxn6c+6e6yL+/e8fZFmaQrnlgEA
INFO (IPF036): Starting proof on task: "<embedded>", 2 properties to prove with 0 already proven/unreachable
INFO (IRS029): Starting reset analysis: phase 1 of 4.
INFO (IRS030): Running reset analysis: phase 2 of 4.
INFO (IRS031): Running reset analysis: phase 3 of 4.
INFO (IRS020): Starting the reset analysis simulation with a limit of 100 iterations (phase 4 of 4).
INFO (IRS024): Reset iterations 0 to 4 analyzed.
INFO (IRS018): Reset analysis simulation executed for 3 iterations. Assigned values for 16 of 16 design flops, 0 of 0 design latches, 6 of 6 internal elements.
INFO (IRS039): Reset analysis complete.
INFO (IPF031): Settings used for proof thread 0:
    orchestration                 = on
    time_limit                    = 86400s
    per_property_time_limit       = 1s * 10 ^ scan
    engine_mode                   = auto
    proofgrid_per_engine_max_jobs = 1
    max engine jobs               = auto
    proofgrid_mode                = local
    proofgrid_restarts            = 10
0: Using multistage preprocessing
0: Starting reduce
AMcustom5: Custom engine code is hT3N1rhP11/52HrFRS21ROp2LOjVTgPvT8L8BGXHgLhaIuqtT4nARFjUqrBL+7pLmaTOzBepZW/Jm8SSrHDybSQtoNiO3y43wk+dEoWlsZizu97Fih6O6lPVG/LpWP5SsUPwlGagLNa1FKEFvwVXyX7//8prySbvSxIHXr5er+z4RAEA
0: Finished reduce in 0s
Ncustom6: Custom engine code is hT3OXrhPByJp3TrFSTLhUmMH4KVtJgmTCnNDF46yMXOKY48m4LS5nE7yBzFjA7kDuwO/GhGUpEPiky3p3wmPn3dJZHxFMsafSoObRzSC+tn7sEY0WbTdZ/FV4hL3MYH/b1CIUvXSWR4wqEoVLsmMOD4xIPT4lI1LO6ZCO7PnnWQuLwetnvKlrXx6wCW/A+x+enqslg1YPobi4wEF/EvbzOvcTYdJvl2s4H2yZg2b2ofAVN5WvhWk1HoBAA
ADcustom7: Custom engine code is hT3Nv7hPv1752HrFRa2kROx2f/ECJeZB2AZsLdlO8VwmIuqtT4nIDFXclhg+O+o+DMmQCekbheGk0kK28laA9gaOFDXsQp29J3X615HY1IPHJWd6FUFvCHjO+p1k652b5JJvZlShNpGlGSXAiQe/mEAj6tEBAA
0.0.PRE: Performing Proof Simplification...
0.0.N: clocks: 1, declared: 1, looping: 0, posedge: 1, negedge: 0, noedge: 0, bothedge: 0
Tricustom8: Custom engine code is hT3Nu7hPt1752DvFRa0kNDiyIV97VyejwM9C/jCLJjdPvusZONHY42VYUy0Q1ZotnhcVtNc56tJ5wbxv6V2+XpdsaSlHck5vfnbYjdwj1OECy9U+7oSQ0SZE3g5ayD+Phuh4odCJTjeKa2k4elM9ldQfkAEA
Gcustom9: Custom engine code is hT3NibhPDfeYQADBZnYcglOvK9Pfd7EOeniIqP8jNsyIqInncipMGcUXqAadachREE9F2PwhBUZUNw5kHnd4JdXkamORRgEA
C2custom10: Custom engine code is hT3NirhPjfWYQADBZnYcglOvK9Pfd7EOeniIqP8jNsyIqInncgkrYMMXCYbdK0dUjZIF9d4cJ0rHoBDjwVLBKuG86XYVV00BAA
0.0.N: Proof Simplification Iteration 1	[0.00 s]
AGcustom11: Custom engine code is hT3NirhP/fmYQADBZnYcglOvK9Pfd7EOeniIqP8jNsyIqInnckcwYMMXCYbdK0dUjZIF9d4cJ0rHoBDjwVLBKuHEZnZByh0BAA
Bcustom12: Custom engine code is hT3NjrhPDfiYQADBZnYcglOvK9PfWxFtenjIyBqfrgr7if/jL/yPOuK1BAflEcW0DxNH2eDIoezN2gxlQFg81RZtiWXh7aiTAidvAQA
Ncustom13: Custom engine code is hT3NR7hPByFp3TrFSTLhUmMH4KWtJglTyV/c51BHEeZWamnJv767nE6PCak26bd3gf3XGN3rIRheufhDieCJQVISo+gNYUKhiUedBKGtsP/a18svAnlMJZudHxDFwK5ufsyoxsIyiAeSY2oi3tEuoDHr5gw42DFKAG3PqO3CEsl8Azzdt3pl5nGA1Ifv2H02eYsFzWb/nfp8PMb3F0krE/EgBcm8TD9Div8BAA
0.0.PRE: A trace with 1 cycles was found. [0.00 s]
Tricustom14: Custom engine code is hT3Nu7hP3fiYQADBZnYcglNHp9bfd7EOeniIqP/ji8sGLQu8yhsFO+wxJ+O+R0bU8g/IewXFomyos+viQnWc2xYNYmMqpo3i40O7DaZR7qfp4YqNx26KRvQ/qx0BAA
INFO (IPF047): 0.0.PRE: The cover property "i2cStrech.p1:precondition1" was covered in 1 cycles in 0.00 s.
0.0.N: Proof Simplification Iteration 2	[0.04 s]
0.0.N: Proof Simplification Iteration 3	[0.04 s]
0.0.PRE: A proof was found: No trace exists. [0.00 s]
INFO (IPF057): 0.0.PRE: The property ":noDeadEnd" was proven in 0.00 s.
    Use check_assumptions -show -dead_end to show this property in the property table.
0.0.PRE: A proof was found: No trace exists. [0.00 s]
INFO (IPF057): 0.0.PRE: The property ":noConflict" was proven in 0.00 s.
    Use check_assumptions -show to show this property in the property table.
INFO (IPF047): 0.0.PRE: The cover property ":live" was covered in 1 cycles in 0.00 s.
    Use check_assumptions -show -live to show this property in the property table.
0.0.PRE: Proof Simplification completed in 0.04 s
0: About to start ProofGrid in its own thread with a limit of 10000 pending notifications and a limit of 10 traces.
0: =============================== ProofGrid start ===============================
0: ProofGrid usable level: 1
0: Initial ProofGrid level: 1
0: ProofGrid is starting event handling
0.0.Hp: Proofgrid shell started at 81416@vlsi-moon(local) jg_81347_vlsi-moon_1
0.0.Hp: clocks: 1, declared: 1, looping: 0, posedge: 1, negedge: 0, noedge: 0, bothedge: 0
0.0.Hp: Last scan. Per property time limit: 0s
0.0.N: Proofgrid shell started at 81415@vlsi-moon(local) jg_81347_vlsi-moon_1
0.0.Hp: Trace Attempt  1	[0.00 s]
0.0.N: clocks: 1, declared: 1, looping: 0, posedge: 1, negedge: 0, noedge: 0, bothedge: 0
0.0.N: Last scan. Per property time limit: 0s
0.0.N: Starting proof for property "i2cStrech.p1"	[0.00 s].
0.0.Hp: Trace Attempt  2	[0.01 s]
0.0.N: Trace Attempt  1	[0.00 s]
0.0.N: Trace Attempt  2	[0.00 s]
0.0.Hp: Trace Attempt  3	[0.01 s]
0.0.N: Trace Attempt  2	[0.00 s]
0.0.Hp: Trace Attempt  4	[0.01 s]
0.0.N: Trace Attempt  3	[0.01 s]
0.0.N: Trace Attempt  3	[0.01 s]
0.0.Hp: Trace Attempt  5	[0.01 s]
0.0.N: Trace Attempt  4	[0.01 s]
0.0.N: Trace Attempt  5	[0.01 s]
0.0.N: Trace Attempt  1	[0.03 s]
0.0.N: Trace Attempt  2	[0.03 s]
0.0.N: Trace Attempt  3	[0.03 s]
0.0.N: Trace Attempt  4	[0.03 s]
0.0.N: Trace Attempt  5	[0.03 s]
0.0.Ht: Proofgrid shell started at 81447@vlsi-moon(local) jg_81347_vlsi-moon_1
0.0.Ht: clocks: 1, declared: 1, looping: 0, posedge: 1, negedge: 0, noedge: 0, bothedge: 0
0.0.Ht: Last scan. Per property time limit: 0s
0.0.L: Proofgrid shell started at 81451@vlsi-moon(local) jg_81347_vlsi-moon_1
0.0.Ht: Trace Attempt  1	[0.00 s]
0.0.Ht: Trace Attempt  2	[0.00 s]
0.0.Ht: Trace Attempt  3	[0.00 s]
0.0.Ht: Trace Attempt  4	[0.00 s]
0.0.L: clocks: 1, declared: 1, looping: 0, posedge: 1, negedge: 0, noedge: 0, bothedge: 0
0.0.Ht: Trace Attempt  5	[0.00 s]
0.0.L: Using trace diversification with seed 1 (0.05)
0.0.L: Using LRU state removal heuristic
0.0.L: Ignoring liveness properties
0.0.L: All properties either determined or skipped. [0.00 s]
0.0.L: Exited with Success (@ 0.07 s)
0.0.L: Completed, Restart ignored.
0.0.Mpcustom4: Proofgrid shell started at 81449@vlsi-moon(local) jg_81347_vlsi-moon_1
0.0.Mpcustom4: clocks: 1, declared: 1, looping: 0, posedge: 1, negedge: 0, noedge: 0, bothedge: 0
0.0.Mpcustom4: Ignoring liveness properties
0.0.Mpcustom4: All properties either determined or skipped. [0.00 s]
0.0.Mpcustom4: Exited with Success (@ 0.07 s)
0.0.Mpcustom4: Completed, Restart ignored.
0.0.AM: Proofgrid shell started at 81453@vlsi-moon(local) jg_81347_vlsi-moon_1
0.0.AM: clocks: 1, declared: 1, looping: 0, posedge: 1, negedge: 0, noedge: 0, bothedge: 0
0.0.AM: Last scan. Per property time limit: 0s
0.0.AM: Starting proof for property "i2cStrech.p1"	[0.00 s].
0.0.Oh: Proofgrid shell started at 81450@vlsi-moon(local) jg_81347_vlsi-moon_1
0.0.Bm: Proofgrid shell started at 81448@vlsi-moon(local) jg_81347_vlsi-moon_1
0.0.Oh: clocks: 1, declared: 1, looping: 0, posedge: 1, negedge: 0, noedge: 0, bothedge: 0
0.0.AM: Trace Attempt  1	[0.00 s]
0.0.Oh: Reached length limit (2147483647) [0.00 s]
0.0.AM: Trace Attempt  2	[0.00 s]
0.0.Bm: clocks: 1, declared: 1, looping: 0, posedge: 1, negedge: 0, noedge: 0, bothedge: 0
0.0.Bm: Ignoring liveness properties
0.0.Bm: Last scan. Per property time limit: 0s
0.0.AM: Trace Attempt  3	[0.00 s]
0.0.Bm: Trace Attempt  1	[0.00 s]
0.0.Oh: Exited with Success (@ 0.08 s)
0.0.Bm: Trace Attempt  2	[0.00 s]
0.0.Bm: Trace Attempt  3	[0.00 s]
0.0.Bm: Trace Attempt  4	[0.00 s]
0.0.AM: Trace Attempt  4	[0.00 s]
0.0.Bm: Trace Attempt  5	[0.00 s]
0.0.AM: Trace Attempt  5	[0.00 s]
0.0.B: Proofgrid shell started at 81452@vlsi-moon(local) jg_81347_vlsi-moon_1
0.0.AM: Trace Attempt  1	[0.01 s]
0.0.B: clocks: 1, declared: 1, looping: 0, posedge: 1, negedge: 0, noedge: 0, bothedge: 0
0.0.B: Last scan. Per property time limit: 0s
0.0.B: Starting proof for property "i2cStrech.p1"	[0.00 s].
0.0.B: Trace Attempt  1	[0.00 s]
0.0.B: Trace Attempt  2	[0.00 s]
0.0.B: Trace Attempt  3	[0.00 s]
0.0.B: Trace Attempt  4	[0.00 s]
0.0.B: Trace Attempt  5	[0.00 s]
0.0.AM: Trace Attempt  2	[0.01 s]
0.0.AM: Trace Attempt  3	[0.01 s]
0.0.AM: Trace Attempt  4	[0.01 s]
0.0.AM: Trace Attempt  5	[0.01 s]
0.0.AM: Trace Attempt  1	[0.02 s]
0.0.AM: Trace Attempt  2	[0.03 s]
0.0.AM: Trace Attempt  3	[0.03 s]
0.0.AM: Trace Attempt  4	[0.03 s]
0.0.AM: Trace Attempt  5	[0.03 s]
0.0.AM: Trace Attempt  1	[0.07 s]
0.0.AM: Trace Attempt  2	[0.07 s]
0.0.AM: Trace Attempt  3	[0.07 s]
0.0.AM: Trace Attempt  4	[0.07 s]
0.0.AM: Trace Attempt  5	[0.07 s]
0.0.N: Trace Attempt  1	[0.19 s]
0.0.N: Trace Attempt  2	[0.19 s]
0.0.N: Trace Attempt  3	[0.19 s]
0.0.N: Trace Attempt  4	[0.20 s]
0.0.N: Trace Attempt  5	[0.20 s]
0.0.AM: Trace Attempt  1	[0.21 s]
0.0.AM: Trace Attempt  2	[0.21 s]
0.0.AM: Trace Attempt  3	[0.21 s]
0.0.AM: Trace Attempt  4	[0.21 s]
0.0.AM: Trace Attempt  5	[0.21 s]
0.0.AM: Trace Attempt  1	[0.76 s]
0.0.AM: Trace Attempt  2	[0.76 s]
0.0.AM: Trace Attempt  3	[0.76 s]
0.0.AM: Trace Attempt  4	[0.76 s]
0.0.AM: Trace Attempt  5	[0.77 s]
0.0.N: Trace Attempt  1	[0.86 s]
0.0.N: Trace Attempt  2	[0.86 s]
0.0.N: Trace Attempt  3	[0.86 s]
0.0.N: Trace Attempt  4	[0.87 s]
0.0.N: Trace Attempt  5	[0.87 s]
0.0.AM: Trace Attempt  1	[2.92 s]
0.0.AM: Trace Attempt  2	[2.92 s]
0.0.AM: Trace Attempt  3	[2.92 s]
0.0.AM: Trace Attempt  4	[2.92 s]
0.0.AM: Trace Attempt  5	[2.93 s]
0.0.N: Trace Attempt  1	[3.24 s]
0.0.N: Trace Attempt  2	[3.24 s]
0.0.N: Trace Attempt  3	[3.24 s]
0.0.N: Trace Attempt  4	[3.24 s]
0.0.N: Trace Attempt  5	[3.24 s]
0.0.Hp: Trace Attempt 312	[4.01 s]
0.0.Ht: Trace Attempt 1887	[4.00 s]
0.0.Bm: Trace Attempt 1760	[4.00 s]
0.0.B: Trace Attempt 1734	[4.00 s]
0.0.N: Trace Attempt  1	[5.78 s]
0.0.N: Trace Attempt  2	[5.78 s]
0.0.N: Trace Attempt  3	[5.78 s]
0.0.N: Trace Attempt  4	[5.78 s]
0.0.N: Trace Attempt  5	[5.78 s]
0.0.AM: Trace Attempt 160	[7.01 s]
0.0.Hp: Trace Attempt 470	[8.02 s]
0.0.Ht: Trace Attempt 3102	[8.01 s]
0.0.Bm: Trace Attempt 2444	[8.01 s]
0.0.B: Trace Attempt 2416	[8.01 s]
0.0.N: Trace Attempt 143	[9.79 s]
0.0.AM: Trace Attempt 130	[11.05 s]
0.0.Hp: Trace Attempt 588	[12.04 s]
0.0.Ht: Trace Attempt 3427	[12.01 s]
0.0.Bm: Trace Attempt 2931	[12.01 s]
0.0.B: Trace Attempt 2932	[12.02 s]
0.0.AM: Trace Attempt  1	[12.52 s]
0.0.AM: Trace Attempt  2	[12.52 s]
0.0.AM: Trace Attempt  3	[12.52 s]
0.0.AM: Trace Attempt  4	[12.52 s]
0.0.AM: Trace Attempt  5	[12.52 s]
0.0.N: Trace Attempt 227	[13.83 s]
0.0.N: Trace Attempt  1	[15.26 s]
0.0.N: Trace Attempt  2	[15.26 s]
0.0.N: Trace Attempt  3	[15.26 s]
0.0.N: Trace Attempt  4	[15.27 s]
0.0.N: Trace Attempt  5	[15.27 s]
0.0.Ht: Trace Attempt 4002	[16.03 s]
0.0.Bm: Trace Attempt 3225	[16.02 s]
0.0.Hp: Trace Attempt 632	[16.10 s]
0.0.B: Trace Attempt 3214	[16.04 s]
0.0.AM: Trace Attempt 144	[16.55 s]
0.0.N: Trace Attempt 144	[19.28 s]
0.0.Bm: Trace Attempt 3423	[20.03 s]
0.0.Hp: Trace Attempt 764	[20.10 s]
0.0.B: Trace Attempt 3408	[20.04 s]
0.0.Ht: Trace Attempt 4026	[20.08 s]
0.0.AM: Trace Attempt 203	[20.56 s]
0.0.N: Trace Attempt 228	[23.34 s]
0.0.Bm: Trace Attempt 3604	[24.03 s]
0.0.Hp: Trace Attempt 900	[24.11 s]
0.0.B: Trace Attempt 3588	[24.06 s]
0.0.Ht: Trace Attempt 4052	[24.28 s]
0.0.AM: Trace Attempt 254	[24.57 s]
0.0.N: Trace Attempt  1	[24.68 s]
0.0.N: Trace Attempt  2	[24.68 s]
0.0.N: Trace Attempt  3	[24.68 s]
0.0.N: Trace Attempt  4	[24.68 s]
0.0.N: Trace Attempt  5	[24.68 s]
0.0.Bm: Trace Attempt 3762	[28.04 s]
0.0.Hp: Trace Attempt 1020	[28.13 s]
0.0.B: Trace Attempt 3761	[28.07 s]
0.0.Ht: Trace Attempt 4074	[28.39 s]
0.0.N: Trace Attempt 145	[28.71 s]
0.0.AM: Trace Attempt 279	[28.70 s]
0.0.Bm: Trace Attempt 3923	[32.05 s]
0.0.Hp: Trace Attempt 1126	[32.14 s]
0.0.B: Trace Attempt 3920	[32.08 s]
0.0.Ht: Trace Attempt 4101	[32.51 s]
0.0.N: Trace Attempt 228	[32.73 s]
0.0.AM: Trace Attempt 312	[32.74 s]
0.0.N: Trace Attempt  1	[34.04 s]
0.0.N: Trace Attempt  2	[34.04 s]
0.0.N: Trace Attempt  3	[34.04 s]
0.0.N: Trace Attempt  4	[34.04 s]
0.0.N: Trace Attempt  5	[34.04 s]
0.0.Hp: Trace Attempt 1219	[36.17 s]
0.0.Bm: Trace Attempt 4014	[36.13 s]
0.0.B: Trace Attempt 4013	[36.18 s]
0.0.Ht: Trace Attempt 4128	[36.56 s]
0.0.AM: Trace Attempt 346	[36.75 s]
0.0.N: Trace Attempt 145	[38.09 s]
0.0.Hp: Trace Attempt 1306	[40.17 s]
0.0.Bm: Trace Attempt 4033	[40.14 s]
0.0.B: Trace Attempt 4032	[40.29 s]
0.0.Ht: Trace Attempt 4155	[40.62 s]
0.0.AM: Trace Attempt 374	[40.80 s]
0.0.N: Trace Attempt 228	[42.18 s]
0.0.N: Trace Attempt  1	[43.45 s]
0.0.N: Trace Attempt  2	[43.45 s]
0.0.N: Trace Attempt  3	[43.45 s]
0.0.N: Trace Attempt  4	[43.46 s]
0.0.N: Trace Attempt  5	[43.46 s]
0.0.Hp: Trace Attempt 1388	[44.18 s]
0.0.Bm: Trace Attempt 4053	[44.29 s]
0.0.B: Trace Attempt 4050	[44.43 s]
0.0.Ht: Trace Attempt 4181	[44.66 s]
0.0.AM: Trace Attempt 400	[44.90 s]
0.0.N: Trace Attempt 146	[47.49 s]
0.0.Hp: Trace Attempt 1465	[48.21 s]
0.0.B: Trace Attempt 4066	[48.45 s]
0.0.Bm: Trace Attempt 4072	[48.50 s]
0.0.Ht: Trace Attempt 4208	[48.73 s]
0.0.AM: Trace Attempt 435	[48.92 s]
0.0.N: Trace Attempt 229	[51.50 s]
0.0.Hp: Trace Attempt 1538	[52.27 s]
0.0.B: Trace Attempt 4083	[52.49 s]
0.0.Bm: Trace Attempt 4091	[52.60 s]
0.0.N: Trace Attempt  1	[52.81 s]
0.0.N: Trace Attempt  2	[52.81 s]
0.0.N: Trace Attempt  3	[52.81 s]
0.0.N: Trace Attempt  4	[52.81 s]
0.0.N: Trace Attempt  5	[52.82 s]
0.0.Ht: Trace Attempt 4233	[52.80 s]
0.0.AM: Trace Attempt 469	[53.05 s]
0.0.Bm: Trace Attempt 4110	[56.75 s]
0.0.N: Trace Attempt 144	[56.84 s]
0.0.B: Trace Attempt 4098	[56.97 s]
0.0.AM: Trace Attempt 260	[57.20 s]
0.0.Ht: Trace Attempt 4259	[59.69 s]
0.0.N: Trace Attempt 227	[60.88 s]
0.0.Hp: Trace Attempt 1595	[61.01 s]
0.0.Bm: Trace Attempt 4128	[61.37 s]
0.0.B: Trace Attempt 4116	[61.40 s]
0.0.N: Trace Attempt  1	[62.29 s]
0.0.N: Trace Attempt  2	[62.29 s]
0.0.N: Trace Attempt  3	[62.29 s]
0.0.N: Trace Attempt  4	[62.29 s]
0.0.N: Trace Attempt  5	[62.29 s]
0.0.Ht: Trace Attempt 4297	[63.72 s]
0.0.AM: Trace Attempt 512	[64.95 s]
0.0.AM: Trace Attempt  1	[65.45 s]
0.0.AM: Trace Attempt  2	[65.45 s]
0.0.AM: Trace Attempt  3	[65.45 s]
0.0.AM: Trace Attempt  4	[65.46 s]
0.0.AM: Trace Attempt  5	[65.46 s]
0.0.Bm: Trace Attempt 4145	[65.50 s]
0.0.B: Trace Attempt 4129	[65.61 s]
0.0.N: Trace Attempt 144	[66.34 s]
0.0.Hp: Trace Attempt 1607	[67.56 s]
0.0.AM: Trace Attempt 132	[69.47 s]
0.0.Bm: Trace Attempt 4162	[69.54 s]
0.0.B: Trace Attempt 4144	[69.90 s]
0.0.N: Trace Attempt 228	[70.40 s]
0.0.Hp: Trace Attempt 1619	[71.56 s]
0.0.N: Trace Attempt  1	[71.67 s]
0.0.N: Trace Attempt  2	[71.67 s]
0.0.N: Trace Attempt  3	[71.67 s]
0.0.N: Trace Attempt  4	[71.68 s]
0.0.N: Trace Attempt  5	[71.68 s]
0.0.Ht: Trace Attempt 4321	[72.77 s]
0.0.AM: Trace Attempt 183	[73.48 s]
0.0.Bm: Trace Attempt 4182	[73.55 s]
0.0.B: Trace Attempt 4155	[74.15 s]
0.0.Hp: Trace Attempt 1699	[75.58 s]
0.0.N: Trace Attempt 145	[75.68 s]
0.0.Ht: Trace Attempt 4375	[76.77 s]
0.0.AM: Trace Attempt 232	[77.67 s]
0.0.Bm: Trace Attempt 4202	[77.70 s]
0.0.B: Trace Attempt 4168	[78.21 s]
0.0.Hp: Trace Attempt 1774	[79.60 s]
0.0.N: Trace Attempt 228	[79.70 s]
0.0.N: Trace Attempt  1	[81.08 s]
0.0.N: Trace Attempt  2	[81.08 s]
0.0.N: Trace Attempt  3	[81.08 s]
0.0.N: Trace Attempt  4	[81.08 s]
0.0.N: Trace Attempt  5	[81.08 s]
0.0.AM: Trace Attempt 255	[81.77 s]
0.0.Bm: Trace Attempt 4224	[81.91 s]
0.0.B: Trace Attempt 4188	[82.34 s]
0.0.Hp: Trace Attempt 1845	[83.64 s]
0.0.N: Trace Attempt 144	[85.11 s]
0.0.Ht: Trace Attempt 4385	[85.06 s]
0.0.AM: Trace Attempt 290	[85.87 s]
0.0.Bm: Trace Attempt 4244	[86.00 s]
0.0.B: Trace Attempt 4209	[86.60 s]
0.0.Hp: Trace Attempt 1913	[87.69 s]
0.0.Ht: Trace Attempt 4431	[89.12 s]
0.0.N: Trace Attempt 228	[89.20 s]
0.0.AM: Trace Attempt 326	[89.93 s]
0.0.Bm: Trace Attempt 4262	[90.04 s]
0.0.N: Trace Attempt  1	[90.78 s]
0.0.N: Trace Attempt  2	[90.78 s]
0.0.N: Trace Attempt  3	[90.78 s]
0.0.N: Trace Attempt  4	[90.78 s]
0.0.N: Trace Attempt  5	[90.78 s]
0.0.B: Trace Attempt 4228	[90.71 s]
0.0.Hp: Trace Attempt 1977	[91.70 s]
0.0.AM: Trace Attempt 354	[93.99 s]
0.0.Bm: Trace Attempt 4281	[94.24 s]
0.0.Ht: Trace Attempt 4449	[94.30 s]
0.0.N: Trace Attempt 143	[94.79 s]
0.0.B: Trace Attempt 4248	[95.08 s]
0.0.Hp: Trace Attempt 1991	[97.48 s]
0.0.AM: Trace Attempt 386	[98.03 s]
0.0.Ht: Trace Attempt 4496	[98.32 s]
0.0.Bm: Trace Attempt 4297	[98.41 s]
0.0.N: Trace Attempt 227	[98.82 s]
0.0.B: Trace Attempt 4265	[99.19 s]
0.0.N: Trace Attempt  1	[100.27 s]
0.0.N: Trace Attempt  2	[100.28 s]
0.0.N: Trace Attempt  3	[100.28 s]
0.0.N: Trace Attempt  4	[100.28 s]
0.0.N: Trace Attempt  5	[100.28 s]
0.0.AM: Trace Attempt 414	[102.07 s]
0.0.Ht: Trace Attempt 4543	[102.34 s]
0.0.Bm: Trace Attempt 4316	[102.42 s]
0.0.B: Trace Attempt 4284	[103.35 s]
0.0.Hp: Trace Attempt 2000	[103.83 s]
0.0.N: Trace Attempt 143	[104.30 s]
0.0.AM: Trace Attempt 443	[106.29 s]
0.0.Ht: Trace Attempt 4586	[106.40 s]
0.0.Bm: Trace Attempt 4332	[106.53 s]
0.0.B: Trace Attempt 4299	[107.48 s]
0.0.Hp: Trace Attempt 2017	[107.97 s]
0.0.N: Trace Attempt 227	[108.36 s]
0.0.N: Trace Attempt  1	[109.84 s]
0.0.N: Trace Attempt  2	[109.84 s]
0.0.N: Trace Attempt  3	[109.84 s]
0.0.N: Trace Attempt  4	[109.84 s]
0.0.N: Trace Attempt  5	[109.84 s]
0.0.AM: Trace Attempt 464	[110.45 s]
0.0.Bm: Trace Attempt 4349	[110.59 s]
0.0.B: Trace Attempt 4319	[111.61 s]
0.0.Hp: Trace Attempt 2034	[112.42 s]
0.0.Ht: Trace Attempt 4621	[112.78 s]
0.0.N: Trace Attempt 144	[113.87 s]
0.0.Bm: Trace Attempt 4365	[114.78 s]
0.0.AM: Trace Attempt 472	[114.91 s]
0.0.B: Trace Attempt 4336	[116.03 s]
0.0.Hp: Trace Attempt 2048	[116.78 s]
0.0.Ht: Trace Attempt 4634	[117.10 s]
0.0.N: Trace Attempt 228	[117.96 s]
0.0.AM: Trace Attempt 480	[118.96 s]
0.0.Bm: Trace Attempt 4382	[118.97 s]
0.0.N: Trace Attempt  1	[119.38 s]
0.0.N: Trace Attempt  2	[119.38 s]
0.0.N: Trace Attempt  3	[119.38 s]
0.0.N: Trace Attempt  4	[119.39 s]
0.0.N: Trace Attempt  5	[119.39 s]
0.0.B: Trace Attempt 4353	[120.33 s]
0.0.Hp: Trace Attempt 2069	[120.79 s]
0.0.Ht: Trace Attempt 4664	[121.19 s]
0.0.AM: Trace Attempt 488	[123.14 s]
0.0.Bm: Trace Attempt 4398	[123.17 s]
0.0.N: Trace Attempt 144	[123.41 s]
0.0.B: Trace Attempt 4369	[124.36 s]
0.0.Ht: Trace Attempt 4694	[125.23 s]
0.0.Hp: Trace Attempt 2082	[126.46 s]
0.0.Bm: Trace Attempt 4413	[127.28 s]
0.0.AM: Trace Attempt 500	[127.30 s]
0.0.N: Trace Attempt 228	[127.47 s]
0.0.B: Trace Attempt 4385	[128.56 s]
0.0.N: Trace Attempt  1	[129.04 s]
0.0.N: Trace Attempt  2	[129.04 s]
0.0.N: Trace Attempt  3	[129.04 s]
0.0.N: Trace Attempt  4	[129.05 s]
0.0.N: Trace Attempt  5	[129.05 s]
0.0.Ht: Trace Attempt 4722	[129.39 s]
0.0.Bm: Trace Attempt 4428	[131.48 s]
0.0.AM: Trace Attempt 513	[131.65 s]
0.0.B: Trace Attempt 4401	[132.64 s]
0.0.Hp: Trace Attempt 2097	[133.00 s]
0.0.N: Trace Attempt 144	[133.08 s]
0.0.Ht: Trace Attempt 4749	[133.46 s]
0.0.Bm: Trace Attempt 4446	[135.69 s]
0.0.AM: Trace Attempt 526	[136.13 s]
0.0.B: Trace Attempt 4417	[136.70 s]
0.0.N: Trace Attempt 228	[137.14 s]
0.0.Ht: Trace Attempt 4784	[137.50 s]
0.0.N: Trace Attempt  1	[138.54 s]
0.0.N: Trace Attempt  2	[138.54 s]
0.0.N: Trace Attempt  3	[138.54 s]
0.0.N: Trace Attempt  4	[138.54 s]
0.0.N: Trace Attempt  5	[138.55 s]
0.0.Hp: Trace Attempt 2102	[139.56 s]
0.0.Bm: Trace Attempt 4461	[139.72 s]
0.0.AM: Trace Attempt 539	[140.44 s]
0.0.B: Trace Attempt 4433	[141.05 s]
0.0.Ht: Trace Attempt 4822	[141.56 s]
0.0.N: Trace Attempt 144	[142.56 s]
0.0.Bm: Trace Attempt 4477	[143.75 s]
0.0.Hp: Trace Attempt 2118	[144.51 s]
0.0.AM: Trace Attempt 552	[144.51 s]
0.0.B: Trace Attempt 4449	[145.31 s]
0.0.Ht: Trace Attempt 4859	[145.59 s]
0.0.N: Trace Attempt 228	[146.64 s]
0.0.Bm: Trace Attempt 4492	[147.88 s]
0.0.N: Trace Attempt  1	[147.99 s]
0.0.N: Trace Attempt  2	[147.99 s]
0.0.N: Trace Attempt  3	[147.99 s]
0.0.N: Trace Attempt  4	[147.99 s]
0.0.N: Trace Attempt  5	[147.99 s]
0.0.AM: Trace Attempt 565	[148.88 s]
0.0.Hp: Trace Attempt 2137	[149.05 s]
0.0.B: Trace Attempt 4466	[149.47 s]
0.0.Ht: Trace Attempt 4895	[149.64 s]
0.0.Bm: Trace Attempt 4508	[151.90 s]
0.0.N: Trace Attempt 144	[152.03 s]
0.0.AM: Trace Attempt 577	[153.09 s]
0.0.B: Trace Attempt 4483	[153.59 s]
0.0.Ht: Trace Attempt 4930	[153.72 s]
0.0.Hp: Trace Attempt 2145	[155.47 s]
0.0.N: Trace Attempt 228	[156.06 s]
0.0.Bm: Trace Attempt 4521	[156.21 s]
0.0.N: Trace Attempt  1	[157.52 s]
0.0.N: Trace Attempt  2	[157.52 s]
0.0.N: Trace Attempt  3	[157.52 s]
0.0.N: Trace Attempt  4	[157.52 s]
0.0.N: Trace Attempt  5	[157.53 s]
0.0.AM: Trace Attempt 588	[157.56 s]
0.0.Ht: Trace Attempt 4963	[157.72 s]
0.0.B: Trace Attempt 4498	[157.76 s]
0.0.Hp: Trace Attempt 2157	[159.76 s]
0.0.Bm: Trace Attempt 4536	[160.34 s]
0.0.N: Trace Attempt 146	[161.56 s]
0.0.AM: Trace Attempt 599	[161.72 s]
0.0.Ht: Trace Attempt 5001	[161.81 s]
0.0.B: Trace Attempt 4514	[162.00 s]
0.0.Hp: Trace Attempt 2165	[164.25 s]
0.0.Bm: Trace Attempt 4552	[164.45 s]
0.0.Ht: Trace Attempt 5034	[165.97 s]
0.0.AM: Trace Attempt 610	[166.03 s]
0.0.N: Trace Attempt 230	[166.29 s]
0.0.B: Trace Attempt 4529	[166.35 s]
0.0.N: Trace Attempt  1	[167.36 s]
0.0.N: Trace Attempt  2	[167.36 s]
0.0.N: Trace Attempt  3	[167.36 s]
0.0.N: Trace Attempt  4	[167.37 s]
0.0.N: Trace Attempt  5	[167.37 s]
0.0.Bm: Trace Attempt 4567	[168.47 s]
0.0.Hp: Trace Attempt 2182	[169.18 s]
0.0.Ht: Trace Attempt 5069	[170.10 s]
0.0.AM: Trace Attempt 622	[170.20 s]
0.0.B: Trace Attempt 4545	[170.56 s]
0.0.N: Trace Attempt 157	[171.39 s]
0.0.Bm: Trace Attempt 4580	[172.60 s]
0.0.Hp: Trace Attempt 2198	[173.23 s]
0.0.Ht: Trace Attempt 5098	[174.14 s]
0.0.AM: Trace Attempt 633	[174.58 s]
0.0.B: Trace Attempt 4561	[174.69 s]
0.0.N: Trace Attempt 226	[175.41 s]
0.0.Bm: Trace Attempt 4594	[176.71 s]
0.0.Hp: Trace Attempt 2202	[177.90 s]
0.0.Ht: Trace Attempt 5129	[178.21 s]
0.0.AM: Trace Attempt 643	[178.80 s]
0.0.B: Trace Attempt 4577	[179.12 s]
0.0.N: Trace Attempt 253	[179.48 s]
0.0.Bm: Trace Attempt 4610	[180.78 s]
0.0.N: Trace Attempt 269	[180.94 s]
0.0.N: Stopped processing property "i2cStrech.p1"	[180.98 s].
0.0.N: Morphing to Ncustom1
0.0.N: All properties determined. [0.00 s]
0.0.N: Exited with Success (@ 0.00 s)
0.0.Ncustom1: clocks: 1, declared: 1, looping: 0, posedge: 1, negedge: 0, noedge: 0, bothedge: 0
0.0.Ncustom1: Starting proof for property "i2cStrech.p1"	[0.00 s].
0.0.Ncustom1: Trace Attempt 256	[0.03 s]
0.0.B: Trace Attempt 4584	[180.88 s]
0.0.B: Stopped processing property "i2cStrech.p1"	[180.95 s].
0.0.B: Morphing to Bcustom2
0.0.B: All properties determined. [0.00 s]
0.0.B: Exited with Success (@ 0.00 s)
0.0.Bcustom2: clocks: 1, declared: 1, looping: 0, posedge: 1, negedge: 0, noedge: 0, bothedge: 0
0.0.Bcustom2: Starting proof for property "i2cStrech.p1"	[0.00 s].
0.0.Bcustom2: Trace Attempt  1	[0.00 s]
0.0.Bcustom2: Trace Attempt  2	[0.00 s]
0.0.Bcustom2: Trace Attempt  1	[0.00 s]
0.0.Bcustom2: Trace Attempt  2	[0.00 s]
0.0.Bcustom2: Trace Attempt  3	[0.00 s]
0.0.Bcustom2: Trace Attempt  4	[0.00 s]
0.0.Bcustom2: Trace Attempt  5	[0.00 s]
0.0.Bcustom2: Trace Attempt  1	[0.00 s]
0.0.Bcustom2: Trace Attempt  2	[0.00 s]
0.0.Bcustom2: Trace Attempt  3	[0.00 s]
0.0.Bcustom2: Trace Attempt  4	[0.00 s]
0.0.Bcustom2: Trace Attempt  5	[0.00 s]
0.0.Bcustom2: Trace Attempt  1	[0.01 s]
0.0.Bcustom2: Trace Attempt  2	[0.01 s]
0.0.Bcustom2: Trace Attempt  3	[0.01 s]
0.0.Bcustom2: Trace Attempt  4	[0.01 s]
0.0.Bcustom2: Trace Attempt  5	[0.01 s]
0.0.Bcustom2: Trace Attempt  1	[0.01 s]
0.0.Bcustom2: Trace Attempt  2	[0.01 s]
0.0.Bcustom2: Trace Attempt  3	[0.01 s]
0.0.Bcustom2: Trace Attempt  4	[0.01 s]
0.0.Bcustom2: Trace Attempt  5	[0.01 s]
0.0.Bcustom2: Trace Attempt  1	[0.03 s]
0.0.Bcustom2: Trace Attempt  2	[0.03 s]
0.0.Bcustom2: Trace Attempt  3	[0.03 s]
0.0.Bcustom2: Trace Attempt  4	[0.03 s]
0.0.Bcustom2: Trace Attempt  5	[0.03 s]
0.0.D: Proofgrid shell started at 83171@vlsi-moon(local) jg_81347_vlsi-moon_1
0.0.Tri: Proofgrid shell started at 83170@vlsi-moon(local) jg_81347_vlsi-moon_1
0.0.D: clocks: 1, declared: 1, looping: 0, posedge: 1, negedge: 0, noedge: 0, bothedge: 0
0.0.D: Last scan. Per property time limit: 0s
0.0.D: Starting proof for property "i2cStrech.p1"	[0.00 s].
0.0.Tri: clocks: 1, declared: 1, looping: 0, posedge: 1, negedge: 0, noedge: 0, bothedge: 0
0.0.D: Trace Attempt  1	[0.00 s]
0.0.D: Trace Attempt  2	[0.00 s]
0.0.D: Trace Attempt  3	[0.00 s]
0.0.Tri: Last scan. Per property time limit: 0s
0.0.Tri: Starting proof for property "i2cStrech.p1"	[0.00 s].
0.0.Tri: Trace Attempt  1	[0.00 s]
0.0.AM: Trace Attempt 647	[180.57 s]
0.0.AM: Stopped processing property "i2cStrech.p1"	[181.02 s].
0.0.AM: Morphing to AMcustom3
0.0.Bcustom2: Trace Attempt  1	[0.07 s]
0.0.Bcustom2: Trace Attempt  2	[0.07 s]
0.0.Bcustom2: Trace Attempt  3	[0.07 s]
0.0.Bcustom2: Trace Attempt  4	[0.07 s]
0.0.Bcustom2: Trace Attempt  5	[0.07 s]
0.0.AM: All properties determined. [0.00 s]
0.0.AM: Exited with Success (@ 0.00 s)
0.0.AMcustom3: clocks: 1, declared: 1, looping: 0, posedge: 1, negedge: 0, noedge: 0, bothedge: 0
0.0.AMcustom3: Starting proof for property "i2cStrech.p1"	[0.00 s].
0.0.AMcustom3: Trace Attempt  1	[0.00 s]
0.0.AMcustom3: Trace Attempt  2	[0.00 s]
0.0.AMcustom3: Trace Attempt  3	[0.00 s]
0.0.AMcustom3: Trace Attempt  4	[0.01 s]
0.0.AMcustom3: Trace Attempt  5	[0.01 s]
0.0.AMcustom3: Trace Attempt  1	[0.01 s]
0.0.AMcustom3: Trace Attempt  2	[0.01 s]
0.0.AMcustom3: Trace Attempt  3	[0.01 s]
0.0.AMcustom3: Trace Attempt  4	[0.02 s]
0.0.AMcustom3: Trace Attempt  5	[0.02 s]
0.0.Tri:    0.00" ---- Launching main thread ----
0.0.AMcustom3: Trace Attempt  1	[0.03 s]
0.0.AMcustom3: Trace Attempt  2	[0.03 s]
0.0.AMcustom3: Trace Attempt  3	[0.03 s]
0.0.AMcustom3: Trace Attempt  4	[0.03 s]
0.0.AMcustom3: Trace Attempt  5	[0.03 s]
0.0.Tri:    0.03" ---- Launching abstraction thread ----
0.0.Tri:    0.04" ---- Launching multi-phase simplification thread ----
0.0.AMcustom3: Trace Attempt  1	[0.07 s]
0.0.AMcustom3: Trace Attempt  2	[0.07 s]
0.0.AMcustom3: Trace Attempt  3	[0.07 s]
0.0.AMcustom3: Trace Attempt  4	[0.07 s]
0.0.AMcustom3: Trace Attempt  5	[0.07 s]
0.0.Tri:    0.07" ---- Launching liveness simplification thread ----
0.0.Bcustom2: Trace Attempt  1	[0.29 s]
0.0.Bcustom2: Trace Attempt  2	[0.29 s]
0.0.Bcustom2: Trace Attempt  3	[0.29 s]
0.0.Bcustom2: Trace Attempt  4	[0.29 s]
0.0.Bcustom2: Trace Attempt  5	[0.29 s]
0.0.AMcustom3: Trace Attempt  1	[0.21 s]
0.0.AMcustom3: Trace Attempt  2	[0.21 s]
0.0.AMcustom3: Trace Attempt  3	[0.21 s]
0.0.AMcustom3: Trace Attempt  4	[0.21 s]
0.0.AMcustom3: Trace Attempt  5	[0.21 s]
0.0.Ncustom1: Trace Attempt  1	[0.60 s]
0.0.Ncustom1: Trace Attempt  2	[0.60 s]
0.0.Ncustom1: Trace Attempt  3	[0.60 s]
0.0.Ncustom1: Trace Attempt  4	[0.61 s]
0.0.Ncustom1: Trace Attempt  5	[0.61 s]
0.0.AMcustom3: Trace Attempt  1	[0.78 s]
0.0.AMcustom3: Trace Attempt  2	[0.78 s]
0.0.AMcustom3: Trace Attempt  3	[0.78 s]
0.0.AMcustom3: Trace Attempt  4	[0.79 s]
0.0.AMcustom3: Trace Attempt  5	[0.79 s]
0.0.Bcustom2: Trace Attempt  1	[0.92 s]
0.0.Bcustom2: Trace Attempt  2	[0.92 s]
0.0.Bcustom2: Trace Attempt  3	[0.92 s]
0.0.Bcustom2: Trace Attempt  4	[0.92 s]
0.0.Bcustom2: Trace Attempt  5	[0.92 s]
0.0.D: Trace Attempt 42	[0.62 s]
0.0.D: Stopped processing property "i2cStrech.p1"	[0.89 s].
0.0.D: Morphing to M
0.0.D: All properties determined. [0.00 s]
0.0.D: Exited with Success (@ 0.00 s)
0.0.M: clocks: 1, declared: 1, looping: 0, posedge: 1, negedge: 0, noedge: 0, bothedge: 0
0.0.M: Starting proof for property "i2cStrech.p1"	[0.00 s].
0.0.M: Trace Attempt  1	[0.00 s]
0.0.M: Trace Attempt  2	[0.00 s]
0.0.M: Trace Attempt  3	[0.00 s]
0.0.M: Trace Attempt  4	[0.01 s]
0.0.M: Trace Attempt  5	[0.01 s]
0.0.Tri:    0.90" Simplification phase 1 complete
0.0.AMcustom5: Proofgrid shell started at 83248@vlsi-moon(local) jg_81347_vlsi-moon_1
0.0.AMcustom5: clocks: 1, declared: 1, looping: 0, posedge: 1, negedge: 0, noedge: 0, bothedge: 0
0.0.AMcustom5: Last scan. Per property time limit: 0s
0.0.AMcustom5: Starting proof for property "i2cStrech.p1"	[0.00 s].
0.0.AMcustom5: Trace Attempt  1	[0.00 s]
0.0.AMcustom5: Trace Attempt  2	[0.00 s]
0.0.AMcustom5: Trace Attempt  1	[0.00 s]
0.0.AMcustom5: Trace Attempt  2	[0.00 s]
0.0.AMcustom5: Trace Attempt  3	[0.00 s]
0.0.AMcustom5: Trace Attempt  4	[0.00 s]
0.0.AMcustom5: Trace Attempt  5	[0.00 s]
0.0.AMcustom5: Trace Attempt  1	[0.01 s]
0.0.AMcustom5: Trace Attempt  2	[0.01 s]
0.0.AMcustom5: Trace Attempt  3	[0.01 s]
0.0.AMcustom5: Trace Attempt  4	[0.01 s]
0.0.AMcustom5: Trace Attempt  5	[0.01 s]
0.0.AMcustom5: Trace Attempt  1	[0.01 s]
0.0.AMcustom5: Trace Attempt  2	[0.01 s]
0.0.AMcustom5: Trace Attempt  3	[0.01 s]
0.0.AMcustom5: Trace Attempt  4	[0.01 s]
0.0.AMcustom5: Trace Attempt  5	[0.01 s]
0.0.AMcustom5: Trace Attempt  1	[0.02 s]
0.0.AMcustom5: Trace Attempt  2	[0.02 s]
0.0.AMcustom5: Trace Attempt  3	[0.02 s]
0.0.AMcustom5: Trace Attempt  4	[0.02 s]
0.0.AMcustom5: Trace Attempt  5	[0.02 s]
0.0.AMcustom5: Trace Attempt  1	[0.03 s]
0.0.AMcustom5: Trace Attempt  2	[0.03 s]
0.0.AMcustom5: Trace Attempt  3	[0.03 s]
0.0.AMcustom5: Trace Attempt  4	[0.03 s]
0.0.AMcustom5: Trace Attempt  5	[0.03 s]
0.0.AMcustom5: Trace Attempt  1	[0.03 s]
0.0.AMcustom5: Trace Attempt  2	[0.04 s]
0.0.AMcustom5: Trace Attempt  3	[0.04 s]
0.0.AMcustom5: Trace Attempt  4	[0.04 s]
0.0.AMcustom5: Trace Attempt  5	[0.04 s]
0.0.Hp: Trace Attempt 2218	[182.10 s]
0.0.Tri:    0.96" ---- Completed liveness simplification thread ----
0.0.AMcustom5: Trace Attempt  1	[0.08 s]
0.0.AMcustom5: Trace Attempt  2	[0.08 s]
0.0.AMcustom5: Trace Attempt  3	[0.08 s]
0.0.AMcustom5: Trace Attempt  4	[0.08 s]
0.0.AMcustom5: Trace Attempt  5	[0.08 s]
0.0.AMcustom5: Trace Attempt  1	[0.08 s]
0.0.AMcustom5: Trace Attempt  2	[0.08 s]
0.0.AMcustom5: Trace Attempt  3	[0.08 s]
0.0.AMcustom5: Trace Attempt  4	[0.08 s]
0.0.AMcustom5: Trace Attempt  5	[0.09 s]
0.0.AMcustom5: Trace Attempt  1	[0.09 s]
0.0.AMcustom5: Trace Attempt  2	[0.09 s]
0.0.AMcustom5: Trace Attempt  3	[0.09 s]
0.0.AMcustom5: Trace Attempt  4	[0.10 s]
0.0.AMcustom5: Trace Attempt  5	[0.10 s]
0.0.AMcustom5: Trace Attempt  1	[0.13 s]
0.0.AMcustom5: Trace Attempt  2	[0.13 s]
0.0.AMcustom5: Trace Attempt  3	[0.13 s]
0.0.AMcustom5: Trace Attempt  4	[0.14 s]
0.0.AMcustom5: Trace Attempt  5	[0.14 s]
0.0.Ht: Trace Attempt 5160	[182.21 s]
0.0.AMcustom5: Trace Attempt  1	[0.27 s]
0.0.AMcustom5: Trace Attempt  2	[0.27 s]
0.0.AMcustom5: Trace Attempt  3	[0.27 s]
0.0.AMcustom5: Trace Attempt  4	[0.27 s]
0.0.AMcustom5: Trace Attempt  5	[0.27 s]
0.0.AMcustom5: Trace Attempt  1	[0.27 s]
0.0.AMcustom5: Trace Attempt  2	[0.27 s]
0.0.AMcustom5: Trace Attempt  3	[0.27 s]
0.0.AMcustom5: Trace Attempt  4	[0.28 s]
0.0.AMcustom5: Trace Attempt  5	[0.28 s]
0.0.AMcustom5: Trace Attempt  1	[0.28 s]
0.0.AMcustom5: Trace Attempt  2	[0.28 s]
0.0.AMcustom5: Trace Attempt  3	[0.28 s]
0.0.AMcustom5: Trace Attempt  4	[0.29 s]
0.0.AMcustom5: Trace Attempt  5	[0.29 s]
0.0.Tri:    1.20" Simplification phase 2 complete
0.0.AMcustom5: Trace Attempt  1	[0.32 s]
0.0.AMcustom5: Trace Attempt  2	[0.32 s]
0.0.AMcustom5: Trace Attempt  3	[0.32 s]
0.0.AMcustom5: Trace Attempt  4	[0.32 s]
0.0.AMcustom5: Trace Attempt  5	[0.32 s]
0.0.AMcustom5: Trace Attempt  1	[0.43 s]
0.0.AMcustom5: Trace Attempt  2	[0.43 s]
0.0.AMcustom5: Trace Attempt  3	[0.43 s]
0.0.AMcustom5: Trace Attempt  4	[0.44 s]
0.0.AMcustom5: Trace Attempt  5	[0.44 s]
0.0.Tri:    1.46" Simplification phase 3 complete
   1.46" ---- Completed simplification thread ----
0.0.Tri:    1.46" ---- Restarting main thread on simplified netlist ----
0.0.Tri:    1.51" ---- Restarting abstraction thread on simplified netlist ----
0.0.AMcustom5: Trace Attempt  1	[0.97 s]
0.0.AMcustom5: Trace Attempt  2	[0.97 s]
0.0.AMcustom5: Trace Attempt  3	[0.97 s]
0.0.AMcustom5: Trace Attempt  4	[0.97 s]
0.0.AMcustom5: Trace Attempt  5	[0.97 s]
0.0.AMcustom5: Trace Attempt  1	[0.97 s]
0.0.AMcustom5: Trace Attempt  2	[0.97 s]
0.0.AMcustom5: Trace Attempt  3	[0.97 s]
0.0.AMcustom5: Trace Attempt  4	[0.97 s]
0.0.AMcustom5: Trace Attempt  5	[0.97 s]
0.0.AMcustom5: Trace Attempt  1	[0.98 s]
0.0.AMcustom5: Trace Attempt  2	[0.98 s]
0.0.AMcustom5: Trace Attempt  3	[0.98 s]
0.0.AMcustom5: Trace Attempt  4	[0.98 s]
0.0.AMcustom5: Trace Attempt  5	[0.98 s]
0.0.AMcustom5: Trace Attempt  1	[1.01 s]
0.0.AMcustom5: Trace Attempt  2	[1.02 s]
0.0.AMcustom5: Trace Attempt  3	[1.02 s]
0.0.AMcustom5: Trace Attempt  4	[1.02 s]
0.0.AMcustom5: Trace Attempt  5	[1.02 s]
0.0.AMcustom5: Trace Attempt  1	[1.13 s]
0.0.AMcustom5: Trace Attempt  2	[1.13 s]
0.0.AMcustom5: Trace Attempt  3	[1.13 s]
0.0.AMcustom5: Trace Attempt  4	[1.14 s]
0.0.AMcustom5: Trace Attempt  5	[1.14 s]
0.0.Bcustom2: Trace Attempt  1	[2.44 s]
0.0.Bcustom2: Trace Attempt  2	[2.44 s]
0.0.Bcustom2: Trace Attempt  3	[2.44 s]
0.0.Bcustom2: Trace Attempt  4	[2.44 s]
0.0.Bcustom2: Trace Attempt  5	[2.44 s]
0.0.AMcustom5: Trace Attempt  1	[1.69 s]
0.0.AMcustom5: Trace Attempt  2	[1.70 s]
0.0.AMcustom5: Trace Attempt  3	[1.70 s]
0.0.AMcustom5: Trace Attempt  4	[1.70 s]
0.0.AMcustom5: Trace Attempt  5	[1.70 s]
0.0.Bcustom2: Trace Attempt 712	[2.95 s]
0.0.Bcustom2: Stopped processing property "i2cStrech.p1"	[2.96 s].
0.0.Bcustom2: Morphing to D
0.0.Bcustom2: All properties determined. [0.00 s]
0.0.Bcustom2: Exited with Success (@ 0.00 s)
0.0.D: clocks: 1, declared: 1, looping: 0, posedge: 1, negedge: 0, noedge: 0, bothedge: 0
0.0.D: Starting proof for property "i2cStrech.p1"	[0.00 s].
0.0.D: Trace Attempt  1	[0.00 s]
0.0.D: Trace Attempt  2	[0.00 s]
0.0.D: Trace Attempt  3	[0.00 s]
0.0.Tri: Stopped processing property "i2cStrech.p1"	[2.97 s].
0.0.Tri: Morphing to ADcustom7
0.0.Tri: All properties determined. [0.00 s]
0.0.Tri: Exited with Success (@ 0.00 s)
0.0.ADcustom7: clocks: 1, declared: 1, looping: 0, posedge: 1, negedge: 0, noedge: 0, bothedge: 0
0.0.ADcustom7: Starting proof for property "i2cStrech.p1"	[0.00 s].
0.0.ADcustom7: Trace Attempt  1	[0.00 s]
0.0.ADcustom7: Trace Attempt  2	[0.00 s]
0.0.AMcustom3: Trace Attempt  1	[2.95 s]
0.0.ADcustom7: Trace Attempt  1	[0.01 s]
0.0.AMcustom3: Trace Attempt  2	[2.96 s]
0.0.ADcustom7: Trace Attempt  2	[0.01 s]
0.0.AMcustom3: Trace Attempt  3	[2.96 s]
0.0.ADcustom7: Trace Attempt  3	[0.01 s]
0.0.ADcustom7: Trace Attempt  4	[0.01 s]
0.0.AMcustom3: Trace Attempt  4	[2.96 s]
0.0.AMcustom3: Trace Attempt  5	[2.96 s]
0.0.ADcustom7: Trace Attempt  5	[0.01 s]
0.0.ADcustom7: Trace Attempt  1	[0.01 s]
0.0.ADcustom7: Trace Attempt  2	[0.01 s]
0.0.ADcustom7: Trace Attempt  3	[0.02 s]
0.0.ADcustom7: Trace Attempt  4	[0.02 s]
0.0.ADcustom7: Trace Attempt  5	[0.02 s]
0.0.ADcustom7: Trace Attempt  1	[0.02 s]
0.0.ADcustom7: Trace Attempt  2	[0.02 s]
0.0.ADcustom7: Trace Attempt  3	[0.02 s]
0.0.ADcustom7: Trace Attempt  1	[0.03 s]
0.0.ADcustom7: Trace Attempt  2	[0.03 s]
0.0.ADcustom7: Trace Attempt  3	[0.03 s]
0.0.ADcustom7: Trace Attempt  4	[0.03 s]
0.0.ADcustom7: Trace Attempt  5	[0.03 s]
0.0.ADcustom7: Trace Attempt  1	[0.04 s]
0.0.ADcustom7: Trace Attempt  2	[0.04 s]
0.0.ADcustom7: Trace Attempt  3	[0.04 s]
0.0.ADcustom7: Trace Attempt  1	[0.04 s]
0.0.ADcustom7: Trace Attempt  2	[0.04 s]
0.0.ADcustom7: Trace Attempt  3	[0.05 s]
0.0.ADcustom7: Trace Attempt  1	[0.10 s]
0.0.ADcustom7: Trace Attempt  2	[0.10 s]
0.0.ADcustom7: Trace Attempt  3	[0.10 s]
0.0.ADcustom7: Trace Attempt  4	[0.10 s]
0.0.ADcustom7: Trace Attempt  5	[0.10 s]
0.0.ADcustom7: Trace Attempt  1	[0.10 s]
0.0.ADcustom7: Trace Attempt  2	[0.10 s]
0.0.ADcustom7: Trace Attempt  3	[0.10 s]
0.0.ADcustom7: Trace Attempt  1	[0.11 s]
0.0.ADcustom7: Trace Attempt  2	[0.11 s]
0.0.ADcustom7: Trace Attempt  3	[0.11 s]
0.0.ADcustom7: Trace Attempt  1	[0.16 s]
0.0.ADcustom7: Trace Attempt  2	[0.16 s]
0.0.ADcustom7: Trace Attempt  3	[0.16 s]
0.0.ADcustom7: Trace Attempt  1	[0.45 s]
0.0.ADcustom7: Trace Attempt  2	[0.45 s]
0.0.ADcustom7: Trace Attempt  3	[0.45 s]
0.0.ADcustom7: Trace Attempt  4	[0.45 s]
0.0.ADcustom7: Trace Attempt  5	[0.45 s]
0.0.ADcustom7: Trace Attempt  1	[0.46 s]
0.0.ADcustom7: Trace Attempt  2	[0.46 s]
0.0.ADcustom7: Trace Attempt  3	[0.46 s]
0.0.ADcustom7: Trace Attempt  1	[0.47 s]
0.0.ADcustom7: Trace Attempt  2	[0.47 s]
0.0.ADcustom7: Trace Attempt  3	[0.47 s]
0.0.ADcustom7: Trace Attempt  1	[0.52 s]
0.0.ADcustom7: Trace Attempt  2	[0.52 s]
0.0.ADcustom7: Trace Attempt  3	[0.52 s]
0.0.ADcustom7: Trace Attempt  1	[0.77 s]
0.0.ADcustom7: Trace Attempt  2	[0.77 s]
0.0.ADcustom7: Trace Attempt  3	[0.77 s]
0.0.Bm: Trace Attempt 4626	[184.86 s]
0.0.Ncustom1: Trace Attempt 153	[4.62 s]
0.0.ADcustom7: Trace Attempt  1	[1.84 s]
0.0.ADcustom7: Trace Attempt  2	[1.84 s]
0.0.ADcustom7: Trace Attempt  3	[1.84 s]
0.0.ADcustom7: Trace Attempt  4	[1.84 s]
0.0.ADcustom7: Trace Attempt  5	[1.84 s]
0.0.ADcustom7: Trace Attempt  1	[1.84 s]
0.0.ADcustom7: Trace Attempt  2	[1.84 s]
0.0.ADcustom7: Trace Attempt  3	[1.84 s]
0.0.ADcustom7: Trace Attempt  1	[1.85 s]
0.0.ADcustom7: Trace Attempt  2	[1.85 s]
0.0.ADcustom7: Trace Attempt  3	[1.85 s]
0.0.ADcustom7: Trace Attempt  1	[1.91 s]
0.0.ADcustom7: Trace Attempt  2	[1.91 s]
0.0.ADcustom7: Trace Attempt  3	[1.91 s]
0.0.AMcustom5: Trace Attempt  1	[3.98 s]
0.0.AMcustom5: Trace Attempt  2	[3.98 s]
0.0.M: Trace Attempt 137	[4.06 s]
0.0.AMcustom5: Trace Attempt  3	[3.98 s]
0.0.AMcustom5: Trace Attempt  4	[3.98 s]
0.0.AMcustom5: Trace Attempt  5	[3.98 s]
0.0.AMcustom5: Trace Attempt  1	[3.98 s]
0.0.AMcustom5: Trace Attempt  2	[3.98 s]
0.0.AMcustom5: Trace Attempt  3	[3.98 s]
0.0.AMcustom5: Trace Attempt  4	[3.98 s]
0.0.AMcustom5: Trace Attempt  5	[3.98 s]
0.0.AMcustom5: Trace Attempt  1	[3.99 s]
0.0.AMcustom5: Trace Attempt  2	[3.99 s]
0.0.AMcustom5: Trace Attempt  3	[3.99 s]
0.0.AMcustom5: Trace Attempt  4	[3.99 s]
0.0.AMcustom5: Trace Attempt  5	[4.00 s]
0.0.AMcustom5: Trace Attempt  1	[4.02 s]
0.0.AMcustom5: Trace Attempt  2	[4.03 s]
0.0.AMcustom5: Trace Attempt  3	[4.03 s]
0.0.AMcustom5: Trace Attempt  4	[4.03 s]
0.0.AMcustom5: Trace Attempt  5	[4.03 s]
0.0.AMcustom5: Trace Attempt  1	[4.13 s]
0.0.AMcustom5: Trace Attempt  2	[4.13 s]
0.0.AMcustom5: Trace Attempt  3	[4.13 s]
0.0.AMcustom5: Trace Attempt  4	[4.14 s]
0.0.AMcustom5: Trace Attempt  5	[4.14 s]
0.0.ADcustom7: Trace Attempt  1	[2.15 s]
0.0.ADcustom7: Trace Attempt  2	[2.15 s]
0.0.ADcustom7: Trace Attempt  3	[2.15 s]
0.0.Ht: Trace Attempt 5193	[186.28 s]
0.0.Hp: Trace Attempt 2231	[186.52 s]
0.0.AMcustom5: Trace Attempt  1	[4.66 s]
0.0.AMcustom5: Trace Attempt  2	[4.66 s]
0.0.AMcustom5: Trace Attempt  3	[4.66 s]
0.0.AMcustom5: Trace Attempt  4	[4.66 s]
0.0.AMcustom5: Trace Attempt  5	[4.66 s]
0.0.ADcustom7: Trace Attempt  1	[3.17 s]
0.0.ADcustom7: Trace Attempt  2	[3.17 s]
0.0.ADcustom7: Trace Attempt  3	[3.17 s]
0.0.AMcustom3: Trace Attempt 159	[6.99 s]
0.0.AMcustom5: Trace Attempt 117	[6.47 s]
0.0.AMcustom5: Stopped processing property "i2cStrech.p1"	[6.48 s].
0.0.AMcustom5: Morphing to Tricustom8
0.0.AMcustom5: All properties determined. [0.00 s]
0.0.AMcustom5: Exited with Success (@ 0.00 s)
0.0.AMcustom3: Trace Attempt 165	[7.38 s]
0.0.AMcustom3: Stopped processing property "i2cStrech.p1"	[7.41 s].
0.0.AMcustom3: Morphing to Tri
0.0.Tricustom8: clocks: 1, declared: 1, looping: 0, posedge: 1, negedge: 0, noedge: 0, bothedge: 0
0.0.AMcustom3: All properties determined. [0.00 s]
0.0.AMcustom3: Exited with Success (@ 0.00 s)
0.0.Tri: clocks: 1, declared: 1, looping: 0, posedge: 1, negedge: 0, noedge: 0, bothedge: 0
0.0.Tri: Starting proof for property "i2cStrech.p1"	[0.00 s].
0.0.Tri: Trace Attempt  1	[0.00 s]
0.0.Ncustom1: Trace Attempt 208	[7.48 s]
0.0.Ncustom1: Stopped processing property "i2cStrech.p1"	[7.55 s].
0.0.Ncustom1: Morphing to Bcustom2
0.0.Tricustom8: Starting proof for property "i2cStrech.p1"	[0.00 s].
0.0.Tricustom8: Trace Attempt  1	[0.00 s]
0.0.Ncustom1: All properties determined. [0.00 s]
0.0.Ncustom1: Exited with Success (@ 0.00 s)
0.0.Bcustom2: clocks: 1, declared: 1, looping: 0, posedge: 1, negedge: 0, noedge: 0, bothedge: 0
0.0.Bcustom2: Starting proof for property "i2cStrech.p1"	[0.00 s].
0.0.Bcustom2: Trace Attempt  1	[0.00 s]
0.0.Bcustom2: Trace Attempt  2	[0.00 s]
0.0.Bcustom2: Trace Attempt  1	[0.00 s]
0.0.Bcustom2: Trace Attempt  2	[0.00 s]
0.0.Bcustom2: Trace Attempt  3	[0.00 s]
0.0.Bcustom2: Trace Attempt  4	[0.00 s]
0.0.Bcustom2: Trace Attempt  5	[0.00 s]
0.0.Bcustom2: Trace Attempt  1	[0.00 s]
0.0.Bcustom2: Trace Attempt  2	[0.00 s]
0.0.Bcustom2: Trace Attempt  3	[0.00 s]
0.0.Bcustom2: Trace Attempt  4	[0.00 s]
0.0.Bcustom2: Trace Attempt  5	[0.00 s]
0.0.Bcustom2: Trace Attempt  1	[0.01 s]
0.0.Bcustom2: Trace Attempt  2	[0.01 s]
0.0.Bcustom2: Trace Attempt  3	[0.01 s]
0.0.Bcustom2: Trace Attempt  4	[0.01 s]
0.0.Bcustom2: Trace Attempt  5	[0.01 s]
0.0.Bcustom2: Trace Attempt  1	[0.01 s]
0.0.Bcustom2: Trace Attempt  2	[0.01 s]
0.0.Bcustom2: Trace Attempt  3	[0.01 s]
0.0.Bcustom2: Trace Attempt  4	[0.01 s]
0.0.Bcustom2: Trace Attempt  5	[0.01 s]
0.0.Bcustom2: Trace Attempt  1	[0.03 s]
0.0.Bcustom2: Trace Attempt  2	[0.03 s]
0.0.Bcustom2: Trace Attempt  3	[0.03 s]
0.0.Bcustom2: Trace Attempt  4	[0.03 s]
0.0.Bcustom2: Trace Attempt  5	[0.03 s]
0.0.Tri:    0.00" ---- Launching main thread ----
0.0.Bcustom2: Trace Attempt  1	[0.07 s]
0.0.Bcustom2: Trace Attempt  2	[0.07 s]
0.0.Bcustom2: Trace Attempt  3	[0.07 s]
0.0.Bcustom2: Trace Attempt  4	[0.07 s]
0.0.Bcustom2: Trace Attempt  5	[0.07 s]
0.0.Tri:    0.04" ---- Launching abstraction thread ----
0.0.Tri:    0.04" ---- Launching multi-phase simplification thread ----
0.0.Tri:    0.05" ---- Launching liveness simplification thread ----
0.0.Bcustom2: Trace Attempt  1	[0.29 s]
0.0.Bcustom2: Trace Attempt  2	[0.29 s]
0.0.Bcustom2: Trace Attempt  3	[0.29 s]
0.0.Bcustom2: Trace Attempt  4	[0.29 s]
0.0.Bcustom2: Trace Attempt  5	[0.29 s]
0.0.Bm: Trace Attempt 4640	[188.88 s]
0.0.Tri:    0.87" Simplification phase 1 complete
0.0.Bcustom2: Trace Attempt  1	[0.91 s]
0.0.Bcustom2: Trace Attempt  2	[0.91 s]
0.0.Bcustom2: Trace Attempt  3	[0.91 s]
0.0.Bcustom2: Trace Attempt  4	[0.91 s]
0.0.Bcustom2: Trace Attempt  5	[0.91 s]
0.0.Tri:    0.94" ---- Completed liveness simplification thread ----
0.0.Tri:    1.19" Simplification phase 2 complete
0.0.M: Trace Attempt 227	[8.06 s]
0.0.Tri:    1.45" Simplification phase 3 complete
0.0.Tri:    1.45" ---- Completed simplification thread ----
0.0.Tri:    1.46" ---- Restarting main thread on simplified netlist ----
0.0.Tri:    1.50" ---- Restarting abstraction thread on simplified netlist ----
0.0.Ht: Trace Attempt 5222	[190.31 s]
0.0.D: Trace Attempt 127	[6.64 s]
0.0.Bcustom2: Trace Attempt  1	[2.42 s]
0.0.Bcustom2: Trace Attempt  2	[2.42 s]
0.0.Bcustom2: Trace Attempt  3	[2.42 s]
0.0.Bcustom2: Trace Attempt  4	[2.42 s]
0.0.Bcustom2: Trace Attempt  5	[2.42 s]
0.0.Hp: Trace Attempt 2236	[191.29 s]
0.0.ADcustom7: Trace Attempt 127	[8.77 s]
0.0.Bm: Trace Attempt 4654	[193.03 s]
0.0.ADcustom7: Trace Attempt  1	[9.31 s]
0.0.ADcustom7: Trace Attempt  2	[9.31 s]
0.0.ADcustom7: Trace Attempt  3	[9.31 s]
0.0.ADcustom7: Trace Attempt  4	[9.31 s]
0.0.ADcustom7: Trace Attempt  5	[9.31 s]
0.0.ADcustom7: Trace Attempt  1	[9.31 s]
0.0.ADcustom7: Trace Attempt  2	[9.31 s]
0.0.ADcustom7: Trace Attempt  3	[9.31 s]
0.0.ADcustom7: Trace Attempt  1	[9.32 s]
0.0.ADcustom7: Trace Attempt  2	[9.32 s]
0.0.ADcustom7: Trace Attempt  3	[9.33 s]
0.0.ADcustom7: Trace Attempt  1	[9.37 s]
0.0.ADcustom7: Trace Attempt  2	[9.37 s]
0.0.ADcustom7: Trace Attempt  3	[9.37 s]
0.0.ADcustom7: Trace Attempt  1	[9.60 s]
0.0.ADcustom7: Trace Attempt  2	[9.60 s]
0.0.ADcustom7: Trace Attempt  3	[9.61 s]
0.0.M: Trace Attempt 272	[12.11 s]
0.0.Ht: Trace Attempt 5250	[194.41 s]
0.0.ADcustom7: Trace Attempt  1	[10.78 s]
0.0.ADcustom7: Trace Attempt  2	[10.78 s]
0.0.ADcustom7: Trace Attempt  3	[10.79 s]
0.0.Bcustom2: Trace Attempt  1	[6.40 s]
0.0.Bcustom2: Trace Attempt  2	[6.40 s]
0.0.Bcustom2: Trace Attempt  3	[6.40 s]
0.0.Bcustom2: Trace Attempt  4	[6.40 s]
0.0.Bcustom2: Trace Attempt  5	[6.40 s]
0.0.D: Trace Attempt 129	[6.94 s]
0.0.D: Stopped processing property "i2cStrech.p1"	[12.17 s].
0.0.D: Morphing to AMcustom3
0.0.D: All properties determined. [0.00 s]
0.0.D: Exited with Success (@ 0.00 s)
0.0.AMcustom3: clocks: 1, declared: 1, looping: 0, posedge: 1, negedge: 0, noedge: 0, bothedge: 0
0.0.AMcustom3: Starting proof for property "i2cStrech.p1"	[0.00 s].
0.0.AMcustom3: Trace Attempt  1	[0.00 s]
0.0.AMcustom3: Trace Attempt  2	[0.00 s]
0.0.AMcustom3: Trace Attempt  3	[0.00 s]
0.0.AMcustom3: Trace Attempt  4	[0.00 s]
0.0.AMcustom3: Trace Attempt  5	[0.00 s]
0.0.AMcustom3: Trace Attempt  1	[0.00 s]
0.0.AMcustom3: Trace Attempt  2	[0.01 s]
0.0.AMcustom3: Trace Attempt  3	[0.01 s]
0.0.AMcustom3: Trace Attempt  4	[0.01 s]
0.0.AMcustom3: Trace Attempt  5	[0.01 s]
0.0.AMcustom3: Trace Attempt  1	[0.01 s]
0.0.Tricustom8: Stopped processing property "i2cStrech.p1"	[7.64 s].
0.0.AMcustom3: Trace Attempt  2	[0.02 s]
0.0.AMcustom3: Trace Attempt  3	[0.02 s]
0.0.Tricustom8: Morphing to I
0.0.Tricustom8: All properties determined. [0.00 s]
0.0.Tricustom8: Exited with Success (@ 0.00 s)
0.0.AMcustom3: Trace Attempt  4	[0.02 s]
0.0.I: clocks: 1, declared: 1, looping: 0, posedge: 1, negedge: 0, noedge: 0, bothedge: 0
0.0.AMcustom3: Trace Attempt  5	[0.02 s]
0.0.I: Starting proof for property "i2cStrech.p1"	[0.00 s].
0.0.M: Trace Attempt 304	[14.18 s]
0.0.M: Stopped processing property "i2cStrech.p1"	[14.23 s].
0.0.M: Morphing to AMcustom5
0.0.M: All properties determined. [0.00 s]
0.0.M: Exited with Success (@ 0.00 s)
0.0.AMcustom5: clocks: 1, declared: 1, looping: 0, posedge: 1, negedge: 0, noedge: 0, bothedge: 0
0.0.AMcustom5: Starting proof for property "i2cStrech.p1"	[0.00 s].
0.0.AMcustom5: Trace Attempt  1	[0.00 s]
0.0.AMcustom5: Trace Attempt  2	[0.00 s]
0.0.AMcustom5: Trace Attempt  1	[0.00 s]
0.0.AMcustom5: Trace Attempt  2	[0.00 s]
0.0.AMcustom5: Trace Attempt  3	[0.00 s]
0.0.AMcustom5: Trace Attempt  4	[0.00 s]
0.0.AMcustom5: Trace Attempt  5	[0.00 s]
0.0.AMcustom5: Trace Attempt  1	[0.01 s]
0.0.AMcustom5: Trace Attempt  2	[0.01 s]
0.0.AMcustom5: Trace Attempt  3	[0.01 s]
0.0.AMcustom5: Trace Attempt  4	[0.01 s]
0.0.AMcustom5: Trace Attempt  5	[0.01 s]
0.0.AMcustom5: Trace Attempt  1	[0.01 s]
0.0.AMcustom5: Trace Attempt  2	[0.01 s]
0.0.AMcustom5: Trace Attempt  3	[0.01 s]
0.0.AMcustom5: Trace Attempt  4	[0.01 s]
0.0.AMcustom5: Trace Attempt  5	[0.01 s]
0.0.AMcustom5: Trace Attempt  1	[0.02 s]
0.0.AMcustom5: Trace Attempt  2	[0.02 s]
0.0.AMcustom3: Trace Attempt  1	[0.05 s]
0.0.AMcustom5: Trace Attempt  3	[0.02 s]
0.0.AMcustom5: Trace Attempt  4	[0.02 s]
0.0.AMcustom5: Trace Attempt  5	[0.02 s]
0.0.AMcustom5: Trace Attempt  1	[0.02 s]
0.0.AMcustom3: Trace Attempt  2	[0.06 s]
0.0.AMcustom3: Trace Attempt  3	[0.06 s]
0.0.AMcustom5: Trace Attempt  2	[0.02 s]
0.0.AMcustom5: Trace Attempt  3	[0.02 s]
0.0.AMcustom5: Trace Attempt  4	[0.03 s]
0.0.AMcustom3: Trace Attempt  4	[0.06 s]
0.0.AMcustom5: Trace Attempt  5	[0.03 s]
0.0.AMcustom3: Trace Attempt  5	[0.06 s]
0.0.AMcustom5: Trace Attempt  1	[0.03 s]
0.0.AMcustom5: Trace Attempt  2	[0.03 s]
0.0.AMcustom5: Trace Attempt  3	[0.03 s]
0.0.AMcustom5: Trace Attempt  4	[0.03 s]
0.0.AMcustom5: Trace Attempt  5	[0.03 s]
0.0.I: Trace Attempt 247	[0.05 s]
0.0.AMcustom5: Trace Attempt  1	[0.07 s]
0.0.AMcustom5: Trace Attempt  2	[0.07 s]
0.0.AMcustom5: Trace Attempt  3	[0.07 s]
0.0.AMcustom5: Trace Attempt  4	[0.07 s]
0.0.AMcustom5: Trace Attempt  5	[0.07 s]
0.0.AMcustom5: Trace Attempt  1	[0.07 s]
0.0.AMcustom5: Trace Attempt  2	[0.07 s]
0.0.AMcustom5: Trace Attempt  3	[0.07 s]
0.0.AMcustom5: Trace Attempt  4	[0.07 s]
0.0.AMcustom5: Trace Attempt  5	[0.07 s]
0.0.AMcustom5: Trace Attempt  1	[0.08 s]
0.0.AMcustom5: Trace Attempt  2	[0.08 s]
0.0.AMcustom5: Trace Attempt  3	[0.08 s]
0.0.AMcustom5: Trace Attempt  4	[0.08 s]
0.0.AMcustom5: Trace Attempt  5	[0.08 s]
0.0.AMcustom5: Trace Attempt  1	[0.11 s]
0.0.AMcustom5: Trace Attempt  2	[0.11 s]
0.0.AMcustom5: Trace Attempt  3	[0.12 s]
0.0.Tri: Stopped processing property "i2cStrech.p1"	[7.77 s].
0.0.AMcustom5: Trace Attempt  4	[0.12 s]
0.0.AMcustom5: Trace Attempt  5	[0.12 s]
0.0.Tri: Morphing to Ncustom1
0.0.Tri: All properties determined. [0.00 s]
0.0.Tri: Exited with Success (@ 0.00 s)
0.0.Ncustom1: clocks: 1, declared: 1, looping: 0, posedge: 1, negedge: 0, noedge: 0, bothedge: 0
0.0.Ncustom1: Starting proof for property "i2cStrech.p1"	[0.00 s].
0.0.AMcustom3: Trace Attempt  1	[0.20 s]
0.0.AMcustom3: Trace Attempt  2	[0.20 s]
0.0.AMcustom3: Trace Attempt  3	[0.20 s]
0.0.AMcustom3: Trace Attempt  4	[0.20 s]
0.0.AMcustom3: Trace Attempt  5	[0.20 s]
0.0.Ncustom1: Trace Attempt 256	[0.05 s]
0.0.AMcustom5: Trace Attempt  1	[0.25 s]
0.0.AMcustom5: Trace Attempt  2	[0.25 s]
0.0.AMcustom5: Trace Attempt  3	[0.25 s]
0.0.AMcustom5: Trace Attempt  4	[0.25 s]
0.0.AMcustom5: Trace Attempt  5	[0.25 s]
0.0.AMcustom5: Trace Attempt  1	[0.25 s]
0.0.AMcustom5: Trace Attempt  2	[0.25 s]
0.0.AMcustom5: Trace Attempt  3	[0.25 s]
0.0.AMcustom5: Trace Attempt  4	[0.25 s]
0.0.AMcustom5: Trace Attempt  5	[0.25 s]
0.0.AMcustom5: Trace Attempt  1	[0.26 s]
0.0.AMcustom5: Trace Attempt  2	[0.26 s]
0.0.AMcustom5: Trace Attempt  3	[0.26 s]
0.0.AMcustom5: Trace Attempt  4	[0.26 s]
0.0.AMcustom5: Trace Attempt  5	[0.26 s]
0.0.AMcustom5: Trace Attempt  1	[0.29 s]
0.0.AMcustom5: Trace Attempt  2	[0.29 s]
0.0.AMcustom5: Trace Attempt  3	[0.29 s]
0.0.AMcustom5: Trace Attempt  4	[0.29 s]
0.0.AMcustom5: Trace Attempt  5	[0.29 s]
0.0.AMcustom5: Trace Attempt  1	[0.40 s]
0.0.AMcustom5: Trace Attempt  2	[0.40 s]
0.0.AMcustom5: Trace Attempt  3	[0.40 s]
0.0.AMcustom5: Trace Attempt  4	[0.40 s]
0.0.AMcustom5: Trace Attempt  5	[0.40 s]
0.0.AMcustom3: Trace Attempt  1	[0.74 s]
0.0.AMcustom3: Trace Attempt  2	[0.74 s]
0.0.AMcustom3: Trace Attempt  3	[0.74 s]
0.0.AMcustom3: Trace Attempt  4	[0.75 s]
0.0.AMcustom3: Trace Attempt  5	[0.75 s]
0.0.Hp: Trace Attempt 2242	[196.95 s]
0.0.Ncustom1: Trace Attempt  1	[0.67 s]
0.0.Ncustom1: Trace Attempt  2	[0.67 s]
0.0.Ncustom1: Trace Attempt  3	[0.67 s]
0.0.Ncustom1: Trace Attempt  4	[0.68 s]
0.0.Ncustom1: Trace Attempt  5	[0.68 s]
0.0.AMcustom5: Trace Attempt  1	[0.89 s]
0.0.AMcustom5: Trace Attempt  2	[0.89 s]
0.0.AMcustom5: Trace Attempt  3	[0.89 s]
0.0.AMcustom5: Trace Attempt  4	[0.89 s]
0.0.AMcustom5: Trace Attempt  5	[0.89 s]
0.0.AMcustom5: Trace Attempt  1	[0.89 s]
0.0.AMcustom5: Trace Attempt  2	[0.89 s]
0.0.AMcustom5: Trace Attempt  3	[0.89 s]
0.0.AMcustom5: Trace Attempt  4	[0.89 s]
0.0.AMcustom5: Trace Attempt  5	[0.89 s]
0.0.AMcustom5: Trace Attempt  1	[0.90 s]
0.0.AMcustom5: Trace Attempt  2	[0.90 s]
0.0.AMcustom5: Trace Attempt  3	[0.90 s]
0.0.AMcustom5: Trace Attempt  4	[0.90 s]
0.0.AMcustom5: Trace Attempt  5	[0.90 s]
0.0.AMcustom5: Trace Attempt  1	[0.94 s]
0.0.AMcustom5: Trace Attempt  2	[0.94 s]
0.0.AMcustom5: Trace Attempt  3	[0.94 s]
0.0.AMcustom5: Trace Attempt  4	[0.94 s]
0.0.AMcustom5: Trace Attempt  5	[0.94 s]
0.0.Bm: Trace Attempt 4669	[197.14 s]
0.0.AMcustom5: Trace Attempt  1	[1.05 s]
0.0.AMcustom5: Trace Attempt  2	[1.05 s]
0.0.AMcustom5: Trace Attempt  3	[1.05 s]
0.0.AMcustom5: Trace Attempt  4	[1.05 s]
0.0.AMcustom5: Trace Attempt  5	[1.05 s]
0.0.AMcustom5: Trace Attempt  1	[1.57 s]
0.0.AMcustom5: Trace Attempt  2	[1.57 s]
0.0.AMcustom5: Trace Attempt  3	[1.57 s]
0.0.AMcustom5: Trace Attempt  4	[1.57 s]
0.0.AMcustom5: Trace Attempt  5	[1.57 s]
0.0.Ht: Trace Attempt 5279	[198.53 s]
0.0.Bcustom2: Trace Attempt 1608	[10.40 s]
0.0.AMcustom3: Trace Attempt  1	[2.79 s]
0.0.AMcustom3: Trace Attempt  2	[2.79 s]
0.0.AMcustom3: Trace Attempt  3	[2.79 s]
0.0.AMcustom3: Trace Attempt  4	[2.80 s]
0.0.AMcustom3: Trace Attempt  5	[2.80 s]
0.0.AMcustom5: Trace Attempt  1	[3.77 s]
0.0.AMcustom5: Trace Attempt  2	[3.77 s]
0.0.AMcustom5: Trace Attempt  3	[3.77 s]
0.0.AMcustom5: Trace Attempt  4	[3.77 s]
0.0.AMcustom5: Trace Attempt  5	[3.77 s]
0.0.AMcustom5: Trace Attempt  1	[3.77 s]
0.0.AMcustom5: Trace Attempt  2	[3.78 s]
0.0.AMcustom5: Trace Attempt  3	[3.78 s]
0.0.AMcustom5: Trace Attempt  4	[3.78 s]
0.0.AMcustom5: Trace Attempt  5	[3.78 s]
0.0.AMcustom5: Trace Attempt  1	[3.78 s]
0.0.AMcustom5: Trace Attempt  2	[3.79 s]
0.0.AMcustom5: Trace Attempt  3	[3.79 s]
0.0.AMcustom5: Trace Attempt  4	[3.79 s]
0.0.AMcustom5: Trace Attempt  5	[3.79 s]
0.0.AMcustom5: Trace Attempt  1	[3.82 s]
0.0.AMcustom5: Trace Attempt  2	[3.82 s]
0.0.AMcustom5: Trace Attempt  3	[3.82 s]
0.0.AMcustom5: Trace Attempt  4	[3.82 s]
0.0.AMcustom5: Trace Attempt  5	[3.82 s]
0.0.AMcustom5: Trace Attempt  1	[3.93 s]
0.0.AMcustom5: Trace Attempt  2	[3.93 s]
0.0.AMcustom5: Trace Attempt  3	[3.93 s]
0.0.AMcustom5: Trace Attempt  4	[3.93 s]
0.0.AMcustom5: Trace Attempt  5	[3.93 s]
0.0.I: Trace Attempt 254	[4.08 s]
0.0.ADcustom7: Trace Attempt 127	[16.48 s]
0.0.AMcustom5: Trace Attempt  1	[4.46 s]
0.0.AMcustom5: Trace Attempt  2	[4.46 s]
0.0.AMcustom5: Trace Attempt  3	[4.46 s]
0.0.AMcustom5: Trace Attempt  4	[4.46 s]
0.0.AMcustom5: Trace Attempt  5	[4.46 s]
0.0.ADcustom7: Trace Attempt  1	[16.83 s]
0.0.ADcustom7: Trace Attempt  2	[16.83 s]
0.0.ADcustom7: Trace Attempt  3	[16.83 s]
0.0.Ncustom1: Trace Attempt 144	[4.69 s]
0.0.Bm: Trace Attempt 4682	[201.37 s]
0.0.I: Trace Attempt  1	[5.48 s]
0.0.I: Trace Attempt  2	[5.48 s]
0.0.I: Trace Attempt  3	[5.49 s]
0.0.Hp: Trace Attempt 2252	[202.09 s]
0.0.Ht: Trace Attempt 5304	[202.61 s]
0.0.AMcustom5: Trace Attempt  1	[6.67 s]
0.0.AMcustom5: Trace Attempt  2	[6.68 s]
0.0.AMcustom5: Trace Attempt  3	[6.68 s]
0.0.AMcustom5: Trace Attempt  4	[6.68 s]
0.0.AMcustom5: Trace Attempt  5	[6.68 s]
0.0.AMcustom3: Trace Attempt 163	[6.82 s]
0.0.Bcustom2: Trace Attempt 2048	[15.99 s]
0.0.Ncustom1: Trace Attempt 221	[8.71 s]
0.0.Bm: Trace Attempt 4695	[205.50 s]
0.0.Hp: Trace Attempt 2258	[206.29 s]
0.0.I: Trace Attempt 111	[10.18 s]
0.0.Ht: Trace Attempt 5336	[206.74 s]
0.0.AMcustom5: Trace Attempt 173	[10.70 s]
0.0.AMcustom3: Trace Attempt 148	[10.82 s]
0.0.ADcustom7: Trace Attempt 127	[22.93 s]
0.0.AMcustom3: Trace Attempt  1	[12.03 s]
0.0.AMcustom3: Trace Attempt  2	[12.03 s]
0.0.AMcustom3: Trace Attempt  3	[12.03 s]
0.0.AMcustom3: Trace Attempt  4	[12.03 s]
0.0.AMcustom3: Trace Attempt  5	[12.03 s]
0.0.Ncustom1: Trace Attempt 242	[12.85 s]
0.0.Bm: Trace Attempt 4706	[209.54 s]
0.0.Bcustom2: Trace Attempt  1	[21.41 s]
0.0.Bcustom2: Trace Attempt  2	[21.42 s]
0.0.Bcustom2: Trace Attempt  3	[21.42 s]
0.0.Bcustom2: Trace Attempt  4	[21.42 s]
0.0.Bcustom2: Trace Attempt  5	[21.42 s]
0.0.AMcustom5: Trace Attempt 223	[14.70 s]
0.0.Ht: Trace Attempt 5365	[210.87 s]
0.0.Hp: Trace Attempt 2278	[211.65 s]
0.0.AMcustom3: Trace Attempt 145	[16.07 s]
0.0.I: Trace Attempt 129	[13.01 s]
0.0.I: Stopped processing property "i2cStrech.p1"	[16.15 s].
0.0.I: Morphing to Tricustom8
0.0.I: All properties determined. [0.00 s]
0.0.I: Exited with Success (@ 0.00 s)
0.0.Tricustom8: clocks: 1, declared: 1, looping: 0, posedge: 1, negedge: 0, noedge: 0, bothedge: 0
0.0.AMcustom3: Trace Attempt 146	[16.15 s]
0.0.AMcustom3: Stopped processing property "i2cStrech.p1"	[16.18 s].
0.0.AMcustom3: Morphing to D
0.0.AMcustom3: All properties determined. [0.00 s]
0.0.AMcustom3: Exited with Success (@ 0.00 s)
0.0.D: clocks: 1, declared: 1, looping: 0, posedge: 1, negedge: 0, noedge: 0, bothedge: 0
0.0.D: Starting proof for property "i2cStrech.p1"	[0.00 s].
0.0.Tricustom8: Starting proof for property "i2cStrech.p1"	[0.00 s].
0.0.Tricustom8: Trace Attempt  1	[0.00 s]
0.0.Bcustom2: Trace Attempt 1192	[23.79 s]
0.0.Bcustom2: Stopped processing property "i2cStrech.p1"	[23.82 s].
0.0.Bcustom2: Morphing to Tri
0.0.Bcustom2: All properties determined. [0.00 s]
0.0.Bcustom2: Exited with Success (@ 0.00 s)
0.0.D: Trace Attempt 129	[0.01 s]
0.0.Tri: clocks: 1, declared: 1, looping: 0, posedge: 1, negedge: 0, noedge: 0, bothedge: 0
0.0.Tri: Starting proof for property "i2cStrech.p1"	[0.00 s].
0.0.Tri: Trace Attempt  1	[0.00 s]
0.0.Tri:    0.00" ---- Launching main thread ----
0.0.Tri:    0.05" ---- Launching abstraction thread ----
0.0.Tri:    0.05" ---- Launching multi-phase simplification thread ----
0.0.Tri:    0.07" ---- Launching liveness simplification thread ----
0.0.AMcustom5: Trace Attempt 257	[15.23 s]
0.0.AMcustom5: Stopped processing property "i2cStrech.p1"	[16.67 s].
0.0.AMcustom5: Morphing to M
0.0.AMcustom5: All properties determined. [0.00 s]
0.0.AMcustom5: Exited with Success (@ 0.00 s)
0.0.M: clocks: 1, declared: 1, looping: 0, posedge: 1, negedge: 0, noedge: 0, bothedge: 0
0.0.M: Starting proof for property "i2cStrech.p1"	[0.00 s].
0.0.M: Trace Attempt  1	[0.00 s]
0.0.M: Trace Attempt  2	[0.00 s]
0.0.M: Trace Attempt  3	[0.00 s]
0.0.M: Trace Attempt  4	[0.01 s]
0.0.M: Trace Attempt  5	[0.01 s]
0.0.Ncustom1: Trace Attempt 279	[16.86 s]
0.0.Tri:    0.91" Simplification phase 1 complete
0.0.Tri:    0.97" ---- Completed liveness simplification thread ----
0.0.Tri:    1.21" Simplification phase 2 complete
0.0.Bm: Trace Attempt 4721	[213.66 s]
0.0.Tri:    1.45" Simplification phase 3 complete
   1.45" ---- Completed simplification thread ----
0.0.Tri:    1.45" ---- Restarting main thread on simplified netlist ----
0.0.Tri:    1.50" ---- Restarting abstraction thread on simplified netlist ----
0.0.Hp: Trace Attempt 2292	[215.93 s]
0.0.Ht: Trace Attempt 5370	[216.37 s]
0.0.ADcustom7: Trace Attempt 181	[32.80 s]
0.0.M: Trace Attempt 125	[4.03 s]
0.0.Ncustom1: Trace Attempt 313	[20.92 s]
0.0.Bm: Trace Attempt 4736	[218.17 s]
0.0.Hp: Trace Attempt 2302	[220.16 s]
0.0.Ht: Trace Attempt 5414	[220.49 s]
0.0.M: Trace Attempt 174	[8.06 s]
0.0.Ncustom1: Trace Attempt 339	[25.02 s]
0.0.Bm: Trace Attempt 4751	[222.32 s]
0.0.Hp: Trace Attempt 2316	[224.19 s]
0.0.Ht: Trace Attempt 5440	[224.51 s]
0.0.M: Trace Attempt 228	[12.09 s]
0.0.Ncustom1: Trace Attempt 364	[29.13 s]
0.0.Bm: Trace Attempt 4764	[226.38 s]
0.0.Ht: Trace Attempt 5461	[228.59 s]
0.0.Ncustom1: Requesting engine job to terminate
0.0.Tri: Requesting engine job to terminate
0.0.D: Requesting engine job to terminate
0.0.M: Requesting engine job to terminate
0.0.ADcustom7: Requesting engine job to terminate
0.0.Tricustom8: Requesting engine job to terminate
0.0.Hp: Requesting engine job to terminate
0.0.Ht: Requesting engine job to terminate
0.0.Bm: Requesting engine job to terminate
INFO (IPF144): 0: Initiating shutdown of proof [228.78 s]
0.0.Tri: A proof was found: No trace exists. [16.41 s]
INFO (IPF057): 0.0.Tri: The property "i2cStrech.p1" was proven in 16.41 s.
0.0.ADcustom7: Stopped processing property "i2cStrech.p1"	[44.72 s].
0.0.ADcustom7: All properties determined. [44.72 s]
0.0.ADcustom7: Exited with Success (@ 228.79 s)
0: ProofGrid usable level: 0
0.0.M: Trace Attempt 253	[15.91 s]
0.0.M: Stopped processing property "i2cStrech.p1"	[15.94 s].
0.0.M: All properties determined. [15.94 s]
0.0.M: Exited with Success (@ 228.82 s)
0.0.Tricustom8: Stopped processing property "i2cStrech.p1"	[16.48 s].
0.0.Tricustom8: All properties determined. [16.49 s]
0.0.Ht: Trace Attempt 5462	[228.69 s]
0.0.Ht: All properties determined. [228.78 s]
0.0.Ncustom1: Trace Attempt 387	[32.32 s]
0.0.Ncustom1: Stopped processing property "i2cStrech.p1"	[32.54 s].
0.0.Ncustom1: All properties determined. [32.53 s]
0.0.Ncustom1: Exited with Success (@ 228.86 s)
0.0.Tricustom8: Exited with Success (@ 228.86 s)
0.0.D: Stopped processing property "i2cStrech.p1"	[16.53 s].
0.0.D: All properties determined. [16.53 s]
0.0.D: Exited with Success (@ 228.89 s)
0.0.Bm: Trace Attempt 4769	[228.69 s]
0.0.Bm: All properties determined. [228.81 s]
0.0.Bm: Exited with Success (@ 228.91 s)
0.0.Ht: Exited with Success (@ 228.93 s)
0.0.Tri: Stopped processing property "i2cStrech.p1"	[16.61 s].
0.0.Tri: All properties determined. [16.61 s]
0.0.Tri: Exited with Success (@ 229.00 s)
0.0.Hp: Trace Attempt 2322	[225.75 s]
0.0.Hp: All properties determined. [229.26 s]
0.0.Hp: Exited with Success (@ 229.48 s)
0: --------------------------------------------------------------
ProofGrid Summary (utilization 99.94 %)
--------------------------------------------------------------
     engines started                               :    19
     engine jobs started                           :    12

    Average time in state (seconds)
    ------------------------------------------------------
    Engine  Pending     Running        Dead    Utilization
    ------------------------------------------------------
     Hp        0.07      228.78        0.00       99.97 %
     Ht        0.06      228.72        0.00       99.97 %
     Bm        0.07      228.71        0.00       99.97 %
    Mpcustom4        0.07        0.00        0.00        0.60 %
     Oh        0.07        0.00        0.00        0.58 %
      L        0.06        0.00        0.00        0.92 %
    Ncustom1        0.07      228.38        0.00       99.97 %
    Tri        0.08      228.69        0.00       99.96 %
      D        0.07      228.60        0.00       99.97 %
      M        0.09       47.14        0.00       99.82 %
    ADcustom7        0.09       47.62        0.00       99.81 %
    Tricustom8        0.09       46.70        0.00       99.81 %
    all        0.08      126.11        0.00       99.94 %

    Total time in state (seconds)
    -----------------------------------------
            Pending     Running        Dead  
    -----------------------------------------
               0.91     1513.35        0.00

    Data read    : 7.28 MiB
    Data written : 8.40 kiB

0: All pending notifications were processed.
INFO (IPF059): 0: Completed proof on task: "<embedded>"

==============================================================
SUMMARY
==============================================================
           Properties Considered              : 2
                 assertions                   : 1
                  - proven                    : 1 (100%)
                  - bounded_proven (user)     : 0 (0%)
                  - bounded_proven (auto)     : 0 (0%)
                  - marked_proven             : 0 (0%)
                  - cex                       : 0 (0%)
                  - ar_cex                    : 0 (0%)
                  - undetermined              : 0 (0%)
                  - unknown                   : 0 (0%)
                  - error                     : 0 (0%)
                 covers                       : 1
                  - unreachable               : 0 (0%)
                  - bounded_unreachable (user): 0 (0%)
                  - covered                   : 1 (100%)
                  - ar_covered                : 0 (0%)
                  - undetermined              : 0 (0%)
                  - unknown                   : 0 (0%)
                  - error                     : 0 (0%)
determined
[<embedded>] % exit -force
INFO (IPL005): Received request to exit from the console.
INFO (IPL014): Waiting for the Tcl-thread to exit.
INFO: Waiting for proof threads to stop...
INFO: Proof threads stopped.
INFO (IPL018): The peak resident set memory use for this session was 1.959 GB.
INFO (IPL015): The Tcl-thread exited with status 0.
INFO (IPL016): Exiting the analysis session with status 0.
