# ----------------------------------------
# Jasper Version Info
# tool      : Jasper 2024.06
# platform  : Linux 3.10.0-1160.62.1.el7.x86_64
# version   : 2024.06p002 64 bits
# build date: 2024.09.02 16:28:38 UTC
# ----------------------------------------
# started   : 2025-11-17 19:29:49 IST
# hostname  : vlsi-ria85.vlsidomain
# pid       : 757
# arguments : '-label' 'session_0' '-console' '//127.0.0.1:34580' '-nowindow' '-style' 'windows' '-exitonerror' '-data' 'AAAAynicY2RgYLCp////PwMYMD6A0Aw2jAyoAMRnQhUJbEChGRhYYZphSliAmItBl6GAoYghnyELyNNi0ANCfSA7HS6aypDMUMJQDBRNYshhyGTIY8hmiGcwBarmAepNYkgEyiYzZAD5Ymgq9MAyOWC7AAsuFt8=' '-proj' '/users/rompel/jasper_executions/safety/jgprojects/blink_5/sessionLogs/session_0' '-init' '-hidden' '/users/rompel/jasper_executions/safety/jgprojects/blink_5/.tmp/.initCmds.tcl' 'blink_5.tcl' '-hidden' '/users/rompel/jasper_executions/safety/jgprojects/blink_5/.tmp/.postCmds.tcl'

Any disclosure about the Cadence Design Systems software or its use
model to any third party violates the written Non-Disclosure Agreement
between Cadence Design Systems, Inc. and the customer.

THIS SOFTWARE CONTAINS CONFIDENTIAL INFORMATION AND TRADE SECRETS OF
CADENCE DESIGN SYSTEMS, INC. USE, DISCLOSURE, OR REPRODUCTION IS
PROHIBITED WITHOUT THE PRIOR EXPRESS WRITTEN PERMISSION OF CADENCE
DESIGN SYSTEMS, INC.

Copyright (C) 2000-2024 Cadence Design Systems, Inc. All Rights
Reserved.  Unpublished -- rights reserved under the copyright laws of
the United States.

This product includes software developed by others and redistributed
according to license agreement. See doc/third_party_readme.txt for
further details.

RESTRICTED RIGHTS LEGEND

Use, duplication, or disclosure by the Government is subject to
restrictions as set forth in subparagraph (c) (1) (ii) of the Rights in
Technical Data and Computer Software clause at DFARS 252.227-7013 or
subparagraphs (c) (1) and (2) of Commercial Computer Software -- Restricted
Rights at 48 CFR 52.227-19, as applicable.


                          Cadence Design Systems, Inc.
                          2655 Seely Avenue
                          San Jose, CA 95134
                          Phone: 408.943.1234

For technical assistance visit http://support.cadence.com.

Jasper Apps Analysis Session - /users/rompel/jasper_executions/safety/jgprojects/blink_5/sessionLogs/session_0

WARNING (WG017): [session]: The system's locale is "ANSI_X3.4-1968", which is not UTF-8. Non-ASCII characters might not be handled correctly.
WARNING (WG017): [jg_console]: The system's locale is "ANSI_X3.4-1968", which is not UTF-8. Non-ASCII characters might not be handled correctly.
INFO: successfully checked out license "jasper_fao".
INFO: reading configuration file "/users/rompel/.config/cadence/jasper.conf".
% analyze -sv09 ../blink_5.sv
[-- (VERI-1482)] Analyzing Verilog file '/tools/cadence2425/JASPER/jasper_2024.06p002/lib/verilog/packages/std/std.sv' into library 'std'
[-- (VERI-1482)] Analyzing Verilog file '../blink_5.sv'
% elaborate -bbox_mul 1000000 -bbox_div 1000000 -bbox_mod 1000000 -bbox_a 1000000
[INFO (HIER-8002)] ../blink_5.sv(18): Disabling old hierarchical reference handler
[INFO (VERI-1018)] ../blink_5.sv(1): compiling module 'BLINK'
[WARN (VERI-1209)] ../blink_5.sv(10): expression size 32 truncated to fit in target size 12
INFO (ISW003): Top module name is "BLINK".
INFO (INL208): Elaboration synthesis summary:
  Number of synthesized netlists          1 (0 packages)
  Single run mode                         On
  Pipeline                                On (1 pipelined netlists)
  Late hierarchical reference connection  On
  Number of analyzed Verilog modules      1 (1 synthesized)
  Number of analyzed VHDL entities        0 (0 synthesized)
INFO (INL003): Clearing all state information (assumes, stopats, and so forth).
BLINK
[<embedded>] % reset rst
INFO (IPM031): Clearing proof results of all properties.
INFO (IRS006): Current reset condition is "rst".
[<embedded>] % clock clk
[<embedded>] % prove -all
Ncustom1: Custom engine code is hT3Ng7hPPfiYQOTDZ3qhYOwGAM51eA+J/FjkM5shLioAsqhgLR4Ft+O1BuKG6ilQ83B9tLXSl+CwjiTMAQA
Bcustom2: Custom engine code is hT3Nm7hPr1Vp3Di1Ra2USNIGL4JypRnLKLAdF6JAyuavO2JfGCiY9OZJhcAcOUnLx5xwNdhILGrAWX9s+z2WDkKwNR7tAfClBEjRFVQeq6DU54boFgEA
AMcustom3: Custom engine code is hT3Ng7hP/feYQOTDZ3qhYOwGAM51eA+J/FjkM5shLioAsqhgLR4Ft+O1BuKG6ilQ83B9tLXSmmqwm7g9AQA
Mpcustom4: Custom engine code is hT3NZbhP9fmY2AbBQnsjfOxn6c+6e6yL+/e8fZFmaQrnlgEA
INFO (IPF036): Starting proof on task: "<embedded>", 1 properties to prove with 0 already proven/unreachable
INFO (IRS029): Starting reset analysis: phase 1 of 4.
INFO (IRS030): Running reset analysis: phase 2 of 4.
INFO (IRS031): Running reset analysis: phase 3 of 4.
INFO (IRS020): Starting the reset analysis simulation with a limit of 100 iterations (phase 4 of 4).
INFO (IRS024): Reset iterations 0 to 4 analyzed.
INFO (IRS018): Reset analysis simulation executed for 3 iterations. Assigned values for 13 of 15 design flops, 0 of 0 design latches, 3 of 3 internal elements.
INFO (IRS039): Reset analysis complete.
INFO (IPF031): Settings used for proof thread 0:
    orchestration                 = on
    time_limit                    = 86400s
    per_property_time_limit       = 1s * 10 ^ scan
    engine_mode                   = auto
    proofgrid_per_engine_max_jobs = 1
    max engine jobs               = auto
    proofgrid_mode                = local
    proofgrid_restarts            = 10
0: Using multistage preprocessing
AMcustom5: Custom engine code is hT3N1rhP11/52HrFRS21ROp2LOjVTgPvT8L8BGXHgLhaIuqtT4nARFjUqrBL+7pLmaTOzBepZW/Jm8SSrHDybSQtoNiO3y43wk+dEoWlsZizu97Fih6O6lPVG/LpWP5SsUPwlGagLNa1FKEFvwVXyX7//8prySbvSxIHXr5er+z4RAEA
0: Starting reduce
Ncustom6: Custom engine code is hT3OXrhPByJp3TrFSTLhUmMH4KVtJgmTCnNDF46yMXOKY48m4LS5nE7yBzFjA7kDuwO/GhGUpEPiky3p3wmPn3dJZHxFMsafSoObRzSC+tn7sEY0WbTdZ/FV4hL3MYH/b1CIUvXSWR4wqEoVLsmMOD4xIPT4lI1LO6ZCO7PnnWQuLwetnvKlrXx6wCW/A+x+enqslg1YPobi4wEF/EvbzOvcTYdJvl2s4H2yZg2b2ofAVN5WvhWk1HoBAA
ADcustom7: Custom engine code is hT3Nv7hPv1752HrFRa2kROx2f/ECJeZB2AZsLdlO8VwmIuqtT4nIDFXclhg+O+o+DMmQCekbheGk0kK28laA9gaOFDXsQp29J3X615HY1IPHJWd6FUFvCHjO+p1k652b5JJvZlShNpGlGSXAiQe/mEAj6tEBAA
Tricustom8: Custom engine code is hT3Nu7hPt1752DvFRa0kNDiyIV97VyejwM9C/jCLJjdPvusZONHY42VYUy0Q1ZotnhcVtNc56tJ5wbxv6V2+XpdsaSlHck5vfnbYjdwj1OECy9U+7oSQ0SZE3g5ayD+Phuh4odCJTjeKa2k4elM9ldQfkAEA
Gcustom9: Custom engine code is hT3NibhPDfeYQADBZnYcglOvK9Pfd7EOeniIqP8jNsyIqInncipMGcUXqAadachREE9F2PwhBUZUNw5kHnd4JdXkamORRgEA
C2custom10: Custom engine code is hT3NirhPjfWYQADBZnYcglOvK9Pfd7EOeniIqP8jNsyIqInncgkrYMMXCYbdK0dUjZIF9d4cJ0rHoBDjwVLBKuG86XYVV00BAA
AGcustom11: Custom engine code is hT3NirhP/fmYQADBZnYcglOvK9Pfd7EOeniIqP8jNsyIqInnckcwYMMXCYbdK0dUjZIF9d4cJ0rHoBDjwVLBKuHEZnZByh0BAA
Bcustom12: Custom engine code is hT3NjrhPDfiYQADBZnYcglOvK9PfWxFtenjIyBqfrgr7if/jL/yPOuK1BAflEcW0DxNH2eDIoezN2gxlQFg81RZtiWXh7aiTAidvAQA
0: Finished reduce in 0s
Ncustom13: Custom engine code is hT3NR7hPByFp3TrFSTLhUmMH4KWtJglTyV/c51BHEeZWamnJv767nE6PCak26bd3gf3XGN3rIRheufhDieCJQVISo+gNYUKhiUedBKGtsP/a18svAnlMJZudHxDFwK5ufsyoxsIyiAeSY2oi3tEuoDHr5gw42DFKAG3PqO3CEsl8Azzdt3pl5nGA1Ifv2H02eYsFzWb/nfp8PMb3F0krE/EgBcm8TD9Div8BAA
Tricustom14: Custom engine code is hT3Nu7hP3fiYQADBZnYcglNHp9bfd7EOeniIqP/ji8sGLQu8yhsFO+wxJ+O+R0bU8g/IewXFomyos+viQnWc2xYNYmMqpo3i40O7DaZR7qfp4YqNx26KRvQ/qx0BAA
0.0.PRE: Performing Proof Simplification...
0.0.N: clocks: 1, declared: 1, looping: 0, posedge: 1, negedge: 0, noedge: 0, bothedge: 0
0.0.N: Proof Simplification Iteration 1	[0.00 s]
0.0.PRE: A proof was found: No trace exists. [0.00 s]
INFO (IPF057): 0.0.PRE: The property ":noDeadEnd" was proven in 0.00 s.
    Use check_assumptions -show -dead_end to show this property in the property table.
0.0.PRE: A proof was found: No trace exists. [0.00 s]
INFO (IPF057): 0.0.PRE: The property ":noConflict" was proven in 0.00 s.
    Use check_assumptions -show to show this property in the property table.
INFO (IPF047): 0.0.PRE: The cover property ":live" was covered in 1 cycles in 0.00 s.
    Use check_assumptions -show -live to show this property in the property table.
0.0.PRE: Proof Simplification completed in 0.00 s
0: About to start ProofGrid in its own thread with a limit of 10000 pending notifications and a limit of 10 traces.
0: =============================== ProofGrid start ===============================
0: ProofGrid usable level: 1
0: Initial ProofGrid level: 1
0: ProofGrid is starting event handling
0.0.Hp: Proofgrid shell started at 839@vlsi-ria85(local) jg_757_vlsi-ria85_1
0.0.N: Proofgrid shell started at 837@vlsi-ria85(local) jg_757_vlsi-ria85_1
0.0.Hp: clocks: 1, declared: 1, looping: 0, posedge: 1, negedge: 0, noedge: 0, bothedge: 0
0.0.N: clocks: 1, declared: 1, looping: 0, posedge: 1, negedge: 0, noedge: 0, bothedge: 0
0.0.N: Last scan. Per property time limit: 0s
0.0.N: Starting proof for property "BLINK.p1"	[0.00 s].
0.0.N: Trace Attempt  1	[0.00 s]
0.0.N: Trace Attempt  2	[0.00 s]
0.0.N: Trace Attempt  2	[0.00 s]
0.0.N: Trace Attempt  3	[0.00 s]
0.0.N: Trace Attempt  3	[0.00 s]
0.0.N: Trace Attempt  4	[0.00 s]
0.0.N: Trace Attempt  5	[0.00 s]
0.0.N: Trace Attempt  1	[0.00 s]
0.0.N: Trace Attempt  2	[0.00 s]
0.0.N: Trace Attempt  3	[0.00 s]
0.0.Hp: Last scan. Per property time limit: 0s
0.0.Hp: Trace Attempt  1	[0.00 s]
0.0.Hp: Trace Attempt  2	[0.00 s]
0.0.Hp: Trace Attempt  3	[0.00 s]
0.0.Hp: Trace Attempt  4	[0.00 s]
0.0.Hp: Trace Attempt  5	[0.00 s]
0.0.N: Trace Attempt  4	[0.00 s]
0.0.N: Trace Attempt  5	[0.01 s]
0.0.B: Proofgrid shell started at 879@vlsi-ria85(local) jg_757_vlsi-ria85_1
0.0.B: clocks: 1, declared: 1, looping: 0, posedge: 1, negedge: 0, noedge: 0, bothedge: 0
0.0.B: Last scan. Per property time limit: 0s
0.0.B: Starting proof for property "BLINK.p1"	[0.00 s].
0.0.B: Trace Attempt  1	[0.00 s]
0.0.B: Trace Attempt  2	[0.00 s]
0.0.B: Trace Attempt  3	[0.00 s]
0.0.B: Trace Attempt  4	[0.00 s]
0.0.Ht: Proofgrid shell started at 874@vlsi-ria85(local) jg_757_vlsi-ria85_1
0.0.B: Trace Attempt  5	[0.00 s]
0.0.Ht: clocks: 1, declared: 1, looping: 0, posedge: 1, negedge: 0, noedge: 0, bothedge: 0
0.0.Ht: Last scan. Per property time limit: 0s
0.0.Ht: Trace Attempt  1	[0.00 s]
0.0.Ht: Trace Attempt  2	[0.00 s]
0.0.Ht: Trace Attempt  3	[0.00 s]
0.0.Ht: Trace Attempt  4	[0.00 s]
0.0.Ht: Trace Attempt  5	[0.00 s]
0.0.Oh: Proofgrid shell started at 878@vlsi-ria85(local) jg_757_vlsi-ria85_1
0.0.Oh: clocks: 1, declared: 1, looping: 0, posedge: 1, negedge: 0, noedge: 0, bothedge: 0
0.0.Oh: Reached length limit (2147483647) [0.00 s]
0.0.Oh: Exited with Success (@ 0.05 s)
0.0.Oh: Completed, Restart ignored.
0.0.AM: Proofgrid shell started at 881@vlsi-ria85(local) jg_757_vlsi-ria85_1
0.0.AM: clocks: 1, declared: 1, looping: 0, posedge: 1, negedge: 0, noedge: 0, bothedge: 0
0.0.AM: Last scan. Per property time limit: 0s
0.0.AM: Starting proof for property "BLINK.p1"	[0.00 s].
0.0.AM: Trace Attempt  1	[0.00 s]
0.0.AM: Trace Attempt  2	[0.00 s]
0.0.AM: Trace Attempt  3	[0.00 s]
0.0.AM: Trace Attempt  4	[0.00 s]
0.0.AM: Trace Attempt  5	[0.00 s]
0.0.AM: Trace Attempt  1	[0.00 s]
0.0.AM: Trace Attempt  2	[0.00 s]
0.0.AM: Trace Attempt  3	[0.00 s]
0.0.AM: Trace Attempt  4	[0.00 s]
0.0.AM: Trace Attempt  1	[0.01 s]
0.0.AM: Trace Attempt  2	[0.01 s]
0.0.AM: Trace Attempt  3	[0.01 s]
0.0.AM: Trace Attempt  4	[0.02 s]
0.0.AM: Trace Attempt  5	[0.02 s]
0.0.AM: Trace Attempt  1	[0.05 s]
0.0.AM: Trace Attempt  2	[0.05 s]
0.0.AM: Trace Attempt  3	[0.05 s]
0.0.AM: Trace Attempt  4	[0.05 s]
0.0.AM: Trace Attempt  5	[0.05 s]
0.0.AM: Trace Attempt  1	[0.11 s]
0.0.AM: Trace Attempt  2	[0.11 s]
0.0.AM: Trace Attempt  3	[0.11 s]
0.0.AM: Trace Attempt  4	[0.11 s]
0.0.AM: Trace Attempt  5	[0.11 s]
0.0.AM: Trace Attempt  1	[0.25 s]
0.0.AM: Trace Attempt  2	[0.25 s]
0.0.AM: Trace Attempt  3	[0.25 s]
0.0.AM: Trace Attempt  4	[0.25 s]
0.0.AM: Trace Attempt  5	[0.25 s]
0.0.AM: Trace Attempt  1	[0.74 s]
0.0.AM: Trace Attempt  2	[0.74 s]
0.0.AM: Trace Attempt  3	[0.74 s]
0.0.AM: Trace Attempt  4	[0.75 s]
0.0.AM: Trace Attempt  5	[0.75 s]
0.0.AM: Trace Attempt  1	[1.80 s]
0.0.AM: Trace Attempt  2	[1.80 s]
0.0.AM: Trace Attempt  3	[1.80 s]
0.0.AM: Trace Attempt  4	[1.80 s]
0.0.AM: Trace Attempt  5	[1.80 s]
0.0.Hp: Trace Attempt 745	[4.01 s]
0.0.B: Trace Attempt 1703	[4.00 s]
0.0.Ht: Trace Attempt 2224	[4.00 s]
0.0.N: Trace Attempt 314	[4.36 s]
0.0.AM: Trace Attempt 420	[5.81 s]
0.0.AM: Trace Attempt  1	[6.53 s]
0.0.AM: Trace Attempt  2	[6.53 s]
0.0.AM: Trace Attempt  3	[6.53 s]
0.0.AM: Trace Attempt  4	[6.53 s]
0.0.AM: Trace Attempt  5	[6.53 s]
0.0.Hp: Trace Attempt 1030	[8.01 s]
0.0.B: Trace Attempt 2336	[8.00 s]
0.0.Ht: Trace Attempt 3006	[8.00 s]
0.0.N: Trace Attempt 372	[8.89 s]
0.0.AM: Trace Attempt 598	[10.57 s]
0.0.Hp: Trace Attempt 1256	[12.02 s]
0.0.Ht: Trace Attempt 3637	[12.00 s]
0.0.B: Trace Attempt 2843	[12.01 s]
0.0.N: Trace Attempt 614	[12.92 s]
0.0.AM: Trace Attempt 854	[14.57 s]
0.0.Hp: Trace Attempt 1432	[16.04 s]
0.0.Ht: Trace Attempt 4119	[16.01 s]
0.0.B: Trace Attempt 3231	[16.02 s]
0.0.N: Trace Attempt 867	[16.98 s]
0.0.AM: Trace Attempt 891	[18.74 s]
0.0.Ht: Trace Attempt 4553	[20.01 s]
0.0.Hp: Trace Attempt 1598	[20.05 s]
0.0.B: Trace Attempt 3600	[20.02 s]
0.0.N: Trace Attempt 1032	[21.04 s]
0.0.AM: Trace Attempt 698	[22.82 s]
0.0.Ht: Trace Attempt 4911	[24.01 s]
0.0.B: Trace Attempt 3913	[24.02 s]
0.0.Hp: Trace Attempt 1741	[24.06 s]
0.0.N: Trace Attempt 1125	[25.06 s]
0.0.AM: Trace Attempt 949	[26.82 s]
0.0.Ht: Trace Attempt 5236	[28.02 s]
0.0.B: Trace Attempt 4240	[28.03 s]
0.0.Hp: Trace Attempt 1869	[28.06 s]
0.0.AM: Trace Attempt  1	[28.62 s]
0.0.AM: Trace Attempt  2	[28.62 s]
0.0.AM: Trace Attempt  3	[28.62 s]
0.0.AM: Trace Attempt  4	[28.62 s]
0.0.AM: Trace Attempt  5	[28.62 s]
0.0.N: Trace Attempt 1245	[29.32 s]
0.0.Ht: Trace Attempt 5571	[32.03 s]
0.0.B: Trace Attempt 4643	[32.03 s]
0.0.Hp: Trace Attempt 1997	[32.06 s]
0.0.AM: Trace Attempt 527	[32.63 s]
0.0.N: Trace Attempt 1366	[33.46 s]
0.0.Ht: Trace Attempt 5877	[36.03 s]
0.0.B: Trace Attempt 5017	[36.04 s]
0.0.Hp: Trace Attempt 2118	[36.08 s]
0.0.AM: Trace Attempt 839	[36.64 s]
0.0.N: Trace Attempt 1549	[37.91 s]
0.0.Ht: Trace Attempt 6173	[40.03 s]
0.0.B: Trace Attempt 5366	[40.05 s]
0.0.Hp: Trace Attempt 2233	[40.09 s]
0.0.AM: Trace Attempt 883	[40.69 s]
0.0.N: Trace Attempt 1735	[41.93 s]
0.0.Ht: Trace Attempt 6446	[44.05 s]
0.0.B: Trace Attempt 5683	[44.06 s]
0.0.Hp: Trace Attempt 2342	[44.12 s]
0.0.AM: Trace Attempt 1030	[44.86 s]
0.0.N: Trace Attempt 1973	[46.02 s]
0.0.Ht: Trace Attempt 6711	[48.05 s]
0.0.B: Trace Attempt 5989	[48.07 s]
0.0.Hp: Trace Attempt 2446	[48.13 s]
0.0.AM: Trace Attempt 1101	[49.00 s]
0.0.N: Trace Attempt 2270	[50.05 s]
0.0.Ht: Trace Attempt 6958	[52.05 s]
0.0.B: Trace Attempt 6277	[52.08 s]
0.0.Hp: Trace Attempt 2546	[52.16 s]
0.0.AM: Trace Attempt 1134	[53.09 s]
0.0.N: Trace Attempt 2445	[54.05 s]
0.0.Ht: Trace Attempt 7195	[56.06 s]
0.0.B: Trace Attempt 6542	[56.09 s]
0.0.Hp: Trace Attempt 2639	[56.17 s]
0.0.AM: Trace Attempt 1199	[57.43 s]
0.0.N: Trace Attempt 2726	[58.06 s]
0.0.Ht: Trace Attempt 7426	[60.08 s]
0.0.B: Trace Attempt 6790	[60.10 s]
0.0.Hp: Trace Attempt 2729	[60.20 s]
0.0.AM: Trace Attempt 1386	[61.45 s]
0.0.N: Trace Attempt 3031	[62.13 s]
0.0.Ht: Trace Attempt 7651	[64.08 s]
0.0.B: Trace Attempt 7027	[64.11 s]
0.0.Hp: Trace Attempt 2816	[64.21 s]
0.0.AM: Trace Attempt 1649	[65.47 s]
0.0.N: Trace Attempt 3052	[66.50 s]
0.0.Ht: Trace Attempt 7860	[68.09 s]
0.0.B: Trace Attempt 7254	[68.12 s]
0.0.Hp: Trace Attempt 2899	[68.23 s]
0.0.AM: Trace Attempt 1697	[69.91 s]
0.0.N: Trace Attempt 3078	[70.83 s]
0.0.Ht: Trace Attempt 8067	[72.10 s]
0.0.B: Trace Attempt 7476	[72.14 s]
0.0.Hp: Trace Attempt 2980	[72.26 s]
0.0.AM: Trace Attempt 1714	[74.07 s]
0.0.N: Trace Attempt 3092	[74.86 s]
0.0.B: Trace Attempt 7694	[76.15 s]
0.0.Hp: Trace Attempt 3061	[76.30 s]
0.0.AM: Trace Attempt 1727	[78.17 s]
0.0.N: Trace Attempt 3106	[79.84 s]
0.0.B: Trace Attempt 7908	[80.16 s]
0.0.Hp: Trace Attempt 3140	[80.35 s]
0.0.Ht: Trace Attempt 8196	[81.45 s]
0.0.AM: Trace Attempt 1746	[82.47 s]
0.0.N: Trace Attempt 3115	[83.89 s]
0.0.B: Trace Attempt 8110	[84.17 s]
0.0.Hp: Trace Attempt 3215	[84.36 s]
0.0.AM: Trace Attempt 1756	[86.98 s]
0.0.N: Trace Attempt 3131	[88.06 s]
0.0.B: Trace Attempt 8247	[88.20 s]
0.0.Hp: Trace Attempt 3291	[88.41 s]
0.0.Ht: Trace Attempt 8197	[89.73 s]
0.0.AM: Trace Attempt 1049	[91.00 s]
0.0.B: Trace Attempt 8345	[92.22 s]
0.0.N: Trace Attempt 3139	[92.39 s]
0.0.Hp: Trace Attempt 3362	[92.44 s]
0.0.Ht: Trace Attempt 8540	[93.73 s]
0.0.AM: Trace Attempt 1199	[95.01 s]
0.0.B: Trace Attempt 8438	[96.25 s]
0.0.N: Trace Attempt 3148	[96.41 s]
0.0.Hp: Trace Attempt 3430	[96.46 s]
0.0.Ht: Trace Attempt 8822	[97.74 s]
0.0.AM: Trace Attempt 1334	[99.02 s]
0.0.B: Trace Attempt 8518	[100.27 s]
0.0.N: Trace Attempt 3157	[100.44 s]
0.0.Hp: Trace Attempt 3498	[100.50 s]
0.0.Ht: Trace Attempt 9101	[101.75 s]
0.0.AM: Trace Attempt 1474	[103.04 s]
0.0.B: Trace Attempt 8600	[104.28 s]
0.0.Hp: Trace Attempt 3565	[104.55 s]
0.0.N: Trace Attempt 3166	[105.40 s]
0.0.Ht: Trace Attempt 9148	[105.76 s]
0.0.AM: Trace Attempt 1593	[107.06 s]
0.0.B: Trace Attempt 8681	[108.33 s]
0.0.Hp: Trace Attempt 3629	[108.55 s]
0.0.N: Trace Attempt 3178	[109.71 s]
0.0.Ht: Trace Attempt 9329	[109.78 s]
0.0.B: Trace Attempt 8764	[112.36 s]
0.0.Hp: Trace Attempt 3694	[112.58 s]
0.0.AM: Trace Attempt 1605	[113.58 s]
0.0.Ht: Trace Attempt 9520	[113.78 s]
0.0.N: Trace Attempt 3185	[114.36 s]
0.0.B: Trace Attempt 8848	[116.38 s]
0.0.Hp: Trace Attempt 3759	[116.62 s]
0.0.AM: Trace Attempt 1703	[117.58 s]
0.0.Ht: Trace Attempt 9703	[117.78 s]
0.0.N: Trace Attempt 3194	[118.39 s]
0.0.B: Trace Attempt 8932	[120.41 s]
0.0.Hp: Trace Attempt 3823	[120.63 s]
0.0.AM: Trace Attempt 1804	[121.60 s]
0.0.Ht: Trace Attempt 9878	[121.80 s]
0.0.N: Trace Attempt 3200	[123.33 s]
0.0.B: Trace Attempt 9014	[124.45 s]
0.0.Hp: Trace Attempt 3886	[124.67 s]
0.0.AM: Trace Attempt 1899	[125.61 s]
0.0.Ht: Trace Attempt 10053	[125.81 s]
0.0.N: Trace Attempt 3207	[127.45 s]
0.0.B: Trace Attempt 9091	[128.48 s]
0.0.Hp: Trace Attempt 3947	[128.73 s]
0.0.AM: Trace Attempt 1983	[129.63 s]
0.0.Ht: Trace Attempt 10225	[129.82 s]
0.0.B: Trace Attempt 9168	[132.52 s]
0.0.Hp: Trace Attempt 4006	[132.76 s]
0.0.N: Trace Attempt 3213	[133.25 s]
0.0.Ht: Trace Attempt 10380	[133.84 s]
0.0.B: Trace Attempt 9245	[136.55 s]
0.0.Hp: Trace Attempt 4063	[136.78 s]
0.0.N: Trace Attempt 3221	[137.62 s]
0.0.Ht: Trace Attempt 10523	[137.84 s]
0.0.AM: Trace Attempt 2049	[139.69 s]
0.0.AM: Trace Attempt  1	[140.23 s]
0.0.AM: Trace Attempt  2	[140.23 s]
0.0.AM: Trace Attempt  3	[140.23 s]
0.0.AM: Trace Attempt  4	[140.23 s]
0.0.AM: Trace Attempt  5	[140.23 s]
0.0.B: Trace Attempt 9321	[140.59 s]
0.0.Hp: Trace Attempt 4118	[140.78 s]
0.0.N: Trace Attempt 3227	[141.67 s]
0.0.Ht: Trace Attempt 10663	[141.85 s]
0.0.AM: Trace Attempt 499	[144.34 s]
0.0.B: Trace Attempt 9405	[144.64 s]
0.0.Hp: Trace Attempt 4178	[144.84 s]
0.0.N: Trace Attempt 3233	[145.84 s]
0.0.Ht: Trace Attempt 10805	[145.88 s]
0.0.AM: Trace Attempt 672	[148.40 s]
0.0.B: Trace Attempt 9487	[148.66 s]
0.0.Hp: Trace Attempt 4236	[148.87 s]
0.0.N: Trace Attempt 3239	[149.86 s]
0.0.Ht: Trace Attempt 10961	[149.89 s]
0.0.AM: Trace Attempt 761	[152.51 s]
0.0.B: Trace Attempt 9567	[152.68 s]
0.0.Hp: Trace Attempt 4293	[152.91 s]
0.0.Ht: Trace Attempt 11110	[153.90 s]
0.0.N: Trace Attempt 3246	[155.17 s]
0.0.AM: Trace Attempt 786	[156.63 s]
0.0.B: Trace Attempt 9647	[156.69 s]
0.0.Hp: Trace Attempt 4350	[156.96 s]
0.0.Ht: Trace Attempt 11251	[157.90 s]
0.0.N: Trace Attempt 3250	[160.22 s]
0.0.B: Trace Attempt 9728	[160.72 s]
0.0.Hp: Trace Attempt 4406	[160.97 s]
0.0.AM: Trace Attempt 1003	[161.18 s]
0.0.Ht: Trace Attempt 11388	[161.91 s]
0.0.B: Trace Attempt 9809	[164.76 s]
0.0.Hp: Trace Attempt 4462	[165.04 s]
0.0.N: Trace Attempt 3255	[165.07 s]
0.0.AM: Trace Attempt 1171	[165.24 s]
0.0.Ht: Trace Attempt 11518	[165.92 s]
0.0.B: Trace Attempt 9891	[168.80 s]
0.0.Hp: Trace Attempt 4517	[169.05 s]
0.0.AM: Trace Attempt 1460	[169.25 s]
0.0.N: Trace Attempt 3261	[169.56 s]
0.0.Ht: Trace Attempt 11641	[169.93 s]
0.0.B: Trace Attempt 9971	[172.80 s]
0.0.Hp: Trace Attempt 4572	[173.12 s]
0.0.AM: Trace Attempt 1586	[173.25 s]
0.0.N: Trace Attempt 3266	[173.77 s]
0.0.Ht: Trace Attempt 11761	[173.94 s]
0.0.B: Trace Attempt 10050	[176.81 s]
0.0.Hp: Trace Attempt 4625	[177.13 s]
0.0.AM: Trace Attempt 1738	[177.25 s]
0.0.N: Trace Attempt 3271	[178.77 s]
0.0.Ht: Trace Attempt 11784	[179.03 s]
0.0.B: Trace Attempt 10129	[180.85 s]
0.0.B: Trace Attempt 10130	[180.91 s]
0.0.B: Stopped processing property "BLINK.p1"	[181.05 s].
0.0.B: Morphing to Bcustom2
0.0.B: All properties determined. [0.00 s]
0.0.B: Exited with Success (@ 0.00 s)
0.0.Bcustom2: clocks: 1, declared: 1, looping: 0, posedge: 1, negedge: 0, noedge: 0, bothedge: 0
0.0.Bcustom2: Starting proof for property "BLINK.p1"	[0.00 s].
0.0.Bcustom2: Trace Attempt  1	[0.00 s]
0.0.Bcustom2: Trace Attempt  2	[0.00 s]
0.0.Bcustom2: Trace Attempt  1	[0.00 s]
0.0.Bcustom2: Trace Attempt  2	[0.00 s]
0.0.Bcustom2: Trace Attempt  3	[0.00 s]
0.0.Bcustom2: Trace Attempt  4	[0.00 s]
0.0.Bcustom2: Trace Attempt  5	[0.00 s]
0.0.Tri: Proofgrid shell started at 9165@vlsi-ria85(local) jg_757_vlsi-ria85_1
0.0.Tri: clocks: 1, declared: 1, looping: 0, posedge: 1, negedge: 0, noedge: 0, bothedge: 0
0.0.Tri: Last scan. Per property time limit: 0s
0.0.Tri: Starting proof for property "BLINK.p1"	[0.00 s].
0.0.Tri: Trace Attempt  1	[0.00 s]
0.0.AM: Trace Attempt 1836	[180.89 s]
0.0.AM: Stopped processing property "BLINK.p1"	[181.06 s].
0.0.AM: Morphing to AMcustom3
0.0.AM: All properties determined. [0.00 s]
0.0.AM: Exited with Success (@ 0.00 s)
0.0.AMcustom3: clocks: 1, declared: 1, looping: 0, posedge: 1, negedge: 0, noedge: 0, bothedge: 0
0.0.AMcustom3: Starting proof for property "BLINK.p1"	[0.00 s].
0.0.AMcustom3: Trace Attempt  1	[0.00 s]
0.0.AMcustom3: Trace Attempt  2	[0.00 s]
0.0.AMcustom3: Trace Attempt  3	[0.00 s]
0.0.AMcustom3: Trace Attempt  4	[0.00 s]
0.0.AMcustom3: Trace Attempt  5	[0.00 s]
0.0.AMcustom3: Trace Attempt  1	[0.00 s]
0.0.AMcustom3: Trace Attempt  2	[0.00 s]
0.0.AMcustom3: Trace Attempt  3	[0.00 s]
0.0.AMcustom3: Trace Attempt  4	[0.00 s]
0.0.Hp: Trace Attempt 4677	[181.15 s]
0.0.AMcustom3: Trace Attempt  1	[0.02 s]
0.0.AMcustom3: Trace Attempt  2	[0.02 s]
0.0.AMcustom3: Trace Attempt  3	[0.02 s]
0.0.AMcustom3: Trace Attempt  4	[0.02 s]
0.0.AMcustom3: Trace Attempt  5	[0.02 s]
0.0.Tri:    0.00" ---- Launching main thread ----
0.0.AMcustom3: Trace Attempt  1	[0.04 s]
0.0.AMcustom3: Trace Attempt  2	[0.04 s]
0.0.AMcustom3: Trace Attempt  3	[0.04 s]
0.0.AMcustom3: Trace Attempt  4	[0.04 s]
0.0.AMcustom3: Trace Attempt  5	[0.05 s]
0.0.Tri:    0.09" ---- Launching abstraction thread ----
0.0.Tri:    0.10" ---- Launching multi-phase simplification thread ----
0.0.AMcustom3: Trace Attempt  1	[0.13 s]
0.0.AMcustom3: Trace Attempt  2	[0.13 s]
0.0.AMcustom3: Trace Attempt  3	[0.13 s]
0.0.AMcustom3: Trace Attempt  4	[0.13 s]
0.0.AMcustom3: Trace Attempt  5	[0.13 s]
0.0.Tri:    0.14" ---- Launching liveness simplification thread ----
0.0.AMcustom3: Trace Attempt  1	[0.31 s]
0.0.AMcustom3: Trace Attempt  2	[0.31 s]
0.0.AMcustom3: Trace Attempt  3	[0.31 s]
0.0.AMcustom3: Trace Attempt  4	[0.32 s]
0.0.AMcustom3: Trace Attempt  5	[0.32 s]
0.0.N: Trace Attempt 3272	[179.62 s]
0.0.N: Stopped processing property "BLINK.p1"	[181.50 s].
0.0.N: Morphing to Ncustom1
0.0.N: All properties determined. [0.00 s]
0.0.N: Exited with Success (@ 0.00 s)
0.0.Ncustom1: clocks: 1, declared: 1, looping: 0, posedge: 1, negedge: 0, noedge: 0, bothedge: 0
0.0.Ncustom1: Starting proof for property "BLINK.p1"	[0.00 s].
0.0.Ncustom1: Trace Attempt  3	[0.00 s]
0.0.Ncustom1: Trace Attempt  4	[0.00 s]
0.0.Ncustom1: Trace Attempt  5	[0.00 s]
0.0.Ncustom1: Trace Attempt  1	[0.00 s]
0.0.Ncustom1: Trace Attempt  2	[0.00 s]
0.0.Ncustom1: Trace Attempt  3	[0.00 s]
0.0.Ncustom1: Trace Attempt  4	[0.00 s]
0.0.Ncustom1: Trace Attempt  5	[0.00 s]
0.0.AMcustom3: Trace Attempt  1	[0.73 s]
0.0.AMcustom3: Trace Attempt  2	[0.73 s]
0.0.AMcustom3: Trace Attempt  3	[0.73 s]
0.0.AMcustom3: Trace Attempt  4	[0.73 s]
0.0.AMcustom3: Trace Attempt  5	[0.73 s]
0.0.AMcustom3: Trace Attempt 60	[0.91 s]
0.0.AMcustom3: Stopped processing property "BLINK.p1"	[0.90 s].
0.0.AMcustom3: Morphing to M
0.0.AMcustom3: All properties determined. [0.00 s]
0.0.AMcustom3: Exited with Success (@ 0.00 s)
0.0.M: clocks: 1, declared: 1, looping: 0, posedge: 1, negedge: 0, noedge: 0, bothedge: 0
0.0.Bcustom2: Trace Attempt 1465	[0.96 s]
0.0.Bcustom2: Stopped processing property "BLINK.p1"	[0.96 s].
0.0.Bcustom2: Morphing to D
0.0.Bcustom2: All properties determined. [0.00 s]
0.0.Bcustom2: Exited with Success (@ 0.00 s)
0.0.M: Starting proof for property "BLINK.p1"	[0.00 s].
0.0.M: Trace Attempt  1	[0.00 s]
0.0.M: Trace Attempt  2	[0.00 s]
0.0.M: Trace Attempt  3	[0.00 s]
0.0.M: Trace Attempt  4	[0.00 s]
0.0.M: Trace Attempt  5	[0.00 s]
0.0.D: clocks: 1, declared: 1, looping: 0, posedge: 1, negedge: 0, noedge: 0, bothedge: 0
0.0.D: Starting proof for property "BLINK.p1"	[0.00 s].
0.0.D: Trace Attempt  1	[0.00 s]
0.0.D: Trace Attempt  2	[0.00 s]
0.0.D: Trace Attempt  4	[0.00 s]
0.0.D: Trace Attempt  5	[0.00 s]
0.0.Tri: Stopped processing property "BLINK.p1"	[0.99 s].
0.0.Tri: Morphing to AMcustom5
0.0.Tri: All properties determined. [0.00 s]
0.0.Tri: Exited with Success (@ 0.00 s)
0.0.AMcustom5: clocks: 1, declared: 1, looping: 0, posedge: 1, negedge: 0, noedge: 0, bothedge: 0
0.0.AMcustom5: Starting proof for property "BLINK.p1"	[0.00 s].
0.0.AMcustom5: Trace Attempt  1	[0.00 s]
0.0.AMcustom5: Trace Attempt  2	[0.00 s]
0.0.AMcustom5: Trace Attempt  1	[0.00 s]
0.0.AMcustom5: Trace Attempt  2	[0.00 s]
0.0.AMcustom5: Trace Attempt  3	[0.00 s]
0.0.AMcustom5: Trace Attempt  4	[0.00 s]
0.0.AMcustom5: Trace Attempt  5	[0.00 s]
0.0.AMcustom5: Trace Attempt  1	[0.00 s]
0.0.AMcustom5: Trace Attempt  2	[0.00 s]
0.0.AMcustom5: Trace Attempt  3	[0.00 s]
0.0.AMcustom5: Trace Attempt  4	[0.00 s]
0.0.AMcustom5: Trace Attempt  5	[0.01 s]
0.0.Ht: Trace Attempt 12073	[183.03 s]
0.0.D: Trace Attempt 132	[1.25 s]
0.0.D: Stopped processing property "BLINK.p1"	[2.18 s].
0.0.D: Morphing to AMcustom3
0.0.D: All properties determined. [0.00 s]
0.0.D: Exited with Success (@ 0.00 s)
0.0.AMcustom3: clocks: 1, declared: 1, looping: 0, posedge: 1, negedge: 0, noedge: 0, bothedge: 0
0.0.AMcustom3: Starting proof for property "BLINK.p1"	[0.00 s].
0.0.AMcustom3: Trace Attempt  1	[0.00 s]
0.0.AMcustom3: Trace Attempt  2	[0.00 s]
0.0.AMcustom3: Trace Attempt  3	[0.00 s]
0.0.AMcustom3: Trace Attempt  4	[0.00 s]
0.0.AMcustom3: Trace Attempt  5	[0.00 s]
0.0.AMcustom3: Trace Attempt  1	[0.00 s]
0.0.AMcustom3: Trace Attempt  2	[0.00 s]
0.0.AMcustom3: Trace Attempt  3	[0.00 s]
0.0.Ncustom1: Trace Attempt 221	[2.61 s]
0.0.Ncustom1: Stopped processing property "BLINK.p1"	[2.73 s].
0.0.Ncustom1: Morphing to Bcustom2
0.0.Ncustom1: All properties determined. [0.00 s]
0.0.Ncustom1: Exited with Success (@ 0.00 s)
0.0.AMcustom3: Trace Attempt  4	[0.00 s]
0.0.Bcustom2: clocks: 1, declared: 1, looping: 0, posedge: 1, negedge: 0, noedge: 0, bothedge: 0
0.0.AMcustom5: Trace Attempt 245	[2.06 s]
0.0.AMcustom5: Stopped processing property "BLINK.p1"	[2.12 s].
0.0.AMcustom5: Morphing to ADcustom7
0.0.AMcustom5: All properties determined. [0.00 s]
0.0.AMcustom5: Exited with Success (@ 0.00 s)
0.0.Bcustom2: Starting proof for property "BLINK.p1"	[0.00 s].
0.0.Bcustom2: Trace Attempt  1	[0.00 s]
0.0.Bcustom2: Trace Attempt  2	[0.00 s]
0.0.Bcustom2: Trace Attempt  1	[0.00 s]
0.0.Bcustom2: Trace Attempt  2	[0.00 s]
0.0.Bcustom2: Trace Attempt  3	[0.00 s]
0.0.Bcustom2: Trace Attempt  4	[0.00 s]
0.0.Bcustom2: Trace Attempt  5	[0.00 s]
0.0.ADcustom7: clocks: 1, declared: 1, looping: 0, posedge: 1, negedge: 0, noedge: 0, bothedge: 0
0.0.ADcustom7: Starting proof for property "BLINK.p1"	[0.00 s].
0.0.ADcustom7: Trace Attempt  1	[0.00 s]
0.0.ADcustom7: Trace Attempt  2	[0.00 s]
0.0.ADcustom7: Trace Attempt  1	[0.00 s]
0.0.ADcustom7: Trace Attempt  2	[0.00 s]
0.0.ADcustom7: Trace Attempt  3	[0.00 s]
0.0.ADcustom7: Trace Attempt  4	[0.00 s]
0.0.ADcustom7: Trace Attempt  5	[0.00 s]
0.0.ADcustom7: Trace Attempt  1	[0.00 s]
0.0.ADcustom7: Trace Attempt  2	[0.00 s]
0.0.ADcustom7: Trace Attempt  4	[0.00 s]
0.0.ADcustom7: Trace Attempt  5	[0.00 s]
0.0.AMcustom3: Trace Attempt  1	[0.02 s]
0.0.AMcustom3: Trace Attempt  2	[0.02 s]
0.0.AMcustom3: Trace Attempt  3	[0.02 s]
0.0.AMcustom3: Trace Attempt  4	[0.02 s]
0.0.AMcustom3: Trace Attempt  5	[0.02 s]
0.0.AMcustom3: Trace Attempt  1	[0.04 s]
0.0.AMcustom3: Trace Attempt  2	[0.04 s]
0.0.AMcustom3: Trace Attempt  3	[0.04 s]
0.0.AMcustom3: Trace Attempt  4	[0.04 s]
0.0.AMcustom3: Trace Attempt  5	[0.05 s]
0.0.AMcustom3: Trace Attempt  1	[0.12 s]
0.0.AMcustom3: Trace Attempt  2	[0.12 s]
0.0.AMcustom3: Trace Attempt  3	[0.12 s]
0.0.AMcustom3: Trace Attempt  4	[0.12 s]
0.0.AMcustom3: Trace Attempt  5	[0.12 s]
0.0.AMcustom3: Trace Attempt  1	[0.30 s]
0.0.AMcustom3: Trace Attempt  2	[0.30 s]
0.0.AMcustom3: Trace Attempt  3	[0.30 s]
0.0.AMcustom3: Trace Attempt  4	[0.30 s]
0.0.AMcustom3: Trace Attempt  5	[0.31 s]
0.0.AMcustom3: Trace Attempt  1	[0.72 s]
0.0.AMcustom3: Trace Attempt  2	[0.72 s]
0.0.AMcustom3: Trace Attempt  3	[0.72 s]
0.0.AMcustom3: Trace Attempt  4	[0.72 s]
0.0.AMcustom3: Trace Attempt  5	[0.72 s]
0.0.Hp: Trace Attempt 4728	[185.22 s]
0.0.M: Trace Attempt 404	[4.00 s]
0.0.AMcustom3: Trace Attempt  1	[2.37 s]
0.0.AMcustom3: Trace Attempt  2	[2.37 s]
0.0.AMcustom3: Trace Attempt  3	[2.37 s]
0.0.AMcustom3: Trace Attempt  4	[2.37 s]
0.0.AMcustom3: Trace Attempt  5	[2.37 s]
0.0.Ht: Trace Attempt 12241	[187.03 s]
0.0.ADcustom7: Trace Attempt 132	[0.89 s]
0.0.ADcustom7: Stopped processing property "BLINK.p1"	[3.83 s].
0.0.ADcustom7: Morphing to Tricustom8
0.0.ADcustom7: All properties determined. [0.00 s]
0.0.ADcustom7: Exited with Success (@ 0.00 s)
0.0.Tricustom8: clocks: 1, declared: 1, looping: 0, posedge: 1, negedge: 0, noedge: 0, bothedge: 0
0.0.Tricustom8: Starting proof for property "BLINK.p1"	[0.00 s].
0.0.Tricustom8: Trace Attempt  1	[0.00 s]
0.0.AMcustom3: Trace Attempt 360	[3.83 s]
0.0.AMcustom3: Stopped processing property "BLINK.p1"	[3.86 s].
0.0.AMcustom3: Morphing to D
0.0.AMcustom3: All properties determined. [0.00 s]
0.0.AMcustom3: Exited with Success (@ 0.00 s)
0.0.D: clocks: 1, declared: 1, looping: 0, posedge: 1, negedge: 0, noedge: 0, bothedge: 0
0.0.D: Starting proof for property "BLINK.p1"	[0.00 s].
0.0.Bcustom2: Trace Attempt 3028	[3.84 s]
0.0.Bcustom2: Stopped processing property "BLINK.p1"	[3.86 s].
0.0.Bcustom2: Morphing to Tri
0.0.Bcustom2: All properties determined. [0.00 s]
0.0.Bcustom2: Exited with Success (@ 0.00 s)
0.0.D: Trace Attempt 132	[0.01 s]
0.0.Tri: clocks: 1, declared: 1, looping: 0, posedge: 1, negedge: 0, noedge: 0, bothedge: 0
0.0.Tri: Starting proof for property "BLINK.p1"	[0.00 s].
0.0.Tri: Trace Attempt  1	[0.00 s]
0.0.Tri:    0.00" ---- Launching main thread ----
0.0.Tri: Requesting engine job to terminate
0.0.D: Requesting engine job to terminate
0.0.M: Requesting engine job to terminate
0.0.Tricustom8: Requesting engine job to terminate
0.0.Hp: Requesting engine job to terminate
0.0.Ht: Requesting engine job to terminate
INFO (IPF144): 0: Initiating shutdown of proof [188.15 s]
0.0.Tricustom8: A proof was found: No trace exists. [0.07 s]
INFO (IPF057): 0.0.Tricustom8: The property "BLINK.p1" was proven in 0.07 s.
0.0.D: Stopped processing property "BLINK.p1"	[0.06 s].
0.0.D: All properties determined. [0.06 s]
0.0.Ht: Trace Attempt 12289	[188.08 s]
0.0.Ht: All properties determined. [188.12 s]
0.0.D: Exited with Success (@ 188.17 s)
0: ProofGrid usable level: 0
0.0.Hp: Trace Attempt 4760	[188.09 s]
0.0.Hp: All properties determined. [188.17 s]
0.0.M: Trace Attempt 610	[6.10 s]
0.0.M: Stopped processing property "BLINK.p1"	[6.12 s].
0.0.Tri:    0.03" ---- Launching abstraction thread ----
0.0.M: All properties determined. [6.12 s]
0.0.Tri: Stopped processing property "BLINK.p1"	[0.06 s].
0.0.Tri: All properties determined. [0.07 s]
0.0.M: Exited with Success (@ 188.19 s)
0.0.Tri: Exited with Success (@ 188.21 s)
0.0.Ht: Exited with Success (@ 188.22 s)
0.0.Tricustom8: Stopped processing property "BLINK.p1"	[0.27 s].
0.0.Tricustom8: All properties determined. [0.27 s]
0.0.Tricustom8: Exited with Success (@ 188.35 s)
0.0.Hp: Exited with Success (@ 188.37 s)
0: --------------------------------------------------------------
ProofGrid Summary (utilization 99.96 %)
--------------------------------------------------------------
     engines started                               :    15
     engine jobs started                           :     7

    Average time in state (seconds)
    ------------------------------------------------------
    Engine  Pending     Running        Dead    Utilization
    ------------------------------------------------------
     Hp        0.03      188.15        0.00       99.98 %
     Ht        0.03      188.12        0.00       99.98 %
     Oh        0.04        0.00        0.00        6.23 %
    Tri        0.03      187.61        0.00       99.98 %
      D        0.03      188.00        0.00       99.98 %
      M        0.06      187.95        0.00       99.97 %
    Tricustom8        0.10        6.96        0.00       98.58 %
    all        0.05      135.26        0.00       99.96 %

    Total time in state (seconds)
    -----------------------------------------
            Pending     Running        Dead  
    -----------------------------------------
               0.33      946.79        0.00

    Data read    : 9.99 MiB
    Data written : 6.77 kiB

0: All pending notifications were processed.
INFO (IPF059): 0: Completed proof on task: "<embedded>"

==============================================================
SUMMARY
==============================================================
           Properties Considered              : 1
                 assertions                   : 1
                  - proven                    : 1 (100%)
                  - bounded_proven (user)     : 0 (0%)
                  - bounded_proven (auto)     : 0 (0%)
                  - marked_proven             : 0 (0%)
                  - cex                       : 0 (0%)
                  - ar_cex                    : 0 (0%)
                  - undetermined              : 0 (0%)
                  - unknown                   : 0 (0%)
                  - error                     : 0 (0%)
                 covers                       : 0
                  - unreachable               : 0
                  - bounded_unreachable (user): 0
                  - covered                   : 0
                  - ar_covered                : 0
                  - undetermined              : 0
                  - unknown                   : 0
                  - error                     : 0
proven
[<embedded>] % exit -force
INFO (IPL005): Received request to exit from the console.
INFO: Waiting for proof threads to stop...
INFO: Proof threads stopped.
INFO (IPL018): The peak resident set memory use for this session was 2.589 GB.
INFO (IPL014): Waiting for the Tcl-thread to exit.
INFO (IPL015): The Tcl-thread exited with status 0.
INFO (IPL016): Exiting the analysis session with status 0.
