# ----------------------------------------
# Jasper Version Info
# tool      : Jasper 2024.06
# platform  : Linux 3.10.0-1160.62.1.el7.x86_64
# version   : 2024.06p002 64 bits
# build date: 2024.09.02 16:28:38 UTC
# ----------------------------------------
# started   : 2025-11-18 08:37:18 IST
# hostname  : vlsi-ria84.vlsidomain
# pid       : 31747
# arguments : '-label' 'session_0' '-console' '//127.0.0.1:44613' '-nowindow' '-style' 'windows' '-exitonerror' '-data' 'AAAA2nicY2RgYLCp////PwMYMD6A0Aw2jAyoAMRnQhUJbEChGRhYYZphSliAmItBl6GAoYghnyELyDNi0ANCfSA7HS6aypDMUMJQDBQtBrLLgDiPIR7MTgfSlkBdPEAzkhgSgaqSGTKAfDkcKvXAKnLAdgMAxb8aVQ==' '-proj' '/users/rompel/jasper_executions/safety_liveness/jgprojects/seven_seg_9/sessionLogs/session_0' '-init' '-hidden' '/users/rompel/jasper_executions/safety_liveness/jgprojects/seven_seg_9/.tmp/.initCmds.tcl' 'seven_seg_9.tcl' '-hidden' '/users/rompel/jasper_executions/safety_liveness/jgprojects/seven_seg_9/.tmp/.postCmds.tcl'

Any disclosure about the Cadence Design Systems software or its use
model to any third party violates the written Non-Disclosure Agreement
between Cadence Design Systems, Inc. and the customer.

THIS SOFTWARE CONTAINS CONFIDENTIAL INFORMATION AND TRADE SECRETS OF
CADENCE DESIGN SYSTEMS, INC. USE, DISCLOSURE, OR REPRODUCTION IS
PROHIBITED WITHOUT THE PRIOR EXPRESS WRITTEN PERMISSION OF CADENCE
DESIGN SYSTEMS, INC.

Copyright (C) 2000-2024 Cadence Design Systems, Inc. All Rights
Reserved.  Unpublished -- rights reserved under the copyright laws of
the United States.

This product includes software developed by others and redistributed
according to license agreement. See doc/third_party_readme.txt for
further details.

RESTRICTED RIGHTS LEGEND

Use, duplication, or disclosure by the Government is subject to
restrictions as set forth in subparagraph (c) (1) (ii) of the Rights in
Technical Data and Computer Software clause at DFARS 252.227-7013 or
subparagraphs (c) (1) and (2) of Commercial Computer Software -- Restricted
Rights at 48 CFR 52.227-19, as applicable.


                          Cadence Design Systems, Inc.
                          2655 Seely Avenue
                          San Jose, CA 95134
                          Phone: 408.943.1234

For technical assistance visit http://support.cadence.com.

Jasper Apps Analysis Session - /users/rompel/jasper_executions/safety_liveness/jgprojects/seven_seg_9/sessionLogs/session_0

WARNING (WG017): [session]: The system's locale is "ANSI_X3.4-1968", which is not UTF-8. Non-ASCII characters might not be handled correctly.
WARNING (WG017): [jg_console]: The system's locale is "ANSI_X3.4-1968", which is not UTF-8. Non-ASCII characters might not be handled correctly.
INFO: successfully checked out license "jasper_fao".
INFO: reading configuration file "/users/rompel/.config/cadence/jasper.conf".
% analyze -sv09 ../seven_seg_9.sv
[-- (VERI-1482)] Analyzing Verilog file '/tools/cadence2425/JASPER/jasper_2024.06p002/lib/verilog/packages/std/std.sv' into library 'std'
[-- (VERI-1482)] Analyzing Verilog file '../seven_seg_9.sv'
% elaborate -bbox_mul 1000000 -bbox_div 1000000 -bbox_mod 1000000 -bbox_a 1000000
[INFO (HIER-8002)] ../seven_seg_9.sv(32): Disabling old hierarchical reference handler
[INFO (VERI-1018)] ../seven_seg_9.sv(1): compiling module 'SEVEN'
[WARN (VERI-1209)] ../seven_seg_9.sv(15): expression size 32 truncated to fit in target size 14
[INFO (VERI-8005)] ../seven_seg_9.sv(5): Unintentional sequential element inferred for cnt read before write using blocking assignment
[INFO (VERI-8005)] ../seven_seg_9.sv(6): Unintentional sequential element inferred for digit_select read before write using blocking assignment
[INFO (VERI-8005)] ../seven_seg_9.sv(1): Unintentional sequential element inferred for segment read before write using blocking assignment
[INFO (VERI-8005)] ../seven_seg_9.sv(1): Unintentional sequential element inferred for sig read before write using blocking assignment
INFO (ISW003): Top module name is "SEVEN".
INFO (INL208): Elaboration synthesis summary:
  Number of synthesized netlists          1 (0 packages)
  Single run mode                         On
  Pipeline                                On (1 pipelined netlists)
  Late hierarchical reference connection  On
  Number of analyzed Verilog modules      1 (1 synthesized)
  Number of analyzed VHDL entities        0 (0 synthesized)
INFO (INL003): Clearing all state information (assumes, stopats, and so forth).
SEVEN
[<embedded>] % reset rst
INFO (IPM031): Clearing proof results of all properties.
INFO (IRS006): Current reset condition is "rst".
[<embedded>] % clock clk
[<embedded>] % prove -all
Ncustom1: Custom engine code is hT3Ng7hPPfiYQOTDZ3qhYOwGAM51eA+J/FjkM5shLioAsqhgLR4Ft+O1BuKG6ilQ83B9tLXSl+CwjiTMAQA
Bcustom2: Custom engine code is hT3Nm7hPr1Vp3Di1Ra2USNIGL4JypRnLKLAdF6JAyuavO2JfGCiY9OZJhcAcOUnLx5xwNdhILGrAWX9s+z2WDkKwNR7tAfClBEjRFVQeq6DU54boFgEA
AMcustom3: Custom engine code is hT3Ng7hP/feYQOTDZ3qhYOwGAM51eA+J/FjkM5shLioAsqhgLR4Ft+O1BuKG6ilQ83B9tLXSmmqwm7g9AQA
Mpcustom4: Custom engine code is hT3NZbhP9fmY2AbBQnsjfOxn6c+6e6yL+/e8fZFmaQrnlgEA
INFO (IPF036): Starting proof on task: "<embedded>", 2 properties to prove with 0 already proven/unreachable
INFO (IRS029): Starting reset analysis: phase 1 of 4.
INFO (IRS030): Running reset analysis: phase 2 of 4.
INFO (IRS031): Running reset analysis: phase 3 of 4.
INFO (IRS020): Starting the reset analysis simulation with a limit of 100 iterations (phase 4 of 4).
INFO (IRS024): Reset iterations 0 to 4 analyzed.
INFO (IRS018): Reset analysis simulation executed for 3 iterations. Assigned values for 23 of 23 design flops, 0 of 0 design latches, 6 of 6 internal elements.
INFO (IRS039): Reset analysis complete.
INFO (IPF031): Settings used for proof thread 0:
    orchestration                 = on
    time_limit                    = 86400s
    per_property_time_limit       = 1s * 10 ^ scan
    engine_mode                   = auto
    proofgrid_per_engine_max_jobs = 1
    max engine jobs               = auto
    proofgrid_mode                = local
    proofgrid_restarts            = 10
0: Using multistage preprocessing
AMcustom5: Custom engine code is hT3N1rhP11/52HrFRS21ROp2LOjVTgPvT8L8BGXHgLhaIuqtT4nARFjUqrBL+7pLmaTOzBepZW/Jm8SSrHDybSQtoNiO3y43wk+dEoWlsZizu97Fih6O6lPVG/LpWP5SsUPwlGagLNa1FKEFvwVXyX7//8prySbvSxIHXr5er+z4RAEA
0: Starting reduce
Ncustom6: Custom engine code is hT3OXrhPByJp3TrFSTLhUmMH4KVtJgmTCnNDF46yMXOKY48m4LS5nE7yBzFjA7kDuwO/GhGUpEPiky3p3wmPn3dJZHxFMsafSoObRzSC+tn7sEY0WbTdZ/FV4hL3MYH/b1CIUvXSWR4wqEoVLsmMOD4xIPT4lI1LO6ZCO7PnnWQuLwetnvKlrXx6wCW/A+x+enqslg1YPobi4wEF/EvbzOvcTYdJvl2s4H2yZg2b2ofAVN5WvhWk1HoBAA
ADcustom7: Custom engine code is hT3Nv7hPv1752HrFRa2kROx2f/ECJeZB2AZsLdlO8VwmIuqtT4nIDFXclhg+O+o+DMmQCekbheGk0kK28laA9gaOFDXsQp29J3X615HY1IPHJWd6FUFvCHjO+p1k652b5JJvZlShNpGlGSXAiQe/mEAj6tEBAA
Tricustom8: Custom engine code is hT3Nu7hPt1752DvFRa0kNDiyIV97VyejwM9C/jCLJjdPvusZONHY42VYUy0Q1ZotnhcVtNc56tJ5wbxv6V2+XpdsaSlHck5vfnbYjdwj1OECy9U+7oSQ0SZE3g5ayD+Phuh4odCJTjeKa2k4elM9ldQfkAEA
Gcustom9: Custom engine code is hT3NibhPDfeYQADBZnYcglOvK9Pfd7EOeniIqP8jNsyIqInncipMGcUXqAadachREE9F2PwhBUZUNw5kHnd4JdXkamORRgEA
C2custom10: Custom engine code is hT3NirhPjfWYQADBZnYcglOvK9Pfd7EOeniIqP8jNsyIqInncgkrYMMXCYbdK0dUjZIF9d4cJ0rHoBDjwVLBKuG86XYVV00BAA
AGcustom11: Custom engine code is hT3NirhP/fmYQADBZnYcglOvK9Pfd7EOeniIqP8jNsyIqInnckcwYMMXCYbdK0dUjZIF9d4cJ0rHoBDjwVLBKuHEZnZByh0BAA
Bcustom12: Custom engine code is hT3NjrhPDfiYQADBZnYcglOvK9PfWxFtenjIyBqfrgr7if/jL/yPOuK1BAflEcW0DxNH2eDIoezN2gxlQFg81RZtiWXh7aiTAidvAQA
0: Finished reduce in 0s
Ncustom13: Custom engine code is hT3NR7hPByFp3TrFSTLhUmMH4KWtJglTyV/c51BHEeZWamnJv767nE6PCak26bd3gf3XGN3rIRheufhDieCJQVISo+gNYUKhiUedBKGtsP/a18svAnlMJZudHxDFwK5ufsyoxsIyiAeSY2oi3tEuoDHr5gw42DFKAG3PqO3CEsl8Azzdt3pl5nGA1Ifv2H02eYsFzWb/nfp8PMb3F0krE/EgBcm8TD9Div8BAA
Tricustom14: Custom engine code is hT3Nu7hP3fiYQADBZnYcglNHp9bfd7EOeniIqP/ji8sGLQu8yhsFO+wxJ+O+R0bU8g/IewXFomyos+viQnWc2xYNYmMqpo3i40O7DaZR7qfp4YqNx26KRvQ/qx0BAA
0.0.PRE: Performing Proof Simplification...
0.0.N: clocks: 1, declared: 1, looping: 0, posedge: 1, negedge: 0, noedge: 0, bothedge: 0
0.0.N: Proof Simplification Iteration 1	[0.00 s]
0.0.PRE: A trace with 1 cycles was found. [0.00 s]
INFO (IPF047): 0.0.PRE: The cover property "SEVEN.p1:precondition1" was covered in 1 cycles in 0.00 s.
0.0.N: Proof Simplification Iteration 2	[0.05 s]
0.0.PRE: A proof was found: No trace exists. [0.00 s]
INFO (IPF057): 0.0.PRE: The property ":noDeadEnd" was proven in 0.00 s.
    Use check_assumptions -show -dead_end to show this property in the property table.
0.0.PRE: A proof was found: No trace exists. [0.00 s]
INFO (IPF057): 0.0.PRE: The property ":noConflict" was proven in 0.00 s.
    Use check_assumptions -show to show this property in the property table.
INFO (IPF047): 0.0.PRE: The cover property ":live" was covered in 1 cycles in 0.00 s.
    Use check_assumptions -show -live to show this property in the property table.
0.0.PRE: Proof Simplification completed in 0.06 s
0: About to start ProofGrid in its own thread with a limit of 10000 pending notifications and a limit of 10 traces.
0: =============================== ProofGrid start ===============================
0: ProofGrid usable level: 1
0: Initial ProofGrid level: 1
0: ProofGrid is starting event handling
0.0.N: Proofgrid shell started at 31817@vlsi-ria84(local) jg_31747_vlsi-ria84_1
0.0.Hp: Proofgrid shell started at 31818@vlsi-ria84(local) jg_31747_vlsi-ria84_1
0.0.Hp: clocks: 1, declared: 1, looping: 0, posedge: 1, negedge: 0, noedge: 0, bothedge: 0
0.0.Hp: Last scan. Per property time limit: 0s
0.0.Hp: Trace Attempt  1	[0.00 s]
0.0.Hp: Trace Attempt  2	[0.00 s]
0.0.Hp: Trace Attempt  3	[0.00 s]
0.0.Hp: Trace Attempt  4	[0.00 s]
0.0.Hp: Trace Attempt  5	[0.00 s]
0.0.N: clocks: 1, declared: 1, looping: 0, posedge: 1, negedge: 0, noedge: 0, bothedge: 0
0.0.N: Last scan. Per property time limit: 0s
0.0.N: Starting proof for property "SEVEN.p1"	[0.00 s].
0.0.N: Trace Attempt  1	[0.00 s]
0.0.N: Trace Attempt  2	[0.00 s]
0.0.N: Trace Attempt  2	[0.00 s]
0.0.N: Trace Attempt  3	[0.00 s]
0.0.N: Trace Attempt  3	[0.00 s]
0.0.N: Trace Attempt  4	[0.00 s]
0.0.N: Trace Attempt  5	[0.00 s]
0.0.N: Trace Attempt  1	[0.01 s]
0.0.N: Trace Attempt  2	[0.01 s]
0.0.N: Trace Attempt  3	[0.01 s]
0.0.N: Trace Attempt  4	[0.01 s]
0.0.N: Trace Attempt  5	[0.01 s]
0.0.L: Proofgrid shell started at 31854@vlsi-ria84(local) jg_31747_vlsi-ria84_1
0.0.Mpcustom4: Proofgrid shell started at 31852@vlsi-ria84(local) jg_31747_vlsi-ria84_1
0.0.Mpcustom4: clocks: 1, declared: 1, looping: 0, posedge: 1, negedge: 0, noedge: 0, bothedge: 0
0.0.Mpcustom4: Ignoring liveness properties
0.0.Mpcustom4: All properties either determined or skipped. [0.00 s]
0.0.Mpcustom4: Exited with Success (@ 0.03 s)
0.0.Mpcustom4: Completed, Restart ignored.
0.0.Ht: Proofgrid shell started at 31850@vlsi-ria84(local) jg_31747_vlsi-ria84_1
0.0.Bm: Proofgrid shell started at 31851@vlsi-ria84(local) jg_31747_vlsi-ria84_1
0.0.L: clocks: 1, declared: 1, looping: 0, posedge: 1, negedge: 0, noedge: 0, bothedge: 0
0.0.L: Using trace diversification with seed 1 (0.05)
0.0.L: Using LRU state removal heuristic
0.0.L: Ignoring liveness properties
0.0.L: All properties either determined or skipped. [0.00 s]
0.0.L: Exited with Success (@ 0.03 s)
0.0.L: Completed, Restart ignored.
0.0.Ht: clocks: 1, declared: 1, looping: 0, posedge: 1, negedge: 0, noedge: 0, bothedge: 0
0.0.Ht: Last scan. Per property time limit: 0s
0.0.Ht: Trace Attempt  1	[0.00 s]
0.0.Ht: Trace Attempt  2	[0.00 s]
0.0.Bm: clocks: 1, declared: 1, looping: 0, posedge: 1, negedge: 0, noedge: 0, bothedge: 0
0.0.Ht: Trace Attempt  3	[0.00 s]
0.0.Bm: Ignoring liveness properties
0.0.Bm: Last scan. Per property time limit: 0s
0.0.Ht: Trace Attempt  4	[0.00 s]
0.0.Ht: Trace Attempt  5	[0.00 s]
0.0.Bm: Trace Attempt  1	[0.00 s]
0.0.Bm: Trace Attempt  2	[0.00 s]
0.0.Bm: Trace Attempt  3	[0.00 s]
0.0.Bm: Trace Attempt  4	[0.00 s]
0.0.Bm: Trace Attempt  5	[0.00 s]
0.0.Oh: Proofgrid shell started at 31853@vlsi-ria84(local) jg_31747_vlsi-ria84_1
0.0.AM: Proofgrid shell started at 31922@vlsi-ria84(local) jg_31747_vlsi-ria84_1
0.0.Oh: clocks: 1, declared: 1, looping: 0, posedge: 1, negedge: 0, noedge: 0, bothedge: 0
0.0.AM: clocks: 1, declared: 1, looping: 0, posedge: 1, negedge: 0, noedge: 0, bothedge: 0
0.0.Oh: Reached length limit (2147483647) [0.00 s]
0.0.AM: Last scan. Per property time limit: 0s
0.0.AM: Starting proof for property "SEVEN.p1"	[0.00 s].
0.0.AM: Trace Attempt  1	[0.00 s]
0.0.Oh: Exited with Success (@ 0.06 s)
0.0.Oh: Completed, Restart ignored.
0.0.AM: Trace Attempt  2	[0.00 s]
0.0.AM: Trace Attempt  3	[0.00 s]
0.0.AM: Trace Attempt  4	[0.00 s]
0.0.AM: Trace Attempt  5	[0.00 s]
0.0.AM: Trace Attempt  1	[0.00 s]
0.0.AM: Trace Attempt  2	[0.00 s]
0.0.AM: Trace Attempt  3	[0.00 s]
0.0.AM: Trace Attempt  4	[0.00 s]
0.0.AM: Trace Attempt  5	[0.00 s]
0.0.AM: Trace Attempt  1	[0.01 s]
0.0.AM: Trace Attempt  2	[0.01 s]
0.0.AM: Trace Attempt  3	[0.01 s]
0.0.AM: Trace Attempt  4	[0.01 s]
0.0.AM: Trace Attempt  5	[0.01 s]
0.0.B: Proofgrid shell started at 31855@vlsi-ria84(local) jg_31747_vlsi-ria84_1
0.0.B: clocks: 1, declared: 1, looping: 0, posedge: 1, negedge: 0, noedge: 0, bothedge: 0
0.0.B: Last scan. Per property time limit: 0s
0.0.B: Starting proof for property "SEVEN.p1"	[0.00 s].
0.0.B: Trace Attempt  1	[0.00 s]
0.0.B: Trace Attempt  2	[0.00 s]
0.0.B: Trace Attempt  3	[0.00 s]
0.0.B: Trace Attempt  4	[0.00 s]
0.0.B: Trace Attempt  5	[0.00 s]
0.0.AM: Trace Attempt  1	[0.03 s]
0.0.AM: Trace Attempt  2	[0.03 s]
0.0.AM: Trace Attempt  3	[0.03 s]
0.0.AM: Trace Attempt  4	[0.03 s]
0.0.AM: Trace Attempt  5	[0.03 s]
0.0.N: Trace Attempt  1	[0.10 s]
0.0.N: Trace Attempt  2	[0.10 s]
0.0.N: Trace Attempt  3	[0.10 s]
0.0.N: Trace Attempt  4	[0.10 s]
0.0.N: Trace Attempt  5	[0.10 s]
0.0.AM: Trace Attempt  1	[0.11 s]
0.0.AM: Trace Attempt  2	[0.11 s]
0.0.AM: Trace Attempt  3	[0.11 s]
0.0.AM: Trace Attempt  4	[0.11 s]
0.0.AM: Trace Attempt  5	[0.12 s]
0.0.N: Trace Attempt  1	[0.46 s]
0.0.N: Trace Attempt  2	[0.46 s]
0.0.N: Trace Attempt  3	[0.46 s]
0.0.N: Trace Attempt  4	[0.46 s]
0.0.N: Trace Attempt  5	[0.46 s]
0.0.AM: Trace Attempt  1	[0.48 s]
0.0.AM: Trace Attempt  2	[0.48 s]
0.0.AM: Trace Attempt  3	[0.48 s]
0.0.AM: Trace Attempt  4	[0.48 s]
0.0.AM: Trace Attempt  5	[0.48 s]
0.0.N: Trace Attempt  1	[1.98 s]
0.0.N: Trace Attempt  2	[1.98 s]
0.0.N: Trace Attempt  3	[1.98 s]
0.0.N: Trace Attempt  4	[1.98 s]
0.0.N: Trace Attempt  5	[1.98 s]
0.0.AM: Trace Attempt  1	[2.01 s]
0.0.AM: Trace Attempt  2	[2.01 s]
0.0.AM: Trace Attempt  3	[2.01 s]
0.0.AM: Trace Attempt  4	[2.01 s]
0.0.AM: Trace Attempt  5	[2.01 s]
0.0.N: Trace Attempt  1	[3.59 s]
0.0.N: Trace Attempt  2	[3.59 s]
0.0.N: Trace Attempt  3	[3.59 s]
0.0.N: Trace Attempt  4	[3.59 s]
0.0.N: Trace Attempt  5	[3.59 s]
0.0.Hp: Trace Attempt 383	[4.03 s]
0.0.Bm: Trace Attempt 1729	[4.00 s]
0.0.Ht: Trace Attempt 1795	[4.00 s]
0.0.B: Trace Attempt 1736	[4.00 s]
0.0.AM: Trace Attempt 205	[6.05 s]
0.0.N: Trace Attempt 193	[7.59 s]
0.0.Bm: Trace Attempt 2387	[8.00 s]
0.0.Ht: Trace Attempt 2461	[8.00 s]
0.0.Hp: Trace Attempt 502	[8.05 s]
0.0.B: Trace Attempt 2409	[8.00 s]
0.0.AM: Trace Attempt  1	[8.51 s]
0.0.AM: Trace Attempt  2	[8.51 s]
0.0.AM: Trace Attempt  3	[8.51 s]
0.0.AM: Trace Attempt  4	[8.51 s]
0.0.AM: Trace Attempt  5	[8.51 s]
0.0.N: Trace Attempt  1	[10.01 s]
0.0.N: Trace Attempt  2	[10.01 s]
0.0.N: Trace Attempt  3	[10.01 s]
0.0.N: Trace Attempt  4	[10.01 s]
0.0.N: Trace Attempt  5	[10.01 s]
0.0.Bm: Trace Attempt 2889	[12.01 s]
0.0.Ht: Trace Attempt 2964	[12.01 s]
0.0.B: Trace Attempt 2915	[12.00 s]
0.0.Hp: Trace Attempt 592	[12.08 s]
0.0.AM: Trace Attempt 196	[12.54 s]
0.0.N: Trace Attempt 190	[14.02 s]
0.0.Bm: Trace Attempt 3310	[16.01 s]
0.0.Ht: Trace Attempt 3394	[16.02 s]
0.0.B: Trace Attempt 3343	[16.01 s]
0.0.Hp: Trace Attempt 679	[16.11 s]
0.0.N: Trace Attempt  1	[16.61 s]
0.0.N: Trace Attempt  2	[16.61 s]
0.0.N: Trace Attempt  3	[16.61 s]
0.0.N: Trace Attempt  4	[16.61 s]
0.0.N: Trace Attempt  5	[16.61 s]
0.0.AM: Trace Attempt 255	[16.58 s]
0.0.Bm: Trace Attempt 3684	[20.02 s]
0.0.Ht: Trace Attempt 3772	[20.02 s]
0.0.B: Trace Attempt 3712	[20.02 s]
0.0.Hp: Trace Attempt 763	[20.14 s]
0.0.N: Trace Attempt 190	[20.61 s]
0.0.AM: Trace Attempt 309	[20.70 s]
0.0.N: Trace Attempt  1	[23.21 s]
0.0.N: Trace Attempt  2	[23.21 s]
0.0.N: Trace Attempt  3	[23.21 s]
0.0.N: Trace Attempt  4	[23.21 s]
0.0.N: Trace Attempt  5	[23.21 s]
0.0.Ht: Trace Attempt 4120	[24.03 s]
0.0.Bm: Trace Attempt 4014	[24.03 s]
0.0.B: Trace Attempt 4038	[24.03 s]
0.0.Hp: Trace Attempt 839	[24.20 s]
0.0.AM: Trace Attempt 349	[24.73 s]
0.0.N: Trace Attempt 191	[27.23 s]
0.0.Ht: Trace Attempt 4436	[28.03 s]
0.0.Bm: Trace Attempt 4331	[28.03 s]
0.0.B: Trace Attempt 4353	[28.03 s]
0.0.Hp: Trace Attempt 907	[28.21 s]
0.0.AM: Trace Attempt 392	[28.80 s]
0.0.N: Trace Attempt  1	[29.69 s]
0.0.N: Trace Attempt  2	[29.69 s]
0.0.N: Trace Attempt  3	[29.69 s]
0.0.N: Trace Attempt  4	[29.69 s]
0.0.N: Trace Attempt  5	[29.69 s]
0.0.Bm: Trace Attempt 4626	[32.03 s]
0.0.Ht: Trace Attempt 4733	[32.03 s]
0.0.B: Trace Attempt 4646	[32.04 s]
0.0.Hp: Trace Attempt 972	[32.22 s]
0.0.AM: Trace Attempt 430	[32.84 s]
0.0.N: Trace Attempt 191	[33.71 s]
0.0.Bm: Trace Attempt 4889	[36.03 s]
0.0.Ht: Trace Attempt 5002	[36.03 s]
0.0.B: Trace Attempt 4907	[36.06 s]
0.0.Hp: Trace Attempt 1032	[36.28 s]
0.0.N: Trace Attempt  1	[36.44 s]
0.0.N: Trace Attempt  2	[36.44 s]
0.0.N: Trace Attempt  3	[36.44 s]
0.0.N: Trace Attempt  4	[36.44 s]
0.0.N: Trace Attempt  5	[36.44 s]
0.0.AM: Trace Attempt 385	[36.85 s]
0.0.Bm: Trace Attempt 5119	[40.03 s]
0.0.Ht: Trace Attempt 5238	[40.03 s]
0.0.B: Trace Attempt 5135	[40.06 s]
0.0.Hp: Trace Attempt 1088	[40.32 s]
0.0.N: Trace Attempt 190	[40.44 s]
0.0.AM: Trace Attempt 512	[42.32 s]
0.0.N: Trace Attempt  1	[43.07 s]
0.0.N: Trace Attempt  2	[43.07 s]
0.0.N: Trace Attempt  3	[43.07 s]
0.0.N: Trace Attempt  4	[43.07 s]
0.0.N: Trace Attempt  5	[43.07 s]
0.0.AM: Trace Attempt  1	[43.35 s]
0.0.AM: Trace Attempt  2	[43.35 s]
0.0.AM: Trace Attempt  3	[43.35 s]
0.0.AM: Trace Attempt  4	[43.36 s]
0.0.AM: Trace Attempt  5	[43.36 s]
0.0.Ht: Trace Attempt 5468	[44.03 s]
0.0.Bm: Trace Attempt 5343	[44.03 s]
0.0.B: Trace Attempt 5356	[44.07 s]
0.0.Hp: Trace Attempt 1143	[44.37 s]
0.0.N: Trace Attempt 190	[47.08 s]
0.0.AM: Trace Attempt 186	[47.39 s]
0.0.Ht: Trace Attempt 5714	[48.03 s]
0.0.Bm: Trace Attempt 5588	[48.04 s]
0.0.B: Trace Attempt 5593	[48.07 s]
0.0.Hp: Trace Attempt 1194	[48.39 s]
0.0.N: Trace Attempt  1	[49.73 s]
0.0.N: Trace Attempt  2	[49.73 s]
0.0.N: Trace Attempt  3	[49.73 s]
0.0.N: Trace Attempt  4	[49.73 s]
0.0.N: Trace Attempt  5	[49.73 s]
0.0.AM: Trace Attempt 246	[51.49 s]
0.0.Ht: Trace Attempt 5935	[52.04 s]
0.0.Bm: Trace Attempt 5814	[52.04 s]
0.0.B: Trace Attempt 5814	[52.08 s]
0.0.Hp: Trace Attempt 1242	[52.40 s]
0.0.N: Trace Attempt 191	[53.75 s]
0.0.AM: Trace Attempt 266	[55.59 s]
0.0.Ht: Trace Attempt 6169	[56.05 s]
0.0.Bm: Trace Attempt 6034	[56.06 s]
0.0.B: Trace Attempt 6028	[56.08 s]
0.0.N: Trace Attempt  1	[56.76 s]
0.0.N: Trace Attempt  2	[56.76 s]
0.0.N: Trace Attempt  3	[56.76 s]
0.0.N: Trace Attempt  4	[56.76 s]
0.0.N: Trace Attempt  5	[56.77 s]
0.0.Hp: Trace Attempt 1265	[59.18 s]
0.0.AM: Trace Attempt 281	[59.93 s]
0.0.Ht: Trace Attempt 6380	[60.06 s]
0.0.Bm: Trace Attempt 6252	[60.07 s]
0.0.B: Trace Attempt 6242	[60.10 s]
0.0.N: Trace Attempt 193	[60.77 s]
0.0.Hp: Trace Attempt 1428	[63.18 s]
0.0.Ht: Trace Attempt 6604	[64.06 s]
0.0.Bm: Trace Attempt 6458	[64.08 s]
0.0.B: Trace Attempt 6443	[64.11 s]
0.0.AM: Trace Attempt 298	[64.32 s]
0.0.N: Trace Attempt 230	[64.77 s]
0.0.Hp: Trace Attempt 1570	[67.19 s]
0.0.Ht: Trace Attempt 6799	[68.08 s]
0.0.Bm: Trace Attempt 6657	[68.09 s]
0.0.B: Trace Attempt 6638	[68.11 s]
0.0.AM: Trace Attempt 318	[68.39 s]
0.0.N: Trace Attempt 293	[68.77 s]
0.0.Hp: Trace Attempt 1697	[71.20 s]
0.0.Ht: Trace Attempt 6993	[72.09 s]
0.0.Bm: Trace Attempt 6845	[72.10 s]
0.0.B: Trace Attempt 6823	[72.13 s]
0.0.AM: Trace Attempt 338	[72.44 s]
0.0.N: Trace Attempt 371	[72.80 s]
0.0.Hp: Trace Attempt 1813	[75.23 s]
0.0.Ht: Trace Attempt 7183	[76.09 s]
0.0.Bm: Trace Attempt 7025	[76.11 s]
0.0.B: Trace Attempt 6997	[76.14 s]
0.0.AM: Trace Attempt 358	[76.59 s]
0.0.N: Trace Attempt 442	[77.14 s]
0.0.N: Trace Attempt  1	[79.18 s]
0.0.N: Trace Attempt  2	[79.18 s]
0.0.N: Trace Attempt  3	[79.18 s]
0.0.N: Trace Attempt  4	[79.18 s]
0.0.N: Trace Attempt  5	[79.18 s]
0.0.Hp: Trace Attempt 1919	[79.23 s]
0.0.Ht: Trace Attempt 7349	[80.11 s]
0.0.Bm: Trace Attempt 7201	[80.11 s]
0.0.B: Trace Attempt 7170	[80.15 s]
0.0.AM: Trace Attempt 371	[80.70 s]
0.0.N: Trace Attempt 194	[83.19 s]
0.0.Hp: Trace Attempt 2023	[83.27 s]
0.0.Ht: Trace Attempt 7529	[84.13 s]
0.0.Bm: Trace Attempt 7379	[84.12 s]
0.0.B: Trace Attempt 7344	[84.16 s]
0.0.AM: Trace Attempt 385	[84.88 s]
0.0.N: Trace Attempt 231	[87.30 s]
0.0.Hp: Trace Attempt 2119	[87.31 s]
0.0.Ht: Trace Attempt 7705	[88.13 s]
0.0.Bm: Trace Attempt 7551	[88.14 s]
0.0.B: Trace Attempt 7512	[88.16 s]
0.0.AM: Trace Attempt 400	[89.06 s]
0.0.N: Trace Attempt 297	[91.33 s]
0.0.Hp: Trace Attempt 2210	[91.34 s]
0.0.Ht: Trace Attempt 7863	[92.14 s]
0.0.Bm: Trace Attempt 7716	[92.15 s]
0.0.B: Trace Attempt 7675	[92.17 s]
0.0.AM: Trace Attempt 415	[93.39 s]
0.0.N: Trace Attempt 375	[95.35 s]
0.0.Hp: Trace Attempt 2297	[95.35 s]
0.0.Ht: Trace Attempt 8028	[96.16 s]
0.0.Bm: Trace Attempt 7875	[96.17 s]
0.0.B: Trace Attempt 7830	[96.17 s]
0.0.AM: Trace Attempt 428	[97.52 s]
0.0.Hp: Trace Attempt 2380	[99.38 s]
0.0.N: Trace Attempt 442	[99.43 s]
0.0.Ht: Trace Attempt 8194	[100.17 s]
0.0.Bm: Trace Attempt 8028	[100.18 s]
0.0.B: Trace Attempt 7981	[100.20 s]
0.0.N: Trace Attempt  1	[101.32 s]
0.0.N: Trace Attempt  2	[101.33 s]
0.0.N: Trace Attempt  3	[101.33 s]
0.0.N: Trace Attempt  4	[101.33 s]
0.0.N: Trace Attempt  5	[101.33 s]
0.0.AM: Trace Attempt 439	[101.80 s]
0.0.Hp: Trace Attempt 2459	[103.39 s]
0.0.Ht: Trace Attempt 8338	[104.18 s]
0.0.Bm: Trace Attempt 8179	[104.18 s]
0.0.B: Trace Attempt 8129	[104.20 s]
0.0.N: Trace Attempt 193	[105.33 s]
0.0.AM: Trace Attempt 450	[105.83 s]
0.0.Hp: Trace Attempt 2537	[107.44 s]
0.0.Ht: Trace Attempt 8496	[108.19 s]
0.0.Bm: Trace Attempt 8334	[108.20 s]
0.0.B: Trace Attempt 8278	[108.20 s]
0.0.N: Trace Attempt 231	[109.47 s]
0.0.AM: Trace Attempt 462	[110.07 s]
0.0.Hp: Trace Attempt 2611	[111.46 s]
0.0.Ht: Trace Attempt 8663	[112.19 s]
0.0.Bm: Trace Attempt 8488	[112.20 s]
0.0.B: Trace Attempt 8430	[112.22 s]
0.0.N: Trace Attempt 297	[113.50 s]
0.0.AM: Trace Attempt 473	[114.32 s]
0.0.Hp: Trace Attempt 2683	[115.49 s]
0.0.Ht: Trace Attempt 8809	[116.22 s]
0.0.Bm: Trace Attempt 8638	[116.22 s]
0.0.B: Trace Attempt 8578	[116.24 s]
0.0.N: Trace Attempt 374	[117.51 s]
0.0.AM: Trace Attempt 483	[118.60 s]
0.0.Hp: Trace Attempt 2753	[119.54 s]
0.0.Ht: Trace Attempt 8948	[120.22 s]
0.0.Bm: Trace Attempt 8785	[120.25 s]
0.0.B: Trace Attempt 8723	[120.25 s]
0.0.N: Trace Attempt 442	[121.70 s]
0.0.AM: Trace Attempt 491	[123.02 s]
0.0.Hp: Trace Attempt 2819	[123.55 s]
0.0.N: Trace Attempt  1	[124.25 s]
0.0.N: Trace Attempt  2	[124.25 s]
0.0.N: Trace Attempt  3	[124.25 s]
0.0.N: Trace Attempt  4	[124.25 s]
0.0.N: Trace Attempt  5	[124.25 s]
0.0.Ht: Trace Attempt 9099	[124.23 s]
0.0.Bm: Trace Attempt 8923	[124.28 s]
0.0.B: Trace Attempt 8859	[124.25 s]
0.0.AM: Trace Attempt 500	[127.47 s]
0.0.Hp: Trace Attempt 2886	[127.57 s]
0.0.N: Trace Attempt 193	[128.26 s]
0.0.Ht: Trace Attempt 9247	[128.25 s]
0.0.Bm: Trace Attempt 9064	[128.28 s]
0.0.B: Trace Attempt 9000	[128.25 s]
0.0.Hp: Trace Attempt 2951	[131.58 s]
0.0.AM: Trace Attempt 510	[131.81 s]
0.0.Ht: Trace Attempt 9379	[132.25 s]
0.0.Bm: Trace Attempt 9206	[132.28 s]
0.0.B: Trace Attempt 9138	[132.28 s]
0.0.N: Trace Attempt 231	[132.40 s]
0.0.Hp: Trace Attempt 3015	[135.63 s]
0.0.AM: Trace Attempt 520	[135.94 s]
0.0.Ht: Trace Attempt 9517	[136.25 s]
0.0.Bm: Trace Attempt 9344	[136.30 s]
0.0.B: Trace Attempt 9275	[136.28 s]
0.0.N: Trace Attempt 295	[136.43 s]
0.0.Hp: Trace Attempt 3077	[139.66 s]
0.0.AM: Trace Attempt 529	[140.19 s]
0.0.Ht: Trace Attempt 9664	[140.26 s]
0.0.Bm: Trace Attempt 9479	[140.31 s]
0.0.B: Trace Attempt 9409	[140.29 s]
0.0.N: Trace Attempt 373	[140.49 s]
0.0.Hp: Trace Attempt 3137	[143.72 s]
0.0.Ht: Trace Attempt 9794	[144.26 s]
0.0.Bm: Trace Attempt 9610	[144.32 s]
0.0.B: Trace Attempt 9539	[144.31 s]
0.0.N: Trace Attempt 442	[144.66 s]
0.0.AM: Trace Attempt 539	[144.69 s]
0.0.Hp: Trace Attempt 3193	[147.73 s]
0.0.N: Trace Attempt  1	[147.74 s]
0.0.N: Trace Attempt  2	[147.74 s]
0.0.N: Trace Attempt  3	[147.74 s]
0.0.N: Trace Attempt  4	[147.74 s]
0.0.N: Trace Attempt  5	[147.75 s]
0.0.Ht: Trace Attempt 9911	[148.27 s]
0.0.Bm: Trace Attempt 9734	[148.34 s]
0.0.B: Trace Attempt 9662	[148.34 s]
0.0.AM: Trace Attempt 549	[148.88 s]
0.0.Hp: Trace Attempt 3250	[151.74 s]
0.0.N: Trace Attempt 194	[151.76 s]
0.0.Ht: Trace Attempt 10042	[152.29 s]
0.0.Bm: Trace Attempt 9862	[152.35 s]
0.0.B: Trace Attempt 9789	[152.35 s]
0.0.AM: Trace Attempt 559	[153.02 s]
0.0.Hp: Trace Attempt 3307	[155.81 s]
0.0.N: Trace Attempt 231	[155.85 s]
0.0.Ht: Trace Attempt 10179	[156.30 s]
0.0.Bm: Trace Attempt 9988	[156.37 s]
0.0.B: Trace Attempt 9914	[156.38 s]
0.0.AM: Trace Attempt 569	[157.18 s]
0.0.Hp: Trace Attempt 3363	[159.84 s]
0.0.N: Trace Attempt 297	[159.89 s]
0.0.Ht: Trace Attempt 10304	[160.31 s]
0.0.Bm: Trace Attempt 10113	[160.41 s]
0.0.B: Trace Attempt 10037	[160.38 s]
0.0.AM: Trace Attempt 578	[161.33 s]
0.0.Hp: Trace Attempt 3417	[163.88 s]
0.0.N: Trace Attempt 372	[163.92 s]
0.0.Ht: Trace Attempt 10416	[164.32 s]
0.0.B: Trace Attempt 10154	[164.39 s]
0.0.Bm: Trace Attempt 10232	[164.43 s]
0.0.AM: Trace Attempt 586	[165.50 s]
0.0.Hp: Trace Attempt 3470	[167.90 s]
0.0.N: Trace Attempt 442	[168.24 s]
0.0.Ht: Trace Attempt 10534	[168.35 s]
0.0.Bm: Trace Attempt 10346	[168.44 s]
0.0.B: Trace Attempt 10271	[168.42 s]
0.0.AM: Trace Attempt 595	[169.75 s]
0.0.N: Trace Attempt  1	[170.43 s]
0.0.N: Trace Attempt  2	[170.43 s]
0.0.N: Trace Attempt  3	[170.43 s]
0.0.N: Trace Attempt  4	[170.43 s]
0.0.N: Trace Attempt  5	[170.43 s]
0.0.Hp: Trace Attempt 3522	[171.94 s]
0.0.Ht: Trace Attempt 10659	[172.38 s]
0.0.Bm: Trace Attempt 10459	[172.45 s]
0.0.B: Trace Attempt 10384	[172.44 s]
0.0.AM: Trace Attempt 604	[173.93 s]
0.0.N: Trace Attempt 194	[174.44 s]
0.0.Hp: Trace Attempt 3574	[175.96 s]
0.0.Ht: Trace Attempt 10779	[176.40 s]
0.0.Bm: Trace Attempt 10575	[176.47 s]
0.0.B: Trace Attempt 10499	[176.47 s]
0.0.AM: Trace Attempt 613	[178.16 s]
0.0.N: Trace Attempt 231	[178.54 s]
0.0.Hp: Trace Attempt 3625	[180.01 s]
0.0.Ht: Trace Attempt 10889	[180.40 s]
0.0.Bm: Trace Attempt 10690	[180.50 s]
0.0.B: Trace Attempt 10613	[180.50 s]
0.0.N: Trace Attempt 265	[180.93 s]
0.0.N: Stopped processing property "SEVEN.p1"	[180.95 s].
0.0.N: Morphing to Ncustom1
0.0.N: All properties determined. [0.00 s]
0.0.N: Exited with Success (@ 0.00 s)
0.0.Ncustom1: clocks: 1, declared: 1, looping: 0, posedge: 1, negedge: 0, noedge: 0, bothedge: 0
0.0.Ncustom1: Starting proof for property "SEVEN.p1"	[0.00 s].
0.0.Ncustom1: Trace Attempt 450	[0.04 s]
0.0.Tri: Proofgrid shell started at 32264@vlsi-ria84(local) jg_31747_vlsi-ria84_1
0.0.Tri: clocks: 1, declared: 1, looping: 0, posedge: 1, negedge: 0, noedge: 0, bothedge: 0
0.0.Tri: Last scan. Per property time limit: 0s
0.0.Tri: Starting proof for property "SEVEN.p1"	[0.00 s].
0.0.Tri: Trace Attempt  1	[0.00 s]
0.0.D: Proofgrid shell started at 32266@vlsi-ria84(local) jg_31747_vlsi-ria84_1
0.0.D: clocks: 1, declared: 1, looping: 0, posedge: 1, negedge: 0, noedge: 0, bothedge: 0
0.0.D: Last scan. Per property time limit: 0s
0.0.D: Starting proof for property "SEVEN.p1"	[0.00 s].
0.0.D: Trace Attempt  1	[0.00 s]
0.0.D: Trace Attempt  2	[0.00 s]
0.0.D: Trace Attempt  3	[0.00 s]
0.0.AM: Trace Attempt 618	[180.82 s]
0.0.AM: Stopped processing property "SEVEN.p1"	[181.02 s].
0.0.AM: Morphing to AMcustom3
0.0.Tri:    0.00" ---- Launching main thread ----
0.0.AM: All properties determined. [0.00 s]
0.0.AM: Exited with Success (@ 0.00 s)
0.0.AMcustom3: clocks: 1, declared: 1, looping: 0, posedge: 1, negedge: 0, noedge: 0, bothedge: 0
0.0.AMcustom3: Starting proof for property "SEVEN.p1"	[0.00 s].
0.0.AMcustom3: Trace Attempt  1	[0.00 s]
0.0.AMcustom3: Trace Attempt  2	[0.00 s]
0.0.AMcustom3: Trace Attempt  3	[0.00 s]
0.0.AMcustom3: Trace Attempt  4	[0.00 s]
0.0.AMcustom3: Trace Attempt  5	[0.00 s]
0.0.AMcustom3: Trace Attempt  1	[0.00 s]
0.0.AMcustom3: Trace Attempt  2	[0.00 s]
0.0.AMcustom3: Trace Attempt  3	[0.00 s]
0.0.AMcustom3: Trace Attempt  4	[0.00 s]
0.0.AMcustom3: Trace Attempt  5	[0.00 s]
0.0.AMcustom3: Trace Attempt  1	[0.01 s]
0.0.AMcustom3: Trace Attempt  2	[0.01 s]
0.0.AMcustom3: Trace Attempt  3	[0.01 s]
0.0.AMcustom3: Trace Attempt  4	[0.01 s]
0.0.AMcustom3: Trace Attempt  5	[0.01 s]
0.0.B: Trace Attempt 10623	[180.86 s]
0.0.B: Stopped processing property "SEVEN.p1"	[181.04 s].
0.0.B: Morphing to Bcustom2
0.0.B: All properties determined. [0.00 s]
0.0.B: Exited with Success (@ 0.00 s)
0.0.Bcustom2: clocks: 1, declared: 1, looping: 0, posedge: 1, negedge: 0, noedge: 0, bothedge: 0
0.0.Bcustom2: Starting proof for property "SEVEN.p1"	[0.00 s].
0.0.Bcustom2: Trace Attempt  1	[0.00 s]
0.0.Bcustom2: Trace Attempt  2	[0.00 s]
0.0.Bcustom2: Trace Attempt  1	[0.00 s]
0.0.Bcustom2: Trace Attempt  2	[0.00 s]
0.0.Bcustom2: Trace Attempt  3	[0.00 s]
0.0.Bcustom2: Trace Attempt  4	[0.00 s]
0.0.Bcustom2: Trace Attempt  5	[0.00 s]
0.0.Bcustom2: Trace Attempt  1	[0.00 s]
0.0.Bcustom2: Trace Attempt  2	[0.00 s]
0.0.Bcustom2: Trace Attempt  3	[0.00 s]
0.0.Bcustom2: Trace Attempt  4	[0.00 s]
0.0.Bcustom2: Trace Attempt  5	[0.00 s]
0.0.Bcustom2: Trace Attempt  1	[0.00 s]
0.0.Bcustom2: Trace Attempt  2	[0.00 s]
0.0.Bcustom2: Trace Attempt  3	[0.00 s]
0.0.Bcustom2: Trace Attempt  4	[0.00 s]
0.0.Bcustom2: Trace Attempt  5	[0.00 s]
0.0.Bcustom2: Trace Attempt  1	[0.01 s]
0.0.Bcustom2: Trace Attempt  2	[0.01 s]
0.0.Bcustom2: Trace Attempt  3	[0.01 s]
0.0.Bcustom2: Trace Attempt  4	[0.01 s]
0.0.Bcustom2: Trace Attempt  5	[0.01 s]
0.0.AMcustom3: Trace Attempt  1	[0.03 s]
0.0.AMcustom3: Trace Attempt  2	[0.03 s]
0.0.AMcustom3: Trace Attempt  3	[0.03 s]
0.0.AMcustom3: Trace Attempt  4	[0.03 s]
0.0.AMcustom3: Trace Attempt  5	[0.03 s]
0.0.Bcustom2: Trace Attempt  1	[0.02 s]
0.0.Bcustom2: Trace Attempt  2	[0.02 s]
0.0.Bcustom2: Trace Attempt  3	[0.02 s]
0.0.Bcustom2: Trace Attempt  4	[0.02 s]
0.0.Bcustom2: Trace Attempt  5	[0.02 s]
0.0.Tri:    0.07" ---- Launching abstraction thread ----
0.0.Bcustom2: Trace Attempt  1	[0.04 s]
0.0.Bcustom2: Trace Attempt  2	[0.04 s]
0.0.Bcustom2: Trace Attempt  3	[0.04 s]
0.0.Bcustom2: Trace Attempt  4	[0.04 s]
0.0.Bcustom2: Trace Attempt  5	[0.04 s]
0.0.Tri:    0.08" ---- Launching multi-phase simplification thread ----
0.0.Bcustom2: Trace Attempt  1	[0.08 s]
0.0.Bcustom2: Trace Attempt  2	[0.08 s]
0.0.Bcustom2: Trace Attempt  3	[0.08 s]
0.0.Bcustom2: Trace Attempt  4	[0.08 s]
0.0.Bcustom2: Trace Attempt  5	[0.08 s]
0.0.AMcustom3: Trace Attempt  1	[0.12 s]
0.0.AMcustom3: Trace Attempt  2	[0.12 s]
0.0.AMcustom3: Trace Attempt  3	[0.12 s]
0.0.Tri:    0.13" ---- Launching liveness simplification thread ----
0.0.AMcustom3: Trace Attempt  4	[0.13 s]
0.0.AMcustom3: Trace Attempt  5	[0.13 s]
0.0.Bcustom2: Trace Attempt  1	[0.21 s]
0.0.Bcustom2: Trace Attempt  2	[0.21 s]
0.0.Bcustom2: Trace Attempt  3	[0.21 s]
0.0.Bcustom2: Trace Attempt  4	[0.21 s]
0.0.Bcustom2: Trace Attempt  5	[0.21 s]
0.0.AMcustom3: Trace Attempt  1	[0.55 s]
0.0.AMcustom3: Trace Attempt  2	[0.55 s]
0.0.AMcustom3: Trace Attempt  3	[0.55 s]
0.0.AMcustom3: Trace Attempt  4	[0.55 s]
0.0.AMcustom3: Trace Attempt  5	[0.55 s]
0.0.Tri:    0.94" Simplification phase 1 complete
0.0.Ncustom1: Requesting engine job to terminate
0.0.Bcustom2: Requesting engine job to terminate
0.0.AMcustom3: Requesting engine job to terminate
0.0.Tri: Requesting engine job to terminate
0.0.D: Requesting engine job to terminate
0.0.Hp: Requesting engine job to terminate
0.0.Ht: Requesting engine job to terminate
0.0.Bm: Requesting engine job to terminate
INFO (IPF144): 0: Initiating shutdown of proof [182.07 s]
0.0.Tri: A proof was found: No trace exists. [1.03 s]
INFO (IPF057): 0.0.Tri: The property "SEVEN.p1" was proven in 1.03 s.
0.0.D: Trace Attempt 63	[0.96 s]
0.0.D: Stopped processing property "SEVEN.p1"	[1.03 s].
0.0.D: All properties determined. [1.03 s]
0.0.D: Exited with Success (@ 182.07 s)
0: ProofGrid usable level: 0
0.0.AMcustom3: Trace Attempt 64	[0.95 s]
0.0.AMcustom3: Stopped processing property "SEVEN.p1"	[0.98 s].
0.0.AMcustom3: All properties determined. [0.98 s]
0.0.AMcustom3: Exited with Success (@ 182.08 s)
0.0.Ht: Trace Attempt 10930	[182.01 s]
0.0.Ht: All properties determined. [182.04 s]
0.0.Ncustom1: Stopped processing property "SEVEN.p1"	[1.11 s].
0.0.Ncustom1: All properties determined. [1.11 s]
0.0.Ncustom1: Exited with Success (@ 182.08 s)
0.0.Hp: Trace Attempt 3649	[182.02 s]
0.0.Hp: All properties determined. [182.09 s]
0.0.Bm: Trace Attempt 10731	[182.02 s]
0.0.Bm: All properties determined. [182.13 s]
0.0.Bm: Exited with Success (@ 182.19 s)
0.0.Ht: Exited with Success (@ 182.20 s)
0.0.Tri: Stopped processing property "SEVEN.p1"	[1.23 s].
0.0.Tri: All properties determined. [1.23 s]
0.0.Tri: Exited with Success (@ 182.27 s)
0.0.Hp: Exited with Success (@ 182.29 s)
0.0.Bcustom2: Trace Attempt  1	[2.16 s]
0.0.Bcustom2: Stopped processing property "SEVEN.p1"	[2.16 s].
0.0.Bcustom2: All properties determined. [2.16 s]
0.0.Bcustom2: Exited with Success (@ 183.28 s)
0: --------------------------------------------------------------
ProofGrid Summary (utilization 99.95 %)
--------------------------------------------------------------
     engines started                               :    14
     engine jobs started                           :    11

    Average time in state (seconds)
    ------------------------------------------------------
    Engine  Pending     Running        Dead    Utilization
    ------------------------------------------------------
     Hp        0.03      182.07        0.00       99.98 %
     Ht        0.03      182.04        0.00       99.98 %
     Bm        0.03      182.04        0.00       99.98 %
    Mpcustom4        0.03        0.00        0.00        2.63 %
     Oh        0.05        0.00        0.00        3.11 %
      L        0.03        0.00        0.00        7.09 %
    Ncustom1        0.03      182.04        0.00       99.98 %
    Bcustom2        0.07      181.83        0.00       99.96 %
    AMcustom3        0.04      181.87        0.00       99.98 %
    Tri        0.09        1.04        0.00       92.32 %
      D        0.08        1.03        0.00       93.20 %
    all        0.05       99.45        0.00       99.95 %

    Total time in state (seconds)
    -----------------------------------------
            Pending     Running        Dead  
    -----------------------------------------
               0.51     1093.96        0.00

    Data read    : 7.43 MiB
    Data written : 4.08 kiB

0: All pending notifications were processed.
INFO (IPF059): 0: Completed proof on task: "<embedded>"

==============================================================
SUMMARY
==============================================================
           Properties Considered              : 2
                 assertions                   : 1
                  - proven                    : 1 (100%)
                  - bounded_proven (user)     : 0 (0%)
                  - bounded_proven (auto)     : 0 (0%)
                  - marked_proven             : 0 (0%)
                  - cex                       : 0 (0%)
                  - ar_cex                    : 0 (0%)
                  - undetermined              : 0 (0%)
                  - unknown                   : 0 (0%)
                  - error                     : 0 (0%)
                 covers                       : 1
                  - unreachable               : 0 (0%)
                  - bounded_unreachable (user): 0 (0%)
                  - covered                   : 1 (100%)
                  - ar_covered                : 0 (0%)
                  - undetermined              : 0 (0%)
                  - unknown                   : 0 (0%)
                  - error                     : 0 (0%)
determined
[<embedded>] % exit -force
INFO (IPL005): Received request to exit from the console.
INFO (IPL014): Waiting for the Tcl-thread to exit.
INFO: Waiting for proof threads to stop...
INFO: Proof threads stopped.
INFO (IPL018): The peak resident set memory use for this session was 2.239 GB.
INFO (IPL015): The Tcl-thread exited with status 0.
INFO (IPL016): Exiting the analysis session with status 0.
