# ----------------------------------------
# Jasper Version Info
# tool      : Jasper 2024.06
# platform  : Linux 3.10.0-1160.62.1.el7.x86_64
# version   : 2024.06p002 64 bits
# build date: 2024.09.02 16:28:38 UTC
# ----------------------------------------
# started   : 2025-11-18 08:55:57 IST
# hostname  : vlsi-ria84.vlsidomain
# pid       : 3419
# arguments : '-label' 'session_0' '-console' '//127.0.0.1:46420' '-nowindow' '-style' 'windows' '-exitonerror' '-data' 'AAAA6nicY2RgYLCp////PwMYMD6A0Aw2jAyoAMRnQhUJbEChGRhYYZphSliAmItBl6GAoYghnyELyLNi0ANCfSA7HS6aypDMUMJQDBQtYcgA8ooYcoHiyUBcClSTAxSJZzBkMAXq5gGalcSQCFSXDFTJwKBGQIceWGUO2C0Aqa8dbw==' '-proj' '/users/rompel/jasper_executions/safety_liveness/jgprojects/thermocouple_15/sessionLogs/session_0' '-init' '-hidden' '/users/rompel/jasper_executions/safety_liveness/jgprojects/thermocouple_15/.tmp/.initCmds.tcl' 'thermocouple_15.tcl' '-hidden' '/users/rompel/jasper_executions/safety_liveness/jgprojects/thermocouple_15/.tmp/.postCmds.tcl'

Any disclosure about the Cadence Design Systems software or its use
model to any third party violates the written Non-Disclosure Agreement
between Cadence Design Systems, Inc. and the customer.

THIS SOFTWARE CONTAINS CONFIDENTIAL INFORMATION AND TRADE SECRETS OF
CADENCE DESIGN SYSTEMS, INC. USE, DISCLOSURE, OR REPRODUCTION IS
PROHIBITED WITHOUT THE PRIOR EXPRESS WRITTEN PERMISSION OF CADENCE
DESIGN SYSTEMS, INC.

Copyright (C) 2000-2024 Cadence Design Systems, Inc. All Rights
Reserved.  Unpublished -- rights reserved under the copyright laws of
the United States.

This product includes software developed by others and redistributed
according to license agreement. See doc/third_party_readme.txt for
further details.

RESTRICTED RIGHTS LEGEND

Use, duplication, or disclosure by the Government is subject to
restrictions as set forth in subparagraph (c) (1) (ii) of the Rights in
Technical Data and Computer Software clause at DFARS 252.227-7013 or
subparagraphs (c) (1) and (2) of Commercial Computer Software -- Restricted
Rights at 48 CFR 52.227-19, as applicable.


                          Cadence Design Systems, Inc.
                          2655 Seely Avenue
                          San Jose, CA 95134
                          Phone: 408.943.1234

For technical assistance visit http://support.cadence.com.

Jasper Apps Analysis Session - /users/rompel/jasper_executions/safety_liveness/jgprojects/thermocouple_15/sessionLogs/session_0

WARNING (WG017): [session]: The system's locale is "ANSI_X3.4-1968", which is not UTF-8. Non-ASCII characters might not be handled correctly.
WARNING (WG017): [jg_console]: The system's locale is "ANSI_X3.4-1968", which is not UTF-8. Non-ASCII characters might not be handled correctly.
INFO: successfully checked out license "jasper_fao".
INFO: reading configuration file "/users/rompel/.config/cadence/jasper.conf".
% analyze -sv09 ../thermocouple_15.sv
[-- (VERI-1482)] Analyzing Verilog file '/tools/cadence2425/JASPER/jasper_2024.06p002/lib/verilog/packages/std/std.sv' into library 'std'
[-- (VERI-1482)] Analyzing Verilog file '../thermocouple_15.sv'
% elaborate -bbox_mul 1000000 -bbox_div 1000000 -bbox_mod 1000000 -bbox_a 1000000
[INFO (HIER-8002)] ../thermocouple_15.sv(46): Disabling old hierarchical reference handler
[INFO (VERI-1018)] ../thermocouple_15.sv(1): compiling module 'Thermocouple'
[WARN (VERI-1209)] ../thermocouple_15.sv(18): expression size 32 truncated to fit in target size 17
[WARN (VERI-1209)] ../thermocouple_15.sv(37): expression size 32 truncated to fit in target size 17
[INFO (VERI-8005)] ../thermocouple_15.sv(1): Unintentional sequential element inferred for tc_temp_data read before write using blocking assignment
[INFO (VERI-8005)] ../thermocouple_15.sv(1): Unintentional sequential element inferred for junction_temp_data read before write using blocking assignment
[INFO (VERI-8005)] ../thermocouple_15.sv(1): Unintentional sequential element inferred for fault_bits read before write using blocking assignment
[INFO (VERI-8005)] ../thermocouple_15.sv(5): Unintentional sequential element inferred for state read before write using blocking assignment
[INFO (VERI-8005)] ../thermocouple_15.sv(6): Unintentional sequential element inferred for cnt read before write using blocking assignment
INFO (ISW003): Top module name is "Thermocouple".
INFO (INL208): Elaboration synthesis summary:
  Number of synthesized netlists          1 (0 packages)
  Single run mode                         On
  Pipeline                                On (1 pipelined netlists)
  Late hierarchical reference connection  On
  Number of analyzed Verilog modules      1 (1 synthesized)
  Number of analyzed VHDL entities        0 (0 synthesized)
INFO (INL003): Clearing all state information (assumes, stopats, and so forth).
Thermocouple
[<embedded>] % reset rst
INFO (IPM031): Clearing proof results of all properties.
INFO (IRS006): Current reset condition is "rst".
[<embedded>] % clock clk
[<embedded>] % prove -all
Ncustom1: Custom engine code is hT3Ng7hPPfiYQOTDZ3qhYOwGAM51eA+J/FjkM5shLioAsqhgLR4Ft+O1BuKG6ilQ83B9tLXSl+CwjiTMAQA
Bcustom2: Custom engine code is hT3Nm7hPr1Vp3Di1Ra2USNIGL4JypRnLKLAdF6JAyuavO2JfGCiY9OZJhcAcOUnLx5xwNdhILGrAWX9s+z2WDkKwNR7tAfClBEjRFVQeq6DU54boFgEA
AMcustom3: Custom engine code is hT3Ng7hP/feYQOTDZ3qhYOwGAM51eA+J/FjkM5shLioAsqhgLR4Ft+O1BuKG6ilQ83B9tLXSmmqwm7g9AQA
Mpcustom4: Custom engine code is hT3NZbhP9fmY2AbBQnsjfOxn6c+6e6yL+/e8fZFmaQrnlgEA
INFO (IPF036): Starting proof on task: "<embedded>", 1 properties to prove with 0 already proven/unreachable
INFO (IRS029): Starting reset analysis: phase 1 of 4.
INFO (IRS030): Running reset analysis: phase 2 of 4.
INFO (IRS031): Running reset analysis: phase 3 of 4.
INFO (IRS020): Starting the reset analysis simulation with a limit of 100 iterations (phase 4 of 4).
INFO (IRS024): Reset iterations 0 to 4 analyzed.
INFO (IRS018): Reset analysis simulation executed for 3 iterations. Assigned values for 50 of 50 design flops, 0 of 0 design latches, 3 of 3 internal elements.
INFO (IRS039): Reset analysis complete.
INFO (IPF031): Settings used for proof thread 0:
    orchestration                 = on
    time_limit                    = 86400s
    per_property_time_limit       = 1s * 10 ^ scan
    engine_mode                   = auto
    proofgrid_per_engine_max_jobs = 1
    max engine jobs               = auto
    proofgrid_mode                = local
    proofgrid_restarts            = 10
0: Using multistage preprocessing
AMcustom5: Custom engine code is hT3N1rhP11/52HrFRS21ROp2LOjVTgPvT8L8BGXHgLhaIuqtT4nARFjUqrBL+7pLmaTOzBepZW/Jm8SSrHDybSQtoNiO3y43wk+dEoWlsZizu97Fih6O6lPVG/LpWP5SsUPwlGagLNa1FKEFvwVXyX7//8prySbvSxIHXr5er+z4RAEA
0: Starting reduce
Ncustom6: Custom engine code is hT3OXrhPByJp3TrFSTLhUmMH4KVtJgmTCnNDF46yMXOKY48m4LS5nE7yBzFjA7kDuwO/GhGUpEPiky3p3wmPn3dJZHxFMsafSoObRzSC+tn7sEY0WbTdZ/FV4hL3MYH/b1CIUvXSWR4wqEoVLsmMOD4xIPT4lI1LO6ZCO7PnnWQuLwetnvKlrXx6wCW/A+x+enqslg1YPobi4wEF/EvbzOvcTYdJvl2s4H2yZg2b2ofAVN5WvhWk1HoBAA
ADcustom7: Custom engine code is hT3Nv7hPv1752HrFRa2kROx2f/ECJeZB2AZsLdlO8VwmIuqtT4nIDFXclhg+O+o+DMmQCekbheGk0kK28laA9gaOFDXsQp29J3X615HY1IPHJWd6FUFvCHjO+p1k652b5JJvZlShNpGlGSXAiQe/mEAj6tEBAA
Tricustom8: Custom engine code is hT3Nu7hPt1752DvFRa0kNDiyIV97VyejwM9C/jCLJjdPvusZONHY42VYUy0Q1ZotnhcVtNc56tJ5wbxv6V2+XpdsaSlHck5vfnbYjdwj1OECy9U+7oSQ0SZE3g5ayD+Phuh4odCJTjeKa2k4elM9ldQfkAEA
Gcustom9: Custom engine code is hT3NibhPDfeYQADBZnYcglOvK9Pfd7EOeniIqP8jNsyIqInncipMGcUXqAadachREE9F2PwhBUZUNw5kHnd4JdXkamORRgEA
C2custom10: Custom engine code is hT3NirhPjfWYQADBZnYcglOvK9Pfd7EOeniIqP8jNsyIqInncgkrYMMXCYbdK0dUjZIF9d4cJ0rHoBDjwVLBKuG86XYVV00BAA
AGcustom11: Custom engine code is hT3NirhP/fmYQADBZnYcglOvK9Pfd7EOeniIqP8jNsyIqInnckcwYMMXCYbdK0dUjZIF9d4cJ0rHoBDjwVLBKuHEZnZByh0BAA
Bcustom12: Custom engine code is hT3NjrhPDfiYQADBZnYcglOvK9PfWxFtenjIyBqfrgr7if/jL/yPOuK1BAflEcW0DxNH2eDIoezN2gxlQFg81RZtiWXh7aiTAidvAQA
Ncustom13: Custom engine code is hT3NR7hPByFp3TrFSTLhUmMH4KWtJglTyV/c51BHEeZWamnJv767nE6PCak26bd3gf3XGN3rIRheufhDieCJQVISo+gNYUKhiUedBKGtsP/a18svAnlMJZudHxDFwK5ufsyoxsIyiAeSY2oi3tEuoDHr5gw42DFKAG3PqO3CEsl8Azzdt3pl5nGA1Ifv2H02eYsFzWb/nfp8PMb3F0krE/EgBcm8TD9Div8BAA
0: Finished reduce in 0s
Tricustom14: Custom engine code is hT3Nu7hP3fiYQADBZnYcglNHp9bfd7EOeniIqP/ji8sGLQu8yhsFO+wxJ+O+R0bU8g/IewXFomyos+viQnWc2xYNYmMqpo3i40O7DaZR7qfp4YqNx26KRvQ/qx0BAA
0.0.PRE: Performing Proof Simplification...
0.0.N: clocks: 1, declared: 1, looping: 0, posedge: 1, negedge: 0, noedge: 0, bothedge: 0
0.0.N: Proof Simplification Iteration 1	[0.00 s]
0.0.N: Proof Simplification Iteration 2	[0.00 s]
0.0.N: Proof Simplification Iteration 3	[0.00 s]
0.0.PRE: A proof was found: No trace exists. [0.00 s]
INFO (IPF057): 0.0.PRE: The property ":noDeadEnd" was proven in 0.00 s.
    Use check_assumptions -show -dead_end to show this property in the property table.
0.0.PRE: A proof was found: No trace exists. [0.00 s]
INFO (IPF057): 0.0.PRE: The property ":noConflict" was proven in 0.00 s.
    Use check_assumptions -show to show this property in the property table.
INFO (IPF047): 0.0.PRE: The cover property ":live" was covered in 1 cycles in 0.00 s.
    Use check_assumptions -show -live to show this property in the property table.
0.0.PRE: Proof Simplification completed in 0.00 s
0: About to start ProofGrid in its own thread with a limit of 10000 pending notifications and a limit of 10 traces.
0: =============================== ProofGrid start ===============================
0: ProofGrid usable level: 1
0: Initial ProofGrid level: 1
0: ProofGrid is starting event handling
0.0.Hp: Proofgrid shell started at 3485@vlsi-ria84(local) jg_3419_vlsi-ria84_1
0.0.N: Proofgrid shell started at 3484@vlsi-ria84(local) jg_3419_vlsi-ria84_1
0.0.Hp: clocks: 1, declared: 1, looping: 0, posedge: 1, negedge: 0, noedge: 0, bothedge: 0
0.0.N: clocks: 1, declared: 1, looping: 0, posedge: 1, negedge: 0, noedge: 0, bothedge: 0
0.0.N: Last scan. Per property time limit: 0s
0.0.N: Starting proof for property "Thermocouple.p1"	[0.00 s].
0.0.Hp: Last scan. Per property time limit: 0s
0.0.Hp: Trace Attempt  1	[0.00 s]
0.0.N: Trace Attempt  1	[0.00 s]
0.0.N: Trace Attempt  2	[0.00 s]
0.0.Hp: Trace Attempt  2	[0.00 s]
0.0.N: Trace Attempt  2	[0.00 s]
0.0.Hp: Trace Attempt  3	[0.00 s]
0.0.N: Trace Attempt  3	[0.00 s]
0.0.N: Trace Attempt  4	[0.00 s]
0.0.Hp: Trace Attempt  4	[0.00 s]
0.0.Hp: Trace Attempt  5	[0.00 s]
0.0.N: Trace Attempt  4	[0.00 s]
0.0.N: Trace Attempt  5	[0.00 s]
0.0.N: Trace Attempt  1	[0.01 s]
0.0.N: Trace Attempt  2	[0.01 s]
0.0.N: Trace Attempt  3	[0.01 s]
0.0.N: Trace Attempt  4	[0.02 s]
0.0.Ht: Proofgrid shell started at 3516@vlsi-ria84(local) jg_3419_vlsi-ria84_1
0.0.Oh: Proofgrid shell started at 3517@vlsi-ria84(local) jg_3419_vlsi-ria84_1
0.0.Ht: clocks: 1, declared: 1, looping: 0, posedge: 1, negedge: 0, noedge: 0, bothedge: 0
0.0.Oh: clocks: 1, declared: 1, looping: 0, posedge: 1, negedge: 0, noedge: 0, bothedge: 0
0.0.Ht: Last scan. Per property time limit: 0s
0.0.Oh: Reached length limit (2147483647) [0.00 s]
0.0.Ht: Trace Attempt  1	[0.00 s]
0.0.Ht: Trace Attempt  2	[0.00 s]
0.0.Ht: Trace Attempt  3	[0.00 s]
0.0.Ht: Trace Attempt  4	[0.00 s]
0.0.B: Proofgrid shell started at 3518@vlsi-ria84(local) jg_3419_vlsi-ria84_1
0.0.Oh: Exited with Success (@ 0.03 s)
0.0.Ht: Trace Attempt  5	[0.00 s]
0.0.B: clocks: 1, declared: 1, looping: 0, posedge: 1, negedge: 0, noedge: 0, bothedge: 0
0.0.B: Last scan. Per property time limit: 0s
0.0.B: Starting proof for property "Thermocouple.p1"	[0.00 s].
0.0.B: Trace Attempt  1	[0.00 s]
0.0.B: Trace Attempt  2	[0.00 s]
0.0.B: Trace Attempt  3	[0.00 s]
0.0.B: Trace Attempt  4	[0.00 s]
0.0.B: Trace Attempt  5	[0.00 s]
0.0.AM: Proofgrid shell started at 3519@vlsi-ria84(local) jg_3419_vlsi-ria84_1
0.0.AM: clocks: 1, declared: 1, looping: 0, posedge: 1, negedge: 0, noedge: 0, bothedge: 0
0.0.AM: Last scan. Per property time limit: 0s
0.0.AM: Starting proof for property "Thermocouple.p1"	[0.00 s].
0.0.AM: Trace Attempt  1	[0.00 s]
0.0.AM: Trace Attempt  2	[0.00 s]
0.0.AM: Trace Attempt  3	[0.00 s]
0.0.AM: Trace Attempt  4	[0.00 s]
0.0.AM: Trace Attempt  5	[0.00 s]
0.0.AM: Trace Attempt  1	[0.00 s]
0.0.AM: Trace Attempt  2	[0.00 s]
0.0.AM: Trace Attempt  3	[0.00 s]
0.0.AM: Trace Attempt  4	[0.01 s]
0.0.AM: Trace Attempt  5	[0.01 s]
0.0.AM: Trace Attempt  1	[0.01 s]
0.0.AM: Trace Attempt  2	[0.01 s]
0.0.AM: Trace Attempt  3	[0.01 s]
0.0.AM: Trace Attempt  4	[0.01 s]
0.0.AM: Trace Attempt  5	[0.01 s]
0.0.AM: Trace Attempt  1	[0.05 s]
0.0.AM: Trace Attempt  2	[0.05 s]
0.0.AM: Trace Attempt  3	[0.05 s]
0.0.AM: Trace Attempt  4	[0.05 s]
0.0.AM: Trace Attempt  5	[0.05 s]
0.0.N: Trace Attempt  1	[0.15 s]
0.0.N: Trace Attempt  2	[0.15 s]
0.0.N: Trace Attempt  3	[0.15 s]
0.0.N: Trace Attempt  4	[0.16 s]
0.0.AM: Trace Attempt  1	[0.16 s]
0.0.AM: Trace Attempt  2	[0.16 s]
0.0.AM: Trace Attempt  3	[0.16 s]
0.0.AM: Trace Attempt  4	[0.16 s]
0.0.AM: Trace Attempt  5	[0.16 s]
0.0.AM: Trace Attempt  1	[0.55 s]
0.0.AM: Trace Attempt  2	[0.55 s]
0.0.AM: Trace Attempt  3	[0.55 s]
0.0.AM: Trace Attempt  4	[0.56 s]
0.0.AM: Trace Attempt  5	[0.56 s]
0.0.N: Trace Attempt  1	[0.60 s]
0.0.N: Trace Attempt  2	[0.60 s]
0.0.N: Trace Attempt  3	[0.60 s]
0.0.N: Trace Attempt  4	[0.60 s]
0.0.N: Trace Attempt  5	[0.60 s]
0.0.N: Trace Attempt  1	[2.11 s]
0.0.N: Trace Attempt  2	[2.11 s]
0.0.N: Trace Attempt  3	[2.11 s]
0.0.N: Trace Attempt  4	[2.11 s]
0.0.N: Trace Attempt  5	[2.11 s]
0.0.AM: Trace Attempt  1	[2.28 s]
0.0.AM: Trace Attempt  2	[2.28 s]
0.0.AM: Trace Attempt  3	[2.28 s]
0.0.AM: Trace Attempt  4	[2.28 s]
0.0.AM: Trace Attempt  5	[2.28 s]
0.0.N: Trace Attempt  1	[3.61 s]
0.0.N: Trace Attempt  2	[3.61 s]
0.0.N: Trace Attempt  3	[3.61 s]
0.0.N: Trace Attempt  4	[3.61 s]
0.0.N: Trace Attempt  5	[3.62 s]
0.0.Hp: Trace Attempt 478	[4.01 s]
0.0.Ht: Trace Attempt 1820	[4.00 s]
0.0.B: Trace Attempt 1879	[4.00 s]
0.0.N: Trace Attempt  1	[5.11 s]
0.0.N: Trace Attempt  2	[5.11 s]
0.0.N: Trace Attempt  3	[5.11 s]
0.0.N: Trace Attempt  4	[5.11 s]
0.0.N: Trace Attempt  5	[5.11 s]
0.0.AM: Trace Attempt 179	[6.30 s]
0.0.N: Trace Attempt  1	[6.76 s]
0.0.N: Trace Attempt  2	[6.76 s]
0.0.N: Trace Attempt  3	[6.76 s]
0.0.N: Trace Attempt  4	[6.76 s]
0.0.N: Trace Attempt  5	[6.76 s]
0.0.Hp: Trace Attempt 674	[8.03 s]
0.0.Ht: Trace Attempt 2523	[8.00 s]
0.0.B: Trace Attempt 2584	[8.01 s]
0.0.AM: Trace Attempt  1	[9.44 s]
0.0.AM: Trace Attempt  2	[9.44 s]
0.0.AM: Trace Attempt  3	[9.44 s]
0.0.AM: Trace Attempt  4	[9.44 s]
0.0.AM: Trace Attempt  5	[9.44 s]
0.0.N: Trace Attempt 169	[10.77 s]
0.0.Ht: Trace Attempt 3050	[12.00 s]
0.0.B: Trace Attempt 3102	[12.01 s]
0.0.Hp: Trace Attempt 821	[12.05 s]
0.0.AM: Trace Attempt 207	[13.44 s]
0.0.N: Trace Attempt  1	[13.86 s]
0.0.N: Trace Attempt  2	[13.86 s]
0.0.N: Trace Attempt  3	[13.86 s]
0.0.N: Trace Attempt  4	[13.86 s]
0.0.N: Trace Attempt  5	[13.86 s]
0.0.Ht: Trace Attempt 3519	[16.01 s]
0.0.B: Trace Attempt 3546	[16.01 s]
0.0.Hp: Trace Attempt 948	[16.08 s]
0.0.AM: Trace Attempt 305	[17.49 s]
0.0.N: Trace Attempt 180	[17.88 s]
0.0.Ht: Trace Attempt 3923	[20.01 s]
0.0.B: Trace Attempt 3944	[20.01 s]
0.0.Hp: Trace Attempt 1059	[20.09 s]
0.0.N: Trace Attempt  1	[20.62 s]
0.0.N: Trace Attempt  2	[20.62 s]
0.0.N: Trace Attempt  3	[20.62 s]
0.0.N: Trace Attempt  4	[20.62 s]
0.0.N: Trace Attempt  5	[20.62 s]
0.0.AM: Trace Attempt 378	[21.82 s]
0.0.B: Trace Attempt 4302	[24.02 s]
0.0.Ht: Trace Attempt 4271	[24.02 s]
0.0.Hp: Trace Attempt 1158	[24.11 s]
0.0.N: Trace Attempt 179	[24.65 s]
0.0.AM: Trace Attempt 403	[25.82 s]
0.0.N: Trace Attempt  1	[27.41 s]
0.0.N: Trace Attempt  2	[27.41 s]
0.0.N: Trace Attempt  3	[27.41 s]
0.0.N: Trace Attempt  4	[27.41 s]
0.0.N: Trace Attempt  5	[27.41 s]
0.0.Ht: Trace Attempt 4581	[28.02 s]
0.0.B: Trace Attempt 4634	[28.03 s]
0.0.Hp: Trace Attempt 1249	[28.13 s]
0.0.AM: Trace Attempt 421	[29.86 s]
0.0.N: Trace Attempt 179	[31.43 s]
0.0.Ht: Trace Attempt 4868	[32.04 s]
0.0.B: Trace Attempt 4943	[32.04 s]
0.0.Hp: Trace Attempt 1334	[32.17 s]
0.0.AM: Trace Attempt 437	[33.88 s]
0.0.N: Trace Attempt  1	[34.23 s]
0.0.N: Trace Attempt  2	[34.24 s]
0.0.N: Trace Attempt  3	[34.24 s]
0.0.N: Trace Attempt  4	[34.24 s]
0.0.N: Trace Attempt  5	[34.24 s]
0.0.Ht: Trace Attempt 5140	[36.05 s]
0.0.B: Trace Attempt 5228	[36.04 s]
0.0.Hp: Trace Attempt 1414	[36.18 s]
0.0.AM: Trace Attempt 317	[37.88 s]
0.0.N: Trace Attempt 179	[38.27 s]
0.0.Ht: Trace Attempt 5408	[40.05 s]
0.0.B: Trace Attempt 5475	[40.06 s]
0.0.Hp: Trace Attempt 1485	[40.19 s]
0.0.N: Trace Attempt  1	[41.12 s]
0.0.N: Trace Attempt  2	[41.12 s]
0.0.N: Trace Attempt  3	[41.12 s]
0.0.N: Trace Attempt  4	[41.12 s]
0.0.N: Trace Attempt  5	[41.12 s]
0.0.AM: Trace Attempt 511	[41.88 s]
0.0.Ht: Trace Attempt 5657	[44.06 s]
0.0.B: Trace Attempt 5701	[44.06 s]
0.0.Hp: Trace Attempt 1552	[44.23 s]
0.0.AM: Trace Attempt  1	[44.39 s]
0.0.AM: Trace Attempt  2	[44.39 s]
0.0.AM: Trace Attempt  3	[44.39 s]
0.0.AM: Trace Attempt  4	[44.39 s]
0.0.AM: Trace Attempt  5	[44.39 s]
0.0.N: Trace Attempt 179	[45.15 s]
0.0.N: Trace Attempt  1	[47.85 s]
0.0.N: Trace Attempt  2	[47.85 s]
0.0.N: Trace Attempt  3	[47.85 s]
0.0.N: Trace Attempt  4	[47.86 s]
0.0.N: Trace Attempt  5	[47.86 s]
0.0.Ht: Trace Attempt 5920	[48.06 s]
0.0.B: Trace Attempt 5952	[48.08 s]
0.0.Hp: Trace Attempt 1622	[48.26 s]
0.0.AM: Trace Attempt 240	[48.47 s]
0.0.N: Trace Attempt 179	[51.87 s]
0.0.Ht: Trace Attempt 6177	[52.07 s]
0.0.B: Trace Attempt 6193	[52.09 s]
0.0.Hp: Trace Attempt 1689	[52.27 s]
0.0.AM: Trace Attempt 329	[52.52 s]
0.0.N: Trace Attempt  1	[54.61 s]
0.0.N: Trace Attempt  2	[54.61 s]
0.0.N: Trace Attempt  3	[54.61 s]
0.0.N: Trace Attempt  4	[54.62 s]
0.0.N: Trace Attempt  5	[54.62 s]
0.0.Ht: Trace Attempt 6413	[56.07 s]
0.0.B: Trace Attempt 6418	[56.10 s]
0.0.Hp: Trace Attempt 1753	[56.28 s]
0.0.AM: Trace Attempt 418	[56.53 s]
0.0.N: Trace Attempt 179	[58.63 s]
0.0.Ht: Trace Attempt 6643	[60.09 s]
0.0.B: Trace Attempt 6636	[60.11 s]
0.0.Hp: Trace Attempt 1815	[60.32 s]
0.0.AM: Trace Attempt 472	[60.62 s]
0.0.N: Trace Attempt  1	[61.35 s]
0.0.N: Trace Attempt  2	[61.35 s]
0.0.N: Trace Attempt  3	[61.35 s]
0.0.N: Trace Attempt  4	[61.36 s]
0.0.N: Trace Attempt  5	[61.36 s]
0.0.Ht: Trace Attempt 6859	[64.09 s]
0.0.B: Trace Attempt 6845	[64.12 s]
0.0.Hp: Trace Attempt 1875	[64.39 s]
0.0.AM: Trace Attempt 509	[64.67 s]
0.0.N: Trace Attempt 179	[65.39 s]
0.0.Ht: Trace Attempt 7069	[68.09 s]
0.0.N: Trace Attempt  1	[68.16 s]
0.0.N: Trace Attempt  2	[68.16 s]
0.0.N: Trace Attempt  3	[68.16 s]
0.0.N: Trace Attempt  4	[68.16 s]
0.0.B: Trace Attempt 7046	[68.13 s]
0.0.N: Trace Attempt  5	[68.16 s]
0.0.Hp: Trace Attempt 1933	[68.45 s]
0.0.AM: Trace Attempt 553	[68.78 s]
0.0.Ht: Trace Attempt 7277	[72.10 s]
0.0.B: Trace Attempt 7242	[72.13 s]
0.0.N: Trace Attempt 179	[72.18 s]
0.0.Hp: Trace Attempt 1989	[72.47 s]
0.0.AM: Trace Attempt 591	[72.88 s]
0.0.N: Trace Attempt  1	[74.92 s]
0.0.N: Trace Attempt  2	[74.92 s]
0.0.N: Trace Attempt  3	[74.92 s]
0.0.N: Trace Attempt  4	[74.92 s]
0.0.N: Trace Attempt  5	[74.92 s]
0.0.Ht: Trace Attempt 7482	[76.12 s]
0.0.B: Trace Attempt 7431	[76.15 s]
0.0.Hp: Trace Attempt 2043	[76.49 s]
0.0.AM: Trace Attempt 631	[76.91 s]
0.0.N: Trace Attempt 179	[78.93 s]
0.0.Ht: Trace Attempt 7683	[80.13 s]
0.0.B: Trace Attempt 7619	[80.16 s]
0.0.Hp: Trace Attempt 2096	[80.53 s]
0.0.AM: Trace Attempt 670	[80.92 s]
0.0.N: Trace Attempt  1	[82.18 s]
0.0.N: Trace Attempt  2	[82.18 s]
0.0.N: Trace Attempt  3	[82.18 s]
0.0.N: Trace Attempt  4	[82.19 s]
0.0.N: Trace Attempt  5	[82.19 s]
0.0.Ht: Trace Attempt 7869	[84.14 s]
0.0.B: Trace Attempt 7798	[84.17 s]
0.0.Hp: Trace Attempt 2147	[84.55 s]
0.0.AM: Trace Attempt 708	[84.97 s]
0.0.N: Trace Attempt 228	[86.22 s]
0.0.Ht: Trace Attempt 8055	[88.16 s]
0.0.B: Trace Attempt 7975	[88.17 s]
0.0.Hp: Trace Attempt 2197	[88.56 s]
0.0.AM: Trace Attempt 737	[89.01 s]
0.0.N: Trace Attempt 322	[90.27 s]
0.0.Ht: Trace Attempt 8227	[92.17 s]
0.0.B: Trace Attempt 8148	[92.18 s]
0.0.Hp: Trace Attempt 2246	[92.58 s]
0.0.AM: Trace Attempt 772	[93.07 s]
0.0.N: Trace Attempt 417	[94.30 s]
0.0.B: Trace Attempt 8322	[96.18 s]
0.0.Ht: Trace Attempt 8364	[96.19 s]
0.0.Hp: Trace Attempt 2294	[96.66 s]
0.0.AM: Trace Attempt 808	[97.09 s]
0.0.N: Trace Attempt 448	[99.33 s]
0.0.N: Trace Attempt  1	[99.34 s]
0.0.N: Trace Attempt  2	[99.34 s]
0.0.N: Trace Attempt  3	[99.34 s]
0.0.N: Trace Attempt  4	[99.35 s]
0.0.N: Trace Attempt  5	[99.35 s]
0.0.B: Trace Attempt 8487	[100.20 s]
0.0.Ht: Trace Attempt 8504	[100.20 s]
0.0.Hp: Trace Attempt 2340	[100.73 s]
0.0.AM: Trace Attempt 840	[101.09 s]
0.0.N: Trace Attempt 179	[103.35 s]
0.0.Ht: Trace Attempt 8648	[104.21 s]
0.0.B: Trace Attempt 8656	[104.21 s]
0.0.Hp: Trace Attempt 2386	[104.78 s]
0.0.AM: Trace Attempt 878	[105.18 s]
0.0.N: Trace Attempt 247	[107.36 s]
0.0.Ht: Trace Attempt 8781	[108.21 s]
0.0.B: Trace Attempt 8819	[108.23 s]
0.0.Hp: Trace Attempt 2431	[108.83 s]
0.0.AM: Trace Attempt 917	[109.31 s]
0.0.N: Trace Attempt 287	[111.49 s]
0.0.Ht: Trace Attempt 8912	[112.22 s]
0.0.B: Trace Attempt 8977	[112.24 s]
0.0.Hp: Trace Attempt 2474	[112.83 s]
0.0.AM: Trace Attempt 516	[113.34 s]
0.0.N: Trace Attempt 344	[115.64 s]
0.0.B: Trace Attempt 9119	[116.25 s]
0.0.Ht: Trace Attempt 9038	[116.26 s]
0.0.Hp: Trace Attempt 2514	[116.85 s]
0.0.AM: Trace Attempt 631	[117.34 s]
0.0.N: Trace Attempt 385	[119.65 s]
0.0.B: Trace Attempt 9257	[120.25 s]
0.0.Ht: Trace Attempt 9161	[120.28 s]
0.0.Hp: Trace Attempt 2554	[120.93 s]
0.0.AM: Trace Attempt 732	[121.35 s]
0.0.N: Trace Attempt 425	[123.66 s]
0.0.B: Trace Attempt 9388	[124.27 s]
0.0.Ht: Trace Attempt 9296	[124.29 s]
0.0.Hp: Trace Attempt 2592	[124.99 s]
0.0.AM: Trace Attempt 828	[125.37 s]
0.0.N: Trace Attempt 460	[127.66 s]
0.0.B: Trace Attempt 9515	[128.28 s]
0.0.Ht: Trace Attempt 9442	[128.29 s]
0.0.Hp: Trace Attempt 2629	[129.10 s]
0.0.AM: Trace Attempt 908	[129.42 s]
0.0.N: Trace Attempt  1	[130.29 s]
0.0.N: Trace Attempt  2	[130.29 s]
0.0.N: Trace Attempt  3	[130.29 s]
0.0.N: Trace Attempt  4	[130.29 s]
0.0.N: Trace Attempt  5	[130.30 s]
0.0.B: Trace Attempt 9642	[132.29 s]
0.0.Ht: Trace Attempt 9584	[132.30 s]
0.0.Hp: Trace Attempt 2666	[133.18 s]
0.0.AM: Trace Attempt 981	[133.43 s]
0.0.N: Trace Attempt 179	[134.33 s]
0.0.B: Trace Attempt 9773	[136.31 s]
0.0.Ht: Trace Attempt 9732	[136.31 s]
0.0.Hp: Trace Attempt 2703	[137.25 s]
0.0.N: Trace Attempt 247	[138.36 s]
0.0.Ht: Trace Attempt 9883	[140.32 s]
0.0.B: Trace Attempt 9907	[140.33 s]
0.0.Hp: Trace Attempt 2742	[141.34 s]
0.0.N: Trace Attempt 287	[142.52 s]
0.0.B: Trace Attempt 10033	[144.33 s]
0.0.Ht: Trace Attempt 10027	[144.35 s]
0.0.Hp: Trace Attempt 2779	[145.41 s]
0.0.N: Trace Attempt 344	[146.66 s]
0.0.B: Trace Attempt 10158	[148.34 s]
0.0.Ht: Trace Attempt 10170	[148.36 s]
0.0.Hp: Trace Attempt 2815	[149.43 s]
0.0.N: Trace Attempt 386	[150.72 s]
0.0.AM: Trace Attempt 1025	[151.89 s]
0.0.B: Trace Attempt 10285	[152.34 s]
0.0.Ht: Trace Attempt 10312	[152.38 s]
0.0.Hp: Trace Attempt 2852	[153.53 s]
0.0.N: Trace Attempt 428	[154.76 s]
0.0.B: Trace Attempt 10406	[156.36 s]
0.0.Ht: Trace Attempt 10444	[156.38 s]
0.0.Hp: Trace Attempt 2887	[157.53 s]
0.0.N: Trace Attempt 462	[158.87 s]
0.0.AM: Trace Attempt 1027	[159.19 s]
0.0.AM: Trace Attempt  1	[159.44 s]
0.0.AM: Trace Attempt  2	[159.44 s]
0.0.AM: Trace Attempt  3	[159.44 s]
0.0.AM: Trace Attempt  4	[159.44 s]
0.0.B: Trace Attempt 10520	[160.37 s]
0.0.Ht: Trace Attempt 10572	[160.41 s]
0.0.N: Trace Attempt  1	[160.54 s]
0.0.N: Trace Attempt  2	[160.54 s]
0.0.N: Trace Attempt  3	[160.54 s]
0.0.N: Trace Attempt  4	[160.55 s]
0.0.N: Trace Attempt  5	[160.55 s]
0.0.Hp: Trace Attempt 2922	[161.56 s]
0.0.AM: Trace Attempt 184	[163.46 s]
0.0.B: Trace Attempt 10653	[164.39 s]
0.0.Ht: Trace Attempt 10719	[164.41 s]
0.0.N: Trace Attempt 180	[164.57 s]
0.0.Hp: Trace Attempt 2960	[165.64 s]
0.0.AM: Trace Attempt 247	[167.46 s]
0.0.B: Trace Attempt 10783	[168.39 s]
0.0.Ht: Trace Attempt 10860	[168.43 s]
0.0.N: Trace Attempt 249	[168.62 s]
0.0.Hp: Trace Attempt 2997	[169.67 s]
0.0.AM: Trace Attempt 301	[171.46 s]
0.0.B: Trace Attempt 10912	[172.41 s]
0.0.Ht: Trace Attempt 11000	[172.44 s]
0.0.N: Trace Attempt 288	[172.65 s]
0.0.Hp: Trace Attempt 3034	[173.77 s]
0.0.AM: Trace Attempt 346	[175.50 s]
0.0.B: Trace Attempt 11038	[176.43 s]
0.0.Ht: Trace Attempt 11138	[176.44 s]
0.0.N: Trace Attempt 345	[176.75 s]
0.0.Hp: Trace Attempt 3070	[177.82 s]
0.0.AM: Trace Attempt 384	[179.57 s]
0.0.Ht: Trace Attempt 11273	[180.45 s]
0.0.B: Trace Attempt 11162	[180.45 s]
0.0.N: Trace Attempt 388	[180.78 s]
0.0.N: Trace Attempt 390	[180.93 s]
0.0.N: Stopped processing property "Thermocouple.p1"	[181.04 s].
0.0.N: Morphing to Ncustom1
0.0.N: All properties determined. [0.00 s]
0.0.N: Exited with Success (@ 0.00 s)
0.0.Ncustom1: clocks: 1, declared: 1, looping: 0, posedge: 1, negedge: 0, noedge: 0, bothedge: 0
0.0.Ncustom1: Starting proof for property "Thermocouple.p1"	[0.00 s].
0.0.AM: Trace Attempt 394	[180.51 s]
0.0.AM: Stopped processing property "Thermocouple.p1"	[181.03 s].
0.0.AM: Morphing to AMcustom3
0.0.AM: All properties determined. [0.00 s]
0.0.AM: Exited with Success (@ 0.00 s)
0.0.AMcustom3: clocks: 1, declared: 1, looping: 0, posedge: 1, negedge: 0, noedge: 0, bothedge: 0
0.0.AMcustom3: Starting proof for property "Thermocouple.p1"	[0.00 s].
0.0.AMcustom3: Trace Attempt  1	[0.00 s]
0.0.AMcustom3: Trace Attempt  2	[0.00 s]
0.0.AMcustom3: Trace Attempt  3	[0.00 s]
0.0.AMcustom3: Trace Attempt  4	[0.00 s]
0.0.AMcustom3: Trace Attempt  5	[0.00 s]
0.0.Tri: Proofgrid shell started at 3929@vlsi-ria84(local) jg_3419_vlsi-ria84_1
0.0.AMcustom3: Trace Attempt  1	[0.00 s]
0.0.Tri: clocks: 1, declared: 1, looping: 0, posedge: 1, negedge: 0, noedge: 0, bothedge: 0
0.0.AMcustom3: Trace Attempt  2	[0.00 s]
0.0.AMcustom3: Trace Attempt  3	[0.00 s]
0.0.Tri: Last scan. Per property time limit: 0s
0.0.Tri: Starting proof for property "Thermocouple.p1"	[0.00 s].
0.0.Tri: Trace Attempt  1	[0.00 s]
0.0.AMcustom3: Trace Attempt  4	[0.01 s]
0.0.AMcustom3: Trace Attempt  5	[0.01 s]
0.0.AMcustom3: Trace Attempt  1	[0.01 s]
0.0.AMcustom3: Trace Attempt  2	[0.01 s]
0.0.AMcustom3: Trace Attempt  3	[0.01 s]
0.0.AMcustom3: Trace Attempt  4	[0.01 s]
0.0.AMcustom3: Trace Attempt  5	[0.02 s]
0.0.Ncustom1: Trace Attempt 462	[0.07 s]
0.0.Tri:    0.00" ---- Launching main thread ----
0.0.AMcustom3: Trace Attempt  1	[0.05 s]
0.0.AMcustom3: Trace Attempt  2	[0.05 s]
0.0.AMcustom3: Trace Attempt  3	[0.05 s]
0.0.AMcustom3: Trace Attempt  4	[0.05 s]
0.0.AMcustom3: Trace Attempt  5	[0.05 s]
0.0.B: Trace Attempt 11178	[180.98 s]
0.0.B: Stopped processing property "Thermocouple.p1"	[181.12 s].
0.0.B: Morphing to Bcustom2
0.0.B: All properties determined. [0.00 s]
0.0.B: Exited with Success (@ 0.00 s)
0.0.Bcustom2: clocks: 1, declared: 1, looping: 0, posedge: 1, negedge: 0, noedge: 0, bothedge: 0
0.0.Bcustom2: Starting proof for property "Thermocouple.p1"	[0.00 s].
0.0.Bcustom2: Trace Attempt  1	[0.00 s]
0.0.Bcustom2: Trace Attempt  2	[0.00 s]
0.0.Bcustom2: Trace Attempt  1	[0.00 s]
0.0.Bcustom2: Trace Attempt  2	[0.00 s]
0.0.Bcustom2: Trace Attempt  3	[0.00 s]
0.0.Bcustom2: Trace Attempt  4	[0.00 s]
0.0.Bcustom2: Trace Attempt  5	[0.00 s]
0.0.Bcustom2: Trace Attempt  1	[0.00 s]
0.0.Bcustom2: Trace Attempt  2	[0.00 s]
0.0.Bcustom2: Trace Attempt  3	[0.00 s]
0.0.Bcustom2: Trace Attempt  4	[0.00 s]
0.0.Bcustom2: Trace Attempt  5	[0.00 s]
0.0.Bcustom2: Trace Attempt  1	[0.01 s]
0.0.Bcustom2: Trace Attempt  2	[0.01 s]
0.0.Bcustom2: Trace Attempt  3	[0.01 s]
0.0.Bcustom2: Trace Attempt  4	[0.01 s]
0.0.Bcustom2: Trace Attempt  5	[0.01 s]
0.0.Tri:    0.03" ---- Launching abstraction thread ----
0.0.Bcustom2: Trace Attempt  1	[0.01 s]
0.0.Bcustom2: Trace Attempt  2	[0.01 s]
0.0.Bcustom2: Trace Attempt  3	[0.01 s]
0.0.Bcustom2: Trace Attempt  4	[0.01 s]
0.0.Bcustom2: Trace Attempt  5	[0.01 s]
0.0.Tri:    0.04" ---- Launching multi-phase simplification thread ----
0.0.Bcustom2: Trace Attempt  1	[0.02 s]
0.0.Bcustom2: Trace Attempt  2	[0.02 s]
0.0.Bcustom2: Trace Attempt  3	[0.02 s]
0.0.Bcustom2: Trace Attempt  4	[0.02 s]
0.0.Bcustom2: Trace Attempt  5	[0.02 s]
0.0.Tri:    0.06" ---- Launching liveness simplification thread ----
0.0.Bcustom2: Trace Attempt  1	[0.05 s]
0.0.Bcustom2: Trace Attempt  2	[0.05 s]
0.0.Bcustom2: Trace Attempt  3	[0.05 s]
0.0.Bcustom2: Trace Attempt  4	[0.05 s]
0.0.Bcustom2: Trace Attempt  5	[0.05 s]
0.0.AMcustom3: Trace Attempt  1	[0.17 s]
0.0.AMcustom3: Trace Attempt  2	[0.17 s]
0.0.AMcustom3: Trace Attempt  3	[0.17 s]
0.0.AMcustom3: Trace Attempt  4	[0.17 s]
0.0.AMcustom3: Trace Attempt  5	[0.17 s]
0.0.Bcustom2: Trace Attempt  1	[0.11 s]
0.0.Bcustom2: Trace Attempt  2	[0.11 s]
0.0.Bcustom2: Trace Attempt  3	[0.11 s]
0.0.Bcustom2: Trace Attempt  4	[0.11 s]
0.0.Bcustom2: Trace Attempt  5	[0.11 s]
0.0.Bcustom2: Trace Attempt  1	[0.27 s]
0.0.Bcustom2: Trace Attempt  2	[0.27 s]
0.0.Bcustom2: Trace Attempt  3	[0.27 s]
0.0.Bcustom2: Trace Attempt  4	[0.27 s]
0.0.Bcustom2: Trace Attempt  5	[0.27 s]
0.0.AMcustom3: Trace Attempt  1	[0.60 s]
0.0.AMcustom3: Trace Attempt  2	[0.60 s]
0.0.AMcustom3: Trace Attempt  3	[0.60 s]
0.0.AMcustom3: Trace Attempt  4	[0.60 s]
0.0.AMcustom3: Trace Attempt  5	[0.60 s]
0.0.Hp: Trace Attempt 3105	[181.88 s]
0.0.Bcustom2: Trace Attempt  1	[0.74 s]
0.0.Bcustom2: Trace Attempt  2	[0.74 s]
0.0.Bcustom2: Trace Attempt  3	[0.74 s]
0.0.Bcustom2: Trace Attempt  4	[0.74 s]
0.0.Bcustom2: Trace Attempt  5	[0.74 s]
0.0.Tri:    0.86" Simplification phase 1 complete
0.0.Bcustom2: Trace Attempt 429	[0.88 s]
0.0.Bcustom2: Stopped processing property "Thermocouple.p1"	[0.88 s].
0.0.Bcustom2: Morphing to D
0.0.Bcustom2: All properties determined. [0.00 s]
0.0.Bcustom2: Exited with Success (@ 0.00 s)
0.0.D: clocks: 1, declared: 1, looping: 0, posedge: 1, negedge: 0, noedge: 0, bothedge: 0
0.0.D: Starting proof for property "Thermocouple.p1"	[0.00 s].
0.0.D: Trace Attempt  1	[0.00 s]
0.0.D: Trace Attempt  2	[0.00 s]
0.0.AMcustom3: Trace Attempt 61	[0.94 s]
0.0.AMcustom3: Stopped processing property "Thermocouple.p1"	[0.95 s].
0.0.AMcustom3: Morphing to M
0.0.AMcustom3: All properties determined. [0.00 s]
0.0.AMcustom3: Exited with Success (@ 0.00 s)
0.0.M: clocks: 1, declared: 1, looping: 0, posedge: 1, negedge: 0, noedge: 0, bothedge: 0
0.0.M: Starting proof for property "Thermocouple.p1"	[0.00 s].
0.0.D: Trace Attempt  4	[0.00 s]
0.0.M: Trace Attempt  1	[0.00 s]
0.0.M: Trace Attempt  2	[0.00 s]
0.0.M: Trace Attempt  3	[0.00 s]
0.0.M: Trace Attempt  4	[0.01 s]
0.0.M: Trace Attempt  5	[0.01 s]
0.0.Ncustom1: Requesting engine job to terminate
0.0.D: Requesting engine job to terminate
0.0.M: Requesting engine job to terminate
0.0.Hp: Requesting engine job to terminate
0.0.Ht: Requesting engine job to terminate
INFO (IPF144): 0: Initiating shutdown of proof [182.06 s]
0.0.Tri: A proof was found: No trace exists. [0.96 s]
INFO (IPF057): 0.0.Tri: The property "Thermocouple.p1" was proven in 0.97 s.
0.0.Tri: Stopped processing property "Thermocouple.p1"	[0.97 s].
0.0.D: Trace Attempt  8	[0.01 s]
0.0.D: Stopped processing property "Thermocouple.p1"	[0.02 s].
0.0.D: All properties determined. [0.02 s]
0.0.Tri: Morphing to AMcustom5
0.0.Tri: Preventing job from starting because proof is shutting down.
0.0.Tri: Requesting engine job to terminate
0.0.Tri: All properties determined. [0.00 s]
0.0.M: Trace Attempt 10	[0.02 s]
0.0.M: Stopped processing property "Thermocouple.p1"	[0.02 s].
0.0.M: All properties determined. [0.02 s]
0.0.Tri: Exited with Success (@ 182.06 s)
0: ProofGrid usable level: 0
0.0.M: Exited with Success (@ 182.06 s)
0.0.Ncustom1: Stopped processing property "Thermocouple.p1"	[1.03 s].
0.0.Ncustom1: All properties determined. [1.03 s]
0.0.Ncustom1: Exited with Success (@ 182.08 s)
0.0.Ht: Trace Attempt 11326	[182.02 s]
0.0.Ht: All properties determined. [182.05 s]
0.0.D: Exited with Success (@ 182.09 s)
0.0.Hp: Trace Attempt 3106	[182.01 s]
0.0.Hp: All properties determined. [182.11 s]
0.0.Ht: Exited with Success (@ 182.18 s)
0.0.Hp: Exited with Success (@ 182.35 s)
0: --------------------------------------------------------------
ProofGrid Summary (utilization 99.97 %)
--------------------------------------------------------------
     engines started                               :    13
     engine jobs started                           :     7

    Average time in state (seconds)
    ------------------------------------------------------
    Engine  Pending     Running        Dead    Utilization
    ------------------------------------------------------
     Hp        0.03      182.06        0.00       99.98 %
     Ht        0.03      182.03        0.00       99.98 %
     Oh        0.03        0.00        0.00        4.21 %
    Ncustom1        0.03      182.02        0.00       99.98 %
      D        0.03      181.88        0.00       99.98 %
      M        0.04      181.96        0.00       99.98 %
    AMcustom5        0.05        0.95        0.00       94.57 %
    all        0.03      130.13        0.00       99.97 %

    Total time in state (seconds)
    -----------------------------------------
            Pending     Running        Dead  
    -----------------------------------------
               0.24      910.90        0.00

    Data read    : 7.14 MiB
    Data written : 3.72 kiB

0: All pending notifications were processed.
INFO (IPF059): 0: Completed proof on task: "<embedded>"

==============================================================
SUMMARY
==============================================================
           Properties Considered              : 1
                 assertions                   : 1
                  - proven                    : 1 (100%)
                  - bounded_proven (user)     : 0 (0%)
                  - bounded_proven (auto)     : 0 (0%)
                  - marked_proven             : 0 (0%)
                  - cex                       : 0 (0%)
                  - ar_cex                    : 0 (0%)
                  - undetermined              : 0 (0%)
                  - unknown                   : 0 (0%)
                  - error                     : 0 (0%)
                 covers                       : 0
                  - unreachable               : 0
                  - bounded_unreachable (user): 0
                  - covered                   : 0
                  - ar_covered                : 0
                  - undetermined              : 0
                  - unknown                   : 0
                  - error                     : 0
proven
[<embedded>] % exit -force
INFO (IPL005): Received request to exit from the console.
INFO: Waiting for proof threads to stop...
INFO: Proof threads stopped.
INFO (IPL018): The peak resident set memory use for this session was 1.993 GB.
INFO (IPL014): Waiting for the Tcl-thread to exit.
INFO (IPL015): The Tcl-thread exited with status 0.
INFO (IPL016): Exiting the analysis session with status 0.
