# ----------------------------------------
# Jasper Version Info
# tool      : Jasper 2024.06
# platform  : Linux 3.10.0-1160.62.1.el7.x86_64
# version   : 2024.06p002 64 bits
# build date: 2024.09.02 16:28:38 UTC
# ----------------------------------------
# started   : 2025-11-17 20:24:45 IST
# hostname  : vlsi-ria84.vlsidomain
# pid       : 17413
# arguments : '-label' 'session_0' '-console' '//127.0.0.1:38046' '-nowindow' '-style' 'windows' '-exitonerror' '-data' 'AAAAynicY2RgYLCp////PwMYMD6A0Aw2jAyoAMRnQhUJbEChGRhYYZphSliAmItBl6GAoYghnyELyNNi0ANCfSA7HS6aypDMUMJQDBRNAbJzGBIZKhniGcyBqnmAepOA/BKgigwgXwxNhR5YJgdsFwALFBbh' '-proj' '/users/rompel/jasper_executions/safety_liveness/jgprojects/delay_7/sessionLogs/session_0' '-init' '-hidden' '/users/rompel/jasper_executions/safety_liveness/jgprojects/delay_7/.tmp/.initCmds.tcl' 'delay_7.tcl' '-hidden' '/users/rompel/jasper_executions/safety_liveness/jgprojects/delay_7/.tmp/.postCmds.tcl'

Any disclosure about the Cadence Design Systems software or its use
model to any third party violates the written Non-Disclosure Agreement
between Cadence Design Systems, Inc. and the customer.

THIS SOFTWARE CONTAINS CONFIDENTIAL INFORMATION AND TRADE SECRETS OF
CADENCE DESIGN SYSTEMS, INC. USE, DISCLOSURE, OR REPRODUCTION IS
PROHIBITED WITHOUT THE PRIOR EXPRESS WRITTEN PERMISSION OF CADENCE
DESIGN SYSTEMS, INC.

Copyright (C) 2000-2024 Cadence Design Systems, Inc. All Rights
Reserved.  Unpublished -- rights reserved under the copyright laws of
the United States.

This product includes software developed by others and redistributed
according to license agreement. See doc/third_party_readme.txt for
further details.

RESTRICTED RIGHTS LEGEND

Use, duplication, or disclosure by the Government is subject to
restrictions as set forth in subparagraph (c) (1) (ii) of the Rights in
Technical Data and Computer Software clause at DFARS 252.227-7013 or
subparagraphs (c) (1) and (2) of Commercial Computer Software -- Restricted
Rights at 48 CFR 52.227-19, as applicable.


                          Cadence Design Systems, Inc.
                          2655 Seely Avenue
                          San Jose, CA 95134
                          Phone: 408.943.1234

For technical assistance visit http://support.cadence.com.

Jasper Apps Analysis Session - /users/rompel/jasper_executions/safety_liveness/jgprojects/delay_7/sessionLogs/session_0

WARNING (WG017): [session]: The system's locale is "ANSI_X3.4-1968", which is not UTF-8. Non-ASCII characters might not be handled correctly.
WARNING (WG017): [jg_console]: The system's locale is "ANSI_X3.4-1968", which is not UTF-8. Non-ASCII characters might not be handled correctly.
INFO: successfully checked out license "jasper_fao".
INFO: reading configuration file "/users/rompel/.config/cadence/jasper.conf".
% analyze -sv09 ../delay_7.sv
[-- (VERI-1482)] Analyzing Verilog file '/tools/cadence2425/JASPER/jasper_2024.06p002/lib/verilog/packages/std/std.sv' into library 'std'
[-- (VERI-1482)] Analyzing Verilog file '../delay_7.sv'
% elaborate -bbox_mul 1000000 -bbox_div 1000000 -bbox_mod 1000000 -bbox_a 1000000
[INFO (HIER-8002)] ../delay_7.sv(13): Disabling old hierarchical reference handler
[INFO (VERI-1018)] ../delay_7.sv(1): compiling module 'DELAY'
[WARN (VERI-1209)] ../delay_7.sv(10): expression size 32 truncated to fit in target size 14
INFO (ISW003): Top module name is "DELAY".
INFO (INL208): Elaboration synthesis summary:
  Number of synthesized netlists          1 (0 packages)
  Single run mode                         On
  Pipeline                                On (1 pipelined netlists)
  Late hierarchical reference connection  On
  Number of analyzed Verilog modules      1 (1 synthesized)
  Number of analyzed VHDL entities        0 (0 synthesized)
INFO (INL003): Clearing all state information (assumes, stopats, and so forth).
DELAY
[<embedded>] % reset rst
INFO (IPM031): Clearing proof results of all properties.
INFO (IRS006): Current reset condition is "rst".
[<embedded>] % clock clk
[<embedded>] % prove -all
Ncustom1: Custom engine code is hT3Ng7hPPfiYQOTDZ3qhYOwGAM51eA+J/FjkM5shLioAsqhgLR4Ft+O1BuKG6ilQ83B9tLXSl+CwjiTMAQA
Bcustom2: Custom engine code is hT3Nm7hPr1Vp3Di1Ra2USNIGL4JypRnLKLAdF6JAyuavO2JfGCiY9OZJhcAcOUnLx5xwNdhILGrAWX9s+z2WDkKwNR7tAfClBEjRFVQeq6DU54boFgEA
AMcustom3: Custom engine code is hT3Ng7hP/feYQOTDZ3qhYOwGAM51eA+J/FjkM5shLioAsqhgLR4Ft+O1BuKG6ilQ83B9tLXSmmqwm7g9AQA
Mpcustom4: Custom engine code is hT3NZbhP9fmY2AbBQnsjfOxn6c+6e6yL+/e8fZFmaQrnlgEA
INFO (IPF036): Starting proof on task: "<embedded>", 2 properties to prove with 0 already proven/unreachable
INFO (IRS029): Starting reset analysis: phase 1 of 4.
INFO (IRS030): Running reset analysis: phase 2 of 4.
INFO (IRS031): Running reset analysis: phase 3 of 4.
INFO (IRS020): Starting the reset analysis simulation with a limit of 100 iterations (phase 4 of 4).
INFO (IRS024): Reset iterations 0 to 4 analyzed.
INFO (IRS018): Reset analysis simulation executed for 3 iterations. Assigned values for 14 of 14 design flops, 0 of 0 design latches, 6 of 6 internal elements.
INFO (IRS039): Reset analysis complete.
INFO (IPF031): Settings used for proof thread 0:
    orchestration                 = on
    time_limit                    = 86400s
    per_property_time_limit       = 1s * 10 ^ scan
    engine_mode                   = auto
    proofgrid_per_engine_max_jobs = 1
    max engine jobs               = auto
    proofgrid_mode                = local
    proofgrid_restarts            = 10
0: Using multistage preprocessing
0: Starting reduce
AMcustom5: Custom engine code is hT3N1rhP11/52HrFRS21ROp2LOjVTgPvT8L8BGXHgLhaIuqtT4nARFjUqrBL+7pLmaTOzBepZW/Jm8SSrHDybSQtoNiO3y43wk+dEoWlsZizu97Fih6O6lPVG/LpWP5SsUPwlGagLNa1FKEFvwVXyX7//8prySbvSxIHXr5er+z4RAEA
Ncustom6: Custom engine code is hT3OXrhPByJp3TrFSTLhUmMH4KVtJgmTCnNDF46yMXOKY48m4LS5nE7yBzFjA7kDuwO/GhGUpEPiky3p3wmPn3dJZHxFMsafSoObRzSC+tn7sEY0WbTdZ/FV4hL3MYH/b1CIUvXSWR4wqEoVLsmMOD4xIPT4lI1LO6ZCO7PnnWQuLwetnvKlrXx6wCW/A+x+enqslg1YPobi4wEF/EvbzOvcTYdJvl2s4H2yZg2b2ofAVN5WvhWk1HoBAA
ADcustom7: Custom engine code is hT3Nv7hPv1752HrFRa2kROx2f/ECJeZB2AZsLdlO8VwmIuqtT4nIDFXclhg+O+o+DMmQCekbheGk0kK28laA9gaOFDXsQp29J3X615HY1IPHJWd6FUFvCHjO+p1k652b5JJvZlShNpGlGSXAiQe/mEAj6tEBAA
Tricustom8: Custom engine code is hT3Nu7hPt1752DvFRa0kNDiyIV97VyejwM9C/jCLJjdPvusZONHY42VYUy0Q1ZotnhcVtNc56tJ5wbxv6V2+XpdsaSlHck5vfnbYjdwj1OECy9U+7oSQ0SZE3g5ayD+Phuh4odCJTjeKa2k4elM9ldQfkAEA
Gcustom9: Custom engine code is hT3NibhPDfeYQADBZnYcglOvK9Pfd7EOeniIqP8jNsyIqInncipMGcUXqAadachREE9F2PwhBUZUNw5kHnd4JdXkamORRgEA
C2custom10: Custom engine code is hT3NirhPjfWYQADBZnYcglOvK9Pfd7EOeniIqP8jNsyIqInncgkrYMMXCYbdK0dUjZIF9d4cJ0rHoBDjwVLBKuG86XYVV00BAA
AGcustom11: Custom engine code is hT3NirhP/fmYQADBZnYcglOvK9Pfd7EOeniIqP8jNsyIqInnckcwYMMXCYbdK0dUjZIF9d4cJ0rHoBDjwVLBKuHEZnZByh0BAA
Bcustom12: Custom engine code is hT3NjrhPDfiYQADBZnYcglOvK9PfWxFtenjIyBqfrgr7if/jL/yPOuK1BAflEcW0DxNH2eDIoezN2gxlQFg81RZtiWXh7aiTAidvAQA
0: Finished reduce in 0s
Ncustom13: Custom engine code is hT3NR7hPByFp3TrFSTLhUmMH4KWtJglTyV/c51BHEeZWamnJv767nE6PCak26bd3gf3XGN3rIRheufhDieCJQVISo+gNYUKhiUedBKGtsP/a18svAnlMJZudHxDFwK5ufsyoxsIyiAeSY2oi3tEuoDHr5gw42DFKAG3PqO3CEsl8Azzdt3pl5nGA1Ifv2H02eYsFzWb/nfp8PMb3F0krE/EgBcm8TD9Div8BAA
Tricustom14: Custom engine code is hT3Nu7hP3fiYQADBZnYcglNHp9bfd7EOeniIqP/ji8sGLQu8yhsFO+wxJ+O+R0bU8g/IewXFomyos+viQnWc2xYNYmMqpo3i40O7DaZR7qfp4YqNx26KRvQ/qx0BAA
0.0.PRE: Performing Proof Simplification...
0.0.N: clocks: 1, declared: 1, looping: 0, posedge: 1, negedge: 0, noedge: 0, bothedge: 0
0.0.N: Proof Simplification Iteration 1	[0.00 s]
0.0.PRE: A trace with 1 cycles was found. [0.00 s]
INFO (IPF047): 0.0.PRE: The cover property "DELAY.p1:precondition1" was covered in 1 cycles in 0.00 s.
0.0.N: Proof Simplification Iteration 2	[0.05 s]
0.0.PRE: A proof was found: No trace exists. [0.00 s]
INFO (IPF057): 0.0.PRE: The property ":noDeadEnd" was proven in 0.00 s.
    Use check_assumptions -show -dead_end to show this property in the property table.
0.0.PRE: A proof was found: No trace exists. [0.00 s]
INFO (IPF057): 0.0.PRE: The property ":noConflict" was proven in 0.00 s.
    Use check_assumptions -show to show this property in the property table.
INFO (IPF047): 0.0.PRE: The cover property ":live" was covered in 1 cycles in 0.00 s.
    Use check_assumptions -show -live to show this property in the property table.
0.0.PRE: Proof Simplification completed in 0.05 s
0: About to start ProofGrid in its own thread with a limit of 10000 pending notifications and a limit of 10 traces.
0: =============================== ProofGrid start ===============================
0: ProofGrid usable level: 1
0: Initial ProofGrid level: 1
0: ProofGrid is starting event handling
0.0.Hp: Proofgrid shell started at 17507@vlsi-ria84(local) jg_17413_vlsi-ria84_1
0.0.N: Proofgrid shell started at 17506@vlsi-ria84(local) jg_17413_vlsi-ria84_1
0.0.Hp: clocks: 1, declared: 1, looping: 0, posedge: 1, negedge: 0, noedge: 0, bothedge: 0
0.0.Hp: Last scan. Per property time limit: 0s
0.0.Hp: Trace Attempt  1	[0.00 s]
0.0.Hp: Trace Attempt  2	[0.00 s]
0.0.Hp: Trace Attempt  3	[0.00 s]
0.0.Hp: Trace Attempt  4	[0.00 s]
0.0.Hp: Trace Attempt  5	[0.00 s]
0.0.N: clocks: 1, declared: 1, looping: 0, posedge: 1, negedge: 0, noedge: 0, bothedge: 0
0.0.N: Last scan. Per property time limit: 0s
0.0.N: Starting proof for property "DELAY.p1"	[0.00 s].
0.0.N: Trace Attempt  1	[0.00 s]
0.0.N: Trace Attempt  2	[0.00 s]
0.0.N: Trace Attempt  2	[0.00 s]
0.0.N: Trace Attempt  3	[0.00 s]
0.0.N: Trace Attempt  4	[0.00 s]
0.0.N: Trace Attempt  4	[0.00 s]
0.0.N: Trace Attempt  5	[0.00 s]
0.0.N: Trace Attempt  1	[0.01 s]
0.0.N: Trace Attempt  2	[0.01 s]
0.0.N: Trace Attempt  3	[0.01 s]
0.0.N: Trace Attempt  4	[0.01 s]
0.0.N: Trace Attempt  5	[0.01 s]
0.0.Ht: Proofgrid shell started at 17594@vlsi-ria84(local) jg_17413_vlsi-ria84_1
0.0.Bm: Proofgrid shell started at 17595@vlsi-ria84(local) jg_17413_vlsi-ria84_1
0.0.Mpcustom4: Proofgrid shell started at 17596@vlsi-ria84(local) jg_17413_vlsi-ria84_1
0.0.Ht: clocks: 1, declared: 1, looping: 0, posedge: 1, negedge: 0, noedge: 0, bothedge: 0
0.0.Ht: Last scan. Per property time limit: 0s
0.0.Ht: Trace Attempt  1	[0.00 s]
0.0.Ht: Trace Attempt  2	[0.00 s]
0.0.Ht: Trace Attempt  3	[0.00 s]
0.0.Ht: Trace Attempt  4	[0.00 s]
0.0.Mpcustom4: clocks: 1, declared: 1, looping: 0, posedge: 1, negedge: 0, noedge: 0, bothedge: 0
0.0.Mpcustom4: Ignoring liveness properties
0.0.Mpcustom4: All properties either determined or skipped. [0.00 s]
0.0.Ht: Trace Attempt  5	[0.00 s]
0.0.Mpcustom4: Exited with Success (@ 0.04 s)
0.0.Mpcustom4: Completed, Restart ignored.
0.0.Oh: Proofgrid shell started at 17597@vlsi-ria84(local) jg_17413_vlsi-ria84_1
0.0.Oh: clocks: 1, declared: 1, looping: 0, posedge: 1, negedge: 0, noedge: 0, bothedge: 0
0.0.Oh: Reached length limit (2147483647) [0.00 s]
0.0.Oh: Exited with Success (@ 0.04 s)
0.0.Bm: clocks: 1, declared: 1, looping: 0, posedge: 1, negedge: 0, noedge: 0, bothedge: 0
0.0.Bm: Ignoring liveness properties
0.0.Bm: Last scan. Per property time limit: 0s
0.0.Bm: Trace Attempt  1	[0.00 s]
0.0.Bm: Trace Attempt  2	[0.00 s]
0.0.Bm: Trace Attempt  3	[0.00 s]
0.0.Bm: Trace Attempt  4	[0.00 s]
0.0.Bm: Trace Attempt  5	[0.00 s]
0.0.B: Proofgrid shell started at 17736@vlsi-ria84(local) jg_17413_vlsi-ria84_1
0.0.B: clocks: 1, declared: 1, looping: 0, posedge: 1, negedge: 0, noedge: 0, bothedge: 0
0.0.B: Last scan. Per property time limit: 0s
0.0.B: Starting proof for property "DELAY.p1"	[0.00 s].
0.0.B: Trace Attempt  1	[0.00 s]
0.0.B: Trace Attempt  2	[0.00 s]
0.0.B: Trace Attempt  3	[0.00 s]
0.0.B: Trace Attempt  4	[0.00 s]
0.0.B: Trace Attempt  5	[0.00 s]
0.0.AM: Proofgrid shell started at 17737@vlsi-ria84(local) jg_17413_vlsi-ria84_1
0.0.L: Proofgrid shell started at 17598@vlsi-ria84(local) jg_17413_vlsi-ria84_1
0.0.AM: clocks: 1, declared: 1, looping: 0, posedge: 1, negedge: 0, noedge: 0, bothedge: 0
0.0.AM: Last scan. Per property time limit: 0s
0.0.AM: Starting proof for property "DELAY.p1"	[0.00 s].
0.0.AM: Trace Attempt  1	[0.00 s]
0.0.AM: Trace Attempt  2	[0.00 s]
0.0.AM: Trace Attempt  3	[0.00 s]
0.0.AM: Trace Attempt  4	[0.00 s]
0.0.AM: Trace Attempt  5	[0.00 s]
0.0.AM: Trace Attempt  1	[0.00 s]
0.0.AM: Trace Attempt  2	[0.00 s]
0.0.AM: Trace Attempt  3	[0.00 s]
0.0.L: clocks: 1, declared: 1, looping: 0, posedge: 1, negedge: 0, noedge: 0, bothedge: 0
0.0.L: Using trace diversification with seed 1 (0.05)
0.0.L: Using LRU state removal heuristic
0.0.L: Ignoring liveness properties
0.0.L: All properties either determined or skipped. [0.00 s]
0.0.AM: Trace Attempt  4	[0.00 s]
0.0.L: Exited with Success (@ 0.08 s)
0.0.L: Completed, Restart ignored.
0.0.AM: Trace Attempt  5	[0.00 s]
0.0.AM: Trace Attempt  1	[0.01 s]
0.0.AM: Trace Attempt  2	[0.01 s]
0.0.AM: Trace Attempt  3	[0.01 s]
0.0.AM: Trace Attempt  4	[0.01 s]
0.0.AM: Trace Attempt  5	[0.01 s]
0.0.AM: Trace Attempt  1	[0.03 s]
0.0.AM: Trace Attempt  2	[0.03 s]
0.0.AM: Trace Attempt  3	[0.03 s]
0.0.N: Trace Attempt  1	[0.10 s]
0.0.N: Trace Attempt  2	[0.10 s]
0.0.N: Trace Attempt  3	[0.10 s]
0.0.AM: Trace Attempt  4	[0.03 s]
0.0.AM: Trace Attempt  5	[0.03 s]
0.0.N: Trace Attempt  4	[0.10 s]
0.0.N: Trace Attempt  5	[0.10 s]
0.0.AM: Trace Attempt  1	[0.10 s]
0.0.AM: Trace Attempt  2	[0.10 s]
0.0.AM: Trace Attempt  3	[0.10 s]
0.0.AM: Trace Attempt  4	[0.10 s]
0.0.AM: Trace Attempt  5	[0.10 s]
0.0.N: Trace Attempt  1	[0.45 s]
0.0.N: Trace Attempt  2	[0.45 s]
0.0.N: Trace Attempt  3	[0.45 s]
0.0.N: Trace Attempt  4	[0.45 s]
0.0.N: Trace Attempt  5	[0.46 s]
0.0.AM: Trace Attempt  1	[0.47 s]
0.0.AM: Trace Attempt  2	[0.47 s]
0.0.AM: Trace Attempt  3	[0.47 s]
0.0.AM: Trace Attempt  4	[0.47 s]
0.0.AM: Trace Attempt  5	[0.47 s]
0.0.N: Trace Attempt  1	[1.67 s]
0.0.N: Trace Attempt  2	[1.67 s]
0.0.N: Trace Attempt  3	[1.67 s]
0.0.N: Trace Attempt  4	[1.67 s]
0.0.N: Trace Attempt  5	[1.67 s]
0.0.AM: Trace Attempt  1	[1.77 s]
0.0.AM: Trace Attempt  2	[1.77 s]
0.0.AM: Trace Attempt  3	[1.77 s]
0.0.AM: Trace Attempt  4	[1.77 s]
0.0.AM: Trace Attempt  5	[1.77 s]
0.0.N: Trace Attempt  1	[2.86 s]
0.0.N: Trace Attempt  2	[2.86 s]
0.0.N: Trace Attempt  3	[2.86 s]
0.0.N: Trace Attempt  4	[2.87 s]
0.0.N: Trace Attempt  5	[2.87 s]
0.0.Hp: Trace Attempt 615	[4.01 s]
0.0.Ht: Trace Attempt 1816	[4.00 s]
0.0.Bm: Trace Attempt 1691	[4.00 s]
0.0.B: Trace Attempt 1713	[4.00 s]
0.0.N: Trace Attempt  1	[4.08 s]
0.0.N: Trace Attempt  2	[4.08 s]
0.0.N: Trace Attempt  3	[4.08 s]
0.0.N: Trace Attempt  4	[4.08 s]
0.0.N: Trace Attempt  5	[4.08 s]
0.0.N: Trace Attempt  1	[5.29 s]
0.0.N: Trace Attempt  2	[5.29 s]
0.0.N: Trace Attempt  3	[5.29 s]
0.0.N: Trace Attempt  4	[5.29 s]
0.0.N: Trace Attempt  5	[5.29 s]
0.0.AM: Trace Attempt 202	[5.78 s]
0.0.N: Trace Attempt  1	[6.50 s]
0.0.N: Trace Attempt  2	[6.50 s]
0.0.N: Trace Attempt  3	[6.50 s]
0.0.N: Trace Attempt  4	[6.50 s]
0.0.N: Trace Attempt  5	[6.50 s]
0.0.N: Trace Attempt  1	[7.71 s]
0.0.N: Trace Attempt  2	[7.71 s]
0.0.N: Trace Attempt  3	[7.71 s]
0.0.N: Trace Attempt  4	[7.71 s]
0.0.N: Trace Attempt  5	[7.72 s]
0.0.AM: Trace Attempt  1	[7.86 s]
0.0.AM: Trace Attempt  2	[7.86 s]
0.0.AM: Trace Attempt  3	[7.86 s]
0.0.AM: Trace Attempt  4	[7.87 s]
0.0.AM: Trace Attempt  5	[7.87 s]
0.0.Hp: Trace Attempt 859	[8.01 s]
0.0.Ht: Trace Attempt 2456	[8.00 s]
0.0.Bm: Trace Attempt 2340	[8.00 s]
0.0.B: Trace Attempt 2368	[8.00 s]
0.0.N: Trace Attempt  1	[8.91 s]
0.0.N: Trace Attempt  2	[8.91 s]
0.0.N: Trace Attempt  3	[8.91 s]
0.0.N: Trace Attempt  4	[8.91 s]
0.0.N: Trace Attempt  5	[8.91 s]
0.0.N: Trace Attempt  1	[10.11 s]
0.0.N: Trace Attempt  2	[10.11 s]
0.0.N: Trace Attempt  3	[10.11 s]
0.0.N: Trace Attempt  4	[10.11 s]
0.0.N: Trace Attempt  5	[10.11 s]
0.0.N: Trace Attempt  1	[11.47 s]
0.0.N: Trace Attempt  2	[11.47 s]
0.0.N: Trace Attempt  3	[11.47 s]
0.0.N: Trace Attempt  4	[11.47 s]
0.0.N: Trace Attempt  5	[11.47 s]
0.0.AM: Trace Attempt 203	[11.87 s]
0.0.Hp: Trace Attempt 1048	[12.02 s]
0.0.Ht: Trace Attempt 2979	[12.01 s]
0.0.Bm: Trace Attempt 2849	[12.01 s]
0.0.B: Trace Attempt 2871	[12.01 s]
0.0.N: Trace Attempt 193	[15.51 s]
0.0.AM: Trace Attempt 260	[15.89 s]
0.0.Hp: Trace Attempt 1205	[16.04 s]
0.0.Ht: Trace Attempt 3396	[16.01 s]
0.0.Bm: Trace Attempt 3264	[16.02 s]
0.0.B: Trace Attempt 3278	[16.01 s]
0.0.N: Trace Attempt  1	[17.60 s]
0.0.N: Trace Attempt  2	[17.60 s]
0.0.N: Trace Attempt  3	[17.60 s]
0.0.N: Trace Attempt  4	[17.60 s]
0.0.N: Trace Attempt  5	[17.60 s]
0.0.AM: Trace Attempt 315	[19.97 s]
0.0.Ht: Trace Attempt 3780	[20.02 s]
0.0.Bm: Trace Attempt 3629	[20.02 s]
0.0.B: Trace Attempt 3639	[20.02 s]
0.0.Hp: Trace Attempt 1315	[20.09 s]
0.0.N: Trace Attempt 194	[21.63 s]
0.0.N: Trace Attempt  1	[23.57 s]
0.0.N: Trace Attempt  2	[23.57 s]
0.0.N: Trace Attempt  3	[23.57 s]
0.0.N: Trace Attempt  4	[23.57 s]
0.0.N: Trace Attempt  5	[23.57 s]
0.0.AM: Trace Attempt 355	[23.98 s]
0.0.Ht: Trace Attempt 4118	[24.04 s]
0.0.Bm: Trace Attempt 3957	[24.03 s]
0.0.B: Trace Attempt 3960	[24.03 s]
0.0.Hp: Trace Attempt 1357	[24.13 s]
0.0.N: Trace Attempt 194	[27.60 s]
0.0.Bm: Trace Attempt 4265	[28.03 s]
0.0.Ht: Trace Attempt 4419	[28.04 s]
0.0.B: Trace Attempt 4261	[28.03 s]
0.0.AM: Trace Attempt 392	[28.01 s]
0.0.Hp: Trace Attempt 1398	[28.20 s]
0.0.N: Trace Attempt  1	[29.55 s]
0.0.N: Trace Attempt  2	[29.55 s]
0.0.N: Trace Attempt  3	[29.55 s]
0.0.N: Trace Attempt  4	[29.55 s]
0.0.N: Trace Attempt  5	[29.55 s]
0.0.Bm: Trace Attempt 4553	[32.04 s]
0.0.B: Trace Attempt 4545	[32.03 s]
0.0.Ht: Trace Attempt 4714	[32.05 s]
0.0.Hp: Trace Attempt 1434	[32.20 s]
0.0.AM: Trace Attempt 424	[32.13 s]
0.0.N: Trace Attempt 194	[33.55 s]
0.0.N: Trace Attempt  1	[35.48 s]
0.0.N: Trace Attempt  2	[35.48 s]
0.0.N: Trace Attempt  3	[35.48 s]
0.0.N: Trace Attempt  4	[35.49 s]
0.0.N: Trace Attempt  5	[35.49 s]
0.0.Bm: Trace Attempt 4817	[36.04 s]
0.0.B: Trace Attempt 4807	[36.04 s]
0.0.Ht: Trace Attempt 4984	[36.07 s]
0.0.AM: Trace Attempt 456	[36.17 s]
0.0.Hp: Trace Attempt 1470	[36.25 s]
0.0.N: Trace Attempt 194	[39.51 s]
0.0.Bm: Trace Attempt 5047	[40.05 s]
0.0.B: Trace Attempt 5034	[40.04 s]
0.0.Ht: Trace Attempt 5216	[40.07 s]
0.0.Hp: Trace Attempt 1503	[40.31 s]
0.0.N: Trace Attempt  1	[41.45 s]
0.0.N: Trace Attempt  2	[41.45 s]
0.0.N: Trace Attempt  3	[41.45 s]
0.0.N: Trace Attempt  4	[41.46 s]
0.0.N: Trace Attempt  5	[41.46 s]
0.0.AM: Trace Attempt 513	[43.02 s]
0.0.AM: Trace Attempt  1	[43.42 s]
0.0.AM: Trace Attempt  2	[43.42 s]
0.0.AM: Trace Attempt  3	[43.42 s]
0.0.AM: Trace Attempt  4	[43.42 s]
0.0.AM: Trace Attempt  5	[43.42 s]
0.0.Bm: Trace Attempt 5265	[44.06 s]
0.0.B: Trace Attempt 5250	[44.05 s]
0.0.Ht: Trace Attempt 5442	[44.08 s]
0.0.Hp: Trace Attempt 1536	[44.39 s]
0.0.N: Trace Attempt 194	[45.47 s]
0.0.N: Trace Attempt  1	[47.38 s]
0.0.N: Trace Attempt  2	[47.38 s]
0.0.N: Trace Attempt  3	[47.38 s]
0.0.N: Trace Attempt  4	[47.38 s]
0.0.N: Trace Attempt  5	[47.38 s]
0.0.AM: Trace Attempt 184	[47.45 s]
0.0.Bm: Trace Attempt 5491	[48.06 s]
0.0.B: Trace Attempt 5474	[48.06 s]
0.0.Ht: Trace Attempt 5685	[48.10 s]
0.0.Hp: Trace Attempt 1574	[48.47 s]
0.0.N: Trace Attempt 194	[51.40 s]
0.0.AM: Trace Attempt 247	[51.45 s]
0.0.Bm: Trace Attempt 5713	[52.07 s]
0.0.B: Trace Attempt 5697	[52.07 s]
0.0.Ht: Trace Attempt 5916	[52.12 s]
0.0.Hp: Trace Attempt 1611	[52.55 s]
0.0.N: Trace Attempt  1	[53.90 s]
0.0.N: Trace Attempt  2	[53.90 s]
0.0.N: Trace Attempt  3	[53.90 s]
0.0.N: Trace Attempt  4	[53.90 s]
0.0.N: Trace Attempt  5	[53.90 s]
0.0.AM: Trace Attempt 286	[55.49 s]
0.0.Bm: Trace Attempt 5923	[56.07 s]
0.0.B: Trace Attempt 5908	[56.07 s]
0.0.Ht: Trace Attempt 6136	[56.12 s]
0.0.Hp: Trace Attempt 1647	[56.64 s]
0.0.N: Trace Attempt 197	[57.90 s]
0.0.AM: Trace Attempt 327	[59.51 s]
0.0.Bm: Trace Attempt 6128	[60.08 s]
0.0.B: Trace Attempt 6114	[60.07 s]
0.0.Ht: Trace Attempt 6340	[60.13 s]
0.0.Hp: Trace Attempt 1682	[60.71 s]
0.0.N: Trace Attempt 252	[61.91 s]
0.0.AM: Trace Attempt 366	[63.59 s]
0.0.Bm: Trace Attempt 6320	[64.09 s]
0.0.B: Trace Attempt 6306	[64.07 s]
0.0.Ht: Trace Attempt 6540	[64.13 s]
0.0.Hp: Trace Attempt 1716	[64.75 s]
0.0.N: Trace Attempt 302	[65.94 s]
0.0.AM: Trace Attempt 411	[67.69 s]
0.0.Bm: Trace Attempt 6503	[68.09 s]
0.0.B: Trace Attempt 6489	[68.08 s]
0.0.Ht: Trace Attempt 6732	[68.14 s]
0.0.Hp: Trace Attempt 1749	[68.80 s]
0.0.N: Trace Attempt 343	[70.08 s]
0.0.AM: Trace Attempt 446	[71.71 s]
0.0.Bm: Trace Attempt 6679	[72.09 s]
0.0.B: Trace Attempt 6665	[72.08 s]
0.0.Ht: Trace Attempt 6923	[72.15 s]
0.0.Hp: Trace Attempt 1781	[72.81 s]
0.0.N: Trace Attempt 375	[74.13 s]
0.0.AM: Trace Attempt 471	[75.83 s]
0.0.Bm: Trace Attempt 6848	[76.11 s]
0.0.B: Trace Attempt 6833	[76.10 s]
0.0.Ht: Trace Attempt 7102	[76.16 s]
0.0.Hp: Trace Attempt 1810	[76.82 s]
0.0.N: Trace Attempt 414	[78.17 s]
0.0.Bm: Trace Attempt 7015	[80.12 s]
0.0.B: Trace Attempt 6999	[80.12 s]
0.0.Ht: Trace Attempt 7277	[80.17 s]
0.0.AM: Trace Attempt 480	[80.22 s]
0.0.Hp: Trace Attempt 1838	[80.88 s]
0.0.N: Trace Attempt 448	[82.26 s]
0.0.Bm: Trace Attempt 7178	[84.14 s]
0.0.B: Trace Attempt 7160	[84.15 s]
0.0.Ht: Trace Attempt 7442	[84.18 s]
0.0.AM: Trace Attempt 489	[84.42 s]
0.0.Hp: Trace Attempt 1862	[84.96 s]
0.0.N: Trace Attempt 483	[86.26 s]
0.0.Bm: Trace Attempt 7330	[88.14 s]
0.0.B: Trace Attempt 7311	[88.15 s]
0.0.Ht: Trace Attempt 7600	[88.20 s]
0.0.N: Trace Attempt  1	[88.50 s]
0.0.N: Trace Attempt  2	[88.50 s]
0.0.N: Trace Attempt  3	[88.50 s]
0.0.N: Trace Attempt  4	[88.50 s]
0.0.N: Trace Attempt  5	[88.50 s]
0.0.AM: Trace Attempt 500	[88.49 s]
0.0.Hp: Trace Attempt 1886	[88.97 s]
0.0.Bm: Trace Attempt 7485	[92.14 s]
0.0.B: Trace Attempt 7465	[92.17 s]
0.0.Ht: Trace Attempt 7768	[92.22 s]
0.0.N: Trace Attempt 198	[92.53 s]
0.0.AM: Trace Attempt 517	[92.56 s]
0.0.Hp: Trace Attempt 1911	[93.06 s]
0.0.Bm: Trace Attempt 7637	[96.15 s]
0.0.B: Trace Attempt 7616	[96.18 s]
0.0.Ht: Trace Attempt 7934	[96.24 s]
0.0.N: Trace Attempt 253	[96.62 s]
0.0.AM: Trace Attempt 530	[96.74 s]
0.0.Hp: Trace Attempt 1935	[97.07 s]
0.0.Bm: Trace Attempt 7785	[100.16 s]
0.0.B: Trace Attempt 7763	[100.20 s]
0.0.Ht: Trace Attempt 8092	[100.25 s]
0.0.N: Trace Attempt 303	[100.63 s]
0.0.AM: Trace Attempt 543	[100.86 s]
0.0.Hp: Trace Attempt 1959	[101.18 s]
0.0.Bm: Trace Attempt 7929	[104.18 s]
0.0.B: Trace Attempt 7905	[104.21 s]
0.0.Ht: Trace Attempt 8237	[104.25 s]
0.0.N: Trace Attempt 343	[104.69 s]
0.0.AM: Trace Attempt 558	[105.08 s]
0.0.Hp: Trace Attempt 1983	[105.34 s]
0.0.Bm: Trace Attempt 8070	[108.19 s]
0.0.B: Trace Attempt 8045	[108.21 s]
0.0.Ht: Trace Attempt 8387	[108.26 s]
0.0.N: Trace Attempt 375	[108.78 s]
0.0.Hp: Trace Attempt 2006	[109.39 s]
0.0.AM: Trace Attempt 568	[109.32 s]
0.0.Bm: Trace Attempt 8207	[112.19 s]
0.0.B: Trace Attempt 8181	[112.24 s]
0.0.Ht: Trace Attempt 8532	[112.26 s]
0.0.N: Trace Attempt 413	[112.82 s]
0.0.Hp: Trace Attempt 2029	[113.56 s]
0.0.AM: Trace Attempt 581	[113.63 s]
0.0.Bm: Trace Attempt 8349	[116.21 s]
0.0.Ht: Trace Attempt 8677	[116.28 s]
0.0.B: Trace Attempt 8322	[116.25 s]
0.0.N: Trace Attempt 446	[116.83 s]
0.0.Hp: Trace Attempt 2053	[117.56 s]
0.0.AM: Trace Attempt 590	[117.89 s]
0.0.Bm: Trace Attempt 8487	[120.23 s]
0.0.Ht: Trace Attempt 8823	[120.28 s]
0.0.B: Trace Attempt 8459	[120.26 s]
0.0.N: Trace Attempt 481	[120.92 s]
0.0.Hp: Trace Attempt 2077	[121.71 s]
0.0.AM: Trace Attempt 600	[122.05 s]
0.0.Bm: Trace Attempt 8617	[124.23 s]
0.0.B: Trace Attempt 8589	[124.28 s]
0.0.Ht: Trace Attempt 8963	[124.31 s]
0.0.N: Trace Attempt 491	[125.62 s]
0.0.N: Trace Attempt  1	[125.64 s]
0.0.N: Trace Attempt  2	[125.64 s]
0.0.N: Trace Attempt  3	[125.64 s]
0.0.N: Trace Attempt  4	[125.64 s]
0.0.N: Trace Attempt  5	[125.64 s]
0.0.Hp: Trace Attempt 2103	[125.90 s]
0.0.AM: Trace Attempt 609	[126.25 s]
0.0.Bm: Trace Attempt 8751	[128.25 s]
0.0.B: Trace Attempt 8722	[128.29 s]
0.0.Ht: Trace Attempt 9103	[128.33 s]
0.0.N: Trace Attempt 198	[129.67 s]
0.0.Hp: Trace Attempt 2130	[130.07 s]
0.0.AM: Trace Attempt 619	[130.40 s]
0.0.Bm: Trace Attempt 8884	[132.27 s]
0.0.B: Trace Attempt 8855	[132.32 s]
0.0.Ht: Trace Attempt 9237	[132.34 s]
0.0.N: Trace Attempt 253	[133.76 s]
0.0.Hp: Trace Attempt 2156	[134.22 s]
0.0.AM: Trace Attempt 630	[135.17 s]
0.0.Bm: Trace Attempt 9015	[136.28 s]
0.0.B: Trace Attempt 8986	[136.35 s]
0.0.Ht: Trace Attempt 9369	[136.38 s]
0.0.N: Trace Attempt 303	[137.78 s]
0.0.Hp: Trace Attempt 2179	[138.27 s]
0.0.AM: Trace Attempt 639	[139.35 s]
0.0.Bm: Trace Attempt 9144	[140.30 s]
0.0.Ht: Trace Attempt 9498	[140.39 s]
0.0.B: Trace Attempt 9114	[140.38 s]
0.0.N: Trace Attempt 343	[141.84 s]
0.0.Hp: Trace Attempt 2202	[142.33 s]
0.0.AM: Trace Attempt 647	[143.37 s]
0.0.Bm: Trace Attempt 9271	[144.32 s]
0.0.Ht: Trace Attempt 9626	[144.40 s]
0.0.B: Trace Attempt 9241	[144.39 s]
0.0.N: Trace Attempt 375	[145.94 s]
0.0.Hp: Trace Attempt 2227	[146.41 s]
0.0.AM: Trace Attempt 655	[147.42 s]
0.0.Bm: Trace Attempt 9394	[148.32 s]
0.0.Ht: Trace Attempt 9757	[148.42 s]
0.0.B: Trace Attempt 9364	[148.40 s]
0.0.N: Trace Attempt 414	[150.00 s]
0.0.Hp: Trace Attempt 2252	[150.59 s]
0.0.AM: Trace Attempt 663	[151.53 s]
0.0.Bm: Trace Attempt 9516	[152.32 s]
0.0.B: Trace Attempt 9485	[152.41 s]
0.0.Ht: Trace Attempt 9885	[152.44 s]
0.0.N: Trace Attempt 447	[154.01 s]
0.0.Hp: Trace Attempt 2272	[154.61 s]
0.0.AM: Trace Attempt 671	[155.84 s]
0.0.Bm: Trace Attempt 9634	[156.35 s]
0.0.B: Trace Attempt 9602	[156.41 s]
0.0.Ht: Trace Attempt 10010	[156.45 s]
0.0.N: Trace Attempt 482	[158.12 s]
0.0.Hp: Trace Attempt 2296	[158.77 s]
0.0.AM: Trace Attempt 679	[160.02 s]
0.0.Bm: Trace Attempt 9748	[160.38 s]
0.0.B: Trace Attempt 9715	[160.43 s]
0.0.Ht: Trace Attempt 10130	[160.47 s]
0.0.N: Trace Attempt  1	[161.99 s]
0.0.N: Trace Attempt  2	[161.99 s]
0.0.N: Trace Attempt  3	[161.99 s]
0.0.N: Trace Attempt  4	[161.99 s]
0.0.N: Trace Attempt  5	[162.00 s]
0.0.Hp: Trace Attempt 2316	[162.96 s]
0.0.AM: Trace Attempt 686	[164.14 s]
0.0.Bm: Trace Attempt 9866	[164.40 s]
0.0.B: Trace Attempt 9832	[164.44 s]
0.0.Ht: Trace Attempt 10251	[164.51 s]
0.0.N: Trace Attempt 198	[166.02 s]
0.0.Hp: Trace Attempt 2337	[167.09 s]
0.0.Bm: Trace Attempt 9985	[168.43 s]
0.0.B: Trace Attempt 9950	[168.45 s]
0.0.Ht: Trace Attempt 10370	[168.51 s]
0.0.AM: Trace Attempt 693	[168.50 s]
0.0.N: Trace Attempt 253	[170.12 s]
0.0.Hp: Trace Attempt 2358	[171.25 s]
0.0.Bm: Trace Attempt 10102	[172.44 s]
0.0.B: Trace Attempt 10066	[172.45 s]
0.0.Ht: Trace Attempt 10488	[172.53 s]
0.0.AM: Trace Attempt 700	[172.67 s]
0.0.N: Trace Attempt 303	[174.15 s]
0.0.Hp: Trace Attempt 2378	[175.26 s]
0.0.Bm: Trace Attempt 10216	[176.47 s]
0.0.B: Trace Attempt 10180	[176.49 s]
0.0.Ht: Trace Attempt 10598	[176.54 s]
0.0.AM: Trace Attempt 708	[176.76 s]
0.0.N: Trace Attempt 343	[178.21 s]
0.0.Hp: Trace Attempt 2398	[179.35 s]
0.0.Bm: Trace Attempt 10325	[180.48 s]
0.0.B: Trace Attempt 10290	[180.50 s]
0.0.Ht: Trace Attempt 10712	[180.55 s]
0.0.N: Trace Attempt 364	[180.83 s]
0.0.N: Stopped processing property "DELAY.p1"	[180.96 s].
0.0.N: Morphing to Ncustom1
0.0.N: All properties determined. [0.00 s]
0.0.N: Exited with Success (@ 0.00 s)
0.0.Ncustom1: clocks: 1, declared: 1, looping: 0, posedge: 1, negedge: 0, noedge: 0, bothedge: 0
0.0.Ncustom1: Starting proof for property "DELAY.p1"	[0.00 s].
0.0.Ncustom1: Trace Attempt 491	[0.04 s]
0.0.D: Proofgrid shell started at 18459@vlsi-ria84(local) jg_17413_vlsi-ria84_1
0.0.Tri: Proofgrid shell started at 18458@vlsi-ria84(local) jg_17413_vlsi-ria84_1
0.0.Tri: clocks: 1, declared: 1, looping: 0, posedge: 1, negedge: 0, noedge: 0, bothedge: 0
0.0.D: clocks: 1, declared: 1, looping: 0, posedge: 1, negedge: 0, noedge: 0, bothedge: 0
0.0.D: Last scan. Per property time limit: 0s
0.0.D: Starting proof for property "DELAY.p1"	[0.00 s].
0.0.D: Trace Attempt  1	[0.00 s]
0.0.D: Trace Attempt  2	[0.00 s]
0.0.D: Trace Attempt  4	[0.00 s]
0.0.Tri: Last scan. Per property time limit: 0s
0.0.Tri: Starting proof for property "DELAY.p1"	[0.00 s].
0.0.Tri: Trace Attempt  1	[0.00 s]
0.0.B: Trace Attempt 10300	[180.87 s]
0.0.B: Stopped processing property "DELAY.p1"	[181.06 s].
0.0.B: Morphing to Bcustom2
0.0.B: All properties determined. [0.00 s]
0.0.B: Exited with Success (@ 0.00 s)
0.0.Bcustom2: clocks: 1, declared: 1, looping: 0, posedge: 1, negedge: 0, noedge: 0, bothedge: 0
0.0.Bcustom2: Starting proof for property "DELAY.p1"	[0.00 s].
0.0.Bcustom2: Trace Attempt  1	[0.00 s]
0.0.Bcustom2: Trace Attempt  2	[0.00 s]
0.0.Bcustom2: Trace Attempt  1	[0.00 s]
0.0.Bcustom2: Trace Attempt  2	[0.00 s]
0.0.Bcustom2: Trace Attempt  3	[0.00 s]
0.0.Bcustom2: Trace Attempt  4	[0.00 s]
0.0.Bcustom2: Trace Attempt  5	[0.00 s]
0.0.Bcustom2: Trace Attempt  1	[0.00 s]
0.0.Bcustom2: Trace Attempt  2	[0.00 s]
0.0.Bcustom2: Trace Attempt  3	[0.00 s]
0.0.Bcustom2: Trace Attempt  4	[0.00 s]
0.0.Bcustom2: Trace Attempt  5	[0.00 s]
0.0.Bcustom2: Trace Attempt  1	[0.01 s]
0.0.Bcustom2: Trace Attempt  2	[0.01 s]
0.0.Bcustom2: Trace Attempt  3	[0.01 s]
0.0.Bcustom2: Trace Attempt  4	[0.01 s]
0.0.Bcustom2: Trace Attempt  5	[0.01 s]
0.0.AM: Trace Attempt 716	[180.59 s]
0.0.AM: Stopped processing property "DELAY.p1"	[181.04 s].
0.0.AM: Morphing to AMcustom3
0.0.Bcustom2: Trace Attempt  1	[0.01 s]
0.0.Bcustom2: Trace Attempt  2	[0.01 s]
0.0.Bcustom2: Trace Attempt  3	[0.01 s]
0.0.Bcustom2: Trace Attempt  4	[0.01 s]
0.0.Bcustom2: Trace Attempt  5	[0.01 s]
0.0.Tri:    0.00" ---- Launching main thread ----
0.0.Bcustom2: Trace Attempt  1	[0.02 s]
0.0.Bcustom2: Trace Attempt  2	[0.02 s]
0.0.Bcustom2: Trace Attempt  3	[0.02 s]
0.0.Bcustom2: Trace Attempt  4	[0.02 s]
0.0.Bcustom2: Trace Attempt  5	[0.02 s]
0.0.AM: All properties determined. [0.00 s]
0.0.AM: Exited with Success (@ 0.00 s)
0.0.AMcustom3: clocks: 1, declared: 1, looping: 0, posedge: 1, negedge: 0, noedge: 0, bothedge: 0
0.0.AMcustom3: Starting proof for property "DELAY.p1"	[0.00 s].
0.0.AMcustom3: Trace Attempt  1	[0.00 s]
0.0.AMcustom3: Trace Attempt  2	[0.00 s]
0.0.AMcustom3: Trace Attempt  3	[0.00 s]
0.0.AMcustom3: Trace Attempt  4	[0.00 s]
0.0.AMcustom3: Trace Attempt  5	[0.00 s]
0.0.AMcustom3: Trace Attempt  1	[0.00 s]
0.0.AMcustom3: Trace Attempt  2	[0.00 s]
0.0.AMcustom3: Trace Attempt  3	[0.00 s]
0.0.AMcustom3: Trace Attempt  4	[0.00 s]
0.0.AMcustom3: Trace Attempt  5	[0.00 s]
0.0.AMcustom3: Trace Attempt  1	[0.01 s]
0.0.AMcustom3: Trace Attempt  2	[0.01 s]
0.0.Bcustom2: Trace Attempt  1	[0.04 s]
0.0.Bcustom2: Trace Attempt  2	[0.04 s]
0.0.Bcustom2: Trace Attempt  3	[0.04 s]
0.0.Bcustom2: Trace Attempt  4	[0.04 s]
0.0.Bcustom2: Trace Attempt  5	[0.04 s]
0.0.AMcustom3: Trace Attempt  3	[0.01 s]
0.0.AMcustom3: Trace Attempt  4	[0.01 s]
0.0.AMcustom3: Trace Attempt  5	[0.01 s]
0.0.AMcustom3: Trace Attempt  1	[0.03 s]
0.0.AMcustom3: Trace Attempt  2	[0.03 s]
0.0.AMcustom3: Trace Attempt  3	[0.03 s]
0.0.AMcustom3: Trace Attempt  4	[0.04 s]
0.0.AMcustom3: Trace Attempt  5	[0.04 s]
0.0.Bcustom2: Trace Attempt  1	[0.09 s]
0.0.Bcustom2: Trace Attempt  2	[0.09 s]
0.0.Bcustom2: Trace Attempt  3	[0.09 s]
0.0.Bcustom2: Trace Attempt  4	[0.09 s]
0.0.Bcustom2: Trace Attempt  5	[0.09 s]
0.0.Tri:    0.09" ---- Launching abstraction thread ----
0.0.Tri:    0.09" ---- Launching multi-phase simplification thread ----
0.0.AMcustom3: Trace Attempt  1	[0.11 s]
0.0.AMcustom3: Trace Attempt  2	[0.12 s]
0.0.AMcustom3: Trace Attempt  3	[0.12 s]
0.0.AMcustom3: Trace Attempt  4	[0.12 s]
0.0.AMcustom3: Trace Attempt  5	[0.12 s]
0.0.Tri:    0.14" ---- Launching liveness simplification thread ----
0.0.Bcustom2: Trace Attempt  1	[0.28 s]
0.0.Bcustom2: Trace Attempt  2	[0.28 s]
0.0.Bcustom2: Trace Attempt  3	[0.28 s]
0.0.Bcustom2: Trace Attempt  4	[0.28 s]
0.0.Bcustom2: Trace Attempt  5	[0.28 s]
0.0.AMcustom3: Trace Attempt  1	[0.55 s]
0.0.AMcustom3: Trace Attempt  2	[0.55 s]
0.0.AMcustom3: Trace Attempt  3	[0.55 s]
0.0.AMcustom3: Trace Attempt  4	[0.55 s]
0.0.AMcustom3: Trace Attempt  5	[0.55 s]
0.0.Tri:    0.95" Simplification phase 1 complete
0.0.Ncustom1: Requesting engine job to terminate
0.0.Bcustom2: Requesting engine job to terminate
0.0.AMcustom3: Requesting engine job to terminate
0.0.Tri: Requesting engine job to terminate
0.0.D: Requesting engine job to terminate
0.0.Hp: Requesting engine job to terminate
0.0.Ht: Requesting engine job to terminate
0.0.Bm: Requesting engine job to terminate
INFO (IPF144): 0: Initiating shutdown of proof [182.13 s]
0.0.Tri: A proof was found: No trace exists. [1.03 s]
INFO (IPF057): 0.0.Tri: The property "DELAY.p1" was proven in 1.04 s.
0.0.D: Trace Attempt 64	[0.73 s]
0.0.D: Stopped processing property "DELAY.p1"	[1.05 s].
0.0.D: All properties determined. [1.06 s]
0.0.D: Exited with Success (@ 182.13 s)
0: ProofGrid usable level: 0
0.0.AMcustom3: Trace Attempt 62	[0.96 s]
0.0.AMcustom3: Stopped processing property "DELAY.p1"	[0.99 s].
0.0.AMcustom3: All properties determined. [0.99 s]
0.0.AMcustom3: Exited with Success (@ 182.14 s)
0.0.Ncustom1: Stopped processing property "DELAY.p1"	[1.16 s].
0.0.Ncustom1: All properties determined. [1.16 s]
0.0.Ncustom1: Exited with Success (@ 182.14 s)
0.0.Hp: Trace Attempt 2411	[182.10 s]
0.0.Hp: All properties determined. [182.15 s]
0.0.Ht: Trace Attempt 10759	[182.08 s]
0.0.Ht: All properties determined. [182.12 s]
0.0.Bm: Trace Attempt 10367	[182.08 s]
0.0.Bm: All properties determined. [182.18 s]
0.0.Bm: Exited with Success (@ 182.23 s)
0.0.Ht: Exited with Success (@ 182.28 s)
0.0.Hp: Exited with Success (@ 182.33 s)
0.0.Tri: Stopped processing property "DELAY.p1"	[1.24 s].
0.0.Tri: All properties determined. [1.24 s]
0.0.Tri: Exited with Success (@ 182.58 s)
0.0.Bcustom2: Trace Attempt  1	[2.15 s]
0.0.Bcustom2: Stopped processing property "DELAY.p1"	[2.15 s].
0.0.Bcustom2: All properties determined. [2.15 s]
0.0.Bcustom2: Exited with Success (@ 183.28 s)
0: --------------------------------------------------------------
ProofGrid Summary (utilization 99.95 %)
--------------------------------------------------------------
     engines started                               :    14
     engine jobs started                           :    11

    Average time in state (seconds)
    ------------------------------------------------------
    Engine  Pending     Running        Dead    Utilization
    ------------------------------------------------------
     Hp        0.03      182.13        0.00       99.98 %
     Ht        0.03      182.10        0.00       99.98 %
     Bm        0.03      182.10        0.00       99.98 %
    Mpcustom4        0.03        0.00        0.00        5.39 %
     Oh        0.03        0.00        0.00        0.56 %
      L        0.08        0.01        0.00        6.50 %
    Ncustom1        0.03      182.07        0.00       99.98 %
    Bcustom2        0.04      181.92        0.00       99.98 %
    AMcustom3        0.06      181.88        0.00       99.97 %
    Tri        0.10        1.06        0.00       91.18 %
      D        0.09        1.06        0.00       91.86 %
    all        0.05       99.48        0.00       99.95 %

    Total time in state (seconds)
    -----------------------------------------
            Pending     Running        Dead  
    -----------------------------------------
               0.57     1094.33        0.00

    Data read    : 6.59 MiB
    Data written : 4.07 kiB

0: All pending notifications were processed.
INFO (IPF059): 0: Completed proof on task: "<embedded>"

==============================================================
SUMMARY
==============================================================
           Properties Considered              : 2
                 assertions                   : 1
                  - proven                    : 1 (100%)
                  - bounded_proven (user)     : 0 (0%)
                  - bounded_proven (auto)     : 0 (0%)
                  - marked_proven             : 0 (0%)
                  - cex                       : 0 (0%)
                  - ar_cex                    : 0 (0%)
                  - undetermined              : 0 (0%)
                  - unknown                   : 0 (0%)
                  - error                     : 0 (0%)
                 covers                       : 1
                  - unreachable               : 0 (0%)
                  - bounded_unreachable (user): 0 (0%)
                  - covered                   : 1 (100%)
                  - ar_covered                : 0 (0%)
                  - undetermined              : 0 (0%)
                  - unknown                   : 0 (0%)
                  - error                     : 0 (0%)
determined
[<embedded>] % exit -force
INFO (IPL005): Received request to exit from the console.
INFO (IPL014): Waiting for the Tcl-thread to exit.
INFO: Waiting for proof threads to stop...
INFO: Proof threads stopped.
INFO (IPL018): The peak resident set memory use for this session was 2.106 GB.
INFO (IPL015): The Tcl-thread exited with status 0.
INFO (IPL016): Exiting the analysis session with status 0.
