Jasper Apps 2024.06p002 64 bits 2024.09.02 16:28:38 UTC

Any disclosure about the Cadence Design Systems software or its use
model to any third party violates the written Non-Disclosure Agreement
between Cadence Design Systems, Inc. and the customer.

THIS SOFTWARE CONTAINS CONFIDENTIAL INFORMATION AND TRADE SECRETS OF
CADENCE DESIGN SYSTEMS, INC. USE, DISCLOSURE, OR REPRODUCTION IS
PROHIBITED WITHOUT THE PRIOR EXPRESS WRITTEN PERMISSION OF CADENCE
DESIGN SYSTEMS, INC.

Copyright (C) 2000-2024 Cadence Design Systems, Inc. All Rights
Reserved.  Unpublished -- rights reserved under the copyright laws of
the United States.

This product includes software developed by others and redistributed
according to license agreement. See doc/third_party_readme.txt for
further details.

RESTRICTED RIGHTS LEGEND

Use, duplication, or disclosure by the Government is subject to
restrictions as set forth in subparagraph (c) (1) (ii) of the Rights in
Technical Data and Computer Software clause at DFARS 252.227-7013 or
subparagraphs (c) (1) and (2) of Commercial Computer Software -- Restricted
Rights at 48 CFR 52.227-19, as applicable.


                          Cadence Design Systems, Inc.
                          2655 Seely Avenue
                          San Jose, CA 95134
                          Phone: 408.943.1234

For technical assistance visit http://support.cadence.com.

Jasper Apps Analysis Session - /users/rompel/jasper_executions/safety/jgprojects/delay_3/sessionLogs/session_0

WARNING (WG017): [session]: The system's locale is "ANSI_X3.4-1968", which is not UTF-8. Non-ASCII characters might not be handled correctly.
WARNING (WG017): [jg_console]: The system's locale is "ANSI_X3.4-1968", which is not UTF-8. Non-ASCII characters might not be handled correctly.
INFO: successfully checked out license "jasper_fao".
INFO: reading configuration file "/users/rompel/.config/cadence/jasper.conf".
% analyze -sv09 ../delay_3.sv
[-- (VERI-1482)] Analyzing Verilog file '/tools/cadence2425/JASPER/jasper_2024.06p002/lib/verilog/packages/std/std.sv' into library 'std'
[-- (VERI-1482)] Analyzing Verilog file '../delay_3.sv'
% elaborate -bbox_mul 1000000 -bbox_div 1000000 -bbox_mod 1000000 -bbox_a 1000000
[INFO (HIER-8002)] ../delay_3.sv(13): Disabling old hierarchical reference handler
[INFO (VERI-1018)] ../delay_3.sv(1): compiling module 'DELAY'
[WARN (VERI-1209)] ../delay_3.sv(10): expression size 32 truncated to fit in target size 12
INFO (ISW003): Top module name is "DELAY".
INFO (INL208): Elaboration synthesis summary:
  Number of synthesized netlists          1 (0 packages)
  Single run mode                         On
  Pipeline                                On (1 pipelined netlists)
  Late hierarchical reference connection  On
  Number of analyzed Verilog modules      1 (1 synthesized)
  Number of analyzed VHDL entities        0 (0 synthesized)
INFO (INL003): Clearing all state information (assumes, stopats, and so forth).
DELAY
[<embedded>] % reset rst
INFO (IPM031): Clearing proof results of all properties.
INFO (IRS006): Current reset condition is "rst".
[<embedded>] % clock clk
[<embedded>] % prove -all
Ncustom1: Custom engine code is hT3Ng7hPPfiYQOTDZ3qhYOwGAM51eA+J/FjkM5shLioAsqhgLR4Ft+O1BuKG6ilQ83B9tLXSl+CwjiTMAQA
Bcustom2: Custom engine code is hT3Nm7hPr1Vp3Di1Ra2USNIGL4JypRnLKLAdF6JAyuavO2JfGCiY9OZJhcAcOUnLx5xwNdhILGrAWX9s+z2WDkKwNR7tAfClBEjRFVQeq6DU54boFgEA
AMcustom3: Custom engine code is hT3Ng7hP/feYQOTDZ3qhYOwGAM51eA+J/FjkM5shLioAsqhgLR4Ft+O1BuKG6ilQ83B9tLXSmmqwm7g9AQA
Mpcustom4: Custom engine code is hT3NZbhP9fmY2AbBQnsjfOxn6c+6e6yL+/e8fZFmaQrnlgEA
INFO (IPF036): Starting proof on task: "<embedded>", 2 properties to prove with 0 already proven/unreachable
INFO (IRS029): Starting reset analysis: phase 1 of 4.
INFO (IRS030): Running reset analysis: phase 2 of 4.
INFO (IRS031): Running reset analysis: phase 3 of 4.
INFO (IRS020): Starting the reset analysis simulation with a limit of 100 iterations (phase 4 of 4).
INFO (IRS024): Reset iterations 0 to 4 analyzed.
INFO (IRS018): Reset analysis simulation executed for 3 iterations. Assigned values for 12 of 12 design flops, 0 of 0 design latches, 6 of 6 internal elements.
INFO (IRS039): Reset analysis complete.
INFO (IPF031): Settings used for proof thread 0:
    orchestration                 = on
    time_limit                    = 86400s
    per_property_time_limit       = 1s * 10 ^ scan
    engine_mode                   = auto
    proofgrid_per_engine_max_jobs = 1
    max engine jobs               = auto
    proofgrid_mode                = local
    proofgrid_restarts            = 10
AMcustom5: Custom engine code is hT3N1rhP11/52HrFRS21ROp2LOjVTgPvT8L8BGXHgLhaIuqtT4nARFjUqrBL+7pLmaTOzBepZW/Jm8SSrHDybSQtoNiO3y43wk+dEoWlsZizu97Fih6O6lPVG/LpWP5SsUPwlGagLNa1FKEFvwVXyX7//8prySbvSxIHXr5er+z4RAEA
0: Using multistage preprocessing
Ncustom6: Custom engine code is hT3OXrhPByJp3TrFSTLhUmMH4KVtJgmTCnNDF46yMXOKY48m4LS5nE7yBzFjA7kDuwO/GhGUpEPiky3p3wmPn3dJZHxFMsafSoObRzSC+tn7sEY0WbTdZ/FV4hL3MYH/b1CIUvXSWR4wqEoVLsmMOD4xIPT4lI1LO6ZCO7PnnWQuLwetnvKlrXx6wCW/A+x+enqslg1YPobi4wEF/EvbzOvcTYdJvl2s4H2yZg2b2ofAVN5WvhWk1HoBAA
0: Starting reduce
ADcustom7: Custom engine code is hT3Nv7hPv1752HrFRa2kROx2f/ECJeZB2AZsLdlO8VwmIuqtT4nIDFXclhg+O+o+DMmQCekbheGk0kK28laA9gaOFDXsQp29J3X615HY1IPHJWd6FUFvCHjO+p1k652b5JJvZlShNpGlGSXAiQe/mEAj6tEBAA
Tricustom8: Custom engine code is hT3Nu7hPt1752DvFRa0kNDiyIV97VyejwM9C/jCLJjdPvusZONHY42VYUy0Q1ZotnhcVtNc56tJ5wbxv6V2+XpdsaSlHck5vfnbYjdwj1OECy9U+7oSQ0SZE3g5ayD+Phuh4odCJTjeKa2k4elM9ldQfkAEA
Gcustom9: Custom engine code is hT3NibhPDfeYQADBZnYcglOvK9Pfd7EOeniIqP8jNsyIqInncipMGcUXqAadachREE9F2PwhBUZUNw5kHnd4JdXkamORRgEA
C2custom10: Custom engine code is hT3NirhPjfWYQADBZnYcglOvK9Pfd7EOeniIqP8jNsyIqInncgkrYMMXCYbdK0dUjZIF9d4cJ0rHoBDjwVLBKuG86XYVV00BAA
AGcustom11: Custom engine code is hT3NirhP/fmYQADBZnYcglOvK9Pfd7EOeniIqP8jNsyIqInnckcwYMMXCYbdK0dUjZIF9d4cJ0rHoBDjwVLBKuHEZnZByh0BAA
Bcustom12: Custom engine code is hT3NjrhPDfiYQADBZnYcglOvK9PfWxFtenjIyBqfrgr7if/jL/yPOuK1BAflEcW0DxNH2eDIoezN2gxlQFg81RZtiWXh7aiTAidvAQA
Ncustom13: Custom engine code is hT3NR7hPByFp3TrFSTLhUmMH4KWtJglTyV/c51BHEeZWamnJv767nE6PCak26bd3gf3XGN3rIRheufhDieCJQVISo+gNYUKhiUedBKGtsP/a18svAnlMJZudHxDFwK5ufsyoxsIyiAeSY2oi3tEuoDHr5gw42DFKAG3PqO3CEsl8Azzdt3pl5nGA1Ifv2H02eYsFzWb/nfp8PMb3F0krE/EgBcm8TD9Div8BAA
0: Finished reduce in 0s
Tricustom14: Custom engine code is hT3Nu7hP3fiYQADBZnYcglNHp9bfd7EOeniIqP/ji8sGLQu8yhsFO+wxJ+O+R0bU8g/IewXFomyos+viQnWc2xYNYmMqpo3i40O7DaZR7qfp4YqNx26KRvQ/qx0BAA
0.0.PRE: Performing Proof Simplification...
0.0.N: clocks: 1, declared: 1, looping: 0, posedge: 1, negedge: 0, noedge: 0, bothedge: 0
0.0.N: Proof Simplification Iteration 1	[0.00 s]
0.0.PRE: A trace with 1 cycles was found. [0.00 s]
INFO (IPF047): 0.0.PRE: The cover property "DELAY.p1:precondition1" was covered in 1 cycles in 0.00 s.
0.0.N: Proof Simplification Iteration 2	[0.06 s]
0.0.PRE: A proof was found: No trace exists. [0.00 s]
INFO (IPF057): 0.0.PRE: The property ":noDeadEnd" was proven in 0.00 s.
    Use check_assumptions -show -dead_end to show this property in the property table.
0.0.PRE: A proof was found: No trace exists. [0.00 s]
INFO (IPF057): 0.0.PRE: The property ":noConflict" was proven in 0.00 s.
    Use check_assumptions -show to show this property in the property table.
INFO (IPF047): 0.0.PRE: The cover property ":live" was covered in 1 cycles in 0.00 s.
    Use check_assumptions -show -live to show this property in the property table.
0.0.PRE: Proof Simplification completed in 0.06 s
0: About to start ProofGrid in its own thread with a limit of 10000 pending notifications and a limit of 10 traces.
0: =============================== ProofGrid start ===============================
0: ProofGrid usable level: 1
0: Initial ProofGrid level: 1
0: ProofGrid is starting event handling
0.0.Hp: Proofgrid shell started at 26018@vlsi-ria85(local) jg_25888_vlsi-ria85_1
0.0.N: Proofgrid shell started at 26015@vlsi-ria85(local) jg_25888_vlsi-ria85_1
0.0.N: clocks: 1, declared: 1, looping: 0, posedge: 1, negedge: 0, noedge: 0, bothedge: 0
0.0.N: Last scan. Per property time limit: 0s
0.0.N: Starting proof for property "DELAY.p1"	[0.00 s].
0.0.N: Trace Attempt  1	[0.00 s]
0.0.N: Trace Attempt  2	[0.00 s]
0.0.N: Trace Attempt  2	[0.00 s]
0.0.Hp: clocks: 1, declared: 1, looping: 0, posedge: 1, negedge: 0, noedge: 0, bothedge: 0
0.0.Hp: Last scan. Per property time limit: 0s
0.0.Hp: Trace Attempt  1	[0.00 s]
0.0.Hp: Trace Attempt  2	[0.00 s]
0.0.N: Trace Attempt  3	[0.00 s]
0.0.N: Trace Attempt  4	[0.00 s]
0.0.N: Trace Attempt  4	[0.00 s]
0.0.Hp: Trace Attempt  3	[0.00 s]
0.0.Hp: Trace Attempt  4	[0.00 s]
0.0.Hp: Trace Attempt  5	[0.00 s]
0.0.N: Trace Attempt  5	[0.00 s]
0.0.N: Trace Attempt  1	[0.01 s]
0.0.N: Trace Attempt  2	[0.01 s]
0.0.N: Trace Attempt  3	[0.01 s]
0.0.N: Trace Attempt  4	[0.01 s]
0.0.N: Trace Attempt  5	[0.01 s]
0.0.Ht: Proofgrid shell started at 26087@vlsi-ria85(local) jg_25888_vlsi-ria85_1
0.0.Bm: Proofgrid shell started at 26090@vlsi-ria85(local) jg_25888_vlsi-ria85_1
0.0.Mpcustom4: Proofgrid shell started at 26091@vlsi-ria85(local) jg_25888_vlsi-ria85_1
0.0.B: Proofgrid shell started at 26095@vlsi-ria85(local) jg_25888_vlsi-ria85_1
0.0.AM: Proofgrid shell started at 26096@vlsi-ria85(local) jg_25888_vlsi-ria85_1
0.0.Ht: clocks: 1, declared: 1, looping: 0, posedge: 1, negedge: 0, noedge: 0, bothedge: 0
0.0.Mpcustom4: clocks: 1, declared: 1, looping: 0, posedge: 1, negedge: 0, noedge: 0, bothedge: 0
0.0.Ht: Last scan. Per property time limit: 0s
0.0.Mpcustom4: Ignoring liveness properties
0.0.Mpcustom4: All properties either determined or skipped. [0.00 s]
0.0.Ht: Trace Attempt  1	[0.00 s]
0.0.Ht: Trace Attempt  2	[0.00 s]
0.0.Ht: Trace Attempt  3	[0.00 s]
0.0.Ht: Trace Attempt  4	[0.00 s]
0.0.Ht: Trace Attempt  5	[0.00 s]
0.0.Mpcustom4: Exited with Success (@ 0.04 s)
0.0.Mpcustom4: Completed, Restart ignored.
0.0.Bm: clocks: 1, declared: 1, looping: 0, posedge: 1, negedge: 0, noedge: 0, bothedge: 0
0.0.AM: clocks: 1, declared: 1, looping: 0, posedge: 1, negedge: 0, noedge: 0, bothedge: 0
0.0.Bm: Ignoring liveness properties
0.0.AM: Last scan. Per property time limit: 0s
0.0.AM: Starting proof for property "DELAY.p1"	[0.00 s].
0.0.Bm: Last scan. Per property time limit: 0s
0.0.Bm: Trace Attempt  1	[0.00 s]
0.0.AM: Trace Attempt  1	[0.00 s]
0.0.AM: Trace Attempt  2	[0.00 s]
0.0.Bm: Trace Attempt  2	[0.00 s]
0.0.Bm: Trace Attempt  3	[0.00 s]
0.0.Bm: Trace Attempt  4	[0.00 s]
0.0.Bm: Trace Attempt  5	[0.00 s]
0.0.AM: Trace Attempt  3	[0.00 s]
0.0.AM: Trace Attempt  4	[0.00 s]
0.0.AM: Trace Attempt  5	[0.00 s]
0.0.AM: Trace Attempt  1	[0.00 s]
0.0.AM: Trace Attempt  2	[0.00 s]
0.0.AM: Trace Attempt  3	[0.00 s]
0.0.AM: Trace Attempt  4	[0.00 s]
0.0.AM: Trace Attempt  5	[0.00 s]
0.0.AM: Trace Attempt  1	[0.01 s]
0.0.B: clocks: 1, declared: 1, looping: 0, posedge: 1, negedge: 0, noedge: 0, bothedge: 0
0.0.B: Last scan. Per property time limit: 0s
0.0.B: Starting proof for property "DELAY.p1"	[0.00 s].
0.0.B: Trace Attempt  1	[0.00 s]
0.0.B: Trace Attempt  2	[0.00 s]
0.0.B: Trace Attempt  3	[0.00 s]
0.0.B: Trace Attempt  4	[0.00 s]
0.0.AM: Trace Attempt  2	[0.01 s]
0.0.AM: Trace Attempt  3	[0.01 s]
0.0.B: Trace Attempt  5	[0.00 s]
0.0.L: Proofgrid shell started at 26094@vlsi-ria85(local) jg_25888_vlsi-ria85_1
0.0.AM: Trace Attempt  4	[0.01 s]
0.0.AM: Trace Attempt  5	[0.01 s]
0.0.L: clocks: 1, declared: 1, looping: 0, posedge: 1, negedge: 0, noedge: 0, bothedge: 0
0.0.L: Using trace diversification with seed 1 (0.05)
0.0.L: Using LRU state removal heuristic
0.0.L: Ignoring liveness properties
0.0.L: All properties either determined or skipped. [0.00 s]
0.0.L: Exited with Success (@ 0.07 s)
0.0.L: Completed, Restart ignored.
0.0.AM: Trace Attempt  1	[0.03 s]
0.0.AM: Trace Attempt  2	[0.03 s]
0.0.AM: Trace Attempt  3	[0.03 s]
0.0.AM: Trace Attempt  4	[0.03 s]
0.0.AM: Trace Attempt  5	[0.03 s]
0.0.Oh: Proofgrid shell started at 26092@vlsi-ria85(local) jg_25888_vlsi-ria85_1
0.0.Oh: clocks: 1, declared: 1, looping: 0, posedge: 1, negedge: 0, noedge: 0, bothedge: 0
0.0.Oh: Reached length limit (2147483647) [0.00 s]
0.0.Oh: Exited with Success (@ 0.09 s)
0.0.Oh: Completed, Restart ignored.
0.0.N: Trace Attempt  1	[0.13 s]
0.0.N: Trace Attempt  2	[0.13 s]
0.0.N: Trace Attempt  3	[0.13 s]
0.0.N: Trace Attempt  4	[0.14 s]
0.0.N: Trace Attempt  5	[0.14 s]
0.0.AM: Trace Attempt  1	[0.10 s]
0.0.AM: Trace Attempt  2	[0.10 s]
0.0.AM: Trace Attempt  3	[0.10 s]
0.0.AM: Trace Attempt  4	[0.11 s]
0.0.AM: Trace Attempt  5	[0.11 s]
0.0.AM: Trace Attempt  1	[0.36 s]
0.0.AM: Trace Attempt  2	[0.36 s]
0.0.AM: Trace Attempt  3	[0.36 s]
0.0.AM: Trace Attempt  4	[0.36 s]
0.0.AM: Trace Attempt  5	[0.36 s]
0.0.N: Trace Attempt  1	[0.45 s]
0.0.N: Trace Attempt  2	[0.45 s]
0.0.N: Trace Attempt  3	[0.45 s]
0.0.N: Trace Attempt  4	[0.45 s]
0.0.N: Trace Attempt  5	[0.45 s]
0.0.AM: Trace Attempt  1	[1.59 s]
0.0.AM: Trace Attempt  2	[1.59 s]
0.0.AM: Trace Attempt  3	[1.59 s]
0.0.AM: Trace Attempt  4	[1.59 s]
0.0.AM: Trace Attempt  5	[1.59 s]
0.0.N: Trace Attempt  1	[1.82 s]
0.0.N: Trace Attempt  2	[1.82 s]
0.0.N: Trace Attempt  3	[1.82 s]
0.0.N: Trace Attempt  4	[1.82 s]
0.0.N: Trace Attempt  5	[1.82 s]
0.0.N: Trace Attempt  1	[3.19 s]
0.0.N: Trace Attempt  2	[3.19 s]
0.0.N: Trace Attempt  3	[3.19 s]
0.0.N: Trace Attempt  4	[3.19 s]
0.0.N: Trace Attempt  5	[3.19 s]
0.0.Hp: Trace Attempt 590	[4.02 s]
0.0.Ht: Trace Attempt 1835	[4.00 s]
0.0.Bm: Trace Attempt 1671	[4.00 s]
0.0.B: Trace Attempt 1666	[4.00 s]
0.0.N: Trace Attempt  1	[4.55 s]
0.0.N: Trace Attempt  2	[4.55 s]
0.0.N: Trace Attempt  3	[4.55 s]
0.0.N: Trace Attempt  4	[4.55 s]
0.0.N: Trace Attempt  5	[4.55 s]
0.0.AM: Trace Attempt 209	[5.61 s]
0.0.N: Trace Attempt  1	[5.92 s]
0.0.N: Trace Attempt  2	[5.92 s]
0.0.N: Trace Attempt  3	[5.92 s]
0.0.N: Trace Attempt  4	[5.92 s]
0.0.N: Trace Attempt  5	[5.92 s]
0.0.N: Trace Attempt  1	[7.48 s]
0.0.N: Trace Attempt  2	[7.48 s]
0.0.N: Trace Attempt  3	[7.48 s]
0.0.N: Trace Attempt  4	[7.49 s]
0.0.N: Trace Attempt  5	[7.49 s]
0.0.AM: Trace Attempt  1	[7.70 s]
0.0.AM: Trace Attempt  2	[7.70 s]
0.0.AM: Trace Attempt  3	[7.70 s]
0.0.AM: Trace Attempt  4	[7.70 s]
0.0.AM: Trace Attempt  5	[7.70 s]
0.0.Hp: Trace Attempt 715	[8.04 s]
0.0.Bm: Trace Attempt 2294	[8.00 s]
0.0.Ht: Trace Attempt 2475	[8.00 s]
0.0.B: Trace Attempt 2282	[8.01 s]
0.0.N: Trace Attempt  1	[10.65 s]
0.0.N: Trace Attempt  2	[10.65 s]
0.0.N: Trace Attempt  3	[10.65 s]
0.0.N: Trace Attempt  4	[10.65 s]
0.0.N: Trace Attempt  5	[10.65 s]
0.0.AM: Trace Attempt 193	[11.72 s]
0.0.Hp: Trace Attempt 798	[12.05 s]
0.0.Bm: Trace Attempt 2579	[12.01 s]
0.0.B: Trace Attempt 2577	[12.02 s]
0.0.Ht: Trace Attempt 2504	[12.08 s]
0.0.N: Trace Attempt  1	[13.92 s]
0.0.N: Trace Attempt  2	[13.93 s]
0.0.N: Trace Attempt  3	[13.93 s]
0.0.N: Trace Attempt  4	[13.93 s]
0.0.N: Trace Attempt  5	[13.93 s]
0.0.AM: Trace Attempt 254	[15.79 s]
0.0.Hp: Trace Attempt 872	[16.07 s]
0.0.Bm: Trace Attempt 2701	[16.03 s]
0.0.B: Trace Attempt 2700	[16.05 s]
0.0.N: Trace Attempt  1	[17.10 s]
0.0.N: Trace Attempt  2	[17.10 s]
0.0.N: Trace Attempt  3	[17.10 s]
0.0.N: Trace Attempt  4	[17.10 s]
0.0.N: Trace Attempt  5	[17.10 s]
0.0.Ht: Trace Attempt 2505	[17.18 s]
0.0.AM: Trace Attempt 295	[19.87 s]
0.0.Bm: Trace Attempt 2829	[20.04 s]
0.0.B: Trace Attempt 2828	[20.06 s]
0.0.Hp: Trace Attempt 946	[20.11 s]
0.0.N: Trace Attempt  1	[20.26 s]
0.0.N: Trace Attempt  2	[20.27 s]
0.0.N: Trace Attempt  3	[20.27 s]
0.0.N: Trace Attempt  4	[20.27 s]
0.0.N: Trace Attempt  5	[20.27 s]
0.0.Ht: Trace Attempt 2807	[21.20 s]
0.0.N: Trace Attempt  1	[23.59 s]
0.0.N: Trace Attempt  2	[23.59 s]
0.0.N: Trace Attempt  3	[23.59 s]
0.0.N: Trace Attempt  4	[23.59 s]
0.0.N: Trace Attempt  5	[23.59 s]
0.0.AM: Trace Attempt 338	[23.89 s]
0.0.Bm: Trace Attempt 2945	[24.05 s]
0.0.B: Trace Attempt 2944	[24.06 s]
0.0.Hp: Trace Attempt 1012	[24.11 s]
0.0.Ht: Trace Attempt 2968	[25.21 s]
0.0.N: Trace Attempt  1	[26.91 s]
0.0.N: Trace Attempt  2	[26.91 s]
0.0.N: Trace Attempt  3	[26.91 s]
0.0.N: Trace Attempt  4	[26.91 s]
0.0.N: Trace Attempt  5	[26.91 s]
0.0.AM: Trace Attempt 383	[27.91 s]
0.0.Bm: Trace Attempt 3056	[28.07 s]
0.0.B: Trace Attempt 3054	[28.09 s]
0.0.Hp: Trace Attempt 1101	[28.15 s]
0.0.Ht: Trace Attempt 3137	[29.22 s]
0.0.N: Trace Attempt  1	[30.13 s]
0.0.N: Trace Attempt  2	[30.13 s]
0.0.N: Trace Attempt  3	[30.13 s]
0.0.N: Trace Attempt  4	[30.13 s]
0.0.N: Trace Attempt  5	[30.14 s]
0.0.AM: Trace Attempt 420	[32.07 s]
0.0.Bm: Trace Attempt 3165	[32.09 s]
0.0.Hp: Trace Attempt 1162	[32.16 s]
0.0.B: Trace Attempt 3160	[32.13 s]
0.0.Ht: Trace Attempt 3286	[33.22 s]
0.0.N: Trace Attempt  1	[33.32 s]
0.0.N: Trace Attempt  2	[33.32 s]
0.0.N: Trace Attempt  3	[33.32 s]
0.0.N: Trace Attempt  4	[33.33 s]
0.0.N: Trace Attempt  5	[33.33 s]
0.0.Bm: Trace Attempt 3269	[36.12 s]
0.0.Hp: Trace Attempt 1239	[36.18 s]
0.0.B: Trace Attempt 3262	[36.15 s]
0.0.AM: Trace Attempt 457	[36.20 s]
0.0.N: Trace Attempt  1	[36.50 s]
0.0.N: Trace Attempt  2	[36.50 s]
0.0.N: Trace Attempt  3	[36.50 s]
0.0.N: Trace Attempt  4	[36.51 s]
0.0.N: Trace Attempt  5	[36.51 s]
0.0.Ht: Trace Attempt 3426	[37.22 s]
0.0.N: Trace Attempt  1	[39.74 s]
0.0.N: Trace Attempt  2	[39.75 s]
0.0.N: Trace Attempt  3	[39.75 s]
0.0.N: Trace Attempt  4	[39.75 s]
0.0.N: Trace Attempt  5	[39.75 s]
0.0.Bm: Trace Attempt 3364	[40.16 s]
0.0.B: Trace Attempt 3356	[40.18 s]
0.0.AM: Trace Attempt 399	[40.20 s]
0.0.Hp: Trace Attempt 1287	[40.25 s]
0.0.Ht: Trace Attempt 3546	[41.27 s]
0.0.N: Trace Attempt  1	[43.18 s]
0.0.N: Trace Attempt  2	[43.18 s]
0.0.N: Trace Attempt  3	[43.18 s]
0.0.N: Trace Attempt  4	[43.18 s]
0.0.N: Trace Attempt  5	[43.19 s]
0.0.Bm: Trace Attempt 3449	[44.19 s]
0.0.B: Trace Attempt 3441	[44.19 s]
0.0.Hp: Trace Attempt 1331	[44.33 s]
0.0.Ht: Trace Attempt 3650	[45.30 s]
0.0.AM: Trace Attempt 513	[45.38 s]
0.0.AM: Trace Attempt  1	[45.83 s]
0.0.AM: Trace Attempt  2	[45.83 s]
0.0.AM: Trace Attempt  3	[45.83 s]
0.0.AM: Trace Attempt  4	[45.83 s]
0.0.AM: Trace Attempt  5	[45.83 s]
0.0.N: Trace Attempt  1	[46.59 s]
0.0.N: Trace Attempt  2	[46.59 s]
0.0.N: Trace Attempt  3	[46.59 s]
0.0.N: Trace Attempt  4	[46.59 s]
0.0.N: Trace Attempt  5	[46.59 s]
0.0.B: Trace Attempt 3526	[48.19 s]
0.0.Bm: Trace Attempt 3539	[48.23 s]
0.0.Hp: Trace Attempt 1373	[48.44 s]
0.0.Ht: Trace Attempt 3757	[49.32 s]
0.0.AM: Trace Attempt 181	[49.85 s]
0.0.N: Trace Attempt  1	[50.04 s]
0.0.N: Trace Attempt  2	[50.04 s]
0.0.N: Trace Attempt  3	[50.04 s]
0.0.N: Trace Attempt  4	[50.04 s]
0.0.N: Trace Attempt  5	[50.04 s]
0.0.B: Trace Attempt 3620	[52.20 s]
0.0.Bm: Trace Attempt 3634	[52.24 s]
0.0.Hp: Trace Attempt 1410	[52.49 s]
0.0.Ht: Trace Attempt 3832	[53.32 s]
0.0.N: Trace Attempt  1	[53.44 s]
0.0.N: Trace Attempt  2	[53.44 s]
0.0.N: Trace Attempt  3	[53.44 s]
0.0.N: Trace Attempt  4	[53.45 s]
0.0.N: Trace Attempt  5	[53.45 s]
0.0.AM: Trace Attempt 251	[53.92 s]
0.0.B: Trace Attempt 3715	[56.20 s]
0.0.Bm: Trace Attempt 3727	[56.28 s]
0.0.Hp: Trace Attempt 1445	[56.58 s]
0.0.N: Trace Attempt  1	[56.68 s]
0.0.N: Trace Attempt  2	[56.68 s]
0.0.N: Trace Attempt  3	[56.68 s]
0.0.N: Trace Attempt  4	[56.68 s]
0.0.N: Trace Attempt  5	[56.68 s]
0.0.Ht: Trace Attempt 4039	[57.32 s]
0.0.AM: Trace Attempt 297	[57.95 s]
0.0.N: Trace Attempt  1	[59.96 s]
0.0.N: Trace Attempt  2	[59.96 s]
0.0.N: Trace Attempt  3	[59.96 s]
0.0.N: Trace Attempt  4	[59.97 s]
0.0.N: Trace Attempt  5	[59.97 s]
0.0.B: Trace Attempt 3806	[60.21 s]
0.0.Bm: Trace Attempt 3818	[60.31 s]
0.0.Hp: Trace Attempt 1480	[60.69 s]
0.0.Ht: Trace Attempt 4156	[61.35 s]
0.0.AM: Trace Attempt 335	[62.04 s]
0.0.N: Trace Attempt  1	[63.41 s]
0.0.N: Trace Attempt  2	[63.41 s]
0.0.N: Trace Attempt  3	[63.41 s]
0.0.N: Trace Attempt  4	[63.41 s]
0.0.N: Trace Attempt  5	[63.41 s]
0.0.B: Trace Attempt 3890	[64.21 s]
0.0.Bm: Trace Attempt 3905	[64.32 s]
0.0.Hp: Trace Attempt 1513	[64.71 s]
0.0.Ht: Trace Attempt 4289	[65.35 s]
0.0.AM: Trace Attempt 368	[66.16 s]
0.0.N: Trace Attempt  1	[66.80 s]
0.0.N: Trace Attempt  2	[66.80 s]
0.0.N: Trace Attempt  3	[66.80 s]
0.0.N: Trace Attempt  4	[66.80 s]
0.0.N: Trace Attempt  5	[66.80 s]
0.0.B: Trace Attempt 3976	[68.22 s]
0.0.Bm: Trace Attempt 3990	[68.37 s]
0.0.Hp: Trace Attempt 1563	[68.74 s]
0.0.Ht: Trace Attempt 4410	[69.36 s]
0.0.N: Trace Attempt  1	[70.03 s]
0.0.N: Trace Attempt  2	[70.03 s]
0.0.N: Trace Attempt  3	[70.03 s]
0.0.N: Trace Attempt  4	[70.03 s]
0.0.N: Trace Attempt  5	[70.03 s]
0.0.AM: Trace Attempt 400	[70.30 s]
0.0.B: Trace Attempt 4054	[72.27 s]
0.0.Bm: Trace Attempt 4064	[72.42 s]
0.0.Hp: Trace Attempt 1615	[72.75 s]
0.0.Ht: Trace Attempt 4508	[73.39 s]
0.0.N: Trace Attempt  1	[73.56 s]
0.0.N: Trace Attempt  2	[73.57 s]
0.0.N: Trace Attempt  3	[73.57 s]
0.0.N: Trace Attempt  4	[73.57 s]
0.0.N: Trace Attempt  5	[73.57 s]
0.0.AM: Trace Attempt 434	[74.45 s]
0.0.B: Trace Attempt 4122	[76.28 s]
0.0.Bm: Trace Attempt 4134	[76.47 s]
0.0.Hp: Trace Attempt 1645	[76.81 s]
0.0.N: Trace Attempt  1	[76.90 s]
0.0.N: Trace Attempt  2	[76.90 s]
0.0.N: Trace Attempt  3	[76.90 s]
0.0.N: Trace Attempt  4	[76.90 s]
0.0.N: Trace Attempt  5	[76.90 s]
0.0.Ht: Trace Attempt 4626	[77.43 s]
0.0.AM: Trace Attempt 468	[78.50 s]
0.0.N: Trace Attempt  1	[80.31 s]
0.0.N: Trace Attempt  2	[80.32 s]
0.0.N: Trace Attempt  3	[80.32 s]
0.0.N: Trace Attempt  4	[80.32 s]
0.0.N: Trace Attempt  5	[80.32 s]
0.0.B: Trace Attempt 4184	[80.29 s]
0.0.Bm: Trace Attempt 4198	[80.48 s]
0.0.Hp: Trace Attempt 1690	[80.83 s]
0.0.Ht: Trace Attempt 4726	[81.46 s]
0.0.AM: Trace Attempt 492	[82.75 s]
0.0.N: Trace Attempt  1	[84.10 s]
0.0.N: Trace Attempt  2	[84.10 s]
0.0.N: Trace Attempt  3	[84.10 s]
0.0.N: Trace Attempt  4	[84.11 s]
0.0.N: Trace Attempt  5	[84.11 s]
0.0.B: Trace Attempt 4248	[84.32 s]
0.0.Bm: Trace Attempt 4260	[84.52 s]
0.0.Hp: Trace Attempt 1742	[84.87 s]
0.0.Ht: Trace Attempt 4825	[85.48 s]
0.0.AM: Trace Attempt 501	[87.07 s]
0.0.N: Trace Attempt 235	[88.11 s]
0.0.B: Trace Attempt 4306	[88.33 s]
0.0.Bm: Trace Attempt 4316	[88.53 s]
0.0.Hp: Trace Attempt 1770	[88.91 s]
0.0.Ht: Trace Attempt 4916	[89.54 s]
0.0.AM: Trace Attempt 514	[91.31 s]
0.0.N: Trace Attempt 329	[92.14 s]
0.0.B: Trace Attempt 4360	[92.39 s]
0.0.Bm: Trace Attempt 4368	[92.58 s]
0.0.Hp: Trace Attempt 1800	[93.01 s]
0.0.Ht: Trace Attempt 5004	[94.69 s]
0.0.AM: Trace Attempt 527	[95.39 s]
0.0.N: Trace Attempt 421	[96.14 s]
0.0.B: Trace Attempt 4415	[96.41 s]
0.0.Bm: Trace Attempt 4422	[96.62 s]
0.0.Hp: Trace Attempt 1830	[97.06 s]
0.0.Ht: Trace Attempt 5049	[98.70 s]
0.0.AM: Trace Attempt 542	[99.47 s]
0.0.N: Trace Attempt  1	[99.75 s]
0.0.N: Trace Attempt  2	[99.76 s]
0.0.N: Trace Attempt  3	[99.76 s]
0.0.N: Trace Attempt  4	[99.76 s]
0.0.N: Trace Attempt  5	[99.76 s]
0.0.B: Trace Attempt 4465	[100.46 s]
0.0.Bm: Trace Attempt 4470	[100.64 s]
0.0.Hp: Trace Attempt 1859	[101.08 s]
0.0.AM: Trace Attempt 554	[103.68 s]
0.0.N: Trace Attempt 239	[103.80 s]
0.0.B: Trace Attempt 4514	[104.51 s]
0.0.Ht: Trace Attempt 5070	[104.66 s]
0.0.Bm: Trace Attempt 4518	[104.72 s]
0.0.Hp: Trace Attempt 1889	[105.11 s]
0.0.N: Trace Attempt 345	[107.82 s]
0.0.AM: Trace Attempt 570	[107.87 s]
0.0.B: Trace Attempt 4560	[108.51 s]
0.0.Bm: Trace Attempt 4562	[108.78 s]
0.0.Hp: Trace Attempt 1919	[109.11 s]
0.0.Ht: Trace Attempt 5102	[110.19 s]
0.0.N: Trace Attempt 440	[111.83 s]
0.0.AM: Trace Attempt 585	[112.15 s]
0.0.B: Trace Attempt 4602	[112.51 s]
0.0.Bm: Trace Attempt 4602	[112.88 s]
0.0.Hp: Trace Attempt 1949	[113.25 s]
0.0.Ht: Trace Attempt 5272	[114.20 s]
0.0.N: Trace Attempt  1	[114.66 s]
0.0.N: Trace Attempt  2	[114.66 s]
0.0.N: Trace Attempt  3	[114.66 s]
0.0.N: Trace Attempt  4	[114.67 s]
0.0.N: Trace Attempt  5	[114.67 s]
0.0.AM: Trace Attempt 600	[116.55 s]
0.0.B: Trace Attempt 4643	[116.55 s]
0.0.Bm: Trace Attempt 4640	[116.97 s]
0.0.Hp: Trace Attempt 1978	[117.32 s]
0.0.Ht: Trace Attempt 5348	[118.21 s]
0.0.N: Trace Attempt 240	[118.74 s]
0.0.AM: Trace Attempt 613	[120.57 s]
0.0.B: Trace Attempt 4682	[120.61 s]
0.0.Bm: Trace Attempt 4676	[121.01 s]
0.0.Hp: Trace Attempt 2007	[121.36 s]
0.0.Ht: Trace Attempt 5471	[122.24 s]
0.0.N: Trace Attempt 346	[122.75 s]
0.0.AM: Trace Attempt 626	[124.66 s]
0.0.B: Trace Attempt 4720	[124.69 s]
0.0.Bm: Trace Attempt 4712	[125.11 s]
0.0.Hp: Trace Attempt 2036	[125.44 s]
0.0.N: Trace Attempt 441	[126.80 s]
0.0.Ht: Trace Attempt 5525	[127.78 s]
0.0.B: Trace Attempt 4756	[128.78 s]
0.0.AM: Trace Attempt 639	[128.92 s]
0.0.Bm: Trace Attempt 4746	[129.18 s]
0.0.Hp: Trace Attempt 2086	[129.48 s]
0.0.N: Trace Attempt  1	[129.70 s]
0.0.N: Trace Attempt  2	[129.70 s]
0.0.N: Trace Attempt  3	[129.70 s]
0.0.N: Trace Attempt  4	[129.70 s]
0.0.N: Trace Attempt  5	[129.70 s]
0.0.Ht: Trace Attempt 5626	[131.81 s]
0.0.B: Trace Attempt 4790	[132.80 s]
0.0.AM: Trace Attempt 653	[133.18 s]
0.0.Bm: Trace Attempt 4779	[133.21 s]
0.0.Hp: Trace Attempt 2128	[133.55 s]
0.0.N: Trace Attempt 238	[133.72 s]
0.0.Ht: Trace Attempt 5737	[135.81 s]
0.0.B: Trace Attempt 4824	[136.94 s]
0.0.Bm: Trace Attempt 4811	[137.24 s]
0.0.AM: Trace Attempt 666	[137.35 s]
0.0.Hp: Trace Attempt 2155	[137.55 s]
0.0.N: Trace Attempt 342	[137.73 s]
0.0.Ht: Trace Attempt 5811	[139.83 s]
0.0.B: Trace Attempt 4857	[141.01 s]
0.0.Bm: Trace Attempt 4842	[141.30 s]
0.0.AM: Trace Attempt 677	[141.53 s]
0.0.Hp: Trace Attempt 2191	[141.58 s]
0.0.N: Trace Attempt 437	[141.77 s]
0.0.Ht: Trace Attempt 5913	[143.86 s]
0.0.N: Trace Attempt  1	[144.89 s]
0.0.N: Trace Attempt  2	[144.89 s]
0.0.N: Trace Attempt  3	[144.89 s]
0.0.N: Trace Attempt  4	[144.89 s]
0.0.N: Trace Attempt  5	[144.89 s]
0.0.B: Trace Attempt 4888	[145.16 s]
0.0.Bm: Trace Attempt 4872	[145.34 s]
0.0.AM: Trace Attempt 689	[145.66 s]
0.0.Hp: Trace Attempt 2245	[145.71 s]
0.0.Ht: Trace Attempt 6007	[147.87 s]
0.0.N: Trace Attempt 239	[148.94 s]
0.0.B: Trace Attempt 4920	[149.30 s]
0.0.Bm: Trace Attempt 4902	[149.37 s]
0.0.Hp: Trace Attempt 2272	[149.85 s]
0.0.AM: Trace Attempt 702	[150.38 s]
0.0.Ht: Trace Attempt 6101	[151.88 s]
0.0.N: Trace Attempt 346	[153.00 s]
0.0.B: Trace Attempt 4951	[153.32 s]
0.0.Bm: Trace Attempt 4932	[153.40 s]
0.0.Hp: Trace Attempt 2298	[153.90 s]
0.0.AM: Trace Attempt 713	[154.74 s]
0.0.Ht: Trace Attempt 6197	[155.89 s]
0.0.N: Trace Attempt 442	[157.03 s]
0.0.B: Trace Attempt 4981	[157.41 s]
0.0.Bm: Trace Attempt 4962	[157.57 s]
0.0.Hp: Trace Attempt 2324	[157.97 s]
0.0.AM: Trace Attempt 725	[159.18 s]
0.0.Ht: Trace Attempt 6215	[159.93 s]
0.0.N: Trace Attempt  1	[160.09 s]
0.0.N: Trace Attempt  2	[160.09 s]
0.0.N: Trace Attempt  3	[160.09 s]
0.0.N: Trace Attempt  4	[160.09 s]
0.0.N: Trace Attempt  5	[160.09 s]
0.0.B: Trace Attempt 5006	[161.50 s]
0.0.Bm: Trace Attempt 4990	[161.73 s]
0.0.Hp: Trace Attempt 2350	[162.13 s]
0.0.AM: Trace Attempt 735	[163.46 s]
0.0.Ht: Trace Attempt 6368	[163.95 s]
0.0.N: Trace Attempt 239	[164.10 s]
0.0.B: Trace Attempt 5033	[165.53 s]
0.0.Bm: Trace Attempt 5013	[165.74 s]
0.0.Hp: Trace Attempt 2375	[166.27 s]
0.0.AM: Trace Attempt 744	[167.56 s]
0.0.N: Trace Attempt 346	[168.15 s]
0.0.Ht: Trace Attempt 6464	[169.25 s]
0.0.B: Trace Attempt 5067	[169.65 s]
0.0.Bm: Trace Attempt 5042	[169.81 s]
0.0.Hp: Trace Attempt 2399	[170.34 s]
0.0.AM: Trace Attempt 753	[171.74 s]
0.0.N: Trace Attempt 441	[172.17 s]
0.0.Ht: Trace Attempt 6565	[173.27 s]
0.0.B: Trace Attempt 5096	[173.69 s]
0.0.Bm: Trace Attempt 5074	[173.92 s]
0.0.Hp: Trace Attempt 2420	[174.35 s]
0.0.N: Trace Attempt  1	[174.78 s]
0.0.N: Trace Attempt  2	[174.78 s]
0.0.N: Trace Attempt  3	[174.78 s]
0.0.N: Trace Attempt  4	[174.78 s]
0.0.N: Trace Attempt  5	[174.78 s]
0.0.AM: Trace Attempt 762	[175.86 s]
0.0.Ht: Trace Attempt 6656	[177.30 s]
0.0.B: Trace Attempt 5125	[177.71 s]
0.0.Bm: Trace Attempt 5104	[178.00 s]
0.0.Hp: Trace Attempt 2444	[178.40 s]
0.0.N: Trace Attempt 239	[178.79 s]
0.0.AM: Trace Attempt 772	[180.20 s]
0.0.N: Trace Attempt 296	[180.97 s]
0.0.N: Stopped processing property "DELAY.p1"	[181.00 s].
0.0.N: Morphing to Ncustom1
0.0.N: All properties determined. [0.00 s]
0.0.N: Exited with Success (@ 0.00 s)
0.0.Ncustom1: clocks: 1, declared: 1, looping: 0, posedge: 1, negedge: 0, noedge: 0, bothedge: 0
0.0.Ncustom1: Starting proof for property "DELAY.p1"	[0.00 s].
0.0.Ncustom1: Trace Attempt 461	[0.03 s]
0.0.B: Trace Attempt 5147	[180.95 s]
0.0.B: Stopped processing property "DELAY.p1"	[181.02 s].
0.0.B: Morphing to Bcustom2
0.0.B: All properties determined. [0.00 s]
0.0.B: Exited with Success (@ 0.00 s)
0.0.Bcustom2: clocks: 1, declared: 1, looping: 0, posedge: 1, negedge: 0, noedge: 0, bothedge: 0
0.0.Bcustom2: Starting proof for property "DELAY.p1"	[0.00 s].
0.0.Bcustom2: Trace Attempt  1	[0.00 s]
0.0.Bcustom2: Trace Attempt  2	[0.00 s]
0.0.Bcustom2: Trace Attempt  1	[0.00 s]
0.0.Bcustom2: Trace Attempt  2	[0.00 s]
0.0.Bcustom2: Trace Attempt  3	[0.00 s]
0.0.Bcustom2: Trace Attempt  4	[0.00 s]
0.0.Bcustom2: Trace Attempt  5	[0.00 s]
0.0.Bcustom2: Trace Attempt  1	[0.00 s]
0.0.Bcustom2: Trace Attempt  2	[0.00 s]
0.0.Bcustom2: Trace Attempt  3	[0.00 s]
0.0.Bcustom2: Trace Attempt  4	[0.00 s]
0.0.Bcustom2: Trace Attempt  5	[0.00 s]
0.0.Bcustom2: Trace Attempt  1	[0.00 s]
0.0.Bcustom2: Trace Attempt  2	[0.00 s]
0.0.Bcustom2: Trace Attempt  3	[0.00 s]
0.0.Bcustom2: Trace Attempt  4	[0.00 s]
0.0.Bcustom2: Trace Attempt  5	[0.00 s]
0.0.Bcustom2: Trace Attempt  1	[0.01 s]
0.0.Bcustom2: Trace Attempt  2	[0.01 s]
0.0.Bcustom2: Trace Attempt  3	[0.01 s]
0.0.Bcustom2: Trace Attempt  4	[0.01 s]
0.0.Bcustom2: Trace Attempt  5	[0.01 s]
0.0.Bcustom2: Trace Attempt  1	[0.02 s]
0.0.Bcustom2: Trace Attempt  2	[0.02 s]
0.0.Bcustom2: Trace Attempt  3	[0.02 s]
0.0.Bcustom2: Trace Attempt  4	[0.02 s]
0.0.Bcustom2: Trace Attempt  5	[0.02 s]
0.0.Bcustom2: Trace Attempt  1	[0.05 s]
0.0.Bcustom2: Trace Attempt  2	[0.05 s]
0.0.Bcustom2: Trace Attempt  3	[0.05 s]
0.0.Bcustom2: Trace Attempt  4	[0.05 s]
0.0.Bcustom2: Trace Attempt  5	[0.05 s]
0.0.AM: Trace Attempt 773	[180.75 s]
0.0.AM: Stopped processing property "DELAY.p1"	[181.10 s].
0.0.AM: Morphing to AMcustom3
0.0.AM: All properties determined. [0.00 s]
0.0.AM: Exited with Success (@ 0.00 s)
0.0.AMcustom3: clocks: 1, declared: 1, looping: 0, posedge: 1, negedge: 0, noedge: 0, bothedge: 0
0.0.AMcustom3: Starting proof for property "DELAY.p1"	[0.00 s].
0.0.AMcustom3: Trace Attempt  1	[0.00 s]
0.0.AMcustom3: Trace Attempt  2	[0.00 s]
0.0.AMcustom3: Trace Attempt  3	[0.00 s]
0.0.AMcustom3: Trace Attempt  4	[0.00 s]
0.0.AMcustom3: Trace Attempt  5	[0.00 s]
0.0.AMcustom3: Trace Attempt  1	[0.00 s]
0.0.AMcustom3: Trace Attempt  2	[0.00 s]
0.0.AMcustom3: Trace Attempt  3	[0.00 s]
0.0.AMcustom3: Trace Attempt  4	[0.00 s]
0.0.AMcustom3: Trace Attempt  5	[0.00 s]
0.0.Tri: Proofgrid shell started at 32401@vlsi-ria85(local) jg_25888_vlsi-ria85_1
0.0.D: Proofgrid shell started at 32405@vlsi-ria85(local) jg_25888_vlsi-ria85_1
0.0.AMcustom3: Trace Attempt  1	[0.01 s]
0.0.AMcustom3: Trace Attempt  2	[0.01 s]
0.0.AMcustom3: Trace Attempt  3	[0.01 s]
0.0.Tri: clocks: 1, declared: 1, looping: 0, posedge: 1, negedge: 0, noedge: 0, bothedge: 0
0.0.D: clocks: 1, declared: 1, looping: 0, posedge: 1, negedge: 0, noedge: 0, bothedge: 0
0.0.D: Last scan. Per property time limit: 0s
0.0.D: Starting proof for property "DELAY.p1"	[0.00 s].
0.0.D: Trace Attempt  1	[0.00 s]
0.0.D: Trace Attempt  2	[0.00 s]
0.0.D: Trace Attempt  4	[0.00 s]
0.0.AMcustom3: Trace Attempt  4	[0.01 s]
0.0.AMcustom3: Trace Attempt  5	[0.01 s]
0.0.Tri: Last scan. Per property time limit: 0s
0.0.Tri: Starting proof for property "DELAY.p1"	[0.00 s].
0.0.Tri: Trace Attempt  1	[0.00 s]
0.0.AMcustom3: Trace Attempt  1	[0.03 s]
0.0.AMcustom3: Trace Attempt  2	[0.03 s]
0.0.AMcustom3: Trace Attempt  3	[0.03 s]
0.0.AMcustom3: Trace Attempt  4	[0.03 s]
0.0.AMcustom3: Trace Attempt  5	[0.04 s]
0.0.Bcustom2: Trace Attempt  1	[0.21 s]
0.0.Bcustom2: Trace Attempt  2	[0.21 s]
0.0.Bcustom2: Trace Attempt  3	[0.21 s]
0.0.Bcustom2: Trace Attempt  4	[0.21 s]
0.0.Bcustom2: Trace Attempt  5	[0.21 s]
0.0.AMcustom3: Trace Attempt  1	[0.12 s]
0.0.AMcustom3: Trace Attempt  2	[0.12 s]
0.0.AMcustom3: Trace Attempt  3	[0.12 s]
0.0.AMcustom3: Trace Attempt  4	[0.12 s]
0.0.AMcustom3: Trace Attempt  5	[0.12 s]
0.0.Tri:    0.00" ---- Launching main thread ----
0.0.Ht: Trace Attempt 6746	[181.33 s]
0.0.Tri:    0.29" ---- Launching abstraction thread ----
0.0.AMcustom3: Trace Attempt  1	[0.40 s]
0.0.AMcustom3: Trace Attempt  2	[0.40 s]
0.0.AMcustom3: Trace Attempt  3	[0.40 s]
0.0.AMcustom3: Trace Attempt  4	[0.40 s]
0.0.AMcustom3: Trace Attempt  5	[0.40 s]
0.0.Tri:    0.32" ---- Launching multi-phase simplification thread ----
0.0.Bcustom2: Trace Attempt  1	[0.60 s]
0.0.Bcustom2: Trace Attempt  2	[0.60 s]
0.0.Bcustom2: Trace Attempt  3	[0.60 s]
0.0.Bcustom2: Trace Attempt  4	[0.60 s]
0.0.Bcustom2: Trace Attempt  5	[0.60 s]
0.0.Tri:    0.44" ---- Launching liveness simplification thread ----
0.0.Bm: Trace Attempt 5132	[182.14 s]
0.0.Hp: Trace Attempt 2468	[182.49 s]
0.0.D: Trace Attempt 64	[0.77 s]
0.0.D: Stopped processing property "DELAY.p1"	[1.34 s].
0.0.D: Morphing to M
0.0.D: All properties determined. [0.00 s]
0.0.D: Exited with Success (@ 0.00 s)
0.0.M: clocks: 1, declared: 1, looping: 0, posedge: 1, negedge: 0, noedge: 0, bothedge: 0
0.0.M: Starting proof for property "DELAY.p1"	[0.00 s].
0.0.M: Trace Attempt  1	[0.00 s]
0.0.M: Trace Attempt  2	[0.00 s]
0.0.M: Trace Attempt  3	[0.00 s]
0.0.M: Trace Attempt  4	[0.00 s]
0.0.M: Trace Attempt  5	[0.00 s]
0.0.Tri:    1.28" Simplification phase 1 complete
0.0.Ncustom1: Requesting engine job to terminate
0.0.Bcustom2: Requesting engine job to terminate
0.0.AMcustom3: Requesting engine job to terminate
0.0.Tri: Requesting engine job to terminate
0.0.M: Requesting engine job to terminate
0.0.Hp: Requesting engine job to terminate
0.0.Ht: Requesting engine job to terminate
0.0.Bm: Requesting engine job to terminate
INFO (IPF144): 0: Initiating shutdown of proof [182.62 s]
0.0.Tri: A proof was found: No trace exists. [1.42 s]
INFO (IPF057): 0.0.Tri: The property "DELAY.p1" was proven in 1.43 s.
0.0.M: Trace Attempt 25	[0.09 s]
0.0.M: Stopped processing property "DELAY.p1"	[0.09 s].
0.0.M: All properties determined. [0.10 s]
0.0.AMcustom3: Trace Attempt 113	[1.45 s]
0.0.AMcustom3: Stopped processing property "DELAY.p1"	[1.46 s].
0.0.M: Exited with Success (@ 182.63 s)
0: ProofGrid usable level: 0
0.0.AMcustom3: All properties determined. [1.47 s]
0.0.AMcustom3: Exited with Success (@ 182.63 s)
0.0.Ncustom1: Stopped processing property "DELAY.p1"	[1.62 s].
0.0.Ncustom1: All properties determined. [1.63 s]
0.0.Ht: Trace Attempt 6773	[182.56 s]
0.0.Ht: All properties determined. [182.60 s]
0.0.Ncustom1: Exited with Success (@ 182.64 s)
0.0.Hp: All properties determined. [182.65 s]
0.0.AMcustom5: Proofgrid shell started at 32538@vlsi-ria85(local) jg_25888_vlsi-ria85_1
0.0.AMcustom5: Requesting engine job to terminate
0.0.AMcustom5: Preventing job from starting because proof is shutting down.
0.0.AMcustom5: Requesting engine job to terminate
0.0.AMcustom5: Interrupted. [0.00 s]
0.0.AMcustom5: Exited with Success (@ 182.67 s)
0.0.Ht: Exited with Success (@ 182.68 s)
0.0.Bm: Trace Attempt 5134	[182.51 s]
0.0.Bm: All properties determined. [182.64 s]
0.0.Bm: Exited with Success (@ 182.69 s)
0.0.Bcustom2: Trace Attempt  1	[1.67 s]
0.0.Bcustom2: Stopped processing property "DELAY.p1"	[1.67 s].
0.0.Bcustom2: All properties determined. [1.67 s]
0.0.Bcustom2: Exited with Success (@ 182.75 s)
0.0.Hp: Exited with Success (@ 182.79 s)
0.0.Tri: Stopped processing property "DELAY.p1"	[1.62 s].
0.0.Tri: All properties determined. [1.62 s]
0.0.Tri: Exited with Success (@ 182.82 s)
0: --------------------------------------------------------------
ProofGrid Summary (utilization 99.92 %)
--------------------------------------------------------------
     engines started                               :    16
     engine jobs started                           :    12
     jobs where 1 minute load exceeded core count  :     3

    Average time in state (seconds)
    ------------------------------------------------------
    Engine  Pending     Running        Dead    Utilization
    ------------------------------------------------------
     Hp        0.03      182.62        0.00       99.98 %
     Ht        0.04      182.58        0.00       99.98 %
     Bm        0.04      182.58        0.00       99.98 %
    Mpcustom4        0.04        0.00        0.00        0.56 %
     Oh        0.08        0.00        0.00        2.50 %
      L        0.06        0.01        0.00       10.63 %
    Ncustom1        0.04      182.60        0.00       99.98 %
    Bcustom2        0.04      182.51        0.00       99.98 %
    AMcustom3        0.03      182.42        0.00       99.98 %
    Tri        0.17        1.45        0.00       89.74 %
      M        0.14        1.42        0.00       90.88 %
    AMcustom5        0.16        0.00        0.00        0.00 %
    all        0.07       91.52        0.00       99.92 %

    Total time in state (seconds)
    -----------------------------------------
            Pending     Running        Dead  
    -----------------------------------------
               0.86     1098.20        0.00

    Data read    : 8.30 MiB
    Data written : 4.56 kiB

0: All pending notifications were processed.
INFO (IPF059): 0: Completed proof on task: "<embedded>"

==============================================================
SUMMARY
==============================================================
           Properties Considered              : 2
                 assertions                   : 1
                  - proven                    : 1 (100%)
                  - bounded_proven (user)     : 0 (0%)
                  - bounded_proven (auto)     : 0 (0%)
                  - marked_proven             : 0 (0%)
                  - cex                       : 0 (0%)
                  - ar_cex                    : 0 (0%)
                  - undetermined              : 0 (0%)
                  - unknown                   : 0 (0%)
                  - error                     : 0 (0%)
                 covers                       : 1
                  - unreachable               : 0 (0%)
                  - bounded_unreachable (user): 0 (0%)
                  - covered                   : 1 (100%)
                  - ar_covered                : 0 (0%)
                  - undetermined              : 0 (0%)
                  - unknown                   : 0 (0%)
                  - error                     : 0 (0%)
determined
[<embedded>] % exit -force
[<embedded>] % INFO (IPL005): Received request to exit from the console.
INFO (IPL014): Waiting for the Tcl-thread to exit.
INFO: Waiting for proof threads to stop...
INFO: Proof threads stopped.
INFO (IPL018): The peak resident set memory use for this session was 1.669 GB.
INFO (IPL015): The Tcl-thread exited with status 0.
INFO (IPL016): Exiting the analysis session with status 0.
Finished delay_3.tcl successfully
