Jasper Apps 2024.06p002 64 bits 2024.09.02 16:28:38 UTC

Any disclosure about the Cadence Design Systems software or its use
model to any third party violates the written Non-Disclosure Agreement
between Cadence Design Systems, Inc. and the customer.

THIS SOFTWARE CONTAINS CONFIDENTIAL INFORMATION AND TRADE SECRETS OF
CADENCE DESIGN SYSTEMS, INC. USE, DISCLOSURE, OR REPRODUCTION IS
PROHIBITED WITHOUT THE PRIOR EXPRESS WRITTEN PERMISSION OF CADENCE
DESIGN SYSTEMS, INC.

Copyright (C) 2000-2024 Cadence Design Systems, Inc. All Rights
Reserved.  Unpublished -- rights reserved under the copyright laws of
the United States.

This product includes software developed by others and redistributed
according to license agreement. See doc/third_party_readme.txt for
further details.

RESTRICTED RIGHTS LEGEND

Use, duplication, or disclosure by the Government is subject to
restrictions as set forth in subparagraph (c) (1) (ii) of the Rights in
Technical Data and Computer Software clause at DFARS 252.227-7013 or
subparagraphs (c) (1) and (2) of Commercial Computer Software -- Restricted
Rights at 48 CFR 52.227-19, as applicable.


                          Cadence Design Systems, Inc.
                          2655 Seely Avenue
                          San Jose, CA 95134
                          Phone: 408.943.1234

For technical assistance visit http://support.cadence.com.

Jasper Apps Analysis Session - /users/rompel/jasper_executions/safety/jgprojects/blink_14/sessionLogs/session_0

WARNING (WG017): [session]: The system's locale is "ANSI_X3.4-1968", which is not UTF-8. Non-ASCII characters might not be handled correctly.
WARNING (WG017): [jg_console]: The system's locale is "ANSI_X3.4-1968", which is not UTF-8. Non-ASCII characters might not be handled correctly.
INFO: successfully checked out license "jasper_fao".
INFO: reading configuration file "/users/rompel/.config/cadence/jasper.conf".
% analyze -sv09 ../blink_14.sv
[-- (VERI-1482)] Analyzing Verilog file '/tools/cadence2425/JASPER/jasper_2024.06p002/lib/verilog/packages/std/std.sv' into library 'std'
[-- (VERI-1482)] Analyzing Verilog file '../blink_14.sv'
% elaborate -bbox_mul 1000000 -bbox_div 1000000 -bbox_mod 1000000 -bbox_a 1000000
[INFO (HIER-8002)] ../blink_14.sv(18): Disabling old hierarchical reference handler
[INFO (VERI-1018)] ../blink_14.sv(1): compiling module 'BLINK'
[WARN (VERI-1209)] ../blink_14.sv(10): expression size 32 truncated to fit in target size 21
INFO (ISW003): Top module name is "BLINK".
INFO (INL208): Elaboration synthesis summary:
  Number of synthesized netlists          1 (0 packages)
  Single run mode                         On
  Pipeline                                On (1 pipelined netlists)
  Late hierarchical reference connection  On
  Number of analyzed Verilog modules      1 (1 synthesized)
  Number of analyzed VHDL entities        0 (0 synthesized)
INFO (INL003): Clearing all state information (assumes, stopats, and so forth).
BLINK
[<embedded>] % reset rst
INFO (IPM031): Clearing proof results of all properties.
INFO (IRS006): Current reset condition is "rst".
[<embedded>] % clock clk
[<embedded>] % prove -all
Ncustom1: Custom engine code is hT3Ng7hPPfiYQOTDZ3qhYOwGAM51eA+J/FjkM5shLioAsqhgLR4Ft+O1BuKG6ilQ83B9tLXSl+CwjiTMAQA
Bcustom2: Custom engine code is hT3Nm7hPr1Vp3Di1Ra2USNIGL4JypRnLKLAdF6JAyuavO2JfGCiY9OZJhcAcOUnLx5xwNdhILGrAWX9s+z2WDkKwNR7tAfClBEjRFVQeq6DU54boFgEA
AMcustom3: Custom engine code is hT3Ng7hP/feYQOTDZ3qhYOwGAM51eA+J/FjkM5shLioAsqhgLR4Ft+O1BuKG6ilQ83B9tLXSmmqwm7g9AQA
Mpcustom4: Custom engine code is hT3NZbhP9fmY2AbBQnsjfOxn6c+6e6yL+/e8fZFmaQrnlgEA
INFO (IPF036): Starting proof on task: "<embedded>", 1 properties to prove with 0 already proven/unreachable
INFO (IRS029): Starting reset analysis: phase 1 of 4.
INFO (IRS030): Running reset analysis: phase 2 of 4.
INFO (IRS031): Running reset analysis: phase 3 of 4.
INFO (IRS020): Starting the reset analysis simulation with a limit of 100 iterations (phase 4 of 4).
INFO (IRS024): Reset iterations 0 to 4 analyzed.
INFO (IRS018): Reset analysis simulation executed for 3 iterations. Assigned values for 22 of 24 design flops, 0 of 0 design latches, 3 of 3 internal elements.
INFO (IRS039): Reset analysis complete.
INFO (IPF031): Settings used for proof thread 0:
    orchestration                 = on
    time_limit                    = 86400s
    per_property_time_limit       = 1s * 10 ^ scan
    engine_mode                   = auto
    proofgrid_per_engine_max_jobs = 1
    max engine jobs               = auto
    proofgrid_mode                = local
    proofgrid_restarts            = 10
0: Using multistage preprocessing
AMcustom5: Custom engine code is hT3N1rhP11/52HrFRS21ROp2LOjVTgPvT8L8BGXHgLhaIuqtT4nARFjUqrBL+7pLmaTOzBepZW/Jm8SSrHDybSQtoNiO3y43wk+dEoWlsZizu97Fih6O6lPVG/LpWP5SsUPwlGagLNa1FKEFvwVXyX7//8prySbvSxIHXr5er+z4RAEA
0: Starting reduce
Ncustom6: Custom engine code is hT3OXrhPByJp3TrFSTLhUmMH4KVtJgmTCnNDF46yMXOKY48m4LS5nE7yBzFjA7kDuwO/GhGUpEPiky3p3wmPn3dJZHxFMsafSoObRzSC+tn7sEY0WbTdZ/FV4hL3MYH/b1CIUvXSWR4wqEoVLsmMOD4xIPT4lI1LO6ZCO7PnnWQuLwetnvKlrXx6wCW/A+x+enqslg1YPobi4wEF/EvbzOvcTYdJvl2s4H2yZg2b2ofAVN5WvhWk1HoBAA
ADcustom7: Custom engine code is hT3Nv7hPv1752HrFRa2kROx2f/ECJeZB2AZsLdlO8VwmIuqtT4nIDFXclhg+O+o+DMmQCekbheGk0kK28laA9gaOFDXsQp29J3X615HY1IPHJWd6FUFvCHjO+p1k652b5JJvZlShNpGlGSXAiQe/mEAj6tEBAA
Tricustom8: Custom engine code is hT3Nu7hPt1752DvFRa0kNDiyIV97VyejwM9C/jCLJjdPvusZONHY42VYUy0Q1ZotnhcVtNc56tJ5wbxv6V2+XpdsaSlHck5vfnbYjdwj1OECy9U+7oSQ0SZE3g5ayD+Phuh4odCJTjeKa2k4elM9ldQfkAEA
Gcustom9: Custom engine code is hT3NibhPDfeYQADBZnYcglOvK9Pfd7EOeniIqP8jNsyIqInncipMGcUXqAadachREE9F2PwhBUZUNw5kHnd4JdXkamORRgEA
C2custom10: Custom engine code is hT3NirhPjfWYQADBZnYcglOvK9Pfd7EOeniIqP8jNsyIqInncgkrYMMXCYbdK0dUjZIF9d4cJ0rHoBDjwVLBKuG86XYVV00BAA
AGcustom11: Custom engine code is hT3NirhP/fmYQADBZnYcglOvK9Pfd7EOeniIqP8jNsyIqInnckcwYMMXCYbdK0dUjZIF9d4cJ0rHoBDjwVLBKuHEZnZByh0BAA
Bcustom12: Custom engine code is hT3NjrhPDfiYQADBZnYcglOvK9PfWxFtenjIyBqfrgr7if/jL/yPOuK1BAflEcW0DxNH2eDIoezN2gxlQFg81RZtiWXh7aiTAidvAQA
Ncustom13: Custom engine code is hT3NR7hPByFp3TrFSTLhUmMH4KWtJglTyV/c51BHEeZWamnJv767nE6PCak26bd3gf3XGN3rIRheufhDieCJQVISo+gNYUKhiUedBKGtsP/a18svAnlMJZudHxDFwK5ufsyoxsIyiAeSY2oi3tEuoDHr5gw42DFKAG3PqO3CEsl8Azzdt3pl5nGA1Ifv2H02eYsFzWb/nfp8PMb3F0krE/EgBcm8TD9Div8BAA
Tricustom14: Custom engine code is hT3Nu7hP3fiYQADBZnYcglNHp9bfd7EOeniIqP/ji8sGLQu8yhsFO+wxJ+O+R0bU8g/IewXFomyos+viQnWc2xYNYmMqpo3i40O7DaZR7qfp4YqNx26KRvQ/qx0BAA
0: Finished reduce in 0s
0.0.PRE: Performing Proof Simplification...
0.0.N: clocks: 1, declared: 1, looping: 0, posedge: 1, negedge: 0, noedge: 0, bothedge: 0
0.0.N: Proof Simplification Iteration 1	[0.00 s]
0.0.PRE: A proof was found: No trace exists. [0.00 s]
INFO (IPF057): 0.0.PRE: The property ":noDeadEnd" was proven in 0.00 s.
    Use check_assumptions -show -dead_end to show this property in the property table.
0.0.PRE: A proof was found: No trace exists. [0.00 s]
INFO (IPF057): 0.0.PRE: The property ":noConflict" was proven in 0.00 s.
    Use check_assumptions -show to show this property in the property table.
INFO (IPF047): 0.0.PRE: The cover property ":live" was covered in 1 cycles in 0.00 s.
    Use check_assumptions -show -live to show this property in the property table.
0.0.PRE: Proof Simplification completed in 0.00 s
0: About to start ProofGrid in its own thread with a limit of 10000 pending notifications and a limit of 10 traces.
0: =============================== ProofGrid start ===============================
0: ProofGrid usable level: 1
0: Initial ProofGrid level: 1
0: ProofGrid is starting event handling
0.0.N: Proofgrid shell started at 5285@vlsi-ria85(local) jg_4945_vlsi-ria85_1
0.0.Hp: Proofgrid shell started at 5288@vlsi-ria85(local) jg_4945_vlsi-ria85_1
0.0.N: clocks: 1, declared: 1, looping: 0, posedge: 1, negedge: 0, noedge: 0, bothedge: 0
0.0.N: Last scan. Per property time limit: 0s
0.0.N: Starting proof for property "BLINK.p1"	[0.00 s].
0.0.N: Trace Attempt  1	[0.00 s]
0.0.Hp: clocks: 1, declared: 1, looping: 0, posedge: 1, negedge: 0, noedge: 0, bothedge: 0
0.0.N: Trace Attempt  2	[0.00 s]
0.0.Hp: Last scan. Per property time limit: 0s
0.0.N: Trace Attempt  2	[0.00 s]
0.0.N: Trace Attempt  3	[0.00 s]
0.0.Hp: Trace Attempt  1	[0.00 s]
0.0.N: Trace Attempt  3	[0.00 s]
0.0.N: Trace Attempt  4	[0.00 s]
0.0.N: Trace Attempt  5	[0.00 s]
0.0.N: Trace Attempt  1	[0.00 s]
0.0.N: Trace Attempt  2	[0.00 s]
0.0.N: Trace Attempt  3	[0.00 s]
0.0.N: Trace Attempt  4	[0.01 s]
0.0.Hp: Trace Attempt  2	[0.00 s]
0.0.Hp: Trace Attempt  3	[0.00 s]
0.0.Hp: Trace Attempt  4	[0.00 s]
0.0.Hp: Trace Attempt  5	[0.00 s]
0.0.N: Trace Attempt  5	[0.01 s]
0.0.Oh: Proofgrid shell started at 5542@vlsi-ria85(local) jg_4945_vlsi-ria85_1
0.0.Oh: clocks: 1, declared: 1, looping: 0, posedge: 1, negedge: 0, noedge: 0, bothedge: 0
0.0.Oh: Reached length limit (2147483647) [0.00 s]
0.0.Oh: Exited with Success (@ 0.04 s)
0.0.Ht: Proofgrid shell started at 5533@vlsi-ria85(local) jg_4945_vlsi-ria85_1
0.0.B: Proofgrid shell started at 5543@vlsi-ria85(local) jg_4945_vlsi-ria85_1
0.0.AM: Proofgrid shell started at 5544@vlsi-ria85(local) jg_4945_vlsi-ria85_1
0.0.Ht: clocks: 1, declared: 1, looping: 0, posedge: 1, negedge: 0, noedge: 0, bothedge: 0
0.0.Ht: Last scan. Per property time limit: 0s
0.0.Ht: Trace Attempt  1	[0.00 s]
0.0.Ht: Trace Attempt  2	[0.00 s]
0.0.Ht: Trace Attempt  3	[0.00 s]
0.0.Ht: Trace Attempt  4	[0.00 s]
0.0.Ht: Trace Attempt  5	[0.00 s]
0.0.B: clocks: 1, declared: 1, looping: 0, posedge: 1, negedge: 0, noedge: 0, bothedge: 0
0.0.B: Last scan. Per property time limit: 0s
0.0.B: Starting proof for property "BLINK.p1"	[0.00 s].
0.0.B: Trace Attempt  1	[0.00 s]
0.0.B: Trace Attempt  2	[0.00 s]
0.0.B: Trace Attempt  3	[0.00 s]
0.0.B: Trace Attempt  4	[0.00 s]
0.0.B: Trace Attempt  5	[0.00 s]
0.0.AM: clocks: 1, declared: 1, looping: 0, posedge: 1, negedge: 0, noedge: 0, bothedge: 0
0.0.AM: Last scan. Per property time limit: 0s
0.0.AM: Starting proof for property "BLINK.p1"	[0.00 s].
0.0.AM: Trace Attempt  1	[0.00 s]
0.0.AM: Trace Attempt  2	[0.00 s]
0.0.AM: Trace Attempt  3	[0.00 s]
0.0.AM: Trace Attempt  4	[0.00 s]
0.0.AM: Trace Attempt  5	[0.00 s]
0.0.AM: Trace Attempt  1	[0.00 s]
0.0.AM: Trace Attempt  2	[0.00 s]
0.0.AM: Trace Attempt  3	[0.00 s]
0.0.AM: Trace Attempt  4	[0.01 s]
0.0.AM: Trace Attempt  5	[0.01 s]
0.0.AM: Trace Attempt  1	[0.02 s]
0.0.AM: Trace Attempt  2	[0.02 s]
0.0.AM: Trace Attempt  3	[0.02 s]
0.0.AM: Trace Attempt  4	[0.02 s]
0.0.AM: Trace Attempt  5	[0.02 s]
0.0.AM: Trace Attempt  1	[0.06 s]
0.0.AM: Trace Attempt  2	[0.06 s]
0.0.AM: Trace Attempt  3	[0.06 s]
0.0.AM: Trace Attempt  4	[0.06 s]
0.0.AM: Trace Attempt  5	[0.06 s]
0.0.AM: Trace Attempt  1	[0.13 s]
0.0.AM: Trace Attempt  2	[0.14 s]
0.0.AM: Trace Attempt  3	[0.14 s]
0.0.AM: Trace Attempt  4	[0.14 s]
0.0.AM: Trace Attempt  5	[0.14 s]
0.0.AM: Trace Attempt  1	[0.36 s]
0.0.AM: Trace Attempt  2	[0.36 s]
0.0.AM: Trace Attempt  3	[0.36 s]
0.0.AM: Trace Attempt  4	[0.36 s]
0.0.AM: Trace Attempt  5	[0.37 s]
0.0.AM: Trace Attempt  1	[0.87 s]
0.0.AM: Trace Attempt  2	[0.87 s]
0.0.AM: Trace Attempt  3	[0.87 s]
0.0.AM: Trace Attempt  4	[0.87 s]
0.0.AM: Trace Attempt  5	[0.87 s]
0.0.AM: Trace Attempt  1	[2.63 s]
0.0.AM: Trace Attempt  2	[2.63 s]
0.0.AM: Trace Attempt  3	[2.63 s]
0.0.AM: Trace Attempt  4	[2.63 s]
0.0.AM: Trace Attempt  5	[2.64 s]
0.0.Hp: Trace Attempt 570	[4.00 s]
0.0.Ht: Trace Attempt 1702	[4.00 s]
0.0.B: Trace Attempt 1810	[4.00 s]
0.0.N: Trace Attempt 140	[4.07 s]
0.0.AM: Trace Attempt 342	[6.64 s]
0.0.Hp: Trace Attempt 789	[8.01 s]
0.0.Ht: Trace Attempt 2314	[8.01 s]
0.0.B: Trace Attempt 2491	[8.01 s]
0.0.N: Trace Attempt 183	[8.30 s]
0.0.AM: Trace Attempt  1	[8.50 s]
0.0.AM: Trace Attempt  2	[8.50 s]
0.0.AM: Trace Attempt  3	[8.50 s]
0.0.AM: Trace Attempt  4	[8.51 s]
0.0.AM: Trace Attempt  5	[8.51 s]
0.0.Hp: Trace Attempt 962	[12.03 s]
0.0.B: Trace Attempt 3019	[12.01 s]
0.0.Ht: Trace Attempt 2817	[12.01 s]
0.0.N: Trace Attempt 214	[12.31 s]
0.0.AM: Trace Attempt 462	[12.54 s]
0.0.Hp: Trace Attempt 1109	[16.05 s]
0.0.B: Trace Attempt 3471	[16.02 s]
0.0.Ht: Trace Attempt 3231	[16.02 s]
0.0.AM: Trace Attempt 734	[16.75 s]
0.0.N: Trace Attempt 293	[19.38 s]
0.0.Hp: Trace Attempt 1238	[20.05 s]
0.0.Ht: Trace Attempt 3603	[20.02 s]
0.0.B: Trace Attempt 3879	[20.02 s]
0.0.AM: Trace Attempt 836	[20.75 s]
0.0.N: Trace Attempt 376	[23.84 s]
0.0.Ht: Trace Attempt 3931	[24.03 s]
0.0.B: Trace Attempt 4235	[24.03 s]
0.0.Hp: Trace Attempt 1353	[24.07 s]
0.0.AM: Trace Attempt 865	[24.84 s]
0.0.Ht: Trace Attempt 4220	[28.03 s]
0.0.B: Trace Attempt 4546	[28.03 s]
0.0.Hp: Trace Attempt 1460	[28.09 s]
0.0.N: Trace Attempt 411	[28.59 s]
0.0.AM: Trace Attempt 887	[28.88 s]
0.0.B: Trace Attempt 4824	[32.04 s]
0.0.Ht: Trace Attempt 4474	[32.04 s]
0.0.Hp: Trace Attempt 1556	[32.09 s]
0.0.AM: Trace Attempt 695	[32.90 s]
0.0.N: Trace Attempt 414	[32.94 s]
0.0.Ht: Trace Attempt 4706	[36.05 s]
0.0.B: Trace Attempt 5078	[36.05 s]
0.0.Hp: Trace Attempt 1643	[36.11 s]
0.0.AM: Trace Attempt 892	[36.90 s]
0.0.N: Trace Attempt 419	[38.74 s]
0.0.B: Trace Attempt 5321	[40.05 s]
0.0.Ht: Trace Attempt 4927	[40.07 s]
0.0.Hp: Trace Attempt 1726	[40.11 s]
0.0.AM: Trace Attempt  1	[40.55 s]
0.0.AM: Trace Attempt  2	[40.55 s]
0.0.AM: Trace Attempt  3	[40.55 s]
0.0.AM: Trace Attempt  4	[40.56 s]
0.0.AM: Trace Attempt  5	[40.56 s]
0.0.N: Trace Attempt 447	[44.06 s]
0.0.B: Trace Attempt 5573	[44.06 s]
0.0.Ht: Trace Attempt 5158	[44.07 s]
0.0.Hp: Trace Attempt 1809	[44.12 s]
0.0.AM: Trace Attempt 435	[44.58 s]
0.0.B: Trace Attempt 5817	[48.08 s]
0.0.Ht: Trace Attempt 5385	[48.09 s]
0.0.Hp: Trace Attempt 1885	[48.13 s]
0.0.AM: Trace Attempt 654	[48.61 s]
0.0.N: Trace Attempt 456	[49.03 s]
0.0.Ht: Trace Attempt 5592	[52.09 s]
0.0.B: Trace Attempt 6049	[52.09 s]
0.0.Hp: Trace Attempt 1963	[52.18 s]
0.0.AM: Trace Attempt 865	[52.73 s]
0.0.N: Trace Attempt 477	[53.11 s]
0.0.Ht: Trace Attempt 5783	[56.09 s]
0.0.B: Trace Attempt 6278	[56.09 s]
0.0.Hp: Trace Attempt 2038	[56.23 s]
0.0.AM: Trace Attempt 947	[56.76 s]
0.0.N: Trace Attempt 494	[57.66 s]
0.0.Ht: Trace Attempt 5978	[60.10 s]
0.0.B: Trace Attempt 6502	[60.11 s]
0.0.Hp: Trace Attempt 2109	[60.28 s]
0.0.AM: Trace Attempt 1170	[60.76 s]
0.0.N: Trace Attempt 498	[61.96 s]
0.0.Ht: Trace Attempt 6178	[64.10 s]
0.0.B: Trace Attempt 6715	[64.12 s]
0.0.Hp: Trace Attempt 2174	[64.33 s]
0.0.AM: Trace Attempt 1345	[64.76 s]
0.0.Ht: Trace Attempt 6374	[68.11 s]
0.0.B: Trace Attempt 6917	[68.13 s]
0.0.Hp: Trace Attempt 2237	[68.35 s]
0.0.N: Trace Attempt 500	[68.68 s]
0.0.AM: Trace Attempt 1662	[68.82 s]
0.0.Ht: Trace Attempt 6558	[72.11 s]
0.0.B: Trace Attempt 7112	[72.14 s]
0.0.Hp: Trace Attempt 2299	[72.40 s]
0.0.AM: Trace Attempt 1691	[72.91 s]
0.0.N: Trace Attempt 502	[73.44 s]
0.0.Ht: Trace Attempt 6742	[76.12 s]
0.0.B: Trace Attempt 7299	[76.15 s]
0.0.Hp: Trace Attempt 2356	[76.41 s]
0.0.AM: Trace Attempt 1706	[77.38 s]
0.0.N: Trace Attempt 504	[77.57 s]
0.0.Ht: Trace Attempt 6924	[80.12 s]
0.0.B: Trace Attempt 7483	[80.16 s]
0.0.Hp: Trace Attempt 2414	[80.45 s]
0.0.AM: Trace Attempt 1719	[82.08 s]
0.0.Ht: Trace Attempt 7096	[84.12 s]
0.0.B: Trace Attempt 7665	[84.17 s]
0.0.Hp: Trace Attempt 2471	[84.47 s]
0.0.AM: Trace Attempt 1732	[86.43 s]
0.0.N: Trace Attempt 506	[86.49 s]
0.0.Ht: Trace Attempt 7264	[88.13 s]
0.0.B: Trace Attempt 7842	[88.18 s]
0.0.Hp: Trace Attempt 2527	[88.51 s]
0.0.AM: Trace Attempt 1740	[91.02 s]
0.0.N: Trace Attempt 563	[91.50 s]
0.0.Ht: Trace Attempt 7432	[92.13 s]
0.0.B: Trace Attempt 8014	[92.19 s]
0.0.Hp: Trace Attempt 2581	[92.54 s]
0.0.AM: Trace Attempt 1750	[95.13 s]
0.0.Ht: Trace Attempt 7585	[96.14 s]
0.0.B: Trace Attempt 8180	[96.21 s]
0.0.N: Trace Attempt 599	[96.33 s]
0.0.Hp: Trace Attempt 2634	[96.60 s]
0.0.AM: Trace Attempt 1756	[99.35 s]
0.0.Ht: Trace Attempt 7735	[100.14 s]
0.0.B: Trace Attempt 8344	[100.22 s]
0.0.Hp: Trace Attempt 2688	[100.66 s]
0.0.N: Trace Attempt 609	[101.79 s]
0.0.AM: Trace Attempt 1765	[103.83 s]
0.0.Ht: Trace Attempt 7883	[104.16 s]
0.0.B: Trace Attempt 8504	[104.23 s]
0.0.Hp: Trace Attempt 2741	[104.67 s]
0.0.N: Trace Attempt 1021	[107.46 s]
0.0.AM: Trace Attempt 1772	[107.92 s]
0.0.Ht: Trace Attempt 8027	[108.17 s]
0.0.B: Trace Attempt 8663	[108.25 s]
0.0.Hp: Trace Attempt 2794	[108.72 s]
0.0.N: Trace Attempt 1069	[111.69 s]
0.0.Ht: Trace Attempt 8174	[112.19 s]
0.0.B: Trace Attempt 8812	[112.25 s]
0.0.AM: Trace Attempt 1028	[112.53 s]
0.0.Hp: Trace Attempt 2844	[112.80 s]
0.0.N: Trace Attempt 1113	[115.74 s]
0.0.Ht: Trace Attempt 8295	[116.22 s]
0.0.B: Trace Attempt 8949	[116.26 s]
0.0.AM: Trace Attempt 1143	[116.56 s]
0.0.Hp: Trace Attempt 2891	[116.88 s]
0.0.N: Trace Attempt 1140	[119.93 s]
0.0.Ht: Trace Attempt 8432	[120.23 s]
0.0.B: Trace Attempt 9084	[120.28 s]
0.0.AM: Trace Attempt 1246	[120.59 s]
0.0.Hp: Trace Attempt 2937	[120.96 s]
0.0.Ht: Trace Attempt 8549	[124.24 s]
0.0.B: Trace Attempt 9219	[124.31 s]
0.0.AM: Trace Attempt 1348	[124.61 s]
0.0.Hp: Trace Attempt 2982	[125.01 s]
0.0.Ht: Trace Attempt 8678	[128.25 s]
0.0.B: Trace Attempt 9347	[128.31 s]
0.0.AM: Trace Attempt 1450	[128.62 s]
0.0.Hp: Trace Attempt 3026	[129.05 s]
0.0.N: Trace Attempt 1180	[131.19 s]
0.0.Ht: Trace Attempt 8795	[132.28 s]
0.0.B: Trace Attempt 9477	[132.34 s]
0.0.AM: Trace Attempt 1545	[132.64 s]
0.0.Hp: Trace Attempt 3070	[133.10 s]
0.0.N: Trace Attempt 1181	[135.42 s]
0.0.Ht: Trace Attempt 8921	[136.30 s]
0.0.B: Trace Attempt 9603	[136.36 s]
0.0.Hp: Trace Attempt 3112	[137.14 s]
0.0.N: Trace Attempt 1195	[139.42 s]
0.0.Ht: Trace Attempt 9041	[140.33 s]
0.0.B: Trace Attempt 9733	[140.38 s]
0.0.Hp: Trace Attempt 3155	[141.21 s]
0.0.N: Trace Attempt 1239	[143.68 s]
0.0.AM: Trace Attempt 1604	[143.77 s]
0.0.Ht: Trace Attempt 9161	[144.34 s]
0.0.B: Trace Attempt 9855	[144.38 s]
0.0.Hp: Trace Attempt 3197	[145.30 s]
0.0.AM: Trace Attempt 1683	[147.78 s]
0.0.N: Trace Attempt 1263	[147.97 s]
0.0.Ht: Trace Attempt 9279	[148.35 s]
0.0.B: Trace Attempt 9981	[148.39 s]
0.0.Hp: Trace Attempt 3239	[149.30 s]
0.0.AM: Trace Attempt 1769	[151.82 s]
0.0.Ht: Trace Attempt 9398	[152.37 s]
0.0.B: Trace Attempt 10105	[152.42 s]
0.0.N: Trace Attempt 1269	[152.72 s]
0.0.Hp: Trace Attempt 3281	[153.40 s]
0.0.AM: Trace Attempt 1851	[155.87 s]
0.0.Ht: Trace Attempt 9517	[156.37 s]
0.0.B: Trace Attempt 10227	[156.45 s]
0.0.N: Trace Attempt 1272	[156.82 s]
0.0.Hp: Trace Attempt 3322	[157.45 s]
0.0.AM: Trace Attempt 1929	[159.93 s]
0.0.Ht: Trace Attempt 9628	[160.39 s]
0.0.B: Trace Attempt 10345	[160.46 s]
0.0.Hp: Trace Attempt 3362	[161.54 s]
0.0.AM: Trace Attempt 2003	[163.97 s]
0.0.Ht: Trace Attempt 9748	[164.41 s]
0.0.B: Trace Attempt 10462	[164.48 s]
0.0.Hp: Trace Attempt 3401	[165.60 s]
0.0.N: Trace Attempt 1273	[165.80 s]
0.0.Ht: Trace Attempt 9851	[168.43 s]
0.0.B: Trace Attempt 10576	[168.48 s]
0.0.Hp: Trace Attempt 3439	[169.63 s]
0.0.N: Trace Attempt 1435	[170.03 s]
0.0.Ht: Trace Attempt 9968	[172.45 s]
0.0.B: Trace Attempt 10686	[172.51 s]
0.0.Hp: Trace Attempt 3476	[173.64 s]
0.0.N: Trace Attempt 1483	[174.12 s]
0.0.AM: Trace Attempt 2049	[176.27 s]
0.0.Ht: Trace Attempt 10070	[176.46 s]
0.0.B: Trace Attempt 10796	[176.53 s]
0.0.AM: Trace Attempt  1	[176.73 s]
0.0.AM: Trace Attempt  2	[176.73 s]
0.0.AM: Trace Attempt  3	[176.73 s]
0.0.AM: Trace Attempt  4	[176.74 s]
0.0.AM: Trace Attempt  5	[176.74 s]
0.0.Hp: Trace Attempt 3515	[177.70 s]
0.0.N: Trace Attempt 1537	[179.36 s]
0.0.Ht: Trace Attempt 10192	[180.48 s]
0.0.B: Trace Attempt 10917	[180.56 s]
0.0.AM: Trace Attempt 457	[180.78 s]
0.0.AM: Trace Attempt 489	[180.96 s]
0.0.AM: Stopped processing property "BLINK.p1"	[180.98 s].
0.0.AM: Morphing to AMcustom3
0.0.AM: All properties determined. [0.00 s]
0.0.AM: Exited with Success (@ 0.00 s)
0.0.AMcustom3: clocks: 1, declared: 1, looping: 0, posedge: 1, negedge: 0, noedge: 0, bothedge: 0
0.0.AMcustom3: Starting proof for property "BLINK.p1"	[0.00 s].
0.0.AMcustom3: Trace Attempt  1	[0.00 s]
0.0.AMcustom3: Trace Attempt  2	[0.00 s]
0.0.AMcustom3: Trace Attempt  3	[0.00 s]
0.0.AMcustom3: Trace Attempt  4	[0.00 s]
0.0.AMcustom3: Trace Attempt  5	[0.00 s]
0.0.AMcustom3: Trace Attempt  1	[0.00 s]
0.0.AMcustom3: Trace Attempt  2	[0.00 s]
0.0.AMcustom3: Trace Attempt  3	[0.00 s]
0.0.AMcustom3: Trace Attempt  4	[0.01 s]
0.0.AMcustom3: Trace Attempt  5	[0.01 s]
0.0.AMcustom3: Trace Attempt  1	[0.02 s]
0.0.AMcustom3: Trace Attempt  2	[0.02 s]
0.0.AMcustom3: Trace Attempt  3	[0.02 s]
0.0.AMcustom3: Trace Attempt  4	[0.03 s]
0.0.AMcustom3: Trace Attempt  5	[0.03 s]
0.0.Tri: Proofgrid shell started at 12216@vlsi-ria85(local) jg_4945_vlsi-ria85_1
0.0.Tri: clocks: 1, declared: 1, looping: 0, posedge: 1, negedge: 0, noedge: 0, bothedge: 0
0.0.Tri: Last scan. Per property time limit: 0s
0.0.Tri: Starting proof for property "BLINK.p1"	[0.00 s].
0.0.Tri: Trace Attempt  1	[0.00 s]
0.0.AMcustom3: Trace Attempt  1	[0.06 s]
0.0.AMcustom3: Trace Attempt  2	[0.06 s]
0.0.AMcustom3: Trace Attempt  3	[0.06 s]
0.0.AMcustom3: Trace Attempt  4	[0.06 s]
0.0.AMcustom3: Trace Attempt  5	[0.06 s]
0.0.Tri:    0.00" ---- Launching main thread ----
0.0.B: Trace Attempt 10929	[180.96 s]
0.0.B: Stopped processing property "BLINK.p1"	[181.09 s].
0.0.B: Morphing to Bcustom2
0.0.B: All properties determined. [0.00 s]
0.0.B: Exited with Success (@ 0.00 s)
0.0.Bcustom2: clocks: 1, declared: 1, looping: 0, posedge: 1, negedge: 0, noedge: 0, bothedge: 0
0.0.Bcustom2: Starting proof for property "BLINK.p1"	[0.00 s].
0.0.Bcustom2: Trace Attempt  1	[0.00 s]
0.0.Bcustom2: Trace Attempt  2	[0.00 s]
0.0.Bcustom2: Trace Attempt  1	[0.00 s]
0.0.Bcustom2: Trace Attempt  2	[0.00 s]
0.0.Bcustom2: Trace Attempt  3	[0.00 s]
0.0.Bcustom2: Trace Attempt  4	[0.00 s]
0.0.Bcustom2: Trace Attempt  5	[0.00 s]
0.0.Tri:    0.07" ---- Launching abstraction thread ----
0.0.Tri:    0.08" ---- Launching multi-phase simplification thread ----
0.0.AMcustom3: Trace Attempt  1	[0.18 s]
0.0.AMcustom3: Trace Attempt  2	[0.18 s]
0.0.AMcustom3: Trace Attempt  3	[0.18 s]
0.0.AMcustom3: Trace Attempt  4	[0.18 s]
0.0.AMcustom3: Trace Attempt  5	[0.18 s]
0.0.Tri:    0.12" ---- Launching liveness simplification thread ----
0.0.N: Trace Attempt 1563	[180.99 s]
0.0.N: Stopped processing property "BLINK.p1"	[181.40 s].
0.0.N: Morphing to Ncustom1
0.0.N: All properties determined. [0.00 s]
0.0.N: Exited with Success (@ 0.00 s)
0.0.Ncustom1: clocks: 1, declared: 1, looping: 0, posedge: 1, negedge: 0, noedge: 0, bothedge: 0
0.0.Ncustom1: Starting proof for property "BLINK.p1"	[0.00 s].
0.0.Ncustom1: Trace Attempt  3	[0.00 s]
0.0.Ncustom1: Trace Attempt  4	[0.00 s]
0.0.Ncustom1: Trace Attempt  5	[0.00 s]
0.0.Ncustom1: Trace Attempt  1	[0.00 s]
0.0.Ncustom1: Trace Attempt  2	[0.00 s]
0.0.Ncustom1: Trace Attempt  3	[0.00 s]
0.0.Ncustom1: Trace Attempt  4	[0.01 s]
0.0.Ncustom1: Trace Attempt  5	[0.01 s]
0.0.AMcustom3: Trace Attempt  1	[0.44 s]
0.0.AMcustom3: Trace Attempt  2	[0.44 s]
0.0.AMcustom3: Trace Attempt  3	[0.44 s]
0.0.AMcustom3: Trace Attempt  4	[0.45 s]
0.0.AMcustom3: Trace Attempt  5	[0.45 s]
0.0.Hp: Trace Attempt 3555	[181.75 s]
0.0.Tri:    0.95" Simplification phase 1 complete
0.0.Tri: Stopped processing property "BLINK.p1"	[1.00 s].
0.0.Bcustom2: Trace Attempt 1449	[0.94 s]
0.0.Bcustom2: Stopped processing property "BLINK.p1"	[0.95 s].
0.0.Bcustom2: Morphing to D
0.0.Bcustom2: All properties determined. [0.00 s]
0.0.Bcustom2: Exited with Success (@ 0.00 s)
0.0.D: clocks: 1, declared: 1, looping: 0, posedge: 1, negedge: 0, noedge: 0, bothedge: 0
0.0.D: Starting proof for property "BLINK.p1"	[0.00 s].
0.0.D: Trace Attempt  1	[0.00 s]
0.0.D: Trace Attempt  2	[0.00 s]
0.0.D: Trace Attempt  4	[0.00 s]
0.0.D: Trace Attempt  5	[0.00 s]
0.0.Tri: Morphing to AMcustom5
0.0.Tri: All properties determined. [0.00 s]
0.0.Tri: Exited with Success (@ 0.00 s)
0.0.AMcustom5: clocks: 1, declared: 1, looping: 0, posedge: 1, negedge: 0, noedge: 0, bothedge: 0
0.0.AMcustom5: Starting proof for property "BLINK.p1"	[0.00 s].
0.0.AMcustom5: Trace Attempt  1	[0.00 s]
0.0.AMcustom5: Trace Attempt  2	[0.00 s]
0.0.AMcustom5: Trace Attempt  1	[0.00 s]
0.0.AMcustom5: Trace Attempt  2	[0.00 s]
0.0.AMcustom5: Trace Attempt  3	[0.00 s]
0.0.AMcustom5: Trace Attempt  4	[0.00 s]
0.0.AMcustom5: Trace Attempt  5	[0.00 s]
0.0.AMcustom5: Trace Attempt  1	[0.00 s]
0.0.AMcustom5: Trace Attempt  2	[0.00 s]
0.0.AMcustom5: Trace Attempt  3	[0.00 s]
0.0.AMcustom5: Trace Attempt  4	[0.01 s]
0.0.AMcustom5: Trace Attempt  5	[0.01 s]
0.0.AMcustom3: Trace Attempt 117	[1.06 s]
0.0.AMcustom3: Stopped processing property "BLINK.p1"	[1.07 s].
0.0.AMcustom3: Morphing to M
0.0.AMcustom3: All properties determined. [0.00 s]
0.0.AMcustom3: Exited with Success (@ 0.00 s)
0.0.M: clocks: 1, declared: 1, looping: 0, posedge: 1, negedge: 0, noedge: 0, bothedge: 0
0.0.M: Starting proof for property "BLINK.p1"	[0.00 s].
0.0.M: Trace Attempt  1	[0.00 s]
0.0.M: Trace Attempt  2	[0.00 s]
0.0.M: Trace Attempt  3	[0.00 s]
0.0.M: Trace Attempt  4	[0.00 s]
0.0.M: Trace Attempt  5	[0.01 s]
0.0.Ht: Trace Attempt 10320	[184.50 s]
0.0.Ncustom1: Trace Attempt 114	[2.56 s]
0.0.Ncustom1: Stopped processing property "BLINK.p1"	[3.24 s].
0.0.Ncustom1: Morphing to Bcustom2
0.0.Ncustom1: All properties determined. [0.00 s]
0.0.Ncustom1: Exited with Success (@ 0.00 s)
0.0.Bcustom2: clocks: 1, declared: 1, looping: 0, posedge: 1, negedge: 0, noedge: 0, bothedge: 0
0.0.Bcustom2: Starting proof for property "BLINK.p1"	[0.00 s].
0.0.D: Trace Attempt 132	[1.59 s]
0.0.D: Stopped processing property "BLINK.p1"	[2.56 s].
0.0.D: Morphing to AMcustom3
0.0.D: All properties determined. [0.00 s]
0.0.D: Exited with Success (@ 0.00 s)
0.0.Bcustom2: Trace Attempt  1	[0.00 s]
0.0.Bcustom2: Trace Attempt  2	[0.00 s]
0.0.Bcustom2: Trace Attempt  1	[0.00 s]
0.0.Bcustom2: Trace Attempt  2	[0.00 s]
0.0.Bcustom2: Trace Attempt  3	[0.00 s]
0.0.Bcustom2: Trace Attempt  4	[0.00 s]
0.0.Bcustom2: Trace Attempt  5	[0.00 s]
0.0.AMcustom3: clocks: 1, declared: 1, looping: 0, posedge: 1, negedge: 0, noedge: 0, bothedge: 0
0.0.AMcustom3: Starting proof for property "BLINK.p1"	[0.00 s].
0.0.AMcustom3: Trace Attempt  1	[0.00 s]
0.0.AMcustom3: Trace Attempt  2	[0.00 s]
0.0.AMcustom3: Trace Attempt  3	[0.00 s]
0.0.AMcustom3: Trace Attempt  4	[0.00 s]
0.0.AMcustom3: Trace Attempt  5	[0.00 s]
0.0.AMcustom3: Trace Attempt  1	[0.00 s]
0.0.AMcustom5: Trace Attempt 141	[1.90 s]
0.0.AMcustom5: Stopped processing property "BLINK.p1"	[2.56 s].
0.0.AMcustom5: Morphing to ADcustom7
0.0.AMcustom5: All properties determined. [0.00 s]
0.0.AMcustom5: Exited with Success (@ 0.00 s)
0.0.AMcustom3: Trace Attempt  2	[0.01 s]
0.0.AMcustom3: Trace Attempt  3	[0.01 s]
0.0.AMcustom3: Trace Attempt  4	[0.01 s]
0.0.AMcustom3: Trace Attempt  5	[0.01 s]
0.0.ADcustom7: clocks: 1, declared: 1, looping: 0, posedge: 1, negedge: 0, noedge: 0, bothedge: 0
0.0.ADcustom7: Starting proof for property "BLINK.p1"	[0.00 s].
0.0.ADcustom7: Trace Attempt  1	[0.00 s]
0.0.ADcustom7: Trace Attempt  2	[0.00 s]
0.0.ADcustom7: Trace Attempt  1	[0.00 s]
0.0.ADcustom7: Trace Attempt  2	[0.00 s]
0.0.ADcustom7: Trace Attempt  3	[0.00 s]
0.0.ADcustom7: Trace Attempt  4	[0.00 s]
0.0.ADcustom7: Trace Attempt  5	[0.00 s]
0.0.ADcustom7: Trace Attempt  1	[0.00 s]
0.0.ADcustom7: Trace Attempt  2	[0.00 s]
0.0.ADcustom7: Trace Attempt  4	[0.00 s]
0.0.ADcustom7: Trace Attempt  5	[0.01 s]
0.0.AMcustom3: Trace Attempt  1	[0.02 s]
0.0.AMcustom3: Trace Attempt  2	[0.02 s]
0.0.AMcustom3: Trace Attempt  3	[0.02 s]
0.0.AMcustom3: Trace Attempt  4	[0.03 s]
0.0.AMcustom3: Trace Attempt  5	[0.03 s]
0.0.AMcustom3: Trace Attempt  1	[0.10 s]
0.0.AMcustom3: Trace Attempt  2	[0.10 s]
0.0.AMcustom3: Trace Attempt  3	[0.10 s]
0.0.AMcustom3: Trace Attempt  4	[0.11 s]
0.0.AMcustom3: Trace Attempt  5	[0.11 s]
0.0.AMcustom3: Trace Attempt  1	[0.25 s]
0.0.AMcustom3: Trace Attempt  2	[0.25 s]
0.0.AMcustom3: Trace Attempt  3	[0.25 s]
0.0.AMcustom3: Trace Attempt  4	[0.25 s]
0.0.AMcustom3: Trace Attempt  5	[0.26 s]
0.0.AMcustom3: Trace Attempt  1	[0.53 s]
0.0.AMcustom3: Trace Attempt  2	[0.53 s]
0.0.AMcustom3: Trace Attempt  3	[0.53 s]
0.0.AMcustom3: Trace Attempt  4	[0.53 s]
0.0.AMcustom3: Trace Attempt  5	[0.53 s]
0.0.Hp: Trace Attempt 3595	[185.79 s]
0.0.AMcustom3: Trace Attempt  1	[1.28 s]
0.0.AMcustom3: Trace Attempt  2	[1.28 s]
0.0.AMcustom3: Trace Attempt  3	[1.28 s]
0.0.AMcustom3: Trace Attempt  4	[1.29 s]
0.0.AMcustom3: Trace Attempt  5	[1.29 s]
0.0.M: Trace Attempt 375	[4.04 s]
0.0.AMcustom3: Trace Attempt  1	[3.13 s]
0.0.AMcustom3: Trace Attempt  2	[3.14 s]
0.0.AMcustom3: Trace Attempt  3	[3.14 s]
0.0.AMcustom3: Trace Attempt  4	[3.14 s]
0.0.AMcustom3: Trace Attempt  5	[3.14 s]
0.0.AMcustom3: Trace Attempt 70	[3.42 s]
0.0.AMcustom3: Stopped processing property "BLINK.p1"	[3.42 s].
0.0.AMcustom3: Morphing to D
0.0.AMcustom3: All properties determined. [0.00 s]
0.0.AMcustom3: Exited with Success (@ 0.00 s)
0.0.Bcustom2: Trace Attempt 2768	[3.42 s]
0.0.Bcustom2: Stopped processing property "BLINK.p1"	[3.43 s].
0.0.Bcustom2: Morphing to Tri
0.0.Bcustom2: All properties determined. [0.00 s]
0.0.Bcustom2: Exited with Success (@ 0.00 s)
0.0.D: clocks: 1, declared: 1, looping: 0, posedge: 1, negedge: 0, noedge: 0, bothedge: 0
0.0.D: Starting proof for property "BLINK.p1"	[0.00 s].
0.0.ADcustom7: Trace Attempt 132	[1.08 s]
0.0.ADcustom7: Stopped processing property "BLINK.p1"	[3.42 s].
0.0.ADcustom7: Morphing to Tricustom8
0.0.ADcustom7: All properties determined. [0.00 s]
0.0.ADcustom7: Exited with Success (@ 0.00 s)
0.0.Tri: clocks: 1, declared: 1, looping: 0, posedge: 1, negedge: 0, noedge: 0, bothedge: 0
0.0.D: Trace Attempt 132	[0.01 s]
0.0.Tricustom8: clocks: 1, declared: 1, looping: 0, posedge: 1, negedge: 0, noedge: 0, bothedge: 0
0.0.Tricustom8: Starting proof for property "BLINK.p1"	[0.00 s].
0.0.Tricustom8: Trace Attempt  1	[0.00 s]
0.0.Tri: Starting proof for property "BLINK.p1"	[0.00 s].
0.0.Tri: Trace Attempt  1	[0.00 s]
0.0.Tri:    0.00" ---- Launching main thread ----
0.0.Tri:    0.04" ---- Launching abstraction thread ----
0.0.Tri: Requesting engine job to terminate
0.0.D: Requesting engine job to terminate
0.0.M: Requesting engine job to terminate
0.0.Tricustom8: Requesting engine job to terminate
0.0.Hp: Requesting engine job to terminate
0.0.Ht: Requesting engine job to terminate
INFO (IPF144): 0: Initiating shutdown of proof [188.20 s]
0.0.Tricustom8: A proof was found: No trace exists. [0.10 s]
INFO (IPF057): 0.0.Tricustom8: The property "BLINK.p1" was proven in 0.10 s.
0.0.D: Stopped processing property "BLINK.p1"	[0.11 s].
0.0.D: All properties determined. [0.12 s]
0.0.Tri:    0.05" ---- Launching multi-phase simplification thread ----
0.0.Tri: Stopped processing property "BLINK.p1"	[0.09 s].
0.0.Tri: All properties determined. [0.10 s]
0.0.M: Trace Attempt 449	[6.07 s]
0.0.M: Stopped processing property "BLINK.p1"	[6.09 s].
0.0.M: All properties determined. [6.09 s]
0.0.Ht: Trace Attempt 10426	[188.16 s]
0.0.Ht: All properties determined. [188.19 s]
0.0.Hp: Trace Attempt 3615	[188.09 s]
0.0.Hp: All properties determined. [188.23 s]
0.0.M: Exited with Success (@ 188.24 s)
0: ProofGrid usable level: 0
0.0.D: Exited with Success (@ 188.24 s)
0.0.Tri: Exited with Success (@ 188.27 s)
0.0.Ht: Exited with Success (@ 188.34 s)
0.0.Tricustom8: Stopped processing property "BLINK.p1"	[0.30 s].
0.0.Tricustom8: All properties determined. [0.30 s]
0.0.Tricustom8: Exited with Success (@ 188.41 s)
0.0.Hp: Exited with Success (@ 188.47 s)
0: --------------------------------------------------------------
ProofGrid Summary (utilization 99.97 %)
--------------------------------------------------------------
     engines started                               :    15
     engine jobs started                           :     7

    Average time in state (seconds)
    ------------------------------------------------------
    Engine  Pending     Running        Dead    Utilization
    ------------------------------------------------------
     Hp        0.03      188.20        0.00       99.98 %
     Ht        0.04      188.16        0.00       99.98 %
     Oh        0.03        0.00        0.00        4.07 %
    Tri        0.03      187.79        0.00       99.98 %
      D        0.04      188.01        0.00       99.98 %
      M        0.04      188.07        0.00       99.98 %
    Tricustom8        0.08        7.08        0.00       98.85 %
    all        0.04      135.33        0.00       99.97 %

    Total time in state (seconds)
    -----------------------------------------
            Pending     Running        Dead  
    -----------------------------------------
               0.30      947.30        0.00

    Data read    : 5.32 MiB
    Data written : 7.17 kiB

0: All pending notifications were processed.
INFO (IPF059): 0: Completed proof on task: "<embedded>"

==============================================================
SUMMARY
==============================================================
           Properties Considered              : 1
                 assertions                   : 1
                  - proven                    : 1 (100%)
                  - bounded_proven (user)     : 0 (0%)
                  - bounded_proven (auto)     : 0 (0%)
                  - marked_proven             : 0 (0%)
                  - cex                       : 0 (0%)
                  - ar_cex                    : 0 (0%)
                  - undetermined              : 0 (0%)
                  - unknown                   : 0 (0%)
                  - error                     : 0 (0%)
                 covers                       : 0
                  - unreachable               : 0
                  - bounded_unreachable (user): 0
                  - covered                   : 0
                  - ar_covered                : 0
                  - undetermined              : 0
                  - unknown                   : 0
                  - error                     : 0
proven
[<embedded>] % exit -force
[<embedded>] % INFO (IPL005): Received request to exit from the console.
INFO: Waiting for proof threads to stop...
INFO: Proof threads stopped.
INFO (IPL018): The peak resident set memory use for this session was 2.396 GB.
INFO (IPL014): Waiting for the Tcl-thread to exit.
INFO (IPL015): The Tcl-thread exited with status 0.
INFO (IPL016): Exiting the analysis session with status 0.
Finished blink_14.tcl successfully
