Jasper Apps 2024.06p002 64 bits 2024.09.02 16:28:38 UTC

Any disclosure about the Cadence Design Systems software or its use
model to any third party violates the written Non-Disclosure Agreement
between Cadence Design Systems, Inc. and the customer.

THIS SOFTWARE CONTAINS CONFIDENTIAL INFORMATION AND TRADE SECRETS OF
CADENCE DESIGN SYSTEMS, INC. USE, DISCLOSURE, OR REPRODUCTION IS
PROHIBITED WITHOUT THE PRIOR EXPRESS WRITTEN PERMISSION OF CADENCE
DESIGN SYSTEMS, INC.

Copyright (C) 2000-2024 Cadence Design Systems, Inc. All Rights
Reserved.  Unpublished -- rights reserved under the copyright laws of
the United States.

This product includes software developed by others and redistributed
according to license agreement. See doc/third_party_readme.txt for
further details.

RESTRICTED RIGHTS LEGEND

Use, duplication, or disclosure by the Government is subject to
restrictions as set forth in subparagraph (c) (1) (ii) of the Rights in
Technical Data and Computer Software clause at DFARS 252.227-7013 or
subparagraphs (c) (1) and (2) of Commercial Computer Software -- Restricted
Rights at 48 CFR 52.227-19, as applicable.


                          Cadence Design Systems, Inc.
                          2655 Seely Avenue
                          San Jose, CA 95134
                          Phone: 408.943.1234

For technical assistance visit http://support.cadence.com.

Jasper Apps Analysis Session - /users/rompel/jasper_executions/safety/jgprojects/seven_seg_2/sessionLogs/session_0

WARNING (WG017): [session]: The system's locale is "ANSI_X3.4-1968", which is not UTF-8. Non-ASCII characters might not be handled correctly.
WARNING (WG017): [jg_console]: The system's locale is "ANSI_X3.4-1968", which is not UTF-8. Non-ASCII characters might not be handled correctly.
INFO: successfully checked out license "jasper_fao".
INFO: reading configuration file "/users/rompel/.config/cadence/jasper.conf".
% analyze -sv09 ../seven_seg_2.sv
[-- (VERI-1482)] Analyzing Verilog file '/tools/cadence2425/JASPER/jasper_2024.06p002/lib/verilog/packages/std/std.sv' into library 'std'
[-- (VERI-1482)] Analyzing Verilog file '../seven_seg_2.sv'
% elaborate -bbox_mul 1000000 -bbox_div 1000000 -bbox_mod 1000000 -bbox_a 1000000
[INFO (HIER-8002)] ../seven_seg_2.sv(32): Disabling old hierarchical reference handler
[INFO (VERI-1018)] ../seven_seg_2.sv(1): compiling module 'SEVEN'
[WARN (VERI-1209)] ../seven_seg_2.sv(15): expression size 32 truncated to fit in target size 9
[INFO (VERI-8005)] ../seven_seg_2.sv(5): Unintentional sequential element inferred for cnt read before write using blocking assignment
[INFO (VERI-8005)] ../seven_seg_2.sv(6): Unintentional sequential element inferred for digit_select read before write using blocking assignment
[INFO (VERI-8005)] ../seven_seg_2.sv(1): Unintentional sequential element inferred for segment read before write using blocking assignment
[INFO (VERI-8005)] ../seven_seg_2.sv(1): Unintentional sequential element inferred for sig read before write using blocking assignment
INFO (ISW003): Top module name is "SEVEN".
INFO (INL208): Elaboration synthesis summary:
  Number of synthesized netlists          1 (0 packages)
  Single run mode                         On
  Pipeline                                On (1 pipelined netlists)
  Late hierarchical reference connection  On
  Number of analyzed Verilog modules      1 (1 synthesized)
  Number of analyzed VHDL entities        0 (0 synthesized)
INFO (INL003): Clearing all state information (assumes, stopats, and so forth).
SEVEN
[<embedded>] % reset rst
INFO (IPM031): Clearing proof results of all properties.
INFO (IRS006): Current reset condition is "rst".
[<embedded>] % clock clk
[<embedded>] % prove -all
Ncustom1: Custom engine code is hT3Ng7hPPfiYQOTDZ3qhYOwGAM51eA+J/FjkM5shLioAsqhgLR4Ft+O1BuKG6ilQ83B9tLXSl+CwjiTMAQA
Bcustom2: Custom engine code is hT3Nm7hPr1Vp3Di1Ra2USNIGL4JypRnLKLAdF6JAyuavO2JfGCiY9OZJhcAcOUnLx5xwNdhILGrAWX9s+z2WDkKwNR7tAfClBEjRFVQeq6DU54boFgEA
AMcustom3: Custom engine code is hT3Ng7hP/feYQOTDZ3qhYOwGAM51eA+J/FjkM5shLioAsqhgLR4Ft+O1BuKG6ilQ83B9tLXSmmqwm7g9AQA
Mpcustom4: Custom engine code is hT3NZbhP9fmY2AbBQnsjfOxn6c+6e6yL+/e8fZFmaQrnlgEA
INFO (IPF036): Starting proof on task: "<embedded>", 2 properties to prove with 0 already proven/unreachable
INFO (IRS029): Starting reset analysis: phase 1 of 4.
INFO (IRS030): Running reset analysis: phase 2 of 4.
INFO (IRS031): Running reset analysis: phase 3 of 4.
INFO (IRS020): Starting the reset analysis simulation with a limit of 100 iterations (phase 4 of 4).
INFO (IRS024): Reset iterations 0 to 4 analyzed.
INFO (IRS018): Reset analysis simulation executed for 3 iterations. Assigned values for 18 of 18 design flops, 0 of 0 design latches, 6 of 6 internal elements.
INFO (IRS039): Reset analysis complete.
INFO (IPF031): Settings used for proof thread 0:
    orchestration                 = on
    time_limit                    = 86400s
    per_property_time_limit       = 1s * 10 ^ scan
    engine_mode                   = auto
    proofgrid_per_engine_max_jobs = 1
    max engine jobs               = auto
    proofgrid_mode                = local
    proofgrid_restarts            = 10
AMcustom5: Custom engine code is hT3N1rhP11/52HrFRS21ROp2LOjVTgPvT8L8BGXHgLhaIuqtT4nARFjUqrBL+7pLmaTOzBepZW/Jm8SSrHDybSQtoNiO3y43wk+dEoWlsZizu97Fih6O6lPVG/LpWP5SsUPwlGagLNa1FKEFvwVXyX7//8prySbvSxIHXr5er+z4RAEA
0: Using multistage preprocessing
0: Starting reduce
Ncustom6: Custom engine code is hT3OXrhPByJp3TrFSTLhUmMH4KVtJgmTCnNDF46yMXOKY48m4LS5nE7yBzFjA7kDuwO/GhGUpEPiky3p3wmPn3dJZHxFMsafSoObRzSC+tn7sEY0WbTdZ/FV4hL3MYH/b1CIUvXSWR4wqEoVLsmMOD4xIPT4lI1LO6ZCO7PnnWQuLwetnvKlrXx6wCW/A+x+enqslg1YPobi4wEF/EvbzOvcTYdJvl2s4H2yZg2b2ofAVN5WvhWk1HoBAA
ADcustom7: Custom engine code is hT3Nv7hPv1752HrFRa2kROx2f/ECJeZB2AZsLdlO8VwmIuqtT4nIDFXclhg+O+o+DMmQCekbheGk0kK28laA9gaOFDXsQp29J3X615HY1IPHJWd6FUFvCHjO+p1k652b5JJvZlShNpGlGSXAiQe/mEAj6tEBAA
Tricustom8: Custom engine code is hT3Nu7hPt1752DvFRa0kNDiyIV97VyejwM9C/jCLJjdPvusZONHY42VYUy0Q1ZotnhcVtNc56tJ5wbxv6V2+XpdsaSlHck5vfnbYjdwj1OECy9U+7oSQ0SZE3g5ayD+Phuh4odCJTjeKa2k4elM9ldQfkAEA
Gcustom9: Custom engine code is hT3NibhPDfeYQADBZnYcglOvK9Pfd7EOeniIqP8jNsyIqInncipMGcUXqAadachREE9F2PwhBUZUNw5kHnd4JdXkamORRgEA
C2custom10: Custom engine code is hT3NirhPjfWYQADBZnYcglOvK9Pfd7EOeniIqP8jNsyIqInncgkrYMMXCYbdK0dUjZIF9d4cJ0rHoBDjwVLBKuG86XYVV00BAA
AGcustom11: Custom engine code is hT3NirhP/fmYQADBZnYcglOvK9Pfd7EOeniIqP8jNsyIqInnckcwYMMXCYbdK0dUjZIF9d4cJ0rHoBDjwVLBKuHEZnZByh0BAA
Bcustom12: Custom engine code is hT3NjrhPDfiYQADBZnYcglOvK9PfWxFtenjIyBqfrgr7if/jL/yPOuK1BAflEcW0DxNH2eDIoezN2gxlQFg81RZtiWXh7aiTAidvAQA
Ncustom13: Custom engine code is hT3NR7hPByFp3TrFSTLhUmMH4KWtJglTyV/c51BHEeZWamnJv767nE6PCak26bd3gf3XGN3rIRheufhDieCJQVISo+gNYUKhiUedBKGtsP/a18svAnlMJZudHxDFwK5ufsyoxsIyiAeSY2oi3tEuoDHr5gw42DFKAG3PqO3CEsl8Azzdt3pl5nGA1Ifv2H02eYsFzWb/nfp8PMb3F0krE/EgBcm8TD9Div8BAA
0: Finished reduce in 0s
Tricustom14: Custom engine code is hT3Nu7hP3fiYQADBZnYcglNHp9bfd7EOeniIqP/ji8sGLQu8yhsFO+wxJ+O+R0bU8g/IewXFomyos+viQnWc2xYNYmMqpo3i40O7DaZR7qfp4YqNx26KRvQ/qx0BAA
0.0.PRE: Performing Proof Simplification...
0.0.N: clocks: 1, declared: 1, looping: 0, posedge: 1, negedge: 0, noedge: 0, bothedge: 0
0.0.N: Proof Simplification Iteration 1	[0.00 s]
0.0.PRE: A trace with 1 cycles was found. [0.00 s]
INFO (IPF047): 0.0.PRE: The cover property "SEVEN.p1:precondition1" was covered in 1 cycles in 0.00 s.
0.0.N: Proof Simplification Iteration 2	[0.05 s]
0.0.PRE: A proof was found: No trace exists. [0.00 s]
INFO (IPF057): 0.0.PRE: The property ":noDeadEnd" was proven in 0.00 s.
    Use check_assumptions -show -dead_end to show this property in the property table.
0.0.PRE: A proof was found: No trace exists. [0.00 s]
INFO (IPF057): 0.0.PRE: The property ":noConflict" was proven in 0.00 s.
    Use check_assumptions -show to show this property in the property table.
INFO (IPF047): 0.0.PRE: The cover property ":live" was covered in 1 cycles in 0.00 s.
    Use check_assumptions -show -live to show this property in the property table.
0.0.PRE: Proof Simplification completed in 0.05 s
0: About to start ProofGrid in its own thread with a limit of 10000 pending notifications and a limit of 10 traces.
0: =============================== ProofGrid start ===============================
0: ProofGrid usable level: 1
0: Initial ProofGrid level: 1
0: ProofGrid is starting event handling
0.0.Hp: Proofgrid shell started at 15064@vlsi-ria85(local) jg_14932_vlsi-ria85_1
0.0.N: Proofgrid shell started at 15063@vlsi-ria85(local) jg_14932_vlsi-ria85_1
0.0.N: clocks: 1, declared: 1, looping: 0, posedge: 1, negedge: 0, noedge: 0, bothedge: 0
0.0.N: Last scan. Per property time limit: 0s
0.0.N: Starting proof for property "SEVEN.p1"	[0.00 s].
0.0.Hp: clocks: 1, declared: 1, looping: 0, posedge: 1, negedge: 0, noedge: 0, bothedge: 0
0.0.Hp: Last scan. Per property time limit: 0s
0.0.Hp: Trace Attempt  1	[0.00 s]
0.0.Hp: Trace Attempt  2	[0.00 s]
0.0.Hp: Trace Attempt  3	[0.00 s]
0.0.Hp: Trace Attempt  4	[0.00 s]
0.0.Hp: Trace Attempt  5	[0.00 s]
0.0.N: Trace Attempt  1	[0.00 s]
0.0.N: Trace Attempt  2	[0.00 s]
0.0.N: Trace Attempt  2	[0.00 s]
0.0.N: Trace Attempt  3	[0.00 s]
0.0.N: Trace Attempt  3	[0.00 s]
0.0.N: Trace Attempt  4	[0.00 s]
0.0.N: Trace Attempt  5	[0.00 s]
0.0.N: Trace Attempt  1	[0.01 s]
0.0.N: Trace Attempt  2	[0.01 s]
0.0.N: Trace Attempt  3	[0.01 s]
0.0.N: Trace Attempt  4	[0.01 s]
0.0.N: Trace Attempt  5	[0.01 s]
0.0.Mpcustom4: Proofgrid shell started at 15097@vlsi-ria85(local) jg_14932_vlsi-ria85_1
0.0.L: Proofgrid shell started at 15099@vlsi-ria85(local) jg_14932_vlsi-ria85_1
0.0.Mpcustom4: clocks: 1, declared: 1, looping: 0, posedge: 1, negedge: 0, noedge: 0, bothedge: 0
0.0.Mpcustom4: Ignoring liveness properties
0.0.Mpcustom4: All properties either determined or skipped. [0.00 s]
0.0.L: clocks: 1, declared: 1, looping: 0, posedge: 1, negedge: 0, noedge: 0, bothedge: 0
0.0.L: Using trace diversification with seed 1 (0.05)
0.0.L: Using LRU state removal heuristic
0.0.L: Ignoring liveness properties
0.0.L: All properties either determined or skipped. [0.00 s]
0.0.B: Proofgrid shell started at 15100@vlsi-ria85(local) jg_14932_vlsi-ria85_1
0.0.L: Exited with Success (@ 0.04 s)
0.0.L: Completed, Restart ignored.
0.0.Mpcustom4: Exited with Success (@ 0.04 s)
0.0.Mpcustom4: Completed, Restart ignored.
0.0.Bm: Proofgrid shell started at 15096@vlsi-ria85(local) jg_14932_vlsi-ria85_1
0.0.Oh: Proofgrid shell started at 15098@vlsi-ria85(local) jg_14932_vlsi-ria85_1
0.0.B: clocks: 1, declared: 1, looping: 0, posedge: 1, negedge: 0, noedge: 0, bothedge: 0
0.0.B: Last scan. Per property time limit: 0s
0.0.B: Starting proof for property "SEVEN.p1"	[0.00 s].
0.0.B: Trace Attempt  1	[0.00 s]
0.0.B: Trace Attempt  2	[0.00 s]
0.0.B: Trace Attempt  3	[0.00 s]
0.0.B: Trace Attempt  4	[0.00 s]
0.0.B: Trace Attempt  5	[0.00 s]
0.0.Bm: clocks: 1, declared: 1, looping: 0, posedge: 1, negedge: 0, noedge: 0, bothedge: 0
0.0.Oh: clocks: 1, declared: 1, looping: 0, posedge: 1, negedge: 0, noedge: 0, bothedge: 0
0.0.Bm: Ignoring liveness properties
0.0.Bm: Last scan. Per property time limit: 0s
0.0.Oh: Reached length limit (2147483647) [0.00 s]
0.0.Bm: Trace Attempt  1	[0.00 s]
0.0.Bm: Trace Attempt  2	[0.00 s]
0.0.Bm: Trace Attempt  3	[0.00 s]
0.0.Bm: Trace Attempt  4	[0.00 s]
0.0.Bm: Trace Attempt  5	[0.00 s]
0.0.Oh: Exited with Success (@ 0.04 s)
0.0.Oh: Completed, Restart ignored.
0.0.Ht: Proofgrid shell started at 15095@vlsi-ria85(local) jg_14932_vlsi-ria85_1
0.0.Ht: clocks: 1, declared: 1, looping: 0, posedge: 1, negedge: 0, noedge: 0, bothedge: 0
0.0.Ht: Last scan. Per property time limit: 0s
0.0.Ht: Trace Attempt  1	[0.00 s]
0.0.Ht: Trace Attempt  2	[0.00 s]
0.0.Ht: Trace Attempt  3	[0.00 s]
0.0.Ht: Trace Attempt  4	[0.00 s]
0.0.Ht: Trace Attempt  5	[0.00 s]
0.0.AM: Proofgrid shell started at 15112@vlsi-ria85(local) jg_14932_vlsi-ria85_1
0.0.AM: clocks: 1, declared: 1, looping: 0, posedge: 1, negedge: 0, noedge: 0, bothedge: 0
0.0.AM: Last scan. Per property time limit: 0s
0.0.AM: Starting proof for property "SEVEN.p1"	[0.00 s].
0.0.AM: Trace Attempt  1	[0.00 s]
0.0.AM: Trace Attempt  2	[0.00 s]
0.0.AM: Trace Attempt  3	[0.00 s]
0.0.AM: Trace Attempt  4	[0.00 s]
0.0.AM: Trace Attempt  5	[0.00 s]
0.0.AM: Trace Attempt  1	[0.00 s]
0.0.AM: Trace Attempt  2	[0.00 s]
0.0.AM: Trace Attempt  3	[0.00 s]
0.0.AM: Trace Attempt  4	[0.00 s]
0.0.AM: Trace Attempt  5	[0.00 s]
0.0.AM: Trace Attempt  1	[0.01 s]
0.0.AM: Trace Attempt  2	[0.01 s]
0.0.AM: Trace Attempt  3	[0.01 s]
0.0.AM: Trace Attempt  4	[0.01 s]
0.0.AM: Trace Attempt  5	[0.01 s]
0.0.AM: Trace Attempt  1	[0.02 s]
0.0.AM: Trace Attempt  2	[0.02 s]
0.0.AM: Trace Attempt  3	[0.02 s]
0.0.AM: Trace Attempt  4	[0.02 s]
0.0.AM: Trace Attempt  5	[0.02 s]
0.0.N: Trace Attempt  1	[0.10 s]
0.0.N: Trace Attempt  2	[0.10 s]
0.0.N: Trace Attempt  3	[0.10 s]
0.0.N: Trace Attempt  4	[0.10 s]
0.0.N: Trace Attempt  5	[0.10 s]
0.0.AM: Trace Attempt  1	[0.08 s]
0.0.AM: Trace Attempt  2	[0.08 s]
0.0.AM: Trace Attempt  3	[0.08 s]
0.0.AM: Trace Attempt  4	[0.08 s]
0.0.AM: Trace Attempt  5	[0.08 s]
0.0.AM: Trace Attempt  1	[0.34 s]
0.0.AM: Trace Attempt  2	[0.34 s]
0.0.AM: Trace Attempt  3	[0.34 s]
0.0.AM: Trace Attempt  4	[0.34 s]
0.0.AM: Trace Attempt  5	[0.34 s]
0.0.N: Trace Attempt  1	[0.45 s]
0.0.N: Trace Attempt  2	[0.45 s]
0.0.N: Trace Attempt  3	[0.45 s]
0.0.N: Trace Attempt  4	[0.45 s]
0.0.N: Trace Attempt  5	[0.45 s]
0.0.AM: Trace Attempt  1	[1.52 s]
0.0.AM: Trace Attempt  2	[1.52 s]
0.0.AM: Trace Attempt  3	[1.52 s]
0.0.AM: Trace Attempt  4	[1.52 s]
0.0.AM: Trace Attempt  5	[1.52 s]
0.0.N: Trace Attempt  1	[1.60 s]
0.0.N: Trace Attempt  2	[1.60 s]
0.0.N: Trace Attempt  3	[1.60 s]
0.0.N: Trace Attempt  4	[1.60 s]
0.0.N: Trace Attempt  5	[1.60 s]
0.0.N: Trace Attempt  1	[2.74 s]
0.0.N: Trace Attempt  2	[2.74 s]
0.0.N: Trace Attempt  3	[2.74 s]
0.0.N: Trace Attempt  4	[2.75 s]
0.0.N: Trace Attempt  5	[2.75 s]
0.0.N: Trace Attempt  1	[3.90 s]
0.0.N: Trace Attempt  2	[3.90 s]
0.0.N: Trace Attempt  3	[3.90 s]
0.0.N: Trace Attempt  4	[3.90 s]
0.0.N: Trace Attempt  5	[3.90 s]
0.0.Hp: Trace Attempt 459	[4.02 s]
0.0.B: Trace Attempt 1391	[4.00 s]
0.0.Bm: Trace Attempt 1384	[4.00 s]
0.0.Ht: Trace Attempt 1369	[4.00 s]
0.0.N: Trace Attempt  1	[5.11 s]
0.0.N: Trace Attempt  2	[5.12 s]
0.0.N: Trace Attempt  3	[5.12 s]
0.0.N: Trace Attempt  4	[5.12 s]
0.0.N: Trace Attempt  5	[5.12 s]
0.0.AM: Trace Attempt 200	[5.55 s]
0.0.N: Trace Attempt  1	[7.51 s]
0.0.N: Trace Attempt  2	[7.51 s]
0.0.N: Trace Attempt  3	[7.51 s]
0.0.N: Trace Attempt  4	[7.51 s]
0.0.N: Trace Attempt  5	[7.51 s]
0.0.AM: Trace Attempt  1	[7.88 s]
0.0.AM: Trace Attempt  2	[7.88 s]
0.0.AM: Trace Attempt  3	[7.88 s]
0.0.AM: Trace Attempt  4	[7.89 s]
0.0.AM: Trace Attempt  5	[7.89 s]
0.0.B: Trace Attempt 1740	[8.01 s]
0.0.Bm: Trace Attempt 1735	[8.01 s]
0.0.Ht: Trace Attempt 1876	[8.01 s]
0.0.Hp: Trace Attempt 538	[9.55 s]
0.0.N: Trace Attempt  1	[9.91 s]
0.0.N: Trace Attempt  2	[9.91 s]
0.0.N: Trace Attempt  3	[9.91 s]
0.0.N: Trace Attempt  4	[9.92 s]
0.0.N: Trace Attempt  5	[9.92 s]
0.0.AM: Trace Attempt 227	[11.94 s]
0.0.Bm: Trace Attempt 2010	[12.01 s]
0.0.Ht: Trace Attempt 2137	[12.01 s]
0.0.B: Trace Attempt 2011	[12.03 s]
0.0.N: Trace Attempt  1	[12.34 s]
0.0.N: Trace Attempt  2	[12.34 s]
0.0.N: Trace Attempt  3	[12.34 s]
0.0.N: Trace Attempt  4	[12.34 s]
0.0.N: Trace Attempt  5	[12.34 s]
0.0.Hp: Trace Attempt 660	[13.57 s]
0.0.N: Trace Attempt  1	[14.71 s]
0.0.N: Trace Attempt  2	[14.71 s]
0.0.N: Trace Attempt  3	[14.71 s]
0.0.N: Trace Attempt  4	[14.71 s]
0.0.N: Trace Attempt  5	[14.71 s]
0.0.AM: Trace Attempt 291	[15.95 s]
0.0.Ht: Trace Attempt 2285	[16.02 s]
0.0.Bm: Trace Attempt 2180	[16.03 s]
0.0.B: Trace Attempt 2179	[16.04 s]
0.0.N: Trace Attempt  1	[17.11 s]
0.0.N: Trace Attempt  2	[17.11 s]
0.0.N: Trace Attempt  3	[17.11 s]
0.0.N: Trace Attempt  4	[17.11 s]
0.0.N: Trace Attempt  5	[17.11 s]
0.0.Hp: Trace Attempt 766	[17.61 s]
0.0.N: Trace Attempt  1	[19.48 s]
0.0.N: Trace Attempt  2	[19.48 s]
0.0.N: Trace Attempt  3	[19.48 s]
0.0.N: Trace Attempt  4	[19.48 s]
0.0.N: Trace Attempt  5	[19.49 s]
0.0.AM: Trace Attempt 343	[19.97 s]
0.0.Ht: Trace Attempt 2649	[20.02 s]
0.0.B: Trace Attempt 2324	[20.06 s]
0.0.Bm: Trace Attempt 2327	[20.06 s]
0.0.Hp: Trace Attempt 827	[21.63 s]
0.0.N: Trace Attempt  1	[21.86 s]
0.0.N: Trace Attempt  2	[21.86 s]
0.0.N: Trace Attempt  3	[21.86 s]
0.0.N: Trace Attempt  4	[21.86 s]
0.0.N: Trace Attempt  5	[21.87 s]
0.0.AM: Trace Attempt 384	[24.02 s]
0.0.Ht: Trace Attempt 2945	[24.04 s]
0.0.Bm: Trace Attempt 2468	[24.07 s]
0.0.B: Trace Attempt 2463	[24.08 s]
0.0.N: Trace Attempt  1	[24.20 s]
0.0.N: Trace Attempt  2	[24.20 s]
0.0.N: Trace Attempt  3	[24.20 s]
0.0.N: Trace Attempt  4	[24.20 s]
0.0.N: Trace Attempt  5	[24.20 s]
0.0.Hp: Trace Attempt 930	[26.45 s]
0.0.N: Trace Attempt  1	[26.65 s]
0.0.N: Trace Attempt  2	[26.65 s]
0.0.N: Trace Attempt  3	[26.65 s]
0.0.N: Trace Attempt  4	[26.66 s]
0.0.N: Trace Attempt  5	[26.66 s]
0.0.Ht: Trace Attempt 3139	[28.04 s]
0.0.B: Trace Attempt 2613	[28.08 s]
0.0.Bm: Trace Attempt 2621	[28.08 s]
0.0.AM: Trace Attempt 427	[28.12 s]
0.0.N: Trace Attempt  1	[29.09 s]
0.0.N: Trace Attempt  2	[29.09 s]
0.0.N: Trace Attempt  3	[29.09 s]
0.0.N: Trace Attempt  4	[29.09 s]
0.0.N: Trace Attempt  5	[29.09 s]
0.0.Hp: Trace Attempt 1005	[30.56 s]
0.0.N: Trace Attempt  1	[31.59 s]
0.0.N: Trace Attempt  2	[31.59 s]
0.0.N: Trace Attempt  3	[31.59 s]
0.0.N: Trace Attempt  4	[31.59 s]
0.0.N: Trace Attempt  5	[31.59 s]
0.0.B: Trace Attempt 2755	[32.08 s]
0.0.Bm: Trace Attempt 2763	[32.09 s]
0.0.AM: Trace Attempt 353	[32.13 s]
0.0.Ht: Trace Attempt 3224	[33.96 s]
0.0.Hp: Trace Attempt 1076	[34.56 s]
0.0.N: Trace Attempt 195	[35.64 s]
0.0.B: Trace Attempt 2871	[36.11 s]
0.0.Bm: Trace Attempt 2877	[36.11 s]
0.0.AM: Trace Attempt 501	[36.29 s]
0.0.AM: Trace Attempt  1	[36.56 s]
0.0.AM: Trace Attempt  2	[36.56 s]
0.0.AM: Trace Attempt  3	[36.56 s]
0.0.AM: Trace Attempt  4	[36.56 s]
0.0.AM: Trace Attempt  5	[36.56 s]
0.0.N: Trace Attempt  1	[37.69 s]
0.0.N: Trace Attempt  2	[37.70 s]
0.0.N: Trace Attempt  3	[37.70 s]
0.0.N: Trace Attempt  4	[37.70 s]
0.0.N: Trace Attempt  5	[37.70 s]
0.0.Ht: Trace Attempt 3482	[37.97 s]
0.0.Hp: Trace Attempt 1146	[38.56 s]
0.0.B: Trace Attempt 2976	[40.11 s]
0.0.Bm: Trace Attempt 2982	[40.11 s]
0.0.AM: Trace Attempt 181	[40.59 s]
0.0.N: Trace Attempt 197	[41.70 s]
0.0.Ht: Trace Attempt 3717	[41.98 s]
0.0.Hp: Trace Attempt 1235	[42.61 s]
0.0.N: Trace Attempt  1	[43.67 s]
0.0.N: Trace Attempt  2	[43.67 s]
0.0.N: Trace Attempt  3	[43.67 s]
0.0.N: Trace Attempt  4	[43.67 s]
0.0.N: Trace Attempt  5	[43.67 s]
0.0.B: Trace Attempt 3096	[44.13 s]
0.0.Bm: Trace Attempt 3103	[44.13 s]
0.0.AM: Trace Attempt 248	[44.64 s]
0.0.Ht: Trace Attempt 3883	[45.99 s]
0.0.Hp: Trace Attempt 1323	[46.61 s]
0.0.N: Trace Attempt 197	[47.68 s]
0.0.Bm: Trace Attempt 3235	[48.15 s]
0.0.B: Trace Attempt 3230	[48.15 s]
0.0.AM: Trace Attempt 301	[48.72 s]
0.0.N: Trace Attempt  1	[49.56 s]
0.0.N: Trace Attempt  2	[49.56 s]
0.0.N: Trace Attempt  3	[49.56 s]
0.0.N: Trace Attempt  4	[49.56 s]
0.0.N: Trace Attempt  5	[49.56 s]
0.0.Ht: Trace Attempt 4013	[50.00 s]
0.0.Hp: Trace Attempt 1418	[50.65 s]
0.0.Bm: Trace Attempt 3327	[52.17 s]
0.0.B: Trace Attempt 3323	[52.19 s]
0.0.AM: Trace Attempt 345	[52.79 s]
0.0.N: Trace Attempt 198	[53.56 s]
0.0.Ht: Trace Attempt 4173	[54.01 s]
0.0.Hp: Trace Attempt 1503	[54.69 s]
0.0.N: Trace Attempt  1	[55.53 s]
0.0.N: Trace Attempt  2	[55.53 s]
0.0.N: Trace Attempt  3	[55.53 s]
0.0.N: Trace Attempt  4	[55.53 s]
0.0.N: Trace Attempt  5	[55.53 s]
0.0.B: Trace Attempt 3421	[56.22 s]
0.0.Bm: Trace Attempt 3425	[56.22 s]
0.0.AM: Trace Attempt 381	[56.81 s]
0.0.Ht: Trace Attempt 4277	[58.02 s]
0.0.Hp: Trace Attempt 1581	[58.74 s]
0.0.N: Trace Attempt 197	[59.54 s]
0.0.B: Trace Attempt 3517	[60.24 s]
0.0.Bm: Trace Attempt 3522	[60.24 s]
0.0.AM: Trace Attempt 420	[60.81 s]
0.0.N: Trace Attempt  1	[61.53 s]
0.0.N: Trace Attempt  2	[61.53 s]
0.0.N: Trace Attempt  3	[61.53 s]
0.0.N: Trace Attempt  4	[61.53 s]
0.0.N: Trace Attempt  5	[61.53 s]
0.0.Ht: Trace Attempt 4423	[62.03 s]
0.0.Hp: Trace Attempt 1654	[62.75 s]
0.0.Bm: Trace Attempt 3640	[64.26 s]
0.0.B: Trace Attempt 3636	[64.27 s]
0.0.AM: Trace Attempt 455	[64.97 s]
0.0.N: Trace Attempt 199	[65.54 s]
0.0.Ht: Trace Attempt 4520	[66.04 s]
0.0.Hp: Trace Attempt 1723	[66.76 s]
0.0.N: Trace Attempt  1	[67.43 s]
0.0.N: Trace Attempt  2	[67.43 s]
0.0.N: Trace Attempt  3	[67.43 s]
0.0.N: Trace Attempt  4	[67.44 s]
0.0.N: Trace Attempt  5	[67.44 s]
0.0.B: Trace Attempt 3751	[68.28 s]
0.0.Bm: Trace Attempt 3754	[68.29 s]
0.0.AM: Trace Attempt 468	[69.09 s]
0.0.Ht: Trace Attempt 4588	[70.69 s]
0.0.Hp: Trace Attempt 1791	[70.79 s]
0.0.N: Trace Attempt 198	[71.45 s]
0.0.B: Trace Attempt 3858	[72.30 s]
0.0.Bm: Trace Attempt 3860	[72.31 s]
0.0.AM: Trace Attempt 484	[73.18 s]
0.0.N: Trace Attempt  1	[73.31 s]
0.0.N: Trace Attempt  2	[73.32 s]
0.0.N: Trace Attempt  3	[73.32 s]
0.0.N: Trace Attempt  4	[73.32 s]
0.0.N: Trace Attempt  5	[73.32 s]
0.0.Ht: Trace Attempt 4710	[74.69 s]
0.0.Hp: Trace Attempt 1856	[74.82 s]
0.0.B: Trace Attempt 3957	[76.32 s]
0.0.Bm: Trace Attempt 3959	[76.34 s]
0.0.AM: Trace Attempt 499	[77.24 s]
0.0.N: Trace Attempt 197	[77.35 s]
0.0.Ht: Trace Attempt 4855	[78.70 s]
0.0.Hp: Trace Attempt 1919	[78.86 s]
0.0.N: Trace Attempt  1	[79.46 s]
0.0.N: Trace Attempt  2	[79.46 s]
0.0.N: Trace Attempt  3	[79.46 s]
0.0.N: Trace Attempt  4	[79.46 s]
0.0.N: Trace Attempt  5	[79.46 s]
0.0.B: Trace Attempt 4052	[80.34 s]
0.0.Bm: Trace Attempt 4054	[80.37 s]
0.0.AM: Trace Attempt 516	[81.39 s]
0.0.Ht: Trace Attempt 4950	[82.71 s]
0.0.Hp: Trace Attempt 1976	[82.91 s]
0.0.N: Trace Attempt 198	[83.46 s]
0.0.B: Trace Attempt 4151	[84.38 s]
0.0.Bm: Trace Attempt 4152	[84.38 s]
0.0.AM: Trace Attempt 535	[85.52 s]
0.0.N: Trace Attempt  1	[86.02 s]
0.0.N: Trace Attempt  2	[86.02 s]
0.0.N: Trace Attempt  3	[86.02 s]
0.0.N: Trace Attempt  4	[86.02 s]
0.0.N: Trace Attempt  5	[86.02 s]
0.0.Ht: Trace Attempt 5039	[86.72 s]
0.0.B: Trace Attempt 4249	[88.38 s]
0.0.Bm: Trace Attempt 4251	[88.40 s]
0.0.AM: Trace Attempt 554	[89.53 s]
0.0.N: Trace Attempt 208	[90.04 s]
0.0.Ht: Trace Attempt 5104	[90.72 s]
0.0.Hp: Trace Attempt 2008	[91.02 s]
0.0.B: Trace Attempt 4340	[92.39 s]
0.0.Bm: Trace Attempt 4341	[92.41 s]
0.0.AM: Trace Attempt 570	[93.74 s]
0.0.N: Trace Attempt 266	[94.10 s]
0.0.Hp: Trace Attempt 2033	[95.06 s]
0.0.Ht: Trace Attempt 5165	[96.39 s]
0.0.B: Trace Attempt 4428	[96.42 s]
0.0.Bm: Trace Attempt 4429	[96.43 s]
0.0.AM: Trace Attempt 588	[97.80 s]
0.0.N: Trace Attempt 323	[98.19 s]
0.0.Hp: Trace Attempt 2048	[99.86 s]
0.0.B: Trace Attempt 4519	[100.42 s]
0.0.Bm: Trace Attempt 4520	[100.44 s]
0.0.Ht: Trace Attempt 5226	[100.60 s]
0.0.AM: Trace Attempt 606	[101.98 s]
0.0.N: Trace Attempt 365	[102.26 s]
0.0.Hp: Trace Attempt 2062	[103.86 s]
0.0.B: Trace Attempt 4622	[104.43 s]
0.0.Bm: Trace Attempt 4624	[104.48 s]
0.0.Ht: Trace Attempt 5290	[104.62 s]
0.0.AM: Trace Attempt 621	[106.13 s]
0.0.N: Trace Attempt 406	[106.28 s]
0.0.Hp: Trace Attempt 2085	[108.11 s]
0.0.B: Trace Attempt 4725	[108.46 s]
0.0.Bm: Trace Attempt 4727	[108.51 s]
0.0.Ht: Trace Attempt 5372	[108.63 s]
0.0.N: Trace Attempt 443	[110.31 s]
0.0.AM: Trace Attempt 635	[110.36 s]
0.0.Hp: Trace Attempt 2114	[112.13 s]
0.0.B: Trace Attempt 4827	[112.49 s]
0.0.Bm: Trace Attempt 4829	[112.54 s]
0.0.Ht: Trace Attempt 5429	[112.67 s]
0.0.AM: Trace Attempt 648	[114.45 s]
0.0.Hp: Trace Attempt 2134	[116.22 s]
0.0.N: Trace Attempt 466	[116.35 s]
0.0.N: Trace Attempt  1	[116.36 s]
0.0.N: Trace Attempt  2	[116.36 s]
0.0.N: Trace Attempt  3	[116.37 s]
0.0.N: Trace Attempt  4	[116.37 s]
0.0.N: Trace Attempt  5	[116.37 s]
0.0.B: Trace Attempt 4922	[116.52 s]
0.0.Bm: Trace Attempt 4924	[116.58 s]
0.0.Ht: Trace Attempt 5465	[116.67 s]
0.0.AM: Trace Attempt 661	[118.56 s]
0.0.N: Trace Attempt 208	[120.37 s]
0.0.Hp: Trace Attempt 2155	[120.41 s]
0.0.B: Trace Attempt 5011	[120.52 s]
0.0.Bm: Trace Attempt 5013	[120.60 s]
0.0.Ht: Trace Attempt 5515	[120.67 s]
0.0.AM: Trace Attempt 673	[122.88 s]
0.0.N: Trace Attempt 266	[124.38 s]
0.0.B: Trace Attempt 5087	[124.58 s]
0.0.Bm: Trace Attempt 5088	[124.61 s]
0.0.Hp: Trace Attempt 2158	[124.72 s]
0.0.Ht: Trace Attempt 5570	[125.09 s]
0.0.AM: Trace Attempt 683	[127.12 s]
0.0.N: Trace Attempt 323	[128.46 s]
0.0.Bm: Trace Attempt 5161	[128.61 s]
0.0.B: Trace Attempt 5161	[128.62 s]
0.0.Hp: Trace Attempt 2168	[128.86 s]
0.0.Ht: Trace Attempt 5657	[129.16 s]
0.0.AM: Trace Attempt 694	[131.31 s]
0.0.N: Trace Attempt 365	[132.51 s]
0.0.Bm: Trace Attempt 5237	[132.64 s]
0.0.B: Trace Attempt 5237	[132.66 s]
0.0.Hp: Trace Attempt 2180	[132.86 s]
0.0.Ht: Trace Attempt 5712	[133.19 s]
0.0.AM: Trace Attempt 706	[135.58 s]
0.0.N: Trace Attempt 406	[136.54 s]
0.0.Bm: Trace Attempt 5318	[136.65 s]
0.0.B: Trace Attempt 5318	[136.66 s]
0.0.Hp: Trace Attempt 2191	[136.88 s]
0.0.Ht: Trace Attempt 5766	[137.20 s]
0.0.AM: Trace Attempt 719	[139.89 s]
0.0.N: Trace Attempt 443	[140.54 s]
0.0.Bm: Trace Attempt 5391	[140.72 s]
0.0.B: Trace Attempt 5391	[140.73 s]
0.0.Ht: Trace Attempt 5799	[141.21 s]
0.0.Hp: Trace Attempt 2197	[143.11 s]
0.0.AM: Trace Attempt 730	[144.02 s]
0.0.Bm: Trace Attempt 5468	[144.73 s]
0.0.B: Trace Attempt 5469	[144.79 s]
0.0.Ht: Trace Attempt 5843	[145.26 s]
0.0.N: Trace Attempt 467	[145.69 s]
0.0.N: Trace Attempt  1	[145.71 s]
0.0.N: Trace Attempt  2	[145.71 s]
0.0.N: Trace Attempt  3	[145.71 s]
0.0.N: Trace Attempt  4	[145.72 s]
0.0.N: Trace Attempt  5	[145.72 s]
0.0.AM: Trace Attempt 740	[148.17 s]
0.0.Bm: Trace Attempt 5550	[148.77 s]
0.0.B: Trace Attempt 5551	[148.81 s]
0.0.Ht: Trace Attempt 5911	[149.44 s]
0.0.N: Trace Attempt 207	[149.75 s]
0.0.AM: Trace Attempt 751	[152.19 s]
0.0.Hp: Trace Attempt 2213	[152.28 s]
0.0.Bm: Trace Attempt 5651	[152.79 s]
0.0.B: Trace Attempt 5653	[152.84 s]
0.0.Ht: Trace Attempt 5996	[153.48 s]
0.0.N: Trace Attempt 266	[153.78 s]
0.0.AM: Trace Attempt 761	[156.26 s]
0.0.Bm: Trace Attempt 5752	[156.80 s]
0.0.B: Trace Attempt 5755	[156.85 s]
0.0.Ht: Trace Attempt 6074	[157.49 s]
0.0.N: Trace Attempt 323	[157.89 s]
0.0.Hp: Trace Attempt 2219	[160.18 s]
0.0.AM: Trace Attempt 771	[160.46 s]
0.0.Bm: Trace Attempt 5850	[160.81 s]
0.0.B: Trace Attempt 5853	[160.86 s]
0.0.Ht: Trace Attempt 6127	[161.51 s]
0.0.N: Trace Attempt 365	[161.94 s]
0.0.Hp: Trace Attempt 2232	[164.53 s]
0.0.AM: Trace Attempt 780	[164.48 s]
0.0.Bm: Trace Attempt 5947	[164.84 s]
0.0.B: Trace Attempt 5949	[164.88 s]
0.0.Ht: Trace Attempt 6178	[165.54 s]
0.0.N: Trace Attempt 406	[166.00 s]
0.0.AM: Trace Attempt 789	[168.69 s]
0.0.Bm: Trace Attempt 6037	[168.87 s]
0.0.B: Trace Attempt 6039	[168.91 s]
0.0.Ht: Trace Attempt 6228	[169.62 s]
0.0.Hp: Trace Attempt 2235	[169.94 s]
0.0.N: Trace Attempt 443	[170.07 s]
0.0.Bm: Trace Attempt 6122	[172.89 s]
0.0.B: Trace Attempt 6125	[172.96 s]
0.0.AM: Trace Attempt 799	[173.07 s]
0.0.Hp: Trace Attempt 2243	[174.18 s]
0.0.N: Trace Attempt 468	[175.28 s]
0.0.N: Trace Attempt  1	[175.29 s]
0.0.N: Trace Attempt  2	[175.29 s]
0.0.N: Trace Attempt  3	[175.29 s]
0.0.N: Trace Attempt  4	[175.29 s]
0.0.N: Trace Attempt  5	[175.29 s]
0.0.Ht: Trace Attempt 6278	[175.70 s]
0.0.Bm: Trace Attempt 6211	[176.92 s]
0.0.B: Trace Attempt 6215	[176.99 s]
0.0.AM: Trace Attempt 809	[177.34 s]
0.0.N: Trace Attempt 208	[179.31 s]
0.0.Ht: Trace Attempt 6324	[179.72 s]
0.0.N: Trace Attempt 239	[180.79 s]
0.0.N: Stopped processing property "SEVEN.p1"	[180.95 s].
0.0.N: Morphing to Ncustom1
0.0.N: All properties determined. [0.00 s]
0.0.N: Exited with Success (@ 0.00 s)
0.0.Ncustom1: clocks: 1, declared: 1, looping: 0, posedge: 1, negedge: 0, noedge: 0, bothedge: 0
0.0.Ncustom1: Starting proof for property "SEVEN.p1"	[0.00 s].
0.0.Bm: Trace Attempt 6293	[180.92 s]
0.0.Ncustom1: Trace Attempt 467	[0.02 s]
0.0.B: Trace Attempt 6294	[180.87 s]
0.0.B: Stopped processing property "SEVEN.p1"	[180.97 s].
0.0.B: Morphing to Bcustom2
0.0.B: All properties determined. [0.00 s]
0.0.B: Exited with Success (@ 0.00 s)
0.0.Bcustom2: clocks: 1, declared: 1, looping: 0, posedge: 1, negedge: 0, noedge: 0, bothedge: 0
0.0.Bcustom2: Starting proof for property "SEVEN.p1"	[0.00 s].
0.0.Bcustom2: Trace Attempt  1	[0.00 s]
0.0.Bcustom2: Trace Attempt  2	[0.00 s]
0.0.Bcustom2: Trace Attempt  1	[0.00 s]
0.0.Bcustom2: Trace Attempt  2	[0.00 s]
0.0.Bcustom2: Trace Attempt  3	[0.00 s]
0.0.Bcustom2: Trace Attempt  4	[0.00 s]
0.0.Bcustom2: Trace Attempt  5	[0.00 s]
0.0.Bcustom2: Trace Attempt  1	[0.00 s]
0.0.Bcustom2: Trace Attempt  2	[0.00 s]
0.0.Bcustom2: Trace Attempt  3	[0.00 s]
0.0.Bcustom2: Trace Attempt  4	[0.00 s]
0.0.Bcustom2: Trace Attempt  5	[0.00 s]
0.0.Bcustom2: Trace Attempt  1	[0.00 s]
0.0.Bcustom2: Trace Attempt  2	[0.00 s]
0.0.Bcustom2: Trace Attempt  3	[0.00 s]
0.0.Bcustom2: Trace Attempt  4	[0.00 s]
0.0.Bcustom2: Trace Attempt  5	[0.00 s]
0.0.Bcustom2: Trace Attempt  1	[0.01 s]
0.0.Bcustom2: Trace Attempt  2	[0.01 s]
0.0.Bcustom2: Trace Attempt  3	[0.01 s]
0.0.Bcustom2: Trace Attempt  4	[0.01 s]
0.0.Bcustom2: Trace Attempt  5	[0.01 s]
0.0.Bcustom2: Trace Attempt  1	[0.02 s]
0.0.Bcustom2: Trace Attempt  2	[0.02 s]
0.0.Bcustom2: Trace Attempt  3	[0.02 s]
0.0.Bcustom2: Trace Attempt  4	[0.02 s]
0.0.Bcustom2: Trace Attempt  5	[0.02 s]
0.0.Bcustom2: Trace Attempt  1	[0.06 s]
0.0.Bcustom2: Trace Attempt  2	[0.06 s]
0.0.Bcustom2: Trace Attempt  3	[0.06 s]
0.0.Bcustom2: Trace Attempt  4	[0.06 s]
0.0.Bcustom2: Trace Attempt  5	[0.06 s]
0.0.AM: Trace Attempt 817	[180.85 s]
0.0.AM: Stopped processing property "SEVEN.p1"	[181.03 s].
0.0.AM: Morphing to AMcustom3
0.0.Tri: Proofgrid shell started at 19629@vlsi-ria85(local) jg_14932_vlsi-ria85_1
0.0.D: Proofgrid shell started at 19630@vlsi-ria85(local) jg_14932_vlsi-ria85_1
0.0.Tri: clocks: 1, declared: 1, looping: 0, posedge: 1, negedge: 0, noedge: 0, bothedge: 0
0.0.D: clocks: 1, declared: 1, looping: 0, posedge: 1, negedge: 0, noedge: 0, bothedge: 0
0.0.D: Last scan. Per property time limit: 0s
0.0.D: Starting proof for property "SEVEN.p1"	[0.00 s].
0.0.D: Trace Attempt  1	[0.00 s]
0.0.D: Trace Attempt  2	[0.00 s]
0.0.D: Trace Attempt  3	[0.00 s]
0.0.AM: All properties determined. [0.00 s]
0.0.AM: Exited with Success (@ 0.00 s)
0.0.AMcustom3: clocks: 1, declared: 1, looping: 0, posedge: 1, negedge: 0, noedge: 0, bothedge: 0
0.0.AMcustom3: Starting proof for property "SEVEN.p1"	[0.00 s].
0.0.AMcustom3: Trace Attempt  1	[0.00 s]
0.0.AMcustom3: Trace Attempt  2	[0.00 s]
0.0.Tri: Last scan. Per property time limit: 0s
0.0.Tri: Starting proof for property "SEVEN.p1"	[0.00 s].
0.0.Tri: Trace Attempt  1	[0.00 s]
0.0.AMcustom3: Trace Attempt  3	[0.00 s]
0.0.AMcustom3: Trace Attempt  4	[0.00 s]
0.0.AMcustom3: Trace Attempt  5	[0.00 s]
0.0.AMcustom3: Trace Attempt  1	[0.00 s]
0.0.AMcustom3: Trace Attempt  2	[0.00 s]
0.0.AMcustom3: Trace Attempt  3	[0.00 s]
0.0.AMcustom3: Trace Attempt  4	[0.00 s]
0.0.AMcustom3: Trace Attempt  5	[0.00 s]
0.0.AMcustom3: Trace Attempt  1	[0.01 s]
0.0.AMcustom3: Trace Attempt  2	[0.01 s]
0.0.AMcustom3: Trace Attempt  3	[0.01 s]
0.0.AMcustom3: Trace Attempt  4	[0.01 s]
0.0.AMcustom3: Trace Attempt  5	[0.01 s]
0.0.AMcustom3: Trace Attempt  1	[0.03 s]
0.0.AMcustom3: Trace Attempt  2	[0.03 s]
0.0.AMcustom3: Trace Attempt  3	[0.03 s]
0.0.AMcustom3: Trace Attempt  4	[0.03 s]
0.0.AMcustom3: Trace Attempt  5	[0.03 s]
0.0.Tri:    0.00" ---- Launching main thread ----
0.0.Bcustom2: Trace Attempt  1	[0.17 s]
0.0.Bcustom2: Trace Attempt  2	[0.17 s]
0.0.Bcustom2: Trace Attempt  3	[0.17 s]
0.0.Bcustom2: Trace Attempt  4	[0.17 s]
0.0.Bcustom2: Trace Attempt  5	[0.17 s]
0.0.AMcustom3: Trace Attempt  1	[0.09 s]
0.0.AMcustom3: Trace Attempt  2	[0.09 s]
0.0.AMcustom3: Trace Attempt  3	[0.09 s]
0.0.AMcustom3: Trace Attempt  4	[0.09 s]
0.0.AMcustom3: Trace Attempt  5	[0.09 s]
0.0.Tri:    0.13" ---- Launching abstraction thread ----
0.0.Tri:    0.16" ---- Launching multi-phase simplification thread ----
0.0.Bcustom2: Trace Attempt  1	[0.40 s]
0.0.Bcustom2: Trace Attempt  2	[0.40 s]
0.0.Bcustom2: Trace Attempt  3	[0.40 s]
0.0.Bcustom2: Trace Attempt  4	[0.40 s]
0.0.Bcustom2: Trace Attempt  5	[0.40 s]
0.0.AMcustom3: Trace Attempt  1	[0.38 s]
0.0.AMcustom3: Trace Attempt  2	[0.38 s]
0.0.AMcustom3: Trace Attempt  3	[0.38 s]
0.0.AMcustom3: Trace Attempt  4	[0.38 s]
0.0.AMcustom3: Trace Attempt  5	[0.38 s]
0.0.Tri:    0.32" ---- Launching liveness simplification thread ----
0.0.Hp: Trace Attempt 2249	[182.14 s]
0.0.D: Trace Attempt 65	[0.92 s]
0.0.D: Stopped processing property "SEVEN.p1"	[1.05 s].
0.0.D: Morphing to M
0.0.D: All properties determined. [0.00 s]
0.0.D: Exited with Success (@ 0.00 s)
0.0.M: clocks: 1, declared: 1, looping: 0, posedge: 1, negedge: 0, noedge: 0, bothedge: 0
0.0.M: Starting proof for property "SEVEN.p1"	[0.00 s].
0.0.M: Trace Attempt  1	[0.00 s]
0.0.M: Trace Attempt  2	[0.00 s]
0.0.M: Trace Attempt  3	[0.00 s]
0.0.M: Trace Attempt  4	[0.00 s]
0.0.M: Trace Attempt  5	[0.00 s]
0.0.Tri:    1.17" Simplification phase 1 complete
0.0.Ncustom1: Trace Attempt  1	[1.45 s]
0.0.Ncustom1: Trace Attempt  2	[1.45 s]
0.0.Ncustom1: Trace Attempt  3	[1.45 s]
0.0.Ncustom1: Trace Attempt  4	[1.45 s]
0.0.Ncustom1: Trace Attempt  5	[1.45 s]
0.0.Ncustom1: Requesting engine job to terminate
0.0.Bcustom2: Requesting engine job to terminate
0.0.AMcustom3: Requesting engine job to terminate
0.0.Tri: Requesting engine job to terminate
0.0.M: Requesting engine job to terminate
0.0.Hp: Requesting engine job to terminate
0.0.Ht: Requesting engine job to terminate
0.0.Bm: Requesting engine job to terminate
INFO (IPF144): 0: Initiating shutdown of proof [182.44 s]
0.0.Tri: A proof was found: No trace exists. [1.32 s]
INFO (IPF057): 0.0.Tri: The property "SEVEN.p1" was proven in 1.33 s.
0.0.Ncustom1: Trace Attempt 18	[1.48 s]
0.0.Ncustom1: Stopped processing property "SEVEN.p1"	[1.49 s].
0.0.AMcustom3: Trace Attempt 101	[1.32 s]
0.0.AMcustom3: Stopped processing property "SEVEN.p1"	[1.34 s].
0.0.AMcustom3: All properties determined. [1.33 s]
0.0.Ncustom1: All properties determined. [1.49 s]
0.0.Ht: Trace Attempt 6371	[182.35 s]
0.0.Ht: All properties determined. [182.39 s]
0.0.Ncustom1: Exited with Success (@ 182.45 s)
0: ProofGrid usable level: 0
0.0.M: Trace Attempt 41	[0.27 s]
0.0.M: Stopped processing property "SEVEN.p1"	[0.29 s].
0.0.M: All properties determined. [0.29 s]
0.0.M: Exited with Success (@ 182.46 s)
0.0.AMcustom3: Exited with Success (@ 182.46 s)
0.0.Bcustom2: Trace Attempt 623	[1.42 s]
0.0.Bcustom2: Stopped processing property "SEVEN.p1"	[1.44 s].
0.0.Bcustom2: All properties determined. [1.45 s]
0.0.Bcustom2: Exited with Success (@ 182.47 s)
0.0.AMcustom5: Proofgrid shell started at 19925@vlsi-ria85(local) jg_14932_vlsi-ria85_1
0.0.AMcustom5: Requesting engine job to terminate
0.0.AMcustom5: Preventing job from starting because proof is shutting down.
0.0.AMcustom5: Requesting engine job to terminate
0.0.AMcustom5: Interrupted. [0.00 s]
0.0.AMcustom5: Exited with Success (@ 182.47 s)
0.0.Ht: Exited with Success (@ 182.49 s)
0.0.Bm: Trace Attempt 6323	[182.32 s]
0.0.Bm: All properties determined. [182.46 s]
0.0.Bm: Exited with Success (@ 182.51 s)
0.0.Hp: Trace Attempt 2250	[182.40 s]
0.0.Hp: All properties determined. [182.50 s]
0.0.Hp: Exited with Success (@ 182.58 s)
0.0.Tri: Stopped processing property "SEVEN.p1"	[1.52 s].
0.0.Tri: All properties determined. [1.52 s]
0.0.Tri: Exited with Success (@ 182.64 s)
0: --------------------------------------------------------------
ProofGrid Summary (utilization 99.91 %)
--------------------------------------------------------------
     engines started                               :    16
     engine jobs started                           :    12

    Average time in state (seconds)
    ------------------------------------------------------
    Engine  Pending     Running        Dead    Utilization
    ------------------------------------------------------
     Hp        0.03      182.44        0.00       99.98 %
     Ht        0.05      182.39        0.00       99.97 %
     Bm        0.04      182.40        0.00       99.98 %
    Mpcustom4        0.03        0.00        0.00        9.66 %
     Oh        0.04        0.00        0.00        3.02 %
      L        0.03        0.00        0.00        9.78 %
    Ncustom1        0.03      182.42        0.00       99.98 %
    Bcustom2        0.03      182.32        0.00       99.98 %
    AMcustom3        0.06      182.19        0.00       99.97 %
    Tri        0.16        1.33        0.00       89.19 %
      M        0.15        1.31        0.00       89.62 %
    AMcustom5        0.32        0.00        0.00        0.00 %
    all        0.08       91.40        0.00       99.91 %

    Total time in state (seconds)
    -----------------------------------------
            Pending     Running        Dead  
    -----------------------------------------
               0.99     1096.80        0.00

    Data read    : 7.22 MiB
    Data written : 4.72 kiB

0: All pending notifications were processed.
INFO (IPF059): 0: Completed proof on task: "<embedded>"

==============================================================
SUMMARY
==============================================================
           Properties Considered              : 2
                 assertions                   : 1
                  - proven                    : 1 (100%)
                  - bounded_proven (user)     : 0 (0%)
                  - bounded_proven (auto)     : 0 (0%)
                  - marked_proven             : 0 (0%)
                  - cex                       : 0 (0%)
                  - ar_cex                    : 0 (0%)
                  - undetermined              : 0 (0%)
                  - unknown                   : 0 (0%)
                  - error                     : 0 (0%)
                 covers                       : 1
                  - unreachable               : 0 (0%)
                  - bounded_unreachable (user): 0 (0%)
                  - covered                   : 1 (100%)
                  - ar_covered                : 0 (0%)
                  - undetermined              : 0 (0%)
                  - unknown                   : 0 (0%)
                  - error                     : 0 (0%)
determined
[<embedded>] % exit -force
[<embedded>] % INFO (IPL005): Received request to exit from the console.
INFO (IPL014): Waiting for the Tcl-thread to exit.
INFO: Waiting for proof threads to stop...
INFO: Proof threads stopped.
INFO (IPL018): The peak resident set memory use for this session was 1.882 GB.
INFO (IPL015): The Tcl-thread exited with status 0.
INFO (IPL016): Exiting the analysis session with status 0.
Finished seven_seg_2.tcl successfully
