# ----------------------------------------
# Jasper Version Info
# tool      : Jasper 2024.06
# platform  : Linux 3.10.0-1160.62.1.el7.x86_64
# version   : 2024.06p002 64 bits
# build date: 2024.09.02 16:28:38 UTC
# ----------------------------------------
# started   : 2025-12-23 23:11:38 IST
# hostname  : vlsi-ria85.vlsidomain
# pid       : 30300
# arguments : '-label' 'session_0' '-console' '//127.0.0.1:38905' '-nowindow' '-style' 'windows' '-exitonerror' '-data' 'AAAAynicY2RgYLCp////PwMYMD6A0Aw2jAyoAMRnQhUJbEChGRhYYZphSliAmItBl6GAoYghnyELyNNi0ANCfSA7HS6aypDMUMJQDBQ1ZIhnCGAIZ/AF0pZA1TxAvUkMiUDZZIYMIF8MTYUeWCYHbBcA4P8Vzw==' '-proj' '/users/rompel/jasper_executions/safety_liveness/jgprojects/1_PWM_9/sessionLogs/session_0' '-init' '-hidden' '/users/rompel/jasper_executions/safety_liveness/jgprojects/1_PWM_9/.tmp/.initCmds.tcl' '1_PWM_9.tcl' '-hidden' '/users/rompel/jasper_executions/safety_liveness/jgprojects/1_PWM_9/.tmp/.postCmds.tcl'

Any disclosure about the Cadence Design Systems software or its use
model to any third party violates the written Non-Disclosure Agreement
between Cadence Design Systems, Inc. and the customer.

THIS SOFTWARE CONTAINS CONFIDENTIAL INFORMATION AND TRADE SECRETS OF
CADENCE DESIGN SYSTEMS, INC. USE, DISCLOSURE, OR REPRODUCTION IS
PROHIBITED WITHOUT THE PRIOR EXPRESS WRITTEN PERMISSION OF CADENCE
DESIGN SYSTEMS, INC.

Copyright (C) 2000-2024 Cadence Design Systems, Inc. All Rights
Reserved.  Unpublished -- rights reserved under the copyright laws of
the United States.

This product includes software developed by others and redistributed
according to license agreement. See doc/third_party_readme.txt for
further details.

RESTRICTED RIGHTS LEGEND

Use, duplication, or disclosure by the Government is subject to
restrictions as set forth in subparagraph (c) (1) (ii) of the Rights in
Technical Data and Computer Software clause at DFARS 252.227-7013 or
subparagraphs (c) (1) and (2) of Commercial Computer Software -- Restricted
Rights at 48 CFR 52.227-19, as applicable.


                          Cadence Design Systems, Inc.
                          2655 Seely Avenue
                          San Jose, CA 95134
                          Phone: 408.943.1234

For technical assistance visit http://support.cadence.com.

Jasper Apps Analysis Session - /users/rompel/jasper_executions/safety_liveness/jgprojects/1_PWM_9/sessionLogs/session_0

WARNING (WG017): [session]: The system's locale is "ANSI_X3.4-1968", which is not UTF-8. Non-ASCII characters might not be handled correctly.
WARNING (WG017): [jg_console]: The system's locale is "ANSI_X3.4-1968", which is not UTF-8. Non-ASCII characters might not be handled correctly.
INFO: successfully checked out license "jasper_fao".
INFO: reading configuration file "/users/rompel/.config/cadence/jasper.conf".
% analyze -sv09 ../1_PWM_9.sv
[-- (VERI-1482)] Analyzing Verilog file '/tools/cadence2425/JASPER/jasper_2024.06p002/lib/verilog/packages/std/std.sv' into library 'std'
[-- (VERI-1482)] Analyzing Verilog file '../1_PWM_9.sv'
% elaborate -bbox_mul 1000000 -bbox_div 1000000 -bbox_mod 1000000 -bbox_a 1000000
[INFO (HIER-8002)] ../1_PWM_9.sv(37): Disabling old hierarchical reference handler
[INFO (VERI-1018)] ../1_PWM_9.sv(1): compiling module 'PWM_TOP'
[WARN (VERI-1209)] ../1_PWM_9.sv(15): expression size 32 truncated to fit in target size 18
[INFO (VERI-8005)] ../1_PWM_9.sv(1): Unintentional sequential element inferred for pulse_red read before write using blocking assignment
[INFO (VERI-8005)] ../1_PWM_9.sv(1): Unintentional sequential element inferred for lb_pulse read before write using blocking assignment
[INFO (VERI-8005)] ../1_PWM_9.sv(1): Unintentional sequential element inferred for ub_pulse read before write using blocking assignment
INFO (ISW003): Top module name is "PWM_TOP".
INFO (INL208): Elaboration synthesis summary:
  Number of synthesized netlists          1 (0 packages)
  Single run mode                         On
  Pipeline                                On (1 pipelined netlists)
  Late hierarchical reference connection  On
  Number of analyzed Verilog modules      1 (1 synthesized)
  Number of analyzed VHDL entities        0 (0 synthesized)
INFO (IOBS001): ../1_PWM_9.sv(33): Liveness property has safety component.
INFO (INL003): Clearing all state information (assumes, stopats, and so forth).
PWM_TOP
[<embedded>] % reset -none
INFO (IPM031): Clearing proof results of all properties.
[<embedded>] % clock clk
[<embedded>] % prove -all
Ncustom1: Custom engine code is hT3Ng7hPPfiYQOTDZ3qhYOwGAM51eA+J/FjkM5shLioAsqhgLR4Ft+O1BuKG6ilQ83B9tLXSl+CwjiTMAQA
Bcustom2: Custom engine code is hT3Nm7hPr1Vp3Di1Ra2USNIGL4JypRnLKLAdF6JAyuavO2JfGCiY9OZJhcAcOUnLx5xwNdhILGrAWX9s+z2WDkKwNR7tAfClBEjRFVQeq6DU54boFgEA
AMcustom3: Custom engine code is hT3Ng7hP/feYQOTDZ3qhYOwGAM51eA+J/FjkM5shLioAsqhgLR4Ft+O1BuKG6ilQ83B9tLXSmmqwm7g9AQA
Mpcustom4: Custom engine code is hT3NZbhP9fmY2AbBQnsjfOxn6c+6e6yL+/e8fZFmaQrnlgEA
INFO (IPF036): Starting proof on task: "<embedded>", 3 properties to prove with 0 already proven/unreachable
INFO (IRS029): Starting reset analysis: phase 1 of 4.
INFO (IRS030): Running reset analysis: phase 2 of 4.
INFO (IRS031): Running reset analysis: phase 3 of 4.
INFO (IRS020): Starting the reset analysis simulation with a limit of 100 iterations (phase 4 of 4).
INFO (IRS024): Reset iterations 0 to 4 analyzed.
INFO (IRS018): Reset analysis simulation executed for 3 iterations. Assigned values for 0 of 21 design flops, 0 of 0 design latches, 8 of 8 internal elements.
INFO (IRS039): Reset analysis complete.
INFO (IPF031): Settings used for proof thread 0:
    orchestration                 = on
    time_limit                    = 86400s
    per_property_time_limit       = 1s * 10 ^ scan
    engine_mode                   = auto
    proofgrid_per_engine_max_jobs = 1
    max engine jobs               = auto
    proofgrid_mode                = local
    proofgrid_restarts            = 10
AMcustom5: Custom engine code is hT3N1rhP11/52HrFRS21ROp2LOjVTgPvT8L8BGXHgLhaIuqtT4nARFjUqrBL+7pLmaTOzBepZW/Jm8SSrHDybSQtoNiO3y43wk+dEoWlsZizu97Fih6O6lPVG/LpWP5SsUPwlGagLNa1FKEFvwVXyX7//8prySbvSxIHXr5er+z4RAEA
0: Using multistage preprocessing
0: Starting reduce
Ncustom6: Custom engine code is hT3OXrhPByJp3TrFSTLhUmMH4KVtJgmTCnNDF46yMXOKY48m4LS5nE7yBzFjA7kDuwO/GhGUpEPiky3p3wmPn3dJZHxFMsafSoObRzSC+tn7sEY0WbTdZ/FV4hL3MYH/b1CIUvXSWR4wqEoVLsmMOD4xIPT4lI1LO6ZCO7PnnWQuLwetnvKlrXx6wCW/A+x+enqslg1YPobi4wEF/EvbzOvcTYdJvl2s4H2yZg2b2ofAVN5WvhWk1HoBAA
ADcustom7: Custom engine code is hT3Nv7hPv1752HrFRa2kROx2f/ECJeZB2AZsLdlO8VwmIuqtT4nIDFXclhg+O+o+DMmQCekbheGk0kK28laA9gaOFDXsQp29J3X615HY1IPHJWd6FUFvCHjO+p1k652b5JJvZlShNpGlGSXAiQe/mEAj6tEBAA
Tricustom8: Custom engine code is hT3Nu7hPt1752DvFRa0kNDiyIV97VyejwM9C/jCLJjdPvusZONHY42VYUy0Q1ZotnhcVtNc56tJ5wbxv6V2+XpdsaSlHck5vfnbYjdwj1OECy9U+7oSQ0SZE3g5ayD+Phuh4odCJTjeKa2k4elM9ldQfkAEA
Gcustom9: Custom engine code is hT3NibhPDfeYQADBZnYcglOvK9Pfd7EOeniIqP8jNsyIqInncipMGcUXqAadachREE9F2PwhBUZUNw5kHnd4JdXkamORRgEA
C2custom10: Custom engine code is hT3NirhPjfWYQADBZnYcglOvK9Pfd7EOeniIqP8jNsyIqInncgkrYMMXCYbdK0dUjZIF9d4cJ0rHoBDjwVLBKuG86XYVV00BAA
AGcustom11: Custom engine code is hT3NirhP/fmYQADBZnYcglOvK9Pfd7EOeniIqP8jNsyIqInnckcwYMMXCYbdK0dUjZIF9d4cJ0rHoBDjwVLBKuHEZnZByh0BAA
Bcustom12: Custom engine code is hT3NjrhPDfiYQADBZnYcglOvK9PfWxFtenjIyBqfrgr7if/jL/yPOuK1BAflEcW0DxNH2eDIoezN2gxlQFg81RZtiWXh7aiTAidvAQA
0: Finished reduce in 0s
Ncustom13: Custom engine code is hT3NR7hPByFp3TrFSTLhUmMH4KWtJglTyV/c51BHEeZWamnJv767nE6PCak26bd3gf3XGN3rIRheufhDieCJQVISo+gNYUKhiUedBKGtsP/a18svAnlMJZudHxDFwK5ufsyoxsIyiAeSY2oi3tEuoDHr5gw42DFKAG3PqO3CEsl8Azzdt3pl5nGA1Ifv2H02eYsFzWb/nfp8PMb3F0krE/EgBcm8TD9Div8BAA
Tricustom14: Custom engine code is hT3Nu7hP3fiYQADBZnYcglNHp9bfd7EOeniIqP/ji8sGLQu8yhsFO+wxJ+O+R0bU8g/IewXFomyos+viQnWc2xYNYmMqpo3i40O7DaZR7qfp4YqNx26KRvQ/qx0BAA
0.0.PRE: Performing Proof Simplification...
0.0.N: clocks: 1, declared: 1, looping: 0, posedge: 1, negedge: 0, noedge: 0, bothedge: 0
0.0.N: Proof Simplification Iteration 1	[0.00 s]
0.0.PRE: A trace with 1 cycles was found. [0.00 s]
INFO (IPF047): 0.0.PRE: The cover property "PWM_TOP.p1:precondition1" was covered in 1 cycles in 0.00 s.
0.0.N: Proof Simplification Iteration 2	[0.06 s]
0.0.N: Proof Simplification Iteration 3	[0.06 s]
0.0.N: Proof Simplification Iteration 4	[0.06 s]
0.0.PRE: A proof was found: No trace exists. [0.00 s]
INFO (IPF057): 0.0.PRE: The property ":noDeadEnd" was proven in 0.00 s.
    Use check_assumptions -show -dead_end to show this property in the property table.
0.0.PRE: A proof was found: No trace exists. [0.00 s]
INFO (IPF057): 0.0.PRE: The property ":noConflict" was proven in 0.00 s.
    Use check_assumptions -show to show this property in the property table.
INFO (IPF047): 0.0.PRE: The cover property ":live" was covered in 1 cycles in 0.00 s.
    Use check_assumptions -show -live to show this property in the property table.
0.0.PRE: A proof was found: No trace exists. [0.00 s]
INFO (IPF057): 0.0.PRE: The property "PWM_TOP.p1:safety_in_liveness_assert1" was proven in 0.00 s.
0.0.PRE: Proof Simplification completed in 0.06 s
0: About to start ProofGrid in its own thread with a limit of 10000 pending notifications and a limit of 10 traces.
0: =============================== ProofGrid start ===============================
0: ProofGrid usable level: 1
0: Initial ProofGrid level: 1
0: ProofGrid is starting event handling
0.0.Hp: Proofgrid shell started at 30473@vlsi-ria85(local) jg_30300_vlsi-ria85_1
0.0.N: Proofgrid shell started at 30472@vlsi-ria85(local) jg_30300_vlsi-ria85_1
0.0.Hp: clocks: 1, declared: 1, looping: 0, posedge: 1, negedge: 0, noedge: 0, bothedge: 0
0.0.Hp: Last scan. Per property time limit: 0s
0.0.N: clocks: 1, declared: 1, looping: 0, posedge: 1, negedge: 0, noedge: 0, bothedge: 0
0.0.N: Last scan. Per property time limit: 0s
0.0.N: Starting proof for property "PWM_TOP.p1"	[0.00 s].
0.0.N: Trace Attempt  1	[0.00 s]
0.0.N: Trace Attempt  2	[0.00 s]
0.0.N: Trace Attempt  2	[0.00 s]
0.0.N: Trace Attempt  3	[0.00 s]
0.0.N: Trace Attempt  3	[0.00 s]
0.0.N: Trace Attempt  4	[0.00 s]
0.0.N: Trace Attempt  5	[0.00 s]
0.0.N: Trace Attempt  5	[0.00 s]
0.0.Hp: Trace Attempt  1	[0.00 s]
0.0.Hp: Trace Attempt  2	[0.00 s]
0.0.Hp: Trace Attempt  3	[0.00 s]
0.0.Hp: Trace Attempt  4	[0.00 s]
0.0.Hp: Trace Attempt  5	[0.00 s]
0.0.Mpcustom4: Proofgrid shell started at 30537@vlsi-ria85(local) jg_30300_vlsi-ria85_1
0.0.Mpcustom4: clocks: 1, declared: 1, looping: 0, posedge: 1, negedge: 0, noedge: 0, bothedge: 0
0.0.Mpcustom4: Ignoring liveness properties
0.0.Mpcustom4: All properties either determined or skipped. [0.00 s]
0.0.Mpcustom4: Exited with Success (@ 0.04 s)
0.0.Mpcustom4: Completed, Restart ignored.
0.0.Bm: Proofgrid shell started at 30532@vlsi-ria85(local) jg_30300_vlsi-ria85_1
0.0.N: Trace Attempt  1	[0.04 s]
0.0.Bm: clocks: 1, declared: 1, looping: 0, posedge: 1, negedge: 0, noedge: 0, bothedge: 0
0.0.Bm: Ignoring liveness properties
0.0.Bm: Last scan. Per property time limit: 0s
0.0.Bm: Trace Attempt  1	[0.00 s]
0.0.Ht: Proofgrid shell started at 30527@vlsi-ria85(local) jg_30300_vlsi-ria85_1
0.0.Bm: Trace Attempt  2	[0.00 s]
0.0.Bm: Trace Attempt  3	[0.00 s]
0.0.N: Trace Attempt  2	[0.04 s]
0.0.N: Trace Attempt  3	[0.04 s]
0.0.Bm: Trace Attempt  4	[0.00 s]
0.0.Bm: Trace Attempt  5	[0.00 s]
0.0.Ht: clocks: 1, declared: 1, looping: 0, posedge: 1, negedge: 0, noedge: 0, bothedge: 0
0.0.Ht: Last scan. Per property time limit: 0s
0.0.Ht: Trace Attempt  1	[0.00 s]
0.0.Ht: Trace Attempt  2	[0.00 s]
0.0.Ht: Trace Attempt  3	[0.00 s]
0.0.L: Proofgrid shell started at 30540@vlsi-ria85(local) jg_30300_vlsi-ria85_1
0.0.Ht: Trace Attempt  4	[0.00 s]
0.0.N: Trace Attempt  4	[0.04 s]
0.0.Ht: Trace Attempt  5	[0.00 s]
0.0.L: clocks: 1, declared: 1, looping: 0, posedge: 1, negedge: 0, noedge: 0, bothedge: 0
0.0.L: Using trace diversification with seed 1 (0.05)
0.0.L: Using LRU state removal heuristic
0.0.L: Ignoring liveness properties
0.0.L: All properties either determined or skipped. [0.00 s]
0.0.L: Exited with Success (@ 0.05 s)
0.0.L: Completed, Restart ignored.
0.0.N: Trace Attempt  5	[0.05 s]
0.0.Oh: Proofgrid shell started at 30538@vlsi-ria85(local) jg_30300_vlsi-ria85_1
0.0.B: Proofgrid shell started at 30593@vlsi-ria85(local) jg_30300_vlsi-ria85_1
0.0.Oh: clocks: 1, declared: 1, looping: 0, posedge: 1, negedge: 0, noedge: 0, bothedge: 0
0.0.Oh: Reached length limit (2147483647) [0.00 s]
0.0.B: clocks: 1, declared: 1, looping: 0, posedge: 1, negedge: 0, noedge: 0, bothedge: 0
0.0.B: Last scan. Per property time limit: 0s
0.0.B: Starting proof for property "PWM_TOP.p1"	[0.00 s].
0.0.B: Trace Attempt  1	[0.00 s]
0.0.B: Trace Attempt  2	[0.00 s]
0.0.B: Trace Attempt  3	[0.00 s]
0.0.Oh: Exited with Success (@ 0.07 s)
0.0.Oh: Completed, Restart ignored.
0.0.B: Trace Attempt  4	[0.00 s]
0.0.B: Trace Attempt  5	[0.00 s]
0.0.AM: Proofgrid shell started at 30597@vlsi-ria85(local) jg_30300_vlsi-ria85_1
0.0.AM: clocks: 1, declared: 1, looping: 0, posedge: 1, negedge: 0, noedge: 0, bothedge: 0
0.0.AM: Last scan. Per property time limit: 0s
0.0.AM: Starting proof for property "PWM_TOP.p1"	[0.00 s].
0.0.AM: Trace Attempt  1	[0.00 s]
0.0.AM: Trace Attempt  2	[0.00 s]
0.0.AM: Trace Attempt  3	[0.00 s]
0.0.AM: Trace Attempt  4	[0.00 s]
0.0.AM: Trace Attempt  5	[0.00 s]
0.0.AM: Trace Attempt  1	[0.00 s]
0.0.AM: Trace Attempt  2	[0.00 s]
0.0.AM: Trace Attempt  3	[0.00 s]
0.0.AM: Trace Attempt  4	[0.01 s]
0.0.AM: Trace Attempt  5	[0.01 s]
0.0.AM: Trace Attempt  1	[0.02 s]
0.0.AM: Trace Attempt  2	[0.02 s]
0.0.AM: Trace Attempt  3	[0.02 s]
0.0.AM: Trace Attempt  4	[0.02 s]
0.0.AM: Trace Attempt  5	[0.03 s]
0.0.AM: Trace Attempt  1	[0.07 s]
0.0.AM: Trace Attempt  2	[0.07 s]
0.0.AM: Trace Attempt  3	[0.07 s]
0.0.AM: Trace Attempt  4	[0.07 s]
0.0.AM: Trace Attempt  5	[0.08 s]
0.0.N: Trace Attempt  1	[0.25 s]
0.0.N: Trace Attempt  2	[0.25 s]
0.0.N: Trace Attempt  3	[0.25 s]
0.0.N: Trace Attempt  4	[0.26 s]
0.0.N: Trace Attempt  5	[0.26 s]
0.0.AM: Trace Attempt  1	[0.39 s]
0.0.AM: Trace Attempt  2	[0.39 s]
0.0.AM: Trace Attempt  3	[0.39 s]
0.0.N: Trace Attempt  1	[0.48 s]
0.0.N: Trace Attempt  2	[0.48 s]
0.0.N: Trace Attempt  3	[0.48 s]
0.0.N: Trace Attempt  4	[0.48 s]
0.0.AM: Trace Attempt  4	[0.40 s]
0.0.AM: Trace Attempt  5	[0.40 s]
0.0.N: Trace Attempt  5	[0.48 s]
0.0.N: Trace Attempt  1	[0.70 s]
0.0.N: Trace Attempt  2	[0.71 s]
0.0.N: Trace Attempt  3	[0.71 s]
0.0.N: Trace Attempt  4	[0.71 s]
0.0.N: Trace Attempt  5	[0.71 s]
0.0.N: Trace Attempt  1	[1.20 s]
0.0.N: Trace Attempt  2	[1.21 s]
0.0.N: Trace Attempt  3	[1.21 s]
0.0.N: Trace Attempt  4	[1.21 s]
0.0.N: Trace Attempt  5	[1.21 s]
0.0.AM: Trace Attempt  1	[2.33 s]
0.0.AM: Trace Attempt  2	[2.34 s]
0.0.AM: Trace Attempt  3	[2.34 s]
0.0.AM: Trace Attempt  4	[2.34 s]
0.0.AM: Trace Attempt  5	[2.35 s]
0.0.N: Trace Attempt  1	[3.77 s]
0.0.N: Trace Attempt  2	[3.77 s]
0.0.N: Trace Attempt  3	[3.77 s]
0.0.N: Trace Attempt  4	[3.78 s]
0.0.N: Trace Attempt  5	[3.79 s]
0.0.Hp: Trace Attempt 138	[4.11 s]
0.0.Bm: Trace Attempt 145	[4.08 s]
0.0.B: Trace Attempt 145	[4.12 s]
0.0.Ht: Trace Attempt 140	[4.26 s]
0.0.AM: Trace Attempt 68	[6.42 s]
0.0.N: Trace Attempt  1	[6.96 s]
0.0.N: Trace Attempt  2	[6.96 s]
0.0.N: Trace Attempt  3	[6.96 s]
0.0.N: Trace Attempt  4	[6.96 s]
0.0.N: Trace Attempt  5	[6.97 s]
0.0.Hp: Trace Attempt 166	[8.22 s]
0.0.Bm: Trace Attempt 175	[8.19 s]
0.0.B: Trace Attempt 175	[8.28 s]
0.0.Ht: Trace Attempt 167	[8.37 s]
0.0.N: Trace Attempt  1	[10.33 s]
0.0.N: Trace Attempt  2	[10.33 s]
0.0.N: Trace Attempt  3	[10.33 s]
0.0.N: Trace Attempt  4	[10.34 s]
0.0.N: Trace Attempt  5	[10.35 s]
0.0.AM: Trace Attempt 82	[11.14 s]
0.0.Bm: Trace Attempt 198	[12.28 s]
0.0.Hp: Trace Attempt 188	[12.37 s]
0.0.B: Trace Attempt 198	[12.44 s]
0.0.Ht: Trace Attempt 191	[12.56 s]
0.0.N: Trace Attempt  1	[13.27 s]
0.0.N: Trace Attempt  2	[13.28 s]
0.0.N: Trace Attempt  3	[13.28 s]
0.0.N: Trace Attempt  4	[13.28 s]
0.0.N: Trace Attempt  5	[13.29 s]
0.0.AM: Trace Attempt 89	[16.05 s]
0.0.N: Trace Attempt  1	[16.25 s]
0.0.N: Trace Attempt  2	[16.25 s]
0.0.N: Trace Attempt  3	[16.26 s]
0.0.N: Trace Attempt  4	[16.26 s]
0.0.N: Trace Attempt  5	[16.27 s]
0.0.Hp: Trace Attempt 204	[16.46 s]
0.0.Bm: Trace Attempt 213	[16.47 s]
0.0.B: Trace Attempt 213	[16.70 s]
0.0.Ht: Trace Attempt 208	[16.78 s]
0.0.N: Trace Attempt  1	[19.18 s]
0.0.N: Trace Attempt  2	[19.18 s]
0.0.N: Trace Attempt  3	[19.18 s]
0.0.N: Trace Attempt  4	[19.19 s]
0.0.N: Trace Attempt  5	[19.20 s]
0.0.AM: Trace Attempt 73	[20.19 s]
0.0.Hp: Trace Attempt 223	[20.69 s]
0.0.Bm: Trace Attempt 226	[20.65 s]
0.0.Ht: Trace Attempt 226	[20.90 s]
0.0.B: Trace Attempt 226	[20.96 s]
0.0.N: Trace Attempt  1	[22.18 s]
0.0.N: Trace Attempt  2	[22.18 s]
0.0.N: Trace Attempt  3	[22.18 s]
0.0.N: Trace Attempt  4	[22.18 s]
0.0.N: Trace Attempt  5	[22.19 s]
0.0.AM: Trace Attempt  1	[24.25 s]
0.0.AM: Trace Attempt  2	[24.25 s]
0.0.AM: Trace Attempt  3	[24.25 s]
0.0.AM: Trace Attempt  4	[24.25 s]
0.0.AM: Trace Attempt  5	[24.26 s]
0.0.Bm: Trace Attempt 239	[24.75 s]
0.0.Hp: Trace Attempt 235	[25.07 s]
0.0.Ht: Trace Attempt 237	[25.07 s]
0.0.B: Trace Attempt 239	[25.11 s]
0.0.N: Trace Attempt  1	[25.25 s]
0.0.N: Trace Attempt  2	[25.25 s]
0.0.N: Trace Attempt  3	[25.25 s]
0.0.N: Trace Attempt  4	[25.26 s]
0.0.N: Trace Attempt  5	[25.27 s]
0.0.AM: Trace Attempt 64	[28.34 s]
0.0.N: Trace Attempt  1	[28.60 s]
0.0.N: Trace Attempt  2	[28.60 s]
0.0.N: Trace Attempt  3	[28.60 s]
0.0.N: Trace Attempt  4	[28.60 s]
0.0.N: Trace Attempt  5	[28.61 s]
0.0.Bm: Trace Attempt 254	[29.00 s]
0.0.Hp: Trace Attempt 248	[29.15 s]
0.0.B: Trace Attempt 253	[29.11 s]
0.0.Ht: Trace Attempt 251	[29.24 s]
0.0.N: Trace Attempt  1	[31.99 s]
0.0.N: Trace Attempt  2	[31.99 s]
0.0.N: Trace Attempt  3	[31.99 s]
0.0.N: Trace Attempt  4	[32.00 s]
0.0.N: Trace Attempt  5	[32.00 s]
0.0.AM: Trace Attempt 82	[32.50 s]
0.0.Hp: Trace Attempt 258	[33.23 s]
0.0.B: Trace Attempt 261	[33.36 s]
0.0.Bm: Trace Attempt 262	[33.42 s]
0.0.Ht: Trace Attempt 261	[33.55 s]
0.0.N: Trace Attempt  1	[35.58 s]
0.0.N: Trace Attempt  2	[35.58 s]
0.0.N: Trace Attempt  3	[35.58 s]
0.0.N: Trace Attempt  4	[35.59 s]
0.0.N: Trace Attempt  5	[35.59 s]
0.0.Hp: Trace Attempt 265	[37.33 s]
0.0.AM: Trace Attempt 98	[37.27 s]
0.0.Bm: Trace Attempt 270	[37.59 s]
0.0.Ht: Trace Attempt 267	[37.63 s]
0.0.B: Trace Attempt 269	[37.69 s]
0.0.N: Trace Attempt 66	[40.31 s]
0.0.N: Trace Attempt  1	[40.50 s]
0.0.N: Trace Attempt  2	[40.50 s]
0.0.N: Trace Attempt  3	[40.50 s]
0.0.N: Trace Attempt  4	[40.51 s]
0.0.N: Trace Attempt  5	[40.52 s]
0.0.Hp: Trace Attempt 272	[41.35 s]
0.0.AM: Trace Attempt 105	[41.47 s]
0.0.Bm: Trace Attempt 278	[41.78 s]
0.0.B: Trace Attempt 277	[41.76 s]
0.0.Ht: Trace Attempt 275	[42.04 s]
0.0.N: Trace Attempt 65	[44.52 s]
0.0.AM: Trace Attempt 110	[45.67 s]
0.0.Hp: Trace Attempt 280	[45.89 s]
0.0.Bm: Trace Attempt 285	[46.05 s]
0.0.B: Trace Attempt 284	[46.08 s]
0.0.Ht: Trace Attempt 282	[46.21 s]
0.0.N: Trace Attempt 76	[48.89 s]
0.0.Hp: Trace Attempt 287	[50.33 s]
0.0.B: Trace Attempt 291	[50.32 s]
0.0.AM: Trace Attempt 117	[50.33 s]
0.0.Bm: Trace Attempt 292	[50.48 s]
0.0.Ht: Trace Attempt 289	[50.57 s]
0.0.N: Trace Attempt 84	[53.02 s]
0.0.Bm: Trace Attempt 299	[54.48 s]
0.0.Hp: Trace Attempt 293	[54.57 s]
0.0.B: Trace Attempt 298	[54.63 s]
0.0.Ht: Trace Attempt 295	[55.05 s]
0.0.AM: Trace Attempt 122	[55.30 s]
0.0.N: Trace Attempt 88	[58.03 s]
0.0.Hp: Trace Attempt 300	[58.58 s]
0.0.Bm: Trace Attempt 306	[58.70 s]
0.0.B: Trace Attempt 305	[58.78 s]
0.0.Ht: Trace Attempt 303	[59.13 s]
0.0.AM: Trace Attempt 130	[59.41 s]
0.0.N: Trace Attempt 91	[62.20 s]
0.0.Hp: Trace Attempt 308	[63.16 s]
0.0.Ht: Trace Attempt 310	[63.16 s]
0.0.Bm: Trace Attempt 312	[63.32 s]
0.0.B: Trace Attempt 311	[63.42 s]
0.0.AM: Trace Attempt 137	[64.15 s]
0.0.Ht: Trace Attempt 316	[67.29 s]
0.0.B: Trace Attempt 317	[67.49 s]
0.0.Hp: Trace Attempt 314	[67.59 s]
0.0.Bm: Trace Attempt 318	[68.13 s]
0.0.AM: Trace Attempt 143	[68.31 s]
0.0.N: Trace Attempt 92	[69.14 s]
0.0.N: Trace Attempt  1	[69.46 s]
0.0.N: Trace Attempt  2	[69.46 s]
0.0.N: Trace Attempt  3	[69.46 s]
0.0.N: Trace Attempt  4	[69.46 s]
0.0.N: Trace Attempt  5	[69.47 s]
0.0.Ht: Trace Attempt 322	[71.63 s]
0.0.B: Trace Attempt 322	[72.13 s]
0.0.Hp: Trace Attempt 321	[72.29 s]
0.0.AM: Trace Attempt 146	[72.50 s]
0.0.Bm: Trace Attempt 324	[72.55 s]
0.0.N: Trace Attempt 66	[73.53 s]
0.0.Ht: Trace Attempt 328	[75.96 s]
0.0.B: Trace Attempt 328	[76.52 s]
0.0.Hp: Trace Attempt 327	[76.90 s]
0.0.AM: Trace Attempt 150	[76.98 s]
0.0.Bm: Trace Attempt 330	[77.46 s]
0.0.N: Trace Attempt 77	[77.61 s]
0.0.Ht: Trace Attempt 335	[80.43 s]
0.0.Hp: Trace Attempt 333	[80.94 s]
0.0.B: Trace Attempt 333	[81.07 s]
0.0.AM: Trace Attempt 153	[82.08 s]
0.0.N: Trace Attempt 85	[82.59 s]
0.0.Bm: Trace Attempt 335	[82.88 s]
0.0.Ht: Trace Attempt 341	[84.54 s]
0.0.Hp: Trace Attempt 339	[85.05 s]
0.0.B: Trace Attempt 337	[85.67 s]
0.0.AM: Trace Attempt 156	[86.34 s]
0.0.N: Trace Attempt 89	[87.52 s]
0.0.Bm: Trace Attempt 340	[87.83 s]
0.0.Ht: Trace Attempt 346	[88.81 s]
0.0.Hp: Trace Attempt 344	[89.87 s]
0.0.B: Trace Attempt 342	[90.50 s]
0.0.AM: Trace Attempt 158	[91.08 s]
0.0.Ht: Trace Attempt 351	[92.91 s]
0.0.Bm: Trace Attempt 345	[93.32 s]
0.0.Hp: Trace Attempt 350	[94.04 s]
0.0.B: Trace Attempt 346	[95.12 s]
0.0.AM: Trace Attempt 160	[96.92 s]
0.0.Ht: Trace Attempt 356	[97.16 s]
0.0.Bm: Trace Attempt 349	[97.52 s]
0.0.Hp: Trace Attempt 354	[98.36 s]
0.0.N: Trace Attempt 93	[99.62 s]
0.0.N: Trace Attempt  1	[99.96 s]
0.0.N: Trace Attempt  2	[99.96 s]
0.0.N: Trace Attempt  3	[99.96 s]
0.0.N: Trace Attempt  4	[99.97 s]
0.0.N: Trace Attempt  5	[99.98 s]
0.0.B: Trace Attempt 351	[100.10 s]
0.0.Ht: Trace Attempt 362	[101.51 s]
0.0.AM: Trace Attempt 161	[101.58 s]
0.0.Bm: Trace Attempt 353	[101.77 s]
0.0.Hp: Trace Attempt 360	[103.00 s]
0.0.N: Trace Attempt 66	[104.06 s]
0.0.B: Trace Attempt 356	[104.66 s]
0.0.Ht: Trace Attempt 368	[106.09 s]
0.0.Bm: Trace Attempt 358	[106.27 s]
0.0.AM: Trace Attempt 163	[107.12 s]
0.0.Hp: Trace Attempt 366	[107.70 s]
0.0.N: Trace Attempt 77	[108.17 s]
0.0.B: Trace Attempt 360	[108.80 s]
0.0.Ht: Trace Attempt 374	[110.68 s]
0.0.Bm: Trace Attempt 363	[110.75 s]
0.0.Hp: Trace Attempt 371	[111.74 s]
0.0.N: Trace Attempt 85	[113.18 s]
0.0.B: Trace Attempt 365	[113.40 s]
0.0.Bm: Trace Attempt 367	[114.87 s]
0.0.Ht: Trace Attempt 378	[114.91 s]
0.0.AM: Trace Attempt 165	[115.80 s]
0.0.Hp: Trace Attempt 375	[116.61 s]
0.0.B: Trace Attempt 369	[117.40 s]
0.0.N: Trace Attempt 89	[118.09 s]
0.0.Bm: Trace Attempt 371	[119.08 s]
0.0.Ht: Trace Attempt 383	[119.69 s]
0.0.Hp: Trace Attempt 381	[121.13 s]
0.0.B: Trace Attempt 373	[122.13 s]
0.0.Bm: Trace Attempt 375	[123.48 s]
0.0.Ht: Trace Attempt 387	[124.01 s]
0.0.Hp: Trace Attempt 384	[125.30 s]
0.0.B: Trace Attempt 377	[127.00 s]
0.0.AM: Trace Attempt 167	[128.17 s]
0.0.Bm: Trace Attempt 379	[128.51 s]
0.0.Ht: Trace Attempt 392	[128.65 s]
0.0.Hp: Trace Attempt 388	[129.45 s]
0.0.N: Trace Attempt 94	[130.03 s]
0.0.N: Trace Attempt  1	[130.34 s]
0.0.N: Trace Attempt  2	[130.34 s]
0.0.N: Trace Attempt  3	[130.34 s]
0.0.N: Trace Attempt  4	[130.35 s]
0.0.N: Trace Attempt  5	[130.36 s]
0.0.B: Trace Attempt 381	[131.88 s]
0.0.Bm: Trace Attempt 383	[133.07 s]
0.0.Ht: Trace Attempt 397	[133.34 s]
0.0.AM: Trace Attempt 168	[133.46 s]
0.0.Hp: Trace Attempt 393	[134.26 s]
0.0.N: Trace Attempt 66	[134.42 s]
0.0.B: Trace Attempt 385	[136.01 s]
0.0.Ht: Trace Attempt 401	[137.38 s]
0.0.AM: Trace Attempt 169	[138.00 s]
0.0.Bm: Trace Attempt 387	[138.11 s]
0.0.N: Trace Attempt 77	[138.50 s]
0.0.Hp: Trace Attempt 398	[139.23 s]
0.0.B: Trace Attempt 388	[141.02 s]
0.0.AM: Trace Attempt 170	[142.33 s]
0.0.Bm: Trace Attempt 390	[142.70 s]
0.0.Hp: Trace Attempt 402	[143.46 s]
0.0.N: Trace Attempt 85	[143.53 s]
0.0.Ht: Trace Attempt 406	[144.01 s]
0.0.B: Trace Attempt 391	[145.93 s]
0.0.Bm: Trace Attempt 393	[148.08 s]
0.0.Ht: Trace Attempt 411	[148.35 s]
0.0.N: Trace Attempt 89	[148.46 s]
0.0.AM: Trace Attempt 171	[148.73 s]
0.0.Hp: Trace Attempt 406	[149.74 s]
0.0.B: Trace Attempt 394	[151.55 s]
0.0.Ht: Trace Attempt 414	[152.54 s]
0.0.Bm: Trace Attempt 396	[154.05 s]
0.0.Hp: Trace Attempt 411	[154.63 s]
0.0.B: Trace Attempt 396	[155.78 s]
0.0.Ht: Trace Attempt 418	[157.39 s]
0.0.Bm: Trace Attempt 398	[158.20 s]
0.0.AM: Trace Attempt 172	[158.48 s]
0.0.Hp: Trace Attempt 414	[158.99 s]
0.0.B: Trace Attempt 398	[159.96 s]
0.0.N: Trace Attempt 95	[160.29 s]
0.0.N: Trace Attempt  1	[160.60 s]
0.0.N: Trace Attempt  2	[160.60 s]
0.0.N: Trace Attempt  3	[160.60 s]
0.0.N: Trace Attempt  4	[160.61 s]
0.0.N: Trace Attempt  5	[160.62 s]
0.0.Ht: Trace Attempt 422	[161.65 s]
0.0.Hp: Trace Attempt 418	[163.79 s]
0.0.Bm: Trace Attempt 401	[163.83 s]
0.0.N: Trace Attempt 66	[164.66 s]
0.0.AM: Trace Attempt 173	[164.97 s]
0.0.B: Trace Attempt 401	[165.67 s]
0.0.Ht: Trace Attempt 426	[165.75 s]
0.0.Hp: Trace Attempt 422	[168.20 s]
0.0.N: Trace Attempt 77	[168.74 s]
0.0.Bm: Trace Attempt 404	[169.09 s]
0.0.Ht: Trace Attempt 430	[170.22 s]
0.0.B: Trace Attempt 404	[171.07 s]
0.0.Hp: Trace Attempt 426	[172.62 s]
0.0.N: Trace Attempt 85	[173.72 s]
0.0.Bm: Trace Attempt 407	[174.38 s]
0.0.Ht: Trace Attempt 434	[174.91 s]
0.0.AM: Trace Attempt 174	[175.50 s]
0.0.B: Trace Attempt 407	[176.42 s]
0.0.Hp: Trace Attempt 430	[177.37 s]
0.0.N: Trace Attempt 89	[178.61 s]
0.0.Bm: Trace Attempt 410	[179.79 s]
0.0.Ht: Trace Attempt 437	[180.60 s]
0.0.B: Trace Attempt 409	[180.20 s]
0.0.B: Stopped processing property "PWM_TOP.p1"	[181.15 s].
0.0.B: Morphing to Bcustom2
0.0.B: All properties determined. [0.00 s]
0.0.B: Exited with Success (@ 0.00 s)
0.0.Bcustom2: clocks: 1, declared: 1, looping: 0, posedge: 1, negedge: 0, noedge: 0, bothedge: 0
0.0.N: Trace Attempt 90	[180.15 s]
0.0.N: Stopped processing property "PWM_TOP.p1"	[181.23 s].
0.0.N: Morphing to Ncustom1
0.0.N: All properties determined. [0.00 s]
0.0.N: Exited with Success (@ 0.00 s)
0.0.Bcustom2: Starting proof for property "PWM_TOP.p1"	[0.00 s].
0.0.Bcustom2: Trace Attempt  1	[0.00 s]
0.0.Bcustom2: Trace Attempt  2	[0.00 s]
0.0.Bcustom2: Trace Attempt  1	[0.00 s]
0.0.Bcustom2: Trace Attempt  2	[0.00 s]
0.0.Bcustom2: Trace Attempt  3	[0.00 s]
0.0.Bcustom2: Trace Attempt  4	[0.00 s]
0.0.Bcustom2: Trace Attempt  5	[0.00 s]
0.0.Ncustom1: clocks: 1, declared: 1, looping: 0, posedge: 1, negedge: 0, noedge: 0, bothedge: 0
0.0.Ncustom1: Starting proof for property "PWM_TOP.p1"	[0.00 s].
0.0.Ncustom1: Trace Attempt 94	[0.01 s]
0.0.Tri: Proofgrid shell started at 31132@vlsi-ria85(local) jg_30300_vlsi-ria85_1
0.0.AM: Stopped processing property "PWM_TOP.p1"	[181.46 s].
0.0.AM: Morphing to AMcustom3
0.0.AM: All properties determined. [0.00 s]
0.0.AM: Exited with Success (@ 0.00 s)
0.0.AMcustom3: clocks: 1, declared: 1, looping: 0, posedge: 1, negedge: 0, noedge: 0, bothedge: 0
0.0.AMcustom3: Starting proof for property "PWM_TOP.p1"	[0.00 s].
0.0.AMcustom3: Trace Attempt  1	[0.00 s]
0.0.AMcustom3: Trace Attempt  2	[0.00 s]
0.0.AMcustom3: Trace Attempt  3	[0.00 s]
0.0.AMcustom3: Trace Attempt  4	[0.00 s]
0.0.AMcustom3: Trace Attempt  5	[0.00 s]
0.0.Tri: clocks: 1, declared: 1, looping: 0, posedge: 1, negedge: 0, noedge: 0, bothedge: 0
0.0.AMcustom3: Trace Attempt  1	[0.00 s]
0.0.AMcustom3: Trace Attempt  2	[0.01 s]
0.0.AMcustom3: Trace Attempt  3	[0.01 s]
0.0.AMcustom3: Trace Attempt  4	[0.01 s]
0.0.Tri: Last scan. Per property time limit: 0s
0.0.Tri: Starting proof for property "PWM_TOP.p1"	[0.00 s].
0.0.Tri: Trace Attempt  1	[0.00 s]
0.0.AMcustom3: Trace Attempt  5	[0.02 s]
0.0.AMcustom3: Trace Attempt  1	[0.04 s]
0.0.AMcustom3: Trace Attempt  2	[0.04 s]
0.0.AMcustom3: Trace Attempt  3	[0.04 s]
0.0.AMcustom3: Trace Attempt  4	[0.04 s]
0.0.AMcustom3: Trace Attempt  5	[0.05 s]
0.0.D: Proofgrid shell started at 31133@vlsi-ria85(local) jg_30300_vlsi-ria85_1
0.0.D: clocks: 1, declared: 1, looping: 0, posedge: 1, negedge: 0, noedge: 0, bothedge: 0
0.0.D: Last scan. Per property time limit: 0s
0.0.D: Starting proof for property "PWM_TOP.p1"	[0.00 s].
0.0.D: Trace Attempt  1	[0.00 s]
0.0.D: Trace Attempt  2	[0.00 s]
0.0.D: Trace Attempt  3	[0.00 s]
0.0.D: Trace Attempt  5	[0.01 s]
0.0.Tri:    0.00" ---- Launching main thread ----
0.0.AMcustom3: Trace Attempt  1	[0.10 s]
0.0.AMcustom3: Trace Attempt  2	[0.10 s]
0.0.AMcustom3: Trace Attempt  3	[0.10 s]
0.0.AMcustom3: Trace Attempt  4	[0.11 s]
0.0.AMcustom3: Trace Attempt  5	[0.11 s]
0.0.Tri:    0.32" ---- Launching abstraction thread ----
0.0.Tri:    0.34" ---- Launching multi-phase simplification thread ----
0.0.AMcustom3: Trace Attempt  1	[0.45 s]
0.0.AMcustom3: Trace Attempt  2	[0.46 s]
0.0.AMcustom3: Trace Attempt  3	[0.46 s]
0.0.AMcustom3: Trace Attempt  4	[0.46 s]
0.0.AMcustom3: Trace Attempt  5	[0.47 s]
0.0.Tri:    0.42" ---- Launching liveness simplification thread ----
0.0.Hp: Trace Attempt 434	[182.43 s]
0.0.D: Trace Attempt 26	[0.93 s]
0.0.D: Stopped processing property "PWM_TOP.p1"	[1.03 s].
0.0.D: Morphing to M
0.0.D: All properties determined. [0.00 s]
0.0.D: Exited with Success (@ 0.00 s)
0.0.M: clocks: 1, declared: 1, looping: 0, posedge: 1, negedge: 0, noedge: 0, bothedge: 0
0.0.M: Starting proof for property "PWM_TOP.p1"	[0.00 s].
0.0.M: Trace Attempt  1	[0.00 s]
0.0.M: Trace Attempt  2	[0.00 s]
0.0.M: Trace Attempt  3	[0.00 s]
0.0.M: Trace Attempt  4	[0.03 s]
0.0.M: Trace Attempt  5	[0.12 s]
0.0.Tri:    1.26" Simplification phase 1 complete
0.0.AMcustom5: Proofgrid shell started at 31297@vlsi-ria85(local) jg_30300_vlsi-ria85_1
0: Running jobs with 9 threads on "vlsi-ria85" with 8 cores.
0: Running jobs with 9 threads on "vlsi-ria85" with 8 cores.
0.0.AMcustom5: clocks: 1, declared: 1, looping: 0, posedge: 1, negedge: 0, noedge: 0, bothedge: 0
0.0.AMcustom5: Last scan. Per property time limit: 0s
0.0.AMcustom5: Starting proof for property "PWM_TOP.p1"	[0.00 s].
0.0.AMcustom5: Trace Attempt  1	[0.00 s]
0.0.AMcustom5: Trace Attempt  2	[0.00 s]
0.0.AMcustom5: Trace Attempt  1	[0.00 s]
0.0.AMcustom5: Trace Attempt  2	[0.00 s]
0.0.AMcustom5: Trace Attempt  3	[0.00 s]
0.0.AMcustom5: Trace Attempt  4	[0.00 s]
0.0.AMcustom5: Trace Attempt  5	[0.00 s]
0.0.AMcustom5: Trace Attempt  1	[0.01 s]
0.0.AMcustom5: Trace Attempt  2	[0.01 s]
0.0.AMcustom5: Trace Attempt  3	[0.01 s]
0.0.AMcustom5: Trace Attempt  1	[0.02 s]
0.0.AMcustom5: Trace Attempt  2	[0.02 s]
0.0.AMcustom5: Trace Attempt  3	[0.02 s]
0.0.AMcustom5: Trace Attempt  4	[0.02 s]
0.0.AMcustom5: Trace Attempt  5	[0.03 s]
0.0.Ncustom1: Requesting engine job to terminate
0.0.Bcustom2: Requesting engine job to terminate
0.0.AMcustom3: Requesting engine job to terminate
0.0.Tri: Requesting engine job to terminate
0.0.M: Requesting engine job to terminate
0.0.AMcustom5: Requesting engine job to terminate
0.0.Hp: Requesting engine job to terminate
0.0.Ht: Requesting engine job to terminate
0.0.Bm: Requesting engine job to terminate
INFO (IPF144): 0: Initiating shutdown of proof [182.99 s]
0.0.Tri: A proof was found: No trace exists. [1.42 s]
INFO (IPF057): 0.0.Tri: The property "PWM_TOP.p1" was proven in 1.42 s.
0.0.M: Trace Attempt  6	[0.23 s]
0.0.M: Stopped processing property "PWM_TOP.p1"	[0.35 s].
0.0.M: All properties determined. [0.34 s]
0.0.AMcustom5: Trace Attempt  6	[0.03 s]
0.0.AMcustom5: Stopped processing property "PWM_TOP.p1"	[0.04 s].
0.0.AMcustom5: All properties determined. [0.04 s]
0.0.Ncustom1: Stopped processing property "PWM_TOP.p1"	[1.76 s].
0.0.Ncustom1: All properties determined. [1.76 s]
0.0.AMcustom3: Trace Attempt 37	[1.35 s]
0.0.AMcustom3: Stopped processing property "PWM_TOP.p1"	[1.44 s].
0.0.AMcustom3: All properties determined. [1.44 s]
0.0.M: Exited with Success (@ 183.00 s)
0: ProofGrid usable level: 0
0.0.AMcustom5: Exited with Success (@ 183.00 s)
0.0.AMcustom3: Exited with Success (@ 183.00 s)
0.0.Bcustom2: Trace Attempt 102	[1.74 s]
0.0.Bcustom2: Stopped processing property "PWM_TOP.p1"	[1.76 s].
0.0.Bcustom2: All properties determined. [1.78 s]
0.0.Ncustom1: Exited with Success (@ 183.00 s)
0.0.Bcustom2: Exited with Success (@ 183.01 s)
0.0.Bm: Trace Attempt 411	[181.77 s]
0.0.Bm: All properties determined. [182.97 s]
0.0.Bm: Exited with Success (@ 183.01 s)
0.0.Ht: Trace Attempt 439	[182.82 s]
0.0.Ht: All properties determined. [183.00 s]
0.0.Ht: Exited with Success (@ 183.05 s)
0.0.Hp: All properties determined. [183.17 s]
0.0.Tri: Stopped processing property "PWM_TOP.p1"	[1.62 s].
0.0.Tri: All properties determined. [1.62 s]
0.0.Tri: Exited with Success (@ 183.19 s)
0.0.Hp: Exited with Success (@ 183.22 s)
0: --------------------------------------------------------------
ProofGrid Summary (utilization 99.86 %)
--------------------------------------------------------------
     engines started                               :    16
     engine jobs started                           :    12

    Average time in state (seconds)
    ------------------------------------------------------
    Engine  Pending     Running        Dead    Utilization
    ------------------------------------------------------
     Hp        0.03      182.99        0.00       99.98 %
     Ht        0.04      182.95        0.00       99.98 %
     Bm        0.04      182.95        0.00       99.98 %
    Mpcustom4        0.03        0.00        0.00        6.88 %
     Oh        0.07        0.00        0.00        3.17 %
      L        0.05        0.00        0.00        5.07 %
    Ncustom1        0.05      182.91        0.00       99.97 %
    Bcustom2        0.06      182.89        0.00       99.97 %
    AMcustom3        0.08      182.55        0.00       99.96 %
    Tri        0.34        1.44        0.00       81.07 %
      M        0.40        1.36        0.00       77.45 %
    AMcustom5        0.31        0.04        0.00       12.06 %
    all        0.12       91.67        0.00       99.86 %

    Total time in state (seconds)
    -----------------------------------------
            Pending     Running        Dead  
    -----------------------------------------
               1.50     1100.09        0.00

    Data read    : 1.21 MiB
    Data written : 4.99 kiB

0: All pending notifications were processed.
INFO (IPF059): 0: Completed proof on task: "<embedded>"

==============================================================
SUMMARY
==============================================================
           Properties Considered              : 3
                 assertions                   : 2
                  - proven                    : 2 (100%)
                  - bounded_proven (user)     : 0 (0%)
                  - bounded_proven (auto)     : 0 (0%)
                  - marked_proven             : 0 (0%)
                  - cex                       : 0 (0%)
                  - ar_cex                    : 0 (0%)
                  - undetermined              : 0 (0%)
                  - unknown                   : 0 (0%)
                  - error                     : 0 (0%)
                 covers                       : 1
                  - unreachable               : 0 (0%)
                  - bounded_unreachable (user): 0 (0%)
                  - covered                   : 1 (100%)
                  - ar_covered                : 0 (0%)
                  - undetermined              : 0 (0%)
                  - unknown                   : 0 (0%)
                  - error                     : 0 (0%)
determined
[<embedded>] % exit -force
INFO (IPL005): Received request to exit from the console.
INFO (IPL014): Waiting for the Tcl-thread to exit.
INFO: Waiting for proof threads to stop...
INFO: Proof threads stopped.
INFO (IPL018): The peak resident set memory use for this session was 1.213 GB.
INFO (IPL015): The Tcl-thread exited with status 0.
INFO (IPL016): Exiting the analysis session with status 0.
