Jasper Apps 2024.06p002 64 bits 2024.09.02 16:28:38 UTC

Any disclosure about the Cadence Design Systems software or its use
model to any third party violates the written Non-Disclosure Agreement
between Cadence Design Systems, Inc. and the customer.

THIS SOFTWARE CONTAINS CONFIDENTIAL INFORMATION AND TRADE SECRETS OF
CADENCE DESIGN SYSTEMS, INC. USE, DISCLOSURE, OR REPRODUCTION IS
PROHIBITED WITHOUT THE PRIOR EXPRESS WRITTEN PERMISSION OF CADENCE
DESIGN SYSTEMS, INC.

Copyright (C) 2000-2024 Cadence Design Systems, Inc. All Rights
Reserved.  Unpublished -- rights reserved under the copyright laws of
the United States.

This product includes software developed by others and redistributed
according to license agreement. See doc/third_party_readme.txt for
further details.

RESTRICTED RIGHTS LEGEND

Use, duplication, or disclosure by the Government is subject to
restrictions as set forth in subparagraph (c) (1) (ii) of the Rights in
Technical Data and Computer Software clause at DFARS 252.227-7013 or
subparagraphs (c) (1) and (2) of Commercial Computer Software -- Restricted
Rights at 48 CFR 52.227-19, as applicable.


                          Cadence Design Systems, Inc.
                          2655 Seely Avenue
                          San Jose, CA 95134
                          Phone: 408.943.1234

For technical assistance visit http://support.cadence.com.

Jasper Apps Analysis Session - /users/rompel/jasper_executions/liveness/jgprojects/1_delay_8/sessionLogs/session_0

WARNING (WG017): [session]: The system's locale is "ANSI_X3.4-1968", which is not UTF-8. Non-ASCII characters might not be handled correctly.
WARNING (WG017): [jg_console]: The system's locale is "ANSI_X3.4-1968", which is not UTF-8. Non-ASCII characters might not be handled correctly.
INFO: successfully checked out license "jasper_fao".
INFO: reading configuration file "/users/rompel/.config/cadence/jasper.conf".
% analyze -sv09 ../1_delay_8.sv
[-- (VERI-1482)] Analyzing Verilog file '/tools/cadence2425/JASPER/jasper_2024.06p002/lib/verilog/packages/std/std.sv' into library 'std'
[-- (VERI-1482)] Analyzing Verilog file '../1_delay_8.sv'
% elaborate -bbox_mul 1000000 -bbox_div 1000000 -bbox_mod 1000000 -bbox_a 1000000
[INFO (HIER-8002)] ../1_delay_8.sv(13): Disabling old hierarchical reference handler
[INFO (VERI-1018)] ../1_delay_8.sv(1): compiling module 'DELAY'
[WARN (VERI-1209)] ../1_delay_8.sv(10): expression size 32 truncated to fit in target size 14
INFO (ISW003): Top module name is "DELAY".
INFO (INL208): Elaboration synthesis summary:
  Number of synthesized netlists          1 (0 packages)
  Single run mode                         On
  Pipeline                                On (1 pipelined netlists)
  Late hierarchical reference connection  On
  Number of analyzed Verilog modules      1 (1 synthesized)
  Number of analyzed VHDL entities        0 (0 synthesized)
INFO (INL003): Clearing all state information (assumes, stopats, and so forth).
DELAY
[<embedded>] % reset rst
INFO (IPM031): Clearing proof results of all properties.
INFO (IRS006): Current reset condition is "rst".
[<embedded>] % clock clk
[<embedded>] % prove -all
Ncustom1: Custom engine code is hT3Ng7hPPfiYQOTDZ3qhYOwGAM51eA+J/FjkM5shLioAsqhgLR4Ft+O1BuKG6ilQ83B9tLXSl+CwjiTMAQA
Bcustom2: Custom engine code is hT3Nm7hPr1Vp3Di1Ra2USNIGL4JypRnLKLAdF6JAyuavO2JfGCiY9OZJhcAcOUnLx5xwNdhILGrAWX9s+z2WDkKwNR7tAfClBEjRFVQeq6DU54boFgEA
AMcustom3: Custom engine code is hT3Ng7hP/feYQOTDZ3qhYOwGAM51eA+J/FjkM5shLioAsqhgLR4Ft+O1BuKG6ilQ83B9tLXSmmqwm7g9AQA
Mpcustom4: Custom engine code is hT3NZbhP9fmY2AbBQnsjfOxn6c+6e6yL+/e8fZFmaQrnlgEA
INFO (IPF036): Starting proof on task: "<embedded>", 1 properties to prove with 0 already proven/unreachable
INFO (IRS029): Starting reset analysis: phase 1 of 4.
INFO (IRS030): Running reset analysis: phase 2 of 4.
INFO (IRS031): Running reset analysis: phase 3 of 4.
INFO (IRS020): Starting the reset analysis simulation with a limit of 100 iterations (phase 4 of 4).
INFO (IRS024): Reset iterations 0 to 4 analyzed.
INFO (IRS018): Reset analysis simulation executed for 3 iterations. Assigned values for 14 of 14 design flops, 0 of 0 design latches, 3 of 3 internal elements.
INFO (IRS039): Reset analysis complete.
INFO (IPF031): Settings used for proof thread 0:
    orchestration                 = on
    time_limit                    = 86400s
    per_property_time_limit       = 1s * 10 ^ scan
    engine_mode                   = auto
    proofgrid_per_engine_max_jobs = 1
    max engine jobs               = auto
    proofgrid_mode                = local
    proofgrid_restarts            = 10
0: Using multistage preprocessing
AMcustom5: Custom engine code is hT3N1rhP11/52HrFRS21ROp2LOjVTgPvT8L8BGXHgLhaIuqtT4nARFjUqrBL+7pLmaTOzBepZW/Jm8SSrHDybSQtoNiO3y43wk+dEoWlsZizu97Fih6O6lPVG/LpWP5SsUPwlGagLNa1FKEFvwVXyX7//8prySbvSxIHXr5er+z4RAEA
0: Starting reduce
Ncustom6: Custom engine code is hT3OXrhPByJp3TrFSTLhUmMH4KVtJgmTCnNDF46yMXOKY48m4LS5nE7yBzFjA7kDuwO/GhGUpEPiky3p3wmPn3dJZHxFMsafSoObRzSC+tn7sEY0WbTdZ/FV4hL3MYH/b1CIUvXSWR4wqEoVLsmMOD4xIPT4lI1LO6ZCO7PnnWQuLwetnvKlrXx6wCW/A+x+enqslg1YPobi4wEF/EvbzOvcTYdJvl2s4H2yZg2b2ofAVN5WvhWk1HoBAA
ADcustom7: Custom engine code is hT3Nv7hPv1752HrFRa2kROx2f/ECJeZB2AZsLdlO8VwmIuqtT4nIDFXclhg+O+o+DMmQCekbheGk0kK28laA9gaOFDXsQp29J3X615HY1IPHJWd6FUFvCHjO+p1k652b5JJvZlShNpGlGSXAiQe/mEAj6tEBAA
Tricustom8: Custom engine code is hT3Nu7hPt1752DvFRa0kNDiyIV97VyejwM9C/jCLJjdPvusZONHY42VYUy0Q1ZotnhcVtNc56tJ5wbxv6V2+XpdsaSlHck5vfnbYjdwj1OECy9U+7oSQ0SZE3g5ayD+Phuh4odCJTjeKa2k4elM9ldQfkAEA
Gcustom9: Custom engine code is hT3NibhPDfeYQADBZnYcglOvK9Pfd7EOeniIqP8jNsyIqInncipMGcUXqAadachREE9F2PwhBUZUNw5kHnd4JdXkamORRgEA
C2custom10: Custom engine code is hT3NirhPjfWYQADBZnYcglOvK9Pfd7EOeniIqP8jNsyIqInncgkrYMMXCYbdK0dUjZIF9d4cJ0rHoBDjwVLBKuG86XYVV00BAA
AGcustom11: Custom engine code is hT3NirhP/fmYQADBZnYcglOvK9Pfd7EOeniIqP8jNsyIqInnckcwYMMXCYbdK0dUjZIF9d4cJ0rHoBDjwVLBKuHEZnZByh0BAA
Bcustom12: Custom engine code is hT3NjrhPDfiYQADBZnYcglOvK9PfWxFtenjIyBqfrgr7if/jL/yPOuK1BAflEcW0DxNH2eDIoezN2gxlQFg81RZtiWXh7aiTAidvAQA
0: Finished reduce in 0s
Ncustom13: Custom engine code is hT3NR7hPByFp3TrFSTLhUmMH4KWtJglTyV/c51BHEeZWamnJv767nE6PCak26bd3gf3XGN3rIRheufhDieCJQVISo+gNYUKhiUedBKGtsP/a18svAnlMJZudHxDFwK5ufsyoxsIyiAeSY2oi3tEuoDHr5gw42DFKAG3PqO3CEsl8Azzdt3pl5nGA1Ifv2H02eYsFzWb/nfp8PMb3F0krE/EgBcm8TD9Div8BAA
Tricustom14: Custom engine code is hT3Nu7hP3fiYQADBZnYcglNHp9bfd7EOeniIqP/ji8sGLQu8yhsFO+wxJ+O+R0bU8g/IewXFomyos+viQnWc2xYNYmMqpo3i40O7DaZR7qfp4YqNx26KRvQ/qx0BAA
0.0.PRE: Performing Proof Simplification...
0.0.N: clocks: 1, declared: 1, looping: 0, posedge: 1, negedge: 0, noedge: 0, bothedge: 0
0.0.N: Proof Simplification Iteration 1	[0.00 s]
0.0.N: Proof Simplification Iteration 2	[0.00 s]
0.0.N: Proof Simplification Iteration 3	[0.00 s]
0.0.PRE: A proof was found: No trace exists. [0.00 s]
INFO (IPF057): 0.0.PRE: The property ":noDeadEnd" was proven in 0.00 s.
    Use check_assumptions -show -dead_end to show this property in the property table.
0.0.PRE: A proof was found: No trace exists. [0.00 s]
INFO (IPF057): 0.0.PRE: The property ":noConflict" was proven in 0.00 s.
    Use check_assumptions -show to show this property in the property table.
INFO (IPF047): 0.0.PRE: The cover property ":live" was covered in 1 cycles in 0.00 s.
    Use check_assumptions -show -live to show this property in the property table.
0.0.PRE: Proof Simplification completed in 0.00 s
0: About to start ProofGrid in its own thread with a limit of 10000 pending notifications and a limit of 10 traces.
0: =============================== ProofGrid start ===============================
0: ProofGrid usable level: 1
0: Initial ProofGrid level: 1
0: ProofGrid is starting event handling
0.0.Hp: Proofgrid shell started at 6283@vlsi-ria85(local) jg_5800_vlsi-ria85_1
0.0.N: Proofgrid shell started at 6278@vlsi-ria85(local) jg_5800_vlsi-ria85_1
0.0.Hp: clocks: 1, declared: 1, looping: 0, posedge: 1, negedge: 0, noedge: 0, bothedge: 0
0.0.N: clocks: 1, declared: 1, looping: 0, posedge: 1, negedge: 0, noedge: 0, bothedge: 0
0.0.N: Last scan. Per property time limit: 0s
0.0.N: Starting proof for property "DELAY.p1"	[0.00 s].
0.0.N: Trace Attempt  1	[0.00 s]
0.0.N: Trace Attempt  2	[0.00 s]
0.0.N: Trace Attempt  2	[0.00 s]
0.0.N: Trace Attempt  3	[0.00 s]
0.0.N: Trace Attempt  4	[0.00 s]
0.0.N: Trace Attempt  4	[0.00 s]
0.0.N: Trace Attempt  5	[0.00 s]
0.0.Hp: Last scan. Per property time limit: 0s
0.0.Hp: Trace Attempt  1	[0.00 s]
0.0.Hp: Trace Attempt  2	[0.00 s]
0.0.Hp: Trace Attempt  3	[0.00 s]
0.0.Hp: Trace Attempt  4	[0.00 s]
0.0.Hp: Trace Attempt  5	[0.01 s]
0.0.N: Trace Attempt  1	[0.01 s]
0.0.N: Trace Attempt  2	[0.01 s]
0.0.N: Trace Attempt  3	[0.01 s]
0.0.N: Trace Attempt  4	[0.01 s]
0.0.B: Proofgrid shell started at 6499@vlsi-ria85(local) jg_5800_vlsi-ria85_1
0.0.AM: Proofgrid shell started at 6500@vlsi-ria85(local) jg_5800_vlsi-ria85_1
0.0.Ht: Proofgrid shell started at 6497@vlsi-ria85(local) jg_5800_vlsi-ria85_1
0.0.Ht: clocks: 1, declared: 1, looping: 0, posedge: 1, negedge: 0, noedge: 0, bothedge: 0
0.0.Ht: Last scan. Per property time limit: 0s
0.0.B: clocks: 1, declared: 1, looping: 0, posedge: 1, negedge: 0, noedge: 0, bothedge: 0
0.0.B: Last scan. Per property time limit: 0s
0.0.B: Starting proof for property "DELAY.p1"	[0.00 s].
0.0.B: Trace Attempt  1	[0.00 s]
0.0.B: Trace Attempt  2	[0.00 s]
0.0.B: Trace Attempt  3	[0.00 s]
0.0.B: Trace Attempt  4	[0.00 s]
0.0.B: Trace Attempt  5	[0.00 s]
0.0.AM: clocks: 1, declared: 1, looping: 0, posedge: 1, negedge: 0, noedge: 0, bothedge: 0
0.0.AM: Last scan. Per property time limit: 0s
0.0.AM: Starting proof for property "DELAY.p1"	[0.00 s].
0.0.AM: Trace Attempt  1	[0.00 s]
0.0.AM: Trace Attempt  2	[0.00 s]
0.0.AM: Trace Attempt  3	[0.00 s]
0.0.AM: Trace Attempt  4	[0.00 s]
0.0.AM: Trace Attempt  5	[0.00 s]
0.0.AM: Trace Attempt  1	[0.00 s]
0.0.AM: Trace Attempt  2	[0.00 s]
0.0.AM: Trace Attempt  3	[0.00 s]
0.0.AM: Trace Attempt  4	[0.00 s]
0.0.Ht: Trace Attempt  1	[0.00 s]
0.0.Ht: Trace Attempt  2	[0.00 s]
0.0.Ht: Trace Attempt  3	[0.00 s]
0.0.Ht: Trace Attempt  4	[0.00 s]
0.0.Ht: Trace Attempt  5	[0.00 s]
0.0.AM: Trace Attempt  1	[0.01 s]
0.0.AM: Trace Attempt  2	[0.01 s]
0.0.AM: Trace Attempt  3	[0.01 s]
0.0.AM: Trace Attempt  4	[0.01 s]
0.0.AM: Trace Attempt  5	[0.01 s]
0.0.Oh: Proofgrid shell started at 6498@vlsi-ria85(local) jg_5800_vlsi-ria85_1
0.0.Oh: clocks: 1, declared: 1, looping: 0, posedge: 1, negedge: 0, noedge: 0, bothedge: 0
0.0.Oh: Reached length limit (2147483647) [0.00 s]
0.0.AM: Trace Attempt  1	[0.03 s]
0.0.AM: Trace Attempt  2	[0.03 s]
0.0.AM: Trace Attempt  3	[0.03 s]
0.0.AM: Trace Attempt  4	[0.03 s]
0.0.AM: Trace Attempt  5	[0.03 s]
0.0.Oh: Exited with Success (@ 0.07 s)
0.0.Oh: Completed, Restart ignored.
0.0.N: Trace Attempt  1	[0.12 s]
0.0.N: Trace Attempt  2	[0.12 s]
0.0.N: Trace Attempt  3	[0.12 s]
0.0.N: Trace Attempt  4	[0.12 s]
0.0.N: Trace Attempt  5	[0.12 s]
0.0.AM: Trace Attempt  1	[0.10 s]
0.0.AM: Trace Attempt  2	[0.10 s]
0.0.AM: Trace Attempt  3	[0.10 s]
0.0.AM: Trace Attempt  4	[0.10 s]
0.0.AM: Trace Attempt  5	[0.10 s]
0.0.AM: Trace Attempt  1	[0.39 s]
0.0.AM: Trace Attempt  2	[0.39 s]
0.0.AM: Trace Attempt  3	[0.39 s]
0.0.AM: Trace Attempt  4	[0.39 s]
0.0.AM: Trace Attempt  5	[0.39 s]
0.0.N: Trace Attempt  1	[0.46 s]
0.0.N: Trace Attempt  2	[0.46 s]
0.0.N: Trace Attempt  3	[0.46 s]
0.0.N: Trace Attempt  4	[0.46 s]
0.0.N: Trace Attempt  5	[0.46 s]
0.0.N: Trace Attempt  1	[1.30 s]
0.0.N: Trace Attempt  2	[1.30 s]
0.0.N: Trace Attempt  3	[1.30 s]
0.0.N: Trace Attempt  4	[1.30 s]
0.0.N: Trace Attempt  5	[1.30 s]
0.0.AM: Trace Attempt  1	[1.61 s]
0.0.AM: Trace Attempt  2	[1.61 s]
0.0.AM: Trace Attempt  3	[1.61 s]
0.0.AM: Trace Attempt  4	[1.61 s]
0.0.AM: Trace Attempt  5	[1.61 s]
0.0.Hp: Trace Attempt 683	[4.02 s]
0.0.Ht: Trace Attempt 2103	[4.00 s]
0.0.B: Trace Attempt 1934	[4.00 s]
0.0.N: Trace Attempt 213	[5.34 s]
0.0.AM: Trace Attempt 207	[5.62 s]
0.0.N: Trace Attempt  1	[6.35 s]
0.0.N: Trace Attempt  2	[6.35 s]
0.0.N: Trace Attempt  3	[6.35 s]
0.0.N: Trace Attempt  4	[6.36 s]
0.0.N: Trace Attempt  5	[6.36 s]
0.0.AM: Trace Attempt  1	[7.39 s]
0.0.AM: Trace Attempt  2	[7.39 s]
0.0.AM: Trace Attempt  3	[7.39 s]
0.0.AM: Trace Attempt  4	[7.39 s]
0.0.AM: Trace Attempt  5	[7.39 s]
0.0.Hp: Trace Attempt 764	[8.03 s]
0.0.B: Trace Attempt 2658	[8.00 s]
0.0.Ht: Trace Attempt 2838	[8.00 s]
0.0.N: Trace Attempt 212	[10.36 s]
0.0.N: Trace Attempt  1	[11.34 s]
0.0.N: Trace Attempt  2	[11.34 s]
0.0.N: Trace Attempt  3	[11.34 s]
0.0.N: Trace Attempt  4	[11.34 s]
0.0.N: Trace Attempt  5	[11.35 s]
0.0.AM: Trace Attempt 269	[11.40 s]
0.0.Hp: Trace Attempt 844	[12.04 s]
0.0.B: Trace Attempt 3222	[12.00 s]
0.0.Ht: Trace Attempt 3418	[12.01 s]
0.0.N: Trace Attempt 208	[15.35 s]
0.0.AM: Trace Attempt 369	[15.43 s]
0.0.B: Trace Attempt 3687	[16.01 s]
0.0.Ht: Trace Attempt 3927	[16.01 s]
0.0.Hp: Trace Attempt 916	[16.07 s]
0.0.N: Trace Attempt  1	[16.54 s]
0.0.N: Trace Attempt  2	[16.55 s]
0.0.N: Trace Attempt  3	[16.55 s]
0.0.N: Trace Attempt  4	[16.55 s]
0.0.N: Trace Attempt  5	[16.55 s]
0.0.AM: Trace Attempt 283	[19.43 s]
0.0.Ht: Trace Attempt 4342	[20.01 s]
0.0.B: Trace Attempt 4092	[20.01 s]
0.0.Hp: Trace Attempt 982	[20.11 s]
0.0.N: Trace Attempt 208	[20.56 s]
0.0.N: Trace Attempt  1	[21.70 s]
0.0.N: Trace Attempt  2	[21.70 s]
0.0.N: Trace Attempt  3	[21.70 s]
0.0.N: Trace Attempt  4	[21.71 s]
0.0.N: Trace Attempt  5	[21.71 s]
0.0.B: Trace Attempt 4441	[24.01 s]
0.0.Ht: Trace Attempt 4697	[24.02 s]
0.0.Hp: Trace Attempt 1042	[24.14 s]
0.0.AM: Trace Attempt 513	[24.42 s]
0.0.AM: Trace Attempt  1	[24.49 s]
0.0.AM: Trace Attempt  2	[24.49 s]
0.0.AM: Trace Attempt  3	[24.49 s]
0.0.AM: Trace Attempt  4	[24.49 s]
0.0.AM: Trace Attempt  5	[24.49 s]
0.0.N: Trace Attempt 208	[25.71 s]
0.0.N: Trace Attempt  1	[26.97 s]
0.0.N: Trace Attempt  2	[26.98 s]
0.0.N: Trace Attempt  3	[26.98 s]
0.0.N: Trace Attempt  4	[26.98 s]
0.0.N: Trace Attempt  5	[26.98 s]
0.0.B: Trace Attempt 4791	[28.01 s]
0.0.Ht: Trace Attempt 5062	[28.03 s]
0.0.Hp: Trace Attempt 1103	[28.14 s]
0.0.AM: Trace Attempt 265	[28.49 s]
0.0.N: Trace Attempt 210	[31.01 s]
0.0.B: Trace Attempt 5122	[32.02 s]
0.0.Ht: Trace Attempt 5395	[32.04 s]
0.0.N: Trace Attempt  1	[32.14 s]
0.0.N: Trace Attempt  2	[32.14 s]
0.0.N: Trace Attempt  3	[32.14 s]
0.0.N: Trace Attempt  4	[32.14 s]
0.0.N: Trace Attempt  5	[32.14 s]
0.0.Hp: Trace Attempt 1163	[32.21 s]
0.0.AM: Trace Attempt 317	[32.52 s]
0.0.B: Trace Attempt 5425	[36.02 s]
0.0.Ht: Trace Attempt 5708	[36.05 s]
0.0.N: Trace Attempt 210	[36.17 s]
0.0.Hp: Trace Attempt 1219	[36.21 s]
0.0.AM: Trace Attempt 366	[36.56 s]
0.0.N: Trace Attempt  1	[37.29 s]
0.0.N: Trace Attempt  2	[37.30 s]
0.0.N: Trace Attempt  3	[37.30 s]
0.0.N: Trace Attempt  4	[37.30 s]
0.0.N: Trace Attempt  5	[37.30 s]
0.0.B: Trace Attempt 5706	[40.03 s]
0.0.Ht: Trace Attempt 6006	[40.05 s]
0.0.Hp: Trace Attempt 1272	[40.24 s]
0.0.AM: Trace Attempt 415	[40.61 s]
0.0.N: Trace Attempt 209	[41.32 s]
0.0.N: Trace Attempt  1	[42.40 s]
0.0.N: Trace Attempt  2	[42.40 s]
0.0.N: Trace Attempt  3	[42.40 s]
0.0.N: Trace Attempt  4	[42.40 s]
0.0.N: Trace Attempt  5	[42.40 s]
0.0.B: Trace Attempt 5976	[44.04 s]
0.0.Ht: Trace Attempt 6284	[44.06 s]
0.0.Hp: Trace Attempt 1323	[44.28 s]
0.0.AM: Trace Attempt 456	[44.72 s]
0.0.N: Trace Attempt 209	[46.41 s]
0.0.N: Trace Attempt  1	[47.55 s]
0.0.N: Trace Attempt  2	[47.55 s]
0.0.N: Trace Attempt  3	[47.55 s]
0.0.N: Trace Attempt  4	[47.55 s]
0.0.N: Trace Attempt  5	[47.55 s]
0.0.B: Trace Attempt 6235	[48.04 s]
0.0.Ht: Trace Attempt 6550	[48.07 s]
0.0.Hp: Trace Attempt 1372	[48.32 s]
0.0.AM: Trace Attempt 492	[48.72 s]
0.0.N: Trace Attempt 208	[51.56 s]
0.0.B: Trace Attempt 6478	[52.04 s]
0.0.Ht: Trace Attempt 6812	[52.09 s]
0.0.Hp: Trace Attempt 1419	[52.37 s]
0.0.N: Trace Attempt  1	[52.66 s]
0.0.N: Trace Attempt  2	[52.66 s]
0.0.N: Trace Attempt  3	[52.66 s]
0.0.N: Trace Attempt  4	[52.66 s]
0.0.N: Trace Attempt  5	[52.66 s]
0.0.AM: Trace Attempt 523	[52.76 s]
0.0.B: Trace Attempt 6709	[56.05 s]
0.0.Ht: Trace Attempt 7065	[56.10 s]
0.0.Hp: Trace Attempt 1465	[56.46 s]
0.0.N: Trace Attempt 210	[56.69 s]
0.0.AM: Trace Attempt 568	[56.84 s]
0.0.N: Trace Attempt  1	[57.84 s]
0.0.N: Trace Attempt  2	[57.84 s]
0.0.N: Trace Attempt  3	[57.84 s]
0.0.N: Trace Attempt  4	[57.84 s]
0.0.N: Trace Attempt  5	[57.84 s]
0.0.B: Trace Attempt 6929	[60.07 s]
0.0.Ht: Trace Attempt 7298	[60.10 s]
0.0.Hp: Trace Attempt 1509	[60.52 s]
0.0.AM: Trace Attempt 604	[61.00 s]
0.0.N: Trace Attempt 209	[61.85 s]
0.0.N: Trace Attempt  1	[62.94 s]
0.0.N: Trace Attempt  2	[62.95 s]
0.0.N: Trace Attempt  3	[62.95 s]
0.0.N: Trace Attempt  4	[62.95 s]
0.0.N: Trace Attempt  5	[62.95 s]
0.0.B: Trace Attempt 7142	[64.08 s]
0.0.Ht: Trace Attempt 7519	[64.12 s]
0.0.Hp: Trace Attempt 1551	[64.60 s]
0.0.AM: Trace Attempt 637	[65.02 s]
0.0.N: Trace Attempt 209	[66.95 s]
0.0.B: Trace Attempt 7343	[68.08 s]
0.0.Ht: Trace Attempt 7742	[68.13 s]
0.0.N: Trace Attempt  1	[68.17 s]
0.0.N: Trace Attempt  2	[68.17 s]
0.0.N: Trace Attempt  3	[68.17 s]
0.0.N: Trace Attempt  4	[68.17 s]
0.0.N: Trace Attempt  5	[68.18 s]
0.0.Hp: Trace Attempt 1594	[68.67 s]
0.0.AM: Trace Attempt 671	[69.10 s]
0.0.B: Trace Attempt 7547	[72.10 s]
0.0.Ht: Trace Attempt 7961	[72.13 s]
0.0.N: Trace Attempt 210	[72.21 s]
0.0.Hp: Trace Attempt 1635	[72.69 s]
0.0.AM: Trace Attempt 705	[73.19 s]
0.0.N: Trace Attempt  1	[73.33 s]
0.0.N: Trace Attempt  2	[73.33 s]
0.0.N: Trace Attempt  3	[73.33 s]
0.0.N: Trace Attempt  4	[73.34 s]
0.0.N: Trace Attempt  5	[73.34 s]
0.0.B: Trace Attempt 7743	[76.11 s]
0.0.Ht: Trace Attempt 8174	[76.14 s]
0.0.N: Trace Attempt 210	[77.36 s]
0.0.N: Trace Attempt  1	[78.50 s]
0.0.N: Trace Attempt  2	[78.50 s]
0.0.N: Trace Attempt  3	[78.50 s]
0.0.N: Trace Attempt  4	[78.50 s]
0.0.N: Trace Attempt  5	[78.50 s]
0.0.AM: Trace Attempt 735	[78.62 s]
0.0.B: Trace Attempt 7948	[80.12 s]
0.0.Ht: Trace Attempt 8386	[80.15 s]
0.0.Hp: Trace Attempt 1665	[81.27 s]
0.0.N: Trace Attempt 210	[82.53 s]
0.0.AM: Trace Attempt 749	[83.01 s]
0.0.N: Trace Attempt  1	[84.00 s]
0.0.N: Trace Attempt  2	[84.00 s]
0.0.N: Trace Attempt  3	[84.00 s]
0.0.N: Trace Attempt  4	[84.00 s]
0.0.N: Trace Attempt  5	[84.00 s]
0.0.B: Trace Attempt 8144	[84.14 s]
0.0.Ht: Trace Attempt 8586	[84.17 s]
0.0.Hp: Trace Attempt 1794	[85.29 s]
0.0.AM: Trace Attempt 759	[87.12 s]
0.0.N: Trace Attempt 207	[88.00 s]
0.0.B: Trace Attempt 8341	[88.14 s]
0.0.Ht: Trace Attempt 8793	[88.18 s]
0.0.Hp: Trace Attempt 1915	[89.29 s]
0.0.N: Trace Attempt 270	[92.01 s]
0.0.B: Trace Attempt 8534	[92.15 s]
0.0.Ht: Trace Attempt 8995	[92.18 s]
0.0.AM: Trace Attempt 767	[92.73 s]
0.0.Hp: Trace Attempt 2028	[93.31 s]
0.0.N: Trace Attempt 328	[96.03 s]
0.0.B: Trace Attempt 8720	[96.16 s]
0.0.Ht: Trace Attempt 9193	[96.20 s]
0.0.AM: Trace Attempt 776	[96.92 s]
0.0.Hp: Trace Attempt 2134	[97.35 s]
0.0.N: Trace Attempt 368	[100.15 s]
0.0.B: Trace Attempt 8901	[100.18 s]
0.0.Ht: Trace Attempt 9369	[100.22 s]
0.0.Hp: Trace Attempt 2234	[101.35 s]
0.0.AM: Trace Attempt 785	[101.32 s]
0.0.B: Trace Attempt 9074	[104.18 s]
0.0.N: Trace Attempt 406	[104.25 s]
0.0.Ht: Trace Attempt 9548	[104.24 s]
0.0.Hp: Trace Attempt 2329	[105.37 s]
0.0.AM: Trace Attempt 794	[105.99 s]
0.0.B: Trace Attempt 9241	[108.18 s]
0.0.Ht: Trace Attempt 9730	[108.25 s]
0.0.N: Trace Attempt 446	[108.35 s]
0.0.Hp: Trace Attempt 2421	[109.39 s]
0.0.AM: Trace Attempt 802	[110.27 s]
0.0.B: Trace Attempt 9403	[112.18 s]
0.0.Ht: Trace Attempt 9904	[112.26 s]
0.0.N: Trace Attempt 485	[112.39 s]
0.0.Hp: Trace Attempt 2507	[113.39 s]
0.0.N: Trace Attempt  1	[114.17 s]
0.0.N: Trace Attempt  2	[114.17 s]
0.0.N: Trace Attempt  3	[114.17 s]
0.0.N: Trace Attempt  4	[114.17 s]
0.0.N: Trace Attempt  5	[114.17 s]
0.0.AM: Trace Attempt 810	[114.83 s]
0.0.B: Trace Attempt 9563	[116.20 s]
0.0.Ht: Trace Attempt 10078	[116.26 s]
0.0.Hp: Trace Attempt 2593	[117.43 s]
0.0.N: Trace Attempt 208	[118.19 s]
0.0.AM: Trace Attempt 821	[118.88 s]
0.0.B: Trace Attempt 9724	[120.21 s]
0.0.Ht: Trace Attempt 10250	[120.29 s]
0.0.Hp: Trace Attempt 2676	[121.44 s]
0.0.N: Trace Attempt 270	[122.20 s]
0.0.AM: Trace Attempt 829	[123.00 s]
0.0.B: Trace Attempt 9882	[124.22 s]
0.0.Ht: Trace Attempt 10414	[124.31 s]
0.0.Hp: Trace Attempt 2757	[125.48 s]
0.0.N: Trace Attempt 328	[126.21 s]
0.0.AM: Trace Attempt 835	[127.07 s]
0.0.B: Trace Attempt 10037	[128.24 s]
0.0.Ht: Trace Attempt 10576	[128.32 s]
0.0.Hp: Trace Attempt 2835	[129.50 s]
0.0.N: Trace Attempt 368	[130.32 s]
0.0.AM: Trace Attempt 841	[131.10 s]
0.0.B: Trace Attempt 10189	[132.25 s]
0.0.Ht: Trace Attempt 10743	[132.34 s]
0.0.Hp: Trace Attempt 2911	[133.54 s]
0.0.N: Trace Attempt 406	[134.41 s]
0.0.AM: Trace Attempt 848	[135.23 s]
0.0.B: Trace Attempt 10335	[136.27 s]
0.0.Ht: Trace Attempt 10905	[136.37 s]
0.0.Hp: Trace Attempt 2984	[137.59 s]
0.0.N: Trace Attempt 444	[138.42 s]
0.0.AM: Trace Attempt 577	[139.25 s]
0.0.B: Trace Attempt 10466	[140.29 s]
0.0.Ht: Trace Attempt 11054	[140.38 s]
0.0.Hp: Trace Attempt 3052	[141.60 s]
0.0.N: Trace Attempt 483	[142.50 s]
0.0.AM: Trace Attempt 713	[143.25 s]
0.0.B: Trace Attempt 10591	[144.31 s]
0.0.Ht: Trace Attempt 11197	[144.40 s]
0.0.N: Trace Attempt  1	[144.89 s]
0.0.N: Trace Attempt  2	[144.89 s]
0.0.N: Trace Attempt  3	[144.89 s]
0.0.N: Trace Attempt  4	[144.90 s]
0.0.N: Trace Attempt  5	[144.90 s]
0.0.Hp: Trace Attempt 3116	[145.61 s]
0.0.AM: Trace Attempt 834	[147.26 s]
0.0.B: Trace Attempt 10721	[148.31 s]
0.0.Ht: Trace Attempt 11335	[148.42 s]
0.0.N: Trace Attempt 208	[148.92 s]
0.0.Hp: Trace Attempt 3183	[149.65 s]
0.0.AM: Trace Attempt 936	[151.26 s]
0.0.B: Trace Attempt 10849	[152.33 s]
0.0.Ht: Trace Attempt 11477	[152.43 s]
0.0.N: Trace Attempt 270	[152.92 s]
0.0.Hp: Trace Attempt 3248	[153.71 s]
0.0.B: Trace Attempt 10976	[156.34 s]
0.0.Ht: Trace Attempt 11612	[156.45 s]
0.0.N: Trace Attempt 328	[156.98 s]
0.0.Hp: Trace Attempt 3312	[157.73 s]
0.0.B: Trace Attempt 11101	[160.35 s]
0.0.Ht: Trace Attempt 11753	[160.47 s]
0.0.AM: Trace Attempt 1025	[160.66 s]
0.0.N: Trace Attempt 368	[161.16 s]
0.0.Hp: Trace Attempt 3373	[161.76 s]
0.0.B: Trace Attempt 11223	[164.38 s]
0.0.Ht: Trace Attempt 11892	[164.47 s]
0.0.N: Trace Attempt 405	[165.22 s]
0.0.Hp: Trace Attempt 3435	[165.82 s]
0.0.AM: Trace Attempt 1026	[165.88 s]
0.0.AM: Trace Attempt  1	[166.08 s]
0.0.AM: Trace Attempt  2	[166.08 s]
0.0.AM: Trace Attempt  3	[166.08 s]
0.0.AM: Trace Attempt  4	[166.08 s]
0.0.AM: Trace Attempt  5	[166.08 s]
0.0.B: Trace Attempt 11353	[168.38 s]
0.0.Ht: Trace Attempt 12040	[168.47 s]
0.0.N: Trace Attempt 446	[169.37 s]
0.0.Hp: Trace Attempt 3498	[169.84 s]
0.0.AM: Trace Attempt 190	[170.08 s]
0.0.B: Trace Attempt 11484	[172.40 s]
0.0.Ht: Trace Attempt 12185	[172.49 s]
0.0.N: Trace Attempt 487	[173.55 s]
0.0.Hp: Trace Attempt 3560	[173.84 s]
0.0.AM: Trace Attempt 241	[174.15 s]
0.0.N: Trace Attempt  1	[174.94 s]
0.0.N: Trace Attempt  2	[174.94 s]
0.0.N: Trace Attempt  3	[174.94 s]
0.0.N: Trace Attempt  4	[174.95 s]
0.0.N: Trace Attempt  5	[174.95 s]
0.0.B: Trace Attempt 11612	[176.40 s]
0.0.Ht: Trace Attempt 12321	[176.49 s]
0.0.Hp: Trace Attempt 3622	[177.87 s]
0.0.AM: Trace Attempt 287	[178.21 s]
0.0.N: Trace Attempt 208	[178.97 s]
0.0.B: Trace Attempt 11747	[180.41 s]
0.0.Ht: Trace Attempt 12458	[180.51 s]
0.0.N: Trace Attempt 241	[180.94 s]
0.0.N: Stopped processing property "DELAY.p1"	[181.01 s].
0.0.N: Morphing to Ncustom1
0.0.N: All properties determined. [0.00 s]
0.0.N: Exited with Success (@ 0.00 s)
0.0.Ncustom1: clocks: 1, declared: 1, looping: 0, posedge: 1, negedge: 0, noedge: 0, bothedge: 0
0.0.Ncustom1: Starting proof for property "DELAY.p1"	[0.00 s].
0.0.AM: Trace Attempt 317	[180.89 s]
0.0.AM: Stopped processing property "DELAY.p1"	[181.01 s].
0.0.AM: Morphing to AMcustom3
0.0.Ncustom1: Trace Attempt 487	[0.04 s]
0.0.AM: All properties determined. [0.00 s]
0.0.AM: Exited with Success (@ 0.00 s)
0.0.AMcustom3: clocks: 1, declared: 1, looping: 0, posedge: 1, negedge: 0, noedge: 0, bothedge: 0
0.0.AMcustom3: Starting proof for property "DELAY.p1"	[0.00 s].
0.0.AMcustom3: Trace Attempt  1	[0.00 s]
0.0.AMcustom3: Trace Attempt  2	[0.00 s]
0.0.AMcustom3: Trace Attempt  3	[0.00 s]
0.0.AMcustom3: Trace Attempt  4	[0.00 s]
0.0.AMcustom3: Trace Attempt  5	[0.00 s]
0.0.AMcustom3: Trace Attempt  1	[0.00 s]
0.0.AMcustom3: Trace Attempt  2	[0.00 s]
0.0.AMcustom3: Trace Attempt  3	[0.00 s]
0.0.AMcustom3: Trace Attempt  4	[0.00 s]
0.0.AMcustom3: Trace Attempt  1	[0.01 s]
0.0.AMcustom3: Trace Attempt  2	[0.01 s]
0.0.AMcustom3: Trace Attempt  3	[0.01 s]
0.0.AMcustom3: Trace Attempt  4	[0.01 s]
0.0.AMcustom3: Trace Attempt  5	[0.01 s]
0.0.AMcustom3: Trace Attempt  1	[0.03 s]
0.0.AMcustom3: Trace Attempt  2	[0.03 s]
0.0.AMcustom3: Trace Attempt  3	[0.03 s]
0.0.Tri: Proofgrid shell started at 13320@vlsi-ria85(local) jg_5800_vlsi-ria85_1
0.0.AMcustom3: Trace Attempt  4	[0.04 s]
0.0.Tri: clocks: 1, declared: 1, looping: 0, posedge: 1, negedge: 0, noedge: 0, bothedge: 0
0.0.AMcustom3: Trace Attempt  5	[0.04 s]
0.0.Tri: Last scan. Per property time limit: 0s
0.0.Tri: Starting proof for property "DELAY.p1"	[0.00 s].
0.0.Tri: Trace Attempt  1	[0.00 s]
0.0.B: Trace Attempt 11765	[180.94 s]
0.0.B: Stopped processing property "DELAY.p1"	[181.08 s].
0.0.B: Morphing to Bcustom2
0.0.B: All properties determined. [0.00 s]
0.0.B: Exited with Success (@ 0.00 s)
0.0.Bcustom2: clocks: 1, declared: 1, looping: 0, posedge: 1, negedge: 0, noedge: 0, bothedge: 0
0.0.Bcustom2: Starting proof for property "DELAY.p1"	[0.00 s].
0.0.Bcustom2: Trace Attempt  1	[0.00 s]
0.0.Bcustom2: Trace Attempt  2	[0.00 s]
0.0.Bcustom2: Trace Attempt  1	[0.00 s]
0.0.Bcustom2: Trace Attempt  2	[0.00 s]
0.0.Bcustom2: Trace Attempt  3	[0.00 s]
0.0.Bcustom2: Trace Attempt  4	[0.00 s]
0.0.Bcustom2: Trace Attempt  5	[0.00 s]
0.0.Bcustom2: Trace Attempt  1	[0.00 s]
0.0.Bcustom2: Trace Attempt  2	[0.00 s]
0.0.Bcustom2: Trace Attempt  3	[0.00 s]
0.0.Bcustom2: Trace Attempt  4	[0.00 s]
0.0.Bcustom2: Trace Attempt  5	[0.00 s]
0.0.Bcustom2: Trace Attempt  1	[0.00 s]
0.0.Bcustom2: Trace Attempt  2	[0.00 s]
0.0.Bcustom2: Trace Attempt  3	[0.00 s]
0.0.Bcustom2: Trace Attempt  4	[0.00 s]
0.0.Bcustom2: Trace Attempt  5	[0.00 s]
0.0.Bcustom2: Trace Attempt  1	[0.01 s]
0.0.Bcustom2: Trace Attempt  2	[0.01 s]
0.0.Bcustom2: Trace Attempt  3	[0.01 s]
0.0.Bcustom2: Trace Attempt  4	[0.01 s]
0.0.Bcustom2: Trace Attempt  5	[0.01 s]
0.0.Bcustom2: Trace Attempt  1	[0.01 s]
0.0.Bcustom2: Trace Attempt  2	[0.01 s]
0.0.Bcustom2: Trace Attempt  3	[0.01 s]
0.0.Bcustom2: Trace Attempt  4	[0.01 s]
0.0.Bcustom2: Trace Attempt  5	[0.01 s]
0.0.Bcustom2: Trace Attempt  1	[0.03 s]
0.0.Bcustom2: Trace Attempt  2	[0.03 s]
0.0.Bcustom2: Trace Attempt  3	[0.03 s]
0.0.Bcustom2: Trace Attempt  4	[0.03 s]
0.0.Tri:    0.00" ---- Launching main thread ----
0.0.Bcustom2: Trace Attempt  5	[0.03 s]
0.0.AMcustom3: Trace Attempt  1	[0.11 s]
0.0.AMcustom3: Trace Attempt  2	[0.11 s]
0.0.AMcustom3: Trace Attempt  3	[0.11 s]
0.0.AMcustom3: Trace Attempt  4	[0.11 s]
0.0.AMcustom3: Trace Attempt  5	[0.11 s]
0.0.Bcustom2: Trace Attempt  1	[0.07 s]
0.0.Bcustom2: Trace Attempt  2	[0.07 s]
0.0.Bcustom2: Trace Attempt  3	[0.07 s]
0.0.Bcustom2: Trace Attempt  4	[0.07 s]
0.0.Bcustom2: Trace Attempt  5	[0.07 s]
0.0.Tri:    0.05" ---- Launching abstraction thread ----
0.0.Tri:    0.06" ---- Launching multi-phase simplification thread ----
0.0.Tri:    0.08" ---- Launching liveness simplification thread ----
0.0.Bcustom2: Trace Attempt  1	[0.18 s]
0.0.Bcustom2: Trace Attempt  2	[0.18 s]
0.0.Bcustom2: Trace Attempt  3	[0.18 s]
0.0.Bcustom2: Trace Attempt  4	[0.18 s]
0.0.Bcustom2: Trace Attempt  5	[0.18 s]
0.0.AMcustom3: Trace Attempt  1	[0.43 s]
0.0.AMcustom3: Trace Attempt  2	[0.43 s]
0.0.AMcustom3: Trace Attempt  3	[0.43 s]
0.0.AMcustom3: Trace Attempt  4	[0.43 s]
0.0.AMcustom3: Trace Attempt  5	[0.43 s]
0.0.Hp: Trace Attempt 3683	[181.92 s]
0.0.Tri:    0.89" Simplification phase 1 complete
0.0.Ncustom1: Requesting engine job to terminate
0.0.Bcustom2: Requesting engine job to terminate
0.0.AMcustom3: Requesting engine job to terminate
0.0.Tri: Requesting engine job to terminate
0.0.Hp: Requesting engine job to terminate
0.0.Ht: Requesting engine job to terminate
INFO (IPF144): 0: Initiating shutdown of proof [182.09 s]
0.0.Tri: A proof was found: No trace exists. [0.98 s]
INFO (IPF057): 0.0.Tri: The property "DELAY.p1" was proven in 0.98 s.
0.0.AMcustom3: Trace Attempt 75	[1.00 s]
0.0.AMcustom3: Stopped processing property "DELAY.p1"	[1.03 s].
0.0.AMcustom3: All properties determined. [1.03 s]
0.0.AMcustom3: Exited with Success (@ 182.10 s)
0: ProofGrid usable level: 0
0.0.Ncustom1: Stopped processing property "DELAY.p1"	[1.08 s].
0.0.Ncustom1: All properties determined. [1.08 s]
0.0.Ht: Trace Attempt 12512	[182.04 s]
0.0.Ht: All properties determined. [182.07 s]
0.0.Hp: Trace Attempt 3685	[182.05 s]
0.0.Hp: All properties determined. [182.11 s]
0.0.Ncustom1: Exited with Success (@ 182.11 s)
0.0.Ht: Exited with Success (@ 182.21 s)
0.0.Hp: Exited with Success (@ 182.28 s)
0.0.Tri: Stopped processing property "DELAY.p1"	[1.18 s].
0.0.Tri: All properties determined. [1.18 s]
0.0.Tri: Exited with Success (@ 182.29 s)
0.0.Bcustom2: Trace Attempt  1	[1.92 s]
0.0.Bcustom2: Stopped processing property "DELAY.p1"	[1.92 s].
0.0.Bcustom2: All properties determined. [1.92 s]
0.0.Bcustom2: Exited with Success (@ 183.08 s)
0: --------------------------------------------------------------
ProofGrid Summary (utilization 99.96 %)
--------------------------------------------------------------
     engines started                               :    10
     engine jobs started                           :     7

    Average time in state (seconds)
    ------------------------------------------------------
    Engine  Pending     Running        Dead    Utilization
    ------------------------------------------------------
     Hp        0.03      182.09        0.00       99.98 %
     Ht        0.04      182.06        0.00       99.98 %
     Oh        0.06        0.01        0.00       13.99 %
    Ncustom1        0.04      182.07        0.00       99.98 %
    Bcustom2        0.03      181.93        0.00       99.98 %
    AMcustom3        0.03      182.00        0.00       99.98 %
    Tri        0.08        0.99        0.00       92.24 %
    all        0.05      130.16        0.00       99.96 %

    Total time in state (seconds)
    -----------------------------------------
            Pending     Running        Dead  
    -----------------------------------------
               0.32      911.15        0.00

    Data read    : 8.01 MiB
    Data written : 3.03 kiB

0: All pending notifications were processed.
INFO (IPF059): 0: Completed proof on task: "<embedded>"

==============================================================
SUMMARY
==============================================================
           Properties Considered              : 1
                 assertions                   : 1
                  - proven                    : 1 (100%)
                  - bounded_proven (user)     : 0 (0%)
                  - bounded_proven (auto)     : 0 (0%)
                  - marked_proven             : 0 (0%)
                  - cex                       : 0 (0%)
                  - ar_cex                    : 0 (0%)
                  - undetermined              : 0 (0%)
                  - unknown                   : 0 (0%)
                  - error                     : 0 (0%)
                 covers                       : 0
                  - unreachable               : 0
                  - bounded_unreachable (user): 0
                  - covered                   : 0
                  - ar_covered                : 0
                  - undetermined              : 0
                  - unknown                   : 0
                  - error                     : 0
proven
[<embedded>] % exit -force
[<embedded>] % INFO (IPL005): Received request to exit from the console.
INFO: Waiting for proof threads to stop...
INFO: Proof threads stopped.
INFO (IPL018): The peak resident set memory use for this session was 1.532 GB.
INFO (IPL014): Waiting for the Tcl-thread to exit.
INFO (IPL015): The Tcl-thread exited with status 0.
INFO (IPL016): Exiting the analysis session with status 0.
Finished 1_delay_8.tcl successfully
