Jasper Apps 2024.06p002 64 bits 2024.09.02 16:28:38 UTC

Any disclosure about the Cadence Design Systems software or its use
model to any third party violates the written Non-Disclosure Agreement
between Cadence Design Systems, Inc. and the customer.

THIS SOFTWARE CONTAINS CONFIDENTIAL INFORMATION AND TRADE SECRETS OF
CADENCE DESIGN SYSTEMS, INC. USE, DISCLOSURE, OR REPRODUCTION IS
PROHIBITED WITHOUT THE PRIOR EXPRESS WRITTEN PERMISSION OF CADENCE
DESIGN SYSTEMS, INC.

Copyright (C) 2000-2024 Cadence Design Systems, Inc. All Rights
Reserved.  Unpublished -- rights reserved under the copyright laws of
the United States.

This product includes software developed by others and redistributed
according to license agreement. See doc/third_party_readme.txt for
further details.

RESTRICTED RIGHTS LEGEND

Use, duplication, or disclosure by the Government is subject to
restrictions as set forth in subparagraph (c) (1) (ii) of the Rights in
Technical Data and Computer Software clause at DFARS 252.227-7013 or
subparagraphs (c) (1) and (2) of Commercial Computer Software -- Restricted
Rights at 48 CFR 52.227-19, as applicable.


                          Cadence Design Systems, Inc.
                          2655 Seely Avenue
                          San Jose, CA 95134
                          Phone: 408.943.1234

For technical assistance visit http://support.cadence.com.

Jasper Apps Analysis Session - /users/rompel/jasper_executions/liveness/jgprojects/1_gray_5/sessionLogs/session_0

WARNING (WG017): [session]: The system's locale is "ANSI_X3.4-1968", which is not UTF-8. Non-ASCII characters might not be handled correctly.
WARNING (WG017): [jg_console]: The system's locale is "ANSI_X3.4-1968", which is not UTF-8. Non-ASCII characters might not be handled correctly.
INFO: successfully checked out license "jasper_fao".
INFO: reading configuration file "/users/rompel/.config/cadence/jasper.conf".
% analyze -sv09 ../1_gray_5.sv
[-- (VERI-1482)] Analyzing Verilog file '/tools/cadence2425/JASPER/jasper_2024.06p002/lib/verilog/packages/std/std.sv' into library 'std'
[-- (VERI-1482)] Analyzing Verilog file '../1_gray_5.sv'
% elaborate -bbox_mul 1000000 -bbox_div 1000000 -bbox_mod 1000000 -bbox_a 1000000
[INFO (HIER-8002)] ../1_gray_5.sv(14): Disabling old hierarchical reference handler
[INFO (VERI-1018)] ../1_gray_5.sv(1): compiling module 'GRAY'
[WARN (VERI-1209)] ../1_gray_5.sv(9): expression size 32 truncated to fit in target size 12
INFO (ISW003): Top module name is "GRAY".
INFO (INL208): Elaboration synthesis summary:
  Number of synthesized netlists          1 (0 packages)
  Single run mode                         On
  Pipeline                                On (1 pipelined netlists)
  Late hierarchical reference connection  On
  Number of analyzed Verilog modules      1 (1 synthesized)
  Number of analyzed VHDL entities        0 (0 synthesized)
INFO (INL003): Clearing all state information (assumes, stopats, and so forth).
GRAY
[<embedded>] % reset rst
INFO (IPM031): Clearing proof results of all properties.
INFO (IRS006): Current reset condition is "rst".
[<embedded>] % clock clk
[<embedded>] % prove -all
Ncustom1: Custom engine code is hT3Ng7hPPfiYQOTDZ3qhYOwGAM51eA+J/FjkM5shLioAsqhgLR4Ft+O1BuKG6ilQ83B9tLXSl+CwjiTMAQA
Bcustom2: Custom engine code is hT3Nm7hPr1Vp3Di1Ra2USNIGL4JypRnLKLAdF6JAyuavO2JfGCiY9OZJhcAcOUnLx5xwNdhILGrAWX9s+z2WDkKwNR7tAfClBEjRFVQeq6DU54boFgEA
AMcustom3: Custom engine code is hT3Ng7hP/feYQOTDZ3qhYOwGAM51eA+J/FjkM5shLioAsqhgLR4Ft+O1BuKG6ilQ83B9tLXSmmqwm7g9AQA
Mpcustom4: Custom engine code is hT3NZbhP9fmY2AbBQnsjfOxn6c+6e6yL+/e8fZFmaQrnlgEA
INFO (IPF036): Starting proof on task: "<embedded>", 1 properties to prove with 0 already proven/unreachable
INFO (IRS029): Starting reset analysis: phase 1 of 4.
INFO (IRS030): Running reset analysis: phase 2 of 4.
INFO (IRS031): Running reset analysis: phase 3 of 4.
INFO (IRS020): Starting the reset analysis simulation with a limit of 100 iterations (phase 4 of 4).
INFO (IRS024): Reset iterations 0 to 4 analyzed.
INFO (IRS018): Reset analysis simulation executed for 3 iterations. Assigned values for 12 of 24 design flops, 0 of 0 design latches, 3 of 3 internal elements.
INFO (IRS039): Reset analysis complete.
INFO (IPF031): Settings used for proof thread 0:
    orchestration                 = on
    time_limit                    = 86400s
    per_property_time_limit       = 1s * 10 ^ scan
    engine_mode                   = auto
    proofgrid_per_engine_max_jobs = 1
    max engine jobs               = auto
    proofgrid_mode                = local
    proofgrid_restarts            = 10
AMcustom5: Custom engine code is hT3N1rhP11/52HrFRS21ROp2LOjVTgPvT8L8BGXHgLhaIuqtT4nARFjUqrBL+7pLmaTOzBepZW/Jm8SSrHDybSQtoNiO3y43wk+dEoWlsZizu97Fih6O6lPVG/LpWP5SsUPwlGagLNa1FKEFvwVXyX7//8prySbvSxIHXr5er+z4RAEA
0: Using multistage preprocessing
0: Starting reduce
Ncustom6: Custom engine code is hT3OXrhPByJp3TrFSTLhUmMH4KVtJgmTCnNDF46yMXOKY48m4LS5nE7yBzFjA7kDuwO/GhGUpEPiky3p3wmPn3dJZHxFMsafSoObRzSC+tn7sEY0WbTdZ/FV4hL3MYH/b1CIUvXSWR4wqEoVLsmMOD4xIPT4lI1LO6ZCO7PnnWQuLwetnvKlrXx6wCW/A+x+enqslg1YPobi4wEF/EvbzOvcTYdJvl2s4H2yZg2b2ofAVN5WvhWk1HoBAA
ADcustom7: Custom engine code is hT3Nv7hPv1752HrFRa2kROx2f/ECJeZB2AZsLdlO8VwmIuqtT4nIDFXclhg+O+o+DMmQCekbheGk0kK28laA9gaOFDXsQp29J3X615HY1IPHJWd6FUFvCHjO+p1k652b5JJvZlShNpGlGSXAiQe/mEAj6tEBAA
Tricustom8: Custom engine code is hT3Nu7hPt1752DvFRa0kNDiyIV97VyejwM9C/jCLJjdPvusZONHY42VYUy0Q1ZotnhcVtNc56tJ5wbxv6V2+XpdsaSlHck5vfnbYjdwj1OECy9U+7oSQ0SZE3g5ayD+Phuh4odCJTjeKa2k4elM9ldQfkAEA
Gcustom9: Custom engine code is hT3NibhPDfeYQADBZnYcglOvK9Pfd7EOeniIqP8jNsyIqInncipMGcUXqAadachREE9F2PwhBUZUNw5kHnd4JdXkamORRgEA
C2custom10: Custom engine code is hT3NirhPjfWYQADBZnYcglOvK9Pfd7EOeniIqP8jNsyIqInncgkrYMMXCYbdK0dUjZIF9d4cJ0rHoBDjwVLBKuG86XYVV00BAA
AGcustom11: Custom engine code is hT3NirhP/fmYQADBZnYcglOvK9Pfd7EOeniIqP8jNsyIqInnckcwYMMXCYbdK0dUjZIF9d4cJ0rHoBDjwVLBKuHEZnZByh0BAA
Bcustom12: Custom engine code is hT3NjrhPDfiYQADBZnYcglOvK9PfWxFtenjIyBqfrgr7if/jL/yPOuK1BAflEcW0DxNH2eDIoezN2gxlQFg81RZtiWXh7aiTAidvAQA
0: Finished reduce in 0s
Ncustom13: Custom engine code is hT3NR7hPByFp3TrFSTLhUmMH4KWtJglTyV/c51BHEeZWamnJv767nE6PCak26bd3gf3XGN3rIRheufhDieCJQVISo+gNYUKhiUedBKGtsP/a18svAnlMJZudHxDFwK5ufsyoxsIyiAeSY2oi3tEuoDHr5gw42DFKAG3PqO3CEsl8Azzdt3pl5nGA1Ifv2H02eYsFzWb/nfp8PMb3F0krE/EgBcm8TD9Div8BAA
Tricustom14: Custom engine code is hT3Nu7hP3fiYQADBZnYcglNHp9bfd7EOeniIqP/ji8sGLQu8yhsFO+wxJ+O+R0bU8g/IewXFomyos+viQnWc2xYNYmMqpo3i40O7DaZR7qfp4YqNx26KRvQ/qx0BAA
0.0.PRE: Performing Proof Simplification...
0.0.N: clocks: 1, declared: 1, looping: 0, posedge: 1, negedge: 0, noedge: 0, bothedge: 0
0.0.N: Proof Simplification Iteration 1	[0.00 s]
0.0.PRE: A proof was found: No trace exists. [0.00 s]
INFO (IPF057): 0.0.PRE: The property ":noDeadEnd" was proven in 0.00 s.
    Use check_assumptions -show -dead_end to show this property in the property table.
0.0.PRE: A proof was found: No trace exists. [0.00 s]
INFO (IPF057): 0.0.PRE: The property ":noConflict" was proven in 0.00 s.
    Use check_assumptions -show to show this property in the property table.
INFO (IPF047): 0.0.PRE: The cover property ":live" was covered in 1 cycles in 0.00 s.
    Use check_assumptions -show -live to show this property in the property table.
0.0.PRE: Proof Simplification completed in 0.00 s
0: About to start ProofGrid in its own thread with a limit of 10000 pending notifications and a limit of 10 traces.
0: =============================== ProofGrid start ===============================
0: ProofGrid usable level: 1
0: Initial ProofGrid level: 1
0: ProofGrid is starting event handling
0.0.N: Proofgrid shell started at 18952@vlsi-ria85(local) jg_18840_vlsi-ria85_1
0.0.Hp: Proofgrid shell started at 18954@vlsi-ria85(local) jg_18840_vlsi-ria85_1
0.0.N: clocks: 1, declared: 1, looping: 0, posedge: 1, negedge: 0, noedge: 0, bothedge: 0
0.0.N: Last scan. Per property time limit: 0s
0.0.N: Starting proof for property "GRAY.p1"	[0.00 s].
0.0.N: Trace Attempt  1	[0.00 s]
0.0.N: Trace Attempt  2	[0.00 s]
0.0.Hp: clocks: 1, declared: 1, looping: 0, posedge: 1, negedge: 0, noedge: 0, bothedge: 0
0.0.N: Trace Attempt  3	[0.00 s]
0.0.Hp: Last scan. Per property time limit: 0s
0.0.N: Trace Attempt  3	[0.00 s]
0.0.N: Trace Attempt  4	[0.00 s]
0.0.N: Trace Attempt  4	[0.00 s]
0.0.Hp: Trace Attempt  1	[0.00 s]
0.0.Hp: Trace Attempt  2	[0.00 s]
0.0.Hp: Trace Attempt  3	[0.00 s]
0.0.Hp: Trace Attempt  4	[0.00 s]
0.0.N: Trace Attempt  5	[0.00 s]
0.0.Hp: Trace Attempt  5	[0.00 s]
0.0.N: Trace Attempt  1	[0.01 s]
0.0.N: Trace Attempt  2	[0.01 s]
0.0.N: Trace Attempt  3	[0.01 s]
0.0.N: Trace Attempt  4	[0.01 s]
0.0.N: Trace Attempt  5	[0.01 s]
0.0.Ht: Proofgrid shell started at 19014@vlsi-ria85(local) jg_18840_vlsi-ria85_1
0.0.Ht: clocks: 1, declared: 1, looping: 0, posedge: 1, negedge: 0, noedge: 0, bothedge: 0
0.0.Ht: Last scan. Per property time limit: 0s
0.0.Ht: Trace Attempt  1	[0.00 s]
0.0.Ht: Trace Attempt  2	[0.00 s]
0.0.Ht: Trace Attempt  3	[0.00 s]
0.0.Ht: Trace Attempt  4	[0.00 s]
0.0.Ht: Trace Attempt  5	[0.00 s]
0.0.Oh: Proofgrid shell started at 19015@vlsi-ria85(local) jg_18840_vlsi-ria85_1
0.0.B: Proofgrid shell started at 19016@vlsi-ria85(local) jg_18840_vlsi-ria85_1
0.0.B: clocks: 1, declared: 1, looping: 0, posedge: 1, negedge: 0, noedge: 0, bothedge: 0
0.0.B: Last scan. Per property time limit: 0s
0.0.B: Starting proof for property "GRAY.p1"	[0.00 s].
0.0.B: Trace Attempt  1	[0.00 s]
0.0.AM: Proofgrid shell started at 19017@vlsi-ria85(local) jg_18840_vlsi-ria85_1
0.0.B: Trace Attempt  2	[0.00 s]
0.0.B: Trace Attempt  3	[0.00 s]
0.0.B: Trace Attempt  4	[0.00 s]
0.0.B: Trace Attempt  5	[0.00 s]
0.0.Oh: clocks: 1, declared: 1, looping: 0, posedge: 1, negedge: 0, noedge: 0, bothedge: 0
0.0.Oh: Reached length limit (2147483647) [0.01 s]
0.0.AM: clocks: 1, declared: 1, looping: 0, posedge: 1, negedge: 0, noedge: 0, bothedge: 0
0.0.AM: Last scan. Per property time limit: 0s
0.0.AM: Starting proof for property "GRAY.p1"	[0.00 s].
0.0.AM: Trace Attempt  1	[0.00 s]
0.0.AM: Trace Attempt  2	[0.00 s]
0.0.AM: Trace Attempt  3	[0.00 s]
0.0.AM: Trace Attempt  4	[0.00 s]
0.0.AM: Trace Attempt  5	[0.00 s]
0.0.AM: Trace Attempt  1	[0.00 s]
0.0.AM: Trace Attempt  2	[0.00 s]
0.0.AM: Trace Attempt  3	[0.00 s]
0.0.AM: Trace Attempt  5	[0.00 s]
0.0.Oh: Exited with Success (@ 0.07 s)
0.0.N: Trace Attempt  1	[0.07 s]
0.0.N: Trace Attempt  2	[0.07 s]
0.0.N: Trace Attempt  3	[0.07 s]
0.0.N: Trace Attempt  4	[0.07 s]
0.0.N: Trace Attempt  5	[0.07 s]
0.0.AM: Trace Attempt  1	[0.01 s]
0.0.AM: Trace Attempt  2	[0.01 s]
0.0.AM: Trace Attempt  3	[0.01 s]
0.0.AM: Trace Attempt  4	[0.01 s]
0.0.AM: Trace Attempt  5	[0.01 s]
0.0.AM: Trace Attempt  1	[0.03 s]
0.0.AM: Trace Attempt  2	[0.03 s]
0.0.AM: Trace Attempt  3	[0.03 s]
0.0.AM: Trace Attempt  4	[0.03 s]
0.0.AM: Trace Attempt  5	[0.03 s]
0.0.AM: Trace Attempt  1	[0.08 s]
0.0.AM: Trace Attempt  2	[0.08 s]
0.0.AM: Trace Attempt  3	[0.08 s]
0.0.AM: Trace Attempt  4	[0.08 s]
0.0.AM: Trace Attempt  5	[0.08 s]
0.0.N: Trace Attempt  1	[0.37 s]
0.0.N: Trace Attempt  2	[0.37 s]
0.0.N: Trace Attempt  3	[0.37 s]
0.0.N: Trace Attempt  4	[0.37 s]
0.0.N: Trace Attempt  5	[0.37 s]
0.0.AM: Trace Attempt  1	[0.33 s]
0.0.AM: Trace Attempt  2	[0.33 s]
0.0.AM: Trace Attempt  3	[0.33 s]
0.0.AM: Trace Attempt  4	[0.33 s]
0.0.AM: Trace Attempt  5	[0.33 s]
0.0.AM: Trace Attempt  1	[1.37 s]
0.0.AM: Trace Attempt  2	[1.37 s]
0.0.AM: Trace Attempt  3	[1.37 s]
0.0.AM: Trace Attempt  4	[1.37 s]
0.0.AM: Trace Attempt  5	[1.37 s]
0.0.N: Trace Attempt  1	[1.54 s]
0.0.N: Trace Attempt  2	[1.54 s]
0.0.N: Trace Attempt  3	[1.54 s]
0.0.N: Trace Attempt  4	[1.54 s]
0.0.N: Trace Attempt  5	[1.54 s]
0.0.N: Trace Attempt  1	[2.75 s]
0.0.N: Trace Attempt  2	[2.75 s]
0.0.N: Trace Attempt  3	[2.75 s]
0.0.N: Trace Attempt  4	[2.75 s]
0.0.N: Trace Attempt  5	[2.75 s]
0.0.N: Trace Attempt  1	[3.90 s]
0.0.N: Trace Attempt  2	[3.90 s]
0.0.N: Trace Attempt  3	[3.90 s]
0.0.N: Trace Attempt  4	[3.90 s]
0.0.N: Trace Attempt  5	[3.90 s]
0.0.Hp: Trace Attempt 753	[4.00 s]
0.0.Ht: Trace Attempt 2112	[4.00 s]
0.0.B: Trace Attempt 2070	[4.00 s]
0.0.N: Trace Attempt  1	[5.06 s]
0.0.N: Trace Attempt  2	[5.06 s]
0.0.N: Trace Attempt  3	[5.06 s]
0.0.N: Trace Attempt  4	[5.06 s]
0.0.N: Trace Attempt  5	[5.06 s]
0.0.AM: Trace Attempt 219	[5.38 s]
0.0.N: Trace Attempt  1	[6.26 s]
0.0.N: Trace Attempt  2	[6.26 s]
0.0.N: Trace Attempt  3	[6.26 s]
0.0.N: Trace Attempt  4	[6.26 s]
0.0.N: Trace Attempt  5	[6.26 s]
0.0.AM: Trace Attempt  1	[6.37 s]
0.0.AM: Trace Attempt  2	[6.37 s]
0.0.AM: Trace Attempt  3	[6.37 s]
0.0.AM: Trace Attempt  4	[6.37 s]
0.0.AM: Trace Attempt  5	[6.37 s]
0.0.N: Trace Attempt  1	[7.45 s]
0.0.N: Trace Attempt  2	[7.45 s]
0.0.N: Trace Attempt  3	[7.45 s]
0.0.N: Trace Attempt  4	[7.45 s]
0.0.N: Trace Attempt  5	[7.45 s]
0.0.Hp: Trace Attempt 1051	[8.01 s]
0.0.Ht: Trace Attempt 2867	[8.00 s]
0.0.B: Trace Attempt 2855	[8.00 s]
0.0.N: Trace Attempt  1	[8.59 s]
0.0.N: Trace Attempt  2	[8.59 s]
0.0.N: Trace Attempt  3	[8.59 s]
0.0.N: Trace Attempt  4	[8.59 s]
0.0.N: Trace Attempt  5	[8.59 s]
0.0.N: Trace Attempt  1	[9.78 s]
0.0.N: Trace Attempt  2	[9.78 s]
0.0.N: Trace Attempt  3	[9.78 s]
0.0.N: Trace Attempt  4	[9.78 s]
0.0.N: Trace Attempt  5	[9.78 s]
0.0.AM: Trace Attempt 208	[10.39 s]
0.0.N: Trace Attempt  1	[11.04 s]
0.0.N: Trace Attempt  2	[11.04 s]
0.0.N: Trace Attempt  3	[11.04 s]
0.0.N: Trace Attempt  5	[11.04 s]
0.0.Hp: Trace Attempt 1281	[12.02 s]
0.0.Ht: Trace Attempt 3462	[12.00 s]
0.0.B: Trace Attempt 3447	[12.01 s]
0.0.AM: Trace Attempt 267	[14.39 s]
0.0.N: Trace Attempt 202	[15.09 s]
0.0.Hp: Trace Attempt 1469	[16.03 s]
0.0.Ht: Trace Attempt 3971	[16.00 s]
0.0.B: Trace Attempt 3935	[16.01 s]
0.0.AM: Trace Attempt 329	[18.41 s]
0.0.N: Trace Attempt 236	[19.21 s]
0.0.N: Trace Attempt  1	[19.53 s]
0.0.N: Trace Attempt  2	[19.53 s]
0.0.N: Trace Attempt  3	[19.53 s]
0.0.N: Trace Attempt  4	[19.53 s]
0.0.N: Trace Attempt  5	[19.53 s]
0.0.Hp: Trace Attempt 1634	[20.05 s]
0.0.B: Trace Attempt 4176	[20.04 s]
0.0.Ht: Trace Attempt 4098	[21.93 s]
0.0.N: Trace Attempt  1	[21.98 s]
0.0.N: Trace Attempt  2	[21.98 s]
0.0.N: Trace Attempt  3	[21.98 s]
0.0.N: Trace Attempt  4	[21.98 s]
0.0.N: Trace Attempt  5	[21.98 s]
0.0.AM: Trace Attempt 372	[22.43 s]
0.0.Hp: Trace Attempt 1788	[24.05 s]
0.0.B: Trace Attempt 4296	[24.05 s]
0.0.N: Trace Attempt  1	[24.47 s]
0.0.N: Trace Attempt  2	[24.47 s]
0.0.N: Trace Attempt  3	[24.47 s]
0.0.N: Trace Attempt  4	[24.47 s]
0.0.N: Trace Attempt  5	[24.47 s]
0.0.Ht: Trace Attempt 4243	[25.95 s]
0.0.AM: Trace Attempt 421	[26.45 s]
0.0.N: Trace Attempt  1	[27.02 s]
0.0.N: Trace Attempt  2	[27.02 s]
0.0.N: Trace Attempt  3	[27.02 s]
0.0.N: Trace Attempt  4	[27.02 s]
0.0.N: Trace Attempt  5	[27.02 s]
0.0.Hp: Trace Attempt 1926	[28.07 s]
0.0.B: Trace Attempt 4407	[28.07 s]
0.0.N: Trace Attempt  1	[29.48 s]
0.0.N: Trace Attempt  2	[29.48 s]
0.0.N: Trace Attempt  3	[29.48 s]
0.0.N: Trace Attempt  4	[29.48 s]
0.0.N: Trace Attempt  5	[29.48 s]
0.0.Ht: Trace Attempt 4419	[29.97 s]
0.0.AM: Trace Attempt 312	[30.45 s]
0.0.N: Trace Attempt  1	[31.96 s]
0.0.N: Trace Attempt  2	[31.96 s]
0.0.N: Trace Attempt  3	[31.96 s]
0.0.N: Trace Attempt  4	[31.96 s]
0.0.N: Trace Attempt  5	[31.96 s]
0.0.Hp: Trace Attempt 2051	[32.09 s]
0.0.B: Trace Attempt 4509	[32.09 s]
0.0.Ht: Trace Attempt 4559	[34.00 s]
0.0.AM: Trace Attempt  1	[34.16 s]
0.0.AM: Trace Attempt  2	[34.17 s]
0.0.AM: Trace Attempt  3	[34.17 s]
0.0.AM: Trace Attempt  4	[34.17 s]
0.0.AM: Trace Attempt  5	[34.17 s]
0.0.N: Trace Attempt  1	[34.46 s]
0.0.N: Trace Attempt  2	[34.46 s]
0.0.N: Trace Attempt  3	[34.46 s]
0.0.N: Trace Attempt  4	[34.46 s]
0.0.N: Trace Attempt  5	[34.46 s]
0.0.Hp: Trace Attempt 2169	[36.11 s]
0.0.B: Trace Attempt 4601	[36.11 s]
0.0.N: Trace Attempt  1	[36.94 s]
0.0.N: Trace Attempt  2	[36.94 s]
0.0.N: Trace Attempt  3	[36.94 s]
0.0.N: Trace Attempt  4	[36.94 s]
0.0.N: Trace Attempt  5	[36.94 s]
0.0.Ht: Trace Attempt 4734	[38.01 s]
0.0.AM: Trace Attempt 221	[38.18 s]
0.0.N: Trace Attempt  1	[39.52 s]
0.0.N: Trace Attempt  2	[39.52 s]
0.0.N: Trace Attempt  3	[39.52 s]
0.0.N: Trace Attempt  4	[39.52 s]
0.0.N: Trace Attempt  5	[39.52 s]
0.0.Hp: Trace Attempt 2285	[40.15 s]
0.0.B: Trace Attempt 4690	[40.13 s]
0.0.Ht: Trace Attempt 4900	[42.02 s]
0.0.N: Trace Attempt  1	[42.11 s]
0.0.N: Trace Attempt  2	[42.11 s]
0.0.N: Trace Attempt  3	[42.11 s]
0.0.N: Trace Attempt  4	[42.11 s]
0.0.N: Trace Attempt  5	[42.11 s]
0.0.AM: Trace Attempt 271	[42.18 s]
0.0.Hp: Trace Attempt 2393	[44.15 s]
0.0.B: Trace Attempt 4776	[44.14 s]
0.0.N: Trace Attempt  1	[44.86 s]
0.0.N: Trace Attempt  2	[44.86 s]
0.0.N: Trace Attempt  3	[44.86 s]
0.0.N: Trace Attempt  4	[44.86 s]
0.0.N: Trace Attempt  5	[44.86 s]
0.0.Ht: Trace Attempt 5057	[46.05 s]
0.0.AM: Trace Attempt 337	[46.20 s]
0.0.Hp: Trace Attempt 2496	[48.16 s]
0.0.B: Trace Attempt 4868	[48.19 s]
0.0.N: Trace Attempt 210	[48.88 s]
0.0.Ht: Trace Attempt 5189	[50.07 s]
0.0.AM: Trace Attempt 379	[50.22 s]
0.0.Hp: Trace Attempt 2595	[52.19 s]
0.0.B: Trace Attempt 4956	[52.21 s]
0.0.N: Trace Attempt 258	[52.91 s]
0.0.AM: Trace Attempt 427	[54.29 s]
0.0.Ht: Trace Attempt 5240	[54.50 s]
0.0.Hp: Trace Attempt 2690	[56.21 s]
0.0.B: Trace Attempt 5054	[56.22 s]
0.0.N: Trace Attempt 308	[56.96 s]
0.0.Ht: Trace Attempt 5466	[58.51 s]
0.0.AM: Trace Attempt 463	[58.63 s]
0.0.Hp: Trace Attempt 2781	[60.24 s]
0.0.B: Trace Attempt 5148	[60.23 s]
0.0.N: Trace Attempt 347	[61.02 s]
0.0.Ht: Trace Attempt 5668	[62.52 s]
0.0.AM: Trace Attempt 476	[62.71 s]
0.0.Hp: Trace Attempt 2868	[64.26 s]
0.0.B: Trace Attempt 5236	[64.24 s]
0.0.N: Trace Attempt 385	[65.05 s]
0.0.Ht: Trace Attempt 5869	[66.53 s]
0.0.AM: Trace Attempt 490	[66.79 s]
0.0.Hp: Trace Attempt 2952	[68.27 s]
0.0.B: Trace Attempt 5321	[68.25 s]
0.0.N: Trace Attempt 425	[69.11 s]
0.0.Ht: Trace Attempt 6055	[70.55 s]
0.0.AM: Trace Attempt 505	[70.95 s]
0.0.Hp: Trace Attempt 3033	[72.32 s]
0.0.B: Trace Attempt 5401	[72.28 s]
0.0.N: Trace Attempt 462	[73.26 s]
0.0.Ht: Trace Attempt 6221	[74.56 s]
0.0.AM: Trace Attempt 521	[74.97 s]
0.0.N: Trace Attempt  1	[75.57 s]
0.0.N: Trace Attempt  2	[75.57 s]
0.0.N: Trace Attempt  3	[75.57 s]
0.0.N: Trace Attempt  4	[75.57 s]
0.0.N: Trace Attempt  5	[75.58 s]
0.0.Hp: Trace Attempt 3111	[76.33 s]
0.0.B: Trace Attempt 5480	[76.31 s]
0.0.Ht: Trace Attempt 6379	[78.60 s]
0.0.AM: Trace Attempt 538	[79.03 s]
0.0.N: Trace Attempt 210	[79.59 s]
0.0.Hp: Trace Attempt 3188	[80.36 s]
0.0.B: Trace Attempt 5561	[80.35 s]
0.0.Ht: Trace Attempt 6523	[82.60 s]
0.0.AM: Trace Attempt 557	[83.07 s]
0.0.N: Trace Attempt 258	[83.60 s]
0.0.Hp: Trace Attempt 3263	[84.39 s]
0.0.B: Trace Attempt 5640	[84.38 s]
0.0.Ht: Trace Attempt 6666	[86.61 s]
0.0.AM: Trace Attempt 574	[87.09 s]
0.0.N: Trace Attempt 308	[87.63 s]
0.0.Hp: Trace Attempt 3336	[88.42 s]
0.0.B: Trace Attempt 5716	[88.41 s]
0.0.Ht: Trace Attempt 6783	[90.63 s]
0.0.AM: Trace Attempt 587	[91.21 s]
0.0.N: Trace Attempt 347	[91.71 s]
0.0.Hp: Trace Attempt 3407	[92.47 s]
0.0.B: Trace Attempt 5791	[92.45 s]
0.0.Ht: Trace Attempt 6890	[94.64 s]
0.0.AM: Trace Attempt 600	[95.24 s]
0.0.N: Trace Attempt 385	[95.72 s]
0.0.Hp: Trace Attempt 3476	[96.51 s]
0.0.B: Trace Attempt 5864	[96.47 s]
0.0.Ht: Trace Attempt 6989	[98.65 s]
0.0.AM: Trace Attempt 615	[99.36 s]
0.0.N: Trace Attempt 424	[99.72 s]
0.0.Hp: Trace Attempt 3543	[100.54 s]
0.0.B: Trace Attempt 5935	[100.53 s]
0.0.Ht: Trace Attempt 7083	[102.65 s]
0.0.AM: Trace Attempt 629	[103.43 s]
0.0.N: Trace Attempt 460	[103.78 s]
0.0.Hp: Trace Attempt 3608	[104.56 s]
0.0.B: Trace Attempt 6003	[104.53 s]
0.0.N: Trace Attempt  1	[106.11 s]
0.0.N: Trace Attempt  2	[106.11 s]
0.0.N: Trace Attempt  3	[106.11 s]
0.0.N: Trace Attempt  4	[106.12 s]
0.0.N: Trace Attempt  5	[106.12 s]
0.0.Ht: Trace Attempt 7172	[106.66 s]
0.0.AM: Trace Attempt 643	[107.53 s]
0.0.Hp: Trace Attempt 3673	[108.61 s]
0.0.B: Trace Attempt 6073	[108.57 s]
0.0.N: Trace Attempt 210	[110.16 s]
0.0.Ht: Trace Attempt 7228	[110.67 s]
0.0.AM: Trace Attempt 656	[111.68 s]
0.0.B: Trace Attempt 6142	[112.59 s]
0.0.Hp: Trace Attempt 3737	[112.67 s]
0.0.N: Trace Attempt 258	[114.19 s]
0.0.Ht: Trace Attempt 7339	[114.68 s]
0.0.AM: Trace Attempt 670	[115.87 s]
0.0.B: Trace Attempt 6209	[116.62 s]
0.0.Hp: Trace Attempt 3799	[116.68 s]
0.0.N: Trace Attempt 308	[118.24 s]
0.0.Ht: Trace Attempt 7432	[118.69 s]
0.0.AM: Trace Attempt 682	[120.16 s]
0.0.B: Trace Attempt 6275	[120.64 s]
0.0.Hp: Trace Attempt 3860	[120.70 s]
0.0.N: Trace Attempt 347	[122.35 s]
0.0.AM: Trace Attempt 693	[124.31 s]
0.0.B: Trace Attempt 6340	[124.64 s]
0.0.Hp: Trace Attempt 3918	[124.71 s]
0.0.Ht: Trace Attempt 7479	[126.27 s]
0.0.N: Trace Attempt 383	[126.44 s]
0.0.AM: Trace Attempt 702	[128.50 s]
0.0.B: Trace Attempt 6396	[128.69 s]
0.0.Hp: Trace Attempt 3970	[128.75 s]
0.0.Ht: Trace Attempt 7641	[130.27 s]
0.0.N: Trace Attempt 413	[130.53 s]
0.0.B: Trace Attempt 6422	[132.70 s]
0.0.Hp: Trace Attempt 4015	[132.78 s]
0.0.AM: Trace Attempt 710	[132.92 s]
0.0.Ht: Trace Attempt 7785	[134.28 s]
0.0.N: Trace Attempt 443	[134.53 s]
0.0.B: Trace Attempt 6473	[136.70 s]
0.0.Hp: Trace Attempt 4065	[136.82 s]
0.0.AM: Trace Attempt 718	[137.20 s]
0.0.Ht: Trace Attempt 7936	[138.29 s]
0.0.N: Trace Attempt 468	[138.56 s]
0.0.N: Trace Attempt  1	[140.65 s]
0.0.N: Trace Attempt  2	[140.65 s]
0.0.N: Trace Attempt  3	[140.65 s]
0.0.N: Trace Attempt  4	[140.65 s]
0.0.N: Trace Attempt  5	[140.65 s]
0.0.B: Trace Attempt 6528	[140.76 s]
0.0.AM: Trace Attempt 729	[141.57 s]
0.0.Ht: Trace Attempt 8088	[142.29 s]
0.0.N: Trace Attempt 194	[144.66 s]
0.0.B: Trace Attempt 6582	[144.77 s]
0.0.AM: Trace Attempt 741	[145.62 s]
0.0.Ht: Trace Attempt 8217	[146.34 s]
0.0.Hp: Trace Attempt 4098	[147.03 s]
0.0.N: Trace Attempt 248	[148.69 s]
0.0.B: Trace Attempt 6628	[148.78 s]
0.0.AM: Trace Attempt 752	[150.21 s]
0.0.Hp: Trace Attempt 4143	[151.03 s]
0.0.N: Trace Attempt 288	[152.74 s]
0.0.B: Trace Attempt 6669	[152.94 s]
0.0.AM: Trace Attempt 760	[154.22 s]
0.0.Hp: Trace Attempt 4185	[155.07 s]
0.0.Ht: Trace Attempt 8222	[155.24 s]
0.0.N: Trace Attempt 327	[156.76 s]
0.0.B: Trace Attempt 6718	[156.98 s]
0.0.AM: Trace Attempt 770	[158.53 s]
0.0.Hp: Trace Attempt 4215	[159.14 s]
0.0.N: Trace Attempt 359	[160.88 s]
0.0.B: Trace Attempt 6762	[160.99 s]
0.0.Ht: Trace Attempt 8298	[162.33 s]
0.0.AM: Trace Attempt 779	[162.54 s]
0.0.Hp: Trace Attempt 4254	[163.19 s]
0.0.N: Trace Attempt 396	[164.93 s]
0.0.B: Trace Attempt 6815	[165.02 s]
0.0.AM: Trace Attempt 789	[166.74 s]
0.0.Ht: Trace Attempt 8321	[167.23 s]
0.0.Hp: Trace Attempt 4295	[167.27 s]
0.0.N: Trace Attempt 429	[169.03 s]
0.0.B: Trace Attempt 6869	[169.06 s]
0.0.AM: Trace Attempt 799	[171.26 s]
0.0.Hp: Trace Attempt 4335	[171.33 s]
0.0.N: Trace Attempt 460	[173.09 s]
0.0.B: Trace Attempt 6920	[173.19 s]
0.0.Hp: Trace Attempt 4374	[175.34 s]
0.0.AM: Trace Attempt 808	[175.48 s]
0.0.N: Trace Attempt  1	[176.25 s]
0.0.N: Trace Attempt  2	[176.25 s]
0.0.N: Trace Attempt  3	[176.25 s]
0.0.N: Trace Attempt  4	[176.25 s]
0.0.N: Trace Attempt  5	[176.25 s]
0.0.Ht: Trace Attempt 8334	[176.22 s]
0.0.B: Trace Attempt 6957	[177.25 s]
0.0.Hp: Trace Attempt 4413	[179.42 s]
0.0.AM: Trace Attempt 817	[179.72 s]
0.0.N: Trace Attempt 194	[180.25 s]
0.0.Ht: Trace Attempt 8401	[180.25 s]
0.0.N: Trace Attempt 217	[180.99 s]
0.0.N: Stopped processing property "GRAY.p1"	[181.04 s].
0.0.N: Morphing to Ncustom1
0.0.N: All properties determined. [0.00 s]
0.0.N: Exited with Success (@ 0.00 s)
0.0.Ncustom1: clocks: 1, declared: 1, looping: 0, posedge: 1, negedge: 0, noedge: 0, bothedge: 0
0.0.Ncustom1: Starting proof for property "GRAY.p1"	[0.00 s].
0.0.Ncustom1: Trace Attempt 471	[0.03 s]
0.0.B: Trace Attempt 7005	[180.90 s]
0.0.B: Stopped processing property "GRAY.p1"	[181.08 s].
0.0.B: Morphing to Bcustom2
0.0.B: All properties determined. [0.00 s]
0.0.B: Exited with Success (@ 0.00 s)
0.0.Bcustom2: clocks: 1, declared: 1, looping: 0, posedge: 1, negedge: 0, noedge: 0, bothedge: 0
0.0.Bcustom2: Starting proof for property "GRAY.p1"	[0.00 s].
0.0.Bcustom2: Trace Attempt  1	[0.00 s]
0.0.Bcustom2: Trace Attempt  2	[0.00 s]
0.0.Bcustom2: Trace Attempt  3	[0.00 s]
0.0.Bcustom2: Trace Attempt  1	[0.00 s]
0.0.Bcustom2: Trace Attempt  2	[0.00 s]
0.0.Bcustom2: Trace Attempt  3	[0.00 s]
0.0.Bcustom2: Trace Attempt  4	[0.00 s]
0.0.Bcustom2: Trace Attempt  5	[0.00 s]
0.0.Bcustom2: Trace Attempt  1	[0.00 s]
0.0.Bcustom2: Trace Attempt  2	[0.00 s]
0.0.Bcustom2: Trace Attempt  3	[0.00 s]
0.0.Bcustom2: Trace Attempt  4	[0.00 s]
0.0.Bcustom2: Trace Attempt  5	[0.00 s]
0.0.Bcustom2: Trace Attempt  1	[0.00 s]
0.0.Bcustom2: Trace Attempt  2	[0.00 s]
0.0.Bcustom2: Trace Attempt  3	[0.00 s]
0.0.Bcustom2: Trace Attempt  4	[0.00 s]
0.0.Bcustom2: Trace Attempt  5	[0.00 s]
0.0.Bcustom2: Trace Attempt  1	[0.01 s]
0.0.Bcustom2: Trace Attempt  2	[0.01 s]
0.0.Bcustom2: Trace Attempt  3	[0.01 s]
0.0.Bcustom2: Trace Attempt  4	[0.01 s]
0.0.Bcustom2: Trace Attempt  5	[0.01 s]
0.0.Bcustom2: Trace Attempt  1	[0.01 s]
0.0.Bcustom2: Trace Attempt  2	[0.01 s]
0.0.Bcustom2: Trace Attempt  3	[0.01 s]
0.0.Bcustom2: Trace Attempt  4	[0.01 s]
0.0.Bcustom2: Trace Attempt  5	[0.01 s]
0.0.Bcustom2: Trace Attempt  1	[0.03 s]
0.0.Bcustom2: Trace Attempt  2	[0.03 s]
0.0.Bcustom2: Trace Attempt  3	[0.03 s]
0.0.Bcustom2: Trace Attempt  4	[0.03 s]
0.0.Bcustom2: Trace Attempt  5	[0.03 s]
0.0.AM: Trace Attempt 819	[180.61 s]
0.0.AM: Stopped processing property "GRAY.p1"	[181.15 s].
0.0.AM: Morphing to AMcustom3
0.0.AM: All properties determined. [0.00 s]
0.0.AM: Exited with Success (@ 0.00 s)
0.0.AMcustom3: clocks: 1, declared: 1, looping: 0, posedge: 1, negedge: 0, noedge: 0, bothedge: 0
0.0.AMcustom3: Starting proof for property "GRAY.p1"	[0.00 s].
0.0.AMcustom3: Trace Attempt  1	[0.00 s]
0.0.AMcustom3: Trace Attempt  2	[0.00 s]
0.0.AMcustom3: Trace Attempt  3	[0.00 s]
0.0.AMcustom3: Trace Attempt  4	[0.00 s]
0.0.AMcustom3: Trace Attempt  5	[0.00 s]
0.0.AMcustom3: Trace Attempt  1	[0.00 s]
0.0.AMcustom3: Trace Attempt  2	[0.00 s]
0.0.AMcustom3: Trace Attempt  3	[0.00 s]
0.0.AMcustom3: Trace Attempt  5	[0.00 s]
0.0.AMcustom3: Trace Attempt  1	[0.01 s]
0.0.AMcustom3: Trace Attempt  2	[0.01 s]
0.0.AMcustom3: Trace Attempt  3	[0.01 s]
0.0.AMcustom3: Trace Attempt  4	[0.02 s]
0.0.AMcustom3: Trace Attempt  5	[0.02 s]
0.0.AMcustom3: Trace Attempt  1	[0.03 s]
0.0.AMcustom3: Trace Attempt  2	[0.03 s]
0.0.AMcustom3: Trace Attempt  3	[0.03 s]
0.0.AMcustom3: Trace Attempt  4	[0.04 s]
0.0.AMcustom3: Trace Attempt  5	[0.04 s]
0.0.Bcustom2: Trace Attempt  1	[0.16 s]
0.0.Bcustom2: Trace Attempt  2	[0.16 s]
0.0.Bcustom2: Trace Attempt  3	[0.16 s]
0.0.Bcustom2: Trace Attempt  4	[0.16 s]
0.0.Bcustom2: Trace Attempt  5	[0.16 s]
0.0.AMcustom3: Trace Attempt  1	[0.10 s]
0.0.AMcustom3: Trace Attempt  2	[0.10 s]
0.0.AMcustom3: Trace Attempt  3	[0.10 s]
0.0.AMcustom3: Trace Attempt  4	[0.10 s]
0.0.AMcustom3: Trace Attempt  5	[0.10 s]
0.0.Tri: Proofgrid shell started at 26564@vlsi-ria85(local) jg_18840_vlsi-ria85_1
0.0.Tri: clocks: 1, declared: 1, looping: 0, posedge: 1, negedge: 0, noedge: 0, bothedge: 0
0.0.Tri: Last scan. Per property time limit: 0s
0.0.Tri: Starting proof for property "GRAY.p1"	[0.00 s].
0.0.Tri: Trace Attempt  1	[0.00 s]
0.0.Tri:    0.00" ---- Launching main thread ----
0.0.AMcustom3: Trace Attempt  1	[0.39 s]
0.0.AMcustom3: Trace Attempt  2	[0.39 s]
0.0.AMcustom3: Trace Attempt  3	[0.39 s]
0.0.AMcustom3: Trace Attempt  4	[0.39 s]
0.0.AMcustom3: Trace Attempt  5	[0.39 s]
0.0.Tri:    0.08" ---- Launching abstraction thread ----
0.0.Tri:    0.10" ---- Launching multi-phase simplification thread ----
0.0.Bcustom2: Trace Attempt  1	[0.63 s]
0.0.Bcustom2: Trace Attempt  2	[0.63 s]
0.0.Bcustom2: Trace Attempt  3	[0.63 s]
0.0.Bcustom2: Trace Attempt  4	[0.63 s]
0.0.Bcustom2: Trace Attempt  5	[0.63 s]
0.0.Tri:    0.15" ---- Launching liveness simplification thread ----
0.0.Ncustom1: Trace Attempt  1	[1.52 s]
0.0.Ncustom1: Trace Attempt  2	[1.52 s]
0.0.Ncustom1: Trace Attempt  3	[1.52 s]
0.0.Ncustom1: Trace Attempt  4	[1.52 s]
0.0.Ncustom1: Trace Attempt  5	[1.52 s]
0.0.AMcustom3: Trace Attempt 92	[1.31 s]
0.0.AMcustom3: Stopped processing property "GRAY.p1"	[1.32 s].
0.0.AMcustom3: Morphing to M
0.0.AMcustom3: All properties determined. [0.00 s]
0.0.AMcustom3: Exited with Success (@ 0.00 s)
0.0.M: clocks: 1, declared: 1, looping: 0, posedge: 1, negedge: 0, noedge: 0, bothedge: 0
0.0.M: Starting proof for property "GRAY.p1"	[0.00 s].
0.0.M: Trace Attempt  1	[0.00 s]
0.0.M: Trace Attempt  2	[0.00 s]
0.0.M: Trace Attempt  3	[0.00 s]
0.0.M: Trace Attempt  5	[0.00 s]
0.0.Tri:    1.02" Simplification phase 1 complete
0.0.Tri: Stopped processing property "GRAY.p1"	[1.16 s].
0.0.Tri: Morphing to AMcustom5
0.0.Tri: All properties determined. [0.00 s]
0.0.Tri: Exited with Success (@ 0.00 s)
0.0.AMcustom5: clocks: 1, declared: 1, looping: 0, posedge: 1, negedge: 0, noedge: 0, bothedge: 0
0.0.AMcustom5: Starting proof for property "GRAY.p1"	[0.00 s].
0.0.AMcustom5: Trace Attempt  1	[0.00 s]
0.0.AMcustom5: Trace Attempt  2	[0.00 s]
0.0.AMcustom5: Trace Attempt  3	[0.00 s]
0.0.AMcustom5: Trace Attempt  1	[0.01 s]
0.0.AMcustom5: Trace Attempt  2	[0.01 s]
0.0.AMcustom5: Trace Attempt  3	[0.01 s]
0.0.AMcustom5: Trace Attempt  4	[0.01 s]
0.0.AMcustom5: Trace Attempt  5	[0.01 s]
0.0.AMcustom5: Trace Attempt  1	[0.01 s]
0.0.AMcustom5: Trace Attempt  2	[0.01 s]
0.0.AMcustom5: Trace Attempt  3	[0.01 s]
0.0.AMcustom5: Trace Attempt  4	[0.01 s]
0.0.AMcustom5: Trace Attempt  5	[0.01 s]
0.0.AMcustom5: Trace Attempt  1	[0.02 s]
0.0.AMcustom5: Trace Attempt  2	[0.02 s]
0.0.AMcustom5: Trace Attempt  3	[0.02 s]
0.0.AMcustom5: Trace Attempt  5	[0.02 s]
0.0.AMcustom5: Trace Attempt  1	[0.03 s]
0.0.AMcustom5: Trace Attempt  2	[0.03 s]
0.0.AMcustom5: Trace Attempt  3	[0.03 s]
0.0.AMcustom5: Trace Attempt  4	[0.03 s]
0.0.AMcustom5: Trace Attempt  5	[0.03 s]
0.0.AMcustom5: Trace Attempt  1	[0.03 s]
0.0.AMcustom5: Trace Attempt  2	[0.03 s]
0.0.AMcustom5: Trace Attempt  3	[0.03 s]
0.0.AMcustom5: Trace Attempt  5	[0.03 s]
0.0.AMcustom5: Trace Attempt  1	[0.04 s]
0.0.AMcustom5: Trace Attempt  2	[0.04 s]
0.0.AMcustom5: Trace Attempt  3	[0.04 s]
0.0.AMcustom5: Trace Attempt  5	[0.04 s]
0.0.AMcustom5: Trace Attempt  1	[0.06 s]
0.0.AMcustom5: Trace Attempt  2	[0.06 s]
0.0.AMcustom5: Trace Attempt  3	[0.06 s]
0.0.AMcustom5: Trace Attempt  4	[0.06 s]
0.0.AMcustom5: Trace Attempt  5	[0.06 s]
0.0.AMcustom5: Trace Attempt  1	[0.06 s]
0.0.AMcustom5: Trace Attempt  2	[0.06 s]
0.0.AMcustom5: Trace Attempt  3	[0.06 s]
0.0.AMcustom5: Trace Attempt  5	[0.06 s]
0.0.AMcustom5: Trace Attempt  1	[0.07 s]
0.0.AMcustom5: Trace Attempt  2	[0.07 s]
0.0.AMcustom5: Trace Attempt  3	[0.07 s]
0.0.AMcustom5: Trace Attempt  5	[0.07 s]
0.0.AMcustom5: Trace Attempt  1	[0.09 s]
0.0.AMcustom5: Trace Attempt  2	[0.10 s]
0.0.AMcustom5: Trace Attempt  3	[0.10 s]
0.0.AMcustom5: Trace Attempt  4	[0.10 s]
0.0.AMcustom5: Trace Attempt  5	[0.10 s]
0.0.AMcustom5: Trace Attempt  1	[0.16 s]
0.0.AMcustom5: Trace Attempt  2	[0.16 s]
0.0.AMcustom5: Trace Attempt  3	[0.16 s]
0.0.AMcustom5: Trace Attempt  4	[0.16 s]
0.0.AMcustom5: Trace Attempt  5	[0.16 s]
0.0.AMcustom5: Trace Attempt  1	[0.16 s]
0.0.AMcustom5: Trace Attempt  2	[0.16 s]
0.0.AMcustom5: Trace Attempt  3	[0.16 s]
0.0.AMcustom5: Trace Attempt  5	[0.16 s]
0.0.AMcustom5: Trace Attempt  1	[0.17 s]
0.0.AMcustom5: Trace Attempt  2	[0.17 s]
0.0.AMcustom5: Trace Attempt  3	[0.17 s]
0.0.AMcustom5: Trace Attempt  5	[0.17 s]
0.0.AMcustom5: Trace Attempt  1	[0.20 s]
0.0.AMcustom5: Trace Attempt  2	[0.20 s]
0.0.AMcustom5: Trace Attempt  3	[0.20 s]
0.0.AMcustom5: Trace Attempt  4	[0.20 s]
0.0.AMcustom5: Trace Attempt  5	[0.20 s]
0.0.AMcustom5: Trace Attempt  1	[0.26 s]
0.0.AMcustom5: Trace Attempt  2	[0.26 s]
0.0.AMcustom5: Trace Attempt  3	[0.26 s]
0.0.AMcustom5: Trace Attempt  5	[0.26 s]
0.0.Bcustom2: Trace Attempt  1	[1.97 s]
0.0.Bcustom2: Stopped processing property "GRAY.p1"	[1.97 s].
0.0.Bcustom2: Morphing to D
0.0.Bcustom2: All properties determined. [0.00 s]
0.0.Bcustom2: Exited with Success (@ 0.00 s)
0.0.D: clocks: 1, declared: 1, looping: 0, posedge: 1, negedge: 0, noedge: 0, bothedge: 0
0.0.D: Starting proof for property "GRAY.p1"	[0.00 s].
0.0.D: Trace Attempt  1	[0.00 s]
0.0.D: Trace Attempt  2	[0.00 s]
0.0.D: Trace Attempt  3	[0.00 s]
0.0.D: Trace Attempt  4	[0.00 s]
0.0.AMcustom5: Trace Attempt  1	[0.56 s]
0.0.AMcustom5: Trace Attempt  2	[0.56 s]
0.0.AMcustom5: Trace Attempt  3	[0.56 s]
0.0.AMcustom5: Trace Attempt  4	[0.56 s]
0.0.AMcustom5: Trace Attempt  5	[0.56 s]
0.0.AMcustom5: Trace Attempt  1	[0.56 s]
0.0.AMcustom5: Trace Attempt  2	[0.56 s]
0.0.AMcustom5: Trace Attempt  3	[0.56 s]
0.0.AMcustom5: Trace Attempt  5	[0.56 s]
0.0.AMcustom5: Trace Attempt  1	[0.57 s]
0.0.AMcustom5: Trace Attempt  2	[0.57 s]
0.0.AMcustom5: Trace Attempt  3	[0.57 s]
0.0.AMcustom5: Trace Attempt  5	[0.57 s]
0.0.AMcustom5: Trace Attempt  1	[0.60 s]
0.0.AMcustom5: Trace Attempt  2	[0.60 s]
0.0.AMcustom5: Trace Attempt  3	[0.60 s]
0.0.AMcustom5: Trace Attempt  5	[0.60 s]
0.0.AMcustom5: Trace Attempt  1	[0.67 s]
0.0.AMcustom5: Trace Attempt  2	[0.68 s]
0.0.AMcustom5: Trace Attempt  3	[0.68 s]
0.0.AMcustom5: Trace Attempt  4	[0.68 s]
0.0.AMcustom5: Trace Attempt  5	[0.68 s]
0.0.Hp: Trace Attempt 4453	[183.46 s]
0.0.AMcustom5: Trace Attempt  1	[0.96 s]
0.0.AMcustom5: Trace Attempt  2	[0.96 s]
0.0.AMcustom5: Trace Attempt  3	[0.96 s]
0.0.AMcustom5: Trace Attempt  4	[0.96 s]
0.0.AMcustom5: Trace Attempt  5	[0.96 s]
0.0.Ht: Trace Attempt 8450	[184.41 s]
0.0.Ncustom1: Trace Attempt 131	[3.42 s]
0.0.Ncustom1: Stopped processing property "GRAY.p1"	[3.41 s].
0.0.Ncustom1: Morphing to AMcustom3
0.0.Ncustom1: All properties determined. [0.00 s]
0.0.Ncustom1: Exited with Success (@ 0.00 s)
0.0.D: Trace Attempt 64	[0.56 s]
0.0.D: Stopped processing property "GRAY.p1"	[1.36 s].
0.0.D: Morphing to Tri
0.0.D: All properties determined. [0.00 s]
0.0.D: Exited with Success (@ 0.00 s)
0.0.AMcustom5: Trace Attempt 103	[1.82 s]
0.0.AMcustom5: Stopped processing property "GRAY.p1"	[1.83 s].
0.0.AMcustom5: Morphing to ADcustom7
0.0.AMcustom5: All properties determined. [0.00 s]
0.0.AMcustom5: Exited with Success (@ 0.00 s)
0.0.AMcustom3: clocks: 1, declared: 1, looping: 0, posedge: 1, negedge: 0, noedge: 0, bothedge: 0
0.0.AMcustom3: Starting proof for property "GRAY.p1"	[0.00 s].
0.0.AMcustom3: Trace Attempt  1	[0.00 s]
0.0.AMcustom3: Trace Attempt  2	[0.00 s]
0.0.AMcustom3: Trace Attempt  3	[0.00 s]
0.0.AMcustom3: Trace Attempt  4	[0.00 s]
0.0.AMcustom3: Trace Attempt  5	[0.00 s]
0.0.AMcustom3: Trace Attempt  1	[0.00 s]
0.0.AMcustom3: Trace Attempt  2	[0.00 s]
0.0.AMcustom3: Trace Attempt  3	[0.00 s]
0.0.AMcustom3: Trace Attempt  5	[0.00 s]
0.0.Tri: clocks: 1, declared: 1, looping: 0, posedge: 1, negedge: 0, noedge: 0, bothedge: 0
0.0.ADcustom7: clocks: 1, declared: 1, looping: 0, posedge: 1, negedge: 0, noedge: 0, bothedge: 0
0.0.ADcustom7: Starting proof for property "GRAY.p1"	[0.00 s].
0.0.ADcustom7: Trace Attempt  1	[0.00 s]
0.0.ADcustom7: Trace Attempt  2	[0.00 s]
0.0.ADcustom7: Trace Attempt  3	[0.00 s]
0.0.ADcustom7: Trace Attempt  1	[0.00 s]
0.0.ADcustom7: Trace Attempt  2	[0.00 s]
0.0.ADcustom7: Trace Attempt  3	[0.00 s]
0.0.ADcustom7: Trace Attempt  4	[0.00 s]
0.0.ADcustom7: Trace Attempt  5	[0.00 s]
0.0.ADcustom7: Trace Attempt  1	[0.00 s]
0.0.ADcustom7: Trace Attempt  2	[0.00 s]
0.0.ADcustom7: Trace Attempt  3	[0.00 s]
0.0.ADcustom7: Trace Attempt  4	[0.00 s]
0.0.ADcustom7: Trace Attempt  5	[0.00 s]
0.0.ADcustom7: Trace Attempt  1	[0.00 s]
0.0.ADcustom7: Trace Attempt  2	[0.00 s]
0.0.ADcustom7: Trace Attempt  3	[0.00 s]
0.0.ADcustom7: Trace Attempt  4	[0.01 s]
0.0.AMcustom3: Trace Attempt  1	[0.01 s]
0.0.AMcustom3: Trace Attempt  2	[0.01 s]
0.0.AMcustom3: Trace Attempt  3	[0.01 s]
0.0.AMcustom3: Trace Attempt  4	[0.01 s]
0.0.AMcustom3: Trace Attempt  5	[0.01 s]
0.0.Tri: Starting proof for property "GRAY.p1"	[0.00 s].
0.0.Tri: Trace Attempt  1	[0.00 s]
0.0.ADcustom7: Trace Attempt  1	[0.01 s]
0.0.ADcustom7: Trace Attempt  2	[0.01 s]
0.0.ADcustom7: Trace Attempt  3	[0.01 s]
0.0.ADcustom7: Trace Attempt  4	[0.01 s]
0.0.ADcustom7: Trace Attempt  5	[0.01 s]
0.0.ADcustom7: Trace Attempt  1	[0.01 s]
0.0.ADcustom7: Trace Attempt  2	[0.02 s]
0.0.ADcustom7: Trace Attempt  3	[0.02 s]
0.0.ADcustom7: Trace Attempt  4	[0.02 s]
0.0.AMcustom3: Trace Attempt  1	[0.03 s]
0.0.AMcustom3: Trace Attempt  2	[0.03 s]
0.0.AMcustom3: Trace Attempt  3	[0.03 s]
0.0.AMcustom3: Trace Attempt  4	[0.03 s]
0.0.AMcustom3: Trace Attempt  5	[0.03 s]
0.0.ADcustom7: Trace Attempt  1	[0.03 s]
0.0.ADcustom7: Trace Attempt  2	[0.03 s]
0.0.ADcustom7: Trace Attempt  3	[0.03 s]
0.0.ADcustom7: Trace Attempt  4	[0.03 s]
0.0.ADcustom7: Trace Attempt  1	[0.05 s]
0.0.ADcustom7: Trace Attempt  2	[0.05 s]
0.0.ADcustom7: Trace Attempt  3	[0.05 s]
0.0.ADcustom7: Trace Attempt  4	[0.05 s]
0.0.Tri:    0.00" ---- Launching main thread ----
0.0.ADcustom7: Trace Attempt  5	[0.05 s]
0.0.ADcustom7: Trace Attempt  1	[0.06 s]
0.0.ADcustom7: Trace Attempt  2	[0.06 s]
0.0.ADcustom7: Trace Attempt  3	[0.06 s]
0.0.ADcustom7: Trace Attempt  4	[0.06 s]
0.0.ADcustom7: Trace Attempt  1	[0.07 s]
0.0.ADcustom7: Trace Attempt  2	[0.07 s]
0.0.ADcustom7: Trace Attempt  3	[0.07 s]
0.0.ADcustom7: Trace Attempt  4	[0.07 s]
0.0.AMcustom3: Trace Attempt  1	[0.09 s]
0.0.AMcustom3: Trace Attempt  2	[0.09 s]
0.0.AMcustom3: Trace Attempt  3	[0.09 s]
0.0.AMcustom3: Trace Attempt  4	[0.09 s]
0.0.AMcustom3: Trace Attempt  5	[0.09 s]
0.0.ADcustom7: Trace Attempt  1	[0.09 s]
0.0.ADcustom7: Trace Attempt  2	[0.09 s]
0.0.ADcustom7: Trace Attempt  3	[0.09 s]
0.0.ADcustom7: Trace Attempt  4	[0.09 s]
0.0.Tri:    0.10" ---- Launching abstraction thread ----
0.0.Tri:    0.10" ---- Launching multi-phase simplification thread ----
0.0.Tri:    0.13" ---- Launching liveness simplification thread ----
0.0.ADcustom7: Trace Attempt  1	[0.19 s]
0.0.ADcustom7: Trace Attempt  2	[0.19 s]
0.0.ADcustom7: Trace Attempt  3	[0.19 s]
0.0.ADcustom7: Trace Attempt  4	[0.19 s]
0.0.ADcustom7: Trace Attempt  5	[0.19 s]
0.0.ADcustom7: Trace Attempt  1	[0.19 s]
0.0.ADcustom7: Trace Attempt  2	[0.19 s]
0.0.ADcustom7: Trace Attempt  3	[0.19 s]
0.0.ADcustom7: Trace Attempt  4	[0.19 s]
0.0.ADcustom7: Trace Attempt  1	[0.20 s]
0.0.ADcustom7: Trace Attempt  2	[0.20 s]
0.0.ADcustom7: Trace Attempt  3	[0.20 s]
0.0.ADcustom7: Trace Attempt  4	[0.20 s]
0.0.ADcustom7: Trace Attempt  1	[0.23 s]
0.0.ADcustom7: Trace Attempt  2	[0.23 s]
0.0.ADcustom7: Trace Attempt  3	[0.23 s]
0.0.ADcustom7: Trace Attempt  4	[0.23 s]
0.0.ADcustom7: Trace Attempt  1	[0.33 s]
0.0.ADcustom7: Trace Attempt  2	[0.33 s]
0.0.ADcustom7: Trace Attempt  3	[0.33 s]
0.0.ADcustom7: Trace Attempt  4	[0.33 s]
0.0.AMcustom3: Trace Attempt  1	[0.41 s]
0.0.AMcustom3: Trace Attempt  2	[0.41 s]
0.0.AMcustom3: Trace Attempt  3	[0.41 s]
0.0.AMcustom3: Trace Attempt  4	[0.41 s]
0.0.AMcustom3: Trace Attempt  5	[0.41 s]
0.0.ADcustom7: Trace Attempt  1	[0.89 s]
0.0.ADcustom7: Trace Attempt  2	[0.89 s]
0.0.ADcustom7: Trace Attempt  3	[0.89 s]
0.0.ADcustom7: Trace Attempt  4	[0.89 s]
0.0.ADcustom7: Trace Attempt  5	[0.89 s]
0.0.ADcustom7: Trace Attempt  1	[0.89 s]
0.0.ADcustom7: Trace Attempt  2	[0.89 s]
0.0.ADcustom7: Trace Attempt  3	[0.89 s]
0.0.ADcustom7: Trace Attempt  4	[0.89 s]
0.0.ADcustom7: Trace Attempt  1	[0.90 s]
0.0.ADcustom7: Trace Attempt  2	[0.90 s]
0.0.ADcustom7: Trace Attempt  3	[0.90 s]
0.0.ADcustom7: Trace Attempt  4	[0.90 s]
0.0.ADcustom7: Trace Attempt  1	[0.93 s]
0.0.ADcustom7: Trace Attempt  2	[0.93 s]
0.0.ADcustom7: Trace Attempt  3	[0.93 s]
0.0.ADcustom7: Trace Attempt  4	[0.93 s]
0.0.Tri:    0.90" Simplification phase 1 complete
0.0.AMcustom3: Requesting engine job to terminate
0.0.Tri: Requesting engine job to terminate
0.0.M: Requesting engine job to terminate
0.0.ADcustom7: Requesting engine job to terminate
0.0.Hp: Requesting engine job to terminate
0.0.Ht: Requesting engine job to terminate
INFO (IPF144): 0: Initiating shutdown of proof [185.49 s]
0.0.Tri: A proof was found: No trace exists. [0.99 s]
INFO (IPF057): 0.0.Tri: The property "GRAY.p1" was proven in 0.99 s.
0.0.ADcustom7: Trace Attempt 23	[0.98 s]
0.0.ADcustom7: Stopped processing property "GRAY.p1"	[1.01 s].
0.0.ADcustom7: All properties determined. [1.01 s]
0.0.AMcustom3: Trace Attempt 78	[1.00 s]
0.0.AMcustom3: Stopped processing property "GRAY.p1"	[1.01 s].
0.0.AMcustom3: All properties determined. [1.02 s]
0.0.ADcustom7: Exited with Success (@ 185.50 s)
0: ProofGrid usable level: 0
0.0.AMcustom3: Exited with Success (@ 185.50 s)
0.0.M: Trace Attempt 148	[2.91 s]
0.0.M: Stopped processing property "GRAY.p1"	[2.91 s].
0.0.M: All properties determined. [2.92 s]
0.0.M: Exited with Success (@ 185.51 s)
0.0.Hp: Trace Attempt 4475	[185.43 s]
0.0.Hp: All properties determined. [185.54 s]
0.0.Tri: Stopped processing property "GRAY.p1"	[1.19 s].
0.0.Tri: All properties determined. [1.20 s]
0.0.Tri: Exited with Success (@ 185.71 s)
0.0.Hp: Exited with Success (@ 185.72 s)
0.0.Ht: Trace Attempt 8463	[185.44 s]
0.0.Ht: All properties determined. [186.93 s]
0.0.Ht: Exited with Success (@ 186.99 s)
0: --------------------------------------------------------------
ProofGrid Summary (utilization 99.93 %)
--------------------------------------------------------------
     engines started                               :    14
     engine jobs started                           :     7
     jobs where 1 minute load exceeded core count  :     6

    Average time in state (seconds)
    ------------------------------------------------------
    Engine  Pending     Running        Dead    Utilization
    ------------------------------------------------------
     Hp        0.03      185.49        0.00       99.98 %
     Ht        0.03      185.46        0.00       99.98 %
     Oh        0.04        0.00        0.00        2.82 %
    AMcustom3        0.04      185.45        0.00       99.98 %
    Tri        0.06      184.77        0.00       99.97 %
      M        0.06      185.22        0.00       99.97 %
    ADcustom7        0.41        3.96        0.00       90.63 %
    all        0.10      132.91        0.00       99.93 %

    Total time in state (seconds)
    -----------------------------------------
            Pending     Running        Dead  
    -----------------------------------------
               0.67      930.36        0.00

    Data read    : 6.82 MiB
    Data written : 4.28 kiB

0: All pending notifications were processed.
INFO (IPF059): 0: Completed proof on task: "<embedded>"

==============================================================
SUMMARY
==============================================================
           Properties Considered              : 1
                 assertions                   : 1
                  - proven                    : 1 (100%)
                  - bounded_proven (user)     : 0 (0%)
                  - bounded_proven (auto)     : 0 (0%)
                  - marked_proven             : 0 (0%)
                  - cex                       : 0 (0%)
                  - ar_cex                    : 0 (0%)
                  - undetermined              : 0 (0%)
                  - unknown                   : 0 (0%)
                  - error                     : 0 (0%)
                 covers                       : 0
                  - unreachable               : 0
                  - bounded_unreachable (user): 0
                  - covered                   : 0
                  - ar_covered                : 0
                  - undetermined              : 0
                  - unknown                   : 0
                  - error                     : 0
proven
[<embedded>] % exit -force
[<embedded>] % INFO (IPL005): Received request to exit from the console.
INFO: Waiting for proof threads to stop...
INFO: Proof threads stopped.
INFO (IPL018): The peak resident set memory use for this session was 1.838 GB.
INFO (IPL014): Waiting for the Tcl-thread to exit.
INFO (IPL015): The Tcl-thread exited with status 0.
INFO (IPL016): Exiting the analysis session with status 0.
Finished 1_gray_5.tcl successfully
