Jasper Apps 2024.06p002 64 bits 2024.09.02 16:28:38 UTC

Any disclosure about the Cadence Design Systems software or its use
model to any third party violates the written Non-Disclosure Agreement
between Cadence Design Systems, Inc. and the customer.

THIS SOFTWARE CONTAINS CONFIDENTIAL INFORMATION AND TRADE SECRETS OF
CADENCE DESIGN SYSTEMS, INC. USE, DISCLOSURE, OR REPRODUCTION IS
PROHIBITED WITHOUT THE PRIOR EXPRESS WRITTEN PERMISSION OF CADENCE
DESIGN SYSTEMS, INC.

Copyright (C) 2000-2024 Cadence Design Systems, Inc. All Rights
Reserved.  Unpublished -- rights reserved under the copyright laws of
the United States.

This product includes software developed by others and redistributed
according to license agreement. See doc/third_party_readme.txt for
further details.

RESTRICTED RIGHTS LEGEND

Use, duplication, or disclosure by the Government is subject to
restrictions as set forth in subparagraph (c) (1) (ii) of the Rights in
Technical Data and Computer Software clause at DFARS 252.227-7013 or
subparagraphs (c) (1) and (2) of Commercial Computer Software -- Restricted
Rights at 48 CFR 52.227-19, as applicable.


                          Cadence Design Systems, Inc.
                          2655 Seely Avenue
                          San Jose, CA 95134
                          Phone: 408.943.1234

For technical assistance visit http://support.cadence.com.

Jasper Apps Analysis Session - /users/rompel/jasper_executions/liveness/jgprojects/1_i2c_11/sessionLogs/session_0

WARNING (WG017): [session]: The system's locale is "ANSI_X3.4-1968", which is not UTF-8. Non-ASCII characters might not be handled correctly.
WARNING (WG017): [jg_console]: The system's locale is "ANSI_X3.4-1968", which is not UTF-8. Non-ASCII characters might not be handled correctly.
INFO: successfully checked out license "jasper_fao".
INFO: reading configuration file "/users/rompel/.config/cadence/jasper.conf".
% analyze -sv09 ../1_i2c_11.sv
[-- (VERI-1482)] Analyzing Verilog file '/tools/cadence2425/JASPER/jasper_2024.06p002/lib/verilog/packages/std/std.sv' into library 'std'
[-- (VERI-1482)] Analyzing Verilog file '../1_i2c_11.sv'
% elaborate -bbox_mul 1000000 -bbox_div 1000000 -bbox_mod 1000000 -bbox_a 1000000
[INFO (HIER-8002)] ../1_i2c_11.sv(43): Disabling old hierarchical reference handler
[INFO (VERI-1018)] ../1_i2c_11.sv(1): compiling module 'i2cStrech'
[WARN (VERI-1209)] ../1_i2c_11.sv(15): expression size 32 truncated to fit in target size 15
[INFO (VERI-8005)] ../1_i2c_11.sv(6): Unintentional sequential element inferred for stretch read before write using blocking assignment
[INFO (VERI-8005)] ../1_i2c_11.sv(4): Unintentional sequential element inferred for cnt read before write using blocking assignment
[INFO (VERI-8005)] ../1_i2c_11.sv(5): Unintentional sequential element inferred for scl_clk read before write using blocking assignment
[INFO (VERI-8005)] ../1_i2c_11.sv(1): Unintentional sequential element inferred for data_clk read before write using blocking assignment
[INFO (VERI-8005)] ../1_i2c_11.sv(1): Unintentional sequential element inferred for switch_range read before write using blocking assignment
INFO (ISW003): Top module name is "i2cStrech".
INFO (INL208): Elaboration synthesis summary:
  Number of synthesized netlists          1 (0 packages)
  Single run mode                         On
  Pipeline                                On (1 pipelined netlists)
  Late hierarchical reference connection  On
  Number of analyzed Verilog modules      1 (1 synthesized)
  Number of analyzed VHDL entities        0 (0 synthesized)
INFO (INL003): Clearing all state information (assumes, stopats, and so forth).
i2cStrech
[<embedded>] % reset rst
INFO (IPM031): Clearing proof results of all properties.
INFO (IRS006): Current reset condition is "rst".
[<embedded>] % clock clk
[<embedded>] % prove -all
Ncustom1: Custom engine code is hT3Ng7hPPfiYQOTDZ3qhYOwGAM51eA+J/FjkM5shLioAsqhgLR4Ft+O1BuKG6ilQ83B9tLXSl+CwjiTMAQA
Bcustom2: Custom engine code is hT3Nm7hPr1Vp3Di1Ra2USNIGL4JypRnLKLAdF6JAyuavO2JfGCiY9OZJhcAcOUnLx5xwNdhILGrAWX9s+z2WDkKwNR7tAfClBEjRFVQeq6DU54boFgEA
AMcustom3: Custom engine code is hT3Ng7hP/feYQOTDZ3qhYOwGAM51eA+J/FjkM5shLioAsqhgLR4Ft+O1BuKG6ilQ83B9tLXSmmqwm7g9AQA
Mpcustom4: Custom engine code is hT3NZbhP9fmY2AbBQnsjfOxn6c+6e6yL+/e8fZFmaQrnlgEA
INFO (IPF036): Starting proof on task: "<embedded>", 2 properties to prove with 0 already proven/unreachable
INFO (IRS029): Starting reset analysis: phase 1 of 4.
INFO (IRS030): Running reset analysis: phase 2 of 4.
INFO (IRS031): Running reset analysis: phase 3 of 4.
INFO (IRS020): Starting the reset analysis simulation with a limit of 100 iterations (phase 4 of 4).
INFO (IRS024): Reset iterations 0 to 4 analyzed.
INFO (IRS018): Reset analysis simulation executed for 3 iterations. Assigned values for 19 of 19 design flops, 0 of 0 design latches, 4 of 4 internal elements.
INFO (IRS039): Reset analysis complete.
INFO (IPF031): Settings used for proof thread 0:
    orchestration                 = on
    time_limit                    = 86400s
    per_property_time_limit       = 1s * 10 ^ scan
    engine_mode                   = auto
    proofgrid_per_engine_max_jobs = 1
    max engine jobs               = auto
    proofgrid_mode                = local
    proofgrid_restarts            = 10
0: Using multistage preprocessing
AMcustom5: Custom engine code is hT3N1rhP11/52HrFRS21ROp2LOjVTgPvT8L8BGXHgLhaIuqtT4nARFjUqrBL+7pLmaTOzBepZW/Jm8SSrHDybSQtoNiO3y43wk+dEoWlsZizu97Fih6O6lPVG/LpWP5SsUPwlGagLNa1FKEFvwVXyX7//8prySbvSxIHXr5er+z4RAEA
0: Starting reduce
Ncustom6: Custom engine code is hT3OXrhPByJp3TrFSTLhUmMH4KVtJgmTCnNDF46yMXOKY48m4LS5nE7yBzFjA7kDuwO/GhGUpEPiky3p3wmPn3dJZHxFMsafSoObRzSC+tn7sEY0WbTdZ/FV4hL3MYH/b1CIUvXSWR4wqEoVLsmMOD4xIPT4lI1LO6ZCO7PnnWQuLwetnvKlrXx6wCW/A+x+enqslg1YPobi4wEF/EvbzOvcTYdJvl2s4H2yZg2b2ofAVN5WvhWk1HoBAA
ADcustom7: Custom engine code is hT3Nv7hPv1752HrFRa2kROx2f/ECJeZB2AZsLdlO8VwmIuqtT4nIDFXclhg+O+o+DMmQCekbheGk0kK28laA9gaOFDXsQp29J3X615HY1IPHJWd6FUFvCHjO+p1k652b5JJvZlShNpGlGSXAiQe/mEAj6tEBAA
Tricustom8: Custom engine code is hT3Nu7hPt1752DvFRa0kNDiyIV97VyejwM9C/jCLJjdPvusZONHY42VYUy0Q1ZotnhcVtNc56tJ5wbxv6V2+XpdsaSlHck5vfnbYjdwj1OECy9U+7oSQ0SZE3g5ayD+Phuh4odCJTjeKa2k4elM9ldQfkAEA
Gcustom9: Custom engine code is hT3NibhPDfeYQADBZnYcglOvK9Pfd7EOeniIqP8jNsyIqInncipMGcUXqAadachREE9F2PwhBUZUNw5kHnd4JdXkamORRgEA
C2custom10: Custom engine code is hT3NirhPjfWYQADBZnYcglOvK9Pfd7EOeniIqP8jNsyIqInncgkrYMMXCYbdK0dUjZIF9d4cJ0rHoBDjwVLBKuG86XYVV00BAA
AGcustom11: Custom engine code is hT3NirhP/fmYQADBZnYcglOvK9Pfd7EOeniIqP8jNsyIqInnckcwYMMXCYbdK0dUjZIF9d4cJ0rHoBDjwVLBKuHEZnZByh0BAA
Bcustom12: Custom engine code is hT3NjrhPDfiYQADBZnYcglOvK9PfWxFtenjIyBqfrgr7if/jL/yPOuK1BAflEcW0DxNH2eDIoezN2gxlQFg81RZtiWXh7aiTAidvAQA
Ncustom13: Custom engine code is hT3NR7hPByFp3TrFSTLhUmMH4KWtJglTyV/c51BHEeZWamnJv767nE6PCak26bd3gf3XGN3rIRheufhDieCJQVISo+gNYUKhiUedBKGtsP/a18svAnlMJZudHxDFwK5ufsyoxsIyiAeSY2oi3tEuoDHr5gw42DFKAG3PqO3CEsl8Azzdt3pl5nGA1Ifv2H02eYsFzWb/nfp8PMb3F0krE/EgBcm8TD9Div8BAA
0: Finished reduce in 0s
Tricustom14: Custom engine code is hT3Nu7hP3fiYQADBZnYcglNHp9bfd7EOeniIqP/ji8sGLQu8yhsFO+wxJ+O+R0bU8g/IewXFomyos+viQnWc2xYNYmMqpo3i40O7DaZR7qfp4YqNx26KRvQ/qx0BAA
0.0.PRE: Performing Proof Simplification...
0.0.N: clocks: 1, declared: 1, looping: 0, posedge: 1, negedge: 0, noedge: 0, bothedge: 0
0.0.N: Proof Simplification Iteration 1	[0.00 s]
0.0.PRE: A trace with 1 cycles was found. [0.00 s]
INFO (IPF047): 0.0.PRE: The cover property "i2cStrech.p1:precondition1" was covered in 1 cycles in 0.00 s.
0.0.N: Proof Simplification Iteration 2	[0.06 s]
0.0.N: Proof Simplification Iteration 3	[0.06 s]
0.0.PRE: A proof was found: No trace exists. [0.00 s]
INFO (IPF057): 0.0.PRE: The property ":noDeadEnd" was proven in 0.00 s.
    Use check_assumptions -show -dead_end to show this property in the property table.
0.0.PRE: A proof was found: No trace exists. [0.00 s]
INFO (IPF057): 0.0.PRE: The property ":noConflict" was proven in 0.00 s.
    Use check_assumptions -show to show this property in the property table.
INFO (IPF047): 0.0.PRE: The cover property ":live" was covered in 1 cycles in 0.00 s.
    Use check_assumptions -show -live to show this property in the property table.
0.0.PRE: Proof Simplification completed in 0.06 s
0: About to start ProofGrid in its own thread with a limit of 10000 pending notifications and a limit of 10 traces.
0: =============================== ProofGrid start ===============================
0: ProofGrid usable level: 1
0: Initial ProofGrid level: 1
0: ProofGrid is starting event handling
0.0.Hp: Proofgrid shell started at 10372@vlsi-ria85(local) jg_10261_vlsi-ria85_1
0.0.N: Proofgrid shell started at 10371@vlsi-ria85(local) jg_10261_vlsi-ria85_1
0.0.N: clocks: 1, declared: 1, looping: 0, posedge: 1, negedge: 0, noedge: 0, bothedge: 0
0.0.N: Last scan. Per property time limit: 0s
0.0.N: Starting proof for property "i2cStrech.p1"	[0.00 s].
0.0.Hp: clocks: 1, declared: 1, looping: 0, posedge: 1, negedge: 0, noedge: 0, bothedge: 0
0.0.N: Trace Attempt  1	[0.00 s]
0.0.N: Trace Attempt  2	[0.00 s]
0.0.N: Trace Attempt  2	[0.00 s]
0.0.N: Trace Attempt  3	[0.00 s]
0.0.Hp: Last scan. Per property time limit: 0s
0.0.Hp: Trace Attempt  1	[0.00 s]
0.0.Hp: Trace Attempt  2	[0.00 s]
0.0.N: Trace Attempt  3	[0.00 s]
0.0.Hp: Trace Attempt  3	[0.00 s]
0.0.Hp: Trace Attempt  4	[0.00 s]
0.0.N: Trace Attempt  4	[0.00 s]
0.0.Hp: Trace Attempt  5	[0.00 s]
0.0.N: Trace Attempt  5	[0.00 s]
0.0.N: Trace Attempt  1	[0.01 s]
0.0.N: Trace Attempt  2	[0.01 s]
0.0.N: Trace Attempt  3	[0.01 s]
0.0.N: Trace Attempt  4	[0.02 s]
0.0.N: Trace Attempt  5	[0.02 s]
0.0.Ht: Proofgrid shell started at 10435@vlsi-ria85(local) jg_10261_vlsi-ria85_1
0.0.Bm: Proofgrid shell started at 10436@vlsi-ria85(local) jg_10261_vlsi-ria85_1
0.0.Mpcustom4: Proofgrid shell started at 10437@vlsi-ria85(local) jg_10261_vlsi-ria85_1
0.0.L: Proofgrid shell started at 10439@vlsi-ria85(local) jg_10261_vlsi-ria85_1
0.0.B: Proofgrid shell started at 10440@vlsi-ria85(local) jg_10261_vlsi-ria85_1
0.0.Mpcustom4: clocks: 1, declared: 1, looping: 0, posedge: 1, negedge: 0, noedge: 0, bothedge: 0
0.0.Mpcustom4: Ignoring liveness properties
0.0.Mpcustom4: All properties either determined or skipped. [0.00 s]
0.0.Mpcustom4: Exited with Success (@ 0.04 s)
0.0.Mpcustom4: Completed, Restart ignored.
0.0.B: clocks: 1, declared: 1, looping: 0, posedge: 1, negedge: 0, noedge: 0, bothedge: 0
0.0.B: Last scan. Per property time limit: 0s
0.0.B: Starting proof for property "i2cStrech.p1"	[0.00 s].
0.0.B: Trace Attempt  1	[0.00 s]
0.0.B: Trace Attempt  2	[0.00 s]
0.0.B: Trace Attempt  3	[0.00 s]
0.0.B: Trace Attempt  4	[0.00 s]
0.0.B: Trace Attempt  5	[0.00 s]
0.0.Ht: clocks: 1, declared: 1, looping: 0, posedge: 1, negedge: 0, noedge: 0, bothedge: 0
0.0.Ht: Last scan. Per property time limit: 0s
0.0.Ht: Trace Attempt  1	[0.00 s]
0.0.Ht: Trace Attempt  2	[0.00 s]
0.0.Ht: Trace Attempt  3	[0.00 s]
0.0.Ht: Trace Attempt  4	[0.00 s]
0.0.Ht: Trace Attempt  5	[0.00 s]
0.0.Bm: clocks: 1, declared: 1, looping: 0, posedge: 1, negedge: 0, noedge: 0, bothedge: 0
0.0.Bm: Ignoring liveness properties
0.0.Bm: Last scan. Per property time limit: 0s
0.0.Bm: Trace Attempt  1	[0.00 s]
0.0.Bm: Trace Attempt  2	[0.00 s]
0.0.Bm: Trace Attempt  3	[0.00 s]
0.0.Bm: Trace Attempt  4	[0.00 s]
0.0.Bm: Trace Attempt  5	[0.00 s]
0.0.Oh: Proofgrid shell started at 10438@vlsi-ria85(local) jg_10261_vlsi-ria85_1
0.0.L: clocks: 1, declared: 1, looping: 0, posedge: 1, negedge: 0, noedge: 0, bothedge: 0
0.0.L: Using trace diversification with seed 1 (0.05)
0.0.L: Using LRU state removal heuristic
0.0.L: Ignoring liveness properties
0.0.L: All properties either determined or skipped. [0.01 s]
0.0.AM: Proofgrid shell started at 10441@vlsi-ria85(local) jg_10261_vlsi-ria85_1
0.0.L: Exited with Success (@ 0.06 s)
0.0.L: Completed, Restart ignored.
0.0.Oh: clocks: 1, declared: 1, looping: 0, posedge: 1, negedge: 0, noedge: 0, bothedge: 0
0.0.AM: clocks: 1, declared: 1, looping: 0, posedge: 1, negedge: 0, noedge: 0, bothedge: 0
0.0.Oh: Reached length limit (2147483647) [0.00 s]
0.0.AM: Last scan. Per property time limit: 0s
0.0.AM: Starting proof for property "i2cStrech.p1"	[0.00 s].
0.0.AM: Trace Attempt  1	[0.00 s]
0.0.AM: Trace Attempt  2	[0.00 s]
0.0.AM: Trace Attempt  3	[0.00 s]
0.0.AM: Trace Attempt  4	[0.00 s]
0.0.AM: Trace Attempt  5	[0.00 s]
0.0.AM: Trace Attempt  1	[0.00 s]
0.0.AM: Trace Attempt  2	[0.00 s]
0.0.AM: Trace Attempt  3	[0.01 s]
0.0.Oh: Exited with Success (@ 0.07 s)
0.0.AM: Trace Attempt  4	[0.01 s]
0.0.AM: Trace Attempt  5	[0.01 s]
0.0.AM: Trace Attempt  1	[0.04 s]
0.0.AM: Trace Attempt  2	[0.04 s]
0.0.AM: Trace Attempt  3	[0.04 s]
0.0.AM: Trace Attempt  4	[0.04 s]
0.0.AM: Trace Attempt  5	[0.04 s]
0.0.N: Trace Attempt  1	[0.13 s]
0.0.N: Trace Attempt  2	[0.13 s]
0.0.N: Trace Attempt  3	[0.13 s]
0.0.N: Trace Attempt  4	[0.13 s]
0.0.N: Trace Attempt  5	[0.14 s]
0.0.AM: Trace Attempt  1	[0.13 s]
0.0.AM: Trace Attempt  2	[0.13 s]
0.0.AM: Trace Attempt  3	[0.13 s]
0.0.AM: Trace Attempt  4	[0.14 s]
0.0.AM: Trace Attempt  5	[0.14 s]
0.0.N: Trace Attempt  1	[0.58 s]
0.0.N: Trace Attempt  2	[0.58 s]
0.0.N: Trace Attempt  3	[0.58 s]
0.0.AM: Trace Attempt  1	[0.53 s]
0.0.AM: Trace Attempt  2	[0.53 s]
0.0.AM: Trace Attempt  3	[0.53 s]
0.0.N: Trace Attempt  4	[0.58 s]
0.0.N: Trace Attempt  5	[0.58 s]
0.0.AM: Trace Attempt  4	[0.53 s]
0.0.AM: Trace Attempt  5	[0.53 s]
0.0.AM: Trace Attempt  1	[2.11 s]
0.0.AM: Trace Attempt  2	[2.11 s]
0.0.AM: Trace Attempt  3	[2.11 s]
0.0.AM: Trace Attempt  4	[2.11 s]
0.0.AM: Trace Attempt  5	[2.11 s]
0.0.N: Trace Attempt  1	[2.42 s]
0.0.N: Trace Attempt  2	[2.43 s]
0.0.N: Trace Attempt  3	[2.43 s]
0.0.N: Trace Attempt  4	[2.43 s]
0.0.N: Trace Attempt  5	[2.43 s]
0.0.Hp: Trace Attempt 555	[4.01 s]
0.0.Bm: Trace Attempt 1723	[4.00 s]
0.0.Ht: Trace Attempt 1768	[4.00 s]
0.0.B: Trace Attempt 1705	[4.00 s]
0.0.AM: Trace Attempt 202	[6.11 s]
0.0.N: Trace Attempt 175	[6.45 s]
0.0.Hp: Trace Attempt 779	[8.01 s]
0.0.Bm: Trace Attempt 2384	[8.00 s]
0.0.B: Trace Attempt 2360	[8.00 s]
0.0.Ht: Trace Attempt 2383	[8.01 s]
0.0.AM: Trace Attempt  1	[9.14 s]
0.0.AM: Trace Attempt  2	[9.14 s]
0.0.AM: Trace Attempt  3	[9.14 s]
0.0.AM: Trace Attempt  4	[9.14 s]
0.0.AM: Trace Attempt  5	[9.14 s]
0.0.N: Trace Attempt  1	[9.95 s]
0.0.N: Trace Attempt  2	[9.95 s]
0.0.N: Trace Attempt  3	[9.95 s]
0.0.N: Trace Attempt  4	[9.95 s]
0.0.N: Trace Attempt  5	[9.95 s]
0.0.Hp: Trace Attempt 947	[12.02 s]
0.0.B: Trace Attempt 2850	[12.00 s]
0.0.Bm: Trace Attempt 2877	[12.00 s]
0.0.Ht: Trace Attempt 2866	[12.01 s]
0.0.AM: Trace Attempt 202	[13.15 s]
0.0.N: Trace Attempt 174	[13.99 s]
0.0.Hp: Trace Attempt 1092	[16.04 s]
0.0.B: Trace Attempt 3272	[16.01 s]
0.0.Bm: Trace Attempt 3301	[16.01 s]
0.0.Ht: Trace Attempt 3280	[16.02 s]
0.0.AM: Trace Attempt 261	[17.20 s]
0.0.N: Trace Attempt  1	[17.63 s]
0.0.N: Trace Attempt  2	[17.63 s]
0.0.N: Trace Attempt  3	[17.63 s]
0.0.N: Trace Attempt  4	[17.64 s]
0.0.N: Trace Attempt  5	[17.64 s]
0.0.Hp: Trace Attempt 1219	[20.04 s]
0.0.Bm: Trace Attempt 3668	[20.02 s]
0.0.B: Trace Attempt 3640	[20.02 s]
0.0.Ht: Trace Attempt 3640	[20.02 s]
0.0.AM: Trace Attempt 320	[21.23 s]
0.0.N: Trace Attempt 172	[21.66 s]
0.0.Hp: Trace Attempt 1333	[24.05 s]
0.0.Bm: Trace Attempt 4000	[24.02 s]
0.0.B: Trace Attempt 3970	[24.02 s]
0.0.Ht: Trace Attempt 3976	[24.03 s]
0.0.N: Trace Attempt  1	[25.43 s]
0.0.N: Trace Attempt  2	[25.43 s]
0.0.N: Trace Attempt  3	[25.43 s]
0.0.N: Trace Attempt  4	[25.43 s]
0.0.AM: Trace Attempt 363	[25.38 s]
0.0.N: Trace Attempt  5	[25.43 s]
0.0.Bm: Trace Attempt 4312	[28.02 s]
0.0.B: Trace Attempt 4280	[28.03 s]
0.0.Hp: Trace Attempt 1437	[28.08 s]
0.0.Ht: Trace Attempt 4268	[28.04 s]
0.0.N: Trace Attempt 172	[29.47 s]
0.0.AM: Trace Attempt 396	[29.46 s]
0.0.Bm: Trace Attempt 4607	[32.03 s]
0.0.B: Trace Attempt 4576	[32.04 s]
0.0.Ht: Trace Attempt 4546	[32.05 s]
0.0.Hp: Trace Attempt 1535	[32.11 s]
0.0.N: Trace Attempt  1	[33.17 s]
0.0.N: Trace Attempt  2	[33.17 s]
0.0.N: Trace Attempt  3	[33.17 s]
0.0.N: Trace Attempt  4	[33.17 s]
0.0.N: Trace Attempt  5	[33.17 s]
0.0.AM: Trace Attempt 434	[33.54 s]
0.0.Bm: Trace Attempt 4872	[36.03 s]
0.0.B: Trace Attempt 4843	[36.05 s]
0.0.Ht: Trace Attempt 4806	[36.05 s]
0.0.Hp: Trace Attempt 1625	[36.15 s]
0.0.N: Trace Attempt 171	[37.19 s]
0.0.AM: Trace Attempt 477	[37.60 s]
0.0.Bm: Trace Attempt 5114	[40.04 s]
0.0.B: Trace Attempt 5085	[40.05 s]
0.0.Ht: Trace Attempt 5047	[40.05 s]
0.0.Hp: Trace Attempt 1708	[40.18 s]
0.0.N: Trace Attempt  1	[41.04 s]
0.0.N: Trace Attempt  2	[41.04 s]
0.0.N: Trace Attempt  3	[41.04 s]
0.0.N: Trace Attempt  4	[41.04 s]
0.0.N: Trace Attempt  5	[41.04 s]
0.0.AM: Trace Attempt 423	[41.62 s]
0.0.Ht: Trace Attempt 5258	[44.05 s]
0.0.Bm: Trace Attempt 5334	[44.06 s]
0.0.B: Trace Attempt 5306	[44.06 s]
0.0.Hp: Trace Attempt 1784	[44.20 s]
0.0.N: Trace Attempt 172	[45.04 s]
0.0.Ht: Trace Attempt 5459	[48.07 s]
0.0.B: Trace Attempt 5516	[48.07 s]
0.0.Bm: Trace Attempt 5543	[48.07 s]
0.0.AM: Trace Attempt 512	[48.13 s]
0.0.Hp: Trace Attempt 1856	[48.20 s]
0.0.AM: Trace Attempt  1	[48.43 s]
0.0.AM: Trace Attempt  2	[48.43 s]
0.0.AM: Trace Attempt  3	[48.43 s]
0.0.AM: Trace Attempt  4	[48.43 s]
0.0.AM: Trace Attempt  5	[48.43 s]
0.0.N: Trace Attempt  1	[48.68 s]
0.0.N: Trace Attempt  2	[48.68 s]
0.0.N: Trace Attempt  3	[48.68 s]
0.0.N: Trace Attempt  4	[48.68 s]
0.0.N: Trace Attempt  5	[48.68 s]
0.0.Ht: Trace Attempt 5678	[52.08 s]
0.0.Bm: Trace Attempt 5766	[52.08 s]
0.0.B: Trace Attempt 5740	[52.09 s]
0.0.Hp: Trace Attempt 1932	[52.24 s]
0.0.AM: Trace Attempt 175	[52.46 s]
0.0.N: Trace Attempt 172	[52.72 s]
0.0.Ht: Trace Attempt 5893	[56.09 s]
0.0.Bm: Trace Attempt 5979	[56.09 s]
0.0.B: Trace Attempt 5954	[56.10 s]
0.0.Hp: Trace Attempt 2005	[56.30 s]
0.0.N: Trace Attempt  1	[56.47 s]
0.0.N: Trace Attempt  2	[56.48 s]
0.0.N: Trace Attempt  3	[56.48 s]
0.0.N: Trace Attempt  4	[56.48 s]
0.0.N: Trace Attempt  5	[56.48 s]
0.0.AM: Trace Attempt 241	[56.56 s]
0.0.Bm: Trace Attempt 6185	[60.10 s]
0.0.Ht: Trace Attempt 6099	[60.10 s]
0.0.B: Trace Attempt 6161	[60.10 s]
0.0.Hp: Trace Attempt 2074	[60.32 s]
0.0.N: Trace Attempt 172	[60.49 s]
0.0.AM: Trace Attempt 296	[60.59 s]
0.0.Ht: Trace Attempt 6293	[64.10 s]
0.0.Bm: Trace Attempt 6378	[64.11 s]
0.0.B: Trace Attempt 6354	[64.12 s]
0.0.N: Trace Attempt  1	[64.17 s]
0.0.N: Trace Attempt  2	[64.18 s]
0.0.N: Trace Attempt  3	[64.18 s]
0.0.N: Trace Attempt  4	[64.18 s]
0.0.N: Trace Attempt  5	[64.18 s]
0.0.Hp: Trace Attempt 2142	[64.37 s]
0.0.AM: Trace Attempt 342	[64.64 s]
0.0.Ht: Trace Attempt 6481	[68.12 s]
0.0.B: Trace Attempt 6542	[68.13 s]
0.0.Bm: Trace Attempt 6568	[68.13 s]
0.0.N: Trace Attempt 171	[68.21 s]
0.0.Hp: Trace Attempt 2207	[68.38 s]
0.0.AM: Trace Attempt 373	[68.78 s]
0.0.N: Trace Attempt  1	[72.00 s]
0.0.N: Trace Attempt  2	[72.00 s]
0.0.N: Trace Attempt  3	[72.01 s]
0.0.N: Trace Attempt  4	[72.01 s]
0.0.N: Trace Attempt  5	[72.01 s]
0.0.Ht: Trace Attempt 6670	[72.14 s]
0.0.Bm: Trace Attempt 6751	[72.14 s]
0.0.B: Trace Attempt 6725	[72.14 s]
0.0.Hp: Trace Attempt 2270	[72.43 s]
0.0.AM: Trace Attempt 409	[72.88 s]
0.0.N: Trace Attempt 172	[76.02 s]
0.0.Ht: Trace Attempt 6856	[76.15 s]
0.0.Bm: Trace Attempt 6930	[76.16 s]
0.0.B: Trace Attempt 6903	[76.16 s]
0.0.Hp: Trace Attempt 2330	[76.43 s]
0.0.AM: Trace Attempt 448	[76.95 s]
0.0.N: Trace Attempt  1	[79.74 s]
0.0.N: Trace Attempt  2	[79.74 s]
0.0.N: Trace Attempt  3	[79.74 s]
0.0.N: Trace Attempt  4	[79.75 s]
0.0.N: Trace Attempt  5	[79.75 s]
0.0.Bm: Trace Attempt 7101	[80.16 s]
0.0.Ht: Trace Attempt 7034	[80.16 s]
0.0.B: Trace Attempt 7073	[80.18 s]
0.0.Hp: Trace Attempt 2389	[80.47 s]
0.0.AM: Trace Attempt 464	[81.49 s]
0.0.N: Trace Attempt 172	[83.76 s]
0.0.Bm: Trace Attempt 7270	[84.17 s]
0.0.Ht: Trace Attempt 7201	[84.18 s]
0.0.B: Trace Attempt 7241	[84.18 s]
0.0.Hp: Trace Attempt 2448	[84.54 s]
0.0.AM: Trace Attempt 475	[85.84 s]
0.0.N: Trace Attempt  1	[87.47 s]
0.0.N: Trace Attempt  2	[87.47 s]
0.0.N: Trace Attempt  3	[87.47 s]
0.0.N: Trace Attempt  4	[87.47 s]
0.0.N: Trace Attempt  5	[87.47 s]
0.0.Bm: Trace Attempt 7431	[88.18 s]
0.0.Ht: Trace Attempt 7370	[88.18 s]
0.0.B: Trace Attempt 7401	[88.19 s]
0.0.Hp: Trace Attempt 2504	[88.54 s]
0.0.AM: Trace Attempt 489	[90.00 s]
0.0.N: Trace Attempt 172	[91.48 s]
0.0.Bm: Trace Attempt 7590	[92.19 s]
0.0.Ht: Trace Attempt 7527	[92.20 s]
0.0.B: Trace Attempt 7559	[92.21 s]
0.0.Hp: Trace Attempt 2560	[92.60 s]
0.0.AM: Trace Attempt 508	[94.22 s]
0.0.N: Trace Attempt  1	[95.19 s]
0.0.N: Trace Attempt  2	[95.19 s]
0.0.N: Trace Attempt  3	[95.19 s]
0.0.N: Trace Attempt  4	[95.19 s]
0.0.N: Trace Attempt  5	[95.19 s]
0.0.Bm: Trace Attempt 7742	[96.19 s]
0.0.Ht: Trace Attempt 7681	[96.21 s]
0.0.B: Trace Attempt 7710	[96.22 s]
0.0.Hp: Trace Attempt 2613	[96.63 s]
0.0.AM: Trace Attempt 526	[98.37 s]
0.0.N: Trace Attempt 172	[99.22 s]
0.0.Bm: Trace Attempt 7892	[100.21 s]
0.0.Ht: Trace Attempt 7836	[100.22 s]
0.0.B: Trace Attempt 7859	[100.23 s]
0.0.Hp: Trace Attempt 2666	[100.69 s]
0.0.AM: Trace Attempt 540	[102.38 s]
0.0.N: Trace Attempt  1	[103.05 s]
0.0.N: Trace Attempt  2	[103.05 s]
0.0.N: Trace Attempt  3	[103.05 s]
0.0.N: Trace Attempt  4	[103.05 s]
0.0.N: Trace Attempt  5	[103.06 s]
0.0.Ht: Trace Attempt 7988	[104.22 s]
0.0.Bm: Trace Attempt 8038	[104.22 s]
0.0.B: Trace Attempt 8004	[104.25 s]
0.0.Hp: Trace Attempt 2717	[104.75 s]
0.0.AM: Trace Attempt 554	[106.62 s]
0.0.N: Trace Attempt 172	[107.06 s]
0.0.Bm: Trace Attempt 8182	[108.23 s]
0.0.Ht: Trace Attempt 8138	[108.25 s]
0.0.B: Trace Attempt 8147	[108.27 s]
0.0.Hp: Trace Attempt 2767	[108.75 s]
0.0.AM: Trace Attempt 567	[110.70 s]
0.0.N: Trace Attempt 257	[111.19 s]
0.0.N: Trace Attempt  1	[111.20 s]
0.0.N: Trace Attempt  2	[111.20 s]
0.0.N: Trace Attempt  3	[111.20 s]
0.0.N: Trace Attempt  4	[111.20 s]
0.0.N: Trace Attempt  5	[111.20 s]
0.0.Bm: Trace Attempt 8325	[112.23 s]
0.0.Ht: Trace Attempt 8277	[112.25 s]
0.0.B: Trace Attempt 8288	[112.27 s]
0.0.Hp: Trace Attempt 2816	[112.77 s]
0.0.AM: Trace Attempt 578	[114.89 s]
0.0.N: Trace Attempt 176	[115.25 s]
0.0.Bm: Trace Attempt 8472	[116.23 s]
0.0.Ht: Trace Attempt 8424	[116.26 s]
0.0.B: Trace Attempt 8434	[116.28 s]
0.0.Hp: Trace Attempt 2864	[116.81 s]
0.0.AM: Trace Attempt 590	[119.07 s]
0.0.N: Trace Attempt 238	[119.37 s]
0.0.Bm: Trace Attempt 8615	[120.26 s]
0.0.Ht: Trace Attempt 8562	[120.28 s]
0.0.B: Trace Attempt 8576	[120.29 s]
0.0.Hp: Trace Attempt 2911	[120.83 s]
0.0.AM: Trace Attempt 604	[123.34 s]
0.0.N: Trace Attempt 284	[123.44 s]
0.0.Bm: Trace Attempt 8754	[124.28 s]
0.0.Ht: Trace Attempt 8702	[124.30 s]
0.0.B: Trace Attempt 8714	[124.30 s]
0.0.Hp: Trace Attempt 2957	[124.83 s]
0.0.AM: Trace Attempt 617	[127.37 s]
0.0.N: Trace Attempt 332	[127.46 s]
0.0.Bm: Trace Attempt 8889	[128.30 s]
0.0.Ht: Trace Attempt 8837	[128.32 s]
0.0.B: Trace Attempt 8848	[128.32 s]
0.0.Hp: Trace Attempt 3003	[128.91 s]
0.0.AM: Trace Attempt 628	[131.46 s]
0.0.N: Trace Attempt 366	[131.56 s]
0.0.Ht: Trace Attempt 8974	[132.34 s]
0.0.B: Trace Attempt 8982	[132.35 s]
0.0.Hp: Trace Attempt 3048	[132.93 s]
0.0.N: Trace Attempt 403	[135.63 s]
0.0.AM: Trace Attempt 640	[135.74 s]
0.0.Ht: Trace Attempt 9049	[136.40 s]
0.0.Hp: Trace Attempt 3092	[136.98 s]
0.0.N: Trace Attempt 440	[139.65 s]
0.0.AM: Trace Attempt 651	[139.93 s]
0.0.Ht: Trace Attempt 9109	[140.43 s]
0.0.Hp: Trace Attempt 3136	[141.04 s]
0.0.AM: Trace Attempt 661	[143.94 s]
0.0.N: Trace Attempt 456	[144.01 s]
0.0.Ht: Trace Attempt 9167	[144.47 s]
0.0.Hp: Trace Attempt 3180	[145.12 s]
0.0.N: Trace Attempt 461	[148.27 s]
0.0.AM: Trace Attempt 671	[148.29 s]
0.0.Ht: Trace Attempt 9224	[148.53 s]
0.0.Hp: Trace Attempt 3221	[149.14 s]
0.0.AM: Trace Attempt 680	[152.49 s]
0.0.Ht: Trace Attempt 9279	[152.58 s]
0.0.N: Trace Attempt 463	[153.05 s]
0.0.N: Trace Attempt  1	[153.07 s]
0.0.N: Trace Attempt  2	[153.07 s]
0.0.N: Trace Attempt  3	[153.07 s]
0.0.N: Trace Attempt  4	[153.07 s]
0.0.N: Trace Attempt  5	[153.07 s]
0.0.Hp: Trace Attempt 3262	[153.14 s]
0.0.Ht: Trace Attempt 9335	[156.59 s]
0.0.AM: Trace Attempt 689	[156.72 s]
0.0.N: Trace Attempt 176	[157.09 s]
0.0.Hp: Trace Attempt 3304	[157.15 s]
0.0.Ht: Trace Attempt 9392	[160.59 s]
0.0.N: Trace Attempt 238	[161.15 s]
0.0.AM: Trace Attempt 698	[161.10 s]
0.0.Hp: Trace Attempt 3345	[161.17 s]
0.0.Bm: Trace Attempt 9001	[161.39 s]
0.0.B: Trace Attempt 9001	[162.27 s]
0.0.Ht: Trace Attempt 9449	[164.65 s]
0.0.N: Trace Attempt 284	[165.19 s]
0.0.Hp: Trace Attempt 3386	[165.23 s]
0.0.Bm: Trace Attempt 9109	[165.40 s]
0.0.AM: Trace Attempt 708	[165.52 s]
0.0.B: Trace Attempt 9108	[166.28 s]
0.0.Ht: Trace Attempt 9504	[168.67 s]
0.0.N: Trace Attempt 333	[169.21 s]
0.0.Hp: Trace Attempt 3426	[169.25 s]
0.0.Bm: Trace Attempt 9217	[169.40 s]
0.0.AM: Trace Attempt 718	[169.66 s]
0.0.B: Trace Attempt 9213	[170.28 s]
0.0.Ht: Trace Attempt 9558	[172.68 s]
0.0.N: Trace Attempt 366	[173.22 s]
0.0.Hp: Trace Attempt 3466	[173.31 s]
0.0.Bm: Trace Attempt 9293	[173.41 s]
0.0.AM: Trace Attempt 728	[174.05 s]
0.0.B: Trace Attempt 9291	[174.28 s]
0.0.Ht: Trace Attempt 9612	[176.71 s]
0.0.N: Trace Attempt 404	[177.24 s]
0.0.Hp: Trace Attempt 3505	[177.36 s]
0.0.Bm: Trace Attempt 9372	[177.44 s]
0.0.AM: Trace Attempt 738	[178.23 s]
0.0.B: Trace Attempt 9369	[178.28 s]
0.0.Ht: Trace Attempt 9665	[180.78 s]
0.0.N: Trace Attempt 437	[180.72 s]
0.0.N: Stopped processing property "i2cStrech.p1"	[180.99 s].
0.0.N: Morphing to Ncustom1
0.0.N: All properties determined. [0.00 s]
0.0.N: Exited with Success (@ 0.00 s)
0.0.Ncustom1: clocks: 1, declared: 1, looping: 0, posedge: 1, negedge: 0, noedge: 0, bothedge: 0
0.0.Ncustom1: Starting proof for property "i2cStrech.p1"	[0.00 s].
0.0.Tri: Proofgrid shell started at 11121@vlsi-ria85(local) jg_10261_vlsi-ria85_1
0.0.Ncustom1: Trace Attempt 462	[0.06 s]
0.0.Tri: clocks: 1, declared: 1, looping: 0, posedge: 1, negedge: 0, noedge: 0, bothedge: 0
0.0.Tri: Last scan. Per property time limit: 0s
0.0.Tri: Starting proof for property "i2cStrech.p1"	[0.00 s].
0.0.Tri: Trace Attempt  1	[0.00 s]
0.0.B: Trace Attempt 9415	[180.85 s]
0.0.B: Stopped processing property "i2cStrech.p1"	[181.04 s].
0.0.B: Morphing to Bcustom2
0.0.B: All properties determined. [0.00 s]
0.0.B: Exited with Success (@ 0.00 s)
0.0.D: Proofgrid shell started at 11126@vlsi-ria85(local) jg_10261_vlsi-ria85_1
0.0.Bcustom2: clocks: 1, declared: 1, looping: 0, posedge: 1, negedge: 0, noedge: 0, bothedge: 0
0.0.Bcustom2: Starting proof for property "i2cStrech.p1"	[0.00 s].
0.0.Bcustom2: Trace Attempt  1	[0.00 s]
0.0.Bcustom2: Trace Attempt  2	[0.00 s]
0.0.Bcustom2: Trace Attempt  1	[0.00 s]
0.0.Bcustom2: Trace Attempt  2	[0.00 s]
0.0.Bcustom2: Trace Attempt  3	[0.00 s]
0.0.Bcustom2: Trace Attempt  4	[0.00 s]
0.0.Bcustom2: Trace Attempt  5	[0.00 s]
0.0.Bcustom2: Trace Attempt  1	[0.00 s]
0.0.Bcustom2: Trace Attempt  2	[0.00 s]
0.0.Bcustom2: Trace Attempt  3	[0.00 s]
0.0.Bcustom2: Trace Attempt  4	[0.00 s]
0.0.Bcustom2: Trace Attempt  5	[0.00 s]
0.0.Bcustom2: Trace Attempt  1	[0.00 s]
0.0.Bcustom2: Trace Attempt  2	[0.00 s]
0.0.Bcustom2: Trace Attempt  3	[0.01 s]
0.0.Bcustom2: Trace Attempt  4	[0.01 s]
0.0.Bcustom2: Trace Attempt  5	[0.01 s]
0.0.Bcustom2: Trace Attempt  1	[0.01 s]
0.0.Bcustom2: Trace Attempt  2	[0.01 s]
0.0.AM: Trace Attempt 743	[180.47 s]
0.0.AM: Stopped processing property "i2cStrech.p1"	[181.03 s].
0.0.AM: Morphing to AMcustom3
0.0.Bcustom2: Trace Attempt  3	[0.01 s]
0.0.Bcustom2: Trace Attempt  4	[0.01 s]
0.0.D: clocks: 1, declared: 1, looping: 0, posedge: 1, negedge: 0, noedge: 0, bothedge: 0
0.0.Bcustom2: Trace Attempt  5	[0.01 s]
0.0.D: Last scan. Per property time limit: 0s
0.0.D: Starting proof for property "i2cStrech.p1"	[0.00 s].
0.0.AM: All properties determined. [0.00 s]
0.0.AM: Exited with Success (@ 0.00 s)
0.0.D: Trace Attempt  1	[0.00 s]
0.0.D: Trace Attempt  2	[0.00 s]
0.0.D: Trace Attempt  3	[0.00 s]
0.0.AMcustom3: clocks: 1, declared: 1, looping: 0, posedge: 1, negedge: 0, noedge: 0, bothedge: 0
0.0.AMcustom3: Starting proof for property "i2cStrech.p1"	[0.00 s].
0.0.AMcustom3: Trace Attempt  1	[0.00 s]
0.0.AMcustom3: Trace Attempt  2	[0.00 s]
0.0.AMcustom3: Trace Attempt  3	[0.00 s]
0.0.AMcustom3: Trace Attempt  4	[0.00 s]
0.0.AMcustom3: Trace Attempt  5	[0.00 s]
0.0.AMcustom3: Trace Attempt  1	[0.00 s]
0.0.AMcustom3: Trace Attempt  2	[0.01 s]
0.0.AMcustom3: Trace Attempt  3	[0.01 s]
0.0.AMcustom3: Trace Attempt  4	[0.01 s]
0.0.AMcustom3: Trace Attempt  5	[0.01 s]
0.0.Bcustom2: Trace Attempt  1	[0.02 s]
0.0.Bcustom2: Trace Attempt  2	[0.02 s]
0.0.Bcustom2: Trace Attempt  3	[0.02 s]
0.0.Bcustom2: Trace Attempt  4	[0.02 s]
0.0.Bcustom2: Trace Attempt  5	[0.02 s]
0.0.Bcustom2: Trace Attempt  1	[0.04 s]
0.0.Bcustom2: Trace Attempt  2	[0.04 s]
0.0.Bcustom2: Trace Attempt  3	[0.04 s]
0.0.Bcustom2: Trace Attempt  4	[0.04 s]
0.0.Bcustom2: Trace Attempt  5	[0.04 s]
0.0.AMcustom3: Trace Attempt  1	[0.04 s]
0.0.AMcustom3: Trace Attempt  2	[0.04 s]
0.0.AMcustom3: Trace Attempt  3	[0.04 s]
0.0.Tri:    0.00" ---- Launching main thread ----
0.0.AMcustom3: Trace Attempt  4	[0.05 s]
0.0.AMcustom3: Trace Attempt  5	[0.05 s]
0.0.Bcustom2: Trace Attempt  1	[0.10 s]
0.0.Bcustom2: Trace Attempt  2	[0.10 s]
0.0.Bcustom2: Trace Attempt  3	[0.10 s]
0.0.Bcustom2: Trace Attempt  4	[0.10 s]
0.0.Bcustom2: Trace Attempt  5	[0.10 s]
0.0.Tri:    0.13" ---- Launching abstraction thread ----
0.0.Tri:    0.15" ---- Launching multi-phase simplification thread ----
0.0.AMcustom3: Trace Attempt  1	[0.15 s]
0.0.AMcustom3: Trace Attempt  2	[0.15 s]
0.0.AMcustom3: Trace Attempt  3	[0.15 s]
0.0.AMcustom3: Trace Attempt  4	[0.15 s]
0.0.AMcustom3: Trace Attempt  5	[0.15 s]
0.0.Tri:    0.20" ---- Launching liveness simplification thread ----
0.0.Bcustom2: Trace Attempt  1	[0.25 s]
0.0.Bcustom2: Trace Attempt  2	[0.25 s]
0.0.Bcustom2: Trace Attempt  3	[0.25 s]
0.0.Bcustom2: Trace Attempt  4	[0.25 s]
0.0.Bcustom2: Trace Attempt  5	[0.25 s]
0.0.Hp: Trace Attempt 3543	[181.40 s]
0.0.Bm: Trace Attempt 9445	[181.46 s]
0.0.AMcustom3: Trace Attempt  1	[0.60 s]
0.0.AMcustom3: Trace Attempt  2	[0.61 s]
0.0.AMcustom3: Trace Attempt  3	[0.61 s]
0.0.AMcustom3: Trace Attempt  4	[0.61 s]
0.0.AMcustom3: Trace Attempt  5	[0.61 s]
0.0.Tri:    1.01" Simplification phase 1 complete
0.0.Ncustom1: Requesting engine job to terminate
0.0.Bcustom2: Requesting engine job to terminate
0.0.AMcustom3: Requesting engine job to terminate
0.0.Tri: Requesting engine job to terminate
0.0.D: Requesting engine job to terminate
0.0.Hp: Requesting engine job to terminate
0.0.Ht: Requesting engine job to terminate
0.0.Bm: Requesting engine job to terminate
INFO (IPF144): 0: Initiating shutdown of proof [182.21 s]
0.0.Tri: A proof was found: No trace exists. [1.14 s]
INFO (IPF057): 0.0.Tri: The property "i2cStrech.p1" was proven in 1.15 s.
0.0.D: Trace Attempt 35	[0.37 s]
0.0.D: Stopped processing property "i2cStrech.p1"	[1.12 s].
0.0.D: All properties determined. [1.11 s]
0.0.D: Exited with Success (@ 182.21 s)
0: ProofGrid usable level: 0
0.0.AMcustom3: Trace Attempt 63	[1.09 s]
0.0.AMcustom3: Stopped processing property "i2cStrech.p1"	[1.10 s].
0.0.AMcustom3: All properties determined. [1.11 s]
0.0.AMcustom3: Exited with Success (@ 182.22 s)
0.0.Ncustom1: Stopped processing property "i2cStrech.p1"	[1.22 s].
0.0.Ncustom1: All properties determined. [1.23 s]
0.0.Ht: Trace Attempt 9682	[182.14 s]
0.0.Ht: All properties determined. [182.21 s]
0.0.Ncustom1: Exited with Success (@ 182.25 s)
0.0.Hp: Trace Attempt 3550	[182.18 s]
0.0.Hp: All properties determined. [182.26 s]
0.0.Bm: Trace Attempt 9459	[182.15 s]
0.0.Bm: All properties determined. [182.26 s]
0.0.Bm: Exited with Success (@ 182.32 s)
0.0.Ht: Exited with Success (@ 182.39 s)
0.0.Tri: Stopped processing property "i2cStrech.p1"	[1.34 s].
0.0.Tri: All properties determined. [1.34 s]
0.0.Tri: Exited with Success (@ 182.41 s)
0.0.Hp: Exited with Success (@ 182.51 s)
0.0.Bcustom2: Trace Attempt  1	[2.50 s]
0.0.Bcustom2: Stopped processing property "i2cStrech.p1"	[2.50 s].
0.0.Bcustom2: All properties determined. [2.50 s]
0.0.Bcustom2: Exited with Success (@ 183.60 s)
0: --------------------------------------------------------------
ProofGrid Summary (utilization 99.95 %)
--------------------------------------------------------------
     engines started                               :    14
     engine jobs started                           :    11

    Average time in state (seconds)
    ------------------------------------------------------
    Engine  Pending     Running        Dead    Utilization
    ------------------------------------------------------
     Hp        0.03      182.21        0.00       99.98 %
     Ht        0.04      182.17        0.00       99.98 %
     Bm        0.04      182.17        0.00       99.98 %
    Mpcustom4        0.04        0.00        0.00        0.56 %
     Oh        0.06        0.01        0.00       12.99 %
      L        0.04        0.00        0.00        3.44 %
    Ncustom1        0.03      182.15        0.00       99.98 %
    Bcustom2        0.04      182.03        0.00       99.98 %
    AMcustom3        0.05      182.00        0.00       99.97 %
    Tri        0.10        1.15        0.00       92.20 %
      D        0.10        1.12        0.00       92.06 %
    all        0.05       99.55        0.00       99.95 %

    Total time in state (seconds)
    -----------------------------------------
            Pending     Running        Dead  
    -----------------------------------------
               0.58     1095.00        0.00

    Data read    : 6.45 MiB
    Data written : 3.97 kiB

0: All pending notifications were processed.
INFO (IPF059): 0: Completed proof on task: "<embedded>"

==============================================================
SUMMARY
==============================================================
           Properties Considered              : 2
                 assertions                   : 1
                  - proven                    : 1 (100%)
                  - bounded_proven (user)     : 0 (0%)
                  - bounded_proven (auto)     : 0 (0%)
                  - marked_proven             : 0 (0%)
                  - cex                       : 0 (0%)
                  - ar_cex                    : 0 (0%)
                  - undetermined              : 0 (0%)
                  - unknown                   : 0 (0%)
                  - error                     : 0 (0%)
                 covers                       : 1
                  - unreachable               : 0 (0%)
                  - bounded_unreachable (user): 0 (0%)
                  - covered                   : 1 (100%)
                  - ar_covered                : 0 (0%)
                  - undetermined              : 0 (0%)
                  - unknown                   : 0 (0%)
                  - error                     : 0 (0%)
determined
[<embedded>] % exit -force
[<embedded>] % INFO (IPL005): Received request to exit from the console.
INFO (IPL014): Waiting for the Tcl-thread to exit.
INFO: Waiting for proof threads to stop...
INFO: Proof threads stopped.
INFO (IPL018): The peak resident set memory use for this session was 2.278 GB.
INFO (IPL015): The Tcl-thread exited with status 0.
INFO (IPL016): Exiting the analysis session with status 0.
Finished 1_i2c_11.tcl successfully
