Jasper Apps 2024.06p002 64 bits 2024.09.02 16:28:38 UTC

Any disclosure about the Cadence Design Systems software or its use
model to any third party violates the written Non-Disclosure Agreement
between Cadence Design Systems, Inc. and the customer.

THIS SOFTWARE CONTAINS CONFIDENTIAL INFORMATION AND TRADE SECRETS OF
CADENCE DESIGN SYSTEMS, INC. USE, DISCLOSURE, OR REPRODUCTION IS
PROHIBITED WITHOUT THE PRIOR EXPRESS WRITTEN PERMISSION OF CADENCE
DESIGN SYSTEMS, INC.

Copyright (C) 2000-2024 Cadence Design Systems, Inc. All Rights
Reserved.  Unpublished -- rights reserved under the copyright laws of
the United States.

This product includes software developed by others and redistributed
according to license agreement. See doc/third_party_readme.txt for
further details.

RESTRICTED RIGHTS LEGEND

Use, duplication, or disclosure by the Government is subject to
restrictions as set forth in subparagraph (c) (1) (ii) of the Rights in
Technical Data and Computer Software clause at DFARS 252.227-7013 or
subparagraphs (c) (1) and (2) of Commercial Computer Software -- Restricted
Rights at 48 CFR 52.227-19, as applicable.


                          Cadence Design Systems, Inc.
                          2655 Seely Avenue
                          San Jose, CA 95134
                          Phone: 408.943.1234

For technical assistance visit http://support.cadence.com.

Jasper Apps Analysis Session - /users/rompel/jasper_executions/liveness/jgprojects/1_PWM_3/sessionLogs/session_0

WARNING (WG017): [session]: The system's locale is "ANSI_X3.4-1968", which is not UTF-8. Non-ASCII characters might not be handled correctly.
WARNING (WG017): [jg_console]: The system's locale is "ANSI_X3.4-1968", which is not UTF-8. Non-ASCII characters might not be handled correctly.
INFO: successfully checked out license "jasper_fao".
INFO: reading configuration file "/users/rompel/.config/cadence/jasper.conf".
% analyze -sv09 ../1_PWM_3.sv
[-- (VERI-1482)] Analyzing Verilog file '/tools/cadence2425/JASPER/jasper_2024.06p002/lib/verilog/packages/std/std.sv' into library 'std'
[-- (VERI-1482)] Analyzing Verilog file '../1_PWM_3.sv'
% elaborate -bbox_mul 1000000 -bbox_div 1000000 -bbox_mod 1000000 -bbox_a 1000000
[INFO (HIER-8002)] ../1_PWM_3.sv(36): Disabling old hierarchical reference handler
[INFO (VERI-1018)] ../1_PWM_3.sv(1): compiling module 'PWM_TOP'
[WARN (VERI-1209)] ../1_PWM_3.sv(15): expression size 32 truncated to fit in target size 12
[INFO (VERI-8005)] ../1_PWM_3.sv(1): Unintentional sequential element inferred for pulse_red read before write using blocking assignment
[INFO (VERI-8005)] ../1_PWM_3.sv(1): Unintentional sequential element inferred for lb_pulse read before write using blocking assignment
[INFO (VERI-8005)] ../1_PWM_3.sv(1): Unintentional sequential element inferred for ub_pulse read before write using blocking assignment
INFO (ISW003): Top module name is "PWM_TOP".
INFO (INL208): Elaboration synthesis summary:
  Number of synthesized netlists          1 (0 packages)
  Single run mode                         On
  Pipeline                                On (1 pipelined netlists)
  Late hierarchical reference connection  On
  Number of analyzed Verilog modules      1 (1 synthesized)
  Number of analyzed VHDL entities        0 (0 synthesized)
INFO (INL003): Clearing all state information (assumes, stopats, and so forth).
PWM_TOP
[<embedded>] % reset -none
INFO (IPM031): Clearing proof results of all properties.
[<embedded>] % clock clk
[<embedded>] % prove -all
Ncustom1: Custom engine code is hT3Ng7hPPfiYQOTDZ3qhYOwGAM51eA+J/FjkM5shLioAsqhgLR4Ft+O1BuKG6ilQ83B9tLXSl+CwjiTMAQA
Bcustom2: Custom engine code is hT3Nm7hPr1Vp3Di1Ra2USNIGL4JypRnLKLAdF6JAyuavO2JfGCiY9OZJhcAcOUnLx5xwNdhILGrAWX9s+z2WDkKwNR7tAfClBEjRFVQeq6DU54boFgEA
AMcustom3: Custom engine code is hT3Ng7hP/feYQOTDZ3qhYOwGAM51eA+J/FjkM5shLioAsqhgLR4Ft+O1BuKG6ilQ83B9tLXSmmqwm7g9AQA
Mpcustom4: Custom engine code is hT3NZbhP9fmY2AbBQnsjfOxn6c+6e6yL+/e8fZFmaQrnlgEA
INFO (IPF036): Starting proof on task: "<embedded>", 1 properties to prove with 0 already proven/unreachable
INFO (IRS029): Starting reset analysis: phase 1 of 4.
INFO (IRS030): Running reset analysis: phase 2 of 4.
INFO (IRS031): Running reset analysis: phase 3 of 4.
INFO (IRS020): Starting the reset analysis simulation with a limit of 100 iterations (phase 4 of 4).
INFO (IRS024): Reset iterations 0 to 4 analyzed.
INFO (IRS018): Reset analysis simulation executed for 3 iterations. Assigned values for 0 of 15 design flops, 0 of 0 design latches, 3 of 3 internal elements.
INFO (IRS039): Reset analysis complete.
INFO (IPF031): Settings used for proof thread 0:
    orchestration                 = on
    time_limit                    = 86400s
    per_property_time_limit       = 1s * 10 ^ scan
    engine_mode                   = auto
    proofgrid_per_engine_max_jobs = 1
    max engine jobs               = auto
    proofgrid_mode                = local
    proofgrid_restarts            = 10
AMcustom5: Custom engine code is hT3N1rhP11/52HrFRS21ROp2LOjVTgPvT8L8BGXHgLhaIuqtT4nARFjUqrBL+7pLmaTOzBepZW/Jm8SSrHDybSQtoNiO3y43wk+dEoWlsZizu97Fih6O6lPVG/LpWP5SsUPwlGagLNa1FKEFvwVXyX7//8prySbvSxIHXr5er+z4RAEA
0: Using multistage preprocessing
Ncustom6: Custom engine code is hT3OXrhPByJp3TrFSTLhUmMH4KVtJgmTCnNDF46yMXOKY48m4LS5nE7yBzFjA7kDuwO/GhGUpEPiky3p3wmPn3dJZHxFMsafSoObRzSC+tn7sEY0WbTdZ/FV4hL3MYH/b1CIUvXSWR4wqEoVLsmMOD4xIPT4lI1LO6ZCO7PnnWQuLwetnvKlrXx6wCW/A+x+enqslg1YPobi4wEF/EvbzOvcTYdJvl2s4H2yZg2b2ofAVN5WvhWk1HoBAA
0: Starting reduce
ADcustom7: Custom engine code is hT3Nv7hPv1752HrFRa2kROx2f/ECJeZB2AZsLdlO8VwmIuqtT4nIDFXclhg+O+o+DMmQCekbheGk0kK28laA9gaOFDXsQp29J3X615HY1IPHJWd6FUFvCHjO+p1k652b5JJvZlShNpGlGSXAiQe/mEAj6tEBAA
Tricustom8: Custom engine code is hT3Nu7hPt1752DvFRa0kNDiyIV97VyejwM9C/jCLJjdPvusZONHY42VYUy0Q1ZotnhcVtNc56tJ5wbxv6V2+XpdsaSlHck5vfnbYjdwj1OECy9U+7oSQ0SZE3g5ayD+Phuh4odCJTjeKa2k4elM9ldQfkAEA
Gcustom9: Custom engine code is hT3NibhPDfeYQADBZnYcglOvK9Pfd7EOeniIqP8jNsyIqInncipMGcUXqAadachREE9F2PwhBUZUNw5kHnd4JdXkamORRgEA
C2custom10: Custom engine code is hT3NirhPjfWYQADBZnYcglOvK9Pfd7EOeniIqP8jNsyIqInncgkrYMMXCYbdK0dUjZIF9d4cJ0rHoBDjwVLBKuG86XYVV00BAA
AGcustom11: Custom engine code is hT3NirhP/fmYQADBZnYcglOvK9Pfd7EOeniIqP8jNsyIqInnckcwYMMXCYbdK0dUjZIF9d4cJ0rHoBDjwVLBKuHEZnZByh0BAA
Bcustom12: Custom engine code is hT3NjrhPDfiYQADBZnYcglOvK9PfWxFtenjIyBqfrgr7if/jL/yPOuK1BAflEcW0DxNH2eDIoezN2gxlQFg81RZtiWXh7aiTAidvAQA
0: Finished reduce in 0s
Ncustom13: Custom engine code is hT3NR7hPByFp3TrFSTLhUmMH4KWtJglTyV/c51BHEeZWamnJv767nE6PCak26bd3gf3XGN3rIRheufhDieCJQVISo+gNYUKhiUedBKGtsP/a18svAnlMJZudHxDFwK5ufsyoxsIyiAeSY2oi3tEuoDHr5gw42DFKAG3PqO3CEsl8Azzdt3pl5nGA1Ifv2H02eYsFzWb/nfp8PMb3F0krE/EgBcm8TD9Div8BAA
Tricustom14: Custom engine code is hT3Nu7hP3fiYQADBZnYcglNHp9bfd7EOeniIqP/ji8sGLQu8yhsFO+wxJ+O+R0bU8g/IewXFomyos+viQnWc2xYNYmMqpo3i40O7DaZR7qfp4YqNx26KRvQ/qx0BAA
0.0.PRE: Performing Proof Simplification...
0.0.N: clocks: 1, declared: 1, looping: 0, posedge: 1, negedge: 0, noedge: 0, bothedge: 0
0.0.N: Proof Simplification Iteration 1	[0.00 s]
0.0.N: Proof Simplification Iteration 2	[0.00 s]
0.0.PRE: A proof was found: No trace exists. [0.00 s]
INFO (IPF057): 0.0.PRE: The property ":noDeadEnd" was proven in 0.00 s.
    Use check_assumptions -show -dead_end to show this property in the property table.
0.0.PRE: A proof was found: No trace exists. [0.00 s]
INFO (IPF057): 0.0.PRE: The property ":noConflict" was proven in 0.00 s.
    Use check_assumptions -show to show this property in the property table.
INFO (IPF047): 0.0.PRE: The cover property ":live" was covered in 1 cycles in 0.00 s.
    Use check_assumptions -show -live to show this property in the property table.
0.0.PRE: Proof Simplification completed in 0.00 s
0: About to start ProofGrid in its own thread with a limit of 10000 pending notifications and a limit of 10 traces.
0: =============================== ProofGrid start ===============================
0: ProofGrid usable level: 1
0: Initial ProofGrid level: 1
0: ProofGrid is starting event handling
0.0.Hp: Proofgrid shell started at 17792@vlsi-ria84(local) jg_17726_vlsi-ria84_1
0.0.N: Proofgrid shell started at 17791@vlsi-ria84(local) jg_17726_vlsi-ria84_1
0.0.N: clocks: 1, declared: 1, looping: 0, posedge: 1, negedge: 0, noedge: 0, bothedge: 0
0.0.N: Last scan. Per property time limit: 0s
0.0.N: Starting proof for property "PWM_TOP.p1"	[0.00 s].
0.0.N: Trace Attempt  1	[0.00 s]
0.0.N: Trace Attempt  2	[0.00 s]
0.0.N: Trace Attempt  2	[0.00 s]
0.0.Hp: clocks: 1, declared: 1, looping: 0, posedge: 1, negedge: 0, noedge: 0, bothedge: 0
0.0.Hp: Last scan. Per property time limit: 0s
0.0.N: Trace Attempt  3	[0.00 s]
0.0.Hp: Trace Attempt  1	[0.00 s]
0.0.Hp: Trace Attempt  2	[0.00 s]
0.0.Hp: Trace Attempt  3	[0.00 s]
0.0.Hp: Trace Attempt  4	[0.00 s]
0.0.Hp: Trace Attempt  5	[0.00 s]
0.0.N: Trace Attempt  3	[0.00 s]
0.0.N: Trace Attempt  4	[0.00 s]
0.0.N: Trace Attempt  5	[0.00 s]
0.0.B: Proofgrid shell started at 17829@vlsi-ria84(local) jg_17726_vlsi-ria84_1
0.0.B: clocks: 1, declared: 1, looping: 0, posedge: 1, negedge: 0, noedge: 0, bothedge: 0
0.0.B: Last scan. Per property time limit: 0s
0.0.B: Starting proof for property "PWM_TOP.p1"	[0.00 s].
0.0.B: Trace Attempt  1	[0.00 s]
0.0.B: Trace Attempt  2	[0.00 s]
0.0.B: Trace Attempt  3	[0.00 s]
0.0.B: Trace Attempt  4	[0.00 s]
0.0.B: Trace Attempt  5	[0.00 s]
0.0.AM: Proofgrid shell started at 17830@vlsi-ria84(local) jg_17726_vlsi-ria84_1
0.0.Ht: Proofgrid shell started at 17827@vlsi-ria84(local) jg_17726_vlsi-ria84_1
0.0.AM: clocks: 1, declared: 1, looping: 0, posedge: 1, negedge: 0, noedge: 0, bothedge: 0
0.0.AM: Last scan. Per property time limit: 0s
0.0.AM: Starting proof for property "PWM_TOP.p1"	[0.00 s].
0.0.AM: Trace Attempt  1	[0.00 s]
0.0.Ht: clocks: 1, declared: 1, looping: 0, posedge: 1, negedge: 0, noedge: 0, bothedge: 0
0.0.Ht: Last scan. Per property time limit: 0s
0.0.AM: Trace Attempt  2	[0.00 s]
0.0.Ht: Trace Attempt  1	[0.00 s]
0.0.AM: Trace Attempt  3	[0.00 s]
0.0.Ht: Trace Attempt  2	[0.00 s]
0.0.Ht: Trace Attempt  3	[0.00 s]
0.0.AM: Trace Attempt  4	[0.00 s]
0.0.Ht: Trace Attempt  4	[0.00 s]
0.0.Ht: Trace Attempt  5	[0.00 s]
0.0.AM: Trace Attempt  5	[0.00 s]
0.0.AM: Trace Attempt  1	[0.00 s]
0.0.N: Trace Attempt  1	[0.04 s]
0.0.AM: Trace Attempt  2	[0.00 s]
0.0.AM: Trace Attempt  3	[0.00 s]
0.0.N: Trace Attempt  2	[0.04 s]
0.0.N: Trace Attempt  3	[0.04 s]
0.0.AM: Trace Attempt  4	[0.00 s]
0.0.N: Trace Attempt  4	[0.04 s]
0.0.N: Trace Attempt  5	[0.04 s]
0.0.AM: Trace Attempt  1	[0.01 s]
0.0.AM: Trace Attempt  2	[0.01 s]
0.0.AM: Trace Attempt  3	[0.01 s]
0.0.AM: Trace Attempt  4	[0.01 s]
0.0.AM: Trace Attempt  5	[0.02 s]
0.0.Oh: Proofgrid shell started at 17828@vlsi-ria84(local) jg_17726_vlsi-ria84_1
0.0.Oh: clocks: 1, declared: 1, looping: 0, posedge: 1, negedge: 0, noedge: 0, bothedge: 0
0.0.Oh: Reached length limit (2147483647) [0.00 s]
0.0.Oh: Exited with Success (@ 0.07 s)
0.0.AM: Trace Attempt  1	[0.06 s]
0.0.AM: Trace Attempt  2	[0.06 s]
0.0.AM: Trace Attempt  3	[0.06 s]
0.0.AM: Trace Attempt  4	[0.06 s]
0.0.AM: Trace Attempt  5	[0.07 s]
0.0.N: Trace Attempt  1	[0.18 s]
0.0.N: Trace Attempt  2	[0.18 s]
0.0.N: Trace Attempt  3	[0.18 s]
0.0.N: Trace Attempt  4	[0.18 s]
0.0.N: Trace Attempt  5	[0.19 s]
0.0.N: Trace Attempt  1	[0.41 s]
0.0.N: Trace Attempt  2	[0.41 s]
0.0.N: Trace Attempt  3	[0.41 s]
0.0.N: Trace Attempt  4	[0.41 s]
0.0.N: Trace Attempt  5	[0.41 s]
0.0.AM: Trace Attempt  1	[0.44 s]
0.0.AM: Trace Attempt  2	[0.44 s]
0.0.AM: Trace Attempt  3	[0.44 s]
0.0.AM: Trace Attempt  4	[0.45 s]
0.0.AM: Trace Attempt  5	[0.45 s]
0.0.N: Trace Attempt  1	[0.64 s]
0.0.N: Trace Attempt  2	[0.64 s]
0.0.N: Trace Attempt  3	[0.64 s]
0.0.N: Trace Attempt  4	[0.64 s]
0.0.N: Trace Attempt  5	[0.64 s]
0.0.N: Trace Attempt  1	[1.04 s]
0.0.N: Trace Attempt  2	[1.04 s]
0.0.N: Trace Attempt  3	[1.04 s]
0.0.N: Trace Attempt  4	[1.04 s]
0.0.N: Trace Attempt  5	[1.04 s]
0.0.AM: Trace Attempt  1	[2.27 s]
0.0.AM: Trace Attempt  2	[2.27 s]
0.0.AM: Trace Attempt  3	[2.27 s]
0.0.AM: Trace Attempt  4	[2.28 s]
0.0.AM: Trace Attempt  5	[2.29 s]
0.0.N: Trace Attempt  1	[2.67 s]
0.0.N: Trace Attempt  2	[2.67 s]
0.0.N: Trace Attempt  3	[2.67 s]
0.0.N: Trace Attempt  4	[2.67 s]
0.0.N: Trace Attempt  5	[2.68 s]
0.0.Hp: Trace Attempt 139	[4.03 s]
0.0.Ht: Trace Attempt 141	[4.04 s]
0.0.B: Trace Attempt 159	[4.06 s]
0.0.N: Trace Attempt  1	[4.35 s]
0.0.N: Trace Attempt  2	[4.35 s]
0.0.N: Trace Attempt  3	[4.35 s]
0.0.N: Trace Attempt  4	[4.35 s]
0.0.N: Trace Attempt  5	[4.36 s]
0.0.N: Trace Attempt  1	[6.07 s]
0.0.N: Trace Attempt  2	[6.07 s]
0.0.N: Trace Attempt  3	[6.07 s]
0.0.N: Trace Attempt  4	[6.08 s]
0.0.N: Trace Attempt  5	[6.08 s]
0.0.AM: Trace Attempt 91	[6.39 s]
0.0.N: Trace Attempt  1	[7.78 s]
0.0.N: Trace Attempt  2	[7.78 s]
0.0.N: Trace Attempt  3	[7.78 s]
0.0.N: Trace Attempt  4	[7.79 s]
0.0.N: Trace Attempt  5	[7.79 s]
0.0.Hp: Trace Attempt 177	[8.08 s]
0.0.Ht: Trace Attempt 179	[8.07 s]
0.0.B: Trace Attempt 202	[8.10 s]
0.0.N: Trace Attempt  1	[9.51 s]
0.0.N: Trace Attempt  2	[9.51 s]
0.0.N: Trace Attempt  3	[9.51 s]
0.0.N: Trace Attempt  4	[9.52 s]
0.0.N: Trace Attempt  5	[9.52 s]
0.0.AM: Trace Attempt 101	[10.45 s]
0.0.N: Trace Attempt  1	[11.24 s]
0.0.N: Trace Attempt  2	[11.24 s]
0.0.N: Trace Attempt  3	[11.24 s]
0.0.N: Trace Attempt  4	[11.25 s]
0.0.N: Trace Attempt  5	[11.25 s]
0.0.Hp: Trace Attempt 204	[12.13 s]
0.0.Ht: Trace Attempt 207	[12.17 s]
0.0.B: Trace Attempt 231	[12.23 s]
0.0.N: Trace Attempt  1	[13.05 s]
0.0.N: Trace Attempt  2	[13.05 s]
0.0.N: Trace Attempt  3	[13.05 s]
0.0.N: Trace Attempt  4	[13.06 s]
0.0.N: Trace Attempt  5	[13.06 s]
0.0.AM: Trace Attempt 98	[14.45 s]
0.0.N: Trace Attempt  1	[14.92 s]
0.0.N: Trace Attempt  2	[14.92 s]
0.0.N: Trace Attempt  3	[14.92 s]
0.0.N: Trace Attempt  4	[14.92 s]
0.0.N: Trace Attempt  5	[14.93 s]
0.0.Hp: Trace Attempt 225	[16.14 s]
0.0.B: Trace Attempt 257	[16.35 s]
0.0.Ht: Trace Attempt 229	[16.54 s]
0.0.AM: Trace Attempt  1	[16.99 s]
0.0.AM: Trace Attempt  2	[17.00 s]
0.0.AM: Trace Attempt  3	[17.00 s]
0.0.AM: Trace Attempt  4	[17.00 s]
0.0.AM: Trace Attempt  5	[17.01 s]
0.0.N: Trace Attempt  1	[17.10 s]
0.0.N: Trace Attempt  2	[17.10 s]
0.0.N: Trace Attempt  3	[17.10 s]
0.0.N: Trace Attempt  4	[17.10 s]
0.0.N: Trace Attempt  5	[17.11 s]
0.0.N: Trace Attempt  1	[19.04 s]
0.0.N: Trace Attempt  2	[19.05 s]
0.0.N: Trace Attempt  3	[19.05 s]
0.0.N: Trace Attempt  4	[19.05 s]
0.0.N: Trace Attempt  5	[19.05 s]
0.0.Hp: Trace Attempt 243	[20.24 s]
0.0.B: Trace Attempt 271	[20.47 s]
0.0.Ht: Trace Attempt 247	[20.57 s]
0.0.N: Trace Attempt  1	[21.02 s]
0.0.N: Trace Attempt  2	[21.02 s]
0.0.N: Trace Attempt  3	[21.02 s]
0.0.N: Trace Attempt  4	[21.02 s]
0.0.N: Trace Attempt  5	[21.03 s]
0.0.AM: Trace Attempt 78	[21.14 s]
0.0.N: Trace Attempt  1	[23.03 s]
0.0.N: Trace Attempt  2	[23.03 s]
0.0.N: Trace Attempt  3	[23.03 s]
0.0.N: Trace Attempt  4	[23.03 s]
0.0.N: Trace Attempt  5	[23.04 s]
0.0.Hp: Trace Attempt 258	[24.29 s]
0.0.B: Trace Attempt 287	[24.65 s]
0.0.N: Trace Attempt  1	[25.08 s]
0.0.N: Trace Attempt  2	[25.08 s]
0.0.N: Trace Attempt  3	[25.08 s]
0.0.N: Trace Attempt  4	[25.08 s]
0.0.Ht: Trace Attempt 261	[25.05 s]
0.0.N: Trace Attempt  5	[25.09 s]
0.0.AM: Trace Attempt 94	[25.28 s]
0.0.Hp: Trace Attempt 267	[28.47 s]
0.0.N: Trace Attempt  1	[28.49 s]
0.0.N: Trace Attempt  2	[28.49 s]
0.0.N: Trace Attempt  3	[28.49 s]
0.0.N: Trace Attempt  4	[28.49 s]
0.0.N: Trace Attempt  5	[28.50 s]
0.0.B: Trace Attempt 302	[28.84 s]
0.0.Ht: Trace Attempt 271	[29.35 s]
0.0.AM: Trace Attempt 107	[29.52 s]
0.0.N: Trace Attempt 70	[32.64 s]
0.0.Hp: Trace Attempt 278	[32.80 s]
0.0.B: Trace Attempt 317	[33.01 s]
0.0.AM: Trace Attempt 119	[33.99 s]
0.0.Ht: Trace Attempt 281	[34.05 s]
0.0.N: Trace Attempt 84	[36.68 s]
0.0.B: Trace Attempt 329	[37.10 s]
0.0.Hp: Trace Attempt 286	[37.26 s]
0.0.Ht: Trace Attempt 289	[38.25 s]
0.0.AM: Trace Attempt 127	[38.41 s]
0.0.B: Trace Attempt 339	[41.30 s]
0.0.Hp: Trace Attempt 294	[41.72 s]
0.0.AM: Trace Attempt 134	[42.50 s]
0.0.Ht: Trace Attempt 298	[42.59 s]
0.0.N: Trace Attempt 89	[43.45 s]
0.0.N: Trace Attempt  1	[43.66 s]
0.0.N: Trace Attempt  2	[43.66 s]
0.0.N: Trace Attempt  3	[43.66 s]
0.0.N: Trace Attempt  4	[43.67 s]
0.0.N: Trace Attempt  5	[43.67 s]
0.0.B: Trace Attempt 348	[45.54 s]
0.0.Hp: Trace Attempt 303	[45.97 s]
0.0.AM: Trace Attempt 140	[46.65 s]
0.0.Ht: Trace Attempt 307	[47.63 s]
0.0.N: Trace Attempt 70	[47.81 s]
0.0.B: Trace Attempt 356	[49.68 s]
0.0.Hp: Trace Attempt 310	[50.06 s]
0.0.AM: Trace Attempt 146	[51.14 s]
0.0.Ht: Trace Attempt 314	[51.77 s]
0.0.N: Trace Attempt 84	[51.88 s]
0.0.B: Trace Attempt 365	[53.94 s]
0.0.Hp: Trace Attempt 316	[54.38 s]
0.0.AM: Trace Attempt 149	[55.55 s]
0.0.Ht: Trace Attempt 321	[55.83 s]
0.0.B: Trace Attempt 374	[58.24 s]
0.0.Hp: Trace Attempt 324	[58.75 s]
0.0.N: Trace Attempt 90	[59.41 s]
0.0.N: Trace Attempt  1	[59.63 s]
0.0.N: Trace Attempt  2	[59.63 s]
0.0.N: Trace Attempt  3	[59.63 s]
0.0.N: Trace Attempt  4	[59.64 s]
0.0.N: Trace Attempt  5	[59.64 s]
0.0.AM: Trace Attempt 152	[59.73 s]
0.0.Ht: Trace Attempt 328	[59.99 s]
0.0.B: Trace Attempt 381	[62.31 s]
0.0.Hp: Trace Attempt 331	[63.00 s]
0.0.N: Trace Attempt 70	[63.80 s]
0.0.AM: Trace Attempt 155	[64.11 s]
0.0.Ht: Trace Attempt 334	[64.33 s]
0.0.B: Trace Attempt 389	[66.61 s]
0.0.Hp: Trace Attempt 337	[67.29 s]
0.0.N: Trace Attempt 84	[67.84 s]
0.0.AM: Trace Attempt 159	[68.22 s]
0.0.Ht: Trace Attempt 341	[69.07 s]
0.0.B: Trace Attempt 397	[71.02 s]
0.0.Hp: Trace Attempt 342	[71.65 s]
0.0.AM: Trace Attempt 163	[72.43 s]
0.0.Ht: Trace Attempt 347	[73.19 s]
0.0.N: Trace Attempt 91	[74.42 s]
0.0.N: Trace Attempt  1	[74.67 s]
0.0.N: Trace Attempt  2	[74.67 s]
0.0.N: Trace Attempt  3	[74.67 s]
0.0.N: Trace Attempt  4	[74.67 s]
0.0.N: Trace Attempt  5	[74.68 s]
0.0.B: Trace Attempt 404	[75.16 s]
0.0.Hp: Trace Attempt 349	[76.16 s]
0.0.AM: Trace Attempt 168	[76.84 s]
0.0.Ht: Trace Attempt 354	[77.68 s]
0.0.N: Trace Attempt 70	[78.85 s]
0.0.B: Trace Attempt 411	[79.71 s]
0.0.Hp: Trace Attempt 355	[80.19 s]
0.0.AM: Trace Attempt 170	[81.44 s]
0.0.Ht: Trace Attempt 361	[82.40 s]
0.0.N: Trace Attempt 84	[82.91 s]
0.0.B: Trace Attempt 418	[83.93 s]
0.0.Hp: Trace Attempt 361	[84.49 s]
0.0.Ht: Trace Attempt 367	[86.95 s]
0.0.AM: Trace Attempt 173	[87.40 s]
0.0.B: Trace Attempt 424	[88.19 s]
0.0.Hp: Trace Attempt 366	[88.73 s]
0.0.N: Trace Attempt 92	[89.67 s]
0.0.N: Trace Attempt  1	[89.90 s]
0.0.N: Trace Attempt  2	[89.90 s]
0.0.N: Trace Attempt  3	[89.90 s]
0.0.N: Trace Attempt  4	[89.90 s]
0.0.N: Trace Attempt  5	[89.91 s]
0.0.Ht: Trace Attempt 371	[91.30 s]
0.0.B: Trace Attempt 431	[92.87 s]
0.0.Hp: Trace Attempt 371	[93.68 s]
0.0.AM: Trace Attempt 177	[93.90 s]
0.0.N: Trace Attempt 70	[94.06 s]
0.0.Ht: Trace Attempt 377	[95.44 s]
0.0.B: Trace Attempt 436	[97.50 s]
0.0.Hp: Trace Attempt 377	[97.94 s]
0.0.N: Trace Attempt 84	[98.11 s]
0.0.AM: Trace Attempt 179	[99.39 s]
0.0.Ht: Trace Attempt 383	[99.49 s]
0.0.Hp: Trace Attempt 383	[102.26 s]
0.0.B: Trace Attempt 443	[102.32 s]
0.0.Ht: Trace Attempt 388	[103.54 s]
0.0.AM: Trace Attempt 182	[104.48 s]
0.0.N: Trace Attempt 93	[105.29 s]
0.0.N: Trace Attempt  1	[105.54 s]
0.0.N: Trace Attempt  2	[105.54 s]
0.0.N: Trace Attempt  3	[105.54 s]
0.0.N: Trace Attempt  4	[105.54 s]
0.0.N: Trace Attempt  5	[105.55 s]
0.0.Hp: Trace Attempt 388	[106.45 s]
0.0.B: Trace Attempt 450	[107.00 s]
0.0.Ht: Trace Attempt 392	[107.98 s]
0.0.AM: Trace Attempt 184	[108.84 s]
0.0.N: Trace Attempt 70	[109.73 s]
0.0.Hp: Trace Attempt 392	[111.03 s]
0.0.B: Trace Attempt 456	[111.71 s]
0.0.Ht: Trace Attempt 397	[113.43 s]
0.0.N: Trace Attempt 84	[113.78 s]
0.0.AM: Trace Attempt 186	[114.94 s]
0.0.B: Trace Attempt 462	[116.24 s]
0.0.Hp: Trace Attempt 397	[116.62 s]
0.0.Ht: Trace Attempt 401	[117.69 s]
0.0.AM: Trace Attempt 188	[119.39 s]
0.0.B: Trace Attempt 467	[120.87 s]
0.0.Hp: Trace Attempt 401	[121.10 s]
0.0.N: Trace Attempt 94	[121.45 s]
0.0.N: Trace Attempt  1	[121.72 s]
0.0.N: Trace Attempt  2	[121.72 s]
0.0.N: Trace Attempt  3	[121.72 s]
0.0.N: Trace Attempt  4	[121.72 s]
0.0.N: Trace Attempt  5	[121.73 s]
0.0.Ht: Trace Attempt 406	[122.39 s]
0.0.AM: Trace Attempt 190	[124.94 s]
0.0.B: Trace Attempt 472	[125.32 s]
0.0.Hp: Trace Attempt 406	[125.73 s]
0.0.N: Trace Attempt 70	[125.88 s]
0.0.Ht: Trace Attempt 412	[127.06 s]
0.0.Hp: Trace Attempt 411	[129.79 s]
0.0.B: Trace Attempt 477	[129.85 s]
0.0.N: Trace Attempt 84	[129.94 s]
0.0.Ht: Trace Attempt 417	[131.36 s]
0.0.AM: Trace Attempt 192	[133.43 s]
0.0.B: Trace Attempt 482	[133.92 s]
0.0.Hp: Trace Attempt 416	[134.25 s]
0.0.Ht: Trace Attempt 421	[136.59 s]
0.0.N: Trace Attempt 95	[137.28 s]
0.0.N: Trace Attempt  1	[137.52 s]
0.0.N: Trace Attempt  2	[137.52 s]
0.0.N: Trace Attempt  3	[137.52 s]
0.0.N: Trace Attempt  4	[137.53 s]
0.0.N: Trace Attempt  5	[137.53 s]
0.0.AM: Trace Attempt 193	[138.41 s]
0.0.B: Trace Attempt 487	[138.82 s]
0.0.Hp: Trace Attempt 421	[140.65 s]
0.0.Ht: Trace Attempt 426	[140.83 s]
0.0.N: Trace Attempt 70	[141.70 s]
0.0.B: Trace Attempt 492	[143.83 s]
0.0.AM: Trace Attempt 194	[144.46 s]
0.0.Hp: Trace Attempt 426	[145.03 s]
0.0.Ht: Trace Attempt 429	[145.60 s]
0.0.N: Trace Attempt 84	[145.78 s]
0.0.B: Trace Attempt 497	[148.60 s]
0.0.Hp: Trace Attempt 429	[149.85 s]
0.0.Ht: Trace Attempt 434	[150.25 s]
0.0.N: Trace Attempt 96	[153.33 s]
0.0.N: Trace Attempt  1	[153.59 s]
0.0.N: Trace Attempt  2	[153.59 s]
0.0.N: Trace Attempt  3	[153.59 s]
0.0.N: Trace Attempt  4	[153.59 s]
0.0.N: Trace Attempt  5	[153.60 s]
0.0.AM: Trace Attempt 195	[153.59 s]
0.0.B: Trace Attempt 501	[153.73 s]
0.0.Hp: Trace Attempt 433	[153.91 s]
0.0.Ht: Trace Attempt 438	[154.29 s]
0.0.N: Trace Attempt 70	[157.74 s]
0.0.B: Trace Attempt 506	[157.99 s]
0.0.Ht: Trace Attempt 442	[158.36 s]
0.0.Hp: Trace Attempt 438	[158.66 s]
0.0.AM: Trace Attempt 196	[159.82 s]
0.0.N: Trace Attempt 84	[161.80 s]
0.0.Ht: Trace Attempt 446	[162.46 s]
0.0.Hp: Trace Attempt 442	[162.72 s]
0.0.B: Trace Attempt 511	[162.90 s]
0.0.AM: Trace Attempt 197	[166.57 s]
0.0.Ht: Trace Attempt 450	[166.66 s]
0.0.Hp: Trace Attempt 446	[166.92 s]
0.0.B: Trace Attempt 514	[167.36 s]
0.0.N: Trace Attempt 97	[169.85 s]
0.0.N: Trace Attempt  1	[170.10 s]
0.0.N: Trace Attempt  2	[170.10 s]
0.0.N: Trace Attempt  3	[170.10 s]
0.0.N: Trace Attempt  4	[170.10 s]
0.0.N: Trace Attempt  5	[170.11 s]
0.0.Hp: Trace Attempt 450	[171.26 s]
0.0.B: Trace Attempt 516	[171.40 s]
0.0.Ht: Trace Attempt 454	[172.48 s]
0.0.N: Trace Attempt 70	[174.27 s]
0.0.B: Trace Attempt 518	[176.34 s]
0.0.Ht: Trace Attempt 459	[177.10 s]
0.0.Hp: Trace Attempt 454	[177.13 s]
0.0.N: Trace Attempt 84	[178.32 s]
0.0.AM: Trace Attempt 198	[180.43 s]
0.0.B: Trace Attempt 521	[181.20 s]
0.0.N: Trace Attempt 88	[180.69 s]
0.0.N: Stopped processing property "PWM_TOP.p1"	[181.26 s].
0.0.N: Morphing to Ncustom1
0.0.N: All properties determined. [0.00 s]
0.0.N: Exited with Success (@ 0.00 s)
0.0.Ncustom1: clocks: 1, declared: 1, looping: 0, posedge: 1, negedge: 0, noedge: 0, bothedge: 0
0.0.Ncustom1: Starting proof for property "PWM_TOP.p1"	[0.00 s].
0.0.Ncustom1: Trace Attempt 97	[0.00 s]
0.0.B: Stopped processing property "PWM_TOP.p1"	[181.24 s].
0.0.B: Morphing to Bcustom2
0.0.B: All properties determined. [0.00 s]
0.0.B: Exited with Success (@ 0.00 s)
0.0.Bcustom2: clocks: 1, declared: 1, looping: 0, posedge: 1, negedge: 0, noedge: 0, bothedge: 0
0.0.Bcustom2: Starting proof for property "PWM_TOP.p1"	[0.00 s].
0.0.Bcustom2: Trace Attempt  1	[0.00 s]
0.0.Bcustom2: Trace Attempt  2	[0.00 s]
0.0.Bcustom2: Trace Attempt  1	[0.00 s]
0.0.Bcustom2: Trace Attempt  2	[0.00 s]
0.0.Bcustom2: Trace Attempt  3	[0.00 s]
0.0.Bcustom2: Trace Attempt  4	[0.00 s]
0.0.Bcustom2: Trace Attempt  5	[0.00 s]
0.0.Tri: Proofgrid shell started at 18092@vlsi-ria84(local) jg_17726_vlsi-ria84_1
0.0.Tri: clocks: 1, declared: 1, looping: 0, posedge: 1, negedge: 0, noedge: 0, bothedge: 0
0.0.Tri: Last scan. Per property time limit: 0s
0.0.Tri: Starting proof for property "PWM_TOP.p1"	[0.00 s].
0.0.Tri: Trace Attempt  1	[0.00 s]
0.0.Tri:    0.00" ---- Launching main thread ----
0.0.Tri:    0.03" ---- Launching abstraction thread ----
0.0.Tri:    0.03" ---- Launching multi-phase simplification thread ----
0.0.Tri:    0.05" ---- Launching liveness simplification thread ----
0.0.AM: Stopped processing property "PWM_TOP.p1"	[181.59 s].
0.0.AM: Morphing to AMcustom3
0.0.AM: All properties determined. [0.00 s]
0.0.AM: Exited with Success (@ 0.00 s)
0.0.AMcustom3: clocks: 1, declared: 1, looping: 0, posedge: 1, negedge: 0, noedge: 0, bothedge: 0
0.0.AMcustom3: Starting proof for property "PWM_TOP.p1"	[0.00 s].
0.0.AMcustom3: Trace Attempt  1	[0.00 s]
0.0.AMcustom3: Trace Attempt  2	[0.00 s]
0.0.AMcustom3: Trace Attempt  3	[0.00 s]
0.0.AMcustom3: Trace Attempt  4	[0.00 s]
0.0.AMcustom3: Trace Attempt  5	[0.00 s]
0.0.AMcustom3: Trace Attempt  1	[0.00 s]
0.0.AMcustom3: Trace Attempt  2	[0.00 s]
0.0.AMcustom3: Trace Attempt  3	[0.00 s]
0.0.AMcustom3: Trace Attempt  4	[0.01 s]
0.0.AMcustom3: Trace Attempt  1	[0.01 s]
0.0.AMcustom3: Trace Attempt  2	[0.01 s]
0.0.AMcustom3: Trace Attempt  3	[0.01 s]
0.0.AMcustom3: Trace Attempt  4	[0.02 s]
0.0.AMcustom3: Trace Attempt  5	[0.02 s]
0.0.AMcustom3: Trace Attempt  1	[0.07 s]
0.0.AMcustom3: Trace Attempt  2	[0.07 s]
0.0.AMcustom3: Trace Attempt  3	[0.07 s]
0.0.AMcustom3: Trace Attempt  4	[0.07 s]
0.0.AMcustom3: Trace Attempt  5	[0.07 s]
0.0.Hp: Trace Attempt 459	[181.73 s]
0.0.Ht: Trace Attempt 462	[181.99 s]
0.0.AMcustom3: Trace Attempt  1	[0.43 s]
0.0.AMcustom3: Trace Attempt  2	[0.43 s]
0.0.AMcustom3: Trace Attempt  3	[0.43 s]
0.0.AMcustom3: Trace Attempt  4	[0.43 s]
0.0.AMcustom3: Trace Attempt  5	[0.44 s]
0.0.Tri:    0.81" Simplification phase 1 complete
0.0.Ncustom1: Requesting engine job to terminate
0.0.Bcustom2: Requesting engine job to terminate
0.0.AMcustom3: Requesting engine job to terminate
0.0.Tri: Requesting engine job to terminate
0.0.Hp: Requesting engine job to terminate
0.0.Ht: Requesting engine job to terminate
INFO (IPF144): 0: Initiating shutdown of proof [182.20 s]
0.0.Tri: A proof was found: No trace exists. [0.88 s]
INFO (IPF057): 0.0.Tri: The property "PWM_TOP.p1" was proven in 0.88 s.
0.0.Hp: All properties determined. [182.20 s]
0.0.AMcustom3: Trace Attempt 20	[0.54 s]
0.0.AMcustom3: Stopped processing property "PWM_TOP.p1"	[0.55 s].
0.0.AMcustom3: All properties determined. [0.55 s]
0.0.Ncustom1: Stopped processing property "PWM_TOP.p1"	[0.93 s].
0.0.Ncustom1: All properties determined. [0.94 s]
0.0.AMcustom3: Exited with Success (@ 182.20 s)
0: ProofGrid usable level: 0
0.0.Bcustom2: Trace Attempt 83	[0.91 s]
0.0.Bcustom2: Stopped processing property "PWM_TOP.p1"	[0.92 s].
0.0.Bcustom2: All properties determined. [0.93 s]
0.0.Ncustom1: Exited with Success (@ 182.21 s)
0.0.Bcustom2: Exited with Success (@ 182.21 s)
0.0.Hp: Exited with Success (@ 182.24 s)
0.0.Ht: All properties determined. [182.21 s]
0.0.Ht: Exited with Success (@ 182.26 s)
0.0.Tri: Stopped processing property "PWM_TOP.p1"	[1.02 s].
0.0.Tri: All properties determined. [1.02 s]
0.0.Tri: Exited with Success (@ 182.34 s)
0: --------------------------------------------------------------
ProofGrid Summary (utilization 99.97 %)
--------------------------------------------------------------
     engines started                               :    10
     engine jobs started                           :     7

    Average time in state (seconds)
    ------------------------------------------------------
    Engine  Pending     Running        Dead    Utilization
    ------------------------------------------------------
     Hp        0.03      182.20        0.00       99.98 %
     Ht        0.03      182.17        0.00       99.98 %
     Oh        0.07        0.00        0.00        1.88 %
    Ncustom1        0.03      182.17        0.00       99.98 %
    Bcustom2        0.03      182.16        0.00       99.98 %
    AMcustom3        0.03      181.78        0.00       99.98 %
    Tri        0.05        0.88        0.00       94.41 %
    all        0.04      130.19        0.00       99.97 %

    Total time in state (seconds)
    -----------------------------------------
            Pending     Running        Dead  
    -----------------------------------------
               0.28      911.36        0.00

    Data read    : 1.65 MiB
    Data written : 2.95 kiB

0: All pending notifications were processed.
INFO (IPF059): 0: Completed proof on task: "<embedded>"

==============================================================
SUMMARY
==============================================================
           Properties Considered              : 1
                 assertions                   : 1
                  - proven                    : 1 (100%)
                  - bounded_proven (user)     : 0 (0%)
                  - bounded_proven (auto)     : 0 (0%)
                  - marked_proven             : 0 (0%)
                  - cex                       : 0 (0%)
                  - ar_cex                    : 0 (0%)
                  - undetermined              : 0 (0%)
                  - unknown                   : 0 (0%)
                  - error                     : 0 (0%)
                 covers                       : 0
                  - unreachable               : 0
                  - bounded_unreachable (user): 0
                  - covered                   : 0
                  - ar_covered                : 0
                  - undetermined              : 0
                  - unknown                   : 0
                  - error                     : 0
proven
[<embedded>] % exit -force
[<embedded>] % INFO (IPL005): Received request to exit from the console.
INFO: Waiting for proof threads to stop...
INFO: Proof threads stopped.
INFO (IPL018): The peak resident set memory use for this session was 1.148 GB.
INFO (IPL014): Waiting for the Tcl-thread to exit.
INFO (IPL015): The Tcl-thread exited with status 0.
INFO (IPL016): Exiting the analysis session with status 0.
Finished 1_PWM_3.tcl successfully
