Jasper Apps 2024.06p002 64 bits 2024.09.02 16:28:38 UTC

Any disclosure about the Cadence Design Systems software or its use
model to any third party violates the written Non-Disclosure Agreement
between Cadence Design Systems, Inc. and the customer.

THIS SOFTWARE CONTAINS CONFIDENTIAL INFORMATION AND TRADE SECRETS OF
CADENCE DESIGN SYSTEMS, INC. USE, DISCLOSURE, OR REPRODUCTION IS
PROHIBITED WITHOUT THE PRIOR EXPRESS WRITTEN PERMISSION OF CADENCE
DESIGN SYSTEMS, INC.

Copyright (C) 2000-2024 Cadence Design Systems, Inc. All Rights
Reserved.  Unpublished -- rights reserved under the copyright laws of
the United States.

This product includes software developed by others and redistributed
according to license agreement. See doc/third_party_readme.txt for
further details.

RESTRICTED RIGHTS LEGEND

Use, duplication, or disclosure by the Government is subject to
restrictions as set forth in subparagraph (c) (1) (ii) of the Rights in
Technical Data and Computer Software clause at DFARS 252.227-7013 or
subparagraphs (c) (1) and (2) of Commercial Computer Software -- Restricted
Rights at 48 CFR 52.227-19, as applicable.


                          Cadence Design Systems, Inc.
                          2655 Seely Avenue
                          San Jose, CA 95134
                          Phone: 408.943.1234

For technical assistance visit http://support.cadence.com.

Jasper Apps Analysis Session - /users/rompel/jasper_executions/liveness/jgprojects/2_seven_seg_9/sessionLogs/session_0

WARNING (WG017): [session]: The system's locale is "ANSI_X3.4-1968", which is not UTF-8. Non-ASCII characters might not be handled correctly.
WARNING (WG017): [jg_console]: The system's locale is "ANSI_X3.4-1968", which is not UTF-8. Non-ASCII characters might not be handled correctly.
INFO: successfully checked out license "jasper_fao".
INFO: reading configuration file "/users/rompel/.config/cadence/jasper.conf".
% analyze -sv09 ../2_seven_seg_9.sv
[-- (VERI-1482)] Analyzing Verilog file '/tools/cadence2425/JASPER/jasper_2024.06p002/lib/verilog/packages/std/std.sv' into library 'std'
[-- (VERI-1482)] Analyzing Verilog file '../2_seven_seg_9.sv'
% elaborate -bbox_mul 1000000 -bbox_div 1000000 -bbox_mod 1000000 -bbox_a 1000000
[INFO (HIER-8002)] ../2_seven_seg_9.sv(32): Disabling old hierarchical reference handler
[INFO (VERI-1018)] ../2_seven_seg_9.sv(1): compiling module 'SEVEN'
[WARN (VERI-1209)] ../2_seven_seg_9.sv(15): expression size 32 truncated to fit in target size 14
[INFO (VERI-8005)] ../2_seven_seg_9.sv(5): Unintentional sequential element inferred for cnt read before write using blocking assignment
[INFO (VERI-8005)] ../2_seven_seg_9.sv(6): Unintentional sequential element inferred for digit_select read before write using blocking assignment
[INFO (VERI-8005)] ../2_seven_seg_9.sv(1): Unintentional sequential element inferred for segment read before write using blocking assignment
[INFO (VERI-8005)] ../2_seven_seg_9.sv(1): Unintentional sequential element inferred for sig read before write using blocking assignment
INFO (ISW003): Top module name is "SEVEN".
INFO (INL208): Elaboration synthesis summary:
  Number of synthesized netlists          1 (0 packages)
  Single run mode                         On
  Pipeline                                On (1 pipelined netlists)
  Late hierarchical reference connection  On
  Number of analyzed Verilog modules      1 (1 synthesized)
  Number of analyzed VHDL entities        0 (0 synthesized)
INFO (INL003): Clearing all state information (assumes, stopats, and so forth).
SEVEN
[<embedded>] % reset rst
INFO (IPM031): Clearing proof results of all properties.
INFO (IRS006): Current reset condition is "rst".
[<embedded>] % clock clk
[<embedded>] % prove -all
Ncustom1: Custom engine code is hT3Ng7hPPfiYQOTDZ3qhYOwGAM51eA+J/FjkM5shLioAsqhgLR4Ft+O1BuKG6ilQ83B9tLXSl+CwjiTMAQA
Bcustom2: Custom engine code is hT3Nm7hPr1Vp3Di1Ra2USNIGL4JypRnLKLAdF6JAyuavO2JfGCiY9OZJhcAcOUnLx5xwNdhILGrAWX9s+z2WDkKwNR7tAfClBEjRFVQeq6DU54boFgEA
AMcustom3: Custom engine code is hT3Ng7hP/feYQOTDZ3qhYOwGAM51eA+J/FjkM5shLioAsqhgLR4Ft+O1BuKG6ilQ83B9tLXSmmqwm7g9AQA
Mpcustom4: Custom engine code is hT3NZbhP9fmY2AbBQnsjfOxn6c+6e6yL+/e8fZFmaQrnlgEA
INFO (IPF036): Starting proof on task: "<embedded>", 2 properties to prove with 0 already proven/unreachable
INFO (IRS029): Starting reset analysis: phase 1 of 4.
INFO (IRS030): Running reset analysis: phase 2 of 4.
INFO (IRS031): Running reset analysis: phase 3 of 4.
INFO (IRS020): Starting the reset analysis simulation with a limit of 100 iterations (phase 4 of 4).
INFO (IRS024): Reset iterations 0 to 4 analyzed.
INFO (IRS018): Reset analysis simulation executed for 3 iterations. Assigned values for 23 of 23 design flops, 0 of 0 design latches, 6 of 6 internal elements.
INFO (IRS039): Reset analysis complete.
INFO (IPF031): Settings used for proof thread 0:
    orchestration                 = on
    time_limit                    = 86400s
    per_property_time_limit       = 1s * 10 ^ scan
    engine_mode                   = auto
    proofgrid_per_engine_max_jobs = 1
    max engine jobs               = auto
    proofgrid_mode                = local
    proofgrid_restarts            = 10
AMcustom5: Custom engine code is hT3N1rhP11/52HrFRS21ROp2LOjVTgPvT8L8BGXHgLhaIuqtT4nARFjUqrBL+7pLmaTOzBepZW/Jm8SSrHDybSQtoNiO3y43wk+dEoWlsZizu97Fih6O6lPVG/LpWP5SsUPwlGagLNa1FKEFvwVXyX7//8prySbvSxIHXr5er+z4RAEA
Ncustom6: Custom engine code is hT3OXrhPByJp3TrFSTLhUmMH4KVtJgmTCnNDF46yMXOKY48m4LS5nE7yBzFjA7kDuwO/GhGUpEPiky3p3wmPn3dJZHxFMsafSoObRzSC+tn7sEY0WbTdZ/FV4hL3MYH/b1CIUvXSWR4wqEoVLsmMOD4xIPT4lI1LO6ZCO7PnnWQuLwetnvKlrXx6wCW/A+x+enqslg1YPobi4wEF/EvbzOvcTYdJvl2s4H2yZg2b2ofAVN5WvhWk1HoBAA
0: Using multistage preprocessing
ADcustom7: Custom engine code is hT3Nv7hPv1752HrFRa2kROx2f/ECJeZB2AZsLdlO8VwmIuqtT4nIDFXclhg+O+o+DMmQCekbheGk0kK28laA9gaOFDXsQp29J3X615HY1IPHJWd6FUFvCHjO+p1k652b5JJvZlShNpGlGSXAiQe/mEAj6tEBAA
0: Starting reduce
Tricustom8: Custom engine code is hT3Nu7hPt1752DvFRa0kNDiyIV97VyejwM9C/jCLJjdPvusZONHY42VYUy0Q1ZotnhcVtNc56tJ5wbxv6V2+XpdsaSlHck5vfnbYjdwj1OECy9U+7oSQ0SZE3g5ayD+Phuh4odCJTjeKa2k4elM9ldQfkAEA
Gcustom9: Custom engine code is hT3NibhPDfeYQADBZnYcglOvK9Pfd7EOeniIqP8jNsyIqInncipMGcUXqAadachREE9F2PwhBUZUNw5kHnd4JdXkamORRgEA
C2custom10: Custom engine code is hT3NirhPjfWYQADBZnYcglOvK9Pfd7EOeniIqP8jNsyIqInncgkrYMMXCYbdK0dUjZIF9d4cJ0rHoBDjwVLBKuG86XYVV00BAA
AGcustom11: Custom engine code is hT3NirhP/fmYQADBZnYcglOvK9Pfd7EOeniIqP8jNsyIqInnckcwYMMXCYbdK0dUjZIF9d4cJ0rHoBDjwVLBKuHEZnZByh0BAA
Bcustom12: Custom engine code is hT3NjrhPDfiYQADBZnYcglOvK9PfWxFtenjIyBqfrgr7if/jL/yPOuK1BAflEcW0DxNH2eDIoezN2gxlQFg81RZtiWXh7aiTAidvAQA
Ncustom13: Custom engine code is hT3NR7hPByFp3TrFSTLhUmMH4KWtJglTyV/c51BHEeZWamnJv767nE6PCak26bd3gf3XGN3rIRheufhDieCJQVISo+gNYUKhiUedBKGtsP/a18svAnlMJZudHxDFwK5ufsyoxsIyiAeSY2oi3tEuoDHr5gw42DFKAG3PqO3CEsl8Azzdt3pl5nGA1Ifv2H02eYsFzWb/nfp8PMb3F0krE/EgBcm8TD9Div8BAA
Tricustom14: Custom engine code is hT3Nu7hP3fiYQADBZnYcglNHp9bfd7EOeniIqP/ji8sGLQu8yhsFO+wxJ+O+R0bU8g/IewXFomyos+viQnWc2xYNYmMqpo3i40O7DaZR7qfp4YqNx26KRvQ/qx0BAA
0: Finished reduce in 0s
0.0.PRE: Performing Proof Simplification...
0.0.N: clocks: 1, declared: 1, looping: 0, posedge: 1, negedge: 0, noedge: 0, bothedge: 0
0.0.N: Proof Simplification Iteration 1	[0.00 s]
0.0.PRE: A trace with 1 cycles was found. [0.00 s]
INFO (IPF047): 0.0.PRE: The cover property "SEVEN.p1:precondition1" was covered in 1 cycles in 0.00 s.
0.0.N: Proof Simplification Iteration 2	[0.06 s]
0.0.PRE: A proof was found: No trace exists. [0.00 s]
INFO (IPF057): 0.0.PRE: The property ":noDeadEnd" was proven in 0.00 s.
    Use check_assumptions -show -dead_end to show this property in the property table.
0.0.PRE: A proof was found: No trace exists. [0.00 s]
INFO (IPF057): 0.0.PRE: The property ":noConflict" was proven in 0.00 s.
    Use check_assumptions -show to show this property in the property table.
INFO (IPF047): 0.0.PRE: The cover property ":live" was covered in 1 cycles in 0.00 s.
    Use check_assumptions -show -live to show this property in the property table.
0.0.PRE: Proof Simplification completed in 0.06 s
0: About to start ProofGrid in its own thread with a limit of 10000 pending notifications and a limit of 10 traces.
0: =============================== ProofGrid start ===============================
0: ProofGrid usable level: 1
0: Initial ProofGrid level: 1
0: ProofGrid is starting event handling
0.0.N: Proofgrid shell started at 4515@vlsi-ria85(local) jg_4296_vlsi-ria85_1
0.0.Hp: Proofgrid shell started at 4516@vlsi-ria85(local) jg_4296_vlsi-ria85_1
0.0.N: clocks: 1, declared: 1, looping: 0, posedge: 1, negedge: 0, noedge: 0, bothedge: 0
0.0.Hp: clocks: 1, declared: 1, looping: 0, posedge: 1, negedge: 0, noedge: 0, bothedge: 0
0.0.Hp: Last scan. Per property time limit: 0s
0.0.Hp: Trace Attempt  1	[0.00 s]
0.0.Hp: Trace Attempt  2	[0.00 s]
0.0.Hp: Trace Attempt  3	[0.00 s]
0.0.Hp: Trace Attempt  4	[0.00 s]
0.0.Hp: Trace Attempt  5	[0.00 s]
0.0.N: Last scan. Per property time limit: 0s
0.0.N: Starting proof for property "SEVEN.p1"	[0.00 s].
0.0.N: Trace Attempt  1	[0.00 s]
0.0.N: Trace Attempt  2	[0.00 s]
0.0.N: Trace Attempt  2	[0.00 s]
0.0.N: Trace Attempt  3	[0.00 s]
0.0.N: Trace Attempt  3	[0.00 s]
0.0.N: Trace Attempt  4	[0.00 s]
0.0.N: Trace Attempt  5	[0.00 s]
0.0.N: Trace Attempt  1	[0.01 s]
0.0.N: Trace Attempt  2	[0.01 s]
0.0.N: Trace Attempt  3	[0.01 s]
0.0.N: Trace Attempt  4	[0.01 s]
0.0.N: Trace Attempt  5	[0.01 s]
0.0.Ht: Proofgrid shell started at 4564@vlsi-ria85(local) jg_4296_vlsi-ria85_1
0.0.Ht: clocks: 1, declared: 1, looping: 0, posedge: 1, negedge: 0, noedge: 0, bothedge: 0
0.0.Ht: Last scan. Per property time limit: 0s
0.0.Ht: Trace Attempt  1	[0.00 s]
0.0.Ht: Trace Attempt  2	[0.00 s]
0.0.Ht: Trace Attempt  3	[0.00 s]
0.0.Ht: Trace Attempt  4	[0.00 s]
0.0.Ht: Trace Attempt  5	[0.00 s]
0.0.Mpcustom4: Proofgrid shell started at 4566@vlsi-ria85(local) jg_4296_vlsi-ria85_1
0.0.Bm: Proofgrid shell started at 4565@vlsi-ria85(local) jg_4296_vlsi-ria85_1
0.0.L: Proofgrid shell started at 4608@vlsi-ria85(local) jg_4296_vlsi-ria85_1
0.0.L: clocks: 1, declared: 1, looping: 0, posedge: 1, negedge: 0, noedge: 0, bothedge: 0
0.0.L: Using trace diversification with seed 1 (0.05)
0.0.L: Using LRU state removal heuristic
0.0.L: Ignoring liveness properties
0.0.L: All properties either determined or skipped. [0.00 s]
0.0.Bm: clocks: 1, declared: 1, looping: 0, posedge: 1, negedge: 0, noedge: 0, bothedge: 0
0.0.Bm: Ignoring liveness properties
0.0.Bm: Last scan. Per property time limit: 0s
0.0.Bm: Trace Attempt  1	[0.00 s]
0.0.Bm: Trace Attempt  2	[0.00 s]
0.0.Bm: Trace Attempt  3	[0.00 s]
0.0.Bm: Trace Attempt  4	[0.00 s]
0.0.Bm: Trace Attempt  5	[0.00 s]
0.0.Mpcustom4: clocks: 1, declared: 1, looping: 0, posedge: 1, negedge: 0, noedge: 0, bothedge: 0
0.0.Mpcustom4: Ignoring liveness properties
0.0.Mpcustom4: All properties either determined or skipped. [0.00 s]
0.0.Mpcustom4: Exited with Success (@ 0.06 s)
0.0.Mpcustom4: Completed, Restart ignored.
0.0.L: Exited with Success (@ 0.06 s)
0.0.L: Completed, Restart ignored.
0.0.Oh: Proofgrid shell started at 4569@vlsi-ria85(local) jg_4296_vlsi-ria85_1
0.0.Oh: clocks: 1, declared: 1, looping: 0, posedge: 1, negedge: 0, noedge: 0, bothedge: 0
0.0.Oh: Reached length limit (2147483647) [0.00 s]
0.0.B: Proofgrid shell started at 4616@vlsi-ria85(local) jg_4296_vlsi-ria85_1
0.0.Oh: Exited with Success (@ 0.07 s)
0.0.Oh: Completed, Restart ignored.
0.0.B: clocks: 1, declared: 1, looping: 0, posedge: 1, negedge: 0, noedge: 0, bothedge: 0
0.0.B: Last scan. Per property time limit: 0s
0.0.B: Starting proof for property "SEVEN.p1"	[0.00 s].
0.0.B: Trace Attempt  1	[0.00 s]
0.0.B: Trace Attempt  2	[0.00 s]
0.0.B: Trace Attempt  3	[0.00 s]
0.0.B: Trace Attempt  4	[0.00 s]
0.0.B: Trace Attempt  5	[0.00 s]
0.0.N: Trace Attempt  1	[0.11 s]
0.0.N: Trace Attempt  2	[0.11 s]
0.0.N: Trace Attempt  3	[0.11 s]
0.0.N: Trace Attempt  4	[0.11 s]
0.0.N: Trace Attempt  5	[0.11 s]
0.0.AM: Proofgrid shell started at 4624@vlsi-ria85(local) jg_4296_vlsi-ria85_1
0.0.AM: clocks: 1, declared: 1, looping: 0, posedge: 1, negedge: 0, noedge: 0, bothedge: 0
0.0.AM: Last scan. Per property time limit: 0s
0.0.AM: Starting proof for property "SEVEN.p1"	[0.00 s].
0.0.AM: Trace Attempt  1	[0.00 s]
0.0.AM: Trace Attempt  2	[0.00 s]
0.0.AM: Trace Attempt  3	[0.00 s]
0.0.AM: Trace Attempt  4	[0.00 s]
0.0.AM: Trace Attempt  5	[0.00 s]
0.0.AM: Trace Attempt  1	[0.00 s]
0.0.AM: Trace Attempt  2	[0.00 s]
0.0.AM: Trace Attempt  3	[0.00 s]
0.0.AM: Trace Attempt  4	[0.00 s]
0.0.AM: Trace Attempt  5	[0.00 s]
0.0.AM: Trace Attempt  1	[0.01 s]
0.0.AM: Trace Attempt  2	[0.01 s]
0.0.AM: Trace Attempt  3	[0.01 s]
0.0.AM: Trace Attempt  4	[0.01 s]
0.0.AM: Trace Attempt  5	[0.01 s]
0.0.AM: Trace Attempt  1	[0.03 s]
0.0.AM: Trace Attempt  2	[0.03 s]
0.0.AM: Trace Attempt  3	[0.03 s]
0.0.AM: Trace Attempt  4	[0.03 s]
0.0.AM: Trace Attempt  5	[0.03 s]
0.0.AM: Trace Attempt  1	[0.12 s]
0.0.AM: Trace Attempt  2	[0.12 s]
0.0.AM: Trace Attempt  3	[0.12 s]
0.0.AM: Trace Attempt  4	[0.12 s]
0.0.AM: Trace Attempt  5	[0.12 s]
0.0.N: Trace Attempt  1	[0.49 s]
0.0.N: Trace Attempt  2	[0.49 s]
0.0.N: Trace Attempt  3	[0.49 s]
0.0.N: Trace Attempt  4	[0.49 s]
0.0.N: Trace Attempt  5	[0.49 s]
0.0.AM: Trace Attempt  1	[0.50 s]
0.0.AM: Trace Attempt  2	[0.50 s]
0.0.AM: Trace Attempt  3	[0.50 s]
0.0.AM: Trace Attempt  4	[0.51 s]
0.0.AM: Trace Attempt  5	[0.51 s]
0.0.N: Trace Attempt  1	[2.09 s]
0.0.N: Trace Attempt  2	[2.09 s]
0.0.N: Trace Attempt  3	[2.09 s]
0.0.N: Trace Attempt  4	[2.09 s]
0.0.N: Trace Attempt  5	[2.09 s]
0.0.AM: Trace Attempt  1	[2.12 s]
0.0.AM: Trace Attempt  2	[2.12 s]
0.0.AM: Trace Attempt  3	[2.12 s]
0.0.AM: Trace Attempt  4	[2.12 s]
0.0.AM: Trace Attempt  5	[2.12 s]
0.0.N: Trace Attempt  1	[3.80 s]
0.0.N: Trace Attempt  2	[3.80 s]
0.0.N: Trace Attempt  3	[3.80 s]
0.0.N: Trace Attempt  4	[3.80 s]
0.0.N: Trace Attempt  5	[3.80 s]
0.0.Hp: Trace Attempt 374	[4.02 s]
0.0.Ht: Trace Attempt 1752	[4.00 s]
0.0.Bm: Trace Attempt 1685	[4.00 s]
0.0.B: Trace Attempt 1680	[4.00 s]
0.0.AM: Trace Attempt 200	[6.14 s]
0.0.N: Trace Attempt 188	[7.81 s]
0.0.Ht: Trace Attempt 2410	[8.00 s]
0.0.Bm: Trace Attempt 2339	[8.01 s]
0.0.Hp: Trace Attempt 494	[8.06 s]
0.0.B: Trace Attempt 2334	[8.00 s]
0.0.AM: Trace Attempt  1	[9.08 s]
0.0.AM: Trace Attempt  2	[9.08 s]
0.0.AM: Trace Attempt  3	[9.08 s]
0.0.AM: Trace Attempt  4	[9.08 s]
0.0.AM: Trace Attempt  5	[9.08 s]
0.0.N: Trace Attempt  1	[10.74 s]
0.0.N: Trace Attempt  2	[10.74 s]
0.0.N: Trace Attempt  3	[10.74 s]
0.0.N: Trace Attempt  4	[10.74 s]
0.0.N: Trace Attempt  5	[10.75 s]
0.0.Ht: Trace Attempt 2897	[12.01 s]
0.0.Bm: Trace Attempt 2820	[12.02 s]
0.0.B: Trace Attempt 2817	[12.01 s]
0.0.Hp: Trace Attempt 578	[12.11 s]
0.0.AM: Trace Attempt 188	[13.09 s]
0.0.N: Trace Attempt 185	[14.78 s]
0.0.Ht: Trace Attempt 3323	[16.01 s]
0.0.Bm: Trace Attempt 3237	[16.02 s]
0.0.B: Trace Attempt 3226	[16.02 s]
0.0.Hp: Trace Attempt 659	[16.12 s]
0.0.AM: Trace Attempt 251	[17.10 s]
0.0.N: Trace Attempt  1	[17.78 s]
0.0.N: Trace Attempt  2	[17.78 s]
0.0.N: Trace Attempt  3	[17.78 s]
0.0.N: Trace Attempt  4	[17.79 s]
0.0.N: Trace Attempt  5	[17.79 s]
0.0.Ht: Trace Attempt 3703	[20.01 s]
0.0.Bm: Trace Attempt 3606	[20.03 s]
0.0.B: Trace Attempt 3590	[20.02 s]
0.0.Hp: Trace Attempt 740	[20.17 s]
0.0.AM: Trace Attempt 298	[21.16 s]
0.0.N: Trace Attempt 185	[21.80 s]
0.0.Ht: Trace Attempt 4046	[24.02 s]
0.0.Bm: Trace Attempt 3931	[24.04 s]
0.0.B: Trace Attempt 3914	[24.03 s]
0.0.Hp: Trace Attempt 813	[24.18 s]
0.0.N: Trace Attempt  1	[24.82 s]
0.0.N: Trace Attempt  2	[24.82 s]
0.0.N: Trace Attempt  3	[24.82 s]
0.0.N: Trace Attempt  4	[24.82 s]
0.0.N: Trace Attempt  5	[24.82 s]
0.0.AM: Trace Attempt 341	[25.28 s]
0.0.Ht: Trace Attempt 4346	[28.02 s]
0.0.Bm: Trace Attempt 4232	[28.04 s]
0.0.B: Trace Attempt 4212	[28.04 s]
0.0.Hp: Trace Attempt 878	[28.21 s]
0.0.N: Trace Attempt 185	[28.83 s]
0.0.AM: Trace Attempt 376	[29.42 s]
0.0.N: Trace Attempt  1	[31.70 s]
0.0.N: Trace Attempt  2	[31.70 s]
0.0.N: Trace Attempt  3	[31.70 s]
0.0.N: Trace Attempt  4	[31.70 s]
0.0.N: Trace Attempt  5	[31.71 s]
0.0.Ht: Trace Attempt 4648	[32.03 s]
0.0.Bm: Trace Attempt 4522	[32.04 s]
0.0.B: Trace Attempt 4499	[32.05 s]
0.0.Hp: Trace Attempt 941	[32.24 s]
0.0.AM: Trace Attempt 413	[33.44 s]
0.0.N: Trace Attempt 186	[35.73 s]
0.0.Ht: Trace Attempt 4910	[36.04 s]
0.0.Bm: Trace Attempt 4788	[36.06 s]
0.0.B: Trace Attempt 4766	[36.05 s]
0.0.Hp: Trace Attempt 1000	[36.29 s]
0.0.AM: Trace Attempt 453	[37.55 s]
0.0.N: Trace Attempt  1	[38.87 s]
0.0.N: Trace Attempt  2	[38.87 s]
0.0.N: Trace Attempt  3	[38.87 s]
0.0.N: Trace Attempt  4	[38.87 s]
0.0.N: Trace Attempt  5	[38.87 s]
0.0.Ht: Trace Attempt 5159	[40.06 s]
0.0.Bm: Trace Attempt 5019	[40.06 s]
0.0.B: Trace Attempt 5000	[40.05 s]
0.0.Hp: Trace Attempt 1054	[40.33 s]
0.0.AM: Trace Attempt 491	[41.57 s]
0.0.N: Trace Attempt 185	[42.92 s]
0.0.Ht: Trace Attempt 5370	[44.06 s]
0.0.Bm: Trace Attempt 5229	[44.07 s]
0.0.B: Trace Attempt 5215	[44.07 s]
0.0.Hp: Trace Attempt 1106	[44.38 s]
0.0.AM: Trace Attempt 512	[45.67 s]
0.0.N: Trace Attempt  1	[46.03 s]
0.0.N: Trace Attempt  2	[46.03 s]
0.0.N: Trace Attempt  3	[46.03 s]
0.0.N: Trace Attempt  4	[46.03 s]
0.0.N: Trace Attempt  5	[46.03 s]
0.0.AM: Trace Attempt  1	[46.80 s]
0.0.AM: Trace Attempt  2	[46.80 s]
0.0.AM: Trace Attempt  3	[46.80 s]
0.0.AM: Trace Attempt  4	[46.81 s]
0.0.AM: Trace Attempt  5	[46.81 s]
0.0.Ht: Trace Attempt 5607	[48.08 s]
0.0.Bm: Trace Attempt 5442	[48.08 s]
0.0.B: Trace Attempt 5429	[48.07 s]
0.0.Hp: Trace Attempt 1156	[48.39 s]
0.0.N: Trace Attempt 185	[50.05 s]
0.0.AM: Trace Attempt 180	[50.84 s]
0.0.Ht: Trace Attempt 5820	[52.09 s]
0.0.Bm: Trace Attempt 5670	[52.09 s]
0.0.B: Trace Attempt 5658	[52.08 s]
0.0.Hp: Trace Attempt 1204	[52.47 s]
0.0.N: Trace Attempt  1	[53.13 s]
0.0.N: Trace Attempt  2	[53.13 s]
0.0.N: Trace Attempt  3	[53.13 s]
0.0.N: Trace Attempt  4	[53.14 s]
0.0.N: Trace Attempt  5	[53.14 s]
0.0.AM: Trace Attempt 243	[54.89 s]
0.0.Ht: Trace Attempt 6041	[56.11 s]
0.0.Bm: Trace Attempt 5878	[56.11 s]
0.0.B: Trace Attempt 5867	[56.09 s]
0.0.Hp: Trace Attempt 1249	[56.53 s]
0.0.N: Trace Attempt 186	[57.17 s]
0.0.AM: Trace Attempt 261	[59.01 s]
0.0.Ht: Trace Attempt 6249	[60.11 s]
0.0.Bm: Trace Attempt 6084	[60.12 s]
0.0.B: Trace Attempt 6073	[60.09 s]
0.0.N: Trace Attempt  1	[60.62 s]
0.0.N: Trace Attempt  2	[60.62 s]
0.0.N: Trace Attempt  3	[60.62 s]
0.0.N: Trace Attempt  4	[60.62 s]
0.0.N: Trace Attempt  5	[60.62 s]
0.0.AM: Trace Attempt 278	[63.20 s]
0.0.Hp: Trace Attempt 1265	[63.94 s]
0.0.Ht: Trace Attempt 6455	[64.11 s]
0.0.B: Trace Attempt 6277	[64.09 s]
0.0.Bm: Trace Attempt 6290	[64.12 s]
0.0.N: Trace Attempt 185	[64.64 s]
0.0.AM: Trace Attempt 292	[67.57 s]
0.0.Hp: Trace Attempt 1420	[67.96 s]
0.0.Ht: Trace Attempt 6663	[68.12 s]
0.0.B: Trace Attempt 6467	[68.09 s]
0.0.Bm: Trace Attempt 6481	[68.12 s]
0.0.N: Trace Attempt 228	[68.75 s]
0.0.AM: Trace Attempt 308	[71.64 s]
0.0.Hp: Trace Attempt 1557	[71.97 s]
0.0.Ht: Trace Attempt 6843	[72.14 s]
0.0.Bm: Trace Attempt 6667	[72.13 s]
0.0.B: Trace Attempt 6652	[72.11 s]
0.0.N: Trace Attempt 281	[72.77 s]
0.0.AM: Trace Attempt 328	[75.75 s]
0.0.Hp: Trace Attempt 1680	[75.99 s]
0.0.Ht: Trace Attempt 7030	[76.15 s]
0.0.B: Trace Attempt 6827	[76.11 s]
0.0.Bm: Trace Attempt 6843	[76.14 s]
0.0.N: Trace Attempt 352	[76.77 s]
0.0.Hp: Trace Attempt 1792	[80.01 s]
0.0.B: Trace Attempt 6994	[80.12 s]
0.0.Ht: Trace Attempt 7207	[80.16 s]
0.0.Bm: Trace Attempt 7011	[80.15 s]
0.0.AM: Trace Attempt 348	[80.10 s]
0.0.N: Trace Attempt 434	[80.84 s]
0.0.Hp: Trace Attempt 1895	[84.03 s]
0.0.B: Trace Attempt 7158	[84.13 s]
0.0.Ht: Trace Attempt 7362	[84.18 s]
0.0.Bm: Trace Attempt 7175	[84.17 s]
0.0.AM: Trace Attempt 363	[84.38 s]
0.0.N: Trace Attempt  1	[84.70 s]
0.0.N: Trace Attempt  2	[84.70 s]
0.0.N: Trace Attempt  3	[84.70 s]
0.0.N: Trace Attempt  4	[84.70 s]
0.0.N: Trace Attempt  5	[84.70 s]
0.0.Hp: Trace Attempt 1995	[88.06 s]
0.0.B: Trace Attempt 7322	[88.14 s]
0.0.Ht: Trace Attempt 7532	[88.19 s]
0.0.Bm: Trace Attempt 7341	[88.19 s]
0.0.N: Trace Attempt 184	[88.70 s]
0.0.AM: Trace Attempt 376	[88.60 s]
0.0.Hp: Trace Attempt 2088	[92.07 s]
0.0.Ht: Trace Attempt 7701	[92.19 s]
0.0.B: Trace Attempt 7484	[92.16 s]
0.0.Bm: Trace Attempt 7501	[92.21 s]
0.0.N: Trace Attempt 228	[92.82 s]
0.0.AM: Trace Attempt 390	[92.98 s]
0.0.Hp: Trace Attempt 2176	[96.10 s]
0.0.Ht: Trace Attempt 7853	[96.20 s]
0.0.B: Trace Attempt 7639	[96.18 s]
0.0.Bm: Trace Attempt 7656	[96.22 s]
0.0.N: Trace Attempt 281	[96.84 s]
0.0.AM: Trace Attempt 405	[97.26 s]
0.0.Hp: Trace Attempt 2260	[100.14 s]
0.0.Ht: Trace Attempt 8010	[100.20 s]
0.0.B: Trace Attempt 7787	[100.19 s]
0.0.Bm: Trace Attempt 7805	[100.24 s]
0.0.N: Trace Attempt 351	[100.86 s]
0.0.AM: Trace Attempt 418	[101.32 s]
0.0.Hp: Trace Attempt 2340	[104.14 s]
0.0.Ht: Trace Attempt 8171	[104.21 s]
0.0.B: Trace Attempt 7929	[104.19 s]
0.0.Bm: Trace Attempt 7949	[104.25 s]
0.0.N: Trace Attempt 431	[104.89 s]
0.0.AM: Trace Attempt 430	[105.76 s]
0.0.Hp: Trace Attempt 2417	[108.16 s]
0.0.Ht: Trace Attempt 8309	[108.22 s]
0.0.B: Trace Attempt 8065	[108.22 s]
0.0.Bm: Trace Attempt 8086	[108.26 s]
0.0.N: Trace Attempt  1	[108.82 s]
0.0.N: Trace Attempt  2	[108.82 s]
0.0.N: Trace Attempt  3	[108.82 s]
0.0.N: Trace Attempt  4	[108.82 s]
0.0.N: Trace Attempt  5	[108.82 s]
0.0.AM: Trace Attempt 440	[109.86 s]
0.0.Hp: Trace Attempt 2493	[112.17 s]
0.0.Ht: Trace Attempt 8450	[112.22 s]
0.0.B: Trace Attempt 8206	[112.23 s]
0.0.Bm: Trace Attempt 8229	[112.28 s]
0.0.N: Trace Attempt 186	[112.84 s]
0.0.AM: Trace Attempt 451	[114.13 s]
0.0.Hp: Trace Attempt 2566	[116.19 s]
0.0.Ht: Trace Attempt 8609	[116.25 s]
0.0.B: Trace Attempt 8347	[116.25 s]
0.0.Bm: Trace Attempt 8371	[116.31 s]
0.0.N: Trace Attempt 228	[116.87 s]
0.0.AM: Trace Attempt 462	[118.31 s]
0.0.Hp: Trace Attempt 2637	[120.22 s]
0.0.Ht: Trace Attempt 8755	[120.26 s]
0.0.B: Trace Attempt 8490	[120.26 s]
0.0.Bm: Trace Attempt 8514	[120.33 s]
0.0.N: Trace Attempt 282	[120.88 s]
0.0.AM: Trace Attempt 472	[122.49 s]
0.0.Hp: Trace Attempt 2705	[124.23 s]
0.0.Ht: Trace Attempt 8889	[124.28 s]
0.0.B: Trace Attempt 8629	[124.28 s]
0.0.Bm: Trace Attempt 8652	[124.36 s]
0.0.N: Trace Attempt 354	[124.92 s]
0.0.AM: Trace Attempt 483	[127.46 s]
0.0.Hp: Trace Attempt 2771	[128.24 s]
0.0.Ht: Trace Attempt 9031	[128.29 s]
0.0.B: Trace Attempt 8765	[128.30 s]
0.0.Bm: Trace Attempt 8788	[128.36 s]
0.0.N: Trace Attempt 435	[128.94 s]
0.0.AM: Trace Attempt 490	[131.47 s]
0.0.Hp: Trace Attempt 2835	[132.30 s]
0.0.Ht: Trace Attempt 9175	[132.32 s]
0.0.B: Trace Attempt 8892	[132.32 s]
0.0.Bm: Trace Attempt 8917	[132.38 s]
0.0.N: Trace Attempt 449	[133.26 s]
0.0.N: Trace Attempt  1	[133.27 s]
0.0.N: Trace Attempt  2	[133.27 s]
0.0.N: Trace Attempt  3	[133.27 s]
0.0.N: Trace Attempt  4	[133.27 s]
0.0.N: Trace Attempt  5	[133.27 s]
0.0.AM: Trace Attempt 497	[135.60 s]
0.0.Hp: Trace Attempt 2899	[136.31 s]
0.0.Ht: Trace Attempt 9305	[136.34 s]
0.0.B: Trace Attempt 9023	[136.32 s]
0.0.Bm: Trace Attempt 9049	[136.39 s]
0.0.N: Trace Attempt 186	[137.28 s]
0.0.AM: Trace Attempt 507	[139.78 s]
0.0.Hp: Trace Attempt 2962	[140.36 s]
0.0.Ht: Trace Attempt 9429	[140.34 s]
0.0.B: Trace Attempt 9153	[140.33 s]
0.0.Bm: Trace Attempt 9181	[140.42 s]
0.0.N: Trace Attempt 228	[141.29 s]
0.0.AM: Trace Attempt 515	[143.85 s]
0.0.Hp: Trace Attempt 3023	[144.37 s]
0.0.Ht: Trace Attempt 9567	[144.37 s]
0.0.B: Trace Attempt 9283	[144.36 s]
0.0.Bm: Trace Attempt 9311	[144.44 s]
0.0.N: Trace Attempt 280	[145.29 s]
0.0.AM: Trace Attempt 524	[148.18 s]
0.0.Hp: Trace Attempt 3082	[148.39 s]
0.0.Ht: Trace Attempt 9706	[148.39 s]
0.0.B: Trace Attempt 9410	[148.38 s]
0.0.Bm: Trace Attempt 9438	[148.45 s]
0.0.N: Trace Attempt 351	[149.32 s]
0.0.Hp: Trace Attempt 3139	[152.40 s]
0.0.Ht: Trace Attempt 9824	[152.39 s]
0.0.B: Trace Attempt 9533	[152.39 s]
0.0.Bm: Trace Attempt 9562	[152.47 s]
0.0.AM: Trace Attempt 534	[152.41 s]
0.0.N: Trace Attempt 432	[153.32 s]
0.0.Ht: Trace Attempt 9936	[156.40 s]
0.0.Hp: Trace Attempt 3194	[156.45 s]
0.0.B: Trace Attempt 9651	[156.40 s]
0.0.Bm: Trace Attempt 9681	[156.50 s]
0.0.AM: Trace Attempt 542	[156.47 s]
0.0.N: Trace Attempt 450	[158.51 s]
0.0.N: Trace Attempt  1	[158.53 s]
0.0.N: Trace Attempt  2	[158.53 s]
0.0.N: Trace Attempt  3	[158.53 s]
0.0.N: Trace Attempt  4	[158.53 s]
0.0.N: Trace Attempt  5	[158.53 s]
0.0.Ht: Trace Attempt 10060	[160.43 s]
0.0.B: Trace Attempt 9767	[160.41 s]
0.0.Hp: Trace Attempt 3248	[160.51 s]
0.0.Bm: Trace Attempt 9798	[160.53 s]
0.0.AM: Trace Attempt 551	[160.54 s]
0.0.N: Trace Attempt 185	[162.55 s]
0.0.Ht: Trace Attempt 10191	[164.45 s]
0.0.B: Trace Attempt 9885	[164.44 s]
0.0.Hp: Trace Attempt 3302	[164.52 s]
0.0.Bm: Trace Attempt 9916	[164.54 s]
0.0.AM: Trace Attempt 560	[164.58 s]
0.0.N: Trace Attempt 228	[166.70 s]
0.0.Ht: Trace Attempt 10307	[168.45 s]
0.0.Hp: Trace Attempt 3355	[168.53 s]
0.0.B: Trace Attempt 10001	[168.46 s]
0.0.Bm: Trace Attempt 10032	[168.55 s]
0.0.AM: Trace Attempt 570	[169.11 s]
0.0.N: Trace Attempt 282	[170.73 s]
0.0.Ht: Trace Attempt 10418	[172.46 s]
0.0.Hp: Trace Attempt 3408	[172.53 s]
0.0.B: Trace Attempt 10116	[172.47 s]
0.0.Bm: Trace Attempt 10147	[172.57 s]
0.0.AM: Trace Attempt 579	[173.43 s]
0.0.N: Trace Attempt 352	[174.73 s]
0.0.Ht: Trace Attempt 10531	[176.49 s]
0.0.B: Trace Attempt 10227	[176.47 s]
0.0.Hp: Trace Attempt 3460	[176.59 s]
0.0.Bm: Trace Attempt 10259	[176.60 s]
0.0.AM: Trace Attempt 587	[177.51 s]
0.0.N: Trace Attempt 434	[178.73 s]
0.0.Ht: Trace Attempt 10651	[180.49 s]
0.0.B: Trace Attempt 10333	[180.49 s]
0.0.Hp: Trace Attempt 3511	[180.64 s]
0.0.Bm: Trace Attempt 10367	[180.63 s]
0.0.N: Trace Attempt 450	[180.96 s]
0.0.N: Stopped processing property "SEVEN.p1"	[180.96 s].
0.0.N: Morphing to Ncustom1
0.0.N: All properties determined. [0.00 s]
0.0.N: Exited with Success (@ 0.00 s)
0.0.Ncustom1: clocks: 1, declared: 1, looping: 0, posedge: 1, negedge: 0, noedge: 0, bothedge: 0
0.0.Ncustom1: Starting proof for property "SEVEN.p1"	[0.00 s].
0.0.Ncustom1: Trace Attempt 450	[0.04 s]
0.0.Tri: Proofgrid shell started at 12552@vlsi-ria85(local) jg_4296_vlsi-ria85_1
0.0.Tri: clocks: 1, declared: 1, looping: 0, posedge: 1, negedge: 0, noedge: 0, bothedge: 0
0.0.Tri: Last scan. Per property time limit: 0s
0.0.Tri: Starting proof for property "SEVEN.p1"	[0.00 s].
0.0.Tri: Trace Attempt  1	[0.00 s]
0.0.B: Trace Attempt 10343	[180.88 s]
0.0.B: Stopped processing property "SEVEN.p1"	[181.02 s].
0.0.B: Morphing to Bcustom2
0.0.B: All properties determined. [0.00 s]
0.0.B: Exited with Success (@ 0.00 s)
0.0.Bcustom2: clocks: 1, declared: 1, looping: 0, posedge: 1, negedge: 0, noedge: 0, bothedge: 0
0.0.Bcustom2: Starting proof for property "SEVEN.p1"	[0.00 s].
0.0.Bcustom2: Trace Attempt  1	[0.00 s]
0.0.Bcustom2: Trace Attempt  2	[0.00 s]
0.0.Bcustom2: Trace Attempt  1	[0.00 s]
0.0.Bcustom2: Trace Attempt  2	[0.00 s]
0.0.Bcustom2: Trace Attempt  3	[0.00 s]
0.0.Bcustom2: Trace Attempt  4	[0.00 s]
0.0.Bcustom2: Trace Attempt  5	[0.00 s]
0.0.Bcustom2: Trace Attempt  1	[0.00 s]
0.0.Bcustom2: Trace Attempt  2	[0.00 s]
0.0.Bcustom2: Trace Attempt  3	[0.00 s]
0.0.Bcustom2: Trace Attempt  4	[0.00 s]
0.0.Bcustom2: Trace Attempt  5	[0.00 s]
0.0.Bcustom2: Trace Attempt  1	[0.00 s]
0.0.Bcustom2: Trace Attempt  2	[0.00 s]
0.0.Bcustom2: Trace Attempt  3	[0.00 s]
0.0.Bcustom2: Trace Attempt  4	[0.00 s]
0.0.Bcustom2: Trace Attempt  5	[0.00 s]
0.0.Bcustom2: Trace Attempt  1	[0.01 s]
0.0.Bcustom2: Trace Attempt  2	[0.01 s]
0.0.Bcustom2: Trace Attempt  3	[0.01 s]
0.0.Bcustom2: Trace Attempt  4	[0.01 s]
0.0.Bcustom2: Trace Attempt  5	[0.01 s]
0.0.Bcustom2: Trace Attempt  1	[0.02 s]
0.0.Bcustom2: Trace Attempt  2	[0.02 s]
0.0.AM: Trace Attempt 593	[180.59 s]
0.0.AM: Stopped processing property "SEVEN.p1"	[180.99 s].
0.0.Bcustom2: Trace Attempt  3	[0.02 s]
0.0.Bcustom2: Trace Attempt  4	[0.02 s]
0.0.Bcustom2: Trace Attempt  5	[0.02 s]
0.0.AM: Morphing to AMcustom3
0.0.Bcustom2: Trace Attempt  1	[0.04 s]
0.0.Bcustom2: Trace Attempt  2	[0.04 s]
0.0.Bcustom2: Trace Attempt  3	[0.04 s]
0.0.Bcustom2: Trace Attempt  4	[0.04 s]
0.0.Bcustom2: Trace Attempt  5	[0.04 s]
0.0.Tri:    0.00" ---- Launching main thread ----
0.0.AM: All properties determined. [0.00 s]
0.0.AM: Exited with Success (@ 0.00 s)
0.0.AMcustom3: clocks: 1, declared: 1, looping: 0, posedge: 1, negedge: 0, noedge: 0, bothedge: 0
0.0.AMcustom3: Starting proof for property "SEVEN.p1"	[0.00 s].
0.0.AMcustom3: Trace Attempt  1	[0.00 s]
0.0.AMcustom3: Trace Attempt  2	[0.00 s]
0.0.AMcustom3: Trace Attempt  3	[0.00 s]
0.0.AMcustom3: Trace Attempt  4	[0.00 s]
0.0.AMcustom3: Trace Attempt  5	[0.00 s]
0.0.AMcustom3: Trace Attempt  1	[0.00 s]
0.0.AMcustom3: Trace Attempt  2	[0.00 s]
0.0.AMcustom3: Trace Attempt  3	[0.00 s]
0.0.AMcustom3: Trace Attempt  4	[0.00 s]
0.0.AMcustom3: Trace Attempt  5	[0.00 s]
0.0.D: Proofgrid shell started at 12561@vlsi-ria85(local) jg_4296_vlsi-ria85_1
0.0.D: clocks: 1, declared: 1, looping: 0, posedge: 1, negedge: 0, noedge: 0, bothedge: 0
0.0.D: Last scan. Per property time limit: 0s
0.0.D: Starting proof for property "SEVEN.p1"	[0.00 s].
0.0.D: Trace Attempt  1	[0.00 s]
0.0.D: Trace Attempt  2	[0.00 s]
0.0.D: Trace Attempt  3	[0.00 s]
0.0.AMcustom3: Trace Attempt  1	[0.01 s]
0.0.AMcustom3: Trace Attempt  2	[0.01 s]
0.0.AMcustom3: Trace Attempt  3	[0.01 s]
0.0.AMcustom3: Trace Attempt  4	[0.01 s]
0.0.AMcustom3: Trace Attempt  5	[0.01 s]
0.0.Bcustom2: Trace Attempt  1	[0.09 s]
0.0.Bcustom2: Trace Attempt  2	[0.09 s]
0.0.Bcustom2: Trace Attempt  3	[0.09 s]
0.0.Bcustom2: Trace Attempt  4	[0.09 s]
0.0.Bcustom2: Trace Attempt  5	[0.09 s]
0.0.AMcustom3: Trace Attempt  1	[0.03 s]
0.0.AMcustom3: Trace Attempt  2	[0.03 s]
0.0.AMcustom3: Trace Attempt  3	[0.03 s]
0.0.AMcustom3: Trace Attempt  4	[0.03 s]
0.0.AMcustom3: Trace Attempt  5	[0.03 s]
0.0.AMcustom3: Trace Attempt  1	[0.13 s]
0.0.AMcustom3: Trace Attempt  2	[0.13 s]
0.0.AMcustom3: Trace Attempt  3	[0.13 s]
0.0.AMcustom3: Trace Attempt  4	[0.13 s]
0.0.AMcustom3: Trace Attempt  5	[0.13 s]
0.0.Bcustom2: Trace Attempt  1	[0.22 s]
0.0.Bcustom2: Trace Attempt  2	[0.22 s]
0.0.Bcustom2: Trace Attempt  3	[0.22 s]
0.0.Bcustom2: Trace Attempt  4	[0.22 s]
0.0.Bcustom2: Trace Attempt  5	[0.22 s]
0.0.Tri:    0.20" ---- Launching abstraction thread ----
0.0.Tri:    0.23" ---- Launching multi-phase simplification thread ----
0.0.Tri:    0.33" ---- Launching liveness simplification thread ----
0.0.AMcustom3: Trace Attempt  1	[0.59 s]
0.0.AMcustom3: Trace Attempt  2	[0.59 s]
0.0.AMcustom3: Trace Attempt  3	[0.59 s]
0.0.AMcustom3: Trace Attempt  4	[0.59 s]
0.0.AMcustom3: Trace Attempt  5	[0.59 s]
0.0.Tri:    1.17" Simplification phase 1 complete
0.0.Ncustom1: Requesting engine job to terminate
0.0.Bcustom2: Requesting engine job to terminate
0.0.AMcustom3: Requesting engine job to terminate
0.0.Tri: Requesting engine job to terminate
0.0.D: Requesting engine job to terminate
0.0.Hp: Requesting engine job to terminate
0.0.Ht: Requesting engine job to terminate
0.0.Bm: Requesting engine job to terminate
INFO (IPF144): 0: Initiating shutdown of proof [182.39 s]
0.0.Tri: A proof was found: No trace exists. [1.29 s]
INFO (IPF057): 0.0.Tri: The property "SEVEN.p1" was proven in 1.29 s.
0.0.Ht: Trace Attempt 10704	[182.33 s]
0.0.Ht: All properties determined. [182.36 s]
0.0.AMcustom3: Trace Attempt 70	[1.20 s]
0.0.AMcustom3: Stopped processing property "SEVEN.p1"	[1.24 s].
0.0.AMcustom3: All properties determined. [1.23 s]
0.0.D: Trace Attempt 63	[1.01 s]
0.0.D: Stopped processing property "SEVEN.p1"	[1.23 s].
0.0.D: All properties determined. [1.22 s]
0.0.Hp: Trace Attempt 3532	[182.38 s]
0.0.Hp: All properties determined. [182.40 s]
0.0.D: Exited with Success (@ 182.40 s)
0: ProofGrid usable level: 0
0.0.AMcustom3: Exited with Success (@ 182.41 s)
0.0.Ncustom1: Stopped processing property "SEVEN.p1"	[1.41 s].
0.0.Ncustom1: All properties determined. [1.42 s]
0.0.Ncustom1: Exited with Success (@ 182.42 s)
0.0.Bm: Trace Attempt 10409	[182.33 s]
0.0.Bm: All properties determined. [182.45 s]
0.0.Ht: Exited with Success (@ 182.53 s)
0.0.Bm: Exited with Success (@ 182.54 s)
0.0.Tri: Stopped processing property "SEVEN.p1"	[1.49 s].
0.0.Tri: All properties determined. [1.50 s]
0.0.Tri: Exited with Success (@ 182.60 s)
0.0.Hp: Exited with Success (@ 182.62 s)
0.0.Bcustom2: Trace Attempt  1	[2.34 s]
0.0.Bcustom2: Stopped processing property "SEVEN.p1"	[2.34 s].
0.0.Bcustom2: All properties determined. [2.34 s]
0.0.Bcustom2: Exited with Success (@ 183.47 s)
0: --------------------------------------------------------------
ProofGrid Summary (utilization 99.93 %)
--------------------------------------------------------------
     engines started                               :    14
     engine jobs started                           :    11

    Average time in state (seconds)
    ------------------------------------------------------
    Engine  Pending     Running        Dead    Utilization
    ------------------------------------------------------
     Hp        0.03      182.39        0.00       99.98 %
     Ht        0.03      182.36        0.00       99.98 %
     Bm        0.05      182.34        0.00       99.97 %
    Mpcustom4        0.04        0.01        0.00       14.75 %
     Oh        0.07        0.00        0.00        6.59 %
      L        0.03        0.00        0.00        0.88 %
    Ncustom1        0.04      182.37        0.00       99.98 %
    Bcustom2        0.06      182.18        0.00       99.97 %
    AMcustom3        0.12      182.06        0.00       99.93 %
    Tri        0.11        1.30        0.00       91.89 %
      D        0.19        1.22        0.00       86.67 %
    all        0.07       99.66        0.00       99.93 %

    Total time in state (seconds)
    -----------------------------------------
            Pending     Running        Dead  
    -----------------------------------------
               0.78     1096.25        0.00

    Data read    : 7.07 MiB
    Data written : 3.97 kiB

0: All pending notifications were processed.
INFO (IPF059): 0: Completed proof on task: "<embedded>"

==============================================================
SUMMARY
==============================================================
           Properties Considered              : 2
                 assertions                   : 1
                  - proven                    : 1 (100%)
                  - bounded_proven (user)     : 0 (0%)
                  - bounded_proven (auto)     : 0 (0%)
                  - marked_proven             : 0 (0%)
                  - cex                       : 0 (0%)
                  - ar_cex                    : 0 (0%)
                  - undetermined              : 0 (0%)
                  - unknown                   : 0 (0%)
                  - error                     : 0 (0%)
                 covers                       : 1
                  - unreachable               : 0 (0%)
                  - bounded_unreachable (user): 0 (0%)
                  - covered                   : 1 (100%)
                  - ar_covered                : 0 (0%)
                  - undetermined              : 0 (0%)
                  - unknown                   : 0 (0%)
                  - error                     : 0 (0%)
determined
[<embedded>] % exit -force
[<embedded>] % INFO (IPL005): Received request to exit from the console.
INFO (IPL014): Waiting for the Tcl-thread to exit.
INFO: Waiting for proof threads to stop...
INFO: Proof threads stopped.
INFO (IPL018): The peak resident set memory use for this session was 2.069 GB.
INFO (IPL015): The Tcl-thread exited with status 0.
INFO (IPL016): Exiting the analysis session with status 0.
Finished 2_seven_seg_9.tcl successfully
