Jasper Apps 2024.06p002 64 bits 2024.09.02 16:28:38 UTC

Any disclosure about the Cadence Design Systems software or its use
model to any third party violates the written Non-Disclosure Agreement
between Cadence Design Systems, Inc. and the customer.

THIS SOFTWARE CONTAINS CONFIDENTIAL INFORMATION AND TRADE SECRETS OF
CADENCE DESIGN SYSTEMS, INC. USE, DISCLOSURE, OR REPRODUCTION IS
PROHIBITED WITHOUT THE PRIOR EXPRESS WRITTEN PERMISSION OF CADENCE
DESIGN SYSTEMS, INC.

Copyright (C) 2000-2024 Cadence Design Systems, Inc. All Rights
Reserved.  Unpublished -- rights reserved under the copyright laws of
the United States.

This product includes software developed by others and redistributed
according to license agreement. See doc/third_party_readme.txt for
further details.

RESTRICTED RIGHTS LEGEND

Use, duplication, or disclosure by the Government is subject to
restrictions as set forth in subparagraph (c) (1) (ii) of the Rights in
Technical Data and Computer Software clause at DFARS 252.227-7013 or
subparagraphs (c) (1) and (2) of Commercial Computer Software -- Restricted
Rights at 48 CFR 52.227-19, as applicable.


                          Cadence Design Systems, Inc.
                          2655 Seely Avenue
                          San Jose, CA 95134
                          Phone: 408.943.1234

For technical assistance visit http://support.cadence.com.

Jasper Apps Analysis Session - /users/rompel/jasper_executions/liveness/jgprojects/2_seven_seg_1/sessionLogs/session_0

WARNING (WG017): [session]: The system's locale is "ANSI_X3.4-1968", which is not UTF-8. Non-ASCII characters might not be handled correctly.
WARNING (WG017): [jg_console]: The system's locale is "ANSI_X3.4-1968", which is not UTF-8. Non-ASCII characters might not be handled correctly.
INFO: successfully checked out license "jasper_fao".
INFO: reading configuration file "/users/rompel/.config/cadence/jasper.conf".
% analyze -sv09 ../2_seven_seg_1.sv
[-- (VERI-1482)] Analyzing Verilog file '/tools/cadence2425/JASPER/jasper_2024.06p002/lib/verilog/packages/std/std.sv' into library 'std'
[-- (VERI-1482)] Analyzing Verilog file '../2_seven_seg_1.sv'
% elaborate -bbox_mul 1000000 -bbox_div 1000000 -bbox_mod 1000000 -bbox_a 1000000
[INFO (HIER-8002)] ../2_seven_seg_1.sv(32): Disabling old hierarchical reference handler
[INFO (VERI-1018)] ../2_seven_seg_1.sv(1): compiling module 'SEVEN'
[WARN (VERI-1209)] ../2_seven_seg_1.sv(15): expression size 32 truncated to fit in target size 8
[INFO (VERI-8005)] ../2_seven_seg_1.sv(5): Unintentional sequential element inferred for cnt read before write using blocking assignment
[INFO (VERI-8005)] ../2_seven_seg_1.sv(6): Unintentional sequential element inferred for digit_select read before write using blocking assignment
[INFO (VERI-8005)] ../2_seven_seg_1.sv(1): Unintentional sequential element inferred for segment read before write using blocking assignment
[INFO (VERI-8005)] ../2_seven_seg_1.sv(1): Unintentional sequential element inferred for sig read before write using blocking assignment
INFO (ISW003): Top module name is "SEVEN".
INFO (INL208): Elaboration synthesis summary:
  Number of synthesized netlists          1 (0 packages)
  Single run mode                         On
  Pipeline                                On (1 pipelined netlists)
  Late hierarchical reference connection  On
  Number of analyzed Verilog modules      1 (1 synthesized)
  Number of analyzed VHDL entities        0 (0 synthesized)
INFO (INL003): Clearing all state information (assumes, stopats, and so forth).
SEVEN
[<embedded>] % reset rst
INFO (IPM031): Clearing proof results of all properties.
INFO (IRS006): Current reset condition is "rst".
[<embedded>] % clock clk
[<embedded>] % prove -all
Ncustom1: Custom engine code is hT3Ng7hPPfiYQOTDZ3qhYOwGAM51eA+J/FjkM5shLioAsqhgLR4Ft+O1BuKG6ilQ83B9tLXSl+CwjiTMAQA
Bcustom2: Custom engine code is hT3Nm7hPr1Vp3Di1Ra2USNIGL4JypRnLKLAdF6JAyuavO2JfGCiY9OZJhcAcOUnLx5xwNdhILGrAWX9s+z2WDkKwNR7tAfClBEjRFVQeq6DU54boFgEA
AMcustom3: Custom engine code is hT3Ng7hP/feYQOTDZ3qhYOwGAM51eA+J/FjkM5shLioAsqhgLR4Ft+O1BuKG6ilQ83B9tLXSmmqwm7g9AQA
Mpcustom4: Custom engine code is hT3NZbhP9fmY2AbBQnsjfOxn6c+6e6yL+/e8fZFmaQrnlgEA
INFO (IPF036): Starting proof on task: "<embedded>", 2 properties to prove with 0 already proven/unreachable
INFO (IRS029): Starting reset analysis: phase 1 of 4.
INFO (IRS030): Running reset analysis: phase 2 of 4.
INFO (IRS031): Running reset analysis: phase 3 of 4.
INFO (IRS020): Starting the reset analysis simulation with a limit of 100 iterations (phase 4 of 4).
INFO (IRS024): Reset iterations 0 to 4 analyzed.
INFO (IRS018): Reset analysis simulation executed for 3 iterations. Assigned values for 17 of 17 design flops, 0 of 0 design latches, 6 of 6 internal elements.
INFO (IRS039): Reset analysis complete.
INFO (IPF031): Settings used for proof thread 0:
    orchestration                 = on
    time_limit                    = 86400s
    per_property_time_limit       = 1s * 10 ^ scan
    engine_mode                   = auto
    proofgrid_per_engine_max_jobs = 1
    max engine jobs               = auto
    proofgrid_mode                = local
    proofgrid_restarts            = 10
AMcustom5: Custom engine code is hT3N1rhP11/52HrFRS21ROp2LOjVTgPvT8L8BGXHgLhaIuqtT4nARFjUqrBL+7pLmaTOzBepZW/Jm8SSrHDybSQtoNiO3y43wk+dEoWlsZizu97Fih6O6lPVG/LpWP5SsUPwlGagLNa1FKEFvwVXyX7//8prySbvSxIHXr5er+z4RAEA
0: Using multistage preprocessing
Ncustom6: Custom engine code is hT3OXrhPByJp3TrFSTLhUmMH4KVtJgmTCnNDF46yMXOKY48m4LS5nE7yBzFjA7kDuwO/GhGUpEPiky3p3wmPn3dJZHxFMsafSoObRzSC+tn7sEY0WbTdZ/FV4hL3MYH/b1CIUvXSWR4wqEoVLsmMOD4xIPT4lI1LO6ZCO7PnnWQuLwetnvKlrXx6wCW/A+x+enqslg1YPobi4wEF/EvbzOvcTYdJvl2s4H2yZg2b2ofAVN5WvhWk1HoBAA
0: Starting reduce
ADcustom7: Custom engine code is hT3Nv7hPv1752HrFRa2kROx2f/ECJeZB2AZsLdlO8VwmIuqtT4nIDFXclhg+O+o+DMmQCekbheGk0kK28laA9gaOFDXsQp29J3X615HY1IPHJWd6FUFvCHjO+p1k652b5JJvZlShNpGlGSXAiQe/mEAj6tEBAA
Tricustom8: Custom engine code is hT3Nu7hPt1752DvFRa0kNDiyIV97VyejwM9C/jCLJjdPvusZONHY42VYUy0Q1ZotnhcVtNc56tJ5wbxv6V2+XpdsaSlHck5vfnbYjdwj1OECy9U+7oSQ0SZE3g5ayD+Phuh4odCJTjeKa2k4elM9ldQfkAEA
Gcustom9: Custom engine code is hT3NibhPDfeYQADBZnYcglOvK9Pfd7EOeniIqP8jNsyIqInncipMGcUXqAadachREE9F2PwhBUZUNw5kHnd4JdXkamORRgEA
C2custom10: Custom engine code is hT3NirhPjfWYQADBZnYcglOvK9Pfd7EOeniIqP8jNsyIqInncgkrYMMXCYbdK0dUjZIF9d4cJ0rHoBDjwVLBKuG86XYVV00BAA
AGcustom11: Custom engine code is hT3NirhP/fmYQADBZnYcglOvK9Pfd7EOeniIqP8jNsyIqInnckcwYMMXCYbdK0dUjZIF9d4cJ0rHoBDjwVLBKuHEZnZByh0BAA
Bcustom12: Custom engine code is hT3NjrhPDfiYQADBZnYcglOvK9PfWxFtenjIyBqfrgr7if/jL/yPOuK1BAflEcW0DxNH2eDIoezN2gxlQFg81RZtiWXh7aiTAidvAQA
Ncustom13: Custom engine code is hT3NR7hPByFp3TrFSTLhUmMH4KWtJglTyV/c51BHEeZWamnJv767nE6PCak26bd3gf3XGN3rIRheufhDieCJQVISo+gNYUKhiUedBKGtsP/a18svAnlMJZudHxDFwK5ufsyoxsIyiAeSY2oi3tEuoDHr5gw42DFKAG3PqO3CEsl8Azzdt3pl5nGA1Ifv2H02eYsFzWb/nfp8PMb3F0krE/EgBcm8TD9Div8BAA
0: Finished reduce in 0s
Tricustom14: Custom engine code is hT3Nu7hP3fiYQADBZnYcglNHp9bfd7EOeniIqP/ji8sGLQu8yhsFO+wxJ+O+R0bU8g/IewXFomyos+viQnWc2xYNYmMqpo3i40O7DaZR7qfp4YqNx26KRvQ/qx0BAA
0.0.PRE: Performing Proof Simplification...
0.0.N: clocks: 1, declared: 1, looping: 0, posedge: 1, negedge: 0, noedge: 0, bothedge: 0
0.0.N: Proof Simplification Iteration 1	[0.00 s]
0.0.PRE: A trace with 1 cycles was found. [0.00 s]
INFO (IPF047): 0.0.PRE: The cover property "SEVEN.p1:precondition1" was covered in 1 cycles in 0.00 s.
0.0.N: Proof Simplification Iteration 2	[0.06 s]
0.0.PRE: A proof was found: No trace exists. [0.00 s]
INFO (IPF057): 0.0.PRE: The property ":noDeadEnd" was proven in 0.00 s.
    Use check_assumptions -show -dead_end to show this property in the property table.
0.0.PRE: A proof was found: No trace exists. [0.00 s]
INFO (IPF057): 0.0.PRE: The property ":noConflict" was proven in 0.00 s.
    Use check_assumptions -show to show this property in the property table.
INFO (IPF047): 0.0.PRE: The cover property ":live" was covered in 1 cycles in 0.00 s.
    Use check_assumptions -show -live to show this property in the property table.
0.0.PRE: Proof Simplification completed in 0.06 s
0: About to start ProofGrid in its own thread with a limit of 10000 pending notifications and a limit of 10 traces.
0: =============================== ProofGrid start ===============================
0: ProofGrid usable level: 1
0: Initial ProofGrid level: 1
0: ProofGrid is starting event handling
0.0.Hp: Proofgrid shell started at 12016@vlsi-ria85(local) jg_11817_vlsi-ria85_1
0.0.N: Proofgrid shell started at 12012@vlsi-ria85(local) jg_11817_vlsi-ria85_1
0.0.Hp: clocks: 1, declared: 1, looping: 0, posedge: 1, negedge: 0, noedge: 0, bothedge: 0
0.0.Hp: Last scan. Per property time limit: 0s
0.0.Hp: Trace Attempt  1	[0.00 s]
0.0.Hp: Trace Attempt  2	[0.00 s]
0.0.Hp: Trace Attempt  3	[0.00 s]
0.0.Hp: Trace Attempt  4	[0.00 s]
0.0.Hp: Trace Attempt  5	[0.00 s]
0.0.N: clocks: 1, declared: 1, looping: 0, posedge: 1, negedge: 0, noedge: 0, bothedge: 0
0.0.N: Last scan. Per property time limit: 0s
0.0.N: Starting proof for property "SEVEN.p1"	[0.00 s].
0.0.N: Trace Attempt  1	[0.00 s]
0.0.N: Trace Attempt  2	[0.00 s]
0.0.N: Trace Attempt  2	[0.00 s]
0.0.N: Trace Attempt  3	[0.00 s]
0.0.N: Trace Attempt  3	[0.00 s]
0.0.N: Trace Attempt  4	[0.00 s]
0.0.N: Trace Attempt  5	[0.00 s]
0.0.N: Trace Attempt  1	[0.01 s]
0.0.N: Trace Attempt  2	[0.01 s]
0.0.N: Trace Attempt  3	[0.01 s]
0.0.N: Trace Attempt  4	[0.01 s]
0.0.N: Trace Attempt  5	[0.01 s]
0.0.Mpcustom4: Proofgrid shell started at 12122@vlsi-ria85(local) jg_11817_vlsi-ria85_1
0.0.Oh: Proofgrid shell started at 12126@vlsi-ria85(local) jg_11817_vlsi-ria85_1
0.0.AM: Proofgrid shell started at 12174@vlsi-ria85(local) jg_11817_vlsi-ria85_1
0.0.Bm: Proofgrid shell started at 12119@vlsi-ria85(local) jg_11817_vlsi-ria85_1
0.0.Mpcustom4: clocks: 1, declared: 1, looping: 0, posedge: 1, negedge: 0, noedge: 0, bothedge: 0
0.0.Mpcustom4: Ignoring liveness properties
0.0.Mpcustom4: All properties either determined or skipped. [0.00 s]
0.0.Mpcustom4: Exited with Success (@ 0.04 s)
0.0.Mpcustom4: Completed, Restart ignored.
0.0.Bm: clocks: 1, declared: 1, looping: 0, posedge: 1, negedge: 0, noedge: 0, bothedge: 0
0.0.AM: clocks: 1, declared: 1, looping: 0, posedge: 1, negedge: 0, noedge: 0, bothedge: 0
0.0.Bm: Ignoring liveness properties
0.0.Bm: Last scan. Per property time limit: 0s
0.0.Bm: Trace Attempt  1	[0.00 s]
0.0.Bm: Trace Attempt  2	[0.00 s]
0.0.Bm: Trace Attempt  3	[0.00 s]
0.0.Bm: Trace Attempt  4	[0.00 s]
0.0.Bm: Trace Attempt  5	[0.00 s]
0.0.Oh: clocks: 1, declared: 1, looping: 0, posedge: 1, negedge: 0, noedge: 0, bothedge: 0
0.0.Oh: Reached length limit (2147483647) [0.00 s]
0.0.AM: Last scan. Per property time limit: 0s
0.0.AM: Starting proof for property "SEVEN.p1"	[0.00 s].
0.0.AM: Trace Attempt  1	[0.00 s]
0.0.AM: Trace Attempt  2	[0.00 s]
0.0.AM: Trace Attempt  3	[0.00 s]
0.0.AM: Trace Attempt  4	[0.00 s]
0.0.AM: Trace Attempt  5	[0.00 s]
0.0.AM: Trace Attempt  1	[0.00 s]
0.0.Oh: Exited with Success (@ 0.05 s)
0.0.Oh: Completed, Restart ignored.
0.0.AM: Trace Attempt  2	[0.00 s]
0.0.AM: Trace Attempt  3	[0.00 s]
0.0.AM: Trace Attempt  4	[0.00 s]
0.0.AM: Trace Attempt  5	[0.00 s]
0.0.AM: Trace Attempt  1	[0.01 s]
0.0.AM: Trace Attempt  2	[0.01 s]
0.0.AM: Trace Attempt  3	[0.01 s]
0.0.AM: Trace Attempt  4	[0.01 s]
0.0.AM: Trace Attempt  5	[0.01 s]
0.0.L: Proofgrid shell started at 12150@vlsi-ria85(local) jg_11817_vlsi-ria85_1
0.0.B: Proofgrid shell started at 12152@vlsi-ria85(local) jg_11817_vlsi-ria85_1
0.0.AM: Trace Attempt  1	[0.02 s]
0.0.AM: Trace Attempt  2	[0.02 s]
0.0.AM: Trace Attempt  3	[0.02 s]
0.0.L: clocks: 1, declared: 1, looping: 0, posedge: 1, negedge: 0, noedge: 0, bothedge: 0
0.0.L: Using trace diversification with seed 1 (0.05)
0.0.L: Using LRU state removal heuristic
0.0.L: Ignoring liveness properties
0.0.L: All properties either determined or skipped. [0.00 s]
0.0.B: clocks: 1, declared: 1, looping: 0, posedge: 1, negedge: 0, noedge: 0, bothedge: 0
0.0.B: Last scan. Per property time limit: 0s
0.0.B: Starting proof for property "SEVEN.p1"	[0.00 s].
0.0.B: Trace Attempt  1	[0.00 s]
0.0.B: Trace Attempt  2	[0.00 s]
0.0.B: Trace Attempt  3	[0.00 s]
0.0.B: Trace Attempt  4	[0.00 s]
0.0.B: Trace Attempt  5	[0.00 s]
0.0.AM: Trace Attempt  4	[0.02 s]
0.0.AM: Trace Attempt  5	[0.02 s]
0.0.L: Exited with Success (@ 0.07 s)
0.0.L: Completed, Restart ignored.
0.0.Ht: Proofgrid shell started at 12117@vlsi-ria85(local) jg_11817_vlsi-ria85_1
0.0.Ht: clocks: 1, declared: 1, looping: 0, posedge: 1, negedge: 0, noedge: 0, bothedge: 0
0.0.Ht: Last scan. Per property time limit: 0s
0.0.Ht: Trace Attempt  1	[0.00 s]
0.0.Ht: Trace Attempt  2	[0.00 s]
0.0.Ht: Trace Attempt  3	[0.00 s]
0.0.Ht: Trace Attempt  4	[0.00 s]
0.0.Ht: Trace Attempt  5	[0.00 s]
0.0.N: Trace Attempt  1	[0.09 s]
0.0.N: Trace Attempt  2	[0.09 s]
0.0.N: Trace Attempt  3	[0.09 s]
0.0.N: Trace Attempt  4	[0.09 s]
0.0.N: Trace Attempt  5	[0.09 s]
0.0.AM: Trace Attempt  1	[0.08 s]
0.0.AM: Trace Attempt  2	[0.08 s]
0.0.AM: Trace Attempt  3	[0.08 s]
0.0.AM: Trace Attempt  4	[0.08 s]
0.0.AM: Trace Attempt  5	[0.08 s]
0.0.AM: Trace Attempt  1	[0.34 s]
0.0.AM: Trace Attempt  2	[0.34 s]
0.0.AM: Trace Attempt  3	[0.34 s]
0.0.AM: Trace Attempt  4	[0.34 s]
0.0.AM: Trace Attempt  5	[0.34 s]
0.0.N: Trace Attempt  1	[0.42 s]
0.0.N: Trace Attempt  2	[0.42 s]
0.0.N: Trace Attempt  3	[0.42 s]
0.0.N: Trace Attempt  4	[0.43 s]
0.0.N: Trace Attempt  5	[0.43 s]
0.0.N: Trace Attempt  1	[1.23 s]
0.0.N: Trace Attempt  2	[1.23 s]
0.0.N: Trace Attempt  3	[1.23 s]
0.0.N: Trace Attempt  4	[1.23 s]
0.0.N: Trace Attempt  5	[1.23 s]
0.0.AM: Trace Attempt  1	[1.43 s]
0.0.AM: Trace Attempt  2	[1.43 s]
0.0.AM: Trace Attempt  3	[1.43 s]
0.0.AM: Trace Attempt  4	[1.43 s]
0.0.AM: Trace Attempt  5	[1.43 s]
0.0.N: Trace Attempt  1	[2.02 s]
0.0.N: Trace Attempt  2	[2.02 s]
0.0.N: Trace Attempt  3	[2.02 s]
0.0.N: Trace Attempt  4	[2.02 s]
0.0.N: Trace Attempt  5	[2.02 s]
0.0.N: Trace Attempt  1	[2.83 s]
0.0.N: Trace Attempt  2	[2.83 s]
0.0.N: Trace Attempt  3	[2.83 s]
0.0.N: Trace Attempt  4	[2.83 s]
0.0.N: Trace Attempt  5	[2.83 s]
0.0.N: Trace Attempt  1	[3.64 s]
0.0.N: Trace Attempt  2	[3.64 s]
0.0.N: Trace Attempt  3	[3.64 s]
0.0.N: Trace Attempt  4	[3.64 s]
0.0.N: Trace Attempt  5	[3.64 s]
0.0.Hp: Trace Attempt 436	[4.01 s]
0.0.Bm: Trace Attempt 1216	[4.00 s]
0.0.B: Trace Attempt 1223	[4.00 s]
0.0.Ht: Trace Attempt 1131	[4.01 s]
0.0.N: Trace Attempt  1	[4.51 s]
0.0.N: Trace Attempt  2	[4.52 s]
0.0.N: Trace Attempt  3	[4.52 s]
0.0.N: Trace Attempt  4	[4.52 s]
0.0.N: Trace Attempt  5	[4.52 s]
0.0.AM: Trace Attempt 219	[5.44 s]
0.0.AM: Trace Attempt  1	[6.89 s]
0.0.AM: Trace Attempt  2	[6.89 s]
0.0.AM: Trace Attempt  3	[6.89 s]
0.0.AM: Trace Attempt  4	[6.89 s]
0.0.AM: Trace Attempt  5	[6.89 s]
0.0.Bm: Trace Attempt 1495	[8.01 s]
0.0.B: Trace Attempt 1500	[8.00 s]
0.0.Ht: Trace Attempt 1500	[8.02 s]
0.0.N: Trace Attempt 202	[8.52 s]
0.0.Hp: Trace Attempt 575	[8.54 s]
0.0.N: Trace Attempt  1	[10.24 s]
0.0.N: Trace Attempt  2	[10.24 s]
0.0.N: Trace Attempt  3	[10.24 s]
0.0.N: Trace Attempt  4	[10.25 s]
0.0.N: Trace Attempt  5	[10.25 s]
0.0.AM: Trace Attempt 195	[10.91 s]
0.0.Bm: Trace Attempt 1772	[12.01 s]
0.0.B: Trace Attempt 1788	[12.01 s]
0.0.Ht: Trace Attempt 1727	[12.02 s]
0.0.Hp: Trace Attempt 710	[12.56 s]
0.0.N: Trace Attempt 208	[14.26 s]
0.0.AM: Trace Attempt 257	[14.92 s]
0.0.N: Trace Attempt  1	[16.02 s]
0.0.N: Trace Attempt  2	[16.02 s]
0.0.N: Trace Attempt  3	[16.02 s]
0.0.N: Trace Attempt  4	[16.02 s]
0.0.N: Trace Attempt  5	[16.02 s]
0.0.Bm: Trace Attempt 2085	[16.02 s]
0.0.B: Trace Attempt 2100	[16.02 s]
0.0.Ht: Trace Attempt 1902	[16.02 s]
0.0.Hp: Trace Attempt 785	[16.56 s]
0.0.AM: Trace Attempt 300	[18.97 s]
0.0.N: Trace Attempt 208	[20.02 s]
0.0.Bm: Trace Attempt 2382	[20.02 s]
0.0.B: Trace Attempt 2395	[20.02 s]
0.0.Ht: Trace Attempt 2098	[20.03 s]
0.0.Hp: Trace Attempt 912	[20.59 s]
0.0.N: Trace Attempt  1	[21.72 s]
0.0.N: Trace Attempt  2	[21.72 s]
0.0.N: Trace Attempt  3	[21.72 s]
0.0.N: Trace Attempt  4	[21.72 s]
0.0.N: Trace Attempt  5	[21.72 s]
0.0.AM: Trace Attempt 341	[23.08 s]
0.0.Bm: Trace Attempt 2614	[24.03 s]
0.0.B: Trace Attempt 2626	[24.03 s]
0.0.Ht: Trace Attempt 2203	[24.04 s]
0.0.Hp: Trace Attempt 1005	[25.43 s]
0.0.N: Trace Attempt 208	[25.74 s]
0.0.AM: Trace Attempt 378	[27.08 s]
0.0.N: Trace Attempt  1	[27.63 s]
0.0.N: Trace Attempt  2	[27.63 s]
0.0.N: Trace Attempt  3	[27.63 s]
0.0.N: Trace Attempt  4	[27.63 s]
0.0.N: Trace Attempt  5	[27.63 s]
0.0.Bm: Trace Attempt 2839	[28.03 s]
0.0.B: Trace Attempt 2848	[28.03 s]
0.0.Ht: Trace Attempt 2399	[28.04 s]
0.0.Hp: Trace Attempt 1026	[29.48 s]
0.0.AM: Trace Attempt 417	[31.14 s]
0.0.N: Trace Attempt 207	[31.66 s]
0.0.Bm: Trace Attempt 3049	[32.04 s]
0.0.Ht: Trace Attempt 2558	[32.04 s]
0.0.B: Trace Attempt 3061	[32.05 s]
0.0.N: Trace Attempt  1	[33.37 s]
0.0.N: Trace Attempt  2	[33.37 s]
0.0.N: Trace Attempt  3	[33.37 s]
0.0.N: Trace Attempt  4	[33.37 s]
0.0.N: Trace Attempt  5	[33.38 s]
0.0.Hp: Trace Attempt 1057	[33.71 s]
0.0.AM: Trace Attempt 454	[35.20 s]
0.0.Bm: Trace Attempt 3270	[36.04 s]
0.0.B: Trace Attempt 3278	[36.06 s]
0.0.Ht: Trace Attempt 2685	[36.07 s]
0.0.N: Trace Attempt 207	[37.38 s]
0.0.Hp: Trace Attempt 1092	[38.42 s]
0.0.AM: Trace Attempt 342	[39.20 s]
0.0.N: Trace Attempt  1	[39.88 s]
0.0.N: Trace Attempt  2	[39.88 s]
0.0.N: Trace Attempt  3	[39.88 s]
0.0.N: Trace Attempt  4	[39.89 s]
0.0.N: Trace Attempt  5	[39.89 s]
0.0.Bm: Trace Attempt 3454	[40.05 s]
0.0.B: Trace Attempt 3463	[40.06 s]
0.0.Ht: Trace Attempt 2765	[40.58 s]
0.0.Hp: Trace Attempt 1119	[42.42 s]
0.0.N: Trace Attempt 194	[43.89 s]
0.0.Bm: Trace Attempt 3625	[44.07 s]
0.0.B: Trace Attempt 3631	[44.08 s]
0.0.AM: Trace Attempt 503	[44.10 s]
0.0.Ht: Trace Attempt 2900	[44.61 s]
0.0.AM: Trace Attempt  1	[46.64 s]
0.0.AM: Trace Attempt  2	[46.64 s]
0.0.AM: Trace Attempt  3	[46.64 s]
0.0.AM: Trace Attempt  4	[46.65 s]
0.0.AM: Trace Attempt  5	[46.65 s]
0.0.Hp: Trace Attempt 1146	[46.74 s]
0.0.N: Trace Attempt 258	[47.92 s]
0.0.Bm: Trace Attempt 3789	[48.09 s]
0.0.B: Trace Attempt 3794	[48.09 s]
0.0.Ht: Trace Attempt 3034	[48.61 s]
0.0.AM: Trace Attempt 198	[50.69 s]
0.0.Hp: Trace Attempt 1178	[50.83 s]
0.0.N: Trace Attempt 318	[51.95 s]
0.0.Bm: Trace Attempt 3944	[52.10 s]
0.0.B: Trace Attempt 3947	[52.11 s]
0.0.Ht: Trace Attempt 3134	[52.63 s]
0.0.AM: Trace Attempt 256	[54.73 s]
0.0.Hp: Trace Attempt 1214	[54.87 s]
0.0.N: Trace Attempt 358	[55.99 s]
0.0.Bm: Trace Attempt 4091	[56.11 s]
0.0.B: Trace Attempt 4094	[56.14 s]
0.0.Ht: Trace Attempt 3208	[56.69 s]
0.0.AM: Trace Attempt 306	[58.76 s]
0.0.Hp: Trace Attempt 1253	[58.93 s]
0.0.N: Trace Attempt 398	[60.05 s]
0.0.Bm: Trace Attempt 4244	[60.13 s]
0.0.B: Trace Attempt 4243	[60.15 s]
0.0.Ht: Trace Attempt 3314	[60.69 s]
0.0.AM: Trace Attempt 349	[62.81 s]
0.0.Hp: Trace Attempt 1284	[63.27 s]
0.0.N: Trace Attempt 433	[64.15 s]
0.0.Bm: Trace Attempt 4399	[64.14 s]
0.0.B: Trace Attempt 4396	[64.16 s]
0.0.Ht: Trace Attempt 3406	[64.72 s]
0.0.AM: Trace Attempt 378	[66.98 s]
0.0.Hp: Trace Attempt 1303	[67.49 s]
0.0.Bm: Trace Attempt 4558	[68.15 s]
0.0.B: Trace Attempt 4553	[68.17 s]
0.0.N: Trace Attempt 443	[68.55 s]
0.0.Ht: Trace Attempt 3489	[68.73 s]
0.0.AM: Trace Attempt 414	[70.98 s]
0.0.Hp: Trace Attempt 1357	[71.53 s]
0.0.Bm: Trace Attempt 4682	[72.20 s]
0.0.B: Trace Attempt 4679	[72.22 s]
0.0.N: Trace Attempt 453	[72.81 s]
0.0.Ht: Trace Attempt 3540	[72.74 s]
0.0.AM: Trace Attempt 435	[75.15 s]
0.0.Hp: Trace Attempt 1412	[75.56 s]
0.0.N: Trace Attempt  1	[75.61 s]
0.0.N: Trace Attempt  2	[75.61 s]
0.0.N: Trace Attempt  3	[75.61 s]
0.0.N: Trace Attempt  4	[75.61 s]
0.0.N: Trace Attempt  5	[75.61 s]
0.0.Bm: Trace Attempt 4808	[76.22 s]
0.0.B: Trace Attempt 4801	[76.22 s]
0.0.Ht: Trace Attempt 3638	[77.01 s]
0.0.AM: Trace Attempt 456	[79.27 s]
0.0.Hp: Trace Attempt 1471	[79.59 s]
0.0.N: Trace Attempt 186	[79.64 s]
0.0.Bm: Trace Attempt 4935	[80.23 s]
0.0.B: Trace Attempt 4926	[80.23 s]
0.0.Ht: Trace Attempt 3727	[81.01 s]
0.0.AM: Trace Attempt 477	[83.35 s]
0.0.N: Trace Attempt 258	[83.66 s]
0.0.Bm: Trace Attempt 5067	[84.23 s]
0.0.B: Trace Attempt 5055	[84.23 s]
0.0.Ht: Trace Attempt 3822	[85.03 s]
0.0.Hp: Trace Attempt 1518	[85.38 s]
0.0.AM: Trace Attempt 488	[87.38 s]
0.0.N: Trace Attempt 323	[87.70 s]
0.0.AM: Validation of fixpoint was successful. Time = 0.01
0.0.N: Requesting engine job to terminate
0.0.B: Requesting engine job to terminate
0.0.AM: Requesting engine job to terminate
0.0.Hp: Requesting engine job to terminate
0.0.Ht: Requesting engine job to terminate
0.0.Bm: Requesting engine job to terminate
INFO (IPF144): 0: Initiating shutdown of proof [88.04 s]
0.0.AM: Trace Attempt 499	[87.77 s]
0.0.AM: A proof was found: No trace exists. [88.00 s]
INFO (IPF057): 0.0.AM: The property "SEVEN.p1" was proven in 88.00 s.
0.0.AM: Stopped processing property "SEVEN.p1"	[88.00 s].
0.0.AM: All properties determined. [88.00 s]
0.0.AM: Exited with Success (@ 88.06 s)
0: ProofGrid usable level: 0
0.0.Ht: Trace Attempt 3871	[87.93 s]
0.0.Ht: All properties determined. [87.99 s]
0.0.N: Trace Attempt 327	[87.96 s]
0.0.N: Stopped processing property "SEVEN.p1"	[88.07 s].
0.0.N: All properties determined. [88.07 s]
0.0.B: Trace Attempt 5171	[87.97 s]
0.0.B: Stopped processing property "SEVEN.p1"	[88.02 s].
0.0.B: All properties determined. [88.02 s]
0.0.Bm: Trace Attempt 5185	[87.98 s]
0.0.Bm: All properties determined. [88.05 s]
0.0.Ht: Exited with Success (@ 88.09 s)
0.0.N: Exited with Success (@ 88.10 s)
0.0.B: Exited with Success (@ 88.10 s)
0.0.Bm: Exited with Success (@ 88.10 s)
0.0.Hp: Trace Attempt 1522	[86.02 s]
0.0.Hp: All properties determined. [88.40 s]
0.0.Hp: Exited with Success (@ 88.45 s)
0: --------------------------------------------------------------
ProofGrid Summary (utilization 99.92 %)
--------------------------------------------------------------
     engines started                               :     9
     engine jobs started                           :     9

    Average time in state (seconds)
    ------------------------------------------------------
    Engine  Pending     Running        Dead    Utilization
    ------------------------------------------------------
      N        0.04       88.04        0.00       99.96 %
     Hp        0.03       88.04        0.00       99.96 %
     Ht        0.08       87.97        0.00       99.91 %
     Bm        0.04       88.00        0.00       99.95 %
    Mpcustom4        0.04        0.00        0.00       11.51 %
     Oh        0.04        0.00        0.00        5.79 %
      L        0.06        0.00        0.00        4.15 %
      B        0.06       87.98        0.00       99.93 %
     AM        0.03       88.00        0.00       99.96 %
    all        0.05       58.67        0.00       99.92 %

    Total time in state (seconds)
    -----------------------------------------
            Pending     Running        Dead  
    -----------------------------------------
               0.43      528.03        0.00

    Data read    : 4.13 MiB
    Data written : 4.44 kiB

0: All pending notifications were processed.
INFO (IPF059): 0: Completed proof on task: "<embedded>"

==============================================================
SUMMARY
==============================================================
           Properties Considered              : 2
                 assertions                   : 1
                  - proven                    : 1 (100%)
                  - bounded_proven (user)     : 0 (0%)
                  - bounded_proven (auto)     : 0 (0%)
                  - marked_proven             : 0 (0%)
                  - cex                       : 0 (0%)
                  - ar_cex                    : 0 (0%)
                  - undetermined              : 0 (0%)
                  - unknown                   : 0 (0%)
                  - error                     : 0 (0%)
                 covers                       : 1
                  - unreachable               : 0 (0%)
                  - bounded_unreachable (user): 0 (0%)
                  - covered                   : 1 (100%)
                  - ar_covered                : 0 (0%)
                  - undetermined              : 0 (0%)
                  - unknown                   : 0 (0%)
                  - error                     : 0 (0%)
determined
[<embedded>] % exit -force
[<embedded>] % INFO (IPL005): Received request to exit from the console.
INFO (IPL014): Waiting for the Tcl-thread to exit.
INFO: Waiting for proof threads to stop...
INFO: Proof threads stopped.
INFO (IPL018): The peak resident set memory use for this session was 1.149 GB.
INFO (IPL015): The Tcl-thread exited with status 0.
INFO (IPL016): Exiting the analysis session with status 0.
Finished 2_seven_seg_1.tcl successfully
