Jasper Apps 2024.06p002 64 bits 2024.09.02 16:28:38 UTC

Any disclosure about the Cadence Design Systems software or its use
model to any third party violates the written Non-Disclosure Agreement
between Cadence Design Systems, Inc. and the customer.

THIS SOFTWARE CONTAINS CONFIDENTIAL INFORMATION AND TRADE SECRETS OF
CADENCE DESIGN SYSTEMS, INC. USE, DISCLOSURE, OR REPRODUCTION IS
PROHIBITED WITHOUT THE PRIOR EXPRESS WRITTEN PERMISSION OF CADENCE
DESIGN SYSTEMS, INC.

Copyright (C) 2000-2024 Cadence Design Systems, Inc. All Rights
Reserved.  Unpublished -- rights reserved under the copyright laws of
the United States.

This product includes software developed by others and redistributed
according to license agreement. See doc/third_party_readme.txt for
further details.

RESTRICTED RIGHTS LEGEND

Use, duplication, or disclosure by the Government is subject to
restrictions as set forth in subparagraph (c) (1) (ii) of the Rights in
Technical Data and Computer Software clause at DFARS 252.227-7013 or
subparagraphs (c) (1) and (2) of Commercial Computer Software -- Restricted
Rights at 48 CFR 52.227-19, as applicable.


                          Cadence Design Systems, Inc.
                          2655 Seely Avenue
                          San Jose, CA 95134
                          Phone: 408.943.1234

For technical assistance visit http://support.cadence.com.

Jasper Apps Analysis Session - /users/rompel/jasper_executions/liveness/jgprojects/load_store_6/sessionLogs/session_0

WARNING (WG017): [session]: The system's locale is "ANSI_X3.4-1968", which is not UTF-8. Non-ASCII characters might not be handled correctly.
WARNING (WG017): [jg_console]: The system's locale is "ANSI_X3.4-1968", which is not UTF-8. Non-ASCII characters might not be handled correctly.
INFO: successfully checked out license "jasper_fao".
INFO: reading configuration file "/users/rompel/.config/cadence/jasper.conf".
% analyze -sv09 ../load_store_6.sv
[-- (VERI-1482)] Analyzing Verilog file '/tools/cadence2425/JASPER/jasper_2024.06p002/lib/verilog/packages/std/std.sv' into library 'std'
[-- (VERI-1482)] Analyzing Verilog file '../load_store_6.sv'
% elaborate -bbox_mul 1000000 -bbox_div 1000000 -bbox_mod 1000000 -bbox_a 1000000
[INFO (HIER-8002)] ../load_store_6.sv(23): Disabling old hierarchical reference handler
[INFO (VERI-1018)] ../load_store_6.sv(1): compiling module 'Load_Store'
[WARN (VERI-1209)] ../load_store_6.sv(10): expression size 32 truncated to fit in target size 14
[WARN (VERI-1209)] ../load_store_6.sv(12): expression size 32 truncated to fit in target size 14
[INFO (VERI-8005)] ../load_store_6.sv(5): Unintentional sequential element inferred for m read before write using blocking assignment
[INFO (VERI-8005)] ../load_store_6.sv(4): Unintentional sequential element inferred for vol read before write using blocking assignment
[INFO (VERI-8005)] ../load_store_6.sv(1): Unintentional sequential element inferred for sig read before write using blocking assignment
INFO (ISW003): Top module name is "Load_Store".
INFO (INL208): Elaboration synthesis summary:
  Number of synthesized netlists          1 (0 packages)
  Single run mode                         On
  Pipeline                                On (1 pipelined netlists)
  Late hierarchical reference connection  On
  Number of analyzed Verilog modules      1 (1 synthesized)
  Number of analyzed VHDL entities        0 (0 synthesized)
INFO (INL003): Clearing all state information (assumes, stopats, and so forth).
Load_Store
[<embedded>] % reset rst
INFO (IPM031): Clearing proof results of all properties.
INFO (IRS006): Current reset condition is "rst".
[<embedded>] % clock clk
[<embedded>] % prove -all
Ncustom1: Custom engine code is hT3Ng7hPPfiYQOTDZ3qhYOwGAM51eA+J/FjkM5shLioAsqhgLR4Ft+O1BuKG6ilQ83B9tLXSl+CwjiTMAQA
Bcustom2: Custom engine code is hT3Nm7hPr1Vp3Di1Ra2USNIGL4JypRnLKLAdF6JAyuavO2JfGCiY9OZJhcAcOUnLx5xwNdhILGrAWX9s+z2WDkKwNR7tAfClBEjRFVQeq6DU54boFgEA
AMcustom3: Custom engine code is hT3Ng7hP/feYQOTDZ3qhYOwGAM51eA+J/FjkM5shLioAsqhgLR4Ft+O1BuKG6ilQ83B9tLXSmmqwm7g9AQA
Mpcustom4: Custom engine code is hT3NZbhP9fmY2AbBQnsjfOxn6c+6e6yL+/e8fZFmaQrnlgEA
INFO (IPF036): Starting proof on task: "<embedded>", 1 properties to prove with 0 already proven/unreachable
INFO (IRS029): Starting reset analysis: phase 1 of 4.
INFO (IRS030): Running reset analysis: phase 2 of 4.
INFO (IRS031): Running reset analysis: phase 3 of 4.
INFO (IRS020): Starting the reset analysis simulation with a limit of 100 iterations (phase 4 of 4).
INFO (IRS024): Reset iterations 0 to 4 analyzed.
INFO (IRS018): Reset analysis simulation executed for 3 iterations. Assigned values for 16 of 16 design flops, 0 of 0 design latches, 3 of 3 internal elements.
INFO (IRS039): Reset analysis complete.
INFO (IPF031): Settings used for proof thread 0:
    orchestration                 = on
    time_limit                    = 86400s
    per_property_time_limit       = 1s * 10 ^ scan
    engine_mode                   = auto
    proofgrid_per_engine_max_jobs = 1
    max engine jobs               = auto
    proofgrid_mode                = local
    proofgrid_restarts            = 10
0: Using multistage preprocessing
0: Starting reduce
AMcustom5: Custom engine code is hT3N1rhP11/52HrFRS21ROp2LOjVTgPvT8L8BGXHgLhaIuqtT4nARFjUqrBL+7pLmaTOzBepZW/Jm8SSrHDybSQtoNiO3y43wk+dEoWlsZizu97Fih6O6lPVG/LpWP5SsUPwlGagLNa1FKEFvwVXyX7//8prySbvSxIHXr5er+z4RAEA
Ncustom6: Custom engine code is hT3OXrhPByJp3TrFSTLhUmMH4KVtJgmTCnNDF46yMXOKY48m4LS5nE7yBzFjA7kDuwO/GhGUpEPiky3p3wmPn3dJZHxFMsafSoObRzSC+tn7sEY0WbTdZ/FV4hL3MYH/b1CIUvXSWR4wqEoVLsmMOD4xIPT4lI1LO6ZCO7PnnWQuLwetnvKlrXx6wCW/A+x+enqslg1YPobi4wEF/EvbzOvcTYdJvl2s4H2yZg2b2ofAVN5WvhWk1HoBAA
ADcustom7: Custom engine code is hT3Nv7hPv1752HrFRa2kROx2f/ECJeZB2AZsLdlO8VwmIuqtT4nIDFXclhg+O+o+DMmQCekbheGk0kK28laA9gaOFDXsQp29J3X615HY1IPHJWd6FUFvCHjO+p1k652b5JJvZlShNpGlGSXAiQe/mEAj6tEBAA
Tricustom8: Custom engine code is hT3Nu7hPt1752DvFRa0kNDiyIV97VyejwM9C/jCLJjdPvusZONHY42VYUy0Q1ZotnhcVtNc56tJ5wbxv6V2+XpdsaSlHck5vfnbYjdwj1OECy9U+7oSQ0SZE3g5ayD+Phuh4odCJTjeKa2k4elM9ldQfkAEA
Gcustom9: Custom engine code is hT3NibhPDfeYQADBZnYcglOvK9Pfd7EOeniIqP8jNsyIqInncipMGcUXqAadachREE9F2PwhBUZUNw5kHnd4JdXkamORRgEA
C2custom10: Custom engine code is hT3NirhPjfWYQADBZnYcglOvK9Pfd7EOeniIqP8jNsyIqInncgkrYMMXCYbdK0dUjZIF9d4cJ0rHoBDjwVLBKuG86XYVV00BAA
0: Finished reduce in 0s
AGcustom11: Custom engine code is hT3NirhP/fmYQADBZnYcglOvK9Pfd7EOeniIqP8jNsyIqInnckcwYMMXCYbdK0dUjZIF9d4cJ0rHoBDjwVLBKuHEZnZByh0BAA
Bcustom12: Custom engine code is hT3NjrhPDfiYQADBZnYcglOvK9PfWxFtenjIyBqfrgr7if/jL/yPOuK1BAflEcW0DxNH2eDIoezN2gxlQFg81RZtiWXh7aiTAidvAQA
0.0.PRE: Performing Proof Simplification...
0.0.N: clocks: 1, declared: 1, looping: 0, posedge: 1, negedge: 0, noedge: 0, bothedge: 0
Ncustom13: Custom engine code is hT3NR7hPByFp3TrFSTLhUmMH4KWtJglTyV/c51BHEeZWamnJv767nE6PCak26bd3gf3XGN3rIRheufhDieCJQVISo+gNYUKhiUedBKGtsP/a18svAnlMJZudHxDFwK5ufsyoxsIyiAeSY2oi3tEuoDHr5gw42DFKAG3PqO3CEsl8Azzdt3pl5nGA1Ifv2H02eYsFzWb/nfp8PMb3F0krE/EgBcm8TD9Div8BAA
Tricustom14: Custom engine code is hT3Nu7hP3fiYQADBZnYcglNHp9bfd7EOeniIqP/ji8sGLQu8yhsFO+wxJ+O+R0bU8g/IewXFomyos+viQnWc2xYNYmMqpo3i40O7DaZR7qfp4YqNx26KRvQ/qx0BAA
0.0.N: Proof Simplification Iteration 1	[0.00 s]
0.0.N: Proof Simplification Iteration 2	[0.00 s]
0.0.N: Proof Simplification Iteration 3	[0.00 s]
0.0.PRE: A proof was found: No trace exists. [0.00 s]
INFO (IPF057): 0.0.PRE: The property ":noDeadEnd" was proven in 0.00 s.
    Use check_assumptions -show -dead_end to show this property in the property table.
0.0.PRE: A proof was found: No trace exists. [0.00 s]
INFO (IPF057): 0.0.PRE: The property ":noConflict" was proven in 0.00 s.
    Use check_assumptions -show to show this property in the property table.
INFO (IPF047): 0.0.PRE: The cover property ":live" was covered in 1 cycles in 0.00 s.
    Use check_assumptions -show -live to show this property in the property table.
0.0.PRE: Proof Simplification completed in 0.00 s
0: About to start ProofGrid in its own thread with a limit of 10000 pending notifications and a limit of 10 traces.
0: =============================== ProofGrid start ===============================
0: ProofGrid usable level: 1
0: Initial ProofGrid level: 1
0: ProofGrid is starting event handling
0.0.Hp: Proofgrid shell started at 146897@vlsi-moon(local) jg_146830_vlsi-moon_1
0.0.Hp: clocks: 1, declared: 1, looping: 0, posedge: 1, negedge: 0, noedge: 0, bothedge: 0
0.0.Hp: Last scan. Per property time limit: 0s
0.0.Hp: Trace Attempt  1	[0.00 s]
0.0.N: Proofgrid shell started at 146896@vlsi-moon(local) jg_146830_vlsi-moon_1
0.0.Hp: Trace Attempt  2	[0.00 s]
0.0.Hp: Trace Attempt  3	[0.00 s]
0.0.Hp: Trace Attempt  4	[0.00 s]
0.0.N: clocks: 1, declared: 1, looping: 0, posedge: 1, negedge: 0, noedge: 0, bothedge: 0
0.0.N: Last scan. Per property time limit: 0s
0.0.N: Starting proof for property "Load_Store.p1"	[0.00 s].
0.0.Hp: Trace Attempt  5	[0.00 s]
0.0.N: Trace Attempt  1	[0.00 s]
0.0.N: Trace Attempt  2	[0.00 s]
0.0.N: Trace Attempt  2	[0.00 s]
0.0.N: Trace Attempt  3	[0.00 s]
0.0.N: Trace Attempt  3	[0.00 s]
0.0.N: Trace Attempt  4	[0.00 s]
0.0.N: Trace Attempt  5	[0.00 s]
0.0.N: Trace Attempt  5	[0.00 s]
0.0.N: Trace Attempt  1	[0.02 s]
0.0.N: Trace Attempt  2	[0.03 s]
0.0.N: Trace Attempt  3	[0.03 s]
0.0.N: Trace Attempt  4	[0.03 s]
0.0.N: Trace Attempt  5	[0.04 s]
0.0.AM: Proofgrid shell started at 146931@vlsi-moon(local) jg_146830_vlsi-moon_1
0.0.AM: clocks: 1, declared: 1, looping: 0, posedge: 1, negedge: 0, noedge: 0, bothedge: 0
0.0.AM: Last scan. Per property time limit: 0s
0.0.AM: Starting proof for property "Load_Store.p1"	[0.00 s].
0.0.AM: Trace Attempt  1	[0.00 s]
0.0.AM: Trace Attempt  2	[0.00 s]
0.0.AM: Trace Attempt  3	[0.00 s]
0.0.AM: Trace Attempt  4	[0.00 s]
0.0.AM: Trace Attempt  5	[0.00 s]
0.0.AM: Trace Attempt  1	[0.01 s]
0.0.Ht: Proofgrid shell started at 146928@vlsi-moon(local) jg_146830_vlsi-moon_1
0.0.Ht: clocks: 1, declared: 1, looping: 0, posedge: 1, negedge: 0, noedge: 0, bothedge: 0
0.0.AM: Trace Attempt  2	[0.01 s]
0.0.Ht: Last scan. Per property time limit: 0s
0.0.AM: Trace Attempt  3	[0.01 s]
0.0.Ht: Trace Attempt  1	[0.00 s]
0.0.Ht: Trace Attempt  2	[0.00 s]
0.0.Ht: Trace Attempt  3	[0.00 s]
0.0.Ht: Trace Attempt  4	[0.00 s]
0.0.Ht: Trace Attempt  5	[0.00 s]
0.0.AM: Trace Attempt  4	[0.01 s]
0.0.B: Proofgrid shell started at 146930@vlsi-moon(local) jg_146830_vlsi-moon_1
0.0.B: clocks: 1, declared: 1, looping: 0, posedge: 1, negedge: 0, noedge: 0, bothedge: 0
0.0.B: Last scan. Per property time limit: 0s
0.0.B: Starting proof for property "Load_Store.p1"	[0.00 s].
0.0.B: Trace Attempt  1	[0.00 s]
0.0.AM: Trace Attempt  5	[0.01 s]
0.0.B: Trace Attempt  2	[0.00 s]
0.0.B: Trace Attempt  3	[0.00 s]
0.0.Oh: Proofgrid shell started at 146929@vlsi-moon(local) jg_146830_vlsi-moon_1
0.0.B: Trace Attempt  4	[0.00 s]
0.0.B: Trace Attempt  5	[0.00 s]
0.0.Oh: clocks: 1, declared: 1, looping: 0, posedge: 1, negedge: 0, noedge: 0, bothedge: 0
0.0.Oh: Reached length limit (2147483647) [0.00 s]
0.0.Oh: Exited with Success (@ 0.09 s)
0.0.AM: Trace Attempt  1	[0.03 s]
0.0.AM: Trace Attempt  2	[0.03 s]
0.0.AM: Trace Attempt  3	[0.03 s]
0.0.AM: Trace Attempt  4	[0.04 s]
0.0.AM: Trace Attempt  5	[0.04 s]
0.0.AM: Trace Attempt  1	[0.09 s]
0.0.AM: Trace Attempt  2	[0.09 s]
0.0.AM: Trace Attempt  3	[0.09 s]
0.0.AM: Trace Attempt  4	[0.09 s]
0.0.AM: Trace Attempt  5	[0.10 s]
0.0.N: Trace Attempt  1	[0.27 s]
0.0.N: Trace Attempt  2	[0.27 s]
0.0.N: Trace Attempt  3	[0.27 s]
0.0.N: Trace Attempt  4	[0.28 s]
0.0.N: Trace Attempt  5	[0.28 s]
0.0.AM: Trace Attempt  1	[0.29 s]
0.0.AM: Trace Attempt  2	[0.29 s]
0.0.AM: Trace Attempt  3	[0.29 s]
0.0.AM: Trace Attempt  4	[0.30 s]
0.0.AM: Trace Attempt  5	[0.30 s]
0.0.N: Trace Attempt  1	[1.10 s]
0.0.N: Trace Attempt  2	[1.11 s]
0.0.N: Trace Attempt  3	[1.11 s]
0.0.N: Trace Attempt  4	[1.11 s]
0.0.N: Trace Attempt  5	[1.11 s]
0.0.AM: Trace Attempt  1	[1.06 s]
0.0.AM: Trace Attempt  2	[1.06 s]
0.0.AM: Trace Attempt  3	[1.07 s]
0.0.AM: Trace Attempt  4	[1.07 s]
0.0.AM: Trace Attempt  5	[1.07 s]
0.0.AM: Trace Attempt  1	[3.06 s]
0.0.AM: Trace Attempt  2	[3.06 s]
0.0.AM: Trace Attempt  3	[3.06 s]
0.0.AM: Trace Attempt  4	[3.07 s]
0.0.AM: Trace Attempt  5	[3.07 s]
0.0.N: Trace Attempt  1	[3.40 s]
0.0.N: Trace Attempt  2	[3.40 s]
0.0.N: Trace Attempt  3	[3.40 s]
0.0.N: Trace Attempt  4	[3.41 s]
0.0.N: Trace Attempt  5	[3.41 s]
0.0.Hp: Trace Attempt 382	[4.00 s]
0.0.Ht: Trace Attempt 2157	[4.00 s]
0.0.B: Trace Attempt 2043	[4.00 s]
0.0.N: Trace Attempt  1	[5.17 s]
0.0.N: Trace Attempt  2	[5.17 s]
0.0.N: Trace Attempt  3	[5.17 s]
0.0.N: Trace Attempt  4	[5.17 s]
0.0.N: Trace Attempt  5	[5.17 s]
0.0.AM: Trace Attempt 129	[7.07 s]
0.0.Hp: Trace Attempt 533	[8.03 s]
0.0.Ht: Trace Attempt 2899	[8.01 s]
0.0.B: Trace Attempt 2804	[8.00 s]
0.0.N: Trace Attempt  1	[8.27 s]
0.0.N: Trace Attempt  2	[8.28 s]
0.0.N: Trace Attempt  3	[8.28 s]
0.0.N: Trace Attempt  4	[8.28 s]
0.0.N: Trace Attempt  5	[8.28 s]
0.0.AM: Trace Attempt 193	[11.09 s]
0.0.Hp: Trace Attempt 636	[12.05 s]
0.0.Ht: Trace Attempt 3439	[12.01 s]
0.0.B: Trace Attempt 3356	[12.01 s]
0.0.N: Trace Attempt 126	[12.32 s]
0.0.AM: Trace Attempt  1	[15.06 s]
0.0.AM: Trace Attempt  2	[15.06 s]
0.0.AM: Trace Attempt  3	[15.06 s]
0.0.AM: Trace Attempt  4	[15.07 s]
0.0.AM: Trace Attempt  5	[15.07 s]
0.0.Ht: Trace Attempt 3895	[16.01 s]
0.0.B: Trace Attempt 3787	[16.01 s]
0.0.N: Trace Attempt 179	[16.42 s]
0.0.Hp: Trace Attempt 712	[19.05 s]
0.0.AM: Trace Attempt 141	[19.11 s]
0.0.N: Trace Attempt  1	[20.05 s]
0.0.N: Trace Attempt  2	[20.05 s]
0.0.N: Trace Attempt  3	[20.05 s]
0.0.N: Trace Attempt  4	[20.06 s]
0.0.N: Trace Attempt  5	[20.06 s]
0.0.Ht: Trace Attempt 4290	[20.02 s]
0.0.B: Trace Attempt 4174	[20.04 s]
0.0.Hp: Trace Attempt 812	[23.07 s]
0.0.AM: Trace Attempt 203	[23.16 s]
0.0.N: Trace Attempt 128	[24.07 s]
0.0.Ht: Trace Attempt 4635	[24.02 s]
0.0.B: Trace Attempt 4542	[24.05 s]
0.0.Hp: Trace Attempt 889	[27.09 s]
0.0.AM: Trace Attempt 233	[27.30 s]
0.0.N: Trace Attempt 188	[28.09 s]
0.0.Ht: Trace Attempt 4954	[28.02 s]
0.0.B: Trace Attempt 4871	[28.05 s]
0.0.N: Trace Attempt  1	[30.79 s]
0.0.N: Trace Attempt  2	[30.80 s]
0.0.N: Trace Attempt  3	[30.80 s]
0.0.N: Trace Attempt  4	[30.80 s]
0.0.N: Trace Attempt  5	[30.80 s]
0.0.Hp: Trace Attempt 973	[31.10 s]
0.0.AM: Trace Attempt 275	[31.48 s]
0.0.Ht: Trace Attempt 5240	[32.03 s]
0.0.B: Trace Attempt 5167	[32.06 s]
0.0.N: Trace Attempt 137	[34.89 s]
0.0.Hp: Trace Attempt 1051	[35.11 s]
0.0.AM: Trace Attempt 312	[35.58 s]
0.0.Ht: Trace Attempt 5506	[36.04 s]
0.0.B: Trace Attempt 5442	[36.07 s]
0.0.N: Trace Attempt 201	[38.89 s]
0.0.Hp: Trace Attempt 1127	[39.30 s]
0.0.AM: Trace Attempt 337	[39.68 s]
0.0.Ht: Trace Attempt 5767	[40.04 s]
0.0.B: Trace Attempt 5701	[40.09 s]
0.0.N: Trace Attempt  1	[41.52 s]
0.0.N: Trace Attempt  2	[41.52 s]
0.0.N: Trace Attempt  3	[41.52 s]
0.0.N: Trace Attempt  4	[41.52 s]
0.0.N: Trace Attempt  5	[41.53 s]
0.0.Hp: Trace Attempt 1206	[43.35 s]
0.0.AM: Trace Attempt 364	[43.83 s]
0.0.Ht: Trace Attempt 6015	[44.04 s]
0.0.B: Trace Attempt 5942	[44.09 s]
0.0.N: Trace Attempt 137	[45.62 s]
0.0.Hp: Trace Attempt 1283	[47.38 s]
0.0.AM: Trace Attempt 393	[47.85 s]
0.0.Ht: Trace Attempt 6238	[48.05 s]
0.0.B: Trace Attempt 6174	[48.10 s]
0.0.N: Trace Attempt 201	[49.64 s]
0.0.Hp: Trace Attempt 1353	[51.43 s]
0.0.AM: Trace Attempt 427	[51.91 s]
0.0.Ht: Trace Attempt 6461	[52.05 s]
0.0.N: Trace Attempt  1	[52.15 s]
0.0.N: Trace Attempt  2	[52.15 s]
0.0.N: Trace Attempt  3	[52.15 s]
0.0.N: Trace Attempt  4	[52.16 s]
0.0.N: Trace Attempt  5	[52.16 s]
0.0.B: Trace Attempt 6398	[52.10 s]
0.0.Hp: Trace Attempt 1420	[55.47 s]
0.0.AM: Trace Attempt 449	[56.03 s]
0.0.Ht: Trace Attempt 6676	[56.05 s]
0.0.N: Trace Attempt 128	[56.17 s]
0.0.B: Trace Attempt 6614	[56.10 s]
0.0.Hp: Trace Attempt 1483	[59.50 s]
0.0.AM: Trace Attempt 372	[60.04 s]
0.0.Ht: Trace Attempt 6891	[60.06 s]
0.0.B: Trace Attempt 6812	[60.11 s]
0.0.N: Trace Attempt 187	[60.20 s]
0.0.N: Trace Attempt  1	[63.02 s]
0.0.N: Trace Attempt  2	[63.02 s]
0.0.N: Trace Attempt  3	[63.02 s]
0.0.N: Trace Attempt  4	[63.03 s]
0.0.N: Trace Attempt  5	[63.03 s]
0.0.Hp: Trace Attempt 1543	[63.53 s]
0.0.AM: Trace Attempt 510	[64.07 s]
0.0.Ht: Trace Attempt 7093	[64.08 s]
0.0.B: Trace Attempt 7003	[64.12 s]
0.0.AM: Trace Attempt  1	[66.34 s]
0.0.AM: Trace Attempt  2	[66.35 s]
0.0.AM: Trace Attempt  3	[66.35 s]
0.0.AM: Trace Attempt  4	[66.35 s]
0.0.AM: Trace Attempt  5	[66.36 s]
0.0.N: Trace Attempt 136	[67.04 s]
0.0.Hp: Trace Attempt 1601	[67.56 s]
0.0.Ht: Trace Attempt 7284	[68.08 s]
0.0.B: Trace Attempt 7197	[68.13 s]
0.0.AM: Trace Attempt 132	[70.44 s]
0.0.N: Trace Attempt 200	[71.05 s]
0.0.Hp: Trace Attempt 1657	[71.59 s]
0.0.Ht: Trace Attempt 7470	[72.10 s]
0.0.B: Trace Attempt 7381	[72.14 s]
0.0.N: Trace Attempt  1	[73.66 s]
0.0.N: Trace Attempt  2	[73.66 s]
0.0.N: Trace Attempt  3	[73.66 s]
0.0.N: Trace Attempt  4	[73.66 s]
0.0.N: Trace Attempt  5	[73.67 s]
0.0.AM: Trace Attempt 203	[74.52 s]
0.0.Hp: Trace Attempt 1711	[75.63 s]
0.0.Ht: Trace Attempt 7656	[76.11 s]
0.0.B: Trace Attempt 7560	[76.14 s]
0.0.N: Trace Attempt 137	[77.73 s]
0.0.AM: Trace Attempt 256	[78.54 s]
0.0.Hp: Trace Attempt 1763	[79.65 s]
0.0.Ht: Trace Attempt 7837	[80.13 s]
0.0.B: Trace Attempt 7722	[80.14 s]
0.0.N: Trace Attempt 202	[81.76 s]
0.0.AM: Trace Attempt 319	[82.61 s]
0.0.Hp: Trace Attempt 1814	[83.71 s]
0.0.Ht: Trace Attempt 8017	[84.14 s]
0.0.B: Trace Attempt 7884	[84.15 s]
0.0.N: Trace Attempt  1	[84.24 s]
0.0.N: Trace Attempt  2	[84.24 s]
0.0.N: Trace Attempt  3	[84.24 s]
0.0.N: Trace Attempt  4	[84.25 s]
0.0.N: Trace Attempt  5	[84.25 s]
0.0.AM: Trace Attempt 361	[86.64 s]
0.0.Hp: Trace Attempt 1863	[87.75 s]
0.0.Ht: Trace Attempt 8195	[88.14 s]
0.0.B: Trace Attempt 8053	[88.15 s]
0.0.N: Trace Attempt 137	[88.31 s]
0.0.AM: Trace Attempt 391	[91.10 s]
0.0.Hp: Trace Attempt 1911	[91.82 s]
0.0.B: Trace Attempt 8217	[92.15 s]
0.0.Ht: Trace Attempt 8344	[92.17 s]
0.0.N: Trace Attempt 202	[92.35 s]
0.0.N: Trace Attempt  1	[94.80 s]
0.0.N: Trace Attempt  2	[94.81 s]
0.0.N: Trace Attempt  3	[94.81 s]
0.0.N: Trace Attempt  4	[94.81 s]
0.0.N: Trace Attempt  5	[94.81 s]
0.0.AM: Trace Attempt 417	[95.21 s]
0.0.Hp: Trace Attempt 1953	[95.88 s]
0.0.B: Trace Attempt 8384	[96.16 s]
0.0.Ht: Trace Attempt 8498	[96.17 s]
0.0.N: Trace Attempt 130	[98.86 s]
0.0.AM: Trace Attempt 445	[99.40 s]
0.0.Hp: Trace Attempt 2000	[99.96 s]
0.0.B: Trace Attempt 8548	[100.18 s]
0.0.Ht: Trace Attempt 8649	[100.19 s]
0.0.N: Trace Attempt 190	[102.87 s]
0.0.AM: Trace Attempt 480	[103.60 s]
0.0.Hp: Trace Attempt 2045	[104.01 s]
0.0.B: Trace Attempt 8707	[104.18 s]
0.0.Ht: Trace Attempt 8809	[104.20 s]
0.0.N: Trace Attempt  1	[105.52 s]
0.0.N: Trace Attempt  2	[105.52 s]
0.0.N: Trace Attempt  3	[105.53 s]
0.0.N: Trace Attempt  4	[105.53 s]
0.0.N: Trace Attempt  5	[105.53 s]
0.0.AM: Trace Attempt 512	[107.65 s]
0.0.Hp: Trace Attempt 2088	[108.07 s]
0.0.Ht: Trace Attempt 8972	[108.20 s]
0.0.B: Trace Attempt 8864	[108.20 s]
0.0.N: Trace Attempt 137	[109.56 s]
0.0.AM: Trace Attempt 544	[111.68 s]
0.0.Hp: Trace Attempt 2128	[112.08 s]
0.0.Ht: Trace Attempt 9131	[112.21 s]
0.0.B: Trace Attempt 9018	[112.21 s]
0.0.N: Trace Attempt 202	[113.58 s]
0.0.AM: Trace Attempt 575	[115.83 s]
0.0.N: Trace Attempt  1	[115.97 s]
0.0.N: Trace Attempt  2	[115.97 s]
0.0.N: Trace Attempt  3	[115.97 s]
0.0.N: Trace Attempt  4	[115.98 s]
0.0.N: Trace Attempt  5	[115.98 s]
0.0.Hp: Trace Attempt 2170	[116.17 s]
0.0.Ht: Trace Attempt 9281	[116.22 s]
0.0.B: Trace Attempt 9168	[116.21 s]
0.0.AM: Trace Attempt 605	[119.92 s]
0.0.N: Trace Attempt 137	[120.00 s]
0.0.Hp: Trace Attempt 2210	[120.19 s]
0.0.Ht: Trace Attempt 9432	[120.22 s]
0.0.B: Trace Attempt 9321	[120.23 s]
0.0.N: Trace Attempt 202	[124.01 s]
0.0.AM: Trace Attempt 632	[124.05 s]
0.0.Hp: Trace Attempt 2248	[124.29 s]
0.0.Ht: Trace Attempt 9577	[124.23 s]
0.0.B: Trace Attempt 9470	[124.25 s]
0.0.N: Trace Attempt  1	[126.46 s]
0.0.N: Trace Attempt  2	[126.47 s]
0.0.N: Trace Attempt  3	[126.47 s]
0.0.N: Trace Attempt  4	[126.47 s]
0.0.N: Trace Attempt  5	[126.47 s]
0.0.AM: Trace Attempt 654	[128.06 s]
0.0.Ht: Trace Attempt 9723	[128.24 s]
0.0.B: Trace Attempt 9614	[128.27 s]
0.0.Hp: Trace Attempt 2281	[128.41 s]
0.0.N: Trace Attempt 137	[130.50 s]
0.0.AM: Trace Attempt 677	[132.15 s]
0.0.Ht: Trace Attempt 9870	[132.25 s]
0.0.B: Trace Attempt 9756	[132.29 s]
0.0.Hp: Trace Attempt 2313	[132.49 s]
0.0.N: Trace Attempt 202	[134.55 s]
0.0.AM: Trace Attempt 705	[136.22 s]
0.0.Ht: Trace Attempt 10010	[136.27 s]
0.0.B: Trace Attempt 9895	[136.30 s]
0.0.Hp: Trace Attempt 2348	[136.56 s]
0.0.N: Trace Attempt  1	[136.97 s]
0.0.N: Trace Attempt  2	[136.97 s]
0.0.N: Trace Attempt  3	[136.97 s]
0.0.N: Trace Attempt  4	[136.98 s]
0.0.N: Trace Attempt  5	[136.98 s]
0.0.Ht: Trace Attempt 10142	[140.27 s]
0.0.B: Trace Attempt 10033	[140.32 s]
0.0.AM: Trace Attempt 734	[140.46 s]
0.0.Hp: Trace Attempt 2385	[140.65 s]
0.0.N: Trace Attempt 130	[141.01 s]
0.0.Ht: Trace Attempt 10278	[144.30 s]
0.0.B: Trace Attempt 10167	[144.34 s]
0.0.AM: Trace Attempt 762	[144.53 s]
0.0.Hp: Trace Attempt 2422	[144.72 s]
0.0.N: Trace Attempt 190	[145.02 s]
0.0.N: Trace Attempt  1	[147.69 s]
0.0.N: Trace Attempt  2	[147.70 s]
0.0.N: Trace Attempt  3	[147.70 s]
0.0.N: Trace Attempt  4	[147.70 s]
0.0.N: Trace Attempt  5	[147.70 s]
0.0.Ht: Trace Attempt 10412	[148.32 s]
0.0.B: Trace Attempt 10298	[148.36 s]
0.0.Hp: Trace Attempt 2457	[148.75 s]
0.0.AM: Trace Attempt 788	[148.70 s]
0.0.N: Trace Attempt 130	[151.73 s]
0.0.Ht: Trace Attempt 10546	[152.34 s]
0.0.B: Trace Attempt 10429	[152.37 s]
0.0.Hp: Trace Attempt 2492	[152.77 s]
0.0.AM: Trace Attempt 818	[152.76 s]
0.0.N: Trace Attempt 190	[155.74 s]
0.0.Ht: Trace Attempt 10678	[156.35 s]
0.0.B: Trace Attempt 10557	[156.40 s]
0.0.Hp: Trace Attempt 2527	[156.83 s]
0.0.AM: Trace Attempt 845	[156.89 s]
0.0.N: Trace Attempt  1	[158.37 s]
0.0.N: Trace Attempt  2	[158.37 s]
0.0.N: Trace Attempt  3	[158.37 s]
0.0.N: Trace Attempt  4	[158.38 s]
0.0.N: Trace Attempt  5	[158.38 s]
0.0.Ht: Trace Attempt 10799	[160.38 s]
0.0.B: Trace Attempt 10682	[160.40 s]
0.0.Hp: Trace Attempt 2562	[160.93 s]
0.0.AM: Trace Attempt 874	[161.62 s]
0.0.N: Trace Attempt 130	[162.43 s]
0.0.Ht: Trace Attempt 10917	[164.39 s]
0.0.B: Trace Attempt 10804	[164.42 s]
0.0.Hp: Trace Attempt 2596	[165.03 s]
0.0.N: Trace Attempt 190	[166.44 s]
0.0.AM: Trace Attempt 878	[166.58 s]
0.0.Ht: Trace Attempt 11040	[168.41 s]
0.0.B: Trace Attempt 10925	[168.42 s]
0.0.N: Trace Attempt  1	[169.04 s]
0.0.N: Trace Attempt  2	[169.05 s]
0.0.N: Trace Attempt  3	[169.05 s]
0.0.N: Trace Attempt  4	[169.05 s]
0.0.N: Trace Attempt  5	[169.05 s]
0.0.Hp: Trace Attempt 2630	[169.13 s]
0.0.AM: Trace Attempt 884	[171.40 s]
0.0.Ht: Trace Attempt 11157	[172.43 s]
0.0.B: Trace Attempt 11045	[172.44 s]
0.0.N: Trace Attempt 138	[173.06 s]
0.0.Hp: Trace Attempt 2663	[173.20 s]
0.0.Ht: Trace Attempt 11272	[176.45 s]
0.0.B: Trace Attempt 11164	[176.46 s]
0.0.N: Trace Attempt 204	[177.07 s]
0.0.Hp: Trace Attempt 2696	[177.29 s]
0.0.N: Trace Attempt  1	[179.91 s]
0.0.N: Trace Attempt  2	[179.91 s]
0.0.N: Trace Attempt  3	[179.91 s]
0.0.N: Trace Attempt  4	[179.92 s]
0.0.N: Trace Attempt  5	[179.92 s]
0.0.Ht: Trace Attempt 11387	[180.45 s]
0.0.B: Trace Attempt 11279	[180.48 s]
0.0.N: Trace Attempt 65	[180.94 s]
0.0.N: Stopped processing property "Load_Store.p1"	[180.97 s].
0.0.N: Morphing to Ncustom1
0.0.N: All properties determined. [0.00 s]
0.0.N: Exited with Success (@ 0.00 s)
0.0.Ncustom1: clocks: 1, declared: 1, looping: 0, posedge: 1, negedge: 0, noedge: 0, bothedge: 0
0.0.Ncustom1: Starting proof for property "Load_Store.p1"	[0.00 s].
0.0.Ncustom1: Trace Attempt 257	[0.04 s]
0.0.Tri: Proofgrid shell started at 148440@vlsi-moon(local) jg_146830_vlsi-moon_1
0.0.Tri: clocks: 1, declared: 1, looping: 0, posedge: 1, negedge: 0, noedge: 0, bothedge: 0
0.0.Tri: Last scan. Per property time limit: 0s
0.0.Tri: Starting proof for property "Load_Store.p1"	[0.00 s].
0.0.Tri: Trace Attempt  1	[0.00 s]
0.0.B: Trace Attempt 11290	[180.86 s]
0.0.B: Stopped processing property "Load_Store.p1"	[181.01 s].
0.0.B: Morphing to Bcustom2
0.0.B: All properties determined. [0.00 s]
0.0.B: Exited with Success (@ 0.00 s)
0.0.Bcustom2: clocks: 1, declared: 1, looping: 0, posedge: 1, negedge: 0, noedge: 0, bothedge: 0
0.0.Bcustom2: Starting proof for property "Load_Store.p1"	[0.00 s].
0.0.Bcustom2: Trace Attempt  1	[0.00 s]
0.0.Bcustom2: Trace Attempt  2	[0.00 s]
0.0.Bcustom2: Trace Attempt  1	[0.00 s]
0.0.Bcustom2: Trace Attempt  2	[0.00 s]
0.0.Bcustom2: Trace Attempt  3	[0.00 s]
0.0.Bcustom2: Trace Attempt  1	[0.00 s]
0.0.Bcustom2: Trace Attempt  2	[0.00 s]
0.0.Bcustom2: Trace Attempt  3	[0.00 s]
0.0.Bcustom2: Trace Attempt  4	[0.00 s]
0.0.Bcustom2: Trace Attempt  5	[0.00 s]
0.0.Bcustom2: Trace Attempt  1	[0.01 s]
0.0.Bcustom2: Trace Attempt  2	[0.01 s]
0.0.Bcustom2: Trace Attempt  3	[0.01 s]
0.0.Bcustom2: Trace Attempt  4	[0.01 s]
0.0.Bcustom2: Trace Attempt  5	[0.01 s]
0.0.Bcustom2: Trace Attempt  1	[0.01 s]
0.0.Bcustom2: Trace Attempt  2	[0.01 s]
0.0.Bcustom2: Trace Attempt  3	[0.01 s]
0.0.Bcustom2: Trace Attempt  4	[0.01 s]
0.0.Bcustom2: Trace Attempt  5	[0.01 s]
0.0.Bcustom2: Trace Attempt  1	[0.02 s]
0.0.Bcustom2: Trace Attempt  2	[0.02 s]
0.0.Bcustom2: Trace Attempt  3	[0.02 s]
0.0.Bcustom2: Trace Attempt  4	[0.02 s]
0.0.Bcustom2: Trace Attempt  5	[0.02 s]
0.0.Bcustom2: Trace Attempt  1	[0.03 s]
0.0.Bcustom2: Trace Attempt  2	[0.03 s]
0.0.Bcustom2: Trace Attempt  3	[0.03 s]
0.0.Bcustom2: Trace Attempt  4	[0.03 s]
0.0.Bcustom2: Trace Attempt  5	[0.03 s]
0.0.AM: Trace Attempt 888	[174.82 s]
0.0.AM: Stopped processing property "Load_Store.p1"	[181.06 s].
0.0.AM: Morphing to AMcustom3
0.0.AM: All properties determined. [0.00 s]
0.0.AM: Exited with Success (@ 0.00 s)
0.0.AMcustom3: clocks: 1, declared: 1, looping: 0, posedge: 1, negedge: 0, noedge: 0, bothedge: 0
0.0.AMcustom3: Starting proof for property "Load_Store.p1"	[0.00 s].
0.0.AMcustom3: Trace Attempt  1	[0.00 s]
0.0.AMcustom3: Trace Attempt  2	[0.00 s]
0.0.AMcustom3: Trace Attempt  3	[0.00 s]
0.0.AMcustom3: Trace Attempt  4	[0.00 s]
0.0.AMcustom3: Trace Attempt  5	[0.00 s]
0.0.AMcustom3: Trace Attempt  1	[0.01 s]
0.0.Tri:    0.00" ---- Launching main thread ----
0.0.AMcustom3: Trace Attempt  2	[0.01 s]
0.0.AMcustom3: Trace Attempt  3	[0.01 s]
0.0.AMcustom3: Trace Attempt  4	[0.02 s]
0.0.AMcustom3: Trace Attempt  5	[0.02 s]
0.0.Bcustom2: Trace Attempt  1	[0.07 s]
0.0.Bcustom2: Trace Attempt  2	[0.07 s]
0.0.Bcustom2: Trace Attempt  3	[0.07 s]
0.0.Bcustom2: Trace Attempt  4	[0.07 s]
0.0.Bcustom2: Trace Attempt  5	[0.07 s]
0.0.AMcustom3: Trace Attempt  1	[0.03 s]
0.0.AMcustom3: Trace Attempt  2	[0.03 s]
0.0.AMcustom3: Trace Attempt  3	[0.04 s]
0.0.Tri:    0.04" ---- Launching abstraction thread ----
0.0.AMcustom3: Trace Attempt  4	[0.04 s]
0.0.AMcustom3: Trace Attempt  5	[0.04 s]
0.0.Tri:    0.04" ---- Launching multi-phase simplification thread ----
0.0.Tri:    0.06" ---- Launching liveness simplification thread ----
0.0.AMcustom3: Trace Attempt  1	[0.10 s]
0.0.AMcustom3: Trace Attempt  2	[0.10 s]
0.0.AMcustom3: Trace Attempt  3	[0.10 s]
0.0.AMcustom3: Trace Attempt  4	[0.10 s]
0.0.AMcustom3: Trace Attempt  5	[0.10 s]
0.0.Bcustom2: Trace Attempt  1	[0.15 s]
0.0.Bcustom2: Trace Attempt  2	[0.15 s]
0.0.Bcustom2: Trace Attempt  3	[0.15 s]
0.0.Bcustom2: Trace Attempt  4	[0.15 s]
0.0.Bcustom2: Trace Attempt  5	[0.15 s]
0.0.Hp: Trace Attempt 2728	[181.30 s]
0.0.AMcustom3: Trace Attempt  1	[0.31 s]
0.0.AMcustom3: Trace Attempt  2	[0.31 s]
0.0.AMcustom3: Trace Attempt  3	[0.31 s]
0.0.Bcustom2: Trace Attempt  1	[0.35 s]
0.0.Bcustom2: Trace Attempt  2	[0.35 s]
0.0.Bcustom2: Trace Attempt  3	[0.35 s]
0.0.Bcustom2: Trace Attempt  4	[0.35 s]
0.0.Bcustom2: Trace Attempt  5	[0.35 s]
0.0.AMcustom3: Trace Attempt  4	[0.32 s]
0.0.AMcustom3: Trace Attempt  5	[0.32 s]
0.0.Ncustom1: Trace Attempt  1	[0.52 s]
0.0.Ncustom1: Trace Attempt  2	[0.52 s]
0.0.Ncustom1: Trace Attempt  3	[0.52 s]
0.0.Ncustom1: Trace Attempt  4	[0.53 s]
0.0.Ncustom1: Trace Attempt  5	[0.53 s]
0.0.Tri:    0.91" Simplification phase 1 complete
0.0.Tri: Stopped processing property "Load_Store.p1"	[1.16 s].
0.0.AMcustom3: Trace Attempt  1	[1.11 s]
0.0.AMcustom3: Stopped processing property "Load_Store.p1"	[1.12 s].
0.0.Tri: Morphing to AMcustom5
0.0.Tri: All properties determined. [0.00 s]
0.0.Tri: Exited with Success (@ 0.00 s)
0.0.AMcustom5: clocks: 1, declared: 1, looping: 0, posedge: 1, negedge: 0, noedge: 0, bothedge: 0
0.0.AMcustom5: Starting proof for property "Load_Store.p1"	[0.00 s].
0.0.AMcustom5: Trace Attempt  1	[0.00 s]
0.0.AMcustom5: Trace Attempt  2	[0.00 s]
0.0.AMcustom5: Trace Attempt  1	[0.01 s]
0.0.AMcustom5: Trace Attempt  2	[0.01 s]
0.0.AMcustom3: Morphing to M
0.0.AMcustom3: All properties determined. [0.00 s]
0.0.AMcustom3: Exited with Success (@ 0.00 s)
0.0.AMcustom5: Trace Attempt  3	[0.01 s]
0.0.M: clocks: 1, declared: 1, looping: 0, posedge: 1, negedge: 0, noedge: 0, bothedge: 0
0.0.M: Starting proof for property "Load_Store.p1"	[0.00 s].
0.0.M: Trace Attempt  1	[0.00 s]
0.0.AMcustom5: Trace Attempt  1	[0.01 s]
0.0.M: Trace Attempt  2	[0.00 s]
0.0.AMcustom5: Trace Attempt  2	[0.01 s]
0.0.M: Trace Attempt  3	[0.00 s]
0.0.AMcustom5: Trace Attempt  3	[0.01 s]
0.0.AMcustom5: Trace Attempt  4	[0.01 s]
0.0.AMcustom5: Trace Attempt  5	[0.01 s]
0.0.AMcustom5: Trace Attempt  1	[0.02 s]
0.0.AMcustom5: Trace Attempt  2	[0.02 s]
0.0.M: Trace Attempt  4	[0.01 s]
0.0.AMcustom5: Trace Attempt  3	[0.02 s]
0.0.AMcustom5: Trace Attempt  4	[0.02 s]
0.0.AMcustom5: Trace Attempt  5	[0.02 s]
0.0.M: Trace Attempt  5	[0.01 s]
0.0.AMcustom5: Trace Attempt  1	[0.02 s]
0.0.AMcustom5: Trace Attempt  2	[0.02 s]
0.0.AMcustom5: Trace Attempt  3	[0.03 s]
0.0.AMcustom5: Trace Attempt  4	[0.03 s]
0.0.AMcustom5: Trace Attempt  5	[0.03 s]
0.0.AMcustom5: Trace Attempt  1	[0.04 s]
0.0.AMcustom5: Trace Attempt  2	[0.04 s]
0.0.AMcustom5: Trace Attempt  3	[0.04 s]
0.0.AMcustom5: Trace Attempt  4	[0.04 s]
0.0.AMcustom5: Trace Attempt  5	[0.04 s]
0.0.AMcustom5: Trace Attempt  1	[0.05 s]
0.0.AMcustom5: Trace Attempt  2	[0.05 s]
0.0.AMcustom5: Trace Attempt  3	[0.05 s]
0.0.AMcustom5: Trace Attempt  4	[0.05 s]
0.0.AMcustom5: Trace Attempt  5	[0.06 s]
0.0.AMcustom5: Trace Attempt  1	[0.07 s]
0.0.AMcustom5: Trace Attempt  2	[0.07 s]
0.0.AMcustom5: Trace Attempt  3	[0.07 s]
0.0.AMcustom5: Trace Attempt  4	[0.07 s]
0.0.AMcustom5: Trace Attempt  5	[0.07 s]
0.0.AMcustom5: Trace Attempt  1	[0.13 s]
0.0.AMcustom5: Trace Attempt  2	[0.13 s]
0.0.AMcustom5: Trace Attempt  3	[0.13 s]
0.0.AMcustom5: Trace Attempt  4	[0.13 s]
0.0.AMcustom5: Trace Attempt  5	[0.13 s]
0.0.AMcustom5: Trace Attempt  1	[0.13 s]
0.0.AMcustom5: Trace Attempt  2	[0.13 s]
0.0.AMcustom5: Trace Attempt  3	[0.14 s]
0.0.AMcustom5: Trace Attempt  4	[0.14 s]
0.0.AMcustom5: Trace Attempt  5	[0.14 s]
0.0.AMcustom5: Trace Attempt  1	[0.15 s]
0.0.AMcustom5: Trace Attempt  2	[0.15 s]
0.0.AMcustom5: Trace Attempt  3	[0.15 s]
0.0.AMcustom5: Trace Attempt  4	[0.16 s]
0.0.AMcustom5: Trace Attempt  5	[0.17 s]
0.0.AMcustom5: Trace Attempt  1	[0.23 s]
0.0.AMcustom5: Trace Attempt  2	[0.23 s]
0.0.AMcustom5: Trace Attempt  3	[0.23 s]
0.0.AMcustom5: Trace Attempt  4	[0.24 s]
0.0.AMcustom5: Trace Attempt  1	[0.43 s]
0.0.AMcustom5: Trace Attempt  2	[0.43 s]
0.0.AMcustom5: Trace Attempt  3	[0.43 s]
0.0.AMcustom5: Trace Attempt  4	[0.43 s]
0.0.AMcustom5: Trace Attempt  5	[0.43 s]
0.0.AMcustom5: Trace Attempt  1	[0.43 s]
0.0.AMcustom5: Trace Attempt  2	[0.43 s]
0.0.AMcustom5: Trace Attempt  3	[0.43 s]
0.0.AMcustom5: Trace Attempt  4	[0.44 s]
0.0.AMcustom5: Trace Attempt  5	[0.44 s]
0.0.AMcustom5: Trace Attempt  1	[0.45 s]
0.0.AMcustom5: Trace Attempt  2	[0.45 s]
0.0.AMcustom5: Trace Attempt  3	[0.45 s]
0.0.AMcustom5: Trace Attempt  4	[0.45 s]
0.0.AMcustom5: Trace Attempt  5	[0.46 s]
0.0.AMcustom5: Trace Attempt  1	[0.52 s]
0.0.AMcustom5: Trace Attempt  2	[0.52 s]
0.0.AMcustom5: Trace Attempt  3	[0.52 s]
0.0.AMcustom5: Trace Attempt  4	[0.53 s]
0.0.AMcustom5: Trace Attempt  5	[0.54 s]
0.0.AMcustom5: Trace Attempt  1	[0.73 s]
0.0.AMcustom5: Trace Attempt  2	[0.74 s]
0.0.AMcustom5: Trace Attempt  3	[0.74 s]
0.0.AMcustom5: Trace Attempt  4	[0.74 s]
0.0.AMcustom5: Trace Attempt  5	[0.74 s]
0.0.AMcustom5: Trace Attempt  1	[1.53 s]
0.0.AMcustom5: Trace Attempt  2	[1.53 s]
0.0.AMcustom5: Trace Attempt  3	[1.53 s]
0.0.AMcustom5: Trace Attempt  4	[1.53 s]
0.0.AMcustom5: Trace Attempt  5	[1.53 s]
0.0.AMcustom5: Trace Attempt  1	[1.53 s]
0.0.AMcustom5: Trace Attempt  2	[1.53 s]
0.0.AMcustom5: Trace Attempt  3	[1.53 s]
0.0.AMcustom5: Trace Attempt  4	[1.54 s]
0.0.AMcustom5: Trace Attempt  5	[1.54 s]
0.0.AMcustom5: Trace Attempt  1	[1.57 s]
0.0.AMcustom5: Trace Attempt  2	[1.58 s]
0.0.AMcustom5: Trace Attempt  3	[1.58 s]
0.0.AMcustom5: Trace Attempt  4	[1.58 s]
0.0.AMcustom5: Trace Attempt  5	[1.58 s]
0.0.AMcustom5: Trace Attempt  1	[1.64 s]
0.0.AMcustom5: Trace Attempt  2	[1.64 s]
0.0.AMcustom5: Trace Attempt  3	[1.64 s]
0.0.AMcustom5: Trace Attempt  4	[1.65 s]
0.0.AMcustom5: Trace Attempt  5	[1.65 s]
0.0.AMcustom5: Trace Attempt  1	[1.86 s]
0.0.AMcustom5: Trace Attempt  2	[1.86 s]
0.0.AMcustom5: Trace Attempt  3	[1.86 s]
0.0.AMcustom5: Trace Attempt  4	[1.87 s]
0.0.AMcustom5: Trace Attempt  5	[1.87 s]
0.0.AMcustom5: Trace Attempt 28	[2.03 s]
0.0.AMcustom5: Stopped processing property "Load_Store.p1"	[2.03 s].
0.0.AMcustom5: Morphing to ADcustom7
0.0.AMcustom5: All properties determined. [0.00 s]
0.0.AMcustom5: Exited with Success (@ 0.00 s)
0.0.ADcustom7: clocks: 1, declared: 1, looping: 0, posedge: 1, negedge: 0, noedge: 0, bothedge: 0
0.0.ADcustom7: Starting proof for property "Load_Store.p1"	[0.00 s].
0.0.ADcustom7: Trace Attempt  1	[0.00 s]
0.0.ADcustom7: Trace Attempt  2	[0.00 s]
0.0.Ncustom1: Trace Attempt 116	[3.29 s]
0.0.Ncustom1: Stopped processing property "Load_Store.p1"	[3.31 s].
0.0.Ncustom1: Morphing to AMcustom3
0.0.Ncustom1: All properties determined. [0.00 s]
0.0.Ncustom1: Exited with Success (@ 0.00 s)
0.0.ADcustom7: Trace Attempt  1	[0.00 s]
0.0.ADcustom7: Trace Attempt  2	[0.00 s]
0.0.ADcustom7: Trace Attempt  3	[0.00 s]
0.0.AMcustom3: clocks: 1, declared: 1, looping: 0, posedge: 1, negedge: 0, noedge: 0, bothedge: 0
0.0.AMcustom3: Starting proof for property "Load_Store.p1"	[0.00 s].
0.0.AMcustom3: Trace Attempt  1	[0.00 s]
0.0.AMcustom3: Trace Attempt  2	[0.00 s]
0.0.ADcustom7: Trace Attempt  1	[0.00 s]
0.0.ADcustom7: Trace Attempt  2	[0.00 s]
0.0.AMcustom3: Trace Attempt  3	[0.00 s]
0.0.ADcustom7: Trace Attempt  3	[0.00 s]
0.0.AMcustom3: Trace Attempt  4	[0.00 s]
0.0.AMcustom3: Trace Attempt  5	[0.00 s]
0.0.ADcustom7: Trace Attempt  4	[0.01 s]
0.0.ADcustom7: Trace Attempt  5	[0.01 s]
0.0.AMcustom3: Trace Attempt  1	[0.00 s]
0.0.ADcustom7: Trace Attempt  1	[0.01 s]
0.0.ADcustom7: Trace Attempt  2	[0.01 s]
0.0.ADcustom7: Trace Attempt  3	[0.01 s]
0.0.ADcustom7: Trace Attempt  4	[0.01 s]
0.0.AMcustom3: Trace Attempt  2	[0.01 s]
0.0.ADcustom7: Trace Attempt  5	[0.01 s]
0.0.AMcustom3: Trace Attempt  3	[0.01 s]
0.0.ADcustom7: Trace Attempt  1	[0.01 s]
0.0.ADcustom7: Trace Attempt  2	[0.01 s]
0.0.ADcustom7: Trace Attempt  4	[0.01 s]
0.0.AMcustom3: Trace Attempt  4	[0.01 s]
0.0.AMcustom3: Trace Attempt  5	[0.01 s]
0.0.AMcustom3: Trace Attempt  1	[0.03 s]
0.0.AMcustom3: Trace Attempt  2	[0.03 s]
0.0.AMcustom3: Trace Attempt  3	[0.03 s]
0.0.ADcustom7: Trace Attempt  1	[0.03 s]
0.0.ADcustom7: Trace Attempt  2	[0.04 s]
0.0.ADcustom7: Trace Attempt  3	[0.04 s]
0.0.ADcustom7: Trace Attempt  4	[0.04 s]
0.0.ADcustom7: Trace Attempt  5	[0.04 s]
0.0.ADcustom7: Trace Attempt  1	[0.04 s]
0.0.ADcustom7: Trace Attempt  2	[0.04 s]
0.0.AMcustom3: Trace Attempt  4	[0.04 s]
0.0.AMcustom3: Trace Attempt  5	[0.04 s]
0.0.ADcustom7: Trace Attempt  4	[0.04 s]
0.0.ADcustom7: Trace Attempt  1	[0.06 s]
0.0.ADcustom7: Trace Attempt  2	[0.06 s]
0.0.ADcustom7: Trace Attempt  4	[0.06 s]
0.0.AMcustom3: Trace Attempt  1	[0.09 s]
0.0.AMcustom3: Trace Attempt  2	[0.09 s]
0.0.AMcustom3: Trace Attempt  3	[0.09 s]
0.0.AMcustom3: Trace Attempt  4	[0.10 s]
0.0.AMcustom3: Trace Attempt  5	[0.10 s]
0.0.ADcustom7: Trace Attempt  1	[0.13 s]
0.0.ADcustom7: Trace Attempt  2	[0.13 s]
0.0.ADcustom7: Trace Attempt  3	[0.13 s]
0.0.ADcustom7: Trace Attempt  4	[0.13 s]
0.0.ADcustom7: Trace Attempt  5	[0.13 s]
0.0.ADcustom7: Trace Attempt  1	[0.13 s]
0.0.ADcustom7: Trace Attempt  2	[0.13 s]
0.0.ADcustom7: Trace Attempt  4	[0.13 s]
0.0.ADcustom7: Trace Attempt  1	[0.15 s]
0.0.ADcustom7: Trace Attempt  2	[0.15 s]
0.0.ADcustom7: Trace Attempt  4	[0.15 s]
0.0.ADcustom7: Trace Attempt  1	[0.21 s]
0.0.ADcustom7: Trace Attempt  2	[0.21 s]
0.0.ADcustom7: Trace Attempt  4	[0.22 s]
0.0.Ht: Trace Attempt 11500	[184.47 s]
0.0.AMcustom3: Trace Attempt  1	[0.30 s]
0.0.AMcustom3: Trace Attempt  2	[0.30 s]
0.0.AMcustom3: Trace Attempt  3	[0.30 s]
0.0.AMcustom3: Trace Attempt  4	[0.31 s]
0.0.AMcustom3: Trace Attempt  5	[0.31 s]
0.0.ADcustom7: Trace Attempt  1	[0.48 s]
0.0.ADcustom7: Trace Attempt  2	[0.48 s]
0.0.ADcustom7: Trace Attempt  3	[0.48 s]
0.0.ADcustom7: Trace Attempt  4	[0.48 s]
0.0.ADcustom7: Trace Attempt  5	[0.48 s]
0.0.ADcustom7: Trace Attempt  1	[0.49 s]
0.0.ADcustom7: Trace Attempt  2	[0.49 s]
0.0.ADcustom7: Trace Attempt  4	[0.49 s]
0.0.ADcustom7: Trace Attempt  1	[0.51 s]
0.0.ADcustom7: Trace Attempt  2	[0.51 s]
0.0.ADcustom7: Trace Attempt  4	[0.51 s]
0.0.ADcustom7: Trace Attempt  1	[0.57 s]
0.0.ADcustom7: Trace Attempt  2	[0.57 s]
0.0.ADcustom7: Trace Attempt  4	[0.58 s]
0.0.ADcustom7: Trace Attempt  1	[0.86 s]
0.0.ADcustom7: Trace Attempt  2	[0.86 s]
0.0.ADcustom7: Trace Attempt  4	[0.87 s]
0.0.Hp: Trace Attempt 2759	[185.31 s]
0.0.AMcustom3: Trace Attempt  1	[1.06 s]
0.0.AMcustom3: Trace Attempt  2	[1.06 s]
0.0.AMcustom3: Trace Attempt  3	[1.06 s]
0.0.AMcustom3: Trace Attempt  4	[1.07 s]
0.0.AMcustom3: Trace Attempt  5	[1.07 s]
0.0.Bcustom2: Trace Attempt  1	[4.43 s]
0.0.Bcustom2: Stopped processing property "Load_Store.p1"	[4.43 s].
0.0.Bcustom2: Morphing to D
0.0.Bcustom2: All properties determined. [0.00 s]
0.0.Bcustom2: Exited with Success (@ 0.00 s)
0.0.D: clocks: 1, declared: 1, looping: 0, posedge: 1, negedge: 0, noedge: 0, bothedge: 0
0.0.D: Starting proof for property "Load_Store.p1"	[0.00 s].
0.0.D: Trace Attempt  1	[0.00 s]
0.0.D: Trace Attempt  2	[0.00 s]
0.0.D: Trace Attempt  4	[0.00 s]
0.0.M: Trace Attempt 111	[4.09 s]
0.0.ADcustom7: Trace Attempt  1	[2.08 s]
0.0.ADcustom7: Trace Attempt  2	[2.08 s]
0.0.ADcustom7: Trace Attempt  3	[2.08 s]
0.0.ADcustom7: Trace Attempt  4	[2.08 s]
0.0.ADcustom7: Trace Attempt  5	[2.08 s]
0.0.ADcustom7: Trace Attempt  1	[2.08 s]
0.0.ADcustom7: Trace Attempt  2	[2.08 s]
0.0.ADcustom7: Trace Attempt  3	[2.08 s]
0.0.ADcustom7: Trace Attempt  5	[2.09 s]
0.0.ADcustom7: Trace Attempt  1	[2.11 s]
0.0.ADcustom7: Trace Attempt  2	[2.11 s]
0.0.ADcustom7: Trace Attempt  3	[2.11 s]
0.0.ADcustom7: Trace Attempt  5	[2.11 s]
0.0.ADcustom7: Trace Attempt  1	[2.18 s]
0.0.ADcustom7: Trace Attempt  2	[2.18 s]
0.0.ADcustom7: Trace Attempt  3	[2.18 s]
0.0.ADcustom7: Trace Attempt  5	[2.18 s]
0.0.ADcustom7: Trace Attempt  1	[2.45 s]
0.0.ADcustom7: Trace Attempt  2	[2.45 s]
0.0.ADcustom7: Trace Attempt  3	[2.45 s]
0.0.ADcustom7: Trace Attempt  5	[2.45 s]
0.0.AMcustom3: Trace Attempt  1	[2.91 s]
0.0.AMcustom3: Trace Attempt  2	[2.91 s]
0.0.AMcustom3: Trace Attempt  3	[2.91 s]
0.0.AMcustom3: Trace Attempt  4	[2.92 s]
0.0.AMcustom3: Trace Attempt  5	[2.92 s]
0.0.ADcustom7: Trace Attempt  1	[3.85 s]
0.0.ADcustom7: Trace Attempt  2	[3.85 s]
0.0.ADcustom7: Trace Attempt  3	[3.85 s]
0.0.ADcustom7: Trace Attempt  5	[3.86 s]
0.0.AMcustom3: Trace Attempt 74	[4.13 s]
0.0.AMcustom3: Stopped processing property "Load_Store.p1"	[4.13 s].
0.0.AMcustom3: Morphing to Tri
0.0.AMcustom3: All properties determined. [0.00 s]
0.0.AMcustom3: Exited with Success (@ 0.00 s)
0.0.ADcustom7: Trace Attempt 33	[4.11 s]
0.0.ADcustom7: Stopped processing property "Load_Store.p1"	[4.14 s].
0.0.ADcustom7: Morphing to Tricustom8
0.0.ADcustom7: All properties determined. [0.00 s]
0.0.ADcustom7: Exited with Success (@ 0.00 s)
0.0.Tri: clocks: 1, declared: 1, looping: 0, posedge: 1, negedge: 0, noedge: 0, bothedge: 0
0.0.Tricustom8: clocks: 1, declared: 1, looping: 0, posedge: 1, negedge: 0, noedge: 0, bothedge: 0
0.0.Tricustom8: Starting proof for property "Load_Store.p1"	[0.00 s].
0.0.Tricustom8: Trace Attempt  1	[0.00 s]
0.0.Tri: Starting proof for property "Load_Store.p1"	[0.00 s].
0.0.Tri: Trace Attempt  1	[0.00 s]
0.0.M: Trace Attempt 133	[6.10 s]
0.0.M: Stopped processing property "Load_Store.p1"	[6.17 s].
0.0.M: Morphing to AMcustom5
0.0.M: All properties determined. [0.00 s]
0.0.M: Exited with Success (@ 0.00 s)
0.0.AMcustom5: clocks: 1, declared: 1, looping: 0, posedge: 1, negedge: 0, noedge: 0, bothedge: 0
0.0.AMcustom5: Starting proof for property "Load_Store.p1"	[0.00 s].
0.0.AMcustom5: Trace Attempt  1	[0.00 s]
0.0.AMcustom5: Trace Attempt  2	[0.00 s]
0.0.AMcustom5: Trace Attempt  1	[0.00 s]
0.0.AMcustom5: Trace Attempt  2	[0.00 s]
0.0.AMcustom5: Trace Attempt  3	[0.00 s]
0.0.AMcustom5: Trace Attempt  1	[0.00 s]
0.0.AMcustom5: Trace Attempt  2	[0.00 s]
0.0.AMcustom5: Trace Attempt  3	[0.01 s]
0.0.AMcustom5: Trace Attempt  4	[0.01 s]
0.0.AMcustom5: Trace Attempt  5	[0.01 s]
0.0.AMcustom5: Trace Attempt  1	[0.01 s]
0.0.AMcustom5: Trace Attempt  2	[0.01 s]
0.0.AMcustom5: Trace Attempt  3	[0.01 s]
0.0.AMcustom5: Trace Attempt  4	[0.01 s]
0.0.AMcustom5: Trace Attempt  5	[0.01 s]
0.0.AMcustom5: Trace Attempt  1	[0.01 s]
0.0.AMcustom5: Trace Attempt  2	[0.01 s]
0.0.AMcustom5: Trace Attempt  3	[0.01 s]
0.0.AMcustom5: Trace Attempt  4	[0.02 s]
0.0.AMcustom5: Trace Attempt  5	[0.02 s]
0.0.AMcustom5: Trace Attempt  1	[0.03 s]
0.0.AMcustom5: Trace Attempt  2	[0.03 s]
0.0.AMcustom5: Trace Attempt  3	[0.03 s]
0.0.AMcustom5: Trace Attempt  4	[0.03 s]
0.0.AMcustom5: Trace Attempt  5	[0.03 s]
0.0.AMcustom5: Trace Attempt  1	[0.03 s]
0.0.AMcustom5: Trace Attempt  2	[0.04 s]
0.0.AMcustom5: Trace Attempt  3	[0.04 s]
0.0.AMcustom5: Trace Attempt  4	[0.04 s]
0.0.AMcustom5: Trace Attempt  5	[0.04 s]
0.0.Tri:    0.00" ---- Launching main thread ----
0.0.AMcustom5: Trace Attempt  1	[0.05 s]
0.0.AMcustom5: Trace Attempt  2	[0.06 s]
0.0.AMcustom5: Trace Attempt  3	[0.06 s]
0.0.AMcustom5: Trace Attempt  4	[0.06 s]
0.0.AMcustom5: Trace Attempt  5	[0.06 s]
0.0.Tri:    0.04" ---- Launching abstraction thread ----
0.0.Tri:    0.05" ---- Launching multi-phase simplification thread ----
0.0.AMcustom5: Trace Attempt  1	[0.11 s]
0.0.AMcustom5: Trace Attempt  2	[0.11 s]
0.0.AMcustom5: Trace Attempt  3	[0.11 s]
0.0.AMcustom5: Trace Attempt  4	[0.12 s]
0.0.AMcustom5: Trace Attempt  5	[0.12 s]
0.0.AMcustom5: Trace Attempt  1	[0.12 s]
0.0.AMcustom5: Trace Attempt  2	[0.12 s]
0.0.AMcustom5: Trace Attempt  3	[0.12 s]
0.0.Tri:    0.08" ---- Launching liveness simplification thread ----
0.0.AMcustom5: Trace Attempt  4	[0.12 s]
0.0.Ht: Trace Attempt 11617	[188.48 s]
0.0.AMcustom5: Trace Attempt  5	[0.13 s]
0.0.AMcustom5: Trace Attempt  1	[0.14 s]
0.0.AMcustom5: Trace Attempt  2	[0.14 s]
0.0.AMcustom5: Trace Attempt  3	[0.14 s]
0.0.AMcustom5: Trace Attempt  4	[0.14 s]
0.0.AMcustom5: Trace Attempt  5	[0.15 s]
0.0.AMcustom5: Trace Attempt  1	[0.20 s]
0.0.AMcustom5: Trace Attempt  2	[0.20 s]
0.0.AMcustom5: Trace Attempt  3	[0.20 s]
0.0.AMcustom5: Trace Attempt  4	[0.21 s]
0.0.Tri: Requesting engine job to terminate
0.0.D: Requesting engine job to terminate
0.0.AMcustom5: Requesting engine job to terminate
0.0.Tricustom8: Requesting engine job to terminate
0.0.Hp: Requesting engine job to terminate
0.0.Ht: Requesting engine job to terminate
INFO (IPF144): 0: Initiating shutdown of proof [188.73 s]
0.0.Tricustom8: A proof was found: No trace exists. [0.29 s]
INFO (IPF057): 0.0.Tricustom8: The property "Load_Store.p1" was proven in 0.29 s.
0.0.Ht: Trace Attempt 11621	[188.62 s]
0.0.Ht: All properties determined. [188.65 s]
0.0.AMcustom5: Trace Attempt 17	[0.28 s]
0.0.AMcustom5: Stopped processing property "Load_Store.p1"	[0.29 s].
0.0.AMcustom5: All properties determined. [0.29 s]
0.0.D: Trace Attempt 65	[1.73 s]
0.0.D: Stopped processing property "Load_Store.p1"	[3.20 s].
0.0.D: All properties determined. [3.20 s]
0.0.AMcustom5: Exited with Success (@ 188.73 s)
0: ProofGrid usable level: 0
0.0.Tri: Stopped processing property "Load_Store.p1"	[0.32 s].
0.0.D: Exited with Success (@ 188.76 s)
0.0.Tri: All properties determined. [0.33 s]
0.0.Tri: Exited with Success (@ 188.77 s)
0.0.Hp: Trace Attempt 2785	[188.68 s]
0.0.Hp: All properties determined. [188.79 s]
0.0.Ht: Exited with Success (@ 188.89 s)
0.0.Tricustom8: Stopped processing property "Load_Store.p1"	[0.49 s].
0.0.Tricustom8: All properties determined. [0.49 s]
0.0.Tricustom8: Exited with Success (@ 188.93 s)
0.0.Hp: Exited with Success (@ 189.15 s)
0: --------------------------------------------------------------
ProofGrid Summary (utilization 99.94 %)
--------------------------------------------------------------
     engines started                               :    15
     engine jobs started                           :     7

    Average time in state (seconds)
    ------------------------------------------------------
    Engine  Pending     Running        Dead    Utilization
    ------------------------------------------------------
     Hp        0.08      188.73        0.00       99.96 %
     Ht        0.08      188.65        0.00       99.96 %
     Oh        0.09        0.00        0.00        1.63 %
    Tri        0.08      188.71        0.00       99.96 %
      D        0.08      185.24        0.00       99.95 %
    AMcustom5        0.07      188.47        0.00       99.96 %
    Tricustom8        0.10        7.64        0.00       98.68 %
    all        0.08      135.35        0.00       99.94 %

    Total time in state (seconds)
    -----------------------------------------
            Pending     Running        Dead  
    -----------------------------------------
               0.58      947.43        0.00

    Data read    : 5.52 MiB
    Data written : 5.00 kiB

0: All pending notifications were processed.
INFO (IPF059): 0: Completed proof on task: "<embedded>"

==============================================================
SUMMARY
==============================================================
           Properties Considered              : 1
                 assertions                   : 1
                  - proven                    : 1 (100%)
                  - bounded_proven (user)     : 0 (0%)
                  - bounded_proven (auto)     : 0 (0%)
                  - marked_proven             : 0 (0%)
                  - cex                       : 0 (0%)
                  - ar_cex                    : 0 (0%)
                  - undetermined              : 0 (0%)
                  - unknown                   : 0 (0%)
                  - error                     : 0 (0%)
                 covers                       : 0
                  - unreachable               : 0
                  - bounded_unreachable (user): 0
                  - covered                   : 0
                  - ar_covered                : 0
                  - undetermined              : 0
                  - unknown                   : 0
                  - error                     : 0
proven
[<embedded>] % exit -force
[<embedded>] % INFO (IPL005): Received request to exit from the console.
INFO: Waiting for proof threads to stop...
INFO: Proof threads stopped.
INFO (IPL018): The peak resident set memory use for this session was 1.764 GB.
INFO (IPL014): Waiting for the Tcl-thread to exit.
INFO (IPL015): The Tcl-thread exited with status 0.
INFO (IPL016): Exiting the analysis session with status 0.
Finished load_store_6.tcl successfully
