# ----------------------------------------
# Jasper Version Info
# tool      : Jasper 2024.06
# platform  : Linux 3.10.0-1160.62.1.el7.x86_64
# version   : 2024.06p002 64 bits
# build date: 2024.09.02 16:28:38 UTC
# ----------------------------------------
# started   : 2025-11-17 19:01:48 IST
# hostname  : vlsi-ria84.vlsidomain
# pid       : 357
# arguments : '-label' 'session_0' '-console' '//127.0.0.1:34301' '-nowindow' '-style' 'windows' '-exitonerror' '-data' 'AAAAynicY2RgYLCp////PwMYMD6A0Aw2jAyoAMRnQhUJbEChGRhYYZphSliAmItBl6GAoYghnyELyNNi0ANCfSA7HS6aypDMUMJQDBRNYshhyGTIY8hmiGcwAqrmAepNYkgEyiYzZAD5Ymgq9MAyOWC7AAp0Ftk=' '-proj' '/users/rompel/jasper_executions/safety_liveness/jgprojects/blink_2/sessionLogs/session_0' '-init' '-hidden' '/users/rompel/jasper_executions/safety_liveness/jgprojects/blink_2/.tmp/.initCmds.tcl' 'blink_2.tcl' '-hidden' '/users/rompel/jasper_executions/safety_liveness/jgprojects/blink_2/.tmp/.postCmds.tcl'

Any disclosure about the Cadence Design Systems software or its use
model to any third party violates the written Non-Disclosure Agreement
between Cadence Design Systems, Inc. and the customer.

THIS SOFTWARE CONTAINS CONFIDENTIAL INFORMATION AND TRADE SECRETS OF
CADENCE DESIGN SYSTEMS, INC. USE, DISCLOSURE, OR REPRODUCTION IS
PROHIBITED WITHOUT THE PRIOR EXPRESS WRITTEN PERMISSION OF CADENCE
DESIGN SYSTEMS, INC.

Copyright (C) 2000-2024 Cadence Design Systems, Inc. All Rights
Reserved.  Unpublished -- rights reserved under the copyright laws of
the United States.

This product includes software developed by others and redistributed
according to license agreement. See doc/third_party_readme.txt for
further details.

RESTRICTED RIGHTS LEGEND

Use, duplication, or disclosure by the Government is subject to
restrictions as set forth in subparagraph (c) (1) (ii) of the Rights in
Technical Data and Computer Software clause at DFARS 252.227-7013 or
subparagraphs (c) (1) and (2) of Commercial Computer Software -- Restricted
Rights at 48 CFR 52.227-19, as applicable.


                          Cadence Design Systems, Inc.
                          2655 Seely Avenue
                          San Jose, CA 95134
                          Phone: 408.943.1234

For technical assistance visit http://support.cadence.com.

Jasper Apps Analysis Session - /users/rompel/jasper_executions/safety_liveness/jgprojects/blink_2/sessionLogs/session_0

WARNING (WG017): [session]: The system's locale is "ANSI_X3.4-1968", which is not UTF-8. Non-ASCII characters might not be handled correctly.
WARNING (WG017): [jg_console]: The system's locale is "ANSI_X3.4-1968", which is not UTF-8. Non-ASCII characters might not be handled correctly.
INFO: successfully checked out license "jasper_fao".
INFO: reading configuration file "/users/rompel/.config/cadence/jasper.conf".
% analyze -sv09 ../blink_2.sv
[-- (VERI-1482)] Analyzing Verilog file '/tools/cadence2425/JASPER/jasper_2024.06p002/lib/verilog/packages/std/std.sv' into library 'std'
[-- (VERI-1482)] Analyzing Verilog file '../blink_2.sv'
% elaborate -bbox_mul 1000000 -bbox_div 1000000 -bbox_mod 1000000 -bbox_a 1000000
[INFO (HIER-8002)] ../blink_2.sv(18): Disabling old hierarchical reference handler
[INFO (VERI-1018)] ../blink_2.sv(1): compiling module 'BLINK'
[WARN (VERI-1209)] ../blink_2.sv(10): expression size 32 truncated to fit in target size 9
INFO (ISW003): Top module name is "BLINK".
INFO (INL208): Elaboration synthesis summary:
  Number of synthesized netlists          1 (0 packages)
  Single run mode                         On
  Pipeline                                On (1 pipelined netlists)
  Late hierarchical reference connection  On
  Number of analyzed Verilog modules      1 (1 synthesized)
  Number of analyzed VHDL entities        0 (0 synthesized)
INFO (INL003): Clearing all state information (assumes, stopats, and so forth).
BLINK
[<embedded>] % reset rst
INFO (IPM031): Clearing proof results of all properties.
INFO (IRS006): Current reset condition is "rst".
[<embedded>] % clock clk
[<embedded>] % prove -all
Ncustom1: Custom engine code is hT3Ng7hPPfiYQOTDZ3qhYOwGAM51eA+J/FjkM5shLioAsqhgLR4Ft+O1BuKG6ilQ83B9tLXSl+CwjiTMAQA
Bcustom2: Custom engine code is hT3Nm7hPr1Vp3Di1Ra2USNIGL4JypRnLKLAdF6JAyuavO2JfGCiY9OZJhcAcOUnLx5xwNdhILGrAWX9s+z2WDkKwNR7tAfClBEjRFVQeq6DU54boFgEA
AMcustom3: Custom engine code is hT3Ng7hP/feYQOTDZ3qhYOwGAM51eA+J/FjkM5shLioAsqhgLR4Ft+O1BuKG6ilQ83B9tLXSmmqwm7g9AQA
Mpcustom4: Custom engine code is hT3NZbhP9fmY2AbBQnsjfOxn6c+6e6yL+/e8fZFmaQrnlgEA
INFO (IPF036): Starting proof on task: "<embedded>", 1 properties to prove with 0 already proven/unreachable
INFO (IRS029): Starting reset analysis: phase 1 of 4.
INFO (IRS030): Running reset analysis: phase 2 of 4.
INFO (IRS031): Running reset analysis: phase 3 of 4.
INFO (IRS020): Starting the reset analysis simulation with a limit of 100 iterations (phase 4 of 4).
INFO (IRS024): Reset iterations 0 to 4 analyzed.
INFO (IRS018): Reset analysis simulation executed for 3 iterations. Assigned values for 10 of 12 design flops, 0 of 0 design latches, 3 of 3 internal elements.
INFO (IRS039): Reset analysis complete.
INFO (IPF031): Settings used for proof thread 0:
    orchestration                 = on
    time_limit                    = 86400s
    per_property_time_limit       = 1s * 10 ^ scan
    engine_mode                   = auto
    proofgrid_per_engine_max_jobs = 1
    max engine jobs               = auto
    proofgrid_mode                = local
    proofgrid_restarts            = 10
0: Using multistage preprocessing
0: Starting reduce
AMcustom5: Custom engine code is hT3N1rhP11/52HrFRS21ROp2LOjVTgPvT8L8BGXHgLhaIuqtT4nARFjUqrBL+7pLmaTOzBepZW/Jm8SSrHDybSQtoNiO3y43wk+dEoWlsZizu97Fih6O6lPVG/LpWP5SsUPwlGagLNa1FKEFvwVXyX7//8prySbvSxIHXr5er+z4RAEA
Ncustom6: Custom engine code is hT3OXrhPByJp3TrFSTLhUmMH4KVtJgmTCnNDF46yMXOKY48m4LS5nE7yBzFjA7kDuwO/GhGUpEPiky3p3wmPn3dJZHxFMsafSoObRzSC+tn7sEY0WbTdZ/FV4hL3MYH/b1CIUvXSWR4wqEoVLsmMOD4xIPT4lI1LO6ZCO7PnnWQuLwetnvKlrXx6wCW/A+x+enqslg1YPobi4wEF/EvbzOvcTYdJvl2s4H2yZg2b2ofAVN5WvhWk1HoBAA
ADcustom7: Custom engine code is hT3Nv7hPv1752HrFRa2kROx2f/ECJeZB2AZsLdlO8VwmIuqtT4nIDFXclhg+O+o+DMmQCekbheGk0kK28laA9gaOFDXsQp29J3X615HY1IPHJWd6FUFvCHjO+p1k652b5JJvZlShNpGlGSXAiQe/mEAj6tEBAA
Tricustom8: Custom engine code is hT3Nu7hPt1752DvFRa0kNDiyIV97VyejwM9C/jCLJjdPvusZONHY42VYUy0Q1ZotnhcVtNc56tJ5wbxv6V2+XpdsaSlHck5vfnbYjdwj1OECy9U+7oSQ0SZE3g5ayD+Phuh4odCJTjeKa2k4elM9ldQfkAEA
Gcustom9: Custom engine code is hT3NibhPDfeYQADBZnYcglOvK9Pfd7EOeniIqP8jNsyIqInncipMGcUXqAadachREE9F2PwhBUZUNw5kHnd4JdXkamORRgEA
C2custom10: Custom engine code is hT3NirhPjfWYQADBZnYcglOvK9Pfd7EOeniIqP8jNsyIqInncgkrYMMXCYbdK0dUjZIF9d4cJ0rHoBDjwVLBKuG86XYVV00BAA
AGcustom11: Custom engine code is hT3NirhP/fmYQADBZnYcglOvK9Pfd7EOeniIqP8jNsyIqInnckcwYMMXCYbdK0dUjZIF9d4cJ0rHoBDjwVLBKuHEZnZByh0BAA
0: Finished reduce in 0s
Bcustom12: Custom engine code is hT3NjrhPDfiYQADBZnYcglOvK9PfWxFtenjIyBqfrgr7if/jL/yPOuK1BAflEcW0DxNH2eDIoezN2gxlQFg81RZtiWXh7aiTAidvAQA
0.0.PRE: Performing Proof Simplification...
Ncustom13: Custom engine code is hT3NR7hPByFp3TrFSTLhUmMH4KWtJglTyV/c51BHEeZWamnJv767nE6PCak26bd3gf3XGN3rIRheufhDieCJQVISo+gNYUKhiUedBKGtsP/a18svAnlMJZudHxDFwK5ufsyoxsIyiAeSY2oi3tEuoDHr5gw42DFKAG3PqO3CEsl8Azzdt3pl5nGA1Ifv2H02eYsFzWb/nfp8PMb3F0krE/EgBcm8TD9Div8BAA
0.0.N: clocks: 1, declared: 1, looping: 0, posedge: 1, negedge: 0, noedge: 0, bothedge: 0
Tricustom14: Custom engine code is hT3Nu7hP3fiYQADBZnYcglNHp9bfd7EOeniIqP/ji8sGLQu8yhsFO+wxJ+O+R0bU8g/IewXFomyos+viQnWc2xYNYmMqpo3i40O7DaZR7qfp4YqNx26KRvQ/qx0BAA
0.0.N: Proof Simplification Iteration 1	[0.00 s]
0.0.PRE: A proof was found: No trace exists. [0.00 s]
INFO (IPF057): 0.0.PRE: The property ":noDeadEnd" was proven in 0.00 s.
    Use check_assumptions -show -dead_end to show this property in the property table.
0.0.PRE: A proof was found: No trace exists. [0.00 s]
INFO (IPF057): 0.0.PRE: The property ":noConflict" was proven in 0.00 s.
    Use check_assumptions -show to show this property in the property table.
INFO (IPF047): 0.0.PRE: The cover property ":live" was covered in 1 cycles in 0.00 s.
    Use check_assumptions -show -live to show this property in the property table.
0.0.PRE: Proof Simplification completed in 0.00 s
0: About to start ProofGrid in its own thread with a limit of 10000 pending notifications and a limit of 10 traces.
0: =============================== ProofGrid start ===============================
0: ProofGrid usable level: 1
0: Initial ProofGrid level: 1
0: ProofGrid is starting event handling
0.0.Hp: Proofgrid shell started at 434@vlsi-ria84(local) jg_357_vlsi-ria84_1
0.0.N: Proofgrid shell started at 433@vlsi-ria84(local) jg_357_vlsi-ria84_1
0.0.N: clocks: 1, declared: 1, looping: 0, posedge: 1, negedge: 0, noedge: 0, bothedge: 0
0.0.N: Last scan. Per property time limit: 0s
0.0.N: Starting proof for property "BLINK.p1"	[0.00 s].
0.0.N: Trace Attempt  1	[0.00 s]
0.0.N: Trace Attempt  2	[0.00 s]
0.0.N: Trace Attempt  2	[0.00 s]
0.0.Hp: clocks: 1, declared: 1, looping: 0, posedge: 1, negedge: 0, noedge: 0, bothedge: 0
0.0.Hp: Last scan. Per property time limit: 0s
0.0.N: Trace Attempt  3	[0.00 s]
0.0.N: Trace Attempt  3	[0.00 s]
0.0.Hp: Trace Attempt  1	[0.00 s]
0.0.Hp: Trace Attempt  2	[0.00 s]
0.0.Hp: Trace Attempt  3	[0.00 s]
0.0.Hp: Trace Attempt  4	[0.00 s]
0.0.Hp: Trace Attempt  5	[0.00 s]
0.0.N: Trace Attempt  4	[0.00 s]
0.0.N: Trace Attempt  5	[0.00 s]
0.0.N: Trace Attempt  1	[0.00 s]
0.0.N: Trace Attempt  2	[0.00 s]
0.0.N: Trace Attempt  3	[0.00 s]
0.0.N: Trace Attempt  4	[0.00 s]
0.0.N: Trace Attempt  5	[0.00 s]
0.0.AM: Proofgrid shell started at 470@vlsi-ria84(local) jg_357_vlsi-ria84_1
0.0.Ht: Proofgrid shell started at 467@vlsi-ria84(local) jg_357_vlsi-ria84_1
0.0.AM: clocks: 1, declared: 1, looping: 0, posedge: 1, negedge: 0, noedge: 0, bothedge: 0
0.0.AM: Last scan. Per property time limit: 0s
0.0.AM: Starting proof for property "BLINK.p1"	[0.00 s].
0.0.AM: Trace Attempt  1	[0.00 s]
0.0.AM: Trace Attempt  2	[0.00 s]
0.0.AM: Trace Attempt  3	[0.00 s]
0.0.AM: Trace Attempt  4	[0.00 s]
0.0.Ht: clocks: 1, declared: 1, looping: 0, posedge: 1, negedge: 0, noedge: 0, bothedge: 0
0.0.Ht: Last scan. Per property time limit: 0s
0.0.AM: Trace Attempt  5	[0.00 s]
0.0.Ht: Trace Attempt  1	[0.00 s]
0.0.Ht: Trace Attempt  2	[0.00 s]
0.0.Ht: Trace Attempt  3	[0.00 s]
0.0.Ht: Trace Attempt  4	[0.00 s]
0.0.Ht: Trace Attempt  5	[0.00 s]
0.0.AM: Trace Attempt  1	[0.00 s]
0.0.AM: Trace Attempt  2	[0.00 s]
0.0.AM: Trace Attempt  3	[0.00 s]
0.0.AM: Trace Attempt  4	[0.00 s]
0.0.AM: Trace Attempt  5	[0.00 s]
0.0.Oh: Proofgrid shell started at 468@vlsi-ria84(local) jg_357_vlsi-ria84_1
0.0.B: Proofgrid shell started at 469@vlsi-ria84(local) jg_357_vlsi-ria84_1
0.0.Oh: clocks: 1, declared: 1, looping: 0, posedge: 1, negedge: 0, noedge: 0, bothedge: 0
0.0.Oh: Reached length limit (2147483647) [0.00 s]
0.0.Oh: Exited with Success (@ 0.04 s)
0.0.B: clocks: 1, declared: 1, looping: 0, posedge: 1, negedge: 0, noedge: 0, bothedge: 0
0.0.B: Last scan. Per property time limit: 0s
0.0.B: Starting proof for property "BLINK.p1"	[0.00 s].
0.0.B: Trace Attempt  1	[0.00 s]
0.0.AM: Trace Attempt  1	[0.01 s]
0.0.B: Trace Attempt  2	[0.00 s]
0.0.B: Trace Attempt  3	[0.00 s]
0.0.B: Trace Attempt  4	[0.00 s]
0.0.B: Trace Attempt  5	[0.00 s]
0.0.AM: Trace Attempt  2	[0.01 s]
0.0.AM: Trace Attempt  3	[0.01 s]
0.0.AM: Trace Attempt  4	[0.01 s]
0.0.AM: Trace Attempt  5	[0.01 s]
0.0.AM: Trace Attempt  1	[0.03 s]
0.0.AM: Trace Attempt  2	[0.03 s]
0.0.AM: Trace Attempt  3	[0.03 s]
0.0.AM: Trace Attempt  4	[0.03 s]
0.0.AM: Trace Attempt  5	[0.03 s]
0.0.AM: Trace Attempt  1	[0.09 s]
0.0.AM: Trace Attempt  2	[0.09 s]
0.0.AM: Trace Attempt  3	[0.09 s]
0.0.AM: Trace Attempt  4	[0.10 s]
0.0.AM: Trace Attempt  5	[0.10 s]
0.0.AM: Trace Attempt  1	[0.26 s]
0.0.AM: Trace Attempt  2	[0.26 s]
0.0.AM: Trace Attempt  3	[0.26 s]
0.0.AM: Trace Attempt  4	[0.26 s]
0.0.AM: Trace Attempt  5	[0.26 s]
0.0.AM: Trace Attempt  1	[0.59 s]
0.0.AM: Trace Attempt  2	[0.59 s]
0.0.AM: Trace Attempt  3	[0.59 s]
0.0.AM: Trace Attempt  4	[0.59 s]
0.0.AM: Trace Attempt  5	[0.59 s]
0.0.AM: Trace Attempt  1	[2.40 s]
0.0.AM: Trace Attempt  2	[2.40 s]
0.0.AM: Trace Attempt  3	[2.40 s]
0.0.AM: Trace Attempt  4	[2.40 s]
0.0.AM: Trace Attempt  5	[2.40 s]
0.0.Hp: Trace Attempt 847	[4.00 s]
0.0.Ht: Trace Attempt 1858	[4.00 s]
0.0.B: Trace Attempt 1700	[4.00 s]
0.0.N: Trace Attempt 397	[4.13 s]
0.0.AM: Trace Attempt 469	[6.40 s]
0.0.AM: Trace Attempt  1	[6.72 s]
0.0.AM: Trace Attempt  2	[6.72 s]
0.0.AM: Trace Attempt  3	[6.72 s]
0.0.AM: Trace Attempt  4	[6.72 s]
0.0.AM: Trace Attempt  5	[6.73 s]
0.0.N: Trace Attempt  1	[7.80 s]
0.0.N: Trace Attempt  2	[7.80 s]
0.0.N: Trace Attempt  3	[7.80 s]
0.0.N: Trace Attempt  4	[7.80 s]
0.0.N: Trace Attempt  5	[7.80 s]
0.0.Hp: Trace Attempt 1140	[8.02 s]
0.0.Ht: Trace Attempt 2496	[8.00 s]
0.0.B: Trace Attempt 1958	[8.02 s]
0.0.N: Trace Attempt  1	[10.27 s]
0.0.N: Trace Attempt  2	[10.27 s]
0.0.N: Trace Attempt  3	[10.27 s]
0.0.N: Trace Attempt  4	[10.27 s]
0.0.N: Trace Attempt  5	[10.27 s]
0.0.AM: Trace Attempt 541	[10.78 s]
0.0.Hp: Trace Attempt 1394	[12.02 s]
0.0.B: Trace Attempt 2155	[12.02 s]
0.0.Ht: Trace Attempt 2749	[12.32 s]
0.0.N: Trace Attempt  1	[12.76 s]
0.0.N: Trace Attempt  2	[12.76 s]
0.0.N: Trace Attempt  3	[12.76 s]
0.0.N: Trace Attempt  4	[12.76 s]
0.0.N: Trace Attempt  5	[12.76 s]
0.0.AM: Trace Attempt 649	[14.82 s]
0.0.N: Trace Attempt  1	[15.30 s]
0.0.N: Trace Attempt  2	[15.30 s]
0.0.N: Trace Attempt  3	[15.30 s]
0.0.N: Trace Attempt  4	[15.30 s]
0.0.N: Trace Attempt  5	[15.30 s]
0.0.B: Trace Attempt 2544	[16.02 s]
0.0.Hp: Trace Attempt 1562	[16.07 s]
0.0.Ht: Trace Attempt 3218	[16.32 s]
0.0.N: Trace Attempt  1	[17.86 s]
0.0.N: Trace Attempt  2	[17.87 s]
0.0.N: Trace Attempt  3	[17.87 s]
0.0.N: Trace Attempt  4	[17.87 s]
0.0.N: Trace Attempt  5	[17.87 s]
0.0.AM: Trace Attempt 708	[18.88 s]
0.0.B: Trace Attempt 2734	[20.03 s]
0.0.Hp: Trace Attempt 1632	[20.07 s]
0.0.N: Trace Attempt  1	[20.43 s]
0.0.N: Trace Attempt  2	[20.43 s]
0.0.N: Trace Attempt  3	[20.43 s]
0.0.N: Trace Attempt  4	[20.44 s]
0.0.N: Trace Attempt  5	[20.44 s]
0.0.Ht: Trace Attempt 3620	[20.78 s]
0.0.AM: Trace Attempt 783	[22.96 s]
0.0.N: Trace Attempt  1	[23.01 s]
0.0.N: Trace Attempt  2	[23.01 s]
0.0.N: Trace Attempt  3	[23.01 s]
0.0.N: Trace Attempt  4	[23.01 s]
0.0.N: Trace Attempt  5	[23.01 s]
0.0.B: Trace Attempt 2923	[24.03 s]
0.0.Hp: Trace Attempt 1696	[24.12 s]
0.0.Ht: Trace Attempt 3811	[24.78 s]
0.0.N: Trace Attempt  1	[25.58 s]
0.0.N: Trace Attempt  2	[25.58 s]
0.0.N: Trace Attempt  3	[25.58 s]
0.0.N: Trace Attempt  4	[25.58 s]
0.0.N: Trace Attempt  5	[25.59 s]
0.0.AM: Trace Attempt 851	[27.00 s]
0.0.B: Trace Attempt 3080	[28.03 s]
0.0.N: Trace Attempt  1	[28.15 s]
0.0.N: Trace Attempt  2	[28.15 s]
0.0.N: Trace Attempt  3	[28.15 s]
0.0.N: Trace Attempt  4	[28.15 s]
0.0.N: Trace Attempt  5	[28.15 s]
0.0.Hp: Trace Attempt 1759	[28.15 s]
0.0.Ht: Trace Attempt 3956	[28.79 s]
0.0.N: Trace Attempt  1	[30.72 s]
0.0.N: Trace Attempt  2	[30.72 s]
0.0.N: Trace Attempt  3	[30.72 s]
0.0.N: Trace Attempt  4	[30.72 s]
0.0.N: Trace Attempt  5	[30.72 s]
0.0.AM: Trace Attempt 931	[31.05 s]
0.0.B: Trace Attempt 3376	[32.04 s]
0.0.Hp: Trace Attempt 1815	[32.20 s]
0.0.Ht: Trace Attempt 4277	[32.79 s]
0.0.N: Trace Attempt  1	[33.37 s]
0.0.N: Trace Attempt  2	[33.37 s]
0.0.N: Trace Attempt  3	[33.37 s]
0.0.N: Trace Attempt  4	[33.37 s]
0.0.N: Trace Attempt  5	[33.37 s]
0.0.AM: Trace Attempt 945	[35.14 s]
0.0.N: Trace Attempt  1	[35.99 s]
0.0.N: Trace Attempt  2	[35.99 s]
0.0.N: Trace Attempt  3	[35.99 s]
0.0.N: Trace Attempt  4	[35.99 s]
0.0.N: Trace Attempt  5	[35.99 s]
0.0.B: Trace Attempt 3611	[36.06 s]
0.0.Hp: Trace Attempt 1869	[36.27 s]
0.0.Ht: Trace Attempt 4563	[36.80 s]
0.0.N: Trace Attempt  1	[39.01 s]
0.0.N: Trace Attempt  2	[39.01 s]
0.0.N: Trace Attempt  3	[39.01 s]
0.0.N: Trace Attempt  4	[39.01 s]
0.0.N: Trace Attempt  5	[39.01 s]
0.0.AM: Trace Attempt 724	[39.16 s]
0.0.B: Trace Attempt 3672	[40.12 s]
0.0.Hp: Trace Attempt 1919	[40.27 s]
0.0.Ht: Trace Attempt 4644	[41.61 s]
0.0.N: Trace Attempt  1	[42.01 s]
0.0.N: Trace Attempt  2	[42.01 s]
0.0.N: Trace Attempt  3	[42.01 s]
0.0.N: Trace Attempt  4	[42.01 s]
0.0.N: Trace Attempt  5	[42.02 s]
0.0.AM: Trace Attempt 891	[43.16 s]
0.0.B: Trace Attempt 3727	[44.17 s]
0.0.Hp: Trace Attempt 1969	[44.30 s]
0.0.N: Trace Attempt  1	[45.02 s]
0.0.N: Trace Attempt  2	[45.02 s]
0.0.N: Trace Attempt  3	[45.02 s]
0.0.N: Trace Attempt  4	[45.02 s]
0.0.N: Trace Attempt  5	[45.02 s]
0.0.Ht: Trace Attempt 4784	[45.64 s]
0.0.N: Trace Attempt  1	[48.05 s]
0.0.N: Trace Attempt  2	[48.06 s]
0.0.N: Trace Attempt  3	[48.06 s]
0.0.N: Trace Attempt  4	[48.06 s]
0.0.N: Trace Attempt  5	[48.06 s]
0.0.B: Trace Attempt 3779	[48.21 s]
0.0.Hp: Trace Attempt 2017	[48.31 s]
0.0.AM: Trace Attempt 978	[48.66 s]
0.0.Ht: Trace Attempt 4915	[49.64 s]
0.0.N: Trace Attempt  1	[51.17 s]
0.0.N: Trace Attempt  2	[51.17 s]
0.0.N: Trace Attempt  3	[51.17 s]
0.0.N: Trace Attempt  4	[51.17 s]
0.0.N: Trace Attempt  5	[51.17 s]
0.0.B: Trace Attempt 3831	[52.23 s]
0.0.AM: Trace Attempt 991	[52.69 s]
0.0.Hp: Trace Attempt 2050	[52.73 s]
0.0.N: Trace Attempt  1	[54.18 s]
0.0.N: Trace Attempt  2	[54.18 s]
0.0.N: Trace Attempt  3	[54.18 s]
0.0.N: Trace Attempt  4	[54.18 s]
0.0.N: Trace Attempt  5	[54.18 s]
0.0.Ht: Trace Attempt 5000	[54.34 s]
0.0.B: Trace Attempt 3890	[56.26 s]
0.0.Hp: Trace Attempt 2052	[56.73 s]
0.0.AM: Trace Attempt 1026	[56.96 s]
0.0.N: Trace Attempt  1	[57.13 s]
0.0.N: Trace Attempt  2	[57.13 s]
0.0.N: Trace Attempt  3	[57.13 s]
0.0.N: Trace Attempt  4	[57.13 s]
0.0.N: Trace Attempt  5	[57.13 s]
0.0.Ht: Trace Attempt 5110	[58.38 s]
0.0.AM: Trace Attempt  1	[58.84 s]
0.0.AM: Trace Attempt  2	[58.84 s]
0.0.AM: Trace Attempt  3	[58.84 s]
0.0.AM: Trace Attempt  4	[58.84 s]
0.0.N: Trace Attempt  1	[60.10 s]
0.0.N: Trace Attempt  2	[60.10 s]
0.0.N: Trace Attempt  3	[60.10 s]
0.0.N: Trace Attempt  4	[60.11 s]
0.0.N: Trace Attempt  5	[60.11 s]
0.0.B: Trace Attempt 3960	[60.26 s]
0.0.Hp: Trace Attempt 2055	[62.00 s]
0.0.AM: Trace Attempt 456	[62.87 s]
0.0.Ht: Trace Attempt 5407	[62.98 s]
0.0.N: Trace Attempt  1	[63.11 s]
0.0.N: Trace Attempt  2	[63.11 s]
0.0.N: Trace Attempt  3	[63.11 s]
0.0.N: Trace Attempt  4	[63.12 s]
0.0.N: Trace Attempt  5	[63.12 s]
0.0.B: Trace Attempt 4040	[64.28 s]
0.0.N: Trace Attempt  1	[66.12 s]
0.0.N: Trace Attempt  2	[66.12 s]
0.0.N: Trace Attempt  3	[66.12 s]
0.0.N: Trace Attempt  4	[66.12 s]
0.0.N: Trace Attempt  5	[66.12 s]
0.0.Hp: Trace Attempt 2060	[66.81 s]
0.0.AM: Trace Attempt 549	[66.95 s]
0.0.Ht: Trace Attempt 5566	[67.17 s]
0.0.B: Trace Attempt 4159	[68.34 s]
0.0.N: Trace Attempt  1	[69.08 s]
0.0.N: Trace Attempt  2	[69.08 s]
0.0.N: Trace Attempt  3	[69.08 s]
0.0.N: Trace Attempt  4	[69.08 s]
0.0.N: Trace Attempt  5	[69.08 s]
0.0.AM: Trace Attempt 593	[71.00 s]
0.0.Ht: Trace Attempt 5724	[71.18 s]
0.0.N: Trace Attempt  1	[72.13 s]
0.0.N: Trace Attempt  2	[72.13 s]
0.0.N: Trace Attempt  3	[72.13 s]
0.0.N: Trace Attempt  4	[72.13 s]
0.0.N: Trace Attempt  5	[72.13 s]
0.0.B: Trace Attempt 4307	[72.34 s]
0.0.Hp: Trace Attempt 2064	[72.39 s]
0.0.AM: Trace Attempt 646	[75.07 s]
0.0.N: Trace Attempt  1	[75.12 s]
0.0.N: Trace Attempt  2	[75.12 s]
0.0.N: Trace Attempt  3	[75.12 s]
0.0.N: Trace Attempt  4	[75.13 s]
0.0.N: Trace Attempt  5	[75.13 s]
0.0.Ht: Trace Attempt 5827	[75.20 s]
0.0.B: Trace Attempt 4460	[76.36 s]
0.0.Hp: Trace Attempt 2068	[78.03 s]
0.0.N: Trace Attempt  1	[78.20 s]
0.0.N: Trace Attempt  2	[78.20 s]
0.0.N: Trace Attempt  3	[78.20 s]
0.0.N: Trace Attempt  4	[78.20 s]
0.0.N: Trace Attempt  5	[78.20 s]
0.0.AM: Trace Attempt 696	[79.17 s]
0.0.Ht: Trace Attempt 5886	[79.20 s]
0.0.B: Trace Attempt 4616	[80.36 s]
0.0.N: Trace Attempt  1	[81.25 s]
0.0.N: Trace Attempt  2	[81.25 s]
0.0.N: Trace Attempt  3	[81.25 s]
0.0.N: Trace Attempt  4	[81.25 s]
0.0.N: Trace Attempt  5	[81.25 s]
0.0.Hp: Trace Attempt 2070	[83.01 s]
0.0.Ht: Trace Attempt 5964	[83.25 s]
0.0.AM: Trace Attempt 747	[83.27 s]
0.0.N: Trace Attempt  1	[84.21 s]
0.0.N: Trace Attempt  2	[84.21 s]
0.0.N: Trace Attempt  3	[84.21 s]
0.0.N: Trace Attempt  4	[84.21 s]
0.0.N: Trace Attempt  5	[84.21 s]
0.0.B: Trace Attempt 4736	[84.37 s]
0.0.N: Trace Attempt  1	[87.26 s]
0.0.N: Trace Attempt  2	[87.26 s]
0.0.N: Trace Attempt  3	[87.26 s]
0.0.N: Trace Attempt  4	[87.26 s]
0.0.N: Trace Attempt  5	[87.26 s]
0.0.Ht: Trace Attempt 6059	[87.27 s]
0.0.AM: Trace Attempt 777	[87.28 s]
0.0.B: Trace Attempt 4855	[88.37 s]
0.0.N: Trace Attempt  1	[90.23 s]
0.0.N: Trace Attempt  2	[90.23 s]
0.0.N: Trace Attempt  3	[90.23 s]
0.0.N: Trace Attempt  4	[90.23 s]
0.0.N: Trace Attempt  5	[90.23 s]
0.0.Ht: Trace Attempt 6161	[91.29 s]
0.0.AM: Trace Attempt 808	[91.40 s]
0.0.B: Trace Attempt 4972	[92.37 s]
0.0.N: Trace Attempt  1	[93.19 s]
0.0.N: Trace Attempt  2	[93.19 s]
0.0.N: Trace Attempt  3	[93.19 s]
0.0.N: Trace Attempt  4	[93.19 s]
0.0.N: Trace Attempt  5	[93.19 s]
0.0.Hp: Trace Attempt 2076	[93.25 s]
0.0.Ht: Trace Attempt 6301	[95.32 s]
0.0.N: Trace Attempt  1	[96.15 s]
0.0.N: Trace Attempt  2	[96.15 s]
0.0.N: Trace Attempt  3	[96.15 s]
0.0.N: Trace Attempt  4	[96.15 s]
0.0.N: Trace Attempt  5	[96.15 s]
0.0.B: Trace Attempt 5075	[96.41 s]
0.0.Hp: Trace Attempt 2083	[98.55 s]
0.0.N: Trace Attempt  1	[99.15 s]
0.0.N: Trace Attempt  2	[99.15 s]
0.0.N: Trace Attempt  3	[99.15 s]
0.0.N: Trace Attempt  4	[99.15 s]
0.0.N: Trace Attempt  5	[99.15 s]
0.0.Ht: Trace Attempt 6369	[99.34 s]
0.0.B: Trace Attempt 5171	[100.42 s]
0.0.N: Trace Attempt  1	[102.17 s]
0.0.N: Trace Attempt  2	[102.17 s]
0.0.N: Trace Attempt  3	[102.17 s]
0.0.N: Trace Attempt  4	[102.17 s]
0.0.N: Trace Attempt  5	[102.17 s]
0.0.Hp: Trace Attempt 2088	[103.33 s]
0.0.Ht: Trace Attempt 6523	[103.43 s]
0.0.AM: Trace Attempt 810	[104.28 s]
0.0.B: Trace Attempt 5311	[104.44 s]
0.0.N: Trace Attempt  1	[105.16 s]
0.0.N: Trace Attempt  2	[105.16 s]
0.0.N: Trace Attempt  3	[105.16 s]
0.0.N: Trace Attempt  4	[105.16 s]
0.0.N: Trace Attempt  5	[105.16 s]
0.0.Hp: Trace Attempt 2094	[107.37 s]
0.0.Ht: Trace Attempt 6659	[107.45 s]
0.0.N: Trace Attempt  1	[108.28 s]
0.0.N: Trace Attempt  2	[108.28 s]
0.0.N: Trace Attempt  3	[108.28 s]
0.0.N: Trace Attempt  4	[108.28 s]
0.0.N: Trace Attempt  5	[108.28 s]
0.0.AM: Trace Attempt 861	[108.36 s]
0.0.B: Trace Attempt 5454	[108.45 s]
0.0.N: Trace Attempt  1	[111.31 s]
0.0.N: Trace Attempt  2	[111.31 s]
0.0.N: Trace Attempt  3	[111.31 s]
0.0.N: Trace Attempt  4	[111.31 s]
0.0.N: Trace Attempt  5	[111.31 s]
0.0.Hp: Trace Attempt 2101	[111.44 s]
0.0.Ht: Trace Attempt 6716	[111.47 s]
0.0.AM: Trace Attempt 904	[112.39 s]
0.0.B: Trace Attempt 5606	[112.47 s]
0.0.N: Trace Attempt  1	[114.41 s]
0.0.N: Trace Attempt  2	[114.41 s]
0.0.N: Trace Attempt  3	[114.41 s]
0.0.N: Trace Attempt  4	[114.41 s]
0.0.N: Trace Attempt  5	[114.41 s]
0.0.Hp: Trace Attempt 2105	[115.47 s]
0.0.Ht: Trace Attempt 6805	[115.47 s]
0.0.AM: Trace Attempt 934	[116.44 s]
0.0.B: Trace Attempt 5746	[116.48 s]
0.0.N: Trace Attempt  1	[117.49 s]
0.0.N: Trace Attempt  2	[117.49 s]
0.0.N: Trace Attempt  3	[117.49 s]
0.0.N: Trace Attempt  4	[117.49 s]
0.0.N: Trace Attempt  5	[117.49 s]
0.0.Hp: Trace Attempt 2106	[119.55 s]
0.0.Ht: Trace Attempt 6860	[119.52 s]
0.0.N: Trace Attempt  1	[120.45 s]
0.0.N: Trace Attempt  2	[120.45 s]
0.0.N: Trace Attempt  3	[120.45 s]
0.0.N: Trace Attempt  4	[120.45 s]
0.0.N: Trace Attempt  5	[120.45 s]
0.0.B: Trace Attempt 5906	[120.48 s]
0.0.AM: Trace Attempt 979	[120.55 s]
0.0.N: Trace Attempt  1	[123.49 s]
0.0.N: Trace Attempt  2	[123.49 s]
0.0.N: Trace Attempt  3	[123.49 s]
0.0.N: Trace Attempt  4	[123.49 s]
0.0.N: Trace Attempt  5	[123.49 s]
0.0.Ht: Trace Attempt 6973	[123.60 s]
0.0.Hp: Trace Attempt 2109	[123.91 s]
0.0.B: Trace Attempt 6043	[124.50 s]
0.0.AM: Validation of fixpoint was successful. Time = 0.01
0.0.N: Requesting engine job to terminate
0.0.B: Requesting engine job to terminate
0.0.AM: Requesting engine job to terminate
0.0.Hp: Requesting engine job to terminate
0.0.Ht: Requesting engine job to terminate
INFO (IPF144): 0: Initiating shutdown of proof [125.32 s]
0.0.AM: Trace Attempt 1012	[123.90 s]
0.0.AM: A proof was found: No trace exists. [125.28 s]
INFO (IPF057): 0.0.AM: The property "BLINK.p1" was proven in 125.28 s.
0.0.AM: Stopped processing property "BLINK.p1"	[125.28 s].
0.0.AM: All properties determined. [125.29 s]
0.0.AM: Exited with Success (@ 125.32 s)
0: ProofGrid usable level: 0
0.0.N: Trace Attempt 423	[125.26 s]
0.0.N: Stopped processing property "BLINK.p1"	[125.33 s].
0.0.N: All properties determined. [125.33 s]
0.0.N: Exited with Success (@ 125.33 s)
0.0.B: Trace Attempt 6068	[125.25 s]
0.0.B: Stopped processing property "BLINK.p1"	[125.31 s].
0.0.B: All properties determined. [125.31 s]
0.0.B: Exited with Success (@ 125.37 s)
0.0.Ht: Trace Attempt 7004	[125.24 s]
0.0.Ht: All properties determined. [125.34 s]
0.0.Ht: Exited with Success (@ 125.39 s)
0.0.Hp: Trace Attempt 2111	[124.28 s]
0.0.Hp: All properties determined. [126.72 s]
0.0.Hp: Exited with Success (@ 126.77 s)
0: --------------------------------------------------------------
ProofGrid Summary (utilization 99.97 %)
--------------------------------------------------------------
     engines started                               :     6
     engine jobs started                           :     6

    Average time in state (seconds)
    ------------------------------------------------------
    Engine  Pending     Running        Dead    Utilization
    ------------------------------------------------------
      N        0.03      125.32        0.00       99.97 %
     Hp        0.03      125.32        0.00       99.98 %
     Ht        0.04      125.28        0.00       99.97 %
     Oh        0.04        0.00        0.00        2.84 %
      B        0.04      125.28        0.00       99.97 %
     AM        0.03      125.29        0.00       99.98 %
    all        0.03      104.41        0.00       99.97 %

    Total time in state (seconds)
    -----------------------------------------
            Pending     Running        Dead  
    -----------------------------------------
               0.21      626.48        0.00

    Data read    : 10.50 MiB
    Data written : 5.44 kiB

0: All pending notifications were processed.
INFO (IPF059): 0: Completed proof on task: "<embedded>"

==============================================================
SUMMARY
==============================================================
           Properties Considered              : 1
                 assertions                   : 1
                  - proven                    : 1 (100%)
                  - bounded_proven (user)     : 0 (0%)
                  - bounded_proven (auto)     : 0 (0%)
                  - marked_proven             : 0 (0%)
                  - cex                       : 0 (0%)
                  - ar_cex                    : 0 (0%)
                  - undetermined              : 0 (0%)
                  - unknown                   : 0 (0%)
                  - error                     : 0 (0%)
                 covers                       : 0
                  - unreachable               : 0
                  - bounded_unreachable (user): 0
                  - covered                   : 0
                  - ar_covered                : 0
                  - undetermined              : 0
                  - unknown                   : 0
                  - error                     : 0
proven
[<embedded>] % exit -force
INFO (IPL005): Received request to exit from the console.
INFO: Waiting for proof threads to stop...
INFO: Proof threads stopped.
INFO (IPL018): The peak resident set memory use for this session was 1.387 GB.
INFO (IPL014): Waiting for the Tcl-thread to exit.
INFO (IPL015): The Tcl-thread exited with status 0.
INFO (IPL016): Exiting the analysis session with status 0.
