# ----------------------------------------
# Jasper Version Info
# tool      : Jasper 2024.06
# platform  : Linux 3.10.0-1160.62.1.el7.x86_64
# version   : 2024.06p002 64 bits
# build date: 2024.09.02 16:28:38 UTC
# ----------------------------------------
# started   : 2025-11-20 01:03:42 IST
# hostname  : vlsi-ria85.vlsidomain
# pid       : 5281
# arguments : '-label' 'session_0' '-console' '//127.0.0.1:35581' '-nowindow' '-style' 'windows' '-exitonerror' '-data' 'AAAA5nicY2RgYLCp////PwMYMD6A0Aw2jAyoAMRnQhUJbEChGRhYYZphSliAmItBl6GAoYghnyELyLNg0ANCfSA7HS6aypDMUMJQDBQ1ZIgH0qkMZUCcB2WnA2lDBiOgXh6gSUkMiUC1yQwZQL4KXvV6YHU5YHcAAPxCG9U=' '-proj' '/users/rompel/jasper_executions/liveness/jgprojects/1_seven_seg_12/sessionLogs/session_0' '-init' '-hidden' '/users/rompel/jasper_executions/liveness/jgprojects/1_seven_seg_12/.tmp/.initCmds.tcl' '1_seven_seg_12.tcl' '-hidden' '/users/rompel/jasper_executions/liveness/jgprojects/1_seven_seg_12/.tmp/.postCmds.tcl'

Any disclosure about the Cadence Design Systems software or its use
model to any third party violates the written Non-Disclosure Agreement
between Cadence Design Systems, Inc. and the customer.

THIS SOFTWARE CONTAINS CONFIDENTIAL INFORMATION AND TRADE SECRETS OF
CADENCE DESIGN SYSTEMS, INC. USE, DISCLOSURE, OR REPRODUCTION IS
PROHIBITED WITHOUT THE PRIOR EXPRESS WRITTEN PERMISSION OF CADENCE
DESIGN SYSTEMS, INC.

Copyright (C) 2000-2024 Cadence Design Systems, Inc. All Rights
Reserved.  Unpublished -- rights reserved under the copyright laws of
the United States.

This product includes software developed by others and redistributed
according to license agreement. See doc/third_party_readme.txt for
further details.

RESTRICTED RIGHTS LEGEND

Use, duplication, or disclosure by the Government is subject to
restrictions as set forth in subparagraph (c) (1) (ii) of the Rights in
Technical Data and Computer Software clause at DFARS 252.227-7013 or
subparagraphs (c) (1) and (2) of Commercial Computer Software -- Restricted
Rights at 48 CFR 52.227-19, as applicable.


                          Cadence Design Systems, Inc.
                          2655 Seely Avenue
                          San Jose, CA 95134
                          Phone: 408.943.1234

For technical assistance visit http://support.cadence.com.

Jasper Apps Analysis Session - /users/rompel/jasper_executions/liveness/jgprojects/1_seven_seg_12/sessionLogs/session_0

WARNING (WG017): [session]: The system's locale is "ANSI_X3.4-1968", which is not UTF-8. Non-ASCII characters might not be handled correctly.
WARNING (WG017): [jg_console]: The system's locale is "ANSI_X3.4-1968", which is not UTF-8. Non-ASCII characters might not be handled correctly.
INFO: successfully checked out license "jasper_fao".
INFO: reading configuration file "/users/rompel/.config/cadence/jasper.conf".
% analyze -sv09 ../1_seven_seg_12.sv
[-- (VERI-1482)] Analyzing Verilog file '/tools/cadence2425/JASPER/jasper_2024.06p002/lib/verilog/packages/std/std.sv' into library 'std'
[-- (VERI-1482)] Analyzing Verilog file '../1_seven_seg_12.sv'
% elaborate -bbox_mul 1000000 -bbox_div 1000000 -bbox_mod 1000000 -bbox_a 1000000
[INFO (HIER-8002)] ../1_seven_seg_12.sv(32): Disabling old hierarchical reference handler
[INFO (VERI-1018)] ../1_seven_seg_12.sv(1): compiling module 'SEVEN'
[WARN (VERI-1209)] ../1_seven_seg_12.sv(15): expression size 32 truncated to fit in target size 15
[INFO (VERI-8005)] ../1_seven_seg_12.sv(5): Unintentional sequential element inferred for cnt read before write using blocking assignment
[INFO (VERI-8005)] ../1_seven_seg_12.sv(6): Unintentional sequential element inferred for digit_select read before write using blocking assignment
[INFO (VERI-8005)] ../1_seven_seg_12.sv(1): Unintentional sequential element inferred for segment read before write using blocking assignment
[INFO (VERI-8005)] ../1_seven_seg_12.sv(1): Unintentional sequential element inferred for sig read before write using blocking assignment
INFO (ISW003): Top module name is "SEVEN".
INFO (INL208): Elaboration synthesis summary:
  Number of synthesized netlists          1 (0 packages)
  Single run mode                         On
  Pipeline                                On (1 pipelined netlists)
  Late hierarchical reference connection  On
  Number of analyzed Verilog modules      1 (1 synthesized)
  Number of analyzed VHDL entities        0 (0 synthesized)
INFO (INL003): Clearing all state information (assumes, stopats, and so forth).
SEVEN
[<embedded>] % reset rst
INFO (IPM031): Clearing proof results of all properties.
INFO (IRS006): Current reset condition is "rst".
[<embedded>] % clock clk
[<embedded>] % prove -all
Ncustom1: Custom engine code is hT3Ng7hPPfiYQOTDZ3qhYOwGAM51eA+J/FjkM5shLioAsqhgLR4Ft+O1BuKG6ilQ83B9tLXSl+CwjiTMAQA
Bcustom2: Custom engine code is hT3Nm7hPr1Vp3Di1Ra2USNIGL4JypRnLKLAdF6JAyuavO2JfGCiY9OZJhcAcOUnLx5xwNdhILGrAWX9s+z2WDkKwNR7tAfClBEjRFVQeq6DU54boFgEA
AMcustom3: Custom engine code is hT3Ng7hP/feYQOTDZ3qhYOwGAM51eA+J/FjkM5shLioAsqhgLR4Ft+O1BuKG6ilQ83B9tLXSmmqwm7g9AQA
Mpcustom4: Custom engine code is hT3NZbhP9fmY2AbBQnsjfOxn6c+6e6yL+/e8fZFmaQrnlgEA
INFO (IPF036): Starting proof on task: "<embedded>", 1 properties to prove with 0 already proven/unreachable
INFO (IRS029): Starting reset analysis: phase 1 of 4.
INFO (IRS030): Running reset analysis: phase 2 of 4.
INFO (IRS031): Running reset analysis: phase 3 of 4.
INFO (IRS020): Starting the reset analysis simulation with a limit of 100 iterations (phase 4 of 4).
INFO (IRS024): Reset iterations 0 to 4 analyzed.
INFO (IRS018): Reset analysis simulation executed for 3 iterations. Assigned values for 24 of 24 design flops, 0 of 0 design latches, 3 of 3 internal elements.
INFO (IRS039): Reset analysis complete.
INFO (IPF031): Settings used for proof thread 0:
    orchestration                 = on
    time_limit                    = 86400s
    per_property_time_limit       = 1s * 10 ^ scan
    engine_mode                   = auto
    proofgrid_per_engine_max_jobs = 1
    max engine jobs               = auto
    proofgrid_mode                = local
    proofgrid_restarts            = 10
AMcustom5: Custom engine code is hT3N1rhP11/52HrFRS21ROp2LOjVTgPvT8L8BGXHgLhaIuqtT4nARFjUqrBL+7pLmaTOzBepZW/Jm8SSrHDybSQtoNiO3y43wk+dEoWlsZizu97Fih6O6lPVG/LpWP5SsUPwlGagLNa1FKEFvwVXyX7//8prySbvSxIHXr5er+z4RAEA
0: Using multistage preprocessing
Ncustom6: Custom engine code is hT3OXrhPByJp3TrFSTLhUmMH4KVtJgmTCnNDF46yMXOKY48m4LS5nE7yBzFjA7kDuwO/GhGUpEPiky3p3wmPn3dJZHxFMsafSoObRzSC+tn7sEY0WbTdZ/FV4hL3MYH/b1CIUvXSWR4wqEoVLsmMOD4xIPT4lI1LO6ZCO7PnnWQuLwetnvKlrXx6wCW/A+x+enqslg1YPobi4wEF/EvbzOvcTYdJvl2s4H2yZg2b2ofAVN5WvhWk1HoBAA
0: Starting reduce
ADcustom7: Custom engine code is hT3Nv7hPv1752HrFRa2kROx2f/ECJeZB2AZsLdlO8VwmIuqtT4nIDFXclhg+O+o+DMmQCekbheGk0kK28laA9gaOFDXsQp29J3X615HY1IPHJWd6FUFvCHjO+p1k652b5JJvZlShNpGlGSXAiQe/mEAj6tEBAA
Tricustom8: Custom engine code is hT3Nu7hPt1752DvFRa0kNDiyIV97VyejwM9C/jCLJjdPvusZONHY42VYUy0Q1ZotnhcVtNc56tJ5wbxv6V2+XpdsaSlHck5vfnbYjdwj1OECy9U+7oSQ0SZE3g5ayD+Phuh4odCJTjeKa2k4elM9ldQfkAEA
Gcustom9: Custom engine code is hT3NibhPDfeYQADBZnYcglOvK9Pfd7EOeniIqP8jNsyIqInncipMGcUXqAadachREE9F2PwhBUZUNw5kHnd4JdXkamORRgEA
C2custom10: Custom engine code is hT3NirhPjfWYQADBZnYcglOvK9Pfd7EOeniIqP8jNsyIqInncgkrYMMXCYbdK0dUjZIF9d4cJ0rHoBDjwVLBKuG86XYVV00BAA
AGcustom11: Custom engine code is hT3NirhP/fmYQADBZnYcglOvK9Pfd7EOeniIqP8jNsyIqInnckcwYMMXCYbdK0dUjZIF9d4cJ0rHoBDjwVLBKuHEZnZByh0BAA
Bcustom12: Custom engine code is hT3NjrhPDfiYQADBZnYcglOvK9PfWxFtenjIyBqfrgr7if/jL/yPOuK1BAflEcW0DxNH2eDIoezN2gxlQFg81RZtiWXh7aiTAidvAQA
Ncustom13: Custom engine code is hT3NR7hPByFp3TrFSTLhUmMH4KWtJglTyV/c51BHEeZWamnJv767nE6PCak26bd3gf3XGN3rIRheufhDieCJQVISo+gNYUKhiUedBKGtsP/a18svAnlMJZudHxDFwK5ufsyoxsIyiAeSY2oi3tEuoDHr5gw42DFKAG3PqO3CEsl8Azzdt3pl5nGA1Ifv2H02eYsFzWb/nfp8PMb3F0krE/EgBcm8TD9Div8BAA
0: Finished reduce in 0s
Tricustom14: Custom engine code is hT3Nu7hP3fiYQADBZnYcglNHp9bfd7EOeniIqP/ji8sGLQu8yhsFO+wxJ+O+R0bU8g/IewXFomyos+viQnWc2xYNYmMqpo3i40O7DaZR7qfp4YqNx26KRvQ/qx0BAA
0.0.PRE: Performing Proof Simplification...
0.0.N: clocks: 1, declared: 1, looping: 0, posedge: 1, negedge: 0, noedge: 0, bothedge: 0
0.0.N: Proof Simplification Iteration 1	[0.00 s]
0.0.PRE: A proof was found: No trace exists. [0.00 s]
INFO (IPF057): 0.0.PRE: The property ":noDeadEnd" was proven in 0.00 s.
    Use check_assumptions -show -dead_end to show this property in the property table.
0.0.PRE: A proof was found: No trace exists. [0.00 s]
INFO (IPF057): 0.0.PRE: The property ":noConflict" was proven in 0.00 s.
    Use check_assumptions -show to show this property in the property table.
INFO (IPF047): 0.0.PRE: The cover property ":live" was covered in 1 cycles in 0.00 s.
    Use check_assumptions -show -live to show this property in the property table.
0.0.PRE: Proof Simplification completed in 0.00 s
0: About to start ProofGrid in its own thread with a limit of 10000 pending notifications and a limit of 10 traces.
0: =============================== ProofGrid start ===============================
0: ProofGrid usable level: 1
0: Initial ProofGrid level: 1
0: ProofGrid is starting event handling
0.0.Hp: Proofgrid shell started at 5720@vlsi-ria85(local) jg_5281_vlsi-ria85_1
0.0.N: Proofgrid shell started at 5716@vlsi-ria85(local) jg_5281_vlsi-ria85_1
0.0.N: clocks: 1, declared: 1, looping: 0, posedge: 1, negedge: 0, noedge: 0, bothedge: 0
0.0.N: Last scan. Per property time limit: 0s
0.0.N: Starting proof for property "SEVEN.p1"	[0.00 s].
0.0.N: Trace Attempt  1	[0.00 s]
0.0.N: Trace Attempt  2	[0.00 s]
0.0.N: Trace Attempt  2	[0.00 s]
0.0.N: Trace Attempt  3	[0.00 s]
0.0.N: Trace Attempt  3	[0.00 s]
0.0.N: Trace Attempt  4	[0.00 s]
0.0.N: Trace Attempt  5	[0.00 s]
0.0.N: Trace Attempt  5	[0.00 s]
0.0.Hp: clocks: 1, declared: 1, looping: 0, posedge: 1, negedge: 0, noedge: 0, bothedge: 0
0.0.Hp: Last scan. Per property time limit: 0s
0.0.Hp: Trace Attempt  1	[0.00 s]
0.0.Hp: Trace Attempt  2	[0.00 s]
0.0.Hp: Trace Attempt  3	[0.00 s]
0.0.Hp: Trace Attempt  4	[0.00 s]
0.0.Hp: Trace Attempt  5	[0.00 s]
0.0.N: Trace Attempt  1	[0.01 s]
0.0.N: Trace Attempt  2	[0.01 s]
0.0.N: Trace Attempt  3	[0.01 s]
0.0.N: Trace Attempt  4	[0.01 s]
0.0.N: Trace Attempt  5	[0.01 s]
0.0.Ht: Proofgrid shell started at 5797@vlsi-ria85(local) jg_5281_vlsi-ria85_1
0.0.Oh: Proofgrid shell started at 5800@vlsi-ria85(local) jg_5281_vlsi-ria85_1
0.0.AM: Proofgrid shell started at 5814@vlsi-ria85(local) jg_5281_vlsi-ria85_1
0.0.B: Proofgrid shell started at 5801@vlsi-ria85(local) jg_5281_vlsi-ria85_1
0.0.Ht: clocks: 1, declared: 1, looping: 0, posedge: 1, negedge: 0, noedge: 0, bothedge: 0
0.0.Ht: Last scan. Per property time limit: 0s
0.0.Oh: clocks: 1, declared: 1, looping: 0, posedge: 1, negedge: 0, noedge: 0, bothedge: 0
0.0.Oh: Reached length limit (2147483647) [0.00 s]
0.0.B: clocks: 1, declared: 1, looping: 0, posedge: 1, negedge: 0, noedge: 0, bothedge: 0
0.0.B: Last scan. Per property time limit: 0s
0.0.B: Starting proof for property "SEVEN.p1"	[0.00 s].
0.0.B: Trace Attempt  1	[0.00 s]
0.0.Ht: Trace Attempt  1	[0.00 s]
0.0.Ht: Trace Attempt  2	[0.00 s]
0.0.Ht: Trace Attempt  3	[0.00 s]
0.0.Ht: Trace Attempt  4	[0.00 s]
0.0.Ht: Trace Attempt  5	[0.00 s]
0.0.B: Trace Attempt  2	[0.00 s]
0.0.B: Trace Attempt  3	[0.00 s]
0.0.B: Trace Attempt  4	[0.00 s]
0.0.B: Trace Attempt  5	[0.00 s]
0.0.Oh: Exited with Success (@ 0.04 s)
0.0.AM: clocks: 1, declared: 1, looping: 0, posedge: 1, negedge: 0, noedge: 0, bothedge: 0
0.0.AM: Last scan. Per property time limit: 0s
0.0.AM: Starting proof for property "SEVEN.p1"	[0.00 s].
0.0.AM: Trace Attempt  1	[0.00 s]
0.0.AM: Trace Attempt  2	[0.00 s]
0.0.AM: Trace Attempt  3	[0.00 s]
0.0.AM: Trace Attempt  4	[0.00 s]
0.0.AM: Trace Attempt  5	[0.00 s]
0.0.AM: Trace Attempt  1	[0.00 s]
0.0.AM: Trace Attempt  2	[0.00 s]
0.0.AM: Trace Attempt  3	[0.00 s]
0.0.AM: Trace Attempt  4	[0.00 s]
0.0.AM: Trace Attempt  5	[0.00 s]
0.0.AM: Trace Attempt  1	[0.01 s]
0.0.AM: Trace Attempt  2	[0.01 s]
0.0.AM: Trace Attempt  3	[0.01 s]
0.0.AM: Trace Attempt  4	[0.01 s]
0.0.AM: Trace Attempt  5	[0.02 s]
0.0.AM: Trace Attempt  1	[0.04 s]
0.0.AM: Trace Attempt  2	[0.04 s]
0.0.AM: Trace Attempt  3	[0.04 s]
0.0.AM: Trace Attempt  4	[0.04 s]
0.0.AM: Trace Attempt  5	[0.04 s]
0.0.N: Trace Attempt  1	[0.10 s]
0.0.N: Trace Attempt  2	[0.10 s]
0.0.N: Trace Attempt  3	[0.10 s]
0.0.N: Trace Attempt  4	[0.10 s]
0.0.N: Trace Attempt  5	[0.10 s]
0.0.AM: Trace Attempt  1	[0.16 s]
0.0.AM: Trace Attempt  2	[0.16 s]
0.0.AM: Trace Attempt  3	[0.16 s]
0.0.AM: Trace Attempt  4	[0.16 s]
0.0.AM: Trace Attempt  5	[0.16 s]
0.0.N: Trace Attempt  1	[0.45 s]
0.0.N: Trace Attempt  2	[0.45 s]
0.0.N: Trace Attempt  3	[0.45 s]
0.0.N: Trace Attempt  4	[0.45 s]
0.0.N: Trace Attempt  5	[0.45 s]
0.0.AM: Trace Attempt  1	[0.47 s]
0.0.AM: Trace Attempt  2	[0.47 s]
0.0.AM: Trace Attempt  3	[0.47 s]
0.0.AM: Trace Attempt  4	[0.47 s]
0.0.AM: Trace Attempt  5	[0.47 s]
0.0.AM: Trace Attempt  1	[1.70 s]
0.0.AM: Trace Attempt  2	[1.71 s]
0.0.AM: Trace Attempt  3	[1.71 s]
0.0.AM: Trace Attempt  4	[1.71 s]
0.0.AM: Trace Attempt  5	[1.71 s]
0.0.N: Trace Attempt  1	[1.74 s]
0.0.N: Trace Attempt  2	[1.74 s]
0.0.N: Trace Attempt  3	[1.74 s]
0.0.N: Trace Attempt  4	[1.74 s]
0.0.N: Trace Attempt  5	[1.74 s]
0.0.N: Trace Attempt  1	[3.01 s]
0.0.N: Trace Attempt  2	[3.01 s]
0.0.N: Trace Attempt  3	[3.01 s]
0.0.N: Trace Attempt  4	[3.01 s]
0.0.N: Trace Attempt  5	[3.01 s]
0.0.Hp: Trace Attempt 681	[4.01 s]
0.0.Ht: Trace Attempt 1990	[4.00 s]
0.0.B: Trace Attempt 1891	[4.00 s]
0.0.N: Trace Attempt  1	[4.28 s]
0.0.N: Trace Attempt  2	[4.29 s]
0.0.N: Trace Attempt  3	[4.29 s]
0.0.N: Trace Attempt  4	[4.29 s]
0.0.N: Trace Attempt  5	[4.29 s]
0.0.N: Trace Attempt  1	[5.64 s]
0.0.N: Trace Attempt  2	[5.64 s]
0.0.N: Trace Attempt  3	[5.65 s]
0.0.N: Trace Attempt  4	[5.65 s]
0.0.N: Trace Attempt  5	[5.65 s]
0.0.AM: Trace Attempt 180	[5.73 s]
0.0.Hp: Trace Attempt 953	[8.02 s]
0.0.Ht: Trace Attempt 2674	[8.00 s]
0.0.B: Trace Attempt 2586	[8.01 s]
0.0.AM: Trace Attempt  1	[8.27 s]
0.0.AM: Trace Attempt  2	[8.27 s]
0.0.AM: Trace Attempt  3	[8.27 s]
0.0.AM: Trace Attempt  4	[8.27 s]
0.0.AM: Trace Attempt  5	[8.27 s]
0.0.N: Trace Attempt 188	[9.70 s]
0.0.N: Trace Attempt  1	[12.03 s]
0.0.N: Trace Attempt  2	[12.03 s]
0.0.N: Trace Attempt  3	[12.03 s]
0.0.Hp: Trace Attempt 1160	[12.03 s]
0.0.N: Trace Attempt  4	[12.04 s]
0.0.N: Trace Attempt  5	[12.04 s]
0.0.Ht: Trace Attempt 3207	[12.01 s]
0.0.B: Trace Attempt 3129	[12.01 s]
0.0.AM: Trace Attempt 203	[12.27 s]
0.0.N: Trace Attempt 186	[16.04 s]
0.0.Ht: Trace Attempt 3665	[16.01 s]
0.0.B: Trace Attempt 3592	[16.01 s]
0.0.Hp: Trace Attempt 1335	[16.05 s]
0.0.AM: Trace Attempt 251	[16.38 s]
0.0.N: Trace Attempt  1	[18.57 s]
0.0.N: Trace Attempt  2	[18.57 s]
0.0.N: Trace Attempt  3	[18.57 s]
0.0.N: Trace Attempt  4	[18.57 s]
0.0.N: Trace Attempt  5	[18.57 s]
0.0.Ht: Trace Attempt 4071	[20.01 s]
0.0.B: Trace Attempt 4003	[20.01 s]
0.0.Hp: Trace Attempt 1488	[20.07 s]
0.0.AM: Trace Attempt 297	[20.43 s]
0.0.N: Trace Attempt 186	[22.57 s]
0.0.Ht: Trace Attempt 4413	[24.02 s]
0.0.B: Trace Attempt 4385	[24.02 s]
0.0.Hp: Trace Attempt 1628	[24.10 s]
0.0.AM: Trace Attempt 345	[24.50 s]
0.0.N: Trace Attempt  1	[24.98 s]
0.0.N: Trace Attempt  2	[24.98 s]
0.0.N: Trace Attempt  3	[24.98 s]
0.0.N: Trace Attempt  4	[24.98 s]
0.0.N: Trace Attempt  5	[24.98 s]
0.0.Ht: Trace Attempt 4751	[28.02 s]
0.0.B: Trace Attempt 4727	[28.02 s]
0.0.Hp: Trace Attempt 1754	[28.11 s]
0.0.AM: Trace Attempt 382	[28.55 s]
0.0.N: Trace Attempt 186	[29.00 s]
0.0.N: Trace Attempt  1	[31.40 s]
0.0.N: Trace Attempt  2	[31.40 s]
0.0.N: Trace Attempt  3	[31.40 s]
0.0.N: Trace Attempt  4	[31.41 s]
0.0.N: Trace Attempt  5	[31.41 s]
0.0.Ht: Trace Attempt 5060	[32.02 s]
0.0.B: Trace Attempt 5046	[32.03 s]
0.0.Hp: Trace Attempt 1872	[32.13 s]
0.0.AM: Trace Attempt 422	[32.65 s]
0.0.N: Trace Attempt 187	[35.46 s]
0.0.Ht: Trace Attempt 5345	[36.03 s]
0.0.B: Trace Attempt 5339	[36.03 s]
0.0.Hp: Trace Attempt 1983	[36.17 s]
0.0.AM: Trace Attempt 258	[36.72 s]
0.0.N: Trace Attempt  1	[38.05 s]
0.0.N: Trace Attempt  2	[38.05 s]
0.0.N: Trace Attempt  3	[38.05 s]
0.0.N: Trace Attempt  4	[38.05 s]
0.0.N: Trace Attempt  5	[38.05 s]
0.0.B: Trace Attempt 5593	[40.05 s]
0.0.Ht: Trace Attempt 5588	[40.05 s]
0.0.Hp: Trace Attempt 2080	[40.19 s]
0.0.N: Trace Attempt 187	[42.12 s]
0.0.AM: Trace Attempt 512	[43.03 s]
0.0.AM: Trace Attempt  1	[43.35 s]
0.0.AM: Trace Attempt  2	[43.35 s]
0.0.AM: Trace Attempt  3	[43.35 s]
0.0.AM: Trace Attempt  4	[43.36 s]
0.0.AM: Trace Attempt  5	[43.36 s]
0.0.B: Trace Attempt 5839	[44.06 s]
0.0.Ht: Trace Attempt 5833	[44.06 s]
0.0.Hp: Trace Attempt 2176	[44.22 s]
0.0.N: Trace Attempt  1	[44.52 s]
0.0.N: Trace Attempt  2	[44.52 s]
0.0.N: Trace Attempt  3	[44.52 s]
0.0.N: Trace Attempt  4	[44.52 s]
0.0.N: Trace Attempt  5	[44.52 s]
0.0.AM: Trace Attempt 186	[47.39 s]
0.0.Ht: Trace Attempt 6087	[48.07 s]
0.0.B: Trace Attempt 6103	[48.07 s]
0.0.Hp: Trace Attempt 2272	[48.25 s]
0.0.N: Trace Attempt 187	[48.59 s]
0.0.N: Trace Attempt  1	[51.02 s]
0.0.N: Trace Attempt  2	[51.02 s]
0.0.N: Trace Attempt  3	[51.02 s]
0.0.N: Trace Attempt  4	[51.02 s]
0.0.N: Trace Attempt  5	[51.02 s]
0.0.AM: Trace Attempt 245	[51.41 s]
0.0.B: Trace Attempt 6348	[52.07 s]
0.0.Ht: Trace Attempt 6322	[52.08 s]
0.0.Hp: Trace Attempt 2363	[52.26 s]
0.0.N: Trace Attempt 187	[55.08 s]
0.0.AM: Trace Attempt 293	[55.41 s]
0.0.B: Trace Attempt 6580	[56.08 s]
0.0.Ht: Trace Attempt 6553	[56.10 s]
0.0.Hp: Trace Attempt 2452	[56.28 s]
0.0.N: Trace Attempt  1	[57.36 s]
0.0.N: Trace Attempt  2	[57.36 s]
0.0.N: Trace Attempt  3	[57.36 s]
0.0.N: Trace Attempt  4	[57.37 s]
0.0.N: Trace Attempt  5	[57.37 s]
0.0.AM: Trace Attempt 340	[59.51 s]
0.0.B: Trace Attempt 6800	[60.09 s]
0.0.Ht: Trace Attempt 6783	[60.11 s]
0.0.Hp: Trace Attempt 2538	[60.31 s]
0.0.N: Trace Attempt 187	[61.41 s]
0.0.AM: Trace Attempt 389	[63.56 s]
0.0.N: Trace Attempt  1	[63.83 s]
0.0.N: Trace Attempt  2	[63.83 s]
0.0.N: Trace Attempt  3	[63.83 s]
0.0.N: Trace Attempt  4	[63.83 s]
0.0.N: Trace Attempt  5	[63.83 s]
0.0.B: Trace Attempt 7010	[64.09 s]
0.0.Ht: Trace Attempt 7002	[64.11 s]
0.0.Hp: Trace Attempt 2620	[64.33 s]
0.0.AM: Trace Attempt 429	[67.60 s]
0.0.N: Trace Attempt 187	[67.86 s]
0.0.B: Trace Attempt 7215	[68.11 s]
0.0.Ht: Trace Attempt 7206	[68.12 s]
0.0.Hp: Trace Attempt 2700	[68.36 s]
0.0.N: Trace Attempt  1	[70.21 s]
0.0.N: Trace Attempt  2	[70.21 s]
0.0.N: Trace Attempt  3	[70.21 s]
0.0.N: Trace Attempt  4	[70.21 s]
0.0.N: Trace Attempt  5	[70.21 s]
0.0.AM: Trace Attempt 456	[71.83 s]
0.0.B: Trace Attempt 7411	[72.12 s]
0.0.Ht: Trace Attempt 7408	[72.12 s]
0.0.Hp: Trace Attempt 2777	[72.39 s]
0.0.N: Trace Attempt 187	[74.25 s]
0.0.AM: Trace Attempt 469	[75.95 s]
0.0.B: Trace Attempt 7610	[76.13 s]
0.0.Ht: Trace Attempt 7599	[76.14 s]
0.0.Hp: Trace Attempt 2852	[76.42 s]
0.0.N: Trace Attempt  1	[76.71 s]
0.0.N: Trace Attempt  2	[76.71 s]
0.0.N: Trace Attempt  3	[76.71 s]
0.0.N: Trace Attempt  4	[76.71 s]
0.0.N: Trace Attempt  5	[76.72 s]
0.0.AM: Trace Attempt 484	[80.06 s]
0.0.B: Trace Attempt 7801	[80.14 s]
0.0.Ht: Trace Attempt 7793	[80.16 s]
0.0.Hp: Trace Attempt 2924	[80.42 s]
0.0.N: Trace Attempt 186	[80.74 s]
0.0.N: Trace Attempt  1	[83.27 s]
0.0.N: Trace Attempt  2	[83.27 s]
0.0.N: Trace Attempt  3	[83.27 s]
0.0.N: Trace Attempt  4	[83.27 s]
0.0.N: Trace Attempt  5	[83.27 s]
0.0.AM: Trace Attempt 498	[84.09 s]
0.0.B: Trace Attempt 7987	[84.15 s]
0.0.Ht: Trace Attempt 7981	[84.17 s]
0.0.Hp: Trace Attempt 2995	[84.46 s]
0.0.N: Trace Attempt 187	[87.32 s]
0.0.B: Trace Attempt 8168	[88.16 s]
0.0.Ht: Trace Attempt 8165	[88.17 s]
0.0.AM: Trace Attempt 516	[88.19 s]
0.0.Hp: Trace Attempt 3064	[88.50 s]
0.0.N: Trace Attempt  1	[89.70 s]
0.0.N: Trace Attempt  2	[89.70 s]
0.0.N: Trace Attempt  3	[89.70 s]
0.0.N: Trace Attempt  4	[89.71 s]
0.0.N: Trace Attempt  5	[89.71 s]
0.0.B: Trace Attempt 8350	[92.17 s]
0.0.Ht: Trace Attempt 8336	[92.19 s]
0.0.AM: Trace Attempt 530	[92.23 s]
0.0.Hp: Trace Attempt 3130	[92.50 s]
0.0.N: Trace Attempt 187	[93.73 s]
0.0.B: Trace Attempt 8527	[96.19 s]
0.0.Ht: Trace Attempt 8504	[96.20 s]
0.0.N: Trace Attempt  1	[96.26 s]
0.0.N: Trace Attempt  2	[96.26 s]
0.0.N: Trace Attempt  3	[96.26 s]
0.0.N: Trace Attempt  4	[96.27 s]
0.0.N: Trace Attempt  5	[96.27 s]
0.0.AM: Trace Attempt 547	[96.30 s]
0.0.Hp: Trace Attempt 3196	[96.52 s]
0.0.B: Trace Attempt 8699	[100.19 s]
0.0.Ht: Trace Attempt 8681	[100.21 s]
0.0.N: Trace Attempt 187	[100.29 s]
0.0.Hp: Trace Attempt 3261	[100.58 s]
0.0.AM: Trace Attempt 566	[100.58 s]
0.0.N: Trace Attempt  1	[102.66 s]
0.0.N: Trace Attempt  2	[102.66 s]
0.0.N: Trace Attempt  3	[102.66 s]
0.0.N: Trace Attempt  4	[102.66 s]
0.0.N: Trace Attempt  5	[102.66 s]
0.0.B: Trace Attempt 8867	[104.19 s]
0.0.Ht: Trace Attempt 8852	[104.21 s]
0.0.AM: Trace Attempt 578	[104.59 s]
0.0.Hp: Trace Attempt 3325	[104.64 s]
0.0.N: Trace Attempt 187	[106.68 s]
0.0.B: Trace Attempt 9032	[108.20 s]
0.0.Ht: Trace Attempt 9021	[108.23 s]
0.0.AM: Trace Attempt 591	[108.64 s]
0.0.Hp: Trace Attempt 3386	[108.69 s]
0.0.N: Trace Attempt  1	[109.05 s]
0.0.N: Trace Attempt  2	[109.05 s]
0.0.N: Trace Attempt  3	[109.05 s]
0.0.N: Trace Attempt  4	[109.05 s]
0.0.N: Trace Attempt  5	[109.05 s]
0.0.B: Trace Attempt 9194	[112.23 s]
0.0.Ht: Trace Attempt 9185	[112.25 s]
0.0.Hp: Trace Attempt 3448	[112.75 s]
0.0.AM: Trace Attempt 603	[112.75 s]
0.0.N: Trace Attempt 187	[113.08 s]
0.0.N: Trace Attempt  1	[115.43 s]
0.0.N: Trace Attempt  2	[115.43 s]
0.0.N: Trace Attempt  3	[115.43 s]
0.0.N: Trace Attempt  4	[115.43 s]
0.0.N: Trace Attempt  5	[115.43 s]
0.0.B: Trace Attempt 9349	[116.25 s]
0.0.Ht: Trace Attempt 9339	[116.26 s]
0.0.Hp: Trace Attempt 3508	[116.81 s]
0.0.AM: Trace Attempt 616	[116.90 s]
0.0.N: Trace Attempt 187	[119.46 s]
0.0.B: Trace Attempt 9502	[120.26 s]
0.0.Ht: Trace Attempt 9490	[120.26 s]
0.0.Hp: Trace Attempt 3567	[120.85 s]
0.0.AM: Trace Attempt 629	[121.23 s]
0.0.N: Trace Attempt  1	[122.42 s]
0.0.N: Trace Attempt  2	[122.42 s]
0.0.N: Trace Attempt  3	[122.42 s]
0.0.N: Trace Attempt  4	[122.42 s]
0.0.N: Trace Attempt  5	[122.42 s]
0.0.B: Trace Attempt 9654	[124.28 s]
0.0.Ht: Trace Attempt 9638	[124.28 s]
0.0.Hp: Trace Attempt 3623	[124.86 s]
0.0.AM: Trace Attempt 640	[125.51 s]
0.0.N: Trace Attempt 185	[126.45 s]
0.0.B: Trace Attempt 9806	[128.29 s]
0.0.Ht: Trace Attempt 9790	[128.30 s]
0.0.Hp: Trace Attempt 3679	[128.87 s]
0.0.AM: Trace Attempt 650	[129.65 s]
0.0.N: Trace Attempt 248	[130.46 s]
0.0.B: Trace Attempt 9954	[132.30 s]
0.0.Ht: Trace Attempt 9939	[132.32 s]
0.0.Hp: Trace Attempt 3734	[132.90 s]
0.0.AM: Trace Attempt 660	[133.96 s]
0.0.N: Trace Attempt 288	[134.46 s]
0.0.B: Trace Attempt 10099	[136.31 s]
0.0.Ht: Trace Attempt 10084	[136.32 s]
0.0.Hp: Trace Attempt 3788	[136.97 s]
0.0.AM: Trace Attempt 671	[138.18 s]
0.0.N: Trace Attempt 332	[138.47 s]
0.0.B: Trace Attempt 10240	[140.32 s]
0.0.Ht: Trace Attempt 10227	[140.34 s]
0.0.Hp: Trace Attempt 3842	[141.04 s]
0.0.N: Trace Attempt 365	[142.50 s]
0.0.AM: Trace Attempt 681	[142.52 s]
0.0.B: Trace Attempt 10377	[144.32 s]
0.0.Ht: Trace Attempt 10362	[144.35 s]
0.0.Hp: Trace Attempt 3894	[145.06 s]
0.0.N: Trace Attempt 401	[146.58 s]
0.0.AM: Trace Attempt 691	[146.84 s]
0.0.B: Trace Attempt 10511	[148.33 s]
0.0.Ht: Trace Attempt 10499	[148.38 s]
0.0.Hp: Trace Attempt 3946	[149.13 s]
0.0.N: Trace Attempt 436	[150.65 s]
0.0.AM: Trace Attempt 700	[151.18 s]
0.0.B: Trace Attempt 10643	[152.34 s]
0.0.Ht: Trace Attempt 10629	[152.40 s]
0.0.Hp: Trace Attempt 3996	[153.15 s]
0.0.N: Trace Attempt 465	[154.72 s]
0.0.AM: Trace Attempt 708	[155.64 s]
0.0.B: Trace Attempt 10772	[156.37 s]
0.0.Ht: Trace Attempt 10761	[156.43 s]
0.0.Hp: Trace Attempt 4045	[157.17 s]
0.0.N: Trace Attempt  1	[157.92 s]
0.0.N: Trace Attempt  2	[157.92 s]
0.0.N: Trace Attempt  3	[157.92 s]
0.0.N: Trace Attempt  4	[157.93 s]
0.0.N: Trace Attempt  5	[157.93 s]
0.0.AM: Trace Attempt 716	[159.97 s]
0.0.B: Trace Attempt 10901	[160.38 s]
0.0.Ht: Trace Attempt 10895	[160.43 s]
0.0.Hp: Trace Attempt 4095	[161.18 s]
0.0.N: Trace Attempt 184	[161.94 s]
0.0.AM: Trace Attempt 724	[164.05 s]
0.0.B: Trace Attempt 11032	[164.42 s]
0.0.Ht: Trace Attempt 11031	[164.46 s]
0.0.Hp: Trace Attempt 4142	[165.22 s]
0.0.N: Trace Attempt 248	[166.03 s]
0.0.AM: Trace Attempt 734	[168.23 s]
0.0.B: Trace Attempt 11159	[168.42 s]
0.0.Ht: Trace Attempt 11163	[168.48 s]
0.0.Hp: Trace Attempt 4191	[169.29 s]
0.0.N: Trace Attempt 289	[170.09 s]
0.0.B: Trace Attempt 11285	[172.44 s]
0.0.Ht: Trace Attempt 11287	[172.48 s]
0.0.AM: Trace Attempt 744	[172.72 s]
0.0.Hp: Trace Attempt 4239	[173.32 s]
0.0.N: Trace Attempt 334	[174.20 s]
0.0.B: Trace Attempt 11407	[176.46 s]
0.0.Ht: Trace Attempt 11412	[176.51 s]
0.0.AM: Trace Attempt 753	[176.90 s]
0.0.Hp: Trace Attempt 4273	[177.33 s]
0.0.N: Trace Attempt 367	[178.38 s]
0.0.B: Trace Attempt 11526	[180.50 s]
0.0.Ht: Trace Attempt 11532	[180.52 s]
0.0.AM: Trace Attempt 762	[180.92 s]
0.0.N: Trace Attempt 391	[180.97 s]
0.0.N: Stopped processing property "SEVEN.p1"	[181.03 s].
0.0.N: Morphing to Ncustom1
0.0.N: All properties determined. [0.00 s]
0.0.N: Exited with Success (@ 0.00 s)
0.0.Ncustom1: clocks: 1, declared: 1, looping: 0, posedge: 1, negedge: 0, noedge: 0, bothedge: 0
0.0.Ncustom1: Starting proof for property "SEVEN.p1"	[0.00 s].
0.0.Ncustom1: Trace Attempt 469	[0.03 s]
0.0.Tri: Proofgrid shell started at 13043@vlsi-ria85(local) jg_5281_vlsi-ria85_1
0.0.Tri: clocks: 1, declared: 1, looping: 0, posedge: 1, negedge: 0, noedge: 0, bothedge: 0
0.0.Tri: Last scan. Per property time limit: 0s
0.0.Tri: Starting proof for property "SEVEN.p1"	[0.00 s].
0.0.Tri: Trace Attempt  1	[0.00 s]
0.0.B: Trace Attempt 11538	[180.92 s]
0.0.B: Stopped processing property "SEVEN.p1"	[181.07 s].
0.0.B: Morphing to Bcustom2
0.0.B: All properties determined. [0.00 s]
0.0.B: Exited with Success (@ 0.00 s)
0.0.Bcustom2: clocks: 1, declared: 1, looping: 0, posedge: 1, negedge: 0, noedge: 0, bothedge: 0
0.0.Bcustom2: Starting proof for property "SEVEN.p1"	[0.00 s].
0.0.Bcustom2: Trace Attempt  1	[0.00 s]
0.0.Bcustom2: Trace Attempt  2	[0.00 s]
0.0.Bcustom2: Trace Attempt  1	[0.00 s]
0.0.Bcustom2: Trace Attempt  2	[0.00 s]
0.0.Bcustom2: Trace Attempt  3	[0.00 s]
0.0.Bcustom2: Trace Attempt  4	[0.00 s]
0.0.Bcustom2: Trace Attempt  5	[0.00 s]
0.0.Bcustom2: Trace Attempt  1	[0.00 s]
0.0.Bcustom2: Trace Attempt  2	[0.00 s]
0.0.Bcustom2: Trace Attempt  3	[0.00 s]
0.0.Bcustom2: Trace Attempt  4	[0.00 s]
0.0.Bcustom2: Trace Attempt  5	[0.00 s]
0.0.Bcustom2: Trace Attempt  1	[0.00 s]
0.0.Bcustom2: Trace Attempt  2	[0.00 s]
0.0.Bcustom2: Trace Attempt  3	[0.00 s]
0.0.Bcustom2: Trace Attempt  4	[0.00 s]
0.0.Bcustom2: Trace Attempt  5	[0.00 s]
0.0.Bcustom2: Trace Attempt  1	[0.01 s]
0.0.Bcustom2: Trace Attempt  2	[0.01 s]
0.0.Bcustom2: Trace Attempt  3	[0.01 s]
0.0.Bcustom2: Trace Attempt  4	[0.01 s]
0.0.Bcustom2: Trace Attempt  5	[0.01 s]
0.0.Bcustom2: Trace Attempt  1	[0.01 s]
0.0.Bcustom2: Trace Attempt  2	[0.01 s]
0.0.Bcustom2: Trace Attempt  3	[0.01 s]
0.0.Bcustom2: Trace Attempt  4	[0.01 s]
0.0.Bcustom2: Trace Attempt  5	[0.01 s]
0.0.Tri:    0.00" ---- Launching main thread ----
0.0.Bcustom2: Trace Attempt  1	[0.03 s]
0.0.Bcustom2: Trace Attempt  2	[0.03 s]
0.0.Bcustom2: Trace Attempt  3	[0.03 s]
0.0.Bcustom2: Trace Attempt  4	[0.03 s]
0.0.Bcustom2: Trace Attempt  5	[0.03 s]
0.0.Tri:    0.03" ---- Launching abstraction thread ----
0.0.AM: Stopped processing property "SEVEN.p1"	[181.12 s].
0.0.AM: Morphing to AMcustom3
0.0.AM: All properties determined. [0.00 s]
0.0.AM: Exited with Success (@ 0.00 s)
0.0.AMcustom3: clocks: 1, declared: 1, looping: 0, posedge: 1, negedge: 0, noedge: 0, bothedge: 0
0.0.AMcustom3: Starting proof for property "SEVEN.p1"	[0.00 s].
0.0.AMcustom3: Trace Attempt  1	[0.00 s]
0.0.AMcustom3: Trace Attempt  2	[0.00 s]
0.0.AMcustom3: Trace Attempt  3	[0.00 s]
0.0.AMcustom3: Trace Attempt  4	[0.00 s]
0.0.AMcustom3: Trace Attempt  5	[0.00 s]
0.0.AMcustom3: Trace Attempt  1	[0.00 s]
0.0.AMcustom3: Trace Attempt  2	[0.00 s]
0.0.AMcustom3: Trace Attempt  3	[0.00 s]
0.0.AMcustom3: Trace Attempt  4	[0.00 s]
0.0.AMcustom3: Trace Attempt  5	[0.00 s]
0.0.Bcustom2: Trace Attempt  1	[0.07 s]
0.0.Bcustom2: Trace Attempt  2	[0.07 s]
0.0.Bcustom2: Trace Attempt  3	[0.07 s]
0.0.Bcustom2: Trace Attempt  4	[0.07 s]
0.0.Bcustom2: Trace Attempt  5	[0.07 s]
0.0.Tri:    0.05" ---- Launching multi-phase simplification thread ----
0.0.AMcustom3: Trace Attempt  1	[0.01 s]
0.0.AMcustom3: Trace Attempt  2	[0.01 s]
0.0.AMcustom3: Trace Attempt  3	[0.01 s]
0.0.AMcustom3: Trace Attempt  4	[0.02 s]
0.0.AMcustom3: Trace Attempt  5	[0.02 s]
0.0.Tri:    0.07" ---- Launching liveness simplification thread ----
0.0.AMcustom3: Trace Attempt  1	[0.04 s]
0.0.AMcustom3: Trace Attempt  2	[0.04 s]
0.0.AMcustom3: Trace Attempt  3	[0.04 s]
0.0.AMcustom3: Trace Attempt  4	[0.04 s]
0.0.AMcustom3: Trace Attempt  5	[0.04 s]
0.0.Bcustom2: Trace Attempt  1	[0.17 s]
0.0.Bcustom2: Trace Attempt  2	[0.17 s]
0.0.Bcustom2: Trace Attempt  3	[0.17 s]
0.0.Bcustom2: Trace Attempt  4	[0.17 s]
0.0.Bcustom2: Trace Attempt  5	[0.17 s]
0.0.AMcustom3: Trace Attempt  1	[0.17 s]
0.0.AMcustom3: Trace Attempt  2	[0.18 s]
0.0.AMcustom3: Trace Attempt  3	[0.18 s]
0.0.AMcustom3: Trace Attempt  4	[0.18 s]
0.0.AMcustom3: Trace Attempt  5	[0.18 s]
0.0.Hp: Trace Attempt 4299	[181.48 s]
0.0.Bcustom2: Trace Attempt  1	[0.49 s]
0.0.Bcustom2: Trace Attempt  2	[0.49 s]
0.0.Bcustom2: Trace Attempt  3	[0.49 s]
0.0.Bcustom2: Trace Attempt  4	[0.49 s]
0.0.Bcustom2: Trace Attempt  5	[0.49 s]
0.0.AMcustom3: Trace Attempt  1	[0.52 s]
0.0.AMcustom3: Trace Attempt  2	[0.52 s]
0.0.AMcustom3: Trace Attempt  3	[0.52 s]
0.0.AMcustom3: Trace Attempt  4	[0.52 s]
0.0.AMcustom3: Trace Attempt  5	[0.52 s]
0.0.Tri:    0.86" Simplification phase 1 complete
0.0.Ncustom1: Requesting engine job to terminate
0.0.Bcustom2: Requesting engine job to terminate
0.0.AMcustom3: Requesting engine job to terminate
0.0.Tri: Requesting engine job to terminate
0.0.Hp: Requesting engine job to terminate
0.0.Ht: Requesting engine job to terminate
INFO (IPF144): 0: Initiating shutdown of proof [182.04 s]
0.0.Tri: A proof was found: No trace exists. [0.95 s]
INFO (IPF057): 0.0.Tri: The property "SEVEN.p1" was proven in 0.96 s.
0.0.AMcustom3: Trace Attempt 58	[0.86 s]
0.0.AMcustom3: Stopped processing property "SEVEN.p1"	[0.88 s].
0.0.AMcustom3: All properties determined. [0.88 s]
0.0.Ncustom1: Stopped processing property "SEVEN.p1"	[1.01 s].
0.0.Ncustom1: All properties determined. [1.01 s]
0.0.Ht: Trace Attempt 11571	[181.98 s]
0.0.Ht: All properties determined. [182.01 s]
0.0.Bcustom2: Trace Attempt 672	[0.93 s]
0.0.Bcustom2: Stopped processing property "SEVEN.p1"	[0.94 s].
0.0.Bcustom2: All properties determined. [0.94 s]
0.0.Ncustom1: Exited with Success (@ 182.06 s)
0: ProofGrid usable level: 0
0.0.AMcustom3: Exited with Success (@ 182.07 s)
0.0.Hp: Trace Attempt 4302	[181.98 s]
0.0.Hp: All properties determined. [182.07 s]
0.0.Bcustom2: Exited with Success (@ 182.09 s)
0.0.Ht: Exited with Success (@ 182.16 s)
0.0.Tri: Stopped processing property "SEVEN.p1"	[1.12 s].
0.0.Tri: All properties determined. [1.12 s]
0.0.Tri: Exited with Success (@ 182.21 s)
0.0.Hp: Exited with Success (@ 182.28 s)
0: --------------------------------------------------------------
ProofGrid Summary (utilization 99.97 %)
--------------------------------------------------------------
     engines started                               :    10
     engine jobs started                           :     7
     jobs where 1 minute load exceeded core count  :     1

    Average time in state (seconds)
    ------------------------------------------------------
    Engine  Pending     Running        Dead    Utilization
    ------------------------------------------------------
     Hp        0.03      182.04        0.00       99.98 %
     Ht        0.04      182.00        0.00       99.98 %
     Oh        0.04        0.00        0.00        3.42 %
    Ncustom1        0.04      181.98        0.00       99.98 %
    Bcustom2        0.04      181.88        0.00       99.98 %
    AMcustom3        0.03      181.84        0.00       99.98 %
    Tri        0.07        0.96        0.00       92.89 %
    all        0.04      130.10        0.00       99.97 %

    Total time in state (seconds)
    -----------------------------------------
            Pending     Running        Dead  
    -----------------------------------------
               0.28      910.71        0.00

    Data read    : 7.27 MiB
    Data written : 3.03 kiB

0: All pending notifications were processed.
INFO (IPF059): 0: Completed proof on task: "<embedded>"

==============================================================
SUMMARY
==============================================================
           Properties Considered              : 1
                 assertions                   : 1
                  - proven                    : 1 (100%)
                  - bounded_proven (user)     : 0 (0%)
                  - bounded_proven (auto)     : 0 (0%)
                  - marked_proven             : 0 (0%)
                  - cex                       : 0 (0%)
                  - ar_cex                    : 0 (0%)
                  - undetermined              : 0 (0%)
                  - unknown                   : 0 (0%)
                  - error                     : 0 (0%)
                 covers                       : 0
                  - unreachable               : 0
                  - bounded_unreachable (user): 0
                  - covered                   : 0
                  - ar_covered                : 0
                  - undetermined              : 0
                  - unknown                   : 0
                  - error                     : 0
proven
[<embedded>] % exit -force
INFO (IPL005): Received request to exit from the console.
INFO: Waiting for proof threads to stop...
INFO: Proof threads stopped.
INFO (IPL018): The peak resident set memory use for this session was 1.836 GB.
INFO (IPL014): Waiting for the Tcl-thread to exit.
INFO (IPL015): The Tcl-thread exited with status 0.
INFO (IPL016): Exiting the analysis session with status 0.
