# ----------------------------------------
# Jasper Version Info
# tool      : Jasper 2024.06
# platform  : Linux 3.10.0-1160.62.1.el7.x86_64
# version   : 2024.06p002 64 bits
# build date: 2024.09.02 16:28:38 UTC
# ----------------------------------------
# started   : 2025-11-18 10:18:39 IST
# hostname  : vlsi-ria85.vlsidomain
# pid       : 19326
# arguments : '-label' 'session_0' '-console' '//127.0.0.1:42221' '-nowindow' '-style' 'windows' '-exitonerror' '-data' 'AAAAwnicY2RgYLCp////PwMYMD6A0Aw2jAyoAMRnQhUJbEChGRhYYZphSliAmItBl6GAoYghnyELyFNj0ANCfSA7HS6aypDMUMJQDBQtA4omMsQzmAJV8gD1JQF5JUDZDCBfCElWDyyaA7YDAEXzFTM=' '-proj' '/users/rompel/jasper_executions/safety/jgprojects/vga_5/sessionLogs/session_0' '-init' '-hidden' '/users/rompel/jasper_executions/safety/jgprojects/vga_5/.tmp/.initCmds.tcl' 'vga_5.tcl' '-hidden' '/users/rompel/jasper_executions/safety/jgprojects/vga_5/.tmp/.postCmds.tcl'

Any disclosure about the Cadence Design Systems software or its use
model to any third party violates the written Non-Disclosure Agreement
between Cadence Design Systems, Inc. and the customer.

THIS SOFTWARE CONTAINS CONFIDENTIAL INFORMATION AND TRADE SECRETS OF
CADENCE DESIGN SYSTEMS, INC. USE, DISCLOSURE, OR REPRODUCTION IS
PROHIBITED WITHOUT THE PRIOR EXPRESS WRITTEN PERMISSION OF CADENCE
DESIGN SYSTEMS, INC.

Copyright (C) 2000-2024 Cadence Design Systems, Inc. All Rights
Reserved.  Unpublished -- rights reserved under the copyright laws of
the United States.

This product includes software developed by others and redistributed
according to license agreement. See doc/third_party_readme.txt for
further details.

RESTRICTED RIGHTS LEGEND

Use, duplication, or disclosure by the Government is subject to
restrictions as set forth in subparagraph (c) (1) (ii) of the Rights in
Technical Data and Computer Software clause at DFARS 252.227-7013 or
subparagraphs (c) (1) and (2) of Commercial Computer Software -- Restricted
Rights at 48 CFR 52.227-19, as applicable.


                          Cadence Design Systems, Inc.
                          2655 Seely Avenue
                          San Jose, CA 95134
                          Phone: 408.943.1234

For technical assistance visit http://support.cadence.com.

Jasper Apps Analysis Session - /users/rompel/jasper_executions/safety/jgprojects/vga_5/sessionLogs/session_0

WARNING (WG017): [session]: The system's locale is "ANSI_X3.4-1968", which is not UTF-8. Non-ASCII characters might not be handled correctly.
WARNING (WG017): [jg_console]: The system's locale is "ANSI_X3.4-1968", which is not UTF-8. Non-ASCII characters might not be handled correctly.
INFO: successfully checked out license "jasper_fao".
INFO: reading configuration file "/users/rompel/.config/cadence/jasper.conf".
% analyze -sv09 ../vga_5.sv
[-- (VERI-1482)] Analyzing Verilog file '/tools/cadence2425/JASPER/jasper_2024.06p002/lib/verilog/packages/std/std.sv' into library 'std'
[-- (VERI-1482)] Analyzing Verilog file '../vga_5.sv'
% elaborate -bbox_mul 1000000 -bbox_div 1000000 -bbox_mod 1000000 -bbox_a 1000000
[INFO (HIER-8002)] ../vga_5.sv(64): Disabling old hierarchical reference handler
[INFO (VERI-1018)] ../vga_5.sv(1): compiling module 'VGA'
[WARN (VERI-1209)] ../vga_5.sv(33): expression size 32 truncated to fit in target size 9
[WARN (VERI-1209)] ../vga_5.sv(37): expression size 32 truncated to fit in target size 8
[INFO (VERI-8005)] ../vga_5.sv(17): Unintentional sequential element inferred for h_cnt read before write using blocking assignment
[INFO (VERI-8005)] ../vga_5.sv(18): Unintentional sequential element inferred for v_cnt read before write using blocking assignment
[INFO (VERI-8005)] ../vga_5.sv(19): Unintentional sequential element inferred for h_sync read before write using blocking assignment
[INFO (VERI-8005)] ../vga_5.sv(20): Unintentional sequential element inferred for v_sync read before write using blocking assignment
[INFO (VERI-8005)] ../vga_5.sv(1): Unintentional sequential element inferred for disp_ena read before write using blocking assignment
[INFO (VERI-8005)] ../vga_5.sv(1): Unintentional sequential element inferred for col read before write using blocking assignment
[INFO (VERI-8005)] ../vga_5.sv(1): Unintentional sequential element inferred for row read before write using blocking assignment
INFO (ISW003): Top module name is "VGA".
INFO (INL208): Elaboration synthesis summary:
  Number of synthesized netlists          1 (0 packages)
  Single run mode                         On
  Pipeline                                On (1 pipelined netlists)
  Late hierarchical reference connection  On
  Number of analyzed Verilog modules      1 (1 synthesized)
  Number of analyzed VHDL entities        0 (0 synthesized)
INFO (INL003): Clearing all state information (assumes, stopats, and so forth).
VGA
[<embedded>] % reset rst
INFO (IPM031): Clearing proof results of all properties.
INFO (IRS006): Current reset condition is "rst".
[<embedded>] % clock clk
[<embedded>] % prove -all
Ncustom1: Custom engine code is hT3Ng7hPPfiYQOTDZ3qhYOwGAM51eA+J/FjkM5shLioAsqhgLR4Ft+O1BuKG6ilQ83B9tLXSl+CwjiTMAQA
Bcustom2: Custom engine code is hT3Nm7hPr1Vp3Di1Ra2USNIGL4JypRnLKLAdF6JAyuavO2JfGCiY9OZJhcAcOUnLx5xwNdhILGrAWX9s+z2WDkKwNR7tAfClBEjRFVQeq6DU54boFgEA
AMcustom3: Custom engine code is hT3Ng7hP/feYQOTDZ3qhYOwGAM51eA+J/FjkM5shLioAsqhgLR4Ft+O1BuKG6ilQ83B9tLXSmmqwm7g9AQA
Mpcustom4: Custom engine code is hT3NZbhP9fmY2AbBQnsjfOxn6c+6e6yL+/e8fZFmaQrnlgEA
INFO (IPF036): Starting proof on task: "<embedded>", 1 properties to prove with 0 already proven/unreachable
INFO (IRS029): Starting reset analysis: phase 1 of 4.
INFO (IRS030): Running reset analysis: phase 2 of 4.
INFO (IRS031): Running reset analysis: phase 3 of 4.
INFO (IRS020): Starting the reset analysis simulation with a limit of 100 iterations (phase 4 of 4).
INFO (IRS024): Reset iterations 0 to 4 analyzed.
INFO (IRS018): Reset analysis simulation executed for 3 iterations. Assigned values for 35 of 37 design flops, 0 of 0 design latches, 3 of 3 internal elements.
INFO (IRS039): Reset analysis complete.
INFO (IPF031): Settings used for proof thread 0:
    orchestration                 = on
    time_limit                    = 86400s
    per_property_time_limit       = 1s * 10 ^ scan
    engine_mode                   = auto
    proofgrid_per_engine_max_jobs = 1
    max engine jobs               = auto
    proofgrid_mode                = local
    proofgrid_restarts            = 10
AMcustom5: Custom engine code is hT3N1rhP11/52HrFRS21ROp2LOjVTgPvT8L8BGXHgLhaIuqtT4nARFjUqrBL+7pLmaTOzBepZW/Jm8SSrHDybSQtoNiO3y43wk+dEoWlsZizu97Fih6O6lPVG/LpWP5SsUPwlGagLNa1FKEFvwVXyX7//8prySbvSxIHXr5er+z4RAEA
0: Using multistage preprocessing
Ncustom6: Custom engine code is hT3OXrhPByJp3TrFSTLhUmMH4KVtJgmTCnNDF46yMXOKY48m4LS5nE7yBzFjA7kDuwO/GhGUpEPiky3p3wmPn3dJZHxFMsafSoObRzSC+tn7sEY0WbTdZ/FV4hL3MYH/b1CIUvXSWR4wqEoVLsmMOD4xIPT4lI1LO6ZCO7PnnWQuLwetnvKlrXx6wCW/A+x+enqslg1YPobi4wEF/EvbzOvcTYdJvl2s4H2yZg2b2ofAVN5WvhWk1HoBAA
0: Starting reduce
ADcustom7: Custom engine code is hT3Nv7hPv1752HrFRa2kROx2f/ECJeZB2AZsLdlO8VwmIuqtT4nIDFXclhg+O+o+DMmQCekbheGk0kK28laA9gaOFDXsQp29J3X615HY1IPHJWd6FUFvCHjO+p1k652b5JJvZlShNpGlGSXAiQe/mEAj6tEBAA
Tricustom8: Custom engine code is hT3Nu7hPt1752DvFRa0kNDiyIV97VyejwM9C/jCLJjdPvusZONHY42VYUy0Q1ZotnhcVtNc56tJ5wbxv6V2+XpdsaSlHck5vfnbYjdwj1OECy9U+7oSQ0SZE3g5ayD+Phuh4odCJTjeKa2k4elM9ldQfkAEA
Gcustom9: Custom engine code is hT3NibhPDfeYQADBZnYcglOvK9Pfd7EOeniIqP8jNsyIqInncipMGcUXqAadachREE9F2PwhBUZUNw5kHnd4JdXkamORRgEA
C2custom10: Custom engine code is hT3NirhPjfWYQADBZnYcglOvK9Pfd7EOeniIqP8jNsyIqInncgkrYMMXCYbdK0dUjZIF9d4cJ0rHoBDjwVLBKuG86XYVV00BAA
AGcustom11: Custom engine code is hT3NirhP/fmYQADBZnYcglOvK9Pfd7EOeniIqP8jNsyIqInnckcwYMMXCYbdK0dUjZIF9d4cJ0rHoBDjwVLBKuHEZnZByh0BAA
Bcustom12: Custom engine code is hT3NjrhPDfiYQADBZnYcglOvK9PfWxFtenjIyBqfrgr7if/jL/yPOuK1BAflEcW0DxNH2eDIoezN2gxlQFg81RZtiWXh7aiTAidvAQA
Ncustom13: Custom engine code is hT3NR7hPByFp3TrFSTLhUmMH4KWtJglTyV/c51BHEeZWamnJv767nE6PCak26bd3gf3XGN3rIRheufhDieCJQVISo+gNYUKhiUedBKGtsP/a18svAnlMJZudHxDFwK5ufsyoxsIyiAeSY2oi3tEuoDHr5gw42DFKAG3PqO3CEsl8Azzdt3pl5nGA1Ifv2H02eYsFzWb/nfp8PMb3F0krE/EgBcm8TD9Div8BAA
0: Finished reduce in 0s
Tricustom14: Custom engine code is hT3Nu7hP3fiYQADBZnYcglNHp9bfd7EOeniIqP/ji8sGLQu8yhsFO+wxJ+O+R0bU8g/IewXFomyos+viQnWc2xYNYmMqpo3i40O7DaZR7qfp4YqNx26KRvQ/qx0BAA
0.0.PRE: Performing Proof Simplification...
0.0.N: clocks: 1, declared: 1, looping: 0, posedge: 1, negedge: 0, noedge: 0, bothedge: 0
0.0.N: Proof Simplification Iteration 1	[0.00 s]
0.0.PRE: A proof was found: No trace exists. [0.00 s]
INFO (IPF057): 0.0.PRE: The property ":noDeadEnd" was proven in 0.00 s.
    Use check_assumptions -show -dead_end to show this property in the property table.
0.0.PRE: A proof was found: No trace exists. [0.00 s]
INFO (IPF057): 0.0.PRE: The property ":noConflict" was proven in 0.00 s.
    Use check_assumptions -show to show this property in the property table.
INFO (IPF047): 0.0.PRE: The cover property ":live" was covered in 1 cycles in 0.00 s.
    Use check_assumptions -show -live to show this property in the property table.
0.0.PRE: Proof Simplification completed in 0.00 s
0: About to start ProofGrid in its own thread with a limit of 10000 pending notifications and a limit of 10 traces.
0: =============================== ProofGrid start ===============================
0: ProofGrid usable level: 1
0: Initial ProofGrid level: 1
0: ProofGrid is starting event handling
0.0.Hp: Proofgrid shell started at 19540@vlsi-ria85(local) jg_19326_vlsi-ria85_1
0.0.N: Proofgrid shell started at 19539@vlsi-ria85(local) jg_19326_vlsi-ria85_1
0.0.Hp: clocks: 1, declared: 1, looping: 0, posedge: 1, negedge: 0, noedge: 0, bothedge: 0
0.0.Hp: Last scan. Per property time limit: 0s
0.0.Hp: Trace Attempt  1	[0.00 s]
0.0.Hp: Trace Attempt  2	[0.00 s]
0.0.Hp: Trace Attempt  3	[0.00 s]
0.0.N: clocks: 1, declared: 1, looping: 0, posedge: 1, negedge: 0, noedge: 0, bothedge: 0
0.0.N: Last scan. Per property time limit: 0s
0.0.N: Starting proof for property "VGA.p1"	[0.00 s].
0.0.N: Trace Attempt  1	[0.00 s]
0.0.N: Trace Attempt  2	[0.00 s]
0.0.N: Trace Attempt  2	[0.00 s]
0.0.Hp: Trace Attempt  4	[0.00 s]
0.0.Hp: Trace Attempt  5	[0.00 s]
0.0.N: Trace Attempt  3	[0.00 s]
0.0.N: Trace Attempt  4	[0.00 s]
0.0.N: Trace Attempt  4	[0.00 s]
0.0.N: Trace Attempt  5	[0.00 s]
0.0.N: Trace Attempt  1	[0.01 s]
0.0.N: Trace Attempt  2	[0.01 s]
0.0.N: Trace Attempt  3	[0.01 s]
0.0.N: Trace Attempt  4	[0.01 s]
0.0.N: Trace Attempt  5	[0.01 s]
0.0.AM: Proofgrid shell started at 19608@vlsi-ria85(local) jg_19326_vlsi-ria85_1
0.0.AM: clocks: 1, declared: 1, looping: 0, posedge: 1, negedge: 0, noedge: 0, bothedge: 0
0.0.AM: Last scan. Per property time limit: 0s
0.0.AM: Starting proof for property "VGA.p1"	[0.00 s].
0.0.AM: Trace Attempt  1	[0.00 s]
0.0.AM: Trace Attempt  2	[0.00 s]
0.0.AM: Trace Attempt  3	[0.00 s]
0.0.AM: Trace Attempt  4	[0.00 s]
0.0.B: Proofgrid shell started at 19607@vlsi-ria85(local) jg_19326_vlsi-ria85_1
0.0.Ht: Proofgrid shell started at 19604@vlsi-ria85(local) jg_19326_vlsi-ria85_1
0.0.AM: Trace Attempt  5	[0.00 s]
0.0.B: clocks: 1, declared: 1, looping: 0, posedge: 1, negedge: 0, noedge: 0, bothedge: 0
0.0.Ht: clocks: 1, declared: 1, looping: 0, posedge: 1, negedge: 0, noedge: 0, bothedge: 0
0.0.B: Last scan. Per property time limit: 0s
0.0.B: Starting proof for property "VGA.p1"	[0.00 s].
0.0.AM: Trace Attempt  1	[0.00 s]
0.0.AM: Trace Attempt  2	[0.00 s]
0.0.AM: Trace Attempt  3	[0.00 s]
0.0.AM: Trace Attempt  4	[0.00 s]
0.0.AM: Trace Attempt  5	[0.01 s]
0.0.Ht: Last scan. Per property time limit: 0s
0.0.Ht: Trace Attempt  1	[0.00 s]
0.0.Ht: Trace Attempt  2	[0.00 s]
0.0.Ht: Trace Attempt  3	[0.00 s]
0.0.Ht: Trace Attempt  4	[0.00 s]
0.0.Ht: Trace Attempt  5	[0.00 s]
0.0.B: Trace Attempt  1	[0.00 s]
0.0.B: Trace Attempt  2	[0.00 s]
0.0.B: Trace Attempt  3	[0.00 s]
0.0.B: Trace Attempt  4	[0.00 s]
0.0.B: Trace Attempt  5	[0.00 s]
0.0.AM: Trace Attempt  1	[0.01 s]
0.0.AM: Trace Attempt  2	[0.01 s]
0.0.AM: Trace Attempt  3	[0.01 s]
0.0.AM: Trace Attempt  4	[0.01 s]
0.0.AM: Trace Attempt  5	[0.01 s]
0.0.AM: Trace Attempt  1	[0.04 s]
0.0.AM: Trace Attempt  2	[0.04 s]
0.0.AM: Trace Attempt  3	[0.04 s]
0.0.Oh: Proofgrid shell started at 19605@vlsi-ria85(local) jg_19326_vlsi-ria85_1
0.0.AM: Trace Attempt  4	[0.04 s]
0.0.AM: Trace Attempt  5	[0.04 s]
0.0.Oh: clocks: 1, declared: 1, looping: 0, posedge: 1, negedge: 0, noedge: 0, bothedge: 0
0.0.Oh: Reached length limit (2147483647) [0.01 s]
0.0.Oh: Exited with Success (@ 0.09 s)
0.0.Oh: Completed, Restart ignored.
0.0.N: Trace Attempt  1	[0.11 s]
0.0.N: Trace Attempt  2	[0.11 s]
0.0.N: Trace Attempt  3	[0.11 s]
0.0.N: Trace Attempt  4	[0.11 s]
0.0.N: Trace Attempt  5	[0.11 s]
0.0.AM: Trace Attempt  1	[0.12 s]
0.0.AM: Trace Attempt  2	[0.12 s]
0.0.AM: Trace Attempt  3	[0.12 s]
0.0.AM: Trace Attempt  4	[0.13 s]
0.0.AM: Trace Attempt  5	[0.13 s]
0.0.AM: Trace Attempt  1	[0.26 s]
0.0.AM: Trace Attempt  2	[0.26 s]
0.0.AM: Trace Attempt  3	[0.26 s]
0.0.AM: Trace Attempt  4	[0.26 s]
0.0.AM: Trace Attempt  5	[0.26 s]
0.0.N: Trace Attempt  1	[0.30 s]
0.0.N: Trace Attempt  2	[0.30 s]
0.0.N: Trace Attempt  3	[0.30 s]
0.0.N: Trace Attempt  4	[0.30 s]
0.0.N: Trace Attempt  5	[0.30 s]
0.0.AM: Trace Attempt  1	[0.65 s]
0.0.AM: Trace Attempt  2	[0.66 s]
0.0.AM: Trace Attempt  3	[0.66 s]
0.0.AM: Trace Attempt  4	[0.66 s]
0.0.AM: Trace Attempt  5	[0.66 s]
0.0.N: Trace Attempt  1	[0.74 s]
0.0.N: Trace Attempt  2	[0.74 s]
0.0.N: Trace Attempt  3	[0.75 s]
0.0.N: Trace Attempt  4	[0.75 s]
0.0.N: Trace Attempt  5	[0.75 s]
0.0.N: Trace Attempt  1	[1.19 s]
0.0.N: Trace Attempt  2	[1.19 s]
0.0.N: Trace Attempt  3	[1.19 s]
0.0.N: Trace Attempt  4	[1.19 s]
0.0.N: Trace Attempt  5	[1.19 s]
0.0.N: Trace Attempt  1	[1.62 s]
0.0.N: Trace Attempt  2	[1.62 s]
0.0.N: Trace Attempt  3	[1.62 s]
0.0.N: Trace Attempt  4	[1.63 s]
0.0.N: Trace Attempt  5	[1.63 s]
0.0.N: Trace Attempt  1	[2.07 s]
0.0.N: Trace Attempt  2	[2.07 s]
0.0.N: Trace Attempt  3	[2.07 s]
0.0.N: Trace Attempt  4	[2.08 s]
0.0.N: Trace Attempt  5	[2.08 s]
0.0.AM: Trace Attempt  1	[2.37 s]
0.0.AM: Trace Attempt  2	[2.37 s]
0.0.AM: Trace Attempt  3	[2.37 s]
0.0.AM: Trace Attempt  4	[2.37 s]
0.0.AM: Trace Attempt  5	[2.37 s]
0.0.N: Trace Attempt  1	[2.45 s]
0.0.N: Trace Attempt  2	[2.45 s]
0.0.N: Trace Attempt  3	[2.45 s]
0.0.N: Trace Attempt  4	[2.45 s]
0.0.N: Trace Attempt  5	[2.45 s]
0.0.N: Trace Attempt  1	[3.79 s]
0.0.N: Trace Attempt  2	[3.79 s]
0.0.N: Trace Attempt  3	[3.79 s]
0.0.N: Trace Attempt  4	[3.79 s]
0.0.N: Trace Attempt  5	[3.79 s]
0.0.Hp: Trace Attempt 498	[4.01 s]
0.0.Ht: Trace Attempt 1837	[4.00 s]
0.0.B: Trace Attempt 1885	[4.00 s]
0.0.N: Trace Attempt  1	[5.28 s]
0.0.N: Trace Attempt  2	[5.28 s]
0.0.N: Trace Attempt  3	[5.28 s]
0.0.N: Trace Attempt  4	[5.29 s]
0.0.N: Trace Attempt  5	[5.29 s]
0.0.AM: Trace Attempt 298	[6.43 s]
0.0.N: Trace Attempt  1	[6.82 s]
0.0.N: Trace Attempt  2	[6.83 s]
0.0.N: Trace Attempt  3	[6.83 s]
0.0.N: Trace Attempt  4	[6.83 s]
0.0.N: Trace Attempt  5	[6.83 s]
0.0.Hp: Trace Attempt 699	[8.02 s]
0.0.B: Trace Attempt 2595	[8.00 s]
0.0.Ht: Trace Attempt 2466	[8.01 s]
0.0.N: Trace Attempt  1	[8.10 s]
0.0.N: Trace Attempt  2	[8.10 s]
0.0.N: Trace Attempt  3	[8.10 s]
0.0.N: Trace Attempt  4	[8.11 s]
0.0.N: Trace Attempt  5	[8.11 s]
0.0.AM: Trace Attempt  1	[8.86 s]
0.0.AM: Trace Attempt  2	[8.86 s]
0.0.AM: Trace Attempt  3	[8.86 s]
0.0.AM: Trace Attempt  4	[8.86 s]
0.0.AM: Trace Attempt  5	[8.86 s]
0.0.N: Trace Attempt  1	[9.37 s]
0.0.N: Trace Attempt  2	[9.37 s]
0.0.N: Trace Attempt  3	[9.37 s]
0.0.N: Trace Attempt  4	[9.37 s]
0.0.N: Trace Attempt  5	[9.37 s]
0.0.N: Trace Attempt  1	[10.62 s]
0.0.N: Trace Attempt  2	[10.62 s]
0.0.N: Trace Attempt  3	[10.62 s]
0.0.N: Trace Attempt  4	[10.62 s]
0.0.N: Trace Attempt  5	[10.62 s]
0.0.N: Trace Attempt  1	[11.87 s]
0.0.N: Trace Attempt  2	[11.87 s]
0.0.N: Trace Attempt  3	[11.87 s]
0.0.N: Trace Attempt  4	[11.87 s]
0.0.N: Trace Attempt  5	[11.87 s]
0.0.Hp: Trace Attempt 859	[12.04 s]
0.0.B: Trace Attempt 3175	[12.01 s]
0.0.Ht: Trace Attempt 2971	[12.01 s]
0.0.AM: Trace Attempt 339	[12.89 s]
0.0.N: Trace Attempt  1	[13.12 s]
0.0.N: Trace Attempt  2	[13.12 s]
0.0.N: Trace Attempt  3	[13.12 s]
0.0.N: Trace Attempt  4	[13.12 s]
0.0.N: Trace Attempt  5	[13.12 s]
0.0.N: Trace Attempt  1	[14.37 s]
0.0.N: Trace Attempt  2	[14.37 s]
0.0.N: Trace Attempt  3	[14.37 s]
0.0.N: Trace Attempt  4	[14.37 s]
0.0.N: Trace Attempt  5	[14.37 s]
0.0.N: Trace Attempt  1	[15.62 s]
0.0.N: Trace Attempt  2	[15.62 s]
0.0.N: Trace Attempt  3	[15.62 s]
0.0.N: Trace Attempt  4	[15.62 s]
0.0.N: Trace Attempt  5	[15.62 s]
0.0.B: Trace Attempt 3660	[16.00 s]
0.0.Hp: Trace Attempt 994	[16.04 s]
0.0.Ht: Trace Attempt 3397	[16.01 s]
0.0.N: Trace Attempt  1	[16.87 s]
0.0.N: Trace Attempt  2	[16.87 s]
0.0.N: Trace Attempt  3	[16.87 s]
0.0.N: Trace Attempt  4	[16.87 s]
0.0.N: Trace Attempt  5	[16.87 s]
0.0.AM: Trace Attempt 411	[16.98 s]
0.0.N: Trace Attempt  1	[18.27 s]
0.0.N: Trace Attempt  2	[18.27 s]
0.0.N: Trace Attempt  3	[18.27 s]
0.0.N: Trace Attempt  4	[18.27 s]
0.0.N: Trace Attempt  5	[18.27 s]
0.0.B: Trace Attempt 4083	[20.01 s]
0.0.Ht: Trace Attempt 3776	[20.02 s]
0.0.Hp: Trace Attempt 1111	[20.06 s]
0.0.AM: Trace Attempt 529	[20.99 s]
0.0.N: Trace Attempt  1	[21.33 s]
0.0.N: Trace Attempt  2	[21.33 s]
0.0.N: Trace Attempt  3	[21.33 s]
0.0.N: Trace Attempt  4	[21.33 s]
0.0.N: Trace Attempt  5	[21.33 s]
0.0.B: Trace Attempt 4454	[24.01 s]
0.0.Ht: Trace Attempt 4103	[24.03 s]
0.0.Hp: Trace Attempt 1214	[24.07 s]
0.0.N: Trace Attempt  1	[24.81 s]
0.0.N: Trace Attempt  2	[24.81 s]
0.0.N: Trace Attempt  3	[24.81 s]
0.0.N: Trace Attempt  4	[24.81 s]
0.0.N: Trace Attempt  5	[24.81 s]
0.0.AM: Trace Attempt 578	[25.19 s]
0.0.B: Trace Attempt 4783	[28.01 s]
0.0.Ht: Trace Attempt 4384	[28.03 s]
0.0.Hp: Trace Attempt 1306	[28.09 s]
0.0.N: Trace Attempt  1	[28.12 s]
0.0.N: Trace Attempt  2	[28.12 s]
0.0.N: Trace Attempt  3	[28.12 s]
0.0.N: Trace Attempt  4	[28.12 s]
0.0.N: Trace Attempt  5	[28.12 s]
0.0.AM: Trace Attempt 434	[29.20 s]
0.0.N: Trace Attempt  1	[31.35 s]
0.0.N: Trace Attempt  2	[31.35 s]
0.0.N: Trace Attempt  3	[31.35 s]
0.0.N: Trace Attempt  4	[31.36 s]
0.0.N: Trace Attempt  5	[31.36 s]
0.0.B: Trace Attempt 5072	[32.02 s]
0.0.Ht: Trace Attempt 4633	[32.05 s]
0.0.Hp: Trace Attempt 1388	[32.12 s]
0.0.N: Trace Attempt  1	[34.95 s]
0.0.N: Trace Attempt  2	[34.95 s]
0.0.N: Trace Attempt  3	[34.95 s]
0.0.N: Trace Attempt  4	[34.95 s]
0.0.N: Trace Attempt  5	[34.95 s]
0.0.AM: Trace Attempt 612	[35.12 s]
0.0.B: Trace Attempt 5356	[36.03 s]
0.0.Ht: Trace Attempt 4882	[36.06 s]
0.0.Hp: Trace Attempt 1469	[36.15 s]
0.0.AM: Trace Attempt  1	[37.79 s]
0.0.AM: Trace Attempt  2	[37.79 s]
0.0.AM: Trace Attempt  3	[37.79 s]
0.0.AM: Trace Attempt  4	[37.79 s]
0.0.AM: Trace Attempt  5	[37.80 s]
0.0.N: Trace Attempt  1	[38.73 s]
0.0.N: Trace Attempt  2	[38.74 s]
0.0.N: Trace Attempt  3	[38.74 s]
0.0.N: Trace Attempt  4	[38.74 s]
0.0.N: Trace Attempt  5	[38.74 s]
0.0.B: Trace Attempt 5638	[40.04 s]
0.0.Ht: Trace Attempt 5131	[40.07 s]
0.0.Hp: Trace Attempt 1548	[40.19 s]
0.0.AM: Trace Attempt 318	[41.82 s]
0.0.N: Trace Attempt  1	[42.29 s]
0.0.N: Trace Attempt  2	[42.29 s]
0.0.N: Trace Attempt  3	[42.29 s]
0.0.N: Trace Attempt  4	[42.29 s]
0.0.N: Trace Attempt  5	[42.29 s]
0.0.B: Trace Attempt 5922	[44.05 s]
0.0.Ht: Trace Attempt 5374	[44.08 s]
0.0.Hp: Trace Attempt 1626	[44.20 s]
0.0.N: Trace Attempt  1	[45.42 s]
0.0.N: Trace Attempt  2	[45.42 s]
0.0.N: Trace Attempt  3	[45.42 s]
0.0.N: Trace Attempt  4	[45.42 s]
0.0.N: Trace Attempt  5	[45.42 s]
0.0.AM: Trace Attempt 410	[45.87 s]
0.0.B: Trace Attempt 6191	[48.06 s]
0.0.Ht: Trace Attempt 5607	[48.08 s]
0.0.Hp: Trace Attempt 1700	[48.22 s]
0.0.N: Trace Attempt  1	[49.02 s]
0.0.N: Trace Attempt  2	[49.02 s]
0.0.N: Trace Attempt  3	[49.02 s]
0.0.N: Trace Attempt  4	[49.02 s]
0.0.N: Trace Attempt  5	[49.02 s]
0.0.AM: Trace Attempt 473	[49.93 s]
0.0.B: Trace Attempt 6447	[52.07 s]
0.0.Ht: Trace Attempt 5825	[52.09 s]
0.0.Hp: Trace Attempt 1770	[52.25 s]
0.0.N: Trace Attempt  1	[52.57 s]
0.0.N: Trace Attempt  2	[52.57 s]
0.0.N: Trace Attempt  3	[52.57 s]
0.0.N: Trace Attempt  4	[52.57 s]
0.0.N: Trace Attempt  5	[52.58 s]
0.0.AM: Trace Attempt 558	[53.94 s]
0.0.B: Trace Attempt 6687	[56.08 s]
0.0.Ht: Trace Attempt 6039	[56.09 s]
0.0.N: Trace Attempt  1	[56.20 s]
0.0.N: Trace Attempt  2	[56.20 s]
0.0.N: Trace Attempt  3	[56.20 s]
0.0.N: Trace Attempt  4	[56.20 s]
0.0.N: Trace Attempt  5	[56.21 s]
0.0.Hp: Trace Attempt 1837	[56.28 s]
0.0.AM: Trace Attempt 591	[58.00 s]
0.0.N: Trace Attempt  1	[59.90 s]
0.0.N: Trace Attempt  2	[59.90 s]
0.0.N: Trace Attempt  3	[59.90 s]
0.0.N: Trace Attempt  4	[59.90 s]
0.0.N: Trace Attempt  5	[59.90 s]
0.0.B: Trace Attempt 6916	[60.09 s]
0.0.Ht: Trace Attempt 6254	[60.10 s]
0.0.Hp: Trace Attempt 1902	[60.32 s]
0.0.AM: Trace Attempt 624	[62.03 s]
0.0.N: Trace Attempt  1	[63.51 s]
0.0.N: Trace Attempt  2	[63.52 s]
0.0.N: Trace Attempt  3	[63.52 s]
0.0.N: Trace Attempt  4	[63.52 s]
0.0.N: Trace Attempt  5	[63.52 s]
0.0.B: Trace Attempt 7137	[64.10 s]
0.0.Ht: Trace Attempt 6461	[64.11 s]
0.0.Hp: Trace Attempt 1965	[64.34 s]
0.0.AM: Trace Attempt 659	[66.09 s]
0.0.N: Trace Attempt  1	[67.06 s]
0.0.N: Trace Attempt  2	[67.06 s]
0.0.N: Trace Attempt  3	[67.06 s]
0.0.N: Trace Attempt  4	[67.06 s]
0.0.N: Trace Attempt  5	[67.06 s]
0.0.B: Trace Attempt 7353	[68.11 s]
0.0.Ht: Trace Attempt 6656	[68.11 s]
0.0.Hp: Trace Attempt 2026	[68.35 s]
0.0.AM: Trace Attempt 681	[70.53 s]
0.0.N: Trace Attempt  1	[70.63 s]
0.0.N: Trace Attempt  2	[70.63 s]
0.0.N: Trace Attempt  3	[70.63 s]
0.0.N: Trace Attempt  4	[70.63 s]
0.0.N: Trace Attempt  5	[70.63 s]
0.0.B: Trace Attempt 7566	[72.11 s]
0.0.Ht: Trace Attempt 6835	[72.13 s]
0.0.Hp: Trace Attempt 2085	[72.36 s]
0.0.N: Trace Attempt  1	[74.29 s]
0.0.N: Trace Attempt  2	[74.29 s]
0.0.N: Trace Attempt  3	[74.29 s]
0.0.N: Trace Attempt  4	[74.29 s]
0.0.N: Trace Attempt  5	[74.30 s]
0.0.AM: Trace Attempt 698	[74.74 s]
0.0.B: Trace Attempt 7774	[76.12 s]
0.0.Ht: Trace Attempt 7008	[76.14 s]
0.0.Hp: Trace Attempt 2142	[76.36 s]
0.0.N: Trace Attempt  1	[78.25 s]
0.0.N: Trace Attempt  2	[78.26 s]
0.0.N: Trace Attempt  3	[78.26 s]
0.0.N: Trace Attempt  4	[78.26 s]
0.0.N: Trace Attempt  5	[78.26 s]
0.0.AM: Trace Attempt 718	[78.98 s]
0.0.B: Trace Attempt 7971	[80.14 s]
0.0.Ht: Trace Attempt 7177	[80.15 s]
0.0.Hp: Trace Attempt 2198	[80.42 s]
0.0.N: Trace Attempt 337	[82.30 s]
0.0.AM: Trace Attempt 736	[83.19 s]
0.0.B: Trace Attempt 8144	[84.15 s]
0.0.Ht: Trace Attempt 7337	[84.16 s]
0.0.Hp: Trace Attempt 2249	[84.46 s]
0.0.N: Trace Attempt 418	[86.31 s]
0.0.AM: Trace Attempt 757	[87.24 s]
0.0.B: Trace Attempt 8334	[88.17 s]
0.0.Ht: Trace Attempt 7506	[88.18 s]
0.0.Hp: Trace Attempt 2303	[88.52 s]
0.0.N: Trace Attempt 483	[90.39 s]
0.0.AM: Trace Attempt 779	[91.31 s]
0.0.B: Trace Attempt 8516	[92.19 s]
0.0.Ht: Trace Attempt 7673	[92.20 s]
0.0.Hp: Trace Attempt 2354	[92.53 s]
0.0.N: Trace Attempt 535	[94.48 s]
0.0.AM: Trace Attempt 803	[95.34 s]
0.0.B: Trace Attempt 8694	[96.21 s]
0.0.Ht: Trace Attempt 7834	[96.22 s]
0.0.Hp: Trace Attempt 2405	[96.61 s]
0.0.N: Trace Attempt 586	[98.58 s]
0.0.AM: Trace Attempt 814	[99.46 s]
0.0.B: Trace Attempt 8866	[100.23 s]
0.0.Ht: Trace Attempt 7985	[100.23 s]
0.0.Hp: Trace Attempt 2454	[100.66 s]
0.0.N: Trace Attempt 598	[103.03 s]
0.0.Ht: Trace Attempt 8132	[104.23 s]
0.0.B: Trace Attempt 9035	[104.24 s]
0.0.AM: Trace Attempt 829	[104.32 s]
0.0.Hp: Trace Attempt 2502	[104.71 s]
0.0.Ht: Trace Attempt 8270	[108.24 s]
0.0.B: Trace Attempt 9194	[108.25 s]
0.0.AM: Trace Attempt 866	[108.33 s]
0.0.Hp: Trace Attempt 2547	[108.72 s]
0.0.N: Trace Attempt 608	[108.73 s]
0.0.N: Trace Attempt  1	[108.76 s]
0.0.N: Trace Attempt  2	[108.76 s]
0.0.N: Trace Attempt  3	[108.76 s]
0.0.N: Trace Attempt  4	[108.77 s]
0.0.N: Trace Attempt  5	[108.77 s]
0.0.Ht: Trace Attempt 8413	[112.25 s]
0.0.B: Trace Attempt 9360	[112.27 s]
0.0.AM: Trace Attempt 897	[112.43 s]
0.0.Hp: Trace Attempt 2594	[112.78 s]
0.0.N: Trace Attempt 344	[112.78 s]
0.0.Ht: Trace Attempt 8556	[116.27 s]
0.0.B: Trace Attempt 9526	[116.28 s]
0.0.AM: Trace Attempt 925	[116.53 s]
0.0.Hp: Trace Attempt 2640	[116.81 s]
0.0.N: Trace Attempt 426	[116.92 s]
0.0.Ht: Trace Attempt 8699	[120.29 s]
0.0.B: Trace Attempt 9689	[120.30 s]
0.0.AM: Trace Attempt 945	[120.58 s]
0.0.Hp: Trace Attempt 2685	[120.88 s]
0.0.N: Trace Attempt 496	[120.97 s]
0.0.Ht: Trace Attempt 8839	[124.31 s]
0.0.B: Trace Attempt 9848	[124.33 s]
0.0.AM: Trace Attempt 967	[124.79 s]
0.0.Hp: Trace Attempt 2729	[124.95 s]
0.0.N: Trace Attempt 540	[125.08 s]
0.0.Ht: Trace Attempt 8980	[128.33 s]
0.0.B: Trace Attempt 10003	[128.35 s]
0.0.Hp: Trace Attempt 2772	[128.97 s]
0.0.N: Trace Attempt 589	[129.13 s]
0.0.AM: Trace Attempt 970	[132.18 s]
0.0.Ht: Trace Attempt 9116	[132.35 s]
0.0.B: Trace Attempt 10152	[132.36 s]
0.0.Hp: Trace Attempt 2815	[133.06 s]
0.0.N: Trace Attempt 599	[133.20 s]
0.0.B: Trace Attempt 10299	[136.38 s]
0.0.Ht: Trace Attempt 9251	[136.39 s]
0.0.AM: Trace Attempt 996	[136.41 s]
0.0.Hp: Trace Attempt 2856	[137.08 s]
0.0.N: Trace Attempt 609	[140.41 s]
0.0.N: Trace Attempt  1	[140.43 s]
0.0.B: Trace Attempt 10433	[140.40 s]
0.0.N: Trace Attempt  2	[140.43 s]
0.0.N: Trace Attempt  3	[140.43 s]
0.0.N: Trace Attempt  4	[140.44 s]
0.0.N: Trace Attempt  5	[140.44 s]
0.0.Ht: Trace Attempt 9365	[140.41 s]
0.0.AM: Trace Attempt 1014	[140.49 s]
0.0.Hp: Trace Attempt 2895	[141.12 s]
0.0.B: Trace Attempt 10580	[144.40 s]
0.0.N: Trace Attempt 340	[144.46 s]
0.0.Ht: Trace Attempt 9491	[144.44 s]
0.0.AM: Trace Attempt 1026	[144.60 s]
0.0.Hp: Trace Attempt 2936	[145.18 s]
0.0.B: Trace Attempt 10725	[148.42 s]
0.0.N: Trace Attempt 430	[148.48 s]
0.0.Ht: Trace Attempt 9614	[148.45 s]
0.0.Hp: Trace Attempt 2976	[149.18 s]
0.0.AM: Trace Attempt 1032	[151.16 s]
0.0.B: Trace Attempt 10868	[152.42 s]
0.0.Ht: Trace Attempt 9734	[152.46 s]
0.0.N: Trace Attempt 504	[152.53 s]
0.0.Hp: Trace Attempt 3015	[153.23 s]
0.0.AM: Trace Attempt 1041	[155.38 s]
0.0.B: Trace Attempt 11009	[156.44 s]
0.0.Ht: Trace Attempt 9855	[156.49 s]
0.0.N: Trace Attempt 560	[156.60 s]
0.0.Hp: Trace Attempt 3054	[157.27 s]
0.0.AM: Trace Attempt 1048	[159.60 s]
0.0.B: Trace Attempt 11149	[160.47 s]
0.0.Ht: Trace Attempt 9977	[160.52 s]
0.0.N: Trace Attempt 595	[160.77 s]
0.0.Hp: Trace Attempt 3092	[161.28 s]
0.0.AM: Trace Attempt 1055	[163.84 s]
0.0.B: Trace Attempt 11287	[164.48 s]
0.0.Ht: Trace Attempt 10098	[164.53 s]
0.0.N: Trace Attempt 599	[165.05 s]
0.0.Hp: Trace Attempt 3130	[165.29 s]
0.0.AM: Trace Attempt 1058	[168.16 s]
0.0.B: Trace Attempt 11411	[168.49 s]
0.0.Ht: Trace Attempt 10213	[168.57 s]
0.0.N: Trace Attempt 610	[169.30 s]
0.0.Hp: Trace Attempt 3165	[169.33 s]
0.0.N: Trace Attempt  1	[169.33 s]
0.0.N: Trace Attempt  2	[169.33 s]
0.0.N: Trace Attempt  3	[169.33 s]
0.0.N: Trace Attempt  4	[169.33 s]
0.0.N: Trace Attempt  5	[169.33 s]
0.0.AM: Trace Attempt 1067	[172.46 s]
0.0.B: Trace Attempt 11545	[172.51 s]
0.0.Ht: Trace Attempt 10332	[172.59 s]
0.0.Hp: Trace Attempt 3202	[173.34 s]
0.0.N: Trace Attempt 343	[173.35 s]
0.0.B: Trace Attempt 11679	[176.53 s]
0.0.AM: Trace Attempt 1073	[176.53 s]
0.0.Ht: Trace Attempt 10450	[176.61 s]
0.0.N: Trace Attempt 425	[177.36 s]
0.0.Hp: Trace Attempt 3239	[177.39 s]
0.0.B: Trace Attempt 11812	[180.53 s]
0.0.Ht: Trace Attempt 10567	[180.62 s]
0.0.N: Trace Attempt 480	[180.95 s]
0.0.N: Stopped processing property "VGA.p1"	[181.02 s].
0.0.N: Morphing to Ncustom1
0.0.N: All properties determined. [0.00 s]
0.0.N: Exited with Success (@ 0.00 s)
0.0.Ncustom1: clocks: 1, declared: 1, looping: 0, posedge: 1, negedge: 0, noedge: 0, bothedge: 0
0.0.Ncustom1: Starting proof for property "VGA.p1"	[0.00 s].
0.0.Tri: Proofgrid shell started at 24323@vlsi-ria85(local) jg_19326_vlsi-ria85_1
0.0.Tri: clocks: 1, declared: 1, looping: 0, posedge: 1, negedge: 0, noedge: 0, bothedge: 0
0.0.Ncustom1: Trace Attempt 609	[0.07 s]
0.0.Tri: Last scan. Per property time limit: 0s
0.0.Tri: Starting proof for property "VGA.p1"	[0.00 s].
0.0.Tri: Trace Attempt  1	[0.00 s]
0.0.B: Trace Attempt 11826	[180.95 s]
0.0.B: Stopped processing property "VGA.p1"	[181.07 s].
0.0.B: Morphing to Bcustom2
0.0.B: All properties determined. [0.00 s]
0.0.B: Exited with Success (@ 0.00 s)
0.0.Bcustom2: clocks: 1, declared: 1, looping: 0, posedge: 1, negedge: 0, noedge: 0, bothedge: 0
0.0.Bcustom2: Starting proof for property "VGA.p1"	[0.00 s].
0.0.Bcustom2: Trace Attempt  1	[0.00 s]
0.0.Bcustom2: Trace Attempt  2	[0.00 s]
0.0.Bcustom2: Trace Attempt  1	[0.00 s]
0.0.Bcustom2: Trace Attempt  2	[0.00 s]
0.0.Bcustom2: Trace Attempt  3	[0.00 s]
0.0.Bcustom2: Trace Attempt  4	[0.00 s]
0.0.Bcustom2: Trace Attempt  5	[0.00 s]
0.0.Bcustom2: Trace Attempt  1	[0.02 s]
0.0.Bcustom2: Trace Attempt  2	[0.02 s]
0.0.Bcustom2: Trace Attempt  3	[0.02 s]
0.0.Bcustom2: Trace Attempt  4	[0.02 s]
0.0.Bcustom2: Trace Attempt  5	[0.02 s]
0.0.Tri:    0.00" ---- Launching main thread ----
0.0.Bcustom2: Trace Attempt  1	[0.05 s]
0.0.Bcustom2: Trace Attempt  2	[0.05 s]
0.0.Bcustom2: Trace Attempt  3	[0.05 s]
0.0.Bcustom2: Trace Attempt  4	[0.05 s]
0.0.Bcustom2: Trace Attempt  5	[0.05 s]
0.0.Tri:    0.04" ---- Launching abstraction thread ----
0.0.Tri:    0.05" ---- Launching multi-phase simplification thread ----
0.0.Tri:    0.07" ---- Launching liveness simplification thread ----
0.0.AM: Trace Attempt 1075	[177.79 s]
0.0.AM: Stopped processing property "VGA.p1"	[181.25 s].
0.0.AM: Morphing to AMcustom3
0.0.AM: All properties determined. [0.00 s]
0.0.AM: Exited with Success (@ 0.00 s)
0.0.AMcustom3: clocks: 1, declared: 1, looping: 0, posedge: 1, negedge: 0, noedge: 0, bothedge: 0
0.0.AMcustom3: Starting proof for property "VGA.p1"	[0.00 s].
0.0.AMcustom3: Trace Attempt  1	[0.00 s]
0.0.AMcustom3: Trace Attempt  2	[0.00 s]
0.0.AMcustom3: Trace Attempt  3	[0.00 s]
0.0.AMcustom3: Trace Attempt  4	[0.00 s]
0.0.AMcustom3: Trace Attempt  5	[0.00 s]
0.0.AMcustom3: Trace Attempt  1	[0.00 s]
0.0.AMcustom3: Trace Attempt  2	[0.00 s]
0.0.AMcustom3: Trace Attempt  3	[0.00 s]
0.0.AMcustom3: Trace Attempt  4	[0.00 s]
0.0.AMcustom3: Trace Attempt  5	[0.01 s]
0.0.AMcustom3: Trace Attempt  1	[0.01 s]
0.0.AMcustom3: Trace Attempt  2	[0.01 s]
0.0.AMcustom3: Trace Attempt  3	[0.01 s]
0.0.AMcustom3: Trace Attempt  4	[0.01 s]
0.0.AMcustom3: Trace Attempt  5	[0.01 s]
0.0.AMcustom3: Trace Attempt  1	[0.04 s]
0.0.AMcustom3: Trace Attempt  2	[0.04 s]
0.0.AMcustom3: Trace Attempt  3	[0.04 s]
0.0.AMcustom3: Trace Attempt  4	[0.04 s]
0.0.AMcustom3: Trace Attempt  5	[0.04 s]
0.0.Hp: Trace Attempt 3275	[181.44 s]
0.0.AMcustom3: Trace Attempt  1	[0.13 s]
0.0.AMcustom3: Trace Attempt  2	[0.14 s]
0.0.AMcustom3: Trace Attempt  3	[0.14 s]
0.0.AMcustom3: Trace Attempt  4	[0.14 s]
0.0.AMcustom3: Trace Attempt  5	[0.14 s]
0.0.AMcustom3: Trace Attempt  1	[0.28 s]
0.0.AMcustom3: Trace Attempt  2	[0.28 s]
0.0.AMcustom3: Trace Attempt  3	[0.28 s]
0.0.AMcustom3: Trace Attempt  4	[0.28 s]
0.0.AMcustom3: Trace Attempt  5	[0.28 s]
0.0.Tri:    0.87" Simplification phase 1 complete
0.0.AMcustom3: Trace Attempt  1	[0.70 s]
0.0.AMcustom3: Trace Attempt  2	[0.70 s]
0.0.AMcustom3: Trace Attempt  3	[0.71 s]
0.0.AMcustom3: Trace Attempt  4	[0.71 s]
0.0.AMcustom3: Trace Attempt  5	[0.71 s]
0.0.Ncustom1: Requesting engine job to terminate
0.0.Bcustom2: Requesting engine job to terminate
0.0.AMcustom3: Requesting engine job to terminate
0.0.Tri: Requesting engine job to terminate
0.0.Hp: Requesting engine job to terminate
0.0.Ht: Requesting engine job to terminate
INFO (IPF144): 0: Initiating shutdown of proof [182.06 s]
0.0.Tri: A proof was found: No trace exists. [0.96 s]
INFO (IPF057): 0.0.Tri: The property "VGA.p1" was proven in 0.97 s.
0.0.Ht: Trace Attempt 10596	[181.96 s]
0.0.Ht: All properties determined. [182.02 s]
0.0.AMcustom3: Trace Attempt 15	[0.73 s]
0.0.AMcustom3: Stopped processing property "VGA.p1"	[0.73 s].
0.0.AMcustom3: All properties determined. [0.73 s]
0.0.Hp: Trace Attempt 3280	[182.03 s]
0.0.Hp: All properties determined. [182.07 s]
0.0.Bcustom2: Trace Attempt 621	[0.95 s]
0.0.Bcustom2: Stopped processing property "VGA.p1"	[0.97 s].
0.0.Bcustom2: All properties determined. [0.97 s]
0.0.AMcustom3: Exited with Success (@ 182.08 s)
0: ProofGrid usable level: 0
0.0.Ncustom1: Stopped processing property "VGA.p1"	[1.04 s].
0.0.Ncustom1: All properties determined. [1.05 s]
0.0.Ncustom1: Exited with Success (@ 182.08 s)
0.0.Bcustom2: Exited with Success (@ 182.12 s)
0.0.Ht: Exited with Success (@ 182.16 s)
0.0.Tri: Stopped processing property "VGA.p1"	[1.13 s].
0.0.Tri: All properties determined. [1.13 s]
0.0.Tri: Exited with Success (@ 182.23 s)
0.0.Hp: Exited with Success (@ 182.30 s)
0: --------------------------------------------------------------
ProofGrid Summary (utilization 99.96 %)
--------------------------------------------------------------
     engines started                               :    10
     engine jobs started                           :     7

    Average time in state (seconds)
    ------------------------------------------------------
    Engine  Pending     Running        Dead    Utilization
    ------------------------------------------------------
     Hp        0.03      182.06        0.00       99.98 %
     Ht        0.04      182.02        0.00       99.98 %
     Oh        0.08        0.01        0.00        7.04 %
    Ncustom1        0.04      182.01        0.00       99.98 %
    Bcustom2        0.04      181.90        0.00       99.98 %
    AMcustom3        0.04      181.69        0.00       99.98 %
    Tri        0.07        0.97        0.00       93.20 %
    all        0.05      130.09        0.00       99.96 %

    Total time in state (seconds)
    -----------------------------------------
            Pending     Running        Dead  
    -----------------------------------------
               0.33      910.66        0.00

    Data read    : 12.56 MiB
    Data written : 4.40 kiB

0: All pending notifications were processed.
INFO (IPF059): 0: Completed proof on task: "<embedded>"

==============================================================
SUMMARY
==============================================================
           Properties Considered              : 1
                 assertions                   : 1
                  - proven                    : 1 (100%)
                  - bounded_proven (user)     : 0 (0%)
                  - bounded_proven (auto)     : 0 (0%)
                  - marked_proven             : 0 (0%)
                  - cex                       : 0 (0%)
                  - ar_cex                    : 0 (0%)
                  - undetermined              : 0 (0%)
                  - unknown                   : 0 (0%)
                  - error                     : 0 (0%)
                 covers                       : 0
                  - unreachable               : 0
                  - bounded_unreachable (user): 0
                  - covered                   : 0
                  - ar_covered                : 0
                  - undetermined              : 0
                  - unknown                   : 0
                  - error                     : 0
proven
[<embedded>] % exit -force
INFO (IPL005): Received request to exit from the console.
INFO: Waiting for proof threads to stop...
INFO: Proof threads stopped.
INFO (IPL018): The peak resident set memory use for this session was 1.909 GB.
INFO (IPL014): Waiting for the Tcl-thread to exit.
INFO (IPL015): The Tcl-thread exited with status 0.
INFO (IPL016): Exiting the analysis session with status 0.
