# ----------------------------------------
# Jasper Version Info
# tool      : Jasper 2024.06
# platform  : Linux 3.10.0-1160.62.1.el7.x86_64
# version   : 2024.06p002 64 bits
# build date: 2024.09.02 16:28:38 UTC
# ----------------------------------------
# started   : 2025-11-18 09:30:24 IST
# hostname  : vlsi-ria84.vlsidomain
# pid       : 12177
# arguments : '-label' 'session_0' '-console' '//127.0.0.1:44994' '-nowindow' '-style' 'windows' '-exitonerror' '-data' 'AAAAxnicY2RgYLCp////PwMYMD6A0Aw2jAyoAMRnQhUJbEChGRhYYZphSliAmItBl6GAoYghnyELyNNg0ANCfSA7HS6aypDMUMJQDBQtA4omMsQzGDIYANXyAHUmAfklQPkMIF8ERV4PLJ4DtgcAl90Vjw==' '-proj' '/users/rompel/jasper_executions/safety_liveness/jgprojects/vga_10/sessionLogs/session_0' '-init' '-hidden' '/users/rompel/jasper_executions/safety_liveness/jgprojects/vga_10/.tmp/.initCmds.tcl' 'vga_10.tcl' '-hidden' '/users/rompel/jasper_executions/safety_liveness/jgprojects/vga_10/.tmp/.postCmds.tcl'

Any disclosure about the Cadence Design Systems software or its use
model to any third party violates the written Non-Disclosure Agreement
between Cadence Design Systems, Inc. and the customer.

THIS SOFTWARE CONTAINS CONFIDENTIAL INFORMATION AND TRADE SECRETS OF
CADENCE DESIGN SYSTEMS, INC. USE, DISCLOSURE, OR REPRODUCTION IS
PROHIBITED WITHOUT THE PRIOR EXPRESS WRITTEN PERMISSION OF CADENCE
DESIGN SYSTEMS, INC.

Copyright (C) 2000-2024 Cadence Design Systems, Inc. All Rights
Reserved.  Unpublished -- rights reserved under the copyright laws of
the United States.

This product includes software developed by others and redistributed
according to license agreement. See doc/third_party_readme.txt for
further details.

RESTRICTED RIGHTS LEGEND

Use, duplication, or disclosure by the Government is subject to
restrictions as set forth in subparagraph (c) (1) (ii) of the Rights in
Technical Data and Computer Software clause at DFARS 252.227-7013 or
subparagraphs (c) (1) and (2) of Commercial Computer Software -- Restricted
Rights at 48 CFR 52.227-19, as applicable.


                          Cadence Design Systems, Inc.
                          2655 Seely Avenue
                          San Jose, CA 95134
                          Phone: 408.943.1234

For technical assistance visit http://support.cadence.com.

Jasper Apps Analysis Session - /users/rompel/jasper_executions/safety_liveness/jgprojects/vga_10/sessionLogs/session_0

WARNING (WG017): [session]: The system's locale is "ANSI_X3.4-1968", which is not UTF-8. Non-ASCII characters might not be handled correctly.
WARNING (WG017): [jg_console]: The system's locale is "ANSI_X3.4-1968", which is not UTF-8. Non-ASCII characters might not be handled correctly.
INFO: successfully checked out license "jasper_fao".
INFO: reading configuration file "/users/rompel/.config/cadence/jasper.conf".
% analyze -sv09 ../vga_10.sv
[-- (VERI-1482)] Analyzing Verilog file '/tools/cadence2425/JASPER/jasper_2024.06p002/lib/verilog/packages/std/std.sv' into library 'std'
[-- (VERI-1482)] Analyzing Verilog file '../vga_10.sv'
% elaborate -bbox_mul 1000000 -bbox_div 1000000 -bbox_mod 1000000 -bbox_a 1000000
[INFO (HIER-8002)] ../vga_10.sv(64): Disabling old hierarchical reference handler
[INFO (VERI-1018)] ../vga_10.sv(1): compiling module 'VGA'
[WARN (VERI-1209)] ../vga_10.sv(33): expression size 32 truncated to fit in target size 11
[WARN (VERI-1209)] ../vga_10.sv(37): expression size 32 truncated to fit in target size 9
[INFO (VERI-8005)] ../vga_10.sv(17): Unintentional sequential element inferred for h_cnt read before write using blocking assignment
[INFO (VERI-8005)] ../vga_10.sv(18): Unintentional sequential element inferred for v_cnt read before write using blocking assignment
[INFO (VERI-8005)] ../vga_10.sv(19): Unintentional sequential element inferred for h_sync read before write using blocking assignment
[INFO (VERI-8005)] ../vga_10.sv(20): Unintentional sequential element inferred for v_sync read before write using blocking assignment
[INFO (VERI-8005)] ../vga_10.sv(1): Unintentional sequential element inferred for disp_ena read before write using blocking assignment
[INFO (VERI-8005)] ../vga_10.sv(1): Unintentional sequential element inferred for col read before write using blocking assignment
[INFO (VERI-8005)] ../vga_10.sv(1): Unintentional sequential element inferred for row read before write using blocking assignment
INFO (ISW003): Top module name is "VGA".
INFO (INL208): Elaboration synthesis summary:
  Number of synthesized netlists          1 (0 packages)
  Single run mode                         On
  Pipeline                                On (1 pipelined netlists)
  Late hierarchical reference connection  On
  Number of analyzed Verilog modules      1 (1 synthesized)
  Number of analyzed VHDL entities        0 (0 synthesized)
INFO (INL003): Clearing all state information (assumes, stopats, and so forth).
VGA
[<embedded>] % reset rst
INFO (IPM031): Clearing proof results of all properties.
INFO (IRS006): Current reset condition is "rst".
[<embedded>] % clock clk
[<embedded>] % prove -all
Ncustom1: Custom engine code is hT3Ng7hPPfiYQOTDZ3qhYOwGAM51eA+J/FjkM5shLioAsqhgLR4Ft+O1BuKG6ilQ83B9tLXSl+CwjiTMAQA
Bcustom2: Custom engine code is hT3Nm7hPr1Vp3Di1Ra2USNIGL4JypRnLKLAdF6JAyuavO2JfGCiY9OZJhcAcOUnLx5xwNdhILGrAWX9s+z2WDkKwNR7tAfClBEjRFVQeq6DU54boFgEA
AMcustom3: Custom engine code is hT3Ng7hP/feYQOTDZ3qhYOwGAM51eA+J/FjkM5shLioAsqhgLR4Ft+O1BuKG6ilQ83B9tLXSmmqwm7g9AQA
Mpcustom4: Custom engine code is hT3NZbhP9fmY2AbBQnsjfOxn6c+6e6yL+/e8fZFmaQrnlgEA
INFO (IPF036): Starting proof on task: "<embedded>", 1 properties to prove with 0 already proven/unreachable
INFO (IRS029): Starting reset analysis: phase 1 of 4.
INFO (IRS030): Running reset analysis: phase 2 of 4.
INFO (IRS031): Running reset analysis: phase 3 of 4.
INFO (IRS020): Starting the reset analysis simulation with a limit of 100 iterations (phase 4 of 4).
INFO (IRS024): Reset iterations 0 to 4 analyzed.
INFO (IRS018): Reset analysis simulation executed for 3 iterations. Assigned values for 41 of 43 design flops, 0 of 0 design latches, 3 of 3 internal elements.
INFO (IRS039): Reset analysis complete.
INFO (IPF031): Settings used for proof thread 0:
    orchestration                 = on
    time_limit                    = 86400s
    per_property_time_limit       = 1s * 10 ^ scan
    engine_mode                   = auto
    proofgrid_per_engine_max_jobs = 1
    max engine jobs               = auto
    proofgrid_mode                = local
    proofgrid_restarts            = 10
0: Using multistage preprocessing
AMcustom5: Custom engine code is hT3N1rhP11/52HrFRS21ROp2LOjVTgPvT8L8BGXHgLhaIuqtT4nARFjUqrBL+7pLmaTOzBepZW/Jm8SSrHDybSQtoNiO3y43wk+dEoWlsZizu97Fih6O6lPVG/LpWP5SsUPwlGagLNa1FKEFvwVXyX7//8prySbvSxIHXr5er+z4RAEA
0: Starting reduce
Ncustom6: Custom engine code is hT3OXrhPByJp3TrFSTLhUmMH4KVtJgmTCnNDF46yMXOKY48m4LS5nE7yBzFjA7kDuwO/GhGUpEPiky3p3wmPn3dJZHxFMsafSoObRzSC+tn7sEY0WbTdZ/FV4hL3MYH/b1CIUvXSWR4wqEoVLsmMOD4xIPT4lI1LO6ZCO7PnnWQuLwetnvKlrXx6wCW/A+x+enqslg1YPobi4wEF/EvbzOvcTYdJvl2s4H2yZg2b2ofAVN5WvhWk1HoBAA
ADcustom7: Custom engine code is hT3Nv7hPv1752HrFRa2kROx2f/ECJeZB2AZsLdlO8VwmIuqtT4nIDFXclhg+O+o+DMmQCekbheGk0kK28laA9gaOFDXsQp29J3X615HY1IPHJWd6FUFvCHjO+p1k652b5JJvZlShNpGlGSXAiQe/mEAj6tEBAA
Tricustom8: Custom engine code is hT3Nu7hPt1752DvFRa0kNDiyIV97VyejwM9C/jCLJjdPvusZONHY42VYUy0Q1ZotnhcVtNc56tJ5wbxv6V2+XpdsaSlHck5vfnbYjdwj1OECy9U+7oSQ0SZE3g5ayD+Phuh4odCJTjeKa2k4elM9ldQfkAEA
Gcustom9: Custom engine code is hT3NibhPDfeYQADBZnYcglOvK9Pfd7EOeniIqP8jNsyIqInncipMGcUXqAadachREE9F2PwhBUZUNw5kHnd4JdXkamORRgEA
C2custom10: Custom engine code is hT3NirhPjfWYQADBZnYcglOvK9Pfd7EOeniIqP8jNsyIqInncgkrYMMXCYbdK0dUjZIF9d4cJ0rHoBDjwVLBKuG86XYVV00BAA
AGcustom11: Custom engine code is hT3NirhP/fmYQADBZnYcglOvK9Pfd7EOeniIqP8jNsyIqInnckcwYMMXCYbdK0dUjZIF9d4cJ0rHoBDjwVLBKuHEZnZByh0BAA
Bcustom12: Custom engine code is hT3NjrhPDfiYQADBZnYcglOvK9PfWxFtenjIyBqfrgr7if/jL/yPOuK1BAflEcW0DxNH2eDIoezN2gxlQFg81RZtiWXh7aiTAidvAQA
0: Finished reduce in 0s
Ncustom13: Custom engine code is hT3NR7hPByFp3TrFSTLhUmMH4KWtJglTyV/c51BHEeZWamnJv767nE6PCak26bd3gf3XGN3rIRheufhDieCJQVISo+gNYUKhiUedBKGtsP/a18svAnlMJZudHxDFwK5ufsyoxsIyiAeSY2oi3tEuoDHr5gw42DFKAG3PqO3CEsl8Azzdt3pl5nGA1Ifv2H02eYsFzWb/nfp8PMb3F0krE/EgBcm8TD9Div8BAA
Tricustom14: Custom engine code is hT3Nu7hP3fiYQADBZnYcglNHp9bfd7EOeniIqP/ji8sGLQu8yhsFO+wxJ+O+R0bU8g/IewXFomyos+viQnWc2xYNYmMqpo3i40O7DaZR7qfp4YqNx26KRvQ/qx0BAA
0.0.PRE: Performing Proof Simplification...
0.0.N: clocks: 1, declared: 1, looping: 0, posedge: 1, negedge: 0, noedge: 0, bothedge: 0
0.0.N: Proof Simplification Iteration 1	[0.00 s]
0.0.PRE: A proof was found: No trace exists. [0.00 s]
INFO (IPF057): 0.0.PRE: The property ":noDeadEnd" was proven in 0.00 s.
    Use check_assumptions -show -dead_end to show this property in the property table.
0.0.PRE: A proof was found: No trace exists. [0.00 s]
INFO (IPF057): 0.0.PRE: The property ":noConflict" was proven in 0.00 s.
    Use check_assumptions -show to show this property in the property table.
INFO (IPF047): 0.0.PRE: The cover property ":live" was covered in 1 cycles in 0.00 s.
    Use check_assumptions -show -live to show this property in the property table.
0.0.PRE: Proof Simplification completed in 0.00 s
0: About to start ProofGrid in its own thread with a limit of 10000 pending notifications and a limit of 10 traces.
0: =============================== ProofGrid start ===============================
0: ProofGrid usable level: 1
0: Initial ProofGrid level: 1
0: ProofGrid is starting event handling
0.0.N: Proofgrid shell started at 12242@vlsi-ria84(local) jg_12177_vlsi-ria84_1
0.0.Hp: Proofgrid shell started at 12243@vlsi-ria84(local) jg_12177_vlsi-ria84_1
0.0.Hp: clocks: 1, declared: 1, looping: 0, posedge: 1, negedge: 0, noedge: 0, bothedge: 0
0.0.Hp: Last scan. Per property time limit: 0s
0.0.Hp: Trace Attempt  1	[0.00 s]
0.0.N: clocks: 1, declared: 1, looping: 0, posedge: 1, negedge: 0, noedge: 0, bothedge: 0
0.0.Hp: Trace Attempt  2	[0.00 s]
0.0.Hp: Trace Attempt  3	[0.00 s]
0.0.Hp: Trace Attempt  4	[0.00 s]
0.0.Hp: Trace Attempt  5	[0.00 s]
0.0.N: Last scan. Per property time limit: 0s
0.0.N: Starting proof for property "VGA.p1"	[0.00 s].
0.0.N: Trace Attempt  1	[0.00 s]
0.0.N: Trace Attempt  2	[0.00 s]
0.0.N: Trace Attempt  2	[0.00 s]
0.0.N: Trace Attempt  3	[0.00 s]
0.0.N: Trace Attempt  4	[0.00 s]
0.0.N: Trace Attempt  4	[0.00 s]
0.0.N: Trace Attempt  5	[0.00 s]
0.0.N: Trace Attempt  1	[0.01 s]
0.0.N: Trace Attempt  2	[0.01 s]
0.0.N: Trace Attempt  3	[0.01 s]
0.0.N: Trace Attempt  4	[0.01 s]
0.0.N: Trace Attempt  5	[0.01 s]
0.0.Oh: Proofgrid shell started at 12275@vlsi-ria84(local) jg_12177_vlsi-ria84_1
0.0.Oh: clocks: 1, declared: 1, looping: 0, posedge: 1, negedge: 0, noedge: 0, bothedge: 0
0.0.Oh: Reached length limit (2147483647) [0.00 s]
0.0.Oh: Exited with Success (@ 0.03 s)
0.0.Oh: Completed, Restart ignored.
0.0.Ht: Proofgrid shell started at 12274@vlsi-ria84(local) jg_12177_vlsi-ria84_1
0.0.AM: Proofgrid shell started at 12277@vlsi-ria84(local) jg_12177_vlsi-ria84_1
0.0.Ht: clocks: 1, declared: 1, looping: 0, posedge: 1, negedge: 0, noedge: 0, bothedge: 0
0.0.Ht: Last scan. Per property time limit: 0s
0.0.Ht: Trace Attempt  1	[0.00 s]
0.0.Ht: Trace Attempt  2	[0.00 s]
0.0.AM: clocks: 1, declared: 1, looping: 0, posedge: 1, negedge: 0, noedge: 0, bothedge: 0
0.0.Ht: Trace Attempt  3	[0.00 s]
0.0.AM: Last scan. Per property time limit: 0s
0.0.AM: Starting proof for property "VGA.p1"	[0.00 s].
0.0.Ht: Trace Attempt  4	[0.00 s]
0.0.Ht: Trace Attempt  5	[0.00 s]
0.0.AM: Trace Attempt  1	[0.00 s]
0.0.AM: Trace Attempt  2	[0.00 s]
0.0.AM: Trace Attempt  3	[0.00 s]
0.0.AM: Trace Attempt  4	[0.00 s]
0.0.AM: Trace Attempt  5	[0.00 s]
0.0.AM: Trace Attempt  1	[0.00 s]
0.0.B: Proofgrid shell started at 12276@vlsi-ria84(local) jg_12177_vlsi-ria84_1
0.0.AM: Trace Attempt  2	[0.00 s]
0.0.AM: Trace Attempt  3	[0.00 s]
0.0.B: clocks: 1, declared: 1, looping: 0, posedge: 1, negedge: 0, noedge: 0, bothedge: 0
0.0.B: Last scan. Per property time limit: 0s
0.0.B: Starting proof for property "VGA.p1"	[0.00 s].
0.0.B: Trace Attempt  1	[0.00 s]
0.0.B: Trace Attempt  2	[0.00 s]
0.0.AM: Trace Attempt  4	[0.00 s]
0.0.B: Trace Attempt  3	[0.00 s]
0.0.AM: Trace Attempt  5	[0.00 s]
0.0.B: Trace Attempt  4	[0.00 s]
0.0.B: Trace Attempt  5	[0.00 s]
0.0.AM: Trace Attempt  1	[0.01 s]
0.0.AM: Trace Attempt  2	[0.01 s]
0.0.AM: Trace Attempt  3	[0.01 s]
0.0.AM: Trace Attempt  4	[0.02 s]
0.0.AM: Trace Attempt  5	[0.02 s]
0.0.N: Trace Attempt  1	[0.09 s]
0.0.N: Trace Attempt  2	[0.09 s]
0.0.N: Trace Attempt  3	[0.09 s]
0.0.N: Trace Attempt  4	[0.09 s]
0.0.N: Trace Attempt  5	[0.10 s]
0.0.AM: Trace Attempt  1	[0.08 s]
0.0.AM: Trace Attempt  2	[0.08 s]
0.0.AM: Trace Attempt  3	[0.08 s]
0.0.AM: Trace Attempt  4	[0.08 s]
0.0.AM: Trace Attempt  5	[0.08 s]
0.0.N: Trace Attempt  1	[0.23 s]
0.0.N: Trace Attempt  2	[0.24 s]
0.0.N: Trace Attempt  3	[0.24 s]
0.0.N: Trace Attempt  4	[0.24 s]
0.0.N: Trace Attempt  5	[0.24 s]
0.0.N: Trace Attempt  1	[0.62 s]
0.0.N: Trace Attempt  2	[0.62 s]
0.0.N: Trace Attempt  3	[0.62 s]
0.0.N: Trace Attempt  4	[0.62 s]
0.0.N: Trace Attempt  5	[0.62 s]
0.0.N: Trace Attempt  1	[1.00 s]
0.0.N: Trace Attempt  2	[1.00 s]
0.0.N: Trace Attempt  3	[1.00 s]
0.0.N: Trace Attempt  4	[1.00 s]
0.0.N: Trace Attempt  5	[1.00 s]
0.0.N: Trace Attempt  1	[1.38 s]
0.0.N: Trace Attempt  2	[1.38 s]
0.0.N: Trace Attempt  3	[1.38 s]
0.0.N: Trace Attempt  4	[1.38 s]
0.0.N: Trace Attempt  5	[1.38 s]
0.0.N: Trace Attempt  1	[1.76 s]
0.0.N: Trace Attempt  2	[1.76 s]
0.0.N: Trace Attempt  3	[1.76 s]
0.0.N: Trace Attempt  4	[1.76 s]
0.0.N: Trace Attempt  5	[1.76 s]
0.0.N: Trace Attempt  1	[2.14 s]
0.0.N: Trace Attempt  2	[2.14 s]
0.0.N: Trace Attempt  3	[2.14 s]
0.0.N: Trace Attempt  4	[2.14 s]
0.0.N: Trace Attempt  5	[2.15 s]
0.0.N: Trace Attempt  1	[2.56 s]
0.0.N: Trace Attempt  2	[2.56 s]
0.0.N: Trace Attempt  3	[2.56 s]
0.0.N: Trace Attempt  4	[2.56 s]
0.0.N: Trace Attempt  5	[2.56 s]
0.0.N: Trace Attempt  1	[3.71 s]
0.0.N: Trace Attempt  2	[3.72 s]
0.0.N: Trace Attempt  3	[3.72 s]
0.0.N: Trace Attempt  4	[3.72 s]
0.0.N: Trace Attempt  5	[3.72 s]
0.0.Hp: Trace Attempt 479	[4.02 s]
0.0.Ht: Trace Attempt 1959	[4.00 s]
0.0.B: Trace Attempt 1814	[4.00 s]
0.0.AM: Trace Attempt 414	[4.11 s]
0.0.N: Trace Attempt  1	[4.87 s]
0.0.N: Trace Attempt  2	[4.87 s]
0.0.N: Trace Attempt  3	[4.87 s]
0.0.N: Trace Attempt  4	[4.87 s]
0.0.N: Trace Attempt  5	[4.87 s]
0.0.N: Trace Attempt  1	[6.02 s]
0.0.N: Trace Attempt  2	[6.02 s]
0.0.N: Trace Attempt  3	[6.02 s]
0.0.N: Trace Attempt  4	[6.02 s]
0.0.N: Trace Attempt  5	[6.03 s]
0.0.N: Trace Attempt  1	[7.18 s]
0.0.N: Trace Attempt  2	[7.18 s]
0.0.N: Trace Attempt  3	[7.18 s]
0.0.N: Trace Attempt  4	[7.18 s]
0.0.N: Trace Attempt  5	[7.18 s]
0.0.Hp: Trace Attempt 585	[8.04 s]
0.0.Ht: Trace Attempt 2602	[8.00 s]
0.0.B: Trace Attempt 2525	[8.01 s]
0.0.N: Trace Attempt  1	[8.34 s]
0.0.N: Trace Attempt  2	[8.34 s]
0.0.N: Trace Attempt  3	[8.34 s]
0.0.N: Trace Attempt  4	[8.34 s]
0.0.N: Trace Attempt  5	[8.35 s]
0.0.AM: Trace Attempt 622	[8.32 s]
0.0.N: Trace Attempt  1	[9.51 s]
0.0.N: Trace Attempt  2	[9.51 s]
0.0.N: Trace Attempt  3	[9.51 s]
0.0.N: Trace Attempt  4	[9.51 s]
0.0.N: Trace Attempt  5	[9.51 s]
0.0.N: Trace Attempt  1	[10.67 s]
0.0.N: Trace Attempt  2	[10.67 s]
0.0.N: Trace Attempt  3	[10.67 s]
0.0.N: Trace Attempt  4	[10.67 s]
0.0.N: Trace Attempt  5	[10.68 s]
0.0.N: Trace Attempt  1	[11.84 s]
0.0.N: Trace Attempt  2	[11.84 s]
0.0.N: Trace Attempt  3	[11.84 s]
0.0.N: Trace Attempt  4	[11.84 s]
0.0.N: Trace Attempt  5	[11.84 s]
0.0.Ht: Trace Attempt 3095	[12.01 s]
0.0.B: Trace Attempt 3066	[12.01 s]
0.0.Hp: Trace Attempt 695	[12.07 s]
0.0.AM: Trace Attempt 657	[12.44 s]
0.0.N: Trace Attempt  1	[13.01 s]
0.0.N: Trace Attempt  2	[13.01 s]
0.0.N: Trace Attempt  3	[13.01 s]
0.0.N: Trace Attempt  4	[13.01 s]
0.0.N: Trace Attempt  5	[13.01 s]
0.0.N: Trace Attempt  1	[14.18 s]
0.0.N: Trace Attempt  2	[14.18 s]
0.0.N: Trace Attempt  3	[14.18 s]
0.0.N: Trace Attempt  4	[14.18 s]
0.0.N: Trace Attempt  5	[14.18 s]
0.0.N: Trace Attempt  1	[15.35 s]
0.0.N: Trace Attempt  2	[15.35 s]
0.0.N: Trace Attempt  3	[15.35 s]
0.0.N: Trace Attempt  4	[15.35 s]
0.0.N: Trace Attempt  5	[15.35 s]
0.0.Ht: Trace Attempt 3512	[16.01 s]
0.0.B: Trace Attempt 3521	[16.01 s]
0.0.Hp: Trace Attempt 790	[16.10 s]
0.0.AM: Trace Attempt 673	[16.51 s]
0.0.N: Trace Attempt  1	[16.60 s]
0.0.N: Trace Attempt  2	[16.60 s]
0.0.N: Trace Attempt  3	[16.60 s]
0.0.N: Trace Attempt  4	[16.60 s]
0.0.N: Trace Attempt  5	[16.61 s]
0.0.N: Trace Attempt  1	[19.26 s]
0.0.N: Trace Attempt  2	[19.26 s]
0.0.N: Trace Attempt  3	[19.26 s]
0.0.N: Trace Attempt  4	[19.27 s]
0.0.N: Trace Attempt  5	[19.27 s]
0.0.Ht: Trace Attempt 3880	[20.01 s]
0.0.B: Trace Attempt 3910	[20.02 s]
0.0.Hp: Trace Attempt 871	[20.14 s]
0.0.AM: Trace Attempt 443	[20.51 s]
0.0.N: Trace Attempt  1	[22.78 s]
0.0.N: Trace Attempt  2	[22.79 s]
0.0.N: Trace Attempt  3	[22.79 s]
0.0.N: Trace Attempt  4	[22.79 s]
0.0.N: Trace Attempt  5	[22.79 s]
0.0.Ht: Trace Attempt 4174	[24.01 s]
0.0.B: Trace Attempt 4230	[24.02 s]
0.0.Hp: Trace Attempt 939	[24.15 s]
0.0.AM: Trace Attempt 803	[26.18 s]
0.0.N: Trace Attempt  1	[26.25 s]
0.0.N: Trace Attempt  2	[26.25 s]
0.0.N: Trace Attempt  3	[26.25 s]
0.0.N: Trace Attempt  4	[26.25 s]
0.0.N: Trace Attempt  5	[26.26 s]
0.0.Ht: Trace Attempt 4457	[28.02 s]
0.0.B: Trace Attempt 4542	[28.02 s]
0.0.Hp: Trace Attempt 1005	[28.17 s]
0.0.AM: Trace Attempt  1	[28.62 s]
0.0.AM: Trace Attempt  2	[28.62 s]
0.0.AM: Trace Attempt  3	[28.63 s]
0.0.AM: Trace Attempt  4	[28.63 s]
0.0.AM: Trace Attempt  5	[28.63 s]
0.0.N: Trace Attempt  1	[29.68 s]
0.0.N: Trace Attempt  2	[29.68 s]
0.0.N: Trace Attempt  3	[29.68 s]
0.0.N: Trace Attempt  4	[29.69 s]
0.0.N: Trace Attempt  5	[29.69 s]
0.0.B: Trace Attempt 4863	[32.03 s]
0.0.Ht: Trace Attempt 4749	[32.03 s]
0.0.Hp: Trace Attempt 1072	[32.23 s]
0.0.N: Trace Attempt  1	[33.10 s]
0.0.N: Trace Attempt  2	[33.10 s]
0.0.N: Trace Attempt  3	[33.10 s]
0.0.N: Trace Attempt  4	[33.11 s]
0.0.N: Trace Attempt  5	[33.11 s]
0.0.AM: Trace Attempt 371	[33.14 s]
0.0.B: Trace Attempt 5169	[36.04 s]
0.0.Ht: Trace Attempt 5027	[36.04 s]
0.0.Hp: Trace Attempt 1135	[36.24 s]
0.0.N: Trace Attempt  1	[36.52 s]
0.0.N: Trace Attempt  2	[36.52 s]
0.0.N: Trace Attempt  3	[36.52 s]
0.0.N: Trace Attempt  4	[36.52 s]
0.0.N: Trace Attempt  5	[36.52 s]
0.0.AM: Trace Attempt 636	[37.26 s]
0.0.N: Trace Attempt  1	[39.95 s]
0.0.N: Trace Attempt  2	[39.95 s]
0.0.N: Trace Attempt  3	[39.95 s]
0.0.N: Trace Attempt  4	[39.95 s]
0.0.N: Trace Attempt  5	[39.95 s]
0.0.B: Trace Attempt 5449	[40.05 s]
0.0.Ht: Trace Attempt 5292	[40.05 s]
0.0.Hp: Trace Attempt 1194	[40.25 s]
0.0.AM: Trace Attempt 665	[41.53 s]
0.0.N: Trace Attempt  1	[43.36 s]
0.0.N: Trace Attempt  2	[43.36 s]
0.0.N: Trace Attempt  3	[43.36 s]
0.0.N: Trace Attempt  4	[43.36 s]
0.0.N: Trace Attempt  5	[43.37 s]
0.0.B: Trace Attempt 5713	[44.06 s]
0.0.Ht: Trace Attempt 5534	[44.07 s]
0.0.Hp: Trace Attempt 1251	[44.27 s]
0.0.AM: Trace Attempt 708	[45.56 s]
0.0.N: Trace Attempt  1	[46.78 s]
0.0.N: Trace Attempt  2	[46.78 s]
0.0.N: Trace Attempt  3	[46.78 s]
0.0.N: Trace Attempt  4	[46.78 s]
0.0.N: Trace Attempt  5	[46.79 s]
0.0.B: Trace Attempt 5974	[48.07 s]
0.0.Ht: Trace Attempt 5769	[48.08 s]
0.0.Hp: Trace Attempt 1306	[48.27 s]
0.0.AM: Trace Attempt 815	[49.59 s]
0.0.N: Trace Attempt  1	[50.19 s]
0.0.N: Trace Attempt  2	[50.20 s]
0.0.N: Trace Attempt  3	[50.20 s]
0.0.N: Trace Attempt  4	[50.20 s]
0.0.N: Trace Attempt  5	[50.20 s]
0.0.B: Trace Attempt 6225	[52.07 s]
0.0.Ht: Trace Attempt 5999	[52.09 s]
0.0.Hp: Trace Attempt 1359	[52.28 s]
0.0.N: Trace Attempt  1	[53.62 s]
0.0.N: Trace Attempt  2	[53.62 s]
0.0.N: Trace Attempt  3	[53.62 s]
0.0.N: Trace Attempt  4	[53.62 s]
0.0.N: Trace Attempt  5	[53.62 s]
0.0.AM: Trace Attempt 877	[53.68 s]
0.0.B: Trace Attempt 6464	[56.08 s]
0.0.Ht: Trace Attempt 6214	[56.10 s]
0.0.Hp: Trace Attempt 1411	[56.35 s]
0.0.N: Trace Attempt  1	[57.04 s]
0.0.N: Trace Attempt  2	[57.04 s]
0.0.N: Trace Attempt  3	[57.04 s]
0.0.N: Trace Attempt  4	[57.04 s]
0.0.N: Trace Attempt  5	[57.04 s]
0.0.AM: Trace Attempt 931	[57.74 s]
0.0.B: Trace Attempt 6688	[60.10 s]
0.0.Ht: Trace Attempt 6421	[60.11 s]
0.0.Hp: Trace Attempt 1461	[60.41 s]
0.0.N: Trace Attempt  1	[60.46 s]
0.0.N: Trace Attempt  2	[60.46 s]
0.0.N: Trace Attempt  3	[60.46 s]
0.0.N: Trace Attempt  4	[60.46 s]
0.0.N: Trace Attempt  5	[60.47 s]
0.0.AM: Trace Attempt 965	[61.79 s]
0.0.N: Trace Attempt  1	[63.89 s]
0.0.N: Trace Attempt  2	[63.89 s]
0.0.N: Trace Attempt  3	[63.89 s]
0.0.N: Trace Attempt  4	[63.89 s]
0.0.N: Trace Attempt  5	[63.89 s]
0.0.B: Trace Attempt 6903	[64.11 s]
0.0.Ht: Trace Attempt 6624	[64.12 s]
0.0.Hp: Trace Attempt 1509	[64.42 s]
0.0.AM: Trace Attempt 994	[65.95 s]
0.0.N: Trace Attempt  1	[67.30 s]
0.0.N: Trace Attempt  2	[67.30 s]
0.0.N: Trace Attempt  3	[67.30 s]
0.0.N: Trace Attempt  4	[67.31 s]
0.0.N: Trace Attempt  5	[67.31 s]
0.0.B: Trace Attempt 7112	[68.12 s]
0.0.Ht: Trace Attempt 6822	[68.14 s]
0.0.Hp: Trace Attempt 1555	[68.49 s]
0.0.AM: Trace Attempt 1021	[70.01 s]
0.0.N: Trace Attempt  1	[70.74 s]
0.0.N: Trace Attempt  2	[70.74 s]
0.0.N: Trace Attempt  3	[70.74 s]
0.0.N: Trace Attempt  4	[70.74 s]
0.0.N: Trace Attempt  5	[70.74 s]
0.0.B: Trace Attempt 7322	[72.14 s]
0.0.Ht: Trace Attempt 7014	[72.14 s]
0.0.Hp: Trace Attempt 1585	[72.53 s]
0.0.N: Trace Attempt  1	[74.15 s]
0.0.N: Trace Attempt  2	[74.15 s]
0.0.N: Trace Attempt  3	[74.15 s]
0.0.N: Trace Attempt  4	[74.15 s]
0.0.N: Trace Attempt  5	[74.15 s]
0.0.AM: Trace Attempt 1049	[74.27 s]
0.0.Ht: Trace Attempt 7197	[76.14 s]
0.0.B: Trace Attempt 7524	[76.15 s]
0.0.Hp: Trace Attempt 1613	[76.64 s]
0.0.N: Trace Attempt  1	[77.56 s]
0.0.N: Trace Attempt  2	[77.57 s]
0.0.N: Trace Attempt  3	[77.57 s]
0.0.N: Trace Attempt  4	[77.57 s]
0.0.N: Trace Attempt  5	[77.57 s]
0.0.AM: Trace Attempt 1074	[78.53 s]
0.0.Ht: Trace Attempt 7383	[80.15 s]
0.0.B: Trace Attempt 7716	[80.16 s]
0.0.Hp: Trace Attempt 1641	[80.79 s]
0.0.N: Trace Attempt 414	[82.36 s]
0.0.AM: Trace Attempt 1096	[82.57 s]
0.0.N: Trace Attempt  1	[83.79 s]
0.0.N: Trace Attempt  2	[83.79 s]
0.0.N: Trace Attempt  3	[83.79 s]
0.0.N: Trace Attempt  4	[83.79 s]
0.0.N: Trace Attempt  5	[83.79 s]
0.0.Ht: Trace Attempt 7554	[84.16 s]
0.0.B: Trace Attempt 7902	[84.16 s]
0.0.Hp: Trace Attempt 1668	[84.83 s]
0.0.AM: Trace Attempt 1114	[86.63 s]
0.0.Ht: Trace Attempt 7726	[88.18 s]
0.0.B: Trace Attempt 8087	[88.18 s]
0.0.N: Trace Attempt 414	[88.58 s]
0.0.Hp: Trace Attempt 1695	[88.90 s]
0.0.N: Trace Attempt  1	[90.01 s]
0.0.N: Trace Attempt  2	[90.02 s]
0.0.N: Trace Attempt  3	[90.02 s]
0.0.N: Trace Attempt  4	[90.02 s]
0.0.N: Trace Attempt  5	[90.02 s]
0.0.AM: Trace Attempt 1135	[91.28 s]
0.0.Ht: Trace Attempt 7893	[92.19 s]
0.0.B: Trace Attempt 8268	[92.20 s]
0.0.Hp: Trace Attempt 1722	[93.02 s]
0.0.N: Trace Attempt 414	[94.81 s]
0.0.AM: Trace Attempt 1152	[95.61 s]
0.0.N: Trace Attempt  1	[96.24 s]
0.0.N: Trace Attempt  2	[96.25 s]
0.0.N: Trace Attempt  3	[96.25 s]
0.0.B: Trace Attempt 8444	[96.21 s]
0.0.N: Trace Attempt  4	[96.25 s]
0.0.N: Trace Attempt  5	[96.25 s]
0.0.Ht: Trace Attempt 8058	[96.22 s]
0.0.Hp: Trace Attempt 1748	[97.15 s]
0.0.AM: Trace Attempt 1170	[99.68 s]
0.0.B: Trace Attempt 8617	[100.22 s]
0.0.N: Trace Attempt 412	[100.26 s]
0.0.Ht: Trace Attempt 8218	[100.24 s]
0.0.Hp: Trace Attempt 1776	[101.23 s]
0.0.N: Trace Attempt  1	[102.49 s]
0.0.N: Trace Attempt  2	[102.49 s]
0.0.N: Trace Attempt  3	[102.49 s]
0.0.N: Trace Attempt  4	[102.49 s]
0.0.N: Trace Attempt  5	[102.49 s]
0.0.AM: Trace Attempt 1186	[104.10 s]
0.0.B: Trace Attempt 8786	[104.23 s]
0.0.Ht: Trace Attempt 8377	[104.27 s]
0.0.Hp: Trace Attempt 1803	[105.26 s]
0.0.N: Trace Attempt 414	[107.28 s]
0.0.B: Trace Attempt 8956	[108.25 s]
0.0.Ht: Trace Attempt 8531	[108.28 s]
0.0.AM: Trace Attempt 1201	[108.28 s]
0.0.N: Trace Attempt  1	[108.71 s]
0.0.N: Trace Attempt  2	[108.71 s]
0.0.N: Trace Attempt  3	[108.71 s]
0.0.N: Trace Attempt  4	[108.71 s]
0.0.N: Trace Attempt  5	[108.71 s]
0.0.B: Trace Attempt 9131	[112.27 s]
0.0.Ht: Trace Attempt 8695	[112.30 s]
0.0.AM: Trace Attempt 1215	[112.36 s]
0.0.Hp: Trace Attempt 1818	[113.19 s]
0.0.N: Trace Attempt 414	[113.48 s]
0.0.N: Trace Attempt  1	[114.91 s]
0.0.N: Trace Attempt  2	[114.91 s]
0.0.N: Trace Attempt  3	[114.91 s]
0.0.N: Trace Attempt  4	[114.92 s]
0.0.N: Trace Attempt  5	[114.92 s]
0.0.B: Trace Attempt 9295	[116.28 s]
0.0.Ht: Trace Attempt 8846	[116.31 s]
0.0.AM: Trace Attempt 1232	[116.55 s]
0.0.Hp: Trace Attempt 1860	[117.23 s]
0.0.N: Trace Attempt 412	[118.94 s]
0.0.B: Trace Attempt 9457	[120.28 s]
0.0.Ht: Trace Attempt 8992	[120.33 s]
0.0.AM: Trace Attempt 1248	[120.61 s]
0.0.N: Trace Attempt  1	[121.18 s]
0.0.N: Trace Attempt  2	[121.18 s]
0.0.N: Trace Attempt  3	[121.18 s]
0.0.N: Trace Attempt  4	[121.18 s]
0.0.N: Trace Attempt  5	[121.18 s]
0.0.Hp: Trace Attempt 1903	[121.25 s]
0.0.B: Trace Attempt 9611	[124.29 s]
0.0.Ht: Trace Attempt 9137	[124.33 s]
0.0.AM: Trace Attempt 1262	[124.63 s]
0.0.N: Trace Attempt 412	[125.29 s]
0.0.Hp: Trace Attempt 1944	[125.30 s]
0.0.N: Trace Attempt  1	[127.56 s]
0.0.N: Trace Attempt  2	[127.56 s]
0.0.N: Trace Attempt  3	[127.56 s]
0.0.N: Trace Attempt  4	[127.56 s]
0.0.N: Trace Attempt  5	[127.56 s]
0.0.B: Trace Attempt 9760	[128.31 s]
0.0.Ht: Trace Attempt 9278	[128.35 s]
0.0.AM: Trace Attempt 1280	[128.78 s]
0.0.Hp: Trace Attempt 1984	[129.31 s]
0.0.N: Trace Attempt 412	[131.57 s]
0.0.B: Trace Attempt 9911	[132.33 s]
0.0.Ht: Trace Attempt 9423	[132.35 s]
0.0.AM: Trace Attempt 1296	[132.90 s]
0.0.Hp: Trace Attempt 2024	[133.33 s]
0.0.N: Trace Attempt  1	[133.79 s]
0.0.N: Trace Attempt  2	[133.79 s]
0.0.N: Trace Attempt  3	[133.79 s]
0.0.N: Trace Attempt  4	[133.79 s]
0.0.N: Trace Attempt  5	[133.80 s]
0.0.B: Trace Attempt 10059	[136.33 s]
0.0.Ht: Trace Attempt 9563	[136.36 s]
0.0.AM: Trace Attempt 1310	[137.05 s]
0.0.N: Trace Attempt 414	[138.57 s]
0.0.Hp: Trace Attempt 2054	[139.54 s]
0.0.N: Trace Attempt  1	[140.00 s]
0.0.N: Trace Attempt  2	[140.00 s]
0.0.N: Trace Attempt  3	[140.00 s]
0.0.N: Trace Attempt  4	[140.01 s]
0.0.N: Trace Attempt  5	[140.01 s]
0.0.B: Trace Attempt 10211	[140.36 s]
0.0.Ht: Trace Attempt 9700	[140.36 s]
0.0.AM: Trace Attempt 1319	[141.22 s]
0.0.Hp: Trace Attempt 2082	[143.66 s]
0.0.B: Trace Attempt 10356	[144.37 s]
0.0.Ht: Trace Attempt 9834	[144.38 s]
0.0.N: Trace Attempt 414	[144.80 s]
0.0.AM: Trace Attempt 1329	[145.41 s]
0.0.N: Trace Attempt  1	[146.23 s]
0.0.N: Trace Attempt  2	[146.24 s]
0.0.N: Trace Attempt  3	[146.24 s]
0.0.N: Trace Attempt  4	[146.24 s]
0.0.N: Trace Attempt  5	[146.24 s]
0.0.Hp: Trace Attempt 2109	[147.81 s]
0.0.B: Trace Attempt 10499	[148.38 s]
0.0.Ht: Trace Attempt 9965	[148.40 s]
0.0.AM: Trace Attempt 1339	[149.78 s]
0.0.N: Trace Attempt 414	[151.03 s]
0.0.Hp: Trace Attempt 2136	[151.93 s]
0.0.Ht: Trace Attempt 10096	[152.41 s]
0.0.B: Trace Attempt 10638	[152.41 s]
0.0.N: Trace Attempt  1	[152.46 s]
0.0.N: Trace Attempt  2	[152.46 s]
0.0.N: Trace Attempt  3	[152.46 s]
0.0.N: Trace Attempt  4	[152.46 s]
0.0.N: Trace Attempt  5	[152.46 s]
0.0.AM: Trace Attempt 1347	[154.09 s]
0.0.Hp: Trace Attempt 2162	[155.95 s]
0.0.Ht: Trace Attempt 10227	[156.42 s]
0.0.B: Trace Attempt 10773	[156.43 s]
0.0.N: Trace Attempt 412	[156.47 s]
0.0.AM: Trace Attempt 1355	[158.34 s]
0.0.N: Trace Attempt  1	[158.70 s]
0.0.N: Trace Attempt  2	[158.71 s]
0.0.N: Trace Attempt  3	[158.71 s]
0.0.N: Trace Attempt  4	[158.71 s]
0.0.N: Trace Attempt  5	[158.71 s]
0.0.Hp: Trace Attempt 2188	[160.05 s]
0.0.Ht: Trace Attempt 10352	[160.43 s]
0.0.B: Trace Attempt 10904	[160.43 s]
0.0.N: Trace Attempt 412	[162.71 s]
0.0.AM: Trace Attempt 1363	[162.76 s]
0.0.Hp: Trace Attempt 2214	[164.16 s]
0.0.Ht: Trace Attempt 10479	[164.44 s]
0.0.B: Trace Attempt 11035	[164.44 s]
0.0.N: Trace Attempt  1	[164.95 s]
0.0.N: Trace Attempt  2	[164.95 s]
0.0.N: Trace Attempt  3	[164.95 s]
0.0.N: Trace Attempt  4	[164.95 s]
0.0.N: Trace Attempt  5	[164.95 s]
0.0.AM: Trace Attempt 1375	[167.14 s]
0.0.Hp: Trace Attempt 2239	[168.18 s]
0.0.Ht: Trace Attempt 10602	[168.45 s]
0.0.B: Trace Attempt 11166	[168.45 s]
0.0.N: Trace Attempt 414	[169.74 s]
0.0.N: Trace Attempt  1	[171.17 s]
0.0.N: Trace Attempt  2	[171.17 s]
0.0.N: Trace Attempt  3	[171.17 s]
0.0.N: Trace Attempt  4	[171.18 s]
0.0.N: Trace Attempt  5	[171.18 s]
0.0.AM: Trace Attempt 1385	[171.32 s]
0.0.Hp: Trace Attempt 2265	[172.33 s]
0.0.B: Trace Attempt 11295	[172.46 s]
0.0.Ht: Trace Attempt 10721	[172.46 s]
0.0.AM: Trace Attempt 1394	[175.46 s]
0.0.N: Trace Attempt 414	[175.97 s]
0.0.Hp: Trace Attempt 2291	[176.46 s]
0.0.Ht: Trace Attempt 10841	[176.47 s]
0.0.B: Trace Attempt 11425	[176.48 s]
0.0.N: Trace Attempt  1	[177.41 s]
0.0.N: Trace Attempt  2	[177.41 s]
0.0.N: Trace Attempt  3	[177.41 s]
0.0.N: Trace Attempt  4	[177.41 s]
0.0.N: Trace Attempt  5	[177.41 s]
0.0.AM: Trace Attempt 1406	[179.63 s]
0.0.Hp: Trace Attempt 2316	[180.49 s]
0.0.Ht: Trace Attempt 10959	[180.48 s]
0.0.B: Trace Attempt 11554	[180.49 s]
0.0.N: Trace Attempt 409	[180.96 s]
0.0.N: Stopped processing property "VGA.p1"	[180.99 s].
0.0.N: Morphing to Ncustom1
0.0.N: All properties determined. [0.00 s]
0.0.N: Exited with Success (@ 0.00 s)
0.0.Ncustom1: clocks: 1, declared: 1, looping: 0, posedge: 1, negedge: 0, noedge: 0, bothedge: 0
0.0.Ncustom1: Starting proof for property "VGA.p1"	[0.00 s].
0.0.Ncustom1: Trace Attempt 486	[0.05 s]
0.0.Tri: Proofgrid shell started at 12641@vlsi-ria84(local) jg_12177_vlsi-ria84_1
0.0.Tri: clocks: 1, declared: 1, looping: 0, posedge: 1, negedge: 0, noedge: 0, bothedge: 0
0.0.Tri: Last scan. Per property time limit: 0s
0.0.Tri: Starting proof for property "VGA.p1"	[0.00 s].
0.0.Tri: Trace Attempt  1	[0.00 s]
0.0.Tri:    0.00" ---- Launching main thread ----
0.0.B: Trace Attempt 11568	[180.94 s]
0.0.B: Stopped processing property "VGA.p1"	[181.09 s].
0.0.B: Morphing to Bcustom2
0.0.B: All properties determined. [0.00 s]
0.0.B: Exited with Success (@ 0.00 s)
0.0.Bcustom2: clocks: 1, declared: 1, looping: 0, posedge: 1, negedge: 0, noedge: 0, bothedge: 0
0.0.Bcustom2: Starting proof for property "VGA.p1"	[0.00 s].
0.0.Bcustom2: Trace Attempt  1	[0.00 s]
0.0.Bcustom2: Trace Attempt  2	[0.00 s]
0.0.Bcustom2: Trace Attempt  1	[0.00 s]
0.0.Bcustom2: Trace Attempt  2	[0.00 s]
0.0.Bcustom2: Trace Attempt  3	[0.00 s]
0.0.Bcustom2: Trace Attempt  4	[0.00 s]
0.0.Bcustom2: Trace Attempt  5	[0.00 s]
0.0.Tri:    0.03" ---- Launching abstraction thread ----
0.0.Tri:    0.04" ---- Launching multi-phase simplification thread ----
0.0.Tri:    0.06" ---- Launching liveness simplification thread ----
0.0.AM: Trace Attempt 1410	[180.86 s]
0.0.AM: Stopped processing property "VGA.p1"	[181.14 s].
0.0.AM: Morphing to AMcustom3
0.0.AM: All properties determined. [0.00 s]
0.0.AM: Exited with Success (@ 0.00 s)
0.0.Ncustom1: Trace Attempt  1	[0.20 s]
0.0.Ncustom1: Trace Attempt  2	[0.20 s]
0.0.AMcustom3: clocks: 1, declared: 1, looping: 0, posedge: 1, negedge: 0, noedge: 0, bothedge: 0
0.0.AMcustom3: Starting proof for property "VGA.p1"	[0.00 s].
0.0.AMcustom3: Trace Attempt  1	[0.00 s]
0.0.Ncustom1: Trace Attempt  3	[0.20 s]
0.0.AMcustom3: Trace Attempt  2	[0.00 s]
0.0.Ncustom1: Trace Attempt  4	[0.20 s]
0.0.Ncustom1: Trace Attempt  5	[0.20 s]
0.0.AMcustom3: Trace Attempt  3	[0.00 s]
0.0.AMcustom3: Trace Attempt  4	[0.00 s]
0.0.AMcustom3: Trace Attempt  5	[0.00 s]
0.0.AMcustom3: Trace Attempt  1	[0.00 s]
0.0.AMcustom3: Trace Attempt  2	[0.00 s]
0.0.AMcustom3: Trace Attempt  3	[0.00 s]
0.0.AMcustom3: Trace Attempt  4	[0.00 s]
0.0.AMcustom3: Trace Attempt  5	[0.00 s]
0.0.AMcustom3: Trace Attempt  1	[0.02 s]
0.0.AMcustom3: Trace Attempt  2	[0.02 s]
0.0.AMcustom3: Trace Attempt  3	[0.02 s]
0.0.AMcustom3: Trace Attempt  4	[0.02 s]
0.0.AMcustom3: Trace Attempt  5	[0.02 s]
0.0.AMcustom3: Trace Attempt  1	[0.08 s]
0.0.AMcustom3: Trace Attempt  2	[0.08 s]
0.0.AMcustom3: Trace Attempt  3	[0.08 s]
0.0.AMcustom3: Trace Attempt  4	[0.09 s]
0.0.Bcustom2: Trace Attempt  1	[0.20 s]
0.0.Bcustom2: Trace Attempt  2	[0.20 s]
0.0.Bcustom2: Trace Attempt  3	[0.20 s]
0.0.Bcustom2: Trace Attempt  4	[0.20 s]
0.0.Bcustom2: Trace Attempt  5	[0.20 s]
0.0.Bcustom2: Trace Attempt  1	[0.42 s]
0.0.Bcustom2: Trace Attempt  2	[0.42 s]
0.0.Bcustom2: Trace Attempt  3	[0.42 s]
0.0.Bcustom2: Trace Attempt  4	[0.42 s]
0.0.Bcustom2: Trace Attempt  5	[0.42 s]
0.0.Bcustom2: Trace Attempt  1	[0.68 s]
0.0.Bcustom2: Trace Attempt  2	[0.68 s]
0.0.Bcustom2: Trace Attempt  3	[0.68 s]
0.0.Bcustom2: Trace Attempt  4	[0.68 s]
0.0.Bcustom2: Trace Attempt  5	[0.68 s]
0.0.Tri:    0.86" Simplification phase 1 complete
0.0.Ncustom1: Requesting engine job to terminate
0.0.Bcustom2: Requesting engine job to terminate
0.0.AMcustom3: Requesting engine job to terminate
0.0.Tri: Requesting engine job to terminate
0.0.Hp: Requesting engine job to terminate
0.0.Ht: Requesting engine job to terminate
INFO (IPF144): 0: Initiating shutdown of proof [182.02 s]
0.0.Tri: A proof was found: No trace exists. [0.95 s]
INFO (IPF057): 0.0.Tri: The property "VGA.p1" was proven in 0.95 s.
0.0.AMcustom3: Trace Attempt 104	[0.81 s]
0.0.AMcustom3: Stopped processing property "VGA.p1"	[0.82 s].
0.0.AMcustom3: All properties determined. [0.82 s]
0.0.Bcustom2: Trace Attempt 745	[0.88 s]
0.0.Bcustom2: Stopped processing property "VGA.p1"	[0.89 s].
0.0.Ncustom1: Trace Attempt 221	[1.01 s]
0.0.Ncustom1: Stopped processing property "VGA.p1"	[1.02 s].
0.0.Bcustom2: All properties determined. [0.89 s]
0.0.Ncustom1: All properties determined. [1.02 s]
0.0.Ncustom1: Exited with Success (@ 182.03 s)
0: ProofGrid usable level: 0
0.0.Ht: Trace Attempt 11003	[181.97 s]
0.0.Ht: All properties determined. [182.00 s]
0.0.AMcustom3: Exited with Success (@ 182.04 s)
0.0.Bcustom2: Exited with Success (@ 182.05 s)
0.0.Hp: Trace Attempt 2325	[181.97 s]
0.0.Hp: All properties determined. [182.11 s]
0.0.Ht: Exited with Success (@ 182.13 s)
0.0.Tri: Stopped processing property "VGA.p1"	[1.12 s].
0.0.Tri: All properties determined. [1.12 s]
0.0.Tri: Exited with Success (@ 182.19 s)
0.0.Hp: Exited with Success (@ 182.41 s)
0: --------------------------------------------------------------
ProofGrid Summary (utilization 99.97 %)
--------------------------------------------------------------
     engines started                               :    10
     engine jobs started                           :     7

    Average time in state (seconds)
    ------------------------------------------------------
    Engine  Pending     Running        Dead    Utilization
    ------------------------------------------------------
     Hp        0.03      182.02        0.00       99.98 %
     Ht        0.04      181.98        0.00       99.98 %
     Oh        0.03        0.00        0.00        0.72 %
    Ncustom1        0.03      182.00        0.00       99.98 %
    Bcustom2        0.04      181.85        0.00       99.98 %
    AMcustom3        0.03      181.79        0.00       99.98 %
    Tri        0.06        0.95        0.00       93.80 %
    all        0.04      130.08        0.00       99.97 %

    Total time in state (seconds)
    -----------------------------------------
            Pending     Running        Dead  
    -----------------------------------------
               0.26      910.59        0.00

    Data read    : 11.81 MiB
    Data written : 6.19 kiB

0: All pending notifications were processed.
INFO (IPF059): 0: Completed proof on task: "<embedded>"

==============================================================
SUMMARY
==============================================================
           Properties Considered              : 1
                 assertions                   : 1
                  - proven                    : 1 (100%)
                  - bounded_proven (user)     : 0 (0%)
                  - bounded_proven (auto)     : 0 (0%)
                  - marked_proven             : 0 (0%)
                  - cex                       : 0 (0%)
                  - ar_cex                    : 0 (0%)
                  - undetermined              : 0 (0%)
                  - unknown                   : 0 (0%)
                  - error                     : 0 (0%)
                 covers                       : 0
                  - unreachable               : 0
                  - bounded_unreachable (user): 0
                  - covered                   : 0
                  - ar_covered                : 0
                  - undetermined              : 0
                  - unknown                   : 0
                  - error                     : 0
proven
[<embedded>] % exit -force
INFO (IPL005): Received request to exit from the console.
INFO: Waiting for proof threads to stop...
INFO: Proof threads stopped.
INFO (IPL018): The peak resident set memory use for this session was 2.232 GB.
INFO (IPL014): Waiting for the Tcl-thread to exit.
INFO (IPL015): The Tcl-thread exited with status 0.
INFO (IPL016): Exiting the analysis session with status 0.
