# ----------------------------------------
# Jasper Version Info
# tool      : Jasper 2024.06
# platform  : Linux 3.10.0-1160.62.1.el7.x86_64
# version   : 2024.06p002 64 bits
# build date: 2024.09.02 16:28:38 UTC
# ----------------------------------------
# started   : 2025-12-24 22:54:33 IST
# hostname  : vlsi-ria84.vlsidomain
# pid       : 19403
# arguments : '-label' 'session_0' '-console' '//127.0.0.1:38845' '-nowindow' '-style' 'windows' '-exitonerror' '-data' 'AAAAynicY2RgYLCp////PwMYMD6A0Aw2jAyoAMRnQhUJbEChGRhYYZphSliAmItBl6GAoYghnyELyNNi0ANCfSA7HS6aypDMUMJQDBQ1ZIhnCGAIZ/AF0mZA1TxAvUkMiUDZZIYMIF8MTYUeWCYHbBcA4EUVyQ==' '-proj' '/users/rompel/jasper_executions/liveness/jgprojects/1_PWM_6/sessionLogs/session_0' '-init' '-hidden' '/users/rompel/jasper_executions/liveness/jgprojects/1_PWM_6/.tmp/.initCmds.tcl' '1_PWM_6.tcl' '-hidden' '/users/rompel/jasper_executions/liveness/jgprojects/1_PWM_6/.tmp/.postCmds.tcl'

Any disclosure about the Cadence Design Systems software or its use
model to any third party violates the written Non-Disclosure Agreement
between Cadence Design Systems, Inc. and the customer.

THIS SOFTWARE CONTAINS CONFIDENTIAL INFORMATION AND TRADE SECRETS OF
CADENCE DESIGN SYSTEMS, INC. USE, DISCLOSURE, OR REPRODUCTION IS
PROHIBITED WITHOUT THE PRIOR EXPRESS WRITTEN PERMISSION OF CADENCE
DESIGN SYSTEMS, INC.

Copyright (C) 2000-2024 Cadence Design Systems, Inc. All Rights
Reserved.  Unpublished -- rights reserved under the copyright laws of
the United States.

This product includes software developed by others and redistributed
according to license agreement. See doc/third_party_readme.txt for
further details.

RESTRICTED RIGHTS LEGEND

Use, duplication, or disclosure by the Government is subject to
restrictions as set forth in subparagraph (c) (1) (ii) of the Rights in
Technical Data and Computer Software clause at DFARS 252.227-7013 or
subparagraphs (c) (1) and (2) of Commercial Computer Software -- Restricted
Rights at 48 CFR 52.227-19, as applicable.


                          Cadence Design Systems, Inc.
                          2655 Seely Avenue
                          San Jose, CA 95134
                          Phone: 408.943.1234

For technical assistance visit http://support.cadence.com.

Jasper Apps Analysis Session - /users/rompel/jasper_executions/liveness/jgprojects/1_PWM_6/sessionLogs/session_0

WARNING (WG017): [session]: The system's locale is "ANSI_X3.4-1968", which is not UTF-8. Non-ASCII characters might not be handled correctly.
WARNING (WG017): [jg_console]: The system's locale is "ANSI_X3.4-1968", which is not UTF-8. Non-ASCII characters might not be handled correctly.
INFO: successfully checked out license "jasper_fao".
INFO: reading configuration file "/users/rompel/.config/cadence/jasper.conf".
% analyze -sv09 ../1_PWM_6.sv
[-- (VERI-1482)] Analyzing Verilog file '/tools/cadence2425/JASPER/jasper_2024.06p002/lib/verilog/packages/std/std.sv' into library 'std'
[-- (VERI-1482)] Analyzing Verilog file '../1_PWM_6.sv'
% elaborate -bbox_mul 1000000 -bbox_div 1000000 -bbox_mod 1000000 -bbox_a 1000000
[INFO (HIER-8002)] ../1_PWM_6.sv(36): Disabling old hierarchical reference handler
[INFO (VERI-1018)] ../1_PWM_6.sv(1): compiling module 'PWM_TOP'
[WARN (VERI-1209)] ../1_PWM_6.sv(15): expression size 32 truncated to fit in target size 15
[INFO (VERI-8005)] ../1_PWM_6.sv(1): Unintentional sequential element inferred for pulse_red read before write using blocking assignment
[INFO (VERI-8005)] ../1_PWM_6.sv(1): Unintentional sequential element inferred for lb_pulse read before write using blocking assignment
[INFO (VERI-8005)] ../1_PWM_6.sv(1): Unintentional sequential element inferred for ub_pulse read before write using blocking assignment
INFO (ISW003): Top module name is "PWM_TOP".
INFO (INL208): Elaboration synthesis summary:
  Number of synthesized netlists          1 (0 packages)
  Single run mode                         On
  Pipeline                                On (1 pipelined netlists)
  Late hierarchical reference connection  On
  Number of analyzed Verilog modules      1 (1 synthesized)
  Number of analyzed VHDL entities        0 (0 synthesized)
INFO (INL003): Clearing all state information (assumes, stopats, and so forth).
PWM_TOP
[<embedded>] % reset -none
INFO (IPM031): Clearing proof results of all properties.
[<embedded>] % clock clk
[<embedded>] % prove -all
Ncustom1: Custom engine code is hT3Ng7hPPfiYQOTDZ3qhYOwGAM51eA+J/FjkM5shLioAsqhgLR4Ft+O1BuKG6ilQ83B9tLXSl+CwjiTMAQA
Bcustom2: Custom engine code is hT3Nm7hPr1Vp3Di1Ra2USNIGL4JypRnLKLAdF6JAyuavO2JfGCiY9OZJhcAcOUnLx5xwNdhILGrAWX9s+z2WDkKwNR7tAfClBEjRFVQeq6DU54boFgEA
AMcustom3: Custom engine code is hT3Ng7hP/feYQOTDZ3qhYOwGAM51eA+J/FjkM5shLioAsqhgLR4Ft+O1BuKG6ilQ83B9tLXSmmqwm7g9AQA
Mpcustom4: Custom engine code is hT3NZbhP9fmY2AbBQnsjfOxn6c+6e6yL+/e8fZFmaQrnlgEA
INFO (IPF036): Starting proof on task: "<embedded>", 1 properties to prove with 0 already proven/unreachable
INFO (IRS029): Starting reset analysis: phase 1 of 4.
INFO (IRS030): Running reset analysis: phase 2 of 4.
INFO (IRS031): Running reset analysis: phase 3 of 4.
INFO (IRS020): Starting the reset analysis simulation with a limit of 100 iterations (phase 4 of 4).
INFO (IRS024): Reset iterations 0 to 4 analyzed.
INFO (IRS018): Reset analysis simulation executed for 3 iterations. Assigned values for 0 of 18 design flops, 0 of 0 design latches, 3 of 3 internal elements.
INFO (IRS039): Reset analysis complete.
INFO (IPF031): Settings used for proof thread 0:
    orchestration                 = on
    time_limit                    = 86400s
    per_property_time_limit       = 1s * 10 ^ scan
    engine_mode                   = auto
    proofgrid_per_engine_max_jobs = 1
    max engine jobs               = auto
    proofgrid_mode                = local
    proofgrid_restarts            = 10
AMcustom5: Custom engine code is hT3N1rhP11/52HrFRS21ROp2LOjVTgPvT8L8BGXHgLhaIuqtT4nARFjUqrBL+7pLmaTOzBepZW/Jm8SSrHDybSQtoNiO3y43wk+dEoWlsZizu97Fih6O6lPVG/LpWP5SsUPwlGagLNa1FKEFvwVXyX7//8prySbvSxIHXr5er+z4RAEA
0: Using multistage preprocessing
Ncustom6: Custom engine code is hT3OXrhPByJp3TrFSTLhUmMH4KVtJgmTCnNDF46yMXOKY48m4LS5nE7yBzFjA7kDuwO/GhGUpEPiky3p3wmPn3dJZHxFMsafSoObRzSC+tn7sEY0WbTdZ/FV4hL3MYH/b1CIUvXSWR4wqEoVLsmMOD4xIPT4lI1LO6ZCO7PnnWQuLwetnvKlrXx6wCW/A+x+enqslg1YPobi4wEF/EvbzOvcTYdJvl2s4H2yZg2b2ofAVN5WvhWk1HoBAA
0: Starting reduce
ADcustom7: Custom engine code is hT3Nv7hPv1752HrFRa2kROx2f/ECJeZB2AZsLdlO8VwmIuqtT4nIDFXclhg+O+o+DMmQCekbheGk0kK28laA9gaOFDXsQp29J3X615HY1IPHJWd6FUFvCHjO+p1k652b5JJvZlShNpGlGSXAiQe/mEAj6tEBAA
Tricustom8: Custom engine code is hT3Nu7hPt1752DvFRa0kNDiyIV97VyejwM9C/jCLJjdPvusZONHY42VYUy0Q1ZotnhcVtNc56tJ5wbxv6V2+XpdsaSlHck5vfnbYjdwj1OECy9U+7oSQ0SZE3g5ayD+Phuh4odCJTjeKa2k4elM9ldQfkAEA
Gcustom9: Custom engine code is hT3NibhPDfeYQADBZnYcglOvK9Pfd7EOeniIqP8jNsyIqInncipMGcUXqAadachREE9F2PwhBUZUNw5kHnd4JdXkamORRgEA
C2custom10: Custom engine code is hT3NirhPjfWYQADBZnYcglOvK9Pfd7EOeniIqP8jNsyIqInncgkrYMMXCYbdK0dUjZIF9d4cJ0rHoBDjwVLBKuG86XYVV00BAA
AGcustom11: Custom engine code is hT3NirhP/fmYQADBZnYcglOvK9Pfd7EOeniIqP8jNsyIqInnckcwYMMXCYbdK0dUjZIF9d4cJ0rHoBDjwVLBKuHEZnZByh0BAA
Bcustom12: Custom engine code is hT3NjrhPDfiYQADBZnYcglOvK9PfWxFtenjIyBqfrgr7if/jL/yPOuK1BAflEcW0DxNH2eDIoezN2gxlQFg81RZtiWXh7aiTAidvAQA
0: Finished reduce in 0s
Ncustom13: Custom engine code is hT3NR7hPByFp3TrFSTLhUmMH4KWtJglTyV/c51BHEeZWamnJv767nE6PCak26bd3gf3XGN3rIRheufhDieCJQVISo+gNYUKhiUedBKGtsP/a18svAnlMJZudHxDFwK5ufsyoxsIyiAeSY2oi3tEuoDHr5gw42DFKAG3PqO3CEsl8Azzdt3pl5nGA1Ifv2H02eYsFzWb/nfp8PMb3F0krE/EgBcm8TD9Div8BAA
Tricustom14: Custom engine code is hT3Nu7hP3fiYQADBZnYcglNHp9bfd7EOeniIqP/ji8sGLQu8yhsFO+wxJ+O+R0bU8g/IewXFomyos+viQnWc2xYNYmMqpo3i40O7DaZR7qfp4YqNx26KRvQ/qx0BAA
0.0.PRE: Performing Proof Simplification...
0.0.N: clocks: 1, declared: 1, looping: 0, posedge: 1, negedge: 0, noedge: 0, bothedge: 0
0.0.N: Proof Simplification Iteration 1	[0.00 s]
0.0.N: Proof Simplification Iteration 2	[0.00 s]
0.0.PRE: A proof was found: No trace exists. [0.00 s]
INFO (IPF057): 0.0.PRE: The property ":noDeadEnd" was proven in 0.00 s.
    Use check_assumptions -show -dead_end to show this property in the property table.
0.0.PRE: A proof was found: No trace exists. [0.00 s]
INFO (IPF057): 0.0.PRE: The property ":noConflict" was proven in 0.00 s.
    Use check_assumptions -show to show this property in the property table.
INFO (IPF047): 0.0.PRE: The cover property ":live" was covered in 1 cycles in 0.00 s.
    Use check_assumptions -show -live to show this property in the property table.
0.0.PRE: Proof Simplification completed in 0.00 s
0: About to start ProofGrid in its own thread with a limit of 10000 pending notifications and a limit of 10 traces.
0: =============================== ProofGrid start ===============================
0: ProofGrid usable level: 1
0: Initial ProofGrid level: 1
0: ProofGrid is starting event handling
0.0.N: Proofgrid shell started at 19560@vlsi-ria84(local) jg_19403_vlsi-ria84_1
0.0.Hp: Proofgrid shell started at 19561@vlsi-ria84(local) jg_19403_vlsi-ria84_1
0.0.N: clocks: 1, declared: 1, looping: 0, posedge: 1, negedge: 0, noedge: 0, bothedge: 0
0.0.N: Last scan. Per property time limit: 0s
0.0.N: Starting proof for property "PWM_TOP.p1"	[0.00 s].
0.0.N: Trace Attempt  1	[0.00 s]
0.0.N: Trace Attempt  2	[0.00 s]
0.0.N: Trace Attempt  2	[0.00 s]
0.0.N: Trace Attempt  3	[0.00 s]
0.0.N: Trace Attempt  3	[0.00 s]
0.0.N: Trace Attempt  4	[0.00 s]
0.0.N: Trace Attempt  5	[0.00 s]
0.0.Hp: clocks: 1, declared: 1, looping: 0, posedge: 1, negedge: 0, noedge: 0, bothedge: 0
0.0.Hp: Last scan. Per property time limit: 0s
0.0.Hp: Trace Attempt  1	[0.00 s]
0.0.Hp: Trace Attempt  2	[0.00 s]
0.0.Hp: Trace Attempt  3	[0.00 s]
0.0.Hp: Trace Attempt  4	[0.00 s]
0.0.Hp: Trace Attempt  5	[0.00 s]
0.0.Ht: Proofgrid shell started at 19596@vlsi-ria84(local) jg_19403_vlsi-ria84_1
0.0.Ht: clocks: 1, declared: 1, looping: 0, posedge: 1, negedge: 0, noedge: 0, bothedge: 0
0.0.Ht: Last scan. Per property time limit: 0s
0.0.Ht: Trace Attempt  1	[0.00 s]
0.0.Ht: Trace Attempt  2	[0.00 s]
0.0.Ht: Trace Attempt  3	[0.00 s]
0.0.Ht: Trace Attempt  4	[0.00 s]
0.0.Ht: Trace Attempt  5	[0.00 s]
0.0.AM: Proofgrid shell started at 19599@vlsi-ria84(local) jg_19403_vlsi-ria84_1
0.0.B: Proofgrid shell started at 19598@vlsi-ria84(local) jg_19403_vlsi-ria84_1
0.0.AM: clocks: 1, declared: 1, looping: 0, posedge: 1, negedge: 0, noedge: 0, bothedge: 0
0.0.AM: Last scan. Per property time limit: 0s
0.0.AM: Starting proof for property "PWM_TOP.p1"	[0.00 s].
0.0.AM: Trace Attempt  1	[0.00 s]
0.0.AM: Trace Attempt  2	[0.00 s]
0.0.AM: Trace Attempt  3	[0.00 s]
0.0.AM: Trace Attempt  4	[0.00 s]
0.0.AM: Trace Attempt  5	[0.00 s]
0.0.AM: Trace Attempt  1	[0.00 s]
0.0.AM: Trace Attempt  2	[0.00 s]
0.0.AM: Trace Attempt  3	[0.00 s]
0.0.AM: Trace Attempt  4	[0.01 s]
0.0.B: clocks: 1, declared: 1, looping: 0, posedge: 1, negedge: 0, noedge: 0, bothedge: 0
0.0.AM: Trace Attempt  5	[0.01 s]
0.0.B: Last scan. Per property time limit: 0s
0.0.B: Starting proof for property "PWM_TOP.p1"	[0.00 s].
0.0.B: Trace Attempt  1	[0.00 s]
0.0.B: Trace Attempt  2	[0.00 s]
0.0.B: Trace Attempt  3	[0.00 s]
0.0.B: Trace Attempt  4	[0.00 s]
0.0.B: Trace Attempt  5	[0.00 s]
0.0.AM: Trace Attempt  1	[0.01 s]
0.0.AM: Trace Attempt  2	[0.01 s]
0.0.AM: Trace Attempt  3	[0.01 s]
0.0.N: Trace Attempt  1	[0.04 s]
0.0.N: Trace Attempt  2	[0.04 s]
0.0.N: Trace Attempt  3	[0.04 s]
0.0.N: Trace Attempt  4	[0.04 s]
0.0.AM: Trace Attempt  4	[0.02 s]
0.0.N: Trace Attempt  5	[0.05 s]
0.0.AM: Trace Attempt  5	[0.02 s]
0.0.Oh: Proofgrid shell started at 19597@vlsi-ria84(local) jg_19403_vlsi-ria84_1
0.0.Oh: clocks: 1, declared: 1, looping: 0, posedge: 1, negedge: 0, noedge: 0, bothedge: 0
0.0.Oh: Reached length limit (2147483647) [0.00 s]
0.0.Oh: Exited with Success (@ 0.07 s)
0.0.AM: Trace Attempt  1	[0.06 s]
0.0.AM: Trace Attempt  2	[0.06 s]
0.0.AM: Trace Attempt  3	[0.06 s]
0.0.AM: Trace Attempt  4	[0.06 s]
0.0.AM: Trace Attempt  5	[0.07 s]
0.0.N: Trace Attempt  1	[0.18 s]
0.0.N: Trace Attempt  2	[0.18 s]
0.0.N: Trace Attempt  3	[0.18 s]
0.0.N: Trace Attempt  4	[0.18 s]
0.0.N: Trace Attempt  5	[0.19 s]
0.0.AM: Trace Attempt  1	[0.35 s]
0.0.AM: Trace Attempt  2	[0.35 s]
0.0.AM: Trace Attempt  3	[0.35 s]
0.0.AM: Trace Attempt  4	[0.35 s]
0.0.AM: Trace Attempt  5	[0.35 s]
0.0.N: Trace Attempt  1	[0.44 s]
0.0.N: Trace Attempt  2	[0.44 s]
0.0.N: Trace Attempt  3	[0.44 s]
0.0.N: Trace Attempt  4	[0.44 s]
0.0.N: Trace Attempt  5	[0.45 s]
0.0.N: Trace Attempt  1	[0.70 s]
0.0.N: Trace Attempt  2	[0.70 s]
0.0.N: Trace Attempt  3	[0.70 s]
0.0.N: Trace Attempt  4	[0.71 s]
0.0.N: Trace Attempt  5	[0.71 s]
0.0.N: Trace Attempt  1	[1.14 s]
0.0.N: Trace Attempt  2	[1.14 s]
0.0.N: Trace Attempt  3	[1.14 s]
0.0.N: Trace Attempt  4	[1.14 s]
0.0.N: Trace Attempt  5	[1.15 s]
0.0.N: Trace Attempt  1	[2.66 s]
0.0.N: Trace Attempt  2	[2.66 s]
0.0.N: Trace Attempt  3	[2.66 s]
0.0.N: Trace Attempt  4	[2.66 s]
0.0.N: Trace Attempt  5	[2.67 s]
0.0.AM: Trace Attempt  1	[2.81 s]
0.0.AM: Trace Attempt  2	[2.81 s]
0.0.AM: Trace Attempt  3	[2.81 s]
0.0.AM: Trace Attempt  4	[2.81 s]
0.0.AM: Trace Attempt  5	[2.82 s]
0.0.Hp: Trace Attempt 140	[4.05 s]
0.0.B: Trace Attempt 151	[4.02 s]
0.0.Ht: Trace Attempt 142	[4.04 s]
0.0.N: Trace Attempt  1	[4.19 s]
0.0.N: Trace Attempt  2	[4.20 s]
0.0.N: Trace Attempt  3	[4.20 s]
0.0.N: Trace Attempt  4	[4.20 s]
0.0.N: Trace Attempt  5	[4.20 s]
0.0.N: Trace Attempt  1	[5.76 s]
0.0.N: Trace Attempt  2	[5.76 s]
0.0.N: Trace Attempt  3	[5.76 s]
0.0.N: Trace Attempt  4	[5.76 s]
0.0.N: Trace Attempt  5	[5.77 s]
0.0.AM: Trace Attempt 75	[6.89 s]
0.0.N: Trace Attempt  1	[7.28 s]
0.0.N: Trace Attempt  2	[7.28 s]
0.0.N: Trace Attempt  3	[7.28 s]
0.0.N: Trace Attempt  4	[7.28 s]
0.0.N: Trace Attempt  5	[7.29 s]
0.0.Hp: Trace Attempt 174	[8.13 s]
0.0.Ht: Trace Attempt 177	[8.13 s]
0.0.B: Trace Attempt 192	[8.12 s]
0.0.N: Trace Attempt  1	[8.88 s]
0.0.N: Trace Attempt  2	[8.88 s]
0.0.N: Trace Attempt  3	[8.88 s]
0.0.N: Trace Attempt  4	[8.88 s]
0.0.N: Trace Attempt  5	[8.89 s]
0.0.N: Trace Attempt  1	[10.52 s]
0.0.N: Trace Attempt  2	[10.52 s]
0.0.N: Trace Attempt  3	[10.52 s]
0.0.N: Trace Attempt  4	[10.53 s]
0.0.N: Trace Attempt  5	[10.53 s]
0.0.AM: Trace Attempt 86	[11.01 s]
0.0.Ht: Trace Attempt 202	[12.15 s]
0.0.B: Trace Attempt 218	[12.18 s]
0.0.N: Trace Attempt  1	[12.22 s]
0.0.N: Trace Attempt  2	[12.22 s]
0.0.N: Trace Attempt  3	[12.22 s]
0.0.N: Trace Attempt  4	[12.23 s]
0.0.N: Trace Attempt  5	[12.23 s]
0.0.Hp: Trace Attempt 201	[12.55 s]
0.0.N: Trace Attempt  1	[13.93 s]
0.0.N: Trace Attempt  2	[13.93 s]
0.0.N: Trace Attempt  3	[13.93 s]
0.0.N: Trace Attempt  4	[13.93 s]
0.0.N: Trace Attempt  5	[13.94 s]
0.0.AM: Trace Attempt 91	[15.11 s]
0.0.N: Trace Attempt  1	[15.65 s]
0.0.N: Trace Attempt  2	[15.65 s]
0.0.N: Trace Attempt  3	[15.65 s]
0.0.N: Trace Attempt  4	[15.66 s]
0.0.N: Trace Attempt  5	[15.66 s]
0.0.Ht: Trace Attempt 225	[16.23 s]
0.0.B: Trace Attempt 243	[16.31 s]
0.0.Hp: Trace Attempt 224	[16.69 s]
0.0.N: Trace Attempt  1	[17.45 s]
0.0.N: Trace Attempt  2	[17.45 s]
0.0.N: Trace Attempt  3	[17.45 s]
0.0.N: Trace Attempt  4	[17.45 s]
0.0.N: Trace Attempt  5	[17.45 s]
0.0.AM: Trace Attempt 90	[19.12 s]
0.0.N: Trace Attempt  1	[19.30 s]
0.0.N: Trace Attempt  2	[19.30 s]
0.0.N: Trace Attempt  3	[19.30 s]
0.0.N: Trace Attempt  4	[19.30 s]
0.0.N: Trace Attempt  5	[19.31 s]
0.0.Ht: Trace Attempt 241	[20.50 s]
0.0.B: Trace Attempt 260	[20.50 s]
0.0.Hp: Trace Attempt 239	[20.76 s]
0.0.AM: Trace Attempt  1	[22.09 s]
0.0.AM: Trace Attempt  2	[22.09 s]
0.0.AM: Trace Attempt  3	[22.09 s]
0.0.AM: Trace Attempt  4	[22.10 s]
0.0.AM: Trace Attempt  5	[22.11 s]
0.0.N: Trace Attempt  1	[22.54 s]
0.0.N: Trace Attempt  2	[22.54 s]
0.0.N: Trace Attempt  3	[22.54 s]
0.0.N: Trace Attempt  4	[22.54 s]
0.0.N: Trace Attempt  5	[22.55 s]
0.0.Hp: Trace Attempt 254	[24.81 s]
0.0.B: Trace Attempt 273	[24.78 s]
0.0.Ht: Trace Attempt 256	[24.81 s]
0.0.AM: Trace Attempt 67	[26.11 s]
0.0.N: Trace Attempt 65	[26.55 s]
0.0.B: Trace Attempt 285	[28.79 s]
0.0.Ht: Trace Attempt 265	[28.97 s]
0.0.Hp: Trace Attempt 264	[29.34 s]
0.0.AM: Trace Attempt 88	[30.21 s]
0.0.N: Trace Attempt 82	[30.75 s]
0.0.Ht: Trace Attempt 274	[33.30 s]
0.0.B: Trace Attempt 297	[33.30 s]
0.0.Hp: Trace Attempt 272	[33.44 s]
0.0.AM: Trace Attempt 106	[34.30 s]
0.0.N: Trace Attempt 90	[35.45 s]
0.0.B: Trace Attempt 308	[37.38 s]
0.0.Ht: Trace Attempt 283	[37.57 s]
0.0.Hp: Trace Attempt 282	[38.32 s]
0.0.AM: Trace Attempt 115	[38.52 s]
0.0.N: Trace Attempt 94	[39.71 s]
0.0.Ht: Trace Attempt 291	[41.62 s]
0.0.B: Trace Attempt 319	[41.70 s]
0.0.AM: Trace Attempt 125	[42.73 s]
0.0.Hp: Trace Attempt 291	[42.77 s]
0.0.B: Trace Attempt 328	[45.74 s]
0.0.Ht: Trace Attempt 299	[45.95 s]
0.0.Hp: Trace Attempt 299	[47.02 s]
0.0.AM: Trace Attempt 132	[47.03 s]
0.0.N: Trace Attempt 98	[47.59 s]
0.0.N: Trace Attempt  1	[47.86 s]
0.0.N: Trace Attempt  2	[47.86 s]
0.0.N: Trace Attempt  3	[47.86 s]
0.0.N: Trace Attempt  4	[47.87 s]
0.0.N: Trace Attempt  5	[47.87 s]
0.0.B: Trace Attempt 337	[50.10 s]
0.0.Ht: Trace Attempt 308	[50.17 s]
0.0.Hp: Trace Attempt 308	[51.22 s]
0.0.AM: Trace Attempt 141	[51.56 s]
0.0.N: Trace Attempt 65	[51.90 s]
0.0.B: Trace Attempt 346	[54.34 s]
0.0.Ht: Trace Attempt 316	[54.68 s]
0.0.Hp: Trace Attempt 315	[55.33 s]
0.0.AM: Trace Attempt 147	[55.60 s]
0.0.N: Trace Attempt 82	[56.03 s]
0.0.B: Trace Attempt 354	[58.80 s]
0.0.Ht: Trace Attempt 322	[59.26 s]
0.0.Hp: Trace Attempt 321	[59.67 s]
0.0.AM: Trace Attempt 150	[59.65 s]
0.0.N: Trace Attempt 90	[60.73 s]
0.0.B: Trace Attempt 362	[63.30 s]
0.0.Ht: Trace Attempt 329	[63.34 s]
0.0.Hp: Trace Attempt 328	[63.87 s]
0.0.AM: Trace Attempt 158	[64.22 s]
0.0.N: Trace Attempt 94	[65.03 s]
0.0.B: Trace Attempt 370	[67.45 s]
0.0.Ht: Trace Attempt 337	[67.91 s]
0.0.Hp: Trace Attempt 336	[68.38 s]
0.0.AM: Trace Attempt 162	[70.16 s]
0.0.B: Trace Attempt 376	[71.57 s]
0.0.Ht: Trace Attempt 343	[72.30 s]
0.0.Hp: Trace Attempt 341	[72.45 s]
0.0.N: Trace Attempt 99	[73.26 s]
0.0.N: Trace Attempt  1	[73.56 s]
0.0.N: Trace Attempt  2	[73.56 s]
0.0.N: Trace Attempt  3	[73.56 s]
0.0.N: Trace Attempt  4	[73.56 s]
0.0.N: Trace Attempt  5	[73.57 s]
0.0.AM: Trace Attempt 166	[75.94 s]
0.0.B: Trace Attempt 384	[75.95 s]
0.0.Ht: Trace Attempt 349	[76.53 s]
0.0.Hp: Trace Attempt 349	[77.62 s]
0.0.N: Trace Attempt 66	[77.85 s]
0.0.AM: Trace Attempt 169	[80.36 s]
0.0.B: Trace Attempt 390	[80.47 s]
0.0.Ht: Trace Attempt 354	[80.89 s]
0.0.Hp: Trace Attempt 354	[81.81 s]
0.0.N: Trace Attempt 83	[82.06 s]
0.0.Ht: Trace Attempt 360	[85.02 s]
0.0.B: Trace Attempt 396	[85.21 s]
0.0.AM: Trace Attempt 172	[85.66 s]
0.0.Hp: Trace Attempt 360	[85.91 s]
0.0.N: Trace Attempt 90	[86.37 s]
0.0.B: Trace Attempt 401	[89.50 s]
0.0.Ht: Trace Attempt 367	[89.73 s]
0.0.Hp: Trace Attempt 367	[90.61 s]
0.0.N: Trace Attempt 94	[90.62 s]
0.0.AM: Trace Attempt 175	[91.38 s]
0.0.B: Trace Attempt 406	[93.99 s]
0.0.Ht: Trace Attempt 371	[94.11 s]
0.0.Hp: Trace Attempt 371	[95.07 s]
0.0.AM: Trace Attempt 177	[97.41 s]
0.0.N: Trace Attempt 100	[98.13 s]
0.0.N: Trace Attempt  1	[98.40 s]
0.0.N: Trace Attempt  2	[98.40 s]
0.0.N: Trace Attempt  3	[98.40 s]
0.0.N: Trace Attempt  4	[98.40 s]
0.0.N: Trace Attempt  5	[98.41 s]
0.0.Ht: Trace Attempt 378	[98.45 s]
0.0.B: Trace Attempt 411	[98.47 s]
0.0.Hp: Trace Attempt 378	[99.34 s]
0.0.N: Trace Attempt 65	[102.43 s]
0.0.Ht: Trace Attempt 382	[102.60 s]
0.0.B: Trace Attempt 416	[102.76 s]
0.0.AM: Trace Attempt 178	[102.97 s]
0.0.Hp: Trace Attempt 382	[103.46 s]
0.0.N: Trace Attempt 82	[106.58 s]
0.0.Hp: Trace Attempt 387	[107.48 s]
0.0.Ht: Trace Attempt 388	[107.50 s]
0.0.B: Trace Attempt 421	[107.64 s]
0.0.N: Trace Attempt 90	[111.30 s]
0.0.Ht: Trace Attempt 393	[111.87 s]
0.0.Hp: Trace Attempt 392	[111.91 s]
0.0.B: Trace Attempt 426	[112.24 s]
0.0.AM: Trace Attempt 180	[112.44 s]
0.0.N: Trace Attempt 94	[115.58 s]
0.0.Ht: Trace Attempt 398	[116.10 s]
0.0.Hp: Trace Attempt 397	[116.28 s]
0.0.AM: Trace Attempt 181	[116.92 s]
0.0.B: Trace Attempt 431	[116.93 s]
0.0.B: Trace Attempt 435	[120.96 s]
0.0.Ht: Trace Attempt 402	[121.03 s]
0.0.Hp: Trace Attempt 402	[122.27 s]
0.0.AM: Trace Attempt 182	[122.25 s]
0.0.N: Trace Attempt 101	[123.84 s]
0.0.N: Trace Attempt  1	[124.12 s]
0.0.N: Trace Attempt  2	[124.12 s]
0.0.N: Trace Attempt  3	[124.12 s]
0.0.N: Trace Attempt  4	[124.12 s]
0.0.N: Trace Attempt  5	[124.13 s]
0.0.Ht: Trace Attempt 407	[125.25 s]
0.0.B: Trace Attempt 440	[125.63 s]
0.0.Hp: Trace Attempt 407	[126.33 s]
0.0.N: Trace Attempt 65	[128.17 s]
0.0.AM: Trace Attempt 184	[128.30 s]
0.0.B: Trace Attempt 445	[130.44 s]
0.0.Ht: Trace Attempt 412	[130.82 s]
0.0.Hp: Trace Attempt 412	[131.77 s]
0.0.N: Trace Attempt 82	[132.31 s]
0.0.Ht: Trace Attempt 415	[134.84 s]
0.0.AM: Trace Attempt 185	[135.40 s]
0.0.B: Trace Attempt 450	[135.43 s]
0.0.Hp: Trace Attempt 416	[136.54 s]
0.0.N: Trace Attempt 90	[137.02 s]
0.0.Ht: Trace Attempt 420	[139.43 s]
0.0.B: Trace Attempt 454	[140.01 s]
0.0.Hp: Trace Attempt 421	[141.10 s]
0.0.N: Trace Attempt 94	[141.29 s]
0.0.AM: Trace Attempt 187	[143.30 s]
0.0.Ht: Trace Attempt 425	[144.09 s]
0.0.B: Trace Attempt 458	[144.37 s]
0.0.Hp: Trace Attempt 426	[145.79 s]
0.0.Ht: Trace Attempt 429	[148.19 s]
0.0.AM: Trace Attempt 188	[148.52 s]
0.0.B: Trace Attempt 462	[149.32 s]
0.0.Hp: Trace Attempt 430	[149.80 s]
0.0.N: Trace Attempt 102	[150.13 s]
0.0.N: Trace Attempt  1	[150.43 s]
0.0.N: Trace Attempt  2	[150.44 s]
0.0.N: Trace Attempt  3	[150.44 s]
0.0.N: Trace Attempt  4	[150.44 s]
0.0.N: Trace Attempt  5	[150.45 s]
0.0.Ht: Trace Attempt 434	[153.15 s]
0.0.AM: Trace Attempt 189	[153.36 s]
0.0.B: Trace Attempt 466	[154.03 s]
0.0.N: Trace Attempt 65	[154.50 s]
0.0.Hp: Trace Attempt 435	[156.02 s]
0.0.Ht: Trace Attempt 437	[157.35 s]
0.0.AM: Trace Attempt 190	[157.51 s]
0.0.B: Trace Attempt 470	[158.55 s]
0.0.N: Trace Attempt 82	[158.63 s]
0.0.Hp: Trace Attempt 440	[160.80 s]
0.0.Ht: Trace Attempt 442	[162.09 s]
0.0.B: Trace Attempt 474	[162.97 s]
0.0.N: Trace Attempt 90	[163.29 s]
0.0.Ht: Trace Attempt 445	[166.48 s]
0.0.Hp: Trace Attempt 445	[167.14 s]
0.0.N: Trace Attempt 94	[167.53 s]
0.0.B: Trace Attempt 478	[167.72 s]
0.0.AM: Trace Attempt 192	[168.69 s]
0.0.Ht: Trace Attempt 448	[170.57 s]
0.0.Hp: Trace Attempt 448	[171.23 s]
0.0.B: Trace Attempt 481	[171.84 s]
0.0.AM: Trace Attempt 193	[173.57 s]
0.0.Ht: Trace Attempt 452	[175.05 s]
0.0.Hp: Trace Attempt 452	[175.67 s]
0.0.N: Trace Attempt 103	[175.71 s]
0.0.N: Trace Attempt  1	[176.00 s]
0.0.N: Trace Attempt  2	[176.00 s]
0.0.N: Trace Attempt  3	[176.00 s]
0.0.N: Trace Attempt  4	[176.01 s]
0.0.N: Trace Attempt  5	[176.02 s]
0.0.B: Trace Attempt 484	[176.06 s]
0.0.Ht: Trace Attempt 456	[179.38 s]
0.0.Hp: Trace Attempt 456	[179.98 s]
0.0.N: Trace Attempt 65	[180.03 s]
0.0.B: Trace Attempt 488	[180.30 s]
0.0.N: Trace Attempt 70	[180.95 s]
0.0.N: Stopped processing property "PWM_TOP.p1"	[181.09 s].
0.0.N: Morphing to Ncustom1
0.0.N: All properties determined. [0.00 s]
0.0.N: Exited with Success (@ 0.00 s)
0.0.Ncustom1: clocks: 1, declared: 1, looping: 0, posedge: 1, negedge: 0, noedge: 0, bothedge: 0
0.0.Ncustom1: Starting proof for property "PWM_TOP.p1"	[0.00 s].
0.0.Ncustom1: Trace Attempt 102	[0.00 s]
0.0.B: Stopped processing property "PWM_TOP.p1"	[181.06 s].
0.0.B: Morphing to Bcustom2
0.0.B: All properties determined. [0.00 s]
0.0.B: Exited with Success (@ 0.00 s)
0.0.Bcustom2: clocks: 1, declared: 1, looping: 0, posedge: 1, negedge: 0, noedge: 0, bothedge: 0
0.0.Bcustom2: Starting proof for property "PWM_TOP.p1"	[0.00 s].
0.0.Bcustom2: Trace Attempt  1	[0.00 s]
0.0.Bcustom2: Trace Attempt  2	[0.00 s]
0.0.Bcustom2: Trace Attempt  1	[0.00 s]
0.0.Bcustom2: Trace Attempt  2	[0.00 s]
0.0.Bcustom2: Trace Attempt  3	[0.00 s]
0.0.Bcustom2: Trace Attempt  4	[0.00 s]
0.0.Bcustom2: Trace Attempt  5	[0.00 s]
0.0.Tri: Proofgrid shell started at 20303@vlsi-ria84(local) jg_19403_vlsi-ria84_1
0.0.Tri: clocks: 1, declared: 1, looping: 0, posedge: 1, negedge: 0, noedge: 0, bothedge: 0
0.0.Tri: Last scan. Per property time limit: 0s
0.0.Tri: Starting proof for property "PWM_TOP.p1"	[0.00 s].
0.0.Tri: Trace Attempt  1	[0.00 s]
0.0.Tri:    0.00" ---- Launching main thread ----
0.0.Tri:    0.03" ---- Launching abstraction thread ----
0.0.Tri:    0.03" ---- Launching multi-phase simplification thread ----
0.0.Tri:    0.04" ---- Launching liveness simplification thread ----
0.0.AM: Stopped processing property "PWM_TOP.p1"	[181.39 s].
0.0.AM: Morphing to AMcustom3
0.0.AM: All properties determined. [0.00 s]
0.0.AM: Exited with Success (@ 0.00 s)
0.0.AMcustom3: clocks: 1, declared: 1, looping: 0, posedge: 1, negedge: 0, noedge: 0, bothedge: 0
0.0.AMcustom3: Starting proof for property "PWM_TOP.p1"	[0.00 s].
0.0.AMcustom3: Trace Attempt  1	[0.00 s]
0.0.AMcustom3: Trace Attempt  2	[0.00 s]
0.0.AMcustom3: Trace Attempt  3	[0.00 s]
0.0.AMcustom3: Trace Attempt  4	[0.00 s]
0.0.AMcustom3: Trace Attempt  5	[0.00 s]
0.0.AMcustom3: Trace Attempt  1	[0.00 s]
0.0.AMcustom3: Trace Attempt  2	[0.00 s]
0.0.AMcustom3: Trace Attempt  3	[0.00 s]
0.0.AMcustom3: Trace Attempt  4	[0.01 s]
0.0.AMcustom3: Trace Attempt  5	[0.01 s]
0.0.AMcustom3: Trace Attempt  1	[0.01 s]
0.0.AMcustom3: Trace Attempt  2	[0.01 s]
0.0.AMcustom3: Trace Attempt  3	[0.01 s]
0.0.AMcustom3: Trace Attempt  4	[0.02 s]
0.0.AMcustom3: Trace Attempt  5	[0.02 s]
0.0.AMcustom3: Trace Attempt  1	[0.07 s]
0.0.AMcustom3: Trace Attempt  2	[0.07 s]
0.0.AMcustom3: Trace Attempt  3	[0.07 s]
0.0.AMcustom3: Trace Attempt  4	[0.07 s]
0.0.AMcustom3: Trace Attempt  5	[0.07 s]
0.0.AMcustom3: Trace Attempt  1	[0.42 s]
0.0.AMcustom3: Trace Attempt  2	[0.42 s]
0.0.AMcustom3: Trace Attempt  3	[0.42 s]
0.0.AMcustom3: Trace Attempt  4	[0.42 s]
0.0.AMcustom3: Trace Attempt  5	[0.43 s]
0.0.Tri:    0.80" Simplification phase 1 complete
0.0.Ncustom1: Requesting engine job to terminate
0.0.Bcustom2: Requesting engine job to terminate
0.0.AMcustom3: Requesting engine job to terminate
0.0.Tri: Requesting engine job to terminate
0.0.Hp: Requesting engine job to terminate
0.0.Ht: Requesting engine job to terminate
INFO (IPF144): 0: Initiating shutdown of proof [182.04 s]
0.0.Tri: A proof was found: No trace exists. [0.88 s]
INFO (IPF057): 0.0.Tri: The property "PWM_TOP.p1" was proven in 0.88 s.
0.0.AMcustom3: Trace Attempt 25	[0.61 s]
0.0.AMcustom3: Stopped processing property "PWM_TOP.p1"	[0.62 s].
0.0.AMcustom3: All properties determined. [0.61 s]
0.0.Ncustom1: Stopped processing property "PWM_TOP.p1"	[0.94 s].
0.0.Ncustom1: All properties determined. [0.95 s]
0.0.Bcustom2: Trace Attempt 83	[0.91 s]
0.0.Bcustom2: Stopped processing property "PWM_TOP.p1"	[0.94 s].
0.0.Bcustom2: All properties determined. [0.94 s]
0.0.Ncustom1: Exited with Success (@ 182.05 s)
0: ProofGrid usable level: 0
0.0.Bcustom2: Exited with Success (@ 182.05 s)
0.0.AMcustom3: Exited with Success (@ 182.06 s)
0.0.Ht: Trace Attempt 458	[181.87 s]
0.0.Ht: All properties determined. [182.04 s]
0.0.Ht: Exited with Success (@ 182.08 s)
0.0.Hp: Trace Attempt 457	[181.26 s]
0.0.Hp: All properties determined. [182.10 s]
0.0.Hp: Exited with Success (@ 182.15 s)
0.0.Tri: Stopped processing property "PWM_TOP.p1"	[1.02 s].
0.0.Tri: All properties determined. [1.02 s]
0.0.Tri: Exited with Success (@ 182.19 s)
0: --------------------------------------------------------------
ProofGrid Summary (utilization 99.97 %)
--------------------------------------------------------------
     engines started                               :    10
     engine jobs started                           :     7

    Average time in state (seconds)
    ------------------------------------------------------
    Engine  Pending     Running        Dead    Utilization
    ------------------------------------------------------
     Hp        0.03      182.04        0.00       99.98 %
     Ht        0.03      182.01        0.00       99.98 %
     Oh        0.07        0.00        0.00        0.29 %
    Ncustom1        0.03      182.02        0.00       99.98 %
    Bcustom2        0.04      181.99        0.00       99.98 %
    AMcustom3        0.03      181.68        0.00       99.98 %
    Tri        0.06        0.88        0.00       93.14 %
    all        0.04      130.09        0.00       99.97 %

    Total time in state (seconds)
    -----------------------------------------
            Pending     Running        Dead  
    -----------------------------------------
               0.29      910.63        0.00

    Data read    : 1.44 MiB
    Data written : 2.84 kiB

0: All pending notifications were processed.
INFO (IPF059): 0: Completed proof on task: "<embedded>"

==============================================================
SUMMARY
==============================================================
           Properties Considered              : 1
                 assertions                   : 1
                  - proven                    : 1 (100%)
                  - bounded_proven (user)     : 0 (0%)
                  - bounded_proven (auto)     : 0 (0%)
                  - marked_proven             : 0 (0%)
                  - cex                       : 0 (0%)
                  - ar_cex                    : 0 (0%)
                  - undetermined              : 0 (0%)
                  - unknown                   : 0 (0%)
                  - error                     : 0 (0%)
                 covers                       : 0
                  - unreachable               : 0
                  - bounded_unreachable (user): 0
                  - covered                   : 0
                  - ar_covered                : 0
                  - undetermined              : 0
                  - unknown                   : 0
                  - error                     : 0
proven
[<embedded>] % exit -force
INFO (IPL005): Received request to exit from the console.
INFO: Waiting for proof threads to stop...
INFO: Proof threads stopped.
INFO (IPL018): The peak resident set memory use for this session was 1.199 GB.
INFO (IPL014): Waiting for the Tcl-thread to exit.
INFO (IPL015): The Tcl-thread exited with status 0.
INFO (IPL016): Exiting the analysis session with status 0.
