# ----------------------------------------
# Jasper Version Info
# tool      : Jasper 2024.06
# platform  : Linux 3.10.0-1160.62.1.el7.x86_64
# version   : 2024.06p002 64 bits
# build date: 2024.09.02 16:28:38 UTC
# ----------------------------------------
# started   : 2025-11-17 18:20:55 IST
# hostname  : vlsi-ria84.vlsidomain
# pid       : 24223
# arguments : '-label' 'session_0' '-console' '//127.0.0.1:46388' '-nowindow' '-style' 'windows' '-exitonerror' '-data' 'AAAAwnicY2RgYLCp////PwMYMD6A0Aw2jAyoAMRnQhUJbEChGRhYYZphSliAmItBl6GAoYghnyELyFNj0ANCfSA7HS6aypDMUMJQDBQNYAhn8GWIZzAHquQB6ktiSATKJDNkAPlCSLJ6YNEcsB0AMeMUow==' '-proj' '/users/rompel/jasper_executions/safety_liveness/jgprojects/PWM_7/sessionLogs/session_0' '-init' '-hidden' '/users/rompel/jasper_executions/safety_liveness/jgprojects/PWM_7/.tmp/.initCmds.tcl' 'PWM_7.tcl' '-hidden' '/users/rompel/jasper_executions/safety_liveness/jgprojects/PWM_7/.tmp/.postCmds.tcl'

Any disclosure about the Cadence Design Systems software or its use
model to any third party violates the written Non-Disclosure Agreement
between Cadence Design Systems, Inc. and the customer.

THIS SOFTWARE CONTAINS CONFIDENTIAL INFORMATION AND TRADE SECRETS OF
CADENCE DESIGN SYSTEMS, INC. USE, DISCLOSURE, OR REPRODUCTION IS
PROHIBITED WITHOUT THE PRIOR EXPRESS WRITTEN PERMISSION OF CADENCE
DESIGN SYSTEMS, INC.

Copyright (C) 2000-2024 Cadence Design Systems, Inc. All Rights
Reserved.  Unpublished -- rights reserved under the copyright laws of
the United States.

This product includes software developed by others and redistributed
according to license agreement. See doc/third_party_readme.txt for
further details.

RESTRICTED RIGHTS LEGEND

Use, duplication, or disclosure by the Government is subject to
restrictions as set forth in subparagraph (c) (1) (ii) of the Rights in
Technical Data and Computer Software clause at DFARS 252.227-7013 or
subparagraphs (c) (1) and (2) of Commercial Computer Software -- Restricted
Rights at 48 CFR 52.227-19, as applicable.


                          Cadence Design Systems, Inc.
                          2655 Seely Avenue
                          San Jose, CA 95134
                          Phone: 408.943.1234

For technical assistance visit http://support.cadence.com.

Jasper Apps Analysis Session - /users/rompel/jasper_executions/safety_liveness/jgprojects/PWM_7/sessionLogs/session_0

WARNING (WG017): [session]: The system's locale is "ANSI_X3.4-1968", which is not UTF-8. Non-ASCII characters might not be handled correctly.
WARNING (WG017): [jg_console]: The system's locale is "ANSI_X3.4-1968", which is not UTF-8. Non-ASCII characters might not be handled correctly.
INFO: successfully checked out license "jasper_fao".
INFO: reading configuration file "/users/rompel/.config/cadence/jasper.conf".
% analyze -sv09 ../PWM_7.sv
[-- (VERI-1482)] Analyzing Verilog file '/tools/cadence2425/JASPER/jasper_2024.06p002/lib/verilog/packages/std/std.sv' into library 'std'
[-- (VERI-1482)] Analyzing Verilog file '../PWM_7.sv'
[INFO (VERI-2561)] ../PWM_7.sv(7): undeclared symbol 'lbR', assumed default net type 'wire'
[INFO (VERI-2561)] ../PWM_7.sv(8): undeclared symbol 'ubR', assumed default net type 'wire'
% elaborate -bbox_mul 1000000 -bbox_div 1000000 -bbox_mod 1000000 -bbox_a 1000000
[INFO (HIER-8002)] ../PWM_7.sv(32): Disabling old hierarchical reference handler
[INFO (VERI-1018)] ../PWM_7.sv(1): compiling module 'PWM_TOP'
[WARN (VERI-1209)] ../PWM_7.sv(7): expression size 17 truncated to fit in target size 1
[WARN (VERI-1209)] ../PWM_7.sv(8): expression size 17 truncated to fit in target size 1
[WARN (VERI-1209)] ../PWM_7.sv(13): expression size 32 truncated to fit in target size 16
[INFO (VERI-8005)] ../PWM_7.sv(1): Unintentional sequential element inferred for pulse_red read before write using blocking assignment
[INFO (VERI-8005)] ../PWM_7.sv(1): Unintentional sequential element inferred for lb_pulse read before write using blocking assignment
[INFO (VERI-8005)] ../PWM_7.sv(1): Unintentional sequential element inferred for ub_pulse read before write using blocking assignment
INFO (ISW003): Top module name is "PWM_TOP".
INFO (INL208): Elaboration synthesis summary:
  Number of synthesized netlists          1 (0 packages)
  Single run mode                         On
  Pipeline                                On (1 pipelined netlists)
  Late hierarchical reference connection  On
  Number of analyzed Verilog modules      1 (1 synthesized)
  Number of analyzed VHDL entities        0 (0 synthesized)
INFO (INL003): Clearing all state information (assumes, stopats, and so forth).
PWM_TOP
[<embedded>] % reset -none
INFO (IPM031): Clearing proof results of all properties.
[<embedded>] % clock clk
[<embedded>] % prove -all
Ncustom1: Custom engine code is hT3Ng7hPPfiYQOTDZ3qhYOwGAM51eA+J/FjkM5shLioAsqhgLR4Ft+O1BuKG6ilQ83B9tLXSl+CwjiTMAQA
Bcustom2: Custom engine code is hT3Nm7hPr1Vp3Di1Ra2USNIGL4JypRnLKLAdF6JAyuavO2JfGCiY9OZJhcAcOUnLx5xwNdhILGrAWX9s+z2WDkKwNR7tAfClBEjRFVQeq6DU54boFgEA
AMcustom3: Custom engine code is hT3Ng7hP/feYQOTDZ3qhYOwGAM51eA+J/FjkM5shLioAsqhgLR4Ft+O1BuKG6ilQ83B9tLXSmmqwm7g9AQA
Mpcustom4: Custom engine code is hT3NZbhP9fmY2AbBQnsjfOxn6c+6e6yL+/e8fZFmaQrnlgEA
INFO (IPF036): Starting proof on task: "<embedded>", 1 properties to prove with 0 already proven/unreachable
INFO (IRS029): Starting reset analysis: phase 1 of 4.
INFO (IRS030): Running reset analysis: phase 2 of 4.
INFO (IRS031): Running reset analysis: phase 3 of 4.
INFO (IRS020): Starting the reset analysis simulation with a limit of 100 iterations (phase 4 of 4).
INFO (IRS024): Reset iterations 0 to 4 analyzed.
INFO (IRS018): Reset analysis simulation executed for 3 iterations. Assigned values for 2 of 19 design flops, 0 of 0 design latches, 3 of 3 internal elements.
INFO (IRS039): Reset analysis complete.
INFO (IPF031): Settings used for proof thread 0:
    orchestration                 = on
    time_limit                    = 86400s
    per_property_time_limit       = 1s * 10 ^ scan
    engine_mode                   = auto
    proofgrid_per_engine_max_jobs = 1
    max engine jobs               = auto
    proofgrid_mode                = local
    proofgrid_restarts            = 10
0: Using multistage preprocessing
AMcustom5: Custom engine code is hT3N1rhP11/52HrFRS21ROp2LOjVTgPvT8L8BGXHgLhaIuqtT4nARFjUqrBL+7pLmaTOzBepZW/Jm8SSrHDybSQtoNiO3y43wk+dEoWlsZizu97Fih6O6lPVG/LpWP5SsUPwlGagLNa1FKEFvwVXyX7//8prySbvSxIHXr5er+z4RAEA
0: Starting reduce
Ncustom6: Custom engine code is hT3OXrhPByJp3TrFSTLhUmMH4KVtJgmTCnNDF46yMXOKY48m4LS5nE7yBzFjA7kDuwO/GhGUpEPiky3p3wmPn3dJZHxFMsafSoObRzSC+tn7sEY0WbTdZ/FV4hL3MYH/b1CIUvXSWR4wqEoVLsmMOD4xIPT4lI1LO6ZCO7PnnWQuLwetnvKlrXx6wCW/A+x+enqslg1YPobi4wEF/EvbzOvcTYdJvl2s4H2yZg2b2ofAVN5WvhWk1HoBAA
ADcustom7: Custom engine code is hT3Nv7hPv1752HrFRa2kROx2f/ECJeZB2AZsLdlO8VwmIuqtT4nIDFXclhg+O+o+DMmQCekbheGk0kK28laA9gaOFDXsQp29J3X615HY1IPHJWd6FUFvCHjO+p1k652b5JJvZlShNpGlGSXAiQe/mEAj6tEBAA
Tricustom8: Custom engine code is hT3Nu7hPt1752DvFRa0kNDiyIV97VyejwM9C/jCLJjdPvusZONHY42VYUy0Q1ZotnhcVtNc56tJ5wbxv6V2+XpdsaSlHck5vfnbYjdwj1OECy9U+7oSQ0SZE3g5ayD+Phuh4odCJTjeKa2k4elM9ldQfkAEA
Gcustom9: Custom engine code is hT3NibhPDfeYQADBZnYcglOvK9Pfd7EOeniIqP8jNsyIqInncipMGcUXqAadachREE9F2PwhBUZUNw5kHnd4JdXkamORRgEA
C2custom10: Custom engine code is hT3NirhPjfWYQADBZnYcglOvK9Pfd7EOeniIqP8jNsyIqInncgkrYMMXCYbdK0dUjZIF9d4cJ0rHoBDjwVLBKuG86XYVV00BAA
AGcustom11: Custom engine code is hT3NirhP/fmYQADBZnYcglOvK9Pfd7EOeniIqP8jNsyIqInnckcwYMMXCYbdK0dUjZIF9d4cJ0rHoBDjwVLBKuHEZnZByh0BAA
Bcustom12: Custom engine code is hT3NjrhPDfiYQADBZnYcglOvK9PfWxFtenjIyBqfrgr7if/jL/yPOuK1BAflEcW0DxNH2eDIoezN2gxlQFg81RZtiWXh7aiTAidvAQA
0: Finished reduce in 0s
Ncustom13: Custom engine code is hT3NR7hPByFp3TrFSTLhUmMH4KWtJglTyV/c51BHEeZWamnJv767nE6PCak26bd3gf3XGN3rIRheufhDieCJQVISo+gNYUKhiUedBKGtsP/a18svAnlMJZudHxDFwK5ufsyoxsIyiAeSY2oi3tEuoDHr5gw42DFKAG3PqO3CEsl8Azzdt3pl5nGA1Ifv2H02eYsFzWb/nfp8PMb3F0krE/EgBcm8TD9Div8BAA
0.0.PRE: Performing Proof Simplification...
Tricustom14: Custom engine code is hT3Nu7hP3fiYQADBZnYcglNHp9bfd7EOeniIqP/ji8sGLQu8yhsFO+wxJ+O+R0bU8g/IewXFomyos+viQnWc2xYNYmMqpo3i40O7DaZR7qfp4YqNx26KRvQ/qx0BAA
0.0.N: clocks: 1, declared: 1, looping: 0, posedge: 1, negedge: 0, noedge: 0, bothedge: 0
0.0.N: Proof Simplification Iteration 1	[0.00 s]
0.0.N: Proof Simplification Iteration 2	[0.00 s]
0.0.PRE: A proof was found: No trace exists. [0.00 s]
INFO (IPF057): 0.0.PRE: The property ":noDeadEnd" was proven in 0.00 s.
    Use check_assumptions -show -dead_end to show this property in the property table.
0.0.PRE: A proof was found: No trace exists. [0.00 s]
INFO (IPF057): 0.0.PRE: The property ":noConflict" was proven in 0.00 s.
    Use check_assumptions -show to show this property in the property table.
INFO (IPF047): 0.0.PRE: The cover property ":live" was covered in 1 cycles in 0.00 s.
    Use check_assumptions -show -live to show this property in the property table.
0.0.PRE: Proof Simplification completed in 0.00 s
0: About to start ProofGrid in its own thread with a limit of 10000 pending notifications and a limit of 10 traces.
0: =============================== ProofGrid start ===============================
0: ProofGrid usable level: 1
0: Initial ProofGrid level: 1
0: ProofGrid is starting event handling
0.0.Hp: Proofgrid shell started at 24291@vlsi-ria84(local) jg_24223_vlsi-ria84_1
0.0.N: Proofgrid shell started at 24290@vlsi-ria84(local) jg_24223_vlsi-ria84_1
0.0.Hp: clocks: 1, declared: 1, looping: 0, posedge: 1, negedge: 0, noedge: 0, bothedge: 0
0.0.Hp: Last scan. Per property time limit: 0s
0.0.N: clocks: 1, declared: 1, looping: 0, posedge: 1, negedge: 0, noedge: 0, bothedge: 0
0.0.N: Last scan. Per property time limit: 0s
0.0.N: Starting proof for property "PWM_TOP.p1"	[0.00 s].
0.0.N: Trace Attempt  1	[0.00 s]
0.0.N: Trace Attempt  2	[0.00 s]
0.0.N: Trace Attempt  2	[0.00 s]
0.0.Hp: Trace Attempt  1	[0.00 s]
0.0.Hp: Trace Attempt  2	[0.00 s]
0.0.Hp: Trace Attempt  3	[0.00 s]
0.0.Hp: Trace Attempt  4	[0.00 s]
0.0.N: Trace Attempt  3	[0.00 s]
0.0.N: Trace Attempt  3	[0.00 s]
0.0.Hp: Trace Attempt  5	[0.00 s]
0.0.N: Trace Attempt  4	[0.00 s]
0.0.N: Trace Attempt  5	[0.00 s]
0.0.AM: Proofgrid shell started at 24325@vlsi-ria84(local) jg_24223_vlsi-ria84_1
0.0.Oh: Proofgrid shell started at 24323@vlsi-ria84(local) jg_24223_vlsi-ria84_1
0.0.Oh: clocks: 1, declared: 1, looping: 0, posedge: 1, negedge: 0, noedge: 0, bothedge: 0
0.0.Oh: Reached length limit (2147483647) [0.00 s]
0.0.B: Proofgrid shell started at 24324@vlsi-ria84(local) jg_24223_vlsi-ria84_1
0.0.AM: clocks: 1, declared: 1, looping: 0, posedge: 1, negedge: 0, noedge: 0, bothedge: 0
0.0.AM: Last scan. Per property time limit: 0s
0.0.AM: Starting proof for property "PWM_TOP.p1"	[0.00 s].
0.0.AM: Trace Attempt  1	[0.00 s]
0.0.Oh: Exited with Success (@ 0.03 s)
0.0.AM: Trace Attempt  2	[0.00 s]
0.0.AM: Trace Attempt  3	[0.00 s]
0.0.AM: Trace Attempt  4	[0.00 s]
0.0.AM: Trace Attempt  5	[0.00 s]
0.0.AM: Trace Attempt  1	[0.00 s]
0.0.AM: Trace Attempt  2	[0.00 s]
0.0.AM: Trace Attempt  3	[0.00 s]
0.0.AM: Trace Attempt  4	[0.01 s]
0.0.Ht: Proofgrid shell started at 24322@vlsi-ria84(local) jg_24223_vlsi-ria84_1
0.0.B: clocks: 1, declared: 1, looping: 0, posedge: 1, negedge: 0, noedge: 0, bothedge: 0
0.0.B: Last scan. Per property time limit: 0s
0.0.B: Starting proof for property "PWM_TOP.p1"	[0.00 s].
0.0.B: Trace Attempt  1	[0.00 s]
0.0.AM: Trace Attempt  5	[0.01 s]
0.0.B: Trace Attempt  2	[0.00 s]
0.0.B: Trace Attempt  3	[0.00 s]
0.0.B: Trace Attempt  4	[0.00 s]
0.0.B: Trace Attempt  5	[0.00 s]
0.0.Ht: clocks: 1, declared: 1, looping: 0, posedge: 1, negedge: 0, noedge: 0, bothedge: 0
0.0.Ht: Last scan. Per property time limit: 0s
0.0.Ht: Trace Attempt  1	[0.00 s]
0.0.Ht: Trace Attempt  2	[0.00 s]
0.0.Ht: Trace Attempt  3	[0.00 s]
0.0.Ht: Trace Attempt  4	[0.00 s]
0.0.Ht: Trace Attempt  5	[0.00 s]
0.0.AM: Trace Attempt  1	[0.01 s]
0.0.AM: Trace Attempt  2	[0.01 s]
0.0.AM: Trace Attempt  3	[0.01 s]
0.0.AM: Trace Attempt  4	[0.02 s]
0.0.AM: Trace Attempt  5	[0.02 s]
0.0.N: Trace Attempt  1	[0.06 s]
0.0.N: Trace Attempt  2	[0.06 s]
0.0.N: Trace Attempt  3	[0.06 s]
0.0.N: Trace Attempt  4	[0.06 s]
0.0.N: Trace Attempt  5	[0.06 s]
0.0.AM: Trace Attempt  1	[0.06 s]
0.0.AM: Trace Attempt  2	[0.06 s]
0.0.AM: Trace Attempt  3	[0.06 s]
0.0.AM: Trace Attempt  4	[0.06 s]
0.0.AM: Trace Attempt  5	[0.07 s]
0.0.N: Trace Attempt  1	[0.17 s]
0.0.N: Trace Attempt  2	[0.17 s]
0.0.N: Trace Attempt  3	[0.17 s]
0.0.N: Trace Attempt  4	[0.17 s]
0.0.N: Trace Attempt  5	[0.17 s]
0.0.N: Trace Attempt  1	[0.28 s]
0.0.N: Trace Attempt  2	[0.28 s]
0.0.N: Trace Attempt  3	[0.28 s]
0.0.N: Trace Attempt  4	[0.28 s]
0.0.N: Trace Attempt  5	[0.29 s]
0.0.N: Trace Attempt  1	[0.40 s]
0.0.N: Trace Attempt  2	[0.40 s]
0.0.N: Trace Attempt  3	[0.40 s]
0.0.N: Trace Attempt  4	[0.41 s]
0.0.N: Trace Attempt  5	[0.41 s]
0.0.AM: Trace Attempt  1	[0.48 s]
0.0.AM: Trace Attempt  2	[0.48 s]
0.0.AM: Trace Attempt  3	[0.48 s]
0.0.AM: Trace Attempt  4	[0.48 s]
0.0.AM: Trace Attempt  5	[0.48 s]
0.0.N: Trace Attempt  1	[0.53 s]
0.0.N: Trace Attempt  2	[0.53 s]
0.0.N: Trace Attempt  3	[0.53 s]
0.0.N: Trace Attempt  4	[0.53 s]
0.0.N: Trace Attempt  5	[0.54 s]
0.0.N: Trace Attempt  1	[0.66 s]
0.0.N: Trace Attempt  2	[0.66 s]
0.0.N: Trace Attempt  3	[0.66 s]
0.0.N: Trace Attempt  4	[0.67 s]
0.0.N: Trace Attempt  5	[0.67 s]
0.0.N: Trace Attempt  1	[0.97 s]
0.0.N: Trace Attempt  2	[0.97 s]
0.0.N: Trace Attempt  3	[0.97 s]
0.0.N: Trace Attempt  4	[0.97 s]
0.0.N: Trace Attempt  5	[0.98 s]
0.0.N: Trace Attempt  1	[2.16 s]
0.0.N: Trace Attempt  2	[2.16 s]
0.0.N: Trace Attempt  3	[2.16 s]
0.0.N: Trace Attempt  4	[2.17 s]
0.0.N: Trace Attempt  5	[2.17 s]
0.0.AM: Trace Attempt  1	[2.85 s]
0.0.AM: Trace Attempt  2	[2.85 s]
0.0.AM: Trace Attempt  3	[2.85 s]
0.0.AM: Trace Attempt  4	[2.86 s]
0.0.AM: Trace Attempt  5	[2.86 s]
0.0.N: Trace Attempt  1	[3.40 s]
0.0.N: Trace Attempt  2	[3.40 s]
0.0.N: Trace Attempt  3	[3.40 s]
0.0.N: Trace Attempt  4	[3.40 s]
0.0.N: Trace Attempt  5	[3.41 s]
0.0.B: Trace Attempt 144	[4.04 s]
0.0.Hp: Trace Attempt 141	[4.08 s]
0.0.Ht: Trace Attempt 143	[4.04 s]
0.0.N: Trace Attempt  1	[4.68 s]
0.0.N: Trace Attempt  2	[4.68 s]
0.0.N: Trace Attempt  3	[4.68 s]
0.0.N: Trace Attempt  4	[4.68 s]
0.0.N: Trace Attempt  5	[4.69 s]
0.0.N: Trace Attempt  1	[6.02 s]
0.0.N: Trace Attempt  2	[6.02 s]
0.0.N: Trace Attempt  3	[6.02 s]
0.0.N: Trace Attempt  4	[6.02 s]
0.0.N: Trace Attempt  5	[6.03 s]
0.0.AM: Trace Attempt 75	[6.92 s]
0.0.N: Trace Attempt  1	[7.39 s]
0.0.N: Trace Attempt  2	[7.39 s]
0.0.N: Trace Attempt  3	[7.39 s]
0.0.N: Trace Attempt  4	[7.40 s]
0.0.N: Trace Attempt  5	[7.40 s]
0.0.Ht: Trace Attempt 177	[8.09 s]
0.0.B: Trace Attempt 182	[8.14 s]
0.0.Hp: Trace Attempt 174	[8.18 s]
0.0.N: Trace Attempt  1	[8.86 s]
0.0.N: Trace Attempt  2	[8.86 s]
0.0.N: Trace Attempt  3	[8.86 s]
0.0.N: Trace Attempt  4	[8.86 s]
0.0.N: Trace Attempt  5	[8.87 s]
0.0.N: Trace Attempt  1	[10.32 s]
0.0.N: Trace Attempt  2	[10.32 s]
0.0.N: Trace Attempt  3	[10.32 s]
0.0.N: Trace Attempt  4	[10.32 s]
0.0.N: Trace Attempt  5	[10.33 s]
0.0.AM: Trace Attempt 86	[11.07 s]
0.0.N: Trace Attempt  1	[11.83 s]
0.0.N: Trace Attempt  2	[11.84 s]
0.0.N: Trace Attempt  3	[11.84 s]
0.0.N: Trace Attempt  4	[11.84 s]
0.0.N: Trace Attempt  5	[11.84 s]
0.0.Ht: Trace Attempt 203	[12.23 s]
0.0.Hp: Trace Attempt 200	[12.28 s]
0.0.B: Trace Attempt 206	[12.37 s]
0.0.N: Trace Attempt  1	[13.34 s]
0.0.N: Trace Attempt  2	[13.34 s]
0.0.N: Trace Attempt  3	[13.34 s]
0.0.N: Trace Attempt  4	[13.35 s]
0.0.N: Trace Attempt  5	[13.35 s]
0.0.N: Trace Attempt  1	[14.92 s]
0.0.N: Trace Attempt  2	[14.92 s]
0.0.N: Trace Attempt  3	[14.92 s]
0.0.N: Trace Attempt  4	[14.92 s]
0.0.N: Trace Attempt  5	[14.93 s]
0.0.AM: Trace Attempt 68	[15.09 s]
0.0.Ht: Trace Attempt 223	[16.26 s]
0.0.Hp: Trace Attempt 220	[16.41 s]
0.0.B: Trace Attempt 225	[16.38 s]
0.0.N: Trace Attempt  1	[16.51 s]
0.0.N: Trace Attempt  2	[16.51 s]
0.0.N: Trace Attempt  3	[16.51 s]
0.0.N: Trace Attempt  4	[16.52 s]
0.0.N: Trace Attempt  5	[16.52 s]
0.0.N: Trace Attempt  1	[18.16 s]
0.0.N: Trace Attempt  2	[18.16 s]
0.0.N: Trace Attempt  3	[18.16 s]
0.0.N: Trace Attempt  4	[18.16 s]
0.0.N: Trace Attempt  5	[18.17 s]
0.0.AM: Trace Attempt 101	[19.09 s]
0.0.N: Trace Attempt  1	[19.85 s]
0.0.N: Trace Attempt  2	[19.85 s]
0.0.N: Trace Attempt  3	[19.85 s]
0.0.N: Trace Attempt  4	[19.85 s]
0.0.N: Trace Attempt  5	[19.86 s]
0.0.Hp: Trace Attempt 237	[20.49 s]
0.0.Ht: Trace Attempt 240	[20.46 s]
0.0.B: Trace Attempt 242	[20.63 s]
0.0.N: Trace Attempt  1	[21.54 s]
0.0.N: Trace Attempt  2	[21.54 s]
0.0.N: Trace Attempt  3	[21.54 s]
0.0.N: Trace Attempt  4	[21.54 s]
0.0.N: Trace Attempt  5	[21.54 s]
0.0.AM: Trace Attempt  1	[21.52 s]
0.0.AM: Trace Attempt  2	[21.52 s]
0.0.AM: Trace Attempt  3	[21.52 s]
0.0.AM: Trace Attempt  4	[21.53 s]
0.0.AM: Trace Attempt  5	[21.54 s]
0.0.Ht: Trace Attempt 255	[24.51 s]
0.0.Hp: Trace Attempt 251	[24.55 s]
0.0.N: Trace Attempt  1	[24.84 s]
0.0.N: Trace Attempt  2	[24.85 s]
0.0.N: Trace Attempt  3	[24.85 s]
0.0.N: Trace Attempt  4	[24.85 s]
0.0.N: Trace Attempt  5	[24.86 s]
0.0.B: Trace Attempt 258	[25.16 s]
0.0.AM: Trace Attempt 62	[25.59 s]
0.0.Ht: Trace Attempt 264	[28.53 s]
0.0.N: Trace Attempt 78	[28.90 s]
0.0.B: Trace Attempt 266	[29.22 s]
0.0.Hp: Trace Attempt 263	[29.59 s]
0.0.AM: Trace Attempt 84	[29.66 s]
0.0.Ht: Trace Attempt 273	[32.99 s]
0.0.B: Trace Attempt 276	[33.34 s]
0.0.AM: Trace Attempt 94	[33.79 s]
0.0.Hp: Trace Attempt 272	[33.99 s]
0.0.N: Trace Attempt 87	[34.05 s]
0.0.Ht: Trace Attempt 282	[37.17 s]
0.0.B: Trace Attempt 287	[37.62 s]
0.0.AM: Trace Attempt 110	[37.79 s]
0.0.N: Trace Attempt 93	[38.29 s]
0.0.Hp: Trace Attempt 281	[38.35 s]
0.0.Ht: Trace Attempt 291	[41.44 s]
0.0.B: Trace Attempt 297	[41.74 s]
0.0.AM: Trace Attempt 120	[42.48 s]
0.0.Hp: Trace Attempt 290	[43.01 s]
0.0.N: Trace Attempt 95	[44.34 s]
0.0.N: Trace Attempt  1	[44.63 s]
0.0.N: Trace Attempt  2	[44.63 s]
0.0.N: Trace Attempt  3	[44.63 s]
0.0.N: Trace Attempt  4	[44.63 s]
0.0.N: Trace Attempt  5	[44.64 s]
0.0.B: Trace Attempt 306	[45.76 s]
0.0.Ht: Trace Attempt 300	[45.81 s]
0.0.AM: Trace Attempt 128	[46.58 s]
0.0.Hp: Trace Attempt 299	[47.21 s]
0.0.N: Trace Attempt 79	[48.83 s]
0.0.B: Trace Attempt 316	[50.05 s]
0.0.Ht: Trace Attempt 309	[50.14 s]
0.0.AM: Trace Attempt 137	[50.68 s]
0.0.Hp: Trace Attempt 308	[51.47 s]
0.0.N: Trace Attempt 87	[53.31 s]
0.0.Ht: Trace Attempt 318	[54.47 s]
0.0.B: Trace Attempt 325	[54.47 s]
0.0.AM: Trace Attempt 143	[54.70 s]
0.0.Hp: Trace Attempt 317	[55.99 s]
0.0.N: Trace Attempt 93	[57.45 s]
0.0.Ht: Trace Attempt 325	[58.75 s]
0.0.B: Trace Attempt 332	[58.80 s]
0.0.AM: Trace Attempt 150	[59.17 s]
0.0.Hp: Trace Attempt 323	[60.08 s]
0.0.N: Trace Attempt 96	[63.00 s]
0.0.B: Trace Attempt 339	[63.21 s]
0.0.N: Trace Attempt  1	[63.28 s]
0.0.N: Trace Attempt  2	[63.28 s]
0.0.N: Trace Attempt  3	[63.28 s]
0.0.N: Trace Attempt  4	[63.28 s]
0.0.N: Trace Attempt  5	[63.29 s]
0.0.Ht: Trace Attempt 332	[63.26 s]
0.0.AM: Trace Attempt 155	[63.39 s]
0.0.Hp: Trace Attempt 330	[64.42 s]
0.0.Ht: Trace Attempt 339	[67.49 s]
0.0.N: Trace Attempt 79	[67.55 s]
0.0.B: Trace Attempt 346	[67.55 s]
0.0.AM: Trace Attempt 158	[67.67 s]
0.0.Hp: Trace Attempt 337	[68.89 s]
0.0.Ht: Trace Attempt 346	[71.51 s]
0.0.AM: Trace Attempt 162	[71.81 s]
0.0.B: Trace Attempt 353	[71.94 s]
0.0.N: Trace Attempt 87	[72.19 s]
0.0.Hp: Trace Attempt 344	[73.09 s]
0.0.AM: Trace Attempt 165	[75.85 s]
0.0.Ht: Trace Attempt 352	[75.92 s]
0.0.N: Trace Attempt 93	[76.24 s]
0.0.B: Trace Attempt 360	[76.46 s]
0.0.Hp: Trace Attempt 351	[77.39 s]
0.0.Ht: Trace Attempt 359	[79.92 s]
0.0.AM: Trace Attempt 169	[80.55 s]
0.0.B: Trace Attempt 367	[81.13 s]
0.0.Hp: Trace Attempt 357	[81.76 s]
0.0.N: Trace Attempt 97	[82.63 s]
0.0.N: Trace Attempt  1	[82.94 s]
0.0.N: Trace Attempt  2	[82.94 s]
0.0.N: Trace Attempt  3	[82.94 s]
0.0.N: Trace Attempt  4	[82.94 s]
0.0.N: Trace Attempt  5	[82.95 s]
0.0.Ht: Trace Attempt 364	[84.03 s]
0.0.AM: Trace Attempt 171	[84.72 s]
0.0.B: Trace Attempt 373	[85.29 s]
0.0.Hp: Trace Attempt 362	[85.79 s]
0.0.N: Trace Attempt 79	[87.16 s]
0.0.Ht: Trace Attempt 370	[88.05 s]
0.0.AM: Trace Attempt 176	[88.99 s]
0.0.B: Trace Attempt 379	[89.50 s]
0.0.Hp: Trace Attempt 368	[89.99 s]
0.0.N: Trace Attempt 87	[91.65 s]
0.0.Ht: Trace Attempt 377	[92.48 s]
0.0.Hp: Trace Attempt 374	[94.00 s]
0.0.B: Trace Attempt 386	[94.02 s]
0.0.AM: Trace Attempt 180	[94.21 s]
0.0.N: Trace Attempt 93	[95.67 s]
0.0.Ht: Trace Attempt 383	[96.50 s]
0.0.Hp: Trace Attempt 381	[98.73 s]
0.0.B: Trace Attempt 391	[99.08 s]
0.0.AM: Trace Attempt 183	[100.41 s]
0.0.Ht: Trace Attempt 388	[101.00 s]
0.0.N: Trace Attempt 98	[102.11 s]
0.0.N: Trace Attempt  1	[102.41 s]
0.0.N: Trace Attempt  2	[102.41 s]
0.0.N: Trace Attempt  3	[102.41 s]
0.0.N: Trace Attempt  4	[102.41 s]
0.0.N: Trace Attempt  5	[102.42 s]
0.0.Hp: Trace Attempt 385	[102.79 s]
0.0.B: Trace Attempt 395	[104.27 s]
0.0.Ht: Trace Attempt 394	[106.44 s]
0.0.N: Trace Attempt 79	[106.55 s]
0.0.Hp: Trace Attempt 391	[107.12 s]
0.0.AM: Trace Attempt 185	[107.14 s]
0.0.B: Trace Attempt 400	[108.83 s]
0.0.Ht: Trace Attempt 398	[110.46 s]
0.0.N: Trace Attempt 87	[111.04 s]
0.0.Hp: Trace Attempt 395	[111.36 s]
0.0.B: Trace Attempt 405	[113.39 s]
0.0.Ht: Trace Attempt 403	[114.47 s]
0.0.AM: Trace Attempt 187	[114.57 s]
0.0.Hp: Trace Attempt 400	[116.10 s]
0.0.N: Trace Attempt 94	[116.26 s]
0.0.B: Trace Attempt 409	[117.59 s]
0.0.Ht: Trace Attempt 408	[118.87 s]
0.0.Hp: Trace Attempt 405	[120.62 s]
0.0.N: Trace Attempt 99	[121.88 s]
0.0.N: Trace Attempt  1	[122.16 s]
0.0.N: Trace Attempt  2	[122.16 s]
0.0.N: Trace Attempt  3	[122.16 s]
0.0.N: Trace Attempt  4	[122.16 s]
0.0.N: Trace Attempt  5	[122.17 s]
0.0.AM: Trace Attempt 189	[122.28 s]
0.0.B: Trace Attempt 414	[122.33 s]
0.0.Ht: Trace Attempt 413	[123.07 s]
0.0.Hp: Trace Attempt 410	[124.98 s]
0.0.N: Trace Attempt 79	[126.30 s]
0.0.Ht: Trace Attempt 416	[127.10 s]
0.0.B: Trace Attempt 419	[127.27 s]
0.0.AM: Trace Attempt 191	[129.68 s]
0.0.N: Trace Attempt 87	[130.83 s]
0.0.Hp: Trace Attempt 415	[131.02 s]
0.0.Ht: Trace Attempt 421	[131.35 s]
0.0.B: Trace Attempt 424	[131.89 s]
0.0.Hp: Trace Attempt 420	[135.11 s]
0.0.AM: Trace Attempt 192	[135.29 s]
0.0.N: Trace Attempt 94	[136.04 s]
0.0.Ht: Trace Attempt 425	[136.23 s]
0.0.B: Trace Attempt 428	[136.95 s]
0.0.Hp: Trace Attempt 424	[139.18 s]
0.0.Ht: Trace Attempt 429	[140.85 s]
0.0.B: Trace Attempt 432	[141.27 s]
0.0.AM: Trace Attempt 193	[141.57 s]
0.0.N: Trace Attempt 100	[141.85 s]
0.0.N: Trace Attempt  1	[142.14 s]
0.0.N: Trace Attempt  2	[142.14 s]
0.0.N: Trace Attempt  3	[142.14 s]
0.0.N: Trace Attempt  4	[142.14 s]
0.0.N: Trace Attempt  5	[142.15 s]
0.0.Hp: Trace Attempt 427	[143.90 s]
0.0.Ht: Trace Attempt 434	[145.53 s]
0.0.B: Trace Attempt 436	[146.13 s]
0.0.N: Trace Attempt 79	[146.30 s]
0.0.AM: Trace Attempt 194	[148.00 s]
0.0.Hp: Trace Attempt 432	[148.84 s]
0.0.Ht: Trace Attempt 439	[150.07 s]
0.0.B: Trace Attempt 440	[150.39 s]
0.0.N: Trace Attempt 87	[150.84 s]
0.0.AM: Trace Attempt 195	[152.63 s]
0.0.Hp: Trace Attempt 437	[153.65 s]
0.0.B: Trace Attempt 444	[154.57 s]
0.0.N: Trace Attempt 93	[154.85 s]
0.0.Ht: Trace Attempt 444	[154.94 s]
0.0.Hp: Trace Attempt 441	[157.71 s]
0.0.Ht: Trace Attempt 446	[159.20 s]
0.0.B: Trace Attempt 448	[159.34 s]
0.0.AM: Trace Attempt 196	[159.82 s]
0.0.N: Trace Attempt 101	[161.61 s]
0.0.N: Trace Attempt  1	[161.91 s]
0.0.N: Trace Attempt  2	[161.91 s]
0.0.N: Trace Attempt  3	[161.91 s]
0.0.N: Trace Attempt  4	[161.91 s]
0.0.N: Trace Attempt  5	[161.92 s]
0.0.Ht: Trace Attempt 451	[163.72 s]
0.0.Hp: Trace Attempt 445	[163.92 s]
0.0.B: Trace Attempt 452	[164.40 s]
0.0.N: Trace Attempt 79	[166.07 s]
0.0.AM: Trace Attempt 197	[167.48 s]
0.0.Ht: Trace Attempt 455	[167.84 s]
0.0.Hp: Trace Attempt 450	[168.72 s]
0.0.B: Trace Attempt 455	[168.88 s]
0.0.N: Trace Attempt 87	[170.61 s]
0.0.Hp: Trace Attempt 454	[173.01 s]
0.0.Ht: Trace Attempt 458	[173.04 s]
0.0.B: Trace Attempt 458	[173.18 s]
0.0.N: Trace Attempt 93	[174.62 s]
0.0.AM: Trace Attempt 198	[175.72 s]
0.0.B: Trace Attempt 461	[178.09 s]
0.0.Ht: Trace Attempt 462	[178.18 s]
0.0.Hp: Trace Attempt 457	[178.29 s]
0.0.N: Trace Attempt 101	[175.99 s]
0.0.N: Stopped processing property "PWM_TOP.p1"	[181.05 s].
0.0.N: Morphing to Ncustom1
0.0.N: All properties determined. [0.00 s]
0.0.N: Exited with Success (@ 0.00 s)
0.0.Ncustom1: clocks: 1, declared: 1, looping: 0, posedge: 1, negedge: 0, noedge: 0, bothedge: 0
0.0.Ncustom1: Starting proof for property "PWM_TOP.p1"	[0.00 s].
0.0.Ncustom1: Trace Attempt 101	[0.00 s]
0.0.B: Trace Attempt 462	[179.63 s]
0.0.B: Stopped processing property "PWM_TOP.p1"	[181.02 s].
0.0.B: Morphing to Bcustom2
0.0.B: All properties determined. [0.00 s]
0.0.B: Exited with Success (@ 0.00 s)
0.0.Bcustom2: clocks: 1, declared: 1, looping: 0, posedge: 1, negedge: 0, noedge: 0, bothedge: 0
0.0.Bcustom2: Starting proof for property "PWM_TOP.p1"	[0.00 s].
0.0.Bcustom2: Trace Attempt  1	[0.00 s]
0.0.Bcustom2: Trace Attempt  2	[0.00 s]
0.0.Bcustom2: Trace Attempt  1	[0.00 s]
0.0.Bcustom2: Trace Attempt  2	[0.00 s]
0.0.Bcustom2: Trace Attempt  3	[0.00 s]
0.0.Bcustom2: Trace Attempt  4	[0.00 s]
0.0.Bcustom2: Trace Attempt  5	[0.00 s]
0.0.Tri: Proofgrid shell started at 24854@vlsi-ria84(local) jg_24223_vlsi-ria84_1
0.0.Tri: clocks: 1, declared: 1, looping: 0, posedge: 1, negedge: 0, noedge: 0, bothedge: 0
0.0.Tri: Last scan. Per property time limit: 0s
0.0.Tri: Starting proof for property "PWM_TOP.p1"	[0.00 s].
0.0.Tri: Trace Attempt  1	[0.00 s]
0.0.Tri:    0.00" ---- Launching main thread ----
0.0.Tri:    0.03" ---- Launching abstraction thread ----
0.0.Tri:    0.03" ---- Launching multi-phase simplification thread ----
0.0.Tri:    0.05" ---- Launching liveness simplification thread ----
0.0.AM: Stopped processing property "PWM_TOP.p1"	[181.35 s].
0.0.AM: Morphing to AMcustom3
0.0.AM: All properties determined. [0.00 s]
0.0.AM: Exited with Success (@ 0.00 s)
0.0.AMcustom3: clocks: 1, declared: 1, looping: 0, posedge: 1, negedge: 0, noedge: 0, bothedge: 0
0.0.AMcustom3: Starting proof for property "PWM_TOP.p1"	[0.00 s].
0.0.AMcustom3: Trace Attempt  1	[0.00 s]
0.0.AMcustom3: Trace Attempt  2	[0.00 s]
0.0.AMcustom3: Trace Attempt  3	[0.00 s]
0.0.AMcustom3: Trace Attempt  4	[0.00 s]
0.0.AMcustom3: Trace Attempt  5	[0.00 s]
0.0.AMcustom3: Trace Attempt  1	[0.00 s]
0.0.AMcustom3: Trace Attempt  2	[0.00 s]
0.0.AMcustom3: Trace Attempt  3	[0.00 s]
0.0.AMcustom3: Trace Attempt  4	[0.02 s]
0.0.AMcustom3: Trace Attempt  5	[0.02 s]
0.0.AMcustom3: Trace Attempt  1	[0.03 s]
0.0.AMcustom3: Trace Attempt  2	[0.03 s]
0.0.AMcustom3: Trace Attempt  3	[0.03 s]
0.0.AMcustom3: Trace Attempt  4	[0.03 s]
0.0.AMcustom3: Trace Attempt  5	[0.04 s]
0.0.AMcustom3: Trace Attempt  1	[0.09 s]
0.0.AMcustom3: Trace Attempt  2	[0.09 s]
0.0.AMcustom3: Trace Attempt  3	[0.09 s]
0.0.AMcustom3: Trace Attempt  4	[0.10 s]
0.0.AMcustom3: Trace Attempt  5	[0.10 s]
0.0.AMcustom3: Trace Attempt  1	[0.44 s]
0.0.AMcustom3: Trace Attempt  2	[0.44 s]
0.0.AMcustom3: Trace Attempt  3	[0.44 s]
0.0.AMcustom3: Trace Attempt  4	[0.45 s]
0.0.AMcustom3: Trace Attempt  5	[0.45 s]
0.0.Tri:    0.82" Simplification phase 1 complete
0.0.Ncustom1: Requesting engine job to terminate
0.0.Bcustom2: Requesting engine job to terminate
0.0.AMcustom3: Requesting engine job to terminate
0.0.Tri: Requesting engine job to terminate
0.0.Hp: Requesting engine job to terminate
0.0.Ht: Requesting engine job to terminate
INFO (IPF144): 0: Initiating shutdown of proof [182.04 s]
0.0.Tri: A proof was found: No trace exists. [0.89 s]
INFO (IPF057): 0.0.Tri: The property "PWM_TOP.p1" was proven in 0.89 s.
0.0.AMcustom3: Trace Attempt 23	[0.64 s]
0.0.AMcustom3: Stopped processing property "PWM_TOP.p1"	[0.65 s].
0.0.Ncustom1: Stopped processing property "PWM_TOP.p1"	[0.99 s].
0.0.Ncustom1: All properties determined. [0.99 s]
0.0.AMcustom3: All properties determined. [0.65 s]
0.0.AMcustom3: Exited with Success (@ 182.04 s)
0: ProofGrid usable level: 0
0.0.Bcustom2: Trace Attempt 84	[0.97 s]
0.0.Bcustom2: Stopped processing property "PWM_TOP.p1"	[0.97 s].
0.0.Bcustom2: All properties determined. [0.98 s]
0.0.Bcustom2: Exited with Success (@ 182.04 s)
0.0.Ncustom1: Exited with Success (@ 182.07 s)
0.0.Ht: Trace Attempt 465	[181.64 s]
0.0.Ht: All properties determined. [182.03 s]
0.0.Ht: Exited with Success (@ 182.09 s)
0.0.Tri: Stopped processing property "PWM_TOP.p1"	[1.02 s].
0.0.Tri: All properties determined. [1.02 s]
0.0.Tri: Exited with Success (@ 182.16 s)
0.0.Hp: Trace Attempt 459	[181.36 s]
0.0.Hp: All properties determined. [182.19 s]
0.0.Hp: Exited with Success (@ 182.22 s)
0: --------------------------------------------------------------
ProofGrid Summary (utilization 99.97 %)
--------------------------------------------------------------
     engines started                               :    10
     engine jobs started                           :     7

    Average time in state (seconds)
    ------------------------------------------------------
    Engine  Pending     Running        Dead    Utilization
    ------------------------------------------------------
     Hp        0.03      182.04        0.00       99.98 %
     Ht        0.04      182.00        0.00       99.98 %
     Oh        0.03        0.00        0.00        0.66 %
    Ncustom1        0.03      182.03        0.00       99.98 %
    Bcustom2        0.03      181.99        0.00       99.98 %
    AMcustom3        0.03      181.67        0.00       99.98 %
    Tri        0.09        0.90        0.00       90.75 %
    all        0.04      130.09        0.00       99.97 %

    Total time in state (seconds)
    -----------------------------------------
            Pending     Running        Dead  
    -----------------------------------------
               0.29      910.62        0.00

    Data read    : 1.58 MiB
    Data written : 3.01 kiB

0: All pending notifications were processed.
INFO (IPF059): 0: Completed proof on task: "<embedded>"

==============================================================
SUMMARY
==============================================================
           Properties Considered              : 1
                 assertions                   : 1
                  - proven                    : 1 (100%)
                  - bounded_proven (user)     : 0 (0%)
                  - bounded_proven (auto)     : 0 (0%)
                  - marked_proven             : 0 (0%)
                  - cex                       : 0 (0%)
                  - ar_cex                    : 0 (0%)
                  - undetermined              : 0 (0%)
                  - unknown                   : 0 (0%)
                  - error                     : 0 (0%)
                 covers                       : 0
                  - unreachable               : 0
                  - bounded_unreachable (user): 0
                  - covered                   : 0
                  - ar_covered                : 0
                  - undetermined              : 0
                  - unknown                   : 0
                  - error                     : 0
proven
[<embedded>] % exit -force
INFO (IPL005): Received request to exit from the console.
INFO: Waiting for proof threads to stop...
INFO: Proof threads stopped.
INFO (IPL018): The peak resident set memory use for this session was 1.244 GB.
INFO (IPL014): Waiting for the Tcl-thread to exit.
INFO (IPL015): The Tcl-thread exited with status 0.
INFO (IPL016): Exiting the analysis session with status 0.
