# ----------------------------------------
# Jasper Version Info
# tool      : Jasper 2024.06
# platform  : Linux 3.10.0-1160.62.1.el7.x86_64
# version   : 2024.06p002 64 bits
# build date: 2024.09.02 16:28:38 UTC
# ----------------------------------------
# started   : 2025-11-20 00:44:08 IST
# hostname  : vlsi-ria85.vlsidomain
# pid       : 26941
# arguments : '-label' 'session_0' '-console' '//127.0.0.1:45095' '-nowindow' '-style' 'windows' '-exitonerror' '-data' 'AAAAznicY2RgYLCp////PwMYMD6A0Aw2jAyoAMRnQhUJbEChGRhYYZphSliAmItBl6GAoYghnyELyNNh0ANCfSA7HS6aypDMUMJQDBQ1ZIgHihcxJDJUAllmQPU8QN1JQH4JUE0GkC+BoUYPLJcDtg8AX3gXSw==' '-proj' '/users/rompel/jasper_executions/liveness/jgprojects/1_gray_6/sessionLogs/session_0' '-init' '-hidden' '/users/rompel/jasper_executions/liveness/jgprojects/1_gray_6/.tmp/.initCmds.tcl' '1_gray_6.tcl' '-hidden' '/users/rompel/jasper_executions/liveness/jgprojects/1_gray_6/.tmp/.postCmds.tcl'

Any disclosure about the Cadence Design Systems software or its use
model to any third party violates the written Non-Disclosure Agreement
between Cadence Design Systems, Inc. and the customer.

THIS SOFTWARE CONTAINS CONFIDENTIAL INFORMATION AND TRADE SECRETS OF
CADENCE DESIGN SYSTEMS, INC. USE, DISCLOSURE, OR REPRODUCTION IS
PROHIBITED WITHOUT THE PRIOR EXPRESS WRITTEN PERMISSION OF CADENCE
DESIGN SYSTEMS, INC.

Copyright (C) 2000-2024 Cadence Design Systems, Inc. All Rights
Reserved.  Unpublished -- rights reserved under the copyright laws of
the United States.

This product includes software developed by others and redistributed
according to license agreement. See doc/third_party_readme.txt for
further details.

RESTRICTED RIGHTS LEGEND

Use, duplication, or disclosure by the Government is subject to
restrictions as set forth in subparagraph (c) (1) (ii) of the Rights in
Technical Data and Computer Software clause at DFARS 252.227-7013 or
subparagraphs (c) (1) and (2) of Commercial Computer Software -- Restricted
Rights at 48 CFR 52.227-19, as applicable.


                          Cadence Design Systems, Inc.
                          2655 Seely Avenue
                          San Jose, CA 95134
                          Phone: 408.943.1234

For technical assistance visit http://support.cadence.com.

Jasper Apps Analysis Session - /users/rompel/jasper_executions/liveness/jgprojects/1_gray_6/sessionLogs/session_0

WARNING (WG017): [session]: The system's locale is "ANSI_X3.4-1968", which is not UTF-8. Non-ASCII characters might not be handled correctly.
WARNING (WG017): [jg_console]: The system's locale is "ANSI_X3.4-1968", which is not UTF-8. Non-ASCII characters might not be handled correctly.
INFO: successfully checked out license "jasper_fao".
INFO: reading configuration file "/users/rompel/.config/cadence/jasper.conf".
% analyze -sv09 ../1_gray_6.sv
[-- (VERI-1482)] Analyzing Verilog file '/tools/cadence2425/JASPER/jasper_2024.06p002/lib/verilog/packages/std/std.sv' into library 'std'
[-- (VERI-1482)] Analyzing Verilog file '../1_gray_6.sv'
% elaborate -bbox_mul 1000000 -bbox_div 1000000 -bbox_mod 1000000 -bbox_a 1000000
[INFO (HIER-8002)] ../1_gray_6.sv(14): Disabling old hierarchical reference handler
[INFO (VERI-1018)] ../1_gray_6.sv(1): compiling module 'GRAY'
[WARN (VERI-1209)] ../1_gray_6.sv(9): expression size 32 truncated to fit in target size 13
INFO (ISW003): Top module name is "GRAY".
INFO (INL208): Elaboration synthesis summary:
  Number of synthesized netlists          1 (0 packages)
  Single run mode                         On
  Pipeline                                On (1 pipelined netlists)
  Late hierarchical reference connection  On
  Number of analyzed Verilog modules      1 (1 synthesized)
  Number of analyzed VHDL entities        0 (0 synthesized)
INFO (INL003): Clearing all state information (assumes, stopats, and so forth).
GRAY
[<embedded>] % reset rst
INFO (IPM031): Clearing proof results of all properties.
INFO (IRS006): Current reset condition is "rst".
[<embedded>] % clock clk
[<embedded>] % prove -all
Ncustom1: Custom engine code is hT3Ng7hPPfiYQOTDZ3qhYOwGAM51eA+J/FjkM5shLioAsqhgLR4Ft+O1BuKG6ilQ83B9tLXSl+CwjiTMAQA
Bcustom2: Custom engine code is hT3Nm7hPr1Vp3Di1Ra2USNIGL4JypRnLKLAdF6JAyuavO2JfGCiY9OZJhcAcOUnLx5xwNdhILGrAWX9s+z2WDkKwNR7tAfClBEjRFVQeq6DU54boFgEA
AMcustom3: Custom engine code is hT3Ng7hP/feYQOTDZ3qhYOwGAM51eA+J/FjkM5shLioAsqhgLR4Ft+O1BuKG6ilQ83B9tLXSmmqwm7g9AQA
Mpcustom4: Custom engine code is hT3NZbhP9fmY2AbBQnsjfOxn6c+6e6yL+/e8fZFmaQrnlgEA
INFO (IPF036): Starting proof on task: "<embedded>", 1 properties to prove with 0 already proven/unreachable
INFO (IRS029): Starting reset analysis: phase 1 of 4.
INFO (IRS030): Running reset analysis: phase 2 of 4.
INFO (IRS031): Running reset analysis: phase 3 of 4.
INFO (IRS020): Starting the reset analysis simulation with a limit of 100 iterations (phase 4 of 4).
INFO (IRS024): Reset iterations 0 to 4 analyzed.
INFO (IRS018): Reset analysis simulation executed for 3 iterations. Assigned values for 13 of 26 design flops, 0 of 0 design latches, 3 of 3 internal elements.
INFO (IRS039): Reset analysis complete.
INFO (IPF031): Settings used for proof thread 0:
    orchestration                 = on
    time_limit                    = 86400s
    per_property_time_limit       = 1s * 10 ^ scan
    engine_mode                   = auto
    proofgrid_per_engine_max_jobs = 1
    max engine jobs               = auto
    proofgrid_mode                = local
    proofgrid_restarts            = 10
AMcustom5: Custom engine code is hT3N1rhP11/52HrFRS21ROp2LOjVTgPvT8L8BGXHgLhaIuqtT4nARFjUqrBL+7pLmaTOzBepZW/Jm8SSrHDybSQtoNiO3y43wk+dEoWlsZizu97Fih6O6lPVG/LpWP5SsUPwlGagLNa1FKEFvwVXyX7//8prySbvSxIHXr5er+z4RAEA
0: Using multistage preprocessing
Ncustom6: Custom engine code is hT3OXrhPByJp3TrFSTLhUmMH4KVtJgmTCnNDF46yMXOKY48m4LS5nE7yBzFjA7kDuwO/GhGUpEPiky3p3wmPn3dJZHxFMsafSoObRzSC+tn7sEY0WbTdZ/FV4hL3MYH/b1CIUvXSWR4wqEoVLsmMOD4xIPT4lI1LO6ZCO7PnnWQuLwetnvKlrXx6wCW/A+x+enqslg1YPobi4wEF/EvbzOvcTYdJvl2s4H2yZg2b2ofAVN5WvhWk1HoBAA
0: Starting reduce
ADcustom7: Custom engine code is hT3Nv7hPv1752HrFRa2kROx2f/ECJeZB2AZsLdlO8VwmIuqtT4nIDFXclhg+O+o+DMmQCekbheGk0kK28laA9gaOFDXsQp29J3X615HY1IPHJWd6FUFvCHjO+p1k652b5JJvZlShNpGlGSXAiQe/mEAj6tEBAA
Tricustom8: Custom engine code is hT3Nu7hPt1752DvFRa0kNDiyIV97VyejwM9C/jCLJjdPvusZONHY42VYUy0Q1ZotnhcVtNc56tJ5wbxv6V2+XpdsaSlHck5vfnbYjdwj1OECy9U+7oSQ0SZE3g5ayD+Phuh4odCJTjeKa2k4elM9ldQfkAEA
Gcustom9: Custom engine code is hT3NibhPDfeYQADBZnYcglOvK9Pfd7EOeniIqP8jNsyIqInncipMGcUXqAadachREE9F2PwhBUZUNw5kHnd4JdXkamORRgEA
C2custom10: Custom engine code is hT3NirhPjfWYQADBZnYcglOvK9Pfd7EOeniIqP8jNsyIqInncgkrYMMXCYbdK0dUjZIF9d4cJ0rHoBDjwVLBKuG86XYVV00BAA
AGcustom11: Custom engine code is hT3NirhP/fmYQADBZnYcglOvK9Pfd7EOeniIqP8jNsyIqInnckcwYMMXCYbdK0dUjZIF9d4cJ0rHoBDjwVLBKuHEZnZByh0BAA
Bcustom12: Custom engine code is hT3NjrhPDfiYQADBZnYcglOvK9PfWxFtenjIyBqfrgr7if/jL/yPOuK1BAflEcW0DxNH2eDIoezN2gxlQFg81RZtiWXh7aiTAidvAQA
0: Finished reduce in 0s
Ncustom13: Custom engine code is hT3NR7hPByFp3TrFSTLhUmMH4KWtJglTyV/c51BHEeZWamnJv767nE6PCak26bd3gf3XGN3rIRheufhDieCJQVISo+gNYUKhiUedBKGtsP/a18svAnlMJZudHxDFwK5ufsyoxsIyiAeSY2oi3tEuoDHr5gw42DFKAG3PqO3CEsl8Azzdt3pl5nGA1Ifv2H02eYsFzWb/nfp8PMb3F0krE/EgBcm8TD9Div8BAA
Tricustom14: Custom engine code is hT3Nu7hP3fiYQADBZnYcglNHp9bfd7EOeniIqP/ji8sGLQu8yhsFO+wxJ+O+R0bU8g/IewXFomyos+viQnWc2xYNYmMqpo3i40O7DaZR7qfp4YqNx26KRvQ/qx0BAA
0.0.PRE: Performing Proof Simplification...
0.0.N: clocks: 1, declared: 1, looping: 0, posedge: 1, negedge: 0, noedge: 0, bothedge: 0
0.0.N: Proof Simplification Iteration 1	[0.00 s]
0.0.PRE: A proof was found: No trace exists. [0.00 s]
INFO (IPF057): 0.0.PRE: The property ":noDeadEnd" was proven in 0.00 s.
    Use check_assumptions -show -dead_end to show this property in the property table.
0.0.PRE: A proof was found: No trace exists. [0.00 s]
INFO (IPF057): 0.0.PRE: The property ":noConflict" was proven in 0.00 s.
    Use check_assumptions -show to show this property in the property table.
INFO (IPF047): 0.0.PRE: The cover property ":live" was covered in 1 cycles in 0.00 s.
    Use check_assumptions -show -live to show this property in the property table.
0.0.PRE: Proof Simplification completed in 0.00 s
0: About to start ProofGrid in its own thread with a limit of 10000 pending notifications and a limit of 10 traces.
0: =============================== ProofGrid start ===============================
0: ProofGrid usable level: 1
0: Initial ProofGrid level: 1
0: ProofGrid is starting event handling
0.0.Hp: Proofgrid shell started at 27059@vlsi-ria85(local) jg_26941_vlsi-ria85_1
0.0.N: Proofgrid shell started at 27058@vlsi-ria85(local) jg_26941_vlsi-ria85_1
0.0.N: clocks: 1, declared: 1, looping: 0, posedge: 1, negedge: 0, noedge: 0, bothedge: 0
0.0.Hp: clocks: 1, declared: 1, looping: 0, posedge: 1, negedge: 0, noedge: 0, bothedge: 0
0.0.Hp: Last scan. Per property time limit: 0s
0.0.Hp: Trace Attempt  1	[0.00 s]
0.0.Hp: Trace Attempt  2	[0.00 s]
0.0.Hp: Trace Attempt  3	[0.00 s]
0.0.Hp: Trace Attempt  4	[0.00 s]
0.0.Hp: Trace Attempt  5	[0.00 s]
0.0.N: Last scan. Per property time limit: 0s
0.0.N: Starting proof for property "GRAY.p1"	[0.00 s].
0.0.N: Trace Attempt  1	[0.00 s]
0.0.N: Trace Attempt  2	[0.00 s]
0.0.N: Trace Attempt  3	[0.00 s]
0.0.N: Trace Attempt  3	[0.00 s]
0.0.N: Trace Attempt  4	[0.00 s]
0.0.N: Trace Attempt  4	[0.00 s]
0.0.N: Trace Attempt  5	[0.00 s]
0.0.N: Trace Attempt  1	[0.01 s]
0.0.N: Trace Attempt  2	[0.01 s]
0.0.N: Trace Attempt  3	[0.01 s]
0.0.N: Trace Attempt  4	[0.01 s]
0.0.N: Trace Attempt  5	[0.01 s]
0.0.Oh: Proofgrid shell started at 27098@vlsi-ria85(local) jg_26941_vlsi-ria85_1
0.0.Oh: clocks: 1, declared: 1, looping: 0, posedge: 1, negedge: 0, noedge: 0, bothedge: 0
0.0.Oh: Reached length limit (2147483647) [0.00 s]
0.0.Oh: Exited with Success (@ 0.05 s)
0.0.Oh: Completed, Restart ignored.
0.0.B: Proofgrid shell started at 27099@vlsi-ria85(local) jg_26941_vlsi-ria85_1
0.0.AM: Proofgrid shell started at 27129@vlsi-ria85(local) jg_26941_vlsi-ria85_1
0.0.AM: clocks: 1, declared: 1, looping: 0, posedge: 1, negedge: 0, noedge: 0, bothedge: 0
0.0.AM: Last scan. Per property time limit: 0s
0.0.AM: Starting proof for property "GRAY.p1"	[0.00 s].
0.0.AM: Trace Attempt  1	[0.00 s]
0.0.AM: Trace Attempt  2	[0.00 s]
0.0.AM: Trace Attempt  3	[0.00 s]
0.0.AM: Trace Attempt  4	[0.00 s]
0.0.B: clocks: 1, declared: 1, looping: 0, posedge: 1, negedge: 0, noedge: 0, bothedge: 0
0.0.B: Last scan. Per property time limit: 0s
0.0.B: Starting proof for property "GRAY.p1"	[0.00 s].
0.0.AM: Trace Attempt  5	[0.00 s]
0.0.B: Trace Attempt  1	[0.00 s]
0.0.B: Trace Attempt  2	[0.00 s]
0.0.B: Trace Attempt  3	[0.00 s]
0.0.B: Trace Attempt  4	[0.00 s]
0.0.B: Trace Attempt  5	[0.00 s]
0.0.AM: Trace Attempt  1	[0.00 s]
0.0.AM: Trace Attempt  2	[0.00 s]
0.0.AM: Trace Attempt  3	[0.00 s]
0.0.AM: Trace Attempt  5	[0.00 s]
0.0.AM: Trace Attempt  1	[0.01 s]
0.0.AM: Trace Attempt  2	[0.01 s]
0.0.AM: Trace Attempt  3	[0.01 s]
0.0.AM: Trace Attempt  4	[0.01 s]
0.0.AM: Trace Attempt  5	[0.01 s]
0.0.Ht: Proofgrid shell started at 27097@vlsi-ria85(local) jg_26941_vlsi-ria85_1
0.0.Ht: clocks: 1, declared: 1, looping: 0, posedge: 1, negedge: 0, noedge: 0, bothedge: 0
0.0.Ht: Last scan. Per property time limit: 0s
0.0.Ht: Trace Attempt  1	[0.00 s]
0.0.Ht: Trace Attempt  2	[0.00 s]
0.0.Ht: Trace Attempt  3	[0.00 s]
0.0.Ht: Trace Attempt  4	[0.00 s]
0.0.Ht: Trace Attempt  5	[0.00 s]
0.0.AM: Trace Attempt  1	[0.03 s]
0.0.AM: Trace Attempt  2	[0.03 s]
0.0.AM: Trace Attempt  3	[0.03 s]
0.0.AM: Trace Attempt  4	[0.03 s]
0.0.AM: Trace Attempt  5	[0.03 s]
0.0.N: Trace Attempt  1	[0.08 s]
0.0.N: Trace Attempt  2	[0.08 s]
0.0.N: Trace Attempt  3	[0.08 s]
0.0.N: Trace Attempt  5	[0.09 s]
0.0.AM: Trace Attempt  1	[0.10 s]
0.0.AM: Trace Attempt  2	[0.10 s]
0.0.AM: Trace Attempt  3	[0.10 s]
0.0.AM: Trace Attempt  4	[0.10 s]
0.0.AM: Trace Attempt  5	[0.10 s]
0.0.N: Trace Attempt  1	[0.31 s]
0.0.N: Trace Attempt  2	[0.31 s]
0.0.N: Trace Attempt  3	[0.31 s]
0.0.N: Trace Attempt  5	[0.31 s]
0.0.AM: Trace Attempt  1	[0.32 s]
0.0.AM: Trace Attempt  2	[0.33 s]
0.0.AM: Trace Attempt  3	[0.33 s]
0.0.AM: Trace Attempt  4	[0.33 s]
0.0.AM: Trace Attempt  5	[0.33 s]
0.0.N: Trace Attempt  1	[0.55 s]
0.0.N: Trace Attempt  2	[0.55 s]
0.0.N: Trace Attempt  3	[0.55 s]
0.0.N: Trace Attempt  5	[0.55 s]
0.0.N: Trace Attempt  1	[0.81 s]
0.0.N: Trace Attempt  2	[0.81 s]
0.0.N: Trace Attempt  3	[0.81 s]
0.0.N: Trace Attempt  4	[0.81 s]
0.0.N: Trace Attempt  5	[0.81 s]
0.0.AM: Trace Attempt  1	[0.99 s]
0.0.AM: Trace Attempt  2	[0.99 s]
0.0.AM: Trace Attempt  3	[0.99 s]
0.0.AM: Trace Attempt  5	[1.00 s]
0.0.N: Trace Attempt  1	[1.91 s]
0.0.N: Trace Attempt  2	[1.91 s]
0.0.N: Trace Attempt  3	[1.91 s]
0.0.N: Trace Attempt  4	[1.91 s]
0.0.N: Trace Attempt  5	[1.91 s]
0.0.N: Trace Attempt  1	[3.02 s]
0.0.N: Trace Attempt  2	[3.02 s]
0.0.N: Trace Attempt  3	[3.02 s]
0.0.N: Trace Attempt  4	[3.03 s]
0.0.N: Trace Attempt  5	[3.03 s]
0.0.Hp: Trace Attempt 728	[4.01 s]
0.0.B: Trace Attempt 1993	[4.00 s]
0.0.Ht: Trace Attempt 2022	[4.00 s]
0.0.N: Trace Attempt  1	[4.21 s]
0.0.N: Trace Attempt  2	[4.21 s]
0.0.N: Trace Attempt  3	[4.21 s]
0.0.N: Trace Attempt  4	[4.21 s]
0.0.N: Trace Attempt  5	[4.21 s]
0.0.AM: Trace Attempt 180	[5.05 s]
0.0.N: Trace Attempt  1	[5.38 s]
0.0.N: Trace Attempt  2	[5.38 s]
0.0.N: Trace Attempt  3	[5.38 s]
0.0.N: Trace Attempt  4	[5.38 s]
0.0.N: Trace Attempt  5	[5.38 s]
0.0.N: Trace Attempt  1	[6.62 s]
0.0.N: Trace Attempt  2	[6.63 s]
0.0.N: Trace Attempt  3	[6.63 s]
0.0.N: Trace Attempt  5	[6.63 s]
0.0.AM: Trace Attempt  1	[7.57 s]
0.0.AM: Trace Attempt  2	[7.57 s]
0.0.AM: Trace Attempt  3	[7.57 s]
0.0.AM: Trace Attempt  5	[7.58 s]
0.0.Hp: Trace Attempt 1008	[8.02 s]
0.0.B: Trace Attempt 2745	[8.01 s]
0.0.Ht: Trace Attempt 2761	[8.01 s]
0.0.N: Trace Attempt 184	[10.63 s]
0.0.AM: Trace Attempt 207	[11.60 s]
0.0.Hp: Trace Attempt 1225	[12.04 s]
0.0.B: Trace Attempt 3326	[12.01 s]
0.0.Ht: Trace Attempt 3331	[12.01 s]
0.0.N: Trace Attempt  1	[13.57 s]
0.0.N: Trace Attempt  2	[13.57 s]
0.0.N: Trace Attempt  3	[13.57 s]
0.0.N: Trace Attempt  5	[13.57 s]
0.0.AM: Trace Attempt 271	[15.60 s]
0.0.Hp: Trace Attempt 1405	[16.05 s]
0.0.B: Trace Attempt 3810	[16.02 s]
0.0.Ht: Trace Attempt 3807	[16.02 s]
0.0.N: Trace Attempt 212	[17.58 s]
0.0.N: Trace Attempt  1	[18.48 s]
0.0.N: Trace Attempt  2	[18.48 s]
0.0.N: Trace Attempt  3	[18.48 s]
0.0.N: Trace Attempt  5	[18.48 s]
0.0.AM: Trace Attempt 329	[19.60 s]
0.0.Hp: Trace Attempt 1562	[20.05 s]
0.0.B: Trace Attempt 4245	[20.02 s]
0.0.Ht: Trace Attempt 4217	[20.02 s]
0.0.N: Trace Attempt 213	[22.48 s]
0.0.N: Trace Attempt  1	[23.36 s]
0.0.N: Trace Attempt  2	[23.36 s]
0.0.N: Trace Attempt  3	[23.36 s]
0.0.N: Trace Attempt  5	[23.36 s]
0.0.AM: Trace Attempt 367	[23.66 s]
0.0.Hp: Trace Attempt 1704	[24.06 s]
0.0.B: Trace Attempt 4644	[24.02 s]
0.0.Ht: Trace Attempt 4582	[24.02 s]
0.0.N: Trace Attempt 213	[27.37 s]
0.0.AM: Trace Attempt 416	[27.69 s]
0.0.Hp: Trace Attempt 1834	[28.07 s]
0.0.B: Trace Attempt 4999	[28.02 s]
0.0.Ht: Trace Attempt 4911	[28.03 s]
0.0.N: Trace Attempt  1	[28.39 s]
0.0.N: Trace Attempt  2	[28.39 s]
0.0.N: Trace Attempt  3	[28.39 s]
0.0.N: Trace Attempt  5	[28.39 s]
0.0.B: Trace Attempt 5322	[32.03 s]
0.0.Hp: Trace Attempt 1949	[32.08 s]
0.0.Ht: Trace Attempt 5218	[32.04 s]
0.0.AM: Trace Attempt 449	[32.13 s]
0.0.N: Trace Attempt 213	[32.39 s]
0.0.N: Trace Attempt  1	[33.33 s]
0.0.N: Trace Attempt  2	[33.33 s]
0.0.N: Trace Attempt  3	[33.33 s]
0.0.N: Trace Attempt  5	[33.33 s]
0.0.B: Trace Attempt 5594	[36.03 s]
0.0.Hp: Trace Attempt 2053	[36.09 s]
0.0.Ht: Trace Attempt 5500	[36.04 s]
0.0.AM: Trace Attempt 458	[36.35 s]
0.0.N: Trace Attempt 209	[37.34 s]
0.0.N: Trace Attempt  1	[38.48 s]
0.0.N: Trace Attempt  2	[38.49 s]
0.0.N: Trace Attempt  3	[38.49 s]
0.0.N: Trace Attempt  5	[38.49 s]
0.0.B: Trace Attempt 5863	[40.03 s]
0.0.Hp: Trace Attempt 2154	[40.09 s]
0.0.Ht: Trace Attempt 5778	[40.04 s]
0.0.AM: Trace Attempt 465	[40.56 s]
0.0.N: Trace Attempt 213	[42.50 s]
0.0.N: Trace Attempt  1	[43.40 s]
0.0.N: Trace Attempt  2	[43.40 s]
0.0.N: Trace Attempt  3	[43.40 s]
0.0.N: Trace Attempt  5	[43.40 s]
0.0.B: Trace Attempt 6128	[44.05 s]
0.0.Hp: Trace Attempt 2253	[44.11 s]
0.0.Ht: Trace Attempt 6053	[44.05 s]
0.0.AM: Trace Attempt 449	[44.56 s]
0.0.AM: Trace Attempt  1	[47.00 s]
0.0.AM: Trace Attempt  2	[47.00 s]
0.0.AM: Trace Attempt  3	[47.00 s]
0.0.AM: Trace Attempt  5	[47.00 s]
0.0.N: Trace Attempt 212	[47.41 s]
0.0.B: Trace Attempt 6374	[48.06 s]
0.0.Ht: Trace Attempt 6305	[48.06 s]
0.0.Hp: Trace Attempt 2347	[48.13 s]
0.0.N: Trace Attempt  1	[48.27 s]
0.0.N: Trace Attempt  2	[48.27 s]
0.0.N: Trace Attempt  3	[48.27 s]
0.0.N: Trace Attempt  5	[48.27 s]
0.0.AM: Trace Attempt 201	[51.00 s]
0.0.B: Trace Attempt 6632	[52.08 s]
0.0.Hp: Trace Attempt 2441	[52.13 s]
0.0.Ht: Trace Attempt 6560	[52.07 s]
0.0.N: Trace Attempt 213	[52.29 s]
0.0.N: Trace Attempt  1	[53.18 s]
0.0.N: Trace Attempt  2	[53.18 s]
0.0.N: Trace Attempt  3	[53.18 s]
0.0.N: Trace Attempt  5	[53.18 s]
0.0.AM: Trace Attempt 255	[55.05 s]
0.0.Ht: Trace Attempt 6805	[56.07 s]
0.0.B: Trace Attempt 6879	[56.09 s]
0.0.Hp: Trace Attempt 2532	[56.16 s]
0.0.N: Trace Attempt 213	[57.18 s]
0.0.N: Trace Attempt  1	[58.01 s]
0.0.N: Trace Attempt  2	[58.01 s]
0.0.N: Trace Attempt  3	[58.01 s]
0.0.N: Trace Attempt  5	[58.01 s]
0.0.AM: Trace Attempt 312	[59.12 s]
0.0.Ht: Trace Attempt 7044	[60.07 s]
0.0.B: Trace Attempt 7115	[60.10 s]
0.0.Hp: Trace Attempt 2619	[60.16 s]
0.0.N: Trace Attempt 213	[62.02 s]
0.0.AM: Trace Attempt 357	[63.14 s]
0.0.N: Trace Attempt  1	[63.25 s]
0.0.N: Trace Attempt  2	[63.25 s]
0.0.N: Trace Attempt  3	[63.25 s]
0.0.N: Trace Attempt  4	[63.25 s]
0.0.N: Trace Attempt  5	[63.25 s]
0.0.Ht: Trace Attempt 7274	[64.08 s]
0.0.B: Trace Attempt 7335	[64.10 s]
0.0.Hp: Trace Attempt 2702	[64.18 s]
0.0.AM: Trace Attempt 400	[67.15 s]
0.0.N: Trace Attempt 184	[67.25 s]
0.0.Ht: Trace Attempt 7500	[68.09 s]
0.0.B: Trace Attempt 7551	[68.11 s]
0.0.Hp: Trace Attempt 2784	[68.23 s]
0.0.AM: Trace Attempt 440	[71.17 s]
0.0.N: Trace Attempt 246	[71.29 s]
0.0.B: Trace Attempt 7756	[72.11 s]
0.0.Ht: Trace Attempt 7719	[72.09 s]
0.0.Hp: Trace Attempt 2861	[72.23 s]
0.0.AM: Trace Attempt 455	[75.19 s]
0.0.N: Trace Attempt 303	[75.38 s]
0.0.Ht: Trace Attempt 7927	[76.10 s]
0.0.B: Trace Attempt 7952	[76.12 s]
0.0.Hp: Trace Attempt 2934	[76.24 s]
0.0.N: Trace Attempt 348	[79.44 s]
0.0.AM: Trace Attempt 466	[79.40 s]
0.0.Ht: Trace Attempt 8139	[80.11 s]
0.0.B: Trace Attempt 8158	[80.13 s]
0.0.Hp: Trace Attempt 3009	[80.26 s]
0.0.N: Trace Attempt 391	[83.47 s]
0.0.AM: Trace Attempt 485	[83.49 s]
0.0.B: Trace Attempt 8236	[84.16 s]
0.0.Hp: Trace Attempt 3082	[84.29 s]
0.0.N: Trace Attempt 431	[87.48 s]
0.0.AM: Trace Attempt 498	[87.51 s]
0.0.B: Trace Attempt 8286	[88.17 s]
0.0.Hp: Trace Attempt 3153	[88.34 s]
0.0.N: Trace Attempt  1	[90.42 s]
0.0.N: Trace Attempt  2	[90.42 s]
0.0.N: Trace Attempt  3	[90.42 s]
0.0.N: Trace Attempt  4	[90.42 s]
0.0.N: Trace Attempt  5	[90.42 s]
0.0.AM: Trace Attempt 518	[91.51 s]
0.0.B: Trace Attempt 8334	[92.21 s]
0.0.Hp: Trace Attempt 3223	[92.35 s]
0.0.N: Trace Attempt 193	[94.43 s]
0.0.AM: Trace Attempt 540	[95.65 s]
0.0.B: Trace Attempt 8385	[96.22 s]
0.0.Hp: Trace Attempt 3293	[96.39 s]
0.0.N: Trace Attempt 254	[98.45 s]
0.0.AM: Trace Attempt 560	[99.73 s]
0.0.B: Trace Attempt 8436	[100.22 s]
0.0.Hp: Trace Attempt 3362	[100.42 s]
0.0.N: Trace Attempt 317	[102.58 s]
0.0.AM: Trace Attempt 575	[103.92 s]
0.0.B: Trace Attempt 8488	[104.26 s]
0.0.Hp: Trace Attempt 3430	[104.45 s]
0.0.N: Trace Attempt 359	[106.59 s]
0.0.Ht: Trace Attempt 8194	[107.59 s]
0.0.AM: Trace Attempt 590	[108.14 s]
0.0.B: Trace Attempt 8535	[108.27 s]
0.0.Hp: Trace Attempt 3497	[108.45 s]
0.0.N: Trace Attempt 401	[110.61 s]
0.0.Ht: Trace Attempt 8307	[111.61 s]
0.0.B: Trace Attempt 8583	[112.32 s]
0.0.Hp: Trace Attempt 3561	[112.48 s]
0.0.AM: Trace Attempt 606	[112.54 s]
0.0.N: Trace Attempt 441	[114.64 s]
0.0.Ht: Trace Attempt 8430	[115.63 s]
0.0.N: Trace Attempt  1	[116.12 s]
0.0.N: Trace Attempt  2	[116.12 s]
0.0.N: Trace Attempt  3	[116.12 s]
0.0.N: Trace Attempt  4	[116.13 s]
0.0.N: Trace Attempt  5	[116.13 s]
0.0.B: Trace Attempt 8621	[116.33 s]
0.0.Hp: Trace Attempt 3623	[116.50 s]
0.0.AM: Trace Attempt 619	[116.65 s]
0.0.Ht: Trace Attempt 8538	[119.63 s]
0.0.N: Trace Attempt 192	[120.14 s]
0.0.B: Trace Attempt 8668	[120.33 s]
0.0.Hp: Trace Attempt 3686	[120.55 s]
0.0.AM: Trace Attempt 633	[120.67 s]
0.0.Ht: Trace Attempt 8638	[123.64 s]
0.0.N: Trace Attempt 252	[124.19 s]
0.0.B: Trace Attempt 8714	[124.39 s]
0.0.Hp: Trace Attempt 3747	[124.62 s]
0.0.AM: Trace Attempt 646	[124.70 s]
0.0.Ht: Trace Attempt 8744	[127.67 s]
0.0.N: Trace Attempt 313	[128.20 s]
0.0.B: Trace Attempt 8758	[128.40 s]
0.0.Hp: Trace Attempt 3807	[128.62 s]
0.0.AM: Trace Attempt 658	[128.85 s]
0.0.Ht: Trace Attempt 8842	[131.69 s]
0.0.N: Trace Attempt 356	[132.24 s]
0.0.B: Trace Attempt 8802	[132.49 s]
0.0.Hp: Trace Attempt 3866	[132.63 s]
0.0.AM: Trace Attempt 670	[132.89 s]
0.0.Ht: Trace Attempt 8936	[135.70 s]
0.0.N: Trace Attempt 398	[136.29 s]
0.0.B: Trace Attempt 8846	[136.55 s]
0.0.Hp: Trace Attempt 3924	[136.66 s]
0.0.AM: Trace Attempt 679	[137.11 s]
0.0.Ht: Trace Attempt 9023	[139.72 s]
0.0.N: Trace Attempt 439	[140.34 s]
0.0.B: Trace Attempt 8889	[140.58 s]
0.0.Hp: Trace Attempt 3981	[140.71 s]
0.0.AM: Trace Attempt 689	[141.36 s]
0.0.N: Trace Attempt  1	[141.93 s]
0.0.N: Trace Attempt  2	[141.93 s]
0.0.N: Trace Attempt  3	[141.93 s]
0.0.N: Trace Attempt  4	[141.93 s]
0.0.N: Trace Attempt  5	[141.93 s]
0.0.Ht: Trace Attempt 9112	[143.74 s]
0.0.B: Trace Attempt 8934	[144.66 s]
0.0.Hp: Trace Attempt 4037	[144.72 s]
0.0.AM: Trace Attempt 702	[145.49 s]
0.0.N: Trace Attempt 192	[145.96 s]
0.0.Ht: Trace Attempt 9196	[147.78 s]
0.0.Hp: Trace Attempt 4093	[148.79 s]
0.0.B: Trace Attempt 8979	[148.76 s]
0.0.AM: Trace Attempt 717	[149.78 s]
0.0.N: Trace Attempt 252	[149.97 s]
0.0.Ht: Trace Attempt 9258	[152.08 s]
0.0.Hp: Trace Attempt 4147	[152.86 s]
0.0.B: Trace Attempt 9024	[152.84 s]
0.0.N: Trace Attempt 313	[154.00 s]
0.0.AM: Trace Attempt 731	[154.11 s]
0.0.Ht: Trace Attempt 9330	[156.11 s]
0.0.Hp: Trace Attempt 4200	[156.89 s]
0.0.B: Trace Attempt 9068	[156.92 s]
0.0.N: Trace Attempt 356	[158.07 s]
0.0.AM: Trace Attempt 743	[158.58 s]
0.0.Hp: Trace Attempt 4252	[160.89 s]
0.0.B: Trace Attempt 9111	[160.94 s]
0.0.N: Trace Attempt 397	[162.08 s]
0.0.AM: Trace Attempt 754	[162.72 s]
0.0.Ht: Trace Attempt 9390	[164.59 s]
0.0.Hp: Trace Attempt 4303	[164.93 s]
0.0.B: Trace Attempt 9153	[164.95 s]
0.0.N: Trace Attempt 438	[166.16 s]
0.0.AM: Trace Attempt 765	[167.03 s]
0.0.N: Trace Attempt  1	[168.08 s]
0.0.N: Trace Attempt  2	[168.08 s]
0.0.N: Trace Attempt  3	[168.08 s]
0.0.N: Trace Attempt  4	[168.08 s]
0.0.N: Trace Attempt  5	[168.08 s]
0.0.Ht: Trace Attempt 9492	[168.64 s]
0.0.Hp: Trace Attempt 4353	[168.94 s]
0.0.B: Trace Attempt 9194	[168.96 s]
0.0.AM: Trace Attempt 775	[171.24 s]
0.0.N: Trace Attempt 191	[172.10 s]
0.0.Ht: Trace Attempt 9590	[172.67 s]
0.0.Hp: Trace Attempt 4403	[172.96 s]
0.0.B: Trace Attempt 9238	[173.01 s]
0.0.AM: Trace Attempt 785	[175.35 s]
0.0.N: Trace Attempt 251	[176.10 s]
0.0.Ht: Trace Attempt 9697	[176.69 s]
0.0.Hp: Trace Attempt 4454	[177.04 s]
0.0.B: Trace Attempt 9280	[177.07 s]
0.0.AM: Trace Attempt 795	[179.39 s]
0.0.N: Trace Attempt 312	[180.14 s]
0.0.Ht: Trace Attempt 9782	[180.70 s]
0.0.N: Trace Attempt 322	[180.97 s]
0.0.N: Stopped processing property "GRAY.p1"	[181.06 s].
0.0.N: Morphing to Ncustom1
0.0.N: All properties determined. [0.00 s]
0.0.N: Exited with Success (@ 0.00 s)
0.0.Ncustom1: clocks: 1, declared: 1, looping: 0, posedge: 1, negedge: 0, noedge: 0, bothedge: 0
0.0.Ncustom1: Starting proof for property "GRAY.p1"	[0.00 s].
0.0.Ncustom1: Trace Attempt 446	[0.03 s]
0.0.Hp: Trace Attempt 4504	[181.12 s]
0.0.Tri: Proofgrid shell started at 335@vlsi-ria85(local) jg_26941_vlsi-ria85_1
0.0.Tri: clocks: 1, declared: 1, looping: 0, posedge: 1, negedge: 0, noedge: 0, bothedge: 0
0.0.Tri: Last scan. Per property time limit: 0s
0.0.Tri: Starting proof for property "GRAY.p1"	[0.00 s].
0.0.Tri: Trace Attempt  1	[0.00 s]
0.0.B: Trace Attempt 9320	[180.94 s]
0.0.B: Stopped processing property "GRAY.p1"	[181.09 s].
0.0.B: Morphing to Bcustom2
0.0.B: All properties determined. [0.00 s]
0.0.B: Exited with Success (@ 0.00 s)
0.0.Bcustom2: clocks: 1, declared: 1, looping: 0, posedge: 1, negedge: 0, noedge: 0, bothedge: 0
0.0.Bcustom2: Starting proof for property "GRAY.p1"	[0.00 s].
0.0.Bcustom2: Trace Attempt  1	[0.00 s]
0.0.Bcustom2: Trace Attempt  2	[0.00 s]
0.0.Bcustom2: Trace Attempt  3	[0.00 s]
0.0.Bcustom2: Trace Attempt  1	[0.00 s]
0.0.Bcustom2: Trace Attempt  2	[0.00 s]
0.0.Bcustom2: Trace Attempt  3	[0.00 s]
0.0.Bcustom2: Trace Attempt  4	[0.00 s]
0.0.Bcustom2: Trace Attempt  5	[0.00 s]
0.0.Bcustom2: Trace Attempt  1	[0.00 s]
0.0.Bcustom2: Trace Attempt  2	[0.00 s]
0.0.Bcustom2: Trace Attempt  3	[0.00 s]
0.0.Bcustom2: Trace Attempt  4	[0.00 s]
0.0.Bcustom2: Trace Attempt  5	[0.00 s]
0.0.Bcustom2: Trace Attempt  1	[0.00 s]
0.0.Bcustom2: Trace Attempt  2	[0.00 s]
0.0.Bcustom2: Trace Attempt  3	[0.00 s]
0.0.Bcustom2: Trace Attempt  4	[0.00 s]
0.0.Bcustom2: Trace Attempt  5	[0.00 s]
0.0.Bcustom2: Trace Attempt  1	[0.01 s]
0.0.Bcustom2: Trace Attempt  2	[0.01 s]
0.0.Bcustom2: Trace Attempt  3	[0.01 s]
0.0.Bcustom2: Trace Attempt  4	[0.01 s]
0.0.Bcustom2: Trace Attempt  5	[0.01 s]
0.0.Bcustom2: Trace Attempt  1	[0.01 s]
0.0.Bcustom2: Trace Attempt  2	[0.01 s]
0.0.Bcustom2: Trace Attempt  3	[0.01 s]
0.0.Bcustom2: Trace Attempt  4	[0.01 s]
0.0.Bcustom2: Trace Attempt  5	[0.01 s]
0.0.Bcustom2: Trace Attempt  1	[0.03 s]
0.0.Bcustom2: Trace Attempt  2	[0.03 s]
0.0.Bcustom2: Trace Attempt  3	[0.03 s]
0.0.Bcustom2: Trace Attempt  4	[0.03 s]
0.0.Bcustom2: Trace Attempt  5	[0.03 s]
0.0.AM: Trace Attempt 798	[180.70 s]
0.0.AM: Stopped processing property "GRAY.p1"	[181.14 s].
0.0.AM: Morphing to AMcustom3
0.0.Tri:    0.00" ---- Launching main thread ----
0.0.Bcustom2: Trace Attempt  1	[0.07 s]
0.0.Bcustom2: Trace Attempt  2	[0.07 s]
0.0.Bcustom2: Trace Attempt  3	[0.07 s]
0.0.Bcustom2: Trace Attempt  4	[0.07 s]
0.0.Bcustom2: Trace Attempt  5	[0.07 s]
0.0.Tri:    0.03" ---- Launching abstraction thread ----
0.0.Tri:    0.03" ---- Launching multi-phase simplification thread ----
0.0.AM: All properties determined. [0.00 s]
0.0.AM: Exited with Success (@ 0.00 s)
0.0.AMcustom3: clocks: 1, declared: 1, looping: 0, posedge: 1, negedge: 0, noedge: 0, bothedge: 0
0.0.AMcustom3: Starting proof for property "GRAY.p1"	[0.00 s].
0.0.Tri:    0.04" ---- Launching liveness simplification thread ----
0.0.AMcustom3: Trace Attempt  1	[0.00 s]
0.0.AMcustom3: Trace Attempt  2	[0.00 s]
0.0.AMcustom3: Trace Attempt  3	[0.00 s]
0.0.AMcustom3: Trace Attempt  4	[0.00 s]
0.0.AMcustom3: Trace Attempt  5	[0.00 s]
0.0.AMcustom3: Trace Attempt  1	[0.00 s]
0.0.AMcustom3: Trace Attempt  2	[0.00 s]
0.0.AMcustom3: Trace Attempt  3	[0.00 s]
0.0.AMcustom3: Trace Attempt  5	[0.00 s]
0.0.AMcustom3: Trace Attempt  1	[0.01 s]
0.0.AMcustom3: Trace Attempt  2	[0.01 s]
0.0.AMcustom3: Trace Attempt  3	[0.01 s]
0.0.AMcustom3: Trace Attempt  4	[0.01 s]
0.0.AMcustom3: Trace Attempt  5	[0.02 s]
0.0.AMcustom3: Trace Attempt  1	[0.03 s]
0.0.AMcustom3: Trace Attempt  2	[0.03 s]
0.0.AMcustom3: Trace Attempt  3	[0.03 s]
0.0.AMcustom3: Trace Attempt  4	[0.04 s]
0.0.AMcustom3: Trace Attempt  5	[0.04 s]
0.0.AMcustom3: Trace Attempt  1	[0.11 s]
0.0.AMcustom3: Trace Attempt  2	[0.11 s]
0.0.AMcustom3: Trace Attempt  3	[0.11 s]
0.0.AMcustom3: Trace Attempt  4	[0.11 s]
0.0.AMcustom3: Trace Attempt  5	[0.11 s]
0.0.AMcustom3: Trace Attempt  1	[0.37 s]
0.0.AMcustom3: Trace Attempt  2	[0.37 s]
0.0.AMcustom3: Trace Attempt  3	[0.37 s]
0.0.AMcustom3: Trace Attempt  4	[0.37 s]
0.0.AMcustom3: Trace Attempt  5	[0.38 s]
0.0.Bcustom2: Trace Attempt  1	[0.56 s]
0.0.Bcustom2: Trace Attempt  2	[0.56 s]
0.0.Bcustom2: Trace Attempt  3	[0.56 s]
0.0.Bcustom2: Trace Attempt  4	[0.56 s]
0.0.Bcustom2: Trace Attempt  5	[0.56 s]
0.0.Tri:    0.85" Simplification phase 1 complete
0.0.Ncustom1: Requesting engine job to terminate
0.0.Bcustom2: Requesting engine job to terminate
0.0.AMcustom3: Requesting engine job to terminate
0.0.Tri: Requesting engine job to terminate
0.0.Hp: Requesting engine job to terminate
0.0.Ht: Requesting engine job to terminate
INFO (IPF144): 0: Initiating shutdown of proof [182.10 s]
0.0.Tri: A proof was found: No trace exists. [0.94 s]
INFO (IPF057): 0.0.Tri: The property "GRAY.p1" was proven in 0.95 s.
0.0.AMcustom3: Trace Attempt 93	[0.85 s]
0.0.AMcustom3: Stopped processing property "GRAY.p1"	[0.86 s].
0.0.AMcustom3: All properties determined. [0.86 s]
0.0.AMcustom3: Exited with Success (@ 182.11 s)
0: ProofGrid usable level: 0
0.0.Ht: Trace Attempt 9810	[182.03 s]
0.0.Ht: All properties determined. [182.06 s]
0.0.Hp: Trace Attempt 4515	[182.05 s]
0.0.Hp: All properties determined. [182.13 s]
0.0.Ncustom1: Trace Attempt 447	[1.02 s]
0.0.Ncustom1: Stopped processing property "GRAY.p1"	[1.07 s].
0.0.Ncustom1: All properties determined. [1.07 s]
0.0.Ncustom1: Exited with Success (@ 182.15 s)
0.0.Ht: Exited with Success (@ 182.16 s)
0.0.Tri: Stopped processing property "GRAY.p1"	[1.14 s].
0.0.Tri: All properties determined. [1.14 s]
0.0.Tri: Exited with Success (@ 182.30 s)
0.0.Hp: Exited with Success (@ 182.31 s)
0.0.Bcustom2: Trace Attempt  1	[2.14 s]
0.0.Bcustom2: Stopped processing property "GRAY.p1"	[2.14 s].
0.0.Bcustom2: All properties determined. [2.14 s]
0.0.Bcustom2: Exited with Success (@ 183.32 s)
0: --------------------------------------------------------------
ProofGrid Summary (utilization 99.96 %)
--------------------------------------------------------------
     engines started                               :    10
     engine jobs started                           :     7
     jobs where 1 minute load exceeded core count  :     3

    Average time in state (seconds)
    ------------------------------------------------------
    Engine  Pending     Running        Dead    Utilization
    ------------------------------------------------------
     Hp        0.03      182.10        0.00       99.98 %
     Ht        0.06      182.04        0.00       99.96 %
     Oh        0.04        0.00        0.00        3.29 %
    Ncustom1        0.03      182.05        0.00       99.98 %
    Bcustom2        0.05      181.92        0.00       99.97 %
    AMcustom3        0.03      181.85        0.00       99.98 %
    Tri        0.08        0.95        0.00       92.00 %
    all        0.05      130.13        0.00       99.96 %

    Total time in state (seconds)
    -----------------------------------------
            Pending     Running        Dead  
    -----------------------------------------
               0.33      910.93        0.00

    Data read    : 6.71 MiB
    Data written : 2.96 kiB

0: All pending notifications were processed.
INFO (IPF059): 0: Completed proof on task: "<embedded>"

==============================================================
SUMMARY
==============================================================
           Properties Considered              : 1
                 assertions                   : 1
                  - proven                    : 1 (100%)
                  - bounded_proven (user)     : 0 (0%)
                  - bounded_proven (auto)     : 0 (0%)
                  - marked_proven             : 0 (0%)
                  - cex                       : 0 (0%)
                  - ar_cex                    : 0 (0%)
                  - undetermined              : 0 (0%)
                  - unknown                   : 0 (0%)
                  - error                     : 0 (0%)
                 covers                       : 0
                  - unreachable               : 0
                  - bounded_unreachable (user): 0
                  - covered                   : 0
                  - ar_covered                : 0
                  - undetermined              : 0
                  - unknown                   : 0
                  - error                     : 0
proven
[<embedded>] % exit -force
INFO (IPL005): Received request to exit from the console.
INFO: Waiting for proof threads to stop...
INFO: Proof threads stopped.
INFO (IPL018): The peak resident set memory use for this session was 1.747 GB.
INFO (IPL014): Waiting for the Tcl-thread to exit.
INFO (IPL015): The Tcl-thread exited with status 0.
INFO (IPL016): Exiting the analysis session with status 0.
