# ----------------------------------------
# Jasper Version Info
# tool      : Jasper 2024.06
# platform  : Linux 3.10.0-1160.62.1.el7.x86_64
# version   : 2024.06p002 64 bits
# build date: 2024.09.02 16:28:38 UTC
# ----------------------------------------
# started   : 2025-11-18 09:05:42 IST
# hostname  : vlsi-ria84.vlsidomain
# pid       : 5303
# arguments : '-label' 'session_0' '-console' '//127.0.0.1:37153' '-nowindow' '-style' 'windows' '-exitonerror' '-data' 'AAAA5nicY2RgYLCp////PwMYMD6A0Aw2jAyoAMRnQhUJbEChGRhYYZphSliAmItBl6GAoYghnyELyLNg0ANCfSA7HS6aypDMUMJQDBQtYcgA8ooYcoHiyUBcClSTAxSJZzAG6uUBmpTEkAhUlQxUx8Cggle9HlhdDtgdADqhHQU=' '-proj' '/users/rompel/jasper_executions/safety_liveness/jgprojects/thermocouple_3/sessionLogs/session_0' '-init' '-hidden' '/users/rompel/jasper_executions/safety_liveness/jgprojects/thermocouple_3/.tmp/.initCmds.tcl' 'thermocouple_3.tcl' '-hidden' '/users/rompel/jasper_executions/safety_liveness/jgprojects/thermocouple_3/.tmp/.postCmds.tcl'

Any disclosure about the Cadence Design Systems software or its use
model to any third party violates the written Non-Disclosure Agreement
between Cadence Design Systems, Inc. and the customer.

THIS SOFTWARE CONTAINS CONFIDENTIAL INFORMATION AND TRADE SECRETS OF
CADENCE DESIGN SYSTEMS, INC. USE, DISCLOSURE, OR REPRODUCTION IS
PROHIBITED WITHOUT THE PRIOR EXPRESS WRITTEN PERMISSION OF CADENCE
DESIGN SYSTEMS, INC.

Copyright (C) 2000-2024 Cadence Design Systems, Inc. All Rights
Reserved.  Unpublished -- rights reserved under the copyright laws of
the United States.

This product includes software developed by others and redistributed
according to license agreement. See doc/third_party_readme.txt for
further details.

RESTRICTED RIGHTS LEGEND

Use, duplication, or disclosure by the Government is subject to
restrictions as set forth in subparagraph (c) (1) (ii) of the Rights in
Technical Data and Computer Software clause at DFARS 252.227-7013 or
subparagraphs (c) (1) and (2) of Commercial Computer Software -- Restricted
Rights at 48 CFR 52.227-19, as applicable.


                          Cadence Design Systems, Inc.
                          2655 Seely Avenue
                          San Jose, CA 95134
                          Phone: 408.943.1234

For technical assistance visit http://support.cadence.com.

Jasper Apps Analysis Session - /users/rompel/jasper_executions/safety_liveness/jgprojects/thermocouple_3/sessionLogs/session_0

WARNING (WG017): [session]: The system's locale is "ANSI_X3.4-1968", which is not UTF-8. Non-ASCII characters might not be handled correctly.
WARNING (WG017): [jg_console]: The system's locale is "ANSI_X3.4-1968", which is not UTF-8. Non-ASCII characters might not be handled correctly.
INFO: successfully checked out license "jasper_fao".
INFO: reading configuration file "/users/rompel/.config/cadence/jasper.conf".
% analyze -sv09 ../thermocouple_3.sv
[-- (VERI-1482)] Analyzing Verilog file '/tools/cadence2425/JASPER/jasper_2024.06p002/lib/verilog/packages/std/std.sv' into library 'std'
[-- (VERI-1482)] Analyzing Verilog file '../thermocouple_3.sv'
% elaborate -bbox_mul 1000000 -bbox_div 1000000 -bbox_mod 1000000 -bbox_a 1000000
[INFO (HIER-8002)] ../thermocouple_3.sv(46): Disabling old hierarchical reference handler
[INFO (VERI-1018)] ../thermocouple_3.sv(1): compiling module 'Thermocouple'
[WARN (VERI-1209)] ../thermocouple_3.sv(18): expression size 32 truncated to fit in target size 10
[WARN (VERI-1209)] ../thermocouple_3.sv(37): expression size 32 truncated to fit in target size 10
[INFO (VERI-8005)] ../thermocouple_3.sv(1): Unintentional sequential element inferred for tc_temp_data read before write using blocking assignment
[INFO (VERI-8005)] ../thermocouple_3.sv(1): Unintentional sequential element inferred for junction_temp_data read before write using blocking assignment
[INFO (VERI-8005)] ../thermocouple_3.sv(1): Unintentional sequential element inferred for fault_bits read before write using blocking assignment
[INFO (VERI-8005)] ../thermocouple_3.sv(5): Unintentional sequential element inferred for state read before write using blocking assignment
[INFO (VERI-8005)] ../thermocouple_3.sv(6): Unintentional sequential element inferred for cnt read before write using blocking assignment
INFO (ISW003): Top module name is "Thermocouple".
INFO (INL208): Elaboration synthesis summary:
  Number of synthesized netlists          1 (0 packages)
  Single run mode                         On
  Pipeline                                On (1 pipelined netlists)
  Late hierarchical reference connection  On
  Number of analyzed Verilog modules      1 (1 synthesized)
  Number of analyzed VHDL entities        0 (0 synthesized)
INFO (INL003): Clearing all state information (assumes, stopats, and so forth).
Thermocouple
[<embedded>] % reset rst
INFO (IPM031): Clearing proof results of all properties.
INFO (IRS006): Current reset condition is "rst".
[<embedded>] % clock clk
[<embedded>] % prove -all
Ncustom1: Custom engine code is hT3Ng7hPPfiYQOTDZ3qhYOwGAM51eA+J/FjkM5shLioAsqhgLR4Ft+O1BuKG6ilQ83B9tLXSl+CwjiTMAQA
Bcustom2: Custom engine code is hT3Nm7hPr1Vp3Di1Ra2USNIGL4JypRnLKLAdF6JAyuavO2JfGCiY9OZJhcAcOUnLx5xwNdhILGrAWX9s+z2WDkKwNR7tAfClBEjRFVQeq6DU54boFgEA
AMcustom3: Custom engine code is hT3Ng7hP/feYQOTDZ3qhYOwGAM51eA+J/FjkM5shLioAsqhgLR4Ft+O1BuKG6ilQ83B9tLXSmmqwm7g9AQA
Mpcustom4: Custom engine code is hT3NZbhP9fmY2AbBQnsjfOxn6c+6e6yL+/e8fZFmaQrnlgEA
INFO (IPF036): Starting proof on task: "<embedded>", 1 properties to prove with 0 already proven/unreachable
INFO (IRS029): Starting reset analysis: phase 1 of 4.
INFO (IRS030): Running reset analysis: phase 2 of 4.
INFO (IRS031): Running reset analysis: phase 3 of 4.
INFO (IRS020): Starting the reset analysis simulation with a limit of 100 iterations (phase 4 of 4).
INFO (IRS024): Reset iterations 0 to 4 analyzed.
INFO (IRS018): Reset analysis simulation executed for 3 iterations. Assigned values for 43 of 43 design flops, 0 of 0 design latches, 3 of 3 internal elements.
INFO (IRS039): Reset analysis complete.
INFO (IPF031): Settings used for proof thread 0:
    orchestration                 = on
    time_limit                    = 86400s
    per_property_time_limit       = 1s * 10 ^ scan
    engine_mode                   = auto
    proofgrid_per_engine_max_jobs = 1
    max engine jobs               = auto
    proofgrid_mode                = local
    proofgrid_restarts            = 10
0: Using multistage preprocessing
AMcustom5: Custom engine code is hT3N1rhP11/52HrFRS21ROp2LOjVTgPvT8L8BGXHgLhaIuqtT4nARFjUqrBL+7pLmaTOzBepZW/Jm8SSrHDybSQtoNiO3y43wk+dEoWlsZizu97Fih6O6lPVG/LpWP5SsUPwlGagLNa1FKEFvwVXyX7//8prySbvSxIHXr5er+z4RAEA
0: Starting reduce
Ncustom6: Custom engine code is hT3OXrhPByJp3TrFSTLhUmMH4KVtJgmTCnNDF46yMXOKY48m4LS5nE7yBzFjA7kDuwO/GhGUpEPiky3p3wmPn3dJZHxFMsafSoObRzSC+tn7sEY0WbTdZ/FV4hL3MYH/b1CIUvXSWR4wqEoVLsmMOD4xIPT4lI1LO6ZCO7PnnWQuLwetnvKlrXx6wCW/A+x+enqslg1YPobi4wEF/EvbzOvcTYdJvl2s4H2yZg2b2ofAVN5WvhWk1HoBAA
ADcustom7: Custom engine code is hT3Nv7hPv1752HrFRa2kROx2f/ECJeZB2AZsLdlO8VwmIuqtT4nIDFXclhg+O+o+DMmQCekbheGk0kK28laA9gaOFDXsQp29J3X615HY1IPHJWd6FUFvCHjO+p1k652b5JJvZlShNpGlGSXAiQe/mEAj6tEBAA
Tricustom8: Custom engine code is hT3Nu7hPt1752DvFRa0kNDiyIV97VyejwM9C/jCLJjdPvusZONHY42VYUy0Q1ZotnhcVtNc56tJ5wbxv6V2+XpdsaSlHck5vfnbYjdwj1OECy9U+7oSQ0SZE3g5ayD+Phuh4odCJTjeKa2k4elM9ldQfkAEA
Gcustom9: Custom engine code is hT3NibhPDfeYQADBZnYcglOvK9Pfd7EOeniIqP8jNsyIqInncipMGcUXqAadachREE9F2PwhBUZUNw5kHnd4JdXkamORRgEA
C2custom10: Custom engine code is hT3NirhPjfWYQADBZnYcglOvK9Pfd7EOeniIqP8jNsyIqInncgkrYMMXCYbdK0dUjZIF9d4cJ0rHoBDjwVLBKuG86XYVV00BAA
AGcustom11: Custom engine code is hT3NirhP/fmYQADBZnYcglOvK9Pfd7EOeniIqP8jNsyIqInnckcwYMMXCYbdK0dUjZIF9d4cJ0rHoBDjwVLBKuHEZnZByh0BAA
Bcustom12: Custom engine code is hT3NjrhPDfiYQADBZnYcglOvK9PfWxFtenjIyBqfrgr7if/jL/yPOuK1BAflEcW0DxNH2eDIoezN2gxlQFg81RZtiWXh7aiTAidvAQA
0: Finished reduce in 0s
Ncustom13: Custom engine code is hT3NR7hPByFp3TrFSTLhUmMH4KWtJglTyV/c51BHEeZWamnJv767nE6PCak26bd3gf3XGN3rIRheufhDieCJQVISo+gNYUKhiUedBKGtsP/a18svAnlMJZudHxDFwK5ufsyoxsIyiAeSY2oi3tEuoDHr5gw42DFKAG3PqO3CEsl8Azzdt3pl5nGA1Ifv2H02eYsFzWb/nfp8PMb3F0krE/EgBcm8TD9Div8BAA
Tricustom14: Custom engine code is hT3Nu7hP3fiYQADBZnYcglNHp9bfd7EOeniIqP/ji8sGLQu8yhsFO+wxJ+O+R0bU8g/IewXFomyos+viQnWc2xYNYmMqpo3i40O7DaZR7qfp4YqNx26KRvQ/qx0BAA
0.0.PRE: Performing Proof Simplification...
0.0.N: clocks: 1, declared: 1, looping: 0, posedge: 1, negedge: 0, noedge: 0, bothedge: 0
0.0.N: Proof Simplification Iteration 1	[0.00 s]
0.0.N: Proof Simplification Iteration 2	[0.00 s]
0.0.N: Proof Simplification Iteration 3	[0.00 s]
0.0.PRE: A proof was found: No trace exists. [0.00 s]
INFO (IPF057): 0.0.PRE: The property ":noDeadEnd" was proven in 0.00 s.
    Use check_assumptions -show -dead_end to show this property in the property table.
0.0.PRE: A proof was found: No trace exists. [0.00 s]
INFO (IPF057): 0.0.PRE: The property ":noConflict" was proven in 0.00 s.
    Use check_assumptions -show to show this property in the property table.
INFO (IPF047): 0.0.PRE: The cover property ":live" was covered in 1 cycles in 0.00 s.
    Use check_assumptions -show -live to show this property in the property table.
0.0.PRE: Proof Simplification completed in 0.00 s
0: About to start ProofGrid in its own thread with a limit of 10000 pending notifications and a limit of 10 traces.
0: =============================== ProofGrid start ===============================
0: ProofGrid usable level: 1
0: Initial ProofGrid level: 1
0: ProofGrid is starting event handling
0.0.Hp: Proofgrid shell started at 5370@vlsi-ria84(local) jg_5303_vlsi-ria84_1
0.0.N: Proofgrid shell started at 5369@vlsi-ria84(local) jg_5303_vlsi-ria84_1
0.0.N: clocks: 1, declared: 1, looping: 0, posedge: 1, negedge: 0, noedge: 0, bothedge: 0
0.0.N: Last scan. Per property time limit: 0s
0.0.N: Starting proof for property "Thermocouple.p1"	[0.00 s].
0.0.N: Trace Attempt  1	[0.00 s]
0.0.Hp: clocks: 1, declared: 1, looping: 0, posedge: 1, negedge: 0, noedge: 0, bothedge: 0
0.0.N: Trace Attempt  2	[0.00 s]
0.0.Hp: Last scan. Per property time limit: 0s
0.0.N: Trace Attempt  2	[0.00 s]
0.0.N: Trace Attempt  3	[0.00 s]
0.0.N: Trace Attempt  4	[0.00 s]
0.0.Hp: Trace Attempt  1	[0.00 s]
0.0.N: Trace Attempt  4	[0.00 s]
0.0.Hp: Trace Attempt  2	[0.00 s]
0.0.Hp: Trace Attempt  3	[0.00 s]
0.0.N: Trace Attempt  5	[0.00 s]
0.0.Hp: Trace Attempt  4	[0.00 s]
0.0.Hp: Trace Attempt  5	[0.00 s]
0.0.N: Trace Attempt  1	[0.01 s]
0.0.N: Trace Attempt  2	[0.01 s]
0.0.N: Trace Attempt  3	[0.01 s]
0.0.N: Trace Attempt  4	[0.01 s]
0.0.N: Trace Attempt  5	[0.01 s]
0.0.Oh: Proofgrid shell started at 5404@vlsi-ria84(local) jg_5303_vlsi-ria84_1
0.0.Oh: clocks: 1, declared: 1, looping: 0, posedge: 1, negedge: 0, noedge: 0, bothedge: 0
0.0.Oh: Reached length limit (2147483647) [0.00 s]
0.0.Oh: Exited with Success (@ 0.03 s)
0.0.B: Proofgrid shell started at 5405@vlsi-ria84(local) jg_5303_vlsi-ria84_1
0.0.B: clocks: 1, declared: 1, looping: 0, posedge: 1, negedge: 0, noedge: 0, bothedge: 0
0.0.AM: Proofgrid shell started at 5416@vlsi-ria84(local) jg_5303_vlsi-ria84_1
0.0.Ht: Proofgrid shell started at 5403@vlsi-ria84(local) jg_5303_vlsi-ria84_1
0.0.B: Last scan. Per property time limit: 0s
0.0.B: Starting proof for property "Thermocouple.p1"	[0.00 s].
0.0.B: Trace Attempt  1	[0.00 s]
0.0.B: Trace Attempt  2	[0.00 s]
0.0.B: Trace Attempt  3	[0.00 s]
0.0.B: Trace Attempt  4	[0.00 s]
0.0.B: Trace Attempt  5	[0.00 s]
0.0.AM: clocks: 1, declared: 1, looping: 0, posedge: 1, negedge: 0, noedge: 0, bothedge: 0
0.0.Ht: clocks: 1, declared: 1, looping: 0, posedge: 1, negedge: 0, noedge: 0, bothedge: 0
0.0.AM: Last scan. Per property time limit: 0s
0.0.AM: Starting proof for property "Thermocouple.p1"	[0.00 s].
0.0.Ht: Last scan. Per property time limit: 0s
0.0.Ht: Trace Attempt  1	[0.00 s]
0.0.AM: Trace Attempt  1	[0.00 s]
0.0.Ht: Trace Attempt  2	[0.00 s]
0.0.Ht: Trace Attempt  3	[0.00 s]
0.0.Ht: Trace Attempt  4	[0.00 s]
0.0.Ht: Trace Attempt  5	[0.00 s]
0.0.AM: Trace Attempt  2	[0.00 s]
0.0.AM: Trace Attempt  3	[0.00 s]
0.0.AM: Trace Attempt  4	[0.00 s]
0.0.AM: Trace Attempt  5	[0.00 s]
0.0.AM: Trace Attempt  1	[0.00 s]
0.0.AM: Trace Attempt  2	[0.00 s]
0.0.AM: Trace Attempt  3	[0.00 s]
0.0.AM: Trace Attempt  4	[0.00 s]
0.0.AM: Trace Attempt  1	[0.01 s]
0.0.AM: Trace Attempt  2	[0.01 s]
0.0.AM: Trace Attempt  3	[0.01 s]
0.0.AM: Trace Attempt  4	[0.01 s]
0.0.AM: Trace Attempt  5	[0.01 s]
0.0.AM: Trace Attempt  1	[0.03 s]
0.0.AM: Trace Attempt  2	[0.04 s]
0.0.AM: Trace Attempt  3	[0.04 s]
0.0.AM: Trace Attempt  4	[0.04 s]
0.0.AM: Trace Attempt  5	[0.04 s]
0.0.N: Trace Attempt  1	[0.10 s]
0.0.N: Trace Attempt  2	[0.10 s]
0.0.N: Trace Attempt  3	[0.10 s]
0.0.N: Trace Attempt  4	[0.10 s]
0.0.N: Trace Attempt  5	[0.10 s]
0.0.AM: Trace Attempt  1	[0.11 s]
0.0.AM: Trace Attempt  2	[0.11 s]
0.0.AM: Trace Attempt  3	[0.11 s]
0.0.AM: Trace Attempt  4	[0.11 s]
0.0.AM: Trace Attempt  5	[0.11 s]
0.0.N: Trace Attempt  1	[0.40 s]
0.0.N: Trace Attempt  2	[0.40 s]
0.0.N: Trace Attempt  3	[0.40 s]
0.0.N: Trace Attempt  4	[0.40 s]
0.0.N: Trace Attempt  5	[0.40 s]
0.0.AM: Trace Attempt  1	[0.40 s]
0.0.AM: Trace Attempt  2	[0.40 s]
0.0.AM: Trace Attempt  3	[0.40 s]
0.0.AM: Trace Attempt  4	[0.40 s]
0.0.AM: Trace Attempt  5	[0.40 s]
0.0.N: Trace Attempt  1	[0.75 s]
0.0.N: Trace Attempt  2	[0.75 s]
0.0.N: Trace Attempt  3	[0.75 s]
0.0.N: Trace Attempt  4	[0.75 s]
0.0.N: Trace Attempt  5	[0.75 s]
0.0.AM: Trace Attempt  1	[1.68 s]
0.0.AM: Trace Attempt  2	[1.68 s]
0.0.AM: Trace Attempt  3	[1.68 s]
0.0.AM: Trace Attempt  4	[1.68 s]
0.0.AM: Trace Attempt  5	[1.68 s]
0.0.N: Trace Attempt  1	[2.19 s]
0.0.N: Trace Attempt  2	[2.19 s]
0.0.N: Trace Attempt  3	[2.20 s]
0.0.N: Trace Attempt  4	[2.20 s]
0.0.N: Trace Attempt  5	[2.20 s]
0.0.B: Trace Attempt 1866	[4.00 s]
0.0.Ht: Trace Attempt 2762	[4.00 s]
0.0.Hp: Trace Attempt 153	[4.12 s]
0.0.AM: Trace Attempt 217	[5.69 s]
0.0.N: Trace Attempt 220	[6.24 s]
0.0.N: Trace Attempt  1	[6.92 s]
0.0.N: Trace Attempt  2	[6.92 s]
0.0.N: Trace Attempt  3	[6.92 s]
0.0.N: Trace Attempt  4	[6.92 s]
0.0.N: Trace Attempt  5	[6.92 s]
0.0.AM: Trace Attempt  1	[7.35 s]
0.0.AM: Trace Attempt  2	[7.35 s]
0.0.AM: Trace Attempt  3	[7.35 s]
0.0.AM: Trace Attempt  4	[7.35 s]
0.0.AM: Trace Attempt  5	[7.35 s]
0.0.Ht: Trace Attempt 3678	[8.00 s]
0.0.B: Trace Attempt 2518	[8.01 s]
0.0.Hp: Trace Attempt 210	[8.29 s]
0.0.N: Trace Attempt 220	[10.95 s]
0.0.AM: Trace Attempt 228	[11.37 s]
0.0.N: Trace Attempt  1	[11.53 s]
0.0.N: Trace Attempt  2	[11.54 s]
0.0.N: Trace Attempt  3	[11.54 s]
0.0.N: Trace Attempt  4	[11.54 s]
0.0.N: Trace Attempt  5	[11.54 s]
0.0.Ht: Trace Attempt 4082	[12.00 s]
0.0.B: Trace Attempt 3041	[12.01 s]
0.0.Hp: Trace Attempt 269	[12.32 s]
0.0.AM: Trace Attempt 270	[15.39 s]
0.0.N: Trace Attempt 218	[15.54 s]
0.0.Ht: Trace Attempt 4596	[16.00 s]
0.0.B: Trace Attempt 3462	[16.02 s]
0.0.N: Trace Attempt  1	[16.16 s]
0.0.N: Trace Attempt  2	[16.16 s]
0.0.N: Trace Attempt  3	[16.16 s]
0.0.N: Trace Attempt  4	[16.16 s]
0.0.N: Trace Attempt  5	[16.16 s]
0.0.Hp: Trace Attempt 308	[16.46 s]
0.0.AM: Trace Attempt 324	[19.48 s]
0.0.Ht: Trace Attempt 5205	[20.01 s]
0.0.B: Trace Attempt 3820	[20.02 s]
0.0.N: Trace Attempt 212	[20.17 s]
0.0.Hp: Trace Attempt 326	[20.46 s]
0.0.N: Trace Attempt  1	[20.94 s]
0.0.N: Trace Attempt  2	[20.94 s]
0.0.N: Trace Attempt  3	[20.95 s]
0.0.N: Trace Attempt  4	[20.95 s]
0.0.N: Trace Attempt  5	[20.95 s]
0.0.AM: Trace Attempt 373	[23.58 s]
0.0.Ht: Trace Attempt 5775	[24.01 s]
0.0.B: Trace Attempt 4137	[24.03 s]
0.0.Hp: Trace Attempt 380	[24.47 s]
0.0.N: Trace Attempt 213	[24.95 s]
0.0.N: Trace Attempt  1	[25.69 s]
0.0.N: Trace Attempt  2	[25.69 s]
0.0.N: Trace Attempt  3	[25.69 s]
0.0.N: Trace Attempt  4	[25.69 s]
0.0.N: Trace Attempt  5	[25.69 s]
0.0.AM: Trace Attempt 417	[27.62 s]
0.0.Ht: Trace Attempt 6273	[28.02 s]
0.0.B: Trace Attempt 4433	[28.03 s]
0.0.Hp: Trace Attempt 407	[28.77 s]
0.0.N: Trace Attempt 214	[29.70 s]
0.0.N: Trace Attempt  1	[30.40 s]
0.0.N: Trace Attempt  2	[30.40 s]
0.0.N: Trace Attempt  3	[30.41 s]
0.0.N: Trace Attempt  4	[30.41 s]
0.0.N: Trace Attempt  5	[30.41 s]
0.0.AM: Trace Attempt 458	[31.79 s]
0.0.Ht: Trace Attempt 6714	[32.02 s]
0.0.B: Trace Attempt 4703	[32.05 s]
0.0.Hp: Trace Attempt 433	[32.79 s]
0.0.N: Trace Attempt 213	[34.41 s]
0.0.N: Trace Attempt  1	[35.30 s]
0.0.N: Trace Attempt  2	[35.31 s]
0.0.N: Trace Attempt  3	[35.31 s]
0.0.N: Trace Attempt  4	[35.31 s]
0.0.N: Trace Attempt  5	[35.31 s]
0.0.AM: Trace Attempt 462	[35.79 s]
0.0.Ht: Trace Attempt 7082	[36.03 s]
0.0.B: Trace Attempt 4937	[36.05 s]
0.0.Hp: Trace Attempt 451	[37.02 s]
0.0.AM: Trace Attempt  1	[38.56 s]
0.0.AM: Trace Attempt  2	[38.56 s]
0.0.AM: Trace Attempt  3	[38.56 s]
0.0.AM: Trace Attempt  4	[38.57 s]
0.0.AM: Trace Attempt  5	[38.57 s]
0.0.N: Trace Attempt 214	[39.31 s]
0.0.N: Trace Attempt  1	[40.06 s]
0.0.N: Trace Attempt  2	[40.06 s]
0.0.N: Trace Attempt  3	[40.06 s]
0.0.N: Trace Attempt  4	[40.06 s]
0.0.N: Trace Attempt  5	[40.06 s]
0.0.Ht: Trace Attempt 7438	[40.03 s]
0.0.B: Trace Attempt 5167	[40.05 s]
0.0.Hp: Trace Attempt 473	[42.16 s]
0.0.AM: Trace Attempt 207	[42.59 s]
0.0.N: Trace Attempt 215	[44.08 s]
0.0.Ht: Trace Attempt 7799	[44.05 s]
0.0.B: Trace Attempt 5407	[44.05 s]
0.0.N: Trace Attempt  1	[44.78 s]
0.0.N: Trace Attempt  2	[44.78 s]
0.0.N: Trace Attempt  3	[44.78 s]
0.0.N: Trace Attempt  4	[44.78 s]
0.0.N: Trace Attempt  5	[44.78 s]
0.0.AM: Trace Attempt 263	[46.62 s]
0.0.Hp: Trace Attempt 489	[47.19 s]
0.0.Ht: Trace Attempt 8128	[48.05 s]
0.0.B: Trace Attempt 5633	[48.06 s]
0.0.N: Trace Attempt 215	[48.79 s]
0.0.N: Trace Attempt  1	[49.55 s]
0.0.N: Trace Attempt  2	[49.55 s]
0.0.N: Trace Attempt  3	[49.55 s]
0.0.N: Trace Attempt  4	[49.56 s]
0.0.N: Trace Attempt  5	[49.56 s]
0.0.AM: Trace Attempt 325	[50.66 s]
0.0.Hp: Trace Attempt 511	[51.69 s]
0.0.Ht: Trace Attempt 8413	[52.05 s]
0.0.B: Trace Attempt 5842	[52.07 s]
0.0.N: Trace Attempt 212	[53.56 s]
0.0.N: Trace Attempt  1	[54.35 s]
0.0.N: Trace Attempt  2	[54.35 s]
0.0.N: Trace Attempt  3	[54.35 s]
0.0.N: Trace Attempt  4	[54.35 s]
0.0.N: Trace Attempt  5	[54.36 s]
0.0.AM: Trace Attempt 363	[54.70 s]
0.0.Hp: Trace Attempt 531	[55.78 s]
0.0.Ht: Trace Attempt 8759	[56.05 s]
0.0.B: Trace Attempt 6040	[56.08 s]
0.0.N: Trace Attempt 214	[58.38 s]
0.0.AM: Trace Attempt 410	[58.72 s]
0.0.N: Trace Attempt  1	[59.19 s]
0.0.N: Trace Attempt  2	[59.19 s]
0.0.N: Trace Attempt  3	[59.19 s]
0.0.N: Trace Attempt  4	[59.20 s]
0.0.N: Trace Attempt  5	[59.20 s]
0.0.Hp: Trace Attempt 552	[59.88 s]
0.0.Ht: Trace Attempt 9081	[60.05 s]
0.0.B: Trace Attempt 6229	[60.08 s]
0.0.AM: Trace Attempt 459	[62.79 s]
0.0.N: Trace Attempt 214	[63.22 s]
0.0.N: Trace Attempt  1	[63.99 s]
0.0.N: Trace Attempt  2	[63.99 s]
0.0.N: Trace Attempt  3	[63.99 s]
0.0.N: Trace Attempt  4	[63.99 s]
0.0.N: Trace Attempt  5	[63.99 s]
0.0.Ht: Trace Attempt 9383	[64.06 s]
0.0.B: Trace Attempt 6408	[64.10 s]
0.0.Hp: Trace Attempt 567	[64.29 s]
0.0.AM: Trace Attempt 475	[66.83 s]
0.0.N: Trace Attempt 214	[68.02 s]
0.0.Ht: Trace Attempt 9675	[68.07 s]
0.0.B: Trace Attempt 6588	[68.12 s]
0.0.Hp: Trace Attempt 582	[68.32 s]
0.0.N: Trace Attempt  1	[68.89 s]
0.0.N: Trace Attempt  2	[68.89 s]
0.0.N: Trace Attempt  3	[68.89 s]
0.0.N: Trace Attempt  4	[68.89 s]
0.0.N: Trace Attempt  5	[68.89 s]
0.0.AM: Trace Attempt 502	[70.91 s]
0.0.Ht: Trace Attempt 9953	[72.08 s]
0.0.B: Trace Attempt 6762	[72.13 s]
0.0.Hp: Trace Attempt 593	[72.48 s]
0.0.N: Trace Attempt 214	[72.90 s]
0.0.N: Trace Attempt  1	[73.66 s]
0.0.N: Trace Attempt  2	[73.66 s]
0.0.N: Trace Attempt  3	[73.66 s]
0.0.N: Trace Attempt  4	[73.67 s]
0.0.N: Trace Attempt  5	[73.67 s]
0.0.AM: Trace Attempt 535	[74.95 s]
0.0.Ht: Trace Attempt 10215	[76.09 s]
0.0.B: Trace Attempt 6928	[76.13 s]
0.0.Hp: Trace Attempt 609	[76.70 s]
0.0.N: Trace Attempt 213	[77.67 s]
0.0.N: Trace Attempt  1	[78.58 s]
0.0.N: Trace Attempt  2	[78.59 s]
0.0.N: Trace Attempt  3	[78.59 s]
0.0.N: Trace Attempt  4	[78.59 s]
0.0.N: Trace Attempt  5	[78.59 s]
0.0.AM: Trace Attempt 542	[78.97 s]
0.0.Ht: Trace Attempt 10450	[80.09 s]
0.0.B: Trace Attempt 7080	[80.16 s]
0.0.Hp: Trace Attempt 621	[81.05 s]
0.0.N: Trace Attempt 184	[82.59 s]
0.0.AM: Trace Attempt 602	[83.29 s]
0.0.AM: Trace Attempt  1	[83.53 s]
0.0.AM: Trace Attempt  2	[83.53 s]
0.0.AM: Trace Attempt  3	[83.53 s]
0.0.AM: Trace Attempt  4	[83.53 s]
0.0.Ht: Trace Attempt 10678	[84.09 s]
0.0.B: Trace Attempt 7226	[84.17 s]
0.0.N: Trace Attempt  1	[85.20 s]
0.0.N: Trace Attempt  2	[85.21 s]
0.0.N: Trace Attempt  3	[85.21 s]
0.0.Hp: Trace Attempt 636	[85.21 s]
0.0.N: Trace Attempt  4	[85.21 s]
0.0.N: Trace Attempt  5	[85.21 s]
0.0.AM: Trace Attempt 145	[87.58 s]
0.0.Ht: Trace Attempt 10921	[88.10 s]
0.0.B: Trace Attempt 7385	[88.20 s]
0.0.Hp: Trace Attempt 651	[89.34 s]
0.0.N: Trace Attempt 185	[89.39 s]
0.0.AM: Trace Attempt 205	[91.60 s]
0.0.N: Trace Attempt  1	[91.73 s]
0.0.N: Trace Attempt  2	[91.74 s]
0.0.N: Trace Attempt  3	[91.74 s]
0.0.N: Trace Attempt  4	[91.74 s]
0.0.N: Trace Attempt  5	[91.74 s]
0.0.Ht: Trace Attempt 11154	[92.10 s]
0.0.B: Trace Attempt 7540	[92.21 s]
0.0.Hp: Trace Attempt 664	[93.43 s]
0.0.AM: Trace Attempt 263	[95.73 s]
0.0.N: Trace Attempt 185	[95.96 s]
0.0.Ht: Trace Attempt 11383	[96.12 s]
0.0.B: Trace Attempt 7691	[96.22 s]
0.0.Hp: Trace Attempt 675	[98.15 s]
0.0.N: Trace Attempt  1	[98.23 s]
0.0.N: Trace Attempt  2	[98.23 s]
0.0.N: Trace Attempt  3	[98.23 s]
0.0.N: Trace Attempt  4	[98.23 s]
0.0.N: Trace Attempt  5	[98.23 s]
0.0.AM: Trace Attempt 299	[99.81 s]
0.0.Ht: Trace Attempt 11602	[100.13 s]
0.0.B: Trace Attempt 7837	[100.22 s]
0.0.Hp: Trace Attempt 689	[102.17 s]
0.0.N: Trace Attempt 185	[102.42 s]
0.0.AM: Trace Attempt 343	[103.85 s]
0.0.B: Trace Attempt 7990	[104.24 s]
0.0.N: Trace Attempt  1	[104.73 s]
0.0.N: Trace Attempt  2	[104.74 s]
0.0.N: Trace Attempt  3	[104.74 s]
0.0.N: Trace Attempt  4	[104.74 s]
0.0.N: Trace Attempt  5	[104.74 s]
0.0.Hp: Trace Attempt 698	[107.17 s]
0.0.B: Trace Attempt 8138	[108.25 s]
0.0.AM: Trace Attempt 388	[108.42 s]
0.0.N: Trace Attempt 185	[108.90 s]
0.0.N: Trace Attempt  1	[111.56 s]
0.0.N: Trace Attempt  2	[111.56 s]
0.0.N: Trace Attempt  3	[111.56 s]
0.0.N: Trace Attempt  4	[111.56 s]
0.0.N: Trace Attempt  5	[111.56 s]
0.0.Hp: Trace Attempt 715	[111.73 s]
0.0.B: Trace Attempt 8290	[112.26 s]
0.0.AM: Trace Attempt 401	[112.68 s]
0.0.N: Trace Attempt 206	[115.58 s]
0.0.Hp: Trace Attempt 720	[115.86 s]
0.0.B: Trace Attempt 8447	[116.26 s]
0.0.AM: Trace Attempt 413	[116.77 s]
0.0.N: Trace Attempt 260	[119.65 s]
0.0.Hp: Trace Attempt 737	[120.00 s]
0.0.B: Trace Attempt 8595	[120.26 s]
0.0.AM: Trace Attempt 432	[121.17 s]
0.0.Ht: Trace Attempt 11707	[122.14 s]
0.0.N: Trace Attempt 319	[123.68 s]
0.0.Hp: Trace Attempt 750	[124.09 s]
0.0.B: Trace Attempt 8729	[124.27 s]
0.0.AM: Trace Attempt 454	[125.27 s]
0.0.Ht: Trace Attempt 12113	[126.15 s]
0.0.N: Trace Attempt 359	[127.75 s]
0.0.Hp: Trace Attempt 761	[128.32 s]
0.0.B: Trace Attempt 8853	[128.30 s]
0.0.AM: Trace Attempt 478	[129.27 s]
0.0.Ht: Trace Attempt 12480	[130.15 s]
0.0.N: Trace Attempt 406	[131.84 s]
0.0.B: Trace Attempt 8968	[132.31 s]
0.0.Hp: Trace Attempt 775	[132.43 s]
0.0.AM: Trace Attempt 494	[133.31 s]
0.0.Ht: Trace Attempt 12822	[134.16 s]
0.0.N: Trace Attempt 448	[135.90 s]
0.0.B: Trace Attempt 9080	[136.34 s]
0.0.Hp: Trace Attempt 787	[136.58 s]
0.0.AM: Trace Attempt 501	[137.36 s]
0.0.Ht: Trace Attempt 13136	[138.16 s]
0.0.B: Trace Attempt 9197	[140.34 s]
0.0.N: Trace Attempt 463	[140.94 s]
0.0.N: Trace Attempt  1	[140.96 s]
0.0.N: Trace Attempt  2	[140.96 s]
0.0.N: Trace Attempt  3	[140.96 s]
0.0.N: Trace Attempt  4	[140.96 s]
0.0.N: Trace Attempt  5	[140.96 s]
0.0.Hp: Trace Attempt 793	[141.16 s]
0.0.AM: Trace Attempt 515	[141.63 s]
0.0.Ht: Trace Attempt 13410	[142.16 s]
0.0.AM: Validation of fixpoint was successful. Time = 0.01
0.0.N: Requesting engine job to terminate
0.0.B: Requesting engine job to terminate
0.0.AM: Requesting engine job to terminate
0.0.Hp: Requesting engine job to terminate
0.0.Ht: Requesting engine job to terminate
INFO (IPF144): 0: Initiating shutdown of proof [142.80 s]
0.0.AM: Trace Attempt 519	[142.49 s]
0.0.AM: A proof was found: No trace exists. [142.76 s]
INFO (IPF057): 0.0.AM: The property "Thermocouple.p1" was proven in 142.76 s.
0.0.AM: Stopped processing property "Thermocouple.p1"	[142.76 s].
0.0.AM: All properties determined. [142.76 s]
0.0.N: Trace Attempt 134	[142.77 s]
0.0.N: Stopped processing property "Thermocouple.p1"	[142.81 s].
0.0.N: All properties determined. [142.81 s]
0.0.Ht: Trace Attempt 13456	[142.75 s]
0.0.Ht: All properties determined. [142.77 s]
0.0.N: Exited with Success (@ 142.81 s)
0: ProofGrid usable level: 0
0.0.AM: Exited with Success (@ 142.81 s)
0.0.Hp: Trace Attempt 799	[142.60 s]
0.0.Hp: All properties determined. [142.91 s]
0.0.B: Trace Attempt 9267	[142.75 s]
0.0.B: Stopped processing property "Thermocouple.p1"	[142.91 s].
0.0.B: All properties determined. [142.91 s]
0.0.B: Exited with Success (@ 142.95 s)
0.0.Hp: Exited with Success (@ 142.97 s)
0.0.Ht: Exited with Success (@ 142.99 s)
0: --------------------------------------------------------------
ProofGrid Summary (utilization 99.97 %)
--------------------------------------------------------------
     engines started                               :     6
     engine jobs started                           :     6

    Average time in state (seconds)
    ------------------------------------------------------
    Engine  Pending     Running        Dead    Utilization
    ------------------------------------------------------
      N        0.03      142.80        0.00       99.98 %
     Hp        0.03      142.80        0.00       99.98 %
     Ht        0.04      142.76        0.00       99.97 %
     Oh        0.03        0.00        0.00        4.12 %
      B        0.04      142.76        0.00       99.97 %
     AM        0.03      142.76        0.00       99.98 %
    all        0.03      118.98        0.00       99.97 %

    Total time in state (seconds)
    -----------------------------------------
            Pending     Running        Dead  
    -----------------------------------------
               0.20      713.88        0.00

    Data read    : 6.32 MiB
    Data written : 3.54 kiB

0: All pending notifications were processed.
INFO (IPF059): 0: Completed proof on task: "<embedded>"

==============================================================
SUMMARY
==============================================================
           Properties Considered              : 1
                 assertions                   : 1
                  - proven                    : 1 (100%)
                  - bounded_proven (user)     : 0 (0%)
                  - bounded_proven (auto)     : 0 (0%)
                  - marked_proven             : 0 (0%)
                  - cex                       : 0 (0%)
                  - ar_cex                    : 0 (0%)
                  - undetermined              : 0 (0%)
                  - unknown                   : 0 (0%)
                  - error                     : 0 (0%)
                 covers                       : 0
                  - unreachable               : 0
                  - bounded_unreachable (user): 0
                  - covered                   : 0
                  - ar_covered                : 0
                  - undetermined              : 0
                  - unknown                   : 0
                  - error                     : 0
proven
[<embedded>] % exit -force
INFO (IPL005): Received request to exit from the console.
INFO: Waiting for proof threads to stop...
INFO: Proof threads stopped.
INFO (IPL018): The peak resident set memory use for this session was 1.979 GB.
INFO (IPL014): Waiting for the Tcl-thread to exit.
INFO (IPL015): The Tcl-thread exited with status 0.
INFO (IPL016): Exiting the analysis session with status 0.
