# ----------------------------------------
# Jasper Version Info
# tool      : Jasper 2024.06
# platform  : Linux 3.10.0-1160.62.1.el7.x86_64
# version   : 2024.06p002 64 bits
# build date: 2024.09.02 16:28:38 UTC
# ----------------------------------------
# started   : 2025-11-18 09:09:26 IST
# hostname  : vlsi-ria85.vlsidomain
# pid       : 17508
# arguments : '-label' 'session_0' '-console' '//127.0.0.1:45289' '-nowindow' '-style' 'windows' '-exitonerror' '-data' 'AAAA2nicY2RgYLCp////PwMYMD6A0Aw2jAyoAMRnQhUJbEChGRhYYZphSliAmItBl6GAoYghnyELyDNi0ANCfSA7HS6aypDMUMJQDBQtBrLLgDiPIR7MTgfSFkBdPEAzkhgSgaqSGTKAfDkcKvXAKnLAdgMAxXkaUw==' '-proj' '/users/rompel/jasper_executions/safety/jgprojects/seven_seg_8/sessionLogs/session_0' '-init' '-hidden' '/users/rompel/jasper_executions/safety/jgprojects/seven_seg_8/.tmp/.initCmds.tcl' 'seven_seg_8.tcl' '-hidden' '/users/rompel/jasper_executions/safety/jgprojects/seven_seg_8/.tmp/.postCmds.tcl'

Any disclosure about the Cadence Design Systems software or its use
model to any third party violates the written Non-Disclosure Agreement
between Cadence Design Systems, Inc. and the customer.

THIS SOFTWARE CONTAINS CONFIDENTIAL INFORMATION AND TRADE SECRETS OF
CADENCE DESIGN SYSTEMS, INC. USE, DISCLOSURE, OR REPRODUCTION IS
PROHIBITED WITHOUT THE PRIOR EXPRESS WRITTEN PERMISSION OF CADENCE
DESIGN SYSTEMS, INC.

Copyright (C) 2000-2024 Cadence Design Systems, Inc. All Rights
Reserved.  Unpublished -- rights reserved under the copyright laws of
the United States.

This product includes software developed by others and redistributed
according to license agreement. See doc/third_party_readme.txt for
further details.

RESTRICTED RIGHTS LEGEND

Use, duplication, or disclosure by the Government is subject to
restrictions as set forth in subparagraph (c) (1) (ii) of the Rights in
Technical Data and Computer Software clause at DFARS 252.227-7013 or
subparagraphs (c) (1) and (2) of Commercial Computer Software -- Restricted
Rights at 48 CFR 52.227-19, as applicable.


                          Cadence Design Systems, Inc.
                          2655 Seely Avenue
                          San Jose, CA 95134
                          Phone: 408.943.1234

For technical assistance visit http://support.cadence.com.

Jasper Apps Analysis Session - /users/rompel/jasper_executions/safety/jgprojects/seven_seg_8/sessionLogs/session_0

WARNING (WG017): [session]: The system's locale is "ANSI_X3.4-1968", which is not UTF-8. Non-ASCII characters might not be handled correctly.
WARNING (WG017): [jg_console]: The system's locale is "ANSI_X3.4-1968", which is not UTF-8. Non-ASCII characters might not be handled correctly.
INFO: successfully checked out license "jasper_fao".
INFO: reading configuration file "/users/rompel/.config/cadence/jasper.conf".
% analyze -sv09 ../seven_seg_8.sv
[-- (VERI-1482)] Analyzing Verilog file '/tools/cadence2425/JASPER/jasper_2024.06p002/lib/verilog/packages/std/std.sv' into library 'std'
[-- (VERI-1482)] Analyzing Verilog file '../seven_seg_8.sv'
% elaborate -bbox_mul 1000000 -bbox_div 1000000 -bbox_mod 1000000 -bbox_a 1000000
[INFO (HIER-8002)] ../seven_seg_8.sv(32): Disabling old hierarchical reference handler
[INFO (VERI-1018)] ../seven_seg_8.sv(1): compiling module 'SEVEN'
[WARN (VERI-1209)] ../seven_seg_8.sv(15): expression size 32 truncated to fit in target size 14
[INFO (VERI-8005)] ../seven_seg_8.sv(5): Unintentional sequential element inferred for cnt read before write using blocking assignment
[INFO (VERI-8005)] ../seven_seg_8.sv(6): Unintentional sequential element inferred for digit_select read before write using blocking assignment
[INFO (VERI-8005)] ../seven_seg_8.sv(1): Unintentional sequential element inferred for segment read before write using blocking assignment
[INFO (VERI-8005)] ../seven_seg_8.sv(1): Unintentional sequential element inferred for sig read before write using blocking assignment
INFO (ISW003): Top module name is "SEVEN".
INFO (INL208): Elaboration synthesis summary:
  Number of synthesized netlists          1 (0 packages)
  Single run mode                         On
  Pipeline                                On (1 pipelined netlists)
  Late hierarchical reference connection  On
  Number of analyzed Verilog modules      1 (1 synthesized)
  Number of analyzed VHDL entities        0 (0 synthesized)
INFO (INL003): Clearing all state information (assumes, stopats, and so forth).
SEVEN
[<embedded>] % reset rst
INFO (IPM031): Clearing proof results of all properties.
INFO (IRS006): Current reset condition is "rst".
[<embedded>] % clock clk
[<embedded>] % prove -all
Ncustom1: Custom engine code is hT3Ng7hPPfiYQOTDZ3qhYOwGAM51eA+J/FjkM5shLioAsqhgLR4Ft+O1BuKG6ilQ83B9tLXSl+CwjiTMAQA
Bcustom2: Custom engine code is hT3Nm7hPr1Vp3Di1Ra2USNIGL4JypRnLKLAdF6JAyuavO2JfGCiY9OZJhcAcOUnLx5xwNdhILGrAWX9s+z2WDkKwNR7tAfClBEjRFVQeq6DU54boFgEA
AMcustom3: Custom engine code is hT3Ng7hP/feYQOTDZ3qhYOwGAM51eA+J/FjkM5shLioAsqhgLR4Ft+O1BuKG6ilQ83B9tLXSmmqwm7g9AQA
Mpcustom4: Custom engine code is hT3NZbhP9fmY2AbBQnsjfOxn6c+6e6yL+/e8fZFmaQrnlgEA
INFO (IPF036): Starting proof on task: "<embedded>", 2 properties to prove with 0 already proven/unreachable
INFO (IRS029): Starting reset analysis: phase 1 of 4.
INFO (IRS030): Running reset analysis: phase 2 of 4.
INFO (IRS031): Running reset analysis: phase 3 of 4.
INFO (IRS020): Starting the reset analysis simulation with a limit of 100 iterations (phase 4 of 4).
INFO (IRS024): Reset iterations 0 to 4 analyzed.
INFO (IRS018): Reset analysis simulation executed for 3 iterations. Assigned values for 23 of 23 design flops, 0 of 0 design latches, 6 of 6 internal elements.
INFO (IRS039): Reset analysis complete.
INFO (IPF031): Settings used for proof thread 0:
    orchestration                 = on
    time_limit                    = 86400s
    per_property_time_limit       = 1s * 10 ^ scan
    engine_mode                   = auto
    proofgrid_per_engine_max_jobs = 1
    max engine jobs               = auto
    proofgrid_mode                = local
    proofgrid_restarts            = 10
AMcustom5: Custom engine code is hT3N1rhP11/52HrFRS21ROp2LOjVTgPvT8L8BGXHgLhaIuqtT4nARFjUqrBL+7pLmaTOzBepZW/Jm8SSrHDybSQtoNiO3y43wk+dEoWlsZizu97Fih6O6lPVG/LpWP5SsUPwlGagLNa1FKEFvwVXyX7//8prySbvSxIHXr5er+z4RAEA
0: Using multistage preprocessing
Ncustom6: Custom engine code is hT3OXrhPByJp3TrFSTLhUmMH4KVtJgmTCnNDF46yMXOKY48m4LS5nE7yBzFjA7kDuwO/GhGUpEPiky3p3wmPn3dJZHxFMsafSoObRzSC+tn7sEY0WbTdZ/FV4hL3MYH/b1CIUvXSWR4wqEoVLsmMOD4xIPT4lI1LO6ZCO7PnnWQuLwetnvKlrXx6wCW/A+x+enqslg1YPobi4wEF/EvbzOvcTYdJvl2s4H2yZg2b2ofAVN5WvhWk1HoBAA
0: Starting reduce
ADcustom7: Custom engine code is hT3Nv7hPv1752HrFRa2kROx2f/ECJeZB2AZsLdlO8VwmIuqtT4nIDFXclhg+O+o+DMmQCekbheGk0kK28laA9gaOFDXsQp29J3X615HY1IPHJWd6FUFvCHjO+p1k652b5JJvZlShNpGlGSXAiQe/mEAj6tEBAA
Tricustom8: Custom engine code is hT3Nu7hPt1752DvFRa0kNDiyIV97VyejwM9C/jCLJjdPvusZONHY42VYUy0Q1ZotnhcVtNc56tJ5wbxv6V2+XpdsaSlHck5vfnbYjdwj1OECy9U+7oSQ0SZE3g5ayD+Phuh4odCJTjeKa2k4elM9ldQfkAEA
Gcustom9: Custom engine code is hT3NibhPDfeYQADBZnYcglOvK9Pfd7EOeniIqP8jNsyIqInncipMGcUXqAadachREE9F2PwhBUZUNw5kHnd4JdXkamORRgEA
C2custom10: Custom engine code is hT3NirhPjfWYQADBZnYcglOvK9Pfd7EOeniIqP8jNsyIqInncgkrYMMXCYbdK0dUjZIF9d4cJ0rHoBDjwVLBKuG86XYVV00BAA
AGcustom11: Custom engine code is hT3NirhP/fmYQADBZnYcglOvK9Pfd7EOeniIqP8jNsyIqInnckcwYMMXCYbdK0dUjZIF9d4cJ0rHoBDjwVLBKuHEZnZByh0BAA
Bcustom12: Custom engine code is hT3NjrhPDfiYQADBZnYcglOvK9PfWxFtenjIyBqfrgr7if/jL/yPOuK1BAflEcW0DxNH2eDIoezN2gxlQFg81RZtiWXh7aiTAidvAQA
Ncustom13: Custom engine code is hT3NR7hPByFp3TrFSTLhUmMH4KWtJglTyV/c51BHEeZWamnJv767nE6PCak26bd3gf3XGN3rIRheufhDieCJQVISo+gNYUKhiUedBKGtsP/a18svAnlMJZudHxDFwK5ufsyoxsIyiAeSY2oi3tEuoDHr5gw42DFKAG3PqO3CEsl8Azzdt3pl5nGA1Ifv2H02eYsFzWb/nfp8PMb3F0krE/EgBcm8TD9Div8BAA
0: Finished reduce in 0s
Tricustom14: Custom engine code is hT3Nu7hP3fiYQADBZnYcglNHp9bfd7EOeniIqP/ji8sGLQu8yhsFO+wxJ+O+R0bU8g/IewXFomyos+viQnWc2xYNYmMqpo3i40O7DaZR7qfp4YqNx26KRvQ/qx0BAA
0.0.PRE: Performing Proof Simplification...
0.0.N: clocks: 1, declared: 1, looping: 0, posedge: 1, negedge: 0, noedge: 0, bothedge: 0
0.0.N: Proof Simplification Iteration 1	[0.00 s]
0.0.PRE: A trace with 1 cycles was found. [0.00 s]
INFO (IPF047): 0.0.PRE: The cover property "SEVEN.p1:precondition1" was covered in 1 cycles in 0.00 s.
0.0.N: Proof Simplification Iteration 2	[0.06 s]
0.0.PRE: A proof was found: No trace exists. [0.00 s]
INFO (IPF057): 0.0.PRE: The property ":noDeadEnd" was proven in 0.00 s.
    Use check_assumptions -show -dead_end to show this property in the property table.
0.0.PRE: A proof was found: No trace exists. [0.00 s]
INFO (IPF057): 0.0.PRE: The property ":noConflict" was proven in 0.00 s.
    Use check_assumptions -show to show this property in the property table.
INFO (IPF047): 0.0.PRE: The cover property ":live" was covered in 1 cycles in 0.00 s.
    Use check_assumptions -show -live to show this property in the property table.
0.0.PRE: Proof Simplification completed in 0.06 s
0: About to start ProofGrid in its own thread with a limit of 10000 pending notifications and a limit of 10 traces.
0: =============================== ProofGrid start ===============================
0: ProofGrid usable level: 1
0: Initial ProofGrid level: 1
0: ProofGrid is starting event handling
0.0.Hp: Proofgrid shell started at 17690@vlsi-ria85(local) jg_17508_vlsi-ria85_1
0.0.N: Proofgrid shell started at 17689@vlsi-ria85(local) jg_17508_vlsi-ria85_1
0.0.Hp: clocks: 1, declared: 1, looping: 0, posedge: 1, negedge: 0, noedge: 0, bothedge: 0
0.0.Hp: Last scan. Per property time limit: 0s
0.0.N: clocks: 1, declared: 1, looping: 0, posedge: 1, negedge: 0, noedge: 0, bothedge: 0
0.0.N: Last scan. Per property time limit: 0s
0.0.N: Starting proof for property "SEVEN.p1"	[0.00 s].
0.0.N: Trace Attempt  1	[0.00 s]
0.0.N: Trace Attempt  2	[0.00 s]
0.0.N: Trace Attempt  2	[0.00 s]
0.0.N: Trace Attempt  3	[0.00 s]
0.0.N: Trace Attempt  3	[0.00 s]
0.0.N: Trace Attempt  4	[0.00 s]
0.0.N: Trace Attempt  5	[0.00 s]
0.0.Hp: Trace Attempt  1	[0.00 s]
0.0.Hp: Trace Attempt  2	[0.00 s]
0.0.Hp: Trace Attempt  3	[0.00 s]
0.0.Hp: Trace Attempt  4	[0.00 s]
0.0.Hp: Trace Attempt  5	[0.00 s]
0.0.N: Trace Attempt  1	[0.01 s]
0.0.N: Trace Attempt  2	[0.01 s]
0.0.N: Trace Attempt  3	[0.01 s]
0.0.N: Trace Attempt  4	[0.01 s]
0.0.N: Trace Attempt  5	[0.01 s]
0.0.Ht: Proofgrid shell started at 17761@vlsi-ria85(local) jg_17508_vlsi-ria85_1
0.0.Oh: Proofgrid shell started at 17764@vlsi-ria85(local) jg_17508_vlsi-ria85_1
0.0.Ht: clocks: 1, declared: 1, looping: 0, posedge: 1, negedge: 0, noedge: 0, bothedge: 0
0.0.Ht: Last scan. Per property time limit: 0s
0.0.Ht: Trace Attempt  1	[0.00 s]
0.0.Ht: Trace Attempt  2	[0.00 s]
0.0.Ht: Trace Attempt  3	[0.00 s]
0.0.Ht: Trace Attempt  4	[0.00 s]
0.0.Ht: Trace Attempt  5	[0.00 s]
0.0.L: Proofgrid shell started at 17782@vlsi-ria85(local) jg_17508_vlsi-ria85_1
0.0.L: clocks: 1, declared: 1, looping: 0, posedge: 1, negedge: 0, noedge: 0, bothedge: 0
0.0.L: Using trace diversification with seed 1 (0.05)
0.0.L: Using LRU state removal heuristic
0.0.L: Ignoring liveness properties
0.0.L: All properties either determined or skipped. [0.00 s]
0.0.Mpcustom4: Proofgrid shell started at 17763@vlsi-ria85(local) jg_17508_vlsi-ria85_1
0.0.Oh: clocks: 1, declared: 1, looping: 0, posedge: 1, negedge: 0, noedge: 0, bothedge: 0
0.0.Oh: Reached length limit (2147483647) [0.00 s]
0.0.L: Exited with Success (@ 0.05 s)
0.0.L: Completed, Restart ignored.
0.0.B: Proofgrid shell started at 17789@vlsi-ria85(local) jg_17508_vlsi-ria85_1
0.0.Oh: Exited with Success (@ 0.06 s)
0.0.Mpcustom4: clocks: 1, declared: 1, looping: 0, posedge: 1, negedge: 0, noedge: 0, bothedge: 0
0.0.Mpcustom4: Ignoring liveness properties
0.0.Mpcustom4: All properties either determined or skipped. [0.01 s]
0.0.B: clocks: 1, declared: 1, looping: 0, posedge: 1, negedge: 0, noedge: 0, bothedge: 0
0.0.B: Last scan. Per property time limit: 0s
0.0.B: Starting proof for property "SEVEN.p1"	[0.00 s].
0.0.B: Trace Attempt  1	[0.00 s]
0.0.B: Trace Attempt  2	[0.00 s]
0.0.B: Trace Attempt  3	[0.00 s]
0.0.B: Trace Attempt  4	[0.00 s]
0.0.Bm: Proofgrid shell started at 17762@vlsi-ria85(local) jg_17508_vlsi-ria85_1
0.0.B: Trace Attempt  5	[0.00 s]
0.0.Mpcustom4: Exited with Success (@ 0.06 s)
0.0.Mpcustom4: Completed, Restart ignored.
0.0.AM: Proofgrid shell started at 17801@vlsi-ria85(local) jg_17508_vlsi-ria85_1
0.0.Bm: clocks: 1, declared: 1, looping: 0, posedge: 1, negedge: 0, noedge: 0, bothedge: 0
0.0.Bm: Ignoring liveness properties
0.0.Bm: Last scan. Per property time limit: 0s
0.0.Bm: Trace Attempt  1	[0.00 s]
0.0.Bm: Trace Attempt  2	[0.00 s]
0.0.Bm: Trace Attempt  3	[0.00 s]
0.0.Bm: Trace Attempt  4	[0.00 s]
0.0.Bm: Trace Attempt  5	[0.00 s]
0.0.AM: clocks: 1, declared: 1, looping: 0, posedge: 1, negedge: 0, noedge: 0, bothedge: 0
0.0.AM: Last scan. Per property time limit: 0s
0.0.AM: Starting proof for property "SEVEN.p1"	[0.00 s].
0.0.AM: Trace Attempt  1	[0.00 s]
0.0.AM: Trace Attempt  2	[0.00 s]
0.0.AM: Trace Attempt  3	[0.00 s]
0.0.AM: Trace Attempt  4	[0.00 s]
0.0.AM: Trace Attempt  5	[0.00 s]
0.0.AM: Trace Attempt  1	[0.00 s]
0.0.AM: Trace Attempt  2	[0.00 s]
0.0.AM: Trace Attempt  3	[0.00 s]
0.0.AM: Trace Attempt  4	[0.00 s]
0.0.AM: Trace Attempt  5	[0.00 s]
0.0.AM: Trace Attempt  1	[0.01 s]
0.0.AM: Trace Attempt  2	[0.01 s]
0.0.AM: Trace Attempt  3	[0.01 s]
0.0.AM: Trace Attempt  4	[0.01 s]
0.0.AM: Trace Attempt  5	[0.01 s]
0.0.AM: Trace Attempt  1	[0.03 s]
0.0.AM: Trace Attempt  2	[0.03 s]
0.0.AM: Trace Attempt  3	[0.03 s]
0.0.AM: Trace Attempt  4	[0.03 s]
0.0.AM: Trace Attempt  5	[0.03 s]
0.0.N: Trace Attempt  1	[0.12 s]
0.0.N: Trace Attempt  2	[0.12 s]
0.0.N: Trace Attempt  3	[0.12 s]
0.0.N: Trace Attempt  4	[0.12 s]
0.0.N: Trace Attempt  5	[0.13 s]
0.0.AM: Trace Attempt  1	[0.10 s]
0.0.AM: Trace Attempt  2	[0.10 s]
0.0.AM: Trace Attempt  3	[0.10 s]
0.0.AM: Trace Attempt  4	[0.10 s]
0.0.AM: Trace Attempt  5	[0.10 s]
0.0.N: Trace Attempt  1	[0.45 s]
0.0.N: Trace Attempt  2	[0.45 s]
0.0.N: Trace Attempt  3	[0.45 s]
0.0.N: Trace Attempt  4	[0.46 s]
0.0.N: Trace Attempt  5	[0.46 s]
0.0.AM: Trace Attempt  1	[0.42 s]
0.0.AM: Trace Attempt  2	[0.43 s]
0.0.AM: Trace Attempt  3	[0.43 s]
0.0.AM: Trace Attempt  4	[0.43 s]
0.0.AM: Trace Attempt  5	[0.43 s]
0.0.AM: Trace Attempt  1	[1.71 s]
0.0.AM: Trace Attempt  2	[1.71 s]
0.0.AM: Trace Attempt  3	[1.71 s]
0.0.AM: Trace Attempt  4	[1.71 s]
0.0.AM: Trace Attempt  5	[1.71 s]
0.0.N: Trace Attempt  1	[1.81 s]
0.0.N: Trace Attempt  2	[1.81 s]
0.0.N: Trace Attempt  3	[1.81 s]
0.0.N: Trace Attempt  4	[1.81 s]
0.0.N: Trace Attempt  5	[1.81 s]
0.0.N: Trace Attempt  1	[3.25 s]
0.0.N: Trace Attempt  2	[3.25 s]
0.0.N: Trace Attempt  3	[3.25 s]
0.0.N: Trace Attempt  4	[3.25 s]
0.0.N: Trace Attempt  5	[3.26 s]
0.0.Hp: Trace Attempt 485	[4.01 s]
0.0.Ht: Trace Attempt 1765	[4.00 s]
0.0.Bm: Trace Attempt 1695	[4.00 s]
0.0.B: Trace Attempt 1684	[4.00 s]
0.0.AM: Trace Attempt 226	[5.72 s]
0.0.AM: Trace Attempt  1	[6.40 s]
0.0.AM: Trace Attempt  2	[6.40 s]
0.0.AM: Trace Attempt  3	[6.40 s]
0.0.AM: Trace Attempt  4	[6.40 s]
0.0.AM: Trace Attempt  5	[6.40 s]
0.0.N: Trace Attempt 232	[7.49 s]
0.0.N: Trace Attempt  1	[7.49 s]
0.0.N: Trace Attempt  2	[7.49 s]
0.0.N: Trace Attempt  3	[7.49 s]
0.0.N: Trace Attempt  4	[7.50 s]
0.0.N: Trace Attempt  5	[7.50 s]
0.0.Hp: Trace Attempt 672	[8.02 s]
0.0.Ht: Trace Attempt 2397	[8.00 s]
0.0.B: Trace Attempt 2318	[8.01 s]
0.0.Bm: Trace Attempt 2325	[8.00 s]
0.0.AM: Trace Attempt 189	[10.42 s]
0.0.N: Trace Attempt 232	[11.50 s]
0.0.N: Trace Attempt  1	[11.94 s]
0.0.N: Trace Attempt  2	[11.94 s]
0.0.N: Trace Attempt  3	[11.94 s]
0.0.N: Trace Attempt  4	[11.94 s]
0.0.N: Trace Attempt  5	[11.94 s]
0.0.Hp: Trace Attempt 820	[12.04 s]
0.0.Ht: Trace Attempt 2896	[12.00 s]
0.0.B: Trace Attempt 2816	[12.01 s]
0.0.Bm: Trace Attempt 2822	[12.01 s]
0.0.AM: Trace Attempt 245	[14.56 s]
0.0.N: Trace Attempt 229	[15.94 s]
0.0.Hp: Trace Attempt 943	[16.04 s]
0.0.Ht: Trace Attempt 3315	[16.01 s]
0.0.B: Trace Attempt 3229	[16.01 s]
0.0.Bm: Trace Attempt 3234	[16.01 s]
0.0.N: Trace Attempt  1	[16.54 s]
0.0.N: Trace Attempt  2	[16.54 s]
0.0.N: Trace Attempt  3	[16.54 s]
0.0.N: Trace Attempt  4	[16.55 s]
0.0.N: Trace Attempt  5	[16.55 s]
0.0.AM: Trace Attempt 289	[18.64 s]
0.0.Ht: Trace Attempt 3692	[20.01 s]
0.0.Hp: Trace Attempt 1051	[20.07 s]
0.0.B: Trace Attempt 3599	[20.01 s]
0.0.Bm: Trace Attempt 3603	[20.02 s]
0.0.N: Trace Attempt 231	[20.57 s]
0.0.N: Trace Attempt  1	[20.93 s]
0.0.N: Trace Attempt  2	[20.93 s]
0.0.N: Trace Attempt  3	[20.93 s]
0.0.N: Trace Attempt  4	[20.93 s]
0.0.N: Trace Attempt  5	[20.93 s]
0.0.AM: Trace Attempt 334	[22.64 s]
0.0.Ht: Trace Attempt 4029	[24.02 s]
0.0.B: Trace Attempt 3919	[24.02 s]
0.0.Bm: Trace Attempt 3925	[24.02 s]
0.0.Hp: Trace Attempt 1149	[24.10 s]
0.0.N: Trace Attempt 231	[24.95 s]
0.0.N: Trace Attempt  1	[25.57 s]
0.0.N: Trace Attempt  2	[25.57 s]
0.0.N: Trace Attempt  3	[25.57 s]
0.0.N: Trace Attempt  4	[25.57 s]
0.0.N: Trace Attempt  5	[25.57 s]
0.0.AM: Trace Attempt 370	[26.70 s]
0.0.Ht: Trace Attempt 4326	[28.03 s]
0.0.B: Trace Attempt 4218	[28.03 s]
0.0.Bm: Trace Attempt 4226	[28.03 s]
0.0.Hp: Trace Attempt 1238	[28.14 s]
0.0.N: Trace Attempt 236	[29.64 s]
0.0.N: Trace Attempt  1	[30.01 s]
0.0.N: Trace Attempt  2	[30.01 s]
0.0.N: Trace Attempt  3	[30.01 s]
0.0.N: Trace Attempt  4	[30.01 s]
0.0.N: Trace Attempt  5	[30.01 s]
0.0.AM: Trace Attempt 411	[30.80 s]
0.0.Ht: Trace Attempt 4627	[32.04 s]
0.0.B: Trace Attempt 4506	[32.03 s]
0.0.Bm: Trace Attempt 4514	[32.04 s]
0.0.Hp: Trace Attempt 1320	[32.16 s]
0.0.N: Trace Attempt 231	[34.02 s]
0.0.N: Trace Attempt  1	[34.57 s]
0.0.N: Trace Attempt  2	[34.57 s]
0.0.N: Trace Attempt  3	[34.57 s]
0.0.N: Trace Attempt  4	[34.58 s]
0.0.N: Trace Attempt  5	[34.58 s]
0.0.AM: Trace Attempt 449	[34.82 s]
0.0.Ht: Trace Attempt 4873	[36.05 s]
0.0.B: Trace Attempt 4752	[36.04 s]
0.0.Bm: Trace Attempt 4761	[36.04 s]
0.0.Hp: Trace Attempt 1393	[36.19 s]
0.0.N: Trace Attempt 227	[38.60 s]
0.0.AM: Trace Attempt 402	[38.83 s]
0.0.N: Trace Attempt  1	[39.13 s]
0.0.N: Trace Attempt  2	[39.13 s]
0.0.N: Trace Attempt  3	[39.13 s]
0.0.N: Trace Attempt  4	[39.13 s]
0.0.N: Trace Attempt  5	[39.13 s]
0.0.Ht: Trace Attempt 5127	[40.05 s]
0.0.B: Trace Attempt 4978	[40.04 s]
0.0.Bm: Trace Attempt 4992	[40.04 s]
0.0.Hp: Trace Attempt 1462	[40.20 s]
0.0.N: Trace Attempt 228	[43.14 s]
0.0.N: Trace Attempt  1	[43.75 s]
0.0.N: Trace Attempt  2	[43.75 s]
0.0.N: Trace Attempt  3	[43.75 s]
0.0.N: Trace Attempt  4	[43.75 s]
0.0.N: Trace Attempt  5	[43.75 s]
0.0.Ht: Trace Attempt 5334	[44.07 s]
0.0.B: Trace Attempt 5187	[44.05 s]
0.0.Bm: Trace Attempt 5204	[44.05 s]
0.0.Hp: Trace Attempt 1526	[44.21 s]
0.0.AM: Trace Attempt 512	[44.69 s]
0.0.AM: Trace Attempt  1	[45.59 s]
0.0.AM: Trace Attempt  2	[45.59 s]
0.0.AM: Trace Attempt  3	[45.59 s]
0.0.AM: Trace Attempt  4	[45.59 s]
0.0.AM: Trace Attempt  5	[45.59 s]
0.0.N: Trace Attempt 231	[47.77 s]
0.0.B: Trace Attempt 5406	[48.06 s]
0.0.Ht: Trace Attempt 5576	[48.08 s]
0.0.Bm: Trace Attempt 5424	[48.05 s]
0.0.N: Trace Attempt  1	[48.18 s]
0.0.N: Trace Attempt  2	[48.18 s]
0.0.N: Trace Attempt  3	[48.18 s]
0.0.N: Trace Attempt  4	[48.18 s]
0.0.N: Trace Attempt  5	[48.18 s]
0.0.Hp: Trace Attempt 1591	[48.24 s]
0.0.AM: Trace Attempt 168	[49.61 s]
0.0.Ht: Trace Attempt 5792	[52.09 s]
0.0.Bm: Trace Attempt 5651	[52.06 s]
0.0.B: Trace Attempt 5633	[52.06 s]
0.0.N: Trace Attempt 241	[52.25 s]
0.0.Hp: Trace Attempt 1656	[52.26 s]
0.0.N: Trace Attempt  1	[52.57 s]
0.0.N: Trace Attempt  2	[52.57 s]
0.0.N: Trace Attempt  3	[52.57 s]
0.0.N: Trace Attempt  4	[52.57 s]
0.0.N: Trace Attempt  5	[52.57 s]
0.0.AM: Trace Attempt 243	[53.69 s]
0.0.Ht: Trace Attempt 6014	[56.09 s]
0.0.B: Trace Attempt 5844	[56.07 s]
0.0.Bm: Trace Attempt 5862	[56.08 s]
0.0.Hp: Trace Attempt 1718	[56.31 s]
0.0.N: Trace Attempt 229	[56.60 s]
0.0.N: Trace Attempt  1	[56.99 s]
0.0.N: Trace Attempt  2	[56.99 s]
0.0.N: Trace Attempt  3	[56.99 s]
0.0.N: Trace Attempt  4	[57.00 s]
0.0.N: Trace Attempt  5	[57.00 s]
0.0.AM: Trace Attempt 280	[57.74 s]
0.0.Ht: Trace Attempt 6224	[60.09 s]
0.0.B: Trace Attempt 6047	[60.09 s]
0.0.Bm: Trace Attempt 6066	[60.08 s]
0.0.Hp: Trace Attempt 1778	[60.34 s]
0.0.N: Trace Attempt 243	[61.04 s]
0.0.N: Trace Attempt  1	[61.50 s]
0.0.N: Trace Attempt  2	[61.50 s]
0.0.N: Trace Attempt  3	[61.50 s]
0.0.N: Trace Attempt  4	[61.50 s]
0.0.N: Trace Attempt  5	[61.50 s]
0.0.AM: Trace Attempt 323	[61.81 s]
0.0.Ht: Trace Attempt 6417	[64.11 s]
0.0.Bm: Trace Attempt 6260	[64.09 s]
0.0.B: Trace Attempt 6239	[64.11 s]
0.0.Hp: Trace Attempt 1836	[64.38 s]
0.0.N: Trace Attempt 244	[65.57 s]
0.0.AM: Trace Attempt 347	[65.83 s]
0.0.N: Trace Attempt  1	[65.94 s]
0.0.N: Trace Attempt  2	[65.94 s]
0.0.N: Trace Attempt  3	[65.94 s]
0.0.N: Trace Attempt  4	[65.94 s]
0.0.N: Trace Attempt  5	[65.94 s]
0.0.Ht: Trace Attempt 6623	[68.12 s]
0.0.Bm: Trace Attempt 6447	[68.11 s]
0.0.B: Trace Attempt 6423	[68.12 s]
0.0.Hp: Trace Attempt 1892	[68.39 s]
0.0.AM: Trace Attempt 381	[69.85 s]
0.0.N: Trace Attempt 231	[69.95 s]
0.0.N: Trace Attempt  1	[70.46 s]
0.0.N: Trace Attempt  2	[70.46 s]
0.0.N: Trace Attempt  3	[70.46 s]
0.0.N: Trace Attempt  4	[70.46 s]
0.0.N: Trace Attempt  5	[70.46 s]
0.0.Ht: Trace Attempt 6799	[72.12 s]
0.0.Bm: Trace Attempt 6627	[72.11 s]
0.0.B: Trace Attempt 6599	[72.12 s]
0.0.Hp: Trace Attempt 1946	[72.42 s]
0.0.AM: Trace Attempt 419	[73.93 s]
0.0.N: Trace Attempt 246	[74.54 s]
0.0.N: Trace Attempt  1	[75.42 s]
0.0.N: Trace Attempt  2	[75.42 s]
0.0.N: Trace Attempt  3	[75.43 s]
0.0.N: Trace Attempt  4	[75.43 s]
0.0.N: Trace Attempt  5	[75.43 s]
0.0.Ht: Trace Attempt 6975	[76.13 s]
0.0.Bm: Trace Attempt 6797	[76.12 s]
0.0.B: Trace Attempt 6767	[76.15 s]
0.0.Hp: Trace Attempt 1998	[76.47 s]
0.0.AM: Trace Attempt 453	[78.00 s]
0.0.N: Trace Attempt 246	[79.45 s]
0.0.Ht: Trace Attempt 7160	[80.15 s]
0.0.Bm: Trace Attempt 6962	[80.14 s]
0.0.B: Trace Attempt 6930	[80.15 s]
0.0.Hp: Trace Attempt 2049	[80.53 s]
0.0.AM: Trace Attempt 471	[82.10 s]
0.0.N: Trace Attempt 347	[83.45 s]
0.0.Ht: Trace Attempt 7316	[84.17 s]
0.0.Bm: Trace Attempt 7132	[84.14 s]
0.0.B: Trace Attempt 7094	[84.17 s]
0.0.Hp: Trace Attempt 2098	[84.55 s]
0.0.AM: Trace Attempt 478	[86.36 s]
0.0.N: Trace Attempt 441	[87.46 s]
0.0.Ht: Trace Attempt 7480	[88.17 s]
0.0.Bm: Trace Attempt 7295	[88.15 s]
0.0.B: Trace Attempt 7254	[88.18 s]
0.0.Hp: Trace Attempt 2147	[88.63 s]
0.0.AM: Trace Attempt 485	[90.51 s]
0.0.N: Trace Attempt  1	[91.30 s]
0.0.N: Trace Attempt  2	[91.30 s]
0.0.N: Trace Attempt  3	[91.30 s]
0.0.N: Trace Attempt  4	[91.31 s]
0.0.N: Trace Attempt  5	[91.31 s]
0.0.Bm: Trace Attempt 7446	[92.16 s]
0.0.Ht: Trace Attempt 7646	[92.19 s]
0.0.B: Trace Attempt 7404	[92.19 s]
0.0.Hp: Trace Attempt 2193	[92.67 s]
0.0.AM: Trace Attempt 498	[94.70 s]
0.0.N: Trace Attempt 246	[95.35 s]
0.0.Bm: Trace Attempt 7598	[96.16 s]
0.0.Ht: Trace Attempt 7799	[96.21 s]
0.0.B: Trace Attempt 7555	[96.20 s]
0.0.Hp: Trace Attempt 2239	[96.68 s]
0.0.AM: Trace Attempt 510	[98.82 s]
0.0.N: Trace Attempt 348	[99.37 s]
0.0.Ht: Trace Attempt 7947	[100.21 s]
0.0.Bm: Trace Attempt 7748	[100.19 s]
0.0.B: Trace Attempt 7704	[100.22 s]
0.0.Hp: Trace Attempt 2285	[100.75 s]
0.0.AM: Trace Attempt 528	[103.20 s]
0.0.N: Trace Attempt 441	[103.39 s]
0.0.Bm: Trace Attempt 7891	[104.19 s]
0.0.Ht: Trace Attempt 8107	[104.22 s]
0.0.B: Trace Attempt 7844	[104.22 s]
0.0.Hp: Trace Attempt 2329	[104.77 s]
0.0.AM: Trace Attempt 541	[107.41 s]
0.0.N: Trace Attempt 458	[107.52 s]
0.0.N: Trace Attempt  1	[107.53 s]
0.0.N: Trace Attempt  2	[107.53 s]
0.0.N: Trace Attempt  3	[107.53 s]
0.0.N: Trace Attempt  4	[107.54 s]
0.0.N: Trace Attempt  5	[107.54 s]
0.0.Bm: Trace Attempt 8026	[108.19 s]
0.0.Ht: Trace Attempt 8249	[108.23 s]
0.0.B: Trace Attempt 7977	[108.23 s]
0.0.Hp: Trace Attempt 2372	[108.85 s]
0.0.N: Trace Attempt 247	[111.56 s]
0.0.AM: Trace Attempt 555	[111.62 s]
0.0.Bm: Trace Attempt 8167	[112.21 s]
0.0.Ht: Trace Attempt 8389	[112.24 s]
0.0.B: Trace Attempt 8115	[112.24 s]
0.0.Hp: Trace Attempt 2415	[112.86 s]
0.0.N: Trace Attempt 349	[115.62 s]
0.0.AM: Trace Attempt 569	[115.84 s]
0.0.Ht: Trace Attempt 8541	[116.24 s]
0.0.Bm: Trace Attempt 8309	[116.23 s]
0.0.B: Trace Attempt 8253	[116.25 s]
0.0.Hp: Trace Attempt 2458	[116.94 s]
0.0.N: Trace Attempt 444	[119.69 s]
0.0.AM: Trace Attempt 578	[119.84 s]
0.0.Ht: Trace Attempt 8697	[120.26 s]
0.0.Bm: Trace Attempt 8448	[120.24 s]
0.0.B: Trace Attempt 8394	[120.25 s]
0.0.Hp: Trace Attempt 2500	[120.99 s]
0.0.N: Trace Attempt  1	[123.29 s]
0.0.N: Trace Attempt  2	[123.29 s]
0.0.N: Trace Attempt  3	[123.29 s]
0.0.N: Trace Attempt  4	[123.29 s]
0.0.N: Trace Attempt  5	[123.29 s]
0.0.AM: Trace Attempt 588	[123.89 s]
0.0.Ht: Trace Attempt 8825	[124.27 s]
0.0.Bm: Trace Attempt 8577	[124.25 s]
0.0.B: Trace Attempt 8526	[124.26 s]
0.0.Hp: Trace Attempt 2540	[125.01 s]
0.0.N: Trace Attempt 247	[127.31 s]
0.0.AM: Trace Attempt 599	[128.01 s]
0.0.Ht: Trace Attempt 8955	[128.27 s]
0.0.B: Trace Attempt 8660	[128.26 s]
0.0.Bm: Trace Attempt 8711	[128.28 s]
0.0.Hp: Trace Attempt 2580	[129.04 s]
0.0.N: Trace Attempt 349	[131.36 s]
0.0.Ht: Trace Attempt 9102	[132.28 s]
0.0.B: Trace Attempt 8790	[132.27 s]
0.0.Bm: Trace Attempt 8842	[132.29 s]
0.0.AM: Trace Attempt 610	[132.33 s]
0.0.Hp: Trace Attempt 2620	[133.07 s]
0.0.N: Trace Attempt 443	[135.37 s]
0.0.B: Trace Attempt 8916	[136.28 s]
0.0.Ht: Trace Attempt 9237	[136.31 s]
0.0.Bm: Trace Attempt 8969	[136.29 s]
0.0.AM: Trace Attempt 621	[136.60 s]
0.0.Hp: Trace Attempt 2659	[137.11 s]
0.0.N: Trace Attempt 460	[139.41 s]
0.0.N: Trace Attempt  1	[139.43 s]
0.0.N: Trace Attempt  2	[139.44 s]
0.0.N: Trace Attempt  3	[139.44 s]
0.0.N: Trace Attempt  4	[139.44 s]
0.0.N: Trace Attempt  5	[139.44 s]
0.0.B: Trace Attempt 9036	[140.30 s]
0.0.Bm: Trace Attempt 9089	[140.30 s]
0.0.Ht: Trace Attempt 9356	[140.34 s]
0.0.Hp: Trace Attempt 2697	[141.22 s]
0.0.AM: Trace Attempt 632	[141.58 s]
0.0.N: Trace Attempt 248	[143.47 s]
0.0.Bm: Trace Attempt 9217	[144.31 s]
0.0.B: Trace Attempt 9162	[144.31 s]
0.0.Ht: Trace Attempt 9483	[144.36 s]
0.0.Hp: Trace Attempt 2735	[145.22 s]
0.0.AM: Trace Attempt 641	[145.92 s]
0.0.N: Trace Attempt 349	[147.49 s]
0.0.Bm: Trace Attempt 9340	[148.32 s]
0.0.B: Trace Attempt 9286	[148.34 s]
0.0.Ht: Trace Attempt 9621	[148.38 s]
0.0.Hp: Trace Attempt 2773	[149.29 s]
0.0.AM: Trace Attempt 650	[150.05 s]
0.0.N: Trace Attempt 444	[151.55 s]
0.0.Bm: Trace Attempt 9460	[152.33 s]
0.0.B: Trace Attempt 9406	[152.35 s]
0.0.Ht: Trace Attempt 9747	[152.39 s]
0.0.Hp: Trace Attempt 2810	[153.38 s]
0.0.AM: Trace Attempt 659	[154.21 s]
0.0.N: Trace Attempt  1	[155.28 s]
0.0.N: Trace Attempt  2	[155.28 s]
0.0.N: Trace Attempt  3	[155.28 s]
0.0.N: Trace Attempt  4	[155.28 s]
0.0.N: Trace Attempt  5	[155.29 s]
0.0.Bm: Trace Attempt 9574	[156.34 s]
0.0.B: Trace Attempt 9519	[156.37 s]
0.0.Ht: Trace Attempt 9861	[156.42 s]
0.0.Hp: Trace Attempt 2846	[157.39 s]
0.0.AM: Trace Attempt 668	[158.53 s]
0.0.N: Trace Attempt 248	[159.31 s]
0.0.B: Trace Attempt 9638	[160.37 s]
0.0.Bm: Trace Attempt 9694	[160.37 s]
0.0.Ht: Trace Attempt 9976	[160.42 s]
0.0.Hp: Trace Attempt 2883	[161.44 s]
0.0.AM: Trace Attempt 676	[162.72 s]
0.0.N: Trace Attempt 349	[163.36 s]
0.0.B: Trace Attempt 9753	[164.40 s]
0.0.Bm: Trace Attempt 9809	[164.40 s]
0.0.Ht: Trace Attempt 10091	[164.44 s]
0.0.Hp: Trace Attempt 2919	[165.50 s]
0.0.N: Trace Attempt 443	[167.36 s]
0.0.AM: Trace Attempt 685	[167.35 s]
0.0.Bm: Trace Attempt 9923	[168.41 s]
0.0.B: Trace Attempt 9866	[168.41 s]
0.0.Ht: Trace Attempt 10203	[168.47 s]
0.0.Hp: Trace Attempt 2955	[169.61 s]
0.0.N: Trace Attempt  1	[171.01 s]
0.0.N: Trace Attempt  2	[171.01 s]
0.0.N: Trace Attempt  3	[171.01 s]
0.0.N: Trace Attempt  4	[171.01 s]
0.0.N: Trace Attempt  5	[171.02 s]
0.0.AM: Trace Attempt 693	[171.67 s]
0.0.Bm: Trace Attempt 10032	[172.44 s]
0.0.B: Trace Attempt 9976	[172.44 s]
0.0.Ht: Trace Attempt 10326	[172.49 s]
0.0.Hp: Trace Attempt 2990	[173.64 s]
0.0.N: Trace Attempt 247	[175.02 s]
0.0.AM: Trace Attempt 701	[176.09 s]
0.0.Ht: Trace Attempt 10459	[176.49 s]
0.0.Bm: Trace Attempt 10140	[176.47 s]
0.0.B: Trace Attempt 10085	[176.47 s]
0.0.Hp: Trace Attempt 3026	[177.71 s]
0.0.N: Trace Attempt 348	[179.04 s]
0.0.B: Trace Attempt 10192	[180.47 s]
0.0.Ht: Trace Attempt 10575	[180.51 s]
0.0.Bm: Trace Attempt 10249	[180.49 s]
0.0.AM: Trace Attempt 709	[180.55 s]
0.0.N: Trace Attempt 394	[180.94 s]
0.0.N: Stopped processing property "SEVEN.p1"	[180.98 s].
0.0.N: Morphing to Ncustom1
0.0.N: All properties determined. [0.00 s]
0.0.N: Exited with Success (@ 0.00 s)
0.0.Ncustom1: clocks: 1, declared: 1, looping: 0, posedge: 1, negedge: 0, noedge: 0, bothedge: 0
0.0.Ncustom1: Starting proof for property "SEVEN.p1"	[0.00 s].
0.0.Ncustom1: Trace Attempt 461	[0.04 s]
0.0.B: Trace Attempt 10203	[180.88 s]
0.0.B: Stopped processing property "SEVEN.p1"	[181.04 s].
0.0.B: Morphing to Bcustom2
0.0.B: All properties determined. [0.00 s]
0.0.B: Exited with Success (@ 0.00 s)
0.0.Bcustom2: clocks: 1, declared: 1, looping: 0, posedge: 1, negedge: 0, noedge: 0, bothedge: 0
0.0.Bcustom2: Starting proof for property "SEVEN.p1"	[0.00 s].
0.0.Bcustom2: Trace Attempt  1	[0.00 s]
0.0.Bcustom2: Trace Attempt  2	[0.00 s]
0.0.Bcustom2: Trace Attempt  1	[0.00 s]
0.0.Bcustom2: Trace Attempt  2	[0.00 s]
0.0.Bcustom2: Trace Attempt  3	[0.00 s]
0.0.Bcustom2: Trace Attempt  4	[0.00 s]
0.0.Bcustom2: Trace Attempt  5	[0.00 s]
0.0.Bcustom2: Trace Attempt  1	[0.00 s]
0.0.Bcustom2: Trace Attempt  2	[0.00 s]
0.0.Bcustom2: Trace Attempt  3	[0.00 s]
0.0.Bcustom2: Trace Attempt  4	[0.00 s]
0.0.Bcustom2: Trace Attempt  5	[0.00 s]
0.0.Bcustom2: Trace Attempt  1	[0.00 s]
0.0.Bcustom2: Trace Attempt  2	[0.00 s]
0.0.Bcustom2: Trace Attempt  3	[0.01 s]
0.0.Bcustom2: Trace Attempt  4	[0.01 s]
0.0.Bcustom2: Trace Attempt  5	[0.01 s]
0.0.Bcustom2: Trace Attempt  1	[0.01 s]
0.0.Bcustom2: Trace Attempt  2	[0.01 s]
0.0.Bcustom2: Trace Attempt  3	[0.01 s]
0.0.Bcustom2: Trace Attempt  4	[0.01 s]
0.0.Bcustom2: Trace Attempt  5	[0.01 s]
0.0.Bcustom2: Trace Attempt  1	[0.02 s]
0.0.Bcustom2: Trace Attempt  2	[0.02 s]
0.0.Bcustom2: Trace Attempt  3	[0.02 s]
0.0.Bcustom2: Trace Attempt  4	[0.02 s]
0.0.Bcustom2: Trace Attempt  5	[0.02 s]
0.0.Bcustom2: Trace Attempt  1	[0.04 s]
0.0.Bcustom2: Trace Attempt  2	[0.04 s]
0.0.Bcustom2: Trace Attempt  3	[0.04 s]
0.0.Bcustom2: Trace Attempt  4	[0.04 s]
0.0.Bcustom2: Trace Attempt  5	[0.04 s]
0.0.AM: Stopped processing property "SEVEN.p1"	[181.08 s].
0.0.AM: Morphing to AMcustom3
0.0.AM: All properties determined. [0.00 s]
0.0.AM: Exited with Success (@ 0.00 s)
0.0.AMcustom3: clocks: 1, declared: 1, looping: 0, posedge: 1, negedge: 0, noedge: 0, bothedge: 0
0.0.AMcustom3: Starting proof for property "SEVEN.p1"	[0.00 s].
0.0.AMcustom3: Trace Attempt  1	[0.00 s]
0.0.AMcustom3: Trace Attempt  2	[0.00 s]
0.0.Bcustom2: Trace Attempt  1	[0.09 s]
0.0.Bcustom2: Trace Attempt  2	[0.09 s]
0.0.Bcustom2: Trace Attempt  3	[0.09 s]
0.0.Bcustom2: Trace Attempt  4	[0.09 s]
0.0.Bcustom2: Trace Attempt  5	[0.09 s]
0.0.AMcustom3: Trace Attempt  3	[0.04 s]
0.0.AMcustom3: Trace Attempt  4	[0.04 s]
0.0.AMcustom3: Trace Attempt  5	[0.04 s]
0.0.AMcustom3: Trace Attempt  1	[0.05 s]
0.0.AMcustom3: Trace Attempt  2	[0.05 s]
0.0.AMcustom3: Trace Attempt  3	[0.05 s]
0.0.AMcustom3: Trace Attempt  4	[0.05 s]
0.0.AMcustom3: Trace Attempt  5	[0.05 s]
0.0.D: Proofgrid shell started at 23081@vlsi-ria85(local) jg_17508_vlsi-ria85_1
0.0.Tri: Proofgrid shell started at 23077@vlsi-ria85(local) jg_17508_vlsi-ria85_1
0.0.AMcustom3: Trace Attempt  1	[0.05 s]
0.0.AMcustom3: Trace Attempt  2	[0.05 s]
0.0.AMcustom3: Trace Attempt  3	[0.05 s]
0.0.AMcustom3: Trace Attempt  4	[0.05 s]
0.0.AMcustom3: Trace Attempt  5	[0.05 s]
0.0.Tri: clocks: 1, declared: 1, looping: 0, posedge: 1, negedge: 0, noedge: 0, bothedge: 0
0.0.D: clocks: 1, declared: 1, looping: 0, posedge: 1, negedge: 0, noedge: 0, bothedge: 0
0.0.D: Last scan. Per property time limit: 0s
0.0.D: Starting proof for property "SEVEN.p1"	[0.00 s].
0.0.D: Trace Attempt  1	[0.00 s]
0.0.D: Trace Attempt  2	[0.00 s]
0.0.D: Trace Attempt  3	[0.00 s]
0.0.AMcustom3: Trace Attempt  1	[0.07 s]
0.0.AMcustom3: Trace Attempt  2	[0.08 s]
0.0.AMcustom3: Trace Attempt  3	[0.08 s]
0.0.AMcustom3: Trace Attempt  4	[0.08 s]
0.0.AMcustom3: Trace Attempt  5	[0.08 s]
0.0.Tri: Last scan. Per property time limit: 0s
0.0.Tri: Starting proof for property "SEVEN.p1"	[0.00 s].
0.0.Tri: Trace Attempt  1	[0.00 s]
0.0.AMcustom3: Trace Attempt  1	[0.16 s]
0.0.AMcustom3: Trace Attempt  2	[0.16 s]
0.0.AMcustom3: Trace Attempt  3	[0.16 s]
0.0.AMcustom3: Trace Attempt  4	[0.16 s]
0.0.AMcustom3: Trace Attempt  5	[0.17 s]
0.0.Bcustom2: Trace Attempt  1	[0.23 s]
0.0.Bcustom2: Trace Attempt  2	[0.23 s]
0.0.Bcustom2: Trace Attempt  3	[0.23 s]
0.0.Bcustom2: Trace Attempt  4	[0.23 s]
0.0.Bcustom2: Trace Attempt  5	[0.23 s]
0.0.Tri:    0.00" ---- Launching main thread ----
0.0.Tri:    0.24" ---- Launching abstraction thread ----
0.0.Tri:    0.27" ---- Launching multi-phase simplification thread ----
0.0.Tri:    0.35" ---- Launching liveness simplification thread ----
0.0.AMcustom3: Trace Attempt  1	[0.55 s]
0.0.AMcustom3: Trace Attempt  2	[0.55 s]
0.0.AMcustom3: Trace Attempt  3	[0.55 s]
0.0.AMcustom3: Trace Attempt  4	[0.55 s]
0.0.AMcustom3: Trace Attempt  5	[0.55 s]
0.0.Hp: Trace Attempt 3061	[181.72 s]
0.0.D: Trace Attempt 65	[1.00 s]
0.0.D: Stopped processing property "SEVEN.p1"	[1.28 s].
0.0.D: Morphing to M
0.0.D: All properties determined. [0.00 s]
0.0.D: Exited with Success (@ 0.00 s)
0.0.M: clocks: 1, declared: 1, looping: 0, posedge: 1, negedge: 0, noedge: 0, bothedge: 0
0.0.M: Starting proof for property "SEVEN.p1"	[0.00 s].
0.0.M: Trace Attempt  1	[0.00 s]
0.0.M: Trace Attempt  2	[0.00 s]
0.0.M: Trace Attempt  3	[0.00 s]
0.0.M: Trace Attempt  4	[0.00 s]
0.0.M: Trace Attempt  5	[0.00 s]
0.0.Tri:    1.19" Simplification phase 1 complete
0.0.Ncustom1: Requesting engine job to terminate
0.0.Bcustom2: Requesting engine job to terminate
0.0.AMcustom3: Requesting engine job to terminate
0.0.Tri: Requesting engine job to terminate
0.0.M: Requesting engine job to terminate
0.0.Hp: Requesting engine job to terminate
0.0.Ht: Requesting engine job to terminate
0.0.Bm: Requesting engine job to terminate
INFO (IPF144): 0: Initiating shutdown of proof [182.63 s]
0.0.Tri: A proof was found: No trace exists. [1.35 s]
INFO (IPF057): 0.0.Tri: The property "SEVEN.p1" was proven in 1.36 s.
0.0.M: Trace Attempt 29	[0.11 s]
0.0.M: Stopped processing property "SEVEN.p1"	[0.13 s].
0.0.M: All properties determined. [0.13 s]
0.0.M: Exited with Success (@ 182.63 s)
0: ProofGrid usable level: 0
0.0.AMcustom3: Trace Attempt 89	[1.47 s]
0.0.AMcustom3: Stopped processing property "SEVEN.p1"	[1.48 s].
0.0.AMcustom3: All properties determined. [1.48 s]
0.0.AMcustom3: Exited with Success (@ 182.64 s)
0.0.Ncustom1: Stopped processing property "SEVEN.p1"	[1.62 s].
0.0.Ncustom1: All properties determined. [1.65 s]
0.0.Ncustom1: Exited with Success (@ 182.65 s)
0.0.Ht: Trace Attempt 10632	[182.59 s]
0.0.Ht: All properties determined. [182.62 s]
0.0.AMcustom5: Proofgrid shell started at 23231@vlsi-ria85(local) jg_17508_vlsi-ria85_1
0.0.AMcustom5: Requesting engine job to terminate
0.0.AMcustom5: Preventing job from starting because proof is shutting down.
0.0.AMcustom5: Requesting engine job to terminate
0.0.AMcustom5: Interrupted. [0.00 s]
0.0.AMcustom5: Exited with Success (@ 182.69 s)
0.0.Hp: Trace Attempt 3068	[182.59 s]
0.0.Hp: All properties determined. [182.69 s]
0.0.Bm: Trace Attempt 10301	[182.53 s]
0.0.Bm: All properties determined. [182.66 s]
0.0.Bm: Exited with Success (@ 182.76 s)
0.0.Ht: Exited with Success (@ 182.79 s)
0.0.Tri: Stopped processing property "SEVEN.p1"	[1.55 s].
0.0.Tri: All properties determined. [1.55 s]
0.0.Tri: Exited with Success (@ 182.82 s)
0.0.Hp: Exited with Success (@ 182.88 s)
0.0.Bcustom2: Trace Attempt  1	[2.69 s]
0.0.Bcustom2: Stopped processing property "SEVEN.p1"	[2.69 s].
0.0.Bcustom2: All properties determined. [2.69 s]
0.0.Bcustom2: Exited with Success (@ 183.82 s)
0: --------------------------------------------------------------
ProofGrid Summary (utilization 99.91 %)
--------------------------------------------------------------
     engines started                               :    16
     engine jobs started                           :    12

    Average time in state (seconds)
    ------------------------------------------------------
    Engine  Pending     Running        Dead    Utilization
    ------------------------------------------------------
     Hp        0.03      182.63        0.00       99.98 %
     Ht        0.04      182.59        0.00       99.98 %
     Bm        0.06      182.56        0.00       99.97 %
    Mpcustom4        0.05        0.00        0.00        1.62 %
     Oh        0.03        0.01        0.00       23.91 %
      L        0.03        0.00        0.00        4.01 %
    Ncustom1        0.04      182.59        0.00       99.98 %
    Bcustom2        0.04      182.43        0.00       99.98 %
    AMcustom3        0.06      182.40        0.00       99.97 %
    Tri        0.21        1.42        0.00       86.95 %
      M        0.18        1.37        0.00       88.43 %
    AMcustom5        0.23        0.00        0.00        0.00 %
    all        0.08       91.50        0.00       99.91 %

    Total time in state (seconds)
    -----------------------------------------
            Pending     Running        Dead  
    -----------------------------------------
               1.00     1098.00        0.00

    Data read    : 8.39 MiB
    Data written : 4.40 kiB

0: All pending notifications were processed.
INFO (IPF059): 0: Completed proof on task: "<embedded>"

==============================================================
SUMMARY
==============================================================
           Properties Considered              : 2
                 assertions                   : 1
                  - proven                    : 1 (100%)
                  - bounded_proven (user)     : 0 (0%)
                  - bounded_proven (auto)     : 0 (0%)
                  - marked_proven             : 0 (0%)
                  - cex                       : 0 (0%)
                  - ar_cex                    : 0 (0%)
                  - undetermined              : 0 (0%)
                  - unknown                   : 0 (0%)
                  - error                     : 0 (0%)
                 covers                       : 1
                  - unreachable               : 0 (0%)
                  - bounded_unreachable (user): 0 (0%)
                  - covered                   : 1 (100%)
                  - ar_covered                : 0 (0%)
                  - undetermined              : 0 (0%)
                  - unknown                   : 0 (0%)
                  - error                     : 0 (0%)
determined
[<embedded>] % exit -force
INFO (IPL005): Received request to exit from the console.
INFO (IPL014): Waiting for the Tcl-thread to exit.
INFO: Waiting for proof threads to stop...
INFO: Proof threads stopped.
INFO (IPL018): The peak resident set memory use for this session was 1.992 GB.
INFO (IPL015): The Tcl-thread exited with status 0.
INFO (IPL016): Exiting the analysis session with status 0.
