# ----------------------------------------
# Jasper Version Info
# tool      : Jasper 2024.06
# platform  : Linux 3.10.0-1160.62.1.el7.x86_64
# version   : 2024.06p002 64 bits
# build date: 2024.09.02 16:28:38 UTC
# ----------------------------------------
# started   : 2025-11-20 01:28:30 IST
# hostname  : vlsi-ria85.vlsidomain
# pid       : 24736
# arguments : '-label' 'session_0' '-console' '//127.0.0.1:34209' '-nowindow' '-style' 'windows' '-exitonerror' '-data' 'AAAA4nicY2RgYLCp////PwMYMD6A0Aw2jAyoAMRnQhUJbEChGRhYYZphSliAmItBl6GAoYghnyELyDNj0ANCfSA7HS6aypDMUMJQDBQ1ZIgH0qkMZUCcB2WnA2kzoE4eoDlJDIlAlckMGUC+Eh7VemBVOWA3AACUJBt3' '-proj' '/users/rompel/jasper_executions/liveness/jgprojects/1_seven_seg_6/sessionLogs/session_0' '-init' '-hidden' '/users/rompel/jasper_executions/liveness/jgprojects/1_seven_seg_6/.tmp/.initCmds.tcl' '1_seven_seg_6.tcl' '-hidden' '/users/rompel/jasper_executions/liveness/jgprojects/1_seven_seg_6/.tmp/.postCmds.tcl'

Any disclosure about the Cadence Design Systems software or its use
model to any third party violates the written Non-Disclosure Agreement
between Cadence Design Systems, Inc. and the customer.

THIS SOFTWARE CONTAINS CONFIDENTIAL INFORMATION AND TRADE SECRETS OF
CADENCE DESIGN SYSTEMS, INC. USE, DISCLOSURE, OR REPRODUCTION IS
PROHIBITED WITHOUT THE PRIOR EXPRESS WRITTEN PERMISSION OF CADENCE
DESIGN SYSTEMS, INC.

Copyright (C) 2000-2024 Cadence Design Systems, Inc. All Rights
Reserved.  Unpublished -- rights reserved under the copyright laws of
the United States.

This product includes software developed by others and redistributed
according to license agreement. See doc/third_party_readme.txt for
further details.

RESTRICTED RIGHTS LEGEND

Use, duplication, or disclosure by the Government is subject to
restrictions as set forth in subparagraph (c) (1) (ii) of the Rights in
Technical Data and Computer Software clause at DFARS 252.227-7013 or
subparagraphs (c) (1) and (2) of Commercial Computer Software -- Restricted
Rights at 48 CFR 52.227-19, as applicable.


                          Cadence Design Systems, Inc.
                          2655 Seely Avenue
                          San Jose, CA 95134
                          Phone: 408.943.1234

For technical assistance visit http://support.cadence.com.

Jasper Apps Analysis Session - /users/rompel/jasper_executions/liveness/jgprojects/1_seven_seg_6/sessionLogs/session_0

WARNING (WG017): [session]: The system's locale is "ANSI_X3.4-1968", which is not UTF-8. Non-ASCII characters might not be handled correctly.
WARNING (WG017): [jg_console]: The system's locale is "ANSI_X3.4-1968", which is not UTF-8. Non-ASCII characters might not be handled correctly.
INFO: successfully checked out license "jasper_fao".
INFO: reading configuration file "/users/rompel/.config/cadence/jasper.conf".
% analyze -sv09 ../1_seven_seg_6.sv
[-- (VERI-1482)] Analyzing Verilog file '/tools/cadence2425/JASPER/jasper_2024.06p002/lib/verilog/packages/std/std.sv' into library 'std'
[-- (VERI-1482)] Analyzing Verilog file '../1_seven_seg_6.sv'
% elaborate -bbox_mul 1000000 -bbox_div 1000000 -bbox_mod 1000000 -bbox_a 1000000
[INFO (HIER-8002)] ../1_seven_seg_6.sv(32): Disabling old hierarchical reference handler
[INFO (VERI-1018)] ../1_seven_seg_6.sv(1): compiling module 'SEVEN'
[WARN (VERI-1209)] ../1_seven_seg_6.sv(15): expression size 32 truncated to fit in target size 13
[INFO (VERI-8005)] ../1_seven_seg_6.sv(5): Unintentional sequential element inferred for cnt read before write using blocking assignment
[INFO (VERI-8005)] ../1_seven_seg_6.sv(6): Unintentional sequential element inferred for digit_select read before write using blocking assignment
[INFO (VERI-8005)] ../1_seven_seg_6.sv(1): Unintentional sequential element inferred for segment read before write using blocking assignment
[INFO (VERI-8005)] ../1_seven_seg_6.sv(1): Unintentional sequential element inferred for sig read before write using blocking assignment
INFO (ISW003): Top module name is "SEVEN".
INFO (INL208): Elaboration synthesis summary:
  Number of synthesized netlists          1 (0 packages)
  Single run mode                         On
  Pipeline                                On (1 pipelined netlists)
  Late hierarchical reference connection  On
  Number of analyzed Verilog modules      1 (1 synthesized)
  Number of analyzed VHDL entities        0 (0 synthesized)
INFO (INL003): Clearing all state information (assumes, stopats, and so forth).
SEVEN
[<embedded>] % reset rst
INFO (IPM031): Clearing proof results of all properties.
INFO (IRS006): Current reset condition is "rst".
[<embedded>] % clock clk
[<embedded>] % prove -all
Ncustom1: Custom engine code is hT3Ng7hPPfiYQOTDZ3qhYOwGAM51eA+J/FjkM5shLioAsqhgLR4Ft+O1BuKG6ilQ83B9tLXSl+CwjiTMAQA
Bcustom2: Custom engine code is hT3Nm7hPr1Vp3Di1Ra2USNIGL4JypRnLKLAdF6JAyuavO2JfGCiY9OZJhcAcOUnLx5xwNdhILGrAWX9s+z2WDkKwNR7tAfClBEjRFVQeq6DU54boFgEA
AMcustom3: Custom engine code is hT3Ng7hP/feYQOTDZ3qhYOwGAM51eA+J/FjkM5shLioAsqhgLR4Ft+O1BuKG6ilQ83B9tLXSmmqwm7g9AQA
Mpcustom4: Custom engine code is hT3NZbhP9fmY2AbBQnsjfOxn6c+6e6yL+/e8fZFmaQrnlgEA
INFO (IPF036): Starting proof on task: "<embedded>", 1 properties to prove with 0 already proven/unreachable
INFO (IRS029): Starting reset analysis: phase 1 of 4.
INFO (IRS030): Running reset analysis: phase 2 of 4.
INFO (IRS031): Running reset analysis: phase 3 of 4.
INFO (IRS020): Starting the reset analysis simulation with a limit of 100 iterations (phase 4 of 4).
INFO (IRS024): Reset iterations 0 to 4 analyzed.
INFO (IRS018): Reset analysis simulation executed for 3 iterations. Assigned values for 22 of 22 design flops, 0 of 0 design latches, 3 of 3 internal elements.
INFO (IRS039): Reset analysis complete.
INFO (IPF031): Settings used for proof thread 0:
    orchestration                 = on
    time_limit                    = 86400s
    per_property_time_limit       = 1s * 10 ^ scan
    engine_mode                   = auto
    proofgrid_per_engine_max_jobs = 1
    max engine jobs               = auto
    proofgrid_mode                = local
    proofgrid_restarts            = 10
0: Using multistage preprocessing
0: Starting reduce
AMcustom5: Custom engine code is hT3N1rhP11/52HrFRS21ROp2LOjVTgPvT8L8BGXHgLhaIuqtT4nARFjUqrBL+7pLmaTOzBepZW/Jm8SSrHDybSQtoNiO3y43wk+dEoWlsZizu97Fih6O6lPVG/LpWP5SsUPwlGagLNa1FKEFvwVXyX7//8prySbvSxIHXr5er+z4RAEA
Ncustom6: Custom engine code is hT3OXrhPByJp3TrFSTLhUmMH4KVtJgmTCnNDF46yMXOKY48m4LS5nE7yBzFjA7kDuwO/GhGUpEPiky3p3wmPn3dJZHxFMsafSoObRzSC+tn7sEY0WbTdZ/FV4hL3MYH/b1CIUvXSWR4wqEoVLsmMOD4xIPT4lI1LO6ZCO7PnnWQuLwetnvKlrXx6wCW/A+x+enqslg1YPobi4wEF/EvbzOvcTYdJvl2s4H2yZg2b2ofAVN5WvhWk1HoBAA
ADcustom7: Custom engine code is hT3Nv7hPv1752HrFRa2kROx2f/ECJeZB2AZsLdlO8VwmIuqtT4nIDFXclhg+O+o+DMmQCekbheGk0kK28laA9gaOFDXsQp29J3X615HY1IPHJWd6FUFvCHjO+p1k652b5JJvZlShNpGlGSXAiQe/mEAj6tEBAA
Tricustom8: Custom engine code is hT3Nu7hPt1752DvFRa0kNDiyIV97VyejwM9C/jCLJjdPvusZONHY42VYUy0Q1ZotnhcVtNc56tJ5wbxv6V2+XpdsaSlHck5vfnbYjdwj1OECy9U+7oSQ0SZE3g5ayD+Phuh4odCJTjeKa2k4elM9ldQfkAEA
Gcustom9: Custom engine code is hT3NibhPDfeYQADBZnYcglOvK9Pfd7EOeniIqP8jNsyIqInncipMGcUXqAadachREE9F2PwhBUZUNw5kHnd4JdXkamORRgEA
C2custom10: Custom engine code is hT3NirhPjfWYQADBZnYcglOvK9Pfd7EOeniIqP8jNsyIqInncgkrYMMXCYbdK0dUjZIF9d4cJ0rHoBDjwVLBKuG86XYVV00BAA
AGcustom11: Custom engine code is hT3NirhP/fmYQADBZnYcglOvK9Pfd7EOeniIqP8jNsyIqInnckcwYMMXCYbdK0dUjZIF9d4cJ0rHoBDjwVLBKuHEZnZByh0BAA
Bcustom12: Custom engine code is hT3NjrhPDfiYQADBZnYcglOvK9PfWxFtenjIyBqfrgr7if/jL/yPOuK1BAflEcW0DxNH2eDIoezN2gxlQFg81RZtiWXh7aiTAidvAQA
0: Finished reduce in 0s
Ncustom13: Custom engine code is hT3NR7hPByFp3TrFSTLhUmMH4KWtJglTyV/c51BHEeZWamnJv767nE6PCak26bd3gf3XGN3rIRheufhDieCJQVISo+gNYUKhiUedBKGtsP/a18svAnlMJZudHxDFwK5ufsyoxsIyiAeSY2oi3tEuoDHr5gw42DFKAG3PqO3CEsl8Azzdt3pl5nGA1Ifv2H02eYsFzWb/nfp8PMb3F0krE/EgBcm8TD9Div8BAA
0.0.PRE: Performing Proof Simplification...
Tricustom14: Custom engine code is hT3Nu7hP3fiYQADBZnYcglNHp9bfd7EOeniIqP/ji8sGLQu8yhsFO+wxJ+O+R0bU8g/IewXFomyos+viQnWc2xYNYmMqpo3i40O7DaZR7qfp4YqNx26KRvQ/qx0BAA
0.0.N: clocks: 1, declared: 1, looping: 0, posedge: 1, negedge: 0, noedge: 0, bothedge: 0
0.0.N: Proof Simplification Iteration 1	[0.00 s]
0.0.PRE: A proof was found: No trace exists. [0.00 s]
INFO (IPF057): 0.0.PRE: The property ":noDeadEnd" was proven in 0.00 s.
    Use check_assumptions -show -dead_end to show this property in the property table.
0.0.PRE: A proof was found: No trace exists. [0.00 s]
INFO (IPF057): 0.0.PRE: The property ":noConflict" was proven in 0.00 s.
    Use check_assumptions -show to show this property in the property table.
INFO (IPF047): 0.0.PRE: The cover property ":live" was covered in 1 cycles in 0.00 s.
    Use check_assumptions -show -live to show this property in the property table.
0.0.PRE: Proof Simplification completed in 0.00 s
0: About to start ProofGrid in its own thread with a limit of 10000 pending notifications and a limit of 10 traces.
0: =============================== ProofGrid start ===============================
0: ProofGrid usable level: 1
0: Initial ProofGrid level: 1
0: ProofGrid is starting event handling
0.0.Hp: Proofgrid shell started at 24873@vlsi-ria85(local) jg_24736_vlsi-ria85_1
0.0.N: Proofgrid shell started at 24872@vlsi-ria85(local) jg_24736_vlsi-ria85_1
0.0.Hp: clocks: 1, declared: 1, looping: 0, posedge: 1, negedge: 0, noedge: 0, bothedge: 0
0.0.N: clocks: 1, declared: 1, looping: 0, posedge: 1, negedge: 0, noedge: 0, bothedge: 0
0.0.Hp: Last scan. Per property time limit: 0s
0.0.N: Last scan. Per property time limit: 0s
0.0.N: Starting proof for property "SEVEN.p1"	[0.00 s].
0.0.Hp: Trace Attempt  1	[0.00 s]
0.0.Hp: Trace Attempt  2	[0.00 s]
0.0.Hp: Trace Attempt  3	[0.00 s]
0.0.Hp: Trace Attempt  4	[0.00 s]
0.0.Hp: Trace Attempt  5	[0.00 s]
0.0.N: Trace Attempt  1	[0.00 s]
0.0.N: Trace Attempt  2	[0.00 s]
0.0.N: Trace Attempt  2	[0.00 s]
0.0.N: Trace Attempt  3	[0.00 s]
0.0.N: Trace Attempt  3	[0.00 s]
0.0.N: Trace Attempt  4	[0.00 s]
0.0.N: Trace Attempt  5	[0.00 s]
0.0.N: Trace Attempt  5	[0.00 s]
0.0.N: Trace Attempt  1	[0.01 s]
0.0.N: Trace Attempt  2	[0.01 s]
0.0.N: Trace Attempt  3	[0.01 s]
0.0.N: Trace Attempt  4	[0.01 s]
0.0.N: Trace Attempt  5	[0.01 s]
0.0.Ht: Proofgrid shell started at 24910@vlsi-ria85(local) jg_24736_vlsi-ria85_1
0.0.Oh: Proofgrid shell started at 24911@vlsi-ria85(local) jg_24736_vlsi-ria85_1
0.0.Ht: clocks: 1, declared: 1, looping: 0, posedge: 1, negedge: 0, noedge: 0, bothedge: 0
0.0.Ht: Last scan. Per property time limit: 0s
0.0.Oh: clocks: 1, declared: 1, looping: 0, posedge: 1, negedge: 0, noedge: 0, bothedge: 0
0.0.B: Proofgrid shell started at 24912@vlsi-ria85(local) jg_24736_vlsi-ria85_1
0.0.AM: Proofgrid shell started at 24913@vlsi-ria85(local) jg_24736_vlsi-ria85_1
0.0.Ht: Trace Attempt  1	[0.00 s]
0.0.Ht: Trace Attempt  2	[0.00 s]
0.0.Ht: Trace Attempt  3	[0.00 s]
0.0.Ht: Trace Attempt  4	[0.00 s]
0.0.Ht: Trace Attempt  5	[0.00 s]
0.0.Oh: Reached length limit (2147483647) [0.00 s]
0.0.Oh: Exited with Success (@ 0.04 s)
0.0.Oh: Completed, Restart ignored.
0.0.B: clocks: 1, declared: 1, looping: 0, posedge: 1, negedge: 0, noedge: 0, bothedge: 0
0.0.B: Last scan. Per property time limit: 0s
0.0.B: Starting proof for property "SEVEN.p1"	[0.00 s].
0.0.B: Trace Attempt  1	[0.00 s]
0.0.B: Trace Attempt  2	[0.00 s]
0.0.B: Trace Attempt  3	[0.00 s]
0.0.B: Trace Attempt  4	[0.00 s]
0.0.B: Trace Attempt  5	[0.00 s]
0.0.AM: clocks: 1, declared: 1, looping: 0, posedge: 1, negedge: 0, noedge: 0, bothedge: 0
0.0.AM: Last scan. Per property time limit: 0s
0.0.AM: Starting proof for property "SEVEN.p1"	[0.00 s].
0.0.AM: Trace Attempt  1	[0.00 s]
0.0.AM: Trace Attempt  2	[0.00 s]
0.0.AM: Trace Attempt  3	[0.00 s]
0.0.AM: Trace Attempt  4	[0.00 s]
0.0.AM: Trace Attempt  5	[0.00 s]
0.0.AM: Trace Attempt  1	[0.00 s]
0.0.AM: Trace Attempt  2	[0.00 s]
0.0.AM: Trace Attempt  3	[0.00 s]
0.0.AM: Trace Attempt  4	[0.00 s]
0.0.AM: Trace Attempt  5	[0.00 s]
0.0.AM: Trace Attempt  1	[0.01 s]
0.0.AM: Trace Attempt  2	[0.01 s]
0.0.AM: Trace Attempt  3	[0.01 s]
0.0.AM: Trace Attempt  4	[0.01 s]
0.0.AM: Trace Attempt  5	[0.01 s]
0.0.AM: Trace Attempt  1	[0.03 s]
0.0.AM: Trace Attempt  2	[0.03 s]
0.0.AM: Trace Attempt  3	[0.03 s]
0.0.AM: Trace Attempt  4	[0.03 s]
0.0.AM: Trace Attempt  5	[0.03 s]
0.0.N: Trace Attempt  1	[0.10 s]
0.0.N: Trace Attempt  2	[0.10 s]
0.0.N: Trace Attempt  3	[0.10 s]
0.0.N: Trace Attempt  4	[0.10 s]
0.0.N: Trace Attempt  5	[0.10 s]
0.0.AM: Trace Attempt  1	[0.13 s]
0.0.AM: Trace Attempt  2	[0.13 s]
0.0.AM: Trace Attempt  3	[0.13 s]
0.0.AM: Trace Attempt  4	[0.13 s]
0.0.AM: Trace Attempt  5	[0.13 s]
0.0.AM: Trace Attempt  1	[0.41 s]
0.0.AM: Trace Attempt  2	[0.41 s]
0.0.AM: Trace Attempt  3	[0.41 s]
0.0.AM: Trace Attempt  4	[0.42 s]
0.0.AM: Trace Attempt  5	[0.42 s]
0.0.N: Trace Attempt  1	[0.46 s]
0.0.N: Trace Attempt  2	[0.46 s]
0.0.N: Trace Attempt  3	[0.46 s]
0.0.N: Trace Attempt  4	[0.47 s]
0.0.N: Trace Attempt  5	[0.47 s]
0.0.AM: Trace Attempt  1	[1.57 s]
0.0.AM: Trace Attempt  2	[1.57 s]
0.0.AM: Trace Attempt  3	[1.57 s]
0.0.AM: Trace Attempt  4	[1.57 s]
0.0.AM: Trace Attempt  5	[1.57 s]
0.0.N: Trace Attempt  1	[2.55 s]
0.0.N: Trace Attempt  2	[2.55 s]
0.0.N: Trace Attempt  3	[2.55 s]
0.0.N: Trace Attempt  4	[2.56 s]
0.0.N: Trace Attempt  5	[2.56 s]
0.0.Hp: Trace Attempt 721	[4.01 s]
0.0.Ht: Trace Attempt 2114	[4.00 s]
0.0.B: Trace Attempt 1958	[4.00 s]
0.0.AM: Trace Attempt 203	[5.59 s]
0.0.N: Trace Attempt 204	[6.58 s]
0.0.AM: Trace Attempt  1	[7.40 s]
0.0.AM: Trace Attempt  2	[7.40 s]
0.0.AM: Trace Attempt  3	[7.40 s]
0.0.AM: Trace Attempt  4	[7.40 s]
0.0.AM: Trace Attempt  5	[7.40 s]
0.0.Hp: Trace Attempt 1008	[8.01 s]
0.0.Ht: Trace Attempt 2874	[8.01 s]
0.0.B: Trace Attempt 2706	[8.01 s]
0.0.N: Trace Attempt  1	[8.58 s]
0.0.N: Trace Attempt  2	[8.58 s]
0.0.N: Trace Attempt  3	[8.58 s]
0.0.N: Trace Attempt  4	[8.58 s]
0.0.N: Trace Attempt  5	[8.58 s]
0.0.AM: Trace Attempt 208	[11.42 s]
0.0.N: Trace Attempt  1	[11.77 s]
0.0.N: Trace Attempt  2	[11.77 s]
0.0.N: Trace Attempt  3	[11.77 s]
0.0.N: Trace Attempt  4	[11.77 s]
0.0.N: Trace Attempt  5	[11.77 s]
0.0.Ht: Trace Attempt 3450	[12.01 s]
0.0.Hp: Trace Attempt 1158	[12.05 s]
0.0.B: Trace Attempt 3277	[12.01 s]
0.0.N: Trace Attempt  1	[15.15 s]
0.0.N: Trace Attempt  2	[15.15 s]
0.0.N: Trace Attempt  3	[15.15 s]
0.0.N: Trace Attempt  4	[15.15 s]
0.0.N: Trace Attempt  5	[15.15 s]
0.0.AM: Trace Attempt 263	[15.44 s]
0.0.Ht: Trace Attempt 3925	[16.01 s]
0.0.B: Trace Attempt 3746	[16.01 s]
0.0.Hp: Trace Attempt 1270	[16.07 s]
0.0.N: Trace Attempt  1	[18.65 s]
0.0.N: Trace Attempt  2	[18.65 s]
0.0.N: Trace Attempt  3	[18.65 s]
0.0.N: Trace Attempt  4	[18.65 s]
0.0.N: Trace Attempt  5	[18.65 s]
0.0.AM: Trace Attempt 323	[19.47 s]
0.0.Ht: Trace Attempt 4357	[20.01 s]
0.0.B: Trace Attempt 4172	[20.01 s]
0.0.Hp: Trace Attempt 1374	[20.11 s]
0.0.N: Trace Attempt  1	[21.97 s]
0.0.N: Trace Attempt  2	[21.97 s]
0.0.N: Trace Attempt  3	[21.97 s]
0.0.N: Trace Attempt  4	[21.97 s]
0.0.N: Trace Attempt  5	[21.97 s]
0.0.AM: Trace Attempt 369	[23.55 s]
0.0.Ht: Trace Attempt 4748	[24.02 s]
0.0.B: Trace Attempt 4554	[24.02 s]
0.0.Hp: Trace Attempt 1471	[24.11 s]
0.0.N: Trace Attempt  1	[25.25 s]
0.0.N: Trace Attempt  2	[25.25 s]
0.0.N: Trace Attempt  3	[25.25 s]
0.0.N: Trace Attempt  4	[25.26 s]
0.0.N: Trace Attempt  5	[25.26 s]
0.0.AM: Trace Attempt 414	[27.62 s]
0.0.Ht: Trace Attempt 5094	[28.02 s]
0.0.B: Trace Attempt 4895	[28.03 s]
0.0.Hp: Trace Attempt 1559	[28.11 s]
0.0.N: Trace Attempt  1	[28.79 s]
0.0.N: Trace Attempt  2	[28.79 s]
0.0.N: Trace Attempt  3	[28.79 s]
0.0.N: Trace Attempt  4	[28.79 s]
0.0.N: Trace Attempt  5	[28.79 s]
0.0.AM: Trace Attempt 273	[31.62 s]
0.0.Ht: Trace Attempt 5411	[32.03 s]
0.0.B: Trace Attempt 5198	[32.03 s]
0.0.Hp: Trace Attempt 1644	[32.15 s]
0.0.N: Trace Attempt  1	[32.22 s]
0.0.N: Trace Attempt  2	[32.22 s]
0.0.N: Trace Attempt  3	[32.22 s]
0.0.N: Trace Attempt  4	[32.23 s]
0.0.N: Trace Attempt  5	[32.23 s]
0.0.N: Trace Attempt  1	[35.72 s]
0.0.N: Trace Attempt  2	[35.72 s]
0.0.N: Trace Attempt  3	[35.72 s]
0.0.N: Trace Attempt  4	[35.72 s]
0.0.N: Trace Attempt  5	[35.72 s]
0.0.Ht: Trace Attempt 5685	[36.03 s]
0.0.B: Trace Attempt 5462	[36.04 s]
0.0.Hp: Trace Attempt 1723	[36.17 s]
0.0.AM: Trace Attempt 512	[37.10 s]
0.0.AM: Trace Attempt  1	[37.37 s]
0.0.AM: Trace Attempt  2	[37.37 s]
0.0.AM: Trace Attempt  3	[37.37 s]
0.0.AM: Trace Attempt  4	[37.37 s]
0.0.AM: Trace Attempt  5	[37.37 s]
0.0.N: Trace Attempt  1	[39.44 s]
0.0.N: Trace Attempt  2	[39.44 s]
0.0.N: Trace Attempt  3	[39.44 s]
0.0.N: Trace Attempt  4	[39.44 s]
0.0.N: Trace Attempt  5	[39.44 s]
0.0.Ht: Trace Attempt 5966	[40.05 s]
0.0.B: Trace Attempt 5727	[40.05 s]
0.0.Hp: Trace Attempt 1802	[40.18 s]
0.0.AM: Trace Attempt 179	[41.38 s]
0.0.N: Trace Attempt 193	[43.45 s]
0.0.Ht: Trace Attempt 6252	[44.06 s]
0.0.B: Trace Attempt 5994	[44.06 s]
0.0.Hp: Trace Attempt 1881	[44.20 s]
0.0.AM: Trace Attempt 248	[45.48 s]
0.0.N: Trace Attempt 256	[47.53 s]
0.0.Ht: Trace Attempt 6521	[48.06 s]
0.0.B: Trace Attempt 6246	[48.07 s]
0.0.Hp: Trace Attempt 1957	[48.23 s]
0.0.AM: Trace Attempt 299	[49.50 s]
0.0.N: Trace Attempt 312	[51.57 s]
0.0.Ht: Trace Attempt 6784	[52.07 s]
0.0.B: Trace Attempt 6482	[52.07 s]
0.0.Hp: Trace Attempt 2030	[52.24 s]
0.0.AM: Trace Attempt 345	[53.59 s]
0.0.N: Trace Attempt 352	[55.59 s]
0.0.Ht: Trace Attempt 7038	[56.08 s]
0.0.B: Trace Attempt 6706	[56.08 s]
0.0.Hp: Trace Attempt 2101	[56.28 s]
0.0.AM: Trace Attempt 379	[57.62 s]
0.0.N: Trace Attempt 396	[59.64 s]
0.0.Ht: Trace Attempt 7272	[60.08 s]
0.0.B: Trace Attempt 6917	[60.09 s]
0.0.Hp: Trace Attempt 2169	[60.30 s]
0.0.AM: Trace Attempt 421	[61.68 s]
0.0.N: Trace Attempt 435	[63.67 s]
0.0.Ht: Trace Attempt 7494	[64.09 s]
0.0.B: Trace Attempt 7116	[64.10 s]
0.0.Hp: Trace Attempt 2235	[64.36 s]
0.0.AM: Trace Attempt 461	[65.74 s]
0.0.N: Trace Attempt 458	[67.70 s]
0.0.Ht: Trace Attempt 7707	[68.09 s]
0.0.B: Trace Attempt 7307	[68.11 s]
0.0.Hp: Trace Attempt 2299	[68.40 s]
0.0.AM: Trace Attempt 478	[70.03 s]
0.0.N: Trace Attempt  1	[71.01 s]
0.0.N: Trace Attempt  2	[71.01 s]
0.0.N: Trace Attempt  3	[71.01 s]
0.0.N: Trace Attempt  4	[71.02 s]
0.0.N: Trace Attempt  5	[71.02 s]
0.0.Ht: Trace Attempt 7917	[72.11 s]
0.0.B: Trace Attempt 7500	[72.13 s]
0.0.Hp: Trace Attempt 2362	[72.43 s]
0.0.AM: Trace Attempt 488	[74.10 s]
0.0.N: Trace Attempt 200	[75.05 s]
0.0.Ht: Trace Attempt 8131	[76.12 s]
0.0.B: Trace Attempt 7692	[76.14 s]
0.0.Hp: Trace Attempt 2425	[76.47 s]
0.0.AM: Trace Attempt 501	[78.12 s]
0.0.N: Trace Attempt 246	[79.07 s]
0.0.Ht: Trace Attempt 8337	[80.14 s]
0.0.B: Trace Attempt 7875	[80.15 s]
0.0.Hp: Trace Attempt 2486	[80.51 s]
0.0.AM: Trace Attempt 512	[82.37 s]
0.0.N: Trace Attempt 292	[83.11 s]
0.0.Ht: Trace Attempt 8539	[84.16 s]
0.0.B: Trace Attempt 8052	[84.16 s]
0.0.Hp: Trace Attempt 2545	[84.53 s]
0.0.AM: Trace Attempt 528	[86.58 s]
0.0.N: Trace Attempt 338	[87.18 s]
0.0.Ht: Trace Attempt 8733	[88.17 s]
0.0.B: Trace Attempt 8221	[88.16 s]
0.0.Hp: Trace Attempt 2602	[88.54 s]
0.0.AM: Trace Attempt 543	[90.59 s]
0.0.N: Trace Attempt 375	[91.24 s]
0.0.Ht: Trace Attempt 8914	[92.18 s]
0.0.B: Trace Attempt 8372	[92.18 s]
0.0.Hp: Trace Attempt 2653	[92.60 s]
0.0.AM: Trace Attempt 555	[94.99 s]
0.0.N: Trace Attempt 408	[95.34 s]
0.0.Ht: Trace Attempt 9091	[96.19 s]
0.0.B: Trace Attempt 8519	[96.19 s]
0.0.Hp: Trace Attempt 2705	[96.64 s]
0.0.N: Trace Attempt 444	[99.37 s]
0.0.AM: Trace Attempt 568	[99.54 s]
0.0.B: Trace Attempt 8657	[100.19 s]
0.0.Ht: Trace Attempt 9255	[100.21 s]
0.0.Hp: Trace Attempt 2754	[100.65 s]
0.0.N: Trace Attempt 463	[103.38 s]
0.0.AM: Trace Attempt 581	[103.68 s]
0.0.B: Trace Attempt 8800	[104.20 s]
0.0.Ht: Trace Attempt 9425	[104.22 s]
0.0.Hp: Trace Attempt 2805	[104.67 s]
0.0.N: Trace Attempt  1	[105.26 s]
0.0.N: Trace Attempt  2	[105.26 s]
0.0.N: Trace Attempt  3	[105.26 s]
0.0.N: Trace Attempt  4	[105.26 s]
0.0.N: Trace Attempt  5	[105.26 s]
0.0.AM: Trace Attempt 592	[107.82 s]
0.0.B: Trace Attempt 8948	[108.22 s]
0.0.Ht: Trace Attempt 9609	[108.25 s]
0.0.Hp: Trace Attempt 2858	[108.71 s]
0.0.N: Trace Attempt 202	[109.28 s]
0.0.AM: Trace Attempt 602	[112.00 s]
0.0.B: Trace Attempt 9094	[112.24 s]
0.0.Ht: Trace Attempt 9790	[112.25 s]
0.0.Hp: Trace Attempt 2910	[112.75 s]
0.0.N: Trace Attempt 259	[113.31 s]
0.0.B: Trace Attempt 9238	[116.25 s]
0.0.AM: Trace Attempt 612	[116.26 s]
0.0.Ht: Trace Attempt 9966	[116.28 s]
0.0.Hp: Trace Attempt 2961	[116.81 s]
0.0.N: Trace Attempt 317	[117.33 s]
0.0.B: Trace Attempt 9385	[120.28 s]
0.0.AM: Trace Attempt 622	[120.49 s]
0.0.Hp: Trace Attempt 3012	[120.84 s]
0.0.N: Trace Attempt 354	[121.33 s]
0.0.B: Trace Attempt 9528	[124.30 s]
0.0.AM: Trace Attempt 632	[124.70 s]
0.0.Hp: Trace Attempt 3062	[124.90 s]
0.0.N: Trace Attempt 397	[125.37 s]
0.0.B: Trace Attempt 9668	[128.32 s]
0.0.AM: Trace Attempt 643	[128.85 s]
0.0.Hp: Trace Attempt 3110	[128.90 s]
0.0.N: Trace Attempt 439	[129.45 s]
0.0.B: Trace Attempt 9810	[132.33 s]
0.0.Hp: Trace Attempt 3159	[132.92 s]
0.0.AM: Trace Attempt 655	[133.40 s]
0.0.N: Trace Attempt 463	[133.84 s]
0.0.N: Trace Attempt  1	[135.98 s]
0.0.N: Trace Attempt  2	[135.98 s]
0.0.N: Trace Attempt  3	[135.98 s]
0.0.N: Trace Attempt  4	[135.98 s]
0.0.N: Trace Attempt  5	[135.98 s]
0.0.B: Trace Attempt 9947	[136.34 s]
0.0.Hp: Trace Attempt 3207	[136.95 s]
0.0.AM: Trace Attempt 665	[137.45 s]
0.0.N: Trace Attempt 205	[139.99 s]
0.0.B: Trace Attempt 10026	[140.42 s]
0.0.Hp: Trace Attempt 3256	[140.97 s]
0.0.AM: Trace Attempt 676	[141.99 s]
0.0.N: Trace Attempt 262	[144.11 s]
0.0.B: Trace Attempt 10061	[144.49 s]
0.0.Ht: Trace Attempt 10004	[144.72 s]
0.0.Hp: Trace Attempt 3304	[144.99 s]
0.0.AM: Trace Attempt 685	[146.03 s]
0.0.N: Trace Attempt 320	[148.15 s]
0.0.B: Trace Attempt 10095	[148.50 s]
0.0.Ht: Trace Attempt 10132	[148.74 s]
0.0.Hp: Trace Attempt 3350	[149.03 s]
0.0.AM: Trace Attempt 693	[150.46 s]
0.0.N: Trace Attempt 357	[152.27 s]
0.0.B: Trace Attempt 10129	[152.50 s]
0.0.Ht: Trace Attempt 10262	[152.75 s]
0.0.Hp: Trace Attempt 3396	[153.07 s]
0.0.AM: Trace Attempt 701	[154.66 s]
0.0.N: Trace Attempt 400	[156.30 s]
0.0.B: Trace Attempt 10163	[156.51 s]
0.0.Ht: Trace Attempt 10392	[156.76 s]
0.0.Hp: Trace Attempt 3441	[157.10 s]
0.0.AM: Trace Attempt 710	[158.95 s]
0.0.N: Trace Attempt 441	[160.38 s]
0.0.B: Trace Attempt 10201	[160.70 s]
0.0.Ht: Trace Attempt 10513	[160.78 s]
0.0.Hp: Trace Attempt 3485	[161.13 s]
0.0.AM: Trace Attempt 720	[163.15 s]
0.0.N: Trace Attempt 463	[164.72 s]
0.0.Ht: Trace Attempt 10622	[164.79 s]
0.0.B: Trace Attempt 10235	[164.79 s]
0.0.Hp: Trace Attempt 3529	[165.19 s]
0.0.N: Trace Attempt  1	[166.90 s]
0.0.N: Trace Attempt  2	[166.90 s]
0.0.N: Trace Attempt  3	[166.90 s]
0.0.N: Trace Attempt  4	[166.91 s]
0.0.N: Trace Attempt  5	[166.91 s]
0.0.AM: Trace Attempt 731	[167.38 s]
0.0.Ht: Trace Attempt 10721	[168.79 s]
0.0.B: Trace Attempt 10268	[168.86 s]
0.0.Hp: Trace Attempt 3572	[169.19 s]
0.0.N: Trace Attempt 201	[170.92 s]
0.0.AM: Trace Attempt 742	[171.65 s]
0.0.Ht: Trace Attempt 10827	[172.80 s]
0.0.B: Trace Attempt 10301	[172.91 s]
0.0.Hp: Trace Attempt 3616	[173.26 s]
0.0.N: Trace Attempt 259	[175.01 s]
0.0.AM: Trace Attempt 752	[175.88 s]
0.0.Ht: Trace Attempt 10926	[176.80 s]
0.0.B: Trace Attempt 10334	[176.99 s]
0.0.Hp: Trace Attempt 3659	[177.31 s]
0.0.N: Trace Attempt 317	[179.03 s]
0.0.AM: Trace Attempt 763	[180.15 s]
0.0.Ht: Trace Attempt 11018	[180.84 s]
0.0.N: Trace Attempt 335	[180.94 s]
0.0.N: Stopped processing property "SEVEN.p1"	[181.02 s].
0.0.N: Morphing to Ncustom1
0.0.N: All properties determined. [0.00 s]
0.0.N: Exited with Success (@ 0.00 s)
0.0.Ncustom1: clocks: 1, declared: 1, looping: 0, posedge: 1, negedge: 0, noedge: 0, bothedge: 0
0.0.Ncustom1: Starting proof for property "SEVEN.p1"	[0.00 s].
0.0.Ncustom1: Trace Attempt 468	[0.03 s]
0.0.Tri: Proofgrid shell started at 859@vlsi-ria85(local) jg_24736_vlsi-ria85_1
0.0.Tri: clocks: 1, declared: 1, looping: 0, posedge: 1, negedge: 0, noedge: 0, bothedge: 0
0.0.Tri: Last scan. Per property time limit: 0s
0.0.Tri: Starting proof for property "SEVEN.p1"	[0.00 s].
0.0.Tri: Trace Attempt  1	[0.00 s]
0.0.B: Trace Attempt 10365	[180.86 s]
0.0.B: Stopped processing property "SEVEN.p1"	[181.07 s].
0.0.B: Morphing to Bcustom2
0.0.B: All properties determined. [0.00 s]
0.0.B: Exited with Success (@ 0.00 s)
0.0.Bcustom2: clocks: 1, declared: 1, looping: 0, posedge: 1, negedge: 0, noedge: 0, bothedge: 0
0.0.Bcustom2: Starting proof for property "SEVEN.p1"	[0.00 s].
0.0.Bcustom2: Trace Attempt  1	[0.00 s]
0.0.Bcustom2: Trace Attempt  2	[0.00 s]
0.0.Bcustom2: Trace Attempt  1	[0.00 s]
0.0.Bcustom2: Trace Attempt  2	[0.00 s]
0.0.Bcustom2: Trace Attempt  3	[0.00 s]
0.0.Bcustom2: Trace Attempt  4	[0.00 s]
0.0.Bcustom2: Trace Attempt  5	[0.00 s]
0.0.Bcustom2: Trace Attempt  1	[0.00 s]
0.0.Bcustom2: Trace Attempt  2	[0.00 s]
0.0.Bcustom2: Trace Attempt  3	[0.00 s]
0.0.Bcustom2: Trace Attempt  4	[0.00 s]
0.0.Bcustom2: Trace Attempt  5	[0.00 s]
0.0.Bcustom2: Trace Attempt  1	[0.00 s]
0.0.Bcustom2: Trace Attempt  2	[0.00 s]
0.0.Bcustom2: Trace Attempt  3	[0.00 s]
0.0.Bcustom2: Trace Attempt  4	[0.00 s]
0.0.Bcustom2: Trace Attempt  5	[0.00 s]
0.0.Bcustom2: Trace Attempt  1	[0.01 s]
0.0.Bcustom2: Trace Attempt  2	[0.01 s]
0.0.Bcustom2: Trace Attempt  3	[0.01 s]
0.0.Bcustom2: Trace Attempt  4	[0.01 s]
0.0.Bcustom2: Trace Attempt  5	[0.01 s]
0.0.Bcustom2: Trace Attempt  1	[0.01 s]
0.0.Bcustom2: Trace Attempt  2	[0.01 s]
0.0.Bcustom2: Trace Attempt  3	[0.01 s]
0.0.Bcustom2: Trace Attempt  4	[0.01 s]
0.0.Bcustom2: Trace Attempt  5	[0.01 s]
0.0.Tri:    0.00" ---- Launching main thread ----
0.0.Bcustom2: Trace Attempt  1	[0.03 s]
0.0.Bcustom2: Trace Attempt  2	[0.03 s]
0.0.Bcustom2: Trace Attempt  3	[0.03 s]
0.0.Bcustom2: Trace Attempt  4	[0.03 s]
0.0.Bcustom2: Trace Attempt  5	[0.03 s]
0.0.AM: Trace Attempt 764	[180.52 s]
0.0.AM: Stopped processing property "SEVEN.p1"	[181.13 s].
0.0.AM: Morphing to AMcustom3
0.0.Tri:    0.04" ---- Launching abstraction thread ----
0.0.Bcustom2: Trace Attempt  1	[0.07 s]
0.0.Bcustom2: Trace Attempt  2	[0.07 s]
0.0.Bcustom2: Trace Attempt  3	[0.07 s]
0.0.Bcustom2: Trace Attempt  4	[0.07 s]
0.0.Bcustom2: Trace Attempt  5	[0.07 s]
0.0.Tri:    0.05" ---- Launching multi-phase simplification thread ----
0.0.AM: All properties determined. [0.00 s]
0.0.AM: Exited with Success (@ 0.00 s)
0.0.AMcustom3: clocks: 1, declared: 1, looping: 0, posedge: 1, negedge: 0, noedge: 0, bothedge: 0
0.0.AMcustom3: Starting proof for property "SEVEN.p1"	[0.00 s].
0.0.AMcustom3: Trace Attempt  1	[0.00 s]
0.0.AMcustom3: Trace Attempt  2	[0.00 s]
0.0.AMcustom3: Trace Attempt  3	[0.00 s]
0.0.AMcustom3: Trace Attempt  4	[0.00 s]
0.0.AMcustom3: Trace Attempt  5	[0.00 s]
0.0.AMcustom3: Trace Attempt  1	[0.00 s]
0.0.AMcustom3: Trace Attempt  2	[0.00 s]
0.0.AMcustom3: Trace Attempt  3	[0.00 s]
0.0.AMcustom3: Trace Attempt  4	[0.00 s]
0.0.AMcustom3: Trace Attempt  5	[0.00 s]
0.0.AMcustom3: Trace Attempt  1	[0.01 s]
0.0.AMcustom3: Trace Attempt  2	[0.01 s]
0.0.AMcustom3: Trace Attempt  3	[0.01 s]
0.0.AMcustom3: Trace Attempt  4	[0.01 s]
0.0.AMcustom3: Trace Attempt  5	[0.01 s]
0.0.Tri:    0.09" ---- Launching liveness simplification thread ----
0.0.AMcustom3: Trace Attempt  1	[0.03 s]
0.0.AMcustom3: Trace Attempt  2	[0.03 s]
0.0.AMcustom3: Trace Attempt  3	[0.03 s]
0.0.AMcustom3: Trace Attempt  4	[0.03 s]
0.0.AMcustom3: Trace Attempt  5	[0.04 s]
0.0.Hp: Trace Attempt 3701	[181.32 s]
0.0.AMcustom3: Trace Attempt  1	[0.14 s]
0.0.AMcustom3: Trace Attempt  2	[0.14 s]
0.0.AMcustom3: Trace Attempt  3	[0.14 s]
0.0.AMcustom3: Trace Attempt  4	[0.14 s]
0.0.AMcustom3: Trace Attempt  5	[0.14 s]
0.0.AMcustom3: Trace Attempt  1	[0.46 s]
0.0.AMcustom3: Trace Attempt  2	[0.46 s]
0.0.AMcustom3: Trace Attempt  3	[0.46 s]
0.0.AMcustom3: Trace Attempt  4	[0.46 s]
0.0.AMcustom3: Trace Attempt  5	[0.46 s]
0.0.Bcustom2: Trace Attempt  1	[0.66 s]
0.0.Bcustom2: Trace Attempt  2	[0.66 s]
0.0.Bcustom2: Trace Attempt  3	[0.66 s]
0.0.Bcustom2: Trace Attempt  4	[0.66 s]
0.0.Bcustom2: Trace Attempt  5	[0.66 s]
0.0.Tri:    0.88" Simplification phase 1 complete
0.0.Ncustom1: Requesting engine job to terminate
0.0.Bcustom2: Requesting engine job to terminate
0.0.AMcustom3: Requesting engine job to terminate
0.0.Tri: Requesting engine job to terminate
0.0.Hp: Requesting engine job to terminate
0.0.Ht: Requesting engine job to terminate
INFO (IPF144): 0: Initiating shutdown of proof [182.06 s]
0.0.Tri: A proof was found: No trace exists. [0.96 s]
INFO (IPF057): 0.0.Tri: The property "SEVEN.p1" was proven in 0.97 s.
0.0.AMcustom3: Trace Attempt 65	[0.85 s]
0.0.AMcustom3: Stopped processing property "SEVEN.p1"	[0.85 s].
0.0.AMcustom3: All properties determined. [0.85 s]
0.0.AMcustom3: Exited with Success (@ 182.07 s)
0: ProofGrid usable level: 0
0.0.Hp: Trace Attempt 3708	[181.98 s]
0.0.Hp: All properties determined. [182.07 s]
0.0.Ncustom1: Stopped processing property "SEVEN.p1"	[1.06 s].
0.0.Ncustom1: All properties determined. [1.06 s]
0.0.Ht: Trace Attempt 11043	[182.02 s]
0.0.Ht: All properties determined. [182.06 s]
0.0.Ncustom1: Exited with Success (@ 182.10 s)
0.0.Ht: Exited with Success (@ 182.14 s)
0.0.Hp: Exited with Success (@ 182.25 s)
0.0.Tri: Stopped processing property "SEVEN.p1"	[1.16 s].
0.0.Tri: All properties determined. [1.17 s]
0.0.Tri: Exited with Success (@ 182.26 s)
0.0.Bcustom2: Trace Attempt  1	[2.43 s]
0.0.Bcustom2: Stopped processing property "SEVEN.p1"	[2.43 s].
0.0.Bcustom2: All properties determined. [2.43 s]
0.0.Bcustom2: Exited with Success (@ 183.58 s)
0: --------------------------------------------------------------
ProofGrid Summary (utilization 99.97 %)
--------------------------------------------------------------
     engines started                               :    10
     engine jobs started                           :     7

    Average time in state (seconds)
    ------------------------------------------------------
    Engine  Pending     Running        Dead    Utilization
    ------------------------------------------------------
     Hp        0.03      182.06        0.00       99.98 %
     Ht        0.04      182.03        0.00       99.98 %
     Oh        0.03        0.01        0.00       18.65 %
    Ncustom1        0.03      182.02        0.00       99.98 %
    Bcustom2        0.04      181.92        0.00       99.98 %
    AMcustom3        0.04      181.83        0.00       99.98 %
    Tri        0.07        0.97        0.00       93.21 %
    all        0.04      130.12        0.00       99.97 %

    Total time in state (seconds)
    -----------------------------------------
            Pending     Running        Dead  
    -----------------------------------------
               0.29      910.84        0.00

    Data read    : 7.11 MiB
    Data written : 2.86 kiB

0: All pending notifications were processed.
INFO (IPF059): 0: Completed proof on task: "<embedded>"

==============================================================
SUMMARY
==============================================================
           Properties Considered              : 1
                 assertions                   : 1
                  - proven                    : 1 (100%)
                  - bounded_proven (user)     : 0 (0%)
                  - bounded_proven (auto)     : 0 (0%)
                  - marked_proven             : 0 (0%)
                  - cex                       : 0 (0%)
                  - ar_cex                    : 0 (0%)
                  - undetermined              : 0 (0%)
                  - unknown                   : 0 (0%)
                  - error                     : 0 (0%)
                 covers                       : 0
                  - unreachable               : 0
                  - bounded_unreachable (user): 0
                  - covered                   : 0
                  - ar_covered                : 0
                  - undetermined              : 0
                  - unknown                   : 0
                  - error                     : 0
proven
[<embedded>] % exit -force
INFO (IPL005): Received request to exit from the console.
INFO: Waiting for proof threads to stop...
INFO: Proof threads stopped.
INFO (IPL018): The peak resident set memory use for this session was 1.837 GB.
INFO (IPL014): Waiting for the Tcl-thread to exit.
INFO (IPL015): The Tcl-thread exited with status 0.
INFO (IPL016): Exiting the analysis session with status 0.
