# ----------------------------------------
# Jasper Version Info
# tool      : Jasper 2024.06
# platform  : Linux 3.10.0-1160.62.1.el7.x86_64
# version   : 2024.06p002 64 bits
# build date: 2024.09.02 16:28:38 UTC
# ----------------------------------------
# started   : 2025-11-17 19:47:30 IST
# hostname  : vlsi-ria84.vlsidomain
# pid       : 8939
# arguments : '-label' 'session_0' '-console' '//127.0.0.1:34914' '-nowindow' '-style' 'windows' '-exitonerror' '-data' 'AAAAznicY2RgYLCp////PwMYMD6A0Aw2jAyoAMRnQhUJbEChGRhYYZphSliAmItBl6GAoYghnyELyNNh0ANCfSA7HS6aypDMUMJQDBRNAbJzGBIZKhniGQwZDIDqeYC6k4AiJUA1GUC+BIYaPbBcDtg+AGJIFzk=' '-proj' '/users/rompel/jasper_executions/safety_liveness/jgprojects/delay_10/sessionLogs/session_0' '-init' '-hidden' '/users/rompel/jasper_executions/safety_liveness/jgprojects/delay_10/.tmp/.initCmds.tcl' 'delay_10.tcl' '-hidden' '/users/rompel/jasper_executions/safety_liveness/jgprojects/delay_10/.tmp/.postCmds.tcl'

Any disclosure about the Cadence Design Systems software or its use
model to any third party violates the written Non-Disclosure Agreement
between Cadence Design Systems, Inc. and the customer.

THIS SOFTWARE CONTAINS CONFIDENTIAL INFORMATION AND TRADE SECRETS OF
CADENCE DESIGN SYSTEMS, INC. USE, DISCLOSURE, OR REPRODUCTION IS
PROHIBITED WITHOUT THE PRIOR EXPRESS WRITTEN PERMISSION OF CADENCE
DESIGN SYSTEMS, INC.

Copyright (C) 2000-2024 Cadence Design Systems, Inc. All Rights
Reserved.  Unpublished -- rights reserved under the copyright laws of
the United States.

This product includes software developed by others and redistributed
according to license agreement. See doc/third_party_readme.txt for
further details.

RESTRICTED RIGHTS LEGEND

Use, duplication, or disclosure by the Government is subject to
restrictions as set forth in subparagraph (c) (1) (ii) of the Rights in
Technical Data and Computer Software clause at DFARS 252.227-7013 or
subparagraphs (c) (1) and (2) of Commercial Computer Software -- Restricted
Rights at 48 CFR 52.227-19, as applicable.


                          Cadence Design Systems, Inc.
                          2655 Seely Avenue
                          San Jose, CA 95134
                          Phone: 408.943.1234

For technical assistance visit http://support.cadence.com.

Jasper Apps Analysis Session - /users/rompel/jasper_executions/safety_liveness/jgprojects/delay_10/sessionLogs/session_0

WARNING (WG017): [session]: The system's locale is "ANSI_X3.4-1968", which is not UTF-8. Non-ASCII characters might not be handled correctly.
WARNING (WG017): [jg_console]: The system's locale is "ANSI_X3.4-1968", which is not UTF-8. Non-ASCII characters might not be handled correctly.
INFO: successfully checked out license "jasper_fao".
INFO: reading configuration file "/users/rompel/.config/cadence/jasper.conf".
% analyze -sv09 ../delay_10.sv
[-- (VERI-1482)] Analyzing Verilog file '/tools/cadence2425/JASPER/jasper_2024.06p002/lib/verilog/packages/std/std.sv' into library 'std'
[-- (VERI-1482)] Analyzing Verilog file '../delay_10.sv'
% elaborate -bbox_mul 1000000 -bbox_div 1000000 -bbox_mod 1000000 -bbox_a 1000000
[INFO (HIER-8002)] ../delay_10.sv(13): Disabling old hierarchical reference handler
[INFO (VERI-1018)] ../delay_10.sv(1): compiling module 'DELAY'
[WARN (VERI-1209)] ../delay_10.sv(10): expression size 32 truncated to fit in target size 15
INFO (ISW003): Top module name is "DELAY".
INFO (INL208): Elaboration synthesis summary:
  Number of synthesized netlists          1 (0 packages)
  Single run mode                         On
  Pipeline                                On (1 pipelined netlists)
  Late hierarchical reference connection  On
  Number of analyzed Verilog modules      1 (1 synthesized)
  Number of analyzed VHDL entities        0 (0 synthesized)
INFO (INL003): Clearing all state information (assumes, stopats, and so forth).
DELAY
[<embedded>] % reset rst
INFO (IPM031): Clearing proof results of all properties.
INFO (IRS006): Current reset condition is "rst".
[<embedded>] % clock clk
[<embedded>] % prove -all
Ncustom1: Custom engine code is hT3Ng7hPPfiYQOTDZ3qhYOwGAM51eA+J/FjkM5shLioAsqhgLR4Ft+O1BuKG6ilQ83B9tLXSl+CwjiTMAQA
Bcustom2: Custom engine code is hT3Nm7hPr1Vp3Di1Ra2USNIGL4JypRnLKLAdF6JAyuavO2JfGCiY9OZJhcAcOUnLx5xwNdhILGrAWX9s+z2WDkKwNR7tAfClBEjRFVQeq6DU54boFgEA
AMcustom3: Custom engine code is hT3Ng7hP/feYQOTDZ3qhYOwGAM51eA+J/FjkM5shLioAsqhgLR4Ft+O1BuKG6ilQ83B9tLXSmmqwm7g9AQA
Mpcustom4: Custom engine code is hT3NZbhP9fmY2AbBQnsjfOxn6c+6e6yL+/e8fZFmaQrnlgEA
INFO (IPF036): Starting proof on task: "<embedded>", 2 properties to prove with 0 already proven/unreachable
INFO (IRS029): Starting reset analysis: phase 1 of 4.
INFO (IRS030): Running reset analysis: phase 2 of 4.
INFO (IRS031): Running reset analysis: phase 3 of 4.
INFO (IRS020): Starting the reset analysis simulation with a limit of 100 iterations (phase 4 of 4).
INFO (IRS024): Reset iterations 0 to 4 analyzed.
INFO (IRS018): Reset analysis simulation executed for 3 iterations. Assigned values for 15 of 15 design flops, 0 of 0 design latches, 6 of 6 internal elements.
INFO (IRS039): Reset analysis complete.
INFO (IPF031): Settings used for proof thread 0:
    orchestration                 = on
    time_limit                    = 86400s
    per_property_time_limit       = 1s * 10 ^ scan
    engine_mode                   = auto
    proofgrid_per_engine_max_jobs = 1
    max engine jobs               = auto
    proofgrid_mode                = local
    proofgrid_restarts            = 10
AMcustom5: Custom engine code is hT3N1rhP11/52HrFRS21ROp2LOjVTgPvT8L8BGXHgLhaIuqtT4nARFjUqrBL+7pLmaTOzBepZW/Jm8SSrHDybSQtoNiO3y43wk+dEoWlsZizu97Fih6O6lPVG/LpWP5SsUPwlGagLNa1FKEFvwVXyX7//8prySbvSxIHXr5er+z4RAEA
0: Using multistage preprocessing
Ncustom6: Custom engine code is hT3OXrhPByJp3TrFSTLhUmMH4KVtJgmTCnNDF46yMXOKY48m4LS5nE7yBzFjA7kDuwO/GhGUpEPiky3p3wmPn3dJZHxFMsafSoObRzSC+tn7sEY0WbTdZ/FV4hL3MYH/b1CIUvXSWR4wqEoVLsmMOD4xIPT4lI1LO6ZCO7PnnWQuLwetnvKlrXx6wCW/A+x+enqslg1YPobi4wEF/EvbzOvcTYdJvl2s4H2yZg2b2ofAVN5WvhWk1HoBAA
0: Starting reduce
ADcustom7: Custom engine code is hT3Nv7hPv1752HrFRa2kROx2f/ECJeZB2AZsLdlO8VwmIuqtT4nIDFXclhg+O+o+DMmQCekbheGk0kK28laA9gaOFDXsQp29J3X615HY1IPHJWd6FUFvCHjO+p1k652b5JJvZlShNpGlGSXAiQe/mEAj6tEBAA
Tricustom8: Custom engine code is hT3Nu7hPt1752DvFRa0kNDiyIV97VyejwM9C/jCLJjdPvusZONHY42VYUy0Q1ZotnhcVtNc56tJ5wbxv6V2+XpdsaSlHck5vfnbYjdwj1OECy9U+7oSQ0SZE3g5ayD+Phuh4odCJTjeKa2k4elM9ldQfkAEA
Gcustom9: Custom engine code is hT3NibhPDfeYQADBZnYcglOvK9Pfd7EOeniIqP8jNsyIqInncipMGcUXqAadachREE9F2PwhBUZUNw5kHnd4JdXkamORRgEA
C2custom10: Custom engine code is hT3NirhPjfWYQADBZnYcglOvK9Pfd7EOeniIqP8jNsyIqInncgkrYMMXCYbdK0dUjZIF9d4cJ0rHoBDjwVLBKuG86XYVV00BAA
AGcustom11: Custom engine code is hT3NirhP/fmYQADBZnYcglOvK9Pfd7EOeniIqP8jNsyIqInnckcwYMMXCYbdK0dUjZIF9d4cJ0rHoBDjwVLBKuHEZnZByh0BAA
Bcustom12: Custom engine code is hT3NjrhPDfiYQADBZnYcglOvK9PfWxFtenjIyBqfrgr7if/jL/yPOuK1BAflEcW0DxNH2eDIoezN2gxlQFg81RZtiWXh7aiTAidvAQA
Ncustom13: Custom engine code is hT3NR7hPByFp3TrFSTLhUmMH4KWtJglTyV/c51BHEeZWamnJv767nE6PCak26bd3gf3XGN3rIRheufhDieCJQVISo+gNYUKhiUedBKGtsP/a18svAnlMJZudHxDFwK5ufsyoxsIyiAeSY2oi3tEuoDHr5gw42DFKAG3PqO3CEsl8Azzdt3pl5nGA1Ifv2H02eYsFzWb/nfp8PMb3F0krE/EgBcm8TD9Div8BAA
0: Finished reduce in 0s
Tricustom14: Custom engine code is hT3Nu7hP3fiYQADBZnYcglNHp9bfd7EOeniIqP/ji8sGLQu8yhsFO+wxJ+O+R0bU8g/IewXFomyos+viQnWc2xYNYmMqpo3i40O7DaZR7qfp4YqNx26KRvQ/qx0BAA
0.0.PRE: Performing Proof Simplification...
0.0.N: clocks: 1, declared: 1, looping: 0, posedge: 1, negedge: 0, noedge: 0, bothedge: 0
0.0.N: Proof Simplification Iteration 1	[0.00 s]
0.0.PRE: A trace with 1 cycles was found. [0.00 s]
INFO (IPF047): 0.0.PRE: The cover property "DELAY.p1:precondition1" was covered in 1 cycles in 0.00 s.
0.0.N: Proof Simplification Iteration 2	[0.06 s]
0.0.PRE: A proof was found: No trace exists. [0.00 s]
INFO (IPF057): 0.0.PRE: The property ":noDeadEnd" was proven in 0.00 s.
    Use check_assumptions -show -dead_end to show this property in the property table.
0.0.PRE: A proof was found: No trace exists. [0.00 s]
INFO (IPF057): 0.0.PRE: The property ":noConflict" was proven in 0.00 s.
    Use check_assumptions -show to show this property in the property table.
INFO (IPF047): 0.0.PRE: The cover property ":live" was covered in 1 cycles in 0.00 s.
    Use check_assumptions -show -live to show this property in the property table.
0.0.PRE: Proof Simplification completed in 0.06 s
0: About to start ProofGrid in its own thread with a limit of 10000 pending notifications and a limit of 10 traces.
0: =============================== ProofGrid start ===============================
0: ProofGrid usable level: 1
0: Initial ProofGrid level: 1
0: ProofGrid is starting event handling
0.0.Hp: Proofgrid shell started at 9006@vlsi-ria84(local) jg_8939_vlsi-ria84_1
0.0.N: Proofgrid shell started at 9005@vlsi-ria84(local) jg_8939_vlsi-ria84_1
0.0.Hp: clocks: 1, declared: 1, looping: 0, posedge: 1, negedge: 0, noedge: 0, bothedge: 0
0.0.Hp: Last scan. Per property time limit: 0s
0.0.Hp: Trace Attempt  1	[0.00 s]
0.0.N: clocks: 1, declared: 1, looping: 0, posedge: 1, negedge: 0, noedge: 0, bothedge: 0
0.0.N: Last scan. Per property time limit: 0s
0.0.N: Starting proof for property "DELAY.p1"	[0.00 s].
0.0.Hp: Trace Attempt  2	[0.00 s]
0.0.Hp: Trace Attempt  3	[0.00 s]
0.0.Hp: Trace Attempt  4	[0.00 s]
0.0.Hp: Trace Attempt  5	[0.00 s]
0.0.N: Trace Attempt  1	[0.00 s]
0.0.N: Trace Attempt  2	[0.00 s]
0.0.N: Trace Attempt  2	[0.00 s]
0.0.N: Trace Attempt  3	[0.00 s]
0.0.N: Trace Attempt  4	[0.00 s]
0.0.N: Trace Attempt  4	[0.00 s]
0.0.N: Trace Attempt  5	[0.00 s]
0.0.N: Trace Attempt  1	[0.01 s]
0.0.N: Trace Attempt  2	[0.01 s]
0.0.N: Trace Attempt  3	[0.01 s]
0.0.N: Trace Attempt  4	[0.01 s]
0.0.N: Trace Attempt  5	[0.01 s]
0.0.B: Proofgrid shell started at 9042@vlsi-ria84(local) jg_8939_vlsi-ria84_1
0.0.Ht: Proofgrid shell started at 9037@vlsi-ria84(local) jg_8939_vlsi-ria84_1
0.0.Ht: clocks: 1, declared: 1, looping: 0, posedge: 1, negedge: 0, noedge: 0, bothedge: 0
0.0.Ht: Last scan. Per property time limit: 0s
0.0.Ht: Trace Attempt  1	[0.00 s]
0.0.Ht: Trace Attempt  2	[0.00 s]
0.0.Ht: Trace Attempt  3	[0.00 s]
0.0.Ht: Trace Attempt  4	[0.00 s]
0.0.Ht: Trace Attempt  5	[0.00 s]
0.0.Bm: Proofgrid shell started at 9038@vlsi-ria84(local) jg_8939_vlsi-ria84_1
0.0.B: clocks: 1, declared: 1, looping: 0, posedge: 1, negedge: 0, noedge: 0, bothedge: 0
0.0.B: Last scan. Per property time limit: 0s
0.0.B: Starting proof for property "DELAY.p1"	[0.00 s].
0.0.B: Trace Attempt  1	[0.00 s]
0.0.B: Trace Attempt  2	[0.00 s]
0.0.B: Trace Attempt  3	[0.00 s]
0.0.B: Trace Attempt  4	[0.00 s]
0.0.B: Trace Attempt  5	[0.00 s]
0.0.AM: Proofgrid shell started at 9043@vlsi-ria84(local) jg_8939_vlsi-ria84_1
0.0.AM: clocks: 1, declared: 1, looping: 0, posedge: 1, negedge: 0, noedge: 0, bothedge: 0
0.0.AM: Last scan. Per property time limit: 0s
0.0.AM: Starting proof for property "DELAY.p1"	[0.00 s].
0.0.AM: Trace Attempt  1	[0.00 s]
0.0.AM: Trace Attempt  2	[0.00 s]
0.0.AM: Trace Attempt  3	[0.00 s]
0.0.Bm: clocks: 1, declared: 1, looping: 0, posedge: 1, negedge: 0, noedge: 0, bothedge: 0
0.0.Bm: Ignoring liveness properties
0.0.Bm: Last scan. Per property time limit: 0s
0.0.AM: Trace Attempt  4	[0.00 s]
0.0.Bm: Trace Attempt  1	[0.00 s]
0.0.Bm: Trace Attempt  2	[0.00 s]
0.0.AM: Trace Attempt  5	[0.00 s]
0.0.Bm: Trace Attempt  3	[0.00 s]
0.0.AM: Trace Attempt  1	[0.00 s]
0.0.Bm: Trace Attempt  4	[0.00 s]
0.0.Bm: Trace Attempt  5	[0.00 s]
0.0.Oh: Proofgrid shell started at 9040@vlsi-ria84(local) jg_8939_vlsi-ria84_1
0.0.AM: Trace Attempt  2	[0.00 s]
0.0.AM: Trace Attempt  3	[0.00 s]
0.0.AM: Trace Attempt  4	[0.00 s]
0.0.AM: Trace Attempt  5	[0.00 s]
0.0.AM: Trace Attempt  1	[0.01 s]
0.0.AM: Trace Attempt  2	[0.01 s]
0.0.AM: Trace Attempt  3	[0.01 s]
0.0.AM: Trace Attempt  4	[0.01 s]
0.0.L: Proofgrid shell started at 9041@vlsi-ria84(local) jg_8939_vlsi-ria84_1
0.0.Oh: clocks: 1, declared: 1, looping: 0, posedge: 1, negedge: 0, noedge: 0, bothedge: 0
0.0.Oh: Reached length limit (2147483647) [0.00 s]
0.0.AM: Trace Attempt  5	[0.01 s]
0.0.Oh: Exited with Success (@ 0.06 s)
0.0.L: clocks: 1, declared: 1, looping: 0, posedge: 1, negedge: 0, noedge: 0, bothedge: 0
0.0.L: Using trace diversification with seed 1 (0.05)
0.0.L: Using LRU state removal heuristic
0.0.L: Ignoring liveness properties
0.0.L: All properties either determined or skipped. [0.00 s]
0.0.L: Exited with Success (@ 0.07 s)
0.0.L: Completed, Restart ignored.
0.0.AM: Trace Attempt  1	[0.03 s]
0.0.AM: Trace Attempt  2	[0.03 s]
0.0.AM: Trace Attempt  3	[0.03 s]
0.0.AM: Trace Attempt  4	[0.03 s]
0.0.AM: Trace Attempt  5	[0.03 s]
0.0.Mpcustom4: Proofgrid shell started at 9039@vlsi-ria84(local) jg_8939_vlsi-ria84_1
0.0.Mpcustom4: clocks: 1, declared: 1, looping: 0, posedge: 1, negedge: 0, noedge: 0, bothedge: 0
0.0.Mpcustom4: Ignoring liveness properties
0.0.Mpcustom4: All properties either determined or skipped. [0.00 s]
0.0.Mpcustom4: Exited with Success (@ 0.08 s)
0.0.Mpcustom4: Completed, Restart ignored.
0.0.N: Trace Attempt  1	[0.10 s]
0.0.N: Trace Attempt  2	[0.10 s]
0.0.N: Trace Attempt  3	[0.10 s]
0.0.N: Trace Attempt  4	[0.10 s]
0.0.N: Trace Attempt  5	[0.10 s]
0.0.AM: Trace Attempt  1	[0.11 s]
0.0.AM: Trace Attempt  2	[0.11 s]
0.0.AM: Trace Attempt  3	[0.11 s]
0.0.AM: Trace Attempt  4	[0.11 s]
0.0.AM: Trace Attempt  5	[0.12 s]
0.0.N: Trace Attempt  1	[0.44 s]
0.0.N: Trace Attempt  2	[0.44 s]
0.0.N: Trace Attempt  3	[0.44 s]
0.0.N: Trace Attempt  4	[0.44 s]
0.0.N: Trace Attempt  5	[0.45 s]
0.0.AM: Trace Attempt  1	[0.46 s]
0.0.AM: Trace Attempt  2	[0.46 s]
0.0.AM: Trace Attempt  3	[0.46 s]
0.0.AM: Trace Attempt  4	[0.46 s]
0.0.AM: Trace Attempt  5	[0.47 s]
0.0.AM: Trace Attempt  1	[1.57 s]
0.0.AM: Trace Attempt  2	[1.57 s]
0.0.AM: Trace Attempt  3	[1.57 s]
0.0.AM: Trace Attempt  4	[1.57 s]
0.0.AM: Trace Attempt  5	[1.57 s]
0.0.N: Trace Attempt  1	[1.75 s]
0.0.N: Trace Attempt  2	[1.75 s]
0.0.N: Trace Attempt  3	[1.75 s]
0.0.N: Trace Attempt  4	[1.75 s]
0.0.N: Trace Attempt  5	[1.75 s]
0.0.N: Trace Attempt  1	[3.05 s]
0.0.N: Trace Attempt  2	[3.05 s]
0.0.N: Trace Attempt  3	[3.05 s]
0.0.N: Trace Attempt  4	[3.05 s]
0.0.N: Trace Attempt  5	[3.05 s]
0.0.Hp: Trace Attempt 608	[4.01 s]
0.0.B: Trace Attempt 1686	[4.00 s]
0.0.Ht: Trace Attempt 1817	[4.00 s]
0.0.Bm: Trace Attempt 1680	[4.00 s]
0.0.N: Trace Attempt  1	[4.44 s]
0.0.N: Trace Attempt  2	[4.44 s]
0.0.N: Trace Attempt  3	[4.44 s]
0.0.N: Trace Attempt  4	[4.45 s]
0.0.N: Trace Attempt  5	[4.45 s]
0.0.AM: Trace Attempt 187	[5.57 s]
0.0.Hp: Trace Attempt 855	[8.01 s]
0.0.B: Trace Attempt 2345	[8.00 s]
0.0.Ht: Trace Attempt 2484	[8.00 s]
0.0.Bm: Trace Attempt 2340	[8.01 s]
0.0.N: Trace Attempt 186	[8.49 s]
0.0.AM: Trace Attempt  1	[8.98 s]
0.0.AM: Trace Attempt  2	[8.98 s]
0.0.AM: Trace Attempt  3	[8.98 s]
0.0.AM: Trace Attempt  4	[8.98 s]
0.0.AM: Trace Attempt  5	[8.98 s]
0.0.N: Trace Attempt  1	[11.04 s]
0.0.N: Trace Attempt  2	[11.04 s]
0.0.N: Trace Attempt  3	[11.04 s]
0.0.N: Trace Attempt  4	[11.04 s]
0.0.N: Trace Attempt  5	[11.04 s]
0.0.Hp: Trace Attempt 1038	[12.02 s]
0.0.Ht: Trace Attempt 2973	[12.01 s]
0.0.B: Trace Attempt 2833	[12.01 s]
0.0.Bm: Trace Attempt 2832	[12.01 s]
0.0.AM: Trace Attempt 193	[13.00 s]
0.0.N: Trace Attempt 181	[15.07 s]
0.0.Ht: Trace Attempt 3398	[16.01 s]
0.0.Hp: Trace Attempt 1197	[16.04 s]
0.0.B: Trace Attempt 3255	[16.01 s]
0.0.Bm: Trace Attempt 3254	[16.02 s]
0.0.AM: Trace Attempt 257	[17.01 s]
0.0.N: Trace Attempt  1	[17.77 s]
0.0.N: Trace Attempt  2	[17.77 s]
0.0.N: Trace Attempt  3	[17.77 s]
0.0.N: Trace Attempt  4	[17.77 s]
0.0.N: Trace Attempt  5	[17.77 s]
0.0.Ht: Trace Attempt 3774	[20.01 s]
0.0.B: Trace Attempt 3617	[20.02 s]
0.0.Bm: Trace Attempt 3614	[20.02 s]
0.0.Hp: Trace Attempt 1336	[20.06 s]
0.0.AM: Trace Attempt 312	[21.06 s]
0.0.N: Trace Attempt 181	[21.79 s]
0.0.Ht: Trace Attempt 4113	[24.02 s]
0.0.B: Trace Attempt 3951	[24.03 s]
0.0.Hp: Trace Attempt 1462	[24.07 s]
0.0.Bm: Trace Attempt 3947	[24.03 s]
0.0.N: Trace Attempt  1	[24.30 s]
0.0.N: Trace Attempt  2	[24.31 s]
0.0.N: Trace Attempt  3	[24.31 s]
0.0.N: Trace Attempt  4	[24.31 s]
0.0.N: Trace Attempt  5	[24.31 s]
0.0.AM: Trace Attempt 355	[25.07 s]
0.0.Ht: Trace Attempt 4425	[28.03 s]
0.0.B: Trace Attempt 4260	[28.04 s]
0.0.Bm: Trace Attempt 4255	[28.04 s]
0.0.Hp: Trace Attempt 1577	[28.09 s]
0.0.N: Trace Attempt 181	[28.33 s]
0.0.AM: Trace Attempt 394	[29.09 s]
0.0.N: Trace Attempt  1	[30.88 s]
0.0.N: Trace Attempt  2	[30.88 s]
0.0.N: Trace Attempt  3	[30.88 s]
0.0.N: Trace Attempt  4	[30.88 s]
0.0.N: Trace Attempt  5	[30.88 s]
0.0.Ht: Trace Attempt 4712	[32.03 s]
0.0.Bm: Trace Attempt 4537	[32.04 s]
0.0.B: Trace Attempt 4544	[32.05 s]
0.0.Hp: Trace Attempt 1684	[32.12 s]
0.0.AM: Trace Attempt 438	[33.12 s]
0.0.N: Trace Attempt 181	[34.89 s]
0.0.Ht: Trace Attempt 4986	[36.04 s]
0.0.Bm: Trace Attempt 4801	[36.05 s]
0.0.B: Trace Attempt 4809	[36.06 s]
0.0.Hp: Trace Attempt 1783	[36.14 s]
0.0.AM: Trace Attempt 377	[37.13 s]
0.0.N: Trace Attempt  1	[37.46 s]
0.0.N: Trace Attempt  2	[37.46 s]
0.0.N: Trace Attempt  3	[37.46 s]
0.0.N: Trace Attempt  4	[37.46 s]
0.0.N: Trace Attempt  5	[37.46 s]
0.0.Ht: Trace Attempt 5227	[40.04 s]
0.0.Bm: Trace Attempt 5025	[40.05 s]
0.0.B: Trace Attempt 5034	[40.07 s]
0.0.Hp: Trace Attempt 1870	[40.16 s]
0.0.N: Trace Attempt 181	[41.49 s]
0.0.AM: Trace Attempt 513	[42.30 s]
0.0.AM: Trace Attempt  1	[42.73 s]
0.0.AM: Trace Attempt  2	[42.73 s]
0.0.AM: Trace Attempt  3	[42.73 s]
0.0.AM: Trace Attempt  4	[42.73 s]
0.0.AM: Trace Attempt  5	[42.73 s]
0.0.N: Trace Attempt  1	[44.02 s]
0.0.N: Trace Attempt  2	[44.02 s]
0.0.N: Trace Attempt  3	[44.02 s]
0.0.N: Trace Attempt  4	[44.02 s]
0.0.N: Trace Attempt  5	[44.02 s]
0.0.Ht: Trace Attempt 5469	[44.05 s]
0.0.Bm: Trace Attempt 5247	[44.06 s]
0.0.B: Trace Attempt 5256	[44.08 s]
0.0.Hp: Trace Attempt 1957	[44.20 s]
0.0.AM: Trace Attempt 243	[46.79 s]
0.0.N: Trace Attempt 180	[48.02 s]
0.0.Ht: Trace Attempt 5716	[48.05 s]
0.0.B: Trace Attempt 5483	[48.08 s]
0.0.Bm: Trace Attempt 5475	[48.08 s]
0.0.Hp: Trace Attempt 2044	[48.23 s]
0.0.N: Trace Attempt  1	[50.63 s]
0.0.N: Trace Attempt  2	[50.63 s]
0.0.N: Trace Attempt  3	[50.63 s]
0.0.N: Trace Attempt  4	[50.63 s]
0.0.N: Trace Attempt  5	[50.63 s]
0.0.AM: Trace Attempt 341	[50.82 s]
0.0.Ht: Trace Attempt 5950	[52.06 s]
0.0.B: Trace Attempt 5698	[52.08 s]
0.0.Bm: Trace Attempt 5690	[52.08 s]
0.0.Hp: Trace Attempt 2125	[52.24 s]
0.0.N: Trace Attempt 181	[54.64 s]
0.0.AM: Trace Attempt 430	[55.07 s]
0.0.Ht: Trace Attempt 6174	[56.08 s]
0.0.B: Trace Attempt 5910	[56.09 s]
0.0.Bm: Trace Attempt 5902	[56.09 s]
0.0.Hp: Trace Attempt 2205	[56.26 s]
0.0.N: Trace Attempt  1	[57.53 s]
0.0.N: Trace Attempt  2	[57.53 s]
0.0.N: Trace Attempt  3	[57.53 s]
0.0.N: Trace Attempt  4	[57.54 s]
0.0.N: Trace Attempt  5	[57.54 s]
0.0.AM: Trace Attempt 455	[59.09 s]
0.0.Ht: Trace Attempt 6379	[60.08 s]
0.0.B: Trace Attempt 6111	[60.09 s]
0.0.Bm: Trace Attempt 6103	[60.10 s]
0.0.Hp: Trace Attempt 2281	[60.26 s]
0.0.N: Trace Attempt 189	[61.55 s]
0.0.AM: Trace Attempt 484	[63.10 s]
0.0.Ht: Trace Attempt 6580	[64.09 s]
0.0.B: Trace Attempt 6305	[64.10 s]
0.0.Bm: Trace Attempt 6296	[64.11 s]
0.0.Hp: Trace Attempt 2355	[64.31 s]
0.0.N: Trace Attempt 250	[65.58 s]
0.0.AM: Trace Attempt 520	[67.19 s]
0.0.Ht: Trace Attempt 6768	[68.10 s]
0.0.B: Trace Attempt 6491	[68.10 s]
0.0.Bm: Trace Attempt 6480	[68.11 s]
0.0.Hp: Trace Attempt 2426	[68.32 s]
0.0.N: Trace Attempt 280	[69.70 s]
0.0.AM: Trace Attempt 553	[71.25 s]
0.0.Ht: Trace Attempt 6956	[72.10 s]
0.0.B: Trace Attempt 6671	[72.12 s]
0.0.Bm: Trace Attempt 6658	[72.12 s]
0.0.Hp: Trace Attempt 2495	[72.36 s]
0.0.N: Trace Attempt 319	[73.80 s]
0.0.AM: Trace Attempt 583	[75.30 s]
0.0.Ht: Trace Attempt 7143	[76.12 s]
0.0.B: Trace Attempt 6844	[76.13 s]
0.0.Bm: Trace Attempt 6829	[76.14 s]
0.0.Hp: Trace Attempt 2562	[76.39 s]
0.0.N: Trace Attempt 353	[77.81 s]
0.0.AM: Trace Attempt 612	[79.37 s]
0.0.Ht: Trace Attempt 7319	[80.12 s]
0.0.B: Trace Attempt 7010	[80.14 s]
0.0.Bm: Trace Attempt 6994	[80.15 s]
0.0.Hp: Trace Attempt 2625	[80.42 s]
0.0.N: Trace Attempt 392	[81.88 s]
0.0.AM: Trace Attempt 640	[83.41 s]
0.0.Ht: Trace Attempt 7489	[84.14 s]
0.0.B: Trace Attempt 7171	[84.16 s]
0.0.Bm: Trace Attempt 7153	[84.17 s]
0.0.Hp: Trace Attempt 2688	[84.48 s]
0.0.N: Trace Attempt 430	[85.94 s]
0.0.AM: Trace Attempt 668	[87.58 s]
0.0.Ht: Trace Attempt 7661	[88.15 s]
0.0.B: Trace Attempt 7325	[88.18 s]
0.0.Bm: Trace Attempt 7306	[88.19 s]
0.0.Hp: Trace Attempt 2748	[88.50 s]
0.0.N: Trace Attempt 459	[90.14 s]
0.0.AM: Trace Attempt 692	[91.75 s]
0.0.Ht: Trace Attempt 7818	[92.17 s]
0.0.B: Trace Attempt 7475	[92.18 s]
0.0.Bm: Trace Attempt 7455	[92.20 s]
0.0.N: Trace Attempt  1	[92.41 s]
0.0.N: Trace Attempt  2	[92.41 s]
0.0.N: Trace Attempt  3	[92.41 s]
0.0.N: Trace Attempt  4	[92.42 s]
0.0.N: Trace Attempt  5	[92.42 s]
0.0.Hp: Trace Attempt 2806	[92.50 s]
0.0.AM: Trace Attempt 713	[95.83 s]
0.0.Ht: Trace Attempt 7981	[96.19 s]
0.0.B: Trace Attempt 7631	[96.20 s]
0.0.Bm: Trace Attempt 7609	[96.21 s]
0.0.N: Trace Attempt 189	[96.43 s]
0.0.Hp: Trace Attempt 2865	[96.56 s]
0.0.AM: Trace Attempt 739	[99.89 s]
0.0.Ht: Trace Attempt 8142	[100.21 s]
0.0.B: Trace Attempt 7781	[100.22 s]
0.0.Bm: Trace Attempt 7758	[100.22 s]
0.0.N: Trace Attempt 250	[100.45 s]
0.0.Hp: Trace Attempt 2923	[100.64 s]
0.0.AM: Trace Attempt 764	[103.91 s]
0.0.Ht: Trace Attempt 8288	[104.22 s]
0.0.B: Trace Attempt 7927	[104.23 s]
0.0.Bm: Trace Attempt 7903	[104.24 s]
0.0.N: Trace Attempt 280	[104.54 s]
0.0.Hp: Trace Attempt 2979	[104.65 s]
0.0.AM: Trace Attempt 789	[108.05 s]
0.0.Ht: Trace Attempt 8447	[108.23 s]
0.0.B: Trace Attempt 8070	[108.25 s]
0.0.Bm: Trace Attempt 8045	[108.26 s]
0.0.N: Trace Attempt 319	[108.63 s]
0.0.Hp: Trace Attempt 3034	[108.69 s]
0.0.AM: Trace Attempt 813	[112.11 s]
0.0.Ht: Trace Attempt 8591	[112.23 s]
0.0.B: Trace Attempt 8210	[112.26 s]
0.0.Bm: Trace Attempt 8184	[112.28 s]
0.0.N: Trace Attempt 353	[112.64 s]
0.0.Hp: Trace Attempt 3088	[112.76 s]
0.0.AM: Trace Attempt 836	[116.14 s]
0.0.Ht: Trace Attempt 8735	[116.26 s]
0.0.B: Trace Attempt 8353	[116.28 s]
0.0.Bm: Trace Attempt 8326	[116.29 s]
0.0.N: Trace Attempt 392	[116.72 s]
0.0.Hp: Trace Attempt 3140	[116.79 s]
0.0.AM: Trace Attempt 857	[120.17 s]
0.0.Ht: Trace Attempt 8873	[120.27 s]
0.0.B: Trace Attempt 8491	[120.30 s]
0.0.Bm: Trace Attempt 8464	[120.32 s]
0.0.N: Trace Attempt 429	[120.79 s]
0.0.Hp: Trace Attempt 3191	[120.79 s]
0.0.AM: Trace Attempt 879	[124.20 s]
0.0.Ht: Trace Attempt 9009	[124.30 s]
0.0.B: Trace Attempt 8624	[124.32 s]
0.0.Bm: Trace Attempt 8597	[124.34 s]
0.0.N: Trace Attempt 458	[124.79 s]
0.0.Hp: Trace Attempt 3241	[124.85 s]
0.0.N: Trace Attempt  1	[126.39 s]
0.0.N: Trace Attempt  2	[126.39 s]
0.0.N: Trace Attempt  3	[126.39 s]
0.0.N: Trace Attempt  4	[126.39 s]
0.0.N: Trace Attempt  5	[126.39 s]
0.0.Ht: Trace Attempt 9146	[128.31 s]
0.0.AM: Trace Attempt 901	[128.31 s]
0.0.B: Trace Attempt 8754	[128.32 s]
0.0.Bm: Trace Attempt 8726	[128.35 s]
0.0.Hp: Trace Attempt 3290	[128.88 s]
0.0.N: Trace Attempt 190	[130.41 s]
0.0.B: Trace Attempt 8886	[132.32 s]
0.0.Ht: Trace Attempt 9281	[132.32 s]
0.0.AM: Trace Attempt 924	[132.36 s]
0.0.Bm: Trace Attempt 8857	[132.37 s]
0.0.Hp: Trace Attempt 3339	[132.91 s]
0.0.N: Trace Attempt 251	[134.56 s]
0.0.B: Trace Attempt 9015	[136.34 s]
0.0.Ht: Trace Attempt 9421	[136.35 s]
0.0.AM: Trace Attempt 942	[136.38 s]
0.0.Bm: Trace Attempt 8985	[136.39 s]
0.0.Hp: Trace Attempt 3387	[136.99 s]
0.0.N: Trace Attempt 281	[138.79 s]
0.0.B: Trace Attempt 9134	[140.37 s]
0.0.Ht: Trace Attempt 9545	[140.37 s]
0.0.AM: Trace Attempt 570	[140.39 s]
0.0.Bm: Trace Attempt 9102	[140.40 s]
0.0.Hp: Trace Attempt 3432	[140.99 s]
0.0.N: Trace Attempt 322	[142.82 s]
0.0.Ht: Trace Attempt 9673	[144.38 s]
0.0.B: Trace Attempt 9250	[144.39 s]
0.0.AM: Trace Attempt 734	[144.40 s]
0.0.Bm: Trace Attempt 9217	[144.43 s]
0.0.Hp: Trace Attempt 3476	[144.99 s]
0.0.N: Trace Attempt 355	[146.86 s]
0.0.Ht: Trace Attempt 9794	[148.40 s]
0.0.B: Trace Attempt 9368	[148.40 s]
0.0.Bm: Trace Attempt 9334	[148.46 s]
0.0.Hp: Trace Attempt 3521	[149.06 s]
0.0.AM: Trace Attempt 784	[149.03 s]
0.0.N: Trace Attempt 392	[150.88 s]
0.0.B: Trace Attempt 9482	[152.41 s]
0.0.Ht: Trace Attempt 9917	[152.42 s]
0.0.Bm: Trace Attempt 9446	[152.46 s]
0.0.Hp: Trace Attempt 3564	[153.09 s]
0.0.AM: Trace Attempt 916	[153.06 s]
0.0.N: Trace Attempt 427	[154.88 s]
0.0.B: Trace Attempt 9594	[156.42 s]
0.0.Ht: Trace Attempt 10034	[156.45 s]
0.0.Bm: Trace Attempt 9559	[156.49 s]
0.0.AM: Trace Attempt  1	[156.98 s]
0.0.AM: Trace Attempt  2	[156.98 s]
0.0.AM: Trace Attempt  3	[156.98 s]
0.0.AM: Trace Attempt  4	[156.99 s]
0.0.AM: Trace Attempt  5	[156.99 s]
0.0.Hp: Trace Attempt 3607	[157.16 s]
0.0.N: Trace Attempt 457	[158.99 s]
0.0.B: Trace Attempt 9712	[160.42 s]
0.0.Ht: Trace Attempt 10159	[160.46 s]
0.0.Bm: Trace Attempt 9678	[160.51 s]
0.0.AM: Trace Attempt 247	[161.04 s]
0.0.Hp: Trace Attempt 3651	[161.20 s]
0.0.N: Trace Attempt  1	[161.35 s]
0.0.N: Trace Attempt  2	[161.35 s]
0.0.N: Trace Attempt  3	[161.35 s]
0.0.N: Trace Attempt  4	[161.35 s]
0.0.N: Trace Attempt  5	[161.35 s]
0.0.B: Trace Attempt 9836	[164.44 s]
0.0.Ht: Trace Attempt 10281	[164.48 s]
0.0.Bm: Trace Attempt 9803	[164.53 s]
0.0.AM: Trace Attempt 342	[165.07 s]
0.0.Hp: Trace Attempt 3697	[165.23 s]
0.0.N: Trace Attempt 190	[165.38 s]
0.0.B: Trace Attempt 9959	[168.46 s]
0.0.Ht: Trace Attempt 10404	[168.50 s]
0.0.Bm: Trace Attempt 9926	[168.54 s]
0.0.AM: Trace Attempt 433	[169.11 s]
0.0.Hp: Trace Attempt 3742	[169.27 s]
0.0.N: Trace Attempt 251	[169.53 s]
0.0.B: Trace Attempt 10078	[172.47 s]
0.0.Ht: Trace Attempt 10525	[172.52 s]
0.0.Bm: Trace Attempt 10046	[172.55 s]
0.0.AM: Trace Attempt 467	[173.20 s]
0.0.Hp: Trace Attempt 3786	[173.33 s]
0.0.N: Trace Attempt 281	[173.75 s]
0.0.B: Trace Attempt 10197	[176.50 s]
0.0.Ht: Trace Attempt 10645	[176.53 s]
0.0.Bm: Trace Attempt 10165	[176.58 s]
0.0.AM: Trace Attempt 500	[177.20 s]
0.0.Hp: Trace Attempt 3830	[177.38 s]
0.0.N: Trace Attempt 323	[177.85 s]
0.0.B: Trace Attempt 10312	[180.51 s]
0.0.Ht: Trace Attempt 10764	[180.54 s]
0.0.Bm: Trace Attempt 10282	[180.61 s]
0.0.N: Trace Attempt 348	[180.91 s]
0.0.N: Stopped processing property "DELAY.p1"	[180.98 s].
0.0.N: Morphing to Ncustom1
0.0.N: All properties determined. [0.00 s]
0.0.N: Exited with Success (@ 0.00 s)
0.0.Ncustom1: clocks: 1, declared: 1, looping: 0, posedge: 1, negedge: 0, noedge: 0, bothedge: 0
0.0.Ncustom1: Starting proof for property "DELAY.p1"	[0.00 s].
0.0.AM: Trace Attempt 535	[180.76 s]
0.0.AM: Stopped processing property "DELAY.p1"	[180.96 s].
0.0.AM: Morphing to AMcustom3
0.0.AM: All properties determined. [0.00 s]
0.0.AM: Exited with Success (@ 0.00 s)
0.0.AMcustom3: clocks: 1, declared: 1, looping: 0, posedge: 1, negedge: 0, noedge: 0, bothedge: 0
0.0.AMcustom3: Starting proof for property "DELAY.p1"	[0.00 s].
0.0.AMcustom3: Trace Attempt  1	[0.00 s]
0.0.AMcustom3: Trace Attempt  2	[0.00 s]
0.0.AMcustom3: Trace Attempt  3	[0.00 s]
0.0.AMcustom3: Trace Attempt  4	[0.00 s]
0.0.AMcustom3: Trace Attempt  5	[0.00 s]
0.0.AMcustom3: Trace Attempt  1	[0.00 s]
0.0.AMcustom3: Trace Attempt  2	[0.00 s]
0.0.AMcustom3: Trace Attempt  3	[0.00 s]
0.0.AMcustom3: Trace Attempt  4	[0.00 s]
0.0.AMcustom3: Trace Attempt  5	[0.00 s]
0.0.Ncustom1: Trace Attempt 461	[0.04 s]
0.0.AMcustom3: Trace Attempt  1	[0.01 s]
0.0.AMcustom3: Trace Attempt  2	[0.01 s]
0.0.AMcustom3: Trace Attempt  3	[0.01 s]
0.0.AMcustom3: Trace Attempt  4	[0.01 s]
0.0.AMcustom3: Trace Attempt  5	[0.01 s]
0.0.Tri: Proofgrid shell started at 9433@vlsi-ria84(local) jg_8939_vlsi-ria84_1
0.0.Tri: clocks: 1, declared: 1, looping: 0, posedge: 1, negedge: 0, noedge: 0, bothedge: 0
0.0.Tri: Last scan. Per property time limit: 0s
0.0.Tri: Starting proof for property "DELAY.p1"	[0.00 s].
0.0.Tri: Trace Attempt  1	[0.00 s]
0.0.D: Proofgrid shell started at 9444@vlsi-ria84(local) jg_8939_vlsi-ria84_1
0.0.AMcustom3: Trace Attempt  1	[0.04 s]
0.0.AMcustom3: Trace Attempt  2	[0.04 s]
0.0.AMcustom3: Trace Attempt  3	[0.04 s]
0.0.AMcustom3: Trace Attempt  4	[0.04 s]
0.0.AMcustom3: Trace Attempt  5	[0.04 s]
0.0.D: clocks: 1, declared: 1, looping: 0, posedge: 1, negedge: 0, noedge: 0, bothedge: 0
0.0.D: Last scan. Per property time limit: 0s
0.0.D: Starting proof for property "DELAY.p1"	[0.00 s].
0.0.D: Trace Attempt  1	[0.00 s]
0.0.D: Trace Attempt  2	[0.00 s]
0.0.D: Trace Attempt  4	[0.00 s]
0.0.B: Trace Attempt 10323	[180.91 s]
0.0.B: Stopped processing property "DELAY.p1"	[181.05 s].
0.0.B: Morphing to Bcustom2
0.0.B: All properties determined. [0.00 s]
0.0.B: Exited with Success (@ 0.00 s)
0.0.Bcustom2: clocks: 1, declared: 1, looping: 0, posedge: 1, negedge: 0, noedge: 0, bothedge: 0
0.0.Bcustom2: Starting proof for property "DELAY.p1"	[0.00 s].
0.0.Bcustom2: Trace Attempt  1	[0.00 s]
0.0.Bcustom2: Trace Attempt  2	[0.00 s]
0.0.Bcustom2: Trace Attempt  1	[0.00 s]
0.0.Bcustom2: Trace Attempt  2	[0.00 s]
0.0.Bcustom2: Trace Attempt  3	[0.00 s]
0.0.Bcustom2: Trace Attempt  4	[0.00 s]
0.0.Bcustom2: Trace Attempt  5	[0.00 s]
0.0.Bcustom2: Trace Attempt  1	[0.00 s]
0.0.Bcustom2: Trace Attempt  2	[0.00 s]
0.0.Bcustom2: Trace Attempt  3	[0.00 s]
0.0.Bcustom2: Trace Attempt  4	[0.00 s]
0.0.Bcustom2: Trace Attempt  5	[0.00 s]
0.0.Bcustom2: Trace Attempt  1	[0.00 s]
0.0.Bcustom2: Trace Attempt  2	[0.00 s]
0.0.Bcustom2: Trace Attempt  3	[0.00 s]
0.0.Bcustom2: Trace Attempt  4	[0.00 s]
0.0.Bcustom2: Trace Attempt  5	[0.00 s]
0.0.Tri:    0.00" ---- Launching main thread ----
0.0.Bcustom2: Trace Attempt  1	[0.01 s]
0.0.Bcustom2: Trace Attempt  2	[0.01 s]
0.0.Bcustom2: Trace Attempt  3	[0.01 s]
0.0.Bcustom2: Trace Attempt  4	[0.01 s]
0.0.Bcustom2: Trace Attempt  5	[0.01 s]
0.0.Bcustom2: Trace Attempt  1	[0.02 s]
0.0.Bcustom2: Trace Attempt  2	[0.02 s]
0.0.Bcustom2: Trace Attempt  3	[0.02 s]
0.0.Bcustom2: Trace Attempt  4	[0.02 s]
0.0.Bcustom2: Trace Attempt  5	[0.02 s]
0.0.Bcustom2: Trace Attempt  1	[0.04 s]
0.0.Bcustom2: Trace Attempt  2	[0.04 s]
0.0.Bcustom2: Trace Attempt  3	[0.04 s]
0.0.Bcustom2: Trace Attempt  4	[0.04 s]
0.0.Bcustom2: Trace Attempt  5	[0.04 s]
0.0.AMcustom3: Trace Attempt  1	[0.13 s]
0.0.AMcustom3: Trace Attempt  2	[0.13 s]
0.0.AMcustom3: Trace Attempt  3	[0.13 s]
0.0.AMcustom3: Trace Attempt  4	[0.13 s]
0.0.AMcustom3: Trace Attempt  5	[0.13 s]
0.0.Tri:    0.06" ---- Launching abstraction thread ----
0.0.Tri:    0.06" ---- Launching multi-phase simplification thread ----
0.0.Bcustom2: Trace Attempt  1	[0.09 s]
0.0.Bcustom2: Trace Attempt  2	[0.09 s]
0.0.Bcustom2: Trace Attempt  3	[0.09 s]
0.0.Bcustom2: Trace Attempt  4	[0.09 s]
0.0.Bcustom2: Trace Attempt  5	[0.09 s]
0.0.Tri:    0.11" ---- Launching liveness simplification thread ----
0.0.Bcustom2: Trace Attempt  1	[0.22 s]
0.0.Bcustom2: Trace Attempt  2	[0.22 s]
0.0.Bcustom2: Trace Attempt  3	[0.22 s]
0.0.Bcustom2: Trace Attempt  4	[0.22 s]
0.0.Bcustom2: Trace Attempt  5	[0.22 s]
0.0.Hp: Trace Attempt 3872	[181.41 s]
0.0.AMcustom3: Trace Attempt  1	[0.56 s]
0.0.AMcustom3: Trace Attempt  2	[0.57 s]
0.0.AMcustom3: Trace Attempt  3	[0.57 s]
0.0.AMcustom3: Trace Attempt  4	[0.57 s]
0.0.AMcustom3: Trace Attempt  5	[0.57 s]
0.0.Tri:    0.93" Simplification phase 1 complete
0.0.Ncustom1: Requesting engine job to terminate
0.0.Bcustom2: Requesting engine job to terminate
0.0.AMcustom3: Requesting engine job to terminate
0.0.Tri: Requesting engine job to terminate
0.0.D: Requesting engine job to terminate
0.0.Hp: Requesting engine job to terminate
0.0.Ht: Requesting engine job to terminate
0.0.Bm: Requesting engine job to terminate
INFO (IPF144): 0: Initiating shutdown of proof [182.08 s]
0.0.Tri: A proof was found: No trace exists. [1.02 s]
INFO (IPF057): 0.0.Tri: The property "DELAY.p1" was proven in 1.02 s.
0.0.AMcustom3: Trace Attempt 67	[1.05 s]
0.0.AMcustom3: Stopped processing property "DELAY.p1"	[1.06 s].
0.0.AMcustom3: All properties determined. [1.06 s]
0.0.AMcustom3: Exited with Success (@ 182.09 s)
0: ProofGrid usable level: 0
0.0.D: Trace Attempt 64	[0.72 s]
0.0.D: Stopped processing property "DELAY.p1"	[1.01 s].
0.0.D: All properties determined. [1.02 s]
0.0.D: Exited with Success (@ 182.09 s)
0.0.Ncustom1: Stopped processing property "DELAY.p1"	[1.10 s].
0.0.Ncustom1: All properties determined. [1.10 s]
0.0.Ncustom1: Exited with Success (@ 182.09 s)
0.0.Ht: Trace Attempt 10798	[182.01 s]
0.0.Ht: All properties determined. [182.06 s]
0.0.Hp: Trace Attempt 3878	[182.05 s]
0.0.Hp: All properties determined. [182.13 s]
0.0.Bm: Trace Attempt 10319	[182.03 s]
0.0.Bm: All properties determined. [182.13 s]
0.0.Bm: Exited with Success (@ 182.19 s)
0.0.Ht: Exited with Success (@ 182.23 s)
0.0.Tri: Stopped processing property "DELAY.p1"	[1.22 s].
0.0.Tri: All properties determined. [1.22 s]
0.0.Tri: Exited with Success (@ 182.28 s)
0.0.Hp: Exited with Success (@ 182.35 s)
0.0.Bcustom2: Trace Attempt  1	[1.64 s]
0.0.Bcustom2: Stopped processing property "DELAY.p1"	[1.64 s].
0.0.Bcustom2: All properties determined. [1.64 s]
0.0.Bcustom2: Exited with Success (@ 182.74 s)
0: --------------------------------------------------------------
ProofGrid Summary (utilization 99.95 %)
--------------------------------------------------------------
     engines started                               :    14
     engine jobs started                           :    11

    Average time in state (seconds)
    ------------------------------------------------------
    Engine  Pending     Running        Dead    Utilization
    ------------------------------------------------------
     Hp        0.03      182.08        0.00       99.98 %
     Ht        0.03      182.05        0.00       99.98 %
     Bm        0.04      182.04        0.00       99.98 %
    Mpcustom4        0.08        0.00        0.00        1.44 %
     Oh        0.05        0.00        0.00        2.63 %
      L        0.05        0.01        0.00       21.20 %
    Ncustom1        0.03      182.03        0.00       99.98 %
    Bcustom2        0.03      181.90        0.00       99.98 %
    AMcustom3        0.04      181.96        0.00       99.98 %
    Tri        0.09        1.04        0.00       91.82 %
      D        0.07        1.01        0.00       93.44 %
    all        0.05       99.47        0.00       99.95 %

    Total time in state (seconds)
    -----------------------------------------
            Pending     Running        Dead  
    -----------------------------------------
               0.55     1094.12        0.00

    Data read    : 8.19 MiB
    Data written : 3.98 kiB

0: All pending notifications were processed.
INFO (IPF059): 0: Completed proof on task: "<embedded>"

==============================================================
SUMMARY
==============================================================
           Properties Considered              : 2
                 assertions                   : 1
                  - proven                    : 1 (100%)
                  - bounded_proven (user)     : 0 (0%)
                  - bounded_proven (auto)     : 0 (0%)
                  - marked_proven             : 0 (0%)
                  - cex                       : 0 (0%)
                  - ar_cex                    : 0 (0%)
                  - undetermined              : 0 (0%)
                  - unknown                   : 0 (0%)
                  - error                     : 0 (0%)
                 covers                       : 1
                  - unreachable               : 0 (0%)
                  - bounded_unreachable (user): 0 (0%)
                  - covered                   : 1 (100%)
                  - ar_covered                : 0 (0%)
                  - undetermined              : 0 (0%)
                  - unknown                   : 0 (0%)
                  - error                     : 0 (0%)
determined
[<embedded>] % exit -force
INFO (IPL005): Received request to exit from the console.
INFO (IPL014): Waiting for the Tcl-thread to exit.
INFO: Waiting for proof threads to stop...
INFO: Proof threads stopped.
INFO (IPL018): The peak resident set memory use for this session was 2.208 GB.
INFO (IPL015): The Tcl-thread exited with status 0.
INFO (IPL016): Exiting the analysis session with status 0.
