# ----------------------------------------
# Jasper Version Info
# tool      : Jasper 2024.06
# platform  : Linux 3.10.0-1160.62.1.el7.x86_64
# version   : 2024.06p002 64 bits
# build date: 2024.09.02 16:28:38 UTC
# ----------------------------------------
# started   : 2025-11-18 07:40:01 IST
# hostname  : vlsi-ria84.vlsidomain
# pid       : 20371
# arguments : '-label' 'session_0' '-console' '//127.0.0.1:36130' '-nowindow' '-style' 'windows' '-exitonerror' '-data' 'AAAA3nicY2RgYLCp////PwMYMD6A0Aw2jAyoAMRnQhUJbEChGRhYYZphSliAmItBl6GAoYghnyELyDNh0ANCfSA7HS6aypDMUMJQDBTNAfITGVIY4oG8EiC7CCgXz2AK1McDNCUJKFcCVJsB5CvgVKsHVpMDth8AOjIbKw==' '-proj' '/users/rompel/jasper_executions/safety_liveness/jgprojects/load_store_5/sessionLogs/session_0' '-init' '-hidden' '/users/rompel/jasper_executions/safety_liveness/jgprojects/load_store_5/.tmp/.initCmds.tcl' 'load_store_5.tcl' '-hidden' '/users/rompel/jasper_executions/safety_liveness/jgprojects/load_store_5/.tmp/.postCmds.tcl'

Any disclosure about the Cadence Design Systems software or its use
model to any third party violates the written Non-Disclosure Agreement
between Cadence Design Systems, Inc. and the customer.

THIS SOFTWARE CONTAINS CONFIDENTIAL INFORMATION AND TRADE SECRETS OF
CADENCE DESIGN SYSTEMS, INC. USE, DISCLOSURE, OR REPRODUCTION IS
PROHIBITED WITHOUT THE PRIOR EXPRESS WRITTEN PERMISSION OF CADENCE
DESIGN SYSTEMS, INC.

Copyright (C) 2000-2024 Cadence Design Systems, Inc. All Rights
Reserved.  Unpublished -- rights reserved under the copyright laws of
the United States.

This product includes software developed by others and redistributed
according to license agreement. See doc/third_party_readme.txt for
further details.

RESTRICTED RIGHTS LEGEND

Use, duplication, or disclosure by the Government is subject to
restrictions as set forth in subparagraph (c) (1) (ii) of the Rights in
Technical Data and Computer Software clause at DFARS 252.227-7013 or
subparagraphs (c) (1) and (2) of Commercial Computer Software -- Restricted
Rights at 48 CFR 52.227-19, as applicable.


                          Cadence Design Systems, Inc.
                          2655 Seely Avenue
                          San Jose, CA 95134
                          Phone: 408.943.1234

For technical assistance visit http://support.cadence.com.

Jasper Apps Analysis Session - /users/rompel/jasper_executions/safety_liveness/jgprojects/load_store_5/sessionLogs/session_0

WARNING (WG017): [session]: The system's locale is "ANSI_X3.4-1968", which is not UTF-8. Non-ASCII characters might not be handled correctly.
WARNING (WG017): [jg_console]: The system's locale is "ANSI_X3.4-1968", which is not UTF-8. Non-ASCII characters might not be handled correctly.
INFO: successfully checked out license "jasper_fao".
INFO: reading configuration file "/users/rompel/.config/cadence/jasper.conf".
% analyze -sv09 ../load_store_5.sv
[-- (VERI-1482)] Analyzing Verilog file '/tools/cadence2425/JASPER/jasper_2024.06p002/lib/verilog/packages/std/std.sv' into library 'std'
[-- (VERI-1482)] Analyzing Verilog file '../load_store_5.sv'
% elaborate -bbox_mul 1000000 -bbox_div 1000000 -bbox_mod 1000000 -bbox_a 1000000
[INFO (HIER-8002)] ../load_store_5.sv(23): Disabling old hierarchical reference handler
[INFO (VERI-1018)] ../load_store_5.sv(1): compiling module 'Load_Store'
[WARN (VERI-1209)] ../load_store_5.sv(10): expression size 32 truncated to fit in target size 13
[WARN (VERI-1209)] ../load_store_5.sv(12): expression size 32 truncated to fit in target size 13
[INFO (VERI-8005)] ../load_store_5.sv(5): Unintentional sequential element inferred for m read before write using blocking assignment
[INFO (VERI-8005)] ../load_store_5.sv(4): Unintentional sequential element inferred for vol read before write using blocking assignment
[INFO (VERI-8005)] ../load_store_5.sv(1): Unintentional sequential element inferred for sig read before write using blocking assignment
INFO (ISW003): Top module name is "Load_Store".
INFO (INL208): Elaboration synthesis summary:
  Number of synthesized netlists          1 (0 packages)
  Single run mode                         On
  Pipeline                                On (1 pipelined netlists)
  Late hierarchical reference connection  On
  Number of analyzed Verilog modules      1 (1 synthesized)
  Number of analyzed VHDL entities        0 (0 synthesized)
INFO (INL003): Clearing all state information (assumes, stopats, and so forth).
Load_Store
[<embedded>] % reset rst
INFO (IPM031): Clearing proof results of all properties.
INFO (IRS006): Current reset condition is "rst".
[<embedded>] % clock clk
[<embedded>] % prove -all
Ncustom1: Custom engine code is hT3Ng7hPPfiYQOTDZ3qhYOwGAM51eA+J/FjkM5shLioAsqhgLR4Ft+O1BuKG6ilQ83B9tLXSl+CwjiTMAQA
Bcustom2: Custom engine code is hT3Nm7hPr1Vp3Di1Ra2USNIGL4JypRnLKLAdF6JAyuavO2JfGCiY9OZJhcAcOUnLx5xwNdhILGrAWX9s+z2WDkKwNR7tAfClBEjRFVQeq6DU54boFgEA
AMcustom3: Custom engine code is hT3Ng7hP/feYQOTDZ3qhYOwGAM51eA+J/FjkM5shLioAsqhgLR4Ft+O1BuKG6ilQ83B9tLXSmmqwm7g9AQA
Mpcustom4: Custom engine code is hT3NZbhP9fmY2AbBQnsjfOxn6c+6e6yL+/e8fZFmaQrnlgEA
INFO (IPF036): Starting proof on task: "<embedded>", 1 properties to prove with 0 already proven/unreachable
INFO (IRS029): Starting reset analysis: phase 1 of 4.
INFO (IRS030): Running reset analysis: phase 2 of 4.
INFO (IRS031): Running reset analysis: phase 3 of 4.
INFO (IRS020): Starting the reset analysis simulation with a limit of 100 iterations (phase 4 of 4).
INFO (IRS024): Reset iterations 0 to 4 analyzed.
INFO (IRS018): Reset analysis simulation executed for 3 iterations. Assigned values for 15 of 15 design flops, 0 of 0 design latches, 3 of 3 internal elements.
INFO (IRS039): Reset analysis complete.
INFO (IPF031): Settings used for proof thread 0:
    orchestration                 = on
    time_limit                    = 86400s
    per_property_time_limit       = 1s * 10 ^ scan
    engine_mode                   = auto
    proofgrid_per_engine_max_jobs = 1
    max engine jobs               = auto
    proofgrid_mode                = local
    proofgrid_restarts            = 10
0: Using multistage preprocessing
AMcustom5: Custom engine code is hT3N1rhP11/52HrFRS21ROp2LOjVTgPvT8L8BGXHgLhaIuqtT4nARFjUqrBL+7pLmaTOzBepZW/Jm8SSrHDybSQtoNiO3y43wk+dEoWlsZizu97Fih6O6lPVG/LpWP5SsUPwlGagLNa1FKEFvwVXyX7//8prySbvSxIHXr5er+z4RAEA
0: Starting reduce
Ncustom6: Custom engine code is hT3OXrhPByJp3TrFSTLhUmMH4KVtJgmTCnNDF46yMXOKY48m4LS5nE7yBzFjA7kDuwO/GhGUpEPiky3p3wmPn3dJZHxFMsafSoObRzSC+tn7sEY0WbTdZ/FV4hL3MYH/b1CIUvXSWR4wqEoVLsmMOD4xIPT4lI1LO6ZCO7PnnWQuLwetnvKlrXx6wCW/A+x+enqslg1YPobi4wEF/EvbzOvcTYdJvl2s4H2yZg2b2ofAVN5WvhWk1HoBAA
ADcustom7: Custom engine code is hT3Nv7hPv1752HrFRa2kROx2f/ECJeZB2AZsLdlO8VwmIuqtT4nIDFXclhg+O+o+DMmQCekbheGk0kK28laA9gaOFDXsQp29J3X615HY1IPHJWd6FUFvCHjO+p1k652b5JJvZlShNpGlGSXAiQe/mEAj6tEBAA
Tricustom8: Custom engine code is hT3Nu7hPt1752DvFRa0kNDiyIV97VyejwM9C/jCLJjdPvusZONHY42VYUy0Q1ZotnhcVtNc56tJ5wbxv6V2+XpdsaSlHck5vfnbYjdwj1OECy9U+7oSQ0SZE3g5ayD+Phuh4odCJTjeKa2k4elM9ldQfkAEA
Gcustom9: Custom engine code is hT3NibhPDfeYQADBZnYcglOvK9Pfd7EOeniIqP8jNsyIqInncipMGcUXqAadachREE9F2PwhBUZUNw5kHnd4JdXkamORRgEA
C2custom10: Custom engine code is hT3NirhPjfWYQADBZnYcglOvK9Pfd7EOeniIqP8jNsyIqInncgkrYMMXCYbdK0dUjZIF9d4cJ0rHoBDjwVLBKuG86XYVV00BAA
AGcustom11: Custom engine code is hT3NirhP/fmYQADBZnYcglOvK9Pfd7EOeniIqP8jNsyIqInnckcwYMMXCYbdK0dUjZIF9d4cJ0rHoBDjwVLBKuHEZnZByh0BAA
Bcustom12: Custom engine code is hT3NjrhPDfiYQADBZnYcglOvK9PfWxFtenjIyBqfrgr7if/jL/yPOuK1BAflEcW0DxNH2eDIoezN2gxlQFg81RZtiWXh7aiTAidvAQA
Ncustom13: Custom engine code is hT3NR7hPByFp3TrFSTLhUmMH4KWtJglTyV/c51BHEeZWamnJv767nE6PCak26bd3gf3XGN3rIRheufhDieCJQVISo+gNYUKhiUedBKGtsP/a18svAnlMJZudHxDFwK5ufsyoxsIyiAeSY2oi3tEuoDHr5gw42DFKAG3PqO3CEsl8Azzdt3pl5nGA1Ifv2H02eYsFzWb/nfp8PMb3F0krE/EgBcm8TD9Div8BAA
0: Finished reduce in 0s
Tricustom14: Custom engine code is hT3Nu7hP3fiYQADBZnYcglNHp9bfd7EOeniIqP/ji8sGLQu8yhsFO+wxJ+O+R0bU8g/IewXFomyos+viQnWc2xYNYmMqpo3i40O7DaZR7qfp4YqNx26KRvQ/qx0BAA
0.0.PRE: Performing Proof Simplification...
0.0.N: clocks: 1, declared: 1, looping: 0, posedge: 1, negedge: 0, noedge: 0, bothedge: 0
0.0.N: Proof Simplification Iteration 1	[0.00 s]
0.0.N: Proof Simplification Iteration 2	[0.00 s]
0.0.N: Proof Simplification Iteration 3	[0.00 s]
0.0.PRE: A proof was found: No trace exists. [0.00 s]
INFO (IPF057): 0.0.PRE: The property ":noDeadEnd" was proven in 0.00 s.
    Use check_assumptions -show -dead_end to show this property in the property table.
0.0.PRE: A proof was found: No trace exists. [0.00 s]
INFO (IPF057): 0.0.PRE: The property ":noConflict" was proven in 0.00 s.
    Use check_assumptions -show to show this property in the property table.
INFO (IPF047): 0.0.PRE: The cover property ":live" was covered in 1 cycles in 0.00 s.
    Use check_assumptions -show -live to show this property in the property table.
0.0.PRE: Proof Simplification completed in 0.00 s
0: About to start ProofGrid in its own thread with a limit of 10000 pending notifications and a limit of 10 traces.
0: =============================== ProofGrid start ===============================
0: ProofGrid usable level: 1
0: Initial ProofGrid level: 1
0: ProofGrid is starting event handling
0.0.Hp: Proofgrid shell started at 20507@vlsi-ria84(local) jg_20371_vlsi-ria84_1
0.0.N: Proofgrid shell started at 20506@vlsi-ria84(local) jg_20371_vlsi-ria84_1
0.0.Hp: clocks: 1, declared: 1, looping: 0, posedge: 1, negedge: 0, noedge: 0, bothedge: 0
0.0.Hp: Last scan. Per property time limit: 0s
0.0.N: clocks: 1, declared: 1, looping: 0, posedge: 1, negedge: 0, noedge: 0, bothedge: 0
0.0.N: Last scan. Per property time limit: 0s
0.0.N: Starting proof for property "Load_Store.p1"	[0.00 s].
0.0.N: Trace Attempt  1	[0.00 s]
0.0.N: Trace Attempt  2	[0.00 s]
0.0.N: Trace Attempt  2	[0.00 s]
0.0.N: Trace Attempt  3	[0.00 s]
0.0.N: Trace Attempt  3	[0.00 s]
0.0.N: Trace Attempt  4	[0.00 s]
0.0.N: Trace Attempt  5	[0.00 s]
0.0.N: Trace Attempt  5	[0.00 s]
0.0.Hp: Trace Attempt  1	[0.00 s]
0.0.Hp: Trace Attempt  2	[0.00 s]
0.0.Hp: Trace Attempt  3	[0.00 s]
0.0.Hp: Trace Attempt  4	[0.00 s]
0.0.Hp: Trace Attempt  5	[0.00 s]
0.0.N: Trace Attempt  1	[0.01 s]
0.0.N: Trace Attempt  2	[0.01 s]
0.0.N: Trace Attempt  3	[0.01 s]
0.0.N: Trace Attempt  4	[0.02 s]
0.0.N: Trace Attempt  5	[0.02 s]
0.0.Oh: Proofgrid shell started at 20543@vlsi-ria84(local) jg_20371_vlsi-ria84_1
0.0.AM: Proofgrid shell started at 20545@vlsi-ria84(local) jg_20371_vlsi-ria84_1
0.0.Oh: clocks: 1, declared: 1, looping: 0, posedge: 1, negedge: 0, noedge: 0, bothedge: 0
0.0.Oh: Reached length limit (2147483647) [0.00 s]
0.0.Oh: Exited with Success (@ 0.03 s)
0.0.Oh: Completed, Restart ignored.
0.0.AM: clocks: 1, declared: 1, looping: 0, posedge: 1, negedge: 0, noedge: 0, bothedge: 0
0.0.AM: Last scan. Per property time limit: 0s
0.0.AM: Starting proof for property "Load_Store.p1"	[0.00 s].
0.0.AM: Trace Attempt  1	[0.00 s]
0.0.AM: Trace Attempt  2	[0.00 s]
0.0.B: Proofgrid shell started at 20544@vlsi-ria84(local) jg_20371_vlsi-ria84_1
0.0.AM: Trace Attempt  3	[0.00 s]
0.0.AM: Trace Attempt  4	[0.00 s]
0.0.AM: Trace Attempt  5	[0.00 s]
0.0.B: clocks: 1, declared: 1, looping: 0, posedge: 1, negedge: 0, noedge: 0, bothedge: 0
0.0.B: Last scan. Per property time limit: 0s
0.0.B: Starting proof for property "Load_Store.p1"	[0.00 s].
0.0.Ht: Proofgrid shell started at 20542@vlsi-ria84(local) jg_20371_vlsi-ria84_1
0.0.B: Trace Attempt  1	[0.00 s]
0.0.B: Trace Attempt  2	[0.00 s]
0.0.B: Trace Attempt  3	[0.00 s]
0.0.Ht: clocks: 1, declared: 1, looping: 0, posedge: 1, negedge: 0, noedge: 0, bothedge: 0
0.0.B: Trace Attempt  4	[0.00 s]
0.0.Ht: Last scan. Per property time limit: 0s
0.0.B: Trace Attempt  5	[0.00 s]
0.0.Ht: Trace Attempt  1	[0.00 s]
0.0.Ht: Trace Attempt  2	[0.00 s]
0.0.Ht: Trace Attempt  3	[0.00 s]
0.0.Ht: Trace Attempt  4	[0.00 s]
0.0.Ht: Trace Attempt  5	[0.00 s]
0.0.AM: Trace Attempt  1	[0.00 s]
0.0.AM: Trace Attempt  2	[0.00 s]
0.0.AM: Trace Attempt  3	[0.00 s]
0.0.AM: Trace Attempt  4	[0.01 s]
0.0.AM: Trace Attempt  5	[0.01 s]
0.0.AM: Trace Attempt  1	[0.02 s]
0.0.AM: Trace Attempt  2	[0.02 s]
0.0.AM: Trace Attempt  3	[0.02 s]
0.0.AM: Trace Attempt  4	[0.03 s]
0.0.AM: Trace Attempt  5	[0.03 s]
0.0.AM: Trace Attempt  1	[0.07 s]
0.0.AM: Trace Attempt  2	[0.07 s]
0.0.AM: Trace Attempt  3	[0.07 s]
0.0.AM: Trace Attempt  4	[0.07 s]
0.0.AM: Trace Attempt  5	[0.07 s]
0.0.N: Trace Attempt  1	[0.18 s]
0.0.N: Trace Attempt  2	[0.18 s]
0.0.N: Trace Attempt  3	[0.18 s]
0.0.N: Trace Attempt  4	[0.18 s]
0.0.N: Trace Attempt  5	[0.18 s]
0.0.AM: Trace Attempt  1	[0.23 s]
0.0.AM: Trace Attempt  2	[0.23 s]
0.0.AM: Trace Attempt  3	[0.23 s]
0.0.AM: Trace Attempt  4	[0.23 s]
0.0.AM: Trace Attempt  5	[0.23 s]
0.0.N: Trace Attempt  1	[0.67 s]
0.0.N: Trace Attempt  2	[0.67 s]
0.0.N: Trace Attempt  3	[0.67 s]
0.0.N: Trace Attempt  4	[0.68 s]
0.0.N: Trace Attempt  5	[0.68 s]
0.0.AM: Trace Attempt  1	[0.73 s]
0.0.AM: Trace Attempt  2	[0.73 s]
0.0.AM: Trace Attempt  3	[0.73 s]
0.0.AM: Trace Attempt  4	[0.74 s]
0.0.AM: Trace Attempt  5	[0.74 s]
0.0.N: Trace Attempt  1	[2.54 s]
0.0.N: Trace Attempt  2	[2.54 s]
0.0.N: Trace Attempt  3	[2.54 s]
0.0.N: Trace Attempt  4	[2.55 s]
0.0.N: Trace Attempt  5	[2.55 s]
0.0.AM: Trace Attempt  1	[2.70 s]
0.0.AM: Trace Attempt  2	[2.70 s]
0.0.AM: Trace Attempt  3	[2.70 s]
0.0.AM: Trace Attempt  4	[2.71 s]
0.0.AM: Trace Attempt  5	[2.71 s]
0.0.Hp: Trace Attempt 369	[4.00 s]
0.0.B: Trace Attempt 1933	[4.00 s]
0.0.Ht: Trace Attempt 2059	[4.00 s]
0.0.N: Trace Attempt  1	[4.15 s]
0.0.N: Trace Attempt  2	[4.15 s]
0.0.N: Trace Attempt  3	[4.15 s]
0.0.N: Trace Attempt  4	[4.16 s]
0.0.N: Trace Attempt  5	[4.16 s]
0.0.N: Trace Attempt  1	[5.78 s]
0.0.N: Trace Attempt  2	[5.78 s]
0.0.N: Trace Attempt  3	[5.78 s]
0.0.N: Trace Attempt  4	[5.78 s]
0.0.N: Trace Attempt  5	[5.79 s]
0.0.AM: Trace Attempt 180	[6.72 s]
0.0.N: Trace Attempt  1	[7.40 s]
0.0.N: Trace Attempt  2	[7.40 s]
0.0.N: Trace Attempt  3	[7.40 s]
0.0.N: Trace Attempt  4	[7.40 s]
0.0.N: Trace Attempt  5	[7.40 s]
0.0.Hp: Trace Attempt 495	[8.03 s]
0.0.B: Trace Attempt 2680	[8.00 s]
0.0.Ht: Trace Attempt 2816	[8.01 s]
0.0.N: Trace Attempt  1	[9.40 s]
0.0.N: Trace Attempt  2	[9.40 s]
0.0.N: Trace Attempt  3	[9.40 s]
0.0.N: Trace Attempt  4	[9.40 s]
0.0.N: Trace Attempt  5	[9.40 s]
0.0.AM: Trace Attempt  1	[9.87 s]
0.0.AM: Trace Attempt  2	[9.87 s]
0.0.AM: Trace Attempt  3	[9.87 s]
0.0.AM: Trace Attempt  4	[9.88 s]
0.0.AM: Trace Attempt  5	[9.88 s]
0.0.Hp: Trace Attempt 596	[12.04 s]
0.0.B: Trace Attempt 3219	[12.00 s]
0.0.Ht: Trace Attempt 3372	[12.01 s]
0.0.N: Trace Attempt 221	[13.51 s]
0.0.AM: Trace Attempt 186	[13.91 s]
0.0.N: Trace Attempt  1	[14.36 s]
0.0.N: Trace Attempt  2	[14.37 s]
0.0.N: Trace Attempt  3	[14.37 s]
0.0.N: Trace Attempt  4	[14.37 s]
0.0.Hp: Trace Attempt 686	[16.04 s]
0.0.B: Trace Attempt 3686	[16.01 s]
0.0.Ht: Trace Attempt 3859	[16.01 s]
0.0.AM: Trace Attempt 252	[18.04 s]
0.0.N: Trace Attempt 175	[18.42 s]
0.0.B: Trace Attempt 4101	[20.02 s]
0.0.Ht: Trace Attempt 4299	[20.02 s]
0.0.Hp: Trace Attempt 768	[20.09 s]
0.0.AM: Trace Attempt 306	[22.07 s]
0.0.N: Trace Attempt 241	[22.44 s]
0.0.N: Trace Attempt  1	[22.44 s]
0.0.N: Trace Attempt  2	[22.45 s]
0.0.N: Trace Attempt  3	[22.45 s]
0.0.N: Trace Attempt  4	[22.45 s]
0.0.B: Trace Attempt 4485	[24.02 s]
0.0.Ht: Trace Attempt 4699	[24.02 s]
0.0.Hp: Trace Attempt 841	[24.11 s]
0.0.AM: Trace Attempt 346	[26.07 s]
0.0.N: Trace Attempt 173	[26.47 s]
0.0.B: Trace Attempt 4841	[28.02 s]
0.0.Ht: Trace Attempt 5068	[28.04 s]
0.0.Hp: Trace Attempt 907	[28.14 s]
0.0.AM: Trace Attempt 382	[30.17 s]
0.0.N: Trace Attempt 242	[30.59 s]
0.0.N: Trace Attempt  1	[30.60 s]
0.0.N: Trace Attempt  2	[30.60 s]
0.0.N: Trace Attempt  3	[30.60 s]
0.0.N: Trace Attempt  4	[30.60 s]
0.0.B: Trace Attempt 5163	[32.03 s]
0.0.Ht: Trace Attempt 5400	[32.04 s]
0.0.Hp: Trace Attempt 972	[32.19 s]
0.0.AM: Trace Attempt 425	[34.18 s]
0.0.N: Trace Attempt 173	[34.63 s]
0.0.B: Trace Attempt 5461	[36.04 s]
0.0.Ht: Trace Attempt 5718	[36.05 s]
0.0.Hp: Trace Attempt 1032	[36.21 s]
0.0.AM: Trace Attempt 472	[38.23 s]
0.0.N: Trace Attempt 243	[38.71 s]
0.0.N: Trace Attempt  1	[38.72 s]
0.0.N: Trace Attempt  2	[38.72 s]
0.0.N: Trace Attempt  3	[38.72 s]
0.0.N: Trace Attempt  4	[38.72 s]
0.0.N: Trace Attempt  5	[38.72 s]
0.0.B: Trace Attempt 5737	[40.05 s]
0.0.Ht: Trace Attempt 6015	[40.06 s]
0.0.Hp: Trace Attempt 1082	[40.21 s]
0.0.AM: Trace Attempt 427	[42.25 s]
0.0.N: Trace Attempt 165	[42.73 s]
0.0.B: Trace Attempt 5979	[44.06 s]
0.0.Ht: Trace Attempt 6274	[44.07 s]
0.0.Hp: Trace Attempt 1128	[44.29 s]
0.0.N: Trace Attempt  1	[45.44 s]
0.0.N: Trace Attempt  2	[45.44 s]
0.0.N: Trace Attempt  3	[45.44 s]
0.0.N: Trace Attempt  4	[45.44 s]
0.0.AM: Trace Attempt  1	[45.78 s]
0.0.AM: Trace Attempt  2	[45.78 s]
0.0.AM: Trace Attempt  3	[45.78 s]
0.0.AM: Trace Attempt  4	[45.79 s]
0.0.AM: Trace Attempt  5	[45.79 s]
0.0.B: Trace Attempt 6232	[48.06 s]
0.0.Ht: Trace Attempt 6537	[48.08 s]
0.0.Hp: Trace Attempt 1174	[48.33 s]
0.0.N: Trace Attempt 173	[49.46 s]
0.0.AM: Trace Attempt 177	[49.79 s]
0.0.B: Trace Attempt 6485	[52.07 s]
0.0.Ht: Trace Attempt 6800	[52.10 s]
0.0.Hp: Trace Attempt 1220	[52.40 s]
0.0.N: Trace Attempt 245	[53.56 s]
0.0.N: Trace Attempt  1	[53.56 s]
0.0.N: Trace Attempt  2	[53.56 s]
0.0.N: Trace Attempt  3	[53.56 s]
0.0.N: Trace Attempt  4	[53.57 s]
0.0.N: Trace Attempt  5	[53.57 s]
0.0.AM: Trace Attempt 246	[53.83 s]
0.0.B: Trace Attempt 6725	[56.08 s]
0.0.Ht: Trace Attempt 7054	[56.10 s]
0.0.Hp: Trace Attempt 1263	[56.41 s]
0.0.N: Trace Attempt 165	[57.58 s]
0.0.AM: Trace Attempt 298	[57.87 s]
0.0.B: Trace Attempt 6956	[60.09 s]
0.0.Ht: Trace Attempt 7297	[60.11 s]
0.0.N: Trace Attempt  1	[60.26 s]
0.0.N: Trace Attempt  2	[60.26 s]
0.0.N: Trace Attempt  3	[60.26 s]
0.0.N: Trace Attempt  4	[60.27 s]
0.0.Hp: Trace Attempt 1305	[60.45 s]
0.0.AM: Trace Attempt 342	[61.88 s]
0.0.B: Trace Attempt 7179	[64.09 s]
0.0.Ht: Trace Attempt 7522	[64.11 s]
0.0.N: Trace Attempt 172	[64.28 s]
0.0.Hp: Trace Attempt 1346	[64.55 s]
0.0.AM: Trace Attempt 393	[66.00 s]
0.0.B: Trace Attempt 7393	[68.10 s]
0.0.Ht: Trace Attempt 7748	[68.12 s]
0.0.N: Trace Attempt 247	[68.39 s]
0.0.N: Trace Attempt  1	[68.40 s]
0.0.N: Trace Attempt  2	[68.40 s]
0.0.N: Trace Attempt  3	[68.40 s]
0.0.N: Trace Attempt  4	[68.40 s]
0.0.N: Trace Attempt  5	[68.41 s]
0.0.Hp: Trace Attempt 1385	[68.62 s]
0.0.AM: Trace Attempt 439	[70.01 s]
0.0.B: Trace Attempt 7604	[72.12 s]
0.0.Ht: Trace Attempt 7968	[72.14 s]
0.0.N: Trace Attempt 165	[72.42 s]
0.0.Hp: Trace Attempt 1423	[72.69 s]
0.0.AM: Trace Attempt 455	[74.23 s]
0.0.N: Trace Attempt  1	[75.46 s]
0.0.N: Trace Attempt  2	[75.46 s]
0.0.N: Trace Attempt  3	[75.46 s]
0.0.N: Trace Attempt  4	[75.47 s]
0.0.N: Trace Attempt  5	[75.47 s]
0.0.B: Trace Attempt 7812	[76.12 s]
0.0.Ht: Trace Attempt 8181	[76.15 s]
0.0.Hp: Trace Attempt 1459	[76.73 s]
0.0.AM: Trace Attempt 476	[78.28 s]
0.0.N: Trace Attempt 171	[79.48 s]
0.0.B: Trace Attempt 8018	[80.13 s]
0.0.Ht: Trace Attempt 8392	[80.17 s]
0.0.Hp: Trace Attempt 1495	[80.83 s]
0.0.AM: Trace Attempt 502	[82.40 s]
0.0.N: Trace Attempt 227	[83.55 s]
0.0.B: Trace Attempt 8219	[84.14 s]
0.0.Ht: Trace Attempt 8592	[84.17 s]
0.0.Hp: Trace Attempt 1530	[84.94 s]
0.0.AM: Trace Attempt 525	[86.46 s]
0.0.N: Trace Attempt 278	[87.57 s]
0.0.B: Trace Attempt 8413	[88.15 s]
0.0.Ht: Trace Attempt 8793	[88.17 s]
0.0.AM: Trace Attempt 550	[90.64 s]
0.0.N: Trace Attempt 324	[91.61 s]
0.0.B: Trace Attempt 8607	[92.15 s]
0.0.Ht: Trace Attempt 8988	[92.20 s]
0.0.Hp: Trace Attempt 1544	[93.52 s]
0.0.AM: Trace Attempt 568	[94.68 s]
0.0.N: Trace Attempt 365	[95.67 s]
0.0.B: Trace Attempt 8788	[96.17 s]
0.0.Ht: Trace Attempt 9168	[96.22 s]
0.0.Hp: Trace Attempt 1601	[97.57 s]
0.0.AM: Trace Attempt 586	[98.72 s]
0.0.N: Trace Attempt 406	[99.68 s]
0.0.B: Trace Attempt 8963	[100.19 s]
0.0.Ht: Trace Attempt 9347	[100.22 s]
0.0.Hp: Trace Attempt 1655	[101.59 s]
0.0.AM: Trace Attempt 606	[102.83 s]
0.0.N: Trace Attempt 436	[103.75 s]
0.0.B: Trace Attempt 9134	[104.21 s]
0.0.Ht: Trace Attempt 9515	[104.23 s]
0.0.Hp: Trace Attempt 1707	[105.63 s]
0.0.AM: Trace Attempt 625	[106.92 s]
0.0.B: Trace Attempt 9300	[108.22 s]
0.0.Ht: Trace Attempt 9686	[108.25 s]
0.0.N: Trace Attempt 446	[108.35 s]
0.0.Hp: Trace Attempt 1757	[109.68 s]
0.0.AM: Trace Attempt 642	[110.93 s]
0.0.N: Trace Attempt  1	[111.07 s]
0.0.N: Trace Attempt  2	[111.07 s]
0.0.N: Trace Attempt  3	[111.07 s]
0.0.N: Trace Attempt  4	[111.08 s]
0.0.N: Trace Attempt  5	[111.08 s]
0.0.B: Trace Attempt 9459	[112.23 s]
0.0.Ht: Trace Attempt 9849	[112.27 s]
0.0.Hp: Trace Attempt 1805	[113.73 s]
0.0.N: Trace Attempt 197	[115.11 s]
0.0.AM: Trace Attempt 657	[115.36 s]
0.0.B: Trace Attempt 9620	[116.24 s]
0.0.Ht: Trace Attempt 10013	[116.30 s]
0.0.Hp: Trace Attempt 1852	[117.74 s]
0.0.N: Trace Attempt 287	[119.14 s]
0.0.AM: Trace Attempt 674	[119.52 s]
0.0.B: Trace Attempt 9776	[120.26 s]
0.0.Ht: Trace Attempt 10167	[120.31 s]
0.0.Hp: Trace Attempt 1898	[121.83 s]
0.0.N: Trace Attempt 371	[123.16 s]
0.0.AM: Trace Attempt 687	[123.71 s]
0.0.B: Trace Attempt 9930	[124.27 s]
0.0.Ht: Trace Attempt 10327	[124.31 s]
0.0.Hp: Trace Attempt 1942	[125.83 s]
0.0.N: Trace Attempt 438	[127.22 s]
0.0.AM: Trace Attempt 698	[127.71 s]
0.0.B: Trace Attempt 10079	[128.27 s]
0.0.Ht: Trace Attempt 10476	[128.34 s]
0.0.Hp: Trace Attempt 1983	[129.89 s]
0.0.N: Trace Attempt  1	[130.87 s]
0.0.N: Trace Attempt  2	[130.87 s]
0.0.N: Trace Attempt  3	[130.87 s]
0.0.N: Trace Attempt  4	[130.87 s]
0.0.N: Trace Attempt  5	[130.87 s]
0.0.AM: Trace Attempt 715	[131.92 s]
0.0.B: Trace Attempt 10221	[132.29 s]
0.0.Ht: Trace Attempt 10619	[132.36 s]
0.0.Hp: Trace Attempt 2026	[133.93 s]
0.0.N: Trace Attempt 172	[134.91 s]
0.0.AM: Trace Attempt 729	[136.06 s]
0.0.B: Trace Attempt 10371	[136.29 s]
0.0.Ht: Trace Attempt 10769	[136.37 s]
0.0.Hp: Trace Attempt 2069	[137.96 s]
0.0.N: Trace Attempt 240	[139.03 s]
0.0.B: Trace Attempt 10517	[140.31 s]
0.0.Ht: Trace Attempt 10913	[140.38 s]
0.0.AM: Trace Attempt 747	[140.86 s]
0.0.Hp: Trace Attempt 2114	[141.99 s]
0.0.N: Trace Attempt 290	[143.03 s]
0.0.B: Trace Attempt 10659	[144.32 s]
0.0.Ht: Trace Attempt 11055	[144.39 s]
0.0.AM: Trace Attempt 758	[144.91 s]
0.0.Hp: Trace Attempt 2158	[146.07 s]
0.0.N: Trace Attempt 329	[147.09 s]
0.0.B: Trace Attempt 10797	[148.32 s]
0.0.Ht: Trace Attempt 11200	[148.40 s]
0.0.AM: Trace Attempt 774	[149.23 s]
0.0.Hp: Trace Attempt 2200	[150.12 s]
0.0.N: Trace Attempt 362	[151.12 s]
0.0.B: Trace Attempt 10933	[152.34 s]
0.0.Ht: Trace Attempt 11341	[152.41 s]
0.0.AM: Trace Attempt 789	[153.42 s]
0.0.Hp: Trace Attempt 2241	[154.16 s]
0.0.N: Trace Attempt 401	[155.17 s]
0.0.B: Trace Attempt 11067	[156.34 s]
0.0.Ht: Trace Attempt 11477	[156.42 s]
0.0.AM: Trace Attempt 804	[157.51 s]
0.0.Hp: Trace Attempt 2281	[158.19 s]
0.0.N: Trace Attempt 439	[159.21 s]
0.0.B: Trace Attempt 11199	[160.36 s]
0.0.Ht: Trace Attempt 11612	[160.43 s]
0.0.AM: Trace Attempt 815	[161.54 s]
0.0.N: Trace Attempt  1	[162.01 s]
0.0.N: Trace Attempt  2	[162.01 s]
0.0.N: Trace Attempt  3	[162.01 s]
0.0.N: Trace Attempt  4	[162.02 s]
0.0.N: Trace Attempt  5	[162.02 s]
0.0.Hp: Trace Attempt 2319	[162.20 s]
0.0.B: Trace Attempt 11327	[164.36 s]
0.0.Ht: Trace Attempt 11745	[164.43 s]
0.0.AM: Trace Attempt 828	[165.70 s]
0.0.N: Trace Attempt 203	[166.03 s]
0.0.B: Trace Attempt 11460	[168.39 s]
0.0.Ht: Trace Attempt 11881	[168.44 s]
0.0.Hp: Trace Attempt 2341	[169.24 s]
0.0.AM: Trace Attempt 842	[169.86 s]
0.0.N: Trace Attempt 296	[170.03 s]
0.0.B: Trace Attempt 11589	[172.41 s]
0.0.Ht: Trace Attempt 12011	[172.46 s]
0.0.Hp: Trace Attempt 2374	[173.31 s]
0.0.AM: Trace Attempt 854	[173.89 s]
0.0.N: Trace Attempt 388	[174.03 s]
0.0.B: Trace Attempt 11714	[176.43 s]
0.0.Ht: Trace Attempt 12139	[176.46 s]
0.0.Hp: Trace Attempt 2406	[177.33 s]
0.0.AM: Trace Attempt 870	[178.28 s]
0.0.N: Trace Attempt 437	[178.47 s]
0.0.B: Trace Attempt 11836	[180.43 s]
0.0.Ht: Trace Attempt 12268	[180.47 s]
0.0.N: Trace Attempt 447	[180.76 s]
0.0.N: Stopped processing property "Load_Store.p1"	[181.02 s].
0.0.N: Morphing to Ncustom1
0.0.N: All properties determined. [0.00 s]
0.0.N: Exited with Success (@ 0.00 s)
0.0.Ncustom1: clocks: 1, declared: 1, looping: 0, posedge: 1, negedge: 0, noedge: 0, bothedge: 0
0.0.Ncustom1: Starting proof for property "Load_Store.p1"	[0.00 s].
0.0.Tri: Proofgrid shell started at 20813@vlsi-ria84(local) jg_20371_vlsi-ria84_1
0.0.Tri: clocks: 1, declared: 1, looping: 0, posedge: 1, negedge: 0, noedge: 0, bothedge: 0
0.0.Tri: Last scan. Per property time limit: 0s
0.0.Tri: Starting proof for property "Load_Store.p1"	[0.00 s].
0.0.Tri: Trace Attempt  1	[0.00 s]
0.0.Tri:    0.00" ---- Launching main thread ----
0.0.Ncustom1: Trace Attempt 451	[0.06 s]
0.0.B: Trace Attempt 11851	[180.92 s]
0.0.B: Stopped processing property "Load_Store.p1"	[181.07 s].
0.0.B: Morphing to Bcustom2
0.0.B: All properties determined. [0.00 s]
0.0.B: Exited with Success (@ 0.00 s)
0.0.Bcustom2: clocks: 1, declared: 1, looping: 0, posedge: 1, negedge: 0, noedge: 0, bothedge: 0
0.0.Bcustom2: Starting proof for property "Load_Store.p1"	[0.00 s].
0.0.Bcustom2: Trace Attempt  1	[0.00 s]
0.0.Bcustom2: Trace Attempt  2	[0.00 s]
0.0.Bcustom2: Trace Attempt  1	[0.00 s]
0.0.Bcustom2: Trace Attempt  2	[0.00 s]
0.0.Bcustom2: Trace Attempt  3	[0.00 s]
0.0.Bcustom2: Trace Attempt  1	[0.00 s]
0.0.Tri:    0.02" ---- Launching abstraction thread ----
0.0.Tri:    0.03" ---- Launching multi-phase simplification thread ----
0.0.Bcustom2: Trace Attempt  2	[0.00 s]
0.0.Bcustom2: Trace Attempt  3	[0.00 s]
0.0.Bcustom2: Trace Attempt  4	[0.00 s]
0.0.Bcustom2: Trace Attempt  5	[0.00 s]
0.0.Bcustom2: Trace Attempt  1	[0.00 s]
0.0.Bcustom2: Trace Attempt  2	[0.00 s]
0.0.Bcustom2: Trace Attempt  3	[0.00 s]
0.0.Bcustom2: Trace Attempt  4	[0.00 s]
0.0.Bcustom2: Trace Attempt  5	[0.00 s]
0.0.Bcustom2: Trace Attempt  1	[0.01 s]
0.0.Bcustom2: Trace Attempt  2	[0.01 s]
0.0.Bcustom2: Trace Attempt  3	[0.01 s]
0.0.Bcustom2: Trace Attempt  4	[0.01 s]
0.0.Bcustom2: Trace Attempt  5	[0.01 s]
0.0.Bcustom2: Trace Attempt  1	[0.01 s]
0.0.Bcustom2: Trace Attempt  2	[0.01 s]
0.0.Bcustom2: Trace Attempt  3	[0.01 s]
0.0.Bcustom2: Trace Attempt  4	[0.01 s]
0.0.Bcustom2: Trace Attempt  5	[0.01 s]
0.0.Tri:    0.04" ---- Launching liveness simplification thread ----
0.0.Bcustom2: Trace Attempt  1	[0.02 s]
0.0.Bcustom2: Trace Attempt  2	[0.02 s]
0.0.Bcustom2: Trace Attempt  3	[0.02 s]
0.0.Bcustom2: Trace Attempt  4	[0.02 s]
0.0.Bcustom2: Trace Attempt  5	[0.02 s]
0.0.AM: Trace Attempt 878	[180.86 s]
0.0.AM: Stopped processing property "Load_Store.p1"	[181.10 s].
0.0.AM: Morphing to AMcustom3
0.0.Bcustom2: Trace Attempt  1	[0.04 s]
0.0.Bcustom2: Trace Attempt  2	[0.04 s]
0.0.Bcustom2: Trace Attempt  3	[0.04 s]
0.0.Bcustom2: Trace Attempt  4	[0.04 s]
0.0.Bcustom2: Trace Attempt  5	[0.04 s]
0.0.AM: All properties determined. [0.00 s]
0.0.AM: Exited with Success (@ 0.00 s)
0.0.AMcustom3: clocks: 1, declared: 1, looping: 0, posedge: 1, negedge: 0, noedge: 0, bothedge: 0
0.0.AMcustom3: Starting proof for property "Load_Store.p1"	[0.00 s].
0.0.AMcustom3: Trace Attempt  1	[0.00 s]
0.0.AMcustom3: Trace Attempt  2	[0.00 s]
0.0.AMcustom3: Trace Attempt  3	[0.00 s]
0.0.AMcustom3: Trace Attempt  4	[0.00 s]
0.0.AMcustom3: Trace Attempt  5	[0.00 s]
0.0.AMcustom3: Trace Attempt  1	[0.00 s]
0.0.AMcustom3: Trace Attempt  2	[0.00 s]
0.0.AMcustom3: Trace Attempt  3	[0.00 s]
0.0.AMcustom3: Trace Attempt  4	[0.01 s]
0.0.AMcustom3: Trace Attempt  5	[0.01 s]
0.0.AMcustom3: Trace Attempt  1	[0.02 s]
0.0.AMcustom3: Trace Attempt  2	[0.02 s]
0.0.AMcustom3: Trace Attempt  3	[0.02 s]
0.0.AMcustom3: Trace Attempt  4	[0.03 s]
0.0.AMcustom3: Trace Attempt  5	[0.03 s]
0.0.Bcustom2: Trace Attempt  1	[0.10 s]
0.0.Bcustom2: Trace Attempt  2	[0.10 s]
0.0.Bcustom2: Trace Attempt  3	[0.10 s]
0.0.Bcustom2: Trace Attempt  4	[0.10 s]
0.0.Bcustom2: Trace Attempt  5	[0.10 s]
0.0.AMcustom3: Trace Attempt  1	[0.07 s]
0.0.AMcustom3: Trace Attempt  2	[0.07 s]
0.0.AMcustom3: Trace Attempt  3	[0.07 s]
0.0.AMcustom3: Trace Attempt  4	[0.07 s]
0.0.AMcustom3: Trace Attempt  5	[0.08 s]
0.0.AMcustom3: Trace Attempt  1	[0.24 s]
0.0.AMcustom3: Trace Attempt  2	[0.25 s]
0.0.AMcustom3: Trace Attempt  3	[0.25 s]
0.0.AMcustom3: Trace Attempt  4	[0.25 s]
0.0.AMcustom3: Trace Attempt  5	[0.25 s]
0.0.Hp: Trace Attempt 2438	[181.44 s]
0.0.Bcustom2: Trace Attempt  1	[0.47 s]
0.0.Bcustom2: Trace Attempt  2	[0.47 s]
0.0.Bcustom2: Trace Attempt  3	[0.47 s]
0.0.Bcustom2: Trace Attempt  4	[0.47 s]
0.0.Bcustom2: Trace Attempt  5	[0.47 s]
0.0.Tri:    0.84" Simplification phase 1 complete
0.0.AMcustom3: Trace Attempt  1	[0.80 s]
0.0.AMcustom3: Trace Attempt  2	[0.80 s]
0.0.AMcustom3: Trace Attempt  3	[0.80 s]
0.0.AMcustom3: Trace Attempt  4	[0.80 s]
0.0.AMcustom3: Trace Attempt  5	[0.80 s]
0.0.Ncustom1: Requesting engine job to terminate
0.0.Bcustom2: Requesting engine job to terminate
0.0.AMcustom3: Requesting engine job to terminate
0.0.Tri: Requesting engine job to terminate
0.0.Hp: Requesting engine job to terminate
0.0.Ht: Requesting engine job to terminate
INFO (IPF144): 0: Initiating shutdown of proof [182.01 s]
0.0.Tri: A proof was found: No trace exists. [0.96 s]
INFO (IPF057): 0.0.Tri: The property "Load_Store.p1" was proven in 0.97 s.
0.0.AMcustom3: Trace Attempt 18	[0.85 s]
0.0.AMcustom3: Stopped processing property "Load_Store.p1"	[0.86 s].
0.0.AMcustom3: All properties determined. [0.86 s]
0.0.AMcustom3: Exited with Success (@ 182.01 s)
0: ProofGrid usable level: 0
0.0.Ncustom1: Stopped processing property "Load_Store.p1"	[0.99 s].
0.0.Ncustom1: All properties determined. [0.99 s]
0.0.Ncustom1: Exited with Success (@ 182.03 s)
0.0.Ht: Trace Attempt 12316	[181.98 s]
0.0.Ht: All properties determined. [182.01 s]
0.0.Hp: Trace Attempt 2442	[181.99 s]
0.0.Hp: All properties determined. [182.10 s]
0.0.Ht: Exited with Success (@ 182.15 s)
0.0.Tri: Stopped processing property "Load_Store.p1"	[1.12 s].
0.0.Tri: All properties determined. [1.12 s]
0.0.Tri: Exited with Success (@ 182.16 s)
0.0.Hp: Exited with Success (@ 182.42 s)
0.0.Bcustom2: Trace Attempt  1	[2.62 s]
0.0.Bcustom2: Stopped processing property "Load_Store.p1"	[2.63 s].
0.0.Bcustom2: All properties determined. [2.62 s]
0.0.Bcustom2: Exited with Success (@ 183.75 s)
0: --------------------------------------------------------------
ProofGrid Summary (utilization 99.97 %)
--------------------------------------------------------------
     engines started                               :    10
     engine jobs started                           :     7

    Average time in state (seconds)
    ------------------------------------------------------
    Engine  Pending     Running        Dead    Utilization
    ------------------------------------------------------
     Hp        0.03      182.01        0.00       99.98 %
     Ht        0.03      181.98        0.00       99.98 %
     Oh        0.03        0.00        0.00        2.83 %
    Ncustom1        0.03      181.96        0.00       99.98 %
    Bcustom2        0.03      181.86        0.00       99.98 %
    AMcustom3        0.03      181.82        0.00       99.98 %
    Tri        0.06        0.97        0.00       94.46 %
    all        0.03      130.09        0.00       99.97 %

    Total time in state (seconds)
    -----------------------------------------
            Pending     Running        Dead  
    -----------------------------------------
               0.24      910.60        0.00

    Data read    : 6.29 MiB
    Data written : 2.96 kiB

0: All pending notifications were processed.
INFO (IPF059): 0: Completed proof on task: "<embedded>"

==============================================================
SUMMARY
==============================================================
           Properties Considered              : 1
                 assertions                   : 1
                  - proven                    : 1 (100%)
                  - bounded_proven (user)     : 0 (0%)
                  - bounded_proven (auto)     : 0 (0%)
                  - marked_proven             : 0 (0%)
                  - cex                       : 0 (0%)
                  - ar_cex                    : 0 (0%)
                  - undetermined              : 0 (0%)
                  - unknown                   : 0 (0%)
                  - error                     : 0 (0%)
                 covers                       : 0
                  - unreachable               : 0
                  - bounded_unreachable (user): 0
                  - covered                   : 0
                  - ar_covered                : 0
                  - undetermined              : 0
                  - unknown                   : 0
                  - error                     : 0
proven
[<embedded>] % exit -force
INFO (IPL005): Received request to exit from the console.
INFO: Waiting for proof threads to stop...
INFO: Proof threads stopped.
INFO (IPL018): The peak resident set memory use for this session was 2.012 GB.
INFO (IPL014): Waiting for the Tcl-thread to exit.
INFO (IPL015): The Tcl-thread exited with status 0.
INFO (IPL016): Exiting the analysis session with status 0.
