# ----------------------------------------
# Jasper Version Info
# tool      : Jasper 2024.06
# platform  : Linux 3.10.0-1160.62.1.el7.x86_64
# version   : 2024.06p002 64 bits
# build date: 2024.09.02 16:28:38 UTC
# ----------------------------------------
# started   : 2025-11-18 08:24:11 IST
# hostname  : vlsi-ria85.vlsidomain
# pid       : 27366
# arguments : '-label' 'session_0' '-console' '//127.0.0.1:33051' '-nowindow' '-style' 'windows' '-exitonerror' '-data' 'AAAA3nicY2RgYLCp////PwMYMD6A0Aw2jAyoAMRnQhUJbEChGRhYYZphSliAmItBl6GAoYghnyELyDNh0ANCfSA7HS6aypDMUMJQDBTNAfITGVIY4oG8EiC7CCgXz2AB1McDNCUJKFcCVJsB5CvgVKsHVpMDth8AOwobMQ==' '-proj' '/users/rompel/jasper_executions/safety/jgprojects/load_store_8/sessionLogs/session_0' '-init' '-hidden' '/users/rompel/jasper_executions/safety/jgprojects/load_store_8/.tmp/.initCmds.tcl' 'load_store_8.tcl' '-hidden' '/users/rompel/jasper_executions/safety/jgprojects/load_store_8/.tmp/.postCmds.tcl'

Any disclosure about the Cadence Design Systems software or its use
model to any third party violates the written Non-Disclosure Agreement
between Cadence Design Systems, Inc. and the customer.

THIS SOFTWARE CONTAINS CONFIDENTIAL INFORMATION AND TRADE SECRETS OF
CADENCE DESIGN SYSTEMS, INC. USE, DISCLOSURE, OR REPRODUCTION IS
PROHIBITED WITHOUT THE PRIOR EXPRESS WRITTEN PERMISSION OF CADENCE
DESIGN SYSTEMS, INC.

Copyright (C) 2000-2024 Cadence Design Systems, Inc. All Rights
Reserved.  Unpublished -- rights reserved under the copyright laws of
the United States.

This product includes software developed by others and redistributed
according to license agreement. See doc/third_party_readme.txt for
further details.

RESTRICTED RIGHTS LEGEND

Use, duplication, or disclosure by the Government is subject to
restrictions as set forth in subparagraph (c) (1) (ii) of the Rights in
Technical Data and Computer Software clause at DFARS 252.227-7013 or
subparagraphs (c) (1) and (2) of Commercial Computer Software -- Restricted
Rights at 48 CFR 52.227-19, as applicable.


                          Cadence Design Systems, Inc.
                          2655 Seely Avenue
                          San Jose, CA 95134
                          Phone: 408.943.1234

For technical assistance visit http://support.cadence.com.

Jasper Apps Analysis Session - /users/rompel/jasper_executions/safety/jgprojects/load_store_8/sessionLogs/session_0

WARNING (WG017): [session]: The system's locale is "ANSI_X3.4-1968", which is not UTF-8. Non-ASCII characters might not be handled correctly.
WARNING (WG017): [jg_console]: The system's locale is "ANSI_X3.4-1968", which is not UTF-8. Non-ASCII characters might not be handled correctly.
INFO: successfully checked out license "jasper_fao".
INFO: reading configuration file "/users/rompel/.config/cadence/jasper.conf".
% analyze -sv09 ../load_store_8.sv
[-- (VERI-1482)] Analyzing Verilog file '/tools/cadence2425/JASPER/jasper_2024.06p002/lib/verilog/packages/std/std.sv' into library 'std'
[-- (VERI-1482)] Analyzing Verilog file '../load_store_8.sv'
% elaborate -bbox_mul 1000000 -bbox_div 1000000 -bbox_mod 1000000 -bbox_a 1000000
[INFO (HIER-8002)] ../load_store_8.sv(23): Disabling old hierarchical reference handler
[INFO (VERI-1018)] ../load_store_8.sv(1): compiling module 'Load_Store'
[WARN (VERI-1209)] ../load_store_8.sv(10): expression size 32 truncated to fit in target size 14
[WARN (VERI-1209)] ../load_store_8.sv(12): expression size 32 truncated to fit in target size 14
[INFO (VERI-8005)] ../load_store_8.sv(5): Unintentional sequential element inferred for m read before write using blocking assignment
[INFO (VERI-8005)] ../load_store_8.sv(4): Unintentional sequential element inferred for vol read before write using blocking assignment
[INFO (VERI-8005)] ../load_store_8.sv(1): Unintentional sequential element inferred for sig read before write using blocking assignment
INFO (ISW003): Top module name is "Load_Store".
INFO (INL208): Elaboration synthesis summary:
  Number of synthesized netlists          1 (0 packages)
  Single run mode                         On
  Pipeline                                On (1 pipelined netlists)
  Late hierarchical reference connection  On
  Number of analyzed Verilog modules      1 (1 synthesized)
  Number of analyzed VHDL entities        0 (0 synthesized)
INFO (INL003): Clearing all state information (assumes, stopats, and so forth).
Load_Store
[<embedded>] % reset rst
INFO (IPM031): Clearing proof results of all properties.
INFO (IRS006): Current reset condition is "rst".
[<embedded>] % clock clk
[<embedded>] % prove -all
Ncustom1: Custom engine code is hT3Ng7hPPfiYQOTDZ3qhYOwGAM51eA+J/FjkM5shLioAsqhgLR4Ft+O1BuKG6ilQ83B9tLXSl+CwjiTMAQA
Bcustom2: Custom engine code is hT3Nm7hPr1Vp3Di1Ra2USNIGL4JypRnLKLAdF6JAyuavO2JfGCiY9OZJhcAcOUnLx5xwNdhILGrAWX9s+z2WDkKwNR7tAfClBEjRFVQeq6DU54boFgEA
AMcustom3: Custom engine code is hT3Ng7hP/feYQOTDZ3qhYOwGAM51eA+J/FjkM5shLioAsqhgLR4Ft+O1BuKG6ilQ83B9tLXSmmqwm7g9AQA
Mpcustom4: Custom engine code is hT3NZbhP9fmY2AbBQnsjfOxn6c+6e6yL+/e8fZFmaQrnlgEA
INFO (IPF036): Starting proof on task: "<embedded>", 1 properties to prove with 0 already proven/unreachable
INFO (IRS029): Starting reset analysis: phase 1 of 4.
INFO (IRS030): Running reset analysis: phase 2 of 4.
INFO (IRS031): Running reset analysis: phase 3 of 4.
INFO (IRS020): Starting the reset analysis simulation with a limit of 100 iterations (phase 4 of 4).
INFO (IRS024): Reset iterations 0 to 4 analyzed.
INFO (IRS018): Reset analysis simulation executed for 3 iterations. Assigned values for 16 of 16 design flops, 0 of 0 design latches, 3 of 3 internal elements.
INFO (IRS039): Reset analysis complete.
INFO (IPF031): Settings used for proof thread 0:
    orchestration                 = on
    time_limit                    = 86400s
    per_property_time_limit       = 1s * 10 ^ scan
    engine_mode                   = auto
    proofgrid_per_engine_max_jobs = 1
    max engine jobs               = auto
    proofgrid_mode                = local
    proofgrid_restarts            = 10
0: Using multistage preprocessing
AMcustom5: Custom engine code is hT3N1rhP11/52HrFRS21ROp2LOjVTgPvT8L8BGXHgLhaIuqtT4nARFjUqrBL+7pLmaTOzBepZW/Jm8SSrHDybSQtoNiO3y43wk+dEoWlsZizu97Fih6O6lPVG/LpWP5SsUPwlGagLNa1FKEFvwVXyX7//8prySbvSxIHXr5er+z4RAEA
0: Starting reduce
Ncustom6: Custom engine code is hT3OXrhPByJp3TrFSTLhUmMH4KVtJgmTCnNDF46yMXOKY48m4LS5nE7yBzFjA7kDuwO/GhGUpEPiky3p3wmPn3dJZHxFMsafSoObRzSC+tn7sEY0WbTdZ/FV4hL3MYH/b1CIUvXSWR4wqEoVLsmMOD4xIPT4lI1LO6ZCO7PnnWQuLwetnvKlrXx6wCW/A+x+enqslg1YPobi4wEF/EvbzOvcTYdJvl2s4H2yZg2b2ofAVN5WvhWk1HoBAA
ADcustom7: Custom engine code is hT3Nv7hPv1752HrFRa2kROx2f/ECJeZB2AZsLdlO8VwmIuqtT4nIDFXclhg+O+o+DMmQCekbheGk0kK28laA9gaOFDXsQp29J3X615HY1IPHJWd6FUFvCHjO+p1k652b5JJvZlShNpGlGSXAiQe/mEAj6tEBAA
Tricustom8: Custom engine code is hT3Nu7hPt1752DvFRa0kNDiyIV97VyejwM9C/jCLJjdPvusZONHY42VYUy0Q1ZotnhcVtNc56tJ5wbxv6V2+XpdsaSlHck5vfnbYjdwj1OECy9U+7oSQ0SZE3g5ayD+Phuh4odCJTjeKa2k4elM9ldQfkAEA
Gcustom9: Custom engine code is hT3NibhPDfeYQADBZnYcglOvK9Pfd7EOeniIqP8jNsyIqInncipMGcUXqAadachREE9F2PwhBUZUNw5kHnd4JdXkamORRgEA
C2custom10: Custom engine code is hT3NirhPjfWYQADBZnYcglOvK9Pfd7EOeniIqP8jNsyIqInncgkrYMMXCYbdK0dUjZIF9d4cJ0rHoBDjwVLBKuG86XYVV00BAA
AGcustom11: Custom engine code is hT3NirhP/fmYQADBZnYcglOvK9Pfd7EOeniIqP8jNsyIqInnckcwYMMXCYbdK0dUjZIF9d4cJ0rHoBDjwVLBKuHEZnZByh0BAA
Bcustom12: Custom engine code is hT3NjrhPDfiYQADBZnYcglOvK9PfWxFtenjIyBqfrgr7if/jL/yPOuK1BAflEcW0DxNH2eDIoezN2gxlQFg81RZtiWXh7aiTAidvAQA
Ncustom13: Custom engine code is hT3NR7hPByFp3TrFSTLhUmMH4KWtJglTyV/c51BHEeZWamnJv767nE6PCak26bd3gf3XGN3rIRheufhDieCJQVISo+gNYUKhiUedBKGtsP/a18svAnlMJZudHxDFwK5ufsyoxsIyiAeSY2oi3tEuoDHr5gw42DFKAG3PqO3CEsl8Azzdt3pl5nGA1Ifv2H02eYsFzWb/nfp8PMb3F0krE/EgBcm8TD9Div8BAA
0: Finished reduce in 0s
Tricustom14: Custom engine code is hT3Nu7hP3fiYQADBZnYcglNHp9bfd7EOeniIqP/ji8sGLQu8yhsFO+wxJ+O+R0bU8g/IewXFomyos+viQnWc2xYNYmMqpo3i40O7DaZR7qfp4YqNx26KRvQ/qx0BAA
0.0.PRE: Performing Proof Simplification...
0.0.N: clocks: 1, declared: 1, looping: 0, posedge: 1, negedge: 0, noedge: 0, bothedge: 0
0.0.N: Proof Simplification Iteration 1	[0.00 s]
0.0.N: Proof Simplification Iteration 2	[0.00 s]
0.0.N: Proof Simplification Iteration 3	[0.00 s]
0.0.PRE: A proof was found: No trace exists. [0.00 s]
INFO (IPF057): 0.0.PRE: The property ":noDeadEnd" was proven in 0.00 s.
    Use check_assumptions -show -dead_end to show this property in the property table.
0.0.PRE: A proof was found: No trace exists. [0.00 s]
INFO (IPF057): 0.0.PRE: The property ":noConflict" was proven in 0.00 s.
    Use check_assumptions -show to show this property in the property table.
INFO (IPF047): 0.0.PRE: The cover property ":live" was covered in 1 cycles in 0.00 s.
    Use check_assumptions -show -live to show this property in the property table.
0.0.PRE: Proof Simplification completed in 0.00 s
0: About to start ProofGrid in its own thread with a limit of 10000 pending notifications and a limit of 10 traces.
0: =============================== ProofGrid start ===============================
0: ProofGrid usable level: 1
0: Initial ProofGrid level: 1
0: ProofGrid is starting event handling
0.0.Hp: Proofgrid shell started at 27445@vlsi-ria85(local) jg_27366_vlsi-ria85_1
0.0.Hp: clocks: 1, declared: 1, looping: 0, posedge: 1, negedge: 0, noedge: 0, bothedge: 0
0.0.N: Proofgrid shell started at 27442@vlsi-ria85(local) jg_27366_vlsi-ria85_1
0.0.Hp: Last scan. Per property time limit: 0s
0.0.Hp: Trace Attempt  1	[0.00 s]
0.0.Hp: Trace Attempt  2	[0.00 s]
0.0.Hp: Trace Attempt  3	[0.00 s]
0.0.Hp: Trace Attempt  4	[0.00 s]
0.0.Hp: Trace Attempt  5	[0.00 s]
0.0.N: clocks: 1, declared: 1, looping: 0, posedge: 1, negedge: 0, noedge: 0, bothedge: 0
0.0.N: Last scan. Per property time limit: 0s
0.0.N: Starting proof for property "Load_Store.p1"	[0.00 s].
0.0.N: Trace Attempt  1	[0.00 s]
0.0.N: Trace Attempt  2	[0.00 s]
0.0.N: Trace Attempt  2	[0.00 s]
0.0.N: Trace Attempt  3	[0.00 s]
0.0.N: Trace Attempt  3	[0.00 s]
0.0.N: Trace Attempt  4	[0.00 s]
0.0.N: Trace Attempt  5	[0.00 s]
0.0.N: Trace Attempt  5	[0.00 s]
0.0.N: Trace Attempt  1	[0.02 s]
0.0.N: Trace Attempt  2	[0.02 s]
0.0.N: Trace Attempt  3	[0.02 s]
0.0.N: Trace Attempt  4	[0.02 s]
0.0.N: Trace Attempt  5	[0.03 s]
0.0.B: Proofgrid shell started at 27499@vlsi-ria85(local) jg_27366_vlsi-ria85_1
0.0.Oh: Proofgrid shell started at 27491@vlsi-ria85(local) jg_27366_vlsi-ria85_1
0.0.Ht: Proofgrid shell started at 27490@vlsi-ria85(local) jg_27366_vlsi-ria85_1
0.0.B: clocks: 1, declared: 1, looping: 0, posedge: 1, negedge: 0, noedge: 0, bothedge: 0
0.0.B: Last scan. Per property time limit: 0s
0.0.B: Starting proof for property "Load_Store.p1"	[0.00 s].
0.0.B: Trace Attempt  1	[0.00 s]
0.0.B: Trace Attempt  2	[0.00 s]
0.0.B: Trace Attempt  3	[0.00 s]
0.0.B: Trace Attempt  4	[0.00 s]
0.0.B: Trace Attempt  5	[0.00 s]
0.0.Ht: clocks: 1, declared: 1, looping: 0, posedge: 1, negedge: 0, noedge: 0, bothedge: 0
0.0.Ht: Last scan. Per property time limit: 0s
0.0.Ht: Trace Attempt  1	[0.00 s]
0.0.Ht: Trace Attempt  2	[0.00 s]
0.0.Ht: Trace Attempt  3	[0.00 s]
0.0.Ht: Trace Attempt  4	[0.00 s]
0.0.Ht: Trace Attempt  5	[0.00 s]
0.0.Oh: clocks: 1, declared: 1, looping: 0, posedge: 1, negedge: 0, noedge: 0, bothedge: 0
0.0.Oh: Reached length limit (2147483647) [0.00 s]
0.0.Oh: Exited with Success (@ 0.06 s)
0.0.Oh: Completed, Restart ignored.
0.0.AM: Proofgrid shell started at 27503@vlsi-ria85(local) jg_27366_vlsi-ria85_1
0.0.AM: clocks: 1, declared: 1, looping: 0, posedge: 1, negedge: 0, noedge: 0, bothedge: 0
0.0.AM: Last scan. Per property time limit: 0s
0.0.AM: Starting proof for property "Load_Store.p1"	[0.00 s].
0.0.AM: Trace Attempt  1	[0.00 s]
0.0.AM: Trace Attempt  2	[0.00 s]
0.0.AM: Trace Attempt  3	[0.00 s]
0.0.AM: Trace Attempt  4	[0.00 s]
0.0.AM: Trace Attempt  5	[0.00 s]
0.0.AM: Trace Attempt  1	[0.00 s]
0.0.AM: Trace Attempt  2	[0.01 s]
0.0.AM: Trace Attempt  3	[0.01 s]
0.0.AM: Trace Attempt  4	[0.01 s]
0.0.AM: Trace Attempt  5	[0.01 s]
0.0.AM: Trace Attempt  1	[0.02 s]
0.0.AM: Trace Attempt  2	[0.02 s]
0.0.AM: Trace Attempt  3	[0.02 s]
0.0.AM: Trace Attempt  4	[0.03 s]
0.0.AM: Trace Attempt  5	[0.03 s]
0.0.AM: Trace Attempt  1	[0.07 s]
0.0.AM: Trace Attempt  2	[0.07 s]
0.0.AM: Trace Attempt  3	[0.07 s]
0.0.AM: Trace Attempt  4	[0.08 s]
0.0.AM: Trace Attempt  5	[0.08 s]
0.0.N: Trace Attempt  1	[0.17 s]
0.0.N: Trace Attempt  2	[0.17 s]
0.0.N: Trace Attempt  3	[0.17 s]
0.0.N: Trace Attempt  4	[0.17 s]
0.0.N: Trace Attempt  5	[0.17 s]
0.0.AM: Trace Attempt  1	[0.21 s]
0.0.AM: Trace Attempt  2	[0.22 s]
0.0.AM: Trace Attempt  3	[0.22 s]
0.0.AM: Trace Attempt  4	[0.22 s]
0.0.AM: Trace Attempt  5	[0.22 s]
0.0.N: Trace Attempt  1	[0.70 s]
0.0.N: Trace Attempt  2	[0.70 s]
0.0.N: Trace Attempt  3	[0.70 s]
0.0.N: Trace Attempt  4	[0.70 s]
0.0.N: Trace Attempt  5	[0.70 s]
0.0.AM: Trace Attempt  1	[0.74 s]
0.0.AM: Trace Attempt  2	[0.74 s]
0.0.AM: Trace Attempt  3	[0.74 s]
0.0.AM: Trace Attempt  4	[0.75 s]
0.0.AM: Trace Attempt  5	[0.75 s]
0.0.N: Trace Attempt  1	[2.49 s]
0.0.N: Trace Attempt  2	[2.49 s]
0.0.N: Trace Attempt  3	[2.49 s]
0.0.N: Trace Attempt  4	[2.49 s]
0.0.N: Trace Attempt  5	[2.50 s]
0.0.AM: Trace Attempt  1	[2.66 s]
0.0.AM: Trace Attempt  2	[2.66 s]
0.0.AM: Trace Attempt  3	[2.66 s]
0.0.AM: Trace Attempt  4	[2.66 s]
0.0.AM: Trace Attempt  5	[2.67 s]
0.0.Hp: Trace Attempt 404	[4.02 s]
0.0.B: Trace Attempt 1842	[4.00 s]
0.0.Ht: Trace Attempt 2003	[4.00 s]
0.0.N: Trace Attempt  1	[4.50 s]
0.0.N: Trace Attempt  2	[4.50 s]
0.0.N: Trace Attempt  3	[4.50 s]
0.0.N: Trace Attempt  4	[4.50 s]
0.0.N: Trace Attempt  5	[4.51 s]
0.0.N: Trace Attempt  1	[6.66 s]
0.0.N: Trace Attempt  2	[6.66 s]
0.0.N: Trace Attempt  3	[6.66 s]
0.0.N: Trace Attempt  4	[6.67 s]
0.0.N: Trace Attempt  5	[6.67 s]
0.0.AM: Trace Attempt 166	[6.71 s]
0.0.Hp: Trace Attempt 575	[8.04 s]
0.0.B: Trace Attempt 2538	[8.01 s]
0.0.Ht: Trace Attempt 2736	[8.01 s]
0.0.N: Trace Attempt 158	[10.68 s]
0.0.AM: Trace Attempt 258	[10.87 s]
0.0.AM: Trace Attempt  1	[10.93 s]
0.0.AM: Trace Attempt  2	[10.93 s]
0.0.AM: Trace Attempt  3	[10.93 s]
0.0.AM: Trace Attempt  4	[10.93 s]
0.0.AM: Trace Attempt  5	[10.94 s]
0.0.B: Trace Attempt 3050	[12.01 s]
0.0.Ht: Trace Attempt 3278	[12.01 s]
0.0.Hp: Trace Attempt 681	[13.98 s]
0.0.N: Trace Attempt  1	[14.43 s]
0.0.N: Trace Attempt  2	[14.43 s]
0.0.N: Trace Attempt  3	[14.43 s]
0.0.N: Trace Attempt  4	[14.43 s]
0.0.N: Trace Attempt  5	[14.43 s]
0.0.AM: Trace Attempt 216	[14.97 s]
0.0.B: Trace Attempt 3509	[16.02 s]
0.0.Ht: Trace Attempt 3769	[16.02 s]
0.0.Hp: Trace Attempt 785	[18.00 s]
0.0.N: Trace Attempt 159	[18.45 s]
0.0.AM: Trace Attempt 306	[19.06 s]
0.0.B: Trace Attempt 3911	[20.02 s]
0.0.Ht: Trace Attempt 4198	[20.02 s]
0.0.Hp: Trace Attempt 914	[22.01 s]
0.0.N: Trace Attempt 237	[22.76 s]
0.0.N: Trace Attempt  1	[22.77 s]
0.0.N: Trace Attempt  2	[22.77 s]
0.0.N: Trace Attempt  3	[22.77 s]
0.0.N: Trace Attempt  4	[22.77 s]
0.0.N: Trace Attempt  5	[22.77 s]
0.0.AM: Trace Attempt 394	[23.08 s]
0.0.B: Trace Attempt 4278	[24.03 s]
0.0.Ht: Trace Attempt 4575	[24.04 s]
0.0.Hp: Trace Attempt 1026	[26.27 s]
0.0.N: Trace Attempt 155	[26.79 s]
0.0.AM: Trace Attempt 439	[27.14 s]
0.0.B: Trace Attempt 4613	[28.04 s]
0.0.Ht: Trace Attempt 4927	[28.04 s]
0.0.Hp: Trace Attempt 1133	[30.30 s]
0.0.N: Trace Attempt  1	[30.42 s]
0.0.N: Trace Attempt  2	[30.42 s]
0.0.N: Trace Attempt  3	[30.42 s]
0.0.N: Trace Attempt  4	[30.43 s]
0.0.N: Trace Attempt  5	[30.43 s]
0.0.AM: Trace Attempt 341	[31.16 s]
0.0.B: Trace Attempt 4903	[32.04 s]
0.0.Ht: Trace Attempt 5228	[32.05 s]
0.0.Hp: Trace Attempt 1224	[34.31 s]
0.0.N: Trace Attempt 157	[34.44 s]
0.0.AM: Trace Attempt 508	[35.17 s]
0.0.B: Trace Attempt 5167	[36.04 s]
0.0.Ht: Trace Attempt 5504	[36.05 s]
0.0.AM: Trace Attempt  1	[37.17 s]
0.0.AM: Trace Attempt  2	[37.17 s]
0.0.AM: Trace Attempt  3	[37.17 s]
0.0.AM: Trace Attempt  4	[37.19 s]
0.0.AM: Trace Attempt  5	[37.19 s]
0.0.N: Trace Attempt  1	[37.88 s]
0.0.N: Trace Attempt  2	[37.88 s]
0.0.N: Trace Attempt  3	[37.88 s]
0.0.N: Trace Attempt  4	[37.89 s]
0.0.N: Trace Attempt  5	[37.89 s]
0.0.Hp: Trace Attempt 1309	[38.34 s]
0.0.B: Trace Attempt 5432	[40.05 s]
0.0.Ht: Trace Attempt 5790	[40.06 s]
0.0.AM: Trace Attempt 165	[41.25 s]
0.0.N: Trace Attempt 157	[41.90 s]
0.0.Hp: Trace Attempt 1392	[42.36 s]
0.0.B: Trace Attempt 5693	[44.05 s]
0.0.Ht: Trace Attempt 6075	[44.06 s]
0.0.N: Trace Attempt  1	[45.36 s]
0.0.N: Trace Attempt  2	[45.36 s]
0.0.N: Trace Attempt  3	[45.36 s]
0.0.N: Trace Attempt  4	[45.36 s]
0.0.N: Trace Attempt  5	[45.36 s]
0.0.AM: Trace Attempt 234	[45.34 s]
0.0.Hp: Trace Attempt 1469	[46.38 s]
0.0.B: Trace Attempt 5937	[48.05 s]
0.0.Ht: Trace Attempt 6340	[48.08 s]
0.0.N: Trace Attempt 158	[49.38 s]
0.0.AM: Trace Attempt 277	[49.37 s]
0.0.Hp: Trace Attempt 1539	[50.39 s]
0.0.B: Trace Attempt 6169	[52.06 s]
0.0.Ht: Trace Attempt 6589	[52.08 s]
0.0.N: Trace Attempt 240	[53.43 s]
0.0.AM: Trace Attempt 320	[53.40 s]
0.0.N: Trace Attempt  1	[53.79 s]
0.0.N: Trace Attempt  2	[53.79 s]
0.0.N: Trace Attempt  3	[53.79 s]
0.0.N: Trace Attempt  4	[53.80 s]
0.0.N: Trace Attempt  5	[53.80 s]
0.0.Hp: Trace Attempt 1607	[54.41 s]
0.0.B: Trace Attempt 6400	[56.08 s]
0.0.Ht: Trace Attempt 6848	[56.10 s]
0.0.AM: Trace Attempt 359	[57.43 s]
0.0.N: Trace Attempt 157	[57.84 s]
0.0.Hp: Trace Attempt 1671	[58.43 s]
0.0.B: Trace Attempt 6624	[60.09 s]
0.0.Ht: Trace Attempt 7094	[60.11 s]
0.0.N: Trace Attempt  1	[61.30 s]
0.0.N: Trace Attempt  2	[61.31 s]
0.0.N: Trace Attempt  3	[61.31 s]
0.0.N: Trace Attempt  4	[61.31 s]
0.0.N: Trace Attempt  5	[61.31 s]
0.0.AM: Trace Attempt 399	[61.44 s]
0.0.Hp: Trace Attempt 1732	[62.45 s]
0.0.B: Trace Attempt 6837	[64.10 s]
0.0.Ht: Trace Attempt 7319	[64.12 s]
0.0.N: Trace Attempt 158	[65.34 s]
0.0.AM: Trace Attempt 440	[65.49 s]
0.0.Hp: Trace Attempt 1791	[66.52 s]
0.0.B: Trace Attempt 7045	[68.11 s]
0.0.Ht: Trace Attempt 7536	[68.13 s]
0.0.N: Trace Attempt 242	[69.34 s]
0.0.AM: Trace Attempt 458	[69.58 s]
0.0.N: Trace Attempt  1	[69.70 s]
0.0.N: Trace Attempt  2	[69.71 s]
0.0.N: Trace Attempt  3	[69.71 s]
0.0.N: Trace Attempt  4	[69.71 s]
0.0.N: Trace Attempt  5	[69.71 s]
0.0.Hp: Trace Attempt 1843	[70.57 s]
0.0.B: Trace Attempt 7246	[72.13 s]
0.0.Ht: Trace Attempt 7750	[72.14 s]
0.0.N: Trace Attempt 157	[73.72 s]
0.0.AM: Trace Attempt 471	[73.86 s]
0.0.Hp: Trace Attempt 1899	[74.64 s]
0.0.B: Trace Attempt 7437	[76.15 s]
0.0.Ht: Trace Attempt 7957	[76.16 s]
0.0.N: Trace Attempt  1	[77.32 s]
0.0.N: Trace Attempt  2	[77.33 s]
0.0.N: Trace Attempt  3	[77.33 s]
0.0.N: Trace Attempt  4	[77.33 s]
0.0.N: Trace Attempt  5	[77.33 s]
0.0.AM: Trace Attempt 490	[77.96 s]
0.0.Hp: Trace Attempt 1951	[78.72 s]
0.0.B: Trace Attempt 7622	[80.16 s]
0.0.Ht: Trace Attempt 8157	[80.16 s]
0.0.N: Trace Attempt 158	[81.35 s]
0.0.AM: Trace Attempt 509	[82.28 s]
0.0.Hp: Trace Attempt 2002	[82.73 s]
0.0.B: Trace Attempt 7806	[84.16 s]
0.0.Ht: Trace Attempt 8350	[84.16 s]
0.0.N: Trace Attempt 245	[85.69 s]
0.0.N: Trace Attempt  1	[85.69 s]
0.0.N: Trace Attempt  2	[85.69 s]
0.0.N: Trace Attempt  3	[85.69 s]
0.0.N: Trace Attempt  4	[85.70 s]
0.0.N: Trace Attempt  5	[85.70 s]
0.0.AM: Trace Attempt 527	[86.37 s]
0.0.Hp: Trace Attempt 2051	[86.79 s]
0.0.B: Trace Attempt 7983	[88.16 s]
0.0.Ht: Trace Attempt 8542	[88.17 s]
0.0.N: Trace Attempt 157	[89.75 s]
0.0.Hp: Trace Attempt 2093	[90.82 s]
0.0.AM: Trace Attempt 546	[90.75 s]
0.0.B: Trace Attempt 8161	[92.17 s]
0.0.Ht: Trace Attempt 8738	[92.18 s]
0.0.N: Trace Attempt  1	[93.18 s]
0.0.N: Trace Attempt  2	[93.18 s]
0.0.N: Trace Attempt  3	[93.18 s]
0.0.N: Trace Attempt  4	[93.18 s]
0.0.N: Trace Attempt  5	[93.18 s]
0.0.Hp: Trace Attempt 2133	[94.92 s]
0.0.AM: Trace Attempt 560	[94.92 s]
0.0.B: Trace Attempt 8341	[96.19 s]
0.0.Ht: Trace Attempt 8934	[96.19 s]
0.0.N: Trace Attempt 160	[97.25 s]
0.0.Hp: Trace Attempt 2171	[98.96 s]
0.0.AM: Trace Attempt 575	[99.19 s]
0.0.B: Trace Attempt 8519	[100.19 s]
0.0.Ht: Trace Attempt 9121	[100.20 s]
0.0.N: Trace Attempt 247	[101.40 s]
0.0.N: Trace Attempt  1	[101.41 s]
0.0.N: Trace Attempt  2	[101.41 s]
0.0.N: Trace Attempt  3	[101.41 s]
0.0.N: Trace Attempt  4	[101.42 s]
0.0.N: Trace Attempt  5	[101.42 s]
0.0.Hp: Trace Attempt 2208	[103.03 s]
0.0.AM: Trace Attempt 588	[103.37 s]
0.0.B: Trace Attempt 8693	[104.19 s]
0.0.Ht: Trace Attempt 9298	[104.20 s]
0.0.N: Trace Attempt 158	[105.45 s]
0.0.Hp: Trace Attempt 2244	[107.05 s]
0.0.AM: Trace Attempt 604	[107.37 s]
0.0.B: Trace Attempt 8862	[108.21 s]
0.0.Ht: Trace Attempt 9477	[108.23 s]
0.0.N: Trace Attempt 258	[109.45 s]
0.0.N: Trace Attempt  1	[109.46 s]
0.0.N: Trace Attempt  2	[109.46 s]
0.0.N: Trace Attempt  3	[109.46 s]
0.0.N: Trace Attempt  4	[109.47 s]
0.0.N: Trace Attempt  5	[109.47 s]
0.0.Hp: Trace Attempt 2278	[111.05 s]
0.0.AM: Trace Attempt 620	[111.51 s]
0.0.B: Trace Attempt 9027	[112.22 s]
0.0.Ht: Trace Attempt 9639	[112.25 s]
0.0.N: Trace Attempt 163	[113.49 s]
0.0.Hp: Trace Attempt 2312	[115.10 s]
0.0.AM: Trace Attempt 635	[115.59 s]
0.0.B: Trace Attempt 9195	[116.23 s]
0.0.Ht: Trace Attempt 9817	[116.26 s]
0.0.N: Trace Attempt 228	[117.61 s]
0.0.Hp: Trace Attempt 2345	[119.22 s]
0.0.AM: Trace Attempt 648	[119.80 s]
0.0.B: Trace Attempt 9357	[120.24 s]
0.0.Ht: Trace Attempt 9991	[120.26 s]
0.0.N: Trace Attempt 256	[121.62 s]
0.0.Hp: Trace Attempt 2377	[123.28 s]
0.0.AM: Trace Attempt 662	[123.87 s]
0.0.B: Trace Attempt 9517	[124.25 s]
0.0.Ht: Trace Attempt 10160	[124.27 s]
0.0.N: Trace Attempt 293	[125.70 s]
0.0.Hp: Trace Attempt 2408	[127.32 s]
0.0.AM: Trace Attempt 675	[127.90 s]
0.0.B: Trace Attempt 9674	[128.27 s]
0.0.Ht: Trace Attempt 10321	[128.28 s]
0.0.N: Trace Attempt 328	[129.72 s]
0.0.Hp: Trace Attempt 2439	[131.44 s]
0.0.B: Trace Attempt 9828	[132.28 s]
0.0.Ht: Trace Attempt 10489	[132.29 s]
0.0.AM: Trace Attempt 688	[132.31 s]
0.0.N: Trace Attempt 352	[133.86 s]
0.0.Hp: Trace Attempt 2469	[135.52 s]
0.0.B: Trace Attempt 9980	[136.30 s]
0.0.Ht: Trace Attempt 10643	[136.30 s]
0.0.AM: Trace Attempt 699	[136.40 s]
0.0.N: Trace Attempt 384	[137.87 s]
0.0.Hp: Trace Attempt 2498	[139.53 s]
0.0.B: Trace Attempt 10127	[140.30 s]
0.0.Ht: Trace Attempt 10804	[140.30 s]
0.0.AM: Trace Attempt 709	[140.52 s]
0.0.N: Trace Attempt 418	[141.95 s]
0.0.Hp: Trace Attempt 2527	[143.67 s]
0.0.B: Trace Attempt 10271	[144.31 s]
0.0.Ht: Trace Attempt 10964	[144.31 s]
0.0.AM: Trace Attempt 721	[144.74 s]
0.0.N: Trace Attempt 449	[146.11 s]
0.0.Hp: Trace Attempt 2555	[147.74 s]
0.0.B: Trace Attempt 10409	[148.32 s]
0.0.Ht: Trace Attempt 11120	[148.33 s]
0.0.AM: Trace Attempt 733	[148.79 s]
0.0.N: Trace Attempt  1	[149.85 s]
0.0.N: Trace Attempt  2	[149.86 s]
0.0.N: Trace Attempt  3	[149.86 s]
0.0.N: Trace Attempt  4	[149.86 s]
0.0.N: Trace Attempt  5	[149.86 s]
0.0.Hp: Trace Attempt 2582	[151.82 s]
0.0.B: Trace Attempt 10546	[152.33 s]
0.0.Ht: Trace Attempt 11271	[152.33 s]
0.0.AM: Trace Attempt 745	[152.90 s]
0.0.N: Trace Attempt 145	[153.88 s]
0.0.Hp: Trace Attempt 2609	[155.88 s]
0.0.Ht: Trace Attempt 11415	[156.33 s]
0.0.B: Trace Attempt 10685	[156.35 s]
0.0.AM: Trace Attempt 757	[157.04 s]
0.0.N: Trace Attempt 227	[157.91 s]
0.0.Hp: Trace Attempt 2635	[159.89 s]
0.0.Ht: Trace Attempt 11556	[160.34 s]
0.0.B: Trace Attempt 10819	[160.35 s]
0.0.AM: Trace Attempt 770	[161.11 s]
0.0.N: Trace Attempt 272	[161.92 s]
0.0.Hp: Trace Attempt 2661	[164.02 s]
0.0.B: Trace Attempt 10951	[164.36 s]
0.0.Ht: Trace Attempt 11700	[164.35 s]
0.0.AM: Trace Attempt 783	[165.36 s]
0.0.N: Trace Attempt 311	[165.97 s]
0.0.Hp: Trace Attempt 2686	[168.12 s]
0.0.Ht: Trace Attempt 11846	[168.35 s]
0.0.B: Trace Attempt 11081	[168.37 s]
0.0.AM: Trace Attempt 796	[169.63 s]
0.0.N: Trace Attempt 344	[170.15 s]
0.0.Hp: Trace Attempt 2710	[172.15 s]
0.0.Ht: Trace Attempt 11990	[172.38 s]
0.0.B: Trace Attempt 11210	[172.40 s]
0.0.AM: Trace Attempt 809	[173.64 s]
0.0.N: Trace Attempt 381	[174.27 s]
0.0.Hp: Trace Attempt 2734	[176.23 s]
0.0.Ht: Trace Attempt 12132	[176.38 s]
0.0.B: Trace Attempt 11337	[176.41 s]
0.0.AM: Trace Attempt 820	[177.74 s]
0.0.N: Trace Attempt 418	[178.33 s]
0.0.Hp: Trace Attempt 2758	[180.38 s]
0.0.Ht: Trace Attempt 12271	[180.39 s]
0.0.B: Trace Attempt 11460	[180.43 s]
0.0.N: Trace Attempt 441	[181.01 s]
0.0.N: Stopped processing property "Load_Store.p1"	[181.07 s].
0.0.N: Morphing to Ncustom1
0.0.N: All properties determined. [0.00 s]
0.0.N: Exited with Success (@ 0.00 s)
0.0.Ncustom1: clocks: 1, declared: 1, looping: 0, posedge: 1, negedge: 0, noedge: 0, bothedge: 0
0.0.Ncustom1: Starting proof for property "Load_Store.p1"	[0.00 s].
0.0.B: Trace Attempt 11477	[180.98 s]
0.0.B: Stopped processing property "Load_Store.p1"	[181.10 s].
0.0.B: Morphing to Bcustom2
0.0.B: All properties determined. [0.00 s]
0.0.B: Exited with Success (@ 0.00 s)
0.0.Ncustom1: Trace Attempt 456	[0.07 s]
0.0.Bcustom2: clocks: 1, declared: 1, looping: 0, posedge: 1, negedge: 0, noedge: 0, bothedge: 0
0.0.Bcustom2: Starting proof for property "Load_Store.p1"	[0.00 s].
0.0.Bcustom2: Trace Attempt  1	[0.00 s]
0.0.Bcustom2: Trace Attempt  2	[0.00 s]
0.0.Bcustom2: Trace Attempt  1	[0.00 s]
0.0.Bcustom2: Trace Attempt  2	[0.00 s]
0.0.Bcustom2: Trace Attempt  3	[0.00 s]
0.0.Bcustom2: Trace Attempt  1	[0.00 s]
0.0.Bcustom2: Trace Attempt  2	[0.00 s]
0.0.Bcustom2: Trace Attempt  3	[0.00 s]
0.0.Bcustom2: Trace Attempt  4	[0.00 s]
0.0.Bcustom2: Trace Attempt  5	[0.00 s]
0.0.Bcustom2: Trace Attempt  1	[0.00 s]
0.0.Bcustom2: Trace Attempt  2	[0.00 s]
0.0.Bcustom2: Trace Attempt  3	[0.00 s]
0.0.Bcustom2: Trace Attempt  4	[0.00 s]
0.0.Bcustom2: Trace Attempt  5	[0.00 s]
0.0.Bcustom2: Trace Attempt  1	[0.01 s]
0.0.Bcustom2: Trace Attempt  2	[0.01 s]
0.0.Bcustom2: Trace Attempt  3	[0.01 s]
0.0.Bcustom2: Trace Attempt  4	[0.01 s]
0.0.Bcustom2: Trace Attempt  5	[0.01 s]
0.0.Bcustom2: Trace Attempt  1	[0.01 s]
0.0.Bcustom2: Trace Attempt  2	[0.01 s]
0.0.Bcustom2: Trace Attempt  3	[0.01 s]
0.0.Bcustom2: Trace Attempt  4	[0.01 s]
0.0.Bcustom2: Trace Attempt  5	[0.01 s]
0.0.Bcustom2: Trace Attempt  1	[0.02 s]
0.0.Bcustom2: Trace Attempt  2	[0.02 s]
0.0.Bcustom2: Trace Attempt  3	[0.02 s]
0.0.Bcustom2: Trace Attempt  4	[0.02 s]
0.0.Bcustom2: Trace Attempt  5	[0.02 s]
0.0.AM: Trace Attempt 828	[180.71 s]
0.0.AM: Stopped processing property "Load_Store.p1"	[181.13 s].
0.0.AM: Morphing to AMcustom3
0.0.Bcustom2: Trace Attempt  1	[0.05 s]
0.0.Bcustom2: Trace Attempt  2	[0.05 s]
0.0.Bcustom2: Trace Attempt  3	[0.05 s]
0.0.Bcustom2: Trace Attempt  4	[0.05 s]
0.0.Bcustom2: Trace Attempt  5	[0.05 s]
0.0.AM: All properties determined. [0.00 s]
0.0.AM: Exited with Success (@ 0.00 s)
0.0.AMcustom3: clocks: 1, declared: 1, looping: 0, posedge: 1, negedge: 0, noedge: 0, bothedge: 0
0.0.AMcustom3: Starting proof for property "Load_Store.p1"	[0.00 s].
0.0.AMcustom3: Trace Attempt  1	[0.00 s]
0.0.AMcustom3: Trace Attempt  2	[0.00 s]
0.0.AMcustom3: Trace Attempt  3	[0.00 s]
0.0.AMcustom3: Trace Attempt  4	[0.00 s]
0.0.AMcustom3: Trace Attempt  5	[0.00 s]
0.0.AMcustom3: Trace Attempt  1	[0.00 s]
0.0.AMcustom3: Trace Attempt  2	[0.01 s]
0.0.AMcustom3: Trace Attempt  3	[0.01 s]
0.0.AMcustom3: Trace Attempt  4	[0.01 s]
0.0.AMcustom3: Trace Attempt  5	[0.01 s]
0.0.AMcustom3: Trace Attempt  1	[0.02 s]
0.0.AMcustom3: Trace Attempt  2	[0.03 s]
0.0.AMcustom3: Trace Attempt  3	[0.03 s]
0.0.Bcustom2: Trace Attempt  1	[0.11 s]
0.0.Bcustom2: Trace Attempt  2	[0.11 s]
0.0.Bcustom2: Trace Attempt  3	[0.11 s]
0.0.Bcustom2: Trace Attempt  4	[0.11 s]
0.0.Bcustom2: Trace Attempt  5	[0.11 s]
0.0.AMcustom3: Trace Attempt  4	[0.03 s]
0.0.AMcustom3: Trace Attempt  5	[0.03 s]
0.0.Tri: Proofgrid shell started at 765@vlsi-ria85(local) jg_27366_vlsi-ria85_1
0.0.Tri: clocks: 1, declared: 1, looping: 0, posedge: 1, negedge: 0, noedge: 0, bothedge: 0
0.0.AMcustom3: Trace Attempt  1	[0.08 s]
0.0.AMcustom3: Trace Attempt  2	[0.08 s]
0.0.AMcustom3: Trace Attempt  3	[0.08 s]
0.0.AMcustom3: Trace Attempt  4	[0.09 s]
0.0.AMcustom3: Trace Attempt  5	[0.09 s]
0.0.Tri: Last scan. Per property time limit: 0s
0.0.Tri: Starting proof for property "Load_Store.p1"	[0.00 s].
0.0.Tri: Trace Attempt  1	[0.00 s]
0.0.Tri:    0.00" ---- Launching main thread ----
0.0.Bcustom2: Trace Attempt  1	[0.27 s]
0.0.Bcustom2: Trace Attempt  2	[0.27 s]
0.0.Bcustom2: Trace Attempt  3	[0.27 s]
0.0.Bcustom2: Trace Attempt  4	[0.27 s]
0.0.Bcustom2: Trace Attempt  5	[0.27 s]
0.0.Tri:    0.06" ---- Launching abstraction thread ----
0.0.Tri:    0.07" ---- Launching multi-phase simplification thread ----
0.0.AMcustom3: Trace Attempt  1	[0.24 s]
0.0.AMcustom3: Trace Attempt  2	[0.25 s]
0.0.AMcustom3: Trace Attempt  3	[0.25 s]
0.0.AMcustom3: Trace Attempt  4	[0.25 s]
0.0.AMcustom3: Trace Attempt  5	[0.25 s]
0.0.Tri:    0.10" ---- Launching liveness simplification thread ----
0.0.AMcustom3: Trace Attempt  1	[0.86 s]
0.0.AMcustom3: Trace Attempt  2	[0.87 s]
0.0.AMcustom3: Trace Attempt  3	[0.87 s]
0.0.AMcustom3: Trace Attempt  4	[0.87 s]
0.0.AMcustom3: Trace Attempt  5	[0.88 s]
0.0.Tri:    0.91" Simplification phase 1 complete
0.0.Ncustom1: Requesting engine job to terminate
0.0.Bcustom2: Requesting engine job to terminate
0.0.AMcustom3: Requesting engine job to terminate
0.0.Tri: Requesting engine job to terminate
0.0.Hp: Requesting engine job to terminate
0.0.Ht: Requesting engine job to terminate
INFO (IPF144): 0: Initiating shutdown of proof [182.43 s]
0.0.Tri: A proof was found: No trace exists. [1.09 s]
INFO (IPF057): 0.0.Tri: The property "Load_Store.p1" was proven in 1.10 s.
0.0.AMcustom3: Trace Attempt 41	[1.19 s]
0.0.AMcustom3: Stopped processing property "Load_Store.p1"	[1.19 s].
0.0.AMcustom3: All properties determined. [1.20 s]
0.0.AMcustom3: Exited with Success (@ 182.44 s)
0: ProofGrid usable level: 0
0.0.Ht: Trace Attempt 12327	[182.36 s]
0.0.Ht: All properties determined. [182.39 s]
0.0.Ncustom1: Stopped processing property "Load_Store.p1"	[1.36 s].
0.0.Ncustom1: All properties determined. [1.37 s]
0.0.Ncustom1: Exited with Success (@ 182.47 s)
0.0.Hp: Trace Attempt 2769	[182.35 s]
0.0.Hp: All properties determined. [182.52 s]
0.0.Tri: Stopped processing property "Load_Store.p1"	[1.22 s].
0.0.Tri: All properties determined. [1.23 s]
0.0.Tri: Exited with Success (@ 182.56 s)
0.0.Ht: Exited with Success (@ 182.58 s)
0.0.Hp: Exited with Success (@ 182.81 s)
0.0.Bcustom2: Trace Attempt  1	[1.80 s]
0.0.Bcustom2: Stopped processing property "Load_Store.p1"	[1.80 s].
0.0.Bcustom2: All properties determined. [1.80 s]
0.0.Bcustom2: Exited with Success (@ 182.99 s)
0: --------------------------------------------------------------
ProofGrid Summary (utilization 99.95 %)
--------------------------------------------------------------
     engines started                               :    10
     engine jobs started                           :     7

    Average time in state (seconds)
    ------------------------------------------------------
    Engine  Pending     Running        Dead    Utilization
    ------------------------------------------------------
     Hp        0.03      182.43        0.00       99.98 %
     Ht        0.05      182.38        0.00       99.98 %
     Oh        0.04        0.01        0.00       12.15 %
    Ncustom1        0.04      182.36        0.00       99.98 %
    Bcustom2        0.04      182.26        0.00       99.98 %
    AMcustom3        0.06      182.16        0.00       99.97 %
    Tri        0.24        1.12        0.00       82.40 %
    all        0.07      130.39        0.00       99.95 %

    Total time in state (seconds)
    -----------------------------------------
            Pending     Running        Dead  
    -----------------------------------------
               0.49      912.71        0.00

    Data read    : 5.56 MiB
    Data written : 2.88 kiB

0: All pending notifications were processed.
INFO (IPF059): 0: Completed proof on task: "<embedded>"

==============================================================
SUMMARY
==============================================================
           Properties Considered              : 1
                 assertions                   : 1
                  - proven                    : 1 (100%)
                  - bounded_proven (user)     : 0 (0%)
                  - bounded_proven (auto)     : 0 (0%)
                  - marked_proven             : 0 (0%)
                  - cex                       : 0 (0%)
                  - ar_cex                    : 0 (0%)
                  - undetermined              : 0 (0%)
                  - unknown                   : 0 (0%)
                  - error                     : 0 (0%)
                 covers                       : 0
                  - unreachable               : 0
                  - bounded_unreachable (user): 0
                  - covered                   : 0
                  - ar_covered                : 0
                  - undetermined              : 0
                  - unknown                   : 0
                  - error                     : 0
proven
[<embedded>] % exit -force
INFO (IPL005): Received request to exit from the console.
INFO: Waiting for proof threads to stop...
INFO: Proof threads stopped.
INFO (IPL018): The peak resident set memory use for this session was 1.998 GB.
INFO (IPL014): Waiting for the Tcl-thread to exit.
INFO (IPL015): The Tcl-thread exited with status 0.
INFO (IPL016): Exiting the analysis session with status 0.
